InvoiceNo,StockCode,Description,Quantity,InvoiceDate,UnitPrice,CustomerID,Country
579256,20973,12 PENCIL SMALL TUBE WOODLAND,24,2011-11-29 08:07:00,0.65,13349.0,United Kingdom
579256,21891,TRADITIONAL WOODEN SKIPPING ROPE,12,2011-11-29 08:07:00,1.45,13349.0,United Kingdom
579256,22398,MAGNETS PACK OF 4 SWALLOWS,12,2011-11-29 08:07:00,0.39,13349.0,United Kingdom
579256,21746,SMALL RED RETROSPOT WINDMILL,12,2011-11-29 08:07:00,1.25,13349.0,United Kingdom
579256,21747,SMALL SKULL WINDMILL,12,2011-11-29 08:07:00,1.25,13349.0,United Kingdom
579256,22585,PACK OF 6 BIRDY GIFT TAGS,12,2011-11-29 08:07:00,1.25,13349.0,United Kingdom
579256,84228,HEN HOUSE WITH CHICK STANDING,12,2011-11-29 08:07:00,0.42,13349.0,United Kingdom
579256,21894,POTTING SHED SEED ENVELOPES,12,2011-11-29 08:07:00,1.25,13349.0,United Kingdom
579256,23433,HANGING QUILTED PATCHWORK APPLES,12,2011-11-29 08:07:00,0.83,13349.0,United Kingdom
579256,23476,WOODLAND LARGE RED FELT HEART,12,2011-11-29 08:07:00,1.25,13349.0,United Kingdom
579256,84992,72 SWEETHEART FAIRY CAKE CASES,24,2011-11-29 08:07:00,0.55,13349.0,United Kingdom
579256,21977,PACK OF 60 PINK PAISLEY CAKE CASES,24,2011-11-29 08:07:00,0.55,13349.0,United Kingdom
579256,23293,SET OF 12 FAIRY CAKE BAKING CASES,8,2011-11-29 08:07:00,0.83,13349.0,United Kingdom
579256,21975,PACK OF 60 DINOSAUR CAKE CASES,24,2011-11-29 08:07:00,0.55,13349.0,United Kingdom
579256,22813,PACK 3 BOXES BIRD PANNETONE ,12,2011-11-29 08:07:00,1.95,13349.0,United Kingdom
579256,C2,CARRIAGE,1,2011-11-29 08:07:00,50.0,13349.0,United Kingdom
579257,23681,LUNCH BAG RED VINTAGE DOILY,100,2011-11-29 08:14:00,1.45,15619.0,United Kingdom
579257,22191,IVORY DINER WALL CLOCK,12,2011-11-29 08:14:00,7.65,15619.0,United Kingdom
579257,23243,SET OF TEA COFFEE SUGAR TINS PANTRY,24,2011-11-29 08:14:00,4.15,15619.0,United Kingdom
579258,22446,PIN CUSHION BABUSHKA PINK,6,2011-11-29 08:21:00,3.35,15148.0,United Kingdom
579258,22654,DELUXE SEWING KIT ,3,2011-11-29 08:21:00,5.95,15148.0,United Kingdom
579258,23493,VINTAGE DOILY TRAVEL SEWING KIT,10,2011-11-29 08:21:00,1.95,15148.0,United Kingdom
579258,20969,RED FLORAL FELTCRAFT SHOULDER BAG,4,2011-11-29 08:21:00,3.75,15148.0,United Kingdom
579258,20972,PINK CREAM FELT CRAFT TRINKET BOX ,12,2011-11-29 08:21:00,1.25,15148.0,United Kingdom
579258,20970,PINK FLORAL FELTCRAFT SHOULDER BAG,4,2011-11-29 08:21:00,3.75,15148.0,United Kingdom
579258,22273,FELTCRAFT DOLL MOLLY,6,2011-11-29 08:21:00,2.95,15148.0,United Kingdom
579258,22150,3 STRIPEY MICE FELTCRAFT,12,2011-11-29 08:21:00,1.95,15148.0,United Kingdom
579258,22274,FELTCRAFT DOLL EMILY,6,2011-11-29 08:21:00,2.95,15148.0,United Kingdom
579258,22565,FELTCRAFT HAIRBANDS PINK AND WHITE ,12,2011-11-29 08:21:00,0.85,15148.0,United Kingdom
579258,22587,FELTCRAFT HAIRBAND RED AND BLUE,12,2011-11-29 08:21:00,0.85,15148.0,United Kingdom
579258,22749,FELTCRAFT PRINCESS CHARLOTTE DOLL,4,2011-11-29 08:21:00,3.75,15148.0,United Kingdom
579258,22750,FELTCRAFT PRINCESS LOLA DOLL,4,2011-11-29 08:21:00,3.75,15148.0,United Kingdom
579258,23127,FELTCRAFT GIRL NICOLE KIT,4,2011-11-29 08:21:00,4.95,15148.0,United Kingdom
579258,22578,WOODEN STAR CHRISTMAS SCANDINAVIAN,24,2011-11-29 08:21:00,0.29,15148.0,United Kingdom
579258,16008,SMALL FOLDING SCISSOR(POINTED EDGE),24,2011-11-29 08:21:00,0.12,15148.0,United Kingdom
579258,82616B,FRAPPUCINO SCARF KNITTING KIT,12,2011-11-29 08:21:00,1.25,15148.0,United Kingdom
579258,20971,PINK BLUE FELT CRAFT TRINKET BOX,12,2011-11-29 08:21:00,1.25,15148.0,United Kingdom
579258,22566,FELTCRAFT HAIRBAND PINK AND PURPLE,12,2011-11-29 08:21:00,0.85,15148.0,United Kingdom
579258,23126,FELTCRAFT GIRL AMELIE KIT,4,2011-11-29 08:21:00,4.95,15148.0,United Kingdom
579259,47559B,TEA TIME OVEN GLOVE,10,2011-11-29 08:40:00,1.25,12451.0,Switzerland
579259,22627,MINT KITCHEN SCALES,2,2011-11-29 08:40:00,8.5,12451.0,Switzerland
579259,23392,SPACEBOY ROCKET LOLLY MAKERS,6,2011-11-29 08:40:00,2.08,12451.0,Switzerland
579259,23445,ICE CREAM BUBBLES,20,2011-11-29 08:40:00,0.83,12451.0,Switzerland
579259,23371,SET 36 COLOUR PENCILS SPACEBOY ,16,2011-11-29 08:40:00,1.25,12451.0,Switzerland
579259,23372,SET 36 COLOUR PENCILS DOLLY GIRL,16,2011-11-29 08:40:00,1.25,12451.0,Switzerland
579259,22975,SPACEBOY CHILDRENS EGG CUP,12,2011-11-29 08:40:00,1.25,12451.0,Switzerland
579259,23480,MINI LIGHTS WOODLAND MUSHROOMS,4,2011-11-29 08:40:00,3.75,12451.0,Switzerland
579259,23569,TRADTIONAL ALPHABET STAMP SET,4,2011-11-29 08:40:00,4.95,12451.0,Switzerland
579259,22098,BOUDOIR SQUARE TISSUE BOX,36,2011-11-29 08:40:00,0.39,12451.0,Switzerland
579259,22915,ASSORTED BOTTLE TOP  MAGNETS ,12,2011-11-29 08:40:00,0.42,12451.0,Switzerland
579259,23178,JAM CLOCK MAGNET,6,2011-11-29 08:40:00,2.89,12451.0,Switzerland
579259,23180,MUM'S KITCHEN CLOCK,4,2011-11-29 08:40:00,4.95,12451.0,Switzerland
579259,23079,TOADSTOOL BEDSIDE LIGHT ,2,2011-11-29 08:40:00,8.95,12451.0,Switzerland
579259,POST,POSTAGE,1,2011-11-29 08:40:00,40.0,12451.0,Switzerland
579260,23245,SET OF 3 REGENCY CAKE TINS,4,2011-11-29 08:41:00,4.95,14618.0,United Kingdom
579260,22791,T-LIGHT GLASS FLUTED ANTIQUE,24,2011-11-29 08:41:00,1.25,14618.0,United Kingdom
579260,22464,HANGING METAL HEART LANTERN,48,2011-11-29 08:41:00,1.45,14618.0,United Kingdom
579260,21012,ANTIQUE ALL GLASS CANDLESTICK,18,2011-11-29 08:41:00,2.1,14618.0,United Kingdom
579260,22792,FLUTED ANTIQUE CANDLE HOLDER,24,2011-11-29 08:41:00,0.85,14618.0,United Kingdom
579260,22800,ANTIQUE TALL SWIRLGLASS TRINKET POT,12,2011-11-29 08:41:00,3.75,14618.0,United Kingdom
579260,23444,Next Day Carriage,1,2011-11-29 08:41:00,15.0,14618.0,United Kingdom
579260,22464,HANGING METAL HEART LANTERN,12,2011-11-29 08:41:00,1.65,14618.0,United Kingdom
579261,21929,JUMBO BAG PINK VINTAGE PAISLEY,10,2011-11-29 09:10:00,2.08,13429.0,United Kingdom
579261,22411,JUMBO SHOPPER VINTAGE RED PAISLEY,10,2011-11-29 09:10:00,2.08,13429.0,United Kingdom
579261,23581,JUMBO BAG PAISLEY PARK,20,2011-11-29 09:10:00,2.08,13429.0,United Kingdom
579261,23344,JUMBO BAG 50'S CHRISTMAS ,10,2011-11-29 09:10:00,2.08,13429.0,United Kingdom
579261,23200,JUMBO BAG PEARS,10,2011-11-29 09:10:00,2.08,13429.0,United Kingdom
579261,23582,VINTAGE DOILY JUMBO BAG RED ,10,2011-11-29 09:10:00,2.08,13429.0,United Kingdom
579261,23583,LUNCH BAG PAISLEY PARK  ,10,2011-11-29 09:10:00,1.65,13429.0,United Kingdom
579261,23201,JUMBO BAG ALPHABET,10,2011-11-29 09:10:00,2.08,13429.0,United Kingdom
579261,21616,4 PEAR BOTANICAL DINNER CANDLES,12,2011-11-29 09:10:00,1.25,13429.0,United Kingdom
579261,21619,4 VANILLA BOTANICAL CANDLES,12,2011-11-29 09:10:00,1.25,13429.0,United Kingdom
579261,21620,SET OF 4 ROSE BOTANICAL CANDLES,12,2011-11-29 09:10:00,1.25,13429.0,United Kingdom
579261,35953,FOLKART STAR CHRISTMAS DECORATIONS,48,2011-11-29 09:10:00,0.39,13429.0,United Kingdom
579261,22578,WOODEN STAR CHRISTMAS SCANDINAVIAN,24,2011-11-29 09:10:00,0.29,13429.0,United Kingdom
579261,22581,WOOD STOCKING CHRISTMAS SCANDISPOT,24,2011-11-29 09:10:00,0.29,13429.0,United Kingdom
579261,22577,WOODEN HEART CHRISTMAS SCANDINAVIAN,24,2011-11-29 09:10:00,0.29,13429.0,United Kingdom
579261,20719,WOODLAND CHARLOTTE BAG,10,2011-11-29 09:10:00,0.85,13429.0,United Kingdom
579261,20724,RED RETROSPOT CHARLOTTE BAG,10,2011-11-29 09:10:00,0.85,13429.0,United Kingdom
579261,22356,CHARLOTTE BAG PINK POLKADOT,10,2011-11-29 09:10:00,0.85,13429.0,United Kingdom
579261,85099B,JUMBO BAG RED RETROSPOT,10,2011-11-29 09:10:00,2.08,13429.0,United Kingdom
579262,21314,SMALL GLASS HEART TRINKET POT,48,2011-11-29 09:13:00,1.85,13599.0,United Kingdom
579262,23697,A PRETTY THANK YOU CARD,12,2011-11-29 09:13:00,0.42,13599.0,United Kingdom
579263,23552,BICYCLE PUNCTURE REPAIR KIT ,6,2011-11-29 09:14:00,2.08,13599.0,United Kingdom
579263,23498,CLASSIC BICYCLE CLIPS ,12,2011-11-29 09:14:00,1.45,13599.0,United Kingdom
579264,22098,BOUDOIR SQUARE TISSUE BOX,36,2011-11-29 09:15:00,0.39,13599.0,United Kingdom
579264,35471D,SET OF 3 BIRD LIGHT PINK FEATHER ,24,2011-11-29 09:15:00,0.39,13599.0,United Kingdom
579264,23203,JUMBO BAG VINTAGE DOILY ,10,2011-11-29 09:15:00,2.08,13599.0,United Kingdom
579265,21326,AGED GLASS SILVER T-LIGHT HOLDER,24,2011-11-29 09:15:00,0.65,13599.0,United Kingdom
579265,23084,RABBIT NIGHT LIGHT,24,2011-11-29 09:15:00,1.79,13599.0,United Kingdom
C579266,71477,COLOURED GLASS STAR T-LIGHT HOLDER,-24,2011-11-29 09:25:00,3.29,15621.0,United Kingdom
579267,22699,ROSES REGENCY TEACUP AND SAUCER ,6,2011-11-29 09:42:00,2.95,14961.0,United Kingdom
579267,22697,GREEN REGENCY TEACUP AND SAUCER,6,2011-11-29 09:42:00,2.95,14961.0,United Kingdom
579267,22698,PINK REGENCY TEACUP AND SAUCER,6,2011-11-29 09:42:00,2.95,14961.0,United Kingdom
579267,23172,REGENCY TEA PLATE PINK,12,2011-11-29 09:42:00,1.65,14961.0,United Kingdom
579267,23175,REGENCY MILK JUG PINK ,4,2011-11-29 09:42:00,3.25,14961.0,United Kingdom
579267,23245,SET OF 3 REGENCY CAKE TINS,4,2011-11-29 09:42:00,4.95,14961.0,United Kingdom
579267,23170,REGENCY TEA PLATE ROSES ,12,2011-11-29 09:42:00,1.65,14961.0,United Kingdom
579267,22197,POPCORN HOLDER,100,2011-11-29 09:42:00,0.72,14961.0,United Kingdom
579267,23313,VINTAGE CHRISTMAS BUNTING,10,2011-11-29 09:42:00,4.95,14961.0,United Kingdom
579267,23343,JUMBO BAG VINTAGE CHRISTMAS ,20,2011-11-29 09:42:00,2.08,14961.0,United Kingdom
579267,22910,PAPER CHAIN KIT VINTAGE CHRISTMAS,18,2011-11-29 09:42:00,2.95,14961.0,United Kingdom
579267,22734,SET OF 6 RIBBONS VINTAGE CHRISTMAS,12,2011-11-29 09:42:00,2.89,14961.0,United Kingdom
579267,23234,BISCUIT TIN VINTAGE CHRISTMAS,18,2011-11-29 09:42:00,2.89,14961.0,United Kingdom
579267,22952,60 CAKE CASES VINTAGE CHRISTMAS,24,2011-11-29 09:42:00,0.55,14961.0,United Kingdom
579267,22909,SET OF 20 VINTAGE CHRISTMAS NAPKINS,24,2011-11-29 09:42:00,0.85,14961.0,United Kingdom
579267,23200,JUMBO BAG PEARS,10,2011-11-29 09:42:00,2.08,14961.0,United Kingdom
579267,23199,JUMBO BAG APPLES,10,2011-11-29 09:42:00,2.08,14961.0,United Kingdom
579267,23206,LUNCH BAG APPLE DESIGN,10,2011-11-29 09:42:00,1.65,14961.0,United Kingdom
579267,23204,CHARLOTTE BAG APPLES DESIGN,10,2011-11-29 09:42:00,0.85,14961.0,United Kingdom
579267,23534,WALL ART STOP FOR TEA ,3,2011-11-29 09:42:00,5.95,14961.0,United Kingdom
579267,23541,WALL ART CLASSIC PUDDINGS ,2,2011-11-29 09:42:00,8.25,14961.0,United Kingdom
579267,23543,WALL ART KEEP CALM ,6,2011-11-29 09:42:00,7.45,14961.0,United Kingdom
579267,23247,BISCUIT TIN 50'S CHRISTMAS,12,2011-11-29 09:42:00,2.89,14961.0,United Kingdom
579267,23344,JUMBO BAG 50'S CHRISTMAS ,20,2011-11-29 09:42:00,2.08,14961.0,United Kingdom
579267,22086,PAPER CHAIN KIT 50'S CHRISTMAS ,12,2011-11-29 09:42:00,2.95,14961.0,United Kingdom
579267,22112,CHOCOLATE HOT WATER BOTTLE,6,2011-11-29 09:42:00,4.95,14961.0,United Kingdom
579267,22114,HOT WATER BOTTLE TEA AND SYMPATHY,8,2011-11-29 09:42:00,4.25,14961.0,United Kingdom
579267,22835,HOT WATER BOTTLE I AM SO POORLY,8,2011-11-29 09:42:00,4.95,14961.0,United Kingdom
579267,22113,GREY HEART HOT WATER BOTTLE,8,2011-11-29 09:42:00,4.25,14961.0,United Kingdom
579267,23358,HOT STUFF HOT WATER BOTTLE,6,2011-11-29 09:42:00,3.75,14961.0,United Kingdom
579267,23356,LOVE HOT WATER BOTTLE,6,2011-11-29 09:42:00,5.95,14961.0,United Kingdom
579267,23554,LANDMARK FRAME OXFORD STREET,3,2011-11-29 09:42:00,12.5,14961.0,United Kingdom
579267,23555,LANDMARK FRAME NOTTING HILL ,3,2011-11-29 09:42:00,12.5,14961.0,United Kingdom
579267,23558,LANDMARK FRAME LONDON BRIDGE ,3,2011-11-29 09:42:00,12.5,14961.0,United Kingdom
579267,23556,LANDMARK FRAME COVENT GARDEN ,3,2011-11-29 09:42:00,12.5,14961.0,United Kingdom
579267,23162,REGENCY TEA STRAINER,12,2011-11-29 09:42:00,3.75,14961.0,United Kingdom
579267,23163,REGENCY SUGAR TONGS,8,2011-11-29 09:42:00,2.49,14961.0,United Kingdom
579267,23161,REGENCY CAKE FORK,12,2011-11-29 09:42:00,1.25,14961.0,United Kingdom
579268,85048,15CM CHRISTMAS GLASS BALL 20 LIGHTS,12,2011-11-29 09:47:00,6.95,14321.0,United Kingdom
579268,21506,"FANCY FONT BIRTHDAY CARD, ",12,2011-11-29 09:47:00,0.42,14321.0,United Kingdom
579268,22983,CARD BILLBOARD FONT,12,2011-11-29 09:47:00,0.42,14321.0,United Kingdom
579268,21985,PACK OF 12 HEARTS DESIGN TISSUES ,24,2011-11-29 09:47:00,0.39,14321.0,United Kingdom
579268,23077,DOUGHNUT LIP GLOSS ,20,2011-11-29 09:47:00,1.25,14321.0,United Kingdom
579268,16011,ANIMAL STICKERS,24,2011-11-29 09:47:00,0.21,14321.0,United Kingdom
579268,23697,A PRETTY THANK YOU CARD,24,2011-11-29 09:47:00,0.42,14321.0,United Kingdom
579268,22597,MUSICAL ZINC HEART DECORATION ,72,2011-11-29 09:47:00,0.29,14321.0,United Kingdom
579268,84832,ZINC WILLIE WINKIE  CANDLE STICK,36,2011-11-29 09:47:00,0.85,14321.0,United Kingdom
579268,84879,ASSORTED COLOUR BIRD ORNAMENT,8,2011-11-29 09:47:00,1.69,14321.0,United Kingdom
579268,22151,PLACE SETTING WHITE HEART,24,2011-11-29 09:47:00,0.42,14321.0,United Kingdom
579268,23321,SMALL WHITE HEART OF WICKER,12,2011-11-29 09:47:00,1.65,14321.0,United Kingdom
579268,22037,ROBOT BIRTHDAY CARD,12,2011-11-29 09:47:00,0.42,14321.0,United Kingdom
579268,22306,SILVER MUG BONE CHINA TREE OF LIFE,12,2011-11-29 09:47:00,1.06,14321.0,United Kingdom
579268,23695,DOILY THANK YOU CARD,12,2011-11-29 09:47:00,0.42,14321.0,United Kingdom
579268,23694,PAISLEY PARK CARD,12,2011-11-29 09:47:00,0.42,14321.0,United Kingdom
579268,16008,SMALL FOLDING SCISSOR(POINTED EDGE),24,2011-11-29 09:47:00,0.12,14321.0,United Kingdom
579268,85049A,TRADITIONAL CHRISTMAS RIBBONS,12,2011-11-29 09:47:00,1.25,14321.0,United Kingdom
579268,23461,SWEETHEART BIRD HOUSE,4,2011-11-29 09:47:00,4.15,14321.0,United Kingdom
579269,72741,GRAND CHOCOLATECANDLE,72,2011-11-29 09:48:00,1.25,14601.0,United Kingdom
579269,72225C,LAVENDER SCENT CAKE CANDLE,24,2011-11-29 09:48:00,0.29,14601.0,United Kingdom
579269,22809,SET OF 6 T-LIGHTS SANTA,12,2011-11-29 09:48:00,2.95,14601.0,United Kingdom
579269,85034B,3 WHITE CHOC MORRIS BOXED CANDLES,24,2011-11-29 09:48:00,1.25,14601.0,United Kingdom
579269,72122,COFFEE SCENT PILLAR CANDLE,12,2011-11-29 09:48:00,0.95,14601.0,United Kingdom
579269,21494,ROTATING LEAVES T-LIGHT HOLDER,12,2011-11-29 09:48:00,1.25,14601.0,United Kingdom
579269,85038,6 CHOCOLATE LOVE HEART T-LIGHTS,12,2011-11-29 09:48:00,2.1,14601.0,United Kingdom
579270,23479,WIRE EGG BASKET ,2,2011-11-29 09:50:00,7.85,15783.0,United Kingdom
579270,22573,STAR WOODEN CHRISTMAS DECORATION,12,2011-11-29 09:50:00,0.85,15783.0,United Kingdom
579270,22338,STAR DECORATION PAINTED ZINC ,96,2011-11-29 09:50:00,0.19,15783.0,United Kingdom
579270,23492,VINTAGE JINGLE BELLS WREATH,2,2011-11-29 09:50:00,8.25,15783.0,United Kingdom
579270,22672,FRENCH BATHROOM SIGN BLUE METAL,12,2011-11-29 09:50:00,1.65,15783.0,United Kingdom
579270,23395,BELLE JARDINIERE CUSHION COVER,4,2011-11-29 09:50:00,3.75,15783.0,United Kingdom
579270,23396,LE JARDIN BOTANIQUE CUSHION COVER,4,2011-11-29 09:50:00,3.75,15783.0,United Kingdom
579270,23411, TRELLIS COAT RACK,6,2011-11-29 09:50:00,4.95,15783.0,United Kingdom
579270,85059,FRENCH ENAMEL WATER BASIN,4,2011-11-29 09:50:00,3.75,15783.0,United Kingdom
579270,23252,VINTAGE RED ENAMEL TRIM JUG ,4,2011-11-29 09:50:00,3.75,15783.0,United Kingdom
579270,22141,CHRISTMAS CRAFT TREE TOP ANGEL,6,2011-11-29 09:50:00,2.1,15783.0,United Kingdom
579270,23327,HANGING CLEAR MINI BOTTLE,48,2011-11-29 09:50:00,0.63,15783.0,United Kingdom
579270,84879,ASSORTED COLOUR BIRD ORNAMENT,8,2011-11-29 09:50:00,1.69,15783.0,United Kingdom
579270,23569,TRADTIONAL ALPHABET STAMP SET,4,2011-11-29 09:50:00,4.95,15783.0,United Kingdom
579271,23243,SET OF TEA COFFEE SUGAR TINS PANTRY,139,2011-11-29 09:56:00,5.13,17450.0,United Kingdom
579271,22114,HOT WATER BOTTLE TEA AND SYMPATHY,78,2011-11-29 09:56:00,5.1,17450.0,United Kingdom
579271,22989,SET 2 PANTRY DESIGN TEA TOWELS,6,2011-11-29 09:56:00,3.28,17450.0,United Kingdom
579271,22993,SET OF 4 PANTRY JELLY MOULDS,56,2011-11-29 09:56:00,1.43,17450.0,United Kingdom
579271,22979,PANTRY WASHING UP BRUSH,78,2011-11-29 09:56:00,1.65,17450.0,United Kingdom
579271,22728,ALARM CLOCK BAKELIKE PINK,24,2011-11-29 09:56:00,4.08,17450.0,United Kingdom
579271,22730,ALARM CLOCK BAKELIKE IVORY,20,2011-11-29 09:56:00,4.08,17450.0,United Kingdom
579271,22930,BAKING MOULD HEART MILK CHOCOLATE,48,2011-11-29 09:56:00,2.6,17450.0,United Kingdom
579271,22960,JAM MAKING SET WITH JARS,152,2011-11-29 09:56:00,4.6,17450.0,United Kingdom
579271,22720,SET OF 3 CAKE TINS PANTRY DESIGN ,48,2011-11-29 09:56:00,5.08,17450.0,United Kingdom
579272,22812,,2,2011-11-29 10:00:00,0.0,,United Kingdom
579273,22174,PHOTO CUBE,12,2011-11-29 10:00:00,1.65,15197.0,United Kingdom
579273,84946,ANTIQUE SILVER T-LIGHT GLASS,12,2011-11-29 10:00:00,1.25,15197.0,United Kingdom
579273,84947,ANTIQUE SILVER TEA GLASS ENGRAVED,12,2011-11-29 10:00:00,1.25,15197.0,United Kingdom
579273,21666,RIDGED GLASS T-LIGHT HOLDER,12,2011-11-29 10:00:00,0.65,15197.0,United Kingdom
579273,21313,GLASS HEART T-LIGHT HOLDER ,12,2011-11-29 10:00:00,0.85,15197.0,United Kingdom
579273,22460,EMBOSSED GLASS TEALIGHT HOLDER,12,2011-11-29 10:00:00,1.25,15197.0,United Kingdom
579273,22178,VICTORIAN GLASS HANGING T-LIGHT,12,2011-11-29 10:00:00,1.95,15197.0,United Kingdom
579273,84347,ROTATING SILVER ANGELS T-LIGHT HLDR,30,2011-11-29 10:00:00,2.55,15197.0,United Kingdom
579273,84945,MULTI COLOUR SILVER T-LIGHT HOLDER,12,2011-11-29 10:00:00,0.85,15197.0,United Kingdom
579273,21208,PASTEL COLOUR HONEYCOMB FAN,12,2011-11-29 10:00:00,0.39,15197.0,United Kingdom
579273,84879,ASSORTED COLOUR BIRD ORNAMENT,16,2011-11-29 10:00:00,1.69,15197.0,United Kingdom
579273,21136,PAINTED METAL PEARS ASSORTED,16,2011-11-29 10:00:00,1.69,15197.0,United Kingdom
579273,21498,RED RETROSPOT WRAP ,25,2011-11-29 10:00:00,0.42,15197.0,United Kingdom
579273,21499,BLUE POLKADOT WRAP,25,2011-11-29 10:00:00,0.42,15197.0,United Kingdom
579273,21500,PINK POLKADOT WRAP ,25,2011-11-29 10:00:00,0.42,15197.0,United Kingdom
579273,23374,RED SPOT PAPER GIFT BAG,10,2011-11-29 10:00:00,0.82,15197.0,United Kingdom
579273,23438, RED SPOT GIFT BAG LARGE,12,2011-11-29 10:00:00,1.25,15197.0,United Kingdom
579274,22627,MINT KITCHEN SCALES,2,2011-11-29 10:01:00,8.5,13467.0,United Kingdom
579274,22666,RECIPE BOX PANTRY YELLOW DESIGN,6,2011-11-29 10:01:00,2.95,13467.0,United Kingdom
579274,22273,FELTCRAFT DOLL MOLLY,6,2011-11-29 10:01:00,2.95,13467.0,United Kingdom
579274,22274,FELTCRAFT DOLL EMILY,6,2011-11-29 10:01:00,2.95,13467.0,United Kingdom
579274,21055,TOOL BOX SOFT TOY ,1,2011-11-29 10:01:00,8.95,13467.0,United Kingdom
579274,21889,WOODEN BOX OF DOMINOES,12,2011-11-29 10:01:00,1.25,13467.0,United Kingdom
579274,22692,DOORMAT WELCOME TO OUR HOME,2,2011-11-29 10:01:00,8.25,13467.0,United Kingdom
579274,48187,DOORMAT NEW ENGLAND,2,2011-11-29 10:01:00,8.25,13467.0,United Kingdom
579274,22418,10 COLOUR SPACEBOY PEN,24,2011-11-29 10:01:00,0.85,13467.0,United Kingdom
579274,23093,SMALL PARISIENNE HEART PHOTO FRAME ,8,2011-11-29 10:01:00,2.49,13467.0,United Kingdom
579274,16161P,WRAP ENGLISH ROSE ,25,2011-11-29 10:01:00,0.42,13467.0,United Kingdom
579274,22940,FELTCRAFT CHRISTMAS FAIRY,4,2011-11-29 10:01:00,4.25,13467.0,United Kingdom
579274,22762,CUPBOARD 3 DRAWER MA CAMPAGNE,1,2011-11-29 10:01:00,14.95,13467.0,United Kingdom
579274,23112,PARISIENNE CURIO CABINET,2,2011-11-29 10:01:00,7.5,13467.0,United Kingdom
579274,22489,PACK OF 12 TRADITIONAL CRAYONS,24,2011-11-29 10:01:00,0.42,13467.0,United Kingdom
579274,22549,PICTURE DOMINOES,12,2011-11-29 10:01:00,1.45,13467.0,United Kingdom
579274,46000M,POLYESTER FILLER PAD 45x45cm,4,2011-11-29 10:01:00,1.55,13467.0,United Kingdom
579274,23393,HOME SWEET HOME CUSHION COVER ,4,2011-11-29 10:01:00,3.75,13467.0,United Kingdom
579274,21914,BLUE HARMONICA IN BOX ,12,2011-11-29 10:01:00,1.25,13467.0,United Kingdom
579274,21340,CLASSIC METAL BIRDCAGE PLANT HOLDER,1,2011-11-29 10:01:00,12.75,13467.0,United Kingdom
579275,22176,amazon,1,2011-11-29 10:02:00,0.0,,United Kingdom
579276,84375,SET OF 20 KIDS COOKIE CUTTERS,12,2011-11-29 10:10:00,2.1,12654.0,Germany
579276,22562,MONSTERS STENCIL CRAFT,12,2011-11-29 10:10:00,1.25,12654.0,Germany
579276,22563,HAPPY STENCIL CRAFT,12,2011-11-29 10:10:00,1.25,12654.0,Germany
579276,22556,PLASTERS IN TIN CIRCUS PARADE ,12,2011-11-29 10:10:00,1.65,12654.0,Germany
579276,POST,POSTAGE,1,2011-11-29 10:10:00,18.0,12654.0,Germany
C579277,22470,HEART OF WICKER LARGE,-10,2011-11-29 10:16:00,3.2,17450.0,United Kingdom
579278,21733,RED HANGING HEART T-LIGHT HOLDER,6,2011-11-29 10:18:00,2.95,14209.0,United Kingdom
579278,22804,PINK HANGING HEART T-LIGHT HOLDER,6,2011-11-29 10:18:00,2.95,14209.0,United Kingdom
579278,22169,FAMILY ALBUM WHITE PICTURE FRAME,8,2011-11-29 10:18:00,7.65,14209.0,United Kingdom
579278,21754,HOME BUILDING BLOCK WORD,6,2011-11-29 10:18:00,6.25,14209.0,United Kingdom
579278,21755,LOVE BUILDING BLOCK WORD,6,2011-11-29 10:18:00,6.25,14209.0,United Kingdom
579278,85066,CREAM SWEETHEART MINI CHEST,2,2011-11-29 10:18:00,12.75,14209.0,United Kingdom
579279,23084,RABBIT NIGHT LIGHT,48,2011-11-29 10:23:00,1.79,15298.0,United Kingdom
579279,23355,HOT WATER BOTTLE KEEP CALM,24,2011-11-29 10:23:00,4.15,15298.0,United Kingdom
579279,22941,CHRISTMAS LIGHTS 10 REINDEER,6,2011-11-29 10:23:00,8.5,15298.0,United Kingdom
579279,84012,MAGIC SHEEP WOOL GROWING FROM PAPER,24,2011-11-29 10:23:00,0.85,15298.0,United Kingdom
579279,84006,MAGIC TREE -PAPER FLOWERS,24,2011-11-29 10:23:00,0.85,15298.0,United Kingdom
579279,22966,GINGERBREAD MAN COOKIE CUTTER,12,2011-11-29 10:23:00,1.25,15298.0,United Kingdom
579279,84375,SET OF 20 KIDS COOKIE CUTTERS,12,2011-11-29 10:23:00,2.1,15298.0,United Kingdom
579279,22780,LIGHT GARLAND BUTTERFILES PINK,4,2011-11-29 10:23:00,4.25,15298.0,United Kingdom
579279,22779,WOODEN OWLS LIGHT GARLAND ,4,2011-11-29 10:23:00,4.25,15298.0,United Kingdom
579280,82483,WOOD 2 DRAWER CABINET WHITE FINISH,2,2011-11-29 10:33:00,6.95,13928.0,United Kingdom
579280,23118,PARISIENNE JEWELLERY DRAWER ,2,2011-11-29 10:33:00,7.5,13928.0,United Kingdom
579280,23401,RUSTIC MIRROR WITH LACE HEART,2,2011-11-29 10:33:00,6.25,13928.0,United Kingdom
579280,22171,3 HOOK PHOTO SHELF ANTIQUE WHITE,2,2011-11-29 10:33:00,8.5,13928.0,United Kingdom
579280,23404,HOME SWEET HOME BLACKBOARD,6,2011-11-29 10:33:00,4.95,13928.0,United Kingdom
579280,23405,HOME SWEET HOME 2 DRAWER CABINET,4,2011-11-29 10:33:00,4.95,13928.0,United Kingdom
579281,20712,JUMBO BAG WOODLAND ANIMALS,20,2011-11-29 10:36:00,2.08,12375.0,Finland
579281,23200,JUMBO BAG PEARS,30,2011-11-29 10:36:00,2.08,12375.0,Finland
579281,85099C,JUMBO  BAG BAROQUE BLACK WHITE,20,2011-11-29 10:36:00,2.08,12375.0,Finland
579281,23203,JUMBO BAG VINTAGE DOILY ,10,2011-11-29 10:36:00,2.08,12375.0,Finland
579281,21930,JUMBO STORAGE BAG SKULLS,10,2011-11-29 10:36:00,2.08,12375.0,Finland
579281,POST,POSTAGE,1,2011-11-29 10:36:00,40.0,12375.0,Finland
579282,23452,HEART MINI PORTRAIT FRAME,6,2011-11-29 10:41:00,1.95,16818.0,United Kingdom
579282,82494L,WOODEN FRAME ANTIQUE WHITE ,12,2011-11-29 10:41:00,2.95,16818.0,United Kingdom
579282,22457,NATURAL SLATE HEART CHALKBOARD ,6,2011-11-29 10:41:00,2.95,16818.0,United Kingdom
579282,85053,FRENCH ENAMEL CANDLEHOLDER,6,2011-11-29 10:41:00,2.1,16818.0,United Kingdom
579282,23415,HOME SWEET HOME HOOK,12,2011-11-29 10:41:00,1.65,16818.0,United Kingdom
579282,23146,TRIPLE HOOK ANTIQUE IVORY ROSE,4,2011-11-29 10:41:00,3.29,16818.0,United Kingdom
579282,23147,SINGLE ANTIQUE ROSE HOOK IVORY,12,2011-11-29 10:41:00,1.45,16818.0,United Kingdom
579283,23168,CLASSIC CAFE SUGAR DISPENSER,12,2011-11-29 10:45:00,1.25,13883.0,United Kingdom
579283,22993,SET OF 4 PANTRY JELLY MOULDS,12,2011-11-29 10:45:00,1.25,13883.0,United Kingdom
579283,23245,SET OF 3 REGENCY CAKE TINS,4,2011-11-29 10:45:00,4.95,13883.0,United Kingdom
579283,23296,SET OF 6 TEA TIME BAKING CASES,16,2011-11-29 10:45:00,1.25,13883.0,United Kingdom
579283,23294,SET OF 6 SNACK LOAF BAKING CASES,16,2011-11-29 10:45:00,0.83,13883.0,United Kingdom
579283,23293,SET OF 12 FAIRY CAKE BAKING CASES,16,2011-11-29 10:45:00,0.83,13883.0,United Kingdom
579283,23295,SET OF 12 MINI LOAF BAKING CASES,16,2011-11-29 10:45:00,0.83,13883.0,United Kingdom
579283,22723,SET OF 6 HERB TINS SKETCHBOOK,4,2011-11-29 10:45:00,3.95,13883.0,United Kingdom
579283,22721,SET OF 3 CAKE TINS SKETCHBOOK,3,2011-11-29 10:45:00,4.95,13883.0,United Kingdom
579283,22799,SWEETHEART WIRE FRUIT BOWL,2,2011-11-29 10:45:00,8.5,13883.0,United Kingdom
579283,22846,BREAD BIN DINER STYLE RED ,2,2011-11-29 10:45:00,16.95,13883.0,United Kingdom
579283,22842,BISCUIT TIN VINTAGE RED,2,2011-11-29 10:45:00,6.75,13883.0,United Kingdom
579283,22840,ROUND CAKE TIN VINTAGE RED,2,2011-11-29 10:45:00,7.95,13883.0,United Kingdom
579283,22838,3 TIER CAKE TIN RED AND CREAM,2,2011-11-29 10:45:00,14.95,13883.0,United Kingdom
579283,22907,PACK OF 20 NAPKINS PANTRY DESIGN,12,2011-11-29 10:45:00,0.85,13883.0,United Kingdom
579283,22982,PANTRY PASTRY BRUSH,12,2011-11-29 10:45:00,1.25,13883.0,United Kingdom
579283,22722,SET OF 6 SPICE TINS PANTRY DESIGN,4,2011-11-29 10:45:00,3.95,13883.0,United Kingdom
579283,22666,RECIPE BOX PANTRY YELLOW DESIGN,6,2011-11-29 10:45:00,2.95,13883.0,United Kingdom
579283,22961,JAM MAKING SET PRINTED,12,2011-11-29 10:45:00,1.45,13883.0,United Kingdom
579283,22720,SET OF 3 CAKE TINS PANTRY DESIGN ,3,2011-11-29 10:45:00,4.95,13883.0,United Kingdom
579283,22776,SWEETHEART 3 TIER CAKE STAND ,2,2011-11-29 10:45:00,9.95,13883.0,United Kingdom
579283,22667,RECIPE BOX RETROSPOT ,6,2011-11-29 10:45:00,2.95,13883.0,United Kingdom
579283,22348,TEA BAG PLATE RED RETROSPOT,12,2011-11-29 10:45:00,0.85,13883.0,United Kingdom
579283,21155,RED RETROSPOT PEG BAG,6,2011-11-29 10:45:00,2.55,13883.0,United Kingdom
579283,21216,"SET 3 RETROSPOT TEA,COFFEE,SUGAR",4,2011-11-29 10:45:00,4.95,13883.0,United Kingdom
579283,21080,SET/20 RED RETROSPOT PAPER NAPKINS ,12,2011-11-29 10:45:00,0.85,13883.0,United Kingdom
579283,21535,RED RETROSPOT SMALL MILK JUG,6,2011-11-29 10:45:00,2.55,13883.0,United Kingdom
579283,21533,RETROSPOT LARGE MILK JUG,6,2011-11-29 10:45:00,4.95,13883.0,United Kingdom
