InvoiceNo,StockCode,Description,Quantity,InvoiceDate,UnitPrice,CustomerID,Country
581492,20728,LUNCH BAG CARS BLUE,1,2011-12-09 10:03:00,4.13,,United Kingdom
581492,20733,GOLD MINI TAPE MEASURE ,3,2011-12-09 10:03:00,0.83,,United Kingdom
581492,20777,CHRYSANTHEMUM NOTEBOOK,2,2011-12-09 10:03:00,1.63,,United Kingdom
581492,20782,CAMOUFLAGE EAR MUFF HEADPHONES,1,2011-12-09 10:03:00,10.79,,United Kingdom
581492,20914,SET/5 RED RETROSPOT LID GLASS BOWLS,2,2011-12-09 10:03:00,5.79,,United Kingdom
581492,20931,BLUE POT PLANT CANDLE ,1,2011-12-09 10:03:00,7.46,,United Kingdom
581492,20970,PINK FLORAL FELTCRAFT SHOULDER BAG,1,2011-12-09 10:03:00,7.46,,United Kingdom
581492,20971,PINK BLUE FELT CRAFT TRINKET BOX,2,2011-12-09 10:03:00,2.46,,United Kingdom
581492,20972,PINK CREAM FELT CRAFT TRINKET BOX ,3,2011-12-09 10:03:00,2.46,,United Kingdom
581492,20973,12 PENCIL SMALL TUBE WOODLAND,4,2011-12-09 10:03:00,1.25,,United Kingdom
581492,20978,36 PENCILS TUBE SKULLS,1,2011-12-09 10:03:00,2.46,,United Kingdom
581492,20979,36 PENCILS TUBE RED RETROSPOT,3,2011-12-09 10:03:00,2.46,,United Kingdom
581492,20982,12 PENCILS TALL TUBE SKULLS,2,2011-12-09 10:03:00,1.63,,United Kingdom
581492,20983,12 PENCILS TALL TUBE RED RETROSPOT,4,2011-12-09 10:03:00,1.63,,United Kingdom
581492,20985,HEART CALCULATOR,1,2011-12-09 10:03:00,2.46,,United Kingdom
581492,20986,BLUE CALCULATOR RULER,1,2011-12-09 10:03:00,2.46,,United Kingdom
581492,21000,ROSE DU SUD COSMETICS BAG,1,2011-12-09 10:03:00,3.29,,United Kingdom
581492,21012,ANTIQUE ALL GLASS CANDLESTICK,3,2011-12-09 10:03:00,2.46,,United Kingdom
581492,21015,DARK BIRD HOUSE TREE DECORATION,8,2011-12-09 10:03:00,0.83,,United Kingdom
581492,21026,SPACE OWL,1,2011-12-09 10:03:00,2.46,,United Kingdom
581492,21035,SET/2 RED RETROSPOT TEA TOWELS ,1,2011-12-09 10:03:00,6.63,,United Kingdom
581492,21064,BOOM BOX SPEAKER BOYS,4,2011-12-09 10:03:00,4.13,,United Kingdom
581492,21065,BOOM BOX SPEAKER GIRLS,2,2011-12-09 10:03:00,4.13,,United Kingdom
581492,21098,CHRISTMAS TOILET ROLL,1,2011-12-09 10:03:00,2.46,,United Kingdom
581492,21123,SET/10 IVORY POLKADOT PARTY CANDLES,1,2011-12-09 10:03:00,0.83,,United Kingdom
581492,21125,SET 6 FOOTBALL CELEBRATION CANDLES,1,2011-12-09 10:03:00,1.25,,United Kingdom
581492,21126,SET OF 6 GIRLS CELEBRATION CANDLES,1,2011-12-09 10:03:00,1.25,,United Kingdom
581492,21137,BLACK RECORD COVER FRAME,17,2011-12-09 10:03:00,4.13,,United Kingdom
581492,21154,RED RETROSPOT OVEN GLOVE ,2,2011-12-09 10:03:00,2.46,,United Kingdom
581492,21158,MOODY GIRL DOOR HANGER ,1,2011-12-09 10:03:00,3.29,,United Kingdom
581492,21162,TOXIC AREA  DOOR HANGER ,1,2011-12-09 10:03:00,3.29,,United Kingdom
581492,21166,COOK WITH WINE METAL SIGN ,2,2011-12-09 10:03:00,4.13,,United Kingdom
581492,21172,PARTY METAL SIGN ,1,2011-12-09 10:03:00,4.13,,United Kingdom
581492,21174,POTTERING IN THE SHED METAL SIGN,2,2011-12-09 10:03:00,4.13,,United Kingdom
581492,21175,GIN AND TONIC DIET METAL SIGN,2,2011-12-09 10:03:00,4.96,,United Kingdom
581492,21200,MULTICOLOUR HONEYCOMB PAPER GARLAND,6,2011-12-09 10:03:00,3.29,,United Kingdom
581492,21201,TROPICAL  HONEYCOMB PAPER GARLAND ,4,2011-12-09 10:03:00,4.96,,United Kingdom
581492,21212,PACK OF 72 RETROSPOT CAKE CASES,2,2011-12-09 10:03:00,1.25,,United Kingdom
581492,21213,PACK OF 72 SKULL CAKE CASES,2,2011-12-09 10:03:00,1.25,,United Kingdom
581492,21220,SET/4 BADGES DOGS,2,2011-12-09 10:03:00,2.46,,United Kingdom
581492,21224,SET/4 SKULL BADGES,1,2011-12-09 10:03:00,0.83,,United Kingdom
581492,21232,STRAWBERRY CERAMIC TRINKET POT,1,2011-12-09 10:03:00,2.46,,United Kingdom
581492,21257,VICTORIAN SEWING BOX MEDIUM,2,2011-12-09 10:03:00,15.79,,United Kingdom
581492,21258,VICTORIAN SEWING BOX LARGE,1,2011-12-09 10:03:00,24.96,,United Kingdom
581492,21259,VICTORIAN SEWING BOX SMALL ,1,2011-12-09 10:03:00,12.46,,United Kingdom
581492,21313,GLASS HEART T-LIGHT HOLDER ,1,2011-12-09 10:03:00,1.63,,United Kingdom
581492,21314,SMALL GLASS HEART TRINKET POT,2,2011-12-09 10:03:00,4.13,,United Kingdom
581492,21328,BALLOONS  WRITING SET ,2,2011-12-09 10:03:00,3.29,,United Kingdom
581492,21329,DINOSAURS  WRITING SET ,2,2011-12-09 10:03:00,3.29,,United Kingdom
581492,21356,TOAST ITS - FAIRY FLOWER,16,2011-12-09 10:03:00,0.83,,United Kingdom
581492,21378,SMALL TALL CAMPHOR WOOD TOADSTOOL,2,2011-12-09 10:03:00,3.29,,United Kingdom
581492,21379,CAMPHOR WOOD PORTOBELLO MUSHROOM,1,2011-12-09 10:03:00,2.46,,United Kingdom
581492,21383,PACK OF 12 STICKY BUNNIES,1,2011-12-09 10:03:00,1.25,,United Kingdom
581492,21402,RED  EGG  SPOON,1,2011-12-09 10:03:00,0.42,,United Kingdom
581492,21408,SPOTTY PINK DUCK DOORSTOP,2,2011-12-09 10:03:00,8.29,,United Kingdom
581492,21411,GINGHAM HEART  DOORSTOP RED,1,2011-12-09 10:03:00,8.29,,United Kingdom
581492,21467,CHERRY CROCHET FOOD COVER,1,2011-12-09 10:03:00,7.46,,United Kingdom
581492,21471,STRAWBERRY RAFFIA FOOD COVER,2,2011-12-09 10:03:00,3.29,,United Kingdom
581492,21479,WHITE SKULL HOT WATER BOTTLE ,2,2011-12-09 10:03:00,8.29,,United Kingdom
581492,21481,FAWN BLUE HOT WATER BOTTLE,3,2011-12-09 10:03:00,7.46,,United Kingdom
581492,21484,CHICK GREY HOT WATER BOTTLE,1,2011-12-09 10:03:00,8.29,,United Kingdom
581492,21485,RETROSPOT HEART HOT WATER BOTTLE,1,2011-12-09 10:03:00,10.79,,United Kingdom
581492,21494,ROTATING LEAVES T-LIGHT HOLDER,11,2011-12-09 10:03:00,2.46,,United Kingdom
581492,21506,"FANCY FONT BIRTHDAY CARD, ",3,2011-12-09 10:03:00,0.83,,United Kingdom
581492,21507,ELEPHANT BIRTHDAY CARD ,1,2011-12-09 10:03:00,0.83,,United Kingdom
581492,21508,VINTAGE KID DOLLY CARD ,1,2011-12-09 10:03:00,0.83,,United Kingdom
581492,21509,COWBOYS AND INDIANS BIRTHDAY CARD ,2,2011-12-09 10:03:00,0.83,,United Kingdom
581492,21528,DAIRY MAID TRADITIONAL TEAPOT ,1,2011-12-09 10:03:00,13.29,,United Kingdom
581492,21544,SKULLS  WATER TRANSFER TATTOOS ,2,2011-12-09 10:03:00,1.63,,United Kingdom
581492,21558,SKULL LUNCH BOX WITH CUTLERY ,1,2011-12-09 10:03:00,4.96,,United Kingdom
581492,21559,STRAWBERRY LUNCH BOX WITH CUTLERY,1,2011-12-09 10:03:00,4.96,,United Kingdom
581492,21615,4 LAVENDER BOTANICAL DINNER CANDLES,2,2011-12-09 10:03:00,3.29,,United Kingdom
581492,21616,4 PEAR BOTANICAL DINNER CANDLES,6,2011-12-09 10:03:00,3.29,,United Kingdom
581492,21620,SET OF 4 ROSE BOTANICAL CANDLES,5,2011-12-09 10:03:00,3.29,,United Kingdom
581492,21642,ASSORTED TUTTI FRUTTI PEN,4,2011-12-09 10:03:00,1.63,,United Kingdom
581492,21648,ASSORTED TUTTI FRUTTI SMALL PURSE,2,2011-12-09 10:03:00,2.46,,United Kingdom
581492,21650,ASSORTED TUTTI FRUTTI BRACELET,14,2011-12-09 10:03:00,0.83,,United Kingdom
581492,21675,BUTTERFLIES STICKERS,2,2011-12-09 10:03:00,1.63,,United Kingdom
581492,21677,HEARTS  STICKERS,1,2011-12-09 10:03:00,1.63,,United Kingdom
581492,21678,PAISLEY PATTERN  STICKERS,2,2011-12-09 10:03:00,1.63,,United Kingdom
581492,21680,WOODLAND  STICKERS,1,2011-12-09 10:03:00,1.63,,United Kingdom
581492,21703,BAG 125g SWIRLY MARBLES,1,2011-12-09 10:03:00,0.83,,United Kingdom
581492,21704,BAG 250g SWIRLY MARBLES,1,2011-12-09 10:03:00,1.63,,United Kingdom
581492,21716,BOYS VINTAGE TIN SEASIDE BUCKET,1,2011-12-09 10:03:00,4.96,,United Kingdom
581492,21718,RED METAL BEACH SPADE ,1,2011-12-09 10:03:00,2.46,,United Kingdom
581492,21724,PANDA AND BUNNIES STICKER SHEET,1,2011-12-09 10:03:00,1.63,,United Kingdom
581492,21731,RED TOADSTOOL LED NIGHT LIGHT,6,2011-12-09 10:03:00,3.29,,United Kingdom
581492,21739,COSY SLIPPER SHOES SMALL GREEN,2,2011-12-09 10:03:00,2.46,,United Kingdom
581492,21774,DECORATIVE CATS BATHROOM BOTTLE,1,2011-12-09 10:03:00,2.46,,United Kingdom
581492,21786,POLKADOT RAIN HAT ,3,2011-12-09 10:03:00,0.83,,United Kingdom
581492,21787,RAIN PONCHO RETROSPOT,2,2011-12-09 10:03:00,1.63,,United Kingdom
581492,21790,VINTAGE SNAP CARDS,5,2011-12-09 10:03:00,1.63,,United Kingdom
581492,21791,VINTAGE HEADS AND TAILS CARD GAME ,1,2011-12-09 10:03:00,2.46,,United Kingdom
581492,21808,"CHRISTMAS GARLAND STARS,TREES",3,2011-12-09 10:03:00,3.29,,United Kingdom
581492,21810,CHRISTMAS HANGING STAR WITH BELL,25,2011-12-09 10:03:00,0.83,,United Kingdom
581492,21812,GARLAND WITH HEARTS AND BELLS,7,2011-12-09 10:03:00,3.29,,United Kingdom
581492,21813,GARLAND WITH STARS AND BELLS,3,2011-12-09 10:03:00,3.29,,United Kingdom
581492,21822,GLITTER CHRISTMAS TREE WITH BELLS,12,2011-12-09 10:03:00,1.63,,United Kingdom
581492,21828,EIGHT PIECE SNAKE  SET,1,2011-12-09 10:03:00,2.46,,United Kingdom
581492,21832,CHOCOLATE CALCULATOR,1,2011-12-09 10:03:00,3.29,,United Kingdom
581492,21833,CAMOUFLAGE LED TORCH,2,2011-12-09 10:03:00,3.29,,United Kingdom
581492,21871,SAVE THE PLANET MUG,1,2011-12-09 10:03:00,3.29,,United Kingdom
581492,21874,GIN AND TONIC MUG,2,2011-12-09 10:03:00,3.29,,United Kingdom
581492,21876,POTTERING MUG,4,2011-12-09 10:03:00,3.29,,United Kingdom
581492,21879,HEARTS GIFT TAPE,1,2011-12-09 10:03:00,1.63,,United Kingdom
581492,21889,WOODEN BOX OF DOMINOES,3,2011-12-09 10:03:00,2.46,,United Kingdom
581492,21890,S/6 WOODEN SKITTLES IN COTTON BAG,1,2011-12-09 10:03:00,5.79,,United Kingdom
581492,21892,TRADITIONAL WOODEN CATCH CUP GAME ,1,2011-12-09 10:03:00,2.46,,United Kingdom
581492,21900,"KEY FOB , SHED",4,2011-12-09 10:03:00,1.63,,United Kingdom
581492,21901,"KEY FOB , BACK DOOR ",2,2011-12-09 10:03:00,1.63,,United Kingdom
581492,21902,"KEY FOB , FRONT  DOOR ",1,2011-12-09 10:03:00,1.63,,United Kingdom
581492,21905,MORE BUTTER METAL SIGN ,1,2011-12-09 10:03:00,1.63,,United Kingdom
581492,21906,PHARMACIE FIRST AID TIN,1,2011-12-09 10:03:00,13.29,,United Kingdom
581492,21914,BLUE HARMONICA IN BOX ,2,2011-12-09 10:03:00,2.46,,United Kingdom
581492,21916,SET 12 RETRO WHITE CHALK STICKS,2,2011-12-09 10:03:00,0.83,,United Kingdom
581492,21928,JUMBO BAG SCANDINAVIAN BLUE PAISLEY,2,2011-12-09 10:03:00,4.13,,United Kingdom
581492,21929,JUMBO BAG PINK VINTAGE PAISLEY,1,2011-12-09 10:03:00,4.13,,United Kingdom
581492,21930,JUMBO STORAGE BAG SKULLS,1,2011-12-09 10:03:00,4.13,,United Kingdom
581492,21931,JUMBO STORAGE BAG SUKI,1,2011-12-09 10:03:00,4.13,,United Kingdom
581492,21932,SCANDINAVIAN PAISLEY PICNIC BAG,1,2011-12-09 10:03:00,2.46,,United Kingdom
581492,21934,SKULL SHOULDER BAG,3,2011-12-09 10:03:00,1.63,,United Kingdom
581492,21935,SUKI  SHOULDER BAG,9,2011-12-09 10:03:00,1.63,,United Kingdom
581492,21936,RED RETROSPOT PICNIC BAG,1,2011-12-09 10:03:00,5.79,,United Kingdom
581492,21942,SKULLS DESIGN FLANNEL,2,2011-12-09 10:03:00,1.63,,United Kingdom
581492,21945,STRAWBERRIES  DESIGN FLANNEL ,2,2011-12-09 10:03:00,1.63,,United Kingdom
581492,21947,SET OF 6 HEART CHOPSTICKS,1,2011-12-09 10:03:00,2.46,,United Kingdom
581492,21949,SET OF 6 STRAWBERRY CHOPSTICKS,2,2011-12-09 10:03:00,2.46,,United Kingdom
581492,21967,PACK OF 12 SKULL TISSUES,1,2011-12-09 10:03:00,0.83,,United Kingdom
581492,21976,PACK OF 60 MUSHROOM CAKE CASES,3,2011-12-09 10:03:00,1.25,,United Kingdom
581492,21977,PACK OF 60 PINK PAISLEY CAKE CASES,2,2011-12-09 10:03:00,1.25,,United Kingdom
581492,21980,PACK OF 12 RED RETROSPOT TISSUES ,2,2011-12-09 10:03:00,0.83,,United Kingdom
581492,21981,PACK OF 12 WOODLAND TISSUES ,4,2011-12-09 10:03:00,0.83,,United Kingdom
581492,21982,PACK OF 12 SUKI TISSUES ,2,2011-12-09 10:03:00,0.83,,United Kingdom
581492,21983,PACK OF 12 BLUE PAISLEY TISSUES ,1,2011-12-09 10:03:00,0.83,,United Kingdom
581492,21984,PACK OF 12 PINK PAISLEY TISSUES ,1,2011-12-09 10:03:00,0.83,,United Kingdom
581492,21986,PACK OF 12 PINK POLKADOT TISSUES,3,2011-12-09 10:03:00,0.83,,United Kingdom
581492,21989,PACK OF 20 SKULL PAPER NAPKINS,2,2011-12-09 10:03:00,1.63,,United Kingdom
581492,21990,MODERN FLORAL STATIONERY SET,8,2011-12-09 10:03:00,2.46,,United Kingdom
581492,21993,FLORAL FOLK STATIONERY SET,8,2011-12-09 10:03:00,2.46,,United Kingdom
581492,22024,RAINY LADIES BIRTHDAY CARD,3,2011-12-09 10:03:00,0.83,,United Kingdom
581492,22025,RING OF ROSES BIRTHDAY CARD,3,2011-12-09 10:03:00,0.83,,United Kingdom
581492,22026,BANQUET BIRTHDAY  CARD  ,4,2011-12-09 10:03:00,0.83,,United Kingdom
581492,22027,TEA PARTY BIRTHDAY CARD,2,2011-12-09 10:03:00,0.83,,United Kingdom
581492,22028,PENNY FARTHING BIRTHDAY CARD,1,2011-12-09 10:03:00,0.83,,United Kingdom
581492,22029,SPACEBOY BIRTHDAY CARD,4,2011-12-09 10:03:00,0.83,,United Kingdom
581492,22031,BOTANICAL LAVENDER BIRTHDAY CARD,1,2011-12-09 10:03:00,0.83,,United Kingdom
581492,22037,ROBOT BIRTHDAY CARD,4,2011-12-09 10:03:00,0.83,,United Kingdom
581492,22064,PINK DOUGHNUT TRINKET POT ,1,2011-12-09 10:03:00,3.29,,United Kingdom
581492,22065,CHRISTMAS PUDDING TRINKET POT ,2,2011-12-09 10:03:00,1.63,,United Kingdom
581492,22068,BLACK PIRATE TREASURE CHEST,1,2011-12-09 10:03:00,3.29,,United Kingdom
581492,22070,SMALL RED RETROSPOT MUG IN BOX ,3,2011-12-09 10:03:00,7.46,,United Kingdom
581492,22071,SMALL WHITE RETROSPOT MUG IN BOX ,1,2011-12-09 10:03:00,7.46,,United Kingdom
581492,22074,6 RIBBONS SHIMMERING PINKS ,1,2011-12-09 10:03:00,1.25,,United Kingdom
581492,22075,6 RIBBONS ELEGANT CHRISTMAS ,8,2011-12-09 10:03:00,1.63,,United Kingdom
581492,22076,6 RIBBONS EMPIRE  ,4,2011-12-09 10:03:00,1.25,,United Kingdom
581492,22083,PAPER CHAIN KIT RETROSPOT,1,2011-12-09 10:03:00,5.79,,United Kingdom
581492,22085,PAPER CHAIN KIT SKULLS ,1,2011-12-09 10:03:00,5.79,,United Kingdom
581492,22086,PAPER CHAIN KIT 50'S CHRISTMAS ,38,2011-12-09 10:03:00,5.79,,United Kingdom
581492,22091,EMPIRE TISSUE BOX,1,2011-12-09 10:03:00,2.46,,United Kingdom
581492,22099,CARAVAN SQUARE TISSUE BOX,3,2011-12-09 10:03:00,2.46,,United Kingdom
581492,22104,MIRROR MOSAIC CANDLE PLATE,4,2011-12-09 10:03:00,1.63,,United Kingdom
581492,22106,MIRROR MOSAIC HURRICANE LAMP ,1,2011-12-09 10:03:00,4.96,,United Kingdom
581492,22107,PIZZA PLATE IN BOX,10,2011-12-09 10:03:00,3.29,,United Kingdom
581492,22108,PING! MICROWAVE PLATE,2,2011-12-09 10:03:00,3.29,,United Kingdom
581492,22109,FULL ENGLISH BREAKFAST PLATE,2,2011-12-09 10:03:00,7.46,,United Kingdom
581492,22110,BIRD HOUSE HOT WATER BOTTLE,3,2011-12-09 10:03:00,5.79,,United Kingdom
581492,22111,SCOTTIE DOG HOT WATER BOTTLE,1,2011-12-09 10:03:00,10.79,,United Kingdom
581492,22112,CHOCOLATE HOT WATER BOTTLE,1,2011-12-09 10:03:00,10.79,,United Kingdom
581492,22114,HOT WATER BOTTLE TEA AND SYMPATHY,4,2011-12-09 10:03:00,8.29,,United Kingdom
581492,22116,METAL SIGN HIS DINNER IS SERVED,2,2011-12-09 10:03:00,1.63,,United Kingdom
581492,22121,NOEL WOODEN BLOCK LETTERS ,1,2011-12-09 10:03:00,11.63,,United Kingdom
581492,22123,PING MICROWAVE APRON,1,2011-12-09 10:03:00,4.13,,United Kingdom
581492,22124,SET OF 2 TEA TOWELS PING MICROWAVE,1,2011-12-09 10:03:00,2.46,,United Kingdom
581492,22129,PARTY CONES CANDY DECORATION,3,2011-12-09 10:03:00,2.46,,United Kingdom
581492,22134,MINI LADLE LOVE HEART RED ,1,2011-12-09 10:03:00,0.83,,United Kingdom
581492,15036,ASSORTED COLOURS SILK FAN,1,2011-12-09 10:03:00,1.63,,United Kingdom
581492,15039,SANDALWOOD FAN,1,2011-12-09 10:03:00,1.63,,United Kingdom
581492,15058C,ICE CREAM DESIGN GARDEN PARASOL,1,2011-12-09 10:03:00,10.79,,United Kingdom
581492,16218,CARTOON  PENCIL SHARPENERS,5,2011-12-09 10:03:00,0.42,,United Kingdom
581492,16225,RATTLE SNAKE EGGS,1,2011-12-09 10:03:00,3.29,,United Kingdom
581492,16235,RECYCLED PENCIL WITH RABBIT ERASER,3,2011-12-09 10:03:00,0.42,,United Kingdom
581492,16237,SLEEPING CAT ERASERS,1,2011-12-09 10:03:00,0.42,,United Kingdom
581492,17038,PORCELAIN BUDAH INCENSE HOLDER,1,2011-12-09 10:03:00,0.83,,United Kingdom
581492,17084N,FAIRY DREAMS INCENSE ,1,2011-12-09 10:03:00,0.42,,United Kingdom
581492,20659,ECONOMY LUGGAGE TAG,7,2011-12-09 10:03:00,2.46,,United Kingdom
581492,20665,RED RETROSPOT PURSE ,2,2011-12-09 10:03:00,5.79,,United Kingdom
581492,20668,DISCO BALL CHRISTMAS DECORATION,1,2011-12-09 10:03:00,0.42,,United Kingdom
581492,20718,RED RETROSPOT SHOPPER BAG,1,2011-12-09 10:03:00,2.46,,United Kingdom
581492,20719,WOODLAND CHARLOTTE BAG,7,2011-12-09 10:03:00,1.63,,United Kingdom
581492,20723,STRAWBERRY CHARLOTTE BAG,2,2011-12-09 10:03:00,1.63,,United Kingdom
581492,20724,RED RETROSPOT CHARLOTTE BAG,4,2011-12-09 10:03:00,1.63,,United Kingdom
581492,20725,LUNCH BAG RED RETROSPOT,1,2011-12-09 10:03:00,4.13,,United Kingdom
581492,20726,LUNCH BAG WOODLAND,1,2011-12-09 10:03:00,4.13,,United Kingdom
581492,22135,MINI LADLE LOVE HEART PINK,6,2011-12-09 10:03:00,0.83,,United Kingdom
581492,22138,BAKING SET 9 PIECE RETROSPOT ,1,2011-12-09 10:03:00,10.79,,United Kingdom
581492,22141,CHRISTMAS CRAFT TREE TOP ANGEL,2,2011-12-09 10:03:00,4.13,,United Kingdom
581492,22150,3 STRIPEY MICE FELTCRAFT,2,2011-12-09 10:03:00,4.13,,United Kingdom
581492,22153,ANGEL DECORATION STARS ON DRESS,2,2011-12-09 10:03:00,0.83,,United Kingdom
581492,22154,ANGEL DECORATION 3 BUTTONS ,3,2011-12-09 10:03:00,0.83,,United Kingdom
581492,22155,STAR DECORATION RUSTIC,7,2011-12-09 10:03:00,0.83,,United Kingdom
581492,22156,HEART DECORATION WITH PEARLS ,4,2011-12-09 10:03:00,1.63,,United Kingdom
581492,22163,HEART STRING MEMO HOLDER HANGING,9,2011-12-09 10:03:00,1.63,,United Kingdom
581492,22165,"DIAMANTE HEART SHAPED WALL MIRROR, ",1,2011-12-09 10:03:00,10.79,,United Kingdom
581492,22167, OVAL WALL MIRROR DIAMANTE ,1,2011-12-09 10:03:00,8.29,,United Kingdom
581492,22170,PICTURE FRAME WOOD TRIPLE PORTRAIT,1,2011-12-09 10:03:00,13.29,,United Kingdom
581492,22173,METAL 4 HOOK HANGER FRENCH CHATEAU,2,2011-12-09 10:03:00,5.79,,United Kingdom
581492,22174,PHOTO CUBE,7,2011-12-09 10:03:00,3.29,,United Kingdom
581492,22178,VICTORIAN GLASS HANGING T-LIGHT,5,2011-12-09 10:03:00,2.46,,United Kingdom
581492,22186,RED STAR CARD HOLDER,2,2011-12-09 10:03:00,5.79,,United Kingdom
581492,22190,LOCAL CAFE MUG,3,2011-12-09 10:03:00,2.46,,United Kingdom
581492,22193,RED DINER WALL CLOCK,1,2011-12-09 10:03:00,16.63,,United Kingdom
581492,22195,LARGE HEART MEASURING SPOONS,1,2011-12-09 10:03:00,3.29,,United Kingdom
581492,22196,SMALL HEART MEASURING SPOONS,11,2011-12-09 10:03:00,1.63,,United Kingdom
581492,22197,POPCORN HOLDER,34,2011-12-09 10:03:00,1.63,,United Kingdom
581492,22199,FRYING PAN RED RETROSPOT,1,2011-12-09 10:03:00,8.29,,United Kingdom
581492,22209,WOOD STAMP SET HAPPY BIRTHDAY,1,2011-12-09 10:03:00,3.29,,United Kingdom
581492,22212,FOUR HOOK  WHITE LOVEBIRDS,1,2011-12-09 10:03:00,4.13,,United Kingdom
581492,22219,LOVEBIRD HANGING DECORATION WHITE ,4,2011-12-09 10:03:00,1.63,,United Kingdom
581492,22224,WHITE LOVEBIRD LANTERN,4,2011-12-09 10:03:00,5.79,,United Kingdom
581492,22227,HANGING HEART MIRROR DECORATION ,1,2011-12-09 10:03:00,1.25,,United Kingdom
581492,22260,FELT EGG COSY BLUE RABBIT ,2,2011-12-09 10:03:00,1.63,,United Kingdom
581492,22261,FELT EGG COSY WHITE RABBIT ,1,2011-12-09 10:03:00,1.63,,United Kingdom
581492,22264,FELT FARM ANIMAL WHITE BUNNY ,1,2011-12-09 10:03:00,1.63,,United Kingdom
581492,22273,FELTCRAFT DOLL MOLLY,2,2011-12-09 10:03:00,5.79,,United Kingdom
581492,22277,COSMETIC BAG VINTAGE ROSE PAISLEY,1,2011-12-09 10:03:00,4.13,,United Kingdom
581492,22279,POCKET BAG BLUE PAISLEY RED SPOT,5,2011-12-09 10:03:00,2.46,,United Kingdom
581492,22280,POCKET BAG PINK PAISELY BROWN SPOT,4,2011-12-09 10:03:00,2.46,,United Kingdom
581492,22300,COFFEE MUG DOG + BALL DESIGN,1,2011-12-09 10:03:00,4.96,,United Kingdom
581492,22301,COFFEE MUG CAT + BIRD DESIGN,1,2011-12-09 10:03:00,4.96,,United Kingdom
581492,22307,GOLD MUG BONE CHINA TREE OF LIFE,1,2011-12-09 10:03:00,8.29,,United Kingdom
581492,22308,TEA COSY BLUE STRIPE,2,2011-12-09 10:03:00,4.96,,United Kingdom
581492,22309,TEA COSY RED  STRIPE,2,2011-12-09 10:03:00,4.96,,United Kingdom
581492,22324,BLUE POLKADOT KIDS BAG,2,2011-12-09 10:03:00,4.13,,United Kingdom
581492,22326,ROUND SNACK BOXES SET OF4 WOODLAND ,3,2011-12-09 10:03:00,5.79,,United Kingdom
581492,22327,ROUND SNACK BOXES SET OF 4 SKULLS,2,2011-12-09 10:03:00,5.79,,United Kingdom
581492,22329,ROUND CONTAINER SET OF 5 RETROSPOT,2,2011-12-09 10:03:00,3.29,,United Kingdom
581492,22338,STAR DECORATION PAINTED ZINC ,4,2011-12-09 10:03:00,0.63,,United Kingdom
581492,22340,NOEL GARLAND PAINTED ZINC ,17,2011-12-09 10:03:00,0.83,,United Kingdom
581492,22342,HOME GARLAND PAINTED ZINC ,7,2011-12-09 10:03:00,3.29,,United Kingdom
581492,22348,TEA BAG PLATE RED RETROSPOT,3,2011-12-09 10:03:00,1.63,,United Kingdom
581492,22355,CHARLOTTE BAG SUKI DESIGN,3,2011-12-09 10:03:00,1.63,,United Kingdom
581492,22356,CHARLOTTE BAG PINK POLKADOT,1,2011-12-09 10:03:00,1.63,,United Kingdom
581492,22357,KINGS CHOICE BISCUIT TIN,2,2011-12-09 10:03:00,4.13,,United Kingdom
581492,22358,KINGS CHOICE TEA CADDY ,1,2011-12-09 10:03:00,5.79,,United Kingdom
581492,22361,GLASS JAR DAISY FRESH COTTON WOOL,2,2011-12-09 10:03:00,5.79,,United Kingdom
581492,22362,GLASS JAR PEACOCK BATH SALTS,2,2011-12-09 10:03:00,5.79,,United Kingdom
581492,22367,CHILDRENS APRON SPACEBOY DESIGN,1,2011-12-09 10:03:00,4.13,,United Kingdom
581492,22372,AIRLINE BAG VINTAGE WORLD CHAMPION ,1,2011-12-09 10:03:00,8.29,,United Kingdom
581492,22374,AIRLINE BAG VINTAGE JET SET RED,1,2011-12-09 10:03:00,8.29,,United Kingdom
581492,85014B,RED RETROSPOT UMBRELLA,1,2011-12-09 10:03:00,12.46,,United Kingdom
581492,85032C,CURIOUS IMAGES GIFT WRAP SET,1,2011-12-09 10:03:00,1.63,,United Kingdom
581492,85038,6 CHOCOLATE LOVE HEART T-LIGHTS,1,2011-12-09 10:03:00,4.13,,United Kingdom
581492,85039A,SET/4 RED MINI ROSE CANDLE IN BOWL,5,2011-12-09 10:03:00,1.63,,United Kingdom
581492,85039B,S/4 IVORY MINI ROSE CANDLE IN BOWL,4,2011-12-09 10:03:00,1.63,,United Kingdom
581492,85040A,S/4 PINK FLOWER CANDLES IN BOWL,1,2011-12-09 10:03:00,3.29,,United Kingdom
581492,85048,15CM CHRISTMAS GLASS BALL 20 LIGHTS,2,2011-12-09 10:03:00,16.63,,United Kingdom
581492,85049C,ROMANTIC PINKS RIBBONS ,1,2011-12-09 10:03:00,2.46,,United Kingdom
581492,85049G,CHOCOLATE BOX RIBBONS ,1,2011-12-09 10:03:00,2.46,,United Kingdom
581492,85049H,URBAN BLACK RIBBONS ,2,2011-12-09 10:03:00,0.83,,United Kingdom
581492,85053,FRENCH ENAMEL CANDLEHOLDER,1,2011-12-09 10:03:00,4.13,,United Kingdom
581492,85059,FRENCH ENAMEL WATER BASIN,1,2011-12-09 10:03:00,7.46,,United Kingdom
581492,85066,CREAM SWEETHEART MINI CHEST,1,2011-12-09 10:03:00,24.96,,United Kingdom
581492,85094,CANDY SPOT EGG WARMER RABBIT,2,2011-12-09 10:03:00,0.83,,United Kingdom
581492,85099C,JUMBO  BAG BAROQUE BLACK WHITE,7,2011-12-09 10:03:00,4.13,,United Kingdom
581492,85114C,RED ENCHANTED FOREST PLACEMAT,1,2011-12-09 10:03:00,3.29,,United Kingdom
581492,85123A,CREAM HANGING HEART T-LIGHT HOLDER,3,2011-12-09 10:03:00,5.79,,United Kingdom
581492,85131B,BEADED CRYSTAL HEART GREEN ON STICK,1,2011-12-09 10:03:00,0.83,,United Kingdom
581492,85131D,BEADED CRYSTAL HEART PINK ON STICK,2,2011-12-09 10:03:00,0.83,,United Kingdom
581492,85152,HAND OVER THE CHOCOLATE   SIGN ,1,2011-12-09 10:03:00,4.13,,United Kingdom
581492,85168B,BLACK BAROQUE CARRIAGE CLOCK,3,2011-12-09 10:03:00,8.29,,United Kingdom
581492,85169C,EAU DE NIL LOVE BIRD CANDLE,1,2011-12-09 10:03:00,2.46,,United Kingdom
581492,85170C,SET/6 EAU DE NIL BIRD T-LIGHTS,1,2011-12-09 10:03:00,4.13,,United Kingdom
581492,85173,SET/6 FROG PRINCE T-LIGHT CANDLES,1,2011-12-09 10:03:00,4.96,,United Kingdom
581492,85177,BASKET OF FLOWERS SEWING KIT,1,2011-12-09 10:03:00,1.63,,United Kingdom
581492,85178,VICTORIAN SEWING KIT,1,2011-12-09 10:03:00,2.46,,United Kingdom
581492,85179A,GREEN BITTY LIGHT CHAIN,4,2011-12-09 10:03:00,2.46,,United Kingdom
581492,85199S,SMALL HANGING IVORY/RED WOOD BIRD,9,2011-12-09 10:03:00,0.83,,United Kingdom
581492,85227,SET OF 6 3D KIT CARDS FOR KIDS,3,2011-12-09 10:03:00,1.63,,United Kingdom
581492,90003C,MIDNIGHT BLUE PAIR HEART HAIR SLIDE,1,2011-12-09 10:03:00,3.73,,United Kingdom
581492,90003E,GREEN PAIR HEART HAIR SLIDES,2,2011-12-09 10:03:00,3.73,,United Kingdom
581492,90010A,MIDNIGHT BLUE GLASS/SILVER BRACELET,1,2011-12-09 10:03:00,9.57,,United Kingdom
581492,90013A,MIDNIGHT BLUE VINTAGE EARRINGS,3,2011-12-09 10:03:00,3.73,,United Kingdom
581492,90013C,GREEN VINTAGE EARRINGS ,2,2011-12-09 10:03:00,4.15,,United Kingdom
581492,90014A,SILVER M.O.P. ORBIT NECKLACE,1,2011-12-09 10:03:00,10.4,,United Kingdom
581492,90016B,GOLD/M.O.P PENDANT ORBIT NECKLACE,1,2011-12-09 10:03:00,8.32,,United Kingdom
581492,90018B,GOLD M.O.P ORBIT DROP EARRINGS,1,2011-12-09 10:03:00,4.15,,United Kingdom
581492,90019B,GOLD M.O.P ORBIT BRACELET,1,2011-12-09 10:03:00,5.4,,United Kingdom
581492,90027D,GLASS BEAD HOOP EARRINGS AMETHYST,1,2011-12-09 10:03:00,3.32,,United Kingdom
581492,90030B,RED KUKUI COCONUT SEED NECKLACE,1,2011-12-09 10:03:00,5.82,,United Kingdom
581492,90055,CRACKED GLAZE EARRINGS BROWN,1,2011-12-09 10:03:00,2.48,,United Kingdom
581492,90059A,DIAMANTE HAIR GRIP PACK/2 CRYSTAL,1,2011-12-09 10:03:00,1.65,,United Kingdom
581492,90059D,DIAMANTE HAIR GRIP PACK/2 PERIDOT,2,2011-12-09 10:03:00,1.65,,United Kingdom
581492,90059E,DIAMANTE HAIR GRIP PACK/2 RUBY,1,2011-12-09 10:03:00,1.65,,United Kingdom
581492,90059F,DIAMANTE HAIR GRIP PACK/2 LT ROSE,1,2011-12-09 10:03:00,1.65,,United Kingdom
581492,90072,RUBY DROP CHANDELIER EARRINGS,1,2011-12-09 10:03:00,4.15,,United Kingdom
581492,90086,CRYSTAL FROG PHONE CHARM,1,2011-12-09 10:03:00,1.63,,United Kingdom
581492,90120B,BLUE MURANO TWIST BRACELET,2,2011-12-09 10:03:00,4.15,,United Kingdom
581492,90120C,GREEN MURANO TWIST BRACELET,1,2011-12-09 10:03:00,4.15,,United Kingdom
581492,90130B,TURQ STONE/CRYSTAL EARRINGS,1,2011-12-09 10:03:00,2.9,,United Kingdom
581492,90130C,GREEN STONE/CRYSTAL EARRINGS,1,2011-12-09 10:03:00,2.9,,United Kingdom
581492,90134,OLD ROSE COMBO BEAD NECKLACE,1,2011-12-09 10:03:00,2.9,,United Kingdom
581492,90138,WHITE/PINK MINI CRYSTALS NECKLACE,1,2011-12-09 10:03:00,5.4,,United Kingdom
581492,90141B,IVORY PENDANT TRIPLE SHELL NECKLACE,1,2011-12-09 10:03:00,4.98,,United Kingdom
581492,90145,SILVER HOOP EARRINGS WITH FLOWER,1,2011-12-09 10:03:00,6.23,,United Kingdom
581492,90155,RESIN NECKLACE W PASTEL BEADS,1,2011-12-09 10:03:00,7.48,,United Kingdom
581492,90161D,ANT COPPER PINK BOUDICCA BRACELET,1,2011-12-09 10:03:00,4.98,,United Kingdom
581492,90163A,PINK ROSEBUD & PEARL NECKLACE,2,2011-12-09 10:03:00,7.48,,United Kingdom
