InvoiceNo,StockCode,Description,Quantity,InvoiceDate,UnitPrice,CustomerID,Country
560807,23201,JUMBO BAG ALPHABET,10,2011-07-21 10:44:00,2.08,18143.0,United Kingdom
560807,23207,LUNCH BAG ALPHABET DESIGN,10,2011-07-21 10:44:00,1.65,18143.0,United Kingdom
560807,20728,LUNCH BAG CARS BLUE,10,2011-07-21 10:44:00,1.65,18143.0,United Kingdom
560807,22661,CHARLOTTE BAG DOLLY GIRL DESIGN,10,2011-07-21 10:44:00,0.85,18143.0,United Kingdom
560807,23306,SET OF 36 DOILIES PANTRY DESIGN,12,2011-07-21 10:44:00,1.45,18143.0,United Kingdom
560807,22952,60 CAKE CASES VINTAGE CHRISTMAS,24,2011-07-21 10:44:00,0.55,18143.0,United Kingdom
560807,21977,PACK OF 60 PINK PAISLEY CAKE CASES,24,2011-07-21 10:44:00,0.55,18143.0,United Kingdom
560807,22417,PACK OF 60 SPACEBOY CAKE CASES,24,2011-07-21 10:44:00,0.55,18143.0,United Kingdom
560807,23297,SET 40 HEART SHAPE PETIT FOUR CASES,12,2011-07-21 10:44:00,1.65,18143.0,United Kingdom
560807,22960,JAM MAKING SET WITH JARS,6,2011-07-21 10:44:00,4.25,18143.0,United Kingdom
560807,22457,NATURAL SLATE HEART CHALKBOARD ,6,2011-07-21 10:44:00,2.95,18143.0,United Kingdom
560807,48187,DOORMAT NEW ENGLAND,2,2011-07-21 10:44:00,7.95,18143.0,United Kingdom
560807,23293,SET OF 12 FAIRY CAKE BAKING CASES,12,2011-07-21 10:44:00,0.83,18143.0,United Kingdom
560807,23296,SET OF 6 TEA TIME BAKING CASES,8,2011-07-21 10:44:00,1.25,18143.0,United Kingdom
560807,23236,DOILEY STORAGE TIN,6,2011-07-21 10:44:00,2.89,18143.0,United Kingdom
560807,23319,BOX OF 6 MINI 50'S CRACKERS,6,2011-07-21 10:44:00,2.49,18143.0,United Kingdom
560807,22950,36 DOILIES VINTAGE CHRISTMAS,12,2011-07-21 10:44:00,1.45,18143.0,United Kingdom
560807,22910,PAPER CHAIN KIT VINTAGE CHRISTMAS,6,2011-07-21 10:44:00,2.95,18143.0,United Kingdom
560807,23200,JUMBO BAG PEARS,10,2011-07-21 10:44:00,2.08,18143.0,United Kingdom
560807,84375,SET OF 20 KIDS COOKIE CUTTERS,12,2011-07-21 10:44:00,2.1,18143.0,United Kingdom
560807,22956,36 FOIL HEART CAKE CASES,6,2011-07-21 10:44:00,2.1,18143.0,United Kingdom
560807,22083,PAPER CHAIN KIT RETROSPOT,6,2011-07-21 10:44:00,2.95,18143.0,United Kingdom
560807,23318,BOX OF 6 MINI VINTAGE CRACKERS,6,2011-07-21 10:44:00,2.49,18143.0,United Kingdom
C560818,22842,BISCUIT TIN VINTAGE RED,-1,2011-07-21 10:52:00,6.75,17811.0,United Kingdom
C560818,22197,POPCORN HOLDER,-1,2011-07-21 10:52:00,0.72,17811.0,United Kingdom
560819,21686,,2,2011-07-21 10:53:00,0.0,,United Kingdom
560820,23202,JUMBO BAG VINTAGE LEAF,2,2011-07-21 10:59:00,2.08,17811.0,United Kingdom
560820,21931,JUMBO STORAGE BAG SUKI,1,2011-07-21 10:59:00,2.08,17811.0,United Kingdom
560820,85099F,JUMBO BAG STRAWBERRY,4,2011-07-21 10:59:00,2.08,17811.0,United Kingdom
560820,22904,CALENDAR PAPER CUT DESIGN,10,2011-07-21 10:59:00,2.95,17811.0,United Kingdom
560820,21212,PACK OF 72 RETROSPOT CAKE CASES,1,2011-07-21 10:59:00,0.55,17811.0,United Kingdom
560820,21977,PACK OF 60 PINK PAISLEY CAKE CASES,1,2011-07-21 10:59:00,0.55,17811.0,United Kingdom
560820,21213,PACK OF 72 SKULL CAKE CASES,1,2011-07-21 10:59:00,0.55,17811.0,United Kingdom
560820,22332,SKULLS PARTY BAG + STICKER SET,3,2011-07-21 10:59:00,1.65,17811.0,United Kingdom
560820,22619,SET OF 6 SOLDIER SKITTLES,3,2011-07-21 10:59:00,3.75,17811.0,United Kingdom
560820,22526,WHEELBARROW FOR CHILDREN ,1,2011-07-21 10:59:00,12.75,17811.0,United Kingdom
560820,22197,POPCORN HOLDER,100,2011-07-21 10:59:00,0.72,17811.0,United Kingdom
560821,84711B,PINK OVAL SHAPE TRINKET BOX,3,2011-07-21 11:17:00,9.95,17848.0,United Kingdom
560821,21340,CLASSIC METAL BIRDCAGE PLANT HOLDER,8,2011-07-21 11:17:00,9.95,17848.0,United Kingdom
C560822,M,Manual,-1,2011-07-21 11:20:00,770.26,,United Kingdom
C560823,BANK CHARGES,Bank Charges,-1,2011-07-21 11:22:00,21.9,,United Kingdom
560824,20828,GLITTER BUTTERFLY CLIPS,6,2011-07-21 11:23:00,2.55,17935.0,United Kingdom
560824,21866,UNION JACK FLAG LUGGAGE TAG,5,2011-07-21 11:23:00,1.25,17935.0,United Kingdom
560824,21867,PINK UNION JACK  LUGGAGE TAG,5,2011-07-21 11:23:00,1.25,17935.0,United Kingdom
560824,22640,SET OF 4 NAPKIN CHARMS 3 KEYS ,1,2011-07-21 11:23:00,2.55,17935.0,United Kingdom
560824,23290,SPACEBOY CHILDRENS BOWL,1,2011-07-21 11:23:00,1.25,17935.0,United Kingdom
560824,23292,SPACEBOY CHILDRENS CUP,1,2011-07-21 11:23:00,1.25,17935.0,United Kingdom
560824,23309,SET OF 60 I LOVE LONDON CAKE CASES ,3,2011-07-21 11:23:00,0.55,17935.0,United Kingdom
560824,20657,TROPICAL LUGGAGE TAG,5,2011-07-21 11:23:00,1.25,17935.0,United Kingdom
560824,23309,SET OF 60 I LOVE LONDON CAKE CASES ,1,2011-07-21 11:23:00,0.55,17935.0,United Kingdom
560824,20659,ECONOMY LUGGAGE TAG,12,2011-07-21 11:23:00,1.25,17935.0,United Kingdom
560824,22553,PLASTERS IN TIN SKULLS,1,2011-07-21 11:23:00,1.65,17935.0,United Kingdom
560824,22557,PLASTERS IN TIN VINTAGE PAISLEY ,1,2011-07-21 11:23:00,1.65,17935.0,United Kingdom
560824,22551,PLASTERS IN TIN SPACEBOY,2,2011-07-21 11:23:00,1.65,17935.0,United Kingdom
560824,22659,LUNCH BOX I LOVE LONDON,1,2011-07-21 11:23:00,1.95,17935.0,United Kingdom
560824,22210,WOOD STAMP SET BEST WISHES,1,2011-07-21 11:23:00,0.83,17935.0,United Kingdom
560824,22208,WOOD STAMP SET THANK YOU,1,2011-07-21 11:23:00,0.83,17935.0,United Kingdom
560824,22211,WOOD STAMP SET FLOWERS,1,2011-07-21 11:23:00,0.83,17935.0,United Kingdom
560824,22209,WOOD STAMP SET HAPPY BIRTHDAY,1,2011-07-21 11:23:00,0.83,17935.0,United Kingdom
560824,22450,SILK PURSE BABUSHKA BLUE,6,2011-07-21 11:23:00,3.35,17935.0,United Kingdom
560824,22449,SILK PURSE BABUSHKA PINK,6,2011-07-21 11:23:00,3.35,17935.0,United Kingdom
560824,20856,DENIM PATCH PURSE PINK BUTTERFLY,1,2011-07-21 11:23:00,1.65,17935.0,United Kingdom
560824,21051,RIBBONS PURSE ,1,2011-07-21 11:23:00,2.1,17935.0,United Kingdom
560824,22749,FELTCRAFT PRINCESS CHARLOTTE DOLL,1,2011-07-21 11:23:00,3.75,17935.0,United Kingdom
560824,22755,SMALL PURPLE BABUSHKA NOTEBOOK ,4,2011-07-21 11:23:00,0.85,17935.0,United Kingdom
560824,22753,SMALL YELLOW BABUSHKA NOTEBOOK ,4,2011-07-21 11:23:00,0.85,17935.0,United Kingdom
560824,22754,SMALL RED BABUSHKA NOTEBOOK ,4,2011-07-21 11:23:00,0.85,17935.0,United Kingdom
560824,22752,SET 7 BABUSHKA NESTING BOXES,1,2011-07-21 11:23:00,8.5,17935.0,United Kingdom
C560825,M,Manual,-1,2011-07-21 11:23:00,367.38,,United Kingdom
560826,84946,ANTIQUE SILVER T-LIGHT GLASS,288,2011-07-21 11:30:00,1.06,18073.0,United Kingdom
560826,22178,VICTORIAN GLASS HANGING T-LIGHT,96,2011-07-21 11:30:00,1.06,18073.0,United Kingdom
560826,22698,PINK REGENCY TEACUP AND SAUCER,6,2011-07-21 11:30:00,2.95,18073.0,United Kingdom
560826,22697,GREEN REGENCY TEACUP AND SAUCER,6,2011-07-21 11:30:00,2.95,18073.0,United Kingdom
560826,23172,REGENCY TEA PLATE PINK,12,2011-07-21 11:30:00,1.65,18073.0,United Kingdom
560826,23052,RECYCLED ACAPULCO MAT TURQUOISE,2,2011-07-21 11:30:00,8.25,18073.0,United Kingdom
560826,23054,RECYCLED ACAPULCO MAT LAVENDER,2,2011-07-21 11:30:00,8.25,18073.0,United Kingdom
560826,22698,PINK REGENCY TEACUP AND SAUCER,6,2011-07-21 11:30:00,2.95,18073.0,United Kingdom
560827,22789,T-LIGHT HOLDER SWEETHEART HANGING,16,2011-07-21 11:42:00,1.95,14517.0,United Kingdom
560827,82484,WOOD BLACK BOARD ANT WHITE FINISH,2,2011-07-21 11:42:00,7.95,14517.0,United Kingdom
560827,21411,GINGHAM HEART  DOORSTOP RED,3,2011-07-21 11:42:00,4.25,14517.0,United Kingdom
560827,22508,DOORSTOP RETROSPOT HEART,4,2011-07-21 11:42:00,3.75,14517.0,United Kingdom
560827,22169,FAMILY ALBUM WHITE PICTURE FRAME,2,2011-07-21 11:42:00,8.5,14517.0,United Kingdom
560827,22766,PHOTO FRAME CORNICE,8,2011-07-21 11:42:00,2.95,14517.0,United Kingdom
560827,22551,PLASTERS IN TIN SPACEBOY,12,2011-07-21 11:42:00,1.65,14517.0,United Kingdom
560827,22423,REGENCY CAKESTAND 3 TIER,2,2011-07-21 11:42:00,12.75,14517.0,United Kingdom
560827,84510A,SET OF 4 ENGLISH ROSE COASTERS,10,2011-07-21 11:42:00,1.25,14517.0,United Kingdom
560827,21408,SPOTTY PINK DUCK DOORSTOP,3,2011-07-21 11:42:00,4.25,14517.0,United Kingdom
560827,21485,RETROSPOT HEART HOT WATER BOTTLE,3,2011-07-21 11:42:00,4.95,14517.0,United Kingdom
560827,21523,DOORMAT FANCY FONT HOME SWEET HOME,2,2011-07-21 11:42:00,7.95,14517.0,United Kingdom
560827,22692,DOORMAT WELCOME TO OUR HOME,2,2011-07-21 11:42:00,7.95,14517.0,United Kingdom
560827,22430,ENAMEL WATERING CAN CREAM,4,2011-07-21 11:42:00,4.95,14517.0,United Kingdom
560828,16045,POPART WOODEN PENCILS ASST,100,2011-07-21 11:55:00,0.04,14298.0,United Kingdom
560828,16161G,WRAP BAD HAIR DAY,50,2011-07-21 11:55:00,0.1,14298.0,United Kingdom
560828,10133,COLOURING PENCILS BROWN TUBE,20,2011-07-21 11:55:00,0.42,14298.0,United Kingdom
560828,16054,POPART RECT PENCIL SHARPENER ASST,72,2011-07-21 11:55:00,0.12,14298.0,United Kingdom
560828,16216,LETTER SHAPE PENCIL SHARPENER,160,2011-07-21 11:55:00,0.06,14298.0,United Kingdom
560828,20832,RED FLOCK LOVE HEART PHOTO FRAME,48,2011-07-21 11:55:00,0.39,14298.0,United Kingdom
560828,20984,12 PENCILS TALL TUBE POSY,48,2011-07-21 11:55:00,0.29,14298.0,United Kingdom
560828,21158,MOODY GIRL DOOR HANGER ,24,2011-07-21 11:55:00,0.39,14298.0,United Kingdom
560828,21159,MOODY BOY  DOOR HANGER ,24,2011-07-21 11:55:00,0.39,14298.0,United Kingdom
560828,21162,TOXIC AREA  DOOR HANGER ,24,2011-07-21 11:55:00,0.39,14298.0,United Kingdom
560828,21163,DO NOT TOUCH MY STUFF DOOR HANGER ,24,2011-07-21 11:55:00,0.39,14298.0,United Kingdom
560828,21209,MULTICOLOUR HONEYCOMB FAN,24,2011-07-21 11:55:00,0.39,14298.0,United Kingdom
560828,21179,NO JUNK MAIL METAL SIGN,24,2011-07-21 11:55:00,0.39,14298.0,United Kingdom
560828,21311,SET/4 BIRD MIRROR MAGNETS ,24,2011-07-21 11:55:00,0.29,14298.0,United Kingdom
560828,21359,RELAX LARGE WOOD LETTERS,6,2011-07-21 11:55:00,3.95,14298.0,United Kingdom
560828,21641,ASSORTED TUTTI FRUTTI KEYRING BALL,48,2011-07-21 11:55:00,0.29,14298.0,United Kingdom
560828,21642,ASSORTED TUTTI FRUTTI PEN,48,2011-07-21 11:55:00,0.29,14298.0,United Kingdom
560828,21698,MOCK LOBSTER FRIDGE MAGNET,24,2011-07-21 11:55:00,0.39,14298.0,United Kingdom
560828,21905,MORE BUTTER METAL SIGN ,12,2011-07-21 11:55:00,0.79,14298.0,United Kingdom
560828,22093,MOTORING TISSUE BOX,36,2011-07-21 11:55:00,0.39,14298.0,United Kingdom
560828,22095,LADS ONLY TISSUE BOX,36,2011-07-21 11:55:00,0.39,14298.0,United Kingdom
560828,22098,BOUDOIR SQUARE TISSUE BOX,36,2011-07-21 11:55:00,0.39,14298.0,United Kingdom
560828,22161,HEART DECORATION RUSTIC HANGING ,64,2011-07-21 11:55:00,0.19,14298.0,United Kingdom
560828,22208,WOOD STAMP SET THANK YOU,12,2011-07-21 11:55:00,0.83,14298.0,United Kingdom
560828,22211,WOOD STAMP SET FLOWERS,12,2011-07-21 11:55:00,0.83,14298.0,United Kingdom
560828,22229,BUNNY WOODEN PAINTED WITH FLOWER ,24,2011-07-21 11:55:00,0.39,14298.0,United Kingdom
560828,22230,JIGSAW TREE WITH WATERING CAN,48,2011-07-21 11:55:00,0.29,14298.0,United Kingdom
560828,22228,BUNNY WOODEN PAINTED WITH BIRD ,24,2011-07-21 11:55:00,0.39,14298.0,United Kingdom
560828,22231,JIGSAW TREE WITH BIRDHOUSE,24,2011-07-21 11:55:00,0.59,14298.0,United Kingdom
560828,22267,EASTER DECORATION EGG BUNNY ,24,2011-07-21 11:55:00,0.39,14298.0,United Kingdom
560828,22286,DECORATION WOBBLY RABBIT METAL ,24,2011-07-21 11:55:00,0.39,14298.0,United Kingdom
560828,22402,MAGNETS PACK OF 4 VINTAGE COLLAGE,12,2011-07-21 11:55:00,0.39,14298.0,United Kingdom
560828,22403,MAGNETS PACK OF 4 VINTAGE LABELS ,12,2011-07-21 11:55:00,0.39,14298.0,United Kingdom
560828,22461,SAVOY ART DECO CLOCK,12,2011-07-21 11:55:00,3.95,14298.0,United Kingdom
560828,23186,FRENCH STYLE STORAGE JAR CAFE ,48,2011-07-21 11:55:00,0.29,14298.0,United Kingdom
560828,23187,FRENCH STYLE STORAGE JAR BONBONS,48,2011-07-21 11:55:00,0.29,14298.0,United Kingdom
560828,35637A,IVORY STRING CURTAIN WITH POLE ,6,2011-07-21 11:55:00,1.95,14298.0,United Kingdom
560828,35637C,PINK STRING CURTAIN WITH POLE,6,2011-07-21 11:55:00,1.95,14298.0,United Kingdom
560828,35923,CANDY HEART HANGING DECORATION,24,2011-07-21 11:55:00,0.39,14298.0,United Kingdom
560828,44236,PINK/PURPLE CIRCLE CURTAIN,24,2011-07-21 11:55:00,0.79,14298.0,United Kingdom
560828,46118,FUNKY MONKEY CUSHION COVER,24,2011-07-21 11:55:00,0.85,14298.0,United Kingdom
560828,47503A,ASS FLORAL PRINT MULTI SCREWDRIVER,24,2011-07-21 11:55:00,0.42,14298.0,United Kingdom
560828,51014A,"FEATHER PEN,HOT PINK",24,2011-07-21 11:55:00,0.39,14298.0,United Kingdom
560828,51014L,"FEATHER PEN,LIGHT PINK",24,2011-07-21 11:55:00,0.39,14298.0,United Kingdom
560828,72232,FENG SHUI PILLAR CANDLE,96,2011-07-21 11:55:00,0.19,14298.0,United Kingdom
560828,79163,BLACK CHAMPAGNE GLASS,48,2011-07-21 11:55:00,0.39,14298.0,United Kingdom
560828,81950B,FLOWER BLUE CLOCK WITH SUCKER,50,2011-07-21 11:55:00,0.29,14298.0,United Kingdom
560828,81953P,ROUND ARTICULATED PINK CLOCK W/SUCK,20,2011-07-21 11:55:00,0.19,14298.0,United Kingdom
560828,81952B,ROUND BLUE CLOCK WITH SUCKER,1,2011-07-21 11:55:00,0.19,14298.0,United Kingdom
560828,84387A,BIRD ON BRANCH CANVAS SCREEN,11,2011-07-21 11:55:00,1.95,14298.0,United Kingdom
560828,81952V,ROUND PURPLE CLOCK WITH SUCKER,50,2011-07-21 11:55:00,0.19,14298.0,United Kingdom
560828,84402B,PURPLE DRESS JEWELLERY STAND,24,2011-07-21 11:55:00,0.79,14298.0,United Kingdom
560828,84596L,BISCUITS SMALL BOWL LIGHT BLUE,16,2011-07-21 11:55:00,0.42,14298.0,United Kingdom
560828,84596B,SMALL DOLLY MIX DESIGN ORANGE BOWL,16,2011-07-21 11:55:00,0.42,14298.0,United Kingdom
560828,84660A,WHITE STITCHED WALL CLOCK,40,2011-07-21 11:55:00,0.79,14298.0,United Kingdom
560828,84660B,BLACK STITCHED WALL CLOCK,100,2011-07-21 11:55:00,0.79,14298.0,United Kingdom
560828,84660C,PINK STITCHED WALL CLOCK,60,2011-07-21 11:55:00,0.79,14298.0,United Kingdom
560828,84723,CHERRY BLOSSOM CANVAS ART PICTURE,24,2011-07-21 11:55:00,1.95,14298.0,United Kingdom
560828,84663A,GRASS HOPPER WOODEN WALL CLOCK ,100,2011-07-21 11:55:00,0.79,14298.0,United Kingdom
560828,84944,SET OF 6 KASHMIR FOLKART BAUBLES,12,2011-07-21 11:55:00,1.65,14298.0,United Kingdom
560828,85015,SET OF 12  VINTAGE POSTCARD SET,24,2011-07-21 11:55:00,0.65,14298.0,United Kingdom
560828,85017B,ENVELOPE 50 BLOSSOM IMAGES,24,2011-07-21 11:55:00,0.42,14298.0,United Kingdom
560828,85130B,BEADED CRYSTAL HEART GREEN LARGE,48,2011-07-21 11:55:00,0.79,14298.0,United Kingdom
560828,85130C,BEADED CRYSTAL HEART BLUE  LARGE,48,2011-07-21 11:55:00,0.79,14298.0,United Kingdom
560828,85130D,BEADED CRYSTAL HEART PINK LARGE,48,2011-07-21 11:55:00,0.79,14298.0,United Kingdom
560829,21479,WHITE SKULL HOT WATER BOTTLE ,8,2011-07-21 12:00:00,3.75,17694.0,United Kingdom
560829,22465,HANGING METAL STAR LANTERN,12,2011-07-21 12:00:00,1.65,17694.0,United Kingdom
560829,21481,FAWN BLUE HOT WATER BOTTLE,6,2011-07-21 12:00:00,2.95,17694.0,United Kingdom
560829,22457,NATURAL SLATE HEART CHALKBOARD ,6,2011-07-21 12:00:00,2.95,17694.0,United Kingdom
560829,23298,SPOTTY BUNTING,6,2011-07-21 12:00:00,4.95,17694.0,United Kingdom
560829,21238,RED RETROSPOT CUP,8,2011-07-21 12:00:00,0.85,17694.0,United Kingdom
560829,22132,RED LOVE HEART SHAPE CUP,12,2011-07-21 12:00:00,0.85,17694.0,United Kingdom
560829,23288,GREEN VINTAGE SPOT BEAKER,8,2011-07-21 12:00:00,0.85,17694.0,United Kingdom
560829,21743,STAR PORTABLE TABLE LIGHT ,6,2011-07-21 12:00:00,2.95,17694.0,United Kingdom
560829,22780,LIGHT GARLAND BUTTERFILES PINK,8,2011-07-21 12:00:00,4.25,17694.0,United Kingdom
560829,21967,PACK OF 12 SKULL TISSUES,24,2011-07-21 12:00:00,0.29,17694.0,United Kingdom
560829,21985,PACK OF 12 HEARTS DESIGN TISSUES ,24,2011-07-21 12:00:00,0.29,17694.0,United Kingdom
560829,21065,BOOM BOX SPEAKER GIRLS,4,2011-07-21 12:00:00,5.95,17694.0,United Kingdom
560829,21064,BOOM BOX SPEAKER BOYS,4,2011-07-21 12:00:00,5.95,17694.0,United Kingdom
560829,84212,"ASSORTED FLOWER COLOUR ""LEIS""",48,2011-07-21 12:00:00,0.65,17694.0,United Kingdom
560830,81953B,,-6,2011-07-21 12:03:00,0.0,,United Kingdom
560831,81950V,,-1,2011-07-21 12:04:00,0.0,,United Kingdom
C560832,23243,SET OF TEA COFFEE SUGAR TINS PANTRY,-1,2011-07-21 12:07:00,4.95,13488.0,United Kingdom
560833,23010,CIRCUS PARADE BABY GIFT SET,1,2011-07-21 12:14:00,16.95,16891.0,United Kingdom
560833,85036A,GARDENIA 1 WICK MORRIS BOXED CANDLE,1,2011-07-21 12:14:00,4.25,16891.0,United Kingdom
560833,22624,IVORY KITCHEN SCALES,1,2011-07-21 12:14:00,8.5,16891.0,United Kingdom
560833,72122,COFFEE SCENT PILLAR CANDLE,2,2011-07-21 12:14:00,0.95,16891.0,United Kingdom
560833,84882,GREEN WIRE STANDING CANDLE HOLDER,1,2011-07-21 12:14:00,3.75,16891.0,United Kingdom
560833,23322,LARGE WHITE HEART OF WICKER,1,2011-07-21 12:14:00,2.95,16891.0,United Kingdom
560833,22470,HEART OF WICKER LARGE,1,2011-07-21 12:14:00,2.95,16891.0,United Kingdom
560833,20969,RED FLORAL FELTCRAFT SHOULDER BAG,1,2011-07-21 12:14:00,3.75,16891.0,United Kingdom
560833,23322,LARGE WHITE HEART OF WICKER,1,2011-07-21 12:14:00,2.95,16891.0,United Kingdom
560833,23128,FELTCRAFT BOY JEAN-PAUL KIT,1,2011-07-21 12:14:00,4.95,16891.0,United Kingdom
560833,21788,KIDS RAIN MAC BLUE,1,2011-07-21 12:14:00,0.85,16891.0,United Kingdom
560833,22111,SCOTTIE DOG HOT WATER BOTTLE,1,2011-07-21 12:14:00,4.95,16891.0,United Kingdom
560833,22084,PAPER CHAIN KIT EMPIRE,1,2011-07-21 12:14:00,2.95,16891.0,United Kingdom
560833,22927,GREEN GIANT GARDEN THERMOMETER,2,2011-07-21 12:14:00,5.95,16891.0,United Kingdom
560833,22720,SET OF 3 CAKE TINS PANTRY DESIGN ,1,2011-07-21 12:14:00,4.95,16891.0,United Kingdom
560833,22666,RECIPE BOX PANTRY YELLOW DESIGN,1,2011-07-21 12:14:00,2.95,16891.0,United Kingdom
560833,22795,SWEETHEART RECIPE BOOK STAND,1,2011-07-21 12:14:00,6.75,16891.0,United Kingdom
560833,23146,TRIPLE HOOK ANTIQUE IVORY ROSE,2,2011-07-21 12:14:00,3.29,16891.0,United Kingdom
560833,22851,SET 20 NAPKINS FAIRY CAKES DESIGN ,1,2011-07-21 12:14:00,0.85,16891.0,United Kingdom
560833,84969,BOX OF 6 ASSORTED COLOUR TEASPOONS,1,2011-07-21 12:14:00,4.25,16891.0,United Kingdom
560833,22364,GLASS JAR DIGESTIVE BISCUITS,1,2011-07-21 12:14:00,2.95,16891.0,United Kingdom
560833,22359,GLASS JAR KINGS CHOICE,1,2011-07-21 12:14:00,2.95,16891.0,United Kingdom
560833,22360,GLASS JAR ENGLISH CONFECTIONERY,1,2011-07-21 12:14:00,2.95,16891.0,United Kingdom
560833,23243,SET OF TEA COFFEE SUGAR TINS PANTRY,2,2011-07-21 12:14:00,4.95,16891.0,United Kingdom
560833,85036A,GARDENIA 1 WICK MORRIS BOXED CANDLE,1,2011-07-21 12:14:00,4.25,16891.0,United Kingdom
560833,20969,RED FLORAL FELTCRAFT SHOULDER BAG,1,2011-07-21 12:14:00,3.75,16891.0,United Kingdom
560833,23126,FELTCRAFT GIRL AMELIE KIT,1,2011-07-21 12:14:00,4.95,16891.0,United Kingdom
560833,22586,FELTCRAFT HAIRBAND PINK AND BLUE,2,2011-07-21 12:14:00,0.85,16891.0,United Kingdom
560833,20970,PINK FLORAL FELTCRAFT SHOULDER BAG,4,2011-07-21 12:14:00,3.75,16891.0,United Kingdom
560833,23302,KNEELING MAT HOUSEWORK  DESIGN,4,2011-07-21 12:14:00,1.65,16891.0,United Kingdom
560833,23301,GARDENERS KNEELING PAD KEEP CALM ,4,2011-07-21 12:14:00,1.65,16891.0,United Kingdom
560833,23243,SET OF TEA COFFEE SUGAR TINS PANTRY,2,2011-07-21 12:14:00,4.95,16891.0,United Kingdom
560833,21967,PACK OF 12 SKULL TISSUES,12,2011-07-21 12:14:00,0.29,16891.0,United Kingdom
560833,22993,SET OF 4 PANTRY JELLY MOULDS,2,2011-07-21 12:14:00,1.25,16891.0,United Kingdom
560833,22624,IVORY KITCHEN SCALES,1,2011-07-21 12:14:00,8.5,16891.0,United Kingdom
560833,22721,SET OF 3 CAKE TINS SKETCHBOOK,1,2011-07-21 12:14:00,4.95,16891.0,United Kingdom
560833,22720,SET OF 3 CAKE TINS PANTRY DESIGN ,3,2011-07-21 12:14:00,4.95,16891.0,United Kingdom
560834,22061,LARGE CAKE STAND  HANGING STRAWBERY,4,2011-07-21 12:15:00,9.95,16523.0,United Kingdom
560834,84755,COLOUR GLASS T-LIGHT HOLDER HANGING,16,2011-07-21 12:15:00,0.65,16523.0,United Kingdom
560834,23199,JUMBO BAG APPLES,20,2011-07-21 12:15:00,2.08,16523.0,United Kingdom
560834,22411,JUMBO SHOPPER VINTAGE RED PAISLEY,20,2011-07-21 12:15:00,2.08,16523.0,United Kingdom
560834,85099C,JUMBO  BAG BAROQUE BLACK WHITE,20,2011-07-21 12:15:00,2.08,16523.0,United Kingdom
560834,21928,JUMBO BAG SCANDINAVIAN BLUE PAISLEY,20,2011-07-21 12:15:00,2.08,16523.0,United Kingdom
560834,22386,JUMBO BAG PINK POLKADOT,20,2011-07-21 12:15:00,2.08,16523.0,United Kingdom
560834,85099B,JUMBO BAG RED RETROSPOT,30,2011-07-21 12:15:00,2.08,16523.0,United Kingdom
560834,23203,JUMBO BAG DOILEY PATTERNS,30,2011-07-21 12:15:00,2.08,16523.0,United Kingdom
560834,23202,JUMBO BAG VINTAGE LEAF,20,2011-07-21 12:15:00,2.08,16523.0,United Kingdom
560834,22847,BREAD BIN DINER STYLE IVORY,4,2011-07-21 12:15:00,14.95,16523.0,United Kingdom
560839,23284,DOORMAT KEEP CALM AND COME IN,3,2011-07-21 12:23:00,7.95,14527.0,United Kingdom
560839,23283,DOORMAT VINTAGE LEAF,3,2011-07-21 12:23:00,7.95,14527.0,United Kingdom
560839,48194,DOORMAT HEARTS,1,2011-07-21 12:23:00,7.95,14527.0,United Kingdom
560839,22414,DOORMAT NEIGHBOURHOOD WITCH ,1,2011-07-21 12:23:00,7.95,14527.0,United Kingdom
560839,22691,DOORMAT WELCOME SUNRISE,1,2011-07-21 12:23:00,7.95,14527.0,United Kingdom
560839,21524,DOORMAT SPOTTY HOME SWEET HOME,1,2011-07-21 12:23:00,7.95,14527.0,United Kingdom
560839,23202,JUMBO BAG VINTAGE LEAF,3,2011-07-21 12:23:00,2.08,14527.0,United Kingdom
560839,23199,JUMBO BAG APPLES,2,2011-07-21 12:23:00,2.08,14527.0,United Kingdom
560839,72760B,VINTAGE CREAM 3 BASKET CAKE STAND,1,2011-07-21 12:23:00,9.95,14527.0,United Kingdom
560839,84660B,BLACK STITCHED WALL CLOCK,3,2011-07-21 12:23:00,0.79,14527.0,United Kingdom
560839,84660C,PINK STITCHED WALL CLOCK,3,2011-07-21 12:23:00,0.79,14527.0,United Kingdom
560839,22848,BREAD BIN DINER STYLE PINK,1,2011-07-21 12:23:00,16.95,14527.0,United Kingdom
560841,23216,LAUREL HEART ANTIQUE GOLD,24,2011-07-21 12:25:00,1.06,14298.0,United Kingdom
560841,23219,LAUREL STAR ANTIQUE SILVER ,24,2011-07-21 12:25:00,1.04,14298.0,United Kingdom
560841,23212,HEART WREATH DECORATION WITH BELL,24,2011-07-21 12:25:00,1.04,14298.0,United Kingdom
560841,23217,LAUREL HEART ANTIQUE SILVER,24,2011-07-21 12:25:00,1.04,14298.0,United Kingdom
560841,23218,LAUREL STAR ANTIQUE GOLD,24,2011-07-21 12:25:00,1.04,14298.0,United Kingdom
560841,23225,CHERUB HEART DECORATION SILVER ,24,2011-07-21 12:25:00,0.72,14298.0,United Kingdom
560841,23224,CHERUB HEART DECORATION GOLD,24,2011-07-21 12:25:00,0.72,14298.0,United Kingdom
560841,23239,SET OF 4 KNICK KNACK TINS POPPIES,12,2011-07-21 12:25:00,3.75,14298.0,United Kingdom
560841,23263,SET OF 3 WOODEN HEART DECORATIONS,24,2011-07-21 12:25:00,1.04,14298.0,United Kingdom
560841,23270,SET OF 2 CERAMIC PAINTED HEARTS ,24,2011-07-21 12:25:00,1.25,14298.0,United Kingdom
560841,23273,HEART T-LIGHT HOLDER WILLIE WINKIE,24,2011-07-21 12:25:00,1.45,14298.0,United Kingdom
560841,23274,STAR T-LIGHT HOLDER WILLIE WINKIE,24,2011-07-21 12:25:00,1.45,14298.0,United Kingdom
560841,23295,SET OF 12 MINI LOAF BAKING CASES,24,2011-07-21 12:25:00,0.72,14298.0,United Kingdom
560841,23293,SET OF 12 FAIRY CAKE BAKING CASES,24,2011-07-21 12:25:00,0.72,14298.0,United Kingdom
560841,23307,SET OF 60 PANTRY DESIGN CAKE CASES ,24,2011-07-21 12:25:00,0.42,14298.0,United Kingdom
560841,23294,SET OF 6 SNACK LOAF BAKING CASES,24,2011-07-21 12:25:00,0.72,14298.0,United Kingdom
560841,23297,SET 40 HEART SHAPE PETIT FOUR CASES,16,2011-07-21 12:25:00,1.45,14298.0,United Kingdom
560841,23308,SET OF 60 VINTAGE LEAF CAKE CASES ,24,2011-07-21 12:25:00,0.42,14298.0,United Kingdom
560841,23316,RED REFECTORY CLOCK ,6,2011-07-21 12:25:00,8.15,14298.0,United Kingdom
560841,23317,BLUE REFECTORY CLOCK ,6,2011-07-21 12:25:00,8.15,14298.0,United Kingdom
560841,23322,LARGE WHITE HEART OF WICKER,12,2011-07-21 12:25:00,2.55,14298.0,United Kingdom
560841,23323,WHITE WICKER STAR ,12,2011-07-21 12:25:00,1.85,14298.0,United Kingdom
560841,23321,SMALL WHITE HEART OF WICKER,12,2011-07-21 12:25:00,1.45,14298.0,United Kingdom
560841,21314,SMALL GLASS HEART TRINKET POT,8,2011-07-21 12:25:00,1.85,14298.0,United Kingdom
560841,22469,HEART OF WICKER SMALL,36,2011-07-21 12:25:00,1.45,14298.0,United Kingdom
560841,22423,REGENCY CAKESTAND 3 TIER,16,2011-07-21 12:25:00,10.95,14298.0,United Kingdom
560841,22197,POPCORN HOLDER,36,2011-07-21 12:25:00,0.72,14298.0,United Kingdom
560841,85123A,WHITE HANGING HEART T-LIGHT HOLDER,24,2011-07-21 12:25:00,2.55,14298.0,United Kingdom
560841,23089,GLASS BON BON JAR,12,2011-07-21 12:25:00,1.45,14298.0,United Kingdom
560841,22224,WHITE LOVEBIRD LANTERN,6,2011-07-21 12:25:00,2.55,14298.0,United Kingdom
560841,21733,RED HANGING HEART T-LIGHT HOLDER,24,2011-07-21 12:25:00,2.55,14298.0,United Kingdom
560841,22804,CANDLEHOLDER PINK HANGING HEART,12,2011-07-21 12:25:00,2.55,14298.0,United Kingdom
560841,21730,GLASS STAR FROSTED T-LIGHT HOLDER,12,2011-07-21 12:25:00,4.25,14298.0,United Kingdom
560841,71477,COLOUR GLASS. STAR T-LIGHT HOLDER,12,2011-07-21 12:25:00,2.75,14298.0,United Kingdom
560841,22252,BIRDCAGE DECORATION TEALIGHT HOLDER,12,2011-07-21 12:25:00,1.06,14298.0,United Kingdom
560841,23039,T-LIGHT HOLDER SILVER HEART HANDLE,12,2011-07-21 12:25:00,1.65,14298.0,United Kingdom
560841,23088,ZINC HEART FLOWER T-LIGHT HOLDER,16,2011-07-21 12:25:00,1.04,14298.0,United Kingdom
560841,23090,VINTAGE GLASS T-LIGHT HOLDER,12,2011-07-21 12:25:00,0.72,14298.0,United Kingdom
560841,23087,ZINC  HEART T-LIGHT HOLDER,16,2011-07-21 12:25:00,1.04,14298.0,United Kingdom
560841,23037,CANDLE HOLDER SILVER MADELINE,24,2011-07-21 12:25:00,1.45,14298.0,United Kingdom
560841,22792,FLUTED ANTIQUE CANDLE HOLDER,12,2011-07-21 12:25:00,0.72,14298.0,United Kingdom
560841,85053,FRENCH ENAMEL CANDLEHOLDER,6,2011-07-21 12:25:00,1.69,14298.0,United Kingdom
560841,22457,NATURAL SLATE HEART CHALKBOARD ,6,2011-07-21 12:25:00,2.55,14298.0,United Kingdom
560841,23153,ZINC SWEETHEART WIRE LETTER RACK,4,2011-07-21 12:25:00,3.39,14298.0,United Kingdom
560841,21671,RED SPOT CERAMIC DRAWER KNOB,12,2011-07-21 12:25:00,1.06,14298.0,United Kingdom
560841,22771,CLEAR DRAWER KNOB ACRYLIC EDWARDIAN,12,2011-07-21 12:25:00,1.04,14298.0,United Kingdom
560841,21668,RED STRIPE CERAMIC DRAWER KNOB,12,2011-07-21 12:25:00,1.06,14298.0,United Kingdom
560841,21669,BLUE STRIPE CERAMIC DRAWER KNOB,12,2011-07-21 12:25:00,1.06,14298.0,United Kingdom
560841,22772,PINK DRAWER KNOB ACRYLIC EDWARDIAN,12,2011-07-21 12:25:00,1.06,14298.0,United Kingdom
