InvoiceNo,StockCode,Description,Quantity,InvoiceDate,UnitPrice,CustomerID,Country
566734,21915,RED  HARMONICA IN BOX ,2,2011-09-14 14:09:00,1.25,16910.0,United Kingdom
566734,21914,BLUE HARMONICA IN BOX ,2,2011-09-14 14:09:00,1.25,16910.0,United Kingdom
566734,23188,VINTAGE  2 METER FOLDING RULER,1,2011-09-14 14:09:00,1.65,16910.0,United Kingdom
566734,22077,6 RIBBONS RUSTIC CHARM,2,2011-09-14 14:09:00,1.95,16910.0,United Kingdom
566734,20974,12 PENCILS SMALL TUBE SKULL,2,2011-09-14 14:09:00,0.65,16910.0,United Kingdom
566734,20984,12 PENCILS TALL TUBE POSY,1,2011-09-14 14:09:00,0.29,16910.0,United Kingdom
566734,20983,12 PENCILS TALL TUBE RED RETROSPOT,1,2011-09-14 14:09:00,0.85,16910.0,United Kingdom
566734,20982,12 PENCILS TALL TUBE SKULLS,1,2011-09-14 14:09:00,0.85,16910.0,United Kingdom
566734,20978,36 PENCILS TUBE SKULLS,1,2011-09-14 14:09:00,1.25,16910.0,United Kingdom
566734,20979,36 PENCILS TUBE RED RETROSPOT,1,2011-09-14 14:09:00,1.25,16910.0,United Kingdom
566734,20977,36 PENCILS TUBE WOODLAND,1,2011-09-14 14:09:00,1.25,16910.0,United Kingdom
566734,20981,12 PENCILS TALL TUBE WOODLAND,2,2011-09-14 14:09:00,0.85,16910.0,United Kingdom
566734,21034,REX CASH+CARRY JUMBO SHOPPER,1,2011-09-14 14:09:00,0.95,16910.0,United Kingdom
566734,22466,FAIRY TALE COTTAGE NIGHT LIGHT,1,2011-09-14 14:09:00,1.95,16910.0,United Kingdom
566734,21704,BAG 250g SWIRLY MARBLES,1,2011-09-14 14:09:00,0.85,16910.0,United Kingdom
566734,22068,BLACK PIRATE TREASURE CHEST,1,2011-09-14 14:09:00,1.65,16910.0,United Kingdom
566734,23321,SMALL WHITE HEART OF WICKER,1,2011-09-14 14:09:00,1.65,16910.0,United Kingdom
566734,23322,LARGE WHITE HEART OF WICKER,1,2011-09-14 14:09:00,2.95,16910.0,United Kingdom
566734,21967,PACK OF 12 SKULL TISSUES,12,2011-09-14 14:09:00,0.39,16910.0,United Kingdom
566734,22551,PLASTERS IN TIN SPACEBOY,2,2011-09-14 14:09:00,1.65,16910.0,United Kingdom
566734,22555,PLASTERS IN TIN STRONGMAN,2,2011-09-14 14:09:00,1.65,16910.0,United Kingdom
566734,22556,PLASTERS IN TIN CIRCUS PARADE ,1,2011-09-14 14:09:00,1.65,16910.0,United Kingdom
566734,22553,PLASTERS IN TIN SKULLS,3,2011-09-14 14:09:00,1.65,16910.0,United Kingdom
566734,22554,PLASTERS IN TIN WOODLAND ANIMALS,2,2011-09-14 14:09:00,1.65,16910.0,United Kingdom
566734,21212,PACK OF 72 RETROSPOT CAKE CASES,1,2011-09-14 14:09:00,0.55,16910.0,United Kingdom
566734,21213,PACK OF 72 SKULL CAKE CASES,1,2011-09-14 14:09:00,0.55,16910.0,United Kingdom
566734,22417,PACK OF 60 SPACEBOY CAKE CASES,1,2011-09-14 14:09:00,0.55,16910.0,United Kingdom
566734,21975,PACK OF 60 DINOSAUR CAKE CASES,2,2011-09-14 14:09:00,0.55,16910.0,United Kingdom
566734,21976,PACK OF 60 MUSHROOM CAKE CASES,2,2011-09-14 14:09:00,0.55,16910.0,United Kingdom
566734,22952,60 CAKE CASES VINTAGE CHRISTMAS,1,2011-09-14 14:09:00,0.55,16910.0,United Kingdom
566734,23146,TRIPLE HOOK ANTIQUE IVORY ROSE,1,2011-09-14 14:09:00,3.29,16910.0,United Kingdom
566734,22094,RED RETROSPOT TISSUE BOX,1,2011-09-14 14:09:00,0.39,16910.0,United Kingdom
566734,22620,4 TRADITIONAL SPINNING TOPS,1,2011-09-14 14:09:00,1.45,16910.0,United Kingdom
566734,22867,HAND WARMER BIRD DESIGN,1,2011-09-14 14:09:00,2.1,16910.0,United Kingdom
566734,22865,HAND WARMER OWL DESIGN,1,2011-09-14 14:09:00,2.1,16910.0,United Kingdom
566734,23168,CLASSIC CAFE SUGAR DISPENSER,3,2011-09-14 14:09:00,1.25,16910.0,United Kingdom
566734,22961,JAM MAKING SET PRINTED,1,2011-09-14 14:09:00,1.45,16910.0,United Kingdom
566734,22567,20 DOLLY PEGS RETROSPOT,1,2011-09-14 14:09:00,1.45,16910.0,United Kingdom
566734,23424,GINGHAM RECIPE BOOK BOX,1,2011-09-14 14:09:00,4.95,16910.0,United Kingdom
566734,21155,RED RETROSPOT PEG BAG,1,2011-09-14 14:09:00,2.55,16910.0,United Kingdom
566734,22654,DELUXE SEWING KIT ,1,2011-09-14 14:09:00,5.95,16910.0,United Kingdom
566734,22617,BAKING SET SPACEBOY DESIGN,1,2011-09-14 14:09:00,4.95,16910.0,United Kingdom
566734,23081,GREEN METAL BOX ARMY SUPPLIES,1,2011-09-14 14:09:00,8.25,16910.0,United Kingdom
566734,22667,RECIPE BOX RETROSPOT ,1,2011-09-14 14:09:00,2.95,16910.0,United Kingdom
566734,21930,JUMBO STORAGE BAG SKULLS,1,2011-09-14 14:09:00,2.08,16910.0,United Kingdom
566734,21935,SUKI  SHOULDER BAG,1,2011-09-14 14:09:00,1.65,16910.0,United Kingdom
566734,21581,SKULLS  DESIGN  COTTON TOTE BAG,1,2011-09-14 14:09:00,2.25,16910.0,United Kingdom
566734,22895,SET OF 2 TEA TOWELS APPLE AND PEARS,1,2011-09-14 14:09:00,3.25,16910.0,United Kingdom
566734,23389,SPACEBOY MINI BACKPACK,1,2011-09-14 14:09:00,4.15,16910.0,United Kingdom
566734,22111,SCOTTIE DOG HOT WATER BOTTLE,1,2011-09-14 14:09:00,4.95,16910.0,United Kingdom
566734,23388,WOODLAND MINI BACKPACK,1,2011-09-14 14:09:00,4.15,16910.0,United Kingdom
566734,22960,JAM MAKING SET WITH JARS,1,2011-09-14 14:09:00,4.25,16910.0,United Kingdom
566734,20914,SET/5 RED RETROSPOT LID GLASS BOWLS,1,2011-09-14 14:09:00,2.95,16910.0,United Kingdom
566734,22991,GIRAFFE WOODEN RULER,1,2011-09-14 14:09:00,1.95,16910.0,United Kingdom
566734,22992,REVOLVER WOODEN RULER ,1,2011-09-14 14:09:00,1.95,16910.0,United Kingdom
566734,23196,VINTAGE LEAF MAGNETIC NOTEPAD,1,2011-09-14 14:09:00,1.45,16910.0,United Kingdom
566734,23197,SKETCHBOOK MAGNETIC SHOPPING LIST,1,2011-09-14 14:09:00,1.45,16910.0,United Kingdom
566734,20971,PINK BLUE FELT CRAFT TRINKET BOX,1,2011-09-14 14:09:00,1.25,16910.0,United Kingdom
566734,23080,RED METAL BOX TOP SECRET,1,2011-09-14 14:09:00,8.25,16910.0,United Kingdom
566734,22428,ENAMEL FIRE BUCKET CREAM,1,2011-09-14 14:09:00,6.95,16910.0,United Kingdom
566734,22427,ENAMEL FLOWER JUG CREAM,1,2011-09-14 14:09:00,5.95,16910.0,United Kingdom
566735,82484,WOOD BLACK BOARD ANT WHITE FINISH,1,2011-09-14 14:19:00,7.95,15707.0,United Kingdom
566735,22374,AIRLINE BAG VINTAGE JET SET RED,1,2011-09-14 14:19:00,4.25,15707.0,United Kingdom
566735,22220,CAKE STAND LOVEBIRD 2 TIER WHITE,1,2011-09-14 14:19:00,9.95,15707.0,United Kingdom
566735,20914,SET/5 RED RETROSPOT LID GLASS BOWLS,2,2011-09-14 14:19:00,2.95,15707.0,United Kingdom
566735,21533,RETROSPOT LARGE MILK JUG,1,2011-09-14 14:19:00,4.95,15707.0,United Kingdom
566735,21877,HOME SWEET HOME MUG,2,2011-09-14 14:19:00,1.65,15707.0,United Kingdom
566735,21875,KINGS CHOICE MUG,2,2011-09-14 14:19:00,1.25,15707.0,United Kingdom
566735,37413,ICON MUG REVOLUTIONARY,2,2011-09-14 14:19:00,0.39,15707.0,United Kingdom
566735,21535,RED RETROSPOT SMALL MILK JUG,2,2011-09-14 14:19:00,2.55,15707.0,United Kingdom
566735,23242,TREASURE TIN BUFFALO BILL ,2,2011-09-14 14:19:00,2.08,15707.0,United Kingdom
566735,22358,KINGS CHOICE TEA CADDY ,1,2011-09-14 14:19:00,2.95,15707.0,United Kingdom
566735,22358,KINGS CHOICE TEA CADDY ,1,2011-09-14 14:19:00,2.95,15707.0,United Kingdom
566735,21212,PACK OF 72 RETROSPOT CAKE CASES,4,2011-09-14 14:19:00,0.55,15707.0,United Kingdom
566735,21977,PACK OF 60 PINK PAISLEY CAKE CASES,4,2011-09-14 14:19:00,0.55,15707.0,United Kingdom
566735,21213,PACK OF 72 SKULL CAKE CASES,2,2011-09-14 14:19:00,0.55,15707.0,United Kingdom
566735,23309,SET OF 60 I LOVE LONDON CAKE CASES ,4,2011-09-14 14:19:00,0.55,15707.0,United Kingdom
566735,22348,TEA BAG PLATE RED RETROSPOT,4,2011-09-14 14:19:00,0.85,15707.0,United Kingdom
566735,23165,LARGE CERAMIC TOP STORAGE JAR,3,2011-09-14 14:19:00,1.65,15707.0,United Kingdom
566735,21137,BLACK RECORD COVER FRAME,3,2011-09-14 14:19:00,3.75,15707.0,United Kingdom
566735,22739,RIBBON REEL CHRISTMAS SOCK BAUBLE,1,2011-09-14 14:19:00,1.65,15707.0,United Kingdom
566735,22736,RIBBON REEL MAKING SNOWMEN ,1,2011-09-14 14:19:00,1.65,15707.0,United Kingdom
566735,22738,RIBBON REEL SNOWY VILLAGE,2,2011-09-14 14:19:00,1.65,15707.0,United Kingdom
566735,21533,RETROSPOT LARGE MILK JUG,1,2011-09-14 14:19:00,4.95,15707.0,United Kingdom
566735,22734,SET OF 6 RIBBONS VINTAGE CHRISTMAS,3,2011-09-14 14:19:00,2.89,15707.0,United Kingdom
566735,21915,RED  HARMONICA IN BOX ,2,2011-09-14 14:19:00,1.25,15707.0,United Kingdom
566735,21914,BLUE HARMONICA IN BOX ,2,2011-09-14 14:19:00,1.25,15707.0,United Kingdom
566735,16162M,THE KING GIFT BAG 25x24x12cm,3,2011-09-14 14:19:00,0.42,15707.0,United Kingdom
566735,21164,HOME SWEET HOME METAL SIGN ,1,2011-09-14 14:19:00,2.95,15707.0,United Kingdom
566735,85152,HAND OVER THE CHOCOLATE   SIGN ,1,2011-09-14 14:19:00,2.1,15707.0,United Kingdom
566735,22635,CHILDS BREAKFAST SET DOLLY GIRL ,1,2011-09-14 14:19:00,9.95,15707.0,United Kingdom
566735,22138,BAKING SET 9 PIECE RETROSPOT ,1,2011-09-14 14:19:00,4.95,15707.0,United Kingdom
566735,22728,ALARM CLOCK BAKELIKE PINK,1,2011-09-14 14:19:00,3.75,15707.0,United Kingdom
566735,22727,ALARM CLOCK BAKELIKE RED ,1,2011-09-14 14:19:00,3.75,15707.0,United Kingdom
566735,22555,PLASTERS IN TIN STRONGMAN,1,2011-09-14 14:19:00,1.65,15707.0,United Kingdom
566735,22553,PLASTERS IN TIN SKULLS,1,2011-09-14 14:19:00,1.65,15707.0,United Kingdom
566735,22554,PLASTERS IN TIN WOODLAND ANIMALS,2,2011-09-14 14:19:00,1.65,15707.0,United Kingdom
566735,22557,PLASTERS IN TIN VINTAGE PAISLEY ,2,2011-09-14 14:19:00,1.65,15707.0,United Kingdom
566735,22659,LUNCH BOX I LOVE LONDON,1,2011-09-14 14:19:00,1.95,15707.0,United Kingdom
566735,22629,SPACEBOY LUNCH BOX ,1,2011-09-14 14:19:00,1.95,15707.0,United Kingdom
566735,22630,DOLLY GIRL LUNCH BOX,1,2011-09-14 14:19:00,1.95,15707.0,United Kingdom
566735,22098,BOUDOIR SQUARE TISSUE BOX,4,2011-09-14 14:19:00,0.39,15707.0,United Kingdom
566735,22624,IVORY KITCHEN SCALES,1,2011-09-14 14:19:00,8.5,15707.0,United Kingdom
566735,23168,CLASSIC CAFE SUGAR DISPENSER,4,2011-09-14 14:19:00,1.25,15707.0,United Kingdom
566736,22704,WRAP RED APPLES ,25,2011-09-14 14:19:00,0.42,12726.0,France
566736,21498,RED RETROSPOT WRAP ,25,2011-09-14 14:19:00,0.42,12726.0,France
566736,22964,3 PIECE SPACEBOY COOKIE CUTTER SET,6,2011-09-14 14:19:00,2.1,12726.0,France
566736,21883,STARS GIFT TAPE ,12,2011-09-14 14:19:00,0.65,12726.0,France
566736,22082,RIBBON REEL STRIPES DESIGN ,10,2011-09-14 14:19:00,1.65,12726.0,France
566736,22080,RIBBON REEL POLKADOTS ,10,2011-09-14 14:19:00,1.65,12726.0,France
566736,22529,MAGIC DRAWING SLATE GO TO THE FAIR ,24,2011-09-14 14:19:00,0.42,12726.0,France
566736,22535,MAGIC DRAWING SLATE BUNNIES ,24,2011-09-14 14:19:00,0.42,12726.0,France
566736,21988,PACK OF 6 SKULL PAPER PLATES,24,2011-09-14 14:19:00,0.85,12726.0,France
566736,21094,SET/6 RED SPOTTY PAPER PLATES,24,2011-09-14 14:19:00,0.85,12726.0,France
566736,22437,SET OF 9 BLACK SKULL BALLOONS,20,2011-09-14 14:19:00,0.85,12726.0,France
566736,85175,CACTI T-LIGHT CANDLES,16,2011-09-14 14:19:00,0.42,12726.0,France
566736,21080,SET/20 RED RETROSPOT PAPER NAPKINS ,24,2011-09-14 14:19:00,0.85,12726.0,France
566736,21679,SKULLS  STICKERS,24,2011-09-14 14:19:00,0.85,12726.0,France
566736,21987,PACK OF 6 SKULL PAPER CUPS,24,2011-09-14 14:19:00,0.65,12726.0,France
566736,21086,SET/6 RED SPOTTY PAPER CUPS,24,2011-09-14 14:19:00,0.65,12726.0,France
566736,21207,SKULL AND CROSSBONES  GARLAND ,24,2011-09-14 14:19:00,1.65,12726.0,France
566736,22908,PACK OF 20 NAPKINS RED APPLES,24,2011-09-14 14:19:00,0.85,12726.0,France
566736,22531,MAGIC DRAWING SLATE CIRCUS PARADE  ,48,2011-09-14 14:19:00,0.42,12726.0,France
566736,22544,MINI JIGSAW SPACEBOY,24,2011-09-14 14:19:00,0.42,12726.0,France
566736,POST,POSTAGE,2,2011-09-14 14:19:00,18.0,12726.0,France
566737,20996,JAZZ HEARTS ADDRESS BOOK,24,2011-09-14 14:26:00,0.19,13430.0,United Kingdom
566737,21992,VINTAGE PAISLEY STATIONERY SET,12,2011-09-14 14:26:00,1.25,13430.0,United Kingdom
566737,22209,WOOD STAMP SET HAPPY BIRTHDAY,12,2011-09-14 14:26:00,0.83,13430.0,United Kingdom
566737,22610,PENS ASSORTED FUNNY FACE,36,2011-09-14 14:26:00,0.19,13430.0,United Kingdom
566737,84665,SQUARE CHERRY BLOSSOM CABINET,4,2011-09-14 14:26:00,5.95,13430.0,United Kingdom
566737,85032B,BLOSSOM IMAGES GIFT WRAP SET,12,2011-09-14 14:26:00,0.65,13430.0,United Kingdom
566737,85071C,"CHARLIE+LOLA""EXTREMELY BUSY"" SIGN",24,2011-09-14 14:26:00,0.39,13430.0,United Kingdom
566737,22716,CARD CIRCUS PARADE,12,2011-09-14 14:26:00,0.42,13430.0,United Kingdom
566737,22028,PENNY FARTHING BIRTHDAY CARD,12,2011-09-14 14:26:00,0.42,13430.0,United Kingdom
566737,22029,SPACEBOY BIRTHDAY CARD,12,2011-09-14 14:26:00,0.42,13430.0,United Kingdom
566737,22712,CARD DOLLY GIRL ,12,2011-09-14 14:26:00,0.42,13430.0,United Kingdom
566737,22983,CARD BILLBOARD FONT,12,2011-09-14 14:26:00,0.42,13430.0,United Kingdom
566737,84251G,"GREETING CARD, OVERCROWDED POOL.",12,2011-09-14 14:26:00,0.19,13430.0,United Kingdom
566737,20982,12 PENCILS TALL TUBE SKULLS,12,2011-09-14 14:26:00,0.85,13430.0,United Kingdom
566737,23191,BUNDLE OF 3 RETRO NOTE BOOKS,12,2011-09-14 14:26:00,1.65,13430.0,United Kingdom
566737,23192,BUNDLE OF 3 ALPHABET EXERCISE BOOKS,12,2011-09-14 14:26:00,1.65,13430.0,United Kingdom
566737,22652,TRAVEL SEWING KIT,10,2011-09-14 14:26:00,1.65,13430.0,United Kingdom
566737,22621,TRADITIONAL KNITTING NANCY,12,2011-09-14 14:26:00,1.65,13430.0,United Kingdom
566737,22557,PLASTERS IN TIN VINTAGE PAISLEY ,12,2011-09-14 14:26:00,1.65,13430.0,United Kingdom
566737,23240,SET OF 4 KNICK KNACK TINS DOILY ,6,2011-09-14 14:26:00,4.15,13430.0,United Kingdom
566737,16218,CARTOON  PENCIL SHARPENERS,80,2011-09-14 14:26:00,0.06,13430.0,United Kingdom
566737,22277,COSMETIC BAG VINTAGE ROSE PAISLEY,6,2011-09-14 14:26:00,2.1,13430.0,United Kingdom
566737,23408,PHOTO FRAME LINEN AND LACE SMALL,6,2011-09-14 14:26:00,2.08,13430.0,United Kingdom
566737,21108,FAIRY CAKE FLANNEL ASSORTED COLOUR,9,2011-09-14 14:26:00,2.55,13430.0,United Kingdom
566737,22717,CARD DOG AND BALL ,12,2011-09-14 14:26:00,0.42,13430.0,United Kingdom
566737,22718,CARD CAT AND TREE ,12,2011-09-14 14:26:00,0.42,13430.0,United Kingdom
566737,22595,GINGHAM HEART DECORATION,12,2011-09-14 14:26:00,0.85,13430.0,United Kingdom
566737,22961,JAM MAKING SET PRINTED,12,2011-09-14 14:26:00,1.45,13430.0,United Kingdom
566737,20981,12 PENCILS TALL TUBE WOODLAND,12,2011-09-14 14:26:00,0.85,13430.0,United Kingdom
566738,21137,BLACK RECORD COVER FRAME,96,2011-09-14 14:28:00,3.39,14110.0,United Kingdom
566738,22090,PAPER BUNTING RETROSPOT,6,2011-09-14 14:28:00,2.95,14110.0,United Kingdom
566738,47566,PARTY BUNTING,8,2011-09-14 14:28:00,4.95,14110.0,United Kingdom
566739,21231,SWEETHEART CERAMIC TRINKET BOX,12,2011-09-14 14:30:00,1.25,12566.0,Germany
566739,22064,PINK DOUGHNUT TRINKET POT ,12,2011-09-14 14:30:00,1.65,12566.0,Germany
566739,21232,STRAWBERRY CERAMIC TRINKET BOX,12,2011-09-14 14:30:00,1.25,12566.0,Germany
566739,22066,LOVE HEART TRINKET POT,48,2011-09-14 14:30:00,0.39,12566.0,Germany
566739,21154,RED RETROSPOT OVEN GLOVE ,10,2011-09-14 14:30:00,1.25,12566.0,Germany
566739,22138,BAKING SET 9 PIECE RETROSPOT ,3,2011-09-14 14:30:00,4.95,12566.0,Germany
566739,22628,PICNIC BOXES SET OF 3 RETROSPOT ,4,2011-09-14 14:30:00,4.95,12566.0,Germany
566739,22634,CHILDS BREAKFAST SET SPACEBOY ,2,2011-09-14 14:30:00,9.95,12566.0,Germany
566739,22635,CHILDS BREAKFAST SET DOLLY GIRL ,2,2011-09-14 14:30:00,9.95,12566.0,Germany
566739,22922,FRIDGE MAGNETS US DINER ASSORTED,24,2011-09-14 14:30:00,0.85,12566.0,Germany
566739,22915,ASSORTED BOTTLE TOP  MAGNETS ,24,2011-09-14 14:30:00,0.42,12566.0,Germany
566739,16156S,WRAP PINK FAIRY CAKES ,25,2011-09-14 14:30:00,0.42,12566.0,Germany
566739,23076,ICE CREAM SUNDAE LIP GLOSS,24,2011-09-14 14:30:00,1.25,12566.0,Germany
566739,23256,CHILDRENS CUTLERY SPACEBOY ,4,2011-09-14 14:30:00,4.15,12566.0,Germany
566739,23254,CHILDRENS CUTLERY DOLLY GIRL ,4,2011-09-14 14:30:00,4.15,12566.0,Germany
566739,16169E,WRAP 50'S  CHRISTMAS,25,2011-09-14 14:30:00,0.42,12566.0,Germany
566739,22045,SPACEBOY GIFT WRAP,25,2011-09-14 14:30:00,0.42,12566.0,Germany
566739,22624,IVORY KITCHEN SCALES,2,2011-09-14 14:30:00,8.5,12566.0,Germany
566739,POST,POSTAGE,3,2011-09-14 14:30:00,18.0,12566.0,Germany
566740,16219,HOUSE SHAPE PENCIL SHARPENER,96,2011-09-14 14:34:00,0.06,17033.0,United Kingdom
566740,16011,ANIMAL STICKERS,24,2011-09-14 14:34:00,0.21,17033.0,United Kingdom
566740,85184C,SET 4 VALENTINE DECOUPAGE HEART BOX,6,2011-09-14 14:34:00,2.95,17033.0,United Kingdom
566740,22812,PACK 3 BOXES CHRISTMAS PANNETONE,12,2011-09-14 14:34:00,1.95,17033.0,United Kingdom
566740,16237,SLEEPING CAT ERASERS,30,2011-09-14 14:34:00,0.21,17033.0,United Kingdom
566740,21394,RED POLKADOT BEAKER ,48,2011-09-14 14:34:00,0.39,17033.0,United Kingdom
566740,84596B,SMALL DOLLY MIX DESIGN ORANGE BOWL,16,2011-09-14 14:34:00,0.42,17033.0,United Kingdom
566740,84596F,SMALL MARSHMALLOWS PINK BOWL,16,2011-09-14 14:34:00,0.42,17033.0,United Kingdom
566740,22972,CHILDREN'S SPACEBOY MUG,12,2011-09-14 14:34:00,1.65,17033.0,United Kingdom
566740,22974,CHILDRENS DOLLY GIRL MUG,12,2011-09-14 14:34:00,1.65,17033.0,United Kingdom
566740,23121,PACK OF 6 COCKTAIL PARASOL STRAWS,24,2011-09-14 14:34:00,0.42,17033.0,United Kingdom
566740,22128,PARTY CONES CANDY ASSORTED,240,2011-09-14 14:34:00,1.06,17033.0,United Kingdom
566740,22130,PARTY CONE CHRISTMAS DECORATION ,12,2011-09-14 14:34:00,0.85,17033.0,United Kingdom
566740,22065,CHRISTMAS PUDDING TRINKET POT ,12,2011-09-14 14:34:00,1.45,17033.0,United Kingdom
C566741,23431,NATURAL HANGING QUILTED HEARTS ,-12,2011-09-14 14:55:00,0.83,15618.0,United Kingdom
C566741,23433,HANGING QUILTED PATCHWORK APPLES,-12,2011-09-14 14:55:00,0.83,15618.0,United Kingdom
C566741,23405,HOME SWEET HOME 2 DRAWER CABINET,-1,2011-09-14 14:55:00,4.95,15618.0,United Kingdom
C566741,23404,HOME SWEET HOME BLACKBOARD,-1,2011-09-14 14:55:00,4.95,15618.0,United Kingdom
C566742,35648,VINTAGE BEAD PINK PURSE ,-1,2011-09-14 14:56:00,0.83,17422.0,United Kingdom
C566742,22914,BLUE COAT RACK PARIS FASHION,-1,2011-09-14 14:56:00,4.95,17422.0,United Kingdom
C566742,22913,RED COAT RACK PARIS FASHION,-1,2011-09-14 14:56:00,4.95,17422.0,United Kingdom
C566742,22912,YELLOW COAT RACK PARIS FASHION,-2,2011-09-14 14:56:00,4.95,17422.0,United Kingdom
C566742,22147,FELTCRAFT BUTTERFLY HEARTS,-1,2011-09-14 14:56:00,1.45,17422.0,United Kingdom
C566743,22606,WOODEN SKITTLES GARDEN SET,-1,2011-09-14 14:58:00,15.95,14299.0,United Kingdom
566744,21317,GLASS SPHERE CANDLE STAND MEDIUM,20,2011-09-14 15:11:00,5.45,14177.0,United Kingdom
566744,21012,ANTIQUE ALL GLASS CANDLESTICK,20,2011-09-14 15:11:00,2.1,14177.0,United Kingdom
566744,85127,SMALL SQUARE CUT GLASS CANDLESTICK,20,2011-09-14 15:11:00,4.95,14177.0,United Kingdom
C566745,23424,GINGHAM RECIPE BOOK BOX,-1,2011-09-14 15:15:00,4.95,16150.0,United Kingdom
C566745,23245,SET OF 3 REGENCY CAKE TINS,-1,2011-09-14 15:15:00,4.95,16150.0,United Kingdom
C566745,22720,SET OF 3 CAKE TINS PANTRY DESIGN ,-1,2011-09-14 15:15:00,4.95,16150.0,United Kingdom
C566745,22065,CHRISTMAS PUDDING TRINKET POT ,-3,2011-09-14 15:15:00,1.45,16150.0,United Kingdom
C566745,21314,SMALL GLASS HEART TRINKET POT,-2,2011-09-14 15:15:00,2.1,16150.0,United Kingdom
566746,21136,PAINTED METAL PEARS ASSORTED,16,2011-09-14 15:18:00,1.69,13321.0,United Kingdom
566746,23060,HEART BEADED TRELLIS DECORATION,12,2011-09-14 15:18:00,2.08,13321.0,United Kingdom
566746,22599,CHRISTMAS MUSICAL ZINC STAR,24,2011-09-14 15:18:00,0.85,13321.0,United Kingdom
566746,22598,CHRISTMAS MUSICAL ZINC TREE,24,2011-09-14 15:18:00,0.85,13321.0,United Kingdom
566746,22597,MUSICAL ZINC HEART DECORATION ,24,2011-09-14 15:18:00,0.85,13321.0,United Kingdom
566746,84879,ASSORTED COLOUR BIRD ORNAMENT,16,2011-09-14 15:18:00,1.69,13321.0,United Kingdom
566746,82482,WOODEN PICTURE FRAME WHITE FINISH,6,2011-09-14 15:18:00,2.95,13321.0,United Kingdom
566746,82494L,WOODEN FRAME ANTIQUE WHITE ,6,2011-09-14 15:18:00,2.95,13321.0,United Kingdom
566746,85048,15CM CHRISTMAS GLASS BALL 20 LIGHTS,12,2011-09-14 15:18:00,6.95,13321.0,United Kingdom
566747,22771,CLEAR DRAWER KNOB ACRYLIC EDWARDIAN,12,2011-09-14 15:33:00,1.25,16928.0,United Kingdom
566747,22774,RED DRAWER KNOB ACRYLIC EDWARDIAN,12,2011-09-14 15:33:00,1.25,16928.0,United Kingdom
566747,22775,PURPLE DRAWERKNOB ACRYLIC EDWARDIAN,36,2011-09-14 15:33:00,1.25,16928.0,United Kingdom
566747,22773,GREEN DRAWER KNOB ACRYLIC EDWARDIAN,10,2011-09-14 15:33:00,1.25,16928.0,United Kingdom
566747,21673,WHITE SPOT BLUE CERAMIC DRAWER KNOB,18,2011-09-14 15:33:00,1.45,16928.0,United Kingdom
566747,21671,RED SPOT CERAMIC DRAWER KNOB,12,2011-09-14 15:33:00,1.45,16928.0,United Kingdom
566747,21670,BLUE SPOT CERAMIC DRAWER KNOB,12,2011-09-14 15:33:00,1.45,16928.0,United Kingdom
566747,21672,WHITE SPOT RED CERAMIC DRAWER KNOB,12,2011-09-14 15:33:00,1.45,16928.0,United Kingdom
566747,23033,DRAWER KNOB CERAMIC RED,6,2011-09-14 15:33:00,1.45,16928.0,United Kingdom
566747,21669,BLUE STRIPE CERAMIC DRAWER KNOB,6,2011-09-14 15:33:00,1.45,16928.0,United Kingdom
566747,85175,CACTI T-LIGHT CANDLES,16,2011-09-14 15:33:00,0.42,16928.0,United Kingdom
566747,21668,RED STRIPE CERAMIC DRAWER KNOB,6,2011-09-14 15:33:00,1.45,16928.0,United Kingdom
566747,23034,DRAWER KNOB CERAMIC BLACK,11,2011-09-14 15:33:00,1.45,16928.0,United Kingdom
566747,23028,DRAWER KNOB CRACKLE GLAZE BLUE,4,2011-09-14 15:33:00,1.65,16928.0,United Kingdom
C566748,22838,3 TIER CAKE TIN RED AND CREAM,-2,2011-09-14 15:37:00,14.95,12822.0,United Kingdom
C566749,85053,FRENCH ENAMEL CANDLEHOLDER,-4,2011-09-14 15:38:00,2.1,13999.0,United Kingdom
C566749,22426,ENAMEL WASH BOWL CREAM,-3,2011-09-14 15:38:00,3.75,13999.0,United Kingdom
566750,23317,BLUE REFECTORY CLOCK ,2,2011-09-14 15:41:00,9.95,15380.0,United Kingdom
566750,22730,ALARM CLOCK BAKELIKE IVORY,4,2011-09-14 15:41:00,3.75,15380.0,United Kingdom
566750,22193,RED DINER WALL CLOCK,12,2011-09-14 15:41:00,7.65,15380.0,United Kingdom
566750,22191,IVORY DINER WALL CLOCK,12,2011-09-14 15:41:00,7.65,15380.0,United Kingdom
566750,23342,MINT DINER WALL CLOCK,12,2011-09-14 15:41:00,7.65,15380.0,United Kingdom
566750,23341,PINK DINER WALL CLOCK,12,2011-09-14 15:41:00,7.65,15380.0,United Kingdom
566750,23316,RED REFECTORY CLOCK ,2,2011-09-14 15:41:00,9.95,15380.0,United Kingdom
C566751,20914,SET/5 RED RETROSPOT LID GLASS BOWLS,-1,2011-09-14 15:42:00,2.95,14911.0,EIRE
C566751,22796,PHOTO FRAME 3 CLASSIC HANGING,-2,2011-09-14 15:42:00,9.95,14911.0,EIRE
C566751,22197,POPCORN HOLDER,-4,2011-09-14 15:42:00,0.85,14911.0,EIRE
C566752,23130,MISTLETOE HEART WREATH GREEN,-1,2011-09-14 15:46:00,4.15,14397.0,United Kingdom
C566753,22796,PHOTO FRAME 3 CLASSIC HANGING,-1,2011-09-14 15:48:00,9.95,14911.0,EIRE
566755,23023,RIDGED BONNE JAM JAR T-LIGHT HOLDER,48,2011-09-14 15:49:00,1.45,13877.0,United Kingdom
566755,23327,HANGING CLEAR MINI BOTTLE,48,2011-09-14 15:49:00,0.63,13877.0,United Kingdom
566755,21668,RED STRIPE CERAMIC DRAWER KNOB,12,2011-09-14 15:49:00,1.45,13877.0,United Kingdom
C566754,23273,HEART T-LIGHT HOLDER WILLIE WINKIE,-1,2011-09-14 15:49:00,1.65,18158.0,United Kingdom
566756,21481,FAWN BLUE HOT WATER BOTTLE,6,2011-09-14 15:54:00,3.75,12457.0,Switzerland
566756,23299,FOOD COVER WITH BEADS SET 2 ,6,2011-09-14 15:54:00,3.75,12457.0,Switzerland
566756,23229,VINTAGE DONKEY TAIL GAME ,6,2011-09-14 15:54:00,3.75,12457.0,Switzerland
566756,22382,LUNCH BAG SPACEBOY DESIGN ,10,2011-09-14 15:54:00,1.65,12457.0,Switzerland
566756,22630,DOLLY GIRL LUNCH BOX,12,2011-09-14 15:54:00,1.95,12457.0,Switzerland
566756,23208,LUNCH BAG VINTAGE LEAF DESIGN,10,2011-09-14 15:54:00,1.65,12457.0,Switzerland
566756,22631,CIRCUS PARADE LUNCH BOX ,12,2011-09-14 15:54:00,1.95,12457.0,Switzerland
566756,85014A,BLACK/BLUE POLKADOT UMBRELLA,3,2011-09-14 15:54:00,5.95,12457.0,Switzerland
566756,23236,STORAGE TIN VINTAGE DOILY ,6,2011-09-14 15:54:00,2.89,12457.0,Switzerland
566756,22467,GUMBALL COAT RACK,6,2011-09-14 15:54:00,2.55,12457.0,Switzerland
566756,20977,36 PENCILS TUBE WOODLAND,16,2011-09-14 15:54:00,1.25,12457.0,Switzerland
566756,23008,DOLLY GIRL BABY GIFT SET,2,2011-09-14 15:54:00,16.95,12457.0,Switzerland
566756,22026,BANQUET BIRTHDAY  CARD  ,12,2011-09-14 15:54:00,0.42,12457.0,Switzerland
566756,21506,"FANCY FONT BIRTHDAY CARD, ",12,2011-09-14 15:54:00,0.42,12457.0,Switzerland
566756,21680,WOODLAND  STICKERS,12,2011-09-14 15:54:00,0.85,12457.0,Switzerland
566756,21675,BUTTERFLIES STICKERS,12,2011-09-14 15:54:00,0.85,12457.0,Switzerland
566756,21719,LOVELY BONBON STICKER SHEET,12,2011-09-14 15:54:00,0.85,12457.0,Switzerland
566756,22139,RETROSPOT TEA SET CERAMIC 11 PC ,3,2011-09-14 15:54:00,4.95,12457.0,Switzerland
566756,23390,DOLLY GIRL MINI BACKPACK,4,2011-09-14 15:54:00,4.15,12457.0,Switzerland
566756,23388,WOODLAND MINI BACKPACK,8,2011-09-14 15:54:00,4.15,12457.0,Switzerland
566756,23389,SPACEBOY MINI BACKPACK,8,2011-09-14 15:54:00,4.15,12457.0,Switzerland
566756,23240,SET OF 4 KNICK KNACK TINS DOILY ,6,2011-09-14 15:54:00,4.15,12457.0,Switzerland
566756,22551,PLASTERS IN TIN SPACEBOY,12,2011-09-14 15:54:00,1.65,12457.0,Switzerland
566756,22554,PLASTERS IN TIN WOODLAND ANIMALS,12,2011-09-14 15:54:00,1.65,12457.0,Switzerland
566756,22556,PLASTERS IN TIN CIRCUS PARADE ,12,2011-09-14 15:54:00,1.65,12457.0,Switzerland
566756,22555,PLASTERS IN TIN STRONGMAN,12,2011-09-14 15:54:00,1.65,12457.0,Switzerland
566756,23280,FOLDING BUTTERFLY MIRROR HOT PINK ,12,2011-09-14 15:54:00,0.83,12457.0,Switzerland
566756,22628,PICNIC BOXES SET OF 3 RETROSPOT ,8,2011-09-14 15:54:00,4.95,12457.0,Switzerland
566756,23290,SPACEBOY CHILDRENS BOWL,32,2011-09-14 15:54:00,1.25,12457.0,Switzerland
566756,23292,SPACEBOY CHILDRENS CUP,24,2011-09-14 15:54:00,1.25,12457.0,Switzerland
566756,23289,DOLLY GIRL CHILDRENS BOWL,32,2011-09-14 15:54:00,1.25,12457.0,Switzerland
566756,23291,DOLLY GIRL CHILDRENS CUP,24,2011-09-14 15:54:00,1.25,12457.0,Switzerland
566756,21709,FOLDING UMBRELLA CHOCOLATE POLKADOT,4,2011-09-14 15:54:00,4.95,12457.0,Switzerland
566756,23245,SET OF 3 REGENCY CAKE TINS,8,2011-09-14 15:54:00,4.95,12457.0,Switzerland
566757,20775,DAISY NOTEBOOK ,1,2011-09-14 15:54:00,1.63,,United Kingdom
566757,22025,RING OF ROSES BIRTHDAY CARD,7,2011-09-14 15:54:00,0.83,,United Kingdom
566757,22029,SPACEBOY BIRTHDAY CARD,1,2011-09-14 15:54:00,0.83,,United Kingdom
566757,22030,SWALLOWS GREETING CARD,1,2011-09-14 15:54:00,0.83,,United Kingdom
566757,20829,GLITTER HANGING BUTTERFLY STRING,1,2011-09-14 15:54:00,4.13,,United Kingdom
