InvoiceNo,StockCode,Description,Quantity,InvoiceDate,UnitPrice,CustomerID,Country
564756,21774,DECORATIVE CATS BATHROOM BOTTLE,1,2011-08-30 10:33:00,2.46,,United Kingdom
564756,21775,DECORATIVE FLORE BATHROOM BOTTLE,2,2011-08-30 10:33:00,2.46,,United Kingdom
564756,21801,CHRISTMAS TREE DECORATION WITH BELL,7,2011-08-30 10:33:00,0.42,,United Kingdom
564756,21802,CHRISTMAS TREE HEART DECORATION,8,2011-08-30 10:33:00,0.42,,United Kingdom
564756,21803,CHRISTMAS TREE STAR DECORATION,8,2011-08-30 10:33:00,0.42,,United Kingdom
564756,21830,ASSORTED CREEPY CRAWLIES,1,2011-08-30 10:33:00,0.83,,United Kingdom
564756,21900,"KEY FOB , SHED",1,2011-08-30 10:33:00,1.63,,United Kingdom
564756,21907,I'M ON HOLIDAY METAL SIGN,2,2011-08-30 10:33:00,4.13,,United Kingdom
564756,21908,CHOCOLATE THIS WAY METAL SIGN,1,2011-08-30 10:33:00,4.13,,United Kingdom
564756,21929,JUMBO BAG PINK VINTAGE PAISLEY,1,2011-08-30 10:33:00,4.13,,United Kingdom
564756,21930,JUMBO STORAGE BAG SKULLS,1,2011-08-30 10:33:00,4.13,,United Kingdom
564756,21933,PINK VINTAGE PAISLEY PICNIC BAG,4,2011-08-30 10:33:00,2.46,,United Kingdom
564756,21975,PACK OF 60 DINOSAUR CAKE CASES,1,2011-08-30 10:33:00,1.25,,United Kingdom
564756,21985,PACK OF 12 HEARTS DESIGN TISSUES ,10,2011-08-30 10:33:00,0.83,,United Kingdom
564756,21990,MODERN FLORAL STATIONERY SET,1,2011-08-30 10:33:00,2.46,,United Kingdom
564756,21993,FLORAL FOLK STATIONERY SET,1,2011-08-30 10:33:00,2.46,,United Kingdom
564756,22023,EMPIRE BIRTHDAY CARD,1,2011-08-30 10:33:00,0.83,,United Kingdom
564756,22083,PAPER CHAIN KIT RETROSPOT,1,2011-08-30 10:33:00,5.79,,United Kingdom
564756,22090,PAPER BUNTING RETROSPOT,1,2011-08-30 10:33:00,5.79,,United Kingdom
564756,22096,PINK PAISLEY SQUARE TISSUE BOX ,2,2011-08-30 10:33:00,2.46,,United Kingdom
564756,22105,MIRROR MOSAIC GOBLET CANDLE HOLDER,3,2011-08-30 10:33:00,4.13,,United Kingdom
564756,22139,RETROSPOT TEA SET CERAMIC 11 PC ,1,2011-08-30 10:33:00,10.79,,United Kingdom
564756,22152,PLACE SETTING WHITE STAR,10,2011-08-30 10:33:00,1.63,,United Kingdom
564756,22153,ANGEL DECORATION STARS ON DRESS,1,2011-08-30 10:33:00,0.83,,United Kingdom
564756,22164,STRING OF STARS CARD HOLDER,5,2011-08-30 10:33:00,5.79,,United Kingdom
564756,22193,RED DINER WALL CLOCK,1,2011-08-30 10:33:00,16.63,,United Kingdom
564756,22201,FRYING PAN BLUE POLKADOT,1,2011-08-30 10:33:00,8.29,,United Kingdom
564756,22204,MILK PAN BLUE POLKADOT,1,2011-08-30 10:33:00,7.46,,United Kingdom
564756,22211,WOOD STAMP SET FLOWERS,1,2011-08-30 10:33:00,3.29,,United Kingdom
564756,22219,LOVEBIRD HANGING DECORATION WHITE ,3,2011-08-30 10:33:00,1.63,,United Kingdom
564756,22269,EGG CUP NATURAL CHICKEN,1,2011-08-30 10:33:00,0.83,,United Kingdom
564756,22297,HEART IVORY TRELLIS SMALL,1,2011-08-30 10:33:00,2.46,,United Kingdom
564756,22300,COFFEE MUG DOG + BALL DESIGN,2,2011-08-30 10:33:00,4.96,,United Kingdom
564756,22301,COFFEE MUG CAT + BIRD DESIGN,2,2011-08-30 10:33:00,4.96,,United Kingdom
564756,22352,LUNCH BOX WITH CUTLERY RETROSPOT ,1,2011-08-30 10:33:00,4.96,,United Kingdom
564756,22355,CHARLOTTE BAG SUKI DESIGN,1,2011-08-30 10:33:00,1.63,,United Kingdom
564756,22357,KINGS CHOICE BISCUIT TIN,2,2011-08-30 10:33:00,4.13,,United Kingdom
564756,22364,GLASS JAR DIGESTIVE BISCUITS,1,2011-08-30 10:33:00,5.79,,United Kingdom
564756,22367,CHILDRENS APRON SPACEBOY DESIGN,1,2011-08-30 10:33:00,4.13,,United Kingdom
564756,22384,LUNCH BAG PINK POLKADOT,1,2011-08-30 10:33:00,4.13,,United Kingdom
564756,22386,JUMBO BAG PINK POLKADOT,4,2011-08-30 10:33:00,4.13,,United Kingdom
564756,22466,FAIRY TALE COTTAGE NIGHTLIGHT,1,2011-08-30 10:33:00,4.13,,United Kingdom
564756,22505,MEMO BOARD COTTAGE DESIGN,1,2011-08-30 10:33:00,10.79,,United Kingdom
564756,22553,PLASTERS IN TIN SKULLS,1,2011-08-30 10:33:00,3.29,,United Kingdom
564756,22554,PLASTERS IN TIN WOODLAND ANIMALS,1,2011-08-30 10:33:00,3.29,,United Kingdom
564756,22600,CHRISTMAS RETROSPOT STAR WOOD,10,2011-08-30 10:33:00,1.63,,United Kingdom
564756,22616,PACK OF 12 LONDON TISSUES ,1,2011-08-30 10:33:00,0.83,,United Kingdom
564756,22628,PICNIC BOXES SET OF 3 RETROSPOT ,1,2011-08-30 10:33:00,9.96,,United Kingdom
564756,22665,RECIPE BOX BLUE SKETCHBOOK DESIGN,1,2011-08-30 10:33:00,5.79,,United Kingdom
564756,22666,RECIPE BOX PANTRY YELLOW DESIGN,1,2011-08-30 10:33:00,5.79,,United Kingdom
564756,22734,SET OF 6 RIBBONS VINTAGE CHRISTMAS,1,2011-08-30 10:33:00,5.79,,United Kingdom
564756,22745,POPPY'S PLAYHOUSE BEDROOM ,1,2011-08-30 10:33:00,4.13,,United Kingdom
564756,22746,POPPY'S PLAYHOUSE LIVINGROOM ,1,2011-08-30 10:33:00,4.13,,United Kingdom
564756,22747,POPPY'S PLAYHOUSE BATHROOM,1,2011-08-30 10:33:00,4.13,,United Kingdom
564756,22766,PHOTO FRAME CORNICE,1,2011-08-30 10:33:00,5.79,,United Kingdom
564756,22773,GREEN DRAWER KNOB ACRYLIC EDWARDIAN,2,2011-08-30 10:33:00,2.46,,United Kingdom
564756,22775,PURPLE DRAWERKNOB ACRYLIC EDWARDIAN,3,2011-08-30 10:33:00,2.46,,United Kingdom
564756,22805,BLUE DRAWER KNOB ACRYLIC EDWARDIAN,4,2011-08-30 10:33:00,2.46,,United Kingdom
564756,22807,SET OF 6 T-LIGHTS TOADSTOOLS,1,2011-08-30 10:33:00,5.79,,United Kingdom
564756,22851,SET 20 NAPKINS FAIRY CAKES DESIGN ,3,2011-08-30 10:33:00,1.63,,United Kingdom
564756,22898,CHILDRENS APRON APPLES DESIGN,1,2011-08-30 10:33:00,4.13,,United Kingdom
564756,22907,PACK OF 20 NAPKINS PANTRY DESIGN,2,2011-08-30 10:33:00,1.63,,United Kingdom
564756,22915,ASSORTED BOTTLE TOP  MAGNETS ,6,2011-08-30 10:33:00,0.83,,United Kingdom
564756,22930,BAKING MOULD HEART MILK CHOCOLATE,1,2011-08-30 10:33:00,4.96,,United Kingdom
564756,22931,BAKING MOULD HEART WHITE CHOCOLATE,1,2011-08-30 10:33:00,4.96,,United Kingdom
564756,22939,ADULT APRON APPLE DELIGHT,1,2011-08-30 10:33:00,10.79,,United Kingdom
564756,22949,36 DOILIES DOLLY GIRL,1,2011-08-30 10:33:00,2.92,,United Kingdom
564756,22960,JAM MAKING SET WITH JARS,1,2011-08-30 10:33:00,8.29,,United Kingdom
564756,22970,LONDON BUS COFFEE MUG,1,2011-08-30 10:33:00,4.96,,United Kingdom
564756,22981,PANTRY APPLE CORER,1,2011-08-30 10:33:00,2.92,,United Kingdom
564756,23014,GLASS APOTHECARY BOTTLE ELIXIR,1,2011-08-30 10:33:00,8.29,,United Kingdom
564756,23082,SET 6 PAPER TABLE LANTERN HEARTS ,1,2011-08-30 10:33:00,7.46,,United Kingdom
564756,23086,ZINC  STAR T-LIGHT HOLDER ,10,2011-08-30 10:33:00,2.46,,United Kingdom
564756,23125,6PC WOOD PLATE SET DISPOSABLE,1,2011-08-30 10:33:00,2.46,,United Kingdom
564756,23144,ZINC T-LIGHT HOLDER STARS SMALL,10,2011-08-30 10:33:00,1.63,,United Kingdom
564756,23162,REGENCY TEA STRAINER,1,2011-08-30 10:33:00,7.46,,United Kingdom
564756,23165,LARGE CERAMIC TOP STORAGE JAR,5,2011-08-30 10:33:00,3.29,,United Kingdom
564756,23167,SMALL CERAMIC TOP STORAGE JAR ,10,2011-08-30 10:33:00,1.63,,United Kingdom
564756,23182,TOILET SIGN OCCUPIED OR VACANT,2,2011-08-30 10:33:00,2.46,,United Kingdom
564756,23193,BUFFALO BILL TREASURE BOOK BOX,1,2011-08-30 10:33:00,4.58,,United Kingdom
564756,23197,SKETCHBOOK MAGNETIC SHOPPING LIST,1,2011-08-30 10:33:00,3.29,,United Kingdom
564756,23199,JUMBO BAG APPLES,3,2011-08-30 10:33:00,4.13,,United Kingdom
564756,23200,JUMBO BAG PEARS,1,2011-08-30 10:33:00,4.13,,United Kingdom
564756,23212,HEART WREATH DECORATION WITH BELL,1,2011-08-30 10:33:00,2.46,,United Kingdom
564756,23229,VINTAGE DONKEY TAIL GAME ,1,2011-08-30 10:33:00,7.46,,United Kingdom
564756,23240,SET OF 4 KNICK KNACK TINS DOILY ,1,2011-08-30 10:33:00,8.29,,United Kingdom
564756,23251,VINTAGE RED ENAMEL TRIM MUG ,1,2011-08-30 10:33:00,2.46,,United Kingdom
564756,23274,STAR T-LIGHT HOLDER WILLIE WINKIE,10,2011-08-30 10:33:00,3.29,,United Kingdom
564756,23282,FOLDING BUTTERFLY MIRROR IVORY ,1,2011-08-30 10:33:00,2.46,,United Kingdom
564756,23294,SET OF 6 SNACK LOAF BAKING CASES,1,2011-08-30 10:33:00,2.46,,United Kingdom
564756,23295,SET OF 12 MINI LOAF BAKING CASES,1,2011-08-30 10:33:00,2.46,,United Kingdom
564756,23297,SET 40 HEART SHAPE PETIT FOUR CASES,3,2011-08-30 10:33:00,3.29,,United Kingdom
564756,23298,SPOTTY BUNTING,3,2011-08-30 10:33:00,10.79,,United Kingdom
564756,23306,SET OF 36 DOILIES PANTRY DESIGN,1,2011-08-30 10:33:00,2.92,,United Kingdom
564756,23307,SET OF 60 PANTRY DESIGN CAKE CASES ,1,2011-08-30 10:33:00,1.25,,United Kingdom
564756,23328,SET 6 SCHOOL MILK BOTTLES IN CRATE,3,2011-08-30 10:33:00,7.46,,United Kingdom
564756,23340,VINTAGE CHRISTMAS CAKE FRILL,1,2011-08-30 10:33:00,3.29,,United Kingdom
564756,23349,ROLL WRAP VINTAGE CHRISTMAS,1,2011-08-30 10:33:00,2.46,,United Kingdom
564756,23351,ROLL WRAP 50'S CHRISTMAS,1,2011-08-30 10:33:00,2.46,,United Kingdom
564756,23352,ROLL WRAP 50'S RED CHRISTMAS ,1,2011-08-30 10:33:00,2.46,,United Kingdom
564756,23353,6 GIFT TAGS VINTAGE CHRISTMAS ,2,2011-08-30 10:33:00,1.63,,United Kingdom
564756,35954,SMALL FOLKART STAR CHRISTMAS DEC,20,2011-08-30 10:33:00,0.82,,United Kingdom
564756,35967,FOLK ART METAL STAR T-LIGHT HOLDER,10,2011-08-30 10:33:00,1.63,,United Kingdom
564756,37447,CERAMIC CAKE DESIGN SPOTTED PLATE,1,2011-08-30 10:33:00,3.29,,United Kingdom
564756,37448,CERAMIC CAKE DESIGN SPOTTED MUG,1,2011-08-30 10:33:00,3.29,,United Kingdom
564756,47566,PARTY BUNTING,1,2011-08-30 10:33:00,10.79,,United Kingdom
564756,71459,HANGING JAM JAR T-LIGHT HOLDERS,4,2011-08-30 10:33:00,1.66,,United Kingdom
564756,82494L,WOODEN FRAME ANTIQUE WHITE ,1,2011-08-30 10:33:00,7.46,,United Kingdom
564756,82567,"AIRLINE LOUNGE,METAL SIGN",1,2011-08-30 10:33:00,1.63,,United Kingdom
564756,82580,BATHROOM METAL SIGN,1,2011-08-30 10:33:00,1.25,,United Kingdom
564756,82613D,METAL SIGN CUPCAKE SINGLE HOOK,1,2011-08-30 10:33:00,2.46,,United Kingdom
564756,84031A,CHARLIE+LOLA RED HOT WATER BOTTLE ,1,2011-08-30 10:33:00,4.13,,United Kingdom
564756,84032A,CHARLIE+LOLA PINK HOT WATER BOTTLE,1,2011-08-30 10:33:00,3.29,,United Kingdom
564756,84568,GIRLS ALPHABET IRON ON PATCHES ,10,2011-08-30 10:33:00,0.42,,United Kingdom
564756,84596F,SMALL MARSHMALLOWS PINK BOWL,1,2011-08-30 10:33:00,0.83,,United Kingdom
564756,84659A,WHITE TRAVEL ALARM CLOCK,1,2011-08-30 10:33:00,2.46,,United Kingdom
564756,84660C,PINK STITCHED WALL CLOCK,1,2011-08-30 10:33:00,7.46,,United Kingdom
564756,84755,COLOUR GLASS T-LIGHT HOLDER HANGING,4,2011-08-30 10:33:00,1.24,,United Kingdom
564756,84796B,BLUE SAVANNAH PICNIC HAMPER FOR 2,1,2011-08-30 10:33:00,8.29,,United Kingdom
564756,84884A,ANT WHITE WIRE HEART SPIRAL,1,2011-08-30 10:33:00,8.29,,United Kingdom
564756,84923,PINK BUTTERFLY HANDBAG W BOBBLES,1,2011-08-30 10:33:00,4.13,,United Kingdom
564756,84950,ASSORTED COLOUR T-LIGHT HOLDER,6,2011-08-30 10:33:00,1.38,,United Kingdom
564756,84971S,SMALL HEART FLOWERS HOOK ,1,2011-08-30 10:33:00,1.63,,United Kingdom
564756,84978,HANGING HEART JAR T-LIGHT HOLDER,15,2011-08-30 10:33:00,2.46,,United Kingdom
564756,85017B,ENVELOPE 50 BLOSSOM IMAGES,1,2011-08-30 10:33:00,0.83,,United Kingdom
564756,85032D,YULETIDE IMAGES GIFT WRAP SET,1,2011-08-30 10:33:00,1.63,,United Kingdom
564756,85039A,SET/4 RED MINI ROSE CANDLE IN BOWL,2,2011-08-30 10:33:00,1.63,,United Kingdom
564756,85039B,S/4 IVORY MINI ROSE CANDLE IN BOWL,4,2011-08-30 10:33:00,1.63,,United Kingdom
564756,85099F,JUMBO BAG STRAWBERRY,1,2011-08-30 10:33:00,4.13,,United Kingdom
564756,85123A,WHITE HANGING HEART T-LIGHT HOLDER,1,2011-08-30 10:33:00,5.79,,United Kingdom
564756,85131D,BEADED CRYSTAL HEART PINK ON STICK,1,2011-08-30 10:33:00,0.83,,United Kingdom
564756,85132C,CHARLIE AND LOLA FIGURES TINS,1,2011-08-30 10:33:00,5.79,,United Kingdom
564756,90096,NECKLACE+BRACELET SET BLUE BLOSSOM,1,2011-08-30 10:33:00,2.46,,United Kingdom
564756,90116,FRUIT SALAD BAG CHARM,1,2011-08-30 10:33:00,2.46,,United Kingdom
564756,90158,ST TROPEZ NECKLACE,1,2011-08-30 10:33:00,4.98,,United Kingdom
564756,90190C,SILVER/AMETHYST DROP EARRINGS LEAF,1,2011-08-30 10:33:00,2.9,,United Kingdom
564756,90202D,PINK ENAMEL FLOWER HAIR TIE,1,2011-08-30 10:33:00,2.9,,United Kingdom
564756,90214L,"LETTER ""L"" BLING KEY RING",2,2011-08-30 10:33:00,0.83,,United Kingdom
564756,DOT,DOTCOM POSTAGE,1,2011-08-30 10:33:00,165.2,,United Kingdom
564757,21714,CITRONELLA CANDLE GARDEN POT,1,2011-08-30 10:36:00,2.46,,United Kingdom
564757,21746,SMALL RED RETROSPOT WINDMILL,1,2011-08-30 10:36:00,2.46,,United Kingdom
564757,21774,DECORATIVE CATS BATHROOM BOTTLE,1,2011-08-30 10:36:00,2.46,,United Kingdom
564757,21787,RAIN PONCHO RETROSPOT,2,2011-08-30 10:36:00,1.63,,United Kingdom
564757,21790,VINTAGE SNAP CARDS,1,2011-08-30 10:36:00,1.63,,United Kingdom
564757,21791,VINTAGE HEADS AND TAILS CARD GAME ,1,2011-08-30 10:36:00,2.46,,United Kingdom
564757,21812,GARLAND WITH HEARTS AND BELLS,1,2011-08-30 10:36:00,9.96,,United Kingdom
564757,21892,TRADITIONAL WOODEN CATCH CUP GAME ,1,2011-08-30 10:36:00,2.46,,United Kingdom
564757,21894,POTTING SHED SEED ENVELOPES,1,2011-08-30 10:36:00,2.46,,United Kingdom
564757,21916,SET 12 RETRO WHITE CHALK STICKS,2,2011-08-30 10:36:00,0.83,,United Kingdom
564757,21930,JUMBO STORAGE BAG SKULLS,2,2011-08-30 10:36:00,4.13,,United Kingdom
564757,21932,SCANDINAVIAN PAISLEY PICNIC BAG,4,2011-08-30 10:36:00,2.46,,United Kingdom
564757,21933,PINK VINTAGE PAISLEY PICNIC BAG,1,2011-08-30 10:36:00,2.46,,United Kingdom
564757,21936,RED RETROSPOT PICNIC BAG,1,2011-08-30 10:36:00,5.79,,United Kingdom
564757,21967,PACK OF 12 SKULL TISSUES,1,2011-08-30 10:36:00,0.83,,United Kingdom
564757,21977,PACK OF 60 PINK PAISLEY CAKE CASES,1,2011-08-30 10:36:00,1.25,,United Kingdom
564757,21990,MODERN FLORAL STATIONERY SET,1,2011-08-30 10:36:00,2.46,,United Kingdom
564757,21993,FLORAL FOLK STATIONERY SET,5,2011-08-30 10:36:00,2.46,,United Kingdom
564757,22027,TEA PARTY BIRTHDAY CARD,1,2011-08-30 10:36:00,0.83,,United Kingdom
564757,22029,SPACEBOY BIRTHDAY CARD,1,2011-08-30 10:36:00,0.83,,United Kingdom
564757,22037,ROBOT BIRTHDAY CARD,1,2011-08-30 10:36:00,0.83,,United Kingdom
564757,22086,PAPER CHAIN KIT 50'S CHRISTMAS ,1,2011-08-30 10:36:00,5.79,,United Kingdom
564757,22089,PAPER BUNTING VINTAGE PAISLEY,1,2011-08-30 10:36:00,5.79,,United Kingdom
564757,22109,FULL ENGLISH BREAKFAST PLATE,4,2011-08-30 10:36:00,7.46,,United Kingdom
564757,22161,HEART DECORATION RUSTIC HANGING ,1,2011-08-30 10:36:00,0.79,,United Kingdom
564757,22166,WALL MIRROR RECTANGLE DIAMANTE PINK,1,2011-08-30 10:36:00,7.46,,United Kingdom
564757,22178,VICTORIAN GLASS HANGING T-LIGHT,12,2011-08-30 10:36:00,2.46,,United Kingdom
564757,22222,CAKE PLATE LOVEBIRD WHITE,1,2011-08-30 10:36:00,9.96,,United Kingdom
564757,22268,DECORATION SITTING BUNNY,1,2011-08-30 10:36:00,0.63,,United Kingdom
564757,22269,EGG CUP NATURAL CHICKEN,2,2011-08-30 10:36:00,0.83,,United Kingdom
564757,22299,PIG KEYRING WITH LIGHT & SOUND ,5,2011-08-30 10:36:00,2.46,,United Kingdom
564757,22318,FIVE HEART HANGING DECORATION,1,2011-08-30 10:36:00,5.79,,United Kingdom
564757,22328,ROUND SNACK BOXES SET OF 4 FRUITS ,1,2011-08-30 10:36:00,5.79,,United Kingdom
564757,22355,CHARLOTTE BAG SUKI DESIGN,2,2011-08-30 10:36:00,1.63,,United Kingdom
564757,22357,KINGS CHOICE BISCUIT TIN,1,2011-08-30 10:36:00,4.13,,United Kingdom
564757,22378,WALL TIDY RETROSPOT ,1,2011-08-30 10:36:00,4.13,,United Kingdom
564757,22381,TOY TIDY PINK POLKADOT,1,2011-08-30 10:36:00,4.13,,United Kingdom
564757,22423,REGENCY CAKESTAND 3 TIER,4,2011-08-30 10:36:00,24.96,,United Kingdom
564757,22457,NATURAL SLATE HEART CHALKBOARD ,2,2011-08-30 10:36:00,5.79,,United Kingdom
564757,22464,HANGING METAL HEART LANTERN,2,2011-08-30 10:36:00,3.29,,United Kingdom
564757,22469,HEART OF WICKER SMALL,10,2011-08-30 10:36:00,3.29,,United Kingdom
564757,22470,HEART OF WICKER LARGE,11,2011-08-30 10:36:00,5.79,,United Kingdom
564757,22530,MAGIC DRAWING SLATE DOLLY GIRL ,1,2011-08-30 10:36:00,0.83,,United Kingdom
564757,22531,MAGIC DRAWING SLATE CIRCUS PARADE  ,1,2011-08-30 10:36:00,0.83,,United Kingdom
564757,22534,MAGIC DRAWING SLATE SPACEBOY ,1,2011-08-30 10:36:00,0.83,,United Kingdom
564757,22548,HEADS AND TAILS SPORTING FUN,1,2011-08-30 10:36:00,2.46,,United Kingdom
564757,22549,PICTURE DOMINOES,1,2011-08-30 10:36:00,3.29,,United Kingdom
564757,22553,PLASTERS IN TIN SKULLS,3,2011-08-30 10:36:00,3.29,,United Kingdom
564757,22554,PLASTERS IN TIN WOODLAND ANIMALS,1,2011-08-30 10:36:00,3.29,,United Kingdom
564757,22557,PLASTERS IN TIN VINTAGE PAISLEY ,1,2011-08-30 10:36:00,3.29,,United Kingdom
564757,22602,RETROSPOT WOODEN HEART DECORATION,1,2011-08-30 10:36:00,1.63,,United Kingdom
564757,22605,WOODEN CROQUET GARDEN SET,2,2011-08-30 10:36:00,24.96,,United Kingdom
564757,22614,PACK OF 12 SPACEBOY TISSUES,1,2011-08-30 10:36:00,0.83,,United Kingdom
564757,22620,4 TRADITIONAL SPINNING TOPS,1,2011-08-30 10:36:00,2.46,,United Kingdom
564757,22621,TRADITIONAL KNITTING NANCY,1,2011-08-30 10:36:00,3.29,,United Kingdom
564757,22624,IVORY KITCHEN SCALES,1,2011-08-30 10:36:00,16.63,,United Kingdom
564757,22628,PICNIC BOXES SET OF 3 RETROSPOT ,1,2011-08-30 10:36:00,9.96,,United Kingdom
564757,22646,CERAMIC STRAWBERRY CAKE MONEY BANK,1,2011-08-30 10:36:00,3.29,,United Kingdom
564757,22663,JUMBO BAG DOLLY GIRL DESIGN,1,2011-08-30 10:36:00,4.13,,United Kingdom
564757,22698,PINK REGENCY TEACUP AND SAUCER,1,2011-08-30 10:36:00,5.79,,United Kingdom
564757,22718,CARD CAT AND TREE ,1,2011-08-30 10:36:00,0.83,,United Kingdom
564757,22720,SET OF 3 CAKE TINS PANTRY DESIGN ,4,2011-08-30 10:36:00,10.79,,United Kingdom
564757,22817,CARD SUKI BIRTHDAY,1,2011-08-30 10:36:00,0.83,,United Kingdom
564757,22891,TEA FOR ONE POLKADOT,1,2011-08-30 10:36:00,8.29,,United Kingdom
564757,22895,SET OF 2 TEA TOWELS APPLE AND PEARS,1,2011-08-30 10:36:00,6.63,,United Kingdom
564757,22909,SET OF 20 VINTAGE CHRISTMAS NAPKINS,2,2011-08-30 10:36:00,1.63,,United Kingdom
564757,22948,METAL DECORATION NAUGHTY CHILDREN ,4,2011-08-30 10:36:00,1.66,,United Kingdom
564757,22950,36 DOILIES VINTAGE CHRISTMAS,1,2011-08-30 10:36:00,2.92,,United Kingdom
564757,22952,60 CAKE CASES VINTAGE CHRISTMAS,1,2011-08-30 10:36:00,1.25,,United Kingdom
564757,22960,JAM MAKING SET WITH JARS,3,2011-08-30 10:36:00,8.29,,United Kingdom
564757,22963,JAM JAR WITH GREEN LID,3,2011-08-30 10:36:00,1.63,,United Kingdom
564757,22978,PANTRY ROLLING PIN,3,2011-08-30 10:36:00,7.46,,United Kingdom
564757,22983,CARD BILLBOARD FONT,2,2011-08-30 10:36:00,0.83,,United Kingdom
564757,22993,SET OF 4 PANTRY JELLY MOULDS,2,2011-08-30 10:36:00,2.46,,United Kingdom
564757,23012,GLASS APOTHECARY BOTTLE PERFUME,1,2011-08-30 10:36:00,8.29,,United Kingdom
564757,23013,GLASS APOTHECARY BOTTLE TONIC,1,2011-08-30 10:36:00,8.29,,United Kingdom
564757,23014,GLASS APOTHECARY BOTTLE ELIXIR,1,2011-08-30 10:36:00,8.29,,United Kingdom
564757,23026,DRAWER KNOB VINTAGE GLASS STAR,9,2011-08-30 10:36:00,4.13,,United Kingdom
564757,23052,RECYCLED ACAPULCO MAT TURQUOISE,1,2011-08-30 10:36:00,16.63,,United Kingdom
564757,23061,VINTAGE EMBOSSED HEART,1,2011-08-30 10:36:00,2.46,,United Kingdom
564757,23086,ZINC  STAR T-LIGHT HOLDER ,2,2011-08-30 10:36:00,2.46,,United Kingdom
564757,23087,ZINC  HEART T-LIGHT HOLDER,4,2011-08-30 10:36:00,2.46,,United Kingdom
564757,23089,GLASS BON BON JAR,1,2011-08-30 10:36:00,3.29,,United Kingdom
564757,23118,PARISIENNE JEWELLERY DRAWER ,1,2011-08-30 10:36:00,14.96,,United Kingdom
564757,23158,SET OF 5 LUCKY CAT MAGNETS ,1,2011-08-30 10:36:00,4.13,,United Kingdom
564757,23201,JUMBO BAG ALPHABET,2,2011-08-30 10:36:00,4.13,,United Kingdom
564757,23202,JUMBO BAG VINTAGE LEAF,2,2011-08-30 10:36:00,4.13,,United Kingdom
564757,23204,CHARLOTTE BAG APPLES DESIGN,1,2011-08-30 10:36:00,1.63,,United Kingdom
564757,23206,LUNCH BAG APPLE DESIGN,4,2011-08-30 10:36:00,4.13,,United Kingdom
564757,23209,LUNCH BAG VINTAGE DOILY ,4,2011-08-30 10:36:00,4.13,,United Kingdom
564757,23226,FILIGREE HEART DAISY WHITE,6,2011-08-30 10:36:00,2.46,,United Kingdom
564757,23227,FILIGREE HEART BUTTERFLY WHITE ,4,2011-08-30 10:36:00,2.46,,United Kingdom
564757,23228,FILIGREE HEART BIRD WHITE ,5,2011-08-30 10:36:00,2.46,,United Kingdom
564757,23240,SET OF 4 KNICK KNACK TINS DOILY ,2,2011-08-30 10:36:00,8.29,,United Kingdom
564757,23268,SET OF 2 CERAMIC CHRISTMAS REINDEER,1,2011-08-30 10:36:00,2.92,,United Kingdom
564757,23280,FOLDING BUTTERFLY MIRROR HOT PINK ,1,2011-08-30 10:36:00,2.46,,United Kingdom
564757,23285,PINK VINTAGE SPOT BEAKER,1,2011-08-30 10:36:00,1.63,,United Kingdom
564757,23286,BLUE VINTAGE SPOT BEAKER,1,2011-08-30 10:36:00,1.63,,United Kingdom
564757,23287,RED VINTAGE SPOT BEAKER,1,2011-08-30 10:36:00,1.63,,United Kingdom
564757,23288,GREEN VINTAGE SPOT BEAKER,2,2011-08-30 10:36:00,1.63,,United Kingdom
564757,23294,SET OF 6 SNACK LOAF BAKING CASES,1,2011-08-30 10:36:00,2.46,,United Kingdom
564757,23296,SET OF 6 TEA TIME BAKING CASES,1,2011-08-30 10:36:00,3.29,,United Kingdom
564757,23298,SPOTTY BUNTING,12,2011-08-30 10:36:00,10.79,,United Kingdom
564757,23307,SET OF 60 PANTRY DESIGN CAKE CASES ,2,2011-08-30 10:36:00,1.25,,United Kingdom
564757,23308,SET OF 60 VINTAGE LEAF CAKE CASES ,1,2011-08-30 10:36:00,1.25,,United Kingdom
564757,23309,SET OF 60 I LOVE LONDON CAKE CASES ,1,2011-08-30 10:36:00,1.25,,United Kingdom
564757,23328,SET 6 SCHOOL MILK BOTTLES IN CRATE,1,2011-08-30 10:36:00,7.46,,United Kingdom
564757,23331,DECORATIVE WICKER HEART SMALL,1,2011-08-30 10:36:00,1.25,,United Kingdom
564757,23341,PINK DINER WALL CLOCK,1,2011-08-30 10:36:00,16.63,,United Kingdom
564757,23344,JUMBO BAG 50'S CHRISTMAS ,2,2011-08-30 10:36:00,4.13,,United Kingdom
564757,23346,SPACEBOY BEAKER,1,2011-08-30 10:36:00,2.46,,United Kingdom
564757,23438, RED SPOT GIFT BAG LARGE,1,2011-08-30 10:36:00,2.46,,United Kingdom
564757,35916A,YELLOW FELT HANGING HEART W FLOWER,2,2011-08-30 10:36:00,0.63,,United Kingdom
564757,48111,DOORMAT 3 SMILEY CATS,1,2011-08-30 10:36:00,15.79,,United Kingdom
564757,75049L,LARGE CIRCULAR MIRROR MOBILE,2,2011-08-30 10:36:00,2.46,,United Kingdom
564757,82484,WOOD BLACK BOARD ANT WHITE FINISH,2,2011-08-30 10:36:00,16.63,,United Kingdom
564757,82580,BATHROOM METAL SIGN,2,2011-08-30 10:36:00,1.25,,United Kingdom
564757,84031B,CHARLIE LOLA BLUE HOT WATER BOTTLE ,1,2011-08-30 10:36:00,4.13,,United Kingdom
564757,84077,WORLD WAR 2 GLIDERS ASSTD DESIGNS,2,2011-08-30 10:36:00,0.63,,United Kingdom
564757,84596B,SMALL DOLLY MIX DESIGN ORANGE BOWL,2,2011-08-30 10:36:00,0.83,,United Kingdom
564757,84596F,SMALL MARSHMALLOWS PINK BOWL,2,2011-08-30 10:36:00,0.83,,United Kingdom
564757,84596L,BISCUITS SMALL BOWL LIGHT BLUE,1,2011-08-30 10:36:00,0.83,,United Kingdom
564757,84796B,BLUE SAVANNAH PICNIC HAMPER FOR 2,2,2011-08-30 10:36:00,8.29,,United Kingdom
564757,84912A,PINK ROSE WASHBAG,1,2011-08-30 10:36:00,3.29,,United Kingdom
564757,84912B,GREEN ROSE WASHBAG,2,2011-08-30 10:36:00,3.29,,United Kingdom
564757,84923,PINK BUTTERFLY HANDBAG W BOBBLES,1,2011-08-30 10:36:00,4.13,,United Kingdom
564757,84970S,HANGING HEART ZINC T-LIGHT HOLDER,1,2011-08-30 10:36:00,2.08,,United Kingdom
564757,84992,72 SWEETHEART FAIRY CAKE CASES,1,2011-08-30 10:36:00,1.25,,United Kingdom
564757,85035B,CHOCOLATE 3 WICK MORRIS BOX CANDLE,1,2011-08-30 10:36:00,8.29,,United Kingdom
564757,85078,SCANDINAVIAN 3 HEARTS NAPKIN RING,2,2011-08-30 10:36:00,1.63,,United Kingdom
564757,85088,CANDY SPOT HAND BAG,1,2011-08-30 10:36:00,4.13,,United Kingdom
564757,85099F,JUMBO BAG STRAWBERRY,1,2011-08-30 10:36:00,4.13,,United Kingdom
564757,85114A,BLACK ENCHANTED FOREST PLACEMAT,1,2011-08-30 10:36:00,3.29,,United Kingdom
564757,85114C,RED ENCHANTED FOREST PLACEMAT,2,2011-08-30 10:36:00,3.29,,United Kingdom
564757,85129D,BEADED CRYSTAL HEART PINK SMALL,1,2011-08-30 10:36:00,2.46,,United Kingdom
564757,85131B,BEADED CRYSTAL HEART GREEN ON STICK,2,2011-08-30 10:36:00,0.83,,United Kingdom
564757,85131D,BEADED CRYSTAL HEART PINK ON STICK,3,2011-08-30 10:36:00,0.83,,United Kingdom
564757,90087,CRYSTAL SEA HORSE PHONE CHARM,1,2011-08-30 10:36:00,1.63,,United Kingdom
564757,90093,CLEAR CRYSTAL STAR PHONE CHARM,1,2011-08-30 10:36:00,1.63,,United Kingdom
564757,90161C,ANT COPPER LIME BOUDICCA BRACELET,1,2011-08-30 10:36:00,4.98,,United Kingdom
564757,DOT,DOTCOM POSTAGE,1,2011-08-30 10:36:00,198.09,,United Kingdom
564757,15036,ASSORTED COLOURS SILK FAN,2,2011-08-30 10:36:00,1.63,,United Kingdom
564757,17012A,ORIGAMI VANILLA INCENSE/CANDLE SET ,1,2011-08-30 10:36:00,2.46,,United Kingdom
564757,17012B,ORIGAMI JASMINE INCENSE/CANDLE SET,1,2011-08-30 10:36:00,2.46,,United Kingdom
564757,17012C,ORIGAMI LAVENDER INCENSE/CANDL SET ,2,2011-08-30 10:36:00,2.46,,United Kingdom
564757,17012D,ORIGAMI ROSE INCENSE/CANDLE SET ,1,2011-08-30 10:36:00,2.46,,United Kingdom
564757,20616,CHERRY BLOSSOM PASSPORT COVER,1,2011-08-30 10:36:00,1.63,,United Kingdom
564757,20618,QUEEN OF THE SKIES PASSPORT COVER ,1,2011-08-30 10:36:00,1.63,,United Kingdom
564757,20619,TROPICAL PASSPORT COVER ,1,2011-08-30 10:36:00,1.63,,United Kingdom
564757,20664,TROPICAL HOLIDAY PURSE ,1,2011-08-30 10:36:00,2.46,,United Kingdom
564757,20685,DOORMAT RED RETROSPOT,1,2011-08-30 10:36:00,15.79,,United Kingdom
564757,20707,CRAZY DAISY HEART DECORATION,1,2011-08-30 10:36:00,0.83,,United Kingdom
564757,20711,JUMBO BAG TOYS ,1,2011-08-30 10:36:00,4.13,,United Kingdom
564757,20712,JUMBO BAG WOODLAND ANIMALS,1,2011-08-30 10:36:00,4.13,,United Kingdom
564757,20713,JUMBO BAG OWLS,2,2011-08-30 10:36:00,4.13,,United Kingdom
564757,20723,STRAWBERRY CHARLOTTE BAG,1,2011-08-30 10:36:00,1.63,,United Kingdom
564757,20724,RED RETROSPOT CHARLOTTE BAG,1,2011-08-30 10:36:00,1.63,,United Kingdom
564757,20726,LUNCH BAG WOODLAND,1,2011-08-30 10:36:00,4.13,,United Kingdom
564757,20727,LUNCH BAG  BLACK SKULL.,1,2011-08-30 10:36:00,4.13,,United Kingdom
564757,20974,12 PENCILS SMALL TUBE SKULL,1,2011-08-30 10:36:00,1.25,,United Kingdom
564757,20977,36 PENCILS TUBE WOODLAND,3,2011-08-30 10:36:00,2.46,,United Kingdom
564757,20978,36 PENCILS TUBE SKULLS,4,2011-08-30 10:36:00,2.46,,United Kingdom
564757,20981,12 PENCILS TALL TUBE WOODLAND,1,2011-08-30 10:36:00,1.63,,United Kingdom
564757,20982,12 PENCILS TALL TUBE SKULLS,1,2011-08-30 10:36:00,1.63,,United Kingdom
564757,20997,ROSE DU SUD CUSHION COVER ,1,2011-08-30 10:36:00,4.13,,United Kingdom
564757,21003,ROSE DU SUD CUSHION COVER,1,2011-08-30 10:36:00,5.79,,United Kingdom
