InvoiceNo,StockCode,Description,Quantity,InvoiceDate,UnitPrice,CustomerID,Country
556829,21209,MULTICOLOUR HONEYCOMB FAN,12,2011-06-15 10:51:00,0.39,12809.0,Portugal
556829,21208,PASTEL COLOUR HONEYCOMB FAN,12,2011-06-15 10:51:00,0.39,12809.0,Portugal
556829,85054,FRENCH ENAMEL POT W LID,6,2011-06-15 10:51:00,2.95,12809.0,Portugal
556829,22989,SET 2 PANTRY DESIGN TEA TOWELS,6,2011-06-15 10:51:00,3.25,12809.0,Portugal
556829,21218,RED SPOTTY BISCUIT TIN,6,2011-06-15 10:51:00,3.75,12809.0,Portugal
556829,79066K,RETRO MOD TRAY,10,2011-06-15 10:51:00,0.85,12809.0,Portugal
556829,22720,SET OF 3 CAKE TINS PANTRY DESIGN ,3,2011-06-15 10:51:00,4.95,12809.0,Portugal
556829,22556,PLASTERS IN TIN CIRCUS PARADE ,12,2011-06-15 10:51:00,1.65,12809.0,Portugal
556829,22904,CALENDAR PAPER CUT DESIGN,6,2011-06-15 10:51:00,2.95,12809.0,Portugal
556829,POST,POSTAGE,3,2011-06-15 10:51:00,28.0,12809.0,Portugal
556830,22781,GUMBALL MAGAZINE RACK,1,2011-06-15 11:01:00,7.65,15874.0,United Kingdom
556830,23169,CLASSIC GLASS COOKIE JAR,1,2011-06-15 11:01:00,4.15,15874.0,United Kingdom
556830,22467,GUMBALL COAT RACK,13,2011-06-15 11:01:00,2.55,15874.0,United Kingdom
556831,23173,REGENCY TEAPOT ROSES ,20,2011-06-15 11:27:00,8.0,13631.0,United Kingdom
556842,22423,REGENCY CAKESTAND 3 TIER,10,2011-06-15 11:29:00,4.0,13631.0,United Kingdom
556845,23082,SET 6 PAPER TABLE LANTERN HEARTS ,48,2011-06-15 11:30:00,3.29,17511.0,United Kingdom
556845,23309,SET OF 60 I LOVE LONDON CAKE CASES ,120,2011-06-15 11:30:00,0.42,17511.0,United Kingdom
556845,23307,SET OF 60 PANTRY DESIGN CAKE CASES ,120,2011-06-15 11:30:00,0.42,17511.0,United Kingdom
556845,23208,LUNCH BAG VINTAGE LEAF DESIGN,100,2011-06-15 11:30:00,1.45,17511.0,United Kingdom
556845,23238,SET OF 4 KNICK KNACK TINS LONDON ,48,2011-06-15 11:30:00,3.75,17511.0,United Kingdom
556845,23240,SET OF 4 KNICK KNACK TINS DOILEY ,48,2011-06-15 11:30:00,3.75,17511.0,United Kingdom
556845,23236,DOILEY STORAGE TIN,48,2011-06-15 11:30:00,2.49,17511.0,United Kingdom
556845,23243,SET OF TEA COFFEE SUGAR TINS PANTRY,24,2011-06-15 11:30:00,4.15,17511.0,United Kingdom
556845,23241,TREASURE TIN GYMKHANA DESIGN,6,2011-06-15 11:30:00,2.08,17511.0,United Kingdom
556845,23242,TREASURE TIN BUFFALO BILL ,6,2011-06-15 11:30:00,2.08,17511.0,United Kingdom
556845,23235,STORAGE TIN VINTAGE LEAF,48,2011-06-15 11:30:00,2.49,17511.0,United Kingdom
556845,23244,ROUND STORAGE TIN VINTAGE LEAF,48,2011-06-15 11:30:00,1.65,17511.0,United Kingdom
556845,23285,PINK VINTAGE SPOT BEAKER,96,2011-06-15 11:30:00,0.72,17511.0,United Kingdom
556845,23288,GREEN VINTAGE SPOT BEAKER,96,2011-06-15 11:30:00,0.72,17511.0,United Kingdom
556845,23287,RED VINTAGE SPOT BEAKER,96,2011-06-15 11:30:00,0.72,17511.0,United Kingdom
556845,23286,BLUE VINTAGE SPOT BEAKER,96,2011-06-15 11:30:00,0.72,17511.0,United Kingdom
556845,23302,KNEELING MAT HOUSEWORK  DESIGN,48,2011-06-15 11:30:00,1.45,17511.0,United Kingdom
556845,23300,GARDENERS KNEELING PAD CUP OF TEA ,96,2011-06-15 11:30:00,1.45,17511.0,United Kingdom
556845,23301,GARDENERS KNEELING PAD KEEP CALM ,96,2011-06-15 11:30:00,1.45,17511.0,United Kingdom
556845,21212,PACK OF 72 RETROSPOT CAKE CASES,120,2011-06-15 11:30:00,0.42,17511.0,United Kingdom
556845,85123A,WHITE HANGING HEART T-LIGHT HOLDER,64,2011-06-15 11:30:00,2.55,17511.0,United Kingdom
556845,22710,WRAP I LOVE LONDON ,25,2011-06-15 11:30:00,0.42,17511.0,United Kingdom
556845,22851,SET 20 NAPKINS FAIRY CAKES DESIGN ,96,2011-06-15 11:30:00,0.72,17511.0,United Kingdom
556845,16161P,WRAP ENGLISH ROSE ,25,2011-06-15 11:30:00,0.42,17511.0,United Kingdom
556845,20727,LUNCH BAG  BLACK SKULL.,100,2011-06-15 11:30:00,1.45,17511.0,United Kingdom
556845,22050,PINK PAISLEY ROSE GIFT WRAP,25,2011-06-15 11:30:00,0.42,17511.0,United Kingdom
556845,22051,BLUE SCANDINAVIAN PAISLEY WRAP,25,2011-06-15 11:30:00,0.42,17511.0,United Kingdom
556845,23049,RECYCLED ACAPULCO MAT RED,2,2011-06-15 11:30:00,8.25,17511.0,United Kingdom
556845,23052,RECYCLED ACAPULCO MAT TURQUOISE,2,2011-06-15 11:30:00,8.25,17511.0,United Kingdom
556845,23054,RECYCLED ACAPULCO MAT LAVENDER,2,2011-06-15 11:30:00,8.25,17511.0,United Kingdom
556845,22170,PICTURE FRAME WOOD TRIPLE PORTRAIT,12,2011-06-15 11:30:00,5.95,17511.0,United Kingdom
556845,22169,FAMILY ALBUM WHITE PICTURE FRAME,16,2011-06-15 11:30:00,7.65,17511.0,United Kingdom
556845,71459,HANGING JAM JAR T-LIGHT HOLDER,96,2011-06-15 11:30:00,0.72,17511.0,United Kingdom
556845,21165,BEWARE OF THE CAT METAL SIGN ,48,2011-06-15 11:30:00,1.45,17511.0,United Kingdom
556845,21164,HOME SWEET HOME METAL SIGN ,72,2011-06-15 11:30:00,2.55,17511.0,United Kingdom
556845,21174,POTTERING IN THE SHED METAL SIGN,48,2011-06-15 11:30:00,1.85,17511.0,United Kingdom
556845,47566,PARTY BUNTING,50,2011-06-15 11:30:00,4.15,17511.0,United Kingdom
556845,22197,POPCORN HOLDER,100,2011-06-15 11:30:00,0.72,17511.0,United Kingdom
556845,21080,SET/20 RED RETROSPOT PAPER NAPKINS ,96,2011-06-15 11:30:00,0.72,17511.0,United Kingdom
556845,21936,RED RETROSPOT PICNIC BAG,50,2011-06-15 11:30:00,2.55,17511.0,United Kingdom
556845,22354,RETROSPOT PADDED SEAT CUSHION,30,2011-06-15 11:30:00,3.39,17511.0,United Kingdom
556845,21078,SET/20 STRAWBERRY PAPER NAPKINS ,96,2011-06-15 11:30:00,0.72,17511.0,United Kingdom
556845,21428,SET3 BOOK BOX GREEN GINGHAM FLOWER ,16,2011-06-15 11:30:00,3.75,17511.0,United Kingdom
556845,21430,SET/3 RED GINGHAM ROSE STORAGE BOX,24,2011-06-15 11:30:00,3.39,17511.0,United Kingdom
556845,21497,FANCY FONTS BIRTHDAY WRAP,25,2011-06-15 11:30:00,0.42,17511.0,United Kingdom
556845,21499,BLUE POLKADOT WRAP,25,2011-06-15 11:30:00,0.42,17511.0,United Kingdom
556845,21500,PINK POLKADOT WRAP ,25,2011-06-15 11:30:00,0.42,17511.0,United Kingdom
556845,16161U,WRAP SUKI AND FRIENDS,25,2011-06-15 11:30:00,0.42,17511.0,United Kingdom
556845,22045,SPACEBOY GIFT WRAP,25,2011-06-15 11:30:00,0.42,17511.0,United Kingdom
556845,21122,SET/10 PINK POLKADOT PARTY CANDLES,24,2011-06-15 11:30:00,1.25,17511.0,United Kingdom
556845,21124,SET/10 BLUE POLKADOT PARTY CANDLES,24,2011-06-15 11:30:00,1.25,17511.0,United Kingdom
556845,85099B,JUMBO BAG RED RETROSPOT,100,2011-06-15 11:30:00,1.79,17511.0,United Kingdom
556845,23229,VINTAGE DONKEY TAIL GAME ,6,2011-06-15 11:30:00,3.75,17511.0,United Kingdom
556845,23203,JUMBO BAG DOILEY PATTERNS,100,2011-06-15 11:30:00,1.79,17511.0,United Kingdom
556845,23202,JUMBO BAG VINTAGE LEAF,100,2011-06-15 11:30:00,1.79,17511.0,United Kingdom
C556869,23146,TRIPLE HOOK ANTIQUE IVORY ROSE,-4,2011-06-15 11:46:00,3.29,13199.0,United Kingdom
C556870,M,Manual,-1,2011-06-15 11:47:00,306.6,,United Kingdom
C556874,BANK CHARGES,Bank Charges,-1,2011-06-15 11:49:00,464.52,,United Kingdom
C556875,M,Manual,-1,2011-06-15 11:51:00,702.38,,United Kingdom
556876,21172,PARTY METAL SIGN ,1,2011-06-15 11:56:00,1.45,16241.0,United Kingdom
556876,21907,I'M ON HOLIDAY METAL SIGN,1,2011-06-15 11:56:00,2.1,16241.0,United Kingdom
556876,85132B,CHARLIE AND LOLA TABLE TINS,2,2011-06-15 11:56:00,1.95,16241.0,United Kingdom
556876,85132C,CHARLIE AND LOLA FIGURES TINS,2,2011-06-15 11:56:00,1.95,16241.0,United Kingdom
556876,84356,POMPOM CURTAIN,1,2011-06-15 11:56:00,6.95,16241.0,United Kingdom
556876,84865,NEW BAROQUE BLACK PHOTO ALBUM,1,2011-06-15 11:56:00,2.95,16241.0,United Kingdom
556876,23184,BULL DOG BOTTLE OPENER,1,2011-06-15 11:56:00,4.95,16241.0,United Kingdom
556876,47559B,TEA TIME OVEN GLOVE,2,2011-06-15 11:56:00,1.25,16241.0,United Kingdom
556876,23298,SPOTTY BUNTING,2,2011-06-15 11:56:00,4.95,16241.0,United Kingdom
556876,21987,PACK OF 6 SKULL PAPER CUPS,2,2011-06-15 11:56:00,0.65,16241.0,United Kingdom
556876,22083,PAPER CHAIN KIT RETROSPOT,2,2011-06-15 11:56:00,2.95,16241.0,United Kingdom
556876,84944,SET OF 6 KASHMIR FOLKART BAUBLES,6,2011-06-15 11:56:00,1.65,16241.0,United Kingdom
556876,22123,PING MICROWAVE APRON,1,2011-06-15 11:56:00,1.95,16241.0,United Kingdom
556876,47593B,SCOTTIE DOGS BABY BIB,1,2011-06-15 11:56:00,0.39,16241.0,United Kingdom
556876,23321,SMALL WHITE HEART OF WICKER,3,2011-06-15 11:56:00,1.65,16241.0,United Kingdom
556876,23322,LARGE WHITE HEART OF WICKER,1,2011-06-15 11:56:00,2.95,16241.0,United Kingdom
556876,47518F,ICON PLACEMAT POP ART ELVIS,9,2011-06-15 11:56:00,0.12,16241.0,United Kingdom
556876,21090,SET/6 COLLAGE PAPER PLATES,2,2011-06-15 11:56:00,0.39,16241.0,United Kingdom
556876,21094,SET/6 RED SPOTTY PAPER PLATES,2,2011-06-15 11:56:00,0.85,16241.0,United Kingdom
556876,21989,PACK OF 20 SKULL PAPER NAPKINS,1,2011-06-15 11:56:00,0.85,16241.0,United Kingdom
556876,22851,SET 20 NAPKINS FAIRY CAKES DESIGN ,1,2011-06-15 11:56:00,0.85,16241.0,United Kingdom
556876,22613,PACK OF 20 SPACEBOY NAPKINS,1,2011-06-15 11:56:00,0.85,16241.0,United Kingdom
556876,22908,PACK OF 20 NAPKINS RED APPLES,1,2011-06-15 11:56:00,0.85,16241.0,United Kingdom
556876,21080,SET/20 RED RETROSPOT PAPER NAPKINS ,1,2011-06-15 11:56:00,0.85,16241.0,United Kingdom
556876,22907,PACK OF 20 NAPKINS PANTRY DESIGN,1,2011-06-15 11:56:00,0.85,16241.0,United Kingdom
556876,21210,SET OF 72 RETROSPOT PAPER  DOILIES,1,2011-06-15 11:56:00,1.45,16241.0,United Kingdom
556876,22416,SET OF 36 DOILIES SPACEBOY DESIGN ,1,2011-06-15 11:56:00,1.45,16241.0,United Kingdom
556876,21084,SET/6 COLLAGE PAPER CUPS,2,2011-06-15 11:56:00,0.19,16241.0,United Kingdom
556876,21086,SET/6 RED SPOTTY PAPER CUPS,2,2011-06-15 11:56:00,0.65,16241.0,United Kingdom
556876,16254,TRANSPARENT ACRYLIC TAPE DISPENSER,1,2011-06-15 11:56:00,0.85,16241.0,United Kingdom
556876,21060,PARTY INVITES BALLOON GIRL,1,2011-06-15 11:56:00,0.85,16241.0,United Kingdom
556876,21062,PARTY INVITES SPACEMAN,1,2011-06-15 11:56:00,0.85,16241.0,United Kingdom
556876,21063,PARTY INVITES JAZZ HEARTS,1,2011-06-15 11:56:00,0.85,16241.0,United Kingdom
556876,21993,FLORAL FOLK STATIONERY SET,1,2011-06-15 11:56:00,1.25,16241.0,United Kingdom
556876,21992,VINTAGE PAISLEY STATIONERY SET,1,2011-06-15 11:56:00,1.25,16241.0,United Kingdom
556876,84836,ZINC METAL HEART DECORATION,2,2011-06-15 11:56:00,1.25,16241.0,United Kingdom
556876,21089,SET/6 GREEN SPRING PAPER CUPS,5,2011-06-15 11:56:00,0.19,16241.0,United Kingdom
556876,10133,COLOURING PENCILS BROWN TUBE,4,2011-06-15 11:56:00,0.42,16241.0,United Kingdom
556876,21132,SILVER STANDING GNOME   ,1,2011-06-15 11:56:00,4.25,16241.0,United Kingdom
556876,85123A,WHITE HANGING HEART T-LIGHT HOLDER,2,2011-06-15 11:56:00,2.95,16241.0,United Kingdom
556876,85183B,CHARLIE & LOLA WASTEPAPER BIN FLORA,1,2011-06-15 11:56:00,1.25,16241.0,United Kingdom
556876,85183A,CHARLIE & LOLA WASTEPAPER BIN BLUE,1,2011-06-15 11:56:00,1.25,16241.0,United Kingdom
556876,21374,MIRRORED WALL ART SKULLS,1,2011-06-15 11:56:00,1.25,16241.0,United Kingdom
556876,23309,SET OF 60 I LOVE LONDON CAKE CASES ,1,2011-06-15 11:56:00,0.55,16241.0,United Kingdom
556876,21212,PACK OF 72 RETROSPOT CAKE CASES,1,2011-06-15 11:56:00,0.55,16241.0,United Kingdom
556876,21977,PACK OF 60 PINK PAISLEY CAKE CASES,1,2011-06-15 11:56:00,0.55,16241.0,United Kingdom
556876,21975,PACK OF 60 DINOSAUR CAKE CASES,1,2011-06-15 11:56:00,0.55,16241.0,United Kingdom
556876,22417,PACK OF 60 SPACEBOY CAKE CASES,1,2011-06-15 11:56:00,0.55,16241.0,United Kingdom
556876,23308,SET OF 60 VINTAGE LEAF CAKE CASES ,1,2011-06-15 11:56:00,0.55,16241.0,United Kingdom
556876,21215,IVORY PAPER CUP CAKE CASES ,1,2011-06-15 11:56:00,0.55,16241.0,United Kingdom
556876,23307,SET OF 60 PANTRY DESIGN CAKE CASES ,2,2011-06-15 11:56:00,0.55,16241.0,United Kingdom
556876,84991,60 TEATIME FAIRY CAKE CASES,1,2011-06-15 11:56:00,0.55,16241.0,United Kingdom
556876,21213,PACK OF 72 SKULL CAKE CASES,2,2011-06-15 11:56:00,0.55,16241.0,United Kingdom
556876,22951,60 CAKE CASES DOLLY GIRL DESIGN,1,2011-06-15 11:56:00,0.55,16241.0,United Kingdom
556876,21976,PACK OF 60 MUSHROOM CAKE CASES,1,2011-06-15 11:56:00,0.55,16241.0,United Kingdom
556876,20974,12 PENCILS SMALL TUBE SKULL,2,2011-06-15 11:56:00,0.65,16241.0,United Kingdom
556876,20973,12 PENCIL SMALL TUBE WOODLAND,2,2011-06-15 11:56:00,0.65,16241.0,United Kingdom
556876,21733,RED HANGING HEART T-LIGHT HOLDER,2,2011-06-15 11:56:00,2.95,16241.0,United Kingdom
556876,47566,PARTY BUNTING,1,2011-06-15 11:56:00,4.95,16241.0,United Kingdom
556876,23298,SPOTTY BUNTING,1,2011-06-15 11:56:00,4.95,16241.0,United Kingdom
556876,23228,FILIGREE HEART BIRD WHITE ,3,2011-06-15 11:56:00,1.25,16241.0,United Kingdom
556876,23263,SET OF 3 WOODEN HEART DECORATIONS,2,2011-06-15 11:56:00,1.25,16241.0,United Kingdom
556876,22383,LUNCH BAG SUKI DESIGN ,1,2011-06-15 11:56:00,1.65,16241.0,United Kingdom
556876,23207,LUNCH BAG ALPHABET DESIGN,1,2011-06-15 11:56:00,1.65,16241.0,United Kingdom
556876,23203,JUMBO BAG DOILEY PATTERNS,1,2011-06-15 11:56:00,2.08,16241.0,United Kingdom
556876,22386,JUMBO BAG PINK POLKADOT,1,2011-06-15 11:56:00,2.08,16241.0,United Kingdom
556876,21929,JUMBO BAG PINK VINTAGE PAISLEY,1,2011-06-15 11:56:00,2.08,16241.0,United Kingdom
556876,22411,JUMBO SHOPPER VINTAGE RED PAISLEY,1,2011-06-15 11:56:00,2.08,16241.0,United Kingdom
556876,22385,JUMBO BAG SPACEBOY DESIGN,1,2011-06-15 11:56:00,2.08,16241.0,United Kingdom
556876,23202,JUMBO BAG VINTAGE LEAF,1,2011-06-15 11:56:00,2.08,16241.0,United Kingdom
556876,20711,JUMBO BAG TOYS ,1,2011-06-15 11:56:00,2.08,16241.0,United Kingdom
556876,22662,LUNCH BAG DOLLY GIRL DESIGN,1,2011-06-15 11:56:00,1.65,16241.0,United Kingdom
556876,20726,LUNCH BAG WOODLAND,1,2011-06-15 11:56:00,1.65,16241.0,United Kingdom
556876,22382,LUNCH BAG SPACEBOY DESIGN ,1,2011-06-15 11:56:00,1.65,16241.0,United Kingdom
556876,20727,LUNCH BAG  BLACK SKULL.,1,2011-06-15 11:56:00,1.65,16241.0,United Kingdom
556876,20725,LUNCH BAG RED RETROSPOT,1,2011-06-15 11:56:00,1.65,16241.0,United Kingdom
556876,22384,LUNCH BAG PINK POLKADOT,1,2011-06-15 11:56:00,1.65,16241.0,United Kingdom
556876,23208,LUNCH BAG VINTAGE LEAF DESIGN,1,2011-06-15 11:56:00,1.65,16241.0,United Kingdom
556876,23284,DOORMAT KEEP CALM AND COME IN,1,2011-06-15 11:56:00,7.95,16241.0,United Kingdom
C556877,D,Discount,-1,2011-06-15 12:00:00,129.9,15498.0,United Kingdom
556878,22636,CHILDS BREAKFAST SET CIRCUS PARADE,2,2011-06-15 12:01:00,8.5,15574.0,United Kingdom
556878,23170,REGENCY TEA PLATE ROSES ,1,2011-06-15 12:01:00,1.65,15574.0,United Kingdom
556878,47566,PARTY BUNTING,4,2011-06-15 12:01:00,4.95,15574.0,United Kingdom
556878,22088,PAPER BUNTING COLOURED LACE,6,2011-06-15 12:01:00,2.95,15574.0,United Kingdom
556878,22640,SET OF 4 NAPKIN CHARMS 3 KEYS ,1,2011-06-15 12:01:00,2.55,15574.0,United Kingdom
556878,21121,SET/10 RED POLKADOT PARTY CANDLES,2,2011-06-15 12:01:00,1.25,15574.0,United Kingdom
556878,22178,VICTORIAN GLASS HANGING T-LIGHT,12,2011-06-15 12:01:00,1.25,15574.0,United Kingdom
556878,84755,COLOUR GLASS T-LIGHT HOLDER HANGING,16,2011-06-15 12:01:00,0.65,15574.0,United Kingdom
556878,22423,REGENCY CAKESTAND 3 TIER,2,2011-06-15 12:01:00,12.75,15574.0,United Kingdom
556879,22501,PICNIC BASKET WICKER LARGE,1,2011-06-15 12:07:00,9.95,16461.0,United Kingdom
556879,22606,WOODEN SKITTLES GARDEN SET,1,2011-06-15 12:07:00,15.95,16461.0,United Kingdom
556879,22623,BOX OF VINTAGE JIGSAW BLOCKS ,1,2011-06-15 12:07:00,5.95,16461.0,United Kingdom
556879,22745,POPPY'S PLAYHOUSE BEDROOM ,1,2011-06-15 12:07:00,2.1,16461.0,United Kingdom
556879,22747,POPPY'S PLAYHOUSE BATHROOM,1,2011-06-15 12:07:00,2.1,16461.0,United Kingdom
556879,22748,POPPY'S PLAYHOUSE KITCHEN,1,2011-06-15 12:07:00,2.1,16461.0,United Kingdom
556879,22746,POPPY'S PLAYHOUSE LIVINGROOM ,1,2011-06-15 12:07:00,2.1,16461.0,United Kingdom
556879,85178,VICTORIAN SEWING KIT,1,2011-06-15 12:07:00,1.25,16461.0,United Kingdom
556879,22440,BALLOON WATER BOMB PACK OF 35,10,2011-06-15 12:07:00,0.42,16461.0,United Kingdom
556879,22652,TRAVEL SEWING KIT,1,2011-06-15 12:07:00,1.65,16461.0,United Kingdom
556879,20735,BLACK MINI TAPE MEASURE ,1,2011-06-15 12:07:00,0.85,16461.0,United Kingdom
556879,37475,SET/4 COLOURFUL MIXING BOWLS,1,2011-06-15 12:07:00,9.95,16461.0,United Kingdom
556879,22743,MAKE YOUR OWN FLOWERPOWER CARD KIT,1,2011-06-15 12:07:00,2.95,16461.0,United Kingdom
556879,21621,VINTAGE UNION JACK BUNTING,1,2011-06-15 12:07:00,8.5,16461.0,United Kingdom
556879,35653,VINTAGE BEAD NOTEBOOK,1,2011-06-15 12:07:00,2.95,16461.0,United Kingdom
556879,20781,GOLD EAR MUFF HEADPHONES,1,2011-06-15 12:07:00,5.49,16461.0,United Kingdom
556879,22561,WOODEN SCHOOL COLOURING SET,1,2011-06-15 12:07:00,1.65,16461.0,United Kingdom
556879,22622,BOX OF VINTAGE ALPHABET BLOCKS,1,2011-06-15 12:07:00,11.95,16461.0,United Kingdom
556879,22084,PAPER CHAIN KIT EMPIRE,1,2011-06-15 12:07:00,2.95,16461.0,United Kingdom
556879,22083,PAPER CHAIN KIT RETROSPOT,1,2011-06-15 12:07:00,2.95,16461.0,United Kingdom
556879,22493,PAINT YOUR OWN CANVAS SET,2,2011-06-15 12:07:00,1.65,16461.0,United Kingdom
556879,21059,PARTY INVITES DINOSAURS,1,2011-06-15 12:07:00,0.85,16461.0,United Kingdom
556879,22991,GIRAFFE WOODEN RULER,2,2011-06-15 12:07:00,1.95,16461.0,United Kingdom
556879,22560,TRADITIONAL MODELLING CLAY,1,2011-06-15 12:07:00,1.25,16461.0,United Kingdom
556879,21248,DOOR HANGER  MUM + DADS ROOM,1,2011-06-15 12:07:00,1.45,16461.0,United Kingdom
556879,84925D,LA PALMIERA WALL THERMOMETER,1,2011-06-15 12:07:00,2.55,16461.0,United Kingdom
556879,21713,CITRONELLA CANDLE FLOWERPOT,4,2011-06-15 12:07:00,2.1,16461.0,United Kingdom
556879,23241,TREASURE TIN GYMKHANA DESIGN,1,2011-06-15 12:07:00,2.08,16461.0,United Kingdom
556879,21621,VINTAGE UNION JACK BUNTING,1,2011-06-15 12:07:00,8.5,16461.0,United Kingdom
556879,22113,GREY HEART HOT WATER BOTTLE,1,2011-06-15 12:07:00,3.75,16461.0,United Kingdom
556879,22493,PAINT YOUR OWN CANVAS SET,3,2011-06-15 12:07:00,1.65,16461.0,United Kingdom
556879,84563B,BLUE & WHITE BREAKFAST TRAY,1,2011-06-15 12:07:00,2.95,16461.0,United Kingdom
556879,37449,CERAMIC CAKE STAND + HANGING CAKES,1,2011-06-15 12:07:00,9.95,16461.0,United Kingdom
C556880,23172,REGENCY TEA PLATE PINK,-1,2011-06-15 12:12:00,1.65,18073.0,United Kingdom
C556880,22697,GREEN REGENCY TEACUP AND SAUCER,-1,2011-06-15 12:12:00,2.95,18073.0,United Kingdom
C556880,84946,ANTIQUE SILVER T-LIGHT GLASS,-8,2011-06-15 12:12:00,1.06,18073.0,United Kingdom
556881,21584,RETROSPOT SMALL TUBE MATCHES,20,2011-06-15 12:15:00,1.45,17389.0,United Kingdom
556881,22207,FRYING PAN UNION FLAG,6,2011-06-15 12:15:00,3.75,17389.0,United Kingdom
556881,21588,RETROSPOT GIANT TUBE MATCHES,12,2011-06-15 12:15:00,2.1,17389.0,United Kingdom
556881,21586,KINGS CHOICE GIANT TUBE MATCHES,12,2011-06-15 12:15:00,2.1,17389.0,United Kingdom
556881,85066,CREAM SWEETHEART MINI CHEST,6,2011-06-15 12:15:00,10.95,17389.0,United Kingdom
556881,22760,"TRAY, BREAKFAST IN BED",6,2011-06-15 12:15:00,12.75,17389.0,United Kingdom
556881,84970L,SINGLE HEART ZINC T-LIGHT HOLDER,24,2011-06-15 12:15:00,0.79,17389.0,United Kingdom
556882,82483,WOOD 2 DRAWER CABINET WHITE FINISH,2,2011-06-15 12:21:00,6.95,14395.0,United Kingdom
556882,84755,COLOUR GLASS T-LIGHT HOLDER HANGING,16,2011-06-15 12:21:00,0.65,14395.0,United Kingdom
556882,82483,WOOD 2 DRAWER CABINET WHITE FINISH,2,2011-06-15 12:21:00,6.95,14395.0,United Kingdom
556882,22435,SET OF 9 HEART SHAPED BALLOONS,1,2011-06-15 12:21:00,1.25,14395.0,United Kingdom
556882,84880,WHITE WIRE EGG HOLDER,2,2011-06-15 12:21:00,7.5,14395.0,United Kingdom
556882,22507,MEMO BOARD RETROSPOT  DESIGN,4,2011-06-15 12:21:00,4.95,14395.0,United Kingdom
556882,22505,MEMO BOARD COTTAGE DESIGN,4,2011-06-15 12:21:00,4.95,14395.0,United Kingdom
556882,22804,CANDLEHOLDER PINK HANGING HEART,3,2011-06-15 12:21:00,2.95,14395.0,United Kingdom
556882,21733,RED HANGING HEART T-LIGHT HOLDER,3,2011-06-15 12:21:00,2.95,14395.0,United Kingdom
556882,47566,PARTY BUNTING,9,2011-06-15 12:21:00,4.95,14395.0,United Kingdom
556882,21059,PARTY INVITES DINOSAURS,3,2011-06-15 12:21:00,0.85,14395.0,United Kingdom
556882,21060,PARTY INVITES BALLOON GIRL,3,2011-06-15 12:21:00,0.85,14395.0,United Kingdom
556882,22435,SET OF 9 HEART SHAPED BALLOONS,5,2011-06-15 12:21:00,1.25,14395.0,United Kingdom
556882,21166,COOK WITH WINE METAL SIGN ,8,2011-06-15 12:21:00,2.08,14395.0,United Kingdom
556882,21174,POTTERING IN THE SHED METAL SIGN,4,2011-06-15 12:21:00,2.08,14395.0,United Kingdom
556882,82582,AREA PATROLLED METAL SIGN,6,2011-06-15 12:21:00,2.1,14395.0,United Kingdom
556882,85152,HAND OVER THE CHOCOLATE   SIGN ,6,2011-06-15 12:21:00,2.1,14395.0,United Kingdom
556882,82578,KITCHEN METAL SIGN,4,2011-06-15 12:21:00,0.55,14395.0,United Kingdom
556882,82580,BATHROOM METAL SIGN,4,2011-06-15 12:21:00,0.55,14395.0,United Kingdom
556882,82581,TOILET METAL SIGN,2,2011-06-15 12:21:00,0.55,14395.0,United Kingdom
556882,21328,BALLOONS  WRITING SET ,4,2011-06-15 12:21:00,1.65,14395.0,United Kingdom
556882,84692,BOX OF 24 COCKTAIL PARASOLS,2,2011-06-15 12:21:00,0.42,14395.0,United Kingdom
556882,20759,CHRYSANTHEMUM POCKET BOOK ,3,2011-06-15 12:21:00,0.85,14395.0,United Kingdom
556882,20758,ABSTRACT CIRCLES POCKET BOOK,3,2011-06-15 12:21:00,0.85,14395.0,United Kingdom
556882,20760,GARDEN PATH POCKET BOOK,3,2011-06-15 12:21:00,0.85,14395.0,United Kingdom
556882,21990,MODERN FLORAL STATIONERY SET,3,2011-06-15 12:21:00,1.25,14395.0,United Kingdom
556882,23321,SMALL WHITE HEART OF WICKER,4,2011-06-15 12:21:00,1.65,14395.0,United Kingdom
556882,20702,PINK PADDED MOBILE,4,2011-06-15 12:21:00,4.25,14395.0,United Kingdom
556882,23298,SPOTTY BUNTING,4,2011-06-15 12:21:00,4.95,14395.0,United Kingdom
556882,16235,RECYCLED PENCIL WITH RABBIT ERASER,8,2011-06-15 12:21:00,0.21,14395.0,United Kingdom
556882,22469,HEART OF WICKER SMALL,5,2011-06-15 12:21:00,1.65,14395.0,United Kingdom
556882,22470,HEART OF WICKER LARGE,7,2011-06-15 12:21:00,2.95,14395.0,United Kingdom
556882,22112,CHOCOLATE HOT WATER BOTTLE,1,2011-06-15 12:21:00,4.95,14395.0,United Kingdom
556882,21485,RETROSPOT HEART HOT WATER BOTTLE,2,2011-06-15 12:21:00,4.95,14395.0,United Kingdom
556882,22835,HOT WATER BOTTLE I AM SO POORLY,2,2011-06-15 12:21:00,4.65,14395.0,United Kingdom
556883,22939,APRON APPLE DELIGHT,4,2011-06-15 12:24:00,4.95,13343.0,United Kingdom
556883,22898,CHILDRENS APRON APPLES DESIGN,8,2011-06-15 12:24:00,1.95,13343.0,United Kingdom
556883,23200,JUMBO BAG PEARS,10,2011-06-15 12:24:00,2.08,13343.0,United Kingdom
556883,21033,JUMBO BAG CHARLIE AND LOLA TOYS,10,2011-06-15 12:24:00,2.08,13343.0,United Kingdom
556883,22531,MAGIC DRAWING SLATE CIRCUS PARADE  ,24,2011-06-15 12:24:00,0.42,13343.0,United Kingdom
556883,22427,ENAMEL FLOWER JUG CREAM,3,2011-06-15 12:24:00,5.95,13343.0,United Kingdom
556883,22430,ENAMEL WATERING CAN CREAM,4,2011-06-15 12:24:00,4.95,13343.0,United Kingdom
556883,23094,LE GRAND TRAY CHIC SET,1,2011-06-15 12:24:00,12.5,13343.0,United Kingdom
556883,20794,BLUE  TILE HOOK,8,2011-06-15 12:24:00,2.55,13343.0,United Kingdom
556883,23118,PARISIENNE JEWELLERY DRAWER ,2,2011-06-15 12:24:00,7.5,13343.0,United Kingdom
556883,23165,LARGE CERAMIC TOP STORAGE JAR,12,2011-06-15 12:24:00,1.65,13343.0,United Kingdom
556883,23209,LUNCH BAG DOILEY PATTERN ,10,2011-06-15 12:24:00,1.65,13343.0,United Kingdom
556883,22279,POCKET BAG BLUE PAISLEY RED SPOT,12,2011-06-15 12:24:00,1.25,13343.0,United Kingdom
556883,22960,JAM MAKING SET WITH JARS,6,2011-06-15 12:24:00,4.25,13343.0,United Kingdom
556883,22372,AIRLINE BAG VINTAGE WORLD CHAMPION ,4,2011-06-15 12:24:00,4.25,13343.0,United Kingdom
556883,22371,AIRLINE BAG VINTAGE TOKYO 78,4,2011-06-15 12:24:00,4.25,13343.0,United Kingdom
556883,20719,WOODLAND CHARLOTTE BAG,10,2011-06-15 12:24:00,0.85,13343.0,United Kingdom
556883,23110,PARISIENNE KEY CABINET ,2,2011-06-15 12:24:00,5.75,13343.0,United Kingdom
556883,C2,CARRIAGE,1,2011-06-15 12:24:00,50.0,13343.0,United Kingdom
556884,22698,,-61,2011-06-15 12:27:00,0.0,,United Kingdom
556885,22698,PINK REGENCY TEACUP AND SAUCER,6,2011-06-15 12:32:00,2.95,18073.0,United Kingdom
556886,21094,SET/6 RED SPOTTY PAPER PLATES,12,2011-06-15 12:34:00,0.85,12624.0,France
556886,15058A,BLUE POLKADOT GARDEN PARASOL,2,2011-06-15 12:34:00,7.95,12624.0,France
556886,15058C,ICE CREAM DESIGN GARDEN PARASOL,2,2011-06-15 12:34:00,7.95,12624.0,France
556886,15058B,PINK POLKADOT GARDEN PARASOL,2,2011-06-15 12:34:00,7.95,12624.0,France
556886,22138,BAKING SET 9 PIECE RETROSPOT ,3,2011-06-15 12:34:00,4.95,12624.0,France
556886,21703,BAG 125g SWIRLY MARBLES,12,2011-06-15 12:34:00,0.42,12624.0,France
556886,22620,4 TRADITIONAL SPINNING TOPS,12,2011-06-15 12:34:00,1.45,12624.0,France
556886,20979,36 PENCILS TUBE RED RETROSPOT,16,2011-06-15 12:34:00,1.25,12624.0,France
556886,20977,36 PENCILS TUBE WOODLAND,16,2011-06-15 12:34:00,1.25,12624.0,France
556886,84535B,FAIRY CAKES NOTEBOOK A6 SIZE,16,2011-06-15 12:34:00,0.65,12624.0,France
556886,21212,PACK OF 72 RETROSPOT CAKE CASES,24,2011-06-15 12:34:00,0.55,12624.0,France
556886,21976,PACK OF 60 MUSHROOM CAKE CASES,24,2011-06-15 12:34:00,0.55,12624.0,France
556886,84828,JUNGLE POPSICLES ICE LOLLY MOULDS,24,2011-06-15 12:34:00,1.25,12624.0,France
556886,21078,SET/20 STRAWBERRY PAPER NAPKINS ,12,2011-06-15 12:34:00,0.85,12624.0,France
556886,21080,SET/20 RED RETROSPOT PAPER NAPKINS ,12,2011-06-15 12:34:00,0.85,12624.0,France
556886,21086,SET/6 RED SPOTTY PAPER CUPS,12,2011-06-15 12:34:00,0.65,12624.0,France
556886,20749,ASSORTED COLOUR MINI CASES,2,2011-06-15 12:34:00,7.95,12624.0,France
556886,22320,BIRDS MOBILE VINTAGE DESIGN,3,2011-06-15 12:34:00,5.95,12624.0,France
556886,POST,POSTAGE,2,2011-06-15 12:34:00,18.0,12624.0,France
556887,21770,OPEN CLOSED METAL SIGN,1,2011-06-15 12:36:00,4.95,14606.0,United Kingdom
556887,21948,SET OF 6 CAKE CHOPSTICKS,1,2011-06-15 12:36:00,1.25,14606.0,United Kingdom
556887,22153,ANGEL DECORATION STARS ON DRESS,1,2011-06-15 12:36:00,0.42,14606.0,United Kingdom
556887,84212,"ASSORTED FLOWER COLOUR ""LEIS""",60,2011-06-15 12:36:00,0.65,14606.0,United Kingdom
556887,85099B,JUMBO BAG RED RETROSPOT,2,2011-06-15 12:36:00,2.08,14606.0,United Kingdom
556887,22386,JUMBO BAG PINK POLKADOT,2,2011-06-15 12:36:00,2.08,14606.0,United Kingdom
556887,22381,TOY TIDY PINK POLKADOT,1,2011-06-15 12:36:00,2.1,14606.0,United Kingdom
