InvoiceNo,StockCode,Description,Quantity,InvoiceDate,UnitPrice,CustomerID,Country
580516,22577,WOODEN HEART CHRISTMAS SCANDINAVIAN,11,2011-12-04 14:15:00,0.29,17954.0,United Kingdom
580516,22578,WOODEN STAR CHRISTMAS SCANDINAVIAN,10,2011-12-04 14:15:00,0.29,17954.0,United Kingdom
580516,22601,CHRISTMAS RETROSPOT ANGEL WOOD,6,2011-12-04 14:15:00,0.85,17954.0,United Kingdom
580516,23100,SILVER BELLS TABLE DECORATION,2,2011-12-04 14:15:00,1.25,17954.0,United Kingdom
580516,23275,SET OF 3 HANGING OWLS OLLIE BEAK,3,2011-12-04 14:15:00,1.25,17954.0,United Kingdom
580516,23264,SET OF 3 WOODEN SLEIGH DECORATIONS,4,2011-12-04 14:15:00,1.25,17954.0,United Kingdom
580516,23263,SET OF 3 WOODEN HEART DECORATIONS,3,2011-12-04 14:15:00,1.25,17954.0,United Kingdom
580516,23378,PACK OF 12 50'S CHRISTMAS TISSUES,24,2011-12-04 14:15:00,0.39,17954.0,United Kingdom
580516,21063,PARTY INVITES JAZZ HEARTS,2,2011-12-04 14:15:00,0.85,17954.0,United Kingdom
580516,21060,PARTY INVITES BALLOON GIRL,2,2011-12-04 14:15:00,0.85,17954.0,United Kingdom
580516,21059,PARTY INVITES DINOSAURS,2,2011-12-04 14:15:00,0.85,17954.0,United Kingdom
580516,21061,PARTY INVITES FOOTBALL,2,2011-12-04 14:15:00,0.85,17954.0,United Kingdom
580516,21058,PARTY INVITES WOODLAND,2,2011-12-04 14:15:00,0.85,17954.0,United Kingdom
580516,51014L,"FEATHER PEN,LIGHT PINK",12,2011-12-04 14:15:00,0.39,17954.0,United Kingdom
580516,51014C,"FEATHER PEN,COAL BLACK",12,2011-12-04 14:15:00,0.39,17954.0,United Kingdom
580516,51014A,"FEATHER PEN,HOT PINK",12,2011-12-04 14:15:00,0.39,17954.0,United Kingdom
580516,23598,PAPER BUNTING VINTAGE PARTY,1,2011-12-04 14:15:00,2.95,17954.0,United Kingdom
580516,22090,PAPER BUNTING RETROSPOT,1,2011-12-04 14:15:00,2.95,17954.0,United Kingdom
580516,22090,PAPER BUNTING RETROSPOT,1,2011-12-04 14:15:00,2.95,17954.0,United Kingdom
580516,23597,PAPER BUNTING PAISLEY PARK,1,2011-12-04 14:15:00,2.95,17954.0,United Kingdom
580516,23597,PAPER BUNTING PAISLEY PARK,1,2011-12-04 14:15:00,2.95,17954.0,United Kingdom
580516,23598,PAPER BUNTING VINTAGE PARTY,1,2011-12-04 14:15:00,2.95,17954.0,United Kingdom
580516,21822,GLITTER CHRISTMAS TREE WITH BELLS,6,2011-12-04 14:15:00,0.79,17954.0,United Kingdom
580516,22086,PAPER CHAIN KIT 50'S CHRISTMAS ,5,2011-12-04 14:15:00,2.95,17954.0,United Kingdom
580516,22942,CHRISTMAS LIGHTS 10 SANTAS ,3,2011-12-04 14:15:00,2.95,17954.0,United Kingdom
580516,23354,6 GIFT TAGS 50'S CHRISTMAS ,6,2011-12-04 14:15:00,0.83,17954.0,United Kingdom
580516,23353,6 GIFT TAGS VINTAGE CHRISTMAS ,6,2011-12-04 14:15:00,0.83,17954.0,United Kingdom
580516,22329,ROUND CONTAINER SET OF 5 RETROSPOT,1,2011-12-04 14:15:00,1.65,17954.0,United Kingdom
580516,22139,RETROSPOT TEA SET CERAMIC 11 PC ,1,2011-12-04 14:15:00,4.95,17954.0,United Kingdom
580516,22327,ROUND SNACK BOXES SET OF 4 SKULLS,2,2011-12-04 14:15:00,2.95,17954.0,United Kingdom
580516,22316,200 BENDY SKULL STRAWS,2,2011-12-04 14:15:00,1.25,17954.0,United Kingdom
580516,22732,3D VINTAGE CHRISTMAS STICKERS ,4,2011-12-04 14:15:00,1.25,17954.0,United Kingdom
580516,22733,3D TRADITIONAL CHRISTMAS STICKERS,3,2011-12-04 14:15:00,1.25,17954.0,United Kingdom
580516,22731,3D CHRISTMAS STAMPS STICKERS ,3,2011-12-04 14:15:00,1.25,17954.0,United Kingdom
580516,22940,FELTCRAFT CHRISTMAS FAIRY,3,2011-12-04 14:15:00,4.25,17954.0,United Kingdom
580516,22141,CHRISTMAS CRAFT TREE TOP ANGEL,2,2011-12-04 14:15:00,2.1,17954.0,United Kingdom
580516,21818,GLITTER HEART DECORATION,6,2011-12-04 14:15:00,0.39,17954.0,United Kingdom
580516,21819,GLITTER CHRISTMAS STAR ,6,2011-12-04 14:15:00,0.39,17954.0,United Kingdom
580516,23505,PLAYING CARDS I LOVE LONDON ,1,2011-12-04 14:15:00,1.25,17954.0,United Kingdom
580516,23504,PLAYING CARDS JUBILEE UNION JACK,1,2011-12-04 14:15:00,1.25,17954.0,United Kingdom
580516,23503,PLAYING CARDS KEEP CALM & CARRY ON,2,2011-12-04 14:15:00,1.25,17954.0,United Kingdom
580516,21889,WOODEN BOX OF DOMINOES,3,2011-12-04 14:15:00,1.25,17954.0,United Kingdom
580516,21012,ANTIQUE ALL GLASS CANDLESTICK,4,2011-12-04 14:15:00,2.1,17954.0,United Kingdom
580516,21912,VINTAGE SNAKES & LADDERS,2,2011-12-04 14:15:00,3.75,17954.0,United Kingdom
580516,22151,PLACE SETTING WHITE HEART,24,2011-12-04 14:15:00,0.42,17954.0,United Kingdom
580516,21619,4 VANILLA BOTANICAL CANDLES,6,2011-12-04 14:15:00,1.25,17954.0,United Kingdom
580516,21620,SET OF 4 ROSE BOTANICAL CANDLES,6,2011-12-04 14:15:00,1.25,17954.0,United Kingdom
580516,21284,RETROSPOT CANDLE  SMALL,12,2011-12-04 14:15:00,0.39,17954.0,United Kingdom
580516,22550,HOLIDAY FUN LUDO,2,2011-12-04 14:15:00,3.75,17954.0,United Kingdom
580516,23229,VINTAGE DONKEY TAIL GAME ,2,2011-12-04 14:15:00,3.75,17954.0,United Kingdom
580516,22623,BOX OF VINTAGE JIGSAW BLOCKS ,2,2011-12-04 14:15:00,5.95,17954.0,United Kingdom
580516,21888,BINGO SET,1,2011-12-04 14:15:00,3.75,17954.0,United Kingdom
580516,23569,TRADTIONAL ALPHABET STAMP SET,2,2011-12-04 14:15:00,4.95,17954.0,United Kingdom
580516,21914,BLUE HARMONICA IN BOX ,4,2011-12-04 14:15:00,1.25,17954.0,United Kingdom
580516,21822,GLITTER CHRISTMAS TREE WITH BELLS,6,2011-12-04 14:15:00,0.79,17954.0,United Kingdom
580516,22647,CERAMIC LOVE HEART MONEY BANK,3,2011-12-04 14:15:00,0.39,17954.0,United Kingdom
580516,22644,CERAMIC CHERRY CAKE MONEY BANK,2,2011-12-04 14:15:00,0.39,17954.0,United Kingdom
580516,22645,CERAMIC HEART FAIRY CAKE MONEY BANK,1,2011-12-04 14:15:00,0.39,17954.0,United Kingdom
580516,22646,CERAMIC STRAWBERRY CAKE MONEY BANK,1,2011-12-04 14:15:00,0.39,17954.0,United Kingdom
580517,22273,FELTCRAFT DOLL MOLLY,12,2011-12-04 14:40:00,2.95,17173.0,United Kingdom
580517,22274,FELTCRAFT DOLL EMILY,12,2011-12-04 14:40:00,2.95,17173.0,United Kingdom
580517,22150,3 STRIPEY MICE FELTCRAFT,12,2011-12-04 14:40:00,1.95,17173.0,United Kingdom
580517,22144,CHRISTMAS CRAFT LITTLE FRIENDS,12,2011-12-04 14:40:00,2.1,17173.0,United Kingdom
580517,22142,CHRISTMAS CRAFT WHITE FAIRY ,12,2011-12-04 14:40:00,1.45,17173.0,United Kingdom
580517,22141,CHRISTMAS CRAFT TREE TOP ANGEL,12,2011-12-04 14:40:00,2.1,17173.0,United Kingdom
580517,20972,PINK CREAM FELT CRAFT TRINKET BOX ,24,2011-12-04 14:40:00,1.25,17173.0,United Kingdom
580517,20971,PINK BLUE FELT CRAFT TRINKET BOX,24,2011-12-04 14:40:00,1.25,17173.0,United Kingdom
580517,20970,PINK FLORAL FELTCRAFT SHOULDER BAG,8,2011-12-04 14:40:00,3.75,17173.0,United Kingdom
580517,20969,RED FLORAL FELTCRAFT SHOULDER BAG,8,2011-12-04 14:40:00,3.75,17173.0,United Kingdom
580517,22940,FELTCRAFT CHRISTMAS FAIRY,12,2011-12-04 14:40:00,3.75,17173.0,United Kingdom
580517,22795,SWEETHEART RECIPE BOOK STAND,16,2011-12-04 14:40:00,5.95,17173.0,United Kingdom
580517,22751,FELTCRAFT PRINCESS OLIVIA DOLL,12,2011-12-04 14:40:00,3.75,17173.0,United Kingdom
580517,22750,FELTCRAFT PRINCESS LOLA DOLL,12,2011-12-04 14:40:00,3.75,17173.0,United Kingdom
580517,22749,FELTCRAFT PRINCESS CHARLOTTE DOLL,12,2011-12-04 14:40:00,3.75,17173.0,United Kingdom
580518,23188,VINTAGE  2 METRE FOLDING RULER,24,2011-12-04 14:45:00,1.65,13435.0,United Kingdom
580518,23022,SMALL BONNE JAM JAR  T-LIGHT HOLDER,24,2011-12-04 14:45:00,2.08,13435.0,United Kingdom
580518,22457,NATURAL SLATE HEART CHALKBOARD ,24,2011-12-04 14:45:00,2.95,13435.0,United Kingdom
580518,21846,PINK DIAMANTE PEN IN GIFT BOX,1,2011-12-04 14:45:00,4.95,13435.0,United Kingdom
580518,21850,BLUE  DIAMANTE PEN IN GIFT BOX,1,2011-12-04 14:45:00,4.95,13435.0,United Kingdom
580518,21849,SILVER DIAMANTE PEN IN GIFT BOX,3,2011-12-04 14:45:00,4.95,13435.0,United Kingdom
580518,23130,MISTLETOE HEART WREATH GREEN,7,2011-12-04 14:45:00,4.15,13435.0,United Kingdom
580518,21313,GLASS HEART T-LIGHT HOLDER ,24,2011-12-04 14:45:00,0.85,13435.0,United Kingdom
580518,20668,DISCO BALL CHRISTMAS DECORATION,96,2011-12-04 14:45:00,0.12,13435.0,United Kingdom
580518,84832,ZINC WILLIE WINKIE  CANDLE STICK,24,2011-12-04 14:45:00,0.85,13435.0,United Kingdom
580518,23169,CLASSIC GLASS COOKIE JAR,18,2011-12-04 14:45:00,3.75,13435.0,United Kingdom
580518,23188,VINTAGE  2 METRE FOLDING RULER,12,2011-12-04 14:45:00,1.65,13435.0,United Kingdom
580518,22481,BLACK TEA TOWEL CLASSIC DESIGN,24,2011-12-04 14:45:00,0.39,13435.0,United Kingdom
580518,21463,MIRRORED DISCO BALL ,16,2011-12-04 14:45:00,4.95,13435.0,United Kingdom
580519,20719,WOODLAND CHARLOTTE BAG,72,2011-12-04 14:51:00,2.46,,United Kingdom
580519,20723,STRAWBERRY CHARLOTTE BAG,50,2011-12-04 14:51:00,2.46,,United Kingdom
580519,20724,RED RETROSPOT CHARLOTTE BAG,91,2011-12-04 14:51:00,2.46,,United Kingdom
580519,20725,LUNCH BAG RED RETROSPOT,7,2011-12-04 14:51:00,4.96,,United Kingdom
580519,20727,LUNCH BAG  BLACK SKULL.,13,2011-12-04 14:51:00,4.96,,United Kingdom
580519,21154,RED RETROSPOT OVEN GLOVE ,12,2011-12-04 14:51:00,3.29,,United Kingdom
580519,21212,PACK OF 72 RETROSPOT CAKE CASES,23,2011-12-04 14:51:00,2.08,,United Kingdom
580519,21212,PACK OF 72 RETROSPOT CAKE CASES,1,2011-12-04 14:51:00,5.0,,United Kingdom
580519,21238,RED RETROSPOT CUP,1,2011-12-04 14:51:00,1.63,,United Kingdom
580519,21243,PINK POLKADOT PLATE ,1,2011-12-04 14:51:00,3.29,,United Kingdom
580519,21381,MINI WOODEN HAPPY BIRTHDAY GARLAND,1,2011-12-04 14:51:00,4.13,,United Kingdom
580519,21479,WHITE SKULL HOT WATER BOTTLE ,22,2011-12-04 14:51:00,9.13,,United Kingdom
580519,21484,CHICK GREY HOT WATER BOTTLE,3,2011-12-04 14:51:00,9.13,,United Kingdom
580519,21668,RED STRIPE CERAMIC DRAWER KNOB,1,2011-12-04 14:51:00,3.29,,United Kingdom
580519,21672,WHITE SPOT RED CERAMIC DRAWER KNOB,2,2011-12-04 14:51:00,7.5,,United Kingdom
580519,22086,PAPER CHAIN KIT 50'S CHRISTMAS ,1,2011-12-04 14:51:00,6.63,,United Kingdom
580519,22110,BIRD HOUSE HOT WATER BOTTLE,6,2011-12-04 14:51:00,5.79,,United Kingdom
580519,22111,SCOTTIE DOG HOT WATER BOTTLE,2,2011-12-04 14:51:00,12.46,,United Kingdom
580519,22112,CHOCOLATE HOT WATER BOTTLE,16,2011-12-04 14:51:00,12.46,,United Kingdom
580519,22197,POPCORN HOLDER,64,2011-12-04 14:51:00,2.46,,United Kingdom
580519,22355,CHARLOTTE BAG SUKI DESIGN,177,2011-12-04 14:51:00,2.46,,United Kingdom
580519,22356,CHARLOTTE BAG PINK POLKADOT,28,2011-12-04 14:51:00,2.46,,United Kingdom
580519,22383,LUNCH BAG SUKI DESIGN ,3,2011-12-04 14:51:00,4.96,,United Kingdom
580519,22423,REGENCY CAKESTAND 3 TIER,10,2011-12-04 14:51:00,24.96,,United Kingdom
580519,22426,ENAMEL WASH BOWL CREAM,1,2011-12-04 14:51:00,8.29,,United Kingdom
580519,22631,CIRCUS PARADE LUNCH BOX ,1,2011-12-04 14:51:00,4.96,,United Kingdom
580519,22725,ALARM CLOCK BAKELIKE CHOCOLATE,4,2011-12-04 14:51:00,8.29,,United Kingdom
580519,22726,ALARM CLOCK BAKELIKE GREEN,10,2011-12-04 14:51:00,8.29,,United Kingdom
580519,22727,ALARM CLOCK BAKELIKE RED ,13,2011-12-04 14:51:00,8.29,,United Kingdom
580519,22729,ALARM CLOCK BAKELIKE ORANGE,1,2011-12-04 14:51:00,8.29,,United Kingdom
580519,22730,ALARM CLOCK BAKELIKE IVORY,3,2011-12-04 14:51:00,8.29,,United Kingdom
580519,22735,RIBBON REEL SOCKS AND MITTENS,1,2011-12-04 14:51:00,4.13,,United Kingdom
580519,22735,RIBBON REEL SOCKS AND MITTENS,1,2011-12-04 14:51:00,7.5,,United Kingdom
580519,22736,RIBBON REEL MAKING SNOWMEN ,4,2011-12-04 14:51:00,4.13,,United Kingdom
580519,22738,RIBBON REEL SNOWY VILLAGE,3,2011-12-04 14:51:00,4.13,,United Kingdom
580519,22745,POPPY'S PLAYHOUSE BEDROOM ,1,2011-12-04 14:51:00,3.29,,United Kingdom
580519,22746,POPPY'S PLAYHOUSE LIVINGROOM ,1,2011-12-04 14:51:00,3.29,,United Kingdom
580519,22747,POPPY'S PLAYHOUSE BATHROOM,1,2011-12-04 14:51:00,3.29,,United Kingdom
580519,22772,PINK DRAWER KNOB ACRYLIC EDWARDIAN,4,2011-12-04 14:51:00,3.29,,United Kingdom
580519,22834,HAND WARMER BABUSHKA DESIGN,1,2011-12-04 14:51:00,4.96,,United Kingdom
580519,22835,HOT WATER BOTTLE I AM SO POORLY,4,2011-12-04 14:51:00,12.46,,United Kingdom
580519,22896,PEG BAG APPLES DESIGN,1,2011-12-04 14:51:00,5.79,,United Kingdom
580519,22898,CHILDRENS APRON APPLES DESIGN,8,2011-12-04 14:51:00,4.96,,United Kingdom
580519,22910,PAPER CHAIN KIT VINTAGE CHRISTMAS,10,2011-12-04 14:51:00,6.63,,United Kingdom
580519,22943,CHRISTMAS LIGHTS 10 VINTAGE BAUBLES,1,2011-12-04 14:51:00,10.79,,United Kingdom
580519,22952,60 CAKE CASES VINTAGE CHRISTMAS,1,2011-12-04 14:51:00,2.08,,United Kingdom
580519,23084,RABBIT NIGHT LIGHT,45,2011-12-04 14:51:00,4.96,,United Kingdom
580519,23204,CHARLOTTE BAG APPLES DESIGN,30,2011-12-04 14:51:00,2.46,,United Kingdom
580519,23205,CHARLOTTE BAG VINTAGE ALPHABET ,17,2011-12-04 14:51:00,2.46,,United Kingdom
580519,23206,LUNCH BAG APPLE DESIGN,7,2011-12-04 14:51:00,4.96,,United Kingdom
580519,23207,LUNCH BAG ALPHABET DESIGN,2,2011-12-04 14:51:00,4.96,,United Kingdom
580519,23208,LUNCH BAG VINTAGE LEAF DESIGN,2,2011-12-04 14:51:00,4.96,,United Kingdom
580519,23301,GARDENERS KNEELING PAD KEEP CALM ,1,2011-12-04 14:51:00,4.13,,United Kingdom
580519,23355,HOT WATER BOTTLE KEEP CALM,34,2011-12-04 14:51:00,8.29,,United Kingdom
580519,23358,HOT STUFF HOT WATER BOTTLE,1,2011-12-04 14:51:00,5.79,,United Kingdom
580519,35970,ZINC FOLKART SLEIGH BELLS,9,2011-12-04 14:51:00,4.13,,United Kingdom
580519,47566,PARTY BUNTING,9,2011-12-04 14:51:00,10.79,,United Kingdom
580519,82583,HOT BATHS METAL SIGN,11,2011-12-04 14:51:00,4.96,,United Kingdom
580519,82583,HOT BATHS METAL SIGN,1,2011-12-04 14:51:00,8.33,,United Kingdom
580519,84029E,RED WOOLLY HOTTIE WHITE HEART.,18,2011-12-04 14:51:00,9.13,,United Kingdom
580519,84029E,RED WOOLLY HOTTIE WHITE HEART.,1,2011-12-04 14:51:00,13.13,,United Kingdom
580519,84029G,KNITTED UNION FLAG HOT WATER BOTTLE,14,2011-12-04 14:51:00,8.29,,United Kingdom
580519,84030e,ENGLISH ROSE HOT WATER BOTTLE,2,2011-12-04 14:51:00,9.13,,United Kingdom
580519,84347,ROTATING SILVER ANGELS T-LIGHT HLDR,52,2011-12-04 14:51:00,5.79,,United Kingdom
580520,22509,SEWING BOX RETROSPOT DESIGN ,1,2011-12-04 14:55:00,3.95,13521.0,United Kingdom
580520,22365,DOORMAT RESPECTABLE HOUSE,1,2011-12-04 14:55:00,8.25,13521.0,United Kingdom
580520,22770,MIRROR CORNICE,1,2011-12-04 14:55:00,14.95,13521.0,United Kingdom
580520,22605,WOODEN CROQUET GARDEN SET,1,2011-12-04 14:55:00,14.95,13521.0,United Kingdom
580520,22607,WOODEN ROUNDERS GARDEN SET ,1,2011-12-04 14:55:00,9.95,13521.0,United Kingdom
580520,23301,GARDENERS KNEELING PAD KEEP CALM ,5,2011-12-04 14:55:00,1.65,13521.0,United Kingdom
580520,23300,GARDENERS KNEELING PAD CUP OF TEA ,4,2011-12-04 14:55:00,1.65,13521.0,United Kingdom
580520,21912,VINTAGE SNAKES & LADDERS,1,2011-12-04 14:55:00,3.75,13521.0,United Kingdom
580520,22549,PICTURE DOMINOES,1,2011-12-04 14:55:00,1.45,13521.0,United Kingdom
580520,23526,WALL ART DOG LICENCE ,1,2011-12-04 14:55:00,5.95,13521.0,United Kingdom
580520,21619,4 VANILLA BOTANICAL CANDLES,4,2011-12-04 14:55:00,1.25,13521.0,United Kingdom
580520,21713,CITRONELLA CANDLE FLOWERPOT,1,2011-12-04 14:55:00,2.1,13521.0,United Kingdom
580520,84031B,CHARLIE LOLA BLUE HOT WATER BOTTLE ,1,2011-12-04 14:55:00,1.25,13521.0,United Kingdom
580520,20679,EDWARDIAN PARASOL RED,1,2011-12-04 14:55:00,5.95,13521.0,United Kingdom
580520,15056N,EDWARDIAN PARASOL NATURAL,1,2011-12-04 14:55:00,5.95,13521.0,United Kingdom
580520,22952,60 CAKE CASES VINTAGE CHRISTMAS,1,2011-12-04 14:55:00,0.55,13521.0,United Kingdom
580520,22113,GREY HEART HOT WATER BOTTLE,2,2011-12-04 14:55:00,4.25,13521.0,United Kingdom
580520,23356,LOVE HOT WATER BOTTLE,1,2011-12-04 14:55:00,5.95,13521.0,United Kingdom
580520,22835,HOT WATER BOTTLE I AM SO POORLY,1,2011-12-04 14:55:00,4.95,13521.0,United Kingdom
580520,22111,SCOTTIE DOG HOT WATER BOTTLE,1,2011-12-04 14:55:00,4.95,13521.0,United Kingdom
580520,22695,WICKER WREATH SMALL,2,2011-12-04 14:55:00,0.59,13521.0,United Kingdom
580520,22196,SMALL HEART MEASURING SPOONS,1,2011-12-04 14:55:00,0.85,13521.0,United Kingdom
580520,22952,60 CAKE CASES VINTAGE CHRISTMAS,1,2011-12-04 14:55:00,0.55,13521.0,United Kingdom
580520,23295,SET OF 12 MINI LOAF BAKING CASES,1,2011-12-04 14:55:00,0.83,13521.0,United Kingdom
580520,22424,ENAMEL BREAD BIN CREAM,1,2011-12-04 14:55:00,12.75,13521.0,United Kingdom
580520,21592,RETROSPOT CIGAR BOX MATCHES ,5,2011-12-04 14:55:00,0.39,13521.0,United Kingdom
580520,84032B,CHARLIE + LOLA RED HOT WATER BOTTLE,1,2011-12-04 14:55:00,0.79,13521.0,United Kingdom
580520,23394,POSTE FRANCE CUSHION COVER,1,2011-12-04 14:55:00,3.75,13521.0,United Kingdom
580520,23396,LE JARDIN BOTANIQUE CUSHION COVER,2,2011-12-04 14:55:00,3.75,13521.0,United Kingdom
580520,23395,BELLE JARDINIERE CUSHION COVER,2,2011-12-04 14:55:00,3.75,13521.0,United Kingdom
580520,23393,HOME SWEET HOME CUSHION COVER ,2,2011-12-04 14:55:00,3.75,13521.0,United Kingdom
580520,21714,CITRONELLA CANDLE GARDEN POT,2,2011-12-04 14:55:00,1.25,13521.0,United Kingdom
580520,23328,SET 6 SCHOOL MILK BOTTLES IN CRATE,1,2011-12-04 14:55:00,3.75,13521.0,United Kingdom
580520,23535,WALL ART BICYCLE SAFETY,2,2011-12-04 14:55:00,5.95,13521.0,United Kingdom
580520,23536,WALL ART VILLAGE SHOW ,1,2011-12-04 14:55:00,5.95,13521.0,United Kingdom
580520,23089,GLASS BON BON JAR,2,2011-12-04 14:55:00,1.95,13521.0,United Kingdom
580520,21401,BLUE PUDDING SPOON,5,2011-12-04 14:55:00,0.12,13521.0,United Kingdom
580520,21400,RED PUDDING SPOON,5,2011-12-04 14:55:00,0.12,13521.0,United Kingdom
580520,23338,EGG FRYING PAN RED ,1,2011-12-04 14:55:00,2.08,13521.0,United Kingdom
580520,84988,SET OF 72 PINK HEART PAPER DOILIES,2,2011-12-04 14:55:00,1.45,13521.0,United Kingdom
580520,22190,LOCAL CAFE MUG,3,2011-12-04 14:55:00,0.39,13521.0,United Kingdom
580520,23494,VINTAGE DOILY DELUXE SEWING KIT ,1,2011-12-04 14:55:00,5.95,13521.0,United Kingdom
580520,21914,BLUE HARMONICA IN BOX ,1,2011-12-04 14:55:00,1.25,13521.0,United Kingdom
580520,22546,MINI JIGSAW PURDEY,2,2011-12-04 14:55:00,0.19,13521.0,United Kingdom
580520,85178,VICTORIAN SEWING KIT,1,2011-12-04 14:55:00,1.25,13521.0,United Kingdom
580520,23182,TOILET SIGN OCCUPIED OR VACANT,2,2011-12-04 14:55:00,0.83,13521.0,United Kingdom
580520,22673,FRENCH GARDEN SIGN BLUE METAL,1,2011-12-04 14:55:00,1.25,13521.0,United Kingdom
580520,22671,FRENCH LAUNDRY SIGN BLUE METAL,1,2011-12-04 14:55:00,1.65,13521.0,United Kingdom
580520,21787,RAIN PONCHO RETROSPOT,2,2011-12-04 14:55:00,0.85,13521.0,United Kingdom
580520,21914,BLUE HARMONICA IN BOX ,2,2011-12-04 14:55:00,1.25,13521.0,United Kingdom
580520,21064,BOOM BOX SPEAKER BOYS,1,2011-12-04 14:55:00,1.25,13521.0,United Kingdom
580520,22557,PLASTERS IN TIN VINTAGE PAISLEY ,1,2011-12-04 14:55:00,1.65,13521.0,United Kingdom
580520,85231B,CINAMMON SET OF 9 T-LIGHTS,2,2011-12-04 14:55:00,0.85,13521.0,United Kingdom
580520,23241,TREASURE TIN GYMKHANA DESIGN,1,2011-12-04 14:55:00,2.08,13521.0,United Kingdom
580520,85053,FRENCH ENAMEL CANDLEHOLDER,1,2011-12-04 14:55:00,2.1,13521.0,United Kingdom
580520,22118,JOY WOODEN BLOCK LETTERS,1,2011-12-04 14:55:00,1.25,13521.0,United Kingdom
580520,22119,PEACE WOODEN BLOCK LETTERS,1,2011-12-04 14:55:00,1.95,13521.0,United Kingdom
580520,23019,SMALL APOTHECARY MEASURING JAR ,1,2011-12-04 14:55:00,8.25,13521.0,United Kingdom
580520,23080,RED METAL BOX TOP SECRET,1,2011-12-04 14:55:00,8.25,13521.0,United Kingdom
580520,84832,ZINC WILLIE WINKIE  CANDLE STICK,2,2011-12-04 14:55:00,0.85,13521.0,United Kingdom
580520,23084,RABBIT NIGHT LIGHT,3,2011-12-04 14:55:00,2.08,13521.0,United Kingdom
580520,21718,RED METAL BEACH SPADE ,2,2011-12-04 14:55:00,1.25,13521.0,United Kingdom
580520,21494,ROTATING LEAVES T-LIGHT HOLDER,4,2011-12-04 14:55:00,1.25,13521.0,United Kingdom
580520,23422,PANTRY HOOK BALLOON WHISK ,2,2011-12-04 14:55:00,2.08,13521.0,United Kingdom
580520,22494,EMERGENCY FIRST AID TIN ,2,2011-12-04 14:55:00,1.25,13521.0,United Kingdom
580520,84012,MAGIC SHEEP WOOL GROWING FROM PAPER,2,2011-12-04 14:55:00,0.85,13521.0,United Kingdom
580520,23295,SET OF 12 MINI LOAF BAKING CASES,1,2011-12-04 14:55:00,0.83,13521.0,United Kingdom
580520,22642,SET OF 4 NAPKIN CHARMS STARS   ,1,2011-12-04 14:55:00,0.79,13521.0,United Kingdom
580520,84375,SET OF 20 KIDS COOKIE CUTTERS,2,2011-12-04 14:55:00,2.1,13521.0,United Kingdom
580520,22196,SMALL HEART MEASURING SPOONS,3,2011-12-04 14:55:00,0.85,13521.0,United Kingdom
580520,21790,VINTAGE SNAP CARDS,1,2011-12-04 14:55:00,0.85,13521.0,United Kingdom
580520,21916,SET 12 RETRO WHITE CHALK STICKS,2,2011-12-04 14:55:00,0.42,13521.0,United Kingdom
580520,22123,PING MICROWAVE APRON,1,2011-12-04 14:55:00,0.79,13521.0,United Kingdom
580520,22942,CHRISTMAS LIGHTS 10 SANTAS ,4,2011-12-04 14:55:00,2.95,13521.0,United Kingdom
580520,21279,VINTAGE KITCHEN PRINT FRUITS,1,2011-12-04 14:55:00,2.55,13521.0,United Kingdom
580520,22811,SET OF 6 T-LIGHTS CACTI ,2,2011-12-04 14:55:00,1.25,13521.0,United Kingdom
580520,22457,NATURAL SLATE HEART CHALKBOARD ,1,2011-12-04 14:55:00,2.95,13521.0,United Kingdom
580520,22409,MONEY BOX BISCUITS DESIGN,1,2011-12-04 14:55:00,1.25,13521.0,United Kingdom
580520,22406,MONEY BOX KINGS CHOICE DESIGN,3,2011-12-04 14:55:00,0.39,13521.0,United Kingdom
580520,22398,MAGNETS PACK OF 4 SWALLOWS,2,2011-12-04 14:55:00,0.39,13521.0,United Kingdom
580520,22400,MAGNETS PACK OF 4 HOME SWEET HOME,1,2011-12-04 14:55:00,0.39,13521.0,United Kingdom
580520,22400,MAGNETS PACK OF 4 HOME SWEET HOME,1,2011-12-04 14:55:00,0.39,13521.0,United Kingdom
580520,21716,BOYS VINTAGE TIN SEASIDE BUCKET,2,2011-12-04 14:55:00,2.55,13521.0,United Kingdom
580520,22441,GROW YOUR OWN BASIL IN ENAMEL MUG,1,2011-12-04 14:55:00,2.1,13521.0,United Kingdom
580520,22960,JAM MAKING SET WITH JARS,1,2011-12-04 14:55:00,4.25,13521.0,United Kingdom
580520,85061W,WHITE JEWELLED HEART DECORATION,2,2011-12-04 14:55:00,0.85,13521.0,United Kingdom
580520,23060,HEART BEADED TRELLIS DECORATION,2,2011-12-04 14:55:00,2.08,13521.0,United Kingdom
580520,23281,FOLDING BUTTERFLY MIRROR RED  ,2,2011-12-04 14:55:00,0.83,13521.0,United Kingdom
580520,23425,STORAGE TIN HOME SWEET HOME,3,2011-12-04 14:55:00,0.79,13521.0,United Kingdom
580520,22419,LIPSTICK PEN RED,4,2011-12-04 14:55:00,0.42,13521.0,United Kingdom
580520,84707A,SILVER JEWELLED MIRROR TRINKET TRAY,2,2011-12-04 14:55:00,1.95,13521.0,United Kingdom
580520,22076,6 RIBBONS EMPIRE  ,2,2011-12-04 14:55:00,0.39,13521.0,United Kingdom
580520,22075,6 RIBBONS ELEGANT CHRISTMAS ,2,2011-12-04 14:55:00,0.39,13521.0,United Kingdom
580520,22476,EMPIRE UNION JACK TV DINNER TRAY,1,2011-12-04 14:55:00,1.95,13521.0,United Kingdom
580520,23169,CLASSIC GLASS COOKIE JAR,1,2011-12-04 14:55:00,4.15,13521.0,United Kingdom
580520,22474,SPACEBOY TV DINNER TRAY,2,2011-12-04 14:55:00,1.95,13521.0,United Kingdom
580520,23169,CLASSIC GLASS COOKIE JAR,1,2011-12-04 14:55:00,4.15,13521.0,United Kingdom
580520,35471D,SET OF 3 BIRD LIGHT PINK FEATHER ,4,2011-12-04 14:55:00,0.39,13521.0,United Kingdom
580520,23328,SET 6 SCHOOL MILK BOTTLES IN CRATE,3,2011-12-04 14:55:00,3.75,13521.0,United Kingdom
580520,84947,ANTIQUE SILVER TEA GLASS ENGRAVED,2,2011-12-04 14:55:00,1.25,13521.0,United Kingdom
580520,22964,3 PIECE SPACEBOY COOKIE CUTTER SET,1,2011-12-04 14:55:00,2.1,13521.0,United Kingdom
580520,23101,SILVER STARS TABLE DECORATION,1,2011-12-04 14:55:00,0.83,13521.0,United Kingdom
580520,23100,SILVER BELLS TABLE DECORATION,2,2011-12-04 14:55:00,1.25,13521.0,United Kingdom
580520,23418,LAVENDER TOILETTE BOTTLE,1,2011-12-04 14:55:00,2.08,13521.0,United Kingdom
580520,35970,ZINC FOLKART SLEIGH BELLS,2,2011-12-04 14:55:00,1.69,13521.0,United Kingdom
580520,23168,CLASSIC CAFE SUGAR DISPENSER,2,2011-12-04 14:55:00,1.25,13521.0,United Kingdom
580520,23295,SET OF 12 MINI LOAF BAKING CASES,1,2011-12-04 14:55:00,0.83,13521.0,United Kingdom
580520,22956,36 FOIL HEART CAKE CASES,1,2011-12-04 14:55:00,0.79,13521.0,United Kingdom
580520,23489,VINTAGE BELLS GARLAND,2,2011-12-04 14:55:00,2.89,13521.0,United Kingdom
580520,22639,SET OF 4 NAPKIN CHARMS HEARTS,2,2011-12-04 14:55:00,0.79,13521.0,United Kingdom
580520,22642,SET OF 4 NAPKIN CHARMS STARS   ,7,2011-12-04 14:55:00,0.79,13521.0,United Kingdom
580520,22638,SET OF 4 NAPKIN CHARMS CROWNS ,4,2011-12-04 14:55:00,0.79,13521.0,United Kingdom
580520,22643,SET OF 4 NAPKIN CHARMS LEAVES   ,4,2011-12-04 14:55:00,0.79,13521.0,United Kingdom
580520,23214,JINGLE BELL HEART ANTIQUE GOLD,2,2011-12-04 14:55:00,2.08,13521.0,United Kingdom
580520,21818,GLITTER HEART DECORATION,5,2011-12-04 14:55:00,0.39,13521.0,United Kingdom
580520,21819,GLITTER CHRISTMAS STAR ,10,2011-12-04 14:55:00,0.39,13521.0,United Kingdom
580520,21810,CHRISTMAS HANGING STAR WITH BELL,10,2011-12-04 14:55:00,0.39,13521.0,United Kingdom
580520,22956,36 FOIL HEART CAKE CASES,1,2011-12-04 14:55:00,0.79,13521.0,United Kingdom
580520,23495,SET OF 3 PANTRY WOODEN SPOONS,3,2011-12-04 14:55:00,1.25,13521.0,United Kingdom
580520,23552,BICYCLE PUNCTURE REPAIR KIT ,1,2011-12-04 14:55:00,2.08,13521.0,United Kingdom
580520,23498,CLASSIC BICYCLE CLIPS ,2,2011-12-04 14:55:00,1.45,13521.0,United Kingdom
580520,23497,CLASSIC CHROME BICYCLE BELL ,2,2011-12-04 14:55:00,1.45,13521.0,United Kingdom
580520,23296,SET OF 6 TEA TIME BAKING CASES,1,2011-12-04 14:55:00,1.25,13521.0,United Kingdom
580520,23293,SET OF 12 FAIRY CAKE BAKING CASES,3,2011-12-04 14:55:00,0.83,13521.0,United Kingdom
580520,23295,SET OF 12 MINI LOAF BAKING CASES,1,2011-12-04 14:55:00,0.83,13521.0,United Kingdom
580520,23294,SET OF 6 SNACK LOAF BAKING CASES,2,2011-12-04 14:55:00,0.83,13521.0,United Kingdom
580520,21263,GREEN GOOSE FEATHER TREE 60CM,2,2011-12-04 14:55:00,1.95,13521.0,United Kingdom
580521,85136A,YELLOW SHARK HELICOPTER,1,2011-12-04 14:59:00,7.95,,United Kingdom
C580522,23075,PARLOUR CERAMIC WALL HOOK,-1,2011-12-04 14:59:00,4.15,13435.0,United Kingdom
580523,22500,SET OF 2 TINS JARDIN DE PROVENCE,4,2011-12-04 15:00:00,1.25,17827.0,United Kingdom
580523,22750,FELTCRAFT PRINCESS LOLA DOLL,2,2011-12-04 15:00:00,3.75,17827.0,United Kingdom
580523,22751,FELTCRAFT PRINCESS OLIVIA DOLL,1,2011-12-04 15:00:00,3.75,17827.0,United Kingdom
580523,22086,PAPER CHAIN KIT 50'S CHRISTMAS ,1,2011-12-04 15:00:00,2.95,17827.0,United Kingdom
580523,20971,PINK BLUE FELT CRAFT TRINKET BOX,3,2011-12-04 15:00:00,1.25,17827.0,United Kingdom
580523,23691,WRAP KEEP CALM BIRTHDAY,25,2011-12-04 15:00:00,0.42,17827.0,United Kingdom
580523,23500,KEY RING BASEBALL BOOT ASSORTED ,20,2011-12-04 15:00:00,1.25,17827.0,United Kingdom
