InvoiceNo,StockCode,Description,Quantity,InvoiceDate,UnitPrice,CustomerID,Country
564709,20914,SET/5 RED RETROSPOT LID GLASS BOWLS,96,2011-08-28 10:15:00,2.55,15569.0,United Kingdom
564710,84380,SET OF 3 BUTTERFLY COOKIE CUTTERS,12,2011-08-28 10:21:00,1.25,15625.0,United Kingdom
564710,22138,BAKING SET 9 PIECE RETROSPOT ,3,2011-08-28 10:21:00,4.95,15625.0,United Kingdom
564710,21791,VINTAGE HEADS AND TAILS CARD GAME ,24,2011-08-28 10:21:00,1.25,15625.0,United Kingdom
564710,21705,BAG 500g SWIRLY MARBLES,48,2011-08-28 10:21:00,1.45,15625.0,United Kingdom
564710,22966,GINGERBREAD MAN COOKIE CUTTER,12,2011-08-28 10:21:00,1.25,15625.0,United Kingdom
564710,22964,3 PIECE SPACEBOY COOKIE CUTTER SET,12,2011-08-28 10:21:00,2.1,15625.0,United Kingdom
564710,22961,JAM MAKING SET PRINTED,24,2011-08-28 10:21:00,1.45,15625.0,United Kingdom
564710,22492,MINI PAINT SET VINTAGE ,36,2011-08-28 10:21:00,0.65,15625.0,United Kingdom
564710,21790,VINTAGE SNAP CARDS,24,2011-08-28 10:21:00,0.85,15625.0,United Kingdom
564710,22621,TRADITIONAL KNITTING NANCY,24,2011-08-28 10:21:00,1.65,15625.0,United Kingdom
C564711,22442,GROW YOUR OWN FLOWERS SET OF 3,-1,2011-08-28 10:31:00,7.95,16768.0,United Kingdom
C564711,21531,RED RETROSPOT SUGAR JAM BOWL,-1,2011-08-28 10:31:00,2.55,16768.0,United Kingdom
C564711,21232,STRAWBERRY CERAMIC TRINKET BOX,-1,2011-08-28 10:31:00,1.25,16768.0,United Kingdom
564712,23356,LOVE HOT WATER BOTTLE,12,2011-08-28 10:40:00,5.95,15611.0,United Kingdom
564712,23084,RABBIT NIGHT LIGHT,96,2011-08-28 10:40:00,1.79,15611.0,United Kingdom
564712,23318,BOX OF 6 MINI VINTAGE CRACKERS,6,2011-08-28 10:40:00,2.49,15611.0,United Kingdom
564712,23319,BOX OF 6 MINI 50'S CRACKERS,6,2011-08-28 10:40:00,2.49,15611.0,United Kingdom
564712,22144,CHRISTMAS CRAFT LITTLE FRIENDS,6,2011-08-28 10:40:00,2.1,15611.0,United Kingdom
564712,21843,RED RETROSPOT CAKE STAND,1,2011-08-28 10:40:00,10.95,15611.0,United Kingdom
564712,21481,FAWN BLUE HOT WATER BOTTLE,12,2011-08-28 10:40:00,2.95,15611.0,United Kingdom
564712,22580,ADVENT CALENDAR GINGHAM SACK,6,2011-08-28 10:40:00,5.95,15611.0,United Kingdom
564712,21249,WOODLAND  HEIGHT CHART STICKERS ,6,2011-08-28 10:40:00,2.95,15611.0,United Kingdom
564713,21754,HOME BUILDING BLOCK WORD,2,2011-08-28 10:43:00,5.95,16768.0,United Kingdom
564713,85123A,WHITE HANGING HEART T-LIGHT HOLDER,2,2011-08-28 10:43:00,2.95,16768.0,United Kingdom
564713,22917,HERB MARKER ROSEMARY,2,2011-08-28 10:43:00,0.65,16768.0,United Kingdom
564713,22916,HERB MARKER THYME,1,2011-08-28 10:43:00,0.65,16768.0,United Kingdom
564713,22918,HERB MARKER PARSLEY,2,2011-08-28 10:43:00,0.65,16768.0,United Kingdom
564713,22920,HERB MARKER BASIL,2,2011-08-28 10:43:00,0.65,16768.0,United Kingdom
564713,22919,HERB MARKER MINT,2,2011-08-28 10:43:00,0.65,16768.0,United Kingdom
564713,23247,BISCUIT TIN 50'S CHRISTMAS,2,2011-08-28 10:43:00,2.89,16768.0,United Kingdom
564713,23338,EGG FRYING PAN RED ,1,2011-08-28 10:43:00,2.08,16768.0,United Kingdom
564713,22470,HEART OF WICKER LARGE,2,2011-08-28 10:43:00,2.95,16768.0,United Kingdom
564713,22485,SET OF 2 WOODEN MARKET CRATES,1,2011-08-28 10:43:00,12.75,16768.0,United Kingdom
564713,22865,HAND WARMER OWL DESIGN,2,2011-08-28 10:43:00,2.1,16768.0,United Kingdom
564713,22632,HAND WARMER RED RETROSPOT,2,2011-08-28 10:43:00,2.1,16768.0,United Kingdom
564713,22867,HAND WARMER BIRD DESIGN,2,2011-08-28 10:43:00,2.1,16768.0,United Kingdom
564713,22866,HAND WARMER SCOTTY DOG DESIGN,2,2011-08-28 10:43:00,2.1,16768.0,United Kingdom
564713,85123A,WHITE HANGING HEART T-LIGHT HOLDER,3,2011-08-28 10:43:00,2.95,16768.0,United Kingdom
564713,22441,GROW YOUR OWN BASIL IN ENAMEL MUG,4,2011-08-28 10:43:00,2.1,16768.0,United Kingdom
564713,23235,STORAGE TIN VINTAGE LEAF,2,2011-08-28 10:43:00,2.89,16768.0,United Kingdom
564713,23237,SET OF 4 KNICK KNACK TINS LEAF,2,2011-08-28 10:43:00,4.15,16768.0,United Kingdom
564713,23300,GARDENERS KNEELING PAD CUP OF TEA ,3,2011-08-28 10:43:00,1.65,16768.0,United Kingdom
564714,22699,ROSES REGENCY TEACUP AND SAUCER ,12,2011-08-28 10:54:00,2.95,15290.0,United Kingdom
564715,22716,CARD CIRCUS PARADE,12,2011-08-28 11:01:00,0.42,14472.0,United Kingdom
564715,22030,SWALLOWS GREETING CARD,12,2011-08-28 11:01:00,0.42,14472.0,United Kingdom
564715,84201C,HAPPY BIRTHDAY CARD TEDDY/CAKE,5,2011-08-28 11:01:00,0.19,14472.0,United Kingdom
564715,84879,ASSORTED COLOUR BIRD ORNAMENT,8,2011-08-28 11:01:00,1.69,14472.0,United Kingdom
564715,21259,VICTORIAN SEWING BOX SMALL ,1,2011-08-28 11:01:00,5.95,14472.0,United Kingdom
564715,21754,HOME BUILDING BLOCK WORD,1,2011-08-28 11:01:00,5.95,14472.0,United Kingdom
564715,21755,LOVE BUILDING BLOCK WORD,3,2011-08-28 11:01:00,5.95,14472.0,United Kingdom
564715,23130,MISTLETOE HEART WREATH GREEN,2,2011-08-28 11:01:00,4.15,14472.0,United Kingdom
564715,22297,HEART IVORY TRELLIS SMALL,1,2011-08-28 11:01:00,1.25,14472.0,United Kingdom
564715,21385,IVORY HANGING DECORATION  HEART,2,2011-08-28 11:01:00,0.85,14472.0,United Kingdom
564715,22227,HANGING HEART MIRROR DECORATION ,4,2011-08-28 11:01:00,0.65,14472.0,United Kingdom
564715,21385,IVORY HANGING DECORATION  HEART,1,2011-08-28 11:01:00,0.85,14472.0,United Kingdom
564715,22227,HANGING HEART MIRROR DECORATION ,1,2011-08-28 11:01:00,0.65,14472.0,United Kingdom
564715,21390,FILIGRIS HEART WITH BUTTERFLY,2,2011-08-28 11:01:00,1.25,14472.0,United Kingdom
564715,22294,HEART FILIGREE DOVE  SMALL,2,2011-08-28 11:01:00,1.25,14472.0,United Kingdom
564715,22296,HEART IVORY TRELLIS LARGE,1,2011-08-28 11:01:00,1.65,14472.0,United Kingdom
564715,82600,NO SINGING METAL SIGN,1,2011-08-28 11:01:00,2.1,14472.0,United Kingdom
564715,21905,MORE BUTTER METAL SIGN ,1,2011-08-28 11:01:00,0.79,14472.0,United Kingdom
564715,22297,HEART IVORY TRELLIS SMALL,1,2011-08-28 11:01:00,1.25,14472.0,United Kingdom
564715,22296,HEART IVORY TRELLIS LARGE,1,2011-08-28 11:01:00,1.65,14472.0,United Kingdom
564715,22296,HEART IVORY TRELLIS LARGE,1,2011-08-28 11:01:00,1.65,14472.0,United Kingdom
564715,22297,HEART IVORY TRELLIS SMALL,1,2011-08-28 11:01:00,1.25,14472.0,United Kingdom
564715,21385,IVORY HANGING DECORATION  HEART,7,2011-08-28 11:01:00,0.85,14472.0,United Kingdom
564715,22294,HEART FILIGREE DOVE  SMALL,3,2011-08-28 11:01:00,1.25,14472.0,United Kingdom
564715,21452,TOADSTOOL MONEY BOX,3,2011-08-28 11:01:00,2.95,14472.0,United Kingdom
564715,85123A,WHITE HANGING HEART T-LIGHT HOLDER,2,2011-08-28 11:01:00,2.95,14472.0,United Kingdom
564715,22797,CHEST OF DRAWERS GINGHAM HEART ,1,2011-08-28 11:01:00,16.95,14472.0,United Kingdom
564715,21259,VICTORIAN SEWING BOX SMALL ,1,2011-08-28 11:01:00,5.95,14472.0,United Kingdom
564715,84755,COLOUR GLASS T-LIGHT HOLDER HANGING,16,2011-08-28 11:01:00,0.65,14472.0,United Kingdom
564716,85099F,JUMBO BAG STRAWBERRY,6,2011-08-28 11:02:00,2.08,14810.0,United Kingdom
564716,23201,JUMBO BAG ALPHABET,4,2011-08-28 11:02:00,2.08,14810.0,United Kingdom
564716,21935,SUKI  SHOULDER BAG,2,2011-08-28 11:02:00,1.65,14810.0,United Kingdom
564716,21930,JUMBO STORAGE BAG SKULLS,3,2011-08-28 11:02:00,2.08,14810.0,United Kingdom
564716,22386,JUMBO BAG PINK POLKADOT,14,2011-08-28 11:02:00,2.08,14810.0,United Kingdom
564716,20713,JUMBO BAG OWLS,4,2011-08-28 11:02:00,2.08,14810.0,United Kingdom
564716,23203,JUMBO BAG VINTAGE DOILY ,10,2011-08-28 11:02:00,2.08,14810.0,United Kingdom
564716,23321,SMALL WHITE HEART OF WICKER,4,2011-08-28 11:02:00,1.65,14810.0,United Kingdom
564716,23245,SET OF 3 REGENCY CAKE TINS,4,2011-08-28 11:02:00,4.95,14810.0,United Kingdom
564716,22384,LUNCH BAG PINK POLKADOT,10,2011-08-28 11:02:00,1.65,14810.0,United Kingdom
564716,23209,LUNCH BAG VINTAGE DOILY ,10,2011-08-28 11:02:00,1.65,14810.0,United Kingdom
564716,20726,LUNCH BAG WOODLAND,6,2011-08-28 11:02:00,1.65,14810.0,United Kingdom
564716,22091,EMPIRE TISSUE BOX,1,2011-08-28 11:02:00,0.39,14810.0,United Kingdom
564716,22097,SWALLOW SQUARE TISSUE BOX,1,2011-08-28 11:02:00,0.39,14810.0,United Kingdom
564716,20728,LUNCH BAG CARS BLUE,12,2011-08-28 11:02:00,1.65,14810.0,United Kingdom
564716,22382,LUNCH BAG SPACEBOY DESIGN ,4,2011-08-28 11:02:00,1.65,14810.0,United Kingdom
564716,84875D,BLUE SQUARE COMPACT MIRROR,12,2011-08-28 11:02:00,1.25,14810.0,United Kingdom
564716,22296,HEART IVORY TRELLIS LARGE,6,2011-08-28 11:02:00,1.65,14810.0,United Kingdom
564716,82494L,WOODEN FRAME ANTIQUE WHITE ,2,2011-08-28 11:02:00,2.95,14810.0,United Kingdom
564716,22726,ALARM CLOCK BAKELIKE GREEN,2,2011-08-28 11:02:00,3.75,14810.0,United Kingdom
564716,22728,ALARM CLOCK BAKELIKE PINK,3,2011-08-28 11:02:00,3.75,14810.0,United Kingdom
564716,22730,ALARM CLOCK BAKELIKE IVORY,2,2011-08-28 11:02:00,3.75,14810.0,United Kingdom
564716,22727,ALARM CLOCK BAKELIKE RED ,1,2011-08-28 11:02:00,3.75,14810.0,United Kingdom
564716,23263,SET OF 3 WOODEN HEART DECORATIONS,6,2011-08-28 11:02:00,1.25,14810.0,United Kingdom
564716,23290,SPACEBOY CHILDRENS BOWL,2,2011-08-28 11:02:00,1.25,14810.0,United Kingdom
564716,23289,DOLLY GIRL CHILDRENS BOWL,2,2011-08-28 11:02:00,1.25,14810.0,United Kingdom
564716,22383,LUNCH BAG SUKI DESIGN ,4,2011-08-28 11:02:00,1.65,14810.0,United Kingdom
564716,47593B,SCOTTIE DOGS BABY BIB,6,2011-08-28 11:02:00,0.39,14810.0,United Kingdom
564716,82482,WOODEN PICTURE FRAME WHITE FINISH,6,2011-08-28 11:02:00,2.55,14810.0,United Kingdom
564716,23206,LUNCH BAG APPLE DESIGN,4,2011-08-28 11:02:00,1.65,14810.0,United Kingdom
564716,23207,LUNCH BAG ALPHABET DESIGN,6,2011-08-28 11:02:00,1.65,14810.0,United Kingdom
564716,20727,LUNCH BAG  BLACK SKULL.,10,2011-08-28 11:02:00,1.65,14810.0,United Kingdom
564716,20725,LUNCH BAG RED RETROSPOT,6,2011-08-28 11:02:00,1.65,14810.0,United Kingdom
564716,22662,LUNCH BAG DOLLY GIRL DESIGN,4,2011-08-28 11:02:00,1.65,14810.0,United Kingdom
564716,22276,WASH BAG VINTAGE ROSE PAISLEY,3,2011-08-28 11:02:00,2.55,14810.0,United Kingdom
564716,23343,JUMBO BAG VINTAGE CHRISTMAS ,3,2011-08-28 11:02:00,2.08,14810.0,United Kingdom
564716,23344,JUMBO BAG 50'S CHRISTMAS ,3,2011-08-28 11:02:00,2.08,14810.0,United Kingdom
564717,23084,RABBIT NIGHT LIGHT,48,2011-08-28 11:19:00,1.79,15669.0,United Kingdom
564717,23293,SET OF 12 FAIRY CAKE BAKING CASES,8,2011-08-28 11:19:00,0.83,15669.0,United Kingdom
564717,23295,SET OF 12 MINI LOAF BAKING CASES,8,2011-08-28 11:19:00,0.83,15669.0,United Kingdom
564717,23130,MISTLETOE HEART WREATH GREEN,4,2011-08-28 11:19:00,4.15,15669.0,United Kingdom
564717,22592,CARDHOLDER HOLLY WREATH METAL,4,2011-08-28 11:19:00,3.75,15669.0,United Kingdom
564718,23131,MISTLETOE HEART WREATH CREAM,6,2011-08-28 11:25:00,4.15,13301.0,United Kingdom
564718,82001S,VINYL RECORD FRAME SILVER,2,2011-08-28 11:25:00,3.75,13301.0,United Kingdom
564718,22041,"RECORD FRAME 7"" SINGLE SIZE ",3,2011-08-28 11:25:00,2.55,13301.0,United Kingdom
564718,21265,PINK GOOSE FEATHER TREE 60CM,4,2011-08-28 11:25:00,1.95,13301.0,United Kingdom
564718,22297,HEART IVORY TRELLIS SMALL,11,2011-08-28 11:25:00,1.25,13301.0,United Kingdom
564718,79321,CHILLI LIGHTS,1,2011-08-28 11:25:00,5.75,13301.0,United Kingdom
564718,17136A,BLUE STONES ON WIRE FOR CANDLE,6,2011-08-28 11:25:00,0.08,13301.0,United Kingdom
564718,21820,GLITTER HEART GARLAND WITH BELLS ,1,2011-08-28 11:25:00,3.75,13301.0,United Kingdom
564718,21818,GLITTER HEART DECORATION,8,2011-08-28 11:25:00,0.85,13301.0,United Kingdom
564718,22296,HEART IVORY TRELLIS LARGE,3,2011-08-28 11:25:00,1.65,13301.0,United Kingdom
564718,22488,NATURAL SLATE RECTANGLE CHALKBOARD,2,2011-08-28 11:25:00,1.65,13301.0,United Kingdom
564718,22185,SLATE TILE NATURAL HANGING,2,2011-08-28 11:25:00,1.65,13301.0,United Kingdom
564718,84974,S/2 ZINC HEART DESIGN PLANTERS,1,2011-08-28 11:25:00,9.95,13301.0,United Kingdom
564718,23144,ZINC T-LIGHT HOLDER STARS SMALL,12,2011-08-28 11:25:00,0.83,13301.0,United Kingdom
564718,22479,DAISY GARDEN MARKER,10,2011-08-28 11:25:00,1.25,13301.0,United Kingdom
564718,23298,SPOTTY BUNTING,3,2011-08-28 11:25:00,4.95,13301.0,United Kingdom
564719,21871,SAVE THE PLANET MUG,1,2011-08-28 11:55:00,1.25,15325.0,United Kingdom
564719,21066,VINTAGE RED MUG,1,2011-08-28 11:55:00,1.25,15325.0,United Kingdom
564719,21877,HOME SWEET HOME MUG,1,2011-08-28 11:55:00,1.25,15325.0,United Kingdom
564719,21068,VINTAGE BILLBOARD LOVE/HATE MUG,1,2011-08-28 11:55:00,1.25,15325.0,United Kingdom
564719,23230,WRAP ALPHABET DESIGN,25,2011-08-28 11:55:00,0.42,15325.0,United Kingdom
564719,23233,WRAP POPPIES  DESIGN,25,2011-08-28 11:55:00,0.42,15325.0,United Kingdom
564719,79321,CHILLI LIGHTS,2,2011-08-28 11:55:00,5.75,15325.0,United Kingdom
564719,22027,TEA PARTY BIRTHDAY CARD,12,2011-08-28 11:55:00,0.42,15325.0,United Kingdom
564719,22029,SPACEBOY BIRTHDAY CARD,12,2011-08-28 11:55:00,0.42,15325.0,United Kingdom
564719,22030,SWALLOWS GREETING CARD,12,2011-08-28 11:55:00,0.42,15325.0,United Kingdom
564719,22715,CARD WEDDING DAY,12,2011-08-28 11:55:00,0.42,15325.0,United Kingdom
564719,21509,COWBOYS AND INDIANS BIRTHDAY CARD ,12,2011-08-28 11:55:00,0.42,15325.0,United Kingdom
564719,22815,CARD PSYCHEDELIC APPLES,12,2011-08-28 11:55:00,0.42,15325.0,United Kingdom
564719,21654,RIDGED GLASS FINGER BOWL,2,2011-08-28 11:55:00,0.39,15325.0,United Kingdom
564719,84927F,PSYCHEDELIC TILE HOOK,5,2011-08-28 11:55:00,0.39,15325.0,United Kingdom
564719,22951,60 CAKE CASES DOLLY GIRL DESIGN,1,2011-08-28 11:55:00,0.55,15325.0,United Kingdom
564719,84879,ASSORTED COLOUR BIRD ORNAMENT,4,2011-08-28 11:55:00,1.69,15325.0,United Kingdom
564719,22951,60 CAKE CASES DOLLY GIRL DESIGN,1,2011-08-28 11:55:00,0.55,15325.0,United Kingdom
564719,22417,PACK OF 60 SPACEBOY CAKE CASES,1,2011-08-28 11:55:00,0.55,15325.0,United Kingdom
564719,21977,PACK OF 60 PINK PAISLEY CAKE CASES,1,2011-08-28 11:55:00,0.55,15325.0,United Kingdom
564719,23307,SET OF 60 PANTRY DESIGN CAKE CASES ,1,2011-08-28 11:55:00,0.55,15325.0,United Kingdom
564719,21136,PAINTED METAL PEARS ASSORTED,4,2011-08-28 11:55:00,1.69,15325.0,United Kingdom
564719,47566,PARTY BUNTING,1,2011-08-28 11:55:00,4.95,15325.0,United Kingdom
564719,23308,SET OF 60 VINTAGE LEAF CAKE CASES ,1,2011-08-28 11:55:00,0.55,15325.0,United Kingdom
564719,20765,CHRYSANTHEMUM SKETCHBOOK ,1,2011-08-28 11:55:00,3.75,15325.0,United Kingdom
564719,20758,ABSTRACT CIRCLES POCKET BOOK,3,2011-08-28 11:55:00,0.85,15325.0,United Kingdom
564719,79000,MOROCCAN TEA GLASS,24,2011-08-28 11:55:00,0.85,15325.0,United Kingdom
564719,82600,NO SINGING METAL SIGN,1,2011-08-28 11:55:00,2.1,15325.0,United Kingdom
564719,21179,NO JUNK MAIL METAL SIGN,7,2011-08-28 11:55:00,0.39,15325.0,United Kingdom
564719,22666,RECIPE BOX PANTRY YELLOW DESIGN,1,2011-08-28 11:55:00,2.95,15325.0,United Kingdom
564719,22667,RECIPE BOX RETROSPOT ,1,2011-08-28 11:55:00,2.95,15325.0,United Kingdom
564719,17012F,ORIGAMI SANDLEWOOD INCENSE/CAND SET,1,2011-08-28 11:55:00,0.85,15325.0,United Kingdom
564719,17012B,ORIGAMI JASMINE INCENSE/CANDLE SET,1,2011-08-28 11:55:00,0.85,15325.0,United Kingdom
564719,17012D,ORIGAMI ROSE INCENSE/CANDLE SET ,1,2011-08-28 11:55:00,0.85,15325.0,United Kingdom
564719,17012C,ORIGAMI LAVENDER INCENSE/CANDL SET ,1,2011-08-28 11:55:00,0.85,15325.0,United Kingdom
564719,23191,BUNDLE OF 3 RETRO NOTE BOOKS,4,2011-08-28 11:55:00,1.65,15325.0,United Kingdom
564719,22402,MAGNETS PACK OF 4 VINTAGE COLLAGE,3,2011-08-28 11:55:00,0.39,15325.0,United Kingdom
564719,22400,MAGNETS PACK OF 4 HOME SWEET HOME,3,2011-08-28 11:55:00,0.39,15325.0,United Kingdom
564719,21206,STRAWBERRY HONEYCOMB  GARLAND ,4,2011-08-28 11:55:00,1.65,15325.0,United Kingdom
564719,47574A,ENGLISH ROSE SCENTED HANGING FLOWER,6,2011-08-28 11:55:00,0.75,15325.0,United Kingdom
564719,21206,STRAWBERRY HONEYCOMB  GARLAND ,1,2011-08-28 11:55:00,1.65,15325.0,United Kingdom
564719,85017B,ENVELOPE 50 BLOSSOM IMAGES,4,2011-08-28 11:55:00,0.42,15325.0,United Kingdom
564719,22092,BLUE PAISLEY TISSUE BOX,1,2011-08-28 11:55:00,0.39,15325.0,United Kingdom
564719,22091,EMPIRE TISSUE BOX,2,2011-08-28 11:55:00,0.39,15325.0,United Kingdom
564719,22093,MOTORING TISSUE BOX,2,2011-08-28 11:55:00,0.39,15325.0,United Kingdom
564719,22097,SWALLOW SQUARE TISSUE BOX,3,2011-08-28 11:55:00,0.39,15325.0,United Kingdom
564719,22098,BOUDOIR SQUARE TISSUE BOX,2,2011-08-28 11:55:00,0.39,15325.0,United Kingdom
564719,22096,PINK PAISLEY SQUARE TISSUE BOX ,1,2011-08-28 11:55:00,0.39,15325.0,United Kingdom
564719,22099,CARAVAN SQUARE TISSUE BOX,4,2011-08-28 11:55:00,0.39,15325.0,United Kingdom
564720,23245,SET OF 3 REGENCY CAKE TINS,4,2011-08-28 12:00:00,4.95,15095.0,United Kingdom
564721,22904,CALENDAR PAPER CUT DESIGN,6,2011-08-28 12:01:00,2.95,15095.0,United Kingdom
564721,23170,REGENCY TEA PLATE ROSES ,12,2011-08-28 12:01:00,1.65,15095.0,United Kingdom
564721,22493,PAINT YOUR OWN CANVAS SET,24,2011-08-28 12:01:00,1.65,15095.0,United Kingdom
564721,22800,ANTIQUE TALL SWIRLGLASS TRINKET POT,6,2011-08-28 12:01:00,3.75,15095.0,United Kingdom
564721,84879,ASSORTED COLOUR BIRD ORNAMENT,32,2011-08-28 12:01:00,1.69,15095.0,United Kingdom
564721,23173,REGENCY TEAPOT ROSES ,6,2011-08-28 12:01:00,9.95,15095.0,United Kingdom
564721,22652,TRAVEL SEWING KIT,12,2011-08-28 12:01:00,1.65,15095.0,United Kingdom
564721,23089,GLASS BON BON JAR,12,2011-08-28 12:01:00,1.65,15095.0,United Kingdom
564721,22178,VICTORIAN GLASS HANGING T-LIGHT,48,2011-08-28 12:01:00,1.25,15095.0,United Kingdom
564722,22804,CANDLEHOLDER PINK HANGING HEART,2,2011-08-28 12:06:00,2.95,16456.0,United Kingdom
564722,84832,ZINC WILLIE WINKIE  CANDLE STICK,2,2011-08-28 12:06:00,0.85,16456.0,United Kingdom
564722,21929,JUMBO BAG PINK VINTAGE PAISLEY,1,2011-08-28 12:06:00,2.08,16456.0,United Kingdom
564722,82582,AREA PATROLLED METAL SIGN,6,2011-08-28 12:06:00,2.1,16456.0,United Kingdom
564722,23322,LARGE WHITE HEART OF WICKER,3,2011-08-28 12:06:00,2.95,16456.0,United Kingdom
564722,21901,"KEY FOB , BACK DOOR ",10,2011-08-28 12:06:00,0.65,16456.0,United Kingdom
564722,21899,GARAGE KEY FOB,8,2011-08-28 12:06:00,0.65,16456.0,United Kingdom
564722,21385,IVORY HANGING DECORATION  HEART,24,2011-08-28 12:06:00,0.85,16456.0,United Kingdom
564722,85123A,WHITE HANGING HEART T-LIGHT HOLDER,5,2011-08-28 12:06:00,2.95,16456.0,United Kingdom
564722,82483,WOOD 2 DRAWER CABINET WHITE FINISH,2,2011-08-28 12:06:00,6.95,16456.0,United Kingdom
564722,82486,3 DRAWER ANTIQUE WHITE WOOD CABINET,2,2011-08-28 12:06:00,8.95,16456.0,United Kingdom
564722,23099,FRENCH CARRIAGE LANTERN,1,2011-08-28 12:06:00,6.65,16456.0,United Kingdom
564722,84806B,WHITE CANDYSTUFT ARTIFICIAL FLOWER,3,2011-08-28 12:06:00,1.45,16456.0,United Kingdom
564722,84800M,MEDIUM WHITE/PINK ROSE ART FLOWER,2,2011-08-28 12:06:00,1.69,16456.0,United Kingdom
564723,23084,RABBIT NIGHT LIGHT,6,2011-08-28 12:11:00,2.08,16168.0,United Kingdom
564723,22699,ROSES REGENCY TEACUP AND SAUCER ,6,2011-08-28 12:11:00,2.95,16168.0,United Kingdom
564723,23300,GARDENERS KNEELING PAD CUP OF TEA ,48,2011-08-28 12:11:00,1.45,16168.0,United Kingdom
564723,23301,GARDENERS KNEELING PAD KEEP CALM ,48,2011-08-28 12:11:00,1.45,16168.0,United Kingdom
564724,85123A,WHITE HANGING HEART T-LIGHT HOLDER,2,2011-08-28 12:16:00,2.95,15555.0,United Kingdom
564724,21733,RED HANGING HEART T-LIGHT HOLDER,2,2011-08-28 12:16:00,2.95,15555.0,United Kingdom
564724,21213,PACK OF 72 SKULL CAKE CASES,1,2011-08-28 12:16:00,0.55,15555.0,United Kingdom
564724,21705,BAG 500g SWIRLY MARBLES,3,2011-08-28 12:16:00,1.65,15555.0,United Kingdom
564724,21703,BAG 125g SWIRLY MARBLES,5,2011-08-28 12:16:00,0.42,15555.0,United Kingdom
564724,22382,LUNCH BAG SPACEBOY DESIGN ,3,2011-08-28 12:16:00,1.65,15555.0,United Kingdom
564724,20725,LUNCH BAG RED RETROSPOT,3,2011-08-28 12:16:00,1.65,15555.0,United Kingdom
564724,20728,LUNCH BAG CARS BLUE,3,2011-08-28 12:16:00,1.65,15555.0,United Kingdom
564724,23208,LUNCH BAG VINTAGE LEAF DESIGN,3,2011-08-28 12:16:00,1.65,15555.0,United Kingdom
564724,22383,LUNCH BAG SUKI DESIGN ,3,2011-08-28 12:16:00,1.65,15555.0,United Kingdom
564724,23207,LUNCH BAG ALPHABET DESIGN,3,2011-08-28 12:16:00,1.65,15555.0,United Kingdom
564724,22297,HEART IVORY TRELLIS SMALL,3,2011-08-28 12:16:00,1.25,15555.0,United Kingdom
564724,22296,HEART IVORY TRELLIS LARGE,3,2011-08-28 12:16:00,1.65,15555.0,United Kingdom
564724,22219,LOVEBIRD HANGING DECORATION WHITE ,3,2011-08-28 12:16:00,0.85,15555.0,United Kingdom
564724,22577,WOODEN HEART CHRISTMAS SCANDINAVIAN,3,2011-08-28 12:16:00,0.85,15555.0,United Kingdom
564724,85199L,LARGE HANGING IVORY & RED WOOD BIRD,6,2011-08-28 12:16:00,0.65,15555.0,United Kingdom
564724,85199S,SMALL HANGING IVORY/RED WOOD BIRD,4,2011-08-28 12:16:00,0.42,15555.0,United Kingdom
564724,85202,HANGING WOOD AND FELT HEART,2,2011-08-28 12:16:00,0.42,15555.0,United Kingdom
564724,20726,LUNCH BAG WOODLAND,3,2011-08-28 12:16:00,1.65,15555.0,United Kingdom
564724,22662,LUNCH BAG DOLLY GIRL DESIGN,3,2011-08-28 12:16:00,1.65,15555.0,United Kingdom
564724,22994,TRAVEL CARD WALLET RETROSPOT,5,2011-08-28 12:16:00,0.42,15555.0,United Kingdom
564724,22995,TRAVEL CARD WALLET SUKI,5,2011-08-28 12:16:00,0.42,15555.0,United Kingdom
564724,22996,TRAVEL CARD WALLET VINTAGE TICKET,5,2011-08-28 12:16:00,0.42,15555.0,United Kingdom
564724,22998,TRAVEL CARD WALLET KEEP CALM,10,2011-08-28 12:16:00,0.42,15555.0,United Kingdom
564724,22999,TRAVEL CARD WALLET VINTAGE LEAF,10,2011-08-28 12:16:00,0.42,15555.0,United Kingdom
564724,23004,TRAVEL CARD WALLET PANTRY,10,2011-08-28 12:16:00,0.42,15555.0,United Kingdom
564724,23005,TRAVEL CARD WALLET I LOVE LONDON,10,2011-08-28 12:16:00,0.42,15555.0,United Kingdom
564724,23006,TRAVEL CARD WALLET FLOWER MEADOW,5,2011-08-28 12:16:00,0.42,15555.0,United Kingdom
564724,22817,CARD SUKI BIRTHDAY,12,2011-08-28 12:16:00,0.42,15555.0,United Kingdom
564724,22983,CARD BILLBOARD FONT,12,2011-08-28 12:16:00,0.42,15555.0,United Kingdom
564724,22029,SPACEBOY BIRTHDAY CARD,12,2011-08-28 12:16:00,0.42,15555.0,United Kingdom
564724,21504,SKULLS GREETING CARD,12,2011-08-28 12:16:00,0.42,15555.0,United Kingdom
564724,21035,SET/2 RED RETROSPOT TEA TOWELS ,1,2011-08-28 12:16:00,3.25,15555.0,United Kingdom
564724,47559B,TEA TIME OVEN GLOVE,4,2011-08-28 12:16:00,1.25,15555.0,United Kingdom
564724,21154,RED RETROSPOT OVEN GLOVE ,4,2011-08-28 12:16:00,1.25,15555.0,United Kingdom
564724,22551,PLASTERS IN TIN SPACEBOY,2,2011-08-28 12:16:00,1.65,15555.0,United Kingdom
564724,22554,PLASTERS IN TIN WOODLAND ANIMALS,2,2011-08-28 12:16:00,1.65,15555.0,United Kingdom
564724,22556,PLASTERS IN TIN CIRCUS PARADE ,2,2011-08-28 12:16:00,1.65,15555.0,United Kingdom
564724,22553,PLASTERS IN TIN SKULLS,3,2011-08-28 12:16:00,1.65,15555.0,United Kingdom
564724,22437,SET OF 9 BLACK SKULL BALLOONS,4,2011-08-28 12:16:00,0.85,15555.0,United Kingdom
564724,22436,12 COLOURED PARTY BALLOONS,4,2011-08-28 12:16:00,0.65,15555.0,United Kingdom
564724,23159,SET OF 5 PANCAKE DAY MAGNETS,4,2011-08-28 12:16:00,2.08,15555.0,United Kingdom
564724,23156,SET OF 5 MINI GROCERY MAGNETS,1,2011-08-28 12:16:00,2.08,15555.0,United Kingdom
564724,23154,SET OF 4 JAM JAR MAGNETS,1,2011-08-28 12:16:00,2.08,15555.0,United Kingdom
564724,21918,SET 12 KIDS COLOUR  CHALK STICKS,6,2011-08-28 12:16:00,0.42,15555.0,United Kingdom
564724,23197,SKETCHBOOK MAGNETIC SHOPPING LIST,2,2011-08-28 12:16:00,1.45,15555.0,United Kingdom
564724,23198,PANTRY MAGNETIC  SHOPPING LIST,2,2011-08-28 12:16:00,1.45,15555.0,United Kingdom
564724,22493,PAINT YOUR OWN CANVAS SET,3,2011-08-28 12:16:00,1.65,15555.0,United Kingdom
564724,22563,HAPPY STENCIL CRAFT,3,2011-08-28 12:16:00,1.25,15555.0,United Kingdom
564724,22562,MONSTERS STENCIL CRAFT,3,2011-08-28 12:16:00,1.25,15555.0,United Kingdom
564724,22564,ALPHABET STENCIL CRAFT,3,2011-08-28 12:16:00,1.25,15555.0,United Kingdom
564724,22560,TRADITIONAL MODELLING CLAY,3,2011-08-28 12:16:00,1.25,15555.0,United Kingdom
564724,21889,WOODEN BOX OF DOMINOES,3,2011-08-28 12:16:00,1.25,15555.0,United Kingdom
564724,20979,36 PENCILS TUBE RED RETROSPOT,1,2011-08-28 12:16:00,1.25,15555.0,United Kingdom
564724,20978,36 PENCILS TUBE SKULLS,2,2011-08-28 12:16:00,1.25,15555.0,United Kingdom
564724,20981,12 PENCILS TALL TUBE WOODLAND,2,2011-08-28 12:16:00,0.85,15555.0,United Kingdom
564724,20982,12 PENCILS TALL TUBE SKULLS,3,2011-08-28 12:16:00,0.85,15555.0,United Kingdom
564724,37370,RETRO COFFEE MUGS ASSORTED,2,2011-08-28 12:16:00,1.25,15555.0,United Kingdom
564724,21877,HOME SWEET HOME MUG,3,2011-08-28 12:16:00,1.25,15555.0,United Kingdom
564724,21872,GLAMOROUS  MUG,3,2011-08-28 12:16:00,1.25,15555.0,United Kingdom
564724,21876,POTTERING MUG,1,2011-08-28 12:16:00,1.25,15555.0,United Kingdom
564724,21871,SAVE THE PLANET MUG,3,2011-08-28 12:16:00,1.25,15555.0,United Kingdom
564724,21876,POTTERING MUG,2,2011-08-28 12:16:00,1.25,15555.0,United Kingdom
564724,21874,GIN AND TONIC MUG,3,2011-08-28 12:16:00,1.25,15555.0,United Kingdom
564724,37370,RETRO COFFEE MUGS ASSORTED,1,2011-08-28 12:16:00,1.25,15555.0,United Kingdom
564724,21875,KINGS CHOICE MUG,1,2011-08-28 12:16:00,1.25,15555.0,United Kingdom
564724,82483,WOOD 2 DRAWER CABINET WHITE FINISH,2,2011-08-28 12:16:00,6.95,15555.0,United Kingdom
564724,82484,WOOD BLACK BOARD ANT WHITE FINISH,2,2011-08-28 12:16:00,7.95,15555.0,United Kingdom
564725,20749,ASSORTED COLOUR MINI CASES,1,2011-08-28 12:28:00,7.95,18041.0,United Kingdom
564725,22333,RETROSPOT PARTY BAG + STICKER SET,1,2011-08-28 12:28:00,1.65,18041.0,United Kingdom
564725,47566,PARTY BUNTING,1,2011-08-28 12:28:00,4.95,18041.0,United Kingdom
564725,22904,CALENDAR PAPER CUT DESIGN,1,2011-08-28 12:28:00,2.95,18041.0,United Kingdom
564725,23198,PANTRY MAGNETIC  SHOPPING LIST,1,2011-08-28 12:28:00,1.45,18041.0,United Kingdom
564725,79191C,RETRO PLASTIC ELEPHANT TRAY,1,2011-08-28 12:28:00,0.85,18041.0,United Kingdom
564725,22961,JAM MAKING SET PRINTED,1,2011-08-28 12:28:00,1.45,18041.0,United Kingdom
564725,22077,6 RIBBONS RUSTIC CHARM,1,2011-08-28 12:28:00,1.65,18041.0,United Kingdom
564725,85017B,ENVELOPE 50 BLOSSOM IMAGES,2,2011-08-28 12:28:00,0.42,18041.0,United Kingdom
564725,22907,PACK OF 20 NAPKINS PANTRY DESIGN,1,2011-08-28 12:28:00,0.85,18041.0,United Kingdom
564725,85032B,BLOSSOM IMAGES GIFT WRAP SET,2,2011-08-28 12:28:00,0.65,18041.0,United Kingdom
