InvoiceNo,StockCode,Description,Quantity,InvoiceDate,UnitPrice,CustomerID,Country
575754,23354,6 GIFT TAGS 50'S CHRISTMAS ,6,2011-11-11 10:43:00,0.83,17295.0,United Kingdom
575754,23353,6 GIFT TAGS VINTAGE CHRISTMAS ,7,2011-11-11 10:43:00,0.83,17295.0,United Kingdom
575754,23247,BISCUIT TIN 50'S CHRISTMAS,1,2011-11-11 10:43:00,2.89,17295.0,United Kingdom
575754,22635,CHILDS BREAKFAST SET DOLLY GIRL ,2,2011-11-11 10:43:00,9.95,17295.0,United Kingdom
575754,22634,CHILDS BREAKFAST SET SPACEBOY ,1,2011-11-11 10:43:00,9.95,17295.0,United Kingdom
575754,22634,CHILDS BREAKFAST SET SPACEBOY ,1,2011-11-11 10:43:00,9.95,17295.0,United Kingdom
575754,21928,JUMBO BAG SCANDINAVIAN BLUE PAISLEY,1,2011-11-11 10:43:00,2.08,17295.0,United Kingdom
575754,23319,BOX OF 6 MINI 50'S CRACKERS,3,2011-11-11 10:43:00,2.49,17295.0,United Kingdom
575755,22142,CHRISTMAS CRAFT WHITE FAIRY ,12,2011-11-11 10:45:00,1.45,17015.0,United Kingdom
575755,22940,FELTCRAFT CHRISTMAS FAIRY,4,2011-11-11 10:45:00,4.25,17015.0,United Kingdom
575755,22144,CHRISTMAS CRAFT LITTLE FRIENDS,6,2011-11-11 10:45:00,2.1,17015.0,United Kingdom
575755,22945,CHRISTMAS METAL TAGS ASSORTED ,12,2011-11-11 10:45:00,0.85,17015.0,United Kingdom
575755,23216,LAUREL HEART ANTIQUE GOLD,12,2011-11-11 10:45:00,1.25,17015.0,United Kingdom
575755,23225,CHERUB HEART DECORATION SILVER ,12,2011-11-11 10:45:00,0.83,17015.0,United Kingdom
575755,23222,CHRISTMAS TREE HANGING GOLD,12,2011-11-11 10:45:00,0.83,17015.0,United Kingdom
575755,22573,STAR WOODEN CHRISTMAS DECORATION,12,2011-11-11 10:45:00,0.85,17015.0,United Kingdom
575755,22576,SWALLOW WOODEN CHRISTMAS DECORATION,12,2011-11-11 10:45:00,0.85,17015.0,United Kingdom
575755,22574,HEART WOODEN CHRISTMAS DECORATION,12,2011-11-11 10:45:00,0.85,17015.0,United Kingdom
575755,22578,WOODEN STAR CHRISTMAS SCANDINAVIAN,24,2011-11-11 10:45:00,0.29,17015.0,United Kingdom
575755,22577,WOODEN HEART CHRISTMAS SCANDINAVIAN,24,2011-11-11 10:45:00,0.29,17015.0,United Kingdom
575755,23212,HEART WREATH DECORATION WITH BELL,12,2011-11-11 10:45:00,1.25,17015.0,United Kingdom
575755,23213,STAR WREATH DECORATION WITH BELL,12,2011-11-11 10:45:00,1.25,17015.0,United Kingdom
575755,22086,PAPER CHAIN KIT 50'S CHRISTMAS ,6,2011-11-11 10:45:00,2.95,17015.0,United Kingdom
575755,23354,6 GIFT TAGS 50'S CHRISTMAS ,12,2011-11-11 10:45:00,0.83,17015.0,United Kingdom
575755,23351,ROLL WRAP 50'S CHRISTMAS,12,2011-11-11 10:45:00,1.25,17015.0,United Kingdom
575755,23434,3 RAFFIA RIBBONS 50'S CHRISTMAS ,10,2011-11-11 10:45:00,0.79,17015.0,United Kingdom
575755,22733,3D TRADITIONAL CHRISTMAS STICKERS,18,2011-11-11 10:45:00,1.25,17015.0,United Kingdom
575755,22959,WRAP CHRISTMAS VILLAGE,25,2011-11-11 10:45:00,0.42,17015.0,United Kingdom
575755,22818,CARD CHRISTMAS VILLAGE,12,2011-11-11 10:45:00,0.42,17015.0,United Kingdom
575755,22734,SET OF 6 RIBBONS VINTAGE CHRISTMAS,6,2011-11-11 10:45:00,2.89,17015.0,United Kingdom
575756,22197,POPCORN HOLDER,10,2011-11-11 10:48:00,0.85,18118.0,United Kingdom
575756,35833P,4 PINK FLOCK CHRISTMAS BALLS,5,2011-11-11 10:48:00,1.25,18118.0,United Kingdom
575756,84836,ZINC METAL HEART DECORATION,12,2011-11-11 10:48:00,1.25,18118.0,United Kingdom
575756,22633,HAND WARMER UNION JACK,1,2011-11-11 10:48:00,2.1,18118.0,United Kingdom
575756,22865,HAND WARMER OWL DESIGN,1,2011-11-11 10:48:00,2.1,18118.0,United Kingdom
575756,22066,LOVE HEART TRINKET POT,2,2011-11-11 10:48:00,0.39,18118.0,United Kingdom
575756,21231,SWEETHEART CERAMIC TRINKET BOX,4,2011-11-11 10:48:00,1.25,18118.0,United Kingdom
575756,22993,SET OF 4 PANTRY JELLY MOULDS,6,2011-11-11 10:48:00,1.25,18118.0,United Kingdom
575756,22645,CERAMIC HEART FAIRY CAKE MONEY BANK,8,2011-11-11 10:48:00,1.45,18118.0,United Kingdom
575756,22646,CERAMIC STRAWBERRY CAKE MONEY BANK,4,2011-11-11 10:48:00,1.45,18118.0,United Kingdom
575756,22064,PINK DOUGHNUT TRINKET POT ,2,2011-11-11 10:48:00,1.65,18118.0,United Kingdom
575756,21232,STRAWBERRY CERAMIC TRINKET POT,1,2011-11-11 10:48:00,1.25,18118.0,United Kingdom
575756,21231,SWEETHEART CERAMIC TRINKET BOX,2,2011-11-11 10:48:00,1.25,18118.0,United Kingdom
575756,22470,HEART OF WICKER LARGE,1,2011-11-11 10:48:00,2.95,18118.0,United Kingdom
575756,23322,LARGE WHITE HEART OF WICKER,1,2011-11-11 10:48:00,2.95,18118.0,United Kingdom
575756,22475,SKULL DESIGN TV DINNER TRAY,1,2011-11-11 10:48:00,4.95,18118.0,United Kingdom
575756,22473,TV DINNER TRAY VINTAGE PAISLEY,1,2011-11-11 10:48:00,4.95,18118.0,United Kingdom
575756,22307,GOLD MUG BONE CHINA TREE OF LIFE,1,2011-11-11 10:48:00,1.06,18118.0,United Kingdom
575756,23318,BOX OF 6 MINI VINTAGE CRACKERS,1,2011-11-11 10:48:00,2.49,18118.0,United Kingdom
575756,23068,ALUMINIUM STAMPED HEART,1,2011-11-11 10:48:00,2.49,18118.0,United Kingdom
575756,21558,SKULL LUNCH BOX WITH CUTLERY ,3,2011-11-11 10:48:00,2.55,18118.0,United Kingdom
575756,23270,SET OF 2 CERAMIC PAINTED HEARTS ,1,2011-11-11 10:48:00,1.45,18118.0,United Kingdom
575756,22596,CHRISTMAS STAR WISH LIST CHALKBOARD,1,2011-11-11 10:48:00,1.25,18118.0,United Kingdom
575756,21154,RED RETROSPOT OVEN GLOVE ,1,2011-11-11 10:48:00,1.25,18118.0,United Kingdom
575756,85123A,WHITE HANGING HEART T-LIGHT HOLDER,2,2011-11-11 10:48:00,2.95,18118.0,United Kingdom
575756,84509C,SET OF 4 POLKADOT PLACEMATS ,2,2011-11-11 10:48:00,3.75,18118.0,United Kingdom
575756,84510C,SET OF 4 POLKADOT COASTERS,2,2011-11-11 10:48:00,1.25,18118.0,United Kingdom
575756,20751,FUNKY WASHING UP GLOVES ASSORTED,2,2011-11-11 10:48:00,2.1,18118.0,United Kingdom
575756,20751,FUNKY WASHING UP GLOVES ASSORTED,2,2011-11-11 10:48:00,2.1,18118.0,United Kingdom
575756,20751,FUNKY WASHING UP GLOVES ASSORTED,4,2011-11-11 10:48:00,2.1,18118.0,United Kingdom
575756,22112,CHOCOLATE HOT WATER BOTTLE,1,2011-11-11 10:48:00,4.95,18118.0,United Kingdom
575756,22457,NATURAL SLATE HEART CHALKBOARD ,1,2011-11-11 10:48:00,2.95,18118.0,United Kingdom
575756,20914,SET/5 RED RETROSPOT LID GLASS BOWLS,1,2011-11-11 10:48:00,2.95,18118.0,United Kingdom
575756,22666,RECIPE BOX PANTRY YELLOW DESIGN,1,2011-11-11 10:48:00,2.95,18118.0,United Kingdom
575756,22667,RECIPE BOX RETROSPOT ,1,2011-11-11 10:48:00,2.95,18118.0,United Kingdom
575756,20971,PINK BLUE FELT CRAFT TRINKET BOX,2,2011-11-11 10:48:00,1.25,18118.0,United Kingdom
575756,20972,PINK CREAM FELT CRAFT TRINKET BOX ,2,2011-11-11 10:48:00,1.25,18118.0,United Kingdom
575757,22646,CERAMIC STRAWBERRY CAKE MONEY BANK,1,2011-11-11 10:49:00,1.45,17295.0,United Kingdom
575757,20723,STRAWBERRY CHARLOTTE BAG,2,2011-11-11 10:49:00,0.85,17295.0,United Kingdom
575757,23205,CHARLOTTE BAG VINTAGE ALPHABET ,2,2011-11-11 10:49:00,0.85,17295.0,United Kingdom
575757,20749,ASSORTED COLOUR MINI CASES,2,2011-11-11 10:49:00,7.95,17295.0,United Kingdom
575757,20750,RED RETROSPOT MINI CASES,2,2011-11-11 10:49:00,7.95,17295.0,United Kingdom
575757,21992,VINTAGE PAISLEY STATIONERY SET,3,2011-11-11 10:49:00,1.25,17295.0,United Kingdom
575757,22491,PACK OF 12 COLOURED PENCILS,6,2011-11-11 10:49:00,0.85,17295.0,United Kingdom
575757,85071A,BLUE CHARLIE+LOLA PERSONAL DOORSIGN,6,2011-11-11 10:49:00,0.39,17295.0,United Kingdom
575757,20829,GLITTER HANGING BUTTERFLY STRING,3,2011-11-11 10:49:00,2.1,17295.0,United Kingdom
575757,23192,BUNDLE OF 3 ALPHABET EXERCISE BOOKS,5,2011-11-11 10:49:00,1.65,17295.0,United Kingdom
575757,23191,BUNDLE OF 3 RETRO NOTE BOOKS,3,2011-11-11 10:49:00,1.65,17295.0,United Kingdom
575757,21327,SKULLS WRITING SET ,6,2011-11-11 10:49:00,1.65,17295.0,United Kingdom
575757,21329,DINOSAURS  WRITING SET ,6,2011-11-11 10:49:00,1.65,17295.0,United Kingdom
575757,21328,BALLOONS  WRITING SET ,6,2011-11-11 10:49:00,1.65,17295.0,United Kingdom
575757,84375,SET OF 20 KIDS COOKIE CUTTERS,6,2011-11-11 10:49:00,2.1,17295.0,United Kingdom
575757,23229,VINTAGE DONKEY TAIL GAME ,2,2011-11-11 10:49:00,3.75,17295.0,United Kingdom
575757,21888,BINGO SET,2,2011-11-11 10:49:00,3.75,17295.0,United Kingdom
575757,21912,VINTAGE SNAKES & LADDERS,2,2011-11-11 10:49:00,3.75,17295.0,United Kingdom
575757,22550,HOLIDAY FUN LUDO,2,2011-11-11 10:49:00,3.75,17295.0,United Kingdom
575757,22411,JUMBO SHOPPER VINTAGE RED PAISLEY,1,2011-11-11 10:49:00,2.08,17295.0,United Kingdom
575757,23202,JUMBO BAG VINTAGE LEAF,1,2011-11-11 10:49:00,2.08,17295.0,United Kingdom
575757,22493,PAINT YOUR OWN CANVAS SET,2,2011-11-11 10:49:00,1.65,17295.0,United Kingdom
575759,22577,WOODEN HEART CHRISTMAS SCANDINAVIAN,94,2011-11-11 10:50:00,0.29,,France
575759,22578,WOODEN STAR CHRISTMAS SCANDINAVIAN,10,2011-11-11 10:50:00,0.29,,France
575759,23481,PEARLISED IVORY HEART SMALL ,10,2011-11-11 10:50:00,1.25,,France
575759,21833,CAMOUFLAGE LED TORCH,1,2011-11-11 10:50:00,1.69,,France
575759,85227,SET OF 6 3D KIT CARDS FOR KIDS,1,2011-11-11 10:50:00,0.85,,France
575759,84559A,3D SHEET OF DOG STICKERS,2,2011-11-11 10:50:00,0.85,,France
575759,21881,CUTE CATS TAPE,1,2011-11-11 10:50:00,0.65,,France
575759,84569A,PACK 3 IRON ON DOG PATCHES,1,2011-11-11 10:50:00,1.25,,France
575759,22551,PLASTERS IN TIN SPACEBOY,1,2011-11-11 10:50:00,1.65,,France
575759,84558A,3D DOG PICTURE PLAYING CARDS,2,2011-11-11 10:50:00,2.95,,France
575759,22972,CHILDREN'S SPACEBOY MUG,1,2011-11-11 10:50:00,1.65,,France
575759,21107,CREAM SLICE FLANNEL PINK SPOT ,2,2011-11-11 10:50:00,2.95,,France
575759,22138,BAKING SET 9 PIECE RETROSPOT ,1,2011-11-11 10:50:00,4.95,,France
575759,22617,BAKING SET SPACEBOY DESIGN,1,2011-11-11 10:50:00,4.95,,France
575759,84836,ZINC METAL HEART DECORATION,24,2011-11-11 10:50:00,1.25,,France
575759,21811,HANGING HEART WITH BELL,48,2011-11-11 10:50:00,0.39,,France
575759,21822,GLITTER CHRISTMAS TREE WITH BELLS,12,2011-11-11 10:50:00,0.79,,France
575759,21034,REX CASH+CARRY JUMBO SHOPPER,1,2011-11-11 10:50:00,0.95,,France
575760,22663,JUMBO BAG DOLLY GIRL DESIGN,2,2011-11-11 10:50:00,2.08,15965.0,United Kingdom
575760,22411,JUMBO SHOPPER VINTAGE RED PAISLEY,7,2011-11-11 10:50:00,2.08,15965.0,United Kingdom
575760,21928,JUMBO BAG SCANDINAVIAN BLUE PAISLEY,1,2011-11-11 10:50:00,2.08,15965.0,United Kingdom
575760,23581,JUMBO BAG PAISLEY PARK,14,2011-11-11 10:50:00,2.08,15965.0,United Kingdom
575760,85099C,JUMBO  BAG BAROQUE BLACK WHITE,3,2011-11-11 10:50:00,2.08,15965.0,United Kingdom
575760,21930,JUMBO STORAGE BAG SKULLS,3,2011-11-11 10:50:00,2.08,15965.0,United Kingdom
575760,22688,DOORMAT PEACE ON EARTH BLUE,1,2011-11-11 10:50:00,8.25,15965.0,United Kingdom
575760,22816,CARD MOTORBIKE SANTA,12,2011-11-11 10:50:00,0.42,15965.0,United Kingdom
575760,22737,RIBBON REEL CHRISTMAS PRESENT ,1,2011-11-11 10:50:00,1.65,15965.0,United Kingdom
575760,22659,LUNCH BOX I LOVE LONDON,1,2011-11-11 10:50:00,1.95,15965.0,United Kingdom
575760,23378,PACK OF 12 50'S CHRISTMAS TISSUES,12,2011-11-11 10:50:00,0.39,15965.0,United Kingdom
575760,23264,SET OF 3 WOODEN SLEIGH DECORATIONS,1,2011-11-11 10:50:00,1.25,15965.0,United Kingdom
575760,23263,SET OF 3 WOODEN HEART DECORATIONS,1,2011-11-11 10:50:00,1.25,15965.0,United Kingdom
575760,23207,LUNCH BAG ALPHABET DESIGN,1,2011-11-11 10:50:00,1.65,15965.0,United Kingdom
575760,22659,LUNCH BOX I LOVE LONDON,1,2011-11-11 10:50:00,1.95,15965.0,United Kingdom
575760,21591,COSY HOUR CIGAR BOX MATCHES ,1,2011-11-11 10:50:00,1.25,15965.0,United Kingdom
575760,23312,VINTAGE CHRISTMAS GIFT SACK,1,2011-11-11 10:50:00,4.15,15965.0,United Kingdom
575760,23227,FILIGREE HEART BUTTERFLY WHITE ,4,2011-11-11 10:50:00,1.25,15965.0,United Kingdom
575760,23226,FILIGREE HEART DAISY WHITE,4,2011-11-11 10:50:00,1.25,15965.0,United Kingdom
575760,23215,JINGLE BELL HEART ANTIQUE SILVER,3,2011-11-11 10:50:00,2.08,15965.0,United Kingdom
575760,22900,SET 2 TEA TOWELS I LOVE LONDON ,1,2011-11-11 10:50:00,3.25,15965.0,United Kingdom
575760,22997,TRAVEL CARD WALLET UNION JACK,6,2011-11-11 10:50:00,0.42,15965.0,United Kingdom
575760,22998,TRAVEL CARD WALLET KEEP CALM,4,2011-11-11 10:50:00,0.42,15965.0,United Kingdom
575760,22996,TRAVEL CARD WALLET VINTAGE TICKET,3,2011-11-11 10:50:00,0.42,15965.0,United Kingdom
575760,23312,VINTAGE CHRISTMAS GIFT SACK,6,2011-11-11 10:50:00,4.15,15965.0,United Kingdom
575760,23313,VINTAGE CHRISTMAS BUNTING,1,2011-11-11 10:50:00,4.95,15965.0,United Kingdom
575760,21591,COSY HOUR CIGAR BOX MATCHES ,1,2011-11-11 10:50:00,1.25,15965.0,United Kingdom
575760,22733,3D TRADITIONAL CHRISTMAS STICKERS,6,2011-11-11 10:50:00,1.25,15965.0,United Kingdom
575760,84247N,PACK/12 BLUE FOLKART CARDS,1,2011-11-11 10:50:00,2.95,15965.0,United Kingdom
575760,23320,GIANT 50'S CHRISTMAS CRACKER,2,2011-11-11 10:50:00,2.89,15965.0,United Kingdom
575760,22737,RIBBON REEL CHRISTMAS PRESENT ,1,2011-11-11 10:50:00,1.65,15965.0,United Kingdom
575760,23322,LARGE WHITE HEART OF WICKER,2,2011-11-11 10:50:00,2.95,15965.0,United Kingdom
575760,22736,RIBBON REEL MAKING SNOWMEN ,5,2011-11-11 10:50:00,1.65,15965.0,United Kingdom
575760,84879,ASSORTED COLOUR BIRD ORNAMENT,8,2011-11-11 10:50:00,1.69,15965.0,United Kingdom
575760,23207,LUNCH BAG ALPHABET DESIGN,3,2011-11-11 10:50:00,1.65,15965.0,United Kingdom
575760,22900,SET 2 TEA TOWELS I LOVE LONDON ,2,2011-11-11 10:50:00,3.25,15965.0,United Kingdom
575760,22659,LUNCH BOX I LOVE LONDON,2,2011-11-11 10:50:00,1.95,15965.0,United Kingdom
575760,23263,SET OF 3 WOODEN HEART DECORATIONS,3,2011-11-11 10:50:00,1.25,15965.0,United Kingdom
575760,23264,SET OF 3 WOODEN SLEIGH DECORATIONS,2,2011-11-11 10:50:00,1.25,15965.0,United Kingdom
575760,23318,BOX OF 6 MINI VINTAGE CRACKERS,4,2011-11-11 10:50:00,2.49,15965.0,United Kingdom
575760,23320,GIANT 50'S CHRISTMAS CRACKER,1,2011-11-11 10:50:00,2.89,15965.0,United Kingdom
575760,23583,LUNCH BAG PAISLEY PARK  ,5,2011-11-11 10:50:00,1.65,15965.0,United Kingdom
575760,84879,ASSORTED COLOUR BIRD ORNAMENT,8,2011-11-11 10:50:00,1.69,15965.0,United Kingdom
575760,84029G,KNITTED UNION FLAG HOT WATER BOTTLE,3,2011-11-11 10:50:00,4.25,15965.0,United Kingdom
575760,21479,WHITE SKULL HOT WATER BOTTLE ,2,2011-11-11 10:50:00,4.25,15965.0,United Kingdom
575760,23356,LOVE HOT WATER BOTTLE,2,2011-11-11 10:50:00,5.95,15965.0,United Kingdom
575760,23355,HOT WATER BOTTLE KEEP CALM,5,2011-11-11 10:50:00,4.95,15965.0,United Kingdom
575760,23681,LUNCH BAG RED VINTAGE DOILY,2,2011-11-11 10:50:00,1.65,15965.0,United Kingdom
575760,23209,LUNCH BAG VINTAGE DOILY ,2,2011-11-11 10:50:00,1.65,15965.0,United Kingdom
575760,84913B,MINT GREEN ROSE TOWEL,2,2011-11-11 10:50:00,4.65,15965.0,United Kingdom
575760,21041,RED RETROSPOT OVEN GLOVE DOUBLE,1,2011-11-11 10:50:00,2.95,15965.0,United Kingdom
575760,21976,PACK OF 60 MUSHROOM CAKE CASES,1,2011-11-11 10:50:00,0.55,15965.0,United Kingdom
575760,22082,RIBBON REEL STRIPES DESIGN ,1,2011-11-11 10:50:00,1.65,15965.0,United Kingdom
575760,20981,12 PENCILS TALL TUBE WOODLAND,1,2011-11-11 10:50:00,0.85,15965.0,United Kingdom
575760,84992,72 SWEETHEART FAIRY CAKE CASES,3,2011-11-11 10:50:00,0.55,15965.0,United Kingdom
575760,21327,SKULLS WRITING SET ,3,2011-11-11 10:50:00,1.65,15965.0,United Kingdom
575760,23366,SET 12 COLOURING PENCILS DOILY,1,2011-11-11 10:50:00,0.65,15965.0,United Kingdom
575760,20983,12 PENCILS TALL TUBE RED RETROSPOT,2,2011-11-11 10:50:00,0.85,15965.0,United Kingdom
575760,22077,6 RIBBONS RUSTIC CHARM,1,2011-11-11 10:50:00,1.95,15965.0,United Kingdom
575760,21041,RED RETROSPOT OVEN GLOVE DOUBLE,1,2011-11-11 10:50:00,2.95,15965.0,United Kingdom
575760,85123A,WHITE HANGING HEART T-LIGHT HOLDER,20,2011-11-11 10:50:00,2.95,15965.0,United Kingdom
575760,84375,SET OF 20 KIDS COOKIE CUTTERS,1,2011-11-11 10:50:00,2.1,15965.0,United Kingdom
575760,22096,PINK PAISLEY SQUARE TISSUE BOX ,2,2011-11-11 10:50:00,0.39,15965.0,United Kingdom
575760,22082,RIBBON REEL STRIPES DESIGN ,1,2011-11-11 10:50:00,1.65,15965.0,United Kingdom
575760,84992,72 SWEETHEART FAIRY CAKE CASES,1,2011-11-11 10:50:00,0.55,15965.0,United Kingdom
575760,22082,RIBBON REEL STRIPES DESIGN ,1,2011-11-11 10:50:00,1.65,15965.0,United Kingdom
575760,23365,SET 12 COLOUR PENCILS LOVE LONDON,2,2011-11-11 10:50:00,0.65,15965.0,United Kingdom
575760,23369,SET 36 COLOUR PENCILS LOVE LONDON,2,2011-11-11 10:50:00,1.25,15965.0,United Kingdom
575760,20982,12 PENCILS TALL TUBE SKULLS,2,2011-11-11 10:50:00,0.85,15965.0,United Kingdom
575760,20978,36 PENCILS TUBE SKULLS,2,2011-11-11 10:50:00,1.25,15965.0,United Kingdom
575760,23366,SET 12 COLOURING PENCILS DOILY,2,2011-11-11 10:50:00,0.65,15965.0,United Kingdom
575760,84375,SET OF 20 KIDS COOKIE CUTTERS,2,2011-11-11 10:50:00,2.1,15965.0,United Kingdom
575760,85231B,CINAMMON SET OF 9 T-LIGHTS,10,2011-11-11 10:50:00,0.85,15965.0,United Kingdom
575760,23365,SET 12 COLOUR PENCILS LOVE LONDON,4,2011-11-11 10:50:00,0.65,15965.0,United Kingdom
575760,23370,SET 36 COLOURING PENCILS DOILY,4,2011-11-11 10:50:00,1.25,15965.0,United Kingdom
575760,22931,BAKING MOULD HEART WHITE CHOCOLATE,1,2011-11-11 10:50:00,2.55,15965.0,United Kingdom
575760,22964,3 PIECE SPACEBOY COOKIE CUTTER SET,2,2011-11-11 10:50:00,2.1,15965.0,United Kingdom
575760,21471,STRAWBERRY RAFFIA FOOD COVER,1,2011-11-11 10:50:00,3.75,15965.0,United Kingdom
575760,21466,RED FLOWER CROCHET FOOD COVER,3,2011-11-11 10:50:00,3.75,15965.0,United Kingdom
575760,21471,STRAWBERRY RAFFIA FOOD COVER,1,2011-11-11 10:50:00,3.75,15965.0,United Kingdom
575760,21465,PINK FLOWER CROCHET FOOD COVER,2,2011-11-11 10:50:00,3.75,15965.0,United Kingdom
575760,21976,PACK OF 60 MUSHROOM CAKE CASES,3,2011-11-11 10:50:00,0.55,15965.0,United Kingdom
575760,22082,RIBBON REEL STRIPES DESIGN ,1,2011-11-11 10:50:00,1.65,15965.0,United Kingdom
575760,23559,WOODLAND BUNNIES LOLLY MAKERS,1,2011-11-11 10:50:00,2.08,15965.0,United Kingdom
575760,23392,SPACEBOY ROCKET LOLLY MAKERS,1,2011-11-11 10:50:00,2.08,15965.0,United Kingdom
575760,22093,MOTORING TISSUE BOX,2,2011-11-11 10:50:00,0.39,15965.0,United Kingdom
575760,22931,BAKING MOULD HEART WHITE CHOCOLATE,1,2011-11-11 10:50:00,2.55,15965.0,United Kingdom
575760,84375,SET OF 20 KIDS COOKIE CUTTERS,2,2011-11-11 10:50:00,2.1,15965.0,United Kingdom
575760,23117,POPPY FIELDS CHOPPING BOARD,1,2011-11-11 10:50:00,4.95,15965.0,United Kingdom
575760,23116,VEGETABLE GARDEN CHOPPING BOARD,1,2011-11-11 10:50:00,4.95,15965.0,United Kingdom
575760,23203,JUMBO BAG VINTAGE DOILY ,3,2011-11-11 10:50:00,2.08,15965.0,United Kingdom
C575763,22726,ALARM CLOCK BAKELIKE GREEN,-1,2011-11-11 10:55:00,3.75,15034.0,United Kingdom
575764,23501,KEY RING BASEBALL BOOT UNION JACK,14,2011-11-11 11:02:00,1.25,15965.0,United Kingdom
575764,23500,KEY RING BASEBALL BOOT ASSORTED ,12,2011-11-11 11:02:00,1.25,15965.0,United Kingdom
575765,23320,GIANT 50'S CHRISTMAS CRACKER,12,2011-11-11 11:02:00,2.89,17730.0,United Kingdom
575765,22086,PAPER CHAIN KIT 50'S CHRISTMAS ,12,2011-11-11 11:02:00,2.95,17730.0,United Kingdom
575765,22909,SET OF 20 VINTAGE CHRISTMAS NAPKINS,12,2011-11-11 11:02:00,0.85,17730.0,United Kingdom
575765,23267,SET OF 4 SANTA PLACE SETTINGS,24,2011-11-11 11:02:00,1.25,17730.0,United Kingdom
575765,22141,CHRISTMAS CRAFT TREE TOP ANGEL,12,2011-11-11 11:02:00,2.1,17730.0,United Kingdom
575765,22163,HEART STRING MEMO HOLDER HANGING,24,2011-11-11 11:02:00,0.79,17730.0,United Kingdom
575765,35971,ROSE FOLKART HEART DECORATIONS,24,2011-11-11 11:02:00,1.25,17730.0,United Kingdom
575765,22866,HAND WARMER SCOTTY DOG DESIGN,12,2011-11-11 11:02:00,2.1,17730.0,United Kingdom
575765,21918,SET 12 KIDS COLOUR  CHALK STICKS,24,2011-11-11 11:02:00,0.42,17730.0,United Kingdom
575765,85176,SEWING SUSAN 21 NEEDLE SET,12,2011-11-11 11:02:00,0.85,17730.0,United Kingdom
575765,21519,GIN & TONIC DIET GREETING CARD ,12,2011-11-11 11:02:00,0.42,17730.0,United Kingdom
575765,84510A,SET OF 4 ENGLISH ROSE COASTERS,10,2011-11-11 11:02:00,1.25,17730.0,United Kingdom
575765,22473,TV DINNER TRAY VINTAGE PAISLEY,3,2011-11-11 11:02:00,4.95,17730.0,United Kingdom
575765,20972,PINK CREAM FELT CRAFT TRINKET BOX ,12,2011-11-11 11:02:00,1.25,17730.0,United Kingdom
575765,22947,WOODEN ADVENT CALENDAR RED,6,2011-11-11 11:02:00,7.95,17730.0,United Kingdom
575766,84947,ANTIQUE SILVER TEA GLASS ENGRAVED,6,2011-11-11 11:06:00,1.25,12856.0,United Kingdom
575766,84946,ANTIQUE SILVER T-LIGHT GLASS,18,2011-11-11 11:06:00,1.25,12856.0,United Kingdom
575766,22385,JUMBO BAG SPACEBOY DESIGN,2,2011-11-11 11:06:00,2.08,12856.0,United Kingdom
575766,23199,JUMBO BAG APPLES,2,2011-11-11 11:06:00,2.08,12856.0,United Kingdom
575766,23200,JUMBO BAG PEARS,2,2011-11-11 11:06:00,2.08,12856.0,United Kingdom
575766,21931,JUMBO STORAGE BAG SUKI,2,2011-11-11 11:06:00,2.08,12856.0,United Kingdom
575766,23202,JUMBO BAG VINTAGE LEAF,2,2011-11-11 11:06:00,2.08,12856.0,United Kingdom
575766,23323,WHITE WICKER STAR ,4,2011-11-11 11:06:00,2.1,12856.0,United Kingdom
575766,23084,RABBIT NIGHT LIGHT,3,2011-11-11 11:06:00,2.08,12856.0,United Kingdom
575766,23215,JINGLE BELL HEART ANTIQUE SILVER,12,2011-11-11 11:06:00,2.08,12856.0,United Kingdom
575766,85123A,WHITE HANGING HEART T-LIGHT HOLDER,1,2011-11-11 11:06:00,2.95,12856.0,United Kingdom
575766,23407,SET OF 2 TRAYS HOME SWEET HOME,1,2011-11-11 11:06:00,9.95,12856.0,United Kingdom
575766,22470,HEART OF WICKER LARGE,6,2011-11-11 11:06:00,2.95,12856.0,United Kingdom
575766,22694,WICKER STAR ,7,2011-11-11 11:06:00,2.1,12856.0,United Kingdom
575766,22418,10 COLOUR SPACEBOY PEN,12,2011-11-11 11:06:00,0.85,12856.0,United Kingdom
575766,84792,ENCHANTED BIRD COATHANGER 5 HOOK,2,2011-11-11 11:06:00,4.65,12856.0,United Kingdom
575766,23148,MINIATURE ANTIQUE ROSE HOOK IVORY,3,2011-11-11 11:06:00,0.83,12856.0,United Kingdom
575766,21820,GLITTER HEART GARLAND WITH BELLS ,6,2011-11-11 11:06:00,3.75,12856.0,United Kingdom
575766,21584,RETROSPOT SMALL TUBE MATCHES,4,2011-11-11 11:06:00,1.65,12856.0,United Kingdom
575766,47591D,PINK FAIRY CAKE CHILDRENS APRON,1,2011-11-11 11:06:00,1.95,12856.0,United Kingdom
575766,23329,DECORATIVE WICKER HEART LARGE,8,2011-11-11 11:06:00,1.65,12856.0,United Kingdom
575766,22197,POPCORN HOLDER,3,2011-11-11 11:06:00,0.85,12856.0,United Kingdom
575766,23322,LARGE WHITE HEART OF WICKER,2,2011-11-11 11:06:00,2.95,12856.0,United Kingdom
575766,22251,BIRDHOUSE DECORATION MAGIC GARDEN,5,2011-11-11 11:06:00,1.25,12856.0,United Kingdom
575766,22173,METAL 4 HOOK HANGER FRENCH CHATEAU,3,2011-11-11 11:06:00,3.29,12856.0,United Kingdom
575766,85123A,WHITE HANGING HEART T-LIGHT HOLDER,7,2011-11-11 11:06:00,2.95,12856.0,United Kingdom
575766,21733,RED HANGING HEART T-LIGHT HOLDER,3,2011-11-11 11:06:00,2.95,12856.0,United Kingdom
575766,22144,CHRISTMAS CRAFT LITTLE FRIENDS,1,2011-11-11 11:06:00,2.1,12856.0,United Kingdom
575766,22142,CHRISTMAS CRAFT WHITE FAIRY ,3,2011-11-11 11:06:00,1.45,12856.0,United Kingdom
575766,23353,6 GIFT TAGS VINTAGE CHRISTMAS ,2,2011-11-11 11:06:00,0.83,12856.0,United Kingdom
575767,23567,EGG CUP HENRIETTA HEN PINK,1,2011-11-11 11:11:00,1.25,17348.0,United Kingdom
575767,16236,KITTY PENCIL ERASERS,1,2011-11-11 11:11:00,0.21,17348.0,United Kingdom
575767,16235,RECYCLED PENCIL WITH RABBIT ERASER,2,2011-11-11 11:11:00,0.21,17348.0,United Kingdom
575767,23275,SET OF 3 HANGING OWLS OLLIE BEAK,1,2011-11-11 11:11:00,1.25,17348.0,United Kingdom
575767,23232,WRAP VINTAGE LEAF DESIGN,25,2011-11-11 11:11:00,0.42,17348.0,United Kingdom
575767,16011,ANIMAL STICKERS,48,2011-11-11 11:11:00,0.21,17348.0,United Kingdom
575767,21220,SET/4 BADGES DOGS,1,2011-11-11 11:11:00,1.25,17348.0,United Kingdom
575767,84199,GLOW IN DARK DOLPHINS,1,2011-11-11 11:11:00,0.21,17348.0,United Kingdom
575767,84826,ASSTD DESIGN 3D PAPER STICKERS,1,2011-11-11 11:11:00,0.85,17348.0,United Kingdom
575767,21943,CAKES AND RABBITS DESIGN FLANNEL ,1,2011-11-11 11:11:00,0.85,17348.0,United Kingdom
575767,21944,KITTENS DESIGN FLANNEL,1,2011-11-11 11:11:00,0.85,17348.0,United Kingdom
575767,21945,STRAWBERRIES  DESIGN FLANNEL ,1,2011-11-11 11:11:00,0.85,17348.0,United Kingdom
575767,21452,TOADSTOOL MONEY BOX,1,2011-11-11 11:11:00,2.95,17348.0,United Kingdom
575767,22556,PLASTERS IN TIN CIRCUS PARADE ,1,2011-11-11 11:11:00,1.65,17348.0,United Kingdom
575767,22555,PLASTERS IN TIN STRONGMAN,1,2011-11-11 11:11:00,1.65,17348.0,United Kingdom
575767,90094,NECKLACE+BRACELET SET FRUIT SALAD ,1,2011-11-11 11:11:00,2.55,17348.0,United Kingdom
575767,90099,NECKLACE+BRACELET SET BLUE HIBISCUS,1,2011-11-11 11:11:00,2.55,17348.0,United Kingdom
575767,22440,BALLOON WATER BOMB PACK OF 35,3,2011-11-11 11:11:00,0.42,17348.0,United Kingdom
575767,47590B,PINK HAPPY BIRTHDAY BUNTING,2,2011-11-11 11:11:00,5.45,17348.0,United Kingdom
575767,22445,PENCIL CASE LIFE IS BEAUTIFUL,1,2011-11-11 11:11:00,2.95,17348.0,United Kingdom
575767,23351,ROLL WRAP 50'S CHRISTMAS,1,2011-11-11 11:11:00,1.25,17348.0,United Kingdom
575767,23378,PACK OF 12 50'S CHRISTMAS TISSUES,2,2011-11-11 11:11:00,0.39,17348.0,United Kingdom
575767,90098,NECKLACE+BRACELET PINK BUTTERFLY,1,2011-11-11 11:11:00,2.55,17348.0,United Kingdom
575767,22595,GINGHAM HEART DECORATION,3,2011-11-11 11:11:00,0.85,17348.0,United Kingdom
575767,23378,PACK OF 12 50'S CHRISTMAS TISSUES,1,2011-11-11 11:11:00,0.39,17348.0,United Kingdom
575767,22551,PLASTERS IN TIN SPACEBOY,1,2011-11-11 11:11:00,1.65,17348.0,United Kingdom
575767,84569D,PACK 6 HEART/ICE-CREAM PATCHES,4,2011-11-11 11:11:00,1.25,17348.0,United Kingdom
575767,23159,SET OF 5 PANCAKE DAY MAGNETS,1,2011-11-11 11:11:00,2.08,17348.0,United Kingdom
575767,23154,SET OF 4 JAM JAR MAGNETS,1,2011-11-11 11:11:00,2.08,17348.0,United Kingdom
575767,23156,SET OF 5 MINI GROCERY MAGNETS,1,2011-11-11 11:11:00,2.08,17348.0,United Kingdom
575767,22906,12 MESSAGE CARDS WITH ENVELOPES,2,2011-11-11 11:11:00,1.65,17348.0,United Kingdom
575767,23480,MINI LIGHTS WOODLAND MUSHROOMS,1,2011-11-11 11:11:00,3.75,17348.0,United Kingdom
575767,22086,PAPER CHAIN KIT 50'S CHRISTMAS ,2,2011-11-11 11:11:00,2.95,17348.0,United Kingdom
575767,22144,CHRISTMAS CRAFT LITTLE FRIENDS,1,2011-11-11 11:11:00,2.1,17348.0,United Kingdom
575767,22315,200 RED + WHITE BENDY STRAWS,1,2011-11-11 11:11:00,1.25,17348.0,United Kingdom
575767,23010,CIRCUS PARADE BABY GIFT SET,1,2011-11-11 11:11:00,16.95,17348.0,United Kingdom
575767,84012,MAGIC SHEEP WOOL GROWING FROM PAPER,1,2011-11-11 11:11:00,0.85,17348.0,United Kingdom
