InvoiceNo,StockCode,Description,Quantity,InvoiceDate,UnitPrice,CustomerID,Country
558747,22666,RECIPE BOX PANTRY YELLOW DESIGN,5,2011-07-03 10:11:00,2.95,15465.0,United Kingdom
558747,21755,LOVE BUILDING BLOCK WORD,2,2011-07-03 10:11:00,5.95,15465.0,United Kingdom
558747,21756,BATH BUILDING BLOCK WORD,2,2011-07-03 10:11:00,5.95,15465.0,United Kingdom
558747,21463,MIRRORED DISCO BALL ,4,2011-07-03 10:11:00,5.95,15465.0,United Kingdom
558747,21430,SET/3 RED GINGHAM ROSE STORAGE BOX,24,2011-07-03 10:11:00,3.39,15465.0,United Kingdom
558747,22423,REGENCY CAKESTAND 3 TIER,16,2011-07-03 10:11:00,10.95,15465.0,United Kingdom
558748,22566,FELTCRAFT HAIRBAND PINK AND PURPLE,12,2011-07-03 10:23:00,0.85,17800.0,United Kingdom
558748,47566B,TEA TIME PARTY BUNTING,1,2011-07-03 10:23:00,4.95,17800.0,United Kingdom
558748,20727,LUNCH BAG  BLACK SKULL.,10,2011-07-03 10:23:00,1.65,17800.0,United Kingdom
558748,22383,LUNCH BAG SUKI DESIGN ,10,2011-07-03 10:23:00,1.65,17800.0,United Kingdom
558748,23206,LUNCH BAG APPLE DESIGN,10,2011-07-03 10:23:00,1.65,17800.0,United Kingdom
558748,22149,FELTCRAFT 6 FLOWER FRIENDS,10,2011-07-03 10:23:00,2.1,17800.0,United Kingdom
558748,22150,3 STRIPEY MICE FELTCRAFT,8,2011-07-03 10:23:00,1.95,17800.0,United Kingdom
558748,22147,FELTCRAFT BUTTERFLY HEARTS,10,2011-07-03 10:23:00,1.45,17800.0,United Kingdom
558749,48184,DOORMAT ENGLISH ROSE ,1,2011-07-03 10:28:00,7.95,16326.0,United Kingdom
558749,48194,DOORMAT HEARTS,1,2011-07-03 10:28:00,7.95,16326.0,United Kingdom
558749,22692,DOORMAT WELCOME TO OUR HOME,1,2011-07-03 10:28:00,7.95,16326.0,United Kingdom
558749,23283,DOORMAT VINTAGE LEAVES DESIGN ,1,2011-07-03 10:28:00,7.95,16326.0,United Kingdom
558749,23284,DOORMAT KEEP CALM AND COME IN,3,2011-07-03 10:28:00,7.95,16326.0,United Kingdom
558749,48129,DOORMAT TOPIARY,2,2011-07-03 10:28:00,7.95,16326.0,United Kingdom
558749,48111,DOORMAT 3 SMILEY CATS,2,2011-07-03 10:28:00,7.95,16326.0,United Kingdom
558749,20685,DOORMAT RED RETROSPOT,2,2011-07-03 10:28:00,7.95,16326.0,United Kingdom
558749,48194,DOORMAT HEARTS,2,2011-07-03 10:28:00,7.95,16326.0,United Kingdom
558749,23013,GLASS APOTHECARY BOTTLE TONIC,2,2011-07-03 10:28:00,3.95,16326.0,United Kingdom
558749,23012,GLASS APOTHECARY BOTTLE PERFUME,2,2011-07-03 10:28:00,3.95,16326.0,United Kingdom
558749,23014,GLASS APOTHECARY BOTTLE ELIXIR,2,2011-07-03 10:28:00,3.95,16326.0,United Kingdom
558749,84580,MOUSE TOY WITH PINK T-SHIRT,1,2011-07-03 10:28:00,3.75,16326.0,United Kingdom
558749,47503A,ASS FLORAL PRINT MULTI SCREWDRIVER,1,2011-07-03 10:28:00,0.42,16326.0,United Kingdom
558749,85132C,CHARLIE AND LOLA FIGURES TINS,1,2011-07-03 10:28:00,1.95,16326.0,United Kingdom
558749,85132C,CHARLIE AND LOLA FIGURES TINS,2,2011-07-03 10:28:00,1.95,16326.0,United Kingdom
558749,47504K,ENGLISH ROSE GARDEN SECATEURS,3,2011-07-03 10:28:00,0.79,16326.0,United Kingdom
558750,21933,PINK VINTAGE PAISLEY PICNIC BAG,10,2011-07-03 10:47:00,1.65,18226.0,United Kingdom
558750,23322,LARGE WHITE HEART OF WICKER,6,2011-07-03 10:47:00,2.95,18226.0,United Kingdom
558750,23321,SMALL WHITE HEART OF WICKER,12,2011-07-03 10:47:00,1.65,18226.0,United Kingdom
558750,22383,LUNCH BAG SUKI DESIGN ,20,2011-07-03 10:47:00,1.65,18226.0,United Kingdom
558750,22384,LUNCH BAG PINK POLKADOT,10,2011-07-03 10:47:00,1.65,18226.0,United Kingdom
558750,23206,LUNCH BAG APPLE DESIGN,20,2011-07-03 10:47:00,1.65,18226.0,United Kingdom
558750,23208,LUNCH BAG VINTAGE LEAF DESIGN,20,2011-07-03 10:47:00,1.65,18226.0,United Kingdom
558750,23209,LUNCH BAG DOILEY PATTERN ,10,2011-07-03 10:47:00,1.65,18226.0,United Kingdom
558750,20725,LUNCH BAG RED RETROSPOT,20,2011-07-03 10:47:00,1.65,18226.0,United Kingdom
558750,20728,LUNCH BAG CARS BLUE,20,2011-07-03 10:47:00,1.65,18226.0,United Kingdom
558750,20727,LUNCH BAG  BLACK SKULL.,10,2011-07-03 10:47:00,1.65,18226.0,United Kingdom
558750,21790,VINTAGE SNAP CARDS,12,2011-07-03 10:47:00,0.85,18226.0,United Kingdom
558750,21915,RED  HARMONICA IN BOX ,12,2011-07-03 10:47:00,1.25,18226.0,United Kingdom
558750,22549,PICTURE DOMINOES,12,2011-07-03 10:47:00,1.45,18226.0,United Kingdom
558750,23199,JUMBO BAG APPLES,10,2011-07-03 10:47:00,2.08,18226.0,United Kingdom
558750,22411,JUMBO SHOPPER VINTAGE RED PAISLEY,10,2011-07-03 10:47:00,2.08,18226.0,United Kingdom
558750,23202,JUMBO BAG VINTAGE LEAF,10,2011-07-03 10:47:00,2.08,18226.0,United Kingdom
558750,23301,GARDENERS KNEELING PAD KEEP CALM ,12,2011-07-03 10:47:00,1.65,18226.0,United Kingdom
558750,21166,COOK WITH WINE METAL SIGN ,12,2011-07-03 10:47:00,2.08,18226.0,United Kingdom
558750,21733,RED HANGING HEART T-LIGHT HOLDER,6,2011-07-03 10:47:00,2.95,18226.0,United Kingdom
558750,23298,SPOTTY BUNTING,3,2011-07-03 10:47:00,4.95,18226.0,United Kingdom
558751,23084,RABBIT NIGHT LIGHT,3,2011-07-03 11:26:00,2.08,16009.0,United Kingdom
558751,84674,FLYING PIG WATERING CAN,2,2011-07-03 11:26:00,2.95,16009.0,United Kingdom
558751,22433,WATERING CAN GREEN DINOSAUR,1,2011-07-03 11:26:00,1.95,16009.0,United Kingdom
558751,22432,WATERING CAN PINK BUNNY,1,2011-07-03 11:26:00,1.95,16009.0,United Kingdom
558751,22431,WATERING CAN BLUE ELEPHANT,2,2011-07-03 11:26:00,1.95,16009.0,United Kingdom
558751,22111,SCOTTIE DOG HOT WATER BOTTLE,1,2011-07-03 11:26:00,4.95,16009.0,United Kingdom
558751,21481,FAWN BLUE HOT WATER BOTTLE,1,2011-07-03 11:26:00,2.95,16009.0,United Kingdom
558751,22112,CHOCOLATE HOT WATER BOTTLE,2,2011-07-03 11:26:00,4.95,16009.0,United Kingdom
558751,23322,LARGE WHITE HEART OF WICKER,6,2011-07-03 11:26:00,2.95,16009.0,United Kingdom
558751,23302,KNEELING MAT HOUSEWORK  DESIGN,2,2011-07-03 11:26:00,1.65,16009.0,United Kingdom
558751,23300,GARDENERS KNEELING PAD CUP OF TEA ,2,2011-07-03 11:26:00,1.65,16009.0,United Kingdom
558751,23078,ICE CREAM PEN LIP GLOSS ,24,2011-07-03 11:26:00,1.25,16009.0,United Kingdom
558751,23341,PINK DINER WALL CLOCK,1,2011-07-03 11:26:00,8.5,16009.0,United Kingdom
558751,23342,MINT DINER WALL CLOCK,1,2011-07-03 11:26:00,8.5,16009.0,United Kingdom
558751,22910,PAPER CHAIN KIT VINTAGE CHRISTMAS,6,2011-07-03 11:26:00,2.95,16009.0,United Kingdom
558751,22086,PAPER CHAIN KIT 50'S CHRISTMAS ,6,2011-07-03 11:26:00,2.95,16009.0,United Kingdom
558751,22940,FELTCRAFT CHRISTMAS FAIRY,5,2011-07-03 11:26:00,4.25,16009.0,United Kingdom
558751,84988,SET OF 72 PINK HEART PAPER DOILIES,3,2011-07-03 11:26:00,1.45,16009.0,United Kingdom
558751,21974,SET OF 36 PAISLEY FLOWER DOILIES,2,2011-07-03 11:26:00,1.45,16009.0,United Kingdom
558751,84987,SET OF 36 TEATIME PAPER DOILIES,2,2011-07-03 11:26:00,1.45,16009.0,United Kingdom
558751,84988,SET OF 72 PINK HEART PAPER DOILIES,2,2011-07-03 11:26:00,1.45,16009.0,United Kingdom
558751,22956,36 FOIL HEART CAKE CASES,2,2011-07-03 11:26:00,2.1,16009.0,United Kingdom
558751,22851,SET 20 NAPKINS FAIRY CAKES DESIGN ,1,2011-07-03 11:26:00,0.85,16009.0,United Kingdom
558751,22907,PACK OF 20 NAPKINS PANTRY DESIGN,1,2011-07-03 11:26:00,0.85,16009.0,United Kingdom
558751,22851,SET 20 NAPKINS FAIRY CAKES DESIGN ,1,2011-07-03 11:26:00,0.85,16009.0,United Kingdom
558751,22851,SET 20 NAPKINS FAIRY CAKES DESIGN ,1,2011-07-03 11:26:00,0.85,16009.0,United Kingdom
558751,21078,SET/20 STRAWBERRY PAPER NAPKINS ,3,2011-07-03 11:26:00,0.85,16009.0,United Kingdom
558751,21080,SET/20 RED RETROSPOT PAPER NAPKINS ,1,2011-07-03 11:26:00,0.85,16009.0,United Kingdom
558751,22908,PACK OF 20 NAPKINS RED APPLES,2,2011-07-03 11:26:00,0.85,16009.0,United Kingdom
558751,21078,SET/20 STRAWBERRY PAPER NAPKINS ,3,2011-07-03 11:26:00,0.85,16009.0,United Kingdom
558751,21080,SET/20 RED RETROSPOT PAPER NAPKINS ,1,2011-07-03 11:26:00,0.85,16009.0,United Kingdom
558751,23207,LUNCH BAG ALPHABET DESIGN,2,2011-07-03 11:26:00,1.65,16009.0,United Kingdom
558751,22384,LUNCH BAG PINK POLKADOT,2,2011-07-03 11:26:00,1.65,16009.0,United Kingdom
558751,20727,LUNCH BAG  BLACK SKULL.,2,2011-07-03 11:26:00,1.65,16009.0,United Kingdom
558751,20728,LUNCH BAG CARS BLUE,2,2011-07-03 11:26:00,1.65,16009.0,United Kingdom
558751,22382,LUNCH BAG SPACEBOY DESIGN ,2,2011-07-03 11:26:00,1.65,16009.0,United Kingdom
558751,23192,BUNDLE OF 3 ALPHABET EXERCISE BOOKS,3,2011-07-03 11:26:00,1.65,16009.0,United Kingdom
558751,23191,BUNDLE OF 3 RETRO NOTE BOOKS,3,2011-07-03 11:26:00,1.65,16009.0,United Kingdom
558751,20761,BLUE PAISLEY SKETCHBOOK,1,2011-07-03 11:26:00,3.75,16009.0,United Kingdom
558751,20763,DAISY SKETCHBOOK ,2,2011-07-03 11:26:00,3.75,16009.0,United Kingdom
558751,20768,GREEN FERN JOURNAL ,2,2011-07-03 11:26:00,2.55,16009.0,United Kingdom
558751,20761,BLUE PAISLEY SKETCHBOOK,1,2011-07-03 11:26:00,3.75,16009.0,United Kingdom
558751,22141,CHRISTMAS CRAFT TREE TOP ANGEL,3,2011-07-03 11:26:00,2.1,16009.0,United Kingdom
558751,22964,3 PIECE SPACEBOY COOKIE CUTTER SET,2,2011-07-03 11:26:00,2.1,16009.0,United Kingdom
558751,22141,CHRISTMAS CRAFT TREE TOP ANGEL,1,2011-07-03 11:26:00,2.1,16009.0,United Kingdom
558751,22142,CHRISTMAS CRAFT WHITE FAIRY ,4,2011-07-03 11:26:00,1.45,16009.0,United Kingdom
558751,22955,36 FOIL STAR CAKE CASES ,6,2011-07-03 11:26:00,2.1,16009.0,United Kingdom
558751,22630,DOLLY GIRL LUNCH BOX,2,2011-07-03 11:26:00,1.95,16009.0,United Kingdom
558751,22629,SPACEBOY LUNCH BOX ,2,2011-07-03 11:26:00,1.95,16009.0,United Kingdom
558751,21563,RED HEART SHAPE LOVE BUCKET ,5,2011-07-03 11:26:00,2.95,16009.0,United Kingdom
558751,20914,SET/5 RED RETROSPOT LID GLASS BOWLS,3,2011-07-03 11:26:00,2.95,16009.0,United Kingdom
558751,22063,CERAMIC BOWL WITH STRAWBERRY DESIGN,1,2011-07-03 11:26:00,2.95,16009.0,United Kingdom
558751,22063,CERAMIC BOWL WITH STRAWBERRY DESIGN,2,2011-07-03 11:26:00,2.95,16009.0,United Kingdom
558751,22063,CERAMIC BOWL WITH STRAWBERRY DESIGN,2,2011-07-03 11:26:00,2.95,16009.0,United Kingdom
558751,22055,MINI CAKE STAND  HANGING STRAWBERY,6,2011-07-03 11:26:00,1.65,16009.0,United Kingdom
558751,37446,MINI CAKE STAND WITH HANGING CAKES,2,2011-07-03 11:26:00,1.45,16009.0,United Kingdom
558751,22063,CERAMIC BOWL WITH STRAWBERRY DESIGN,1,2011-07-03 11:26:00,2.95,16009.0,United Kingdom
558751,21555,CERAMIC STRAWBERRY TRINKET TRAY,1,2011-07-03 11:26:00,2.55,16009.0,United Kingdom
558751,37446,MINI CAKE STAND WITH HANGING CAKES,2,2011-07-03 11:26:00,1.45,16009.0,United Kingdom
558751,23152,IVORY SWEETHEART WIRE LETTER RACK ,2,2011-07-03 11:26:00,3.75,16009.0,United Kingdom
558751,85032A,ROMANTIC IMAGES GIFT WRAP SET,12,2011-07-03 11:26:00,0.65,16009.0,United Kingdom
558751,85032B,BLOSSOM IMAGES GIFT WRAP SET,12,2011-07-03 11:26:00,0.65,16009.0,United Kingdom
558751,22993,SET OF 4 PANTRY JELLY MOULDS,12,2011-07-03 11:26:00,1.25,16009.0,United Kingdom
558751,37449,CERAMIC CAKE STAND + HANGING CAKES,3,2011-07-03 11:26:00,9.95,16009.0,United Kingdom
558751,22061,LARGE CAKE STAND  HANGING STRAWBERY,4,2011-07-03 11:26:00,9.95,16009.0,United Kingdom
558751,21564,PINK  HEART SHAPE LOVE BUCKET ,5,2011-07-03 11:26:00,2.95,16009.0,United Kingdom
558752,23148,MINIATURE ANTIQUE ROSE HOOK IVORY,6,2011-07-03 11:40:00,0.83,16931.0,United Kingdom
558752,23147,SINGLE ANTIQUE ROSE HOOK IVORY,6,2011-07-03 11:40:00,1.45,16931.0,United Kingdom
558752,23206,LUNCH BAG APPLE DESIGN,3,2011-07-03 11:40:00,1.65,16931.0,United Kingdom
558752,22384,LUNCH BAG PINK POLKADOT,3,2011-07-03 11:40:00,1.65,16931.0,United Kingdom
558752,23208,LUNCH BAG VINTAGE LEAF DESIGN,3,2011-07-03 11:40:00,1.65,16931.0,United Kingdom
558752,21932,SCANDINAVIAN PAISLEY PICNIC BAG,3,2011-07-03 11:40:00,1.65,16931.0,United Kingdom
558752,21933,PINK VINTAGE PAISLEY PICNIC BAG,3,2011-07-03 11:40:00,1.65,16931.0,United Kingdom
558752,23199,JUMBO BAG APPLES,3,2011-07-03 11:40:00,2.08,16931.0,United Kingdom
558752,23200,JUMBO BAG PEARS,6,2011-07-03 11:40:00,2.08,16931.0,United Kingdom
558752,22381,TOY TIDY PINK POLKADOT,4,2011-07-03 11:40:00,2.1,16931.0,United Kingdom
558752,85066,CREAM SWEETHEART MINI CHEST,1,2011-07-03 11:40:00,12.75,16931.0,United Kingdom
558752,22139,RETROSPOT TEA SET CERAMIC 11 PC ,3,2011-07-03 11:40:00,4.95,16931.0,United Kingdom
558752,23065,LARGE DECO JEWELLERY STAND,1,2011-07-03 11:40:00,12.5,16931.0,United Kingdom
558752,21794,CLASSIC FRENCH STYLE BASKET NATURAL,2,2011-07-03 11:40:00,3.95,16931.0,United Kingdom
558752,85123A,WHITE HANGING HEART T-LIGHT HOLDER,9,2011-07-03 11:40:00,2.95,16931.0,United Kingdom
558752,23132,SMALL IVORY HEART WALL ORGANISER,1,2011-07-03 11:40:00,5.75,16931.0,United Kingdom
558752,23131,MISTLETOE HEART WREATH CREAM,1,2011-07-03 11:40:00,4.15,16931.0,United Kingdom
558752,23152,IVORY SWEETHEART WIRE LETTER RACK ,1,2011-07-03 11:40:00,3.75,16931.0,United Kingdom
558752,21901,"KEY FOB , BACK DOOR ",1,2011-07-03 11:40:00,0.65,16931.0,United Kingdom
558752,21163,DO NOT TOUCH MY STUFF DOOR HANGER ,2,2011-07-03 11:40:00,0.39,16931.0,United Kingdom
558752,21901,"KEY FOB , BACK DOOR ",4,2011-07-03 11:40:00,0.65,16931.0,United Kingdom
558752,22464,HANGING METAL HEART LANTERN,3,2011-07-03 11:40:00,1.65,16931.0,United Kingdom
558752,22251,BIRDHOUSE DECORATION MAGIC GARDEN,1,2011-07-03 11:40:00,1.25,16931.0,United Kingdom
558752,22219,LOVEBIRD HANGING DECORATION WHITE ,6,2011-07-03 11:40:00,0.85,16931.0,United Kingdom
558752,22296,HEART IVORY TRELLIS LARGE,3,2011-07-03 11:40:00,1.65,16931.0,United Kingdom
558752,22336,DOVE DECORATION PAINTED ZINC ,6,2011-07-03 11:40:00,0.65,16931.0,United Kingdom
558752,22297,HEART IVORY TRELLIS SMALL,3,2011-07-03 11:40:00,1.25,16931.0,United Kingdom
558752,22268,DECORATION SITTING BUNNY,6,2011-07-03 11:40:00,0.19,16931.0,United Kingdom
558752,23300,GARDENERS KNEELING PAD CUP OF TEA ,6,2011-07-03 11:40:00,1.65,16931.0,United Kingdom
558752,23301,GARDENERS KNEELING PAD KEEP CALM ,6,2011-07-03 11:40:00,1.65,16931.0,United Kingdom
558752,23302,KNEELING MAT HOUSEWORK  DESIGN,3,2011-07-03 11:40:00,1.65,16931.0,United Kingdom
558752,22556,PLASTERS IN TIN CIRCUS PARADE ,13,2011-07-03 11:40:00,1.65,16931.0,United Kingdom
558752,84971S,SMALL HEART FLOWERS HOOK ,2,2011-07-03 11:40:00,0.85,16931.0,United Kingdom
558752,23138,SINGLE WIRE HOOK IVORY HEART,3,2011-07-03 11:40:00,1.45,16931.0,United Kingdom
558752,22178,VICTORIAN GLASS HANGING T-LIGHT,3,2011-07-03 11:40:00,1.25,16931.0,United Kingdom
558752,21135,VICTORIAN  METAL POSTCARD SPRING,8,2011-07-03 11:40:00,1.69,16931.0,United Kingdom
558752,23146,TRIPLE HOOK ANTIQUE IVORY ROSE,1,2011-07-03 11:40:00,3.29,16931.0,United Kingdom
558752,23140,TRIPLE WIRE HOOK IVORY HEART,1,2011-07-03 11:40:00,4.15,16931.0,United Kingdom
558752,23202,JUMBO BAG VINTAGE LEAF,3,2011-07-03 11:40:00,2.08,16931.0,United Kingdom
558752,20713,JUMBO BAG OWLS,3,2011-07-03 11:40:00,2.08,16931.0,United Kingdom
C558753,37500,TEA TIME TEAPOT IN GIFT BOX,-1,2011-07-03 11:54:00,4.95,15033.0,United Kingdom
C558753,21359,RELAX LARGE WOOD LETTERS,-1,2011-07-03 11:54:00,3.95,15033.0,United Kingdom
C558753,21364,PEACE SMALL WOOD LETTERS,-1,2011-07-03 11:54:00,6.75,15033.0,United Kingdom
558754,22382,LUNCH BAG SPACEBOY DESIGN ,2,2011-07-03 12:10:00,1.65,15518.0,United Kingdom
558754,23206,LUNCH BAG APPLE DESIGN,6,2011-07-03 12:10:00,1.65,15518.0,United Kingdom
558754,20727,LUNCH BAG  BLACK SKULL.,4,2011-07-03 12:10:00,1.65,15518.0,United Kingdom
558754,20726,LUNCH BAG WOODLAND,4,2011-07-03 12:10:00,1.65,15518.0,United Kingdom
558754,84692,BOX OF 24 COCKTAIL PARASOLS,6,2011-07-03 12:10:00,0.42,15518.0,United Kingdom
558754,23209,LUNCH BAG DOILEY PATTERN ,5,2011-07-03 12:10:00,1.65,15518.0,United Kingdom
558754,23122,PARTY CHARMS 50 PIECES,2,2011-07-03 12:10:00,0.83,15518.0,United Kingdom
558754,23207,LUNCH BAG ALPHABET DESIGN,5,2011-07-03 12:10:00,1.65,15518.0,United Kingdom
558754,23123,COCKTAIL SWORDS 50 PIECES,4,2011-07-03 12:10:00,0.83,15518.0,United Kingdom
558754,22570,FELTCRAFT CUSHION RABBIT,1,2011-07-03 12:10:00,3.75,15518.0,United Kingdom
558754,22568,FELTCRAFT CUSHION OWL,1,2011-07-03 12:10:00,3.75,15518.0,United Kingdom
558754,23120,PACK OF 6 SMALL FRUIT STRAWS,7,2011-07-03 12:10:00,0.42,15518.0,United Kingdom
558754,22568,FELTCRAFT CUSHION OWL,1,2011-07-03 12:10:00,3.75,15518.0,United Kingdom
558754,22570,FELTCRAFT CUSHION RABBIT,1,2011-07-03 12:10:00,3.75,15518.0,United Kingdom
558754,22456,NATURAL SLATE CHALKBOARD LARGE ,2,2011-07-03 12:10:00,4.95,15518.0,United Kingdom
558754,22210,WOOD STAMP SET BEST WISHES,6,2011-07-03 12:10:00,0.83,15518.0,United Kingdom
558754,22620,4 TRADITIONAL SPINNING TOPS,8,2011-07-03 12:10:00,1.45,15518.0,United Kingdom
558754,22961,JAM MAKING SET PRINTED,3,2011-07-03 12:10:00,1.45,15518.0,United Kingdom
558754,22030,SWALLOWS GREETING CARD,12,2011-07-03 12:10:00,0.42,15518.0,United Kingdom
558754,23126,FELTCRAFT GIRL AMELIE KIT,1,2011-07-03 12:10:00,4.95,15518.0,United Kingdom
558754,84558A,3D DOG PICTURE PLAYING CARDS,2,2011-07-03 12:10:00,2.95,15518.0,United Kingdom
558754,21918,SET 12 KIDS COLOUR  CHALK STICKS,4,2011-07-03 12:10:00,0.42,15518.0,United Kingdom
558754,22556,PLASTERS IN TIN CIRCUS PARADE ,6,2011-07-03 12:10:00,1.65,15518.0,United Kingdom
558754,22437,SET OF 9 BLACK SKULL BALLOONS,4,2011-07-03 12:10:00,0.85,15518.0,United Kingdom
558754,22435,SET OF 9 HEART SHAPED BALLOONS,5,2011-07-03 12:10:00,1.25,15518.0,United Kingdom
558754,71459,HANGING JAM JAR T-LIGHT HOLDER,12,2011-07-03 12:10:00,0.85,15518.0,United Kingdom
558754,21558,SKULL LUNCH BOX WITH CUTLERY ,1,2011-07-03 12:10:00,2.55,15518.0,United Kingdom
558754,21559,STRAWBERRY LUNCH BOX WITH CUTLERY,1,2011-07-03 12:10:00,2.55,15518.0,United Kingdom
558754,22623,BOX OF VINTAGE JIGSAW BLOCKS ,2,2011-07-03 12:10:00,5.95,15518.0,United Kingdom
558754,23315,IVORY REFECTORY CLOCK,1,2011-07-03 12:10:00,9.95,15518.0,United Kingdom
558754,22726,ALARM CLOCK BAKELIKE GREEN,1,2011-07-03 12:10:00,3.75,15518.0,United Kingdom
558754,23342,MINT DINER WALL CLOCK,1,2011-07-03 12:10:00,8.5,15518.0,United Kingdom
558754,21977,PACK OF 60 PINK PAISLEY CAKE CASES,24,2011-07-03 12:10:00,0.55,15518.0,United Kingdom
558754,22423,REGENCY CAKESTAND 3 TIER,2,2011-07-03 12:10:00,12.75,15518.0,United Kingdom
558754,22607,WOODEN ROUNDERS GARDEN SET ,2,2011-07-03 12:10:00,9.95,15518.0,United Kingdom
558754,22727,ALARM CLOCK BAKELIKE RED ,1,2011-07-03 12:10:00,3.75,15518.0,United Kingdom
558754,23184,BULL DOG BOTTLE OPENER,1,2011-07-03 12:10:00,4.95,15518.0,United Kingdom
558754,21843,RED RETROSPOT CAKE STAND,2,2011-07-03 12:10:00,10.95,15518.0,United Kingdom
558754,22659,LUNCH BOX I LOVE LONDON,1,2011-07-03 12:10:00,1.95,15518.0,United Kingdom
558754,84380,SET OF 3 BUTTERFLY COOKIE CUTTERS,4,2011-07-03 12:10:00,1.25,15518.0,United Kingdom
558754,22729,ALARM CLOCK BAKELIKE ORANGE,1,2011-07-03 12:10:00,3.75,15518.0,United Kingdom
558754,22729,ALARM CLOCK BAKELIKE ORANGE,7,2011-07-03 12:10:00,3.75,15518.0,United Kingdom
558754,21080,SET/20 RED RETROSPOT PAPER NAPKINS ,2,2011-07-03 12:10:00,0.85,15518.0,United Kingdom
558754,21078,SET/20 STRAWBERRY PAPER NAPKINS ,3,2011-07-03 12:10:00,0.85,15518.0,United Kingdom
558754,23301,GARDENERS KNEELING PAD KEEP CALM ,4,2011-07-03 12:10:00,1.65,15518.0,United Kingdom
558754,23300,GARDENERS KNEELING PAD CUP OF TEA ,2,2011-07-03 12:10:00,1.65,15518.0,United Kingdom
558754,23310,BUBBLEGUM RING ASSORTED,72,2011-07-03 12:10:00,0.42,15518.0,United Kingdom
558754,22659,LUNCH BOX I LOVE LONDON,5,2011-07-03 12:10:00,1.95,15518.0,United Kingdom
558754,22616,PACK OF 12 LONDON TISSUES ,12,2011-07-03 12:10:00,0.29,15518.0,United Kingdom
558754,22900,SET 2 TEA TOWELS I LOVE LONDON ,6,2011-07-03 12:10:00,3.25,15518.0,United Kingdom
558754,20914,SET/5 RED RETROSPOT LID GLASS BOWLS,6,2011-07-03 12:10:00,2.95,15518.0,United Kingdom
558755,10135,COLOURING PENCILS BROWN TUBE,90,2011-07-03 12:21:00,1.25,14053.0,United Kingdom
558755,21429,RED GINGHAM ROSE JEWELLERY BOX,15,2011-07-03 12:21:00,1.95,14053.0,United Kingdom
558755,10135,COLOURING PENCILS BROWN TUBE,10,2011-07-03 12:21:00,1.25,14053.0,United Kingdom
558756,23245,SET OF 3 REGENCY CAKE TINS,4,2011-07-03 12:21:00,4.95,12843.0,United Kingdom
558756,23207,LUNCH BAG ALPHABET DESIGN,10,2011-07-03 12:21:00,1.65,12843.0,United Kingdom
558756,21876,POTTERING MUG,12,2011-07-03 12:21:00,1.25,12843.0,United Kingdom
558756,22980,PANTRY SCRUBBING BRUSH,1,2011-07-03 12:21:00,1.65,12843.0,United Kingdom
558756,22427,ENAMEL FLOWER JUG CREAM,4,2011-07-03 12:21:00,5.95,12843.0,United Kingdom
558756,85014A,BLACK/BLUE POLKADOT UMBRELLA,3,2011-07-03 12:21:00,5.95,12843.0,United Kingdom
558756,85014B,RED RETROSPOT UMBRELLA,3,2011-07-03 12:21:00,5.95,12843.0,United Kingdom
558756,23298,SPOTTY BUNTING,6,2011-07-03 12:21:00,4.95,12843.0,United Kingdom
558756,20728,LUNCH BAG CARS BLUE,10,2011-07-03 12:21:00,1.65,12843.0,United Kingdom
558756,47566,PARTY BUNTING,12,2011-07-03 12:21:00,4.95,12843.0,United Kingdom
558756,47566B,TEA TIME PARTY BUNTING,7,2011-07-03 12:21:00,4.95,12843.0,United Kingdom
558756,85099C,JUMBO  BAG BAROQUE BLACK WHITE,20,2011-07-03 12:21:00,2.08,12843.0,United Kingdom
558757,22185,SLATE TILE NATURAL HANGING,5,2011-07-03 12:22:00,1.65,13148.0,United Kingdom
558757,16236,KITTY PENCIL ERASERS,2,2011-07-03 12:22:00,0.21,13148.0,United Kingdom
558757,18098C,PORCELAIN BUTTERFLY OIL BURNER,5,2011-07-03 12:22:00,2.95,13148.0,United Kingdom
558757,21420,OYSTER TRINKET BOX,1,2011-07-03 12:22:00,3.25,13148.0,United Kingdom
558757,22171,3 HOOK PHOTO SHELF ANTIQUE WHITE,2,2011-07-03 12:22:00,8.5,13148.0,United Kingdom
558757,21363,HOME SMALL WOOD LETTERS,1,2011-07-03 12:22:00,4.95,13148.0,United Kingdom
558757,35648,VINTAGE BEAD PINK PURSE ,2,2011-07-03 12:22:00,0.83,13148.0,United Kingdom
558757,35646,VINTAGE BEAD PINK EVENING BAG,5,2011-07-03 12:22:00,1.25,13148.0,United Kingdom
558757,22030,SWALLOWS GREETING CARD,12,2011-07-03 12:22:00,0.42,13148.0,United Kingdom
558757,22715,CARD WEDDING DAY,12,2011-07-03 12:22:00,0.42,13148.0,United Kingdom
558757,21420,OYSTER TRINKET BOX,1,2011-07-03 12:22:00,3.25,13148.0,United Kingdom
558757,23110,PARISIENNE KEY CABINET ,2,2011-07-03 12:22:00,5.75,13148.0,United Kingdom
558757,21415,CLAM SHELL SMALL ,3,2011-07-03 12:22:00,2.1,13148.0,United Kingdom
558757,21417,COCKLE SHELL DISH,1,2011-07-03 12:22:00,2.1,13148.0,United Kingdom
558757,35648,VINTAGE BEAD PINK PURSE ,2,2011-07-03 12:22:00,0.83,13148.0,United Kingdom
558757,20886,BOX OF 9 PEBBLE CANDLES,7,2011-07-03 12:22:00,1.95,13148.0,United Kingdom
558757,21609,SET 12 LAVENDER  BOTANICAL T-LIGHTS,3,2011-07-03 12:22:00,2.95,13148.0,United Kingdom
558757,22743,MAKE YOUR OWN FLOWERPOWER CARD KIT,1,2011-07-03 12:22:00,2.95,13148.0,United Kingdom
558757,21473,SWEETHEART CREAM STEEL TABLE RECT,1,2011-07-03 12:22:00,19.95,13148.0,United Kingdom
558757,23146,TRIPLE HOOK ANTIQUE IVORY ROSE,1,2011-07-03 12:22:00,3.29,13148.0,United Kingdom
558757,23147,SINGLE ANTIQUE ROSE HOOK IVORY,3,2011-07-03 12:22:00,1.45,13148.0,United Kingdom
558757,23148,MINIATURE ANTIQUE ROSE HOOK IVORY,3,2011-07-03 12:22:00,0.83,13148.0,United Kingdom
558757,35646,VINTAGE BEAD PINK EVENING BAG,1,2011-07-03 12:22:00,1.25,13148.0,United Kingdom
558757,35648,VINTAGE BEAD PINK PURSE ,1,2011-07-03 12:22:00,0.83,13148.0,United Kingdom
558757,82484,WOOD BLACK BOARD ANT WHITE FINISH,2,2011-07-03 12:22:00,7.95,13148.0,United Kingdom
558757,21735,TWO DOOR CURIO CABINET,4,2011-07-03 12:22:00,12.75,13148.0,United Kingdom
558757,21609,SET 12 LAVENDER  BOTANICAL T-LIGHTS,1,2011-07-03 12:22:00,2.95,13148.0,United Kingdom
558757,22815,CARD PSYCHEDELIC APPLES,12,2011-07-03 12:22:00,0.42,13148.0,United Kingdom
558758,21034,REX CASH+CARRY JUMBO SHOPPER,2,2011-07-03 12:27:00,0.95,17939.0,United Kingdom
558758,22223,CAKE PLATE LOVEBIRD PINK,2,2011-07-03 12:27:00,4.95,17939.0,United Kingdom
558758,22222,CAKE PLATE LOVEBIRD WHITE,2,2011-07-03 12:27:00,4.95,17939.0,United Kingdom
558758,22488,NATURAL SLATE RECTANGLE CHALKBOARD,7,2011-07-03 12:27:00,1.65,17939.0,United Kingdom
558758,84817,DANISH ROSE DECORATIVE PLATE,12,2011-07-03 12:27:00,2.1,17939.0,United Kingdom
558758,22456,NATURAL SLATE CHALKBOARD LARGE ,3,2011-07-03 12:27:00,4.95,17939.0,United Kingdom
558758,22778,GLASS CLOCHE SMALL,2,2011-07-03 12:27:00,3.95,17939.0,United Kingdom
558758,21326,AGED GLASS SILVER T-LIGHT HOLDER,1,2011-07-03 12:27:00,0.65,17939.0,United Kingdom
558758,20802,SMALL GLASS SUNDAE DISH CLEAR,3,2011-07-03 12:27:00,1.65,17939.0,United Kingdom
558758,21395,BLUE POLKADOT BEAKER ,1,2011-07-03 12:27:00,0.39,17939.0,United Kingdom
558758,21394,RED POLKADOT BEAKER ,1,2011-07-03 12:27:00,0.39,17939.0,United Kingdom
558758,23109,LED TEA LIGHTS,4,2011-07-03 12:27:00,2.89,17939.0,United Kingdom
558759,22780,LIGHT GARLAND BUTTERFILES PINK,8,2011-07-03 12:36:00,4.25,13148.0,United Kingdom
558759,22779,WOODEN OWLS LIGHT GARLAND ,7,2011-07-03 12:36:00,4.25,13148.0,United Kingdom
558759,22037,ROBOT BIRTHDAY CARD,12,2011-07-03 12:36:00,0.42,13148.0,United Kingdom
558759,21506,"FANCY FONT BIRTHDAY CARD, ",12,2011-07-03 12:36:00,0.42,13148.0,United Kingdom
558759,22716,CARD CIRCUS PARADE,12,2011-07-03 12:36:00,0.42,13148.0,United Kingdom
558759,21504,SKULLS GREETING CARD,12,2011-07-03 12:36:00,0.42,13148.0,United Kingdom
558759,78034B,BLUE NETTING STORAGE HANGER,1,2011-07-03 12:36:00,1.95,13148.0,United Kingdom
558759,78034B,BLUE NETTING STORAGE HANGER,2,2011-07-03 12:36:00,1.95,13148.0,United Kingdom
558759,21890,S/6 WOODEN SKITTLES IN COTTON BAG,3,2011-07-03 12:36:00,3.25,13148.0,United Kingdom
558759,21828,EIGHT PIECE SNAKE  SET,2,2011-07-03 12:36:00,1.25,13148.0,United Kingdom
558759,21829,DINOSAUR KEYRINGS ASSORTED,36,2011-07-03 12:36:00,0.21,13148.0,United Kingdom
558759,22271,FELTCRAFT DOLL ROSIE,2,2011-07-03 12:36:00,2.95,13148.0,United Kingdom
558759,22274,FELTCRAFT DOLL EMILY,2,2011-07-03 12:36:00,2.95,13148.0,United Kingdom
558759,22273,FELTCRAFT DOLL MOLLY,2,2011-07-03 12:36:00,2.95,13148.0,United Kingdom
558759,21249,WOODLAND  HEIGHT CHART STICKERS ,3,2011-07-03 12:36:00,2.95,13148.0,United Kingdom
558759,21251,DINOSAUR HEIGHT CHART STICKER SET,2,2011-07-03 12:36:00,2.95,13148.0,United Kingdom
558759,22438,BALLOON ART MAKE YOUR OWN FLOWERS,4,2011-07-03 12:36:00,1.95,13148.0,United Kingdom
558759,22449,SILK PURSE BABUSHKA PINK,3,2011-07-03 12:36:00,3.35,13148.0,United Kingdom
