InvoiceNo,StockCode,Description,Quantity,InvoiceDate,UnitPrice,CustomerID,Country
C564748,23155,KNICKERBOCKERGLORY MAGNET ASSORTED ,-6,2011-08-30 08:00:00,0.83,14911.0,EIRE
C564748,23211,RED ROCKING HORSE HAND PAINTED,-24,2011-08-30 08:00:00,1.25,14911.0,EIRE
C564748,23210,WHITE ROCKING HORSE HAND PAINTED,-24,2011-08-30 08:00:00,1.25,14911.0,EIRE
C564748,22978,PANTRY ROLLING PIN,-5,2011-08-30 08:00:00,3.75,14911.0,EIRE
C564748,21672,WHITE SPOT RED CERAMIC DRAWER KNOB,-24,2011-08-30 08:00:00,1.25,14911.0,EIRE
564749,23317,BLUE REFECTORY CLOCK ,2,2011-08-30 08:15:00,9.95,12708.0,Germany
564749,23242,TREASURE TIN BUFFALO BILL ,6,2011-08-30 08:15:00,2.08,12708.0,Germany
564749,85053,FRENCH ENAMEL CANDLEHOLDER,6,2011-08-30 08:15:00,2.1,12708.0,Germany
564749,22990,COTTON APRON PANTRY DESIGN,2,2011-08-30 08:15:00,4.95,12708.0,Germany
564749,22963,JAM JAR WITH GREEN LID,12,2011-08-30 08:15:00,0.85,12708.0,Germany
564749,23253,16 PIECE CUTLERY SET PANTRY DESIGN,2,2011-08-30 08:15:00,15.95,12708.0,Germany
564749,22627,MINT KITCHEN SCALES,2,2011-08-30 08:15:00,8.5,12708.0,Germany
564749,22727,ALARM CLOCK BAKELIKE RED ,4,2011-08-30 08:15:00,3.75,12708.0,Germany
564749,22728,ALARM CLOCK BAKELIKE PINK,4,2011-08-30 08:15:00,3.75,12708.0,Germany
564749,23013,GLASS APOTHECARY BOTTLE TONIC,4,2011-08-30 08:15:00,3.95,12708.0,Germany
564749,22326,ROUND SNACK BOXES SET OF4 WOODLAND ,12,2011-08-30 08:15:00,2.95,12708.0,Germany
564749,22328,ROUND SNACK BOXES SET OF 4 FRUITS ,12,2011-08-30 08:15:00,2.95,12708.0,Germany
564749,84968F,SET OF 16 VINTAGE SKY BLUE CUTLERY,1,2011-08-30 08:15:00,12.75,12708.0,Germany
564749,84968C,SET OF 16 VINTAGE PISTACHIO CUTLERY,1,2011-08-30 08:15:00,12.75,12708.0,Germany
564749,84968D,SET OF 16 VINTAGE RED CUTLERY,1,2011-08-30 08:15:00,12.75,12708.0,Germany
564749,POST,POSTAGE,2,2011-08-30 08:15:00,18.0,12708.0,Germany
564749,22556,PLASTERS IN TIN CIRCUS PARADE ,12,2011-08-30 08:15:00,1.65,12708.0,Germany
564749,22555,PLASTERS IN TIN STRONGMAN,12,2011-08-30 08:15:00,1.65,12708.0,Germany
564749,22554,PLASTERS IN TIN WOODLAND ANIMALS,12,2011-08-30 08:15:00,1.65,12708.0,Germany
564749,22553,PLASTERS IN TIN SKULLS,12,2011-08-30 08:15:00,1.65,12708.0,Germany
564749,22551,PLASTERS IN TIN SPACEBOY,12,2011-08-30 08:15:00,1.65,12708.0,Germany
564750,22729,ALARM CLOCK BAKELIKE ORANGE,4,2011-08-30 09:36:00,3.75,17690.0,United Kingdom
564750,22730,ALARM CLOCK BAKELIKE IVORY,4,2011-08-30 09:36:00,3.75,17690.0,United Kingdom
564750,22726,ALARM CLOCK BAKELIKE GREEN,4,2011-08-30 09:36:00,3.75,17690.0,United Kingdom
564750,21066,VINTAGE RED MUG,12,2011-08-30 09:36:00,1.25,17690.0,United Kingdom
564750,21871,SAVE THE PLANET MUG,12,2011-08-30 09:36:00,1.25,17690.0,United Kingdom
564750,21875,KINGS CHOICE MUG,12,2011-08-30 09:36:00,1.25,17690.0,United Kingdom
564750,21068,VINTAGE BILLBOARD LOVE/HATE MUG,12,2011-08-30 09:36:00,1.25,17690.0,United Kingdom
564750,22973,CHILDREN'S CIRCUS PARADE MUG,12,2011-08-30 09:36:00,1.65,17690.0,United Kingdom
564750,21877,HOME SWEET HOME MUG,12,2011-08-30 09:36:00,1.25,17690.0,United Kingdom
564750,22076,6 RIBBONS EMPIRE  ,12,2011-08-30 09:36:00,1.65,17690.0,United Kingdom
564750,85049C,ROMANTIC PINKS RIBBONS ,12,2011-08-30 09:36:00,1.25,17690.0,United Kingdom
564750,23082,SET 6 PAPER TABLE LANTERN HEARTS ,6,2011-08-30 09:36:00,3.75,17690.0,United Kingdom
564750,23083,SET 6 PAPER TABLE LANTERN STARS ,6,2011-08-30 09:36:00,3.75,17690.0,United Kingdom
564750,23316,RED REFECTORY CLOCK ,2,2011-08-30 09:36:00,9.95,17690.0,United Kingdom
564750,23317,BLUE REFECTORY CLOCK ,2,2011-08-30 09:36:00,9.95,17690.0,United Kingdom
564750,23315,IVORY REFECTORY CLOCK,2,2011-08-30 09:36:00,9.95,17690.0,United Kingdom
564750,22624,IVORY KITCHEN SCALES,2,2011-08-30 09:36:00,8.5,17690.0,United Kingdom
564750,22627,MINT KITCHEN SCALES,2,2011-08-30 09:36:00,8.5,17690.0,United Kingdom
564750,22625,RED KITCHEN SCALES,2,2011-08-30 09:36:00,8.5,17690.0,United Kingdom
564750,22847,BREAD BIN DINER STYLE IVORY,1,2011-08-30 09:36:00,16.95,17690.0,United Kingdom
564750,22846,BREAD BIN DINER STYLE RED ,1,2011-08-30 09:36:00,16.95,17690.0,United Kingdom
564750,22848,BREAD BIN DINER STYLE PINK,1,2011-08-30 09:36:00,16.95,17690.0,United Kingdom
564750,84992,72 SWEETHEART FAIRY CAKE CASES,24,2011-08-30 09:36:00,0.55,17690.0,United Kingdom
564750,21212,PACK OF 72 RETROSPOT CAKE CASES,24,2011-08-30 09:36:00,0.55,17690.0,United Kingdom
564750,22178,VICTORIAN GLASS HANGING T-LIGHT,12,2011-08-30 09:36:00,1.25,17690.0,United Kingdom
564750,22651,GENTLEMAN SHIRT REPAIR KIT ,12,2011-08-30 09:36:00,0.85,17690.0,United Kingdom
564750,22727,ALARM CLOCK BAKELIKE RED ,4,2011-08-30 09:36:00,3.75,17690.0,United Kingdom
564750,22725,ALARM CLOCK BAKELIKE CHOCOLATE,4,2011-08-30 09:36:00,3.75,17690.0,United Kingdom
C564751,22065,CHRISTMAS PUDDING TRINKET POT ,-4,2011-08-30 10:06:00,1.45,17828.0,Malta
C564751,22768,FAMILY PHOTO FRAME CORNICE,-1,2011-08-30 10:06:00,9.95,17828.0,Malta
564752,22652,TRAVEL SEWING KIT,20,2011-08-30 10:07:00,1.65,16126.0,United Kingdom
564752,22654,DELUXE SEWING KIT ,12,2011-08-30 10:07:00,5.95,16126.0,United Kingdom
564752,22077,6 RIBBONS RUSTIC CHARM,36,2011-08-30 10:07:00,1.65,16126.0,United Kingdom
564752,20969,RED FLORAL FELTCRAFT SHOULDER BAG,16,2011-08-30 10:07:00,3.75,16126.0,United Kingdom
564752,20972,PINK CREAM FELT CRAFT TRINKET BOX ,36,2011-08-30 10:07:00,1.25,16126.0,United Kingdom
564752,22150,3 STRIPEY MICE FELTCRAFT,18,2011-08-30 10:07:00,1.95,16126.0,United Kingdom
564752,22147,FELTCRAFT BUTTERFLY HEARTS,24,2011-08-30 10:07:00,1.45,16126.0,United Kingdom
564752,20971,PINK BLUE FELT CRAFT TRINKET BOX,36,2011-08-30 10:07:00,1.25,16126.0,United Kingdom
564752,22271,FELTCRAFT DOLL ROSIE,18,2011-08-30 10:07:00,2.95,16126.0,United Kingdom
564752,22273,FELTCRAFT DOLL MOLLY,18,2011-08-30 10:07:00,2.95,16126.0,United Kingdom
564752,22568,FELTCRAFT CUSHION OWL,16,2011-08-30 10:07:00,3.75,16126.0,United Kingdom
564752,22569,FELTCRAFT CUSHION BUTTERFLY,16,2011-08-30 10:07:00,3.75,16126.0,United Kingdom
564752,22570,FELTCRAFT CUSHION RABBIT,16,2011-08-30 10:07:00,3.75,16126.0,United Kingdom
564752,23126,FELTCRAFT GIRL AMELIE KIT,16,2011-08-30 10:07:00,4.95,16126.0,United Kingdom
564752,23128,FELTCRAFT BOY JEAN-PAUL KIT,8,2011-08-30 10:07:00,4.95,16126.0,United Kingdom
564752,23127,FELTCRAFT GIRL NICOLE KIT,16,2011-08-30 10:07:00,4.95,16126.0,United Kingdom
564752,21621,VINTAGE UNION JACK BUNTING,20,2011-08-30 10:07:00,8.5,16126.0,United Kingdom
564752,47566,PARTY BUNTING,24,2011-08-30 10:07:00,4.95,16126.0,United Kingdom
564752,47590A,BLUE HAPPY BIRTHDAY BUNTING,9,2011-08-30 10:07:00,5.45,16126.0,United Kingdom
564752,23298,SPOTTY BUNTING,21,2011-08-30 10:07:00,4.95,16126.0,United Kingdom
564752,47590B,PINK HAPPY BIRTHDAY BUNTING,9,2011-08-30 10:07:00,5.45,16126.0,United Kingdom
564752,22274,FELTCRAFT DOLL EMILY,12,2011-08-30 10:07:00,2.95,16126.0,United Kingdom
564752,20970,PINK FLORAL FELTCRAFT SHOULDER BAG,16,2011-08-30 10:07:00,3.75,16126.0,United Kingdom
564752,23313,VINTAGE CHRISTMAS BUNTING,25,2011-08-30 10:07:00,4.95,16126.0,United Kingdom
564752,23188,VINTAGE  2 METER FOLDING RULER,12,2011-08-30 10:07:00,1.65,16126.0,United Kingdom
564752,23311,VINTAGE CHRISTMAS STOCKING ,6,2011-08-30 10:07:00,2.55,16126.0,United Kingdom
564752,23312,VINTAGE CHRISTMAS GIFT SACK,4,2011-08-30 10:07:00,4.15,16126.0,United Kingdom
564752,22457,NATURAL SLATE HEART CHALKBOARD ,18,2011-08-30 10:07:00,2.95,16126.0,United Kingdom
564752,22749,FELTCRAFT PRINCESS CHARLOTTE DOLL,16,2011-08-30 10:07:00,3.75,16126.0,United Kingdom
564752,22750,FELTCRAFT PRINCESS LOLA DOLL,16,2011-08-30 10:07:00,3.75,16126.0,United Kingdom
564752,22751,FELTCRAFT PRINCESS OLIVIA DOLL,16,2011-08-30 10:07:00,3.75,16126.0,United Kingdom
564753,21931,JUMBO STORAGE BAG SUKI,10,2011-08-30 10:20:00,2.08,13709.0,United Kingdom
564753,22411,JUMBO SHOPPER VINTAGE RED PAISLEY,10,2011-08-30 10:20:00,2.08,13709.0,United Kingdom
564753,21232,STRAWBERRY CERAMIC TRINKET BOX,12,2011-08-30 10:20:00,1.25,13709.0,United Kingdom
564753,21231,SWEETHEART CERAMIC TRINKET BOX,12,2011-08-30 10:20:00,1.25,13709.0,United Kingdom
564753,22907,PACK OF 20 NAPKINS PANTRY DESIGN,12,2011-08-30 10:20:00,0.85,13709.0,United Kingdom
564753,22993,SET OF 4 PANTRY JELLY MOULDS,12,2011-08-30 10:20:00,1.25,13709.0,United Kingdom
564753,23297,SET 40 HEART SHAPE PETIT FOUR CASES,16,2011-08-30 10:20:00,1.65,13709.0,United Kingdom
564753,23309,SET OF 60 I LOVE LONDON CAKE CASES ,24,2011-08-30 10:20:00,0.55,13709.0,United Kingdom
564753,21672,WHITE SPOT RED CERAMIC DRAWER KNOB,12,2011-08-30 10:20:00,1.25,13709.0,United Kingdom
564753,22139,RETROSPOT TEA SET CERAMIC 11 PC ,3,2011-08-30 10:20:00,4.95,13709.0,United Kingdom
564753,22819,"BIRTHDAY CARD, RETRO SPOT",12,2011-08-30 10:20:00,0.42,13709.0,United Kingdom
564753,21519,GIN & TONIC DIET GREETING CARD ,12,2011-08-30 10:20:00,0.42,13709.0,United Kingdom
564753,22983,CARD BILLBOARD FONT,12,2011-08-30 10:20:00,0.42,13709.0,United Kingdom
564753,21929,JUMBO BAG PINK VINTAGE PAISLEY,10,2011-08-30 10:20:00,2.08,13709.0,United Kingdom
564753,23203,JUMBO BAG VINTAGE DOILY ,10,2011-08-30 10:20:00,2.08,13709.0,United Kingdom
564753,23209,LUNCH BAG VINTAGE DOILY ,10,2011-08-30 10:20:00,1.65,13709.0,United Kingdom
564753,23167,SMALL CERAMIC TOP STORAGE JAR ,24,2011-08-30 10:20:00,0.83,13709.0,United Kingdom
564753,23166,MEDIUM CERAMIC TOP STORAGE JAR,12,2011-08-30 10:20:00,1.25,13709.0,United Kingdom
564753,23165,LARGE CERAMIC TOP STORAGE JAR,12,2011-08-30 10:20:00,1.65,13709.0,United Kingdom
564753,23342,MINT DINER WALL CLOCK,2,2011-08-30 10:20:00,8.5,13709.0,United Kingdom
564753,22191,IVORY DINER WALL CLOCK,2,2011-08-30 10:20:00,8.5,13709.0,United Kingdom
564753,82580,BATHROOM METAL SIGN,12,2011-08-30 10:20:00,0.55,13709.0,United Kingdom
564753,22686,FRENCH BLUE METAL DOOR SIGN No,24,2011-08-30 10:20:00,1.25,13709.0,United Kingdom
564753,22685,FRENCH BLUE METAL DOOR SIGN 0,10,2011-08-30 10:20:00,1.25,13709.0,United Kingdom
564753,22684,FRENCH BLUE METAL DOOR SIGN 9,10,2011-08-30 10:20:00,1.25,13709.0,United Kingdom
564753,22683,FRENCH BLUE METAL DOOR SIGN 8,10,2011-08-30 10:20:00,1.25,13709.0,United Kingdom
564753,22682,FRENCH BLUE METAL DOOR SIGN 7,10,2011-08-30 10:20:00,1.25,13709.0,United Kingdom
564753,22681,FRENCH BLUE METAL DOOR SIGN 6,10,2011-08-30 10:20:00,1.25,13709.0,United Kingdom
564753,22680,FRENCH BLUE METAL DOOR SIGN 5,10,2011-08-30 10:20:00,1.25,13709.0,United Kingdom
564753,22679,FRENCH BLUE METAL DOOR SIGN 4,10,2011-08-30 10:20:00,1.25,13709.0,United Kingdom
564753,22678,FRENCH BLUE METAL DOOR SIGN 3,10,2011-08-30 10:20:00,1.25,13709.0,United Kingdom
564753,22677,FRENCH BLUE METAL DOOR SIGN 2,20,2011-08-30 10:20:00,1.25,13709.0,United Kingdom
564753,22676,FRENCH BLUE METAL DOOR SIGN 1,20,2011-08-30 10:20:00,1.25,13709.0,United Kingdom
564753,22675,FRENCH KITCHEN SIGN BLUE METAL,12,2011-08-30 10:20:00,1.25,13709.0,United Kingdom
564753,22674,FRENCH TOILET SIGN BLUE METAL,12,2011-08-30 10:20:00,1.25,13709.0,United Kingdom
564753,48187,DOORMAT NEW ENGLAND,2,2011-08-30 10:20:00,7.95,13709.0,United Kingdom
564753,22488,NATURAL SLATE RECTANGLE CHALKBOARD,12,2011-08-30 10:20:00,1.65,13709.0,United Kingdom
564753,82483,WOOD 2 DRAWER CABINET WHITE FINISH,2,2011-08-30 10:20:00,6.95,13709.0,United Kingdom
564753,82494L,WOODEN FRAME ANTIQUE WHITE ,6,2011-08-30 10:20:00,2.95,13709.0,United Kingdom
564754,21068,VINTAGE BILLBOARD LOVE/HATE MUG,1,2011-08-30 10:29:00,2.46,,United Kingdom
564754,21080,SET/20 RED RETROSPOT PAPER NAPKINS ,5,2011-08-30 10:29:00,0.83,,United Kingdom
564754,21084,SET/6 COLLAGE PAPER CUPS,3,2011-08-30 10:29:00,0.83,,United Kingdom
564754,21090,SET/6 COLLAGE PAPER PLATES,3,2011-08-30 10:29:00,0.83,,United Kingdom
564754,21094,SET/6 RED SPOTTY PAPER PLATES,7,2011-08-30 10:29:00,0.83,,United Kingdom
564754,21129,SILVER FISHING GNOME ,1,2011-08-30 10:29:00,12.46,,United Kingdom
564754,21137,BLACK RECORD COVER FRAME,3,2011-08-30 10:29:00,7.46,,United Kingdom
564754,21165,BEWARE OF THE CAT METAL SIGN ,1,2011-08-30 10:29:00,4.13,,United Kingdom
564754,21191,LARGE WHITE HONEYCOMB PAPER BELL  ,3,2011-08-30 10:29:00,4.13,,United Kingdom
564754,21210,SET OF 72 RETROSPOT PAPER  DOILIES,1,2011-08-30 10:29:00,2.92,,United Kingdom
564754,21221,SET/4 BADGES CUTE CREATURES,1,2011-08-30 10:29:00,2.46,,United Kingdom
564754,21232,STRAWBERRY CERAMIC TRINKET BOX,1,2011-08-30 10:29:00,2.46,,United Kingdom
564754,21246,RED RETROSPOT BIG BOWL,1,2011-08-30 10:29:00,4.13,,United Kingdom
564754,21340,CLASSIC METAL BIRDCAGE PLANT HOLDER,1,2011-08-30 10:29:00,24.96,,United Kingdom
564754,21365,MIRRORED WALL ART STARS,4,2011-08-30 10:29:00,5.79,,United Kingdom
564754,21379,CAMPHOR WOOD PORTOBELLO MUSHROOM,1,2011-08-30 10:29:00,2.46,,United Kingdom
564754,21447,12 IVORY ROSE PEG PLACE SETTINGS,5,2011-08-30 10:29:00,2.46,,United Kingdom
564754,21455,PAINTED YELLOW WOODEN DAISY,5,2011-08-30 10:29:00,0.83,,United Kingdom
564754,21530,DAIRY MAID TOASTRACK,1,2011-08-30 10:29:00,3.29,,United Kingdom
564754,21559,STRAWBERRY LUNCH BOX WITH CUTLERY,1,2011-08-30 10:29:00,4.96,,United Kingdom
564754,21563,RED HEART SHAPE LOVE BUCKET ,1,2011-08-30 10:29:00,5.79,,United Kingdom
564754,21684,SMALL MEDINA STAMPED METAL BOWL ,2,2011-08-30 10:29:00,2.46,,United Kingdom
564754,21723,ALPHABET HEARTS STICKER SHEET,1,2011-08-30 10:29:00,1.63,,United Kingdom
564754,21733,RED HANGING HEART T-LIGHT HOLDER,1,2011-08-30 10:29:00,5.79,,United Kingdom
564754,21743,STAR PORTABLE TABLE LIGHT ,4,2011-08-30 10:29:00,5.79,,United Kingdom
564754,21746,SMALL RED RETROSPOT WINDMILL,5,2011-08-30 10:29:00,2.46,,United Kingdom
564754,21774,DECORATIVE CATS BATHROOM BOTTLE,1,2011-08-30 10:29:00,2.46,,United Kingdom
564754,21786,POLKADOT RAIN HAT ,2,2011-08-30 10:29:00,0.83,,United Kingdom
564754,21787,RAIN PONCHO RETROSPOT,1,2011-08-30 10:29:00,1.63,,United Kingdom
564754,21801,CHRISTMAS TREE DECORATION WITH BELL,1,2011-08-30 10:29:00,0.42,,United Kingdom
564754,21802,CHRISTMAS TREE HEART DECORATION,1,2011-08-30 10:29:00,0.42,,United Kingdom
564754,21803,CHRISTMAS TREE STAR DECORATION,1,2011-08-30 10:29:00,0.42,,United Kingdom
564754,21811,HANGING HEART WITH BELL,1,2011-08-30 10:29:00,2.46,,United Kingdom
564754,21820,GLITTER HEART GARLAND WITH BELLS ,3,2011-08-30 10:29:00,7.46,,United Kingdom
564754,21871,SAVE THE PLANET MUG,1,2011-08-30 10:29:00,3.29,,United Kingdom
564754,21880,RED RETROSPOT TAPE,1,2011-08-30 10:29:00,0.42,,United Kingdom
564754,21889,WOODEN BOX OF DOMINOES,1,2011-08-30 10:29:00,2.46,,United Kingdom
564754,21903,MAN FLU METAL SIGN,1,2011-08-30 10:29:00,4.13,,United Kingdom
564754,21913,VINTAGE SEASIDE JIGSAW PUZZLES,1,2011-08-30 10:29:00,7.46,,United Kingdom
564754,21929,JUMBO BAG PINK VINTAGE PAISLEY,1,2011-08-30 10:29:00,4.13,,United Kingdom
564754,21931,JUMBO STORAGE BAG SUKI,1,2011-08-30 10:29:00,4.13,,United Kingdom
564754,21933,PINK VINTAGE PAISLEY PICNIC BAG,1,2011-08-30 10:29:00,2.46,,United Kingdom
564754,21992,VINTAGE PAISLEY STATIONERY SET,2,2011-08-30 10:29:00,2.46,,United Kingdom
564754,21993,FLORAL FOLK STATIONERY SET,2,2011-08-30 10:29:00,2.46,,United Kingdom
564754,22062,CERAMIC BOWL WITH LOVE HEART DESIGN,1,2011-08-30 10:29:00,2.46,,United Kingdom
564754,22064,PINK DOUGHNUT TRINKET POT ,1,2011-08-30 10:29:00,3.29,,United Kingdom
564754,22090,PAPER BUNTING RETROSPOT,7,2011-08-30 10:29:00,5.79,,United Kingdom
564754,22109,FULL ENGLISH BREAKFAST PLATE,1,2011-08-30 10:29:00,7.46,,United Kingdom
564754,22131,FOOD CONTAINER SET 3 LOVE HEART ,2,2011-08-30 10:29:00,4.13,,United Kingdom
564754,22132,RED LOVE HEART SHAPE CUP,1,2011-08-30 10:29:00,1.63,,United Kingdom
564754,22133,PINK LOVE HEART SHAPE CUP,1,2011-08-30 10:29:00,1.63,,United Kingdom
564754,22134,MINI LADLE LOVE HEART RED ,1,2011-08-30 10:29:00,0.83,,United Kingdom
564754,22147,FELTCRAFT BUTTERFLY HEARTS,1,2011-08-30 10:29:00,3.29,,United Kingdom
564754,22165,"DIAMANTE HEART SHAPED WALL MIRROR, ",1,2011-08-30 10:29:00,10.79,,United Kingdom
564754,22174,PHOTO CUBE,1,2011-08-30 10:29:00,3.29,,United Kingdom
564754,22189,CREAM HEART CARD HOLDER,1,2011-08-30 10:29:00,8.29,,United Kingdom
564754,22192,BLUE DINER WALL CLOCK,1,2011-08-30 10:29:00,16.63,,United Kingdom
564754,22197,POPCORN HOLDER,1,2011-08-30 10:29:00,1.63,,United Kingdom
564754,22203,MILK PAN RED RETROSPOT,1,2011-08-30 10:29:00,7.46,,United Kingdom
564754,22204,MILK PAN BLUE POLKADOT,1,2011-08-30 10:29:00,7.46,,United Kingdom
564754,22227,HANGING HEART MIRROR DECORATION ,4,2011-08-30 10:29:00,1.25,,United Kingdom
564754,22268,DECORATION SITTING BUNNY,1,2011-08-30 10:29:00,0.63,,United Kingdom
564754,22269,EGG CUP NATURAL CHICKEN,1,2011-08-30 10:29:00,0.83,,United Kingdom
564754,22284,HEN HOUSE DECORATION,1,2011-08-30 10:29:00,3.29,,United Kingdom
564754,22300,COFFEE MUG DOG + BALL DESIGN,1,2011-08-30 10:29:00,4.96,,United Kingdom
564754,22348,TEA BAG PLATE RED RETROSPOT,1,2011-08-30 10:29:00,1.63,,United Kingdom
564754,22355,CHARLOTTE BAG SUKI DESIGN,1,2011-08-30 10:29:00,1.63,,United Kingdom
564754,22356,CHARLOTTE BAG PINK POLKADOT,1,2011-08-30 10:29:00,1.63,,United Kingdom
564754,22359,GLASS JAR KINGS CHOICE,1,2011-08-30 10:29:00,5.79,,United Kingdom
564754,22360,GLASS JAR ENGLISH CONFECTIONERY,1,2011-08-30 10:29:00,5.79,,United Kingdom
564754,22361,GLASS JAR DAISY FRESH COTTON WOOL,1,2011-08-30 10:29:00,5.79,,United Kingdom
564754,22363,GLASS JAR MARMALADE ,1,2011-08-30 10:29:00,5.79,,United Kingdom
564754,22364,GLASS JAR DIGESTIVE BISCUITS,2,2011-08-30 10:29:00,5.79,,United Kingdom
564754,22366,DOORMAT AIRMAIL ,1,2011-08-30 10:29:00,15.79,,United Kingdom
564754,22380,TOY TIDY SPACEBOY  ,1,2011-08-30 10:29:00,4.13,,United Kingdom
564754,22381,TOY TIDY PINK POLKADOT,2,2011-08-30 10:29:00,4.13,,United Kingdom
564754,22382,LUNCH BAG SPACEBOY DESIGN ,1,2011-08-30 10:29:00,4.13,,United Kingdom
564754,22384,LUNCH BAG PINK POLKADOT,1,2011-08-30 10:29:00,4.13,,United Kingdom
564754,22393,PAPERWEIGHT VINTAGE COLLAGE,1,2011-08-30 10:29:00,4.96,,United Kingdom
564754,22395,PAPERWEIGHT VINTAGE PAISLEY,1,2011-08-30 10:29:00,4.96,,United Kingdom
564754,22411,JUMBO SHOPPER VINTAGE RED PAISLEY,1,2011-08-30 10:29:00,4.13,,United Kingdom
564754,22412,METAL SIGN NEIGHBOURHOOD WITCH ,1,2011-08-30 10:29:00,4.13,,United Kingdom
564754,22422,TOOTHPASTE TUBE PEN,1,2011-08-30 10:29:00,1.25,,United Kingdom
564754,22423,REGENCY CAKESTAND 3 TIER,2,2011-08-30 10:29:00,24.96,,United Kingdom
564754,22429,ENAMEL MEASURING JUG CREAM,1,2011-08-30 10:29:00,8.29,,United Kingdom
564754,22494,EMERGENCY FIRST AID TIN ,1,2011-08-30 10:29:00,2.46,,United Kingdom
564754,22496,SET OF 2 ROUND TINS DUTCH CHEESE,2,2011-08-30 10:29:00,5.79,,United Kingdom
564754,22500,SET OF 2 TINS JARDIN DE PROVENCE,1,2011-08-30 10:29:00,10.79,,United Kingdom
564754,22508,DOORSTOP RETROSPOT HEART,3,2011-08-30 10:29:00,7.46,,United Kingdom
564754,22530,MAGIC DRAWING SLATE DOLLY GIRL ,1,2011-08-30 10:29:00,0.83,,United Kingdom
564754,22534,MAGIC DRAWING SLATE SPACEBOY ,1,2011-08-30 10:29:00,0.83,,United Kingdom
564754,22549,PICTURE DOMINOES,1,2011-08-30 10:29:00,3.29,,United Kingdom
564754,22564,ALPHABET STENCIL CRAFT,1,2011-08-30 10:29:00,2.46,,United Kingdom
564754,22570,FELTCRAFT CUSHION RABBIT,1,2011-08-30 10:29:00,7.46,,United Kingdom
564754,22630,DOLLY GIRL LUNCH BOX,1,2011-08-30 10:29:00,4.13,,United Kingdom
564754,22653,BUTTON BOX ,2,2011-08-30 10:29:00,4.13,,United Kingdom
564754,22659,LUNCH BOX I LOVE LONDON,1,2011-08-30 10:29:00,4.13,,United Kingdom
564754,22662,LUNCH BAG DOLLY GIRL DESIGN,1,2011-08-30 10:29:00,4.13,,United Kingdom
564754,22669,RED BABY BUNTING ,1,2011-08-30 10:29:00,5.79,,United Kingdom
564754,22672,FRENCH BATHROOM SIGN BLUE METAL,1,2011-08-30 10:29:00,3.29,,United Kingdom
564754,22677,FRENCH BLUE METAL DOOR SIGN 2,2,2011-08-30 10:29:00,2.46,,United Kingdom
564754,22683,FRENCH BLUE METAL DOOR SIGN 8,1,2011-08-30 10:29:00,2.46,,United Kingdom
564754,22686,FRENCH BLUE METAL DOOR SIGN No,1,2011-08-30 10:29:00,2.46,,United Kingdom
564754,22692,DOORMAT WELCOME TO OUR HOME,1,2011-08-30 10:29:00,15.79,,United Kingdom
564754,22693,GROW A FLYTRAP OR SUNFLOWER IN TIN,1,2011-08-30 10:29:00,2.5,,United Kingdom
564754,22697,GREEN REGENCY TEACUP AND SAUCER,1,2011-08-30 10:29:00,5.79,,United Kingdom
564754,22699,ROSES REGENCY TEACUP AND SAUCER ,1,2011-08-30 10:29:00,5.79,,United Kingdom
564754,22732,3D VINTAGE CHRISTMAS STICKERS ,1,2011-08-30 10:29:00,2.46,,United Kingdom
564754,22741,FUNKY DIVA PEN,2,2011-08-30 10:29:00,1.63,,United Kingdom
564754,22743,MAKE YOUR OWN FLOWERPOWER CARD KIT,1,2011-08-30 10:29:00,5.79,,United Kingdom
564754,22753,SMALL YELLOW BABUSHKA NOTEBOOK ,1,2011-08-30 10:29:00,1.63,,United Kingdom
564754,22754,SMALL RED BABUSHKA NOTEBOOK ,1,2011-08-30 10:29:00,1.63,,United Kingdom
564754,22798,ANTIQUE GLASS DRESSING TABLE POT,1,2011-08-30 10:29:00,5.79,,United Kingdom
564754,22800,ANTIQUE TALL SWIRLGLASS TRINKET POT,2,2011-08-30 10:29:00,7.46,,United Kingdom
564754,22806,SET OF 6 T-LIGHTS WEDDING CAKE ,1,2011-08-30 10:29:00,5.79,,United Kingdom
564754,22869,NUMBER TILE COTTAGE GARDEN 1,2,2011-08-30 10:29:00,4.13,,United Kingdom
564754,22877,NUMBER TILE COTTAGE GARDEN 9,2,2011-08-30 10:29:00,4.13,,United Kingdom
564754,22893,MINI CAKE STAND T-LIGHT HOLDER,6,2011-08-30 10:29:00,0.83,,United Kingdom
564754,22907,PACK OF 20 NAPKINS PANTRY DESIGN,1,2011-08-30 10:29:00,1.63,,United Kingdom
564754,22952,60 CAKE CASES VINTAGE CHRISTMAS,1,2011-08-30 10:29:00,1.25,,United Kingdom
564754,22961,JAM MAKING SET PRINTED,1,2011-08-30 10:29:00,3.29,,United Kingdom
564754,22966,GINGERBREAD MAN COOKIE CUTTER,2,2011-08-30 10:29:00,2.46,,United Kingdom
564754,22969,HOMEMADE JAM SCENTED CANDLES,2,2011-08-30 10:29:00,3.29,,United Kingdom
564754,22978,PANTRY ROLLING PIN,1,2011-08-30 10:29:00,7.46,,United Kingdom
564754,22979,PANTRY WASHING UP BRUSH,2,2011-08-30 10:29:00,3.29,,United Kingdom
564754,22980,PANTRY SCRUBBING BRUSH,2,2011-08-30 10:29:00,3.29,,United Kingdom
564754,22982,PANTRY PASTRY BRUSH,2,2011-08-30 10:29:00,2.46,,United Kingdom
564754,22993,SET OF 4 PANTRY JELLY MOULDS,2,2011-08-30 10:29:00,2.46,,United Kingdom
564754,23028,DRAWER KNOB CRACKLE GLAZE BLUE,7,2011-08-30 10:29:00,3.29,,United Kingdom
564754,23089,GLASS BON BON JAR,3,2011-08-30 10:29:00,3.29,,United Kingdom
564754,23109,PACK OF SIX LED TEA LIGHTS,1,2011-08-30 10:29:00,5.79,,United Kingdom
564754,23110,PARISIENNE KEY CABINET ,1,2011-08-30 10:29:00,12.46,,United Kingdom
564754,23153,ZINC SWEETHEART WIRE LETTER RACK,1,2011-08-30 10:29:00,7.46,,United Kingdom
564754,23160,REGENCY TEA SPOON,3,2011-08-30 10:29:00,2.46,,United Kingdom
564754,23161,REGENCY CAKE FORK,3,2011-08-30 10:29:00,2.46,,United Kingdom
564754,23162,REGENCY TEA STRAINER,1,2011-08-30 10:29:00,7.46,,United Kingdom
564754,23163,REGENCY SUGAR TONGS,1,2011-08-30 10:29:00,4.96,,United Kingdom
564754,23164,REGENCY CAKE SLICE,1,2011-08-30 10:29:00,9.96,,United Kingdom
564754,23165,LARGE CERAMIC TOP STORAGE JAR,2,2011-08-30 10:29:00,3.29,,United Kingdom
564754,23166,MEDIUM CERAMIC TOP STORAGE JAR,2,2011-08-30 10:29:00,2.46,,United Kingdom
564754,23167,SMALL CERAMIC TOP STORAGE JAR ,3,2011-08-30 10:29:00,1.63,,United Kingdom
564754,23168,CLASSIC CAFE SUGAR DISPENSER,1,2011-08-30 10:29:00,2.46,,United Kingdom
564754,23169,CLASSIC GLASS COOKIE JAR,2,2011-08-30 10:29:00,8.29,,United Kingdom
564754,23170,REGENCY TEA PLATE ROSES ,2,2011-08-30 10:29:00,3.29,,United Kingdom
564754,23171,REGENCY TEA PLATE GREEN ,1,2011-08-30 10:29:00,3.29,,United Kingdom
564754,23172,REGENCY TEA PLATE PINK,1,2011-08-30 10:29:00,3.29,,United Kingdom
564754,23174,REGENCY SUGAR BOWL GREEN,1,2011-08-30 10:29:00,8.29,,United Kingdom
564754,23176,ABC TREASURE BOOK BOX ,1,2011-08-30 10:29:00,4.58,,United Kingdom
564754,23181,BULL DOG BOTTLE TOP WALL CLOCK,1,2011-08-30 10:29:00,16.63,,United Kingdom
564754,23184,BULL DOG BOTTLE OPENER,2,2011-08-30 10:29:00,10.79,,United Kingdom
564754,23191,BUNDLE OF 3 RETRO NOTE BOOKS,1,2011-08-30 10:29:00,3.29,,United Kingdom
564754,23197,SKETCHBOOK MAGNETIC SHOPPING LIST,1,2011-08-30 10:29:00,3.29,,United Kingdom
564754,23198,PANTRY MAGNETIC  SHOPPING LIST,1,2011-08-30 10:29:00,3.29,,United Kingdom
564754,23199,JUMBO BAG APPLES,1,2011-08-30 10:29:00,4.13,,United Kingdom
564754,23200,JUMBO BAG PEARS,4,2011-08-30 10:29:00,4.13,,United Kingdom
564754,23203,JUMBO BAG VINTAGE DOILY ,2,2011-08-30 10:29:00,4.13,,United Kingdom
564754,23204,CHARLOTTE BAG APPLES DESIGN,1,2011-08-30 10:29:00,1.63,,United Kingdom
564754,23209,LUNCH BAG VINTAGE DOILY ,1,2011-08-30 10:29:00,4.13,,United Kingdom
564754,23220,REINDEER HEART DECORATION GOLD,1,2011-08-30 10:29:00,1.63,,United Kingdom
564754,23224,CHERUB HEART DECORATION GOLD,1,2011-08-30 10:29:00,1.63,,United Kingdom
564754,23239,SET OF 4 KNICK KNACK TINS POPPIES,1,2011-08-30 10:29:00,8.29,,United Kingdom
564754,23241,TREASURE TIN GYMKHANA DESIGN,1,2011-08-30 10:29:00,4.13,,United Kingdom
564754,23243,SET OF TEA COFFEE SUGAR TINS PANTRY,1,2011-08-30 10:29:00,10.79,,United Kingdom
564754,23245,SET OF 3 REGENCY CAKE TINS,2,2011-08-30 10:29:00,10.79,,United Kingdom
564754,23251,VINTAGE RED ENAMEL TRIM MUG ,2,2011-08-30 10:29:00,2.46,,United Kingdom
564754,23265,SET OF 3 WOODEN TREE DECORATIONS,1,2011-08-30 10:29:00,2.46,,United Kingdom
564754,23266,SET OF 3 WOODEN STOCKING DECORATION,1,2011-08-30 10:29:00,2.46,,United Kingdom
564754,23285,PINK VINTAGE SPOT BEAKER,1,2011-08-30 10:29:00,1.63,,United Kingdom
564754,23291,DOLLY GIRL CHILDRENS CUP,1,2011-08-30 10:29:00,2.46,,United Kingdom
564754,23293,SET OF 12 FAIRY CAKE BAKING CASES,3,2011-08-30 10:29:00,2.46,,United Kingdom
564754,23294,SET OF 6 SNACK LOAF BAKING CASES,2,2011-08-30 10:29:00,2.46,,United Kingdom
564754,23295,SET OF 12 MINI LOAF BAKING CASES,1,2011-08-30 10:29:00,2.46,,United Kingdom
564754,23296,SET OF 6 TEA TIME BAKING CASES,1,2011-08-30 10:29:00,3.29,,United Kingdom
564754,23297,SET 40 HEART SHAPE PETIT FOUR CASES,1,2011-08-30 10:29:00,3.29,,United Kingdom
564754,23300,GARDENERS KNEELING PAD CUP OF TEA ,1,2011-08-30 10:29:00,3.29,,United Kingdom
