InvoiceNo,StockCode,Description,Quantity,InvoiceDate,UnitPrice,CustomerID,Country
564837,22962,JAM JAR WITH PINK LID,2,2011-08-30 12:40:00,1.63,,United Kingdom
564837,22963,JAM JAR WITH GREEN LID,2,2011-08-30 12:40:00,1.63,,United Kingdom
564837,22972,CHILDREN'S SPACEBOY MUG,1,2011-08-30 12:40:00,3.29,,United Kingdom
564837,22974,CHILDRENS DOLLY GIRL MUG,1,2011-08-30 12:40:00,3.29,,United Kingdom
564837,22983,CARD BILLBOARD FONT,2,2011-08-30 12:40:00,0.83,,United Kingdom
564837,22994,TRAVEL CARD WALLET RETROSPOT,1,2011-08-30 12:40:00,0.83,,United Kingdom
564837,22996,TRAVEL CARD WALLET VINTAGE TICKET,1,2011-08-30 12:40:00,0.83,,United Kingdom
564837,23006,TRAVEL CARD WALLET FLOWER MEADOW,1,2011-08-30 12:40:00,0.83,,United Kingdom
564837,23010,CIRCUS PARADE BABY GIFT SET,1,2011-08-30 12:40:00,24.96,,United Kingdom
564837,23012,GLASS APOTHECARY BOTTLE PERFUME,1,2011-08-30 12:40:00,8.29,,United Kingdom
564837,23014,GLASS APOTHECARY BOTTLE ELIXIR,1,2011-08-30 12:40:00,8.29,,United Kingdom
564837,23061,VINTAGE EMBOSSED HEART,2,2011-08-30 12:40:00,2.46,,United Kingdom
564837,23076,ICE CREAM SUNDAE LIP GLOSS,1,2011-08-30 12:40:00,2.46,,United Kingdom
564837,23077,DOUGHNUT LIP GLOSS ,2,2011-08-30 12:40:00,2.46,,United Kingdom
564837,23078,ICE CREAM PEN LIP GLOSS ,1,2011-08-30 12:40:00,2.46,,United Kingdom
564837,23089,GLASS BON BON JAR,4,2011-08-30 12:40:00,3.29,,United Kingdom
564837,23091,ZINC HERB GARDEN CONTAINER,2,2011-08-30 12:40:00,12.46,,United Kingdom
564837,23162,REGENCY TEA STRAINER,1,2011-08-30 12:40:00,7.46,,United Kingdom
564837,23163,REGENCY SUGAR TONGS,1,2011-08-30 12:40:00,4.96,,United Kingdom
564837,23170,REGENCY TEA PLATE ROSES ,4,2011-08-30 12:40:00,3.29,,United Kingdom
564837,23171,REGENCY TEA PLATE GREEN ,4,2011-08-30 12:40:00,3.29,,United Kingdom
564837,23172,REGENCY TEA PLATE PINK,4,2011-08-30 12:40:00,3.29,,United Kingdom
564837,23173,REGENCY TEAPOT ROSES ,1,2011-08-30 12:40:00,19.96,,United Kingdom
564837,23174,REGENCY SUGAR BOWL GREEN,1,2011-08-30 12:40:00,8.29,,United Kingdom
564837,23182,TOILET SIGN OCCUPIED OR VACANT,1,2011-08-30 12:40:00,2.46,,United Kingdom
564837,23204,CHARLOTTE BAG APPLES DESIGN,1,2011-08-30 12:40:00,1.63,,United Kingdom
564837,23206,LUNCH BAG APPLE DESIGN,1,2011-08-30 12:40:00,4.13,,United Kingdom
564837,23209,LUNCH BAG VINTAGE DOILY ,2,2011-08-30 12:40:00,4.13,,United Kingdom
564837,23213,STAR WREATH DECORATION WITH BELL,2,2011-08-30 12:40:00,2.46,,United Kingdom
564837,23221,REINDEER HEART DECORATION SILVER,1,2011-08-30 12:40:00,1.63,,United Kingdom
564837,23223,CHRISTMAS TREE HANGING SILVER ,1,2011-08-30 12:40:00,1.63,,United Kingdom
564837,23225,CHERUB HEART DECORATION SILVER ,1,2011-08-30 12:40:00,1.63,,United Kingdom
564837,23245,SET OF 3 REGENCY CAKE TINS,1,2011-08-30 12:40:00,10.79,,United Kingdom
564837,23265,SET OF 3 WOODEN TREE DECORATIONS,3,2011-08-30 12:40:00,2.46,,United Kingdom
564837,23293,SET OF 12 FAIRY CAKE BAKING CASES,3,2011-08-30 12:40:00,2.46,,United Kingdom
564837,23295,SET OF 12 MINI LOAF BAKING CASES,2,2011-08-30 12:40:00,2.46,,United Kingdom
564837,23296,SET OF 6 TEA TIME BAKING CASES,1,2011-08-30 12:40:00,3.29,,United Kingdom
564837,23298,SPOTTY BUNTING,1,2011-08-30 12:40:00,10.79,,United Kingdom
564837,23300,GARDENERS KNEELING PAD CUP OF TEA ,2,2011-08-30 12:40:00,3.29,,United Kingdom
564837,23309,SET OF 60 I LOVE LONDON CAKE CASES ,3,2011-08-30 12:40:00,1.25,,United Kingdom
564837,23321,SMALL WHITE HEART OF WICKER,1,2011-08-30 12:40:00,3.29,,United Kingdom
564837,23323,WHITE WICKER STAR ,1,2011-08-30 12:40:00,4.13,,United Kingdom
564837,23326,HANGING MINI COLOURED BOTTLES,2,2011-08-30 12:40:00,8.29,,United Kingdom
564837,23328,SET 6 SCHOOL MILK BOTTLES IN CRATE,11,2011-08-30 12:40:00,7.46,,United Kingdom
564837,23330,DECORATIVE WICKER HEART MEDIUM,2,2011-08-30 12:40:00,2.46,,United Kingdom
564837,23334,IVORY WICKER HEART SMALL,3,2011-08-30 12:40:00,1.25,,United Kingdom
564837,23341,PINK DINER WALL CLOCK,1,2011-08-30 12:40:00,16.63,,United Kingdom
564837,23343,JUMBO BAG VINTAGE CHRISTMAS ,1,2011-08-30 12:40:00,4.13,,United Kingdom
564837,23344,JUMBO BAG 50'S CHRISTMAS ,3,2011-08-30 12:40:00,4.13,,United Kingdom
564837,23355,HOT WATER BOTTLE KEEP CALM,2,2011-08-30 12:40:00,10.79,,United Kingdom
564837,35637A,IVORY STRING CURTAIN WITH POLE ,1,2011-08-30 12:40:00,19.13,,United Kingdom
564837,35923,CANDY HEART HANGING DECORATION,1,2011-08-30 12:40:00,2.46,,United Kingdom
564837,35924,HANGING FAIRY CAKE DECORATION,1,2011-08-30 12:40:00,4.13,,United Kingdom
564837,35961,FOLKART ZINC HEART CHRISTMAS DEC,1,2011-08-30 12:40:00,1.63,,United Kingdom
564837,35971,ROSE FOLKART HEART DECORATIONS,1,2011-08-30 12:40:00,2.46,,United Kingdom
564837,47566,PARTY BUNTING,1,2011-08-30 12:40:00,10.79,,United Kingdom
564837,47578A,ENGLISH ROSE SMALL SCENTED FLOWER,1,2011-08-30 12:40:00,1.63,,United Kingdom
564837,47590A,BLUE HAPPY BIRTHDAY BUNTING,1,2011-08-30 12:40:00,10.79,,United Kingdom
564837,75049L,LARGE CIRCULAR MIRROR MOBILE,4,2011-08-30 12:40:00,2.46,,United Kingdom
564837,84030E,ENGLISH ROSE HOT WATER BOTTLE,1,2011-08-30 12:40:00,8.29,,United Kingdom
564837,84031B,CHARLIE LOLA BLUE HOT WATER BOTTLE ,2,2011-08-30 12:40:00,4.13,,United Kingdom
564837,84032A,CHARLIE+LOLA PINK HOT WATER BOTTLE,1,2011-08-30 12:40:00,3.29,,United Kingdom
564837,84347,ROTATING SILVER ANGELS T-LIGHT HLDR,1,2011-08-30 12:40:00,4.96,,United Kingdom
564837,84380,SET OF 3 BUTTERFLY COOKIE CUTTERS,1,2011-08-30 12:40:00,2.46,,United Kingdom
564837,84406B,CREAM CUPID HEARTS COAT HANGER,1,2011-08-30 12:40:00,8.29,,United Kingdom
564837,84535B,FAIRY CAKES NOTEBOOK A6 SIZE,1,2011-08-30 12:40:00,1.46,,United Kingdom
564837,84536A,ENGLISH ROSE NOTEBOOK A7 SIZE,2,2011-08-30 12:40:00,0.83,,United Kingdom
564837,84568,GIRLS ALPHABET IRON ON PATCHES ,8,2011-08-30 12:40:00,0.42,,United Kingdom
564837,84596F,SMALL MARSHMALLOWS PINK BOWL,4,2011-08-30 12:40:00,0.83,,United Kingdom
564837,84598,BOYS ALPHABET IRON ON PATCHES,11,2011-08-30 12:40:00,0.42,,United Kingdom
564837,84637,KITCHEN FLOWER POTS WALL PLAQUE,3,2011-08-30 12:40:00,4.96,,United Kingdom
564837,84828,JUNGLE POPSICLES ICE LOLLY MOULDS,1,2011-08-30 12:40:00,2.46,,United Kingdom
564837,84832,ZINC WILLIE WINKIE  CANDLE STICK,1,2011-08-30 12:40:00,1.63,,United Kingdom
564837,84836,ZINC METAL HEART DECORATION,1,2011-08-30 12:40:00,2.46,,United Kingdom
564837,84912B,GREEN ROSE WASHBAG,2,2011-08-30 12:40:00,3.29,,United Kingdom
564837,84913A,SOFT PINK ROSE TOWEL ,1,2011-08-30 12:40:00,3.29,,United Kingdom
564837,84951A,SET OF 4 PISTACHIO LOVEBIRD COASTER,1,2011-08-30 12:40:00,2.46,,United Kingdom
564837,84971S,SMALL HEART FLOWERS HOOK ,1,2011-08-30 12:40:00,1.63,,United Kingdom
564837,85014B,RED RETROSPOT UMBRELLA,1,2011-08-30 12:40:00,12.46,,United Kingdom
564837,85017B,ENVELOPE 50 BLOSSOM IMAGES,1,2011-08-30 12:40:00,0.83,,United Kingdom
564837,85032C,CURIOUS IMAGES GIFT WRAP SET,1,2011-08-30 12:40:00,1.63,,United Kingdom
564837,85039B,S/4 IVORY MINI ROSE CANDLE IN BOWL,1,2011-08-30 12:40:00,1.63,,United Kingdom
564837,85049H,URBAN BLACK RIBBONS ,2,2011-08-30 12:40:00,0.83,,United Kingdom
564837,85131D,BEADED CRYSTAL HEART PINK ON STICK,2,2011-08-30 12:40:00,0.83,,United Kingdom
564837,85132C,CHARLIE AND LOLA FIGURES TINS,1,2011-08-30 12:40:00,5.79,,United Kingdom
564837,85170B,SET/6 BLACK BIRD T-LIGHT CANDLES,1,2011-08-30 12:40:00,4.13,,United Kingdom
564837,85170C,SET/6 EAU DE NIL BIRD T-LIGHTS,1,2011-08-30 12:40:00,4.13,,United Kingdom
564837,85176,SEWING SUSAN 21 NEEDLE SET,2,2011-08-30 12:40:00,1.63,,United Kingdom
564837,90003B,ROSE COLOUR PAIR HEART HAIR SLIDES,1,2011-08-30 12:40:00,3.73,,United Kingdom
564837,90003C,MIDNIGHT BLUE PAIR HEART HAIR SLIDE,1,2011-08-30 12:40:00,3.73,,United Kingdom
564837,90003D,CRYSTAL PAIR HEART HAIR SLIDES,1,2011-08-30 12:40:00,3.73,,United Kingdom
564837,90003E,GREEN PAIR HEART HAIR SLIDES,1,2011-08-30 12:40:00,3.73,,United Kingdom
564837,90013A,MIDNIGHT BLUE VINTAGE EARRINGS,1,2011-08-30 12:40:00,3.73,,United Kingdom
564837,90027A,GLASS BEAD HOOP EARRINGS BLACK,1,2011-08-30 12:40:00,2.9,,United Kingdom
564837,90144,SILVER DROP EARRINGS WITH FLOWER,1,2011-08-30 12:40:00,3.73,,United Kingdom
564837,90183B,AMETHYST DROP EARRINGS W LONG BEADS,1,2011-08-30 12:40:00,2.9,,United Kingdom
564837,90200E,GREEN SWEETHEART BRACELET,1,2011-08-30 12:40:00,4.15,,United Kingdom
564837,DOT,DOTCOM POSTAGE,1,2011-08-30 12:40:00,177.63,,United Kingdom
564837,15036,ASSORTED COLOURS SILK FAN,8,2011-08-30 12:40:00,1.63,,United Kingdom
564837,15056N,EDWARDIAN PARASOL NATURAL,2,2011-08-30 12:40:00,12.46,,United Kingdom
564837,15058C,ICE CREAM DESIGN GARDEN PARASOL,1,2011-08-30 12:40:00,10.79,,United Kingdom
564837,15060B,FAIRY CAKE DESIGN UMBRELLA,1,2011-08-30 12:40:00,8.29,,United Kingdom
564837,17012A,ORIGAMI VANILLA INCENSE/CANDLE SET ,1,2011-08-30 12:40:00,2.46,,United Kingdom
564837,17038,PORCELAIN BUDAH INCENSE HOLDER,5,2011-08-30 12:40:00,0.83,,United Kingdom
564837,17084N,FAIRY DREAMS INCENSE ,20,2011-08-30 12:40:00,0.42,,United Kingdom
564837,17129F,BLUE GLASS GEMS IN BAG,3,2011-08-30 12:40:00,1.63,,United Kingdom
564837,20712,JUMBO BAG WOODLAND ANIMALS,1,2011-08-30 12:40:00,4.13,,United Kingdom
564837,20718,RED RETROSPOT SHOPPER BAG,1,2011-08-30 12:40:00,2.46,,United Kingdom
564837,20719,WOODLAND CHARLOTTE BAG,1,2011-08-30 12:40:00,1.63,,United Kingdom
564837,20725,LUNCH BAG RED RETROSPOT,1,2011-08-30 12:40:00,4.13,,United Kingdom
564837,21012,ANTIQUE ALL GLASS CANDLESTICK,2,2011-08-30 12:40:00,2.46,,United Kingdom
564837,23322,LARGE WHITE HEART OF WICKER,1,2011-08-30 12:40:00,2.95,,United Kingdom
564837,82482,WOODEN PICTURE FRAME WHITE FINISH,6,2011-08-30 12:40:00,2.55,,United Kingdom
564837,82483,WOOD 2 DRAWER CABINET WHITE FINISH,5,2011-08-30 12:40:00,6.95,,United Kingdom
564837,82494L,WOODEN FRAME ANTIQUE WHITE ,4,2011-08-30 12:40:00,2.95,,United Kingdom
564838,10133,COLOURING PENCILS BROWN TUBE,1,2011-08-30 12:43:00,0.83,,United Kingdom
564838,15036,ASSORTED COLOURS SILK FAN,3,2011-08-30 12:43:00,1.63,,United Kingdom
564838,15058A,BLUE POLKADOT GARDEN PARASOL,1,2011-08-30 12:43:00,10.79,,United Kingdom
564838,15058C,ICE CREAM DESIGN GARDEN PARASOL,1,2011-08-30 12:43:00,10.79,,United Kingdom
564838,20665,RED RETROSPOT PURSE ,1,2011-08-30 12:43:00,5.79,,United Kingdom
564838,20669,RED HEART LUGGAGE TAG,1,2011-08-30 12:43:00,2.46,,United Kingdom
564838,20712,JUMBO BAG WOODLAND ANIMALS,6,2011-08-30 12:43:00,4.13,,United Kingdom
564838,20713,JUMBO BAG OWLS,2,2011-08-30 12:43:00,4.13,,United Kingdom
564838,20717,STRAWBERRY SHOPPER BAG,1,2011-08-30 12:43:00,2.46,,United Kingdom
564838,20719,WOODLAND CHARLOTTE BAG,2,2011-08-30 12:43:00,1.63,,United Kingdom
564838,20723,STRAWBERRY CHARLOTTE BAG,1,2011-08-30 12:43:00,1.63,,United Kingdom
564838,20724,RED RETROSPOT CHARLOTTE BAG,2,2011-08-30 12:43:00,1.63,,United Kingdom
564838,20725,LUNCH BAG RED RETROSPOT,1,2011-08-30 12:43:00,4.13,,United Kingdom
564838,20726,LUNCH BAG WOODLAND,7,2011-08-30 12:43:00,4.13,,United Kingdom
564838,20727,LUNCH BAG  BLACK SKULL.,3,2011-08-30 12:43:00,4.13,,United Kingdom
564838,20728,LUNCH BAG CARS BLUE,1,2011-08-30 12:43:00,4.13,,United Kingdom
564838,20733,GOLD MINI TAPE MEASURE ,3,2011-08-30 12:43:00,0.83,,United Kingdom
564838,20757,RED DAISY POCKET BOOK ,1,2011-08-30 12:43:00,1.63,,United Kingdom
564838,20775,DAISY NOTEBOOK ,2,2011-08-30 12:43:00,1.63,,United Kingdom
564838,20839,FRENCH PAISLEY CUSHION COVER ,2,2011-08-30 12:43:00,3.29,,United Kingdom
564838,20914,SET/5 RED RETROSPOT LID GLASS BOWLS,2,2011-08-30 12:43:00,5.79,,United Kingdom
564838,21080,SET/20 RED RETROSPOT PAPER NAPKINS ,15,2011-08-30 12:43:00,1.63,,United Kingdom
564838,21088,SET/6 FRUIT SALAD PAPER CUPS,8,2011-08-30 12:43:00,0.83,,United Kingdom
564838,21090,SET/6 COLLAGE PAPER PLATES,8,2011-08-30 12:43:00,0.83,,United Kingdom
564838,21123,SET/10 IVORY POLKADOT PARTY CANDLES,1,2011-08-30 12:43:00,0.83,,United Kingdom
564838,21215,IVORY PAPER CUP CAKE CASES ,2,2011-08-30 12:43:00,1.25,,United Kingdom
564838,21291,SMALL POLKADOT CHOCOLATE GIFT BAG ,1,2011-08-30 12:43:00,1.63,,United Kingdom
564838,21329,DINOSAURS  WRITING SET ,2,2011-08-30 12:43:00,3.29,,United Kingdom
564838,21407,BROWN CHECK CAT DOORSTOP ,1,2011-08-30 12:43:00,8.29,,United Kingdom
564838,21506,"FANCY FONT BIRTHDAY CARD, ",2,2011-08-30 12:43:00,0.83,,United Kingdom
564838,21558,SKULL LUNCH BOX WITH CUTLERY ,1,2011-08-30 12:43:00,4.96,,United Kingdom
564838,21578,WOODLAND DESIGN  COTTON TOTE BAG,1,2011-08-30 12:43:00,4.96,,United Kingdom
564838,21668,RED STRIPE CERAMIC DRAWER KNOB,19,2011-08-30 12:43:00,3.29,,United Kingdom
564838,21669,BLUE STRIPE CERAMIC DRAWER KNOB,16,2011-08-30 12:43:00,3.29,,United Kingdom
564838,21671,RED SPOT CERAMIC DRAWER KNOB,3,2011-08-30 12:43:00,3.29,,United Kingdom
564838,21713,CITRONELLA CANDLE FLOWERPOT,1,2011-08-30 12:43:00,4.13,,United Kingdom
564838,21715,GIRLS VINTAGE TIN SEASIDE BUCKET,2,2011-08-30 12:43:00,4.96,,United Kingdom
564838,21718,RED METAL BEACH SPADE ,2,2011-08-30 12:43:00,2.46,,United Kingdom
564838,21731,RED TOADSTOOL LED NIGHT LIGHT,1,2011-08-30 12:43:00,3.29,,United Kingdom
564838,21739,COSY SLIPPER SHOES SMALL GREEN,1,2011-08-30 12:43:00,2.46,,United Kingdom
564838,21918,SET 12 KIDS COLOUR  CHALK STICKS,1,2011-08-30 12:43:00,0.83,,United Kingdom
564838,21928,JUMBO BAG SCANDINAVIAN BLUE PAISLEY,4,2011-08-30 12:43:00,4.13,,United Kingdom
564838,21929,JUMBO BAG PINK VINTAGE PAISLEY,19,2011-08-30 12:43:00,2.46,,United Kingdom
564838,21930,JUMBO STORAGE BAG SKULLS,1,2011-08-30 12:43:00,4.13,,United Kingdom
564838,21931,JUMBO STORAGE BAG SUKI,3,2011-08-30 12:43:00,4.13,,United Kingdom
564838,21932,SCANDINAVIAN PAISLEY PICNIC BAG,4,2011-08-30 12:43:00,2.46,,United Kingdom
564838,21933,PINK VINTAGE PAISLEY PICNIC BAG,1,2011-08-30 12:43:00,2.46,,United Kingdom
564838,21934,SKULL SHOULDER BAG,1,2011-08-30 12:43:00,1.63,,United Kingdom
564838,21935,SUKI  SHOULDER BAG,2,2011-08-30 12:43:00,1.63,,United Kingdom
564838,21974,SET OF 36 PAISLEY FLOWER DOILIES,1,2011-08-30 12:43:00,2.92,,United Kingdom
564838,21992,VINTAGE PAISLEY STATIONERY SET,1,2011-08-30 12:43:00,2.46,,United Kingdom
564838,21993,FLORAL FOLK STATIONERY SET,1,2011-08-30 12:43:00,2.46,,United Kingdom
564838,22029,SPACEBOY BIRTHDAY CARD,3,2011-08-30 12:43:00,0.83,,United Kingdom
564838,22037,ROBOT BIRTHDAY CARD,1,2011-08-30 12:43:00,0.83,,United Kingdom
564838,22074,6 RIBBONS SHIMMERING PINKS ,1,2011-08-30 12:43:00,1.25,,United Kingdom
564838,22076,6 RIBBONS EMPIRE  ,1,2011-08-30 12:43:00,1.25,,United Kingdom
564838,22083,PAPER CHAIN KIT RETROSPOT,3,2011-08-30 12:43:00,5.79,,United Kingdom
564838,22086,PAPER CHAIN KIT 50'S CHRISTMAS ,1,2011-08-30 12:43:00,5.79,,United Kingdom
564838,22090,PAPER BUNTING RETROSPOT,3,2011-08-30 12:43:00,5.79,,United Kingdom
564838,22109,FULL ENGLISH BREAKFAST PLATE,2,2011-08-30 12:43:00,7.46,,United Kingdom
564838,22138,BAKING SET 9 PIECE RETROSPOT ,1,2011-08-30 12:43:00,10.79,,United Kingdom
564838,22173,METAL 4 HOOK HANGER FRENCH CHATEAU,1,2011-08-30 12:43:00,5.79,,United Kingdom
564838,22178,VICTORIAN GLASS HANGING T-LIGHT,7,2011-08-30 12:43:00,2.46,,United Kingdom
564838,22193,RED DINER WALL CLOCK,1,2011-08-30 12:43:00,16.63,,United Kingdom
564838,22197,POPCORN HOLDER,2,2011-08-30 12:43:00,1.63,,United Kingdom
564838,22209,WOOD STAMP SET HAPPY BIRTHDAY,1,2011-08-30 12:43:00,3.29,,United Kingdom
564838,22212,FOUR HOOK  WHITE LOVEBIRDS,1,2011-08-30 12:43:00,4.13,,United Kingdom
564838,22224,WHITE LOVEBIRD LANTERN,1,2011-08-30 12:43:00,5.79,,United Kingdom
564838,22324,BLUE POLKADOT KIDS BAG,1,2011-08-30 12:43:00,4.13,,United Kingdom
564838,22326,ROUND SNACK BOXES SET OF4 WOODLAND ,1,2011-08-30 12:43:00,5.79,,United Kingdom
564838,22327,ROUND SNACK BOXES SET OF 4 SKULLS,1,2011-08-30 12:43:00,5.79,,United Kingdom
564838,22329,ROUND CONTAINER SET OF 5 RETROSPOT,1,2011-08-30 12:43:00,3.29,,United Kingdom
564838,22348,TEA BAG PLATE RED RETROSPOT,1,2011-08-30 12:43:00,1.63,,United Kingdom
564838,22352,LUNCH BOX WITH CUTLERY RETROSPOT ,1,2011-08-30 12:43:00,4.96,,United Kingdom
564838,22355,CHARLOTTE BAG SUKI DESIGN,2,2011-08-30 12:43:00,1.63,,United Kingdom
564838,22357,KINGS CHOICE BISCUIT TIN,2,2011-08-30 12:43:00,4.13,,United Kingdom
564838,22362,GLASS JAR PEACOCK BATH SALTS,1,2011-08-30 12:43:00,5.79,,United Kingdom
564838,22371,AIRLINE BAG VINTAGE TOKYO 78,1,2011-08-30 12:43:00,8.29,,United Kingdom
564838,22378,WALL TIDY RETROSPOT ,1,2011-08-30 12:43:00,4.13,,United Kingdom
564838,22379,RECYCLING BAG RETROSPOT ,1,2011-08-30 12:43:00,4.13,,United Kingdom
564838,22383,LUNCH BAG SUKI DESIGN ,1,2011-08-30 12:43:00,4.13,,United Kingdom
564838,22384,LUNCH BAG PINK POLKADOT,2,2011-08-30 12:43:00,4.13,,United Kingdom
564838,22386,JUMBO BAG PINK POLKADOT,3,2011-08-30 12:43:00,4.13,,United Kingdom
564838,22393,PAPERWEIGHT VINTAGE COLLAGE,1,2011-08-30 12:43:00,4.96,,United Kingdom
564838,22411,JUMBO SHOPPER VINTAGE RED PAISLEY,2,2011-08-30 12:43:00,4.13,,United Kingdom
564838,22423,REGENCY CAKESTAND 3 TIER,1,2011-08-30 12:43:00,24.96,,United Kingdom
564838,22445,PENCIL CASE LIFE IS BEAUTIFUL,1,2011-08-30 12:43:00,5.79,,United Kingdom
564838,22446,PIN CUSHION BABUSHKA PINK,1,2011-08-30 12:43:00,2.46,,United Kingdom
564838,22449,SILK PURSE BABUSHKA PINK,3,2011-08-30 12:43:00,2.46,,United Kingdom
564838,22452,MEASURING TAPE BABUSHKA PINK,2,2011-08-30 12:43:00,1.63,,United Kingdom
564838,22456,NATURAL SLATE CHALKBOARD LARGE ,1,2011-08-30 12:43:00,9.96,,United Kingdom
564838,22457,NATURAL SLATE HEART CHALKBOARD ,1,2011-08-30 12:43:00,5.79,,United Kingdom
564838,22489,PACK OF 12 TRADITIONAL CRAYONS,2,2011-08-30 12:43:00,0.83,,United Kingdom
564838,22549,PICTURE DOMINOES,1,2011-08-30 12:43:00,3.29,,United Kingdom
564838,22568,FELTCRAFT CUSHION OWL,1,2011-08-30 12:43:00,7.46,,United Kingdom
564838,22608,PENS ASSORTED FUNKY JEWELED ,6,2011-08-30 12:43:00,0.42,,United Kingdom
564838,22619,SET OF 6 SOLDIER SKITTLES,1,2011-08-30 12:43:00,7.46,,United Kingdom
564838,22621,TRADITIONAL KNITTING NANCY,1,2011-08-30 12:43:00,3.29,,United Kingdom
564838,22625,RED KITCHEN SCALES,1,2011-08-30 12:43:00,16.63,,United Kingdom
564838,22627,MINT KITCHEN SCALES,1,2011-08-30 12:43:00,16.63,,United Kingdom
564838,22630,DOLLY GIRL LUNCH BOX,1,2011-08-30 12:43:00,4.13,,United Kingdom
564838,22631,CIRCUS PARADE LUNCH BOX ,1,2011-08-30 12:43:00,4.13,,United Kingdom
564838,22651,GENTLEMAN SHIRT REPAIR KIT ,1,2011-08-30 12:43:00,1.63,,United Kingdom
564838,22692,DOORMAT WELCOME TO OUR HOME,1,2011-08-30 12:43:00,15.79,,United Kingdom
564838,22697,GREEN REGENCY TEACUP AND SAUCER,8,2011-08-30 12:43:00,5.79,,United Kingdom
564838,22699,ROSES REGENCY TEACUP AND SAUCER ,1,2011-08-30 12:43:00,5.79,,United Kingdom
564838,22712,CARD DOLLY GIRL ,2,2011-08-30 12:43:00,0.83,,United Kingdom
564838,22713,CARD I LOVE LONDON ,1,2011-08-30 12:43:00,0.83,,United Kingdom
564838,22718,CARD CAT AND TREE ,1,2011-08-30 12:43:00,0.83,,United Kingdom
564838,22720,SET OF 3 CAKE TINS PANTRY DESIGN ,1,2011-08-30 12:43:00,10.79,,United Kingdom
564838,22743,MAKE YOUR OWN FLOWERPOWER CARD KIT,1,2011-08-30 12:43:00,5.79,,United Kingdom
564838,22771,CLEAR DRAWER KNOB ACRYLIC EDWARDIAN,2,2011-08-30 12:43:00,2.46,,United Kingdom
564838,22805,BLUE DRAWER KNOB ACRYLIC EDWARDIAN,6,2011-08-30 12:43:00,2.46,,United Kingdom
564838,22814,CARD PARTY GAMES ,3,2011-08-30 12:43:00,0.42,,United Kingdom
564838,22817,CARD SUKI BIRTHDAY,3,2011-08-30 12:43:00,0.42,,United Kingdom
564838,22819,"BIRTHDAY CARD, RETRO SPOT",4,2011-08-30 12:43:00,0.42,,United Kingdom
564838,22897,OVEN MITT APPLES DESIGN,1,2011-08-30 12:43:00,3.29,,United Kingdom
564838,22905,CALENDAR IN SEASON DESIGN,2,2011-08-30 12:43:00,2.46,,United Kingdom
564838,22928,YELLOW GIANT GARDEN THERMOMETER,1,2011-08-30 12:43:00,12.46,,United Kingdom
564838,22960,JAM MAKING SET WITH JARS,1,2011-08-30 12:43:00,8.29,,United Kingdom
564838,22983,CARD BILLBOARD FONT,2,2011-08-30 12:43:00,0.83,,United Kingdom
564838,22993,SET OF 4 PANTRY JELLY MOULDS,1,2011-08-30 12:43:00,2.46,,United Kingdom
564838,23004,TRAVEL CARD WALLET PANTRY,1,2011-08-30 12:43:00,0.83,,United Kingdom
564838,23028,DRAWER KNOB CRACKLE GLAZE BLUE,21,2011-08-30 12:43:00,3.29,,United Kingdom
564838,23078,ICE CREAM PEN LIP GLOSS ,4,2011-08-30 12:43:00,2.46,,United Kingdom
564838,23080,RED METAL BOX TOP SECRET,1,2011-08-30 12:43:00,16.63,,United Kingdom
564838,23086,ZINC  STAR T-LIGHT HOLDER ,2,2011-08-30 12:43:00,2.46,,United Kingdom
564838,23087,ZINC  HEART T-LIGHT HOLDER,3,2011-08-30 12:43:00,2.46,,United Kingdom
564838,23089,GLASS BON BON JAR,1,2011-08-30 12:43:00,3.29,,United Kingdom
564838,23135,SMALL ZINC HEART WALL ORGANISER,1,2011-08-30 12:43:00,12.46,,United Kingdom
564838,23144,ZINC T-LIGHT HOLDER STARS SMALL,2,2011-08-30 12:43:00,1.63,,United Kingdom
564838,23152,IVORY SWEETHEART WIRE LETTER RACK ,1,2011-08-30 12:43:00,7.46,,United Kingdom
564838,23170,REGENCY TEA PLATE ROSES ,6,2011-08-30 12:43:00,3.29,,United Kingdom
564838,23177,TREASURE ISLAND BOOK BOX,1,2011-08-30 12:43:00,4.58,,United Kingdom
564838,23192,BUNDLE OF 3 ALPHABET EXERCISE BOOKS,1,2011-08-30 12:43:00,3.29,,United Kingdom
564838,23194,GYMKHANA TREASURE BOOK BOX,1,2011-08-30 12:43:00,4.58,,United Kingdom
564838,23196,VINTAGE LEAF MAGNETIC NOTEPAD,1,2011-08-30 12:43:00,3.29,,United Kingdom
564838,23199,JUMBO BAG APPLES,1,2011-08-30 12:43:00,4.13,,United Kingdom
564838,23200,JUMBO BAG PEARS,1,2011-08-30 12:43:00,4.13,,United Kingdom
564838,23202,JUMBO BAG VINTAGE LEAF,2,2011-08-30 12:43:00,4.13,,United Kingdom
564838,23203,JUMBO BAG VINTAGE DOILY ,1,2011-08-30 12:43:00,4.13,,United Kingdom
564838,23239,SET OF 4 KNICK KNACK TINS POPPIES,1,2011-08-30 12:43:00,8.29,,United Kingdom
564838,23245,SET OF 3 REGENCY CAKE TINS,1,2011-08-30 12:43:00,10.79,,United Kingdom
564838,23293,SET OF 12 FAIRY CAKE BAKING CASES,1,2011-08-30 12:43:00,2.46,,United Kingdom
564838,23297,SET 40 HEART SHAPE PETIT FOUR CASES,1,2011-08-30 12:43:00,3.29,,United Kingdom
564838,23298,SPOTTY BUNTING,1,2011-08-30 12:43:00,10.79,,United Kingdom
564838,23300,GARDENERS KNEELING PAD CUP OF TEA ,1,2011-08-30 12:43:00,3.29,,United Kingdom
564838,23309,SET OF 60 I LOVE LONDON CAKE CASES ,1,2011-08-30 12:43:00,1.25,,United Kingdom
564838,23327,HANGING CLEAR MINI BOTTLE,1,2011-08-30 12:43:00,1.63,,United Kingdom
564838,23328,SET 6 SCHOOL MILK BOTTLES IN CRATE,3,2011-08-30 12:43:00,7.46,,United Kingdom
564838,23330,DECORATIVE WICKER HEART MEDIUM,2,2011-08-30 12:43:00,2.46,,United Kingdom
564838,23340,VINTAGE CHRISTMAS CAKE FRILL,1,2011-08-30 12:43:00,3.29,,United Kingdom
564838,23344,JUMBO BAG 50'S CHRISTMAS ,1,2011-08-30 12:43:00,4.13,,United Kingdom
564838,23348,CHILDRENS TOY COOKING UTENSIL SET,1,2011-08-30 12:43:00,4.13,,United Kingdom
564838,35095B,RED VICTORIAN FABRIC OVAL BOX,1,2011-08-30 12:43:00,0.83,,United Kingdom
564838,35471D,SET OF 3 BIRD LIGHT PINK FEATHER ,1,2011-08-30 12:43:00,1.25,,United Kingdom
564838,46775D,SUNSET COLOUR CHUNKY KNITTED THROW,1,2011-08-30 12:43:00,8.29,,United Kingdom
564838,47310M,SMALL POP BOX FUNKY MONKEY,2,2011-08-30 12:43:00,1.63,,United Kingdom
564838,47563A,RETRO LONGBOARD IRONING BOARD COVER,1,2011-08-30 12:43:00,3.29,,United Kingdom
564838,47566,PARTY BUNTING,2,2011-08-30 12:43:00,10.79,,United Kingdom
564838,47585A,PINK FAIRY CAKE CUSHION COVER,1,2011-08-30 12:43:00,9.96,,United Kingdom
564838,47590B,PINK HAPPY BIRTHDAY BUNTING,1,2011-08-30 12:43:00,10.79,,United Kingdom
564838,48187,DOORMAT NEW ENGLAND,1,2011-08-30 12:43:00,15.79,,United Kingdom
564838,51014C,"FEATHER PEN,COAL BLACK",12,2011-08-30 12:43:00,0.83,,United Kingdom
564838,72586,SET OF 6 HALLOWEEN GHOST T-LIGHTS,1,2011-08-30 12:43:00,0.83,,United Kingdom
564838,82482,WOODEN PICTURE FRAME WHITE FINISH,2,2011-08-30 12:43:00,2.55,,United Kingdom
564838,82567,"AIRLINE LOUNGE,METAL SIGN",2,2011-08-30 12:43:00,1.63,,United Kingdom
564838,82580,BATHROOM METAL SIGN,1,2011-08-30 12:43:00,1.25,,United Kingdom
564838,84032A,CHARLIE+LOLA PINK HOT WATER BOTTLE,1,2011-08-30 12:43:00,3.29,,United Kingdom
564838,84032B,CHARLIE + LOLA RED HOT WATER BOTTLE,1,2011-08-30 12:43:00,3.29,,United Kingdom
564838,84536A,ENGLISH ROSE NOTEBOOK A7 SIZE,1,2011-08-30 12:43:00,0.83,,United Kingdom
564838,84536B,FAIRY CAKES NOTEBOOK A7 SIZE,1,2011-08-30 12:43:00,0.83,,United Kingdom
564838,84568,GIRLS ALPHABET IRON ON PATCHES ,18,2011-08-30 12:43:00,0.42,,United Kingdom
564838,84598,BOYS ALPHABET IRON ON PATCHES,12,2011-08-30 12:43:00,0.42,,United Kingdom
564838,84813,SET OF 4 DIAMOND NAPKIN RINGS,1,2011-08-30 12:43:00,24.96,,United Kingdom
564838,84912B,GREEN ROSE WASHBAG,1,2011-08-30 12:43:00,3.29,,United Kingdom
564838,84946,ANTIQUE SILVER T-LIGHT GLASS,4,2011-08-30 12:43:00,2.46,,United Kingdom
564838,84949,SILVER HANGING T-LIGHT HOLDER,1,2011-08-30 12:43:00,3.29,,United Kingdom
564838,84978,HANGING HEART JAR T-LIGHT HOLDER,3,2011-08-30 12:43:00,2.46,,United Kingdom
564838,84988,SET OF 72 PINK HEART PAPER DOILIES,1,2011-08-30 12:43:00,2.92,,United Kingdom
564838,85036A,GARDENIA 1 WICK MORRIS BOXED CANDLE,1,2011-08-30 12:43:00,8.29,,United Kingdom
564838,85087,CANDY SPOT CUSHION COVER,4,2011-08-30 12:43:00,3.29,,United Kingdom
564838,85099B,JUMBO BAG RED RETROSPOT,3,2011-08-30 12:43:00,4.13,,United Kingdom
564838,85099F,JUMBO BAG STRAWBERRY,3,2011-08-30 12:43:00,4.13,,United Kingdom
564838,85123A,WHITE HANGING HEART T-LIGHT HOLDER,1,2011-08-30 12:43:00,5.79,,United Kingdom
564838,85131B,BEADED CRYSTAL HEART GREEN ON STICK,1,2011-08-30 12:43:00,0.83,,United Kingdom
564838,85131D,BEADED CRYSTAL HEART PINK ON STICK,1,2011-08-30 12:43:00,0.83,,United Kingdom
564838,85132C,CHARLIE AND LOLA FIGURES TINS,1,2011-08-30 12:43:00,5.79,,United Kingdom
564838,90003E,GREEN PAIR HEART HAIR SLIDES,1,2011-08-30 12:43:00,3.73,,United Kingdom
564838,90059D,DIAMANTE HAIR GRIP PACK/2 PERIDOT,1,2011-08-30 12:43:00,1.65,,United Kingdom
564838,90199C,5 STRAND GLASS NECKLACE CRYSTAL,1,2011-08-30 12:43:00,6.23,,United Kingdom
564838,DOT,DOTCOM POSTAGE,1,2011-08-30 12:43:00,171.07,,United Kingdom
