InvoiceNo,StockCode,Description,Quantity,InvoiceDate,UnitPrice,CustomerID,Country
579401,23552,BICYCLE PUNCTURE REPAIR KIT ,1,2011-11-29 12:12:00,2.08,14550.0,United Kingdom
579401,23499,SET 12 VINTAGE DOILY CHALK ,7,2011-11-29 12:12:00,0.42,14550.0,United Kingdom
579401,23189,SET OF 12 FORK CANDLES,4,2011-11-29 12:12:00,2.89,14550.0,United Kingdom
579401,22079,RIBBON REEL HEARTS DESIGN ,5,2011-11-29 12:12:00,1.65,14550.0,United Kingdom
579401,23500,KEY RING BASEBALL BOOT ASSORTED ,20,2011-11-29 12:12:00,1.25,14550.0,United Kingdom
579401,21985,PACK OF 12 HEARTS DESIGN TISSUES ,12,2011-11-29 12:12:00,0.39,14550.0,United Kingdom
579401,23461,SWEETHEART BIRD HOUSE,1,2011-11-29 12:12:00,4.15,14550.0,United Kingdom
579401,23378,PACK OF 12 50'S CHRISTMAS TISSUES,12,2011-11-29 12:12:00,0.39,14550.0,United Kingdom
579401,23084,RABBIT NIGHT LIGHT,30,2011-11-29 12:12:00,1.79,14550.0,United Kingdom
579401,82482,WOODEN PICTURE FRAME WHITE FINISH,6,2011-11-29 12:12:00,2.95,14550.0,United Kingdom
579401,23552,BICYCLE PUNCTURE REPAIR KIT ,4,2011-11-29 12:12:00,2.08,14550.0,United Kingdom
579401,82494L,WOODEN FRAME ANTIQUE WHITE ,6,2011-11-29 12:12:00,2.95,14550.0,United Kingdom
579401,23498,CLASSIC BICYCLE CLIPS ,2,2011-11-29 12:12:00,1.45,14550.0,United Kingdom
579401,22768,FAMILY PHOTO FRAME CORNICE,2,2011-11-29 12:12:00,9.95,14550.0,United Kingdom
579402,23157,SET OF 6 NATIVITY MAGNETS ,115,2011-11-29 12:14:00,1.85,17306.0,United Kingdom
579402,22619,SET OF 6 SOLDIER SKITTLES,16,2011-11-29 12:14:00,3.75,17306.0,United Kingdom
579402,22970,LONDON BUS COFFEE MUG,36,2011-11-29 12:14:00,2.1,17306.0,United Kingdom
579403,23080,RED METAL BOX TOP SECRET,10,2011-11-29 12:15:00,8.25,14503.0,United Kingdom
579403,23582,VINTAGE DOILY JUMBO BAG RED ,20,2011-11-29 12:15:00,2.08,14503.0,United Kingdom
579403,23581,JUMBO BAG PAISLEY PARK,30,2011-11-29 12:15:00,2.08,14503.0,United Kingdom
579403,85099B,JUMBO BAG RED RETROSPOT,20,2011-11-29 12:15:00,2.08,14503.0,United Kingdom
579403,22411,JUMBO SHOPPER VINTAGE RED PAISLEY,20,2011-11-29 12:15:00,2.08,14503.0,United Kingdom
579403,85099C,JUMBO  BAG BAROQUE BLACK WHITE,10,2011-11-29 12:15:00,2.08,14503.0,United Kingdom
579403,22386,JUMBO BAG PINK POLKADOT,10,2011-11-29 12:15:00,2.08,14503.0,United Kingdom
579403,23343,JUMBO BAG VINTAGE CHRISTMAS ,40,2011-11-29 12:15:00,2.08,14503.0,United Kingdom
579403,23344,JUMBO BAG 50'S CHRISTMAS ,20,2011-11-29 12:15:00,2.08,14503.0,United Kingdom
579404,22274,FELTCRAFT DOLL EMILY,6,2011-11-29 12:21:00,2.95,14126.0,United Kingdom
579404,22150,3 STRIPEY MICE FELTCRAFT,6,2011-11-29 12:21:00,1.95,14126.0,United Kingdom
579404,22273,FELTCRAFT DOLL MOLLY,6,2011-11-29 12:21:00,2.95,14126.0,United Kingdom
579404,22779,WOODEN OWLS LIGHT GARLAND ,4,2011-11-29 12:21:00,4.25,14126.0,United Kingdom
579404,22621,TRADITIONAL KNITTING NANCY,12,2011-11-29 12:21:00,1.65,14126.0,United Kingdom
579404,22457,NATURAL SLATE HEART CHALKBOARD ,12,2011-11-29 12:21:00,2.95,14126.0,United Kingdom
579404,85123A,WHITE HANGING HEART T-LIGHT HOLDER,12,2011-11-29 12:21:00,2.95,14126.0,United Kingdom
579404,20961,STRAWBERRY BATH SPONGE ,50,2011-11-29 12:21:00,1.25,14126.0,United Kingdom
579404,22605,WOODEN CROQUET GARDEN SET,1,2011-11-29 12:21:00,14.95,14126.0,United Kingdom
579404,22433,WATERING CAN GREEN DINOSAUR,6,2011-11-29 12:21:00,1.95,14126.0,United Kingdom
579404,21479,WHITE SKULL HOT WATER BOTTLE ,4,2011-11-29 12:21:00,4.25,14126.0,United Kingdom
579404,23444,Next Day Carriage,1,2011-11-29 12:21:00,15.0,14126.0,United Kingdom
579405,20963,APPLE BATH SPONGE,50,2011-11-29 12:22:00,1.25,14126.0,United Kingdom
579405,22560,TRADITIONAL MODELLING CLAY,288,2011-11-29 12:22:00,1.06,14126.0,United Kingdom
579406,37449,CERAMIC CAKE STAND + HANGING CAKES,2,2011-11-29 12:27:00,9.95,13014.0,United Kingdom
579406,22061,LARGE CAKE STAND  HANGING STRAWBERY,2,2011-11-29 12:27:00,9.95,13014.0,United Kingdom
579406,21258,VICTORIAN SEWING BOX LARGE,8,2011-11-29 12:27:00,10.95,13014.0,United Kingdom
579406,21257,VICTORIAN SEWING BOX MEDIUM,10,2011-11-29 12:27:00,7.95,13014.0,United Kingdom
579406,21259,VICTORIAN SEWING BOX SMALL ,8,2011-11-29 12:27:00,5.95,13014.0,United Kingdom
579406,21232,STRAWBERRY CERAMIC TRINKET POT,12,2011-11-29 12:27:00,1.25,13014.0,United Kingdom
579406,22667,RECIPE BOX RETROSPOT ,12,2011-11-29 12:27:00,2.95,13014.0,United Kingdom
579407,21790,VINTAGE SNAP CARDS,12,2011-11-29 12:32:00,0.85,13657.0,United Kingdom
579407,21791,VINTAGE HEADS AND TAILS CARD GAME ,12,2011-11-29 12:32:00,1.25,13657.0,United Kingdom
579407,22468,BABUSHKA LIGHTS STRING OF 10,10,2011-11-29 12:32:00,6.75,13657.0,United Kingdom
579407,22940,FELTCRAFT CHRISTMAS FAIRY,12,2011-11-29 12:32:00,4.25,13657.0,United Kingdom
579407,22144,CHRISTMAS CRAFT LITTLE FRIENDS,12,2011-11-29 12:32:00,2.1,13657.0,United Kingdom
579407,84347,ROTATING SILVER ANGELS T-LIGHT HLDR,18,2011-11-29 12:32:00,2.55,13657.0,United Kingdom
579407,23444,Next Day Carriage,1,2011-11-29 12:32:00,15.0,13657.0,United Kingdom
579408,21642,ASSORTED TUTTI FRUTTI PEN,1,2011-11-29 12:34:00,0.29,14701.0,United Kingdom
579408,23284,DOORMAT KEEP CALM AND COME IN,1,2011-11-29 12:34:00,8.25,14701.0,United Kingdom
579408,23489,VINTAGE BELLS GARLAND,16,2011-11-29 12:34:00,2.89,14701.0,United Kingdom
579408,23216,LAUREL HEART ANTIQUE GOLD,5,2011-11-29 12:34:00,1.25,14701.0,United Kingdom
579408,23220,REINDEER HEART DECORATION GOLD,3,2011-11-29 12:34:00,0.83,14701.0,United Kingdom
579408,23217,LAUREL HEART ANTIQUE SILVER,9,2011-11-29 12:34:00,1.25,14701.0,United Kingdom
579408,23225,CHERUB HEART DECORATION SILVER ,4,2011-11-29 12:34:00,0.83,14701.0,United Kingdom
579408,23221,REINDEER HEART DECORATION SILVER,4,2011-11-29 12:34:00,0.83,14701.0,United Kingdom
579408,23265,SET OF 3 WOODEN TREE DECORATIONS,3,2011-11-29 12:34:00,1.25,14701.0,United Kingdom
579408,23266,SET OF 3 WOODEN STOCKING DECORATION,3,2011-11-29 12:34:00,1.25,14701.0,United Kingdom
579408,23264,SET OF 3 WOODEN SLEIGH DECORATIONS,4,2011-11-29 12:34:00,1.25,14701.0,United Kingdom
579408,23263,SET OF 3 WOODEN HEART DECORATIONS,4,2011-11-29 12:34:00,1.25,14701.0,United Kingdom
579408,84875B,GREEN SQUARE COMPACT MIRROR,1,2011-11-29 12:34:00,1.25,14701.0,United Kingdom
579408,84876B,GREEN HEART COMPACT MIRROR,2,2011-11-29 12:34:00,1.25,14701.0,United Kingdom
579408,22945,CHRISTMAS METAL TAGS ASSORTED ,7,2011-11-29 12:34:00,0.85,14701.0,United Kingdom
579408,23501,KEY RING BASEBALL BOOT UNION JACK,2,2011-11-29 12:34:00,1.25,14701.0,United Kingdom
579408,23500,KEY RING BASEBALL BOOT ASSORTED ,6,2011-11-29 12:34:00,1.25,14701.0,United Kingdom
579408,23116,VEGETABLE GARDEN CHOPPING BOARD,1,2011-11-29 12:34:00,4.95,14701.0,United Kingdom
579408,23115,RED APPLES CHOPPING BOARD   ,1,2011-11-29 12:34:00,4.95,14701.0,United Kingdom
579408,23114,VINTAGE LEAF CHOPPING BOARD  ,2,2011-11-29 12:34:00,4.95,14701.0,United Kingdom
579408,23117,POPPY FIELDS CHOPPING BOARD,2,2011-11-29 12:34:00,4.95,14701.0,United Kingdom
579408,22961,JAM MAKING SET PRINTED,2,2011-11-29 12:34:00,1.45,14701.0,United Kingdom
579408,23426,METAL SIGN DROP YOUR PANTS,2,2011-11-29 12:34:00,2.89,14701.0,United Kingdom
579408,21172,PARTY METAL SIGN ,1,2011-11-29 12:34:00,1.45,14701.0,United Kingdom
579408,21166,COOK WITH WINE METAL SIGN ,1,2011-11-29 12:34:00,2.08,14701.0,United Kingdom
579408,21903,MAN FLU METAL SIGN,1,2011-11-29 12:34:00,2.1,14701.0,United Kingdom
579408,21832,CHOCOLATE CALCULATOR,1,2011-11-29 12:34:00,1.65,14701.0,United Kingdom
579408,22997,TRAVEL CARD WALLET UNION JACK,2,2011-11-29 12:34:00,0.42,14701.0,United Kingdom
579408,23000,TRAVEL CARD WALLET TRANSPORT,4,2011-11-29 12:34:00,0.42,14701.0,United Kingdom
579408,23005,TRAVEL CARD WALLET I LOVE LONDON,3,2011-11-29 12:34:00,0.42,14701.0,United Kingdom
579408,23002,TRAVEL CARD WALLET SKULLS,5,2011-11-29 12:34:00,0.42,14701.0,United Kingdom
579408,22998,TRAVEL CARD WALLET KEEP CALM,4,2011-11-29 12:34:00,0.42,14701.0,United Kingdom
579408,20986,BLUE CALCULATOR RULER,1,2011-11-29 12:34:00,1.25,14701.0,United Kingdom
579408,23269,SET OF 2 CERAMIC CHRISTMAS TREES,6,2011-11-29 12:34:00,1.45,14701.0,United Kingdom
579408,23270,SET OF 2 CERAMIC PAINTED HEARTS ,6,2011-11-29 12:34:00,1.45,14701.0,United Kingdom
579408,23497,CLASSIC CHROME BICYCLE BELL ,1,2011-11-29 12:34:00,1.45,14701.0,United Kingdom
579408,23498,CLASSIC BICYCLE CLIPS ,1,2011-11-29 12:34:00,1.45,14701.0,United Kingdom
579408,23552,BICYCLE PUNCTURE REPAIR KIT ,1,2011-11-29 12:34:00,2.08,14701.0,United Kingdom
579408,22564,ALPHABET STENCIL CRAFT,2,2011-11-29 12:34:00,1.25,14701.0,United Kingdom
579408,22992,REVOLVER WOODEN RULER ,1,2011-11-29 12:34:00,1.95,14701.0,United Kingdom
579408,22991,GIRAFFE WOODEN RULER,1,2011-11-29 12:34:00,1.95,14701.0,United Kingdom
579408,22953,BIRTHDAY PARTY CORDON BARRIER TAPE,1,2011-11-29 12:34:00,1.25,14701.0,United Kingdom
579408,23439,HAND WARMER RED LOVE HEART,1,2011-11-29 12:34:00,2.1,14701.0,United Kingdom
579408,22865,HAND WARMER OWL DESIGN,1,2011-11-29 12:34:00,2.1,14701.0,United Kingdom
579408,22633,HAND WARMER UNION JACK,2,2011-11-29 12:34:00,2.1,14701.0,United Kingdom
579408,22095,LADS ONLY TISSUE BOX,2,2011-11-29 12:34:00,0.39,14701.0,United Kingdom
579408,23189,SET OF 12 FORK CANDLES,5,2011-11-29 12:34:00,2.89,14701.0,United Kingdom
579408,21592,RETROSPOT CIGAR BOX MATCHES ,5,2011-11-29 12:34:00,1.25,14701.0,United Kingdom
579408,23491,VINTAGE JINGLE BELLS HEART,6,2011-11-29 12:34:00,8.25,14701.0,United Kingdom
579408,23492,VINTAGE JINGLE BELLS WREATH,1,2011-11-29 12:34:00,8.25,14701.0,United Kingdom
579408,22349,DOG BOWL CHASING BALL DESIGN,4,2011-11-29 12:34:00,3.75,14701.0,United Kingdom
579408,23215,JINGLE BELL HEART ANTIQUE SILVER,10,2011-11-29 12:34:00,2.08,14701.0,United Kingdom
579408,23660,HENRIETTA HEN MUG ,6,2011-11-29 12:34:00,1.65,14701.0,United Kingdom
579408,22791,T-LIGHT GLASS FLUTED ANTIQUE,12,2011-11-29 12:34:00,1.25,14701.0,United Kingdom
579408,23355,HOT WATER BOTTLE KEEP CALM,2,2011-11-29 12:34:00,4.95,14701.0,United Kingdom
579408,23356,LOVE HOT WATER BOTTLE,2,2011-11-29 12:34:00,5.95,14701.0,United Kingdom
579408,22909,SET OF 20 VINTAGE CHRISTMAS NAPKINS,2,2011-11-29 12:34:00,0.85,14701.0,United Kingdom
579408,23085,ANTIQUE SILVER BAUBLE LAMP  ,6,2011-11-29 12:34:00,10.4,14701.0,United Kingdom
579408,22086,PAPER CHAIN KIT 50'S CHRISTMAS ,2,2011-11-29 12:34:00,2.95,14701.0,United Kingdom
579408,22585,PACK OF 6 BIRDY GIFT TAGS,1,2011-11-29 12:34:00,1.25,14701.0,United Kingdom
579408,22733,3D TRADITIONAL CHRISTMAS STICKERS,2,2011-11-29 12:34:00,1.25,14701.0,United Kingdom
579408,22734,SET OF 6 RIBBONS VINTAGE CHRISTMAS,2,2011-11-29 12:34:00,2.89,14701.0,United Kingdom
579408,22952,60 CAKE CASES VINTAGE CHRISTMAS,2,2011-11-29 12:34:00,0.55,14701.0,United Kingdom
579408,23319,BOX OF 6 MINI 50'S CRACKERS,2,2011-11-29 12:34:00,2.49,14701.0,United Kingdom
579408,23320,GIANT 50'S CHRISTMAS CRACKER,4,2011-11-29 12:34:00,2.89,14701.0,United Kingdom
579408,23196,VINTAGE LEAF MAGNETIC NOTEPAD,1,2011-11-29 12:34:00,1.45,14701.0,United Kingdom
579408,22909,SET OF 20 VINTAGE CHRISTMAS NAPKINS,3,2011-11-29 12:34:00,0.85,14701.0,United Kingdom
579408,23353,6 GIFT TAGS VINTAGE CHRISTMAS ,2,2011-11-29 12:34:00,0.83,14701.0,United Kingdom
579408,23354,6 GIFT TAGS 50'S CHRISTMAS ,2,2011-11-29 12:34:00,0.83,14701.0,United Kingdom
579408,23553,LANDMARK FRAME CAMDEN TOWN ,1,2011-11-29 12:34:00,12.5,14701.0,United Kingdom
579408,23557,LANDMARK FRAME BAKER STREET ,1,2011-11-29 12:34:00,12.5,14701.0,United Kingdom
579408,23558,LANDMARK FRAME LONDON BRIDGE ,1,2011-11-29 12:34:00,12.5,14701.0,United Kingdom
579408,23247,BISCUIT TIN 50'S CHRISTMAS,4,2011-11-29 12:34:00,2.89,14701.0,United Kingdom
579408,21638,ASSORTED TUTTI FRUTTI NOTEBOOK,1,2011-11-29 12:34:00,2.1,14701.0,United Kingdom
579408,23083,SET 6 PAPER TABLE LANTERN STARS ,1,2011-11-29 12:34:00,3.75,14701.0,United Kingdom
579408,22398,MAGNETS PACK OF 4 SWALLOWS,1,2011-11-29 12:34:00,0.39,14701.0,United Kingdom
579408,47563A,RETRO LONGBOARD IRONING BOARD COVER,1,2011-11-29 12:34:00,1.25,14701.0,United Kingdom
579408,23190,BUNDLE OF 3 SCHOOL EXERCISE BOOKS  ,1,2011-11-29 12:34:00,1.65,14701.0,United Kingdom
579408,23123,COCKTAIL SWORDS 50 PIECES,1,2011-11-29 12:34:00,0.83,14701.0,United Kingdom
579408,23571,TRADITIONAL NAUGHTS & CROSSES,1,2011-11-29 12:34:00,1.65,14701.0,United Kingdom
579408,23569,TRADTIONAL ALPHABET STAMP SET,1,2011-11-29 12:34:00,4.95,14701.0,United Kingdom
579408,23570,TRADITIONAL PICK UP STICKS GAME ,1,2011-11-29 12:34:00,1.25,14701.0,United Kingdom
579408,23082,SET 6 PAPER TABLE LANTERN HEARTS ,1,2011-11-29 12:34:00,3.75,14701.0,United Kingdom
579408,22095,LADS ONLY TISSUE BOX,1,2011-11-29 12:34:00,0.39,14701.0,United Kingdom
579408,23552,BICYCLE PUNCTURE REPAIR KIT ,1,2011-11-29 12:34:00,2.08,14701.0,United Kingdom
579408,23493,VINTAGE DOILY TRAVEL SEWING KIT,1,2011-11-29 12:34:00,1.95,14701.0,United Kingdom
579408,23241,TREASURE TIN GYMKHANA DESIGN,1,2011-11-29 12:34:00,2.08,14701.0,United Kingdom
579408,23196,VINTAGE LEAF MAGNETIC NOTEPAD,1,2011-11-29 12:34:00,1.45,14701.0,United Kingdom
579408,23340,VINTAGE CHRISTMAS CAKE FRILL,1,2011-11-29 12:34:00,1.65,14701.0,United Kingdom
579408,21832,CHOCOLATE CALCULATOR,1,2011-11-29 12:34:00,1.65,14701.0,United Kingdom
579408,22585,PACK OF 6 BIRDY GIFT TAGS,1,2011-11-29 12:34:00,1.25,14701.0,United Kingdom
579408,23201,JUMBO BAG ALPHABET,1,2011-11-29 12:34:00,2.08,14701.0,United Kingdom
579408,22812,PACK 3 BOXES CHRISTMAS PANETTONE,4,2011-11-29 12:34:00,1.95,14701.0,United Kingdom
579408,22992,REVOLVER WOODEN RULER ,3,2011-11-29 12:34:00,1.95,14701.0,United Kingdom
579408,23300,GARDENERS KNEELING PAD CUP OF TEA ,2,2011-11-29 12:34:00,1.65,14701.0,United Kingdom
579408,22197,POPCORN HOLDER,5,2011-11-29 12:34:00,0.85,14701.0,United Kingdom
579409,23531,WALL ART BIG LOVE ,1,2011-11-29 12:38:00,6.95,14701.0,United Kingdom
579410,21174,POTTERING IN THE SHED METAL SIGN,12,2011-11-29 12:45:00,2.08,16168.0,United Kingdom
579410,21868,POTTING SHED TEA MUG,12,2011-11-29 12:45:00,1.65,16168.0,United Kingdom
579410,21876,POTTERING MUG,12,2011-11-29 12:45:00,1.65,16168.0,United Kingdom
579411,23200,JUMBO BAG PEARS,1,2011-11-29 12:46:00,2.08,16794.0,United Kingdom
579411,22772,PINK DRAWER KNOB ACRYLIC EDWARDIAN,1,2011-11-29 12:46:00,1.25,16794.0,United Kingdom
579411,22773,GREEN DRAWER KNOB ACRYLIC EDWARDIAN,2,2011-11-29 12:46:00,1.25,16794.0,United Kingdom
579411,22457,NATURAL SLATE HEART CHALKBOARD ,2,2011-11-29 12:46:00,2.95,16794.0,United Kingdom
579411,22227,HANGING HEART MIRROR DECORATION ,27,2011-11-29 12:46:00,0.65,16794.0,United Kingdom
579411,23226,FILIGREE HEART DAISY WHITE,2,2011-11-29 12:46:00,1.25,16794.0,United Kingdom
579411,23227,FILIGREE HEART BUTTERFLY WHITE ,2,2011-11-29 12:46:00,1.25,16794.0,United Kingdom
579411,20725,LUNCH BAG RED RETROSPOT,7,2011-11-29 12:46:00,1.65,16794.0,United Kingdom
579411,23681,LUNCH BAG RED VINTAGE DOILY,2,2011-11-29 12:46:00,1.65,16794.0,United Kingdom
579411,22383,LUNCH BAG SUKI DESIGN ,4,2011-11-29 12:46:00,1.65,16794.0,United Kingdom
579411,22384,LUNCH BAG PINK POLKADOT,8,2011-11-29 12:46:00,1.65,16794.0,United Kingdom
579411,23209,LUNCH BAG VINTAGE DOILY ,4,2011-11-29 12:46:00,1.65,16794.0,United Kingdom
579411,23206,LUNCH BAG APPLE DESIGN,2,2011-11-29 12:46:00,1.65,16794.0,United Kingdom
579411,23583,LUNCH BAG PAISLEY PARK  ,11,2011-11-29 12:46:00,1.65,16794.0,United Kingdom
579411,22666,RECIPE BOX PANTRY YELLOW DESIGN,3,2011-11-29 12:46:00,2.95,16794.0,United Kingdom
579411,23198,PANTRY MAGNETIC  SHOPPING LIST,2,2011-11-29 12:46:00,1.45,16794.0,United Kingdom
579411,21218,RED SPOTTY BISCUIT TIN,2,2011-11-29 12:46:00,3.75,16794.0,United Kingdom
579411,82552,WASHROOM METAL SIGN,3,2011-11-29 12:46:00,1.45,16794.0,United Kingdom
579411,22720,SET OF 3 CAKE TINS PANTRY DESIGN ,1,2011-11-29 12:46:00,4.95,16794.0,United Kingdom
579411,22993,SET OF 4 PANTRY JELLY MOULDS,3,2011-11-29 12:46:00,1.25,16794.0,United Kingdom
579411,23243,SET OF TEA COFFEE SUGAR TINS PANTRY,2,2011-11-29 12:46:00,4.95,16794.0,United Kingdom
579411,21216,"SET 3 RETROSPOT TEA,COFFEE,SUGAR",2,2011-11-29 12:46:00,4.95,16794.0,United Kingdom
579411,22723,SET OF 6 HERB TINS SKETCHBOOK,3,2011-11-29 12:46:00,3.95,16794.0,United Kingdom
579412,23552,BICYCLE PUNCTURE REPAIR KIT ,6,2011-11-29 12:47:00,2.08,14125.0,United Kingdom
579412,23084,RABBIT NIGHT LIGHT,6,2011-11-29 12:47:00,2.08,14125.0,United Kingdom
579412,22150,3 STRIPEY MICE FELTCRAFT,6,2011-11-29 12:47:00,1.95,14125.0,United Kingdom
579412,23126,FELTCRAFT GIRL AMELIE KIT,4,2011-11-29 12:47:00,4.95,14125.0,United Kingdom
579412,72800E,4 IVORY DINNER CANDLES SILVER FLOCK,6,2011-11-29 12:47:00,2.55,14125.0,United Kingdom
579412,22835,HOT WATER BOTTLE I AM SO POORLY,4,2011-11-29 12:47:00,4.95,14125.0,United Kingdom
579412,22725,ALARM CLOCK BAKELIKE CHOCOLATE,4,2011-11-29 12:47:00,3.75,14125.0,United Kingdom
579412,22726,ALARM CLOCK BAKELIKE GREEN,4,2011-11-29 12:47:00,3.75,14125.0,United Kingdom
579412,22727,ALARM CLOCK BAKELIKE RED ,4,2011-11-29 12:47:00,3.75,14125.0,United Kingdom
579412,22730,ALARM CLOCK BAKELIKE IVORY,4,2011-11-29 12:47:00,3.75,14125.0,United Kingdom
579412,22192,BLUE DINER WALL CLOCK,2,2011-11-29 12:47:00,8.5,14125.0,United Kingdom
579412,23429,RED RETRO KITCHEN WALL CLOCK,2,2011-11-29 12:47:00,8.15,14125.0,United Kingdom
579412,10135,COLOURING PENCILS BROWN TUBE,10,2011-11-29 12:47:00,1.25,14125.0,United Kingdom
579412,22489,PACK OF 12 TRADITIONAL CRAYONS,24,2011-11-29 12:47:00,0.42,14125.0,United Kingdom
579412,22374,AIRLINE BAG VINTAGE JET SET RED,8,2011-11-29 12:47:00,4.25,14125.0,United Kingdom
579412,22372,AIRLINE BAG VINTAGE WORLD CHAMPION ,4,2011-11-29 12:47:00,4.25,14125.0,United Kingdom
579412,22028,PENNY FARTHING BIRTHDAY CARD,12,2011-11-29 12:47:00,0.42,14125.0,United Kingdom
579412,21506,"FANCY FONT BIRTHDAY CARD, ",12,2011-11-29 12:47:00,0.42,14125.0,United Kingdom
579412,85015,SET OF 12  VINTAGE POSTCARD SET,24,2011-11-29 12:47:00,0.65,14125.0,United Kingdom
579412,22771,CLEAR DRAWER KNOB ACRYLIC EDWARDIAN,12,2011-11-29 12:47:00,1.25,14125.0,United Kingdom
579412,23029,DRAWER KNOB CRACKLE GLAZE GREEN,6,2011-11-29 12:47:00,1.65,14125.0,United Kingdom
579412,23031,DRAWER KNOB CRACKLE GLAZE PINK,6,2011-11-29 12:47:00,1.65,14125.0,United Kingdom
579412,21990,MODERN FLORAL STATIONERY SET,12,2011-11-29 12:47:00,1.25,14125.0,United Kingdom
579413,23406,HOME SWEET HOME KEY HOLDER,2,2011-11-29 12:50:00,6.25,13668.0,United Kingdom
579413,22573,STAR WOODEN CHRISTMAS DECORATION,6,2011-11-29 12:50:00,0.85,13668.0,United Kingdom
579413,22578,WOODEN STAR CHRISTMAS SCANDINAVIAN,10,2011-11-29 12:50:00,0.29,13668.0,United Kingdom
579413,22577,WOODEN HEART CHRISTMAS SCANDINAVIAN,10,2011-11-29 12:50:00,0.29,13668.0,United Kingdom
579413,22574,HEART WOODEN CHRISTMAS DECORATION,6,2011-11-29 12:50:00,0.85,13668.0,United Kingdom
579413,23490,T-LIGHT HOLDER HANGING LOVE BIRD,1,2011-11-29 12:50:00,3.75,13668.0,United Kingdom
579413,23213,STAR WREATH DECORATION WITH BELL,6,2011-11-29 12:50:00,1.25,13668.0,United Kingdom
579413,23212,HEART WREATH DECORATION WITH BELL,6,2011-11-29 12:50:00,1.25,13668.0,United Kingdom
579413,23210,WHITE ROCKING HORSE HAND PAINTED,10,2011-11-29 12:50:00,1.25,13668.0,United Kingdom
579413,21181,PLEASE ONE PERSON METAL SIGN,8,2011-11-29 12:50:00,2.1,13668.0,United Kingdom
579413,23404,HOME SWEET HOME BLACKBOARD,2,2011-11-29 12:50:00,4.95,13668.0,United Kingdom
579413,23403,LETTER HOLDER HOME SWEET HOME,2,2011-11-29 12:50:00,3.75,13668.0,United Kingdom
579413,22178,VICTORIAN GLASS HANGING T-LIGHT,12,2011-11-29 12:50:00,1.95,13668.0,United Kingdom
579413,23132,SMALL IVORY HEART WALL ORGANISER,2,2011-11-29 12:50:00,5.75,13668.0,United Kingdom
579413,23486,ANTIQUE HEART SHELF UNIT,1,2011-11-29 12:50:00,16.65,13668.0,United Kingdom
579413,82483,WOOD 2 DRAWER CABINET WHITE FINISH,2,2011-11-29 12:50:00,6.95,13668.0,United Kingdom
579413,23400,SHELF WITH 4 HOOKS HOME SWEET HOME,4,2011-11-29 12:50:00,6.25,13668.0,United Kingdom
579413,22297,HEART IVORY TRELLIS SMALL,10,2011-11-29 12:50:00,1.25,13668.0,United Kingdom
579413,23152,IVORY SWEETHEART WIRE LETTER RACK ,2,2011-11-29 12:50:00,3.75,13668.0,United Kingdom
579413,22909,SET OF 20 VINTAGE CHRISTMAS NAPKINS,4,2011-11-29 12:50:00,0.85,13668.0,United Kingdom
579413,23061,VINTAGE EMBOSSED HEART,12,2011-11-29 12:50:00,1.25,13668.0,United Kingdom
579413,82483,WOOD 2 DRAWER CABINET WHITE FINISH,2,2011-11-29 12:50:00,6.95,13668.0,United Kingdom
579413,23318,BOX OF 6 MINI VINTAGE CRACKERS,2,2011-11-29 12:50:00,2.49,13668.0,United Kingdom
579413,23320,GIANT 50'S CHRISTMAS CRACKER,2,2011-11-29 12:50:00,2.89,13668.0,United Kingdom
579413,23452,HEART MINI PORTRAIT FRAME,4,2011-11-29 12:50:00,1.95,13668.0,United Kingdom
579413,37448,CERAMIC CAKE DESIGN SPOTTED MUG,2,2011-11-29 12:50:00,1.49,13668.0,United Kingdom
579413,22059,CERAMIC STRAWBERRY DESIGN MUG,2,2011-11-29 12:50:00,1.49,13668.0,United Kingdom
579413,82486,3 DRAWER ANTIQUE WHITE WOOD CABINET,2,2011-11-29 12:50:00,8.95,13668.0,United Kingdom
579413,23319,BOX OF 6 MINI 50'S CRACKERS,2,2011-11-29 12:50:00,2.49,13668.0,United Kingdom
579413,72598,SET/12 TAPER CANDLES,4,2011-11-29 12:50:00,0.85,13668.0,United Kingdom
579413,37448,CERAMIC CAKE DESIGN SPOTTED MUG,2,2011-11-29 12:50:00,1.49,13668.0,United Kingdom
579413,22059,CERAMIC STRAWBERRY DESIGN MUG,2,2011-11-29 12:50:00,1.49,13668.0,United Kingdom
579413,22154,ANGEL DECORATION 3 BUTTONS ,8,2011-11-29 12:50:00,0.42,13668.0,United Kingdom
579413,22155,STAR DECORATION RUSTIC,10,2011-11-29 12:50:00,0.42,13668.0,United Kingdom
579413,22153,ANGEL DECORATION STARS ON DRESS,10,2011-11-29 12:50:00,0.42,13668.0,United Kingdom
579413,23453,OVAL  MINI PORTRAIT FRAME,4,2011-11-29 12:50:00,1.95,13668.0,United Kingdom
579413,82484,WOOD BLACK BOARD ANT WHITE FINISH,4,2011-11-29 12:50:00,7.95,13668.0,United Kingdom
579413,21673,WHITE SPOT BLUE CERAMIC DRAWER KNOB,2,2011-11-29 12:50:00,1.45,13668.0,United Kingdom
579413,21670,BLUE SPOT CERAMIC DRAWER KNOB,4,2011-11-29 12:50:00,1.45,13668.0,United Kingdom
579413,22834,HAND WARMER BABUSHKA DESIGN,1,2011-11-29 12:50:00,2.1,13668.0,United Kingdom
579413,21928,JUMBO BAG SCANDINAVIAN BLUE PAISLEY,10,2011-11-29 12:50:00,2.08,13668.0,United Kingdom
579413,22867,HAND WARMER BIRD DESIGN,4,2011-11-29 12:50:00,2.1,13668.0,United Kingdom
579413,22866,HAND WARMER SCOTTY DOG DESIGN,4,2011-11-29 12:50:00,2.1,13668.0,United Kingdom
579413,22865,HAND WARMER OWL DESIGN,4,2011-11-29 12:50:00,2.1,13668.0,United Kingdom
579413,23439,HAND WARMER RED LOVE HEART,4,2011-11-29 12:50:00,2.1,13668.0,United Kingdom
579413,23215,JINGLE BELL HEART ANTIQUE SILVER,4,2011-11-29 12:50:00,2.08,13668.0,United Kingdom
579413,21463,MIRRORED DISCO BALL ,1,2011-11-29 12:50:00,5.95,13668.0,United Kingdom
579414,22969,HOMEMADE JAM SCENTED CANDLES,12,2011-11-29 12:52:00,1.45,14719.0,United Kingdom
579414,22138,BAKING SET 9 PIECE RETROSPOT ,2,2011-11-29 12:52:00,4.95,14719.0,United Kingdom
579414,23076,ICE CREAM SUNDAE LIP GLOSS,24,2011-11-29 12:52:00,1.25,14719.0,United Kingdom
579414,22360,GLASS JAR ENGLISH CONFECTIONERY,1,2011-11-29 12:52:00,2.95,14719.0,United Kingdom
579414,20973,12 PENCIL SMALL TUBE WOODLAND,8,2011-11-29 12:52:00,0.65,14719.0,United Kingdom
579414,85019B,BLOSSOM  IMAGES NOTEBOOK SET,4,2011-11-29 12:52:00,1.25,14719.0,United Kingdom
579414,22360,GLASS JAR ENGLISH CONFECTIONERY,1,2011-11-29 12:52:00,2.95,14719.0,United Kingdom
579414,21485,RETROSPOT HEART HOT WATER BOTTLE,2,2011-11-29 12:52:00,4.95,14719.0,United Kingdom
579414,22086,PAPER CHAIN KIT 50'S CHRISTMAS ,2,2011-11-29 12:52:00,2.95,14719.0,United Kingdom
579414,22910,PAPER CHAIN KIT VINTAGE CHRISTMAS,2,2011-11-29 12:52:00,2.95,14719.0,United Kingdom
579414,22602,RETROSPOT WOODEN HEART DECORATION,12,2011-11-29 12:52:00,0.85,14719.0,United Kingdom
579414,22601,CHRISTMAS RETROSPOT ANGEL WOOD,12,2011-11-29 12:52:00,0.85,14719.0,United Kingdom
579414,22603,CHRISTMAS RETROSPOT TREE WOOD,12,2011-11-29 12:52:00,0.85,14719.0,United Kingdom
579414,22600,CHRISTMAS RETROSPOT STAR WOOD,12,2011-11-29 12:52:00,0.85,14719.0,United Kingdom
579414,21975,PACK OF 60 DINOSAUR CAKE CASES,2,2011-11-29 12:52:00,0.55,14719.0,United Kingdom
579414,21977,PACK OF 60 PINK PAISLEY CAKE CASES,2,2011-11-29 12:52:00,0.55,14719.0,United Kingdom
579414,84992,72 SWEETHEART FAIRY CAKE CASES,2,2011-11-29 12:52:00,0.55,14719.0,United Kingdom
579414,84991,60 TEATIME FAIRY CAKE CASES,2,2011-11-29 12:52:00,0.55,14719.0,United Kingdom
579414,22551,PLASTERS IN TIN SPACEBOY,16,2011-11-29 12:52:00,1.65,14719.0,United Kingdom
579414,23569,TRADTIONAL ALPHABET STAMP SET,2,2011-11-29 12:52:00,4.95,14719.0,United Kingdom
579414,22750,FELTCRAFT PRINCESS LOLA DOLL,2,2011-11-29 12:52:00,3.75,14719.0,United Kingdom
579414,22110,BIRD HOUSE HOT WATER BOTTLE,2,2011-11-29 12:52:00,2.55,14719.0,United Kingdom
579414,21484,CHICK GREY HOT WATER BOTTLE,2,2011-11-29 12:52:00,4.25,14719.0,United Kingdom
579414,22580,ADVENT CALENDAR GINGHAM SACK,4,2011-11-29 12:52:00,5.95,14719.0,United Kingdom
579414,23320,GIANT 50'S CHRISTMAS CRACKER,4,2011-11-29 12:52:00,2.89,14719.0,United Kingdom
579414,22112,CHOCOLATE HOT WATER BOTTLE,1,2011-11-29 12:52:00,4.95,14719.0,United Kingdom
579414,23298,SPOTTY BUNTING,1,2011-11-29 12:52:00,4.95,14719.0,United Kingdom
579414,47566B,TEA TIME PARTY BUNTING,1,2011-11-29 12:52:00,4.95,14719.0,United Kingdom
579414,21621,VINTAGE UNION JACK BUNTING,1,2011-11-29 12:52:00,8.5,14719.0,United Kingdom
579414,47566,PARTY BUNTING,1,2011-11-29 12:52:00,4.95,14719.0,United Kingdom
579414,23275,SET OF 3 HANGING OWLS OLLIE BEAK,2,2011-11-29 12:52:00,1.25,14719.0,United Kingdom
579414,23263,SET OF 3 WOODEN HEART DECORATIONS,4,2011-11-29 12:52:00,1.25,14719.0,United Kingdom
579414,23265,SET OF 3 WOODEN TREE DECORATIONS,4,2011-11-29 12:52:00,1.25,14719.0,United Kingdom
579414,23266,SET OF 3 WOODEN STOCKING DECORATION,4,2011-11-29 12:52:00,1.25,14719.0,United Kingdom
579414,23264,SET OF 3 WOODEN SLEIGH DECORATIONS,4,2011-11-29 12:52:00,1.25,14719.0,United Kingdom
