InvoiceNo,StockCode,Description,Quantity,InvoiceDate,UnitPrice,CustomerID,Country
579503,23234,BISCUIT TIN VINTAGE CHRISTMAS,1,2011-11-29 16:23:00,2.89,17097.0,Spain
579503,23314,VINTAGE CHRISTMAS TABLECLOTH,1,2011-11-29 16:23:00,12.5,17097.0,Spain
579503,22697,GREEN REGENCY TEACUP AND SAUCER,2,2011-11-29 16:23:00,2.95,17097.0,Spain
579503,22698,PINK REGENCY TEACUP AND SAUCER,2,2011-11-29 16:23:00,2.95,17097.0,Spain
579503,22699,ROSES REGENCY TEACUP AND SAUCER ,4,2011-11-29 16:23:00,2.95,17097.0,Spain
579503,22326,ROUND SNACK BOXES SET OF4 WOODLAND ,2,2011-11-29 16:23:00,2.95,17097.0,Spain
579503,23343,JUMBO BAG VINTAGE CHRISTMAS ,2,2011-11-29 16:23:00,2.08,17097.0,Spain
579503,21931,JUMBO STORAGE BAG SUKI,1,2011-11-29 16:23:00,2.08,17097.0,Spain
579503,23581,JUMBO BAG PAISLEY PARK,2,2011-11-29 16:23:00,2.08,17097.0,Spain
579503,23344,JUMBO BAG 50'S CHRISTMAS ,2,2011-11-29 16:23:00,2.08,17097.0,Spain
579503,21929,JUMBO BAG PINK VINTAGE PAISLEY,1,2011-11-29 16:23:00,2.08,17097.0,Spain
579503,85099B,JUMBO BAG RED RETROSPOT,1,2011-11-29 16:23:00,2.08,17097.0,Spain
579503,20713,JUMBO BAG OWLS,1,2011-11-29 16:23:00,2.08,17097.0,Spain
579503,21928,JUMBO BAG SCANDINAVIAN BLUE PAISLEY,1,2011-11-29 16:23:00,2.08,17097.0,Spain
579503,23582,VINTAGE DOILY JUMBO BAG RED ,1,2011-11-29 16:23:00,2.08,17097.0,Spain
579505,22107,PIZZA PLATE IN BOX,4,2011-11-29 16:31:00,3.75,13078.0,United Kingdom
579505,21463,MIRRORED DISCO BALL ,2,2011-11-29 16:31:00,5.95,13078.0,United Kingdom
579505,21464,DISCO BALL ROTATOR BATTERY OPERATED,2,2011-11-29 16:31:00,4.25,13078.0,United Kingdom
579505,21754,HOME BUILDING BLOCK WORD,3,2011-11-29 16:31:00,6.25,13078.0,United Kingdom
579505,21181,PLEASE ONE PERSON METAL SIGN,48,2011-11-29 16:31:00,1.85,13078.0,United Kingdom
579505,22197,POPCORN HOLDER,300,2011-11-29 16:31:00,0.72,13078.0,United Kingdom
579505,23084,RABBIT NIGHT LIGHT,48,2011-11-29 16:31:00,1.79,13078.0,United Kingdom
579506,23497,CLASSIC CHROME BICYCLE BELL ,12,2011-11-29 16:31:00,1.45,15089.0,United Kingdom
579506,22441,GROW YOUR OWN BASIL IN ENAMEL MUG,8,2011-11-29 16:31:00,2.1,15089.0,United Kingdom
579506,22916,HERB MARKER THYME,12,2011-11-29 16:31:00,0.65,15089.0,United Kingdom
579506,22918,HERB MARKER PARSLEY,12,2011-11-29 16:31:00,0.65,15089.0,United Kingdom
579506,22920,HERB MARKER BASIL,12,2011-11-29 16:31:00,0.65,15089.0,United Kingdom
579506,22917,HERB MARKER ROSEMARY,12,2011-11-29 16:31:00,0.65,15089.0,United Kingdom
579506,22919,HERB MARKER MINT,12,2011-11-29 16:31:00,0.65,15089.0,United Kingdom
579506,22921,HERB MARKER CHIVES ,12,2011-11-29 16:31:00,0.65,15089.0,United Kingdom
579506,23552,BICYCLE PUNCTURE REPAIR KIT ,12,2011-11-29 16:31:00,2.08,15089.0,United Kingdom
579506,23498,CLASSIC BICYCLE CLIPS ,12,2011-11-29 16:31:00,1.45,15089.0,United Kingdom
579506,22138,BAKING SET 9 PIECE RETROSPOT ,3,2011-11-29 16:31:00,4.95,15089.0,United Kingdom
579507,23089,GLASS BON BON JAR,12,2011-11-29 16:32:00,1.95,15297.0,United Kingdom
579507,22798,ANTIQUE GLASS DRESSING TABLE POT,8,2011-11-29 16:32:00,2.95,15297.0,United Kingdom
579507,23282,FOLDING BUTTERFLY MIRROR IVORY ,12,2011-11-29 16:32:00,0.83,15297.0,United Kingdom
579507,21481,FAWN BLUE HOT WATER BOTTLE,4,2011-11-29 16:32:00,3.75,15297.0,United Kingdom
579507,22361,GLASS JAR DAISY FRESH COTTON WOOL,6,2011-11-29 16:32:00,2.95,15297.0,United Kingdom
579507,22362,GLASS JAR PEACOCK BATH SALTS,6,2011-11-29 16:32:00,2.95,15297.0,United Kingdom
579507,85053,FRENCH ENAMEL CANDLEHOLDER,6,2011-11-29 16:32:00,2.1,15297.0,United Kingdom
579507,22941,CHRISTMAS LIGHTS 10 REINDEER,2,2011-11-29 16:32:00,8.5,15297.0,United Kingdom
579507,23513,EMBROIDERED RIBBON REEL SUSIE ,6,2011-11-29 16:32:00,2.08,15297.0,United Kingdom
579507,23514,EMBROIDERED RIBBON REEL SALLY ,6,2011-11-29 16:32:00,2.08,15297.0,United Kingdom
579507,23013,GLASS APOTHECARY BOTTLE TONIC,4,2011-11-29 16:32:00,3.95,15297.0,United Kingdom
579507,23012,GLASS APOTHECARY BOTTLE PERFUME,4,2011-11-29 16:32:00,3.95,15297.0,United Kingdom
579507,22055,MINI CAKE STAND  HANGING STRAWBERY,8,2011-11-29 16:32:00,1.65,15297.0,United Kingdom
579507,22557,PLASTERS IN TIN VINTAGE PAISLEY ,12,2011-11-29 16:32:00,1.65,15297.0,United Kingdom
579507,23154,SET OF 4 JAM JAR MAGNETS,12,2011-11-29 16:32:00,2.08,15297.0,United Kingdom
579507,21790,VINTAGE SNAP CARDS,12,2011-11-29 16:32:00,0.85,15297.0,United Kingdom
579508,22135,MINI LADLE LOVE HEART PINK,2,2011-11-29 16:33:00,0.83,,United Kingdom
579508,22138,BAKING SET 9 PIECE RETROSPOT ,2,2011-11-29 16:33:00,10.79,,United Kingdom
579508,22139,RETROSPOT TEA SET CERAMIC 11 PC ,1,2011-11-29 16:33:00,10.79,,United Kingdom
579508,22141,CHRISTMAS CRAFT TREE TOP ANGEL,2,2011-11-29 16:33:00,4.13,,United Kingdom
579508,22142,CHRISTMAS CRAFT WHITE FAIRY ,1,2011-11-29 16:33:00,3.29,,United Kingdom
579508,22144,CHRISTMAS CRAFT LITTLE FRIENDS,2,2011-11-29 16:33:00,4.13,,United Kingdom
579508,22150,3 STRIPEY MICE FELTCRAFT,1,2011-11-29 16:33:00,4.13,,United Kingdom
579508,22153,ANGEL DECORATION STARS ON DRESS,7,2011-11-29 16:33:00,0.83,,United Kingdom
579508,22154,ANGEL DECORATION 3 BUTTONS ,1,2011-11-29 16:33:00,0.83,,United Kingdom
579508,22155,STAR DECORATION RUSTIC,2,2011-11-29 16:33:00,0.83,,United Kingdom
579508,22169,FAMILY ALBUM WHITE PICTURE FRAME,1,2011-11-29 16:33:00,16.63,,United Kingdom
579508,22174,PHOTO CUBE,1,2011-11-29 16:33:00,3.29,,United Kingdom
579508,22178,VICTORIAN GLASS HANGING T-LIGHT,7,2011-11-29 16:33:00,2.46,,United Kingdom
579508,22187,GREEN CHRISTMAS TREE CARD HOLDER,1,2011-11-29 16:33:00,8.29,,United Kingdom
579508,22193,RED DINER WALL CLOCK,1,2011-11-29 16:33:00,16.63,,United Kingdom
579508,22195,LARGE HEART MEASURING SPOONS,1,2011-11-29 16:33:00,3.29,,United Kingdom
579508,22196,SMALL HEART MEASURING SPOONS,4,2011-11-29 16:33:00,1.63,,United Kingdom
579508,22197,POPCORN HOLDER,32,2011-11-29 16:33:00,0.85,,United Kingdom
579508,22211,WOOD STAMP SET FLOWERS,1,2011-11-29 16:33:00,3.29,,United Kingdom
579508,22212,FOUR HOOK  WHITE LOVEBIRDS,1,2011-11-29 16:33:00,4.13,,United Kingdom
579508,22219,LOVEBIRD HANGING DECORATION WHITE ,2,2011-11-29 16:33:00,1.63,,United Kingdom
579508,22227,HANGING HEART MIRROR DECORATION ,1,2011-11-29 16:33:00,1.25,,United Kingdom
579508,22261,FELT EGG COSY WHITE RABBIT ,1,2011-11-29 16:33:00,1.63,,United Kingdom
579508,22262,FELT EGG COSY CHICKEN,1,2011-11-29 16:33:00,1.63,,United Kingdom
579508,22273,FELTCRAFT DOLL MOLLY,1,2011-11-29 16:33:00,5.79,,United Kingdom
579508,22274,FELTCRAFT DOLL EMILY,1,2011-11-29 16:33:00,5.79,,United Kingdom
579508,22277,COSMETIC BAG VINTAGE ROSE PAISLEY,1,2011-11-29 16:33:00,4.13,,United Kingdom
579508,22279,POCKET BAG BLUE PAISLEY RED SPOT,2,2011-11-29 16:33:00,2.46,,United Kingdom
579508,22310,IVORY KNITTED MUG COSY ,2,2011-11-29 16:33:00,3.29,,United Kingdom
579508,22311,OFFICE MUG WARMER BLACK+SILVER ,1,2011-11-29 16:33:00,5.79,,United Kingdom
579508,22324,BLUE POLKADOT KIDS BAG,1,2011-11-29 16:33:00,4.13,,United Kingdom
579508,22326,ROUND SNACK BOXES SET OF4 WOODLAND ,1,2011-11-29 16:33:00,5.79,,United Kingdom
579508,22334,DINOSAUR PARTY BAG + STICKER SET,1,2011-11-29 16:33:00,3.29,,United Kingdom
579508,22335,HEART DECORATION PAINTED ZINC ,1,2011-11-29 16:33:00,1.25,,United Kingdom
579508,22338,STAR DECORATION PAINTED ZINC ,4,2011-11-29 16:33:00,0.63,,United Kingdom
579508,22340,NOEL GARLAND PAINTED ZINC ,13,2011-11-29 16:33:00,0.83,,United Kingdom
579508,22355,CHARLOTTE BAG SUKI DESIGN,5,2011-11-29 16:33:00,1.63,,United Kingdom
579508,22356,CHARLOTTE BAG PINK POLKADOT,3,2011-11-29 16:33:00,1.63,,United Kingdom
579508,22357,KINGS CHOICE BISCUIT TIN,1,2011-11-29 16:33:00,4.13,,United Kingdom
579508,22364,GLASS JAR DIGESTIVE BISCUITS,1,2011-11-29 16:33:00,5.79,,United Kingdom
579508,22365,DOORMAT RESPECTABLE HOUSE,1,2011-11-29 16:33:00,15.79,,United Kingdom
579508,22367,CHILDRENS APRON SPACEBOY DESIGN,2,2011-11-29 16:33:00,4.13,,United Kingdom
579508,22371,AIRLINE BAG VINTAGE TOKYO 78,2,2011-11-29 16:33:00,8.29,,United Kingdom
579508,22378,WALL TIDY RETROSPOT ,2,2011-11-29 16:33:00,4.13,,United Kingdom
579508,22382,LUNCH BAG SPACEBOY DESIGN ,1,2011-11-29 16:33:00,4.13,,United Kingdom
579508,22385,JUMBO BAG SPACEBOY DESIGN,1,2011-11-29 16:33:00,4.13,,United Kingdom
579508,22386,JUMBO BAG PINK POLKADOT,1,2011-11-29 16:33:00,4.13,,United Kingdom
579508,22393,PAPERWEIGHT VINTAGE COLLAGE,3,2011-11-29 16:33:00,4.96,,United Kingdom
579508,22417,PACK OF 60 SPACEBOY CAKE CASES,1,2011-11-29 16:33:00,1.25,,United Kingdom
579508,22418,10 COLOUR SPACEBOY PEN,1,2011-11-29 16:33:00,1.63,,United Kingdom
579508,22419,LIPSTICK PEN RED,5,2011-11-29 16:33:00,0.83,,United Kingdom
579508,22421,LIPSTICK PEN FUSCHIA,1,2011-11-29 16:33:00,0.83,,United Kingdom
579508,22422,TOOTHPASTE TUBE PEN,8,2011-11-29 16:33:00,1.25,,United Kingdom
579508,22423,REGENCY CAKESTAND 3 TIER,5,2011-11-29 16:33:00,24.96,,United Kingdom
579508,22429,ENAMEL MEASURING JUG CREAM,1,2011-11-29 16:33:00,8.29,,United Kingdom
579508,22433,WATERING CAN GREEN DINOSAUR,1,2011-11-29 16:33:00,4.13,,United Kingdom
579508,22446,PIN CUSHION BABUSHKA PINK,3,2011-11-29 16:33:00,2.46,,United Kingdom
579508,22465,HANGING METAL STAR LANTERN,3,2011-11-29 16:33:00,3.29,,United Kingdom
579508,22467,GUMBALL COAT RACK,2,2011-11-29 16:33:00,4.96,,United Kingdom
579508,22471,TV DINNER TRAY AIR HOSTESS ,1,2011-11-29 16:33:00,10.79,,United Kingdom
579508,22474,SPACEBOY TV DINNER TRAY,1,2011-11-29 16:33:00,10.79,,United Kingdom
579508,22476,EMPIRE UNION JACK TV DINNER TRAY,1,2011-11-29 16:33:00,10.79,,United Kingdom
579508,22477,WATERING CAN GARDEN MARKER,1,2011-11-29 16:33:00,2.46,,United Kingdom
579508,22483,RED GINGHAM TEDDY BEAR ,1,2011-11-29 16:33:00,5.79,,United Kingdom
579508,22487,WHITE WOOD GARDEN PLANT LADDER,1,2011-11-29 16:33:00,19.96,,United Kingdom
579508,22489,PACK OF 12 TRADITIONAL CRAYONS,2,2011-11-29 16:33:00,0.83,,United Kingdom
579508,22492,MINI PAINT SET VINTAGE ,2,2011-11-29 16:33:00,1.63,,United Kingdom
579508,22494,EMERGENCY FIRST AID TIN ,1,2011-11-29 16:33:00,2.46,,United Kingdom
579508,22508,DOORSTOP RETROSPOT HEART,2,2011-11-29 16:33:00,7.46,,United Kingdom
579508,22514,CHILDS GARDEN SPADE BLUE,2,2011-11-29 16:33:00,4.13,,United Kingdom
579508,22515,CHILDS GARDEN SPADE PINK,4,2011-11-29 16:33:00,4.13,,United Kingdom
579508,22516,CHILDS GARDEN RAKE BLUE,2,2011-11-29 16:33:00,4.13,,United Kingdom
579508,22517,CHILDS GARDEN RAKE PINK,3,2011-11-29 16:33:00,4.13,,United Kingdom
579508,22523,CHILDS GARDEN FORK PINK,3,2011-11-29 16:33:00,1.63,,United Kingdom
579508,15034,PAPER POCKET TRAVELING FAN ,1,2011-11-29 16:33:00,0.83,,United Kingdom
579508,16235,RECYCLED PENCIL WITH RABBIT ERASER,3,2011-11-29 16:33:00,0.42,,United Kingdom
579508,16236,KITTY PENCIL ERASERS,1,2011-11-29 16:33:00,0.42,,United Kingdom
579508,16237,SLEEPING CAT ERASERS,1,2011-11-29 16:33:00,0.42,,United Kingdom
579508,16238,PARTY TIME PENCIL ERASERS,1,2011-11-29 16:33:00,0.42,,United Kingdom
579508,16258A,SWIRLY CIRCULAR RUBBERS IN BAG,1,2011-11-29 16:33:00,0.83,,United Kingdom
579508,20655,QUEEN OF SKIES LUGGAGE TAG,2,2011-11-29 16:33:00,2.46,,United Kingdom
579508,20669,RED HEART LUGGAGE TAG,2,2011-11-29 16:33:00,2.46,,United Kingdom
579508,20679,EDWARDIAN PARASOL RED,1,2011-11-29 16:33:00,12.46,,United Kingdom
579508,20718,RED RETROSPOT SHOPPER BAG,3,2011-11-29 16:33:00,2.46,,United Kingdom
579508,20719,WOODLAND CHARLOTTE BAG,6,2011-11-29 16:33:00,1.63,,United Kingdom
579508,20724,RED RETROSPOT CHARLOTTE BAG,3,2011-11-29 16:33:00,1.63,,United Kingdom
579508,20725,LUNCH BAG RED RETROSPOT,3,2011-11-29 16:33:00,4.13,,United Kingdom
579508,20726,LUNCH BAG WOODLAND,1,2011-11-29 16:33:00,4.13,,United Kingdom
579508,20727,LUNCH BAG  BLACK SKULL.,1,2011-11-29 16:33:00,4.13,,United Kingdom
579508,20728,LUNCH BAG CARS BLUE,5,2011-11-29 16:33:00,4.13,,United Kingdom
579508,20761,BLUE PAISLEY SKETCHBOOK,2,2011-11-29 16:33:00,7.46,,United Kingdom
579508,20775,DAISY NOTEBOOK ,2,2011-11-29 16:33:00,1.63,,United Kingdom
579508,20839,FRENCH PAISLEY CUSHION COVER ,2,2011-11-29 16:33:00,3.29,,United Kingdom
579508,20972,PINK CREAM FELT CRAFT TRINKET BOX ,1,2011-11-29 16:33:00,2.46,,United Kingdom
579508,20973,12 PENCIL SMALL TUBE WOODLAND,6,2011-11-29 16:33:00,1.25,,United Kingdom
579508,20978,36 PENCILS TUBE SKULLS,2,2011-11-29 16:33:00,2.46,,United Kingdom
579508,22544,MINI JIGSAW SPACEBOY,1,2011-11-29 16:33:00,0.83,,United Kingdom
579508,22547,MINI JIGSAW DINOSAUR ,2,2011-11-29 16:33:00,0.83,,United Kingdom
579508,22549,PICTURE DOMINOES,1,2011-11-29 16:33:00,3.29,,United Kingdom
579508,22551,PLASTERS IN TIN SPACEBOY,1,2011-11-29 16:33:00,3.29,,United Kingdom
579508,22553,PLASTERS IN TIN SKULLS,3,2011-11-29 16:33:00,3.29,,United Kingdom
579508,22554,PLASTERS IN TIN WOODLAND ANIMALS,4,2011-11-29 16:33:00,3.29,,United Kingdom
579508,22555,PLASTERS IN TIN STRONGMAN,3,2011-11-29 16:33:00,3.29,,United Kingdom
579508,22556,PLASTERS IN TIN CIRCUS PARADE ,3,2011-11-29 16:33:00,3.29,,United Kingdom
579508,22560,TRADITIONAL MODELLING CLAY,1,2011-11-29 16:33:00,2.46,,United Kingdom
579508,22564,ALPHABET STENCIL CRAFT,1,2011-11-29 16:33:00,2.46,,United Kingdom
579508,22577,WOODEN HEART CHRISTMAS SCANDINAVIAN,9,2011-11-29 16:33:00,0.83,,United Kingdom
579508,22578,WOODEN STAR CHRISTMAS SCANDINAVIAN,12,2011-11-29 16:33:00,0.83,,United Kingdom
579508,22580,ADVENT CALENDAR GINGHAM SACK,10,2011-11-29 16:33:00,4.13,,United Kingdom
579508,22581,WOOD STOCKING CHRISTMAS SCANDISPOT,6,2011-11-29 16:33:00,0.83,,United Kingdom
579508,22583,PACK OF 6 HANDBAG GIFT BOXES,2,2011-11-29 16:33:00,4.96,,United Kingdom
579508,22585,PACK OF 6 BIRDY GIFT TAGS,19,2011-11-29 16:33:00,2.46,,United Kingdom
579508,22592,CARDHOLDER HOLLY WREATH METAL,4,2011-11-29 16:33:00,7.46,,United Kingdom
579508,22593,CHRISTMAS GINGHAM STAR,2,2011-11-29 16:33:00,1.63,,United Kingdom
579508,22594,CHRISTMAS GINGHAM TREE,2,2011-11-29 16:33:00,1.63,,United Kingdom
579508,22596,CHRISTMAS STAR WISH LIST CHALKBOARD,1,2011-11-29 16:33:00,2.46,,United Kingdom
579508,22597,MUSICAL ZINC HEART DECORATION ,6,2011-11-29 16:33:00,0.83,,United Kingdom
579508,22598,CHRISTMAS MUSICAL ZINC TREE,3,2011-11-29 16:33:00,0.83,,United Kingdom
579508,22599,CHRISTMAS MUSICAL ZINC STAR,1,2011-11-29 16:33:00,0.83,,United Kingdom
579508,22605,WOODEN CROQUET GARDEN SET,1,2011-11-29 16:33:00,24.96,,United Kingdom
579508,22607,WOODEN ROUNDERS GARDEN SET ,1,2011-11-29 16:33:00,16.63,,United Kingdom
579508,22608,PENS ASSORTED FUNKY JEWELED ,2,2011-11-29 16:33:00,0.42,,United Kingdom
579508,22613,PACK OF 20 SPACEBOY NAPKINS,2,2011-11-29 16:33:00,1.63,,United Kingdom
579508,22615,PACK OF 12 CIRCUS PARADE TISSUES ,2,2011-11-29 16:33:00,0.83,,United Kingdom
579508,22616,PACK OF 12 LONDON TISSUES ,1,2011-11-29 16:33:00,0.83,,United Kingdom
579508,22617,BAKING SET SPACEBOY DESIGN,2,2011-11-29 16:33:00,10.79,,United Kingdom
579508,22619,SET OF 6 SOLDIER SKITTLES,4,2011-11-29 16:33:00,7.46,,United Kingdom
579508,22620,4 TRADITIONAL SPINNING TOPS,11,2011-11-29 16:33:00,2.46,,United Kingdom
579508,22621,TRADITIONAL KNITTING NANCY,2,2011-11-29 16:33:00,3.29,,United Kingdom
579508,22625,RED KITCHEN SCALES,1,2011-11-29 16:33:00,16.63,,United Kingdom
579508,22628,PICNIC BOXES SET OF 3 RETROSPOT ,1,2011-11-29 16:33:00,9.96,,United Kingdom
579508,22629,SPACEBOY LUNCH BOX ,1,2011-11-29 16:33:00,4.13,,United Kingdom
579508,22630,DOLLY GIRL LUNCH BOX,1,2011-11-29 16:33:00,4.13,,United Kingdom
579508,22631,CIRCUS PARADE LUNCH BOX ,1,2011-11-29 16:33:00,4.13,,United Kingdom
579508,22633,HAND WARMER UNION JACK,1,2011-11-29 16:33:00,4.13,,United Kingdom
579508,22644,CERAMIC CHERRY CAKE MONEY BANK,1,2011-11-29 16:33:00,3.29,,United Kingdom
579508,22645,CERAMIC HEART FAIRY CAKE MONEY BANK,1,2011-11-29 16:33:00,3.29,,United Kingdom
579508,22650,CERAMIC PIRATE CHEST MONEY BANK,2,2011-11-29 16:33:00,3.29,,United Kingdom
579508,22653,BUTTON BOX ,18,2011-11-29 16:33:00,1.63,,United Kingdom
579508,22659,LUNCH BOX I LOVE LONDON,3,2011-11-29 16:33:00,4.13,,United Kingdom
579508,22661,CHARLOTTE BAG DOLLY GIRL DESIGN,1,2011-11-29 16:33:00,1.63,,United Kingdom
579508,22662,LUNCH BAG DOLLY GIRL DESIGN,1,2011-11-29 16:33:00,4.13,,United Kingdom
579508,22663,JUMBO BAG DOLLY GIRL DESIGN,1,2011-11-29 16:33:00,4.13,,United Kingdom
579508,22666,RECIPE BOX PANTRY YELLOW DESIGN,1,2011-11-29 16:33:00,5.79,,United Kingdom
579508,22671,FRENCH LAUNDRY SIGN BLUE METAL,1,2011-11-29 16:33:00,3.29,,United Kingdom
579508,22675,FRENCH KITCHEN SIGN BLUE METAL,1,2011-11-29 16:33:00,2.46,,United Kingdom
579508,22687,DOORMAT CHRISTMAS VILLAGE,1,2011-11-29 16:33:00,16.63,,United Kingdom
579508,22693,GROW A FLYTRAP OR SUNFLOWER IN TIN,1,2011-11-29 16:33:00,2.5,,United Kingdom
579508,22697,GREEN REGENCY TEACUP AND SAUCER,5,2011-11-29 16:33:00,5.79,,United Kingdom
579508,22698,PINK REGENCY TEACUP AND SAUCER,6,2011-11-29 16:33:00,5.79,,United Kingdom
579508,22699,ROSES REGENCY TEACUP AND SAUCER ,3,2011-11-29 16:33:00,5.79,,United Kingdom
579508,22701,PINK DOG BOWL,1,2011-11-29 16:33:00,2.46,,United Kingdom
579508,22703,PINK CAT BOWL,4,2011-11-29 16:33:00,1.63,,United Kingdom
579508,22712,CARD DOLLY GIRL ,2,2011-11-29 16:33:00,0.83,,United Kingdom
579508,22716,CARD CIRCUS PARADE,2,2011-11-29 16:33:00,0.83,,United Kingdom
579508,22720,SET OF 3 CAKE TINS PANTRY DESIGN ,3,2011-11-29 16:33:00,10.79,,United Kingdom
579508,22722,SET OF 6 SPICE TINS PANTRY DESIGN,2,2011-11-29 16:33:00,8.29,,United Kingdom
579508,22723,SET OF 6 HERB TINS SKETCHBOOK,1,2011-11-29 16:33:00,8.29,,United Kingdom
579508,22726,ALARM CLOCK BAKELIKE GREEN,4,2011-11-29 16:33:00,7.46,,United Kingdom
579508,22734,SET OF 6 RIBBONS VINTAGE CHRISTMAS,4,2011-11-29 16:33:00,5.79,,United Kingdom
579508,22736,RIBBON REEL MAKING SNOWMEN ,3,2011-11-29 16:33:00,3.29,,United Kingdom
579508,22738,RIBBON REEL SNOWY VILLAGE,1,2011-11-29 16:33:00,3.29,,United Kingdom
579508,22739,RIBBON REEL CHRISTMAS SOCK BAUBLE,5,2011-11-29 16:33:00,3.29,,United Kingdom
579508,22741,FUNKY DIVA PEN,6,2011-11-29 16:33:00,1.63,,United Kingdom
579508,22754,SMALL RED BABUSHKA NOTEBOOK ,1,2011-11-29 16:33:00,1.63,,United Kingdom
579508,22755,SMALL PURPLE BABUSHKA NOTEBOOK ,1,2011-11-29 16:33:00,1.63,,United Kingdom
579508,22766,PHOTO FRAME CORNICE,1,2011-11-29 16:33:00,5.79,,United Kingdom
579508,22781,GUMBALL MAGAZINE RACK,2,2011-11-29 16:33:00,14.96,,United Kingdom
579508,22784,LANTERN CREAM GAZEBO ,2,2011-11-29 16:33:00,10.79,,United Kingdom
579508,22792,FLUTED ANTIQUE CANDLE HOLDER,3,2011-11-29 16:33:00,1.63,,United Kingdom
579508,22805,BLUE DRAWER KNOB ACRYLIC EDWARDIAN,3,2011-11-29 16:33:00,2.46,,United Kingdom
579508,22809,SET OF 6 T-LIGHTS SANTA,1,2011-11-29 16:33:00,5.79,,United Kingdom
579508,22814,CARD PARTY GAMES ,1,2011-11-29 16:33:00,0.42,,United Kingdom
579508,22815,CARD PSYCHEDELIC APPLES,2,2011-11-29 16:33:00,0.42,,United Kingdom
579508,22816,CARD MOTORBIKE SANTA,5,2011-11-29 16:33:00,0.42,,United Kingdom
579508,22818,CARD CHRISTMAS VILLAGE,1,2011-11-29 16:33:00,0.42,,United Kingdom
579508,22820,GIFT BAG BIRTHDAY,1,2011-11-29 16:33:00,0.83,,United Kingdom
579508,22821,GIFT BAG PSYCHEDELIC APPLES,5,2011-11-29 16:33:00,0.83,,United Kingdom
579508,22822,CREAM WALL PLANTER HEART SHAPED,1,2011-11-29 16:33:00,12.46,,United Kingdom
579508,22831,WHITE BROCANTE SOAP DISH,1,2011-11-29 16:33:00,5.79,,United Kingdom
579508,22846,BREAD BIN DINER STYLE RED ,1,2011-11-29 16:33:00,33.29,,United Kingdom
579508,22851,SET 20 NAPKINS FAIRY CAKES DESIGN ,1,2011-11-29 16:33:00,1.63,,United Kingdom
579508,22865,HAND WARMER OWL DESIGN,2,2011-11-29 16:33:00,4.13,,United Kingdom
579508,22866,HAND WARMER SCOTTY DOG DESIGN,1,2011-11-29 16:33:00,4.13,,United Kingdom
579508,22895,SET OF 2 TEA TOWELS APPLE AND PEARS,2,2011-11-29 16:33:00,6.63,,United Kingdom
579508,22898,CHILDRENS APRON APPLES DESIGN,1,2011-11-29 16:33:00,4.13,,United Kingdom
579508,22899,CHILDREN'S APRON DOLLY GIRL ,1,2011-11-29 16:33:00,4.13,,United Kingdom
579508,22907,PACK OF 20 NAPKINS PANTRY DESIGN,4,2011-11-29 16:33:00,1.63,,United Kingdom
579508,22908,PACK OF 20 NAPKINS RED APPLES,1,2011-11-29 16:33:00,1.63,,United Kingdom
579508,22909,SET OF 20 VINTAGE CHRISTMAS NAPKINS,5,2011-11-29 16:33:00,1.63,,United Kingdom
579508,22910,PAPER CHAIN KIT VINTAGE CHRISTMAS,3,2011-11-29 16:33:00,5.79,,United Kingdom
579508,22928,YELLOW GIANT GARDEN THERMOMETER,1,2011-11-29 16:33:00,12.46,,United Kingdom
579508,22930,BAKING MOULD HEART MILK CHOCOLATE,1,2011-11-29 16:33:00,4.96,,United Kingdom
579508,22935,BAKING MOULD ROSE MILK CHOCOLATE,1,2011-11-29 16:33:00,6.63,,United Kingdom
579508,22936,BAKING MOULD ROSE WHITE CHOCOLATE,1,2011-11-29 16:33:00,6.63,,United Kingdom
579508,22942,CHRISTMAS LIGHTS 10 SANTAS ,1,2011-11-29 16:33:00,16.63,,United Kingdom
579508,22948,METAL DECORATION NAUGHTY CHILDREN ,8,2011-11-29 16:33:00,1.66,,United Kingdom
579508,22951,60 CAKE CASES DOLLY GIRL DESIGN,3,2011-11-29 16:33:00,1.25,,United Kingdom
579508,22952,60 CAKE CASES VINTAGE CHRISTMAS,4,2011-11-29 16:33:00,1.25,,United Kingdom
579508,22956,36 FOIL HEART CAKE CASES,1,2011-11-29 16:33:00,4.13,,United Kingdom
579508,22961,JAM MAKING SET PRINTED,9,2011-11-29 16:33:00,3.29,,United Kingdom
579508,22964,3 PIECE SPACEBOY COOKIE CUTTER SET,2,2011-11-29 16:33:00,4.13,,United Kingdom
579508,22965,3 TRADITIONAl BISCUIT CUTTERS  SET,1,2011-11-29 16:33:00,4.13,,United Kingdom
579508,22969,HOMEMADE JAM SCENTED CANDLES,7,2011-11-29 16:33:00,3.29,,United Kingdom
579508,22970,LONDON BUS COFFEE MUG,1,2011-11-29 16:33:00,4.96,,United Kingdom
579508,22971,QUEENS GUARD COFFEE MUG,1,2011-11-29 16:33:00,4.96,,United Kingdom
579508,22973,CHILDREN'S CIRCUS PARADE MUG,2,2011-11-29 16:33:00,3.29,,United Kingdom
579508,22981,PANTRY APPLE CORER,1,2011-11-29 16:33:00,2.92,,United Kingdom
579508,22983,CARD BILLBOARD FONT,1,2011-11-29 16:33:00,0.83,,United Kingdom
579508,22988,SOLDIERS EGG CUP ,2,2011-11-29 16:33:00,2.46,,United Kingdom
579508,22991,GIRAFFE WOODEN RULER,1,2011-11-29 16:33:00,4.13,,United Kingdom
579508,22993,SET OF 4 PANTRY JELLY MOULDS,1,2011-11-29 16:33:00,2.46,,United Kingdom
579508,22994,TRAVEL CARD WALLET RETROSPOT,1,2011-11-29 16:33:00,0.83,,United Kingdom
579508,22995,TRAVEL CARD WALLET SUKI,4,2011-11-29 16:33:00,0.83,,United Kingdom
579508,22996,TRAVEL CARD WALLET VINTAGE TICKET,3,2011-11-29 16:33:00,0.83,,United Kingdom
579508,22997,TRAVEL CARD WALLET UNION JACK,1,2011-11-29 16:33:00,0.83,,United Kingdom
579508,22998,TRAVEL CARD WALLET KEEP CALM,2,2011-11-29 16:33:00,0.83,,United Kingdom
579508,23004,TRAVEL CARD WALLET PANTRY,4,2011-11-29 16:33:00,0.83,,United Kingdom
579508,23005,TRAVEL CARD WALLET I LOVE LONDON,2,2011-11-29 16:33:00,0.83,,United Kingdom
579508,23009,I LOVE LONDON BABY GIFT SET,2,2011-11-29 16:33:00,10.79,,United Kingdom
579508,23010,CIRCUS PARADE BABY GIFT SET,1,2011-11-29 16:33:00,10.79,,United Kingdom
579508,23035,DRAWER KNOB CERAMIC IVORY,1,2011-11-29 16:33:00,3.29,,United Kingdom
579508,23039,T-LIGHT HOLDER SILVER HEART HANDLE,1,2011-11-29 16:33:00,4.13,,United Kingdom
579508,23054,RECYCLED ACAPULCO MAT LAVENDER,1,2011-11-29 16:33:00,16.63,,United Kingdom
579508,23081,GREEN METAL BOX ARMY SUPPLIES,1,2011-11-29 16:33:00,16.63,,United Kingdom
579508,23084,RABBIT NIGHT LIGHT,53,2011-11-29 16:33:00,4.13,,United Kingdom
579508,23089,GLASS BON BON JAR,1,2011-11-29 16:33:00,3.29,,United Kingdom
579508,23100,SILVER BELLS TABLE DECORATION,1,2011-11-29 16:33:00,2.46,,United Kingdom
579508,23103,JINGLE BELL HEART DECORATION,6,2011-11-29 16:33:00,3.29,,United Kingdom
579508,23109,PACK OF SIX LED TEA LIGHTS,2,2011-11-29 16:33:00,5.79,,United Kingdom
579508,23114,VINTAGE LEAF CHOPPING BOARD  ,2,2011-11-29 16:33:00,10.79,,United Kingdom
579508,23118,PARISIENNE JEWELLERY DRAWER ,1,2011-11-29 16:33:00,14.96,,United Kingdom
579508,23122,PARTY CHARMS 50 PIECES,1,2011-11-29 16:33:00,1.63,,United Kingdom
579508,23126,FELTCRAFT GIRL AMELIE KIT,3,2011-11-29 16:33:00,10.79,,United Kingdom
579508,23158,SET OF 5 LUCKY CAT MAGNETS ,2,2011-11-29 16:33:00,4.13,,United Kingdom
579508,23162,REGENCY TEA STRAINER,1,2011-11-29 16:33:00,7.46,,United Kingdom
579508,23165,LARGE CERAMIC TOP STORAGE JAR,4,2011-11-29 16:33:00,3.29,,United Kingdom
579508,23166,MEDIUM CERAMIC TOP STORAGE JAR,1,2011-11-29 16:33:00,2.46,,United Kingdom
579508,23167,SMALL CERAMIC TOP STORAGE JAR ,1,2011-11-29 16:33:00,1.63,,United Kingdom
579508,23168,CLASSIC CAFE SUGAR DISPENSER,2,2011-11-29 16:33:00,2.46,,United Kingdom
579508,23169,CLASSIC GLASS COOKIE JAR,1,2011-11-29 16:33:00,8.29,,United Kingdom
579508,23173,REGENCY TEAPOT ROSES ,1,2011-11-29 16:33:00,19.96,,United Kingdom
579508,23174,REGENCY SUGAR BOWL GREEN,1,2011-11-29 16:33:00,8.29,,United Kingdom
579508,23176,ABC TREASURE BOOK BOX ,1,2011-11-29 16:33:00,4.58,,United Kingdom
579508,23177,TREASURE ISLAND BOOK BOX,1,2011-11-29 16:33:00,4.58,,United Kingdom
579508,23182,TOILET SIGN OCCUPIED OR VACANT,2,2011-11-29 16:33:00,2.46,,United Kingdom
579508,23184,BULL DOG BOTTLE OPENER,2,2011-11-29 16:33:00,10.79,,United Kingdom
579508,23188,VINTAGE  2 METRE FOLDING RULER,2,2011-11-29 16:33:00,3.29,,United Kingdom
579508,23193,BUFFALO BILL TREASURE BOOK BOX,1,2011-11-29 16:33:00,4.58,,United Kingdom
579508,23194,GYMKHANA TREASURE BOOK BOX,2,2011-11-29 16:33:00,4.58,,United Kingdom
579508,23198,PANTRY MAGNETIC  SHOPPING LIST,4,2011-11-29 16:33:00,3.29,,United Kingdom
579508,23201,JUMBO BAG ALPHABET,2,2011-11-29 16:33:00,4.13,,United Kingdom
579508,23202,JUMBO BAG VINTAGE LEAF,1,2011-11-29 16:33:00,4.13,,United Kingdom
579508,23203,JUMBO BAG VINTAGE DOILY ,3,2011-11-29 16:33:00,4.13,,United Kingdom
579508,23204,CHARLOTTE BAG APPLES DESIGN,1,2011-11-29 16:33:00,1.63,,United Kingdom
579508,23205,CHARLOTTE BAG VINTAGE ALPHABET ,1,2011-11-29 16:33:00,1.63,,United Kingdom
579508,23206,LUNCH BAG APPLE DESIGN,2,2011-11-29 16:33:00,4.13,,United Kingdom
579508,23209,LUNCH BAG VINTAGE DOILY ,2,2011-11-29 16:33:00,4.13,,United Kingdom
579508,23210,WHITE ROCKING HORSE HAND PAINTED,2,2011-11-29 16:33:00,2.46,,United Kingdom
