InvoiceNo,StockCode,Description,Quantity,InvoiceDate,UnitPrice,CustomerID,Country
558759,20971,PINK BLUE FELT CRAFT TRINKET BOX,3,2011-07-03 12:36:00,1.25,13148.0,United Kingdom
558759,20972,PINK CREAM FELT CRAFT TRINKET BOX ,3,2011-07-03 12:36:00,1.25,13148.0,United Kingdom
558759,84212,"ASSORTED FLOWER COLOUR ""LEIS""",1,2011-07-03 12:36:00,0.65,13148.0,United Kingdom
558759,23207,LUNCH BAG ALPHABET DESIGN,10,2011-07-03 12:36:00,1.65,13148.0,United Kingdom
558759,22384,LUNCH BAG PINK POLKADOT,10,2011-07-03 12:36:00,1.65,13148.0,United Kingdom
558759,20725,LUNCH BAG RED RETROSPOT,10,2011-07-03 12:36:00,1.65,13148.0,United Kingdom
558759,22693,GROW A FLYTRAP OR SUNFLOWER IN TIN,24,2011-07-03 12:36:00,1.25,13148.0,United Kingdom
558760,22297,HEART IVORY TRELLIS SMALL,8,2011-07-03 12:38:00,1.25,16918.0,United Kingdom
558760,22296,HEART IVORY TRELLIS LARGE,8,2011-07-03 12:38:00,1.65,16918.0,United Kingdom
558760,85123A,WHITE HANGING HEART T-LIGHT HOLDER,6,2011-07-03 12:38:00,2.95,16918.0,United Kingdom
558760,22938,CUPCAKE LACE PAPER SET 6,12,2011-07-03 12:38:00,1.95,16918.0,United Kingdom
558760,22938,CUPCAKE LACE PAPER SET 6,6,2011-07-03 12:38:00,1.95,16918.0,United Kingdom
558760,72351B,SET/6 PINK  BUTTERFLY T-LIGHTS,6,2011-07-03 12:38:00,2.1,16918.0,United Kingdom
558760,72351A,SET/6 TURQUOISE BUTTERFLY T-LIGHTS,6,2011-07-03 12:38:00,2.1,16918.0,United Kingdom
558760,20719,WOODLAND CHARLOTTE BAG,5,2011-07-03 12:38:00,0.85,16918.0,United Kingdom
558760,20723,STRAWBERRY CHARLOTTE BAG,10,2011-07-03 12:38:00,0.85,16918.0,United Kingdom
558760,22384,LUNCH BAG PINK POLKADOT,6,2011-07-03 12:38:00,1.65,16918.0,United Kingdom
558760,20724,RED RETROSPOT CHARLOTTE BAG,10,2011-07-03 12:38:00,0.85,16918.0,United Kingdom
558760,23205,CHARLOTTE BAG VINTAGE ALPHABET ,11,2011-07-03 12:38:00,0.85,16918.0,United Kingdom
558760,20725,LUNCH BAG RED RETROSPOT,6,2011-07-03 12:38:00,1.65,16918.0,United Kingdom
558760,23207,LUNCH BAG ALPHABET DESIGN,6,2011-07-03 12:38:00,1.65,16918.0,United Kingdom
558760,23201,JUMBO BAG ALPHABET,4,2011-07-03 12:38:00,2.08,16918.0,United Kingdom
558760,85099B,JUMBO BAG RED RETROSPOT,4,2011-07-03 12:38:00,2.08,16918.0,United Kingdom
558760,85099F,JUMBO BAG STRAWBERRY,4,2011-07-03 12:38:00,2.08,16918.0,United Kingdom
558760,20712,JUMBO BAG WOODLAND ANIMALS,3,2011-07-03 12:38:00,2.08,16918.0,United Kingdom
558760,22386,JUMBO BAG PINK POLKADOT,4,2011-07-03 12:38:00,2.08,16918.0,United Kingdom
558760,21928,JUMBO BAG SCANDINAVIAN BLUE PAISLEY,3,2011-07-03 12:38:00,2.08,16918.0,United Kingdom
558760,21929,JUMBO BAG PINK VINTAGE PAISLEY,3,2011-07-03 12:38:00,2.08,16918.0,United Kingdom
558760,20717,STRAWBERRY SHOPPER BAG,7,2011-07-03 12:38:00,1.25,16918.0,United Kingdom
558760,20718,RED RETROSPOT SHOPPER BAG,10,2011-07-03 12:38:00,1.25,16918.0,United Kingdom
558760,20717,STRAWBERRY SHOPPER BAG,10,2011-07-03 12:38:00,1.25,16918.0,United Kingdom
558761,23284,DOORMAT KEEP CALM AND COME IN,1,2011-07-03 12:52:00,7.95,15033.0,United Kingdom
558761,22367,CHILDRENS APRON SPACEBOY DESIGN,1,2011-07-03 12:52:00,1.95,15033.0,United Kingdom
558761,21156,RETROSPOT CHILDRENS APRON,2,2011-07-03 12:52:00,1.95,15033.0,United Kingdom
558761,47591D,PINK FAIRY CAKE CHILDRENS APRON,2,2011-07-03 12:52:00,1.95,15033.0,United Kingdom
558761,22898,CHILDRENS APRON APPLES DESIGN,2,2011-07-03 12:52:00,1.95,15033.0,United Kingdom
558761,22899,CHILDREN'S APRON DOLLY GIRL ,1,2011-07-03 12:52:00,2.1,15033.0,United Kingdom
558761,23245,SET OF 3 REGENCY CAKE TINS,1,2011-07-03 12:52:00,4.95,15033.0,United Kingdom
558761,22383,LUNCH BAG SUKI DESIGN ,1,2011-07-03 12:52:00,1.65,15033.0,United Kingdom
558761,22662,LUNCH BAG DOLLY GIRL DESIGN,1,2011-07-03 12:52:00,1.65,15033.0,United Kingdom
558761,21790,VINTAGE SNAP CARDS,3,2011-07-03 12:52:00,0.85,15033.0,United Kingdom
558761,22906,12 MESSAGE CARDS WITH ENVELOPES,5,2011-07-03 12:52:00,1.65,15033.0,United Kingdom
558761,23206,LUNCH BAG APPLE DESIGN,1,2011-07-03 12:52:00,1.65,15033.0,United Kingdom
558761,20727,LUNCH BAG  BLACK SKULL.,2,2011-07-03 12:52:00,1.65,15033.0,United Kingdom
558761,20728,LUNCH BAG CARS BLUE,2,2011-07-03 12:52:00,1.65,15033.0,United Kingdom
558761,22630,DOLLY GIRL LUNCH BOX,1,2011-07-03 12:52:00,1.95,15033.0,United Kingdom
558761,22629,SPACEBOY LUNCH BOX ,1,2011-07-03 12:52:00,1.95,15033.0,United Kingdom
558761,22631,CIRCUS PARADE LUNCH BOX ,1,2011-07-03 12:52:00,1.95,15033.0,United Kingdom
558761,22630,DOLLY GIRL LUNCH BOX,1,2011-07-03 12:52:00,1.95,15033.0,United Kingdom
558761,22629,SPACEBOY LUNCH BOX ,1,2011-07-03 12:52:00,1.95,15033.0,United Kingdom
558761,22631,CIRCUS PARADE LUNCH BOX ,1,2011-07-03 12:52:00,1.95,15033.0,United Kingdom
558761,23207,LUNCH BAG ALPHABET DESIGN,1,2011-07-03 12:52:00,1.65,15033.0,United Kingdom
558761,22621,TRADITIONAL KNITTING NANCY,2,2011-07-03 12:52:00,1.65,15033.0,United Kingdom
558761,21892,TRADITIONAL WOODEN CATCH CUP GAME ,2,2011-07-03 12:52:00,1.25,15033.0,United Kingdom
558761,21891,TRADITIONAL WOODEN SKIPPING ROPE,3,2011-07-03 12:52:00,1.45,15033.0,United Kingdom
558761,22620,4 TRADITIONAL SPINNING TOPS,2,2011-07-03 12:52:00,1.45,15033.0,United Kingdom
558761,21448,12 DAISY PEGS IN WOOD BOX,3,2011-07-03 12:52:00,1.65,15033.0,United Kingdom
558761,22548,HEADS AND TAILS SPORTING FUN,2,2011-07-03 12:52:00,1.25,15033.0,United Kingdom
558761,21791,VINTAGE HEADS AND TAILS CARD GAME ,2,2011-07-03 12:52:00,1.25,15033.0,United Kingdom
558761,22293,HANGING CHICK GREEN DECORATION,2,2011-07-03 12:52:00,1.45,15033.0,United Kingdom
558761,21914,BLUE HARMONICA IN BOX ,3,2011-07-03 12:52:00,1.25,15033.0,United Kingdom
558761,21915,RED  HARMONICA IN BOX ,3,2011-07-03 12:52:00,1.25,15033.0,United Kingdom
558761,22219,LOVEBIRD HANGING DECORATION WHITE ,5,2011-07-03 12:52:00,0.85,15033.0,United Kingdom
558761,22405,MONEY BOX POCKET MONEY DESIGN,1,2011-07-03 12:52:00,1.25,15033.0,United Kingdom
558761,20914,SET/5 RED RETROSPOT LID GLASS BOWLS,2,2011-07-03 12:52:00,2.95,15033.0,United Kingdom
558761,21382,SET/4 SPRING FLOWER DECORATION,2,2011-07-03 12:52:00,0.75,15033.0,United Kingdom
558761,20983,12 PENCILS TALL TUBE RED RETROSPOT,2,2011-07-03 12:52:00,0.85,15033.0,United Kingdom
558761,20981,12 PENCILS TALL TUBE WOODLAND,2,2011-07-03 12:52:00,0.85,15033.0,United Kingdom
558761,20982,12 PENCILS TALL TUBE SKULLS,2,2011-07-03 12:52:00,0.85,15033.0,United Kingdom
558761,22315,200 RED + WHITE BENDY STRAWS,2,2011-07-03 12:52:00,1.25,15033.0,United Kingdom
558761,22292,HANGING CHICK  YELLOW DECORATION,4,2011-07-03 12:52:00,1.45,15033.0,United Kingdom
558761,21718,RED METAL BEACH SPADE ,2,2011-07-03 12:52:00,1.25,15033.0,United Kingdom
558761,85061W,WHITE JEWELLED HEART DECORATION,1,2011-07-03 12:52:00,0.85,15033.0,United Kingdom
558761,22155,STAR DECORATION RUSTIC,3,2011-07-03 12:52:00,0.42,15033.0,United Kingdom
558761,23302,KNEELING MAT HOUSEWORK  DESIGN,1,2011-07-03 12:52:00,1.65,15033.0,United Kingdom
558761,82483,WOOD 2 DRAWER CABINET WHITE FINISH,2,2011-07-03 12:52:00,6.95,15033.0,United Kingdom
558761,22469,HEART OF WICKER SMALL,2,2011-07-03 12:52:00,1.65,15033.0,United Kingdom
558761,23201,JUMBO BAG ALPHABET,3,2011-07-03 12:52:00,2.08,15033.0,United Kingdom
558761,20752,BLUE POLKADOT WASHING UP GLOVES,1,2011-07-03 12:52:00,2.1,15033.0,United Kingdom
558761,20751,FUNKY WASHING UP GLOVES ASSORTED,4,2011-07-03 12:52:00,2.1,15033.0,United Kingdom
558761,20754,RETROSPOT RED WASHING UP GLOVES,2,2011-07-03 12:52:00,2.1,15033.0,United Kingdom
558761,23322,LARGE WHITE HEART OF WICKER,1,2011-07-03 12:52:00,2.95,15033.0,United Kingdom
558761,23321,SMALL WHITE HEART OF WICKER,2,2011-07-03 12:52:00,1.65,15033.0,United Kingdom
558761,21034,REX CASH+CARRY JUMBO SHOPPER,1,2011-07-03 12:52:00,0.95,15033.0,United Kingdom
558762,22692,DOORMAT WELCOME TO OUR HOME,2,2011-07-03 13:05:00,7.95,15023.0,United Kingdom
558762,22847,BREAD BIN DINER STYLE IVORY,2,2011-07-03 13:05:00,16.95,15023.0,United Kingdom
558762,23306,SET OF 36 DOILIES PANTRY DESIGN,3,2011-07-03 13:05:00,1.45,15023.0,United Kingdom
558762,22989,SET 2 PANTRY DESIGN TEA TOWELS,2,2011-07-03 13:05:00,3.25,15023.0,United Kingdom
558762,23198,PANTRY MAGNETIC  SHOPPING LIST,3,2011-07-03 13:05:00,1.45,15023.0,United Kingdom
558762,23240,SET OF 4 KNICK KNACK TINS DOILEY ,3,2011-07-03 13:05:00,4.15,15023.0,United Kingdom
558762,23307,SET OF 60 PANTRY DESIGN CAKE CASES ,6,2011-07-03 13:05:00,0.55,15023.0,United Kingdom
558762,23243,SET OF TEA COFFEE SUGAR TINS PANTRY,12,2011-07-03 13:05:00,4.95,15023.0,United Kingdom
558762,23344,JUMBO BAG 50'S CHRISTMAS ,1,2011-07-03 13:05:00,2.08,15023.0,United Kingdom
558762,22989,SET 2 PANTRY DESIGN TEA TOWELS,1,2011-07-03 13:05:00,3.25,15023.0,United Kingdom
558762,23306,SET OF 36 DOILIES PANTRY DESIGN,1,2011-07-03 13:05:00,1.45,15023.0,United Kingdom
558762,22720,SET OF 3 CAKE TINS PANTRY DESIGN ,1,2011-07-03 13:05:00,4.95,15023.0,United Kingdom
558762,23307,SET OF 60 PANTRY DESIGN CAKE CASES ,1,2011-07-03 13:05:00,0.55,15023.0,United Kingdom
558762,23299,FOOD COVER WITH BEADS SET 2 ,1,2011-07-03 13:05:00,3.75,15023.0,United Kingdom
558762,22655,VINTAGE RED KITCHEN CABINET,2,2011-07-03 13:05:00,125.0,15023.0,United Kingdom
558763,21206,STRAWBERRY HONEYCOMB  GARLAND ,10,2011-07-03 13:08:00,1.65,12841.0,United Kingdom
558763,23263,SET OF 3 WOODEN HEART DECORATIONS,6,2011-07-03 13:08:00,1.25,12841.0,United Kingdom
558763,23275,SET OF 3 HANGING OWLS OLLIE BEAK,4,2011-07-03 13:08:00,1.25,12841.0,United Kingdom
558763,23266,SET OF 3 WOODEN STOCKING DECORATION,6,2011-07-03 13:08:00,1.25,12841.0,United Kingdom
558763,23265,SET OF 3 WOODEN TREE DECORATIONS,6,2011-07-03 13:08:00,1.25,12841.0,United Kingdom
558763,23264,SET OF 3 WOODEN SLEIGH DECORATIONS,6,2011-07-03 13:08:00,1.25,12841.0,United Kingdom
558763,23123,COCKTAIL SWORDS 50 PIECES,5,2011-07-03 13:08:00,0.83,12841.0,United Kingdom
558763,21034,REX CASH+CARRY JUMBO SHOPPER,1,2011-07-03 13:08:00,0.95,12841.0,United Kingdom
558763,23122,PARTY CHARMS 50 PIECES,4,2011-07-03 13:08:00,0.83,12841.0,United Kingdom
558763,23120,PACK OF 6 SMALL FRUIT STRAWS,10,2011-07-03 13:08:00,0.42,12841.0,United Kingdom
558763,35970,ZINC FOLKART SLEIGH BELLS,12,2011-07-03 13:08:00,1.69,12841.0,United Kingdom
558763,15036,ASSORTED COLOURS SILK FAN,24,2011-07-03 13:08:00,0.83,12841.0,United Kingdom
558763,21989,PACK OF 20 SKULL PAPER NAPKINS,5,2011-07-03 13:08:00,0.85,12841.0,United Kingdom
558763,22580,ADVENT CALENDAR GINGHAM SACK,3,2011-07-03 13:08:00,5.95,12841.0,United Kingdom
558763,22593,CHRISTMAS GINGHAM STAR,12,2011-07-03 13:08:00,0.85,12841.0,United Kingdom
558763,22594,CHRISTMAS GINGHAM TREE,12,2011-07-03 13:08:00,0.85,12841.0,United Kingdom
558763,22595,GINGHAM HEART DECORATION,12,2011-07-03 13:08:00,0.85,12841.0,United Kingdom
558763,22596,CHRISTMAS STAR WISH LIST CHALKBOARD,12,2011-07-03 13:08:00,1.25,12841.0,United Kingdom
558763,21864,UNION JACK FLAG PASSPORT COVER ,1,2011-07-03 13:08:00,2.1,12841.0,United Kingdom
558763,21865,PINK UNION JACK  PASSPORT COVER ,1,2011-07-03 13:08:00,2.1,12841.0,United Kingdom
558763,20616,CHERRY BLOSSOM PASSPORT COVER,1,2011-07-03 13:08:00,0.75,12841.0,United Kingdom
558763,23298,SPOTTY BUNTING,4,2011-07-03 13:08:00,4.95,12841.0,United Kingdom
558763,22960,JAM MAKING SET WITH JARS,3,2011-07-03 13:08:00,4.25,12841.0,United Kingdom
C558764,23243,SET OF TEA COFFEE SUGAR TINS PANTRY,-8,2011-07-03 13:08:00,4.95,15023.0,United Kingdom
558765,21145,ANTIQUE GLASS PLACE SETTING,12,2011-07-03 13:12:00,1.25,17312.0,United Kingdom
558765,21819,GLITTER CHRISTMAS STAR ,1,2011-07-03 13:12:00,0.85,17312.0,United Kingdom
558765,22642,SET OF 4 NAPKIN CHARMS STARS   ,1,2011-07-03 13:12:00,2.55,17312.0,United Kingdom
558765,22638,SET OF 4 NAPKIN CHARMS CROWNS ,1,2011-07-03 13:12:00,2.55,17312.0,United Kingdom
558765,40001,WHITE BAMBOO RIBS LAMPSHADE,24,2011-07-03 13:12:00,0.85,17312.0,United Kingdom
558765,21694,SMALL REGAL  SILVER CANDLEPOT ,6,2011-07-03 13:12:00,2.95,17312.0,United Kingdom
558765,21693,SMALL HAMMERED SILVER CANDLEPOT ,6,2011-07-03 13:12:00,2.95,17312.0,United Kingdom
558765,21696,SMALL SILVER TRELLIS CANDLEPOT,6,2011-07-03 13:12:00,2.95,17312.0,United Kingdom
558765,40016,CHINESE DRAGON PAPER LANTERNS,120,2011-07-03 13:12:00,0.42,17312.0,United Kingdom
558765,21034,REX CASH+CARRY JUMBO SHOPPER,1,2011-07-03 13:12:00,0.95,17312.0,United Kingdom
558766,22086,PAPER CHAIN KIT 50'S CHRISTMAS ,24,2011-07-03 13:24:00,2.95,14257.0,United Kingdom
558766,22910,PAPER CHAIN KIT VINTAGE CHRISTMAS,24,2011-07-03 13:24:00,2.95,14257.0,United Kingdom
558766,23298,SPOTTY BUNTING,12,2011-07-03 13:24:00,4.95,14257.0,United Kingdom
558766,47566,PARTY BUNTING,8,2011-07-03 13:24:00,4.95,14257.0,United Kingdom
558766,23234,BISCUIT TIN VINTAGE CHRISTMAS,12,2011-07-03 13:24:00,2.89,14257.0,United Kingdom
558766,22952,60 CAKE CASES VINTAGE CHRISTMAS,24,2011-07-03 13:24:00,0.55,14257.0,United Kingdom
558766,21755,LOVE BUILDING BLOCK WORD,3,2011-07-03 13:24:00,5.95,14257.0,United Kingdom
558767,23284,DOORMAT KEEP CALM AND COME IN,2,2011-07-03 13:27:00,7.95,13833.0,United Kingdom
558767,21524,DOORMAT SPOTTY HOME SWEET HOME,2,2011-07-03 13:27:00,7.95,13833.0,United Kingdom
558767,48138,DOORMAT UNION FLAG,2,2011-07-03 13:27:00,7.95,13833.0,United Kingdom
558767,22692,DOORMAT WELCOME TO OUR HOME,2,2011-07-03 13:27:00,7.95,13833.0,United Kingdom
558767,22507,MEMO BOARD RETROSPOT  DESIGN,2,2011-07-03 13:27:00,4.95,13833.0,United Kingdom
558767,22794,SWEETHEART WIRE MAGAZINE RACK,2,2011-07-03 13:27:00,7.95,13833.0,United Kingdom
558767,21452,TOADSTOOL MONEY BOX,2,2011-07-03 13:27:00,2.95,13833.0,United Kingdom
558767,23019,SMALL APOTHECARY MEASURING JAR ,2,2011-07-03 13:27:00,8.25,13833.0,United Kingdom
558767,21034,REX CASH+CARRY JUMBO SHOPPER,1,2011-07-03 13:27:00,0.95,13833.0,United Kingdom
558767,22668,PINK BABY BUNTING,5,2011-07-03 13:27:00,2.95,13833.0,United Kingdom
558767,47566,PARTY BUNTING,4,2011-07-03 13:27:00,4.95,13833.0,United Kingdom
558767,21411,GINGHAM HEART  DOORSTOP RED,2,2011-07-03 13:27:00,4.25,13833.0,United Kingdom
558767,22508,DOORSTOP RETROSPOT HEART,2,2011-07-03 13:27:00,3.75,13833.0,United Kingdom
558767,21621,VINTAGE UNION JACK BUNTING,2,2011-07-03 13:27:00,8.5,13833.0,United Kingdom
558767,22968,ROSE COTTAGE KEEPSAKE BOX ,2,2011-07-03 13:27:00,9.95,13833.0,United Kingdom
558767,21363,HOME SMALL WOOD LETTERS,2,2011-07-03 13:27:00,4.95,13833.0,United Kingdom
558767,23256,CHILDRENS CUTLERY SPACEBOY ,3,2011-07-03 13:27:00,4.15,13833.0,United Kingdom
558767,23254,CHILDRENS CUTLERY DOLLY GIRL ,3,2011-07-03 13:27:00,4.15,13833.0,United Kingdom
558767,22423,REGENCY CAKESTAND 3 TIER,2,2011-07-03 13:27:00,12.75,13833.0,United Kingdom
558767,84581,DOG TOY WITH PINK CROCHET SKIRT,2,2011-07-03 13:27:00,3.75,13833.0,United Kingdom
558767,22483,RED GINGHAM TEDDY BEAR ,2,2011-07-03 13:27:00,2.95,13833.0,United Kingdom
558767,21122,SET/10 PINK POLKADOT PARTY CANDLES,24,2011-07-03 13:27:00,1.25,13833.0,United Kingdom
558767,21124,SET/10 BLUE POLKADOT PARTY CANDLES,24,2011-07-03 13:27:00,1.25,13833.0,United Kingdom
558767,21877,HOME SWEET HOME MUG,6,2011-07-03 13:27:00,1.25,13833.0,United Kingdom
558767,22427,ENAMEL FLOWER JUG CREAM,2,2011-07-03 13:27:00,5.95,13833.0,United Kingdom
558767,23321,SMALL WHITE HEART OF WICKER,6,2011-07-03 13:27:00,1.65,13833.0,United Kingdom
558767,22470,HEART OF WICKER LARGE,2,2011-07-03 13:27:00,2.95,13833.0,United Kingdom
558767,21034,REX CASH+CARRY JUMBO SHOPPER,1,2011-07-03 13:27:00,0.95,13833.0,United Kingdom
558767,23322,LARGE WHITE HEART OF WICKER,5,2011-07-03 13:27:00,2.95,13833.0,United Kingdom
558768,21755,LOVE BUILDING BLOCK WORD,1,2011-07-03 13:33:00,5.95,15952.0,United Kingdom
558768,21755,LOVE BUILDING BLOCK WORD,1,2011-07-03 13:33:00,5.95,15952.0,United Kingdom
558768,22801,ANTIQUE GLASS PEDESTAL BOWL,1,2011-07-03 13:33:00,3.75,15952.0,United Kingdom
558768,22801,ANTIQUE GLASS PEDESTAL BOWL,1,2011-07-03 13:33:00,3.75,15952.0,United Kingdom
558768,85123A,WHITE HANGING HEART T-LIGHT HOLDER,3,2011-07-03 13:33:00,2.95,15952.0,United Kingdom
558768,82494L,WOODEN FRAME ANTIQUE WHITE ,1,2011-07-03 13:33:00,2.95,15952.0,United Kingdom
558768,82482,WOODEN PICTURE FRAME WHITE FINISH,1,2011-07-03 13:33:00,2.55,15952.0,United Kingdom
558768,82486,WOOD S/3 CABINET ANT WHITE FINISH,2,2011-07-03 13:33:00,8.95,15952.0,United Kingdom
558768,21534,DAIRY MAID LARGE MILK JUG,2,2011-07-03 13:33:00,4.95,15952.0,United Kingdom
558768,22507,MEMO BOARD RETROSPOT  DESIGN,2,2011-07-03 13:33:00,4.95,15952.0,United Kingdom
558768,21034,REX CASH+CARRY JUMBO SHOPPER,1,2011-07-03 13:33:00,0.95,15952.0,United Kingdom
558768,22427,ENAMEL FLOWER JUG CREAM,1,2011-07-03 13:33:00,5.95,15952.0,United Kingdom
558768,85054,FRENCH ENAMEL POT W LID,1,2011-07-03 13:33:00,2.95,15952.0,United Kingdom
558768,22784,LANTERN CREAM GAZEBO ,1,2011-07-03 13:33:00,4.95,15952.0,United Kingdom
558768,22427,ENAMEL FLOWER JUG CREAM,1,2011-07-03 13:33:00,5.95,15952.0,United Kingdom
558768,85054,FRENCH ENAMEL POT W LID,1,2011-07-03 13:33:00,2.95,15952.0,United Kingdom
558769,90058B,CRYSTAL STUD EARRINGS ASSORTED COL ,36,2011-07-03 14:58:00,0.38,17899.0,United Kingdom
558769,21931,JUMBO STORAGE BAG SUKI,2,2011-07-03 14:58:00,2.08,17899.0,United Kingdom
558769,21524,DOORMAT SPOTTY HOME SWEET HOME,1,2011-07-03 14:58:00,7.95,17899.0,United Kingdom
558769,22995,TRAVEL CARD WALLET SUKI,24,2011-07-03 14:58:00,0.42,17899.0,United Kingdom
558769,21032,SPACE CADET WHITE,3,2011-07-03 14:58:00,1.25,17899.0,United Kingdom
558769,21028,NINJA RABBIT BLACK,3,2011-07-03 14:58:00,1.25,17899.0,United Kingdom
558769,21034,REX CASH+CARRY JUMBO SHOPPER,2,2011-07-03 14:58:00,0.95,17899.0,United Kingdom
558769,23002,TRAVEL CARD WALLET SKULLS,24,2011-07-03 14:58:00,0.42,17899.0,United Kingdom
558769,21030,SPACE CADET RED,2,2011-07-03 14:58:00,1.25,17899.0,United Kingdom
558769,84548,CROCHET BEAR RED/BLUE  KEYRING,1,2011-07-03 14:58:00,1.65,17899.0,United Kingdom
558769,21027,NINJA RABBIT PINK,3,2011-07-03 14:58:00,1.25,17899.0,United Kingdom
558769,84548,CROCHET BEAR RED/BLUE  KEYRING,3,2011-07-03 14:58:00,1.65,17899.0,United Kingdom
558769,21030,SPACE CADET RED,1,2011-07-03 14:58:00,1.25,17899.0,United Kingdom
558769,20828,GLITTER BUTTERFLY CLIPS,2,2011-07-03 14:58:00,2.55,17899.0,United Kingdom
558769,48173C,DOORMAT BLACK FLOCK ,1,2011-07-03 14:58:00,7.95,17899.0,United Kingdom
558769,22434,BALLOON PUMP WITH 10 BALLOONS,1,2011-07-03 14:58:00,1.95,17899.0,United Kingdom
558769,21888,BINGO SET,1,2011-07-03 14:58:00,3.75,17899.0,United Kingdom
558769,22743,MAKE YOUR OWN FLOWERPOWER CARD KIT,1,2011-07-03 14:58:00,2.95,17899.0,United Kingdom
558769,22440,BALLOON WATER BOMB PACK OF 35,1,2011-07-03 14:58:00,0.42,17899.0,United Kingdom
558769,84991,60 TEATIME FAIRY CAKE CASES,1,2011-07-03 14:58:00,0.55,17899.0,United Kingdom
558769,20981,12 PENCILS TALL TUBE WOODLAND,1,2011-07-03 14:58:00,0.85,17899.0,United Kingdom
558769,22969,HOMEMADE JAM SCENTED CANDLES,12,2011-07-03 14:58:00,1.45,17899.0,United Kingdom
558769,22435,SET OF 9 HEART SHAPED BALLOONS,1,2011-07-03 14:58:00,1.25,17899.0,United Kingdom
558769,21212,PACK OF 72 RETROSPOT CAKE CASES,1,2011-07-03 14:58:00,0.55,17899.0,United Kingdom
558769,22951,60 CAKE CASES DOLLY GIRL DESIGN,1,2011-07-03 14:58:00,0.55,17899.0,United Kingdom
558769,21730,GLASS STAR FROSTED T-LIGHT HOLDER,1,2011-07-03 14:58:00,4.95,17899.0,United Kingdom
558769,84581,DOG TOY WITH PINK CROCHET SKIRT,1,2011-07-03 14:58:00,3.75,17899.0,United Kingdom
558769,21592,RETROSPOT CIGAR BOX MATCHES ,1,2011-07-03 14:58:00,1.25,17899.0,United Kingdom
558769,22993,SET OF 4 PANTRY JELLY MOULDS,1,2011-07-03 14:58:00,1.25,17899.0,United Kingdom
558769,22993,SET OF 4 PANTRY JELLY MOULDS,1,2011-07-03 14:58:00,1.25,17899.0,United Kingdom
558769,23008,DOLLY GIRL BABY GIFT SET,1,2011-07-03 14:58:00,16.95,17899.0,United Kingdom
558769,90058A,CRYSTAL STUD EARRINGS CLEAR DISPLAY,36,2011-07-03 14:58:00,0.38,17899.0,United Kingdom
558770,84877D,BLUE ROUND COMPACT MIRROR,1,2011-07-03 15:19:00,1.25,12748.0,United Kingdom
558770,20914,SET/5 RED RETROSPOT LID GLASS BOWLS,3,2011-07-03 15:19:00,2.95,12748.0,United Kingdom
558770,20992,JAZZ HEARTS PURSE NOTEBOOK,2,2011-07-03 15:19:00,0.39,12748.0,United Kingdom
558770,84987,SET OF 36 TEATIME PAPER DOILIES,1,2011-07-03 15:19:00,1.45,12748.0,United Kingdom
558770,22847,BREAD BIN DINER STYLE IVORY,1,2011-07-03 15:19:00,16.95,12748.0,United Kingdom
558770,37479P,CUBIC MUG FLOCK PINK ON BROWN,6,2011-07-03 15:19:00,0.39,12748.0,United Kingdom
558770,23229,VINTAGE DONKEY TAIL GAME ,2,2011-07-03 15:19:00,3.75,12748.0,United Kingdom
558770,21034,REX CASH+CARRY JUMBO SHOPPER,1,2011-07-03 15:19:00,0.95,12748.0,United Kingdom
558770,20615,BLUE POLKADOT PASSPORT COVER,1,2011-07-03 15:19:00,0.75,12748.0,United Kingdom
558770,22131,FOOD CONTAINER SET 3 LOVE HEART ,1,2011-07-03 15:19:00,1.95,12748.0,United Kingdom
558770,23171,REGENCY TEA PLATE GREEN ,6,2011-07-03 15:19:00,1.65,12748.0,United Kingdom
558770,23173,REGENCY TEAPOT ROSES ,1,2011-07-03 15:19:00,9.95,12748.0,United Kingdom
558770,20622,VIP PASSPORT COVER ,1,2011-07-03 15:19:00,2.1,12748.0,United Kingdom
558770,22423,REGENCY CAKESTAND 3 TIER,1,2011-07-03 15:19:00,12.75,12748.0,United Kingdom
558770,22699,ROSES REGENCY TEACUP AND SAUCER ,1,2011-07-03 15:19:00,2.95,12748.0,United Kingdom
558770,22698,PINK REGENCY TEACUP AND SAUCER,1,2011-07-03 15:19:00,2.95,12748.0,United Kingdom
558770,22697,GREEN REGENCY TEACUP AND SAUCER,1,2011-07-03 15:19:00,2.95,12748.0,United Kingdom
558770,22096,PINK PAISLEY SQUARE TISSUE BOX ,1,2011-07-03 15:19:00,0.39,12748.0,United Kingdom
558770,22098,BOUDOIR SQUARE TISSUE BOX,1,2011-07-03 15:19:00,0.39,12748.0,United Kingdom
558770,22095,LADS ONLY TISSUE BOX,2,2011-07-03 15:19:00,0.39,12748.0,United Kingdom
558770,51014C,"FEATHER PEN,COAL BLACK",12,2011-07-03 15:19:00,0.39,12748.0,United Kingdom
558770,21784,SHOE SHINE BOX ,1,2011-07-03 15:19:00,9.95,12748.0,United Kingdom
558770,22851,SET 20 NAPKINS FAIRY CAKES DESIGN ,2,2011-07-03 15:19:00,0.85,12748.0,United Kingdom
558770,22940,FELTCRAFT CHRISTMAS FAIRY,2,2011-07-03 15:19:00,4.25,12748.0,United Kingdom
558770,23186,FRENCH STYLE STORAGE JAR CAFE ,6,2011-07-03 15:19:00,0.29,12748.0,United Kingdom
558770,22952,60 CAKE CASES VINTAGE CHRISTMAS,2,2011-07-03 15:19:00,0.55,12748.0,United Kingdom
558771,22356,CHARLOTTE BAG PINK POLKADOT,10,2011-07-03 15:53:00,0.85,17105.0,United Kingdom
558771,20724,RED RETROSPOT CHARLOTTE BAG,10,2011-07-03 15:53:00,0.85,17105.0,United Kingdom
558771,22954,HEN PARTY CORDON BARRIER TAPE,4,2011-07-03 15:53:00,1.25,17105.0,United Kingdom
558771,21498,RED RETROSPOT WRAP ,25,2011-07-03 15:53:00,0.42,17105.0,United Kingdom
558771,22333,RETROSPOT PARTY BAG + STICKER SET,3,2011-07-03 15:53:00,1.65,17105.0,United Kingdom
558771,47599A,PINK PARTY BAGS,3,2011-07-03 15:53:00,2.1,17105.0,United Kingdom
558771,21508,VINTAGE KID DOLLY CARD ,12,2011-07-03 15:53:00,0.42,17105.0,United Kingdom
558771,22712,CARD DOLLY GIRL ,12,2011-07-03 15:53:00,0.42,17105.0,United Kingdom
558771,22714,CARD BIRTHDAY COWBOY,12,2011-07-03 15:53:00,0.42,17105.0,United Kingdom
558771,20718,RED RETROSPOT SHOPPER BAG,10,2011-07-03 15:53:00,1.25,17105.0,United Kingdom
558771,22098,BOUDOIR SQUARE TISSUE BOX,4,2011-07-03 15:53:00,0.39,17105.0,United Kingdom
558771,22097,SWALLOW SQUARE TISSUE BOX,4,2011-07-03 15:53:00,0.39,17105.0,United Kingdom
558771,22099,CARAVAN SQUARE TISSUE BOX,4,2011-07-03 15:53:00,0.39,17105.0,United Kingdom
558771,22096,PINK PAISLEY SQUARE TISSUE BOX ,4,2011-07-03 15:53:00,0.39,17105.0,United Kingdom
558771,22188,BLACK HEART CARD HOLDER,3,2011-07-03 15:53:00,3.95,17105.0,United Kingdom
558771,22189,CREAM HEART CARD HOLDER,4,2011-07-03 15:53:00,3.95,17105.0,United Kingdom
558771,23141,TRIPLE WIRE HOOK PINK HEART,2,2011-07-03 15:53:00,4.15,17105.0,United Kingdom
558771,23140,TRIPLE WIRE HOOK IVORY HEART,2,2011-07-03 15:53:00,4.15,17105.0,United Kingdom
558771,23301,GARDENERS KNEELING PAD KEEP CALM ,2,2011-07-03 15:53:00,1.65,17105.0,United Kingdom
558771,23300,GARDENERS KNEELING PAD CUP OF TEA ,2,2011-07-03 15:53:00,1.65,17105.0,United Kingdom
558771,23338,EGG FRYING PAN RED ,1,2011-07-03 15:53:00,2.08,17105.0,United Kingdom
558771,37446,MINI CAKE STAND WITH HANGING CAKES,3,2011-07-03 15:53:00,1.45,17105.0,United Kingdom
558771,22457,NATURAL SLATE HEART CHALKBOARD ,4,2011-07-03 15:53:00,2.95,17105.0,United Kingdom
558771,82581,TOILET METAL SIGN,6,2011-07-03 15:53:00,0.55,17105.0,United Kingdom
558771,82580,BATHROOM METAL SIGN,6,2011-07-03 15:53:00,0.55,17105.0,United Kingdom
558771,82578,KITCHEN METAL SIGN,6,2011-07-03 15:53:00,0.55,17105.0,United Kingdom
558771,21179,NO JUNK MAIL METAL SIGN,3,2011-07-03 15:53:00,0.39,17105.0,United Kingdom
558771,21899,GARAGE KEY FOB,8,2011-07-03 15:53:00,0.65,17105.0,United Kingdom
558771,47480,HANGING PHOTO CLIP ROPE LADDER,5,2011-07-03 15:53:00,1.65,17105.0,United Kingdom
558771,85061W,WHITE JEWELLED HEART DECORATION,6,2011-07-03 15:53:00,0.85,17105.0,United Kingdom
558771,85130D,BEADED CRYSTAL HEART PINK LARGE,4,2011-07-03 15:53:00,0.79,17105.0,United Kingdom
558771,22597,MUSICAL ZINC HEART DECORATION ,14,2011-07-03 15:53:00,0.85,17105.0,United Kingdom
558771,23138,SINGLE WIRE HOOK IVORY HEART,5,2011-07-03 15:53:00,1.45,17105.0,United Kingdom
558771,21291,SMALL POLKADOT CHOCOLATE GIFT BAG ,16,2011-07-03 15:53:00,0.85,17105.0,United Kingdom
558771,22344,PARTY PIZZA DISH PINK POLKADOT,12,2011-07-03 15:53:00,0.85,17105.0,United Kingdom
558771,84755,COLOUR GLASS T-LIGHT HOLDER HANGING,8,2011-07-03 15:53:00,0.65,17105.0,United Kingdom
558771,22151,PLACE SETTING WHITE HEART,24,2011-07-03 15:53:00,0.42,17105.0,United Kingdom
558771,23139,SINGLE WIRE HOOK PINK HEART,6,2011-07-03 15:53:00,1.45,17105.0,United Kingdom
558771,21390,FILIGRIS HEART WITH BUTTERFLY,10,2011-07-03 15:53:00,1.25,17105.0,United Kingdom
558771,22156,HEART DECORATION WITH PEARLS ,6,2011-07-03 15:53:00,0.85,17105.0,United Kingdom
558771,22227,HANGING HEART MIRROR DECORATION ,12,2011-07-03 15:53:00,0.65,17105.0,United Kingdom
