InvoiceNo,StockCode,Description,Quantity,InvoiceDate,UnitPrice,CustomerID,Country
580505,21523,DOORMAT FANCY FONT HOME SWEET HOME,1,2011-12-04 13:32:00,8.25,15867.0,United Kingdom
580505,23284,DOORMAT KEEP CALM AND COME IN,2,2011-12-04 13:32:00,8.25,15867.0,United Kingdom
580505,23323,WHITE WICKER STAR ,5,2011-12-04 13:32:00,2.1,15867.0,United Kingdom
580505,20682,RED RETROSPOT CHILDRENS UMBRELLA,2,2011-12-04 13:32:00,3.25,15867.0,United Kingdom
580505,23350,ROLL WRAP VINTAGE SPOT ,4,2011-12-04 13:32:00,1.25,15867.0,United Kingdom
580505,22338,STAR DECORATION PAINTED ZINC ,96,2011-12-04 13:32:00,0.19,15867.0,United Kingdom
580505,23349,ROLL WRAP VINTAGE CHRISTMAS,4,2011-12-04 13:32:00,1.25,15867.0,United Kingdom
580505,23351,ROLL WRAP 50'S CHRISTMAS,4,2011-12-04 13:32:00,1.25,15867.0,United Kingdom
580505,85179A,GREEN BITTY LIGHT CHAIN,1,2011-12-04 13:32:00,1.25,15867.0,United Kingdom
580505,21703,BAG 125g SWIRLY MARBLES,3,2011-12-04 13:32:00,0.42,15867.0,United Kingdom
580505,23084,RABBIT NIGHT LIGHT,2,2011-12-04 13:32:00,2.08,15867.0,United Kingdom
580505,21903,MAN FLU METAL SIGN,2,2011-12-04 13:32:00,2.1,15867.0,United Kingdom
580505,21166,COOK WITH WINE METAL SIGN ,2,2011-12-04 13:32:00,2.08,15867.0,United Kingdom
580505,21908,CHOCOLATE THIS WAY METAL SIGN,2,2011-12-04 13:32:00,2.1,15867.0,United Kingdom
580505,85150,LADIES & GENTLEMEN METAL SIGN,2,2011-12-04 13:32:00,2.55,15867.0,United Kingdom
580505,21172,PARTY METAL SIGN ,2,2011-12-04 13:32:00,1.45,15867.0,United Kingdom
580505,23426,METAL SIGN DROP YOUR PANTS,2,2011-12-04 13:32:00,2.89,15867.0,United Kingdom
580505,22413,METAL SIGN TAKE IT OR LEAVE IT ,2,2011-12-04 13:32:00,2.95,15867.0,United Kingdom
580505,23354,6 GIFT TAGS 50'S CHRISTMAS ,3,2011-12-04 13:32:00,0.83,15867.0,United Kingdom
580505,23353,6 GIFT TAGS VINTAGE CHRISTMAS ,3,2011-12-04 13:32:00,0.83,15867.0,United Kingdom
580505,85231B,CINAMMON SET OF 9 T-LIGHTS,6,2011-12-04 13:32:00,0.85,15867.0,United Kingdom
580505,23374,RED SPOT PAPER GIFT BAG,20,2011-12-04 13:32:00,0.82,15867.0,United Kingdom
580505,22737,RIBBON REEL CHRISTMAS PRESENT ,2,2011-12-04 13:32:00,1.65,15867.0,United Kingdom
580505,22738,RIBBON REEL SNOWY VILLAGE,1,2011-12-04 13:32:00,1.65,15867.0,United Kingdom
580505,20655,QUEEN OF SKIES LUGGAGE TAG,1,2011-12-04 13:32:00,1.25,15867.0,United Kingdom
580505,20654,FIRST CLASS LUGGAGE TAG ,1,2011-12-04 13:32:00,1.25,15867.0,United Kingdom
580505,21616,4 PEAR BOTANICAL DINNER CANDLES,2,2011-12-04 13:32:00,3.75,15867.0,United Kingdom
580505,22753,SMALL YELLOW BABUSHKA NOTEBOOK ,2,2011-12-04 13:32:00,0.21,15867.0,United Kingdom
580505,22754,SMALL RED BABUSHKA NOTEBOOK ,2,2011-12-04 13:32:00,0.21,15867.0,United Kingdom
580505,22755,SMALL PURPLE BABUSHKA NOTEBOOK ,2,2011-12-04 13:32:00,0.21,15867.0,United Kingdom
580505,85034C,3 ROSE MORRIS BOXED CANDLES,2,2011-12-04 13:32:00,1.25,15867.0,United Kingdom
580505,21843,RED RETROSPOT CAKE STAND,1,2011-12-04 13:32:00,10.95,15867.0,United Kingdom
580505,84879,ASSORTED COLOUR BIRD ORNAMENT,16,2011-12-04 13:32:00,1.69,15867.0,United Kingdom
580505,22423,REGENCY CAKESTAND 3 TIER,4,2011-12-04 13:32:00,12.75,15867.0,United Kingdom
580506,22941,CHRISTMAS LIGHTS 10 REINDEER,10,2011-12-04 13:34:00,8.5,13319.0,United Kingdom
580506,23247,BISCUIT TIN 50'S CHRISTMAS,12,2011-12-04 13:34:00,2.89,13319.0,United Kingdom
580506,22072,RED RETROSPOT TEA CUP AND SAUCER ,12,2011-12-04 13:34:00,1.25,13319.0,United Kingdom
580506,23552,BICYCLE PUNCTURE REPAIR KIT ,12,2011-12-04 13:34:00,2.08,13319.0,United Kingdom
580506,23576,SNACK TRAY RED VINTAGE DOILY,8,2011-12-04 13:34:00,1.95,13319.0,United Kingdom
580506,23562,SET OF 6 RIBBONS PERFECTLY PRETTY  ,6,2011-12-04 13:34:00,2.89,13319.0,United Kingdom
580506,23580,SNACK TRAY HAPPY FOREST  ,8,2011-12-04 13:34:00,1.95,13319.0,United Kingdom
580506,22944,CHRISTMAS METAL POSTCARD WITH BELLS,12,2011-12-04 13:34:00,1.25,13319.0,United Kingdom
580506,23084,RABBIT NIGHT LIGHT,48,2011-12-04 13:34:00,1.79,13319.0,United Kingdom
C580507,22423,REGENCY CAKESTAND 3 TIER,-1,2011-12-04 13:37:00,12.75,15867.0,United Kingdom
C580507,72351B,SET/6 PINK  BUTTERFLY T-LIGHTS,-1,2011-12-04 13:37:00,2.1,15867.0,United Kingdom
580508,22751,FELTCRAFT PRINCESS OLIVIA DOLL,1,2011-12-04 13:45:00,3.75,,United Kingdom
580508,17012D,ORIGAMI ROSE INCENSE/CANDLE SET ,2,2011-12-04 13:45:00,0.85,,United Kingdom
580508,17012F,ORIGAMI SANDLEWOOD INCENSE/CAND SET,2,2011-12-04 13:45:00,0.85,,United Kingdom
580508,17012C,ORIGAMI LAVENDER INCENSE/CANDL SET ,2,2011-12-04 13:45:00,0.85,,United Kingdom
580508,16235,RECYCLED PENCIL WITH RABBIT ERASER,2,2011-12-04 13:45:00,0.21,,United Kingdom
580508,21709,FOLDING UMBRELLA CHOCOLATE POLKADOT,1,2011-12-04 13:45:00,4.95,,United Kingdom
580508,23489,VINTAGE BELLS GARLAND,1,2011-12-04 13:45:00,2.89,,United Kingdom
580508,23245,SET OF 3 REGENCY CAKE TINS,1,2011-12-04 13:45:00,4.95,,United Kingdom
580508,22382,LUNCH BAG SPACEBOY DESIGN ,1,2011-12-04 13:45:00,1.65,,United Kingdom
580508,23319,BOX OF 6 MINI 50'S CRACKERS,2,2011-12-04 13:45:00,2.49,,United Kingdom
580508,22109,FULL ENGLISH BREAKFAST PLATE,1,2011-12-04 13:45:00,3.75,,United Kingdom
580508,23323,WHITE WICKER STAR ,1,2011-12-04 13:45:00,2.1,,United Kingdom
580508,23290,SPACEBOY CHILDRENS BOWL,1,2011-12-04 13:45:00,1.25,,United Kingdom
580508,22489,PACK OF 12 TRADITIONAL CRAYONS,1,2011-12-04 13:45:00,0.42,,United Kingdom
580508,35964,FOLKART CLIP ON STARS,1,2011-12-04 13:45:00,0.39,,United Kingdom
580509,22376,AIRLINE BAG VINTAGE JET SET WHITE,4,2011-12-04 13:45:00,4.25,12719.0,France
580509,23556,LANDMARK FRAME COVENT GARDEN ,3,2011-12-04 13:45:00,12.5,12719.0,France
580509,90201B,BLACK ENAMEL FLOWER RING,6,2011-12-04 13:45:00,2.95,12719.0,France
580509,22951,60 CAKE CASES DOLLY GIRL DESIGN,24,2011-12-04 13:45:00,0.55,12719.0,France
580509,47578A,ENGLISH ROSE SMALL SCENTED FLOWER,10,2011-12-04 13:45:00,0.85,12719.0,France
580509,23367,SET 12 COLOUR PENCILS SPACEBOY ,16,2011-12-04 13:45:00,0.65,12719.0,France
580509,23366,SET 12 COLOURING PENCILS DOILY,16,2011-12-04 13:45:00,0.65,12719.0,France
580509,84580,MOUSE TOY WITH PINK T-SHIRT,4,2011-12-04 13:45:00,3.75,12719.0,France
580509,22138,BAKING SET 9 PIECE RETROSPOT ,3,2011-12-04 13:45:00,4.95,12719.0,France
580509,23504,PLAYING CARDS JUBILEE UNION JACK,12,2011-12-04 13:45:00,1.25,12719.0,France
580509,21790,VINTAGE SNAP CARDS,12,2011-12-04 13:45:00,0.85,12719.0,France
580509,21892,TRADITIONAL WOODEN CATCH CUP GAME ,12,2011-12-04 13:45:00,1.25,12719.0,France
580509,21914,BLUE HARMONICA IN BOX ,12,2011-12-04 13:45:00,1.25,12719.0,France
580509,22549,PICTURE DOMINOES,12,2011-12-04 13:45:00,1.45,12719.0,France
580509,21791,VINTAGE HEADS AND TAILS CARD GAME ,12,2011-12-04 13:45:00,1.25,12719.0,France
580509,23077,DOUGHNUT LIP GLOSS ,20,2011-12-04 13:45:00,1.25,12719.0,France
580509,23368,SET 12 COLOUR PENCILS DOLLY GIRL ,24,2011-12-04 13:45:00,0.65,12719.0,France
580509,21623,VINTAGE UNION JACK MEMOBOARD,2,2011-12-04 13:45:00,9.95,12719.0,France
580509,22111,SCOTTIE DOG HOT WATER BOTTLE,3,2011-12-04 13:45:00,4.95,12719.0,France
580509,23356,LOVE HOT WATER BOTTLE,3,2011-12-04 13:45:00,5.95,12719.0,France
580509,POST,POSTAGE,2,2011-12-04 13:45:00,18.0,12719.0,France
C580510,M,Manual,-1,2011-12-04 13:48:00,1.25,14456.0,United Kingdom
580511,21485,RETROSPOT HEART HOT WATER BOTTLE,6,2011-12-04 13:54:00,4.95,12560.0,Germany
580511,22726,ALARM CLOCK BAKELIKE GREEN,8,2011-12-04 13:54:00,3.75,12560.0,Germany
580511,22727,ALARM CLOCK BAKELIKE RED ,8,2011-12-04 13:54:00,3.75,12560.0,Germany
580511,22722,SET OF 6 SPICE TINS PANTRY DESIGN,4,2011-12-04 13:54:00,3.95,12560.0,Germany
580511,22728,ALARM CLOCK BAKELIKE PINK,8,2011-12-04 13:54:00,3.75,12560.0,Germany
580511,22865,HAND WARMER OWL DESIGN,24,2011-12-04 13:54:00,2.1,12560.0,Germany
580511,22867,HAND WARMER BIRD DESIGN,24,2011-12-04 13:54:00,2.1,12560.0,Germany
580511,22993,SET OF 4 PANTRY JELLY MOULDS,12,2011-12-04 13:54:00,1.25,12560.0,Germany
580511,23240,SET OF 4 KNICK KNACK TINS DOILY ,6,2011-12-04 13:54:00,4.15,12560.0,Germany
580511,23236,STORAGE TIN VINTAGE DOILY ,6,2011-12-04 13:54:00,2.89,12560.0,Germany
580511,23493,VINTAGE DOILY TRAVEL SEWING KIT,10,2011-12-04 13:54:00,1.95,12560.0,Germany
580511,22629,SPACEBOY LUNCH BOX ,12,2011-12-04 13:54:00,1.95,12560.0,Germany
580511,22029,SPACEBOY BIRTHDAY CARD,24,2011-12-04 13:54:00,0.42,12560.0,Germany
580511,22551,PLASTERS IN TIN SPACEBOY,12,2011-12-04 13:54:00,1.65,12560.0,Germany
580511,23389,SPACEBOY MINI BACKPACK,4,2011-12-04 13:54:00,4.15,12560.0,Germany
580511,22630,DOLLY GIRL LUNCH BOX,12,2011-12-04 13:54:00,1.95,12560.0,Germany
580511,84510A,SET OF 4 ENGLISH ROSE COASTERS,10,2011-12-04 13:54:00,1.25,12560.0,Germany
580511,22692,DOORMAT WELCOME TO OUR HOME,4,2011-12-04 13:54:00,8.25,12560.0,Germany
580511,22915,ASSORTED BOTTLE TOP  MAGNETS ,12,2011-12-04 13:54:00,0.42,12560.0,Germany
580511,22725,ALARM CLOCK BAKELIKE CHOCOLATE,8,2011-12-04 13:54:00,3.75,12560.0,Germany
580511,21154,RED RETROSPOT OVEN GLOVE ,10,2011-12-04 13:54:00,1.25,12560.0,Germany
580511,21212,PACK OF 72 RETROSPOT CAKE CASES,24,2011-12-04 13:54:00,0.55,12560.0,Germany
580511,22632,HAND WARMER RED RETROSPOT,12,2011-12-04 13:54:00,2.1,12560.0,Germany
580511,23237,SET OF 4 KNICK KNACK TINS LEAF,6,2011-12-04 13:54:00,4.15,12560.0,Germany
580511,23244,ROUND STORAGE TIN VINTAGE LEAF,6,2011-12-04 13:54:00,1.95,12560.0,Germany
580511,23235,STORAGE TIN VINTAGE LEAF,6,2011-12-04 13:54:00,2.89,12560.0,Germany
580511,21484,CHICK GREY HOT WATER BOTTLE,8,2011-12-04 13:54:00,4.25,12560.0,Germany
580511,POST,POSTAGE,4,2011-12-04 13:54:00,18.0,12560.0,Germany
580512,21389,IVORY HANGING DECORATION  BIRD,12,2011-12-04 13:55:00,0.85,12673.0,Germany
580512,21114,LAVENDER SCENTED FABRIC HEART,10,2011-12-04 13:55:00,1.25,12673.0,Germany
580512,20750,RED RETROSPOT MINI CASES,4,2011-12-04 13:55:00,7.95,12673.0,Germany
580512,20712,JUMBO BAG WOODLAND ANIMALS,10,2011-12-04 13:55:00,2.08,12673.0,Germany
580512,20724,RED RETROSPOT CHARLOTTE BAG,10,2011-12-04 13:55:00,0.85,12673.0,Germany
580512,85099B,JUMBO BAG RED RETROSPOT,10,2011-12-04 13:55:00,2.08,12673.0,Germany
580512,23344,JUMBO BAG 50'S CHRISTMAS ,10,2011-12-04 13:55:00,2.08,12673.0,Germany
580512,21452,TOADSTOOL MONEY BOX,6,2011-12-04 13:55:00,2.95,12673.0,Germany
580512,22139,RETROSPOT TEA SET CERAMIC 11 PC ,3,2011-12-04 13:55:00,4.95,12673.0,Germany
580512,22138,BAKING SET 9 PIECE RETROSPOT ,3,2011-12-04 13:55:00,4.95,12673.0,Germany
580512,22554,PLASTERS IN TIN WOODLAND ANIMALS,12,2011-12-04 13:55:00,1.65,12673.0,Germany
580512,22555,PLASTERS IN TIN STRONGMAN,12,2011-12-04 13:55:00,1.65,12673.0,Germany
580512,23493,VINTAGE DOILY TRAVEL SEWING KIT,20,2011-12-04 13:55:00,1.95,12673.0,Germany
580512,23473,WOODLAND SMALL RED FELT HEART,12,2011-12-04 13:55:00,0.83,12673.0,Germany
580512,23475,WOODLAND SMALL PINK FELT HEART,12,2011-12-04 13:55:00,0.83,12673.0,Germany
580512,23480,MINI LIGHTS WOODLAND MUSHROOMS,12,2011-12-04 13:55:00,3.75,12673.0,Germany
580512,23582,VINTAGE DOILY JUMBO BAG RED ,10,2011-12-04 13:55:00,2.08,12673.0,Germany
580512,23583,LUNCH BAG PAISLEY PARK  ,10,2011-12-04 13:55:00,1.65,12673.0,Germany
580512,POST,POSTAGE,2,2011-12-04 13:55:00,18.0,12673.0,Germany
580513,21109,LARGE CAKE TOWEL CHOCOLATE SPOTS,4,2011-12-04 13:59:00,1.95,14456.0,United Kingdom
580513,21108,FAIRY CAKE FLANNEL ASSORTED COLOUR,9,2011-12-04 13:59:00,0.79,14456.0,United Kingdom
580513,22816,CARD MOTORBIKE SANTA,12,2011-12-04 13:59:00,0.42,14456.0,United Kingdom
580513,22118,JOY WOODEN BLOCK LETTERS,2,2011-12-04 13:59:00,1.25,14456.0,United Kingdom
580513,22703,PINK CAT BOWL,6,2011-12-04 13:59:00,0.59,14456.0,United Kingdom
580513,23076,ICE CREAM SUNDAE LIP GLOSS,24,2011-12-04 13:59:00,1.25,14456.0,United Kingdom
580513,84596F,SMALL MARSHMALLOWS PINK BOWL,2,2011-12-04 13:59:00,0.42,14456.0,United Kingdom
580513,84596G,SMALL CHOCOLATES PINK BOWL,2,2011-12-04 13:59:00,0.42,14456.0,United Kingdom
580513,84596B,SMALL DOLLY MIX DESIGN ORANGE BOWL,2,2011-12-04 13:59:00,0.42,14456.0,United Kingdom
580513,22728,ALARM CLOCK BAKELIKE PINK,1,2011-12-04 13:59:00,3.75,14456.0,United Kingdom
580513,22726,ALARM CLOCK BAKELIKE GREEN,1,2011-12-04 13:59:00,3.75,14456.0,United Kingdom
580513,23322,LARGE WHITE HEART OF WICKER,2,2011-12-04 13:59:00,2.95,14456.0,United Kingdom
580513,22197,POPCORN HOLDER,4,2011-12-04 13:59:00,0.85,14456.0,United Kingdom
580513,23375,50'S CHRISTMAS PAPER GIFT BAG,4,2011-12-04 13:59:00,0.82,14456.0,United Kingdom
580513,23354,6 GIFT TAGS 50'S CHRISTMAS ,3,2011-12-04 13:59:00,0.83,14456.0,United Kingdom
580513,22895,SET OF 2 TEA TOWELS APPLE AND PEARS,2,2011-12-04 13:59:00,3.25,14456.0,United Kingdom
580513,47559B,TEA TIME OVEN GLOVE,1,2011-12-04 13:59:00,1.25,14456.0,United Kingdom
580513,22897,OVEN MITT APPLES DESIGN,2,2011-12-04 13:59:00,1.45,14456.0,United Kingdom
580513,21265,PINK GOOSE FEATHER TREE 60CM,2,2011-12-04 13:59:00,1.95,14456.0,United Kingdom
580513,21264,WHITE GOOSE FEATHER TREE 60CM ,2,2011-12-04 13:59:00,1.95,14456.0,United Kingdom
580513,23437, 50'S CHRISTMAS GIFT BAG LARGE,2,2011-12-04 13:59:00,1.25,14456.0,United Kingdom
580513,23321,SMALL WHITE HEART OF WICKER,2,2011-12-04 13:59:00,1.65,14456.0,United Kingdom
580513,22701,PINK DOG BOWL,6,2011-12-04 13:59:00,0.79,14456.0,United Kingdom
580513,23090,VINTAGE GLASS T-LIGHT HOLDER,12,2011-12-04 13:59:00,0.83,14456.0,United Kingdom
580513,22065,CHRISTMAS PUDDING TRINKET POT ,2,2011-12-04 13:59:00,0.39,14456.0,United Kingdom
580513,22755,SMALL PURPLE BABUSHKA NOTEBOOK ,12,2011-12-04 13:59:00,0.21,14456.0,United Kingdom
580513,22598,CHRISTMAS MUSICAL ZINC TREE,2,2011-12-04 13:59:00,0.29,14456.0,United Kingdom
580513,22581,WOOD STOCKING CHRISTMAS SCANDISPOT,6,2011-12-04 13:59:00,0.29,14456.0,United Kingdom
580513,22599,CHRISTMAS MUSICAL ZINC STAR,2,2011-12-04 13:59:00,0.29,14456.0,United Kingdom
580513,22577,WOODEN HEART CHRISTMAS SCANDINAVIAN,5,2011-12-04 13:59:00,0.29,14456.0,United Kingdom
580513,22578,WOODEN STAR CHRISTMAS SCANDINAVIAN,7,2011-12-04 13:59:00,0.29,14456.0,United Kingdom
580513,22597,MUSICAL ZINC HEART DECORATION ,2,2011-12-04 13:59:00,0.29,14456.0,United Kingdom
580513,85123A,WHITE HANGING HEART T-LIGHT HOLDER,1,2011-12-04 13:59:00,2.95,14456.0,United Kingdom
580513,16054,POPART RECT PENCIL SHARPENER ASST,36,2011-12-04 13:59:00,0.12,14456.0,United Kingdom
580513,20986,BLUE CALCULATOR RULER,2,2011-12-04 13:59:00,1.25,14456.0,United Kingdom
580513,22754,SMALL RED BABUSHKA NOTEBOOK ,2,2011-12-04 13:59:00,0.21,14456.0,United Kingdom
580513,22753,SMALL YELLOW BABUSHKA NOTEBOOK ,2,2011-12-04 13:59:00,0.21,14456.0,United Kingdom
580513,22422,TOOTHPASTE TUBE PEN,50,2011-12-04 13:59:00,0.12,14456.0,United Kingdom
580513,16045,POPART WOODEN PENCILS ASST,100,2011-12-04 13:59:00,0.04,14456.0,United Kingdom
580513,22940,FELTCRAFT CHRISTMAS FAIRY,1,2011-12-04 13:59:00,4.25,14456.0,United Kingdom
580513,23491,VINTAGE JINGLE BELLS HEART,1,2011-12-04 13:59:00,8.25,14456.0,United Kingdom
580513,20985,HEART CALCULATOR,2,2011-12-04 13:59:00,1.25,14456.0,United Kingdom
580513,35961,FOLKART ZINC HEART CHRISTMAS DEC,3,2011-12-04 13:59:00,0.85,14456.0,United Kingdom
580513,22908,PACK OF 20 NAPKINS RED APPLES,2,2011-12-04 13:59:00,0.85,14456.0,United Kingdom
580513,21914,BLUE HARMONICA IN BOX ,2,2011-12-04 13:59:00,1.25,14456.0,United Kingdom
580513,22804,PINK HANGING HEART T-LIGHT HOLDER,1,2011-12-04 13:59:00,2.95,14456.0,United Kingdom
580513,21819,GLITTER CHRISTMAS STAR ,2,2011-12-04 13:59:00,0.39,14456.0,United Kingdom
580513,21818,GLITTER HEART DECORATION,2,2011-12-04 13:59:00,0.39,14456.0,United Kingdom
580513,21015,DARK BIRD HOUSE TREE DECORATION,2,2011-12-04 13:59:00,0.29,14456.0,United Kingdom
580513,22505,MEMO BOARD COTTAGE DESIGN,1,2011-12-04 13:59:00,4.95,14456.0,United Kingdom
580513,22396,MAGNETS PACK OF 4 RETRO PHOTO,2,2011-12-04 13:59:00,0.39,14456.0,United Kingdom
580513,22402,MAGNETS PACK OF 4 VINTAGE COLLAGE,1,2011-12-04 13:59:00,0.39,14456.0,United Kingdom
580513,22400,MAGNETS PACK OF 4 HOME SWEET HOME,1,2011-12-04 13:59:00,0.39,14456.0,United Kingdom
580513,22731,3D CHRISTMAS STAMPS STICKERS ,2,2011-12-04 13:59:00,1.25,14456.0,United Kingdom
580513,22733,3D TRADITIONAL CHRISTMAS STICKERS,2,2011-12-04 13:59:00,1.25,14456.0,United Kingdom
580513,21929,JUMBO BAG PINK VINTAGE PAISLEY,2,2011-12-04 13:59:00,2.08,14456.0,United Kingdom
580513,23344,JUMBO BAG 50'S CHRISTMAS ,4,2011-12-04 13:59:00,2.08,14456.0,United Kingdom
580513,23343,JUMBO BAG VINTAGE CHRISTMAS ,2,2011-12-04 13:59:00,2.08,14456.0,United Kingdom
580513,21928,JUMBO BAG SCANDINAVIAN BLUE PAISLEY,2,2011-12-04 13:59:00,2.08,14456.0,United Kingdom
580513,21930,JUMBO STORAGE BAG SKULLS,2,2011-12-04 13:59:00,2.08,14456.0,United Kingdom
580513,22411,JUMBO SHOPPER VINTAGE RED PAISLEY,1,2011-12-04 13:59:00,2.08,14456.0,United Kingdom
580513,85099F,JUMBO BAG STRAWBERRY,2,2011-12-04 13:59:00,2.08,14456.0,United Kingdom
580513,21931,JUMBO STORAGE BAG SUKI,2,2011-12-04 13:59:00,2.08,14456.0,United Kingdom
580513,23199,JUMBO BAG APPLES,2,2011-12-04 13:59:00,2.08,14456.0,United Kingdom
580513,23200,JUMBO BAG PEARS,2,2011-12-04 13:59:00,2.08,14456.0,United Kingdom
580513,23203,JUMBO BAG VINTAGE DOILY ,2,2011-12-04 13:59:00,2.08,14456.0,United Kingdom
580513,23582,VINTAGE DOILY JUMBO BAG RED ,2,2011-12-04 13:59:00,2.08,14456.0,United Kingdom
580513,22386,JUMBO BAG PINK POLKADOT,2,2011-12-04 13:59:00,2.08,14456.0,United Kingdom
580513,23581,JUMBO BAG PAISLEY PARK,2,2011-12-04 13:59:00,2.08,14456.0,United Kingdom
580513,20718,RED RETROSPOT SHOPPER BAG,1,2011-12-04 13:59:00,1.25,14456.0,United Kingdom
580513,22382,LUNCH BAG SPACEBOY DESIGN ,1,2011-12-04 13:59:00,1.65,14456.0,United Kingdom
580513,22662,LUNCH BAG DOLLY GIRL DESIGN,1,2011-12-04 13:59:00,1.65,14456.0,United Kingdom
580513,20727,LUNCH BAG  BLACK SKULL.,2,2011-12-04 13:59:00,1.65,14456.0,United Kingdom
580513,22383,LUNCH BAG SUKI DESIGN ,2,2011-12-04 13:59:00,1.65,14456.0,United Kingdom
580513,23029,DRAWER KNOB CRACKLE GLAZE GREEN,2,2011-12-04 13:59:00,1.65,14456.0,United Kingdom
580513,23031,DRAWER KNOB CRACKLE GLAZE PINK,2,2011-12-04 13:59:00,1.65,14456.0,United Kingdom
580513,21918,SET 12 KIDS COLOUR  CHALK STICKS,2,2011-12-04 13:59:00,0.42,14456.0,United Kingdom
580513,21917,SET 12 KIDS  WHITE CHALK STICKS,2,2011-12-04 13:59:00,0.42,14456.0,United Kingdom
580513,21991,BOHEMIAN COLLAGE STATIONERY SET,1,2011-12-04 13:59:00,1.25,14456.0,United Kingdom
580513,21990,MODERN FLORAL STATIONERY SET,1,2011-12-04 13:59:00,1.25,14456.0,United Kingdom
580513,22551,PLASTERS IN TIN SPACEBOY,1,2011-12-04 13:59:00,1.65,14456.0,United Kingdom
580513,22554,PLASTERS IN TIN WOODLAND ANIMALS,1,2011-12-04 13:59:00,1.65,14456.0,United Kingdom
580513,22553,PLASTERS IN TIN SKULLS,2,2011-12-04 13:59:00,1.65,14456.0,United Kingdom
580513,22557,PLASTERS IN TIN VINTAGE PAISLEY ,2,2011-12-04 13:59:00,1.65,14456.0,United Kingdom
580513,22511,RETROSPOT BABUSHKA DOORSTOP,2,2011-12-04 13:59:00,0.79,14456.0,United Kingdom
580513,22510,GINGHAM BABUSHKA DOORSTOP,2,2011-12-04 13:59:00,0.79,14456.0,United Kingdom
580513,22512,DOORSTOP RACING CAR DESIGN,1,2011-12-04 13:59:00,0.79,14456.0,United Kingdom
580513,22867,HAND WARMER BIRD DESIGN,2,2011-12-04 13:59:00,2.1,14456.0,United Kingdom
580513,22834,HAND WARMER BABUSHKA DESIGN,2,2011-12-04 13:59:00,2.1,14456.0,United Kingdom
580513,22865,HAND WARMER OWL DESIGN,2,2011-12-04 13:59:00,2.1,14456.0,United Kingdom
580513,22633,HAND WARMER UNION JACK,2,2011-12-04 13:59:00,2.1,14456.0,United Kingdom
580513,22600,CHRISTMAS RETROSPOT STAR WOOD,1,2011-12-04 13:59:00,0.85,14456.0,United Kingdom
580513,23209,LUNCH BAG VINTAGE DOILY ,1,2011-12-04 13:59:00,1.65,14456.0,United Kingdom
580513,82581,TOILET METAL SIGN,1,2011-12-04 13:59:00,0.55,14456.0,United Kingdom
580513,16225,RATTLE SNAKE EGGS,4,2011-12-04 13:59:00,0.39,14456.0,United Kingdom
580513,70006,LOVE HEART POCKET WARMER,1,2011-12-04 13:59:00,0.79,14456.0,United Kingdom
580513,22434,BALLOON PUMP WITH 10 BALLOONS,1,2011-12-04 13:59:00,1.95,14456.0,United Kingdom
580513,20973,12 PENCIL SMALL TUBE WOODLAND,2,2011-12-04 13:59:00,0.65,14456.0,United Kingdom
580513,20975,12 PENCILS SMALL TUBE RED RETROSPOT,2,2011-12-04 13:59:00,0.65,14456.0,United Kingdom
580513,23369,SET 36 COLOUR PENCILS LOVE LONDON,1,2011-12-04 13:59:00,1.25,14456.0,United Kingdom
580513,23371,SET 36 COLOUR PENCILS SPACEBOY ,1,2011-12-04 13:59:00,1.25,14456.0,United Kingdom
580513,20978,36 PENCILS TUBE SKULLS,2,2011-12-04 13:59:00,1.25,14456.0,United Kingdom
580513,23206,LUNCH BAG APPLE DESIGN,1,2011-12-04 13:59:00,1.65,14456.0,United Kingdom
580513,22811,SET OF 6 T-LIGHTS CACTI ,2,2011-12-04 13:59:00,1.25,14456.0,United Kingdom
580513,22099,CARAVAN SQUARE TISSUE BOX,2,2011-12-04 13:59:00,0.39,14456.0,United Kingdom
580513,23067,HANGING ENGRAVED METAL HEART,1,2011-12-04 13:59:00,4.15,14456.0,United Kingdom
580513,20992,JAZZ HEARTS PURSE NOTEBOOK,2,2011-12-04 13:59:00,0.39,14456.0,United Kingdom
580513,20996,JAZZ HEARTS ADDRESS BOOK,6,2011-12-04 13:59:00,0.19,14456.0,United Kingdom
580513,23697,A PRETTY THANK YOU CARD,12,2011-12-04 13:59:00,0.42,14456.0,United Kingdom
580513,23695,DOILY THANK YOU CARD,12,2011-12-04 13:59:00,0.42,14456.0,United Kingdom
580513,23310,BUBBLEGUM RING ASSORTED,36,2011-12-04 13:59:00,0.42,14456.0,United Kingdom
580513,21462,"NURSERY A,B,C PAINTED LETTERS",1,2011-12-04 13:59:00,1.95,14456.0,United Kingdom
580513,22645,CERAMIC HEART FAIRY CAKE MONEY BANK,4,2011-12-04 13:59:00,0.39,14456.0,United Kingdom
580513,47566,PARTY BUNTING,1,2011-12-04 13:59:00,4.95,14456.0,United Kingdom
580513,23298,SPOTTY BUNTING,1,2011-12-04 13:59:00,4.95,14456.0,United Kingdom
580513,23555,LANDMARK FRAME NOTTING HILL ,1,2011-12-04 13:59:00,12.5,14456.0,United Kingdom
580513,23320,GIANT 50'S CHRISTMAS CRACKER,3,2011-12-04 13:59:00,1.25,14456.0,United Kingdom
580514,22800,ANTIQUE TALL SWIRLGLASS TRINKET POT,1,2011-12-04 14:01:00,3.75,16905.0,United Kingdom
580514,21344,MOROCCAN BEATEN METAL DISH,1,2011-12-04 14:01:00,9.95,16905.0,United Kingdom
580514,23084,RABBIT NIGHT LIGHT,1,2011-12-04 14:01:00,2.08,16905.0,United Kingdom
580514,21790,VINTAGE SNAP CARDS,1,2011-12-04 14:01:00,0.85,16905.0,United Kingdom
580514,23482,PEARLISED IVORY HEART LARGE ,12,2011-12-04 14:01:00,1.65,16905.0,United Kingdom
580514,85048,15CM CHRISTMAS GLASS BALL 20 LIGHTS,2,2011-12-04 14:01:00,7.95,16905.0,United Kingdom
580514,22666,RECIPE BOX PANTRY YELLOW DESIGN,1,2011-12-04 14:01:00,2.95,16905.0,United Kingdom
580514,84879,ASSORTED COLOUR BIRD ORNAMENT,8,2011-12-04 14:01:00,1.69,16905.0,United Kingdom
580514,23491,VINTAGE JINGLE BELLS HEART,6,2011-12-04 14:01:00,8.25,16905.0,United Kingdom
580514,82486,3 DRAWER ANTIQUE WHITE WOOD CABINET,4,2011-12-04 14:01:00,8.95,16905.0,United Kingdom
580514,20828,GLITTER BUTTERFLY CLIPS,3,2011-12-04 14:01:00,2.55,16905.0,United Kingdom
580514,84949,SILVER HANGING T-LIGHT HOLDER,10,2011-12-04 14:01:00,1.65,16905.0,United Kingdom
580514,21390,FILIGRIS HEART WITH BUTTERFLY,6,2011-12-04 14:01:00,1.25,16905.0,United Kingdom
580514,22801,ANTIQUE GLASS PEDESTAL BOWL,1,2011-12-04 14:01:00,3.75,16905.0,United Kingdom
580514,23223,CHRISTMAS TREE HANGING SILVER ,15,2011-12-04 14:01:00,0.83,16905.0,United Kingdom
580514,23219,LAUREL STAR ANTIQUE SILVER ,15,2011-12-04 14:01:00,1.25,16905.0,United Kingdom
580514,22113,GREY HEART HOT WATER BOTTLE,5,2011-12-04 14:01:00,4.25,16905.0,United Kingdom
580514,23090,VINTAGE GLASS T-LIGHT HOLDER,20,2011-12-04 14:01:00,0.83,16905.0,United Kingdom
580514,23481,PEARLISED IVORY HEART SMALL ,12,2011-12-04 14:01:00,1.25,16905.0,United Kingdom
580514,22297,HEART IVORY TRELLIS SMALL,10,2011-12-04 14:01:00,1.25,16905.0,United Kingdom
580514,22296,HEART IVORY TRELLIS LARGE,6,2011-12-04 14:01:00,1.65,16905.0,United Kingdom
580514,22866,HAND WARMER SCOTTY DOG DESIGN,3,2011-12-04 14:01:00,2.1,16905.0,United Kingdom
580514,22865,HAND WARMER OWL DESIGN,3,2011-12-04 14:01:00,2.1,16905.0,United Kingdom
580514,23439,HAND WARMER RED LOVE HEART,6,2011-12-04 14:01:00,2.1,16905.0,United Kingdom
580514,22867,HAND WARMER BIRD DESIGN,6,2011-12-04 14:01:00,2.1,16905.0,United Kingdom
580514,21034,REX CASH+CARRY JUMBO SHOPPER,1,2011-12-04 14:01:00,0.95,16905.0,United Kingdom
580515,16012,FOOD/DRINK SPONGE STICKERS,1,2011-12-04 14:09:00,0.21,17750.0,United Kingdom
580515,22999,TRAVEL CARD WALLET VINTAGE LEAF,24,2011-12-04 14:09:00,0.42,17750.0,United Kingdom
580515,22695,WICKER WREATH SMALL,1,2011-12-04 14:09:00,0.59,17750.0,United Kingdom
580515,23100,SILVER BELLS TABLE DECORATION,1,2011-12-04 14:09:00,1.25,17750.0,United Kingdom
580515,21810,CHRISTMAS HANGING STAR WITH BELL,1,2011-12-04 14:09:00,0.39,17750.0,United Kingdom
580515,23004,TRAVEL CARD WALLET PANTRY,24,2011-12-04 14:09:00,0.42,17750.0,United Kingdom
580515,22994,TRAVEL CARD WALLET RETROSPOT,24,2011-12-04 14:09:00,0.42,17750.0,United Kingdom
580515,22997,TRAVEL CARD WALLET UNION JACK,24,2011-12-04 14:09:00,0.42,17750.0,United Kingdom
580515,22999,TRAVEL CARD WALLET VINTAGE LEAF,24,2011-12-04 14:09:00,0.42,17750.0,United Kingdom
580515,23000,TRAVEL CARD WALLET TRANSPORT,24,2011-12-04 14:09:00,0.42,17750.0,United Kingdom
580515,22998,TRAVEL CARD WALLET KEEP CALM,48,2011-12-04 14:09:00,0.42,17750.0,United Kingdom
580515,23005,TRAVEL CARD WALLET I LOVE LONDON,48,2011-12-04 14:09:00,0.42,17750.0,United Kingdom
580515,22996,TRAVEL CARD WALLET VINTAGE TICKET,24,2011-12-04 14:09:00,0.42,17750.0,United Kingdom
580516,23351,ROLL WRAP 50'S CHRISTMAS,5,2011-12-04 14:15:00,1.25,17954.0,United Kingdom
580516,23352,ROLL WRAP 50'S RED CHRISTMAS ,4,2011-12-04 14:15:00,1.25,17954.0,United Kingdom
580516,22895,SET OF 2 TEA TOWELS APPLE AND PEARS,1,2011-12-04 14:15:00,3.25,17954.0,United Kingdom
580516,22989,SET 2 PANTRY DESIGN TEA TOWELS,1,2011-12-04 14:15:00,3.25,17954.0,United Kingdom
580516,22581,WOOD STOCKING CHRISTMAS SCANDISPOT,4,2011-12-04 14:15:00,0.29,17954.0,United Kingdom
580516,22600,CHRISTMAS RETROSPOT STAR WOOD,4,2011-12-04 14:15:00,0.85,17954.0,United Kingdom
