InvoiceNo,StockCode,Description,Quantity,InvoiceDate,UnitPrice,CustomerID,Country
564817,20774,GREEN FERN NOTEBOOK,1,2011-08-30 12:02:00,1.63,,United Kingdom
564817,20775,DAISY NOTEBOOK ,1,2011-08-30 12:02:00,1.63,,United Kingdom
564817,20777,CHRYSANTHEMUM NOTEBOOK,1,2011-08-30 12:02:00,1.63,,United Kingdom
564817,20839,FRENCH PAISLEY CUSHION COVER ,2,2011-08-30 12:02:00,3.29,,United Kingdom
564817,20903,VINTAGE KEEPSAKE BOX TRAVELOGUE,3,2011-08-30 12:02:00,4.13,,United Kingdom
564817,20972,PINK CREAM FELT CRAFT TRINKET BOX ,2,2011-08-30 12:02:00,2.46,,United Kingdom
564817,21014,SWISS CHALET TREE DECORATION ,1,2011-08-30 12:02:00,1.25,,United Kingdom
564817,21094,SET/6 RED SPOTTY PAPER PLATES,12,2011-08-30 12:02:00,0.83,,United Kingdom
564817,21116,OWL DOORSTOP,1,2011-08-30 12:02:00,8.29,,United Kingdom
564817,21123,SET/10 IVORY POLKADOT PARTY CANDLES,4,2011-08-30 12:02:00,0.83,,United Kingdom
564817,21125,SET 6 FOOTBALL CELEBRATION CANDLES,2,2011-08-30 12:02:00,1.25,,United Kingdom
564817,21126,SET OF 6 GIRLS CELEBRATION CANDLES,2,2011-08-30 12:02:00,1.25,,United Kingdom
564817,21179,NO JUNK MAIL METAL SIGN,2,2011-08-30 12:02:00,1.63,,United Kingdom
564817,21194,PINK  HONEYCOMB PAPER FAN,14,2011-08-30 12:02:00,4.13,,United Kingdom
564817,21212,PACK OF 72 RETROSPOT CAKE CASES,1,2011-08-30 12:02:00,1.25,,United Kingdom
564817,21289,LARGE STRIPES CHOCOLATE GIFT BAG,1,2011-08-30 12:02:00,1.25,,United Kingdom
564817,21356,TOAST ITS - FAIRY FLOWER,5,2011-08-30 12:02:00,0.83,,United Kingdom
564817,21380,WOODEN HAPPY BIRTHDAY GARLAND,1,2011-08-30 12:02:00,5.79,,United Kingdom
564817,21422,PORCELAIN ROSE SMALL,1,2011-08-30 12:02:00,1.63,,United Kingdom
564817,21447,12 IVORY ROSE PEG PLACE SETTINGS,5,2011-08-30 12:02:00,2.46,,United Kingdom
564817,21471,STRAWBERRY RAFFIA FOOD COVER,2,2011-08-30 12:02:00,3.29,,United Kingdom
564817,21506,"FANCY FONT BIRTHDAY CARD, ",1,2011-08-30 12:02:00,0.83,,United Kingdom
564817,21519,GIN & TONIC DIET GREETING CARD ,2,2011-08-30 12:02:00,0.83,,United Kingdom
564817,21555,CERAMIC STRAWBERRY TRINKET TRAY,1,2011-08-30 12:02:00,2.46,,United Kingdom
564817,21558,SKULL LUNCH BOX WITH CUTLERY ,2,2011-08-30 12:02:00,4.96,,United Kingdom
564817,21683,MEDIUM MEDINA STAMPED METAL BOWL ,3,2011-08-30 12:02:00,5.79,,United Kingdom
564817,21684,SMALL MEDINA STAMPED METAL BOWL ,3,2011-08-30 12:02:00,2.46,,United Kingdom
564817,21725,SWEETIES  STICKERS,1,2011-08-30 12:02:00,1.63,,United Kingdom
564817,21739,COSY SLIPPER SHOES SMALL GREEN,1,2011-08-30 12:02:00,2.46,,United Kingdom
564817,21746,SMALL RED RETROSPOT WINDMILL,1,2011-08-30 12:02:00,2.46,,United Kingdom
564817,21786,POLKADOT RAIN HAT ,1,2011-08-30 12:02:00,0.83,,United Kingdom
564817,21787,RAIN PONCHO RETROSPOT,3,2011-08-30 12:02:00,1.63,,United Kingdom
564817,21801,CHRISTMAS TREE DECORATION WITH BELL,1,2011-08-30 12:02:00,0.42,,United Kingdom
564817,21802,CHRISTMAS TREE HEART DECORATION,1,2011-08-30 12:02:00,0.42,,United Kingdom
564817,21803,CHRISTMAS TREE STAR DECORATION,1,2011-08-30 12:02:00,0.42,,United Kingdom
564817,21880,RED RETROSPOT TAPE,1,2011-08-30 12:02:00,0.42,,United Kingdom
564817,21907,I'M ON HOLIDAY METAL SIGN,1,2011-08-30 12:02:00,4.13,,United Kingdom
564817,21922,UNION STRIPE WITH FRINGE  HAMMOCK,1,2011-08-30 12:02:00,16.63,,United Kingdom
564817,21929,JUMBO BAG PINK VINTAGE PAISLEY,2,2011-08-30 12:02:00,2.46,,United Kingdom
564817,21929,JUMBO BAG PINK VINTAGE PAISLEY,1,2011-08-30 12:02:00,4.13,,United Kingdom
564817,21931,JUMBO STORAGE BAG SUKI,3,2011-08-30 12:02:00,4.13,,United Kingdom
564817,21933,PINK VINTAGE PAISLEY PICNIC BAG,1,2011-08-30 12:02:00,2.46,,United Kingdom
564817,21934,SKULL SHOULDER BAG,3,2011-08-30 12:02:00,1.63,,United Kingdom
564817,21935,SUKI  SHOULDER BAG,5,2011-08-30 12:02:00,1.63,,United Kingdom
564817,21936,RED RETROSPOT PICNIC BAG,1,2011-08-30 12:02:00,5.79,,United Kingdom
564817,21977,PACK OF 60 PINK PAISLEY CAKE CASES,1,2011-08-30 12:02:00,1.25,,United Kingdom
564817,21986,PACK OF 12 PINK POLKADOT TISSUES,1,2011-08-30 12:02:00,0.83,,United Kingdom
564817,21990,MODERN FLORAL STATIONERY SET,2,2011-08-30 12:02:00,2.46,,United Kingdom
564817,21991,BOHEMIAN COLLAGE STATIONERY SET,2,2011-08-30 12:02:00,2.46,,United Kingdom
564817,21992,VINTAGE PAISLEY STATIONERY SET,2,2011-08-30 12:02:00,2.46,,United Kingdom
564817,21993,FLORAL FOLK STATIONERY SET,2,2011-08-30 12:02:00,2.46,,United Kingdom
564817,22023,EMPIRE BIRTHDAY CARD,1,2011-08-30 12:02:00,0.83,,United Kingdom
564817,22065,CHRISTMAS PUDDING TRINKET POT ,4,2011-08-30 12:02:00,3.29,,United Kingdom
564817,22074,6 RIBBONS SHIMMERING PINKS ,1,2011-08-30 12:02:00,1.25,,United Kingdom
564817,22076,6 RIBBONS EMPIRE  ,2,2011-08-30 12:02:00,1.25,,United Kingdom
564817,22077,6 RIBBONS RUSTIC CHARM,4,2011-08-30 12:02:00,3.29,,United Kingdom
564817,22082,RIBBON REEL STRIPES DESIGN ,1,2011-08-30 12:02:00,3.29,,United Kingdom
564817,22083,PAPER CHAIN KIT RETROSPOT,1,2011-08-30 12:02:00,5.79,,United Kingdom
564817,22098,BOUDOIR SQUARE TISSUE BOX,1,2011-08-30 12:02:00,2.46,,United Kingdom
564817,22116,METAL SIGN HIS DINNER IS SERVED,1,2011-08-30 12:02:00,1.63,,United Kingdom
564817,22124,SET OF 2 TEA TOWELS PING MICROWAVE,1,2011-08-30 12:02:00,2.46,,United Kingdom
564817,22129,PARTY CONES CANDY DECORATION,1,2011-08-30 12:02:00,2.46,,United Kingdom
564817,22144,CHRISTMAS CRAFT LITTLE FRIENDS,2,2011-08-30 12:02:00,4.13,,United Kingdom
564817,22149,FELTCRAFT 6 FLOWER FRIENDS,1,2011-08-30 12:02:00,4.13,,United Kingdom
564817,22169,FAMILY ALBUM WHITE PICTURE FRAME,2,2011-08-30 12:02:00,16.63,,United Kingdom
564817,22195,LARGE HEART MEASURING SPOONS,1,2011-08-30 12:02:00,3.29,,United Kingdom
564817,22327,ROUND SNACK BOXES SET OF 4 SKULLS,1,2011-08-30 12:02:00,5.79,,United Kingdom
564817,22356,CHARLOTTE BAG PINK POLKADOT,1,2011-08-30 12:02:00,1.63,,United Kingdom
564817,22378,WALL TIDY RETROSPOT ,1,2011-08-30 12:02:00,4.13,,United Kingdom
564817,22379,RECYCLING BAG RETROSPOT ,1,2011-08-30 12:02:00,4.13,,United Kingdom
564817,22384,LUNCH BAG PINK POLKADOT,3,2011-08-30 12:02:00,4.13,,United Kingdom
564817,22386,JUMBO BAG PINK POLKADOT,2,2011-08-30 12:02:00,4.13,,United Kingdom
564817,22413,METAL SIGN TAKE IT OR LEAVE IT ,1,2011-08-30 12:02:00,5.79,,United Kingdom
564817,22435,SET OF 9 HEART SHAPED BALLOONS,1,2011-08-30 12:02:00,2.46,,United Kingdom
564817,22446,PIN CUSHION BABUSHKA PINK,1,2011-08-30 12:02:00,2.46,,United Kingdom
564817,22449,SILK PURSE BABUSHKA PINK,1,2011-08-30 12:02:00,2.46,,United Kingdom
564817,22452,MEASURING TAPE BABUSHKA PINK,2,2011-08-30 12:02:00,1.63,,United Kingdom
564817,22460,EMBOSSED GLASS TEALIGHT HOLDER,3,2011-08-30 12:02:00,2.46,,United Kingdom
564817,22472,TV DINNER TRAY DOLLY GIRL,1,2011-08-30 12:02:00,10.79,,United Kingdom
564817,22474,SPACEBOY TV DINNER TRAY,1,2011-08-30 12:02:00,10.79,,United Kingdom
564817,22505,MEMO BOARD COTTAGE DESIGN,1,2011-08-30 12:02:00,10.79,,United Kingdom
564817,22551,PLASTERS IN TIN SPACEBOY,1,2011-08-30 12:02:00,3.29,,United Kingdom
564817,22554,PLASTERS IN TIN WOODLAND ANIMALS,1,2011-08-30 12:02:00,3.29,,United Kingdom
564817,22556,PLASTERS IN TIN CIRCUS PARADE ,1,2011-08-30 12:02:00,3.29,,United Kingdom
564817,22568,FELTCRAFT CUSHION OWL,2,2011-08-30 12:02:00,7.46,,United Kingdom
564817,22587,FELTCRAFT HAIRBAND RED AND BLUE,1,2011-08-30 12:02:00,1.63,,United Kingdom
564817,22605,WOODEN CROQUET GARDEN SET,1,2011-08-30 12:02:00,24.96,,United Kingdom
564817,82486,3 DRAWER ANTIQUE WHITE WOOD CABINET,2,2011-08-30 12:02:00,8.95,,United Kingdom
564817,22804,CANDLEHOLDER PINK HANGING HEART,4,2011-08-30 12:02:00,2.95,,United Kingdom
564817,23322,LARGE WHITE HEART OF WICKER,3,2011-08-30 12:02:00,2.95,,United Kingdom
564818,21121,SET/10 RED POLKADOT PARTY CANDLES,2,2011-08-30 12:10:00,2.46,,United Kingdom
564818,21123,SET/10 IVORY POLKADOT PARTY CANDLES,2,2011-08-30 12:10:00,0.83,,United Kingdom
564818,21128,GOLD FISHING GNOME,1,2011-08-30 12:10:00,12.46,,United Kingdom
564818,21147,JINGLE BELLS TREE DECORATION,1,2011-08-30 12:10:00,2.46,,United Kingdom
564818,21167,WHITE SAGE INCENSE,2,2011-08-30 12:10:00,0.42,,United Kingdom
564818,21172,PARTY METAL SIGN ,2,2011-08-30 12:10:00,4.13,,United Kingdom
564818,21238,RED RETROSPOT CUP,1,2011-08-30 12:10:00,1.63,,United Kingdom
564818,21246,RED RETROSPOT BIG BOWL,12,2011-08-30 12:10:00,4.13,,United Kingdom
564818,21288,STRIPEY CHOCOLATE NESTING BOXES,1,2011-08-30 12:10:00,3.29,,United Kingdom
564818,21326,AGED GLASS SILVER T-LIGHT HOLDER,1,2011-08-30 12:10:00,1.63,,United Kingdom
564818,21327,SKULLS WRITING SET ,1,2011-08-30 12:10:00,3.29,,United Kingdom
564818,21380,WOODEN HAPPY BIRTHDAY GARLAND,1,2011-08-30 12:10:00,5.79,,United Kingdom
564818,21429,RED GINGHAM ROSE JEWELLERY BOX,1,2011-08-30 12:10:00,4.13,,United Kingdom
564818,21458,2 PICTURE BOOK EGGS EASTER BUNNY,1,2011-08-30 12:10:00,2.46,,United Kingdom
564818,21471,STRAWBERRY RAFFIA FOOD COVER,3,2011-08-30 12:10:00,3.29,,United Kingdom
564818,21506,"FANCY FONT BIRTHDAY CARD, ",1,2011-08-30 12:10:00,0.83,,United Kingdom
564818,21507,ELEPHANT BIRTHDAY CARD ,2,2011-08-30 12:10:00,0.83,,United Kingdom
564818,21577,SAVE THE PLANET COTTON TOTE BAG,1,2011-08-30 12:10:00,4.96,,United Kingdom
564818,21581,SKULLS  DESIGN  COTTON TOTE BAG,1,2011-08-30 12:10:00,4.96,,United Kingdom
564818,21621,VINTAGE UNION JACK BUNTING,2,2011-08-30 12:10:00,16.63,,United Kingdom
564818,21672,WHITE SPOT RED CERAMIC DRAWER KNOB,4,2011-08-30 12:10:00,3.29,,United Kingdom
564818,21679,SKULLS  STICKERS,1,2011-08-30 12:10:00,1.63,,United Kingdom
564818,21733,RED HANGING HEART T-LIGHT HOLDER,1,2011-08-30 12:10:00,5.79,,United Kingdom
564818,21739,COSY SLIPPER SHOES SMALL GREEN,3,2011-08-30 12:10:00,2.46,,United Kingdom
564818,21773,DECORATIVE ROSE BATHROOM BOTTLE,1,2011-08-30 12:10:00,2.46,,United Kingdom
564818,21774,DECORATIVE CATS BATHROOM BOTTLE,1,2011-08-30 12:10:00,2.46,,United Kingdom
564818,21790,VINTAGE SNAP CARDS,1,2011-08-30 12:10:00,1.63,,United Kingdom
564818,21801,CHRISTMAS TREE DECORATION WITH BELL,4,2011-08-30 12:10:00,0.42,,United Kingdom
564818,21802,CHRISTMAS TREE HEART DECORATION,4,2011-08-30 12:10:00,0.42,,United Kingdom
564818,21803,CHRISTMAS TREE STAR DECORATION,7,2011-08-30 12:10:00,0.42,,United Kingdom
564818,21829,DINOSAUR KEYRINGS ASSORTED,1,2011-08-30 12:10:00,0.42,,United Kingdom
564818,21874,GIN AND TONIC MUG,1,2011-08-30 12:10:00,3.29,,United Kingdom
564818,21880,RED RETROSPOT TAPE,3,2011-08-30 12:10:00,0.42,,United Kingdom
564818,21889,WOODEN BOX OF DOMINOES,1,2011-08-30 12:10:00,2.46,,United Kingdom
564818,21918,SET 12 KIDS COLOUR  CHALK STICKS,1,2011-08-30 12:10:00,0.83,,United Kingdom
564818,21929,JUMBO BAG PINK VINTAGE PAISLEY,23,2011-08-30 12:10:00,2.46,,United Kingdom
564818,21931,JUMBO STORAGE BAG SUKI,5,2011-08-30 12:10:00,4.13,,United Kingdom
564818,21933,PINK VINTAGE PAISLEY PICNIC BAG,1,2011-08-30 12:10:00,2.46,,United Kingdom
564818,21934,SKULL SHOULDER BAG,11,2011-08-30 12:10:00,1.63,,United Kingdom
564818,21935,SUKI  SHOULDER BAG,15,2011-08-30 12:10:00,1.63,,United Kingdom
564818,21990,MODERN FLORAL STATIONERY SET,1,2011-08-30 12:10:00,2.46,,United Kingdom
564818,21992,VINTAGE PAISLEY STATIONERY SET,2,2011-08-30 12:10:00,2.46,,United Kingdom
564818,21993,FLORAL FOLK STATIONERY SET,2,2011-08-30 12:10:00,2.46,,United Kingdom
564818,22028,PENNY FARTHING BIRTHDAY CARD,1,2011-08-30 12:10:00,0.83,,United Kingdom
564818,22029,SPACEBOY BIRTHDAY CARD,2,2011-08-30 12:10:00,0.83,,United Kingdom
564818,22037,ROBOT BIRTHDAY CARD,1,2011-08-30 12:10:00,0.83,,United Kingdom
564818,22041,"RECORD FRAME 7"" SINGLE SIZE ",1,2011-08-30 12:10:00,4.96,,United Kingdom
564818,22068,BLACK PIRATE TREASURE CHEST,1,2011-08-30 12:10:00,3.29,,United Kingdom
564818,22074,6 RIBBONS SHIMMERING PINKS ,3,2011-08-30 12:10:00,1.25,,United Kingdom
564818,22099,CARAVAN SQUARE TISSUE BOX,1,2011-08-30 12:10:00,2.46,,United Kingdom
564818,22107,PIZZA PLATE IN BOX,1,2011-08-30 12:10:00,3.29,,United Kingdom
564818,22129,PARTY CONES CANDY DECORATION,3,2011-08-30 12:10:00,2.46,,United Kingdom
564818,22139,RETROSPOT TEA SET CERAMIC 11 PC ,1,2011-08-30 12:10:00,10.79,,United Kingdom
564818,22149,FELTCRAFT 6 FLOWER FRIENDS,1,2011-08-30 12:10:00,4.13,,United Kingdom
564818,22166,WALL MIRROR RECTANGLE DIAMANTE PINK,1,2011-08-30 12:10:00,7.46,,United Kingdom
564818,22169,FAMILY ALBUM WHITE PICTURE FRAME,1,2011-08-30 12:10:00,16.63,,United Kingdom
564818,22176,BLUE OWL SOFT TOY,1,2011-08-30 12:10:00,5.79,,United Kingdom
564818,22193,RED DINER WALL CLOCK,1,2011-08-30 12:10:00,16.63,,United Kingdom
564818,22195,LARGE HEART MEASURING SPOONS,1,2011-08-30 12:10:00,3.29,,United Kingdom
564818,22196,SMALL HEART MEASURING SPOONS,1,2011-08-30 12:10:00,1.63,,United Kingdom
564818,22197,POPCORN HOLDER,2,2011-08-30 12:10:00,1.63,,United Kingdom
564818,22203,MILK PAN RED RETROSPOT,1,2011-08-30 12:10:00,7.46,,United Kingdom
564818,22219,LOVEBIRD HANGING DECORATION WHITE ,1,2011-08-30 12:10:00,1.63,,United Kingdom
564818,22230,JIGSAW TREE WITH WATERING CAN,1,2011-08-30 12:10:00,1.63,,United Kingdom
564818,22231,JIGSAW TREE WITH BIRDHOUSE,1,2011-08-30 12:10:00,3.29,,United Kingdom
564818,22255,FELT TOADSTOOL  SMALL,1,2011-08-30 12:10:00,1.63,,United Kingdom
564818,22257,FELT FARM ANIMAL SHEEP,1,2011-08-30 12:10:00,2.46,,United Kingdom
564818,22258,FELT FARM ANIMAL RABBIT,1,2011-08-30 12:10:00,2.46,,United Kingdom
564818,22348,TEA BAG PLATE RED RETROSPOT,1,2011-08-30 12:10:00,1.63,,United Kingdom
564818,22355,CHARLOTTE BAG SUKI DESIGN,16,2011-08-30 12:10:00,1.63,,United Kingdom
564818,22356,CHARLOTTE BAG PINK POLKADOT,5,2011-08-30 12:10:00,1.63,,United Kingdom
564818,22371,AIRLINE BAG VINTAGE TOKYO 78,1,2011-08-30 12:10:00,8.29,,United Kingdom
564818,22378,WALL TIDY RETROSPOT ,1,2011-08-30 12:10:00,4.13,,United Kingdom
564818,22379,RECYCLING BAG RETROSPOT ,2,2011-08-30 12:10:00,4.13,,United Kingdom
564818,22382,LUNCH BAG SPACEBOY DESIGN ,1,2011-08-30 12:10:00,4.13,,United Kingdom
564818,22383,LUNCH BAG SUKI DESIGN ,2,2011-08-30 12:10:00,4.13,,United Kingdom
564818,22413,METAL SIGN TAKE IT OR LEAVE IT ,1,2011-08-30 12:10:00,5.79,,United Kingdom
564818,22446,PIN CUSHION BABUSHKA PINK,1,2011-08-30 12:10:00,2.46,,United Kingdom
564818,22457,NATURAL SLATE HEART CHALKBOARD ,1,2011-08-30 12:10:00,5.79,,United Kingdom
564818,22475,SKULL DESIGN TV DINNER TRAY,1,2011-08-30 12:10:00,10.79,,United Kingdom
564818,22486,PLASMATRONIC LAMP,3,2011-08-30 12:10:00,8.29,,United Kingdom
564818,22494,EMERGENCY FIRST AID TIN ,1,2011-08-30 12:10:00,2.46,,United Kingdom
564818,22497,SET OF 2 TINS VINTAGE BATHROOM ,1,2011-08-30 12:10:00,8.29,,United Kingdom
564818,22507,MEMO BOARD RETROSPOT  DESIGN,2,2011-08-30 12:10:00,10.79,,United Kingdom
564818,22508,DOORSTOP RETROSPOT HEART,1,2011-08-30 12:10:00,7.46,,United Kingdom
564818,22553,PLASTERS IN TIN SKULLS,1,2011-08-30 12:10:00,3.29,,United Kingdom
564818,22555,PLASTERS IN TIN STRONGMAN,2,2011-08-30 12:10:00,3.29,,United Kingdom
564818,22565,FELTCRAFT HAIRBANDS PINK AND WHITE ,1,2011-08-30 12:10:00,1.63,,United Kingdom
564818,22566,FELTCRAFT HAIRBAND PINK AND PURPLE,1,2011-08-30 12:10:00,1.63,,United Kingdom
564818,22602,RETROSPOT WOODEN HEART DECORATION,1,2011-08-30 12:10:00,1.63,,United Kingdom
564818,22608,PENS ASSORTED FUNKY JEWELED ,16,2011-08-30 12:10:00,0.42,,United Kingdom
564818,22631,CIRCUS PARADE LUNCH BOX ,1,2011-08-30 12:10:00,4.13,,United Kingdom
564818,22651,GENTLEMAN SHIRT REPAIR KIT ,1,2011-08-30 12:10:00,1.63,,United Kingdom
564818,22652,TRAVEL SEWING KIT,1,2011-08-30 12:10:00,3.29,,United Kingdom
564818,22653,BUTTON BOX ,1,2011-08-30 12:10:00,1.63,,United Kingdom
564818,22659,LUNCH BOX I LOVE LONDON,1,2011-08-30 12:10:00,4.13,,United Kingdom
564818,22666,RECIPE BOX PANTRY YELLOW DESIGN,1,2011-08-30 12:10:00,5.79,,United Kingdom
564818,22701,PINK DOG BOWL,2,2011-08-30 12:10:00,2.46,,United Kingdom
564818,22703,PINK CAT BOWL,1,2011-08-30 12:10:00,1.63,,United Kingdom
564818,22712,CARD DOLLY GIRL ,1,2011-08-30 12:10:00,0.83,,United Kingdom
564818,22715,CARD WEDDING DAY,1,2011-08-30 12:10:00,0.83,,United Kingdom
564818,22718,CARD CAT AND TREE ,1,2011-08-30 12:10:00,0.83,,United Kingdom
564818,22720,SET OF 3 CAKE TINS PANTRY DESIGN ,2,2011-08-30 12:10:00,10.79,,United Kingdom
564818,22763,KEY CABINET MA CAMPAGNE,2,2011-08-30 12:10:00,19.96,,United Kingdom
564818,22766,PHOTO FRAME CORNICE,2,2011-08-30 12:10:00,5.79,,United Kingdom
564818,22772,PINK DRAWER KNOB ACRYLIC EDWARDIAN,10,2011-08-30 12:10:00,2.46,,United Kingdom
564818,22791,T-LIGHT GLASS FLUTED ANTIQUE,1,2011-08-30 12:10:00,2.46,,United Kingdom
564818,22812,PACK 3 BOXES CHRISTMAS PANNETONE,1,2011-08-30 12:10:00,4.13,,United Kingdom
564818,22814,CARD PARTY GAMES ,6,2011-08-30 12:10:00,0.42,,United Kingdom
564818,22815,CARD PSYCHEDELIC APPLES,15,2011-08-30 12:10:00,0.42,,United Kingdom
564818,22817,CARD SUKI BIRTHDAY,8,2011-08-30 12:10:00,0.42,,United Kingdom
564818,22819,"BIRTHDAY CARD, RETRO SPOT",3,2011-08-30 12:10:00,0.42,,United Kingdom
564818,22831,WHITE BROCANTE SOAP DISH,1,2011-08-30 12:10:00,5.79,,United Kingdom
564818,22844,VINTAGE CREAM DOG FOOD CONTAINER,1,2011-08-30 12:10:00,16.63,,United Kingdom
564818,22865,HAND WARMER OWL DESIGN,1,2011-08-30 12:10:00,4.13,,United Kingdom
564818,22902,TOTE BAG I LOVE LONDON,2,2011-08-30 12:10:00,4.13,,United Kingdom
564818,22906,12 MESSAGE CARDS WITH ENVELOPES,2,2011-08-30 12:10:00,3.29,,United Kingdom
564818,22907,PACK OF 20 NAPKINS PANTRY DESIGN,1,2011-08-30 12:10:00,1.63,,United Kingdom
564818,22936,BAKING MOULD ROSE WHITE CHOCOLATE,1,2011-08-30 12:10:00,6.63,,United Kingdom
564818,22945,CHRISTMAS METAL TAGS ASSORTED ,6,2011-08-30 12:10:00,1.8,,United Kingdom
564818,22952,60 CAKE CASES VINTAGE CHRISTMAS,2,2011-08-30 12:10:00,1.25,,United Kingdom
564818,22964,3 PIECE SPACEBOY COOKIE CUTTER SET,1,2011-08-30 12:10:00,4.13,,United Kingdom
564818,22966,GINGERBREAD MAN COOKIE CUTTER,2,2011-08-30 12:10:00,2.46,,United Kingdom
564818,22989,SET 2 PANTRY DESIGN TEA TOWELS,1,2011-08-30 12:10:00,6.63,,United Kingdom
564818,22996,TRAVEL CARD WALLET VINTAGE TICKET,1,2011-08-30 12:10:00,0.83,,United Kingdom
564818,23000,TRAVEL CARD WALLET TRANSPORT,1,2011-08-30 12:10:00,0.83,,United Kingdom
564818,23004,TRAVEL CARD WALLET PANTRY,1,2011-08-30 12:10:00,0.83,,United Kingdom
564818,23084,RABBIT NIGHT LIGHT,2,2011-08-30 12:10:00,4.13,,United Kingdom
564818,23093,SMALL PARISIENNE HEART PHOTO FRAME ,1,2011-08-30 12:10:00,4.96,,United Kingdom
564818,23109,PACK OF SIX LED TEA LIGHTS,1,2011-08-30 12:10:00,5.79,,United Kingdom
564818,23165,LARGE CERAMIC TOP STORAGE JAR,1,2011-08-30 12:10:00,3.29,,United Kingdom
564818,23182,TOILET SIGN OCCUPIED OR VACANT,1,2011-08-30 12:10:00,2.46,,United Kingdom
564818,23197,SKETCHBOOK MAGNETIC SHOPPING LIST,1,2011-08-30 12:10:00,3.29,,United Kingdom
564818,23206,LUNCH BAG APPLE DESIGN,1,2011-08-30 12:10:00,4.13,,United Kingdom
564818,23208,LUNCH BAG VINTAGE LEAF DESIGN,1,2011-08-30 12:10:00,4.13,,United Kingdom
564818,23240,SET OF 4 KNICK KNACK TINS DOILY ,1,2011-08-30 12:10:00,8.29,,United Kingdom
564818,23242,TREASURE TIN BUFFALO BILL ,1,2011-08-30 12:10:00,4.13,,United Kingdom
564818,23275,SET OF 3 HANGING OWLS OLLIE BEAK,2,2011-08-30 12:10:00,2.46,,United Kingdom
564818,23295,SET OF 12 MINI LOAF BAKING CASES,2,2011-08-30 12:10:00,2.46,,United Kingdom
564818,23300,GARDENERS KNEELING PAD CUP OF TEA ,1,2011-08-30 12:10:00,3.29,,United Kingdom
564818,23308,SET OF 60 VINTAGE LEAF CAKE CASES ,1,2011-08-30 12:10:00,1.25,,United Kingdom
564818,23326,HANGING MINI COLOURED BOTTLES,1,2011-08-30 12:10:00,8.29,,United Kingdom
564818,23328,SET 6 SCHOOL MILK BOTTLES IN CRATE,3,2011-08-30 12:10:00,7.46,,United Kingdom
564818,23329,DECORATIVE WICKER HEART LARGE,1,2011-08-30 12:10:00,3.29,,United Kingdom
564818,23330,DECORATIVE WICKER HEART MEDIUM,2,2011-08-30 12:10:00,2.46,,United Kingdom
564818,23331,DECORATIVE WICKER HEART SMALL,1,2011-08-30 12:10:00,1.25,,United Kingdom
564818,23345, DOLLY GIRL BEAKER,2,2011-08-30 12:10:00,2.46,,United Kingdom
564818,23346,SPACEBOY BEAKER,1,2011-08-30 12:10:00,2.46,,United Kingdom
564818,23348,CHILDRENS TOY COOKING UTENSIL SET,1,2011-08-30 12:10:00,4.13,,United Kingdom
564818,23350,ROLL WRAP VINTAGE SPOT ,1,2011-08-30 12:10:00,2.46,,United Kingdom
564818,37450,CERAMIC CAKE BOWL + HANGING CAKES,1,2011-08-30 12:10:00,5.79,,United Kingdom
564818,46776A,WOVEN BUBBLE GUM CUSHION COVER,1,2011-08-30 12:10:00,4.13,,United Kingdom
564818,47563A,RETRO LONGBOARD IRONING BOARD COVER,1,2011-08-30 12:10:00,3.29,,United Kingdom
564818,47585A,PINK FAIRY CAKE CUSHION COVER,1,2011-08-30 12:10:00,9.96,,United Kingdom
564818,47593B,SCOTTIE DOGS BABY BIB,1,2011-08-30 12:10:00,0.83,,United Kingdom
564818,48188,DOORMAT WELCOME PUPPIES,1,2011-08-30 12:10:00,15.79,,United Kingdom
564818,51014A,"FEATHER PEN,HOT PINK",1,2011-08-30 12:10:00,0.83,,United Kingdom
564818,51014L,"FEATHER PEN,LIGHT PINK",2,2011-08-30 12:10:00,0.83,,United Kingdom
564818,71477,COLOUR GLASS. STAR T-LIGHT HOLDER,2,2011-08-30 12:10:00,6.63,,United Kingdom
564818,72807A,SET/3 ROSE CANDLE IN JEWELLED BOX,1,2011-08-30 12:10:00,8.29,,United Kingdom
564818,72816,SET/3 CHRISTMAS DECOUPAGE CANDLES,1,2011-08-30 12:10:00,2.46,,United Kingdom
564818,82482,WOODEN PICTURE FRAME WHITE FINISH,16,2011-08-30 12:10:00,2.55,,United Kingdom
564818,82551,LAUNDRY 15C METAL SIGN,1,2011-08-30 12:10:00,2.46,,United Kingdom
564818,82580,BATHROOM METAL SIGN,1,2011-08-30 12:10:00,1.25,,United Kingdom
564818,82581,TOILET METAL SIGN,1,2011-08-30 12:10:00,1.25,,United Kingdom
564818,82600,NO SINGING METAL SIGN,1,2011-08-30 12:10:00,4.13,,United Kingdom
564818,84347,ROTATING SILVER ANGELS T-LIGHT HLDR,1,2011-08-30 12:10:00,4.96,,United Kingdom
564818,84568,GIRLS ALPHABET IRON ON PATCHES ,26,2011-08-30 12:10:00,0.42,,United Kingdom
564818,84596F,SMALL MARSHMALLOWS PINK BOWL,1,2011-08-30 12:10:00,0.83,,United Kingdom
564818,84596G,SMALL CHOCOLATES PINK BOWL,1,2011-08-30 12:10:00,0.83,,United Kingdom
564818,84609,TALL ROCOCO CANDLE HOLDER,1,2011-08-30 12:10:00,16.63,,United Kingdom
564818,84659A,WHITE TRAVEL ALARM CLOCK,2,2011-08-30 12:10:00,2.46,,United Kingdom
564818,84692,BOX OF 24 COCKTAIL PARASOLS,1,2011-08-30 12:10:00,0.83,,United Kingdom
564818,84792,ENCHANTED BIRD COATHANGER 5 HOOK,1,2011-08-30 12:10:00,9.13,,United Kingdom
564818,84912A,PINK ROSE WASHBAG,1,2011-08-30 12:10:00,3.29,,United Kingdom
564818,84913A,SOFT PINK ROSE TOWEL ,2,2011-08-30 12:10:00,3.29,,United Kingdom
564818,84923,PINK BUTTERFLY HANDBAG W BOBBLES,1,2011-08-30 12:10:00,4.13,,United Kingdom
564818,84931B,BLUE SCOTTIE DOG W FLOWER PATTERN,1,2011-08-30 12:10:00,4.96,,United Kingdom
564818,84945,MULTI COLOUR SILVER T-LIGHT HOLDER,6,2011-08-30 12:10:00,1.8,,United Kingdom
564818,84988,SET OF 72 PINK HEART PAPER DOILIES,1,2011-08-30 12:10:00,2.92,,United Kingdom
564818,85032D,YULETIDE IMAGES GIFT WRAP SET,1,2011-08-30 12:10:00,1.63,,United Kingdom
564818,85039C,S/4 BLACK MINI ROSE CANDLE IN BOWL,2,2011-08-30 12:10:00,1.63,,United Kingdom
564818,85040A,S/4 PINK FLOWER CANDLES IN BOWL,1,2011-08-30 12:10:00,3.29,,United Kingdom
564818,85049H,URBAN BLACK RIBBONS ,4,2011-08-30 12:10:00,0.83,,United Kingdom
564818,85078,SCANDINAVIAN 3 HEARTS NAPKIN RING,1,2011-08-30 12:10:00,1.63,,United Kingdom
564818,85099B,JUMBO BAG RED RETROSPOT,5,2011-08-30 12:10:00,4.13,,United Kingdom
564818,85129D,BEADED CRYSTAL HEART PINK SMALL,1,2011-08-30 12:10:00,2.46,,United Kingdom
564818,85131B,BEADED CRYSTAL HEART GREEN ON STICK,2,2011-08-30 12:10:00,0.83,,United Kingdom
564818,85131D,BEADED CRYSTAL HEART PINK ON STICK,4,2011-08-30 12:10:00,0.83,,United Kingdom
564818,85177,BASKET OF FLOWERS SEWING KIT,1,2011-08-30 12:10:00,1.63,,United Kingdom
564818,85227,SET OF 6 3D KIT CARDS FOR KIDS,1,2011-08-30 12:10:00,1.63,,United Kingdom
564818,90132,LIGHT TOPAZ TEAL/AQUA COL NECKLACE,1,2011-08-30 12:10:00,4.98,,United Kingdom
564818,90214J,"LETTER ""J"" BLING KEY RING",1,2011-08-30 12:10:00,0.83,,United Kingdom
564818,DOT,DOTCOM POSTAGE,1,2011-08-30 12:10:00,192.71,,United Kingdom
564818,10133,COLOURING PENCILS BROWN TUBE,3,2011-08-30 12:10:00,0.83,,United Kingdom
564818,15036,ASSORTED COLOURS SILK FAN,8,2011-08-30 12:10:00,1.63,,United Kingdom
564818,16219,HOUSE SHAPE PENCIL SHARPENER,4,2011-08-30 12:10:00,0.83,,United Kingdom
564818,16235,RECYCLED PENCIL WITH RABBIT ERASER,16,2011-08-30 12:10:00,0.42,,United Kingdom
564818,16237,SLEEPING CAT ERASERS,16,2011-08-30 12:10:00,0.42,,United Kingdom
564818,17012B,ORIGAMI JASMINE INCENSE/CANDLE SET,1,2011-08-30 12:10:00,2.46,,United Kingdom
564818,17084N,FAIRY DREAMS INCENSE ,1,2011-08-30 12:10:00,0.42,,United Kingdom
564818,20618,QUEEN OF THE SKIES PASSPORT COVER ,1,2011-08-30 12:10:00,4.13,,United Kingdom
564818,20619,TROPICAL PASSPORT COVER ,1,2011-08-30 12:10:00,4.13,,United Kingdom
564818,20674,GREEN POLKADOT BOWL,1,2011-08-30 12:10:00,2.46,,United Kingdom
564818,20675,BLUE POLKADOT BOWL,1,2011-08-30 12:10:00,2.46,,United Kingdom
564818,20676,RED RETROSPOT BOWL,1,2011-08-30 12:10:00,2.46,,United Kingdom
564818,20719,WOODLAND CHARLOTTE BAG,1,2011-08-30 12:10:00,1.63,,United Kingdom
564818,20723,STRAWBERRY CHARLOTTE BAG,1,2011-08-30 12:10:00,1.63,,United Kingdom
564818,20724,RED RETROSPOT CHARLOTTE BAG,5,2011-08-30 12:10:00,1.63,,United Kingdom
564818,20726,LUNCH BAG WOODLAND,1,2011-08-30 12:10:00,4.13,,United Kingdom
564818,20733,GOLD MINI TAPE MEASURE ,1,2011-08-30 12:10:00,0.83,,United Kingdom
564818,20775,DAISY NOTEBOOK ,1,2011-08-30 12:10:00,1.63,,United Kingdom
564818,20839,FRENCH PAISLEY CUSHION COVER ,1,2011-08-30 12:10:00,3.29,,United Kingdom
564818,21003,ROSE DU SUD CUSHION COVER,2,2011-08-30 12:10:00,5.79,,United Kingdom
564818,21080,SET/20 RED RETROSPOT PAPER NAPKINS ,1,2011-08-30 12:10:00,1.63,,United Kingdom
564818,85123A,WHITE HANGING HEART T-LIGHT HOLDER,6,2011-08-30 12:10:00,2.95,,United Kingdom
564818,82483,WOOD 2 DRAWER CABINET WHITE FINISH,5,2011-08-30 12:10:00,6.95,,United Kingdom
564819,23084,RABBIT NIGHT LIGHT,48,2011-08-30 12:11:00,1.79,12814.0,Poland
564819,POST,POSTAGE,1,2011-08-30 12:11:00,40.0,12814.0,Poland
