InvoiceNo,StockCode,Description,Quantity,InvoiceDate,UnitPrice,CustomerID,Country
555343,21559,STRAWBERRY LUNCH BOX WITH CUTLERY,12,2011-06-02 11:42:00,2.55,15918.0,United Kingdom
555343,22352,LUNCH BOX WITH CUTLERY RETROSPOT ,14,2011-06-02 11:42:00,2.55,15918.0,United Kingdom
555343,21561,DINOSAUR LUNCH BOX WITH CUTLERY,12,2011-06-02 11:42:00,2.55,15918.0,United Kingdom
555343,22243,5 HOOK HANGER RED MAGIC TOADSTOOL,6,2011-06-02 11:42:00,1.65,15918.0,United Kingdom
555343,22244,3 HOOK HANGER MAGIC GARDEN,3,2011-06-02 11:42:00,1.95,15918.0,United Kingdom
555343,23146,TRIPLE HOOK ANTIQUE IVORY ROSE,2,2011-06-02 11:42:00,3.29,15918.0,United Kingdom
555343,21272,SALLE DE BAIN HOOK,1,2011-06-02 11:42:00,1.25,15918.0,United Kingdom
555343,21558,SKULL LUNCH BOX WITH CUTLERY ,4,2011-06-02 11:42:00,2.55,15918.0,United Kingdom
555343,22631,CIRCUS PARADE LUNCH BOX ,4,2011-06-02 11:42:00,1.95,15918.0,United Kingdom
555343,22898,CHILDRENS APRON APPLES DESIGN,3,2011-06-02 11:42:00,1.95,15918.0,United Kingdom
555343,22367,CHILDRENS APRON SPACEBOY DESIGN,1,2011-06-02 11:42:00,1.95,15918.0,United Kingdom
555343,22319,HAIRCLIPS FORTIES FABRIC ASSORTED,12,2011-06-02 11:42:00,0.65,15918.0,United Kingdom
555343,22318,FIVE HEART HANGING DECORATION,2,2011-06-02 11:42:00,2.95,15918.0,United Kingdom
555343,79191C,RETRO PLASTIC ELEPHANT TRAY,2,2011-06-02 11:42:00,0.85,15918.0,United Kingdom
555343,22853,CAT BOWL VINTAGE CREAM,2,2011-06-02 11:42:00,3.25,15918.0,United Kingdom
555343,22176,BLUE OWL SOFT TOY,3,2011-06-02 11:42:00,2.95,15918.0,United Kingdom
555343,22175,PINK OWL SOFT TOY,3,2011-06-02 11:42:00,2.95,15918.0,United Kingdom
555343,22845,VINTAGE CREAM CAT FOOD CONTAINER,1,2011-06-02 11:42:00,6.35,15918.0,United Kingdom
C555341,85141,JARDIN ETCHED GLASS FRUITBOWL,-4,2011-06-02 11:42:00,3.95,13004.0,United Kingdom
C555342,21399,BLUE POLKADOT COFFEE MUG,-48,2011-06-02 11:42:00,0.39,17578.0,United Kingdom
555344,23201,JUMBO BAG ALPHABET,100,2011-06-02 11:45:00,1.79,15311.0,United Kingdom
555344,22090,PAPER BUNTING RETROSPOT,40,2011-06-02 11:45:00,2.55,15311.0,United Kingdom
555344,84509A,SET OF 4 ENGLISH ROSE PLACEMATS,24,2011-06-02 11:45:00,2.95,15311.0,United Kingdom
555344,85099C,JUMBO  BAG BAROQUE BLACK WHITE,100,2011-06-02 11:45:00,1.79,15311.0,United Kingdom
555344,23208,LUNCH BAG VINTAGE LEAF DESIGN,50,2011-06-02 11:45:00,1.65,15311.0,United Kingdom
555344,23199,JUMBO BAG APPLES,100,2011-06-02 11:45:00,1.79,15311.0,United Kingdom
555344,22386,JUMBO BAG PINK POLKADOT,100,2011-06-02 11:45:00,1.79,15311.0,United Kingdom
555344,21929,JUMBO BAG PINK VINTAGE PAISLEY,100,2011-06-02 11:45:00,1.79,15311.0,United Kingdom
555344,20727,LUNCH BAG  BLACK SKULL.,100,2011-06-02 11:45:00,1.45,15311.0,United Kingdom
555344,20712,JUMBO BAG WOODLAND ANIMALS,100,2011-06-02 11:45:00,1.79,15311.0,United Kingdom
555344,20718,RED RETROSPOT SHOPPER BAG,2,2011-06-02 11:45:00,1.25,15311.0,United Kingdom
555344,22896,PEG BAG APPLES DESIGN,1,2011-06-02 11:45:00,2.55,15311.0,United Kingdom
555344,20719,WOODLAND CHARLOTTE BAG,1,2011-06-02 11:45:00,0.85,15311.0,United Kingdom
555344,23205,CHARLOTTE BAG VINTAGE ALPHABET ,2,2011-06-02 11:45:00,0.85,15311.0,United Kingdom
555344,20726,LUNCH BAG WOODLAND,1,2011-06-02 11:45:00,1.65,15311.0,United Kingdom
555344,20723,STRAWBERRY CHARLOTTE BAG,1,2011-06-02 11:45:00,0.85,15311.0,United Kingdom
555344,85099F,JUMBO BAG STRAWBERRY,5,2011-06-02 11:45:00,2.08,15311.0,United Kingdom
555344,23256,CHILDRENS CUTLERY SPACEBOY ,2,2011-06-02 11:45:00,4.15,15311.0,United Kingdom
555344,22382,LUNCH BAG SPACEBOY DESIGN ,4,2011-06-02 11:45:00,1.65,15311.0,United Kingdom
555344,20728,LUNCH BAG CARS BLUE,1,2011-06-02 11:45:00,1.65,15311.0,United Kingdom
555344,22384,LUNCH BAG PINK POLKADOT,1,2011-06-02 11:45:00,1.65,15311.0,United Kingdom
555344,22139,RETROSPOT TEA SET CERAMIC 11 PC ,1,2011-06-02 11:45:00,4.95,15311.0,United Kingdom
555344,21670,BLUE SPOT CERAMIC DRAWER KNOB,1,2011-06-02 11:45:00,1.25,15311.0,United Kingdom
555344,23084,RABBIT NIGHT LIGHT,2,2011-06-02 11:45:00,2.08,15311.0,United Kingdom
555344,15056BL,EDWARDIAN PARASOL BLACK,1,2011-06-02 11:45:00,5.95,15311.0,United Kingdom
555344,22752,SET 7 BABUSHKA NESTING BOXES,1,2011-06-02 11:45:00,8.5,15311.0,United Kingdom
555344,84692,BOX OF 24 COCKTAIL PARASOLS,1,2011-06-02 11:45:00,0.42,15311.0,United Kingdom
555344,22757,LARGE RED BABUSHKA NOTEBOOK ,1,2011-06-02 11:45:00,1.25,15311.0,United Kingdom
555344,22758,LARGE PURPLE BABUSHKA NOTEBOOK  ,1,2011-06-02 11:45:00,1.25,15311.0,United Kingdom
555344,22756,LARGE YELLOW BABUSHKA NOTEBOOK ,1,2011-06-02 11:45:00,1.25,15311.0,United Kingdom
C555345,22630,DOLLY GIRL LUNCH BOX,-2,2011-06-02 11:51:00,1.95,13267.0,United Kingdom
C555346,22636,CHILDS BREAKFAST SET CIRCUS PARADE,-1,2011-06-02 11:54:00,8.5,12710.0,Germany
C555346,22634,CHILDS BREAKFAST SET SPACEBOY ,-1,2011-06-02 11:54:00,9.95,12710.0,Germany
555347,22383,LUNCH BAG SUKI DESIGN ,20,2011-06-02 12:04:00,1.65,14389.0,United Kingdom
555347,20718,RED RETROSPOT SHOPPER BAG,10,2011-06-02 12:04:00,1.25,14389.0,United Kingdom
555347,22814,CARD PARTY GAMES ,12,2011-06-02 12:04:00,0.42,14389.0,United Kingdom
555347,22467,GUMBALL COAT RACK,6,2011-06-02 12:04:00,2.55,14389.0,United Kingdom
555347,23065,LARGE DECO JEWELLERY STAND,1,2011-06-02 12:04:00,12.5,14389.0,United Kingdom
555347,23208,LUNCH BAG VINTAGE LEAF DESIGN,10,2011-06-02 12:04:00,1.65,14389.0,United Kingdom
555347,23205,CHARLOTTE BAG VINTAGE ALPHABET ,10,2011-06-02 12:04:00,0.85,14389.0,United Kingdom
555347,22661,CHARLOTTE BAG DOLLY GIRL DESIGN,10,2011-06-02 12:04:00,0.85,14389.0,United Kingdom
555347,23204,CHARLOTTE BAG APPLES DESIGN,10,2011-06-02 12:04:00,0.85,14389.0,United Kingdom
555347,85099C,JUMBO  BAG BAROQUE BLACK WHITE,10,2011-06-02 12:04:00,2.08,14389.0,United Kingdom
555347,22663,JUMBO BAG DOLLY GIRL DESIGN,10,2011-06-02 12:04:00,2.08,14389.0,United Kingdom
555347,23200,JUMBO BAG PEARS,10,2011-06-02 12:04:00,2.08,14389.0,United Kingdom
555347,22386,JUMBO BAG PINK POLKADOT,10,2011-06-02 12:04:00,2.08,14389.0,United Kingdom
555347,23199,JUMBO BAG APPLES,10,2011-06-02 12:04:00,2.08,14389.0,United Kingdom
555347,85099B,JUMBO BAG RED RETROSPOT,10,2011-06-02 12:04:00,2.08,14389.0,United Kingdom
555347,23207,LUNCH BAG ALPHABET DESIGN,10,2011-06-02 12:04:00,1.65,14389.0,United Kingdom
555347,20728,LUNCH BAG CARS BLUE,10,2011-06-02 12:04:00,1.65,14389.0,United Kingdom
555347,22384,LUNCH BAG PINK POLKADOT,10,2011-06-02 12:04:00,1.65,14389.0,United Kingdom
555347,23206,LUNCH BAG APPLE DESIGN,10,2011-06-02 12:04:00,1.65,14389.0,United Kingdom
555348,15056P,EDWARDIAN PARASOL PINK,2,2011-06-02 12:06:00,5.95,15184.0,United Kingdom
555348,20679,EDWARDIAN PARASOL RED,2,2011-06-02 12:06:00,5.95,15184.0,United Kingdom
555348,15056BL,EDWARDIAN PARASOL BLACK,2,2011-06-02 12:06:00,5.95,15184.0,United Kingdom
555348,15056N,EDWARDIAN PARASOL NATURAL,3,2011-06-02 12:06:00,5.95,15184.0,United Kingdom
555348,22191,IVORY DINER WALL CLOCK,2,2011-06-02 12:06:00,8.5,15184.0,United Kingdom
555348,23104,IVORY CAFE HANGING LAMP ,1,2011-06-02 12:06:00,12.5,15184.0,United Kingdom
555348,21485,RETROSPOT HEART HOT WATER BOTTLE,1,2011-06-02 12:06:00,4.95,15184.0,United Kingdom
555348,22113,GREY HEART HOT WATER BOTTLE,1,2011-06-02 12:06:00,3.75,15184.0,United Kingdom
555348,20748,KENSINGTON COFFEE SET,2,2011-06-02 12:06:00,12.75,15184.0,United Kingdom
555348,10133,COLOURING PENCILS BROWN TUBE,10,2011-06-02 12:06:00,0.85,15184.0,United Kingdom
555348,10135,COLOURING PENCILS BROWN TUBE,10,2011-06-02 12:06:00,1.25,15184.0,United Kingdom
555348,22461,SAVOY ART DECO CLOCK,2,2011-06-02 12:06:00,12.75,15184.0,United Kingdom
555348,22470,HEART OF WICKER LARGE,2,2011-06-02 12:06:00,2.95,15184.0,United Kingdom
555348,22193,RED DINER WALL CLOCK,1,2011-06-02 12:06:00,8.5,15184.0,United Kingdom
555348,22194,BLACK DINER WALL CLOCK,2,2011-06-02 12:06:00,8.5,15184.0,United Kingdom
555348,84192,ASSORTED COLOUR METAL CAT ,6,2011-06-02 12:06:00,1.25,15184.0,United Kingdom
555348,82482,WOODEN PICTURE FRAME WHITE FINISH,6,2011-06-02 12:06:00,2.55,15184.0,United Kingdom
555348,17091J,VANILLA INCENSE IN TIN,6,2011-06-02 12:06:00,0.38,15184.0,United Kingdom
555348,17090D,VANILLA INCENSE 40 CONES IN TIN,6,2011-06-02 12:06:00,1.25,15184.0,United Kingdom
555348,17090A,LAVENDER INCENSE 40 CONES IN TIN,6,2011-06-02 12:06:00,1.25,15184.0,United Kingdom
555349,47566,PARTY BUNTING,3,2011-06-02 12:08:00,4.95,16729.0,United Kingdom
555349,23298,SPOTTY BUNTING,2,2011-06-02 12:08:00,4.95,16729.0,United Kingdom
555349,22900,SET 2 TEA TOWELS I LOVE LONDON ,3,2011-06-02 12:08:00,3.25,16729.0,United Kingdom
555349,22328,ROUND SNACK BOXES SET OF 4 FRUITS ,1,2011-06-02 12:08:00,2.95,16729.0,United Kingdom
555349,21135,VICTORIAN  METAL POSTCARD SPRING,8,2011-06-02 12:08:00,1.69,16729.0,United Kingdom
555349,21136,PAINTED METAL PEARS ASSORTED,8,2011-06-02 12:08:00,1.69,16729.0,United Kingdom
555349,84879,ASSORTED COLOUR BIRD ORNAMENT,8,2011-06-02 12:08:00,1.69,16729.0,United Kingdom
555349,21179,NO JUNK MAIL METAL SIGN,5,2011-06-02 12:08:00,1.25,16729.0,United Kingdom
555349,84596B,SMALL DOLLY MIX DESIGN ORANGE BOWL,6,2011-06-02 12:08:00,0.42,16729.0,United Kingdom
555349,22558,CLOTHES PEGS RETROSPOT PACK 24 ,5,2011-06-02 12:08:00,1.65,16729.0,United Kingdom
555349,22659,LUNCH BOX I LOVE LONDON,6,2011-06-02 12:08:00,1.95,16729.0,United Kingdom
555349,23004,TRAVEL CARD WALLET PANTRY,24,2011-06-02 12:08:00,0.42,16729.0,United Kingdom
555349,23000,TRAVEL CARD WALLET TRANSPORT,24,2011-06-02 12:08:00,0.42,16729.0,United Kingdom
555349,22998,TRAVEL CARD WALLET KEEP CALM,48,2011-06-02 12:08:00,0.42,16729.0,United Kingdom
555349,22999,TRAVEL CARD WALLET RETRO PETALS,24,2011-06-02 12:08:00,0.42,16729.0,United Kingdom
555349,75049L,LARGE CIRCULAR MIRROR MOBILE,18,2011-06-02 12:08:00,1.25,16729.0,United Kingdom
555349,21746,SMALL RED RETROSPOT WINDMILL,2,2011-06-02 12:08:00,1.25,16729.0,United Kingdom
555349,21749,LARGE RED RETROSPOT WINDMILL,2,2011-06-02 12:08:00,2.1,16729.0,United Kingdom
555349,85123A,WHITE HANGING HEART T-LIGHT HOLDER,2,2011-06-02 12:08:00,2.95,16729.0,United Kingdom
555349,20725,LUNCH BAG RED RETROSPOT,10,2011-06-02 12:08:00,1.65,16729.0,United Kingdom
555349,23206,LUNCH BAG APPLE DESIGN,5,2011-06-02 12:08:00,1.65,16729.0,United Kingdom
555349,23208,LUNCH BAG VINTAGE LEAF DESIGN,5,2011-06-02 12:08:00,1.65,16729.0,United Kingdom
555349,22193,RED DINER WALL CLOCK,1,2011-06-02 12:08:00,8.5,16729.0,United Kingdom
555349,23209,LUNCH BAG DOILEY PATTERN ,5,2011-06-02 12:08:00,1.65,16729.0,United Kingdom
555349,85132B,CHARLIE AND LOLA TABLE TINS,4,2011-06-02 12:08:00,1.95,16729.0,United Kingdom
555349,23148,MINIATURE ANTIQUE ROSE HOOK IVORY,12,2011-06-02 12:08:00,0.83,16729.0,United Kingdom
555349,22383,LUNCH BAG SUKI DESIGN ,5,2011-06-02 12:08:00,1.65,16729.0,United Kingdom
555349,22384,LUNCH BAG PINK POLKADOT,5,2011-06-02 12:08:00,1.65,16729.0,United Kingdom
555349,21933,PINK VINTAGE PAISLEY PICNIC BAG,5,2011-06-02 12:08:00,1.65,16729.0,United Kingdom
555349,21932,SCANDINAVIAN PAISLEY PICNIC BAG,5,2011-06-02 12:08:00,1.65,16729.0,United Kingdom
555349,85159B,"WHITE TEA,COFFEE,SUGAR JARS",1,2011-06-02 12:08:00,1.95,16729.0,United Kingdom
555350,23138,SINGLE WIRE HOOK IVORY HEART,12,2011-06-02 12:08:00,1.45,17652.0,United Kingdom
555350,23149,ANTIQUE IVORY WIRE BOWL SMALL,6,2011-06-02 12:08:00,2.49,17652.0,United Kingdom
555350,22326,ROUND SNACK BOXES SET OF4 WOODLAND ,6,2011-06-02 12:08:00,2.95,17652.0,United Kingdom
555350,22327,ROUND SNACK BOXES SET OF 4 SKULLS,6,2011-06-02 12:08:00,2.95,17652.0,United Kingdom
555350,22427,ENAMEL FLOWER JUG CREAM,6,2011-06-02 12:08:00,5.95,17652.0,United Kingdom
555350,22619,SET OF 6 SOLDIER SKITTLES,4,2011-06-02 12:08:00,3.75,17652.0,United Kingdom
555350,21430,SET/3 RED GINGHAM ROSE STORAGE BOX,8,2011-06-02 12:08:00,3.75,17652.0,United Kingdom
555350,23209,LUNCH BAG DOILEY PATTERN ,10,2011-06-02 12:08:00,1.65,17652.0,United Kingdom
555350,23299,FOOD COVER WITH BEADS SET 2 ,6,2011-06-02 12:08:00,3.75,17652.0,United Kingdom
555350,22171,3 HOOK PHOTO SHELF ANTIQUE WHITE,2,2011-06-02 12:08:00,8.5,17652.0,United Kingdom
555350,21533,RETROSPOT LARGE MILK JUG,3,2011-06-02 12:08:00,4.95,17652.0,United Kingdom
555350,23203,JUMBO BAG DOILEY PATTERNS,10,2011-06-02 12:08:00,2.08,17652.0,United Kingdom
555350,47590B,PINK HAPPY BIRTHDAY BUNTING,3,2011-06-02 12:08:00,5.45,17652.0,United Kingdom
555350,22488,NATURAL SLATE RECTANGLE CHALKBOARD,12,2011-06-02 12:08:00,1.65,17652.0,United Kingdom
555350,21559,STRAWBERRY LUNCH BOX WITH CUTLERY,6,2011-06-02 12:08:00,2.55,17652.0,United Kingdom
555350,21561,DINOSAUR LUNCH BOX WITH CUTLERY,6,2011-06-02 12:08:00,2.55,17652.0,United Kingdom
555350,22847,BREAD BIN DINER STYLE IVORY,1,2011-06-02 12:08:00,16.95,17652.0,United Kingdom
555350,21217,RED RETROSPOT ROUND CAKE TINS,1,2011-06-02 12:08:00,9.95,17652.0,United Kingdom
555350,20914,SET/5 RED RETROSPOT LID GLASS BOWLS,6,2011-06-02 12:08:00,2.95,17652.0,United Kingdom
555350,85123A,WHITE HANGING HEART T-LIGHT HOLDER,6,2011-06-02 12:08:00,2.95,17652.0,United Kingdom
555350,21932,SCANDINAVIAN PAISLEY PICNIC BAG,10,2011-06-02 12:08:00,1.65,17652.0,United Kingdom
555350,47590A,BLUE HAPPY BIRTHDAY BUNTING,3,2011-06-02 12:08:00,5.45,17652.0,United Kingdom
555350,22469,HEART OF WICKER SMALL,12,2011-06-02 12:08:00,1.65,17652.0,United Kingdom
555350,22595,GINGHAM HEART DECORATION,12,2011-06-02 12:08:00,0.85,17652.0,United Kingdom
555350,22197,SMALL POPCORN HOLDER,12,2011-06-02 12:08:00,0.85,17652.0,United Kingdom
555350,84978,HANGING HEART JAR T-LIGHT HOLDER,12,2011-06-02 12:08:00,1.25,17652.0,United Kingdom
555350,23110,PARISIENNE KEY CABINET ,2,2011-06-02 12:08:00,5.75,17652.0,United Kingdom
555350,23168,CLASSIC CAFE SUGAR DISPENSER,12,2011-06-02 12:08:00,1.25,17652.0,United Kingdom
555350,23165,LARGE CERAMIC TOP STORAGE JAR,12,2011-06-02 12:08:00,1.65,17652.0,United Kingdom
555350,47566,PARTY BUNTING,4,2011-06-02 12:08:00,4.95,17652.0,United Kingdom
555350,22961,JAM MAKING SET PRINTED,12,2011-06-02 12:08:00,1.45,17652.0,United Kingdom
555350,22997,TRAVEL CARD WALLET UNION JACK,24,2011-06-02 12:08:00,0.42,17652.0,United Kingdom
555350,22994,TRAVEL CARD WALLET RETROSPOT,24,2011-06-02 12:08:00,0.42,17652.0,United Kingdom
555350,20749,ASSORTED COLOUR MINI CASES,2,2011-06-02 12:08:00,7.95,17652.0,United Kingdom
555350,22328,ROUND SNACK BOXES SET OF 4 FRUITS ,6,2011-06-02 12:08:00,2.95,17652.0,United Kingdom
555350,22149,FELTCRAFT 6 FLOWER FRIENDS,6,2011-06-02 12:08:00,2.1,17652.0,United Kingdom
555350,20728,LUNCH BAG CARS BLUE,10,2011-06-02 12:08:00,1.65,17652.0,United Kingdom
555350,22652,TRAVEL SEWING KIT,10,2011-06-02 12:08:00,1.65,17652.0,United Kingdom
555350,20725,LUNCH BAG RED RETROSPOT,10,2011-06-02 12:08:00,1.65,17652.0,United Kingdom
555350,22558,CLOTHES PEGS RETROSPOT PACK 24 ,12,2011-06-02 12:08:00,1.65,17652.0,United Kingdom
555350,84596B,SMALL DOLLY MIX DESIGN ORANGE BOWL,16,2011-06-02 12:08:00,0.42,17652.0,United Kingdom
555350,22822,CREAM WALL PLANTER HEART SHAPED,2,2011-06-02 12:08:00,5.95,17652.0,United Kingdom
555350,47013C,WINE BOTTLE DRESSING DARK BLUE,12,2011-06-02 12:08:00,0.12,17652.0,United Kingdom
555350,85066,CREAM SWEETHEART MINI CHEST,2,2011-06-02 12:08:00,12.75,17652.0,United Kingdom
555350,22624,IVORY KITCHEN SCALES,2,2011-06-02 12:08:00,8.5,17652.0,United Kingdom
555350,22185,SLATE TILE NATURAL HANGING,12,2011-06-02 12:08:00,1.65,17652.0,United Kingdom
555350,22625,RED KITCHEN SCALES,2,2011-06-02 12:08:00,8.5,17652.0,United Kingdom
555350,22456,NATURAL SLATE CHALKBOARD LARGE ,3,2011-06-02 12:08:00,4.95,17652.0,United Kingdom
555350,85099B,JUMBO BAG RED RETROSPOT,10,2011-06-02 12:08:00,2.08,17652.0,United Kingdom
555351,23275,SET OF 3 HANGING OWLS OLLIE BEAK,48,2011-06-02 12:37:00,1.25,13408.0,United Kingdom
555351,23298,SPOTTY BUNTING,24,2011-06-02 12:37:00,4.95,13408.0,United Kingdom
555351,23204,CHARLOTTE BAG APPLES DESIGN,30,2011-06-02 12:37:00,0.85,13408.0,United Kingdom
555351,23205,CHARLOTTE BAG VINTAGE ALPHABET ,30,2011-06-02 12:37:00,0.85,13408.0,United Kingdom
555351,22470,HEART OF WICKER LARGE,40,2011-06-02 12:37:00,2.55,13408.0,United Kingdom
555351,23207,LUNCH BAG ALPHABET DESIGN,20,2011-06-02 12:37:00,1.65,13408.0,United Kingdom
555351,23206,LUNCH BAG APPLE DESIGN,20,2011-06-02 12:37:00,1.65,13408.0,United Kingdom
555352,85099F,JUMBO BAG STRAWBERRY,200,2011-06-02 12:46:00,1.79,15838.0,United Kingdom
555352,85099B,JUMBO BAG RED RETROSPOT,100,2011-06-02 12:46:00,1.79,15838.0,United Kingdom
555352,22759,SET OF 3 NOTEBOOKS IN PARCEL,96,2011-06-02 12:46:00,1.45,15838.0,United Kingdom
555352,21242,RED RETROSPOT PLATE ,96,2011-06-02 12:46:00,1.45,15838.0,United Kingdom
555352,21238,RED RETROSPOT CUP,48,2011-06-02 12:46:00,0.72,15838.0,United Kingdom
555352,47590B,PINK HAPPY BIRTHDAY BUNTING,100,2011-06-02 12:46:00,4.65,15838.0,United Kingdom
555352,22386,JUMBO BAG PINK POLKADOT,200,2011-06-02 12:46:00,1.79,15838.0,United Kingdom
555352,20676,RED RETROSPOT BOWL,72,2011-06-02 12:46:00,1.06,15838.0,United Kingdom
555352,22433,WATERING CAN GREEN DINOSAUR,48,2011-06-02 12:46:00,1.65,15838.0,United Kingdom
555352,22379,RECYCLING BAG RETROSPOT ,100,2011-06-02 12:46:00,1.85,15838.0,United Kingdom
555352,22381,TOY TIDY PINK POLKADOT,50,2011-06-02 12:46:00,1.85,15838.0,United Kingdom
555353,22776,SWEETHEART CAKESTAND 3 TIER,1,2011-06-02 13:22:00,9.95,16928.0,United Kingdom
555353,21672,WHITE SPOT RED CERAMIC DRAWER KNOB,1,2011-06-02 13:22:00,1.25,16928.0,United Kingdom
555353,21668,RED STRIPE CERAMIC DRAWER KNOB,2,2011-06-02 13:22:00,1.25,16928.0,United Kingdom
555353,22775,PURPLE DRAWERKNOB ACRYLIC EDWARDIAN,12,2011-06-02 13:22:00,1.25,16928.0,United Kingdom
555353,22773,GREEN DRAWER KNOB ACRYLIC EDWARDIAN,12,2011-06-02 13:22:00,1.25,16928.0,United Kingdom
555353,22772,PINK DRAWER KNOB ACRYLIC EDWARDIAN,24,2011-06-02 13:22:00,1.25,16928.0,United Kingdom
555353,22774,RED DRAWER KNOB ACRYLIC EDWARDIAN,24,2011-06-02 13:22:00,1.25,16928.0,United Kingdom
555353,22771,CLEAR DRAWER KNOB ACRYLIC EDWARDIAN,12,2011-06-02 13:22:00,1.25,16928.0,United Kingdom
555353,22805,BLUE DRAWER KNOB ACRYLIC EDWARDIAN,12,2011-06-02 13:22:00,1.25,16928.0,United Kingdom
555353,21673,WHITE SPOT BLUE CERAMIC DRAWER KNOB,6,2011-06-02 13:22:00,1.25,16928.0,United Kingdom
555353,21669,BLUE STRIPE CERAMIC DRAWER KNOB,6,2011-06-02 13:22:00,1.25,16928.0,United Kingdom
555353,21670,BLUE SPOT CERAMIC DRAWER KNOB,6,2011-06-02 13:22:00,1.25,16928.0,United Kingdom
C555354,21326,AGED GLASS SILVER T-LIGHT HOLDER,-1,2011-06-02 13:26:00,0.65,16566.0,United Kingdom
C555355,35810B,ENAMEL BLUE RIM COFFEE CONTAINER,-12,2011-06-02 13:27:00,0.83,15841.0,United Kingdom
555356,22729,ALARM CLOCK BAKELIKE ORANGE,12,2011-06-02 13:29:00,3.75,16672.0,United Kingdom
555356,22725,ALARM CLOCK BAKELIKE CHOCOLATE,12,2011-06-02 13:29:00,3.75,16672.0,United Kingdom
555356,22467,GUMBALL COAT RACK,48,2011-06-02 13:29:00,2.1,16672.0,United Kingdom
555356,22781,GUMBALL MAGAZINE RACK,24,2011-06-02 13:29:00,6.75,16672.0,United Kingdom
C555357,22465,HANGING METAL STAR LANTERN,-12,2011-06-02 13:38:00,1.45,16422.0,United Kingdom
C555358,22699,ROSES REGENCY TEACUP AND SAUCER ,-1,2011-06-02 13:43:00,2.95,13854.0,United Kingdom
555359,21974,SET OF 36 PAISLEY FLOWER DOILIES,1,2011-06-02 14:04:00,1.45,18135.0,United Kingdom
555359,22082,RIBBON REEL STRIPES DESIGN ,2,2011-06-02 14:04:00,1.65,18135.0,United Kingdom
555359,23131,MISTLETOE HEART WREATH CREAM,1,2011-06-02 14:04:00,4.15,18135.0,United Kingdom
555359,23177,TREASURE ISLAND BOOK BOX,1,2011-06-02 14:04:00,2.25,18135.0,United Kingdom
555359,22082,RIBBON REEL STRIPES DESIGN ,1,2011-06-02 14:04:00,1.65,18135.0,United Kingdom
555359,22296,HEART IVORY TRELLIS LARGE,2,2011-06-02 14:04:00,1.65,18135.0,United Kingdom
555359,84836,ZINC METAL HEART DECORATION,2,2011-06-02 14:04:00,1.25,18135.0,United Kingdom
555359,22469,HEART OF WICKER SMALL,4,2011-06-02 14:04:00,1.65,18135.0,United Kingdom
555359,23129,HEART SHAPED HOLLY WREATH,2,2011-06-02 14:04:00,4.15,18135.0,United Kingdom
555359,84947,ANTIQUE SILVER TEA GLASS ENGRAVED,72,2011-06-02 14:04:00,1.06,18135.0,United Kingdom
C555360,23168,CLASSIC CAFE SUGAR DISPENSER,-5,2011-06-02 14:06:00,1.25,16133.0,United Kingdom
C555360,23169,CLASSIC GLASS COOKIE JAR,-6,2011-06-02 14:06:00,4.15,16133.0,United Kingdom
C555361,71053,WHITE METAL LANTERN,-1,2011-06-02 14:12:00,3.75,13308.0,United Kingdom
C555361,23165,LARGE CERAMIC TOP STORAGE JAR,-1,2011-06-02 14:12:00,1.65,13308.0,United Kingdom
C555361,23111,PARISIENNE SEWING BOX,-1,2011-06-02 14:12:00,12.5,13308.0,United Kingdom
555363,23040,PAPER LANTERN 9 POINT SNOW STAR ,1,2011-06-02 14:15:00,5.75,14453.0,United Kingdom
555363,84507C,BLUE CIRCLES DESIGN MONKEY DOLL,1,2011-06-02 14:15:00,2.55,14453.0,United Kingdom
555363,22179,SET 10 NIGHT OWL LIGHTS,1,2011-06-02 14:15:00,6.75,14453.0,United Kingdom
555363,23263,SET OF 3 WOODEN HEART DECORATIONS,12,2011-06-02 14:15:00,1.25,14453.0,United Kingdom
555363,23045,PAPER LANTERN 5 POINT STAR MOON ,1,2011-06-02 14:15:00,4.15,14453.0,United Kingdom
555363,23298,SPOTTY BUNTING,1,2011-06-02 14:15:00,4.95,14453.0,United Kingdom
555363,22483,RED GINGHAM TEDDY BEAR ,1,2011-06-02 14:15:00,2.95,14453.0,United Kingdom
555363,85034B,3 WHITE CHOC MORRIS BOXED CANDLES,1,2011-06-02 14:15:00,4.25,14453.0,United Kingdom
555363,22224,WHITE LOVEBIRD LANTERN,1,2011-06-02 14:15:00,2.95,14453.0,United Kingdom
555363,85053,FRENCH ENAMEL CANDLEHOLDER,1,2011-06-02 14:15:00,2.1,14453.0,United Kingdom
555363,15036,ASSORTED COLOURS SILK FAN,12,2011-06-02 14:15:00,0.83,14453.0,United Kingdom
555363,23057,BEADED CHANDELIER T-LIGHT HOLDER,1,2011-06-02 14:15:00,4.95,14453.0,United Kingdom
555363,84625C,BLUE NEW BAROQUE CANDLESTICK CANDLE,2,2011-06-02 14:15:00,0.85,14453.0,United Kingdom
555363,20819,SILVER TEDDY BEAR,1,2011-06-02 14:15:00,3.75,14453.0,United Kingdom
555363,85036A,GARDENIA 1 WICK MORRIS BOXED CANDLE,1,2011-06-02 14:15:00,4.25,14453.0,United Kingdom
555363,21743,STAR PORTABLE TABLE LIGHT ,4,2011-06-02 14:15:00,2.95,14453.0,United Kingdom
555363,84581,DOG TOY WITH PINK CROCHET SKIRT,1,2011-06-02 14:15:00,3.75,14453.0,United Kingdom
555363,79321,CHILLI LIGHTS,1,2011-06-02 14:15:00,5.75,14453.0,United Kingdom
555363,22780,LIGHT GARLAND BUTTERFILES PINK,2,2011-06-02 14:15:00,4.25,14453.0,United Kingdom
555363,20696,FLORAL SOFT CAR TOY,1,2011-06-02 14:15:00,3.75,14453.0,United Kingdom
555363,22776,SWEETHEART CAKESTAND 3 TIER,1,2011-06-02 14:15:00,9.95,14453.0,United Kingdom
555363,44089C,LILAC GAUZE BUTTERFLY LAMPSHADE,1,2011-06-02 14:15:00,0.42,14453.0,United Kingdom
C555362,23155,KNICKERBOCKERGLORY MAGNET ASSORTED ,-1,2011-06-02 14:15:00,0.83,15785.0,United Kingdom
C555364,21843,RED RETROSPOT CAKE STAND,-1,2011-06-02 14:17:00,10.95,14903.0,United Kingdom
C555364,22784,LANTERN CREAM GAZEBO ,-1,2011-06-02 14:17:00,4.95,14903.0,United Kingdom
C555364,84947,ANTIQUE SILVER TEA GLASS ENGRAVED,-2,2011-06-02 14:17:00,1.25,14903.0,United Kingdom
C555365,23066,SMALL DECO JEWELLERY STAND,-1,2011-06-02 14:24:00,8.25,15791.0,United Kingdom
C555366,22355,CHARLOTTE BAG SUKI DESIGN,-2,2011-06-02 14:25:00,0.72,12590.0,Germany
C555366,20723,STRAWBERRY CHARLOTTE BAG,-2,2011-06-02 14:25:00,0.72,12590.0,Germany
555367,21927,BLUE/CREAM STRIPE CUSHION COVER ,12,2011-06-02 14:28:00,1.25,17900.0,United Kingdom
555367,21926,RED/CREAM STRIPE CUSHION COVER ,12,2011-06-02 14:28:00,1.25,17900.0,United Kingdom
555367,23444,Next Day Carriage,1,2011-06-02 14:28:00,15.0,17900.0,United Kingdom
555367,46000S,POLYESTER FILLER PAD 40x40cm,24,2011-06-02 14:28:00,1.45,17900.0,United Kingdom
555368,84879,ASSORTED COLOUR BIRD ORNAMENT,8,2011-06-02 14:30:00,1.69,13437.0,United Kingdom
555368,22295,HEART FILIGREE DOVE LARGE,12,2011-06-02 14:30:00,1.65,13437.0,United Kingdom
555368,22296,HEART IVORY TRELLIS LARGE,12,2011-06-02 14:30:00,1.65,13437.0,United Kingdom
555368,22212,FOUR HOOK  WHITE LOVEBIRDS,6,2011-06-02 14:30:00,2.1,13437.0,United Kingdom
555368,23148,MINIATURE ANTIQUE ROSE HOOK IVORY,12,2011-06-02 14:30:00,0.83,13437.0,United Kingdom
555368,82613C,"METAL SIGN,CUPCAKE SINGLE HOOK",8,2011-06-02 14:30:00,1.25,13437.0,United Kingdom
555368,21770,OPEN CLOSED METAL SIGN,2,2011-06-02 14:30:00,4.95,13437.0,United Kingdom
555368,21533,RETROSPOT LARGE MILK JUG,3,2011-06-02 14:30:00,4.95,13437.0,United Kingdom
555368,21035,SET/2 RED RETROSPOT TEA TOWELS ,6,2011-06-02 14:30:00,3.25,13437.0,United Kingdom
555368,22989,SET 2 PANTRY DESIGN TEA TOWELS,6,2011-06-02 14:30:00,3.25,13437.0,United Kingdom
555368,21471,STRAWBERRY RAFFIA FOOD COVER,6,2011-06-02 14:30:00,3.75,13437.0,United Kingdom
555368,21469,POLKA DOT RAFFIA FOOD COVER,6,2011-06-02 14:30:00,3.75,13437.0,United Kingdom
555368,21470,FLOWER VINE RAFFIA FOOD COVER,6,2011-06-02 14:30:00,3.75,13437.0,United Kingdom
555368,22643,SET OF 4 NAPKIN CHARMS LEAVES   ,6,2011-06-02 14:30:00,2.55,13437.0,United Kingdom
555368,22604,SET OF 4 NAPKIN CHARMS CUTLERY,6,2011-06-02 14:30:00,2.55,13437.0,United Kingdom
555368,22639,SET OF 4 NAPKIN CHARMS HEARTS,6,2011-06-02 14:30:00,2.55,13437.0,United Kingdom
555368,47559B,TEA TIME OVEN GLOVE,10,2011-06-02 14:30:00,1.25,13437.0,United Kingdom
555368,21041,RED RETROSPOT OVEN GLOVE DOUBLE,6,2011-06-02 14:30:00,2.95,13437.0,United Kingdom
555368,21216,"SET 3 RETROSPOT TEA,COFFEE,SUGAR",4,2011-06-02 14:30:00,4.95,13437.0,United Kingdom
555368,21218,RED SPOTTY BISCUIT TIN,6,2011-06-02 14:30:00,3.75,13437.0,United Kingdom
555368,22842,BISCUIT TIN VINTAGE RED,2,2011-06-02 14:30:00,6.75,13437.0,United Kingdom
555368,22843,BISCUIT TIN VINTAGE GREEN,2,2011-06-02 14:30:00,6.75,13437.0,United Kingdom
555368,21781,MA CAMPAGNE CUTLERY BOX,1,2011-06-02 14:30:00,14.95,13437.0,United Kingdom
555368,23132,SMALL IVORY HEART WALL ORGANISER,3,2011-06-02 14:30:00,5.75,13437.0,United Kingdom
555368,22847,BREAD BIN DINER STYLE IVORY,2,2011-06-02 14:30:00,16.95,13437.0,United Kingdom
555368,22846,BREAD BIN DINER STYLE RED ,2,2011-06-02 14:30:00,16.95,13437.0,United Kingdom
