InvoiceNo,StockCode,Description,Quantity,InvoiceDate,UnitPrice,CustomerID,Country
564729,21977,PACK OF 60 PINK PAISLEY CAKE CASES,3,2011-08-28 12:44:00,0.55,13137.0,United Kingdom
564729,22208,WOOD STAMP SET THANK YOU,2,2011-08-28 12:44:00,0.83,13137.0,United Kingdom
564729,22417,PACK OF 60 SPACEBOY CAKE CASES,1,2011-08-28 12:44:00,0.55,13137.0,United Kingdom
564729,23309,SET OF 60 I LOVE LONDON CAKE CASES ,1,2011-08-28 12:44:00,0.55,13137.0,United Kingdom
564729,21976,PACK OF 60 MUSHROOM CAKE CASES,3,2011-08-28 12:44:00,0.55,13137.0,United Kingdom
564729,21213,PACK OF 72 SKULL CAKE CASES,3,2011-08-28 12:44:00,0.55,13137.0,United Kingdom
564729,21212,PACK OF 72 RETROSPOT CAKE CASES,4,2011-08-28 12:44:00,0.55,13137.0,United Kingdom
564729,21975,PACK OF 60 DINOSAUR CAKE CASES,5,2011-08-28 12:44:00,0.55,13137.0,United Kingdom
564729,23309,SET OF 60 I LOVE LONDON CAKE CASES ,2,2011-08-28 12:44:00,0.55,13137.0,United Kingdom
564729,22296,HEART IVORY TRELLIS LARGE,4,2011-08-28 12:44:00,1.65,13137.0,United Kingdom
564729,22577,WOODEN HEART CHRISTMAS SCANDINAVIAN,5,2011-08-28 12:44:00,0.85,13137.0,United Kingdom
C564730,22169,FAMILY ALBUM WHITE PICTURE FRAME,-1,2011-08-28 12:47:00,8.5,17841.0,United Kingdom
564731,23205,CHARLOTTE BAG VINTAGE ALPHABET ,10,2011-08-28 12:57:00,0.85,16186.0,United Kingdom
564731,23202,JUMBO BAG VINTAGE LEAF,10,2011-08-28 12:57:00,2.08,16186.0,United Kingdom
564731,23236,STORAGE TIN VINTAGE DOILY ,6,2011-08-28 12:57:00,2.89,16186.0,United Kingdom
564731,22988,SOLDIERS EGG CUP ,12,2011-08-28 12:57:00,1.25,16186.0,United Kingdom
564731,22904,CALENDAR PAPER CUT DESIGN,12,2011-08-28 12:57:00,2.95,16186.0,United Kingdom
564731,20727,LUNCH BAG  BLACK SKULL.,10,2011-08-28 12:57:00,1.65,16186.0,United Kingdom
564731,84992,72 SWEETHEART FAIRY CAKE CASES,24,2011-08-28 12:57:00,0.55,16186.0,United Kingdom
564731,84879,ASSORTED COLOUR BIRD ORNAMENT,8,2011-08-28 12:57:00,1.69,16186.0,United Kingdom
564731,23239,SET OF 4 KNICK KNACK TINS POPPIES,6,2011-08-28 12:57:00,4.15,16186.0,United Kingdom
564731,23237,SET OF 4 KNICK KNACK TINS LEAF,6,2011-08-28 12:57:00,4.15,16186.0,United Kingdom
564731,23209,LUNCH BAG VINTAGE DOILY ,10,2011-08-28 12:57:00,1.65,16186.0,United Kingdom
564731,23208,LUNCH BAG VINTAGE LEAF DESIGN,10,2011-08-28 12:57:00,1.65,16186.0,United Kingdom
564731,23199,JUMBO BAG APPLES,10,2011-08-28 12:57:00,2.08,16186.0,United Kingdom
564731,22741,FUNKY DIVA PEN,48,2011-08-28 12:57:00,0.85,16186.0,United Kingdom
564731,22077,6 RIBBONS RUSTIC CHARM,12,2011-08-28 12:57:00,1.65,16186.0,United Kingdom
564731,20728,LUNCH BAG CARS BLUE,10,2011-08-28 12:57:00,1.65,16186.0,United Kingdom
564731,15036,ASSORTED COLOURS SILK FAN,24,2011-08-28 12:57:00,0.83,16186.0,United Kingdom
564731,23308,SET OF 60 VINTAGE LEAF CAKE CASES ,24,2011-08-28 12:57:00,0.55,16186.0,United Kingdom
564731,23244,ROUND STORAGE TIN VINTAGE LEAF,6,2011-08-28 12:57:00,1.95,16186.0,United Kingdom
564732,22078,RIBBON REEL LACE DESIGN ,1,2011-08-28 13:08:00,2.1,16466.0,United Kingdom
564732,75049L,LARGE CIRCULAR MIRROR MOBILE,6,2011-08-28 13:08:00,1.25,16466.0,United Kingdom
564732,85123A,WHITE HANGING HEART T-LIGHT HOLDER,8,2011-08-28 13:08:00,2.95,16466.0,United Kingdom
564732,23293,SET OF 12 FAIRY CAKE BAKING CASES,4,2011-08-28 13:08:00,0.83,16466.0,United Kingdom
564732,22297,HEART IVORY TRELLIS SMALL,6,2011-08-28 13:08:00,1.25,16466.0,United Kingdom
564732,22082,RIBBON REEL STRIPES DESIGN ,5,2011-08-28 13:08:00,1.65,16466.0,United Kingdom
564732,85123A,WHITE HANGING HEART T-LIGHT HOLDER,6,2011-08-28 13:08:00,2.95,16466.0,United Kingdom
564732,21811,HANGING HEART WITH BELL,19,2011-08-28 13:08:00,1.25,16466.0,United Kingdom
564732,23152,IVORY SWEETHEART WIRE LETTER RACK ,2,2011-08-28 13:08:00,3.75,16466.0,United Kingdom
564732,75049L,LARGE CIRCULAR MIRROR MOBILE,3,2011-08-28 13:08:00,1.25,16466.0,United Kingdom
564732,22639,SET OF 4 NAPKIN CHARMS HEARTS,4,2011-08-28 13:08:00,2.55,16466.0,United Kingdom
564732,23213,STAR WREATH DECORATION WITH BELL,5,2011-08-28 13:08:00,1.25,16466.0,United Kingdom
564732,23212,HEART WREATH DECORATION WITH BELL,6,2011-08-28 13:08:00,1.25,16466.0,United Kingdom
564732,23210,WHITE ROCKING HORSE HAND PAINTED,6,2011-08-28 13:08:00,1.25,16466.0,United Kingdom
564732,22142,CHRISTMAS CRAFT WHITE FAIRY ,11,2011-08-28 13:08:00,1.45,16466.0,United Kingdom
564732,22141,CHRISTMAS CRAFT TREE TOP ANGEL,5,2011-08-28 13:08:00,2.1,16466.0,United Kingdom
564732,22144,CHRISTMAS CRAFT LITTLE FRIENDS,5,2011-08-28 13:08:00,2.1,16466.0,United Kingdom
564732,22144,CHRISTMAS CRAFT LITTLE FRIENDS,9,2011-08-28 13:08:00,2.1,16466.0,United Kingdom
564732,22470,HEART OF WICKER LARGE,9,2011-08-28 13:08:00,2.95,16466.0,United Kingdom
564732,23329,DECORATIVE WICKER HEART LARGE,2,2011-08-28 13:08:00,1.65,16466.0,United Kingdom
564732,23329,DECORATIVE WICKER HEART LARGE,7,2011-08-28 13:08:00,1.65,16466.0,United Kingdom
564733,46000M,POLYESTER FILLER PAD 45x45cm,1,2011-08-28 13:18:00,1.55,17841.0,United Kingdom
564733,46000R,POLYESTER FILLER PAD 45x30cm,2,2011-08-28 13:18:00,1.45,17841.0,United Kingdom
564733,46000U,POLYESTER FILLER PAD 30CMx30CM,2,2011-08-28 13:18:00,1.25,17841.0,United Kingdom
564733,21735,TWO DOOR CURIO CABINET,1,2011-08-28 13:18:00,12.75,17841.0,United Kingdom
564733,22487,WHITE WOOD GARDEN PLANT LADDER,1,2011-08-28 13:18:00,9.95,17841.0,United Kingdom
564733,82001S,VINYL RECORD FRAME SILVER,1,2011-08-28 13:18:00,3.75,17841.0,United Kingdom
564733,21561,DINOSAUR LUNCH BOX WITH CUTLERY,1,2011-08-28 13:18:00,2.55,17841.0,United Kingdom
564733,22326,ROUND SNACK BOXES SET OF4 WOODLAND ,1,2011-08-28 13:18:00,2.95,17841.0,United Kingdom
564733,21041,RED RETROSPOT OVEN GLOVE DOUBLE,1,2011-08-28 13:18:00,2.95,17841.0,United Kingdom
564733,20754,RETROSPOT RED WASHING UP GLOVES,2,2011-08-28 13:18:00,2.1,17841.0,United Kingdom
564733,23126,FELTCRAFT GIRL AMELIE KIT,1,2011-08-28 13:18:00,4.95,17841.0,United Kingdom
564733,22692,DOORMAT WELCOME TO OUR HOME,1,2011-08-28 13:18:00,7.95,17841.0,United Kingdom
564733,20972,PINK CREAM FELT CRAFT TRINKET BOX ,1,2011-08-28 13:18:00,1.25,17841.0,United Kingdom
564733,22659,LUNCH BOX I LOVE LONDON,1,2011-08-28 13:18:00,1.95,17841.0,United Kingdom
564733,22475,SKULL DESIGN TV DINNER TRAY,2,2011-08-28 13:18:00,4.95,17841.0,United Kingdom
564733,22040,BOTANICAL ROSE GIFT WRAP,25,2011-08-28 13:18:00,0.42,17841.0,United Kingdom
564733,22706,WRAP COWBOYS  ,25,2011-08-28 13:18:00,0.42,17841.0,United Kingdom
564733,21930,JUMBO STORAGE BAG SKULLS,1,2011-08-28 13:18:00,2.08,17841.0,United Kingdom
564733,22383,LUNCH BAG SUKI DESIGN ,1,2011-08-28 13:18:00,1.65,17841.0,United Kingdom
564733,22661,CHARLOTTE BAG DOLLY GIRL DESIGN,1,2011-08-28 13:18:00,0.85,17841.0,United Kingdom
564733,21931,JUMBO STORAGE BAG SUKI,1,2011-08-28 13:18:00,2.08,17841.0,United Kingdom
564733,20749,ASSORTED COLOUR MINI CASES,1,2011-08-28 13:18:00,7.95,17841.0,United Kingdom
564733,23031,DRAWER KNOB CRACKLE GLAZE PINK,1,2011-08-28 13:18:00,1.65,17841.0,United Kingdom
564733,21220,SET/4 BADGES DOGS,2,2011-08-28 13:18:00,1.25,17841.0,United Kingdom
564733,22355,CHARLOTTE BAG SUKI DESIGN,1,2011-08-28 13:18:00,0.85,17841.0,United Kingdom
564733,22794,SWEETHEART WIRE MAGAZINE RACK,1,2011-08-28 13:18:00,7.95,17841.0,United Kingdom
564733,23148,MINIATURE ANTIQUE ROSE HOOK IVORY,1,2011-08-28 13:18:00,0.83,17841.0,United Kingdom
564733,47421,ASSORTED COLOUR LIZARD SUCTION HOOK,4,2011-08-28 13:18:00,0.42,17841.0,United Kingdom
564733,82578,KITCHEN METAL SIGN,3,2011-08-28 13:18:00,0.55,17841.0,United Kingdom
564733,22602,RETROSPOT WOODEN HEART DECORATION,1,2011-08-28 13:18:00,0.85,17841.0,United Kingdom
564733,22335,HEART DECORATION PAINTED ZINC ,1,2011-08-28 13:18:00,0.65,17841.0,United Kingdom
564733,22464,HANGING METAL HEART LANTERN,1,2011-08-28 13:18:00,1.65,17841.0,United Kingdom
564733,21669,BLUE STRIPE CERAMIC DRAWER KNOB,12,2011-08-28 13:18:00,1.25,17841.0,United Kingdom
564733,20668,DISCO BALL CHRISTMAS DECORATION,144,2011-08-28 13:18:00,0.12,17841.0,United Kingdom
564733,21439,BASKET OF TOADSTOOLS,1,2011-08-28 13:18:00,1.25,17841.0,United Kingdom
564733,20725,LUNCH BAG RED RETROSPOT,2,2011-08-28 13:18:00,1.65,17841.0,United Kingdom
564733,20728,LUNCH BAG CARS BLUE,2,2011-08-28 13:18:00,1.65,17841.0,United Kingdom
564733,20727,LUNCH BAG  BLACK SKULL.,1,2011-08-28 13:18:00,1.65,17841.0,United Kingdom
564733,21925,UNION STRIPE CUSHION COVER ,2,2011-08-28 13:18:00,1.25,17841.0,United Kingdom
564733,22335,HEART DECORATION PAINTED ZINC ,1,2011-08-28 13:18:00,0.65,17841.0,United Kingdom
564733,20828,GLITTER BUTTERFLY CLIPS,1,2011-08-28 13:18:00,2.55,17841.0,United Kingdom
564733,22893,MINI CAKE STAND T-LIGHT HOLDER,10,2011-08-28 13:18:00,0.42,17841.0,United Kingdom
564733,22136,LOVE HEART SOCK HANGER,1,2011-08-28 13:18:00,1.65,17841.0,United Kingdom
564733,23191,BUNDLE OF 3 RETRO NOTE BOOKS,1,2011-08-28 13:18:00,1.65,17841.0,United Kingdom
564733,21201,TROPICAL  HONEYCOMB PAPER GARLAND ,1,2011-08-28 13:18:00,2.55,17841.0,United Kingdom
564733,21926,RED/CREAM STRIPE CUSHION COVER ,2,2011-08-28 13:18:00,1.25,17841.0,United Kingdom
564733,22222,CAKE PLATE LOVEBIRD WHITE,2,2011-08-28 13:18:00,4.95,17841.0,United Kingdom
564733,23286,BLUE VINTAGE SPOT BEAKER,1,2011-08-28 13:18:00,0.85,17841.0,United Kingdom
564733,22371,AIRLINE BAG VINTAGE TOKYO 78,1,2011-08-28 13:18:00,4.25,17841.0,United Kingdom
564733,21975,PACK OF 60 DINOSAUR CAKE CASES,1,2011-08-28 13:18:00,0.55,17841.0,United Kingdom
564733,23309,SET OF 60 I LOVE LONDON CAKE CASES ,2,2011-08-28 13:18:00,0.55,17841.0,United Kingdom
564733,21976,PACK OF 60 MUSHROOM CAKE CASES,1,2011-08-28 13:18:00,0.55,17841.0,United Kingdom
564733,22348,TEA BAG PLATE RED RETROSPOT,1,2011-08-28 13:18:00,0.85,17841.0,United Kingdom
564733,23240,SET OF 4 KNICK KNACK TINS DOILY ,1,2011-08-28 13:18:00,4.15,17841.0,United Kingdom
564733,22092,BLUE PAISLEY TISSUE BOX,2,2011-08-28 13:18:00,0.39,17841.0,United Kingdom
564733,22094,RED RETROSPOT TISSUE BOX,2,2011-08-28 13:18:00,0.39,17841.0,United Kingdom
564733,21577,SAVE THE PLANET COTTON TOTE BAG,1,2011-08-28 13:18:00,2.25,17841.0,United Kingdom
564733,22384,LUNCH BAG PINK POLKADOT,2,2011-08-28 13:18:00,1.65,17841.0,United Kingdom
564733,23184,BULL DOG BOTTLE OPENER,1,2011-08-28 13:18:00,4.95,17841.0,United Kingdom
564733,21928,JUMBO BAG SCANDINAVIAN BLUE PAISLEY,6,2011-08-28 13:18:00,2.08,17841.0,United Kingdom
564733,20725,LUNCH BAG RED RETROSPOT,5,2011-08-28 13:18:00,1.65,17841.0,United Kingdom
564733,22383,LUNCH BAG SUKI DESIGN ,5,2011-08-28 13:18:00,1.65,17841.0,United Kingdom
564733,22662,LUNCH BAG DOLLY GIRL DESIGN,5,2011-08-28 13:18:00,1.65,17841.0,United Kingdom
564733,22384,LUNCH BAG PINK POLKADOT,5,2011-08-28 13:18:00,1.65,17841.0,United Kingdom
564733,20727,LUNCH BAG  BLACK SKULL.,5,2011-08-28 13:18:00,1.65,17841.0,United Kingdom
564733,23209,LUNCH BAG VINTAGE DOILY ,5,2011-08-28 13:18:00,1.65,17841.0,United Kingdom
564733,20718,RED RETROSPOT SHOPPER BAG,6,2011-08-28 13:18:00,1.25,17841.0,United Kingdom
564733,20717,STRAWBERRY SHOPPER BAG,6,2011-08-28 13:18:00,1.25,17841.0,United Kingdom
564733,21929,JUMBO BAG PINK VINTAGE PAISLEY,6,2011-08-28 13:18:00,2.08,17841.0,United Kingdom
564733,23202,JUMBO BAG VINTAGE LEAF,6,2011-08-28 13:18:00,2.08,17841.0,United Kingdom
564733,85099B,JUMBO BAG RED RETROSPOT,6,2011-08-28 13:18:00,2.08,17841.0,United Kingdom
564733,23166,MEDIUM CERAMIC TOP STORAGE JAR,3,2011-08-28 13:18:00,1.25,17841.0,United Kingdom
564733,82600,NO SINGING METAL SIGN,2,2011-08-28 13:18:00,2.1,17841.0,United Kingdom
564733,84509A,SET OF 4 ENGLISH ROSE PLACEMATS,5,2011-08-28 13:18:00,3.75,17841.0,United Kingdom
564733,22722,SET OF 6 SPICE TINS PANTRY DESIGN,1,2011-08-28 13:18:00,3.95,17841.0,United Kingdom
564733,22557,PLASTERS IN TIN VINTAGE PAISLEY ,5,2011-08-28 13:18:00,1.65,17841.0,United Kingdom
564733,22553,PLASTERS IN TIN SKULLS,5,2011-08-28 13:18:00,1.65,17841.0,United Kingdom
564733,22556,PLASTERS IN TIN CIRCUS PARADE ,5,2011-08-28 13:18:00,1.65,17841.0,United Kingdom
564733,22554,PLASTERS IN TIN WOODLAND ANIMALS,5,2011-08-28 13:18:00,1.65,17841.0,United Kingdom
564733,21524,DOORMAT SPOTTY HOME SWEET HOME,2,2011-08-28 13:18:00,7.95,17841.0,United Kingdom
564733,23165,LARGE CERAMIC TOP STORAGE JAR,3,2011-08-28 13:18:00,1.65,17841.0,United Kingdom
564733,84510A,SET OF 4 ENGLISH ROSE COASTERS,5,2011-08-28 13:18:00,1.25,17841.0,United Kingdom
564733,23301,GARDENERS KNEELING PAD KEEP CALM ,4,2011-08-28 13:18:00,1.65,17841.0,United Kingdom
564733,23302,KNEELING MAT HOUSEWORK  DESIGN,4,2011-08-28 13:18:00,1.65,17841.0,United Kingdom
564733,22110,BIRD HOUSE HOT WATER BOTTLE,4,2011-08-28 13:18:00,2.55,17841.0,United Kingdom
564733,22112,CHOCOLATE HOT WATER BOTTLE,4,2011-08-28 13:18:00,4.95,17841.0,United Kingdom
564733,22835,HOT WATER BOTTLE I AM SO POORLY,3,2011-08-28 13:18:00,4.65,17841.0,United Kingdom
564733,23191,BUNDLE OF 3 RETRO NOTE BOOKS,4,2011-08-28 13:18:00,1.65,17841.0,United Kingdom
564733,23242,TREASURE TIN BUFFALO BILL ,3,2011-08-28 13:18:00,2.08,17841.0,United Kingdom
564733,22425,ENAMEL COLANDER CREAM,1,2011-08-28 13:18:00,4.95,17841.0,United Kingdom
564733,22720,SET OF 3 CAKE TINS PANTRY DESIGN ,1,2011-08-28 13:18:00,4.95,17841.0,United Kingdom
564733,23241,TREASURE TIN GYMKHANA DESIGN,3,2011-08-28 13:18:00,2.08,17841.0,United Kingdom
564733,22276,WASH BAG VINTAGE ROSE PAISLEY,4,2011-08-28 13:18:00,2.55,17841.0,United Kingdom
564733,22597,MUSICAL ZINC HEART DECORATION ,3,2011-08-28 13:18:00,0.85,17841.0,United Kingdom
564734,22197,POPCORN HOLDER,18,2011-08-28 13:32:00,0.85,12484.0,Spain
564734,21500,PINK POLKADOT WRAP ,25,2011-08-28 13:32:00,0.42,12484.0,Spain
564734,21499,BLUE POLKADOT WRAP,25,2011-08-28 13:32:00,0.42,12484.0,Spain
564734,22507,MEMO BOARD RETROSPOT  DESIGN,4,2011-08-28 13:32:00,4.95,12484.0,Spain
564734,22505,MEMO BOARD COTTAGE DESIGN,3,2011-08-28 13:32:00,4.95,12484.0,Spain
564734,22720,SET OF 3 CAKE TINS PANTRY DESIGN ,2,2011-08-28 13:32:00,4.95,12484.0,Spain
564734,22752,SET 7 BABUSHKA NESTING BOXES,1,2011-08-28 13:32:00,8.5,12484.0,Spain
564734,22189,CREAM HEART CARD HOLDER,2,2011-08-28 13:32:00,3.95,12484.0,Spain
564734,21251,DINOSAUR HEIGHT CHART STICKER SET,6,2011-08-28 13:32:00,2.95,12484.0,Spain
564734,21623,VINTAGE UNION JACK MEMOBOARD,1,2011-08-28 13:32:00,9.95,12484.0,Spain
564734,22804,CANDLEHOLDER PINK HANGING HEART,3,2011-08-28 13:32:00,2.95,12484.0,Spain
564734,20686,DOLLY MIXTURE CHILDREN'S UMBRELLA,2,2011-08-28 13:32:00,3.25,12484.0,Spain
564734,22990,COTTON APRON PANTRY DESIGN,6,2011-08-28 13:32:00,4.95,12484.0,Spain
564734,22989,SET 2 PANTRY DESIGN TEA TOWELS,6,2011-08-28 13:32:00,3.25,12484.0,Spain
564734,22965,3 TRADITIONAl BISCUIT CUTTERS  SET,6,2011-08-28 13:32:00,2.1,12484.0,Spain
564734,22429,ENAMEL MEASURING JUG CREAM,3,2011-08-28 13:32:00,4.25,12484.0,Spain
564734,22906,12 MESSAGE CARDS WITH ENVELOPES,12,2011-08-28 13:32:00,1.65,12484.0,Spain
564734,22993,SET OF 4 PANTRY JELLY MOULDS,6,2011-08-28 13:32:00,1.25,12484.0,Spain
564734,84826,ASSTD DESIGN 3D PAPER STICKERS,60,2011-08-28 13:32:00,0.85,12484.0,Spain
564734,72802A,ROSE SCENT CANDLE IN JEWELLED BOX,3,2011-08-28 13:32:00,4.25,12484.0,Spain
564734,72132,COLUMBIAN CUBE CANDLE,2,2011-08-28 13:32:00,1.95,12484.0,Spain
564734,72134,COLUMBIAN  CUBE CANDLE ,2,2011-08-28 13:32:00,0.85,12484.0,Spain
564734,21624,VINTAGE UNION JACK DOORSTOP,1,2011-08-28 13:32:00,5.95,12484.0,Spain
564734,72131,COLUMBIAN CANDLE RECTANGLE,1,2011-08-28 13:32:00,1.95,12484.0,Spain
564734,72803A,ROSE SCENT CANDLE JEWELLED DRAWER,3,2011-08-28 13:32:00,4.25,12484.0,Spain
564734,72807A,SET/3 ROSE CANDLE IN JEWELLED BOX,3,2011-08-28 13:32:00,4.25,12484.0,Spain
564734,22090,PAPER BUNTING RETROSPOT,2,2011-08-28 13:32:00,2.95,12484.0,Spain
564734,23076,ICE CREAM SUNDAE LIP GLOSS,24,2011-08-28 13:32:00,1.25,12484.0,Spain
564734,23310,BUBBLEGUM RING ASSORTED,36,2011-08-28 13:32:00,0.42,12484.0,Spain
564734,82494L,WOODEN FRAME ANTIQUE WHITE ,2,2011-08-28 13:32:00,2.95,12484.0,Spain
564734,82482,WOODEN PICTURE FRAME WHITE FINISH,2,2011-08-28 13:32:00,2.55,12484.0,Spain
564734,22645,CERAMIC HEART FAIRY CAKE MONEY BANK,4,2011-08-28 13:32:00,1.45,12484.0,Spain
564734,84077,WORLD WAR 2 GLIDERS ASSTD DESIGNS,48,2011-08-28 13:32:00,0.29,12484.0,Spain
564734,23184,BULL DOG BOTTLE OPENER,2,2011-08-28 13:32:00,4.95,12484.0,Spain
564734,72131,COLUMBIAN CANDLE RECTANGLE,1,2011-08-28 13:32:00,1.95,12484.0,Spain
564734,22693,GROW A FLYTRAP OR SUNFLOWER IN TIN,24,2011-08-28 13:32:00,1.25,12484.0,Spain
564734,20970,PINK FLORAL FELTCRAFT SHOULDER BAG,4,2011-08-28 13:32:00,3.75,12484.0,Spain
564734,20971,PINK BLUE FELT CRAFT TRINKET BOX,6,2011-08-28 13:32:00,1.25,12484.0,Spain
564734,22611,VINTAGE UNION JACK SHOPPING BAG,1,2011-08-28 13:32:00,4.95,12484.0,Spain
564734,21625,VINTAGE UNION JACK APRON,1,2011-08-28 13:32:00,6.95,12484.0,Spain
564734,22384,LUNCH BAG PINK POLKADOT,4,2011-08-28 13:32:00,1.65,12484.0,Spain
564734,47590A,BLUE HAPPY BIRTHDAY BUNTING,4,2011-08-28 13:32:00,5.45,12484.0,Spain
564734,47566B,TEA TIME PARTY BUNTING,3,2011-08-28 13:32:00,4.95,12484.0,Spain
564734,23298,SPOTTY BUNTING,3,2011-08-28 13:32:00,4.95,12484.0,Spain
564734,47566,PARTY BUNTING,3,2011-08-28 13:32:00,4.95,12484.0,Spain
564734,47590B,PINK HAPPY BIRTHDAY BUNTING,4,2011-08-28 13:32:00,5.45,12484.0,Spain
564734,20727,LUNCH BAG  BLACK SKULL.,4,2011-08-28 13:32:00,1.65,12484.0,Spain
564734,22380,TOY TIDY SPACEBOY  ,1,2011-08-28 13:32:00,2.1,12484.0,Spain
564734,22355,CHARLOTTE BAG SUKI DESIGN,6,2011-08-28 13:32:00,0.85,12484.0,Spain
564734,22940,FELTCRAFT CHRISTMAS FAIRY,6,2011-08-28 13:32:00,4.25,12484.0,Spain
564734,20728,LUNCH BAG CARS BLUE,3,2011-08-28 13:32:00,1.65,12484.0,Spain
564734,22383,LUNCH BAG SUKI DESIGN ,6,2011-08-28 13:32:00,1.65,12484.0,Spain
564734,22382,LUNCH BAG SPACEBOY DESIGN ,3,2011-08-28 13:32:00,1.65,12484.0,Spain
564734,21124,SET/10 BLUE POLKADOT PARTY CANDLES,24,2011-08-28 13:32:00,1.25,12484.0,Spain
564734,21122,SET/10 PINK POLKADOT PARTY CANDLES,24,2011-08-28 13:32:00,1.25,12484.0,Spain
564734,85116,BLACK CANDELABRA T-LIGHT HOLDER,5,2011-08-28 13:32:00,0.65,12484.0,Spain
564734,22083,PAPER CHAIN KIT RETROSPOT,6,2011-08-28 13:32:00,2.95,12484.0,Spain
564734,21993,FLORAL FOLK STATIONERY SET,3,2011-08-28 13:32:00,1.25,12484.0,Spain
564734,21992,VINTAGE PAISLEY STATIONERY SET,3,2011-08-28 13:32:00,1.25,12484.0,Spain
564734,17107D,FLOWER FAIRY 5 DRAWER LINERS,4,2011-08-28 13:32:00,2.55,12484.0,Spain
564734,17091J,VANILLA INCENSE IN TIN,6,2011-08-28 13:32:00,0.38,12484.0,Spain
564734,23198,PANTRY MAGNETIC  SHOPPING LIST,2,2011-08-28 13:32:00,1.45,12484.0,Spain
564734,22210,WOOD STAMP SET BEST WISHES,3,2011-08-28 13:32:00,0.83,12484.0,Spain
564734,22209,WOOD STAMP SET HAPPY BIRTHDAY,3,2011-08-28 13:32:00,0.83,12484.0,Spain
564734,22937,BAKING MOULD CHOCOLATE CUPCAKES,6,2011-08-28 13:32:00,2.55,12484.0,Spain
564734,11001,ASSTD DESIGN RACING CAR PEN,16,2011-08-28 13:32:00,1.69,12484.0,Spain
564734,22195,LARGE HEART MEASURING SPOONS,2,2011-08-28 13:32:00,1.65,12484.0,Spain
564734,85049G,CHOCOLATE BOX RIBBONS ,1,2011-08-28 13:32:00,1.25,12484.0,Spain
564734,22743,MAKE YOUR OWN FLOWERPOWER CARD KIT,4,2011-08-28 13:32:00,2.95,12484.0,Spain
564734,22742,MAKE YOUR OWN PLAYTIME CARD KIT,4,2011-08-28 13:32:00,2.95,12484.0,Spain
564734,84375,SET OF 20 KIDS COOKIE CUTTERS,6,2011-08-28 13:32:00,2.1,12484.0,Spain
564734,22629,SPACEBOY LUNCH BOX ,3,2011-08-28 13:32:00,1.95,12484.0,Spain
564734,72351B,SET/6 PINK  BUTTERFLY T-LIGHTS,4,2011-08-28 13:32:00,2.1,12484.0,Spain
564734,72349B,SET/6 PURPLE BUTTERFLY T-LIGHTS,5,2011-08-28 13:32:00,2.1,12484.0,Spain
564734,21544,SKULLS  WATER TRANSFER TATTOOS ,10,2011-08-28 13:32:00,0.85,12484.0,Spain
564734,21126,SET OF 6 GIRLS CELEBRATION CANDLES,6,2011-08-28 13:32:00,1.25,12484.0,Spain
564734,85049E,SCANDINAVIAN REDS RIBBONS,1,2011-08-28 13:32:00,1.25,12484.0,Spain
564734,22075,6 RIBBONS ELEGANT CHRISTMAS ,1,2011-08-28 13:32:00,1.65,12484.0,Spain
564734,85049A,TRADITIONAL CHRISTMAS RIBBONS,1,2011-08-28 13:32:00,1.25,12484.0,Spain
564734,85049G,CHOCOLATE BOX RIBBONS ,5,2011-08-28 13:32:00,1.25,12484.0,Spain
564734,85049F,BABY BOOM RIBBONS ,6,2011-08-28 13:32:00,1.25,12484.0,Spain
564734,22074,6 RIBBONS SHIMMERING PINKS ,6,2011-08-28 13:32:00,1.65,12484.0,Spain
564734,84378,SET OF 3 HEART COOKIE CUTTERS,6,2011-08-28 13:32:00,1.25,12484.0,Spain
564734,84380,SET OF 3 BUTTERFLY COOKIE CUTTERS,5,2011-08-28 13:32:00,1.25,12484.0,Spain
564734,22966,GINGERBREAD MAN COOKIE CUTTER,2,2011-08-28 13:32:00,1.25,12484.0,Spain
564734,22992,REVOLVER WOODEN RULER ,6,2011-08-28 13:32:00,1.95,12484.0,Spain
564734,22938,CUPCAKE LACE PAPER SET 6,12,2011-08-28 13:32:00,1.95,12484.0,Spain
564734,20992,JAZZ HEARTS PURSE NOTEBOOK,6,2011-08-28 13:32:00,0.39,12484.0,Spain
564734,21063,PARTY INVITES JAZZ HEARTS,6,2011-08-28 13:32:00,0.85,12484.0,Spain
564734,21059,PARTY INVITES DINOSAURS,8,2011-08-28 13:32:00,0.85,12484.0,Spain
564734,22588,CARD HOLDER GINGHAM HEART,3,2011-08-28 13:32:00,2.89,12484.0,Spain
564734,51014L,"FEATHER PEN,LIGHT PINK",12,2011-08-28 13:32:00,0.39,12484.0,Spain
564734,51014A,"FEATHER PEN,HOT PINK",12,2011-08-28 13:32:00,0.39,12484.0,Spain
564734,22283,6 EGG HOUSE PAINTED WOOD,1,2011-08-28 13:32:00,7.95,12484.0,Spain
564734,21329,DINOSAURS  WRITING SET ,6,2011-08-28 13:32:00,1.65,12484.0,Spain
564734,21356,TOAST ITS - FAIRY FLOWER,6,2011-08-28 13:32:00,1.25,12484.0,Spain
564734,21358,TOAST ITS - HAPPY BIRTHDAY,6,2011-08-28 13:32:00,1.25,12484.0,Spain
564734,21328,BALLOONS  WRITING SET ,6,2011-08-28 13:32:00,1.65,12484.0,Spain
564734,22991,GIRAFFE WOODEN RULER,6,2011-08-28 13:32:00,1.95,12484.0,Spain
564734,84596G,SMALL CHOCOLATES PINK BOWL,8,2011-08-28 13:32:00,0.42,12484.0,Spain
564734,84596F,SMALL MARSHMALLOWS PINK BOWL,16,2011-08-28 13:32:00,0.42,12484.0,Spain
564734,84596B,SMALL DOLLY MIX DESIGN ORANGE BOWL,16,2011-08-28 13:32:00,0.42,12484.0,Spain
564734,22932,BAKING MOULD TOFFEE CUP CHOCOLATE,3,2011-08-28 13:32:00,2.55,12484.0,Spain
564734,22931,BAKING MOULD HEART WHITE CHOCOLATE,3,2011-08-28 13:32:00,2.55,12484.0,Spain
564734,22282,12 EGG HOUSE PAINTED WOOD,1,2011-08-28 13:32:00,12.75,12484.0,Spain
564734,22367,CHILDRENS APRON SPACEBOY DESIGN,4,2011-08-28 13:32:00,1.95,12484.0,Spain
564734,21561,DINOSAUR LUNCH BOX WITH CUTLERY,6,2011-08-28 13:32:00,2.55,12484.0,Spain
564734,47559B,TEA TIME OVEN GLOVE,1,2011-08-28 13:32:00,1.25,12484.0,Spain
564734,47580,TEA TIME DES TEA COSY,1,2011-08-28 13:32:00,2.55,12484.0,Spain
564734,47580,TEA TIME DES TEA COSY,1,2011-08-28 13:32:00,2.55,12484.0,Spain
564734,47559B,TEA TIME OVEN GLOVE,3,2011-08-28 13:32:00,1.25,12484.0,Spain
564734,22278,OVERNIGHT BAG VINTAGE ROSE PAISLEY,3,2011-08-28 13:32:00,4.95,12484.0,Spain
564734,22276,WASH BAG VINTAGE ROSE PAISLEY,2,2011-08-28 13:32:00,2.55,12484.0,Spain
564734,47567B,TEA TIME KITCHEN APRON,5,2011-08-28 13:32:00,5.95,12484.0,Spain
564734,22416,SET OF 36 DOILIES SPACEBOY DESIGN ,3,2011-08-28 13:32:00,1.45,12484.0,Spain
564734,21211,SET OF 72 SKULL PAPER  DOILIES,3,2011-08-28 13:32:00,1.45,12484.0,Spain
564734,21972,SET OF 36 DINOSAUR PAPER DOILIES,5,2011-08-28 13:32:00,1.45,12484.0,Spain
564734,84987,SET OF 36 TEATIME PAPER DOILIES,6,2011-08-28 13:32:00,1.45,12484.0,Spain
564734,22278,OVERNIGHT BAG VINTAGE ROSE PAISLEY,2,2011-08-28 13:32:00,4.95,12484.0,Spain
564734,23306,SET OF 36 DOILIES PANTRY DESIGN,6,2011-08-28 13:32:00,1.45,12484.0,Spain
564734,47591D,PINK FAIRY CAKE CHILDRENS APRON,4,2011-08-28 13:32:00,1.95,12484.0,Spain
564734,20711,JUMBO BAG TOYS ,6,2011-08-28 13:32:00,2.08,12484.0,Spain
564735,21901,"KEY FOB , BACK DOOR ",6,2011-08-28 13:35:00,0.65,15856.0,United Kingdom
564735,21902,"KEY FOB , FRONT  DOOR ",6,2011-08-28 13:35:00,0.65,15856.0,United Kingdom
564735,21899,GARAGE KEY FOB,4,2011-08-28 13:35:00,0.65,15856.0,United Kingdom
564735,21900,"KEY FOB , SHED",6,2011-08-28 13:35:00,0.65,15856.0,United Kingdom
564735,22219,LOVEBIRD HANGING DECORATION WHITE ,37,2011-08-28 13:35:00,0.85,15856.0,United Kingdom
564735,85136C,RED SHARK HELICOPTER,1,2011-08-28 13:35:00,7.95,15856.0,United Kingdom
564735,85136A,YELLOW SHARK HELICOPTER,1,2011-08-28 13:35:00,7.95,15856.0,United Kingdom
564735,22306,SILVER MUG BONE CHINA TREE OF LIFE,2,2011-08-28 13:35:00,1.25,15856.0,United Kingdom
564735,22269,EGG CUP NATURAL CHICKEN,1,2011-08-28 13:35:00,0.39,15856.0,United Kingdom
564735,23330,DECORATIVE WICKER HEART MEDIUM,13,2011-08-28 13:35:00,1.25,15856.0,United Kingdom
564735,23333,IVORY WICKER HEART MEDIUM,12,2011-08-28 13:35:00,1.25,15856.0,United Kingdom
564735,22157,ANGEL DECORATION WITH LACE PADDED,48,2011-08-28 13:35:00,0.85,15856.0,United Kingdom
564735,22855,FINE WICKER HEART ,12,2011-08-28 13:35:00,1.25,15856.0,United Kingdom
564735,23228,FILIGREE HEART BIRD WHITE ,48,2011-08-28 13:35:00,1.25,15856.0,United Kingdom
564735,23326,HANGING MINI COLOURED BOTTLES,48,2011-08-28 13:35:00,0.63,15856.0,United Kingdom
564735,22296,HEART IVORY TRELLIS LARGE,36,2011-08-28 13:35:00,1.65,15856.0,United Kingdom
564735,22412,METAL SIGN NEIGHBOURHOOD WITCH ,12,2011-08-28 13:35:00,2.1,15856.0,United Kingdom
564735,23226,FILIGREE HEART DAISY WHITE,24,2011-08-28 13:35:00,1.25,15856.0,United Kingdom
564735,21165,BEWARE OF THE CAT METAL SIGN ,24,2011-08-28 13:35:00,1.69,15856.0,United Kingdom
564735,82600,NO SINGING METAL SIGN,12,2011-08-28 13:35:00,2.1,15856.0,United Kingdom
564735,82582,AREA PATROLLED METAL SIGN,12,2011-08-28 13:35:00,2.1,15856.0,United Kingdom
564735,82567,"AIRLINE LOUNGE,METAL SIGN",5,2011-08-28 13:35:00,2.1,15856.0,United Kingdom
564735,82552,WASHROOM METAL SIGN,6,2011-08-28 13:35:00,1.45,15856.0,United Kingdom
564735,22845,VINTAGE CREAM CAT FOOD CONTAINER,1,2011-08-28 13:35:00,6.35,15856.0,United Kingdom
564735,23110,PARISIENNE KEY CABINET ,1,2011-08-28 13:35:00,5.75,15856.0,United Kingdom
564735,23118,PARISIENNE JEWELLERY DRAWER ,2,2011-08-28 13:35:00,7.5,15856.0,United Kingdom
564735,84879,ASSORTED COLOUR BIRD ORNAMENT,8,2011-08-28 13:35:00,1.69,15856.0,United Kingdom
