InvoiceNo,StockCode,Description,Quantity,InvoiceDate,UnitPrice,CustomerID,Country
555396,22432,WATERING CAN PINK BUNNY,1,2011-06-02 17:23:00,1.95,16529.0,United Kingdom
555396,22961,JAM MAKING SET PRINTED,2,2011-06-02 17:23:00,1.45,16529.0,United Kingdom
555396,22147,FELTCRAFT BUTTERFLY HEARTS,10,2011-06-02 17:23:00,1.45,16529.0,United Kingdom
555396,20971,PINK BLUE FELT CRAFT TRINKET BOX,13,2011-06-02 17:23:00,1.25,16529.0,United Kingdom
555396,20972,PINK CREAM FELT CRAFT TRINKET BOX ,13,2011-06-02 17:23:00,1.25,16529.0,United Kingdom
555396,22750,FELTCRAFT PRINCESS LOLA DOLL,5,2011-06-02 17:23:00,3.75,16529.0,United Kingdom
555396,22749,FELTCRAFT PRINCESS CHARLOTTE DOLL,5,2011-06-02 17:23:00,3.75,16529.0,United Kingdom
555397,90018A,SILVER M.O.P ORBIT DROP EARRINGS,1,2011-06-02 17:26:00,4.15,,United Kingdom
555397,90059A,DIAMANTE HAIR GRIP PACK/2 CRYSTAL,4,2011-06-02 17:26:00,1.65,,United Kingdom
555397,90114,SUMMER DAISIES BAG CHARM,1,2011-06-02 17:26:00,2.46,,United Kingdom
555397,90165A,PINK ROSEBUD PEARL EARRINGS,1,2011-06-02 17:26:00,2.48,,United Kingdom
555397,90185D,CRYSTAL DIAMANTE EXPANDABLE RING,1,2011-06-02 17:26:00,4.15,,United Kingdom
555397,90214A,"LETTER ""A"" BLING KEY RING",1,2011-06-02 17:26:00,0.83,,United Kingdom
555397,DOT,DOTCOM POSTAGE,1,2011-06-02 17:26:00,216.8,,United Kingdom
555397,15036,ASSORTED COLOURS SILK FAN,1,2011-06-02 17:26:00,1.63,,United Kingdom
555397,15039,SANDALWOOD FAN,1,2011-06-02 17:26:00,1.63,,United Kingdom
555397,15056N,EDWARDIAN PARASOL NATURAL,1,2011-06-02 17:26:00,12.46,,United Kingdom
555397,15058A,BLUE POLKADOT GARDEN PARASOL,1,2011-06-02 17:26:00,10.79,,United Kingdom
555397,16207A,PINK STRAWBERRY HANDBAG ,1,2011-06-02 17:26:00,2.46,,United Kingdom
555397,17084N,FAIRY DREAMS INCENSE ,1,2011-06-02 17:26:00,0.42,,United Kingdom
555397,20616,CHERRY BLOSSOM PASSPORT COVER,1,2011-06-02 17:26:00,1.63,,United Kingdom
555397,20707,CRAZY DAISY HEART DECORATION,1,2011-06-02 17:26:00,0.83,,United Kingdom
555397,20712,JUMBO BAG WOODLAND ANIMALS,2,2011-06-02 17:26:00,4.13,,United Kingdom
555397,20733,GOLD MINI TAPE MEASURE ,2,2011-06-02 17:26:00,0.83,,United Kingdom
555397,20802,SMALL GLASS SUNDAE DISH CLEAR,6,2011-06-02 17:26:00,3.29,,United Kingdom
555397,20839,FRENCH PAISLEY CUSHION COVER ,2,2011-06-02 17:26:00,3.29,,United Kingdom
555397,20840,FRENCH FLORAL CUSHION COVER ,2,2011-06-02 17:26:00,3.29,,United Kingdom
555397,20914,SET/5 RED RETROSPOT LID GLASS BOWLS,1,2011-06-02 17:26:00,5.79,,United Kingdom
555397,20961,STRAWBERRY BATH SPONGE ,1,2011-06-02 17:26:00,2.46,,United Kingdom
555397,20963,APPLE BATH SPONGE,1,2011-06-02 17:26:00,2.46,,United Kingdom
555397,20972,PINK CREAM FELT CRAFT TRINKET BOX ,1,2011-06-02 17:26:00,2.46,,United Kingdom
555397,20985,HEART CALCULATOR,1,2011-06-02 17:26:00,2.46,,United Kingdom
555397,21033,JUMBO BAG CHARLIE AND LOLA TOYS,1,2011-06-02 17:26:00,4.13,,United Kingdom
555397,21078,SET/20 STRAWBERRY PAPER NAPKINS ,1,2011-06-02 17:26:00,1.63,,United Kingdom
555397,21084,SET/6 COLLAGE PAPER CUPS,4,2011-06-02 17:26:00,0.83,,United Kingdom
555397,21090,SET/6 COLLAGE PAPER PLATES,10,2011-06-02 17:26:00,0.83,,United Kingdom
555397,21095,SET/6 POSIES PAPER PLATES,1,2011-06-02 17:26:00,1.63,,United Kingdom
555397,21166,COOK WITH WINE METAL SIGN ,1,2011-06-02 17:26:00,4.13,,United Kingdom
555397,21172,PARTY METAL SIGN ,2,2011-06-02 17:26:00,4.13,,United Kingdom
555397,21188,3D HEARTS  HONEYCOMB PAPER GARLAND,6,2011-06-02 17:26:00,5.79,,United Kingdom
555397,21204,DAISIES  HONEYCOMB GARLAND ,4,2011-06-02 17:26:00,3.29,,United Kingdom
555397,21208,PASTEL COLOUR HONEYCOMB FAN,3,2011-06-02 17:26:00,3.29,,United Kingdom
555397,21231,SWEETHEART CERAMIC TRINKET BOX,1,2011-06-02 17:26:00,2.46,,United Kingdom
555397,21294,ETCHED GLASS COASTER,1,2011-06-02 17:26:00,2.46,,United Kingdom
555397,21313,GLASS HEART T-LIGHT HOLDER ,1,2011-06-02 17:26:00,1.63,,United Kingdom
555397,21340,CLASSIC METAL BIRDCAGE PLANT HOLDER,5,2011-06-02 17:26:00,24.96,,United Kingdom
555397,21385,IVORY HANGING DECORATION  HEART,3,2011-06-02 17:26:00,1.63,,United Kingdom
555397,21389,IVORY HANGING DECORATION  BIRD,1,2011-06-02 17:26:00,1.63,,United Kingdom
555397,21417,COCKLE SHELL DISH,1,2011-06-02 17:26:00,4.13,,United Kingdom
555397,21418,STARFISH SOAP DISH,2,2011-06-02 17:26:00,4.96,,United Kingdom
555397,21441,BLUE BIRDHOUSE DECORATION,2,2011-06-02 17:26:00,1.63,,United Kingdom
555397,21442,GREEN BIRDHOUSE DECORATION,1,2011-06-02 17:26:00,1.63,,United Kingdom
555397,21523,DOORMAT FANCY FONT HOME SWEET HOME,1,2011-06-02 17:26:00,15.79,,United Kingdom
555397,21524,DOORMAT SPOTTY HOME SWEET HOME,1,2011-06-02 17:26:00,16.63,,United Kingdom
555397,21557,SET OF 6 FUNKY BEAKERS,3,2011-06-02 17:26:00,5.79,,United Kingdom
555397,21713,CITRONELLA CANDLE FLOWERPOT,1,2011-06-02 17:26:00,4.13,,United Kingdom
555397,21714,CITRONELLA CANDLE GARDEN POT,4,2011-06-02 17:26:00,2.46,,United Kingdom
555397,21756,BATH BUILDING BLOCK WORD,1,2011-06-02 17:26:00,11.63,,United Kingdom
555397,21773,DECORATIVE ROSE BATHROOM BOTTLE,1,2011-06-02 17:26:00,2.46,,United Kingdom
555397,21774,DECORATIVE CATS BATHROOM BOTTLE,1,2011-06-02 17:26:00,2.46,,United Kingdom
555397,21781,MA CAMPAGNE CUTLERY BOX,1,2011-06-02 17:26:00,29.13,,United Kingdom
555397,21786,POLKADOT RAIN HAT ,4,2011-06-02 17:26:00,0.83,,United Kingdom
555397,21790,VINTAGE SNAP CARDS,1,2011-06-02 17:26:00,1.63,,United Kingdom
555397,21868,POTTING SHED TEA MUG,1,2011-06-02 17:26:00,3.29,,United Kingdom
555397,21872,GLAMOROUS  MUG,1,2011-06-02 17:26:00,3.29,,United Kingdom
555397,21900,"KEY FOB , SHED",1,2011-06-02 17:26:00,1.63,,United Kingdom
555397,21918,SET 12 KIDS COLOUR  CHALK STICKS,2,2011-06-02 17:26:00,0.83,,United Kingdom
555397,21930,JUMBO STORAGE BAG SKULLS,2,2011-06-02 17:26:00,4.13,,United Kingdom
555397,21931,JUMBO STORAGE BAG SUKI,1,2011-06-02 17:26:00,4.13,,United Kingdom
555397,21932,SCANDINAVIAN PAISLEY PICNIC BAG,1,2011-06-02 17:26:00,2.46,,United Kingdom
555397,21937,STRAWBERRY   PICNIC BAG,1,2011-06-02 17:26:00,5.79,,United Kingdom
555397,21945,STRAWBERRIES  DESIGN FLANNEL ,1,2011-06-02 17:26:00,1.63,,United Kingdom
555397,21977,PACK OF 60 PINK PAISLEY CAKE CASES,2,2011-06-02 17:26:00,1.25,,United Kingdom
555397,21982,PACK OF 12 SUKI TISSUES ,1,2011-06-02 17:26:00,0.83,,United Kingdom
555397,21992,VINTAGE PAISLEY STATIONERY SET,1,2011-06-02 17:26:00,2.46,,United Kingdom
555397,22041,"RECORD FRAME 7"" SINGLE SIZE ",3,2011-06-02 17:26:00,4.96,,United Kingdom
555397,22079,RIBBON REEL HEARTS DESIGN ,1,2011-06-02 17:26:00,3.29,,United Kingdom
555397,22083,PAPER CHAIN KIT RETROSPOT,2,2011-06-02 17:26:00,3.29,,United Kingdom
555397,22088,PAPER BUNTING COLOURED LACE,2,2011-06-02 17:26:00,5.79,,United Kingdom
555397,22098,BOUDOIR SQUARE TISSUE BOX,1,2011-06-02 17:26:00,2.46,,United Kingdom
555397,22116,METAL SIGN HIS DINNER IS SERVED,1,2011-06-02 17:26:00,1.63,,United Kingdom
555397,22131,FOOD CONTAINER SET 3 LOVE HEART ,1,2011-06-02 17:26:00,4.13,,United Kingdom
555397,22139,RETROSPOT TEA SET CERAMIC 11 PC ,1,2011-06-02 17:26:00,10.79,,United Kingdom
555397,22147,FELTCRAFT BUTTERFLY HEARTS,3,2011-06-02 17:26:00,3.29,,United Kingdom
555397,22149,FELTCRAFT 6 FLOWER FRIENDS,1,2011-06-02 17:26:00,4.13,,United Kingdom
555397,22161,HEART DECORATION RUSTIC HANGING ,4,2011-06-02 17:26:00,0.79,,United Kingdom
555397,22165,"DIAMANTE HEART SHAPED WALL MIRROR, ",1,2011-06-02 17:26:00,10.79,,United Kingdom
555397,22178,VICTORIAN GLASS HANGING T-LIGHT,9,2011-06-02 17:26:00,2.46,,United Kingdom
555397,22188,BLACK HEART CARD HOLDER,1,2011-06-02 17:26:00,8.29,,United Kingdom
555397,22212,FOUR HOOK  WHITE LOVEBIRDS,1,2011-06-02 17:26:00,4.13,,United Kingdom
555397,22215,CAKE STAND WHITE TWO TIER LACE,1,2011-06-02 17:26:00,16.63,,United Kingdom
555397,22219,LOVEBIRD HANGING DECORATION WHITE ,3,2011-06-02 17:26:00,1.63,,United Kingdom
555397,22221,CAKE STAND LOVEBIRD 2 TIER PINK,1,2011-06-02 17:26:00,19.96,,United Kingdom
555397,22222,CAKE PLATE LOVEBIRD WHITE,2,2011-06-02 17:26:00,9.96,,United Kingdom
555397,22224,WHITE LOVEBIRD LANTERN,1,2011-06-02 17:26:00,5.79,,United Kingdom
555397,22227,HANGING HEART MIRROR DECORATION ,4,2011-06-02 17:26:00,1.25,,United Kingdom
555397,22248,DECORATION  PINK CHICK MAGIC GARDEN,1,2011-06-02 17:26:00,1.63,,United Kingdom
555397,22260,FELT EGG COSY BLUE RABBIT ,1,2011-06-02 17:26:00,1.63,,United Kingdom
555397,22261,FELT EGG COSY WHITE RABBIT ,1,2011-06-02 17:26:00,1.63,,United Kingdom
555397,22262,FELT EGG COSY CHICKEN,1,2011-06-02 17:26:00,1.63,,United Kingdom
555397,22263,FELT EGG COSY LADYBIRD ,1,2011-06-02 17:26:00,1.63,,United Kingdom
555397,22304,COFFEE MUG BLUE PAISLEY DESIGN,1,2011-06-02 17:26:00,4.96,,United Kingdom
555397,22305,COFFEE MUG PINK PAISLEY DESIGN,1,2011-06-02 17:26:00,4.96,,United Kingdom
555397,22315,200 RED + WHITE BENDY STRAWS,1,2011-06-02 17:26:00,2.46,,United Kingdom
555397,22321,BIRD DECORATION RED RETROSPOT,3,2011-06-02 17:26:00,1.63,,United Kingdom
555397,22322,BIRD DECORATION GREEN POLKADOT,1,2011-06-02 17:26:00,1.63,,United Kingdom
555397,22326,ROUND SNACK BOXES SET OF4 WOODLAND ,1,2011-06-02 17:26:00,5.79,,United Kingdom
555397,22348,TEA BAG PLATE RED RETROSPOT,1,2011-06-02 17:26:00,1.63,,United Kingdom
555397,22362,GLASS JAR PEACOCK BATH SALTS,1,2011-06-02 17:26:00,5.79,,United Kingdom
555397,22379,RECYCLING BAG RETROSPOT ,1,2011-06-02 17:26:00,4.13,,United Kingdom
555397,22381,TOY TIDY PINK POLKADOT,1,2011-06-02 17:26:00,4.13,,United Kingdom
555397,22385,JUMBO BAG SPACEBOY DESIGN,2,2011-06-02 17:26:00,4.13,,United Kingdom
555397,22398,MAGNETS PACK OF 4 SWALLOWS,1,2011-06-02 17:26:00,2.46,,United Kingdom
555397,22427,ENAMEL FLOWER JUG CREAM,1,2011-06-02 17:26:00,11.63,,United Kingdom
555397,22448,PIN CUSHION BABUSHKA RED,1,2011-06-02 17:26:00,6.63,,United Kingdom
555397,22456,NATURAL SLATE CHALKBOARD LARGE ,1,2011-06-02 17:26:00,9.96,,United Kingdom
555397,22469,HEART OF WICKER SMALL,28,2011-06-02 17:26:00,3.29,,United Kingdom
555397,22493,PAINT YOUR OWN CANVAS SET,1,2011-06-02 17:26:00,3.29,,United Kingdom
555397,22494,EMERGENCY FIRST AID TIN ,1,2011-06-02 17:26:00,2.46,,United Kingdom
555397,22502,PICNIC BASKET WICKER SMALL,1,2011-06-02 17:26:00,10.79,,United Kingdom
555397,22553,PLASTERS IN TIN SKULLS,1,2011-06-02 17:26:00,3.29,,United Kingdom
555397,22595,GINGHAM HEART DECORATION,1,2011-06-02 17:26:00,1.63,,United Kingdom
555397,22602,RETROSPOT WOODEN HEART DECORATION,5,2011-06-02 17:26:00,1.63,,United Kingdom
555397,22639,SET OF 4 NAPKIN CHARMS HEARTS,2,2011-06-02 17:26:00,4.96,,United Kingdom
555397,22654,DELUXE SEWING KIT ,1,2011-06-02 17:26:00,11.63,,United Kingdom
555397,22670,FRENCH WC SIGN BLUE METAL,1,2011-06-02 17:26:00,2.46,,United Kingdom
555397,22692,DOORMAT WELCOME TO OUR HOME,1,2011-06-02 17:26:00,15.79,,United Kingdom
555397,22743,MAKE YOUR OWN FLOWERPOWER CARD KIT,1,2011-06-02 17:26:00,5.79,,United Kingdom
555397,22759,SET OF 3 NOTEBOOKS IN PARCEL,1,2011-06-02 17:26:00,3.29,,United Kingdom
555397,22773,GREEN DRAWER KNOB ACRYLIC EDWARDIAN,1,2011-06-02 17:26:00,2.46,,United Kingdom
555397,22840,ROUND CAKE TIN VINTAGE RED,1,2011-06-02 17:26:00,15.79,,United Kingdom
555397,22863,SOAP DISH BROCANTE,1,2011-06-02 17:26:00,5.79,,United Kingdom
555397,22893,MINI CAKE STAND T-LIGHT HOLDER,1,2011-06-02 17:26:00,0.83,,United Kingdom
555397,22902,TOTE BAG I LOVE LONDON,14,2011-06-02 17:26:00,4.13,,United Kingdom
555397,22916,HERB MARKER THYME,1,2011-06-02 17:26:00,1.63,,United Kingdom
555397,22920,HERB MARKER BASIL,1,2011-06-02 17:26:00,1.63,,United Kingdom
555397,22925,BLUE GIANT GARDEN THERMOMETER,1,2011-06-02 17:26:00,12.46,,United Kingdom
555397,22927,GREEN GIANT GARDEN THERMOMETER,1,2011-06-02 17:26:00,12.46,,United Kingdom
555397,22953,BIRTHDAY PARTY CORDON BARRIER TAPE,2,2011-06-02 17:26:00,2.46,,United Kingdom
555397,22969,HOMEMADE JAM SCENTED CANDLES,4,2011-06-02 17:26:00,3.29,,United Kingdom
555397,22993,SET OF 4 PANTRY JELLY MOULDS,2,2011-06-02 17:26:00,2.46,,United Kingdom
555397,22998,TRAVEL CARD WALLET KEEP CALM,1,2011-06-02 17:26:00,0.83,,United Kingdom
555397,23004,TRAVEL CARD WALLET PANTRY,1,2011-06-02 17:26:00,0.83,,United Kingdom
555397,23007, SPACEBOY BABY GIFT SET,1,2011-06-02 17:26:00,24.96,,United Kingdom
555397,23009,I LOVE LONDON BABY GIFT SET,1,2011-06-02 17:26:00,24.96,,United Kingdom
555397,23050,RECYCLED ACAPULCO MAT GREEN,1,2011-06-02 17:26:00,16.63,,United Kingdom
555397,23051,RECYCLED ACAPULCO MAT BLUE,2,2011-06-02 17:26:00,16.63,,United Kingdom
555397,23052,RECYCLED ACAPULCO MAT TURQUOISE,1,2011-06-02 17:26:00,16.63,,United Kingdom
555397,23054,RECYCLED ACAPULCO MAT LAVENDER,1,2011-06-02 17:26:00,16.63,,United Kingdom
555397,23084,RABBIT NIGHT LIGHT,3,2011-06-02 17:26:00,4.13,,United Kingdom
555397,23112,PARISIENNE CURIO CABINET,1,2011-06-02 17:26:00,14.96,,United Kingdom
555397,23118,PARISIENNE JEWELLERY DRAWER ,1,2011-06-02 17:26:00,14.96,,United Kingdom
555397,23155,KNICKERBOCKERGLORY MAGNET ASSORTED ,1,2011-06-02 17:26:00,8.29,,United Kingdom
555397,23157,SET OF 6 NATIVITY MAGNETS ,1,2011-06-02 17:26:00,4.13,,United Kingdom
555397,23158,SET OF 5 LUCKY CAT MAGNETS ,1,2011-06-02 17:26:00,4.13,,United Kingdom
555397,23159,SET OF 5 PANCAKE DAY MAGNETS,1,2011-06-02 17:26:00,4.13,,United Kingdom
555397,23165,LARGE CERAMIC TOP STORAGE JAR,1,2011-06-02 17:26:00,3.29,,United Kingdom
555397,23171,REGENCY TEA PLATE GREEN ,1,2011-06-02 17:26:00,3.29,,United Kingdom
555397,23172,REGENCY TEA PLATE PINK,1,2011-06-02 17:26:00,3.29,,United Kingdom
555397,23182,TOILET SIGN OCCUPIED OR VACANT,1,2011-06-02 17:26:00,2.46,,United Kingdom
555397,23190,BUNDLE OF 3 SCHOOL EXERCISE BOOKS  ,1,2011-06-02 17:26:00,3.29,,United Kingdom
555397,23199,JUMBO BAG APPLES,1,2011-06-02 17:26:00,4.13,,United Kingdom
555397,23201,JUMBO BAG ALPHABET,1,2011-06-02 17:26:00,4.13,,United Kingdom
555397,23203,JUMBO BAG DOILEY PATTERNS,2,2011-06-02 17:26:00,4.13,,United Kingdom
555397,23204,CHARLOTTE BAG APPLES DESIGN,1,2011-06-02 17:26:00,1.63,,United Kingdom
555397,23209,LUNCH BAG DOILEY PATTERN ,1,2011-06-02 17:26:00,4.13,,United Kingdom
555397,23228,FILIGREE HEART BIRD WHITE ,1,2011-06-02 17:26:00,2.46,,United Kingdom
555397,23284,DOORMAT KEEP CALM AND COME IN,3,2011-06-02 17:26:00,16.63,,United Kingdom
555397,23298,SPOTTY BUNTING,1,2011-06-02 17:26:00,10.79,,United Kingdom
555397,23300,GARDENERS KNEELING PAD CUP OF TEA ,1,2011-06-02 17:26:00,3.29,,United Kingdom
555397,23301,GARDENERS KNEELING PAD KEEP CALM ,1,2011-06-02 17:26:00,3.29,,United Kingdom
555397,35004B,SET OF 3 BLACK FLYING DUCKS,1,2011-06-02 17:26:00,5.79,,United Kingdom
555397,35911A,MULTICOLOUR RABBIT EGG WARMER,2,2011-06-02 17:26:00,0.83,,United Kingdom
555397,46776F,WOVEN ROSE GARDEN CUSHION COVER ,6,2011-06-02 17:26:00,4.13,,United Kingdom
555397,47013C,WINE BOTTLE DRESSING DARK BLUE,1,2011-06-02 17:26:00,0.83,,United Kingdom
555397,47574A,ENGLISH ROSE SCENTED HANGING FLOWER,3,2011-06-02 17:26:00,2.46,,United Kingdom
555397,72817,SET OF 2 CHRISTMAS DECOUPAGE CANDLE,3,2011-06-02 17:26:00,1.63,,United Kingdom
555397,82567,"AIRLINE LOUNGE,METAL SIGN",1,2011-06-02 17:26:00,1.63,,United Kingdom
555397,84078A,SET/4 WHITE RETRO STORAGE CUBES ,1,2011-06-02 17:26:00,58.29,,United Kingdom
555397,84086C,PINK/PURPLE RETRO RADIO,1,2011-06-02 17:26:00,4.13,,United Kingdom
555397,84347,ROTATING SILVER ANGELS T-LIGHT HLDR,1,2011-06-02 17:26:00,4.96,,United Kingdom
555397,84510A,SET OF 4 ENGLISH ROSE COASTERS,1,2011-06-02 17:26:00,2.46,,United Kingdom
555397,84510E,SET OF 4 GREEN CAROUSEL COASTERS,1,2011-06-02 17:26:00,2.46,,United Kingdom
555397,84536A,ENGLISH ROSE NOTEBOOK A7 SIZE,16,2011-06-02 17:26:00,0.83,,United Kingdom
555397,84596B,SMALL DOLLY MIX DESIGN ORANGE BOWL,1,2011-06-02 17:26:00,0.83,,United Kingdom
555397,84596F,SMALL MARSHMALLOWS PINK BOWL,1,2011-06-02 17:26:00,0.83,,United Kingdom
555397,84596L,BISCUITS SMALL BOWL LIGHT BLUE,1,2011-06-02 17:26:00,0.83,,United Kingdom
555397,84674,FLYING PIG WATERING CAN,1,2011-06-02 17:26:00,5.79,,United Kingdom
555397,84692,BOX OF 24 COCKTAIL PARASOLS,3,2011-06-02 17:26:00,0.83,,United Kingdom
555397,84796B,BLUE SAVANNAH PICNIC HAMPER FOR 2,3,2011-06-02 17:26:00,8.29,,United Kingdom
555397,84849A,HELLO SAILOR BLUE SOAP HOLDER,1,2011-06-02 17:26:00,3.29,,United Kingdom
555397,84907,PINK YELLOW PATCH CUSHION COVER,1,2011-06-02 17:26:00,5.79,,United Kingdom
555397,84913A,SOFT PINK ROSE TOWEL ,1,2011-06-02 17:26:00,3.29,,United Kingdom
555397,84919,BLUE CUSHION COVER WITH FLOWER,1,2011-06-02 17:26:00,5.79,,United Kingdom
555397,84927D,LA PALMIERA TILE HOOK,1,2011-06-02 17:26:00,4.13,,United Kingdom
555397,84945,MULTI COLOUR SILVER T-LIGHT HOLDER,6,2011-06-02 17:26:00,1.8,,United Kingdom
555397,84946,ANTIQUE SILVER T-LIGHT GLASS,3,2011-06-02 17:26:00,2.46,,United Kingdom
555397,84949,SILVER HANGING T-LIGHT HOLDER,3,2011-06-02 17:26:00,3.29,,United Kingdom
555397,84951A,SET OF 4 PISTACHIO LOVEBIRD COASTER,3,2011-06-02 17:26:00,2.46,,United Kingdom
555397,84951B,SET OF 4 BLACK LOVEBIRD COASTERS,1,2011-06-02 17:26:00,2.46,,United Kingdom
555397,84968C,SET OF 16 VINTAGE PISTACHIO CUTLERY,2,2011-06-02 17:26:00,24.96,,United Kingdom
555397,84969,BOX OF 6 ASSORTED COLOUR TEASPOONS,1,2011-06-02 17:26:00,3.29,,United Kingdom
555397,84970L,SINGLE HEART ZINC T-LIGHT HOLDER,1,2011-06-02 17:26:00,2.08,,United Kingdom
555397,84978,HANGING HEART JAR T-LIGHT HOLDER,3,2011-06-02 17:26:00,2.46,,United Kingdom
555397,84988,SET OF 72 PINK HEART PAPER DOILIES,2,2011-06-02 17:26:00,2.92,,United Kingdom
555397,84992,72 SWEETHEART FAIRY CAKE CASES,1,2011-06-02 17:26:00,1.25,,United Kingdom
555397,84997A,CHILDRENS CUTLERY POLKADOT GREEN ,1,2011-06-02 17:26:00,8.29,,United Kingdom
555397,85059,FRENCH ENAMEL WATER BASIN,1,2011-06-02 17:26:00,7.46,,United Kingdom
555397,85099B,JUMBO BAG RED RETROSPOT,1,2011-06-02 17:26:00,4.13,,United Kingdom
555397,85099F,JUMBO BAG STRAWBERRY,1,2011-06-02 17:26:00,4.13,,United Kingdom
555397,85123A,WHITE HANGING HEART T-LIGHT HOLDER,2,2011-06-02 17:26:00,5.79,,United Kingdom
555397,85131A,BEADED PEARL HEART WHITE ON STICK,19,2011-06-02 17:26:00,0.83,,United Kingdom
555397,85131B,BEADED CRYSTAL HEART GREEN ON STICK,8,2011-06-02 17:26:00,0.83,,United Kingdom
555397,85199L,LARGE HANGING IVORY & RED WOOD BIRD,1,2011-06-02 17:26:00,1.25,,United Kingdom
555397,85199S,SMALL HANGING IVORY/RED WOOD BIRD,4,2011-06-02 17:26:00,0.83,,United Kingdom
555397,85203,HANGING WOOD AND FELT BUTTERFLY ,1,2011-06-02 17:26:00,0.79,,United Kingdom
555397,85204,HANGING WOOD AND FELT FLOWER,4,2011-06-02 17:26:00,0.42,,United Kingdom
555397,90010A,MIDNIGHT BLUE GLASS/SILVER BRACELET,1,2011-06-02 17:26:00,9.57,,United Kingdom
C555398,20703,BLUE PADDED SOFT MOBILE,-3,2011-06-02 17:30:00,4.25,17375.0,United Kingdom
C555398,22325,MOBILE VINTAGE HEARTS ,-3,2011-06-02 17:30:00,4.95,17375.0,United Kingdom
555399,20727,LUNCH BAG  BLACK SKULL.,3,2011-06-02 17:41:00,1.65,15555.0,United Kingdom
555399,23208,LUNCH BAG VINTAGE LEAF DESIGN,2,2011-06-02 17:41:00,1.65,15555.0,United Kingdom
555399,22382,LUNCH BAG SPACEBOY DESIGN ,4,2011-06-02 17:41:00,1.65,15555.0,United Kingdom
555399,20725,LUNCH BAG RED RETROSPOT,3,2011-06-02 17:41:00,1.65,15555.0,United Kingdom
555399,22662,LUNCH BAG DOLLY GIRL DESIGN,3,2011-06-02 17:41:00,1.65,15555.0,United Kingdom
555399,23209,LUNCH BAG DOILEY PATTERN ,4,2011-06-02 17:41:00,1.65,15555.0,United Kingdom
555399,20726,LUNCH BAG WOODLAND,3,2011-06-02 17:41:00,1.65,15555.0,United Kingdom
555399,23206,LUNCH BAG APPLE DESIGN,3,2011-06-02 17:41:00,1.65,15555.0,United Kingdom
555399,22383,LUNCH BAG SUKI DESIGN ,3,2011-06-02 17:41:00,1.65,15555.0,United Kingdom
555399,22553,PLASTERS IN TIN SKULLS,1,2011-06-02 17:41:00,1.65,15555.0,United Kingdom
555399,22551,PLASTERS IN TIN SPACEBOY,1,2011-06-02 17:41:00,1.65,15555.0,United Kingdom
555399,22557,PLASTERS IN TIN VINTAGE PAISLEY ,1,2011-06-02 17:41:00,1.65,15555.0,United Kingdom
555399,22554,PLASTERS IN TIN WOODLAND ANIMALS,1,2011-06-02 17:41:00,1.65,15555.0,United Kingdom
555399,22556,PLASTERS IN TIN CIRCUS PARADE ,3,2011-06-02 17:41:00,1.65,15555.0,United Kingdom
555399,22555,PLASTERS IN TIN STRONGMAN,3,2011-06-02 17:41:00,1.65,15555.0,United Kingdom
555399,22560,TRADITIONAL MODELLING CLAY,3,2011-06-02 17:41:00,1.25,15555.0,United Kingdom
555399,23158,SET OF 5 LUCKY CAT MAGNETS ,5,2011-06-02 17:41:00,2.08,15555.0,United Kingdom
555399,22563,HAPPY STENCIL CRAFT,3,2011-06-02 17:41:00,1.25,15555.0,United Kingdom
555399,22561,WOODEN SCHOOL COLOURING SET,3,2011-06-02 17:41:00,1.65,15555.0,United Kingdom
555399,22147,FELTCRAFT BUTTERFLY HEARTS,3,2011-06-02 17:41:00,1.45,15555.0,United Kingdom
555399,22178,VICTORIAN GLASS HANGING T-LIGHT,12,2011-06-02 17:41:00,1.25,15555.0,United Kingdom
555399,82486,WOOD S/3 CABINET ANT WHITE FINISH,2,2011-06-02 17:41:00,8.95,15555.0,United Kingdom
555399,21034,REX CASH+CARRY JUMBO SHOPPER,1,2011-06-02 17:41:00,0.95,15555.0,United Kingdom
555400,22730,ALARM CLOCK BAKELIKE IVORY,10,2011-06-02 17:50:00,3.39,14088.0,United Kingdom
555400,22727,ALARM CLOCK BAKELIKE RED ,10,2011-06-02 17:50:00,3.39,14088.0,United Kingdom
555400,22898,CHILDRENS APRON APPLES DESIGN,4,2011-06-02 17:50:00,1.65,14088.0,United Kingdom
555400,84078A,SET/4 WHITE RETRO STORAGE CUBES ,8,2011-06-02 17:50:00,34.95,14088.0,United Kingdom
555400,22430,ENAMEL WATERING CAN CREAM,2,2011-06-02 17:50:00,4.25,14088.0,United Kingdom
555400,22427,ENAMEL FLOWER JUG CREAM,22,2011-06-02 17:50:00,5.45,14088.0,United Kingdom
555400,22424,ENAMEL BREAD BIN CREAM,11,2011-06-02 17:50:00,10.95,14088.0,United Kingdom
555400,23208,LUNCH BAG VINTAGE LEAF DESIGN,24,2011-06-02 17:50:00,1.45,14088.0,United Kingdom
555400,20728,LUNCH BAG CARS BLUE,51,2011-06-02 17:50:00,1.45,14088.0,United Kingdom
555400,85099C,JUMBO  BAG BAROQUE BLACK WHITE,47,2011-06-02 17:50:00,1.79,14088.0,United Kingdom
555400,21929,JUMBO BAG PINK VINTAGE PAISLEY,27,2011-06-02 17:50:00,1.79,14088.0,United Kingdom
555400,15056BL,EDWARDIAN PARASOL BLACK,16,2011-06-02 17:50:00,1.95,14088.0,United Kingdom
555400,15056N,EDWARDIAN PARASOL NATURAL,24,2011-06-02 17:50:00,1.95,14088.0,United Kingdom
555400,85014B,RED RETROSPOT UMBRELLA,9,2011-06-02 17:50:00,4.95,14088.0,United Kingdom
555400,22798,ANTIQUE GLASS DRESSING TABLE POT,20,2011-06-02 17:50:00,2.55,14088.0,United Kingdom
555400,22801,ANTIQUE GLASS PEDESTAL BOWL,16,2011-06-02 17:50:00,3.39,14088.0,United Kingdom
555400,22617,BAKING SET SPACEBOY DESIGN,7,2011-06-02 17:50:00,4.25,14088.0,United Kingdom
555400,22900, SET 2 TEA TOWELS I LOVE LONDON ,41,2011-06-02 17:50:00,2.75,14088.0,United Kingdom
555400,22138,BAKING SET 9 PIECE RETROSPOT ,33,2011-06-02 17:50:00,4.25,14088.0,United Kingdom
555400,22902,TOTE BAG I LOVE LONDON,38,2011-06-02 17:50:00,1.69,14088.0,United Kingdom
555400,22606,WOODEN SKITTLES GARDEN SET,5,2011-06-02 17:50:00,12.75,14088.0,United Kingdom
555400,22607,WOODEN ROUNDERS GARDEN SET ,19,2011-06-02 17:50:00,8.5,14088.0,United Kingdom
555400,22605,WOODEN CROQUET GARDEN SET,15,2011-06-02 17:50:00,12.75,14088.0,United Kingdom
555400,22057,CERAMIC PLATE STRAWBERRY DESIGN,21,2011-06-02 17:50:00,1.25,14088.0,United Kingdom
555400,21232,STRAWBERRY CERAMIC TRINKET BOX,72,2011-06-02 17:50:00,1.06,14088.0,United Kingdom
555400,22649,STRAWBERRY FAIRY CAKE TEAPOT,3,2011-06-02 17:50:00,4.25,14088.0,United Kingdom
555400,23175,REGENCY MILK JUG PINK ,11,2011-06-02 17:50:00,2.75,14088.0,United Kingdom
555400,23174,REGENCY SUGAR BOWL GREEN,12,2011-06-02 17:50:00,3.75,14088.0,United Kingdom
555400,23173,REGENCY TEAPOT ROSES ,10,2011-06-02 17:50:00,8.15,14088.0,United Kingdom
555400,22699,ROSES REGENCY TEACUP AND SAUCER ,40,2011-06-02 17:50:00,2.55,14088.0,United Kingdom
555400,22698,PINK REGENCY TEACUP AND SAUCER,60,2011-06-02 17:50:00,2.55,14088.0,United Kingdom
555400,22697,GREEN REGENCY TEACUP AND SAUCER,72,2011-06-02 17:50:00,2.55,14088.0,United Kingdom
555400,22423,REGENCY CAKESTAND 3 TIER,39,2011-06-02 17:50:00,10.95,14088.0,United Kingdom
555400,21871,SAVE THE PLANET MUG,72,2011-06-02 17:50:00,1.06,14088.0,United Kingdom
555400,22842,BISCUIT TIN VINTAGE RED,1,2011-06-02 17:50:00,5.95,14088.0,United Kingdom
555400,22838,3 TIER CAKE TIN RED AND CREAM,5,2011-06-02 17:50:00,12.75,14088.0,United Kingdom
555400,22847,BREAD BIN DINER STYLE IVORY,9,2011-06-02 17:50:00,14.95,14088.0,United Kingdom
555400,22846,BREAD BIN DINER STYLE RED ,4,2011-06-02 17:50:00,14.95,14088.0,United Kingdom
555400,22625,RED KITCHEN SCALES,18,2011-06-02 17:50:00,7.65,14088.0,United Kingdom
555400,22624,IVORY KITCHEN SCALES,32,2011-06-02 17:50:00,7.65,14088.0,United Kingdom
555400,22897,OVEN MITT APPLES DESIGN,19,2011-06-02 17:50:00,1.25,14088.0,United Kingdom
555400,22894,TABLECLOTH RED APPLES DESIGN ,7,2011-06-02 17:50:00,8.15,14088.0,United Kingdom
555400,22767,TRIPLE PHOTO FRAME CORNICE ,6,2011-06-02 17:50:00,8.5,14088.0,United Kingdom
555400,85066,CREAM SWEETHEART MINI CHEST,7,2011-06-02 17:50:00,10.95,14088.0,United Kingdom
555400,22768,FAMILY PHOTO FRAME CORNICE,12,2011-06-02 17:50:00,8.5,14088.0,United Kingdom
555400,82482,WOODEN PICTURE FRAME WHITE FINISH,65,2011-06-02 17:50:00,2.1,14088.0,United Kingdom
555400,82486,WOOD S/3 CABINET ANT WHITE FINISH,8,2011-06-02 17:50:00,8.15,14088.0,United Kingdom
555400,82484,WOOD BLACK BOARD ANT WHITE FINISH,15,2011-06-02 17:50:00,6.75,14088.0,United Kingdom
555400,22854,CREAM SWEETHEART EGG HOLDER,8,2011-06-02 17:50:00,4.25,14088.0,United Kingdom
555400,23142,IVORY WIRE KITCHEN ORGANISER,7,2011-06-02 17:50:00,9.15,14088.0,United Kingdom
555400,22776,SWEETHEART CAKESTAND 3 TIER,17,2011-06-02 17:50:00,8.5,14088.0,United Kingdom
555400,22502,PICNIC BASKET WICKER SMALL,16,2011-06-02 17:50:00,4.95,14088.0,United Kingdom
555400,22501,PICNIC BASKET WICKER LARGE,31,2011-06-02 17:50:00,8.5,14088.0,United Kingdom
555400,23053,RECYCLED ACAPULCO MAT PINK,2,2011-06-02 17:50:00,7.45,14088.0,United Kingdom
555400,23054,RECYCLED ACAPULCO MAT LAVENDER,6,2011-06-02 17:50:00,7.45,14088.0,United Kingdom
555400,23051,RECYCLED ACAPULCO MAT BLUE,8,2011-06-02 17:50:00,7.45,14088.0,United Kingdom
