InvoiceNo,StockCode,Description,Quantity,InvoiceDate,UnitPrice,CustomerID,Country
561021,22423,REGENCY CAKESTAND 3 TIER,16,2011-07-24 10:03:00,10.95,15465.0,United Kingdom
561021,22666,RECIPE BOX PANTRY YELLOW DESIGN,6,2011-07-24 10:03:00,2.95,15465.0,United Kingdom
561021,21793,CLASSIC FRENCH STYLE BASKET BROWN,5,2011-07-24 10:03:00,3.95,15465.0,United Kingdom
561021,23284,DOORMAT KEEP CALM AND COME IN,10,2011-07-24 10:03:00,6.75,15465.0,United Kingdom
561021,84879,ASSORTED COLOUR BIRD ORNAMENT,24,2011-07-24 10:03:00,1.69,15465.0,United Kingdom
561022,23005,TRAVEL CARD WALLET I LOVE LONDON,24,2011-07-24 10:24:00,0.42,14800.0,United Kingdom
561022,22431,WATERING CAN BLUE ELEPHANT,5,2011-07-24 10:24:00,1.95,14800.0,United Kingdom
561022,22432,WATERING CAN PINK BUNNY,5,2011-07-24 10:24:00,1.95,14800.0,United Kingdom
561022,23310,BUBBLEGUM RING ASSORTED,72,2011-07-24 10:24:00,0.42,14800.0,United Kingdom
561022,23002,TRAVEL CARD WALLET SKULLS,24,2011-07-24 10:24:00,0.42,14800.0,United Kingdom
561022,17003,BROCADE RING PURSE ,36,2011-07-24 10:24:00,0.29,14800.0,United Kingdom
561022,23290,SPACEBOY CHILDRENS BOWL,12,2011-07-24 10:24:00,1.25,14800.0,United Kingdom
561022,23289,DOLLY GIRL CHILDRENS BOWL,12,2011-07-24 10:24:00,1.25,14800.0,United Kingdom
561022,22659,LUNCH BOX I LOVE LONDON,5,2011-07-24 10:24:00,1.95,14800.0,United Kingdom
561022,23256,CHILDRENS CUTLERY SPACEBOY ,5,2011-07-24 10:24:00,4.15,14800.0,United Kingdom
561022,23254,CHILDRENS CUTLERY DOLLY GIRL ,5,2011-07-24 10:24:00,4.15,14800.0,United Kingdom
561022,23291,DOLLY GIRL CHILDRENS CUP,8,2011-07-24 10:24:00,1.25,14800.0,United Kingdom
561022,23292,SPACEBOY CHILDRENS CUP,8,2011-07-24 10:24:00,1.25,14800.0,United Kingdom
561022,23238,SET OF 4 KNICK KNACK TINS LONDON ,6,2011-07-24 10:24:00,4.15,14800.0,United Kingdom
561022,23281,FOLDING BUTTERFLY MIRROR RED  ,12,2011-07-24 10:24:00,0.83,14800.0,United Kingdom
561022,23280,FOLDING BUTTERFLY MIRROR HOT PINK ,12,2011-07-24 10:24:00,0.83,14800.0,United Kingdom
561022,22751,FELTCRAFT PRINCESS OLIVIA DOLL,3,2011-07-24 10:24:00,3.75,14800.0,United Kingdom
561022,22749,FELTCRAFT PRINCESS CHARLOTTE DOLL,3,2011-07-24 10:24:00,3.75,14800.0,United Kingdom
561022,22750,FELTCRAFT PRINCESS LOLA DOLL,3,2011-07-24 10:24:00,3.75,14800.0,United Kingdom
561022,20970,PINK FLORAL FELTCRAFT SHOULDER BAG,6,2011-07-24 10:24:00,3.75,14800.0,United Kingdom
561023,21137,BLACK RECORD COVER FRAME,72,2011-07-24 10:30:00,3.39,13576.0,United Kingdom
561023,22041,"RECORD FRAME 7"" SINGLE SIZE ",48,2011-07-24 10:30:00,2.1,13576.0,United Kingdom
561023,21179,NO JUNK MAIL METAL SIGN,24,2011-07-24 10:30:00,0.39,13576.0,United Kingdom
561024,22789,T-LIGHT HOLDER SWEETHEART HANGING,12,2011-07-24 10:35:00,1.95,12916.0,United Kingdom
561024,22784,LANTERN CREAM GAZEBO ,4,2011-07-24 10:35:00,4.95,12916.0,United Kingdom
561024,23132,SMALL IVORY HEART WALL ORGANISER,6,2011-07-24 10:35:00,5.75,12916.0,United Kingdom
561024,22173,METAL 4 HOOK HANGER FRENCH CHATEAU,8,2011-07-24 10:35:00,2.95,12916.0,United Kingdom
561024,22189,CREAM HEART CARD HOLDER,5,2011-07-24 10:35:00,3.95,12916.0,United Kingdom
561024,84949,SILVER HANGING T-LIGHT HOLDER,18,2011-07-24 10:35:00,1.65,12916.0,United Kingdom
561024,84946,ANTIQUE SILVER T-LIGHT GLASS,6,2011-07-24 10:35:00,1.25,12916.0,United Kingdom
561024,82482,WOODEN PICTURE FRAME WHITE FINISH,6,2011-07-24 10:35:00,2.55,12916.0,United Kingdom
561024,21642,ASSORTED TUTTI FRUTTI PEN,48,2011-07-24 10:35:00,0.29,12916.0,United Kingdom
561024,21638,ASSORTED TUTTI FRUTTI NOTEBOOK,12,2011-07-24 10:35:00,2.1,12916.0,United Kingdom
561024,21643,ASSORTED TUTTI FRUTTI MIRROR,24,2011-07-24 10:35:00,1.25,12916.0,United Kingdom
561024,22776,SWEETHEART CAKESTAND 3 TIER,2,2011-07-24 10:35:00,9.95,12916.0,United Kingdom
561024,22795,SWEETHEART RECIPE BOOK STAND,4,2011-07-24 10:35:00,6.75,12916.0,United Kingdom
561024,23322,LARGE WHITE HEART OF WICKER,8,2011-07-24 10:35:00,2.95,12916.0,United Kingdom
561024,85123A,WHITE HANGING HEART T-LIGHT HOLDER,64,2011-07-24 10:35:00,2.55,12916.0,United Kingdom
561024,85066,CREAM SWEETHEART MINI CHEST,2,2011-07-24 10:35:00,12.75,12916.0,United Kingdom
561024,21428,SET3 BOOK BOX GREEN GINGHAM FLOWER ,3,2011-07-24 10:35:00,4.25,12916.0,United Kingdom
561024,22927,GREEN GIANT GARDEN THERMOMETER,2,2011-07-24 10:35:00,5.95,12916.0,United Kingdom
561024,22925,BLUE GIANT GARDEN THERMOMETER,2,2011-07-24 10:35:00,5.95,12916.0,United Kingdom
561024,82486,WOOD S/3 CABINET ANT WHITE FINISH,4,2011-07-24 10:35:00,8.95,12916.0,United Kingdom
561024,23094,LE GRAND TRAY CHIC SET,2,2011-07-24 10:35:00,12.5,12916.0,United Kingdom
561024,82483,WOOD 2 DRAWER CABINET WHITE FINISH,2,2011-07-24 10:35:00,6.95,12916.0,United Kingdom
561024,21429,RED GINGHAM ROSE JEWELLERY BOX,6,2011-07-24 10:35:00,1.95,12916.0,United Kingdom
561024,82484,WOOD BLACK BOARD ANT WHITE FINISH,3,2011-07-24 10:35:00,7.95,12916.0,United Kingdom
561024,21430,SET/3 RED GINGHAM ROSE STORAGE BOX,4,2011-07-24 10:35:00,3.75,12916.0,United Kingdom
561024,23298,SPOTTY BUNTING,6,2011-07-24 10:35:00,4.95,12916.0,United Kingdom
561025,22855,FINE WICKER HEART ,2,2011-07-24 10:37:00,1.25,16241.0,United Kingdom
561025,22602,RETROSPOT WOODEN HEART DECORATION,4,2011-07-24 10:37:00,0.85,16241.0,United Kingdom
561025,84970S,HANGING HEART ZINC T-LIGHT HOLDER,4,2011-07-24 10:37:00,0.85,16241.0,United Kingdom
561025,23322,LARGE WHITE HEART OF WICKER,1,2011-07-24 10:37:00,2.95,16241.0,United Kingdom
561025,22634,CHILDS BREAKFAST SET SPACEBOY ,1,2011-07-24 10:37:00,9.95,16241.0,United Kingdom
561025,21932,SCANDINAVIAN PAISLEY PICNIC BAG,1,2011-07-24 10:37:00,1.65,16241.0,United Kingdom
561025,23203,JUMBO BAG DOILEY PATTERNS,1,2011-07-24 10:37:00,2.08,16241.0,United Kingdom
561025,23201,JUMBO BAG ALPHABET,1,2011-07-24 10:37:00,2.08,16241.0,United Kingdom
561025,21931,JUMBO STORAGE BAG SUKI,1,2011-07-24 10:37:00,2.08,16241.0,United Kingdom
561025,23202,JUMBO BAG VINTAGE LEAF,1,2011-07-24 10:37:00,2.08,16241.0,United Kingdom
561025,22386,JUMBO BAG PINK POLKADOT,1,2011-07-24 10:37:00,2.08,16241.0,United Kingdom
561025,21929,JUMBO BAG PINK VINTAGE PAISLEY,1,2011-07-24 10:37:00,2.08,16241.0,United Kingdom
561025,22411,JUMBO SHOPPER VINTAGE RED PAISLEY,1,2011-07-24 10:37:00,2.08,16241.0,United Kingdom
561025,22692,DOORMAT WELCOME TO OUR HOME,1,2011-07-24 10:37:00,7.95,16241.0,United Kingdom
561025,23284,DOORMAT KEEP CALM AND COME IN,1,2011-07-24 10:37:00,7.95,16241.0,United Kingdom
561025,48187,DOORMAT NEW ENGLAND,1,2011-07-24 10:37:00,7.95,16241.0,United Kingdom
561025,22649,STRAWBERRY FAIRY CAKE TEAPOT,1,2011-07-24 10:37:00,4.95,16241.0,United Kingdom
561025,85183A,CHARLIE & LOLA WASTEPAPER BIN BLUE,1,2011-07-24 10:37:00,1.25,16241.0,United Kingdom
561025,21096,SET/6 FRUIT SALAD  PAPER PLATES,2,2011-07-24 10:37:00,0.39,16241.0,United Kingdom
561025,20727,LUNCH BAG  BLACK SKULL.,2,2011-07-24 10:37:00,1.65,16241.0,United Kingdom
561025,23204,CHARLOTTE BAG APPLES DESIGN,1,2011-07-24 10:37:00,0.85,16241.0,United Kingdom
561025,23209,LUNCH BAG DOILEY PATTERN ,1,2011-07-24 10:37:00,1.65,16241.0,United Kingdom
561025,85183B,CHARLIE & LOLA WASTEPAPER BIN FLORA,1,2011-07-24 10:37:00,1.25,16241.0,United Kingdom
561025,23207,LUNCH BAG ALPHABET DESIGN,1,2011-07-24 10:37:00,1.65,16241.0,United Kingdom
561025,22382,LUNCH BAG SPACEBOY DESIGN ,1,2011-07-24 10:37:00,1.65,16241.0,United Kingdom
561025,22384,LUNCH BAG PINK POLKADOT,1,2011-07-24 10:37:00,1.65,16241.0,United Kingdom
561025,20724,RED RETROSPOT CHARLOTTE BAG,1,2011-07-24 10:37:00,0.85,16241.0,United Kingdom
561025,22383,LUNCH BAG SUKI DESIGN ,1,2011-07-24 10:37:00,1.65,16241.0,United Kingdom
561025,22662,LUNCH BAG DOLLY GIRL DESIGN,1,2011-07-24 10:37:00,1.65,16241.0,United Kingdom
561025,20726,LUNCH BAG WOODLAND,1,2011-07-24 10:37:00,1.65,16241.0,United Kingdom
561025,22908,PACK OF 20 NAPKINS RED APPLES,1,2011-07-24 10:37:00,0.85,16241.0,United Kingdom
561025,23308,SET OF 60 VINTAGE LEAF CAKE CASES ,1,2011-07-24 10:37:00,0.55,16241.0,United Kingdom
561025,23309,SET OF 60 I LOVE LONDON CAKE CASES ,1,2011-07-24 10:37:00,0.55,16241.0,United Kingdom
561025,23307,SET OF 60 PANTRY DESIGN CAKE CASES ,1,2011-07-24 10:37:00,0.55,16241.0,United Kingdom
561025,84247N,PACK/12 BLUE FOLKART CARDS,1,2011-07-24 10:37:00,2.95,16241.0,United Kingdom
561025,84536A,ENGLISH ROSE NOTEBOOK A7 SIZE,1,2011-07-24 10:37:00,0.42,16241.0,United Kingdom
561025,22219,LOVEBIRD HANGING DECORATION WHITE ,1,2011-07-24 10:37:00,0.85,16241.0,United Kingdom
561025,84692,BOX OF 24 COCKTAIL PARASOLS,2,2011-07-24 10:37:00,0.42,16241.0,United Kingdom
561025,22280,POCKET BAG PINK PAISELY BROWN SPOT,1,2011-07-24 10:37:00,1.25,16241.0,United Kingdom
561025,22279,POCKET BAG BLUE PAISLEY RED SPOT,1,2011-07-24 10:37:00,1.25,16241.0,United Kingdom
561025,82600,NO SINGING METAL SIGN,1,2011-07-24 10:37:00,2.1,16241.0,United Kingdom
561025,21908,CHOCOLATE THIS WAY METAL SIGN,1,2011-07-24 10:37:00,2.1,16241.0,United Kingdom
561025,22412,METAL SIGN NEIGHBOURHOOD WITCH ,1,2011-07-24 10:37:00,2.1,16241.0,United Kingdom
561025,21733,RED HANGING HEART T-LIGHT HOLDER,2,2011-07-24 10:37:00,2.95,16241.0,United Kingdom
561025,85123A,WHITE HANGING HEART T-LIGHT HOLDER,2,2011-07-24 10:37:00,2.95,16241.0,United Kingdom
561025,21974,SET OF 36 PAISLEY FLOWER DOILIES,1,2011-07-24 10:37:00,1.45,16241.0,United Kingdom
561025,84987,SET OF 36 TEATIME PAPER DOILIES,1,2011-07-24 10:37:00,1.45,16241.0,United Kingdom
561025,23306,SET OF 36 DOILIES PANTRY DESIGN,1,2011-07-24 10:37:00,1.45,16241.0,United Kingdom
561025,22416,SET OF 36 DOILIES SPACEBOY DESIGN ,1,2011-07-24 10:37:00,1.45,16241.0,United Kingdom
561025,23298,SPOTTY BUNTING,2,2011-07-24 10:37:00,4.95,16241.0,United Kingdom
561025,47566B,TEA TIME PARTY BUNTING,2,2011-07-24 10:37:00,4.95,16241.0,United Kingdom
561025,47566,PARTY BUNTING,2,2011-07-24 10:37:00,4.95,16241.0,United Kingdom
561025,21621,VINTAGE UNION JACK BUNTING,1,2011-07-24 10:37:00,8.5,16241.0,United Kingdom
561025,22851,SET 20 NAPKINS FAIRY CAKES DESIGN ,1,2011-07-24 10:37:00,0.85,16241.0,United Kingdom
561025,21078,SET/20 STRAWBERRY PAPER NAPKINS ,1,2011-07-24 10:37:00,0.85,16241.0,United Kingdom
561025,21989,PACK OF 20 SKULL PAPER NAPKINS,1,2011-07-24 10:37:00,0.85,16241.0,United Kingdom
561025,22613,PACK OF 20 SPACEBOY NAPKINS,1,2011-07-24 10:37:00,0.85,16241.0,United Kingdom
561025,22907,PACK OF 20 NAPKINS PANTRY DESIGN,2,2011-07-24 10:37:00,0.85,16241.0,United Kingdom
561025,23245,SET OF 3 REGENCY CAKE TINS,1,2011-07-24 10:37:00,4.95,16241.0,United Kingdom
561025,22752,SET 7 BABUSHKA NESTING BOXES,1,2011-07-24 10:37:00,8.5,16241.0,United Kingdom
561025,21755,LOVE BUILDING BLOCK WORD,1,2011-07-24 10:37:00,5.95,16241.0,United Kingdom
561025,20914,SET/5 RED RETROSPOT LID GLASS BOWLS,1,2011-07-24 10:37:00,2.95,16241.0,United Kingdom
561025,21874,GIN AND TONIC MUG,3,2011-07-24 10:37:00,1.25,16241.0,United Kingdom
561025,21530,DAIRY MAID TOASTRACK,3,2011-07-24 10:37:00,0.79,16241.0,United Kingdom
561025,22093,MOTORING TISSUE BOX,1,2011-07-24 10:37:00,0.39,16241.0,United Kingdom
561025,22095,LADS ONLY TISSUE BOX,3,2011-07-24 10:37:00,0.39,16241.0,United Kingdom
561025,22091,EMPIRE TISSUE BOX,1,2011-07-24 10:37:00,0.39,16241.0,United Kingdom
561025,22092,BLUE PAISLEY TISSUE BOX,1,2011-07-24 10:37:00,0.39,16241.0,United Kingdom
561025,22099,CARAVAN SQUARE TISSUE BOX,1,2011-07-24 10:37:00,0.39,16241.0,United Kingdom
561025,22096,PINK PAISLEY SQUARE TISSUE BOX ,1,2011-07-24 10:37:00,0.39,16241.0,United Kingdom
561025,22097,SWALLOW SQUARE TISSUE BOX,1,2011-07-24 10:37:00,0.39,16241.0,United Kingdom
561026,20711,JUMBO BAG TOYS ,1,2011-07-24 10:49:00,2.08,17265.0,United Kingdom
561026,23200,JUMBO BAG PEARS,3,2011-07-24 10:49:00,2.08,17265.0,United Kingdom
561026,23199,JUMBO BAG APPLES,3,2011-07-24 10:49:00,2.08,17265.0,United Kingdom
561026,23203,JUMBO BAG DOILEY PATTERNS,2,2011-07-24 10:49:00,2.08,17265.0,United Kingdom
561026,23344,JUMBO BAG 50'S CHRISTMAS ,2,2011-07-24 10:49:00,2.08,17265.0,United Kingdom
561026,85099B,JUMBO BAG RED RETROSPOT,1,2011-07-24 10:49:00,2.08,17265.0,United Kingdom
561026,23343,JUMBO BAG VINTAGE CHRISTMAS ,2,2011-07-24 10:49:00,2.08,17265.0,United Kingdom
561026,22909,SET OF 20 VINTAGE CHRISTMAS NAPKINS,4,2011-07-24 10:49:00,0.85,17265.0,United Kingdom
561026,21179,NO JUNK MAIL METAL SIGN,5,2011-07-24 10:49:00,0.39,17265.0,United Kingdom
561026,22092,BLUE PAISLEY TISSUE BOX,1,2011-07-24 10:49:00,0.39,17265.0,United Kingdom
561026,23296,SET OF 6 TEA TIME BAKING CASES,2,2011-07-24 10:49:00,1.25,17265.0,United Kingdom
561026,22211,WOOD STAMP SET FLOWERS,1,2011-07-24 10:49:00,0.83,17265.0,United Kingdom
561026,23307,SET OF 60 PANTRY DESIGN CAKE CASES ,1,2011-07-24 10:49:00,0.55,17265.0,United Kingdom
561026,21976,PACK OF 60 MUSHROOM CAKE CASES,2,2011-07-24 10:49:00,0.55,17265.0,United Kingdom
561026,21213,PACK OF 72 SKULL CAKE CASES,2,2011-07-24 10:49:00,0.55,17265.0,United Kingdom
561026,22952,60 CAKE CASES VINTAGE CHRISTMAS,4,2011-07-24 10:49:00,0.55,17265.0,United Kingdom
561026,23307,SET OF 60 PANTRY DESIGN CAKE CASES ,3,2011-07-24 10:49:00,0.55,17265.0,United Kingdom
561026,84992,72 SWEETHEART FAIRY CAKE CASES,4,2011-07-24 10:49:00,0.55,17265.0,United Kingdom
561026,21089,SET/6 GREEN SPRING PAPER CUPS,2,2011-07-24 10:49:00,0.19,17265.0,United Kingdom
561026,22994,TRAVEL CARD WALLET RETROSPOT,5,2011-07-24 10:49:00,0.42,17265.0,United Kingdom
561026,23002,TRAVEL CARD WALLET SKULLS,5,2011-07-24 10:49:00,0.42,17265.0,United Kingdom
561026,23006,TRAVEL CARD WALLET FLOWER MEADOW,5,2011-07-24 10:49:00,0.42,17265.0,United Kingdom
561026,22996,TRAVEL CARD WALLET VINTAGE TICKET,5,2011-07-24 10:49:00,0.42,17265.0,United Kingdom
561026,23000,TRAVEL CARD WALLET TRANSPORT,20,2011-07-24 10:49:00,0.42,17265.0,United Kingdom
561026,23005,TRAVEL CARD WALLET I LOVE LONDON,5,2011-07-24 10:49:00,0.42,17265.0,United Kingdom
561026,22998,TRAVEL CARD WALLET KEEP CALM,20,2011-07-24 10:49:00,0.42,17265.0,United Kingdom
561026,23091,ZINC HERB GARDEN CONTAINER,1,2011-07-24 10:49:00,6.25,17265.0,United Kingdom
561026,22362,GLASS JAR PEACOCK BATH SALTS,1,2011-07-24 10:49:00,2.95,17265.0,United Kingdom
561026,22361,GLASS JAR DAISY FRESH COTTON WOOL,1,2011-07-24 10:49:00,2.95,17265.0,United Kingdom
561026,22360,GLASS JAR ENGLISH CONFECTIONERY,1,2011-07-24 10:49:00,2.95,17265.0,United Kingdom
561026,85053,FRENCH ENAMEL CANDLEHOLDER,3,2011-07-24 10:49:00,2.1,17265.0,United Kingdom
561026,21533,RETROSPOT LARGE MILK JUG,2,2011-07-24 10:49:00,4.95,17265.0,United Kingdom
561026,22094,RED RETROSPOT TISSUE BOX,1,2011-07-24 10:49:00,0.39,17265.0,United Kingdom
561026,22093,MOTORING TISSUE BOX,1,2011-07-24 10:49:00,0.39,17265.0,United Kingdom
561026,22098,BOUDOIR SQUARE TISSUE BOX,1,2011-07-24 10:49:00,0.39,17265.0,United Kingdom
561026,22094,RED RETROSPOT TISSUE BOX,1,2011-07-24 10:49:00,0.39,17265.0,United Kingdom
561026,22091,EMPIRE TISSUE BOX,1,2011-07-24 10:49:00,0.39,17265.0,United Kingdom
561026,23089,GLASS BON BON JAR,6,2011-07-24 10:49:00,1.65,17265.0,United Kingdom
561026,22427,ENAMEL FLOWER JUG CREAM,3,2011-07-24 10:49:00,5.95,17265.0,United Kingdom
561026,84660B,BLACK STITCHED WALL CLOCK,1,2011-07-24 10:49:00,0.79,17265.0,United Kingdom
561026,84660A,WHITE STITCHED WALL CLOCK,1,2011-07-24 10:49:00,0.79,17265.0,United Kingdom
561026,84663A,GRASS HOPPER WOODEN WALL CLOCK ,1,2011-07-24 10:49:00,0.79,17265.0,United Kingdom
561026,84660C,PINK STITCHED WALL CLOCK,1,2011-07-24 10:49:00,0.79,17265.0,United Kingdom
561026,21533,RETROSPOT LARGE MILK JUG,1,2011-07-24 10:49:00,4.95,17265.0,United Kingdom
561026,23091,ZINC HERB GARDEN CONTAINER,1,2011-07-24 10:49:00,6.25,17265.0,United Kingdom
561026,21535,RED RETROSPOT SMALL MILK JUG,2,2011-07-24 10:49:00,2.55,17265.0,United Kingdom
561026,21530,DAIRY MAID TOASTRACK,2,2011-07-24 10:49:00,0.79,17265.0,United Kingdom
561026,21900,"KEY FOB , SHED",15,2011-07-24 10:49:00,0.65,17265.0,United Kingdom
561026,21901,"KEY FOB , BACK DOOR ",4,2011-07-24 10:49:00,0.65,17265.0,United Kingdom
561026,21899,GARAGE KEY FOB,15,2011-07-24 10:49:00,0.65,17265.0,United Kingdom
561027,20725,LUNCH BAG RED RETROSPOT,100,2011-07-24 10:54:00,1.45,13802.0,United Kingdom
561027,23209,LUNCH BAG DOILEY PATTERN ,100,2011-07-24 10:54:00,1.45,13802.0,United Kingdom
561027,21929,JUMBO BAG PINK VINTAGE PAISLEY,100,2011-07-24 10:54:00,1.79,13802.0,United Kingdom
561027,22411,JUMBO SHOPPER VINTAGE RED PAISLEY,100,2011-07-24 10:54:00,1.79,13802.0,United Kingdom
561027,47559B,TEA TIME OVEN GLOVE,50,2011-07-24 10:54:00,1.06,13802.0,United Kingdom
561027,21217,RED RETROSPOT ROUND CAKE TINS,12,2011-07-24 10:54:00,8.95,13802.0,United Kingdom
561027,21535,RED RETROSPOT SMALL MILK JUG,48,2011-07-24 10:54:00,2.1,13802.0,United Kingdom
561027,22139,RETROSPOT TEA SET CERAMIC 11 PC ,24,2011-07-24 10:54:00,4.25,13802.0,United Kingdom
561027,21531,RED RETROSPOT SUGAR JAM BOWL,24,2011-07-24 10:54:00,2.1,13802.0,United Kingdom
561027,21926,RED/CREAM STRIPE CUSHION COVER ,24,2011-07-24 10:54:00,1.25,13802.0,United Kingdom
561027,22178,VICTORIAN GLASS HANGING T-LIGHT,96,2011-07-24 10:54:00,1.06,13802.0,United Kingdom
561027,21035,SET/2 RED RETROSPOT TEA TOWELS ,100,2011-07-24 10:54:00,2.75,13802.0,United Kingdom
561028,23547,WRAP FLOWER SHOP  ,25,2011-07-24 11:06:00,0.42,17769.0,United Kingdom
561028,23550,WRAP ALPHABET POSTER  ,25,2011-07-24 11:06:00,0.42,17769.0,United Kingdom
561028,23548,WRAP MAGIC FOREST ,25,2011-07-24 11:06:00,0.42,17769.0,United Kingdom
561028,22906,12 MESSAGE CARDS WITH ENVELOPES,10,2011-07-24 11:06:00,1.65,17769.0,United Kingdom
561028,22616,PACK OF 12 LONDON TISSUES ,12,2011-07-24 11:06:00,0.29,17769.0,United Kingdom
561028,47566,PARTY BUNTING,6,2011-07-24 11:06:00,4.95,17769.0,United Kingdom
561028,23321,SMALL WHITE HEART OF WICKER,9,2011-07-24 11:06:00,1.65,17769.0,United Kingdom
561028,22904,CALENDAR PAPER CUT DESIGN,6,2011-07-24 11:06:00,2.95,17769.0,United Kingdom
561028,22659,LUNCH BOX I LOVE LONDON,2,2011-07-24 11:06:00,1.95,17769.0,United Kingdom
561028,22623,BOX OF VINTAGE JIGSAW BLOCKS ,3,2011-07-24 11:06:00,5.95,17769.0,United Kingdom
561028,22622,BOX OF VINTAGE ALPHABET BLOCKS,2,2011-07-24 11:06:00,11.95,17769.0,United Kingdom
561028,23207,LUNCH BAG ALPHABET DESIGN,2,2011-07-24 11:06:00,1.65,17769.0,United Kingdom
561028,20726,LUNCH BAG WOODLAND,4,2011-07-24 11:06:00,1.65,17769.0,United Kingdom
561028,20725,LUNCH BAG RED RETROSPOT,2,2011-07-24 11:06:00,1.65,17769.0,United Kingdom
561028,23019,SMALL APOTHECARY MEASURING JAR ,1,2011-07-24 11:06:00,8.25,17769.0,United Kingdom
561028,23300,GARDENERS KNEELING PAD CUP OF TEA ,6,2011-07-24 11:06:00,1.65,17769.0,United Kingdom
561028,21745,GAOLERS KEYS DECORATIVE GARDEN ,2,2011-07-24 11:06:00,3.75,17769.0,United Kingdom
561028,22970,LONDON BUS COFFEE MUG,6,2011-07-24 11:06:00,2.55,17769.0,United Kingdom
561028,22792,FLUTED ANTIQUE CANDLE HOLDER,12,2011-07-24 11:06:00,0.85,17769.0,United Kingdom
561028,84879,ASSORTED COLOUR BIRD ORNAMENT,8,2011-07-24 11:06:00,1.69,17769.0,United Kingdom
561028,21731,RED TOADSTOOL LED NIGHT LIGHT,8,2011-07-24 11:06:00,1.65,17769.0,United Kingdom
561028,84755,COLOUR GLASS T-LIGHT HOLDER HANGING,40,2011-07-24 11:06:00,0.65,17769.0,United Kingdom
561028,22798,ANTIQUE GLASS DRESSING TABLE POT,8,2011-07-24 11:06:00,2.95,17769.0,United Kingdom
561028,22720,SET OF 3 CAKE TINS PANTRY DESIGN ,4,2011-07-24 11:06:00,4.95,17769.0,United Kingdom
561029,22908,PACK OF 20 NAPKINS RED APPLES,12,2011-07-24 11:25:00,0.85,12490.0,France
561029,22895,SET OF 2 TEA TOWELS APPLE AND PEARS,6,2011-07-24 11:25:00,3.25,12490.0,France
561029,22303,COFFEE MUG APPLES DESIGN,6,2011-07-24 11:25:00,2.55,12490.0,France
561029,23204,CHARLOTTE BAG APPLES DESIGN,10,2011-07-24 11:25:00,0.85,12490.0,France
561029,23206,LUNCH BAG APPLE DESIGN,10,2011-07-24 11:25:00,1.65,12490.0,France
561029,21156,RETROSPOT CHILDRENS APRON,8,2011-07-24 11:25:00,1.95,12490.0,France
561029,20724,RED RETROSPOT CHARLOTTE BAG,10,2011-07-24 11:25:00,0.85,12490.0,France
561029,21122,SET/10 PINK POLKADOT PARTY CANDLES,24,2011-07-24 11:25:00,1.25,12490.0,France
561029,22356,CHARLOTTE BAG PINK POLKADOT,10,2011-07-24 11:25:00,0.85,12490.0,France
561029,22386,JUMBO BAG PINK POLKADOT,10,2011-07-24 11:25:00,2.08,12490.0,France
561029,22381,TOY TIDY PINK POLKADOT,5,2011-07-24 11:25:00,2.1,12490.0,France
561029,23203,JUMBO BAG DOILEY PATTERNS,10,2011-07-24 11:25:00,2.08,12490.0,France
561029,20712,JUMBO BAG WOODLAND ANIMALS,10,2011-07-24 11:25:00,2.08,12490.0,France
561029,20719,WOODLAND CHARLOTTE BAG,10,2011-07-24 11:25:00,0.85,12490.0,France
561029,20726,LUNCH BAG WOODLAND,10,2011-07-24 11:25:00,1.65,12490.0,France
561029,22898,CHILDRENS APRON APPLES DESIGN,8,2011-07-24 11:25:00,1.95,12490.0,France
561029,23241,TREASURE TIN GYMKHANA DESIGN,6,2011-07-24 11:25:00,2.08,12490.0,France
561029,21915,RED  HARMONICA IN BOX ,12,2011-07-24 11:25:00,1.25,12490.0,France
561029,22139,RETROSPOT TEA SET CERAMIC 11 PC ,3,2011-07-24 11:25:00,4.95,12490.0,France
561029,21559,STRAWBERRY LUNCH BOX WITH CUTLERY,6,2011-07-24 11:25:00,2.55,12490.0,France
561029,22659,LUNCH BOX I LOVE LONDON,12,2011-07-24 11:25:00,1.95,12490.0,France
561029,21121,SET/10 RED POLKADOT PARTY CANDLES,24,2011-07-24 11:25:00,1.25,12490.0,France
561029,21731,RED TOADSTOOL LED NIGHT LIGHT,12,2011-07-24 11:25:00,1.65,12490.0,France
561029,POST,POSTAGE,2,2011-07-24 11:25:00,18.0,12490.0,France
561030,23298,SPOTTY BUNTING,2,2011-07-24 11:25:00,4.95,16407.0,United Kingdom
561030,82486,WOOD S/3 CABINET ANT WHITE FINISH,1,2011-07-24 11:25:00,8.95,16407.0,United Kingdom
561030,82483,WOOD 2 DRAWER CABINET WHITE FINISH,1,2011-07-24 11:25:00,6.95,16407.0,United Kingdom
561030,23091,ZINC HERB GARDEN CONTAINER,2,2011-07-24 11:25:00,6.25,16407.0,United Kingdom
561030,22979,PANTRY WASHING UP BRUSH,2,2011-07-24 11:25:00,1.45,16407.0,United Kingdom
561030,21745,GAOLERS KEYS DECORATIVE GARDEN ,2,2011-07-24 11:25:00,3.75,16407.0,United Kingdom
561030,23186,FRENCH STYLE STORAGE JAR CAFE ,6,2011-07-24 11:25:00,0.29,16407.0,United Kingdom
561030,21770,OPEN CLOSED METAL SIGN,1,2011-07-24 11:25:00,4.95,16407.0,United Kingdom
561030,21179,NO JUNK MAIL METAL SIGN,12,2011-07-24 11:25:00,0.39,16407.0,United Kingdom
561030,84836,ZINC METAL HEART DECORATION,12,2011-07-24 11:25:00,1.25,16407.0,United Kingdom
561030,23245,SET OF 3 REGENCY CAKE TINS,4,2011-07-24 11:25:00,4.95,16407.0,United Kingdom
561030,21756,BATH BUILDING BLOCK WORD,2,2011-07-24 11:25:00,5.95,16407.0,United Kingdom
561030,22120,WELCOME  WOODEN BLOCK LETTERS,2,2011-07-24 11:25:00,9.95,16407.0,United Kingdom
561030,23029,DRAWER KNOB CRACKLE GLAZE GREEN,6,2011-07-24 11:25:00,1.65,16407.0,United Kingdom
561030,23032,DRAWER KNOB CRACKLE GLAZE IVORY,6,2011-07-24 11:25:00,1.65,16407.0,United Kingdom
561030,23031,DRAWER KNOB CRACKLE GLAZE PINK,6,2011-07-24 11:25:00,1.65,16407.0,United Kingdom
561030,22772,PINK DRAWER KNOB ACRYLIC EDWARDIAN,24,2011-07-24 11:25:00,1.25,16407.0,United Kingdom
561030,23322,LARGE WHITE HEART OF WICKER,1,2011-07-24 11:25:00,2.95,16407.0,United Kingdom
561030,22771,CLEAR DRAWER KNOB ACRYLIC EDWARDIAN,36,2011-07-24 11:25:00,1.25,16407.0,United Kingdom
561030,35961,FOLKART ZINC HEART CHRISTMAS DEC,12,2011-07-24 11:25:00,0.85,16407.0,United Kingdom
561030,23321,SMALL WHITE HEART OF WICKER,4,2011-07-24 11:25:00,1.65,16407.0,United Kingdom
561030,21253,SET OF PICTURE FRAME  STICKERS,1,2011-07-24 11:25:00,2.95,16407.0,United Kingdom
561030,85123A,WHITE HANGING HEART T-LIGHT HOLDER,4,2011-07-24 11:25:00,2.95,16407.0,United Kingdom
561031,20724,RED RETROSPOT CHARLOTTE BAG,100,2011-07-24 11:32:00,0.72,13461.0,United Kingdom
561031,23204,CHARLOTTE BAG APPLES DESIGN,100,2011-07-24 11:32:00,0.72,13461.0,United Kingdom
561031,20723,STRAWBERRY CHARLOTTE BAG,100,2011-07-24 11:32:00,0.72,13461.0,United Kingdom
561031,20719,WOODLAND CHARLOTTE BAG,100,2011-07-24 11:32:00,0.72,13461.0,United Kingdom
561031,22077,6 RIBBONS RUSTIC CHARM,12,2011-07-24 11:32:00,1.65,13461.0,United Kingdom
561032,22504,CABIN BAG VINTAGE RETROSPOT,12,2011-07-24 11:37:00,24.95,13029.0,United Kingdom
561032,22379,RECYCLING BAG RETROSPOT ,10,2011-07-24 11:37:00,2.1,13029.0,United Kingdom
561032,23199,JUMBO BAG APPLES,10,2011-07-24 11:37:00,2.08,13029.0,United Kingdom
561032,20727,LUNCH BAG  BLACK SKULL.,10,2011-07-24 11:37:00,1.65,13029.0,United Kingdom
561032,22384,LUNCH BAG PINK POLKADOT,10,2011-07-24 11:37:00,1.65,13029.0,United Kingdom
561032,84874B,BLUE TRAVEL FIRST AID KIT,10,2011-07-24 11:37:00,1.65,13029.0,United Kingdom
561033,22029,SPACEBOY BIRTHDAY CARD,12,2011-07-24 11:40:00,0.42,14443.0,United Kingdom
561033,16161U,WRAP SUKI AND FRIENDS,25,2011-07-24 11:40:00,0.42,14443.0,United Kingdom
561033,22045,SPACEBOY GIFT WRAP,25,2011-07-24 11:40:00,0.42,14443.0,United Kingdom
561033,23233,WRAP POPPIES  DESIGN,25,2011-07-24 11:40:00,0.42,14443.0,United Kingdom
561033,23232,WRAP VINTAGE LEAF DESIGN,25,2011-07-24 11:40:00,0.42,14443.0,United Kingdom
561033,23230,WRAP ALPHABET DESIGN,25,2011-07-24 11:40:00,0.42,14443.0,United Kingdom
561033,22381,TOY TIDY PINK POLKADOT,5,2011-07-24 11:40:00,2.1,14443.0,United Kingdom
561033,23209,LUNCH BAG DOILEY PATTERN ,10,2011-07-24 11:40:00,1.65,14443.0,United Kingdom
561033,22379,RECYCLING BAG RETROSPOT ,5,2011-07-24 11:40:00,2.1,14443.0,United Kingdom
561033,20718,RED RETROSPOT SHOPPER BAG,10,2011-07-24 11:40:00,1.25,14443.0,United Kingdom
561033,84380,SET OF 3 BUTTERFLY COOKIE CUTTERS,12,2011-07-24 11:40:00,1.25,14443.0,United Kingdom
561033,22961,JAM MAKING SET PRINTED,12,2011-07-24 11:40:00,1.45,14443.0,United Kingdom
561033,23056,FLOWERS CHANDELIER T-LIGHT HOLDER,3,2011-07-24 11:40:00,6.25,14443.0,United Kingdom
561033,22178,VICTORIAN GLASS HANGING T-LIGHT,12,2011-07-24 11:40:00,1.25,14443.0,United Kingdom
561033,71053,WHITE METAL LANTERN,4,2011-07-24 11:40:00,3.75,14443.0,United Kingdom
561033,22824,3 TIER SWEETHEART GARDEN SHELF,1,2011-07-24 11:40:00,35.95,14443.0,United Kingdom
561033,22295,HEART FILIGREE DOVE LARGE,12,2011-07-24 11:40:00,1.65,14443.0,United Kingdom
