InvoiceNo,StockCode,Description,Quantity,InvoiceDate,UnitPrice,CustomerID,Country
574076,15036,ASSORTED COLOURS SILK FAN,2,2011-11-02 15:38:00,1.63,,United Kingdom
574076,16168M,FUNKY MONKEY GIFT BAG MEDIUM,2,2011-11-02 15:38:00,0.83,,United Kingdom
574076,16236,KITTY PENCIL ERASERS,1,2011-11-02 15:38:00,0.42,,United Kingdom
574076,16237,SLEEPING CAT ERASERS,3,2011-11-02 15:38:00,0.42,,United Kingdom
574076,17038,PORCELAIN BUDAH INCENSE HOLDER,1,2011-11-02 15:38:00,0.83,,United Kingdom
574076,20615,BLUE POLKADOT PASSPORT COVER,1,2011-11-02 15:38:00,4.13,,United Kingdom
574076,20661,BLUE POLKADOT PURSE ,1,2011-11-02 15:38:00,5.79,,United Kingdom
574076,20685,DOORMAT RED RETROSPOT,1,2011-11-02 15:38:00,15.79,,United Kingdom
574076,20712,JUMBO BAG WOODLAND ANIMALS,2,2011-11-02 15:38:00,4.13,,United Kingdom
574076,20718,RED RETROSPOT SHOPPER BAG,1,2011-11-02 15:38:00,2.46,,United Kingdom
574076,20719,WOODLAND CHARLOTTE BAG,3,2011-11-02 15:38:00,1.63,,United Kingdom
574076,20723,STRAWBERRY CHARLOTTE BAG,3,2011-11-02 15:38:00,1.63,,United Kingdom
574076,20724,RED RETROSPOT CHARLOTTE BAG,3,2011-11-02 15:38:00,1.63,,United Kingdom
574076,20725,LUNCH BAG RED RETROSPOT,1,2011-11-02 15:38:00,4.13,,United Kingdom
574076,20727,LUNCH BAG  BLACK SKULL.,5,2011-11-02 15:38:00,4.13,,United Kingdom
574076,20733,GOLD MINI TAPE MEASURE ,1,2011-11-02 15:38:00,0.83,,United Kingdom
574076,20775,DAISY NOTEBOOK ,2,2011-11-02 15:38:00,1.63,,United Kingdom
574076,20777,CHRYSANTHEMUM NOTEBOOK,1,2011-11-02 15:38:00,1.63,,United Kingdom
574076,20828,GLITTER BUTTERFLY CLIPS,1,2011-11-02 15:38:00,4.96,,United Kingdom
574076,20914,SET/5 RED RETROSPOT LID GLASS BOWLS,1,2011-11-02 15:38:00,5.79,,United Kingdom
574076,20956,PORCELAIN T-LIGHT HOLDERS ASSORTED,1,2011-11-02 15:38:00,2.46,,United Kingdom
574076,20961,STRAWBERRY BATH SPONGE ,1,2011-11-02 15:38:00,2.46,,United Kingdom
574076,20963,APPLE BATH SPONGE,2,2011-11-02 15:38:00,2.46,,United Kingdom
574076,20973,12 PENCIL SMALL TUBE WOODLAND,2,2011-11-02 15:38:00,1.25,,United Kingdom
574076,20982,12 PENCILS TALL TUBE SKULLS,1,2011-11-02 15:38:00,1.63,,United Kingdom
574076,20983,12 PENCILS TALL TUBE RED RETROSPOT,1,2011-11-02 15:38:00,1.63,,United Kingdom
574076,21014,SWISS CHALET TREE DECORATION ,3,2011-11-02 15:38:00,0.83,,United Kingdom
574076,21015,DARK BIRD HOUSE TREE DECORATION,2,2011-11-02 15:38:00,0.83,,United Kingdom
574076,21035,SET/2 RED RETROSPOT TEA TOWELS ,2,2011-11-02 15:38:00,6.63,,United Kingdom
574076,21064,BOOM BOX SPEAKER BOYS,1,2011-11-02 15:38:00,4.13,,United Kingdom
574076,21080,SET/20 RED RETROSPOT PAPER NAPKINS ,4,2011-11-02 15:38:00,1.63,,United Kingdom
574076,21094,SET/6 RED SPOTTY PAPER PLATES,6,2011-11-02 15:38:00,0.83,,United Kingdom
574076,21125,SET 6 FOOTBALL CELEBRATION CANDLES,1,2011-11-02 15:38:00,1.25,,United Kingdom
574076,21126,SET OF 6 GIRLS CELEBRATION CANDLES,1,2011-11-02 15:38:00,1.25,,United Kingdom
574076,21136,PAINTED METAL PEARS ASSORTED,8,2011-11-02 15:38:00,3.12,,United Kingdom
574076,21154,RED RETROSPOT OVEN GLOVE ,1,2011-11-02 15:38:00,2.46,,United Kingdom
574076,21167,WHITE SAGE INCENSE,1,2011-11-02 15:38:00,0.42,,United Kingdom
574076,21174,POTTERING IN THE SHED METAL SIGN,1,2011-11-02 15:38:00,4.13,,United Kingdom
574076,21175,GIN + TONIC DIET METAL SIGN,2,2011-11-02 15:38:00,4.96,,United Kingdom
574076,21191,LARGE WHITE HONEYCOMB PAPER BELL  ,1,2011-11-02 15:38:00,4.13,,United Kingdom
574076,21192,WHITE BELL HONEYCOMB PAPER ,1,2011-11-02 15:38:00,3.29,,United Kingdom
574076,21207,SKULL AND CROSSBONES  GARLAND ,1,2011-11-02 15:38:00,1.63,,United Kingdom
574076,21232,STRAWBERRY CERAMIC TRINKET POT,4,2011-11-02 15:38:00,2.46,,United Kingdom
574076,21289,LARGE STRIPES CHOCOLATE GIFT BAG,1,2011-11-02 15:38:00,1.25,,United Kingdom
574076,21356,TOAST ITS - FAIRY FLOWER,4,2011-11-02 15:38:00,0.83,,United Kingdom
574076,21367,MIRRORED WALL ART GENTS,1,2011-11-02 15:38:00,4.96,,United Kingdom
574076,21368,MIRRORED WALL ART LADIES,1,2011-11-02 15:38:00,4.96,,United Kingdom
574076,21380,WOODEN HAPPY BIRTHDAY GARLAND,1,2011-11-02 15:38:00,5.79,,United Kingdom
574076,21479,WHITE SKULL HOT WATER BOTTLE ,1,2011-11-02 15:38:00,8.29,,United Kingdom
574076,21509,COWBOYS AND INDIANS BIRTHDAY CARD ,1,2011-11-02 15:38:00,0.83,,United Kingdom
574076,21616,4 PEAR BOTANICAL DINNER CANDLES,1,2011-11-02 15:38:00,3.29,,United Kingdom
574076,21640,ASSORTED TUTTI FRUTTI  FOB NOTEBOOK,1,2011-11-02 15:38:00,1.63,,United Kingdom
574076,21650,ASSORTED TUTTI FRUTTI BRACELET,3,2011-11-02 15:38:00,0.83,,United Kingdom
574076,21668,RED STRIPE CERAMIC DRAWER KNOB,2,2011-11-02 15:38:00,3.29,,United Kingdom
574076,21673,WHITE SPOT BLUE CERAMIC DRAWER KNOB,2,2011-11-02 15:38:00,3.29,,United Kingdom
574076,21679,SKULLS  STICKERS,1,2011-11-02 15:38:00,1.63,,United Kingdom
574076,21680,WOODLAND  STICKERS,1,2011-11-02 15:38:00,1.63,,United Kingdom
574076,21703,BAG 125g SWIRLY MARBLES,1,2011-11-02 15:38:00,0.83,,United Kingdom
574076,21704,BAG 250g SWIRLY MARBLES,1,2011-11-02 15:38:00,1.63,,United Kingdom
574076,21705,BAG 500g SWIRLY MARBLES,1,2011-11-02 15:38:00,3.29,,United Kingdom
574076,21731,RED TOADSTOOL LED NIGHT LIGHT,4,2011-11-02 15:38:00,3.29,,United Kingdom
574076,21786,POLKADOT RAIN HAT ,1,2011-11-02 15:38:00,0.83,,United Kingdom
574076,21790,VINTAGE SNAP CARDS,4,2011-11-02 15:38:00,1.63,,United Kingdom
574076,21791,VINTAGE HEADS AND TAILS CARD GAME ,1,2011-11-02 15:38:00,2.46,,United Kingdom
574076,21802,CHRISTMAS TREE HEART DECORATION,12,2011-11-02 15:38:00,0.42,,United Kingdom
574076,21803,CHRISTMAS TREE STAR DECORATION,22,2011-11-02 15:38:00,0.42,,United Kingdom
574076,21804,WHITE CHRISTMAS GARLAND STARS TREES,3,2011-11-02 15:38:00,3.29,,United Kingdom
574076,21808,"CHRISTMAS GARLAND STARS,TREES",4,2011-11-02 15:38:00,3.29,,United Kingdom
574076,21810,CHRISTMAS HANGING STAR WITH BELL,5,2011-11-02 15:38:00,0.83,,United Kingdom
574076,21811,HANGING HEART WITH BELL,5,2011-11-02 15:38:00,0.83,,United Kingdom
574076,21812,GARLAND WITH HEARTS AND BELLS,4,2011-11-02 15:38:00,3.29,,United Kingdom
574076,21813,GARLAND WITH STARS AND BELLS,6,2011-11-02 15:38:00,3.29,,United Kingdom
574076,21821,GLITTER STAR GARLAND WITH BELLS ,1,2011-11-02 15:38:00,7.46,,United Kingdom
574076,21824,PAINTED METAL STAR WITH HOLLY BELLS,21,2011-11-02 15:38:00,0.83,,United Kingdom
574076,21873,IF YOU CAN'T STAND THE HEAT MUG,1,2011-11-02 15:38:00,3.29,,United Kingdom
574076,21888,BINGO SET,1,2011-11-02 15:38:00,7.46,,United Kingdom
574076,21889,WOODEN BOX OF DOMINOES,2,2011-11-02 15:38:00,2.46,,United Kingdom
574076,21891,TRADITIONAL WOODEN SKIPPING ROPE,1,2011-11-02 15:38:00,2.46,,United Kingdom
574076,21892,TRADITIONAL WOODEN CATCH CUP GAME ,1,2011-11-02 15:38:00,2.46,,United Kingdom
574076,21914,BLUE HARMONICA IN BOX ,1,2011-11-02 15:38:00,2.46,,United Kingdom
574076,21915,RED  HARMONICA IN BOX ,1,2011-11-02 15:38:00,2.46,,United Kingdom
574076,21928,JUMBO BAG SCANDINAVIAN BLUE PAISLEY,1,2011-11-02 15:38:00,4.13,,United Kingdom
574076,21930,JUMBO STORAGE BAG SKULLS,2,2011-11-02 15:38:00,4.13,,United Kingdom
574076,21931,JUMBO STORAGE BAG SUKI,1,2011-11-02 15:38:00,4.13,,United Kingdom
574076,21934,SKULL SHOULDER BAG,3,2011-11-02 15:38:00,1.63,,United Kingdom
574076,21935,SUKI  SHOULDER BAG,3,2011-11-02 15:38:00,1.63,,United Kingdom
574076,21944,KITTENS DESIGN FLANNEL,1,2011-11-02 15:38:00,1.63,,United Kingdom
574076,21945,STRAWBERRIES  DESIGN FLANNEL ,1,2011-11-02 15:38:00,1.63,,United Kingdom
574076,21975,PACK OF 60 DINOSAUR CAKE CASES,1,2011-11-02 15:38:00,1.25,,United Kingdom
574076,21990,MODERN FLORAL STATIONERY SET,1,2011-11-02 15:38:00,2.46,,United Kingdom
574076,21991,BOHEMIAN COLLAGE STATIONERY SET,2,2011-11-02 15:38:00,2.46,,United Kingdom
574076,21992,VINTAGE PAISLEY STATIONERY SET,1,2011-11-02 15:38:00,2.46,,United Kingdom
574076,21993,FLORAL FOLK STATIONERY SET,2,2011-11-02 15:38:00,2.46,,United Kingdom
574076,22024,RAINY LADIES BIRTHDAY CARD,1,2011-11-02 15:38:00,0.83,,United Kingdom
574076,22025,RING OF ROSES BIRTHDAY CARD,1,2011-11-02 15:38:00,0.83,,United Kingdom
574076,22027,TEA PARTY BIRTHDAY CARD,1,2011-11-02 15:38:00,0.83,,United Kingdom
574076,22029,SPACEBOY BIRTHDAY CARD,2,2011-11-02 15:38:00,0.83,,United Kingdom
574076,22064,PINK DOUGHNUT TRINKET POT ,2,2011-11-02 15:38:00,3.29,,United Kingdom
574076,22065,CHRISTMAS PUDDING TRINKET POT ,10,2011-11-02 15:38:00,1.63,,United Kingdom
574076,22074,6 RIBBONS SHIMMERING PINKS ,1,2011-11-02 15:38:00,1.25,,United Kingdom
574076,22075,6 RIBBONS ELEGANT CHRISTMAS ,2,2011-11-02 15:38:00,1.63,,United Kingdom
574076,22076,6 RIBBONS EMPIRE  ,1,2011-11-02 15:38:00,1.25,,United Kingdom
574076,22077,6 RIBBONS RUSTIC CHARM,1,2011-11-02 15:38:00,3.29,,United Kingdom
574076,22082,RIBBON REEL STRIPES DESIGN ,1,2011-11-02 15:38:00,3.29,,United Kingdom
574076,22086,PAPER CHAIN KIT 50'S CHRISTMAS ,6,2011-11-02 15:38:00,5.79,,United Kingdom
574076,22095,LADS ONLY TISSUE BOX,2,2011-11-02 15:38:00,2.46,,United Kingdom
574076,22107,PIZZA PLATE IN BOX,2,2011-11-02 15:38:00,3.29,,United Kingdom
574076,22115,METAL SIGN EMPIRE TEA,1,2011-11-02 15:38:00,5.79,,United Kingdom
574076,22134,MINI LADLE LOVE HEART RED ,3,2011-11-02 15:38:00,0.83,,United Kingdom
574076,22135,MINI LADLE LOVE HEART PINK,4,2011-11-02 15:38:00,0.83,,United Kingdom
574076,22138,BAKING SET 9 PIECE RETROSPOT ,1,2011-11-02 15:38:00,10.79,,United Kingdom
574076,22141,CHRISTMAS CRAFT TREE TOP ANGEL,1,2011-11-02 15:38:00,4.13,,United Kingdom
574076,22142,CHRISTMAS CRAFT WHITE FAIRY ,1,2011-11-02 15:38:00,3.29,,United Kingdom
574076,22144,CHRISTMAS CRAFT LITTLE FRIENDS,21,2011-11-02 15:38:00,4.13,,United Kingdom
574076,22150,3 STRIPEY MICE FELTCRAFT,1,2011-11-02 15:38:00,4.13,,United Kingdom
574076,22154,ANGEL DECORATION 3 BUTTONS ,3,2011-11-02 15:38:00,0.83,,United Kingdom
574076,22156,HEART DECORATION WITH PEARLS ,2,2011-11-02 15:38:00,1.63,,United Kingdom
574076,22161,HEART DECORATION RUSTIC HANGING ,4,2011-11-02 15:38:00,0.79,,United Kingdom
574076,22163,HEART STRING MEMO HOLDER HANGING,9,2011-11-02 15:38:00,1.63,,United Kingdom
574076,22174,PHOTO CUBE,1,2011-11-02 15:38:00,3.29,,United Kingdom
574076,22178,VICTORIAN GLASS HANGING T-LIGHT,4,2011-11-02 15:38:00,2.46,,United Kingdom
574076,22190,LOCAL CAFE MUG,2,2011-11-02 15:38:00,2.46,,United Kingdom
574076,22195,LARGE HEART MEASURING SPOONS,4,2011-11-02 15:38:00,3.29,,United Kingdom
574076,22196,SMALL HEART MEASURING SPOONS,2,2011-11-02 15:38:00,1.63,,United Kingdom
574076,22197,POPCORN HOLDER,4,2011-11-02 15:38:00,1.63,,United Kingdom
574076,22208,WOOD STAMP SET THANK YOU,2,2011-11-02 15:38:00,3.29,,United Kingdom
574076,22212,FOUR HOOK  WHITE LOVEBIRDS,1,2011-11-02 15:38:00,4.13,,United Kingdom
574076,22230,JIGSAW TREE WITH WATERING CAN,3,2011-11-02 15:38:00,1.63,,United Kingdom
574076,22231,JIGSAW TREE WITH BIRDHOUSE,3,2011-11-02 15:38:00,3.29,,United Kingdom
574076,22251,BIRDHOUSE DECORATION MAGIC GARDEN,1,2011-11-02 15:38:00,2.46,,United Kingdom
574076,22262,FELT EGG COSY CHICKEN,1,2011-11-02 15:38:00,1.63,,United Kingdom
574076,22299,PIG KEYRING WITH LIGHT & SOUND ,3,2011-11-02 15:38:00,2.46,,United Kingdom
574076,22308,TEA COSY BLUE STRIPE,1,2011-11-02 15:38:00,4.96,,United Kingdom
574076,22310,IVORY KNITTED MUG COSY ,3,2011-11-02 15:38:00,3.29,,United Kingdom
574076,22322,BIRD DECORATION GREEN POLKADOT,2,2011-11-02 15:38:00,1.63,,United Kingdom
574076,22326,ROUND SNACK BOXES SET OF4 WOODLAND ,1,2011-11-02 15:38:00,5.79,,United Kingdom
574076,22335,HEART DECORATION PAINTED ZINC ,4,2011-11-02 15:38:00,1.25,,United Kingdom
574076,22337,ANGEL DECORATION PAINTED ZINC ,1,2011-11-02 15:38:00,0.63,,United Kingdom
574076,22338,STAR DECORATION PAINTED ZINC ,2,2011-11-02 15:38:00,0.63,,United Kingdom
574076,22339,CHRISTMAS TREE PAINTED ZINC ,10,2011-11-02 15:38:00,0.63,,United Kingdom
574076,22340,NOEL GARLAND PAINTED ZINC ,15,2011-11-02 15:38:00,0.83,,United Kingdom
574076,22348,TEA BAG PLATE RED RETROSPOT,2,2011-11-02 15:38:00,1.63,,United Kingdom
574076,22354,RETROSPOT PADDED SEAT CUSHION,4,2011-11-02 15:38:00,7.46,,United Kingdom
574076,22356,CHARLOTTE BAG PINK POLKADOT,2,2011-11-02 15:38:00,1.63,,United Kingdom
574076,22357,KINGS CHOICE BISCUIT TIN,1,2011-11-02 15:38:00,4.13,,United Kingdom
574076,22361,GLASS JAR DAISY FRESH COTTON WOOL,1,2011-11-02 15:38:00,5.79,,United Kingdom
574076,22362,GLASS JAR PEACOCK BATH SALTS,1,2011-11-02 15:38:00,5.79,,United Kingdom
574076,22378,WALL TIDY RETROSPOT ,1,2011-11-02 15:38:00,4.13,,United Kingdom
574076,22379,RECYCLING BAG RETROSPOT ,2,2011-11-02 15:38:00,4.13,,United Kingdom
574076,22383,LUNCH BAG SUKI DESIGN ,1,2011-11-02 15:38:00,4.13,,United Kingdom
574076,22384,LUNCH BAG PINK POLKADOT,1,2011-11-02 15:38:00,4.13,,United Kingdom
574076,22422,TOOTHPASTE TUBE PEN,2,2011-11-02 15:38:00,1.25,,United Kingdom
574076,22423,REGENCY CAKESTAND 3 TIER,1,2011-11-02 15:38:00,24.96,,United Kingdom
574076,22437,SET OF 9 BLACK SKULL BALLOONS,1,2011-11-02 15:38:00,1.63,,United Kingdom
574076,22446,PIN CUSHION BABUSHKA PINK,1,2011-11-02 15:38:00,2.46,,United Kingdom
574076,22452,MEASURING TAPE BABUSHKA PINK,1,2011-11-02 15:38:00,1.63,,United Kingdom
574076,22457,NATURAL SLATE HEART CHALKBOARD ,2,2011-11-02 15:38:00,5.79,,United Kingdom
574076,22460,EMBOSSED GLASS TEALIGHT HOLDER,1,2011-11-02 15:38:00,2.46,,United Kingdom
574076,22466,FAIRY TALE COTTAGE NIGHT LIGHT,1,2011-11-02 15:38:00,4.13,,United Kingdom
574076,22467,GUMBALL COAT RACK,1,2011-11-02 15:38:00,4.96,,United Kingdom
574076,22483,RED GINGHAM TEDDY BEAR ,1,2011-11-02 15:38:00,5.79,,United Kingdom
574076,22486,PLASMATRONIC LAMP,2,2011-11-02 15:38:00,8.29,,United Kingdom
574076,22488,NATURAL SLATE RECTANGLE CHALKBOARD,1,2011-11-02 15:38:00,3.29,,United Kingdom
574076,22489,PACK OF 12 TRADITIONAL CRAYONS,15,2011-11-02 15:38:00,0.83,,United Kingdom
574076,22492,MINI PAINT SET VINTAGE ,4,2011-11-02 15:38:00,1.63,,United Kingdom
574076,22494,EMERGENCY FIRST AID TIN ,1,2011-11-02 15:38:00,2.46,,United Kingdom
574076,22495,SET OF 2 ROUND TINS CAMEMBERT ,1,2011-11-02 15:38:00,5.79,,United Kingdom
574076,22499,WOODEN UNION JACK BUNTING,1,2011-11-02 15:38:00,12.46,,United Kingdom
574076,22507,MEMO BOARD RETROSPOT  DESIGN,1,2011-11-02 15:38:00,10.79,,United Kingdom
574076,22515,CHILDS GARDEN SPADE PINK,1,2011-11-02 15:38:00,4.13,,United Kingdom
574076,22517,CHILDS GARDEN RAKE PINK,1,2011-11-02 15:38:00,4.13,,United Kingdom
574076,22544,MINI JIGSAW SPACEBOY,1,2011-11-02 15:38:00,0.83,,United Kingdom
574076,22546,MINI JIGSAW PURDEY,1,2011-11-02 15:38:00,0.83,,United Kingdom
574076,22549,PICTURE DOMINOES,1,2011-11-02 15:38:00,3.29,,United Kingdom
574076,22551,PLASTERS IN TIN SPACEBOY,1,2011-11-02 15:38:00,3.29,,United Kingdom
574076,22553,PLASTERS IN TIN SKULLS,1,2011-11-02 15:38:00,3.29,,United Kingdom
574076,22556,PLASTERS IN TIN CIRCUS PARADE ,1,2011-11-02 15:38:00,3.29,,United Kingdom
574076,22557,PLASTERS IN TIN VINTAGE PAISLEY ,1,2011-11-02 15:38:00,3.29,,United Kingdom
574076,22562,MONSTERS STENCIL CRAFT,1,2011-11-02 15:38:00,2.46,,United Kingdom
574076,22567,20 DOLLY PEGS RETROSPOT,1,2011-11-02 15:38:00,2.92,,United Kingdom
574076,22571,ROCKING HORSE RED CHRISTMAS ,2,2011-11-02 15:38:00,1.63,,United Kingdom
574076,22572,ROCKING HORSE GREEN CHRISTMAS ,1,2011-11-02 15:38:00,1.63,,United Kingdom
574076,22573,STAR WOODEN CHRISTMAS DECORATION,6,2011-11-02 15:38:00,1.63,,United Kingdom
574076,22574,HEART WOODEN CHRISTMAS DECORATION,3,2011-11-02 15:38:00,1.63,,United Kingdom
574076,22576,SWALLOW WOODEN CHRISTMAS DECORATION,1,2011-11-02 15:38:00,1.63,,United Kingdom
574076,22577,WOODEN HEART CHRISTMAS SCANDINAVIAN,29,2011-11-02 15:38:00,0.83,,United Kingdom
574076,22578,WOODEN STAR CHRISTMAS SCANDINAVIAN,20,2011-11-02 15:38:00,0.83,,United Kingdom
574076,22579,WOODEN TREE CHRISTMAS SCANDINAVIAN,9,2011-11-02 15:38:00,0.83,,United Kingdom
574076,22580,ADVENT CALENDAR GINGHAM SACK,10,2011-11-02 15:38:00,4.13,,United Kingdom
574076,22581,WOOD STOCKING CHRISTMAS SCANDISPOT,10,2011-11-02 15:38:00,0.83,,United Kingdom
574076,22582,PACK OF 6 SWEETIE GIFT BOXES,1,2011-11-02 15:38:00,4.96,,United Kingdom
574076,22585,PACK OF 6 BIRDY GIFT TAGS,1,2011-11-02 15:38:00,2.46,,United Kingdom
574076,22586,FELTCRAFT HAIRBAND PINK AND BLUE,2,2011-11-02 15:38:00,1.63,,United Kingdom
574076,22587,FELTCRAFT HAIRBAND RED AND BLUE,1,2011-11-02 15:38:00,1.63,,United Kingdom
574076,22588,CARD HOLDER GINGHAM HEART,3,2011-11-02 15:38:00,5.79,,United Kingdom
574076,22593,CHRISTMAS GINGHAM STAR,1,2011-11-02 15:38:00,1.63,,United Kingdom
574076,22594,CHRISTMAS GINGHAM TREE,1,2011-11-02 15:38:00,1.63,,United Kingdom
574076,22597,MUSICAL ZINC HEART DECORATION ,1,2011-11-02 15:38:00,0.83,,United Kingdom
574076,22598,CHRISTMAS MUSICAL ZINC TREE,1,2011-11-02 15:38:00,0.83,,United Kingdom
574076,22599,CHRISTMAS MUSICAL ZINC STAR,2,2011-11-02 15:38:00,0.83,,United Kingdom
574076,22600,CHRISTMAS RETROSPOT STAR WOOD,1,2011-11-02 15:38:00,1.63,,United Kingdom
574076,22601,CHRISTMAS RETROSPOT ANGEL WOOD,3,2011-11-02 15:38:00,1.63,,United Kingdom
574076,22602,RETROSPOT WOODEN HEART DECORATION,1,2011-11-02 15:38:00,1.63,,United Kingdom
574076,22603,CHRISTMAS RETROSPOT TREE WOOD,1,2011-11-02 15:38:00,1.63,,United Kingdom
574076,22604,SET OF 4 NAPKIN CHARMS CUTLERY,1,2011-11-02 15:38:00,4.96,,United Kingdom
574076,22614,PACK OF 12 SPACEBOY TISSUES,1,2011-11-02 15:38:00,0.83,,United Kingdom
574076,22616,PACK OF 12 LONDON TISSUES ,1,2011-11-02 15:38:00,0.83,,United Kingdom
574076,22617,BAKING SET SPACEBOY DESIGN,1,2011-11-02 15:38:00,10.79,,United Kingdom
574076,22619,SET OF 6 SOLDIER SKITTLES,1,2011-11-02 15:38:00,7.46,,United Kingdom
574076,22620,4 TRADITIONAL SPINNING TOPS,5,2011-11-02 15:38:00,2.46,,United Kingdom
574076,22621,TRADITIONAL KNITTING NANCY,1,2011-11-02 15:38:00,3.29,,United Kingdom
574076,22633,HAND WARMER UNION JACK,1,2011-11-02 15:38:00,4.13,,United Kingdom
574076,22634,CHILDS BREAKFAST SET SPACEBOY ,1,2011-11-02 15:38:00,19.96,,United Kingdom
574076,22635,CHILDS BREAKFAST SET DOLLY GIRL ,1,2011-11-02 15:38:00,19.96,,United Kingdom
574076,22637,PIGGY BANK RETROSPOT ,1,2011-11-02 15:38:00,4.96,,United Kingdom
574076,22639,SET OF 4 NAPKIN CHARMS HEARTS,1,2011-11-02 15:38:00,4.96,,United Kingdom
574076,22640,SET OF 4 NAPKIN CHARMS 3 KEYS ,1,2011-11-02 15:38:00,4.96,,United Kingdom
574076,22642,SET OF 4 NAPKIN CHARMS STARS   ,1,2011-11-02 15:38:00,4.96,,United Kingdom
574076,22651,GENTLEMAN SHIRT REPAIR KIT ,1,2011-11-02 15:38:00,1.63,,United Kingdom
574076,22653,BUTTON BOX ,3,2011-11-02 15:38:00,1.63,,United Kingdom
574076,22654,DELUXE SEWING KIT ,1,2011-11-02 15:38:00,11.63,,United Kingdom
574076,22659,LUNCH BOX I LOVE LONDON,1,2011-11-02 15:38:00,4.13,,United Kingdom
574076,22661,CHARLOTTE BAG DOLLY GIRL DESIGN,1,2011-11-02 15:38:00,1.63,,United Kingdom
574076,22666,RECIPE BOX PANTRY YELLOW DESIGN,6,2011-11-02 15:38:00,5.79,,United Kingdom
574076,22697,GREEN REGENCY TEACUP AND SAUCER,1,2011-11-02 15:38:00,5.79,,United Kingdom
574076,22698,PINK REGENCY TEACUP AND SAUCER,2,2011-11-02 15:38:00,5.79,,United Kingdom
574076,22699,ROSES REGENCY TEACUP AND SAUCER ,1,2011-11-02 15:38:00,5.79,,United Kingdom
574076,22713,CARD I LOVE LONDON ,1,2011-11-02 15:38:00,0.83,,United Kingdom
574076,22718,CARD CAT AND TREE ,1,2011-11-02 15:38:00,0.83,,United Kingdom
574076,22720,SET OF 3 CAKE TINS PANTRY DESIGN ,2,2011-11-02 15:38:00,10.79,,United Kingdom
574076,22722,SET OF 6 SPICE TINS PANTRY DESIGN,1,2011-11-02 15:38:00,8.29,,United Kingdom
574076,22726,ALARM CLOCK BAKELIKE GREEN,4,2011-11-02 15:38:00,7.46,,United Kingdom
574076,22730,ALARM CLOCK BAKELIKE IVORY,1,2011-11-02 15:38:00,7.46,,United Kingdom
574076,22742,MAKE YOUR OWN PLAYTIME CARD KIT,1,2011-11-02 15:38:00,5.79,,United Kingdom
574076,22743,MAKE YOUR OWN FLOWERPOWER CARD KIT,1,2011-11-02 15:38:00,5.79,,United Kingdom
574076,22744,MAKE YOUR OWN MONSOON CARD KIT,1,2011-11-02 15:38:00,5.79,,United Kingdom
574076,22746,POPPY'S PLAYHOUSE LIVINGROOM ,1,2011-11-02 15:38:00,4.13,,United Kingdom
574076,22748,POPPY'S PLAYHOUSE KITCHEN,1,2011-11-02 15:38:00,4.13,,United Kingdom
574076,22749,FELTCRAFT PRINCESS CHARLOTTE DOLL,1,2011-11-02 15:38:00,7.46,,United Kingdom
574076,22752,SET 7 BABUSHKA NESTING BOXES,1,2011-11-02 15:38:00,16.63,,United Kingdom
574076,22757,LARGE RED BABUSHKA NOTEBOOK ,1,2011-11-02 15:38:00,2.46,,United Kingdom
574076,22759,SET OF 3 NOTEBOOKS IN PARCEL,2,2011-11-02 15:38:00,3.29,,United Kingdom
574076,22763,KEY CABINET MA CAMPAGNE,1,2011-11-02 15:38:00,19.96,,United Kingdom
574076,22781,GUMBALL MAGAZINE RACK,1,2011-11-02 15:38:00,14.96,,United Kingdom
574076,22800,ANTIQUE TALL SWIRLGLASS TRINKET POT,2,2011-11-02 15:38:00,7.46,,United Kingdom
574076,22804,PINK HANGING HEART T-LIGHT HOLDER,2,2011-11-02 15:38:00,5.79,,United Kingdom
574076,22807,SET OF 6 T-LIGHTS TOADSTOOLS,2,2011-11-02 15:38:00,5.79,,United Kingdom
574076,22808,SET OF 6 T-LIGHTS EASTER CHICKS,2,2011-11-02 15:38:00,5.79,,United Kingdom
574076,22809,SET OF 6 T-LIGHTS SANTA,4,2011-11-02 15:38:00,5.79,,United Kingdom
574076,22810,SET OF 6 T-LIGHTS SNOWMEN,5,2011-11-02 15:38:00,5.79,,United Kingdom
574076,22814,CARD PARTY GAMES ,1,2011-11-02 15:38:00,0.42,,United Kingdom
574076,22815,CARD PSYCHEDELIC APPLES,7,2011-11-02 15:38:00,0.42,,United Kingdom
574076,22816,CARD MOTORBIKE SANTA,3,2011-11-02 15:38:00,0.42,,United Kingdom
574076,22819,"BIRTHDAY CARD, RETRO SPOT",9,2011-11-02 15:38:00,0.42,,United Kingdom
574076,22847,BREAD BIN DINER STYLE IVORY,1,2011-11-02 15:38:00,33.29,,United Kingdom
574076,22863,SOAP DISH BROCANTE,1,2011-11-02 15:38:00,5.79,,United Kingdom
574076,22865,HAND WARMER OWL DESIGN,1,2011-11-02 15:38:00,4.13,,United Kingdom
574076,22867,HAND WARMER BIRD DESIGN,1,2011-11-02 15:38:00,4.13,,United Kingdom
574076,22905,CALENDAR IN SEASON DESIGN,1,2011-11-02 15:38:00,2.46,,United Kingdom
574076,22908,PACK OF 20 NAPKINS RED APPLES,4,2011-11-02 15:38:00,1.63,,United Kingdom
574076,22909,SET OF 20 VINTAGE CHRISTMAS NAPKINS,9,2011-11-02 15:38:00,1.63,,United Kingdom
574076,22910,PAPER CHAIN KIT VINTAGE CHRISTMAS,3,2011-11-02 15:38:00,5.79,,United Kingdom
574076,22943,CHRISTMAS LIGHTS 10 VINTAGE BAUBLES,1,2011-11-02 15:38:00,10.79,,United Kingdom
574076,22944,CHRISTMAS METAL POSTCARD WITH BELLS,6,2011-11-02 15:38:00,0.97,,United Kingdom
574076,22952,60 CAKE CASES VINTAGE CHRISTMAS,1,2011-11-02 15:38:00,1.25,,United Kingdom
574076,22960,JAM MAKING SET WITH JARS,1,2011-11-02 15:38:00,8.29,,United Kingdom
574076,22961,JAM MAKING SET PRINTED,3,2011-11-02 15:38:00,3.29,,United Kingdom
574076,22962,JAM JAR WITH PINK LID,1,2011-11-02 15:38:00,1.63,,United Kingdom
574076,22963,JAM JAR WITH GREEN LID,1,2011-11-02 15:38:00,1.63,,United Kingdom
574076,22969,HOMEMADE JAM SCENTED CANDLES,3,2011-11-02 15:38:00,3.29,,United Kingdom
574076,22990,COTTON APRON PANTRY DESIGN,1,2011-11-02 15:38:00,10.79,,United Kingdom
574076,22993,SET OF 4 PANTRY JELLY MOULDS,2,2011-11-02 15:38:00,2.46,,United Kingdom
574076,22995,TRAVEL CARD WALLET SUKI,1,2011-11-02 15:38:00,0.83,,United Kingdom
574076,23000,TRAVEL CARD WALLET TRANSPORT,1,2011-11-02 15:38:00,0.83,,United Kingdom
574076,23002,TRAVEL CARD WALLET SKULLS,1,2011-11-02 15:38:00,0.83,,United Kingdom
574076,23004,TRAVEL CARD WALLET PANTRY,1,2011-11-02 15:38:00,0.83,,United Kingdom
574076,23007, SPACEBOY BABY GIFT SET,2,2011-11-02 15:38:00,10.79,,United Kingdom
574076,23009,I LOVE LONDON BABY GIFT SET,2,2011-11-02 15:38:00,10.79,,United Kingdom
574076,23037,CANDLE HOLDER SILVER MADELINE,2,2011-11-02 15:38:00,3.29,,United Kingdom
574076,23078,ICE CREAM PEN LIP GLOSS ,3,2011-11-02 15:38:00,2.46,,United Kingdom
574076,23084,RABBIT NIGHT LIGHT,17,2011-11-02 15:38:00,4.13,,United Kingdom
574076,23089,GLASS BON BON JAR,1,2011-11-02 15:38:00,3.29,,United Kingdom
574076,23103,JINGLE BELL HEART DECORATION,2,2011-11-02 15:38:00,3.29,,United Kingdom
574076,23113,PANTRY CHOPPING BOARD,2,2011-11-02 15:38:00,10.79,,United Kingdom
574076,23118,PARISIENNE JEWELLERY DRAWER ,1,2011-11-02 15:38:00,14.96,,United Kingdom
574076,23122,PARTY CHARMS 50 PIECES,1,2011-11-02 15:38:00,1.63,,United Kingdom
574076,23133,LARGE IVORY HEART WALL ORGANISER,1,2011-11-02 15:38:00,16.63,,United Kingdom
574076,23145,ZINC T-LIGHT HOLDER STAR LARGE,1,2011-11-02 15:38:00,2.08,,United Kingdom
574076,23168,CLASSIC CAFE SUGAR DISPENSER,1,2011-11-02 15:38:00,2.46,,United Kingdom
574076,23169,CLASSIC GLASS COOKIE JAR,1,2011-11-02 15:38:00,8.29,,United Kingdom
574076,23183,MOTHER'S KITCHEN SPOON REST ,1,2011-11-02 15:38:00,7.46,,United Kingdom
574076,23199,JUMBO BAG APPLES,7,2011-11-02 15:38:00,4.13,,United Kingdom
574076,23200,JUMBO BAG PEARS,2,2011-11-02 15:38:00,4.13,,United Kingdom
574076,23201,JUMBO BAG ALPHABET,2,2011-11-02 15:38:00,4.13,,United Kingdom
574076,23202,JUMBO BAG VINTAGE LEAF,2,2011-11-02 15:38:00,4.13,,United Kingdom
574076,23203,JUMBO BAG VINTAGE DOILY ,2,2011-11-02 15:38:00,4.13,,United Kingdom
574076,23206,LUNCH BAG APPLE DESIGN,15,2011-11-02 15:38:00,4.13,,United Kingdom
574076,23212,HEART WREATH DECORATION WITH BELL,1,2011-11-02 15:38:00,2.46,,United Kingdom
574076,23238,SET OF 4 KNICK KNACK TINS LONDON ,1,2011-11-02 15:38:00,8.29,,United Kingdom
574076,23240,SET OF 4 KNICK KNACK TINS DOILY ,1,2011-11-02 15:38:00,8.29,,United Kingdom
574076,23243,SET OF TEA COFFEE SUGAR TINS PANTRY,1,2011-11-02 15:38:00,10.79,,United Kingdom
574076,23245,SET OF 3 REGENCY CAKE TINS,3,2011-11-02 15:38:00,10.79,,United Kingdom
574076,23255,CHILDRENS CUTLERY CIRCUS PARADE,1,2011-11-02 15:38:00,8.29,,United Kingdom
574076,23256,CHILDRENS CUTLERY SPACEBOY ,1,2011-11-02 15:38:00,8.29,,United Kingdom
574076,23263,SET OF 3 WOODEN HEART DECORATIONS,3,2011-11-02 15:38:00,2.46,,United Kingdom
574076,23264,SET OF 3 WOODEN SLEIGH DECORATIONS,2,2011-11-02 15:38:00,2.46,,United Kingdom
574076,23265,SET OF 3 WOODEN TREE DECORATIONS,3,2011-11-02 15:38:00,2.46,,United Kingdom
574076,23266,SET OF 3 WOODEN STOCKING DECORATION,3,2011-11-02 15:38:00,2.46,,United Kingdom
574076,23275,SET OF 3 HANGING OWLS OLLIE BEAK,2,2011-11-02 15:38:00,2.46,,United Kingdom
