InvoiceNo,StockCode,Description,Quantity,InvoiceDate,UnitPrice,CustomerID,Country
562353,23245,SET OF 3 REGENCY CAKE TINS,4,2011-08-04 13:15:00,4.95,16180.0,United Kingdom
562353,22423,REGENCY CAKESTAND 3 TIER,2,2011-08-04 13:15:00,12.75,16180.0,United Kingdom
562353,22699,ROSES REGENCY TEACUP AND SAUCER ,6,2011-08-04 13:15:00,2.95,16180.0,United Kingdom
562353,22698,PINK REGENCY TEACUP AND SAUCER,6,2011-08-04 13:15:00,2.95,16180.0,United Kingdom
562353,22697,GREEN REGENCY TEACUP AND SAUCER,6,2011-08-04 13:15:00,2.95,16180.0,United Kingdom
562353,23173,REGENCY TEAPOT ROSES ,2,2011-08-04 13:15:00,9.95,16180.0,United Kingdom
562353,21936,RED RETROSPOT PICNIC BAG,10,2011-08-04 13:15:00,2.95,16180.0,United Kingdom
562354,20984,12 PENCILS TALL TUBE POSY,24,2011-08-04 13:15:00,0.29,17470.0,United Kingdom
562354,21179,NO JUNK MAIL METAL SIGN,24,2011-08-04 13:15:00,0.39,17470.0,United Kingdom
562354,21394,RED POLKADOT BEAKER ,48,2011-08-04 13:15:00,0.39,17470.0,United Kingdom
562354,21845,DAIRY MAID STRIPE MUG,36,2011-08-04 13:15:00,0.79,17470.0,United Kingdom
562354,22100,SKULLS SQUARE TISSUE BOX,36,2011-08-04 13:15:00,0.39,17470.0,United Kingdom
562354,22094,RED RETROSPOT TISSUE BOX,36,2011-08-04 13:15:00,0.39,17470.0,United Kingdom
562354,22161,HEART DECORATION RUSTIC HANGING ,48,2011-08-04 13:15:00,0.19,17470.0,United Kingdom
562354,35471D,SET OF 3 BIRD LIGHT PINK FEATHER ,24,2011-08-04 13:15:00,0.39,17470.0,United Kingdom
562354,22189,CREAM HEART CARD HOLDER,4,2011-08-04 13:15:00,3.95,17470.0,United Kingdom
562354,20982,12 PENCILS TALL TUBE SKULLS,12,2011-08-04 13:15:00,0.85,17470.0,United Kingdom
562354,20983,12 PENCILS TALL TUBE RED RETROSPOT,12,2011-08-04 13:15:00,0.85,17470.0,United Kingdom
562354,22099,CARAVAN SQUARE TISSUE BOX,36,2011-08-04 13:15:00,0.39,17470.0,United Kingdom
562354,84976,RECTANGULAR SHAPED MIRROR,12,2011-08-04 13:15:00,0.79,17470.0,United Kingdom
562354,84755,COLOUR GLASS T-LIGHT HOLDER HANGING,16,2011-08-04 13:15:00,0.65,17470.0,United Kingdom
562354,82581,TOILET METAL SIGN,12,2011-08-04 13:15:00,0.55,17470.0,United Kingdom
562354,82578,KITCHEN METAL SIGN,12,2011-08-04 13:15:00,0.55,17470.0,United Kingdom
562355,21452,TOADSTOOL MONEY BOX,12,2011-08-04 13:25:00,2.95,14768.0,United Kingdom
562355,22138,BAKING SET 9 PIECE RETROSPOT ,6,2011-08-04 13:25:00,4.95,14768.0,United Kingdom
562355,22619,SET OF 6 SOLDIER SKITTLES,4,2011-08-04 13:25:00,3.75,14768.0,United Kingdom
562355,21481,FAWN BLUE HOT WATER BOTTLE,18,2011-08-04 13:25:00,2.95,14768.0,United Kingdom
562365,23135,SMALL ZINC HEART WALL ORGANISER,2,2011-08-04 13:51:00,5.75,14344.0,United Kingdom
562365,47585A,PINK FAIRY CAKE CUSHION COVER,1,2011-08-04 13:51:00,3.75,14344.0,United Kingdom
562365,22423,REGENCY CAKESTAND 3 TIER,1,2011-08-04 13:51:00,12.75,14344.0,United Kingdom
562365,22625,RED KITCHEN SCALES,1,2011-08-04 13:51:00,8.5,14344.0,United Kingdom
562365,22786,CUSHION COVER PINK UNION JACK,1,2011-08-04 13:51:00,5.95,14344.0,United Kingdom
562365,23171,REGENCY TEA PLATE GREEN ,1,2011-08-04 13:51:00,1.65,14344.0,United Kingdom
562365,23170,REGENCY TEA PLATE ROSES ,1,2011-08-04 13:51:00,1.65,14344.0,United Kingdom
562365,23172,REGENCY TEA PLATE PINK,1,2011-08-04 13:51:00,1.65,14344.0,United Kingdom
562365,22699,ROSES REGENCY TEACUP AND SAUCER ,1,2011-08-04 13:51:00,2.95,14344.0,United Kingdom
562365,22698,PINK REGENCY TEACUP AND SAUCER,1,2011-08-04 13:51:00,2.95,14344.0,United Kingdom
562365,22697,GREEN REGENCY TEACUP AND SAUCER,1,2011-08-04 13:51:00,2.95,14344.0,United Kingdom
562365,22737,RIBBON REEL CHRISTMAS PRESENT ,2,2011-08-04 13:51:00,1.65,14344.0,United Kingdom
562365,22694,WICKER STAR ,1,2011-08-04 13:51:00,2.1,14344.0,United Kingdom
562365,21823,PAINTED METAL HEART WITH HOLLY BELL,4,2011-08-04 13:51:00,1.45,14344.0,United Kingdom
562365,22602,RETROSPOT WOODEN HEART DECORATION,5,2011-08-04 13:51:00,0.85,14344.0,United Kingdom
562365,22577,WOODEN HEART CHRISTMAS SCANDINAVIAN,4,2011-08-04 13:51:00,0.85,14344.0,United Kingdom
562365,22695,WICKER WREATH SMALL,1,2011-08-04 13:51:00,1.45,14344.0,United Kingdom
562365,23321,SMALL WHITE HEART OF WICKER,1,2011-08-04 13:51:00,1.65,14344.0,United Kingdom
562365,85123A,WHITE HANGING HEART T-LIGHT HOLDER,4,2011-08-04 13:51:00,2.95,14344.0,United Kingdom
562365,23322,LARGE WHITE HEART OF WICKER,3,2011-08-04 13:51:00,2.95,14344.0,United Kingdom
562365,22844,VINTAGE CREAM DOG FOOD CONTAINER,1,2011-08-04 13:51:00,8.5,14344.0,United Kingdom
562365,22501,PICNIC BASKET WICKER LARGE,1,2011-08-04 13:51:00,9.95,14344.0,United Kingdom
562366,23144,ZINC T-LIGHT HOLDER STARS SMALL,24,2011-08-04 14:01:00,0.83,17692.0,United Kingdom
562366,22161,HEART DECORATION RUSTIC HANGING ,24,2011-08-04 14:01:00,0.19,17692.0,United Kingdom
562366,21876,POTTERING MUG,12,2011-08-04 14:01:00,1.25,17692.0,United Kingdom
562366,21871,SAVE THE PLANET MUG,12,2011-08-04 14:01:00,1.25,17692.0,United Kingdom
562366,21874,GIN AND TONIC MUG,12,2011-08-04 14:01:00,1.25,17692.0,United Kingdom
562366,21175,GIN + TONIC DIET METAL SIGN,12,2011-08-04 14:01:00,2.55,17692.0,United Kingdom
562366,22650,CERAMIC PIRATE CHEST MONEY BANK,12,2011-08-04 14:01:00,1.45,17692.0,United Kingdom
C562367,22203,MILK PAN RED RETROSPOT,-1,2011-08-04 14:03:00,3.75,17811.0,United Kingdom
562368,84755,COLOUR GLASS T-LIGHT HOLDER HANGING,24,2011-08-04 14:06:00,0.65,16570.0,United Kingdom
562368,84879,ASSORTED COLOUR BIRD ORNAMENT,48,2011-08-04 14:06:00,1.69,16570.0,United Kingdom
562368,20723,STRAWBERRY CHARLOTTE BAG,50,2011-08-04 14:06:00,0.85,16570.0,United Kingdom
562368,20724,RED RETROSPOT CHARLOTTE BAG,50,2011-08-04 14:06:00,0.85,16570.0,United Kingdom
562368,21212,PACK OF 72 RETROSPOT CAKE CASES,24,2011-08-04 14:06:00,0.55,16570.0,United Kingdom
562368,22383,LUNCH BAG SUKI DESIGN ,10,2011-08-04 14:06:00,1.65,16570.0,United Kingdom
562368,22460,EMBOSSED GLASS TEALIGHT HOLDER,24,2011-08-04 14:06:00,1.25,16570.0,United Kingdom
562368,23201,JUMBO BAG ALPHABET,20,2011-08-04 14:06:00,2.08,16570.0,United Kingdom
562368,23206,LUNCH BAG APPLE DESIGN,10,2011-08-04 14:06:00,1.65,16570.0,United Kingdom
562369,84687,BEACH HUT SHELF W 3 DRAWERS,8,2011-08-04 14:12:00,4.95,17584.0,United Kingdom
562369,23112,PARISIENNE CURIO CABINET,6,2011-08-04 14:12:00,7.5,17584.0,United Kingdom
562369,85053,FRENCH ENAMEL CANDLEHOLDER,6,2011-08-04 14:12:00,2.1,17584.0,United Kingdom
562369,22469,HEART OF WICKER SMALL,40,2011-08-04 14:12:00,1.45,17584.0,United Kingdom
562369,22457,NATURAL SLATE HEART CHALKBOARD ,12,2011-08-04 14:12:00,2.95,17584.0,United Kingdom
562369,21770,OPEN CLOSED METAL SIGN,10,2011-08-04 14:12:00,4.95,17584.0,United Kingdom
562369,82552,WASHROOM METAL SIGN,25,2011-08-04 14:12:00,1.45,17584.0,United Kingdom
562369,82484,WOOD BLACK BOARD ANT WHITE FINISH,12,2011-08-04 14:12:00,6.75,17584.0,United Kingdom
562369,84406B,CREAM CUPID HEARTS COAT HANGER,32,2011-08-04 14:12:00,3.75,17584.0,United Kingdom
562369,22467,GUMBALL COAT RACK,10,2011-08-04 14:12:00,2.55,17584.0,United Kingdom
562369,22212,FOUR HOOK  WHITE LOVEBIRDS,20,2011-08-04 14:12:00,2.1,17584.0,United Kingdom
562369,23270,SET OF 2 CERAMIC PAINTED HEARTS ,10,2011-08-04 14:12:00,1.45,17584.0,United Kingdom
562369,23263,SET OF 3 WOODEN HEART DECORATIONS,12,2011-08-04 14:12:00,1.25,17584.0,United Kingdom
562369,21735,TWO DOOR CURIO CABINET,6,2011-08-04 14:12:00,10.95,17584.0,United Kingdom
562369,82483,WOOD 2 DRAWER CABINET WHITE FINISH,4,2011-08-04 14:12:00,6.95,17584.0,United Kingdom
562369,22173,METAL 4 HOOK HANGER FRENCH CHATEAU,32,2011-08-04 14:12:00,2.55,17584.0,United Kingdom
562370,22603,CHRISTMAS RETROSPOT TREE WOOD,12,2011-08-04 14:20:00,0.85,12626.0,Germany
562370,22813,PACK 3 BOXES BIRD PANNETONE ,12,2011-08-04 14:20:00,1.95,12626.0,Germany
562370,23311,VINTAGE CHRISTMAS STOCKING ,12,2011-08-04 14:20:00,2.55,12626.0,Germany
562370,23275,SET OF 3 HANGING OWLS OLLIE BEAK,12,2011-08-04 14:20:00,1.25,12626.0,Germany
562370,23240,SET OF 4 KNICK KNACK TINS DOILEY ,6,2011-08-04 14:20:00,4.15,12626.0,Germany
562370,23008,DOLLY GIRL BABY GIFT SET,6,2011-08-04 14:20:00,14.95,12626.0,Germany
562370,23345, DOLLY GIRL BEAKER,12,2011-08-04 14:20:00,1.25,12626.0,Germany
562370,23007, SPACEBOY BABY GIFT SET,6,2011-08-04 14:20:00,14.95,12626.0,Germany
562370,23346,SPACEBOY BEAKER,12,2011-08-04 14:20:00,1.25,12626.0,Germany
562370,22614,PACK OF 12 SPACEBOY TISSUES,24,2011-08-04 14:20:00,0.29,12626.0,Germany
562370,22551,PLASTERS IN TIN SPACEBOY,24,2011-08-04 14:20:00,1.65,12626.0,Germany
562370,22615,PACK OF 12 CIRCUS PARADE TISSUES ,24,2011-08-04 14:20:00,0.29,12626.0,Germany
562370,23077,DOUGHNUT LIP GLOSS ,20,2011-08-04 14:20:00,1.25,12626.0,Germany
562370,21915,RED  HARMONICA IN BOX ,12,2011-08-04 14:20:00,1.25,12626.0,Germany
562370,21906,PHARMACIE FIRST AID TIN,2,2011-08-04 14:20:00,6.75,12626.0,Germany
562370,21558,SKULL LUNCH BOX WITH CUTLERY ,12,2011-08-04 14:20:00,2.55,12626.0,Germany
562370,22327,ROUND SNACK BOXES SET OF 4 SKULLS,12,2011-08-04 14:20:00,2.95,12626.0,Germany
562370,22328,ROUND SNACK BOXES SET OF 4 FRUITS ,24,2011-08-04 14:20:00,2.95,12626.0,Germany
562370,22993,SET OF 4 PANTRY JELLY MOULDS,12,2011-08-04 14:20:00,1.25,12626.0,Germany
562370,22966,GINGERBREAD MAN COOKIE CUTTER,24,2011-08-04 14:20:00,1.25,12626.0,Germany
562370,22897,OVEN MITT APPLES DESIGN,10,2011-08-04 14:20:00,1.45,12626.0,Germany
562370,22431,WATERING CAN BLUE ELEPHANT,6,2011-08-04 14:20:00,1.95,12626.0,Germany
562370,22961,JAM MAKING SET PRINTED,12,2011-08-04 14:20:00,1.45,12626.0,Germany
562370,22492,MINI PAINT SET VINTAGE ,36,2011-08-04 14:20:00,0.65,12626.0,Germany
562370,21108,FAIRY CAKE FLANNEL ASSORTED COLOUR,9,2011-08-04 14:20:00,2.55,12626.0,Germany
562370,22555,PLASTERS IN TIN STRONGMAN,12,2011-08-04 14:20:00,1.65,12626.0,Germany
562370,23287,RED VINTAGE SPOT BEAKER,8,2011-08-04 14:20:00,0.85,12626.0,Germany
562370,23286,BLUE VINTAGE SPOT BEAKER,8,2011-08-04 14:20:00,0.85,12626.0,Germany
562370,23288,GREEN VINTAGE SPOT BEAKER,8,2011-08-04 14:20:00,0.85,12626.0,Germany
562370,23285,PINK VINTAGE SPOT BEAKER,8,2011-08-04 14:20:00,0.85,12626.0,Germany
562370,23344,JUMBO BAG 50'S CHRISTMAS ,10,2011-08-04 14:20:00,2.08,12626.0,Germany
562370,22139,RETROSPOT TEA SET CERAMIC 11 PC ,3,2011-08-04 14:20:00,4.95,12626.0,Germany
562370,22969,HOMEMADE JAM SCENTED CANDLES,12,2011-08-04 14:20:00,1.45,12626.0,Germany
562370,POST,POSTAGE,4,2011-08-04 14:20:00,18.0,12626.0,Germany
562370,20914,SET/5 RED RETROSPOT LID GLASS BOWLS,12,2011-08-04 14:20:00,2.95,12626.0,Germany
562370,22352,LUNCH BOX WITH CUTLERY RETROSPOT ,12,2011-08-04 14:20:00,2.55,12626.0,Germany
562370,20712,JUMBO BAG WOODLAND ANIMALS,10,2011-08-04 14:20:00,2.08,12626.0,Germany
562370,21981,PACK OF 12 WOODLAND TISSUES ,24,2011-08-04 14:20:00,0.29,12626.0,Germany
562370,22554,PLASTERS IN TIN WOODLAND ANIMALS,24,2011-08-04 14:20:00,1.65,12626.0,Germany
562370,23190,BUNDLE OF 3 SCHOOL EXERCISE BOOKS  ,12,2011-08-04 14:20:00,1.65,12626.0,Germany
562370,23241,TREASURE TIN GYMKHANA DESIGN,6,2011-08-04 14:20:00,2.08,12626.0,Germany
562370,23242,TREASURE TIN BUFFALO BILL ,6,2011-08-04 14:20:00,2.08,12626.0,Germany
562370,22600,CHRISTMAS RETROSPOT STAR WOOD,12,2011-08-04 14:20:00,0.85,12626.0,Germany
562370,22601,CHRISTMAS RETROSPOT ANGEL WOOD,12,2011-08-04 14:20:00,0.85,12626.0,Germany
562371,21232,STRAWBERRY CERAMIC TRINKET BOX,12,2011-08-04 14:30:00,1.25,13709.0,United Kingdom
562371,21231,SWEETHEART CERAMIC TRINKET BOX,12,2011-08-04 14:30:00,1.25,13709.0,United Kingdom
562371,21877,HOME SWEET HOME MUG,12,2011-08-04 14:30:00,1.25,13709.0,United Kingdom
562371,23075,PARLOUR CERAMIC WALL HOOK,4,2011-08-04 14:30:00,4.15,13709.0,United Kingdom
562371,20749,ASSORTED COLOUR MINI CASES,2,2011-08-04 14:30:00,7.95,13709.0,United Kingdom
562371,21506,"FANCY FONT BIRTHDAY CARD, ",12,2011-08-04 14:30:00,0.42,13709.0,United Kingdom
562371,21497,FANCY FONTS BIRTHDAY WRAP,25,2011-08-04 14:30:00,0.42,13709.0,United Kingdom
562371,23231,WRAP DOILEY DESIGN,25,2011-08-04 14:30:00,0.42,13709.0,United Kingdom
562371,16161P,WRAP ENGLISH ROSE ,25,2011-08-04 14:30:00,0.42,13709.0,United Kingdom
562371,21984,PACK OF 12 PINK PAISLEY TISSUES ,24,2011-08-04 14:30:00,0.29,13709.0,United Kingdom
562371,21983,PACK OF 12 BLUE PAISLEY TISSUES ,24,2011-08-04 14:30:00,0.29,13709.0,United Kingdom
562371,23202,JUMBO BAG VINTAGE LEAF,10,2011-08-04 14:30:00,2.08,13709.0,United Kingdom
562371,22652,TRAVEL SEWING KIT,10,2011-08-04 14:30:00,1.65,13709.0,United Kingdom
562371,20750,RED RETROSPOT MINI CASES,2,2011-08-04 14:30:00,7.95,13709.0,United Kingdom
562371,23235,STORAGE TIN VINTAGE LEAF,6,2011-08-04 14:30:00,2.89,13709.0,United Kingdom
562371,23244,ROUND STORAGE TIN VINTAGE LEAF,6,2011-08-04 14:30:00,1.95,13709.0,United Kingdom
562371,23237,SET OF 4 KNICK KNACK TINS LEAF,6,2011-08-04 14:30:00,4.15,13709.0,United Kingdom
562371,23166,MEDIUM CERAMIC TOP STORAGE JAR,12,2011-08-04 14:30:00,1.25,13709.0,United Kingdom
562371,23167,SMALL CERAMIC TOP STORAGE JAR ,24,2011-08-04 14:30:00,0.83,13709.0,United Kingdom
562371,23298,SPOTTY BUNTING,15,2011-08-04 14:30:00,4.95,13709.0,United Kingdom
562371,22993,SET OF 4 PANTRY JELLY MOULDS,12,2011-08-04 14:30:00,1.25,13709.0,United Kingdom
562371,23293,SET OF 12 FAIRY CAKE BAKING CASES,12,2011-08-04 14:30:00,0.83,13709.0,United Kingdom
562371,23295,SET OF 12 MINI LOAF BAKING CASES,12,2011-08-04 14:30:00,0.83,13709.0,United Kingdom
562371,23296,SET OF 6 TEA TIME BAKING CASES,12,2011-08-04 14:30:00,1.25,13709.0,United Kingdom
562371,23308,SET OF 60 VINTAGE LEAF CAKE CASES ,24,2011-08-04 14:30:00,0.55,13709.0,United Kingdom
562371,21977,PACK OF 60 PINK PAISLEY CAKE CASES,24,2011-08-04 14:30:00,0.55,13709.0,United Kingdom
562371,84991,60 TEATIME FAIRY CAKE CASES,24,2011-08-04 14:30:00,0.55,13709.0,United Kingdom
562371,22428,ENAMEL FIRE BUCKET CREAM,6,2011-08-04 14:30:00,6.95,13709.0,United Kingdom
562371,22627,MINT KITCHEN SCALES,2,2011-08-04 14:30:00,8.5,13709.0,United Kingdom
562371,22625,RED KITCHEN SCALES,2,2011-08-04 14:30:00,8.5,13709.0,United Kingdom
562371,22624,IVORY KITCHEN SCALES,2,2011-08-04 14:30:00,8.5,13709.0,United Kingdom
562371,21668,RED STRIPE CERAMIC DRAWER KNOB,12,2011-08-04 14:30:00,1.25,13709.0,United Kingdom
562371,21669,BLUE STRIPE CERAMIC DRAWER KNOB,12,2011-08-04 14:30:00,1.25,13709.0,United Kingdom
562371,22192,BLUE DINER WALL CLOCK,2,2011-08-04 14:30:00,8.5,13709.0,United Kingdom
562371,22672,FRENCH BATHROOM SIGN BLUE METAL,12,2011-08-04 14:30:00,1.65,13709.0,United Kingdom
562371,22670,FRENCH WC SIGN BLUE METAL,12,2011-08-04 14:30:00,1.25,13709.0,United Kingdom
562371,84755,COLOUR GLASS T-LIGHT HOLDER HANGING,16,2011-08-04 14:30:00,0.65,13709.0,United Kingdom
562371,23188,VINTAGE  2 METER FOLDING RULER,12,2011-08-04 14:30:00,1.65,13709.0,United Kingdom
562371,22171,3 HOOK PHOTO SHELF ANTIQUE WHITE,2,2011-08-04 14:30:00,8.5,13709.0,United Kingdom
562371,82486,WOOD S/3 CABINET ANT WHITE FINISH,2,2011-08-04 14:30:00,8.95,13709.0,United Kingdom
562371,82482,WOODEN PICTURE FRAME WHITE FINISH,6,2011-08-04 14:30:00,2.55,13709.0,United Kingdom
562371,22294,HEART FILIGREE DOVE  SMALL,24,2011-08-04 14:30:00,1.25,13709.0,United Kingdom
562371,22189,CREAM HEART CARD HOLDER,4,2011-08-04 14:30:00,3.95,13709.0,United Kingdom
562371,21756,BATH BUILDING BLOCK WORD,3,2011-08-04 14:30:00,5.95,13709.0,United Kingdom
562371,21754,HOME BUILDING BLOCK WORD,3,2011-08-04 14:30:00,5.95,13709.0,United Kingdom
562371,21755,LOVE BUILDING BLOCK WORD,3,2011-08-04 14:30:00,5.95,13709.0,United Kingdom
562372,47566,PARTY BUNTING,50,2011-08-04 14:33:00,4.15,16258.0,United Kingdom
562372,23298,SPOTTY BUNTING,50,2011-08-04 14:33:00,4.15,16258.0,United Kingdom
562372,23301,GARDENERS KNEELING PAD KEEP CALM ,24,2011-08-04 14:33:00,1.65,16258.0,United Kingdom
562372,23300,GARDENERS KNEELING PAD CUP OF TEA ,24,2011-08-04 14:33:00,1.65,16258.0,United Kingdom
562372,20914,SET/5 RED RETROSPOT LID GLASS BOWLS,18,2011-08-04 14:33:00,2.95,16258.0,United Kingdom
562372,23313,VINTAGE CHRISTMAS BUNTING,50,2011-08-04 14:33:00,4.15,16258.0,United Kingdom
562373,22974,CHILDRENS DOLLY GIRL MUG,12,2011-08-04 14:33:00,1.65,16672.0,United Kingdom
562373,22629,SPACEBOY LUNCH BOX ,36,2011-08-04 14:33:00,1.95,16672.0,United Kingdom
562373,22630,DOLLY GIRL LUNCH BOX,30,2011-08-04 14:33:00,1.95,16672.0,United Kingdom
562373,22634,CHILDS BREAKFAST SET SPACEBOY ,12,2011-08-04 14:33:00,8.5,16672.0,United Kingdom
562373,22635,CHILDS BREAKFAST SET DOLLY GIRL ,8,2011-08-04 14:33:00,8.5,16672.0,United Kingdom
562374,22945,CHRISTMAS METAL TAGS ASSORTED ,144,2011-08-04 14:40:00,0.72,14911.0,EIRE
562374,22910,PAPER CHAIN KIT VINTAGE CHRISTMAS,200,2011-08-04 14:40:00,2.55,14911.0,EIRE
562374,22909,SET OF 20 VINTAGE CHRISTMAS NAPKINS,192,2011-08-04 14:40:00,0.72,14911.0,EIRE
562374,22907,PACK OF 20 NAPKINS PANTRY DESIGN,12,2011-08-04 14:40:00,0.85,14911.0,EIRE
562374,22699,ROSES REGENCY TEACUP AND SAUCER ,48,2011-08-04 14:40:00,2.55,14911.0,EIRE
562374,22698,PINK REGENCY TEACUP AND SAUCER,48,2011-08-04 14:40:00,2.55,14911.0,EIRE
562374,22697,GREEN REGENCY TEACUP AND SAUCER,48,2011-08-04 14:40:00,2.55,14911.0,EIRE
562374,22423,REGENCY CAKESTAND 3 TIER,32,2011-08-04 14:40:00,10.95,14911.0,EIRE
562374,22193,RED DINER WALL CLOCK,12,2011-08-04 14:40:00,7.65,14911.0,EIRE
562374,22192,BLUE DINER WALL CLOCK,12,2011-08-04 14:40:00,7.65,14911.0,EIRE
562374,22086,PAPER CHAIN KIT 50'S CHRISTMAS ,120,2011-08-04 14:40:00,2.55,14911.0,EIRE
562374,21977,PACK OF 60 PINK PAISLEY CAKE CASES,24,2011-08-04 14:40:00,0.55,14911.0,EIRE
562374,23318,BOX OF 6 MINI VINTAGE CRACKERS,96,2011-08-04 14:40:00,2.08,14911.0,EIRE
562374,23315,IVORY REFECTORY CLOCK,12,2011-08-04 14:40:00,8.15,14911.0,EIRE
562374,23314,VINTAGE CHRISTMAS TABLECLOTH,4,2011-08-04 14:40:00,12.5,14911.0,EIRE
562374,23307,SET OF 60 PANTRY DESIGN CAKE CASES ,24,2011-08-04 14:40:00,0.55,14911.0,EIRE
562374,23175,REGENCY MILK JUG PINK ,48,2011-08-04 14:40:00,2.75,14911.0,EIRE
562374,23174,REGENCY SUGAR BOWL GREEN,48,2011-08-04 14:40:00,3.75,14911.0,EIRE
562374,23173,REGENCY TEAPOT ROSES ,24,2011-08-04 14:40:00,8.15,14911.0,EIRE
562374,23172,REGENCY TEA PLATE PINK,48,2011-08-04 14:40:00,1.45,14911.0,EIRE
562374,23171,REGENCY TEA PLATE GREEN ,48,2011-08-04 14:40:00,1.45,14911.0,EIRE
562374,23170,REGENCY TEA PLATE ROSES ,48,2011-08-04 14:40:00,1.45,14911.0,EIRE
562374,23169,CLASSIC GLASS COOKIE JAR,6,2011-08-04 14:40:00,4.15,14911.0,EIRE
562374,23166,MEDIUM CERAMIC TOP STORAGE JAR,12,2011-08-04 14:40:00,1.25,14911.0,EIRE
562374,23163,REGENCY SUGAR TONGS,48,2011-08-04 14:40:00,2.08,14911.0,EIRE
562374,23157,SET OF 6 NATIVITY MAGNETS ,240,2011-08-04 14:40:00,1.85,14911.0,EIRE
562374,22980,PANTRY SCRUBBING BRUSH,48,2011-08-04 14:40:00,1.45,14911.0,EIRE
562374,22979,PANTRY WASHING UP BRUSH,72,2011-08-04 14:40:00,1.25,14911.0,EIRE
562374,22978,PANTRY ROLLING PIN,24,2011-08-04 14:40:00,3.39,14911.0,EIRE
562374,22952,60 CAKE CASES VINTAGE CHRISTMAS,240,2011-08-04 14:40:00,0.42,14911.0,EIRE
562374,22950,36 DOILIES VINTAGE CHRISTMAS,288,2011-08-04 14:40:00,1.25,14911.0,EIRE
C562375,23318,BOX OF 6 MINI VINTAGE CRACKERS,-96,2011-08-04 14:46:00,2.08,14911.0,EIRE
C562375,23315,IVORY REFECTORY CLOCK,-12,2011-08-04 14:46:00,8.15,14911.0,EIRE
C562375,23314,VINTAGE CHRISTMAS TABLECLOTH,-4,2011-08-04 14:46:00,12.5,14911.0,EIRE
C562375,23307,SET OF 60 PANTRY DESIGN CAKE CASES ,-24,2011-08-04 14:46:00,0.55,14911.0,EIRE
C562375,23175,REGENCY MILK JUG PINK ,-48,2011-08-04 14:46:00,2.75,14911.0,EIRE
C562375,23174,REGENCY SUGAR BOWL GREEN,-48,2011-08-04 14:46:00,3.75,14911.0,EIRE
C562375,23173,REGENCY TEAPOT ROSES ,-24,2011-08-04 14:46:00,8.15,14911.0,EIRE
C562375,23172,REGENCY TEA PLATE PINK,-48,2011-08-04 14:46:00,1.45,14911.0,EIRE
C562375,23171,REGENCY TEA PLATE GREEN ,-48,2011-08-04 14:46:00,1.45,14911.0,EIRE
C562375,23170,REGENCY TEA PLATE ROSES ,-48,2011-08-04 14:46:00,1.45,14911.0,EIRE
C562375,23169,CLASSIC GLASS COOKIE JAR,-6,2011-08-04 14:46:00,4.15,14911.0,EIRE
C562375,23166,MEDIUM CERAMIC TOP STORAGE JAR,-12,2011-08-04 14:46:00,1.25,14911.0,EIRE
C562375,23163,REGENCY SUGAR TONGS,-48,2011-08-04 14:46:00,2.08,14911.0,EIRE
C562375,23157,SET OF 6 NATIVITY MAGNETS ,-240,2011-08-04 14:46:00,1.85,14911.0,EIRE
C562375,22980,PANTRY SCRUBBING BRUSH,-48,2011-08-04 14:46:00,1.45,14911.0,EIRE
C562375,22979,PANTRY WASHING UP BRUSH,-72,2011-08-04 14:46:00,1.25,14911.0,EIRE
C562375,22978,PANTRY ROLLING PIN,-24,2011-08-04 14:46:00,3.39,14911.0,EIRE
C562375,22952,60 CAKE CASES VINTAGE CHRISTMAS,-240,2011-08-04 14:46:00,0.42,14911.0,EIRE
C562375,22950,36 DOILIES VINTAGE CHRISTMAS,-288,2011-08-04 14:46:00,1.25,14911.0,EIRE
C562375,22945,CHRISTMAS METAL TAGS ASSORTED ,-144,2011-08-04 14:46:00,0.72,14911.0,EIRE
C562375,22910,PAPER CHAIN KIT VINTAGE CHRISTMAS,-200,2011-08-04 14:46:00,2.55,14911.0,EIRE
C562375,22909,SET OF 20 VINTAGE CHRISTMAS NAPKINS,-192,2011-08-04 14:46:00,0.72,14911.0,EIRE
C562375,22907,PACK OF 20 NAPKINS PANTRY DESIGN,-12,2011-08-04 14:46:00,0.85,14911.0,EIRE
C562375,22699,ROSES REGENCY TEACUP AND SAUCER ,-48,2011-08-04 14:46:00,2.55,14911.0,EIRE
C562375,22698,PINK REGENCY TEACUP AND SAUCER,-48,2011-08-04 14:46:00,2.55,14911.0,EIRE
C562375,22697,GREEN REGENCY TEACUP AND SAUCER,-48,2011-08-04 14:46:00,2.55,14911.0,EIRE
C562375,22423,REGENCY CAKESTAND 3 TIER,-32,2011-08-04 14:46:00,10.95,14911.0,EIRE
C562375,22193,RED DINER WALL CLOCK,-12,2011-08-04 14:46:00,7.65,14911.0,EIRE
C562375,22192,BLUE DINER WALL CLOCK,-12,2011-08-04 14:46:00,7.65,14911.0,EIRE
C562375,22086,PAPER CHAIN KIT 50'S CHRISTMAS ,-120,2011-08-04 14:46:00,2.55,14911.0,EIRE
C562375,21977,PACK OF 60 PINK PAISLEY CAKE CASES,-24,2011-08-04 14:46:00,0.55,14911.0,EIRE
562376,10133,COLOURING PENCILS BROWN TUBE,40,2011-08-04 15:04:00,0.42,15254.0,United Kingdom
562376,22381,TOY TIDY PINK POLKADOT,5,2011-08-04 15:04:00,2.1,15254.0,United Kingdom
562376,85032D,YULETIDE IMAGES GIFT WRAP SET,12,2011-08-04 15:04:00,0.65,15254.0,United Kingdom
562376,22969,HOMEMADE JAM SCENTED CANDLES,12,2011-08-04 15:04:00,1.45,15254.0,United Kingdom
562376,84946,ANTIQUE SILVER T-LIGHT GLASS,12,2011-08-04 15:04:00,1.25,15254.0,United Kingdom
562376,23109,PACK OF SIX LED TEA LIGHTS,6,2011-08-04 15:04:00,2.89,15254.0,United Kingdom
562376,22548,HEADS AND TAILS SPORTING FUN,12,2011-08-04 15:04:00,1.25,15254.0,United Kingdom
562376,23546,WRAP PAISLEY PARK ,25,2011-08-04 15:04:00,0.42,15254.0,United Kingdom
562376,23549,WRAP BIRD GARDEN ,25,2011-08-04 15:04:00,0.42,15254.0,United Kingdom
562376,23234,BISCUIT TIN VINTAGE CHRISTMAS,6,2011-08-04 15:04:00,2.89,15254.0,United Kingdom
562376,23313,VINTAGE CHRISTMAS BUNTING,5,2011-08-04 15:04:00,4.95,15254.0,United Kingdom
562376,23319,BOX OF 6 MINI 50'S CRACKERS,6,2011-08-04 15:04:00,2.49,15254.0,United Kingdom
562376,23344,JUMBO BAG 50'S CHRISTMAS ,10,2011-08-04 15:04:00,2.08,15254.0,United Kingdom
562376,22113,GREY HEART HOT WATER BOTTLE,4,2011-08-04 15:04:00,3.75,15254.0,United Kingdom
562376,23310,BUBBLEGUM RING ASSORTED,72,2011-08-04 15:04:00,0.42,15254.0,United Kingdom
562376,85099C,JUMBO  BAG BAROQUE BLACK WHITE,10,2011-08-04 15:04:00,2.08,15254.0,United Kingdom
562376,23203,JUMBO BAG DOILEY PATTERNS,10,2011-08-04 15:04:00,2.08,15254.0,United Kingdom
562376,21485,RETROSPOT HEART HOT WATER BOTTLE,3,2011-08-04 15:04:00,4.95,15254.0,United Kingdom
562377,23299,FOOD COVER WITH BEADS SET 2 ,2,2011-08-04 15:04:00,3.75,14535.0,United Kingdom
562377,22993,SET OF 4 PANTRY JELLY MOULDS,2,2011-08-04 15:04:00,1.25,14535.0,United Kingdom
562377,21559,STRAWBERRY LUNCH BOX WITH CUTLERY,1,2011-08-04 15:04:00,2.55,14535.0,United Kingdom
562377,21922,UNION STRIPE WITH FRINGE  HAMMOCK,7,2011-08-04 15:04:00,7.95,14535.0,United Kingdom
562377,23245,SET OF 3 REGENCY CAKE TINS,1,2011-08-04 15:04:00,4.95,14535.0,United Kingdom
562377,23229,VINTAGE DONKEY TAIL GAME ,3,2011-08-04 15:04:00,3.75,14535.0,United Kingdom
562377,23307,SET OF 60 PANTRY DESIGN CAKE CASES ,3,2011-08-04 15:04:00,0.55,14535.0,United Kingdom
562377,23308,SET OF 60 VINTAGE LEAF CAKE CASES ,3,2011-08-04 15:04:00,0.55,14535.0,United Kingdom
562377,23191,BUNDLE OF 3 RETRO NOTE BOOKS,3,2011-08-04 15:04:00,1.65,14535.0,United Kingdom
562377,23192,BUNDLE OF 3 ALPHABET EXERCISE BOOKS,3,2011-08-04 15:04:00,1.65,14535.0,United Kingdom
562377,22907,PACK OF 20 NAPKINS PANTRY DESIGN,2,2011-08-04 15:04:00,0.85,14535.0,United Kingdom
562377,23298,SPOTTY BUNTING,4,2011-08-04 15:04:00,4.95,14535.0,United Kingdom
562377,23321,SMALL WHITE HEART OF WICKER,6,2011-08-04 15:04:00,1.65,14535.0,United Kingdom
562377,23188,VINTAGE  2 METER FOLDING RULER,4,2011-08-04 15:04:00,1.65,14535.0,United Kingdom
562377,23322,LARGE WHITE HEART OF WICKER,6,2011-08-04 15:04:00,2.95,14535.0,United Kingdom
562377,23288,GREEN VINTAGE SPOT BEAKER,2,2011-08-04 15:04:00,0.85,14535.0,United Kingdom
562377,23285,PINK VINTAGE SPOT BEAKER,2,2011-08-04 15:04:00,0.85,14535.0,United Kingdom
562377,23287,RED VINTAGE SPOT BEAKER,2,2011-08-04 15:04:00,0.85,14535.0,United Kingdom
562377,23286,BLUE VINTAGE SPOT BEAKER,2,2011-08-04 15:04:00,0.85,14535.0,United Kingdom
562377,22990,COTTON APRON PANTRY DESIGN,3,2011-08-04 15:04:00,4.95,14535.0,United Kingdom
562377,21745,GAOLERS KEYS DECORATIVE GARDEN ,3,2011-08-04 15:04:00,3.75,14535.0,United Kingdom
562377,22697,GREEN REGENCY TEACUP AND SAUCER,2,2011-08-04 15:04:00,2.95,14535.0,United Kingdom
562377,22699,ROSES REGENCY TEACUP AND SAUCER ,2,2011-08-04 15:04:00,2.95,14535.0,United Kingdom
562377,22426,ENAMEL WASH BOWL CREAM,2,2011-08-04 15:04:00,3.75,14535.0,United Kingdom
562377,20752,BLUE POLKADOT WASHING UP GLOVES,2,2011-08-04 15:04:00,2.1,14535.0,United Kingdom
562377,20996,JAZZ HEARTS ADDRESS BOOK,6,2011-08-04 15:04:00,0.19,14535.0,United Kingdom
562377,22210,WOOD STAMP SET BEST WISHES,3,2011-08-04 15:04:00,0.83,14535.0,United Kingdom
562377,22211,WOOD STAMP SET FLOWERS,3,2011-08-04 15:04:00,0.83,14535.0,United Kingdom
562377,84997A,CHILDRENS CUTLERY POLKADOT GREEN ,1,2011-08-04 15:04:00,4.15,14535.0,United Kingdom
562377,23256,CHILDRENS CUTLERY SPACEBOY ,2,2011-08-04 15:04:00,4.15,14535.0,United Kingdom
