InvoiceNo,StockCode,Description,Quantity,InvoiceDate,UnitPrice,CustomerID,Country
574053,22766,PHOTO FRAME CORNICE,8,2011-11-02 14:04:00,2.95,16379.0,United Kingdom
574053,21975,PACK OF 60 DINOSAUR CAKE CASES,24,2011-11-02 14:04:00,0.55,16379.0,United Kingdom
574053,21976,PACK OF 60 MUSHROOM CAKE CASES,24,2011-11-02 14:04:00,0.55,16379.0,United Kingdom
574053,23200,JUMBO BAG PEARS,10,2011-11-02 14:04:00,2.08,16379.0,United Kingdom
574053,23199,JUMBO BAG APPLES,10,2011-11-02 14:04:00,2.08,16379.0,United Kingdom
574053,23201,JUMBO BAG ALPHABET,10,2011-11-02 14:04:00,2.08,16379.0,United Kingdom
574053,23203,JUMBO BAG VINTAGE DOILY ,10,2011-11-02 14:04:00,2.08,16379.0,United Kingdom
574053,23343,JUMBO BAG VINTAGE CHRISTMAS ,20,2011-11-02 14:04:00,2.08,16379.0,United Kingdom
574053,23344,JUMBO BAG 50'S CHRISTMAS ,30,2011-11-02 14:04:00,2.08,16379.0,United Kingdom
574053,23503,PLAYING CARDS KEEP CALM & CARRY ON,12,2011-11-02 14:04:00,1.25,16379.0,United Kingdom
574053,21889,WOODEN BOX OF DOMINOES,12,2011-11-02 14:04:00,1.25,16379.0,United Kingdom
574053,22867,HAND WARMER BIRD DESIGN,12,2011-11-02 14:04:00,2.1,16379.0,United Kingdom
574053,84077,WORLD WAR 2 GLIDERS ASSTD DESIGNS,48,2011-11-02 14:04:00,0.29,16379.0,United Kingdom
574053,23237,SET OF 4 KNICK KNACK TINS LEAF,6,2011-11-02 14:04:00,4.15,16379.0,United Kingdom
574053,23240,SET OF 4 KNICK KNACK TINS DOILY ,6,2011-11-02 14:04:00,4.15,16379.0,United Kingdom
574053,23382,BOX OF 6 CHRISTMAS CAKE DECORATIONS,4,2011-11-02 14:04:00,3.75,16379.0,United Kingdom
574053,23330,DECORATIVE WICKER HEART MEDIUM,12,2011-11-02 14:04:00,1.25,16379.0,United Kingdom
574053,22572,ROCKING HORSE GREEN CHRISTMAS ,12,2011-11-02 14:04:00,0.85,16379.0,United Kingdom
574053,23269,SET OF 2 CERAMIC CHRISTMAS TREES,12,2011-11-02 14:04:00,1.45,16379.0,United Kingdom
574053,23096,PETIT TRAY CHIC,12,2011-11-02 14:04:00,1.65,16379.0,United Kingdom
574053,20982,12 PENCILS TALL TUBE SKULLS,12,2011-11-02 14:04:00,0.85,16379.0,United Kingdom
574053,20981,12 PENCILS TALL TUBE WOODLAND,12,2011-11-02 14:04:00,0.85,16379.0,United Kingdom
574053,23192,BUNDLE OF 3 ALPHABET EXERCISE BOOKS,12,2011-11-02 14:04:00,1.65,16379.0,United Kingdom
574053,82552,WASHROOM METAL SIGN,12,2011-11-02 14:04:00,1.45,16379.0,United Kingdom
574053,23215,JINGLE BELL HEART ANTIQUE SILVER,12,2011-11-02 14:04:00,2.08,16379.0,United Kingdom
574053,23214,JINGLE BELL HEART ANTIQUE GOLD,24,2011-11-02 14:04:00,2.08,16379.0,United Kingdom
574054,23356,LOVE HOT WATER BOTTLE,6,2011-11-02 14:07:00,5.95,18104.0,United Kingdom
574054,23355,HOT WATER BOTTLE KEEP CALM,4,2011-11-02 14:07:00,4.95,18104.0,United Kingdom
574054,21485,RETROSPOT HEART HOT WATER BOTTLE,6,2011-11-02 14:07:00,4.95,18104.0,United Kingdom
574054,22468,BABUSHKA LIGHTS STRING OF 10,4,2011-11-02 14:07:00,6.75,18104.0,United Kingdom
574054,79321,CHILLI LIGHTS,4,2011-11-02 14:07:00,5.75,18104.0,United Kingdom
574054,22573,STAR WOODEN CHRISTMAS DECORATION,24,2011-11-02 14:07:00,0.85,18104.0,United Kingdom
574054,22574,HEART WOODEN CHRISTMAS DECORATION,24,2011-11-02 14:07:00,0.85,18104.0,United Kingdom
574054,22578,WOODEN STAR CHRISTMAS SCANDINAVIAN,24,2011-11-02 14:07:00,0.29,18104.0,United Kingdom
574054,22576,SWALLOW WOODEN CHRISTMAS DECORATION,12,2011-11-02 14:07:00,0.85,18104.0,United Kingdom
574054,22579,WOODEN TREE CHRISTMAS SCANDINAVIAN,24,2011-11-02 14:07:00,0.29,18104.0,United Kingdom
574054,22595,GINGHAM HEART DECORATION,12,2011-11-02 14:07:00,0.85,18104.0,United Kingdom
574054,23263,SET OF 3 WOODEN HEART DECORATIONS,12,2011-11-02 14:07:00,1.25,18104.0,United Kingdom
574054,23266,SET OF 3 WOODEN STOCKING DECORATION,12,2011-11-02 14:07:00,1.25,18104.0,United Kingdom
574054,85199L,LARGE HANGING IVORY & RED WOOD BIRD,12,2011-11-02 14:07:00,0.65,18104.0,United Kingdom
574054,22571,ROCKING HORSE RED CHRISTMAS ,12,2011-11-02 14:07:00,0.85,18104.0,United Kingdom
574054,22572,ROCKING HORSE GREEN CHRISTMAS ,12,2011-11-02 14:07:00,0.85,18104.0,United Kingdom
574054,23212,HEART WREATH DECORATION WITH BELL,12,2011-11-02 14:07:00,1.25,18104.0,United Kingdom
574054,20685,DOORMAT RED RETROSPOT,4,2011-11-02 14:07:00,8.25,18104.0,United Kingdom
574054,21523,DOORMAT FANCY FONT HOME SWEET HOME,4,2011-11-02 14:07:00,8.25,18104.0,United Kingdom
574054,22690,DOORMAT HOME SWEET HOME BLUE ,4,2011-11-02 14:07:00,8.25,18104.0,United Kingdom
574054,22691,DOORMAT WELCOME SUNRISE,4,2011-11-02 14:07:00,8.25,18104.0,United Kingdom
574054,23284,DOORMAT KEEP CALM AND COME IN,4,2011-11-02 14:07:00,8.25,18104.0,United Kingdom
574054,48138,DOORMAT UNION FLAG,4,2011-11-02 14:07:00,8.25,18104.0,United Kingdom
574054,48194,DOORMAT HEARTS,4,2011-11-02 14:07:00,8.25,18104.0,United Kingdom
574054,48185,DOORMAT FAIRY CAKE,4,2011-11-02 14:07:00,8.25,18104.0,United Kingdom
574054,22593,CHRISTMAS GINGHAM STAR,12,2011-11-02 14:07:00,0.85,18104.0,United Kingdom
574054,22594,CHRISTMAS GINGHAM TREE,12,2011-11-02 14:07:00,0.85,18104.0,United Kingdom
574054,35970,ZINC FOLKART SLEIGH BELLS,12,2011-11-02 14:07:00,1.69,18104.0,United Kingdom
574054,21624,VINTAGE UNION JACK DOORSTOP,3,2011-11-02 14:07:00,5.95,18104.0,United Kingdom
574054,22508,DOORSTOP RETROSPOT HEART,4,2011-11-02 14:07:00,3.75,18104.0,United Kingdom
574054,21411,GINGHAM HEART  DOORSTOP RED,3,2011-11-02 14:07:00,4.25,18104.0,United Kingdom
574054,23213,STAR WREATH DECORATION WITH BELL,12,2011-11-02 14:07:00,1.25,18104.0,United Kingdom
574054,23220,REINDEER HEART DECORATION GOLD,12,2011-11-02 14:07:00,0.83,18104.0,United Kingdom
574054,23221,REINDEER HEART DECORATION SILVER,12,2011-11-02 14:07:00,0.83,18104.0,United Kingdom
574054,23224,CHERUB HEART DECORATION GOLD,12,2011-11-02 14:07:00,0.83,18104.0,United Kingdom
574054,23225,CHERUB HEART DECORATION SILVER ,12,2011-11-02 14:07:00,0.83,18104.0,United Kingdom
574054,23283,DOORMAT VINTAGE LEAF,4,2011-11-02 14:07:00,8.25,18104.0,United Kingdom
574054,22366,DOORMAT AIRMAIL ,4,2011-11-02 14:07:00,8.25,18104.0,United Kingdom
574055,22169,FAMILY ALBUM WHITE PICTURE FRAME,8,2011-11-02 14:08:00,7.65,16525.0,United Kingdom
574055,22767,TRIPLE PHOTO FRAME CORNICE ,16,2011-11-02 14:08:00,8.5,16525.0,United Kingdom
574055,82482,WOODEN PICTURE FRAME WHITE FINISH,36,2011-11-02 14:08:00,2.55,16525.0,United Kingdom
574055,82494L,WOODEN FRAME ANTIQUE WHITE ,24,2011-11-02 14:08:00,2.55,16525.0,United Kingdom
574055,84946,ANTIQUE SILVER T-LIGHT GLASS,72,2011-11-02 14:08:00,1.06,16525.0,United Kingdom
574055,84947,ANTIQUE SILVER TEA GLASS ENGRAVED,12,2011-11-02 14:08:00,1.25,16525.0,United Kingdom
574055,21259,VICTORIAN SEWING BOX SMALL ,2,2011-11-02 14:08:00,5.95,16525.0,United Kingdom
574055,48129,DOORMAT TOPIARY,10,2011-11-02 14:08:00,7.08,16525.0,United Kingdom
574055,23462,ROCOCO WALL MIRROR WHITE,6,2011-11-02 14:08:00,16.95,16525.0,United Kingdom
574055,85123A,WHITE HANGING HEART T-LIGHT HOLDER,32,2011-11-02 14:08:00,2.55,16525.0,United Kingdom
574055,22791,T-LIGHT GLASS FLUTED ANTIQUE,72,2011-11-02 14:08:00,1.06,16525.0,United Kingdom
574055,21326,AGED GLASS SILVER T-LIGHT HOLDER,144,2011-11-02 14:08:00,0.55,16525.0,United Kingdom
574056,22385,JUMBO BAG SPACEBOY DESIGN,100,2011-11-02 14:09:00,1.79,14646.0,Netherlands
574056,85099B,JUMBO BAG RED RETROSPOT,200,2011-11-02 14:09:00,1.79,14646.0,Netherlands
574056,20718,RED RETROSPOT SHOPPER BAG,100,2011-11-02 14:09:00,1.06,14646.0,Netherlands
574056,21668,RED STRIPE CERAMIC DRAWER KNOB,96,2011-11-02 14:09:00,1.25,14646.0,Netherlands
574056,21669,BLUE STRIPE CERAMIC DRAWER KNOB,96,2011-11-02 14:09:00,1.25,14646.0,Netherlands
574056,21670,BLUE SPOT CERAMIC DRAWER KNOB,192,2011-11-02 14:09:00,1.25,14646.0,Netherlands
574056,22467,GUMBALL COAT RACK,72,2011-11-02 14:09:00,2.1,14646.0,Netherlands
574056,21507,ELEPHANT BIRTHDAY CARD ,72,2011-11-02 14:09:00,0.36,14646.0,Netherlands
574056,22029,SPACEBOY BIRTHDAY CARD,72,2011-11-02 14:09:00,0.36,14646.0,Netherlands
574056,22952,60 CAKE CASES VINTAGE CHRISTMAS,24,2011-11-02 14:09:00,0.55,14646.0,Netherlands
574056,22666,RECIPE BOX PANTRY YELLOW DESIGN,24,2011-11-02 14:09:00,2.55,14646.0,Netherlands
574056,84997C,CHILDRENS CUTLERY POLKADOT BLUE,72,2011-11-02 14:09:00,3.75,14646.0,Netherlands
574056,22326,ROUND SNACK BOXES SET OF4 WOODLAND ,96,2011-11-02 14:09:00,2.55,14646.0,Netherlands
574056,22328,ROUND SNACK BOXES SET OF 4 FRUITS ,48,2011-11-02 14:09:00,2.55,14646.0,Netherlands
574056,22631,CIRCUS PARADE LUNCH BOX ,64,2011-11-02 14:09:00,1.65,14646.0,Netherlands
574056,22629,SPACEBOY LUNCH BOX ,64,2011-11-02 14:09:00,1.65,14646.0,Netherlands
574056,23256,CHILDRENS CUTLERY SPACEBOY ,72,2011-11-02 14:09:00,3.75,14646.0,Netherlands
574056,20750,RED RETROSPOT MINI CASES,12,2011-11-02 14:09:00,6.35,14646.0,Netherlands
574056,21428,SET3 BOOK BOX GREEN GINGHAM FLOWER ,16,2011-11-02 14:09:00,3.75,14646.0,Netherlands
574056,21249,WOODLAND  HEIGHT CHART STICKERS ,30,2011-11-02 14:09:00,2.55,14646.0,Netherlands
574056,22554,PLASTERS IN TIN WOODLAND ANIMALS,96,2011-11-02 14:09:00,1.45,14646.0,Netherlands
574056,22551,PLASTERS IN TIN SPACEBOY,96,2011-11-02 14:09:00,1.45,14646.0,Netherlands
574056,21238,RED RETROSPOT CUP,96,2011-11-02 14:09:00,0.72,14646.0,Netherlands
574056,22667,RECIPE BOX RETROSPOT ,24,2011-11-02 14:09:00,2.55,14646.0,Netherlands
574056,21212,PACK OF 72 RETROSPOT CAKE CASES,120,2011-11-02 14:09:00,0.42,14646.0,Netherlands
574056,22382,LUNCH BAG SPACEBOY DESIGN ,100,2011-11-02 14:09:00,1.45,14646.0,Netherlands
574056,20725,LUNCH BAG RED RETROSPOT,100,2011-11-02 14:09:00,1.45,14646.0,Netherlands
574056,20726,LUNCH BAG WOODLAND,100,2011-11-02 14:09:00,1.45,14646.0,Netherlands
574056,22384,LUNCH BAG PINK POLKADOT,100,2011-11-02 14:09:00,1.45,14646.0,Netherlands
574056,20712,JUMBO BAG WOODLAND ANIMALS,100,2011-11-02 14:09:00,1.79,14646.0,Netherlands
574058,23084,RABBIT NIGHT LIGHT,216,2011-11-02 14:10:00,2.08,14646.0,Netherlands
C574057,23028,DRAWER KNOB CRACKLE GLAZE BLUE,-1,2011-11-02 14:10:00,1.65,14102.0,United Kingdom
C574057,22938,CUPCAKE LACE PAPER SET 6,-12,2011-11-02 14:10:00,1.95,14102.0,United Kingdom
574059,23115,RED APPLES CHOPPING BOARD   ,1,2011-11-02 14:13:00,4.95,14646.0,Netherlands
574059,23113,PANTRY CHOPPING BOARD,1,2011-11-02 14:13:00,4.95,14646.0,Netherlands
574059,23499,SET 12 VINTAGE DOILY CHALK ,24,2011-11-02 14:13:00,0.42,14646.0,Netherlands
574059,23497,CLASSIC CHROME BICYCLE BELL ,1,2011-11-02 14:13:00,1.45,14646.0,Netherlands
574059,23480,MINI LIGHTS WOODLAND MUSHROOMS,1,2011-11-02 14:13:00,3.75,14646.0,Netherlands
574059,23476,WOODLAND LARGE RED FELT HEART,1,2011-11-02 14:13:00,1.25,14646.0,Netherlands
574059,23478,WOODLAND LARGE PINK FELT HEART,1,2011-11-02 14:13:00,1.25,14646.0,Netherlands
574059,23477,WOODLAND LARGE BLUE FELT HEART,1,2011-11-02 14:13:00,1.25,14646.0,Netherlands
574059,23473,WOODLAND SMALL RED FELT HEART,1,2011-11-02 14:13:00,0.83,14646.0,Netherlands
574059,23475,WOODLAND SMALL PINK FELT HEART,1,2011-11-02 14:13:00,0.83,14646.0,Netherlands
574059,23474,WOODLAND SMALL BLUE FELT HEART,1,2011-11-02 14:13:00,0.83,14646.0,Netherlands
574059,23390,DOLLY GIRL MINI BACKPACK,1,2011-11-02 14:13:00,4.15,14646.0,Netherlands
574059,23241,TREASURE TIN GYMKHANA DESIGN,1,2011-11-02 14:13:00,2.08,14646.0,Netherlands
574059,23510,MINI PLAYING CARDS GYMKHANA,1,2011-11-02 14:13:00,0.42,14646.0,Netherlands
574059,23507,MINI PLAYING CARDS BUFFALO BILL ,1,2011-11-02 14:13:00,0.42,14646.0,Netherlands
574059,20979,36 PENCILS TUBE RED RETROSPOT,1,2011-11-02 14:13:00,1.25,14646.0,Netherlands
574059,20981,12 PENCILS TALL TUBE WOODLAND,1,2011-11-02 14:13:00,0.85,14646.0,Netherlands
574059,20983,12 PENCILS TALL TUBE RED RETROSPOT,1,2011-11-02 14:13:00,0.85,14646.0,Netherlands
574059,20931,BLUE POT PLANT CANDLE ,1,2011-11-02 14:13:00,2.95,14646.0,Netherlands
574059,20975,12 PENCILS SMALL TUBE RED RETROSPOT,1,2011-11-02 14:13:00,0.65,14646.0,Netherlands
574059,23582,VINTAGE DOILY JUMBO BAG RED ,1,2011-11-02 14:13:00,2.08,14646.0,Netherlands
574059,22614,PACK OF 12 SPACEBOY TISSUES,1,2011-11-02 14:13:00,0.39,14646.0,Netherlands
574059,21981,PACK OF 12 WOODLAND TISSUES ,1,2011-11-02 14:13:00,0.39,14646.0,Netherlands
574059,23380,PACK OF 12 VINTAGE DOILY TISSUES,1,2011-11-02 14:13:00,0.39,14646.0,Netherlands
574059,23551,PACK OF 12 PAISLEY PARK TISSUES ,1,2011-11-02 14:13:00,0.39,14646.0,Netherlands
574059,23583,LUNCH BAG PAISLEY PARK  ,1,2011-11-02 14:13:00,1.65,14646.0,Netherlands
574059,23581,JUMBO BAG PAISLEY PARK,1,2011-11-02 14:13:00,2.08,14646.0,Netherlands
574059,23515,EMBROIDERED RIBBON REEL DAISY ,1,2011-11-02 14:13:00,2.08,14646.0,Netherlands
574059,23494,VINTAGE DOILY DELUXE SEWING KIT ,1,2011-11-02 14:13:00,5.95,14646.0,Netherlands
574059,23493,VINTAGE DOILY TRAVEL SEWING KIT,1,2011-11-02 14:13:00,1.95,14646.0,Netherlands
574059,23198,PANTRY MAGNETIC  SHOPPING LIST,1,2011-11-02 14:13:00,1.45,14646.0,Netherlands
574059,23559,WOODLAND BUNNIES LOLLY MAKERS,1,2011-11-02 14:13:00,2.08,14646.0,Netherlands
574059,22730,ALARM CLOCK BAKELIKE IVORY,1,2011-11-02 14:13:00,3.75,14646.0,Netherlands
574059,22726,ALARM CLOCK BAKELIKE GREEN,1,2011-11-02 14:13:00,3.75,14646.0,Netherlands
574059,22725,ALARM CLOCK BAKELIKE CHOCOLATE,1,2011-11-02 14:13:00,3.75,14646.0,Netherlands
574059,22728,ALARM CLOCK BAKELIKE PINK,1,2011-11-02 14:13:00,3.75,14646.0,Netherlands
574059,22727,ALARM CLOCK BAKELIKE RED ,1,2011-11-02 14:13:00,3.75,14646.0,Netherlands
574059,23416,CHAMBRE HOOK,1,2011-11-02 14:13:00,1.65,14646.0,Netherlands
574059,23415,HOME SWEET HOME HOOK,1,2011-11-02 14:13:00,1.65,14646.0,Netherlands
574060,23570,TRADITIONAL PICK UP STICKS GAME ,12,2011-11-02 14:16:00,1.25,16531.0,United Kingdom
574060,21888,BINGO SET,4,2011-11-02 14:16:00,3.75,16531.0,United Kingdom
574060,21915,RED  HARMONICA IN BOX ,12,2011-11-02 14:16:00,1.25,16531.0,United Kingdom
574060,22622,BOX OF VINTAGE ALPHABET BLOCKS,2,2011-11-02 14:16:00,11.95,16531.0,United Kingdom
574060,21485,RETROSPOT HEART HOT WATER BOTTLE,3,2011-11-02 14:16:00,4.95,16531.0,United Kingdom
574060,21479,WHITE SKULL HOT WATER BOTTLE ,4,2011-11-02 14:16:00,4.25,16531.0,United Kingdom
574060,70007,HI TEC ALPINE HAND WARMER,12,2011-11-02 14:16:00,1.65,16531.0,United Kingdom
574060,70006,LOVE HEART POCKET WARMER,12,2011-11-02 14:16:00,1.65,16531.0,United Kingdom
574060,84375,SET OF 20 KIDS COOKIE CUTTERS,12,2011-11-02 14:16:00,2.1,16531.0,United Kingdom
574060,23348,CHILDRENS TOY COOKING UTENSIL SET,6,2011-11-02 14:16:00,2.08,16531.0,United Kingdom
574060,23084,RABBIT NIGHT LIGHT,6,2011-11-02 14:16:00,2.08,16531.0,United Kingdom
574060,23480,MINI LIGHTS WOODLAND MUSHROOMS,4,2011-11-02 14:16:00,3.75,16531.0,United Kingdom
574060,22086,PAPER CHAIN KIT 50'S CHRISTMAS ,6,2011-11-02 14:16:00,2.95,16531.0,United Kingdom
C574061,22779,WOODEN OWLS LIGHT GARLAND ,-12,2011-11-02 14:18:00,4.25,12474.0,Germany
574062,23308,SET OF 60 VINTAGE LEAF CAKE CASES ,24,2011-11-02 14:30:00,0.55,17675.0,United Kingdom
574062,22720,SET OF 3 CAKE TINS PANTRY DESIGN ,3,2011-11-02 14:30:00,4.95,17675.0,United Kingdom
574062,21484,CHICK GREY HOT WATER BOTTLE,8,2011-11-02 14:30:00,4.25,17675.0,United Kingdom
574062,23356,LOVE HOT WATER BOTTLE,6,2011-11-02 14:30:00,5.95,17675.0,United Kingdom
574062,22585,PACK OF 6 BIRDY GIFT TAGS,36,2011-11-02 14:30:00,1.25,17675.0,United Kingdom
574062,23370,SET 36 COLOURING PENCILS DOILY,16,2011-11-02 14:30:00,1.25,17675.0,United Kingdom
574062,20978,36 PENCILS TUBE SKULLS,16,2011-11-02 14:30:00,1.25,17675.0,United Kingdom
574062,22759,SET OF 3 NOTEBOOKS IN PARCEL,12,2011-11-02 14:30:00,1.65,17675.0,United Kingdom
574062,22621,TRADITIONAL KNITTING NANCY,12,2011-11-02 14:30:00,1.65,17675.0,United Kingdom
574062,23242,TREASURE TIN BUFFALO BILL ,6,2011-11-02 14:30:00,2.08,17675.0,United Kingdom
574062,23571,TRADITIONAL NAUGHTS & CROSSES,12,2011-11-02 14:30:00,1.65,17675.0,United Kingdom
574062,23570,TRADITIONAL PICK UP STICKS GAME ,12,2011-11-02 14:30:00,1.25,17675.0,United Kingdom
574062,22992,REVOLVER WOODEN RULER ,12,2011-11-02 14:30:00,1.95,17675.0,United Kingdom
574062,22991,GIRAFFE WOODEN RULER,12,2011-11-02 14:30:00,1.95,17675.0,United Kingdom
574062,22139,RETROSPOT TEA SET CERAMIC 11 PC ,3,2011-11-02 14:30:00,4.95,17675.0,United Kingdom
574062,22553,PLASTERS IN TIN SKULLS,12,2011-11-02 14:30:00,1.65,17675.0,United Kingdom
574062,84997C,CHILDRENS CUTLERY POLKADOT BLUE,8,2011-11-02 14:30:00,4.15,17675.0,United Kingdom
574062,84997D,CHILDRENS CUTLERY POLKADOT PINK,8,2011-11-02 14:30:00,4.15,17675.0,United Kingdom
574062,23371,SET 36 COLOUR PENCILS SPACEBOY ,16,2011-11-02 14:30:00,1.25,17675.0,United Kingdom
574062,47566,PARTY BUNTING,8,2011-11-02 14:30:00,4.95,17675.0,United Kingdom
574062,22467,GUMBALL COAT RACK,6,2011-11-02 14:30:00,2.55,17675.0,United Kingdom
574062,23503,PLAYING CARDS KEEP CALM & CARRY ON,12,2011-11-02 14:30:00,1.25,17675.0,United Kingdom
574062,85174,S/4 CACTI CANDLES,16,2011-11-02 14:30:00,4.25,17675.0,United Kingdom
574062,85123A,WHITE HANGING HEART T-LIGHT HOLDER,32,2011-11-02 14:30:00,2.55,17675.0,United Kingdom
574062,22075,6 RIBBONS ELEGANT CHRISTMAS ,12,2011-11-02 14:30:00,1.65,17675.0,United Kingdom
574062,85049A,TRADITIONAL CHRISTMAS RIBBONS,12,2011-11-02 14:30:00,1.25,17675.0,United Kingdom
574062,22187,GREEN CHRISTMAS TREE CARD HOLDER,24,2011-11-02 14:30:00,1.95,17675.0,United Kingdom
574062,22952,60 CAKE CASES VINTAGE CHRISTMAS,24,2011-11-02 14:30:00,0.55,17675.0,United Kingdom
574062,22940,FELTCRAFT CHRISTMAS FAIRY,4,2011-11-02 14:30:00,4.25,17675.0,United Kingdom
574062,22141,CHRISTMAS CRAFT TREE TOP ANGEL,12,2011-11-02 14:30:00,2.1,17675.0,United Kingdom
574062,23343,JUMBO BAG VINTAGE CHRISTMAS ,20,2011-11-02 14:30:00,2.08,17675.0,United Kingdom
574062,23157,SET OF 6 NATIVITY MAGNETS ,24,2011-11-02 14:30:00,2.08,17675.0,United Kingdom
574062,23333,IVORY WICKER HEART MEDIUM,36,2011-11-02 14:30:00,1.25,17675.0,United Kingdom
574062,22144,CHRISTMAS CRAFT LITTLE FRIENDS,12,2011-11-02 14:30:00,2.1,17675.0,United Kingdom
574062,23274,STAR T-LIGHT HOLDER WILLIE WINKIE,12,2011-11-02 14:30:00,1.65,17675.0,United Kingdom
574062,22767,TRIPLE PHOTO FRAME CORNICE ,2,2011-11-02 14:30:00,9.95,17675.0,United Kingdom
574062,84945,MULTI COLOUR SILVER T-LIGHT HOLDER,24,2011-11-02 14:30:00,0.85,17675.0,United Kingdom
574062,71053,WHITE METAL LANTERN,16,2011-11-02 14:30:00,3.75,17675.0,United Kingdom
574062,84946,ANTIQUE SILVER T-LIGHT GLASS,12,2011-11-02 14:30:00,1.25,17675.0,United Kingdom
574062,22676,FRENCH BLUE METAL DOOR SIGN 1,10,2011-11-02 14:30:00,1.25,17675.0,United Kingdom
574062,22679,FRENCH BLUE METAL DOOR SIGN 4,10,2011-11-02 14:30:00,1.25,17675.0,United Kingdom
574062,22680,FRENCH BLUE METAL DOOR SIGN 5,10,2011-11-02 14:30:00,1.25,17675.0,United Kingdom
574062,22681,FRENCH BLUE METAL DOOR SIGN 6,20,2011-11-02 14:30:00,1.25,17675.0,United Kingdom
574062,21668,RED STRIPE CERAMIC DRAWER KNOB,12,2011-11-02 14:30:00,1.45,17675.0,United Kingdom
574062,23307,SET OF 60 PANTRY DESIGN CAKE CASES ,24,2011-11-02 14:30:00,0.55,17675.0,United Kingdom
574063,22398,MAGNETS PACK OF 4 SWALLOWS,1,2011-11-02 14:31:00,0.39,13271.0,United Kingdom
574063,22649,STRAWBERRY FAIRY CAKE TEAPOT,1,2011-11-02 14:31:00,4.95,13271.0,United Kingdom
574063,22066,LOVE HEART TRINKET POT,2,2011-11-02 14:31:00,0.39,13271.0,United Kingdom
574063,22672,FRENCH BATHROOM SIGN BLUE METAL,2,2011-11-02 14:31:00,1.65,13271.0,United Kingdom
574063,21147,JINGLE BELLS TREE DECORATION,1,2011-11-02 14:31:00,2.1,13271.0,United Kingdom
574063,85071C,"CHARLIE+LOLA""EXTREMELY BUSY"" SIGN",1,2011-11-02 14:31:00,0.39,13271.0,United Kingdom
574063,85071D,CHARLIE+LOLA MY ROOM DOOR SIGN,1,2011-11-02 14:31:00,0.39,13271.0,United Kingdom
574063,85071A,BLUE CHARLIE+LOLA PERSONAL DOORSIGN,1,2011-11-02 14:31:00,0.39,13271.0,United Kingdom
574063,85071B,RED CHARLIE+LOLA PERSONAL DOORSIGN,1,2011-11-02 14:31:00,0.39,13271.0,United Kingdom
574063,22400,MAGNETS PACK OF 4 HOME SWEET HOME,1,2011-11-02 14:31:00,0.39,13271.0,United Kingdom
574063,35964,FOLKART CLIP ON STARS,2,2011-11-02 14:31:00,0.39,13271.0,United Kingdom
574063,22099,CARAVAN SQUARE TISSUE BOX,2,2011-11-02 14:31:00,0.39,13271.0,United Kingdom
574063,82552,WASHROOM METAL SIGN,2,2011-11-02 14:31:00,1.45,13271.0,United Kingdom
574063,21175,GIN + TONIC DIET METAL SIGN,2,2011-11-02 14:31:00,2.55,13271.0,United Kingdom
574063,21166,COOK WITH WINE METAL SIGN ,2,2011-11-02 14:31:00,2.08,13271.0,United Kingdom
574063,85152,HAND OVER THE CHOCOLATE   SIGN ,2,2011-11-02 14:31:00,2.1,13271.0,United Kingdom
574063,21263,GREEN GOOSE FEATHER TREE 60CM,1,2011-11-02 14:31:00,1.95,13271.0,United Kingdom
574063,22671,FRENCH LAUNDRY SIGN BLUE METAL,2,2011-11-02 14:31:00,1.65,13271.0,United Kingdom
574063,21162,TOXIC AREA  DOOR HANGER ,3,2011-11-02 14:31:00,0.39,13271.0,United Kingdom
574063,21175,GIN + TONIC DIET METAL SIGN,1,2011-11-02 14:31:00,2.55,13271.0,United Kingdom
574063,23426,METAL SIGN DROP YOUR PANTS,3,2011-11-02 14:31:00,2.89,13271.0,United Kingdom
574063,22116,METAL SIGN HIS DINNER IS SERVED,2,2011-11-02 14:31:00,0.79,13271.0,United Kingdom
574063,22413,METAL SIGN TAKE IT OR LEAVE IT ,2,2011-11-02 14:31:00,2.95,13271.0,United Kingdom
574063,21905,MORE BUTTER METAL SIGN ,2,2011-11-02 14:31:00,0.79,13271.0,United Kingdom
574063,21174,POTTERING IN THE SHED METAL SIGN,1,2011-11-02 14:31:00,2.08,13271.0,United Kingdom
574063,23526,WALL ART DOG LICENCE ,1,2011-11-02 14:31:00,5.95,13271.0,United Kingdom
574063,22123,PING MICROWAVE APRON,1,2011-11-02 14:31:00,1.95,13271.0,United Kingdom
574063,47563A,RETRO LONGBOARD IRONING BOARD COVER,1,2011-11-02 14:31:00,1.25,13271.0,United Kingdom
574063,71496B,A4 WALL TIDY RED FLOWERS,1,2011-11-02 14:31:00,0.53,13271.0,United Kingdom
574063,71496A,A4 WALL TIDY BLUE OFFICE,1,2011-11-02 14:31:00,0.53,13271.0,United Kingdom
574063,47563A,RETRO LONGBOARD IRONING BOARD COVER,1,2011-11-02 14:31:00,1.25,13271.0,United Kingdom
574063,21823,PAINTED METAL HEART WITH HOLLY BELL,1,2011-11-02 14:31:00,0.39,13271.0,United Kingdom
574063,21824,PAINTED METAL STAR WITH HOLLY BELLS,10,2011-11-02 14:31:00,0.39,13271.0,United Kingdom
574063,21108,FAIRY CAKE FLANNEL ASSORTED COLOUR,9,2011-11-02 14:31:00,0.79,13271.0,United Kingdom
574063,23242,TREASURE TIN BUFFALO BILL ,1,2011-11-02 14:31:00,2.08,13271.0,United Kingdom
574063,22578,WOODEN STAR CHRISTMAS SCANDINAVIAN,1,2011-11-02 14:31:00,0.29,13271.0,United Kingdom
574063,22233,JIGSAW RABBIT AND BIRDHOUSE,1,2011-11-02 14:31:00,0.59,13271.0,United Kingdom
574063,22232,JIGSAW TOADSTOOLS 3 PIECE,1,2011-11-02 14:31:00,0.59,13271.0,United Kingdom
574063,22231,JIGSAW TREE WITH BIRDHOUSE,1,2011-11-02 14:31:00,0.59,13271.0,United Kingdom
574063,22230,JIGSAW TREE WITH WATERING CAN,2,2011-11-02 14:31:00,0.29,13271.0,United Kingdom
574063,22616,PACK OF 12 LONDON TISSUES ,12,2011-11-02 14:31:00,0.39,13271.0,United Kingdom
574063,22141,CHRISTMAS CRAFT TREE TOP ANGEL,1,2011-11-02 14:31:00,2.1,13271.0,United Kingdom
574063,22578,WOODEN STAR CHRISTMAS SCANDINAVIAN,3,2011-11-02 14:31:00,0.29,13271.0,United Kingdom
574063,22870,NUMBER TILE COTTAGE GARDEN 2,1,2011-11-02 14:31:00,1.95,13271.0,United Kingdom
574063,21619,4 VANILLA BOTANICAL CANDLES,1,2011-11-02 14:31:00,1.25,13271.0,United Kingdom
574063,21616,4 PEAR BOTANICAL DINNER CANDLES,1,2011-11-02 14:31:00,1.25,13271.0,United Kingdom
574063,22093,MOTORING TISSUE BOX,1,2011-11-02 14:31:00,0.39,13271.0,United Kingdom
574063,21619,4 VANILLA BOTANICAL CANDLES,1,2011-11-02 14:31:00,1.25,13271.0,United Kingdom
574063,82616B,FRAPPUCINO SCARF KNITTING KIT,2,2011-11-02 14:31:00,1.25,13271.0,United Kingdom
574063,22091,EMPIRE TISSUE BOX,2,2011-11-02 14:31:00,0.39,13271.0,United Kingdom
574063,22474,SPACEBOY TV DINNER TRAY,1,2011-11-02 14:31:00,4.95,13271.0,United Kingdom
574063,22615,PACK OF 12 CIRCUS PARADE TISSUES ,12,2011-11-02 14:31:00,0.39,13271.0,United Kingdom
574063,22065,CHRISTMAS PUDDING TRINKET POT ,22,2011-11-02 14:31:00,0.39,13271.0,United Kingdom
574063,84836,ZINC METAL HEART DECORATION,1,2011-11-02 14:31:00,1.25,13271.0,United Kingdom
574063,23321,SMALL WHITE HEART OF WICKER,2,2011-11-02 14:31:00,1.65,13271.0,United Kingdom
574063,22945,CHRISTMAS METAL TAGS ASSORTED ,6,2011-11-02 14:31:00,0.85,13271.0,United Kingdom
574063,21014,SWISS CHALET TREE DECORATION ,1,2011-11-02 14:31:00,0.29,13271.0,United Kingdom
574063,21015,DARK BIRD HOUSE TREE DECORATION,2,2011-11-02 14:31:00,0.29,13271.0,United Kingdom
574063,22396,MAGNETS PACK OF 4 RETRO PHOTO,1,2011-11-02 14:31:00,0.39,13271.0,United Kingdom
574063,22340,NOEL GARLAND PAINTED ZINC ,1,2011-11-02 14:31:00,0.39,13271.0,United Kingdom
574063,22577,WOODEN HEART CHRISTMAS SCANDINAVIAN,2,2011-11-02 14:31:00,0.29,13271.0,United Kingdom
574063,22579,WOODEN TREE CHRISTMAS SCANDINAVIAN,3,2011-11-02 14:31:00,0.29,13271.0,United Kingdom
574063,23182,TOILET SIGN OCCUPIED OR VACANT,3,2011-11-02 14:31:00,0.83,13271.0,United Kingdom
574063,85094,CANDY SPOT EGG WARMER RABBIT,1,2011-11-02 14:31:00,0.19,13271.0,United Kingdom
574063,22945,CHRISTMAS METAL TAGS ASSORTED ,18,2011-11-02 14:31:00,0.85,13271.0,United Kingdom
574063,22944,CHRISTMAS METAL POSTCARD WITH BELLS,12,2011-11-02 14:31:00,0.39,13271.0,United Kingdom
574063,23265,SET OF 3 WOODEN TREE DECORATIONS,1,2011-11-02 14:31:00,1.25,13271.0,United Kingdom
574063,23313,VINTAGE CHRISTMAS BUNTING,1,2011-11-02 14:31:00,4.95,13271.0,United Kingdom
574063,23234,BISCUIT TIN VINTAGE CHRISTMAS,1,2011-11-02 14:31:00,2.89,13271.0,United Kingdom
574063,22910,PAPER CHAIN KIT VINTAGE CHRISTMAS,1,2011-11-02 14:31:00,2.95,13271.0,United Kingdom
574063,23184,BULL DOG BOTTLE OPENER,1,2011-11-02 14:31:00,4.95,13271.0,United Kingdom
574063,22187,GREEN CHRISTMAS TREE CARD HOLDER,2,2011-11-02 14:31:00,1.95,13271.0,United Kingdom
574063,22186,RED STAR CARD HOLDER,2,2011-11-02 14:31:00,1.95,13271.0,United Kingdom
574063,72817,SET OF 2 CHRISTMAS DECOUPAGE CANDLE,4,2011-11-02 14:31:00,0.79,13271.0,United Kingdom
574063,22340,NOEL GARLAND PAINTED ZINC ,1,2011-11-02 14:31:00,0.39,13271.0,United Kingdom
574063,22577,WOODEN HEART CHRISTMAS SCANDINAVIAN,2,2011-11-02 14:31:00,0.29,13271.0,United Kingdom
