InvoiceNo,StockCode,Description,Quantity,InvoiceDate,UnitPrice,CustomerID,Country
555280,84879,ASSORTED COLOUR BIRD ORNAMENT,8,2011-06-02 09:02:00,1.69,17162.0,United Kingdom
555280,22296,HEART IVORY TRELLIS LARGE,12,2011-06-02 09:02:00,1.65,17162.0,United Kingdom
555280,22297,HEART IVORY TRELLIS SMALL,24,2011-06-02 09:02:00,1.25,17162.0,United Kingdom
555280,22295,HEART FILIGREE DOVE LARGE,12,2011-06-02 09:02:00,1.65,17162.0,United Kingdom
555280,22294,HEART FILIGREE DOVE  SMALL,24,2011-06-02 09:02:00,1.25,17162.0,United Kingdom
555280,23228,FILIGREE HEART BIRD WHITE ,24,2011-06-02 09:02:00,1.25,17162.0,United Kingdom
555280,23227,FILIGREE HEART BUTTERFLY WHITE ,24,2011-06-02 09:02:00,1.25,17162.0,United Kingdom
555280,23065,LARGE DECO JEWELLERY STAND,1,2011-06-02 09:02:00,12.5,17162.0,United Kingdom
555280,23066,SMALL DECO JEWELLERY STAND,2,2011-06-02 09:02:00,8.25,17162.0,United Kingdom
555280,23284,DOORMAT KEEP CALM AND COME IN,2,2011-06-02 09:02:00,7.95,17162.0,United Kingdom
555280,21523,DOORMAT FANCY FONT HOME SWEET HOME,2,2011-06-02 09:02:00,7.95,17162.0,United Kingdom
555281,23080,RED METAL BOX TOP SECRET,2,2011-06-02 09:03:00,8.25,17162.0,United Kingdom
555281,23091,ZINC HERB GARDEN CONTAINER,3,2011-06-02 09:03:00,6.25,17162.0,United Kingdom
555281,23094,LE GRAND TRAY CHIC SET,1,2011-06-02 09:03:00,12.5,17162.0,United Kingdom
555282,47590B,PINK HAPPY BIRTHDAY BUNTING,10,2011-06-02 09:04:00,5.45,12709.0,Germany
555282,47590A,BLUE HAPPY BIRTHDAY BUNTING,20,2011-06-02 09:04:00,5.45,12709.0,Germany
555282,22354,RETROSPOT PADDED SEAT CUSHION,10,2011-06-02 09:04:00,3.75,12709.0,Germany
555282,21592,RETROSPOT CIGAR BOX MATCHES ,24,2011-06-02 09:04:00,1.25,12709.0,Germany
555282,22197,SMALL POPCORN HOLDER,12,2011-06-02 09:04:00,0.85,12709.0,Germany
555282,22333,RETROSPOT PARTY BAG + STICKER SET,10,2011-06-02 09:04:00,1.65,12709.0,Germany
555282,21094,SET/6 RED SPOTTY PAPER PLATES,20,2011-06-02 09:04:00,0.85,12709.0,Germany
555282,21086,SET/6 RED SPOTTY PAPER CUPS,50,2011-06-02 09:04:00,0.65,12709.0,Germany
555282,21080,SET/20 RED RETROSPOT PAPER NAPKINS ,40,2011-06-02 09:04:00,0.85,12709.0,Germany
555282,21212,PACK OF 72 RETROSPOT CAKE CASES,24,2011-06-02 09:04:00,0.55,12709.0,Germany
555282,21238,RED RETROSPOT CUP,16,2011-06-02 09:04:00,0.85,12709.0,Germany
555282,20658,RED RETROSPOT LUGGAGE TAG,20,2011-06-02 09:04:00,1.25,12709.0,Germany
555282,22243,5 HOOK HANGER RED MAGIC TOADSTOOL,12,2011-06-02 09:04:00,1.65,12709.0,Germany
555282,21121,SET/10 RED POLKADOT PARTY CANDLES,24,2011-06-02 09:04:00,1.25,12709.0,Germany
555282,21124,SET/10 BLUE POLKADOT PARTY CANDLES,24,2011-06-02 09:04:00,1.25,12709.0,Germany
555282,20685,DOORMAT RED RETROSPOT,5,2011-06-02 09:04:00,7.95,12709.0,Germany
555282,20979,36 PENCILS TUBE RED RETROSPOT,32,2011-06-02 09:04:00,1.25,12709.0,Germany
555282,22467,GUMBALL COAT RACK,20,2011-06-02 09:04:00,2.55,12709.0,Germany
555282,22627,MINT KITCHEN SCALES,12,2011-06-02 09:04:00,7.65,12709.0,Germany
555282,23210,WHITE ROCKING HORSE HAND PAINTED,24,2011-06-02 09:04:00,1.25,12709.0,Germany
555282,23213,STAR WREATH DECORATION WITH BELL,12,2011-06-02 09:04:00,1.25,12709.0,Germany
555282,23212,HEART WREATH DECORATION WITH BELL,12,2011-06-02 09:04:00,1.25,12709.0,Germany
555282,23169,CLASSIC GLASS COOKIE JAR,6,2011-06-02 09:04:00,4.15,12709.0,Germany
555282,23168,CLASSIC CAFE SUGAR DISPENSER,12,2011-06-02 09:04:00,1.25,12709.0,Germany
555282,23118,PARISIENNE JEWELLERY DRAWER ,2,2011-06-02 09:04:00,7.5,12709.0,Germany
555282,23111,PARISIENNE SEWING BOX,1,2011-06-02 09:04:00,12.5,12709.0,Germany
555282,22979,PANTRY WASHING UP BRUSH,12,2011-06-02 09:04:00,1.45,12709.0,Germany
555282,22980,PANTRY SCRUBBING BRUSH,12,2011-06-02 09:04:00,1.65,12709.0,Germany
555282,22989,SET 2 PANTRY DESIGN TEA TOWELS,24,2011-06-02 09:04:00,3.25,12709.0,Germany
555282,22907,PACK OF 20 NAPKINS PANTRY DESIGN,24,2011-06-02 09:04:00,0.85,12709.0,Germany
555282,22965,3 TRADITIONAl BISCUIT CUTTERS  SET,12,2011-06-02 09:04:00,2.1,12709.0,Germany
555282,22960,JAM MAKING SET WITH JARS,24,2011-06-02 09:04:00,3.75,12709.0,Germany
555282,22666,RECIPE BOX PANTRY YELLOW DESIGN,24,2011-06-02 09:04:00,2.55,12709.0,Germany
555282,22961,JAM MAKING SET PRINTED,48,2011-06-02 09:04:00,1.45,12709.0,Germany
555282,23219,LAUREL STAR ANTIQUE SILVER ,1,2011-06-02 09:04:00,1.25,12709.0,Germany
555282,23224,CHERUB HEART DECORATION GOLD,1,2011-06-02 09:04:00,0.83,12709.0,Germany
555282,23221,REINDEER HEART DECORATION SILVER,1,2011-06-02 09:04:00,0.83,12709.0,Germany
555282,22948,METAL DECORATION NAUGHTY CHILDREN ,4,2011-06-02 09:04:00,0.85,12709.0,Germany
555282,22944,CHRISTMAS METAL POSTCARD WITH BELLS,6,2011-06-02 09:04:00,1.25,12709.0,Germany
555282,21809,CHRISTMAS HANGING TREE WITH BELL,1,2011-06-02 09:04:00,1.25,12709.0,Germany
555282,35953,FOLKART STAR CHRISTMAS DECORATIONS,4,2011-06-02 09:04:00,1.25,12709.0,Germany
555282,35961,FOLKART ZINC HEART CHRISTMAS DEC,1,2011-06-02 09:04:00,0.85,12709.0,Germany
555283,23201,JUMBO BAG ALPHABET,10,2011-06-02 09:04:00,1.95,17162.0,United Kingdom
555283,23207,LUNCH BAG ALPHABET DESIGN,10,2011-06-02 09:04:00,1.65,17162.0,United Kingdom
555283,23205,CHARLOTTE BAG ALPHABET  DESIGN,10,2011-06-02 09:04:00,0.85,17162.0,United Kingdom
555283,23192,BUNDLE OF 3 ALPHABET EXERCISE BOOKS,12,2011-06-02 09:04:00,1.65,17162.0,United Kingdom
555284,23083,SET 6 PAPER TABLE LANTERN STARS ,12,2011-06-02 09:37:00,3.29,14298.0,United Kingdom
555284,23084,RABBIT NIGHT LIGHT,12,2011-06-02 09:37:00,2.08,14298.0,United Kingdom
555284,23082,SET 6 PAPER TABLE LANTERN HEARTS ,12,2011-06-02 09:37:00,3.29,14298.0,United Kingdom
555284,23090,VINTAGE GLASS T-LIGHT HOLDER,24,2011-06-02 09:37:00,0.72,14298.0,United Kingdom
555284,23100,SILVER BELLS TABLE DECORATION,24,2011-06-02 09:37:00,1.04,14298.0,United Kingdom
555284,23101,SILVER STARS TABLE DECORATION,24,2011-06-02 09:37:00,0.72,14298.0,United Kingdom
555284,23109,LED TEA LIGHTS,12,2011-06-02 09:37:00,2.49,14298.0,United Kingdom
555284,23102,SILVER HEARTS TABLE DECORATION,24,2011-06-02 09:37:00,0.72,14298.0,United Kingdom
555284,23106,ZINC HEARTS PLANT POT HOLDER,8,2011-06-02 09:37:00,2.49,14298.0,United Kingdom
555284,23103,JINGLE BELL HEART DECORATION,24,2011-06-02 09:37:00,1.45,14298.0,United Kingdom
555284,23107,WHITE HEARTS WIRE PLANT POT HOLDER,8,2011-06-02 09:37:00,2.49,14298.0,United Kingdom
555284,23112,PARISIENNE CURIO CABINET,4,2011-06-02 09:37:00,6.65,14298.0,United Kingdom
555284,23145,ZINC T-LIGHT HOLDER STAR LARGE,12,2011-06-02 09:37:00,0.79,14298.0,United Kingdom
555284,23162,REGENCY TEA STRAINER,12,2011-06-02 09:37:00,3.29,14298.0,United Kingdom
555284,23160,REGENCY TEA SPOON,12,2011-06-02 09:37:00,1.04,14298.0,United Kingdom
555284,23163,REGENCY SUGAR TONGS,8,2011-06-02 09:37:00,2.08,14298.0,United Kingdom
555284,23144,ZINC T-LIGHT HOLDER STARS SMALL,24,2011-06-02 09:37:00,0.72,14298.0,United Kingdom
555284,23161,REGENCY CAKE FORK,12,2011-06-02 09:37:00,1.04,14298.0,United Kingdom
555284,23164,REGENCY CAKE SLICE,8,2011-06-02 09:37:00,4.15,14298.0,United Kingdom
555284,23168,CLASSIC CAFE SUGAR DISPENSER,36,2011-06-02 09:37:00,1.04,14298.0,United Kingdom
555284,23171,REGENCY TEA PLATE GREEN ,12,2011-06-02 09:37:00,1.45,14298.0,United Kingdom
555284,23169,CLASSIC GLASS COOKIE JAR,6,2011-06-02 09:37:00,3.75,14298.0,United Kingdom
555284,23172,REGENCY TEA PLATE PINK,24,2011-06-02 09:37:00,1.45,14298.0,United Kingdom
555284,23170,REGENCY TEA PLATE ROSES ,24,2011-06-02 09:37:00,1.45,14298.0,United Kingdom
555284,23173,REGENCY TEAPOT ROSES ,6,2011-06-02 09:37:00,8.15,14298.0,United Kingdom
555284,23174,REGENCY SUGAR BOWL GREEN,8,2011-06-02 09:37:00,3.75,14298.0,United Kingdom
555284,23175,REGENCY MILK JUG PINK ,8,2011-06-02 09:37:00,2.75,14298.0,United Kingdom
555284,23211,RED ROCKING HORSE HAND PAINTED,24,2011-06-02 09:37:00,1.04,14298.0,United Kingdom
555284,23214,JINGLE BELL HEART ANTIQUE GOLD,12,2011-06-02 09:37:00,1.79,14298.0,United Kingdom
555284,23212,HEART WREATH DECORATION WITH BELL,24,2011-06-02 09:37:00,1.04,14298.0,United Kingdom
555284,23215,JINGLE BELL HEART ANTIQUE SILVER,12,2011-06-02 09:37:00,1.79,14298.0,United Kingdom
555284,23210,WHITE ROCKING HORSE HAND PAINTED,24,2011-06-02 09:37:00,1.04,14298.0,United Kingdom
555284,23213,STAR WREATH DECORATION WITH BELL,24,2011-06-02 09:37:00,1.04,14298.0,United Kingdom
555284,23216,LAUREL HEART ANTIQUE GOLD,24,2011-06-02 09:37:00,1.04,14298.0,United Kingdom
555284,23217,LAUREL HEART ANTIQUE SILVER,24,2011-06-02 09:37:00,1.04,14298.0,United Kingdom
555284,23225,CHERUB HEART DECORATION SILVER ,24,2011-06-02 09:37:00,0.72,14298.0,United Kingdom
555284,23226,FILIGREE HEART DAISY WHITE,24,2011-06-02 09:37:00,1.04,14298.0,United Kingdom
555284,23301,GARDENERS KNEELING PAD KEEP CALM ,24,2011-06-02 09:37:00,1.45,14298.0,United Kingdom
555284,23227,FILIGREE HEART BUTTERFLY WHITE ,24,2011-06-02 09:37:00,1.04,14298.0,United Kingdom
555284,23284,DOORMAT KEEP CALM AND COME IN,6,2011-06-02 09:37:00,6.75,14298.0,United Kingdom
555284,23302,KNEELING MAT HOUSEWORK  DESIGN,12,2011-06-02 09:37:00,1.45,14298.0,United Kingdom
555284,23228,FILIGREE HEART BIRD WHITE ,24,2011-06-02 09:37:00,1.04,14298.0,United Kingdom
555284,23300,GARDENERS KNEELING PAD CUP OF TEA ,12,2011-06-02 09:37:00,1.45,14298.0,United Kingdom
555284,22423,REGENCY CAKESTAND 3 TIER,16,2011-06-02 09:37:00,10.95,14298.0,United Kingdom
555284,22469,HEART OF WICKER SMALL,12,2011-06-02 09:37:00,1.45,14298.0,United Kingdom
555284,20655,QUEEN OF SKIES LUGGAGE TAG,12,2011-06-02 09:37:00,1.06,14298.0,United Kingdom
555284,21866,UNION JACK FLAG LUGGAGE TAG,24,2011-06-02 09:37:00,1.06,14298.0,United Kingdom
555284,20657,TROPICAL LUGGAGE TAG,12,2011-06-02 09:37:00,1.06,14298.0,United Kingdom
555284,20654,FIRST CLASS LUGGAGE TAG ,12,2011-06-02 09:37:00,1.06,14298.0,United Kingdom
555284,20659,ECONOMY LUGGAGE TAG,12,2011-06-02 09:37:00,1.06,14298.0,United Kingdom
555284,85095,THREE CANVAS LUGGAGE TAGS,16,2011-06-02 09:37:00,1.65,14298.0,United Kingdom
555284,20618,QUEEN OF THE SKIES PASSPORT COVER ,6,2011-06-02 09:37:00,1.69,14298.0,United Kingdom
555284,20619,TROPICAL PASSPORT COVER ,6,2011-06-02 09:37:00,1.69,14298.0,United Kingdom
555284,21865,PINK UNION JACK  PASSPORT COVER ,6,2011-06-02 09:37:00,1.69,14298.0,United Kingdom
555284,20617,FIRST CLASS PASSPORT COVER ,6,2011-06-02 09:37:00,1.69,14298.0,United Kingdom
555284,20622,VIPPASSPORT COVER ,6,2011-06-02 09:37:00,1.69,14298.0,United Kingdom
555284,47343A,FUSCHIA FLOWER PURSE WITH BEADS,48,2011-06-02 09:37:00,0.83,14298.0,United Kingdom
555284,35648,VINTAGE BEAD PINK PURSE ,48,2011-06-02 09:37:00,0.83,14298.0,United Kingdom
555284,47344B,BLUE FLOWER DES PURSE,10,2011-06-02 09:37:00,0.83,14298.0,United Kingdom
555284,15036,ASSORTED COLOURS SILK FAN,60,2011-06-02 09:37:00,0.72,14298.0,United Kingdom
555284,15034,PAPER POCKET TRAVELING FAN ,240,2011-06-02 09:37:00,0.07,14298.0,United Kingdom
555284,23281,FOLDING BUTTERFLY MIRROR RED  ,36,2011-06-02 09:37:00,0.72,14298.0,United Kingdom
555284,20866,BLUE ROSE FABRIC MIRROR,12,2011-06-02 09:37:00,1.06,14298.0,United Kingdom
555284,20867,PINK ROSE FABRIC MIRROR,12,2011-06-02 09:37:00,1.06,14298.0,United Kingdom
555284,21643,ASSORTED TUTTI FRUTTI MIRROR,24,2011-06-02 09:37:00,1.06,14298.0,United Kingdom
555284,23282,FOLDING BUTTERFLY MIRROR IVORY ,36,2011-06-02 09:37:00,0.72,14298.0,United Kingdom
555284,23280,FOLDING BUTTERFLY MIRROR HOT PINK ,36,2011-06-02 09:37:00,0.72,14298.0,United Kingdom
555284,72741,GRAND CHOCOLATECANDLE,36,2011-06-02 09:37:00,1.25,14298.0,United Kingdom
555284,85230E,STRAWBRY SCENTED VOTIVE CANDLE,144,2011-06-02 09:37:00,0.21,14298.0,United Kingdom
555284,85230G,ORANGE VOTIVE CANDLE,144,2011-06-02 09:37:00,0.21,14298.0,United Kingdom
555284,85230A,OPIUM SCENTED VOTIVE CANDLE,48,2011-06-02 09:37:00,0.21,14298.0,United Kingdom
555284,85230B,CINNAMON SCENTED VOTIVE CANDLE,48,2011-06-02 09:37:00,0.21,14298.0,United Kingdom
555284,21922,UNION STRIPE WITH FRINGE  HAMMOCK,6,2011-06-02 09:37:00,6.95,14298.0,United Kingdom
555284,84050,PINK HEART SHAPE EGG FRYING PAN,24,2011-06-02 09:37:00,1.45,14298.0,United Kingdom
555284,79163,BLACK CHAMPAGNE GLASS,240,2011-06-02 09:37:00,0.39,14298.0,United Kingdom
555284,79000,MOROCCAN TEA GLASS,24,2011-06-02 09:37:00,0.65,14298.0,United Kingdom
555284,79030G,TUMBLER NEW ENGLAND,24,2011-06-02 09:37:00,0.39,14298.0,United Kingdom
555284,62018,SOMBRERO ,48,2011-06-02 09:37:00,1.25,14298.0,United Kingdom
555284,21562,HAWAIIAN GRASS SKIRT ,40,2011-06-02 09:37:00,1.06,14298.0,United Kingdom
555284,84212,"ASSORTED FLOWER COLOUR ""LEIS""",240,2011-06-02 09:37:00,0.42,14298.0,United Kingdom
555284,84527,FLAMES SUNGLASSES PINK LENSES,24,2011-06-02 09:37:00,1.65,14298.0,United Kingdom
555284,22439,6 ROCKET BALLOONS ,24,2011-06-02 09:37:00,0.55,14298.0,United Kingdom
555284,22435,SET OF 9 HEART SHAPED BALLOONS,12,2011-06-02 09:37:00,1.06,14298.0,United Kingdom
555284,22440,BALLOON WATER BOMB PACK OF 35,40,2011-06-02 09:37:00,0.36,14298.0,United Kingdom
555284,22437,SET OF 9 BLACK SKULL BALLOONS,20,2011-06-02 09:37:00,0.72,14298.0,United Kingdom
555284,21025,SPACE FROG,20,2011-06-02 09:37:00,1.06,14298.0,United Kingdom
555284,21026,SPACE OWL,20,2011-06-02 09:37:00,1.06,14298.0,United Kingdom
555284,21028,NINJA RABBIT BLACK,20,2011-06-02 09:37:00,1.06,14298.0,United Kingdom
555284,21829,DINOSAUR KEYRINGS ASSORTED,72,2011-06-02 09:37:00,0.18,14298.0,United Kingdom
555284,84549,CROCHET WHITE RABBIT KEYRING ,24,2011-06-02 09:37:00,1.45,14298.0,United Kingdom
555284,23154,SET OF 4 JAM JAR MAGNETS,36,2011-06-02 09:37:00,1.85,14298.0,United Kingdom
555284,23155,KNICKERBOCKERGLORY MAGNET ASSORTED ,24,2011-06-02 09:37:00,0.72,14298.0,United Kingdom
555284,23156,SET OF 5 MINI GROCERY MAGNETS,36,2011-06-02 09:37:00,1.85,14298.0,United Kingdom
555284,23159,SET OF 5 PANCAKE DAY MAGNETS,36,2011-06-02 09:37:00,1.85,14298.0,United Kingdom
555284,23158,SET OF 5 LUCKY CAT MAGNETS ,24,2011-06-02 09:37:00,1.85,14298.0,United Kingdom
555284,22536,MAGIC DRAWING SLATE PURDEY,24,2011-06-02 09:37:00,0.36,14298.0,United Kingdom
555284,22535,MAGIC DRAWING SLATE BUNNIES ,24,2011-06-02 09:37:00,0.36,14298.0,United Kingdom
555284,22533,MAGIC DRAWING SLATE BAKE A CAKE ,24,2011-06-02 09:37:00,0.36,14298.0,United Kingdom
555284,23076,ICE CREAM SUNDAE LIP GLOSS,96,2011-06-02 09:37:00,1.04,14298.0,United Kingdom
555284,23077,DOUGHNUT LIP GLOSS ,80,2011-06-02 09:37:00,1.04,14298.0,United Kingdom
555284,20838,FRENCH LATTICE CUSHION COVER ,12,2011-06-02 09:37:00,0.85,14298.0,United Kingdom
555284,20840,FRENCH FLORAL CUSHION COVER ,12,2011-06-02 09:37:00,0.85,14298.0,United Kingdom
555284,21933,PINK VINTAGE PAISLEY PICNIC BAG,20,2011-06-02 09:37:00,1.65,14298.0,United Kingdom
555284,21932,SCANDINAVIAN PAISLEY PICNIC BAG,40,2011-06-02 09:37:00,1.65,14298.0,United Kingdom
555284,37342,POLKADOT COFFEE CUP & SAUCER PINK,24,2011-06-02 09:37:00,0.79,14298.0,United Kingdom
555285,84313C,ORANGE TV TRAY TABLE ,186,2011-06-02 09:38:00,1.95,14298.0,United Kingdom
555286,22467,GUMBALL COAT RACK,12,2011-06-02 09:40:00,2.55,14298.0,United Kingdom
555286,22245,"HOOK, 1 HANGER ,MAGIC GARDEN",24,2011-06-02 09:40:00,0.85,14298.0,United Kingdom
555287,23168,CLASSIC SUGAR DISPENSER,36,2011-06-02 09:42:00,1.04,14298.0,United Kingdom
555287,23209,LUNCH BAG DOILEY PATTERN ,20,2011-06-02 09:42:00,1.45,14298.0,United Kingdom
555287,23200,JUMBO BAG PEARS,30,2011-06-02 09:42:00,1.65,14298.0,United Kingdom
555287,23202,JUMBO BAG VINTAGE LEAF,30,2011-06-02 09:42:00,1.65,14298.0,United Kingdom
555287,23203,JUMBO BAG DOILEY PATTERNS,30,2011-06-02 09:42:00,1.65,14298.0,United Kingdom
C555288,84945,MULTI COLOUR SILVER T-LIGHT HOLDER,-6,2011-06-02 09:57:00,0.85,12431.0,Australia
C555288,23079,TOADSTOOL BEDSIDE LIGHT ,-2,2011-06-02 09:57:00,8.95,12431.0,Australia
555289,23207,LUNCH BAG ALPHABET DESIGN,10,2011-06-02 10:00:00,1.65,15078.0,United Kingdom
555289,23203,JUMBO BAG DOILEY PATTERNS,20,2011-06-02 10:00:00,2.08,15078.0,United Kingdom
555289,23202,JUMBO BAG VINTAGE LEAF,20,2011-06-02 10:00:00,2.08,15078.0,United Kingdom
555289,22663,JUMBO BAG DOLLY GIRL DESIGN,10,2011-06-02 10:00:00,2.08,15078.0,United Kingdom
555289,22385,JUMBO BAG SPACEBOY DESIGN,10,2011-06-02 10:00:00,2.08,15078.0,United Kingdom
555289,22411,JUMBO SHOPPER VINTAGE RED PAISLEY,10,2011-06-02 10:00:00,2.08,15078.0,United Kingdom
555289,21929,JUMBO BAG PINK VINTAGE PAISLEY,10,2011-06-02 10:00:00,2.08,15078.0,United Kingdom
555289,21931,JUMBO STORAGE BAG SUKI,10,2011-06-02 10:00:00,2.08,15078.0,United Kingdom
555289,21212,PACK OF 72 RETROSPOT CAKE CASES,24,2011-06-02 10:00:00,0.55,15078.0,United Kingdom
555289,21175,GIN + TONIC DIET METAL SIGN,12,2011-06-02 10:00:00,2.55,15078.0,United Kingdom
555289,85099F,JUMBO BAG STRAWBERRY,20,2011-06-02 10:00:00,2.08,15078.0,United Kingdom
555289,20712,JUMBO BAG WOODLAND ANIMALS,10,2011-06-02 10:00:00,2.08,15078.0,United Kingdom
555289,20658,RED RETROSPOT LUGGAGE TAG,12,2011-06-02 10:00:00,1.25,15078.0,United Kingdom
555289,85099B,JUMBO BAG RED RETROSPOT,10,2011-06-02 10:00:00,2.08,15078.0,United Kingdom
555312,84945,MULTI COLOUR SILVER T-LIGHT HOLDER,12,2011-06-02 10:39:00,0.85,16484.0,United Kingdom
555312,84755,COLOUR GLASS T-LIGHT HOLDER HANGING,16,2011-06-02 10:39:00,0.65,16484.0,United Kingdom
555312,71053,WHITE METAL LANTERN,4,2011-06-02 10:39:00,3.75,16484.0,United Kingdom
555312,22178,VICTORIAN GLASS HANGING T-LIGHT,12,2011-06-02 10:39:00,1.25,16484.0,United Kingdom
555312,21172,PARTY METAL SIGN ,12,2011-06-02 10:39:00,1.45,16484.0,United Kingdom
555312,22960,JAM MAKING SET WITH JARS,6,2011-06-02 10:39:00,4.25,16484.0,United Kingdom
555312,23169,CLASSIC GLASS COOKIE JAR,6,2011-06-02 10:39:00,4.15,16484.0,United Kingdom
555312,20914,SET/5 RED RETROSPOT LID GLASS BOWLS,6,2011-06-02 10:39:00,2.95,16484.0,United Kingdom
555312,22652,TRAVEL SEWING KIT,10,2011-06-02 10:39:00,1.65,16484.0,United Kingdom
555312,21481,FAWN BLUE HOT WATER BOTTLE,6,2011-06-02 10:39:00,2.95,16484.0,United Kingdom
555312,22583,PACK OF 6 HANDBAG GIFT BOXES,6,2011-06-02 10:39:00,2.55,16484.0,United Kingdom
555312,20981,12 PENCILS TALL TUBE WOODLAND,12,2011-06-02 10:39:00,0.85,16484.0,United Kingdom
555312,20972,PINK CREAM FELT CRAFT TRINKET BOX ,12,2011-06-02 10:39:00,1.25,16484.0,United Kingdom
555312,22745,POPPY'S PLAYHOUSE BEDROOM ,6,2011-06-02 10:39:00,2.1,16484.0,United Kingdom
555312,21892,TRADITIONAL WOODEN CATCH CUP GAME ,12,2011-06-02 10:39:00,1.25,16484.0,United Kingdom
555312,22555,PLASTERS IN TIN STRONGMAN,12,2011-06-02 10:39:00,1.65,16484.0,United Kingdom
555312,23073,GEORGIAN TRINKET BOX,1,2011-06-02 10:39:00,12.5,16484.0,United Kingdom
555312,23444,Next Day Carriage,1,2011-06-02 10:39:00,15.0,16484.0,United Kingdom
555320,15056n,EDWARDIAN PARASOL NATURAL,1,2011-06-02 11:00:00,12.46,,United Kingdom
555320,20676,RED RETROSPOT BOWL,3,2011-06-02 11:00:00,2.46,,United Kingdom
555320,20711,JUMBO BAG TOYS ,1,2011-06-02 11:00:00,4.13,,United Kingdom
555320,20717,STRAWBERRY SHOPPER BAG,1,2011-06-02 11:00:00,2.46,,United Kingdom
555320,21033,JUMBO BAG CHARLIE AND LOLA TOYS,1,2011-06-02 11:00:00,4.13,,United Kingdom
555320,21166,COOK WITH WINE METAL SIGN ,1,2011-06-02 11:00:00,4.13,,United Kingdom
555320,21172,PARTY METAL SIGN ,1,2011-06-02 11:00:00,4.13,,United Kingdom
555320,21216,"SET 3 RETROSPOT TEA,COFFEE,SUGAR",1,2011-06-02 11:00:00,10.79,,United Kingdom
555320,21218,RED SPOTTY BISCUIT TIN,1,2011-06-02 11:00:00,8.29,,United Kingdom
555320,21700,BIG DOUGHNUT FRIDGE MAGNETS,1,2011-06-02 11:00:00,8.29,,United Kingdom
555320,21864,UNION JACK FLAG PASSPORT COVER ,1,2011-06-02 11:00:00,4.13,,United Kingdom
555320,21931,JUMBO STORAGE BAG SUKI,1,2011-06-02 11:00:00,4.13,,United Kingdom
555320,21974,SET OF 36 PAISLEY FLOWER DOILIES,1,2011-06-02 11:00:00,3.75,,United Kingdom
555320,22089,PAPER BUNTING VINTAGE PAISLEY,1,2011-06-02 11:00:00,4.13,,United Kingdom
555320,22090,PAPER BUNTING RETROSPOT,1,2011-06-02 11:00:00,6.63,,United Kingdom
555320,22197,SMALL POPCORN HOLDER,6,2011-06-02 11:00:00,1.63,,United Kingdom
555320,22309,TEA COSY RED  STRIPE,1,2011-06-02 11:00:00,4.96,,United Kingdom
555320,22350,ILLUSTRATED CAT BOWL ,1,2011-06-02 11:00:00,4.96,,United Kingdom
555320,22360,GLASS JAR ENGLISH CONFECTIONERY,1,2011-06-02 11:00:00,5.79,,United Kingdom
555320,22411,JUMBO SHOPPER VINTAGE RED PAISLEY,1,2011-06-02 11:00:00,4.13,,United Kingdom
555320,22423,REGENCY CAKESTAND 3 TIER,1,2011-06-02 11:00:00,24.96,,United Kingdom
555320,22433,WATERING CAN GREEN DINOSAUR,1,2011-06-02 11:00:00,4.13,,United Kingdom
555320,22501,PICNIC BASKET WICKER LARGE,1,2011-06-02 11:00:00,20.79,,United Kingdom
555320,22519,CHILDS GARDEN BRUSH PINK,1,2011-06-02 11:00:00,4.13,,United Kingdom
555320,22722,SET OF 6 SPICE TINS PANTRY DESIGN,1,2011-06-02 11:00:00,8.29,,United Kingdom
555320,22845,VINTAGE CREAM CAT FOOD CONTAINER,1,2011-06-02 11:00:00,12.46,,United Kingdom
555320,22961,JAM MAKING SET PRINTED,1,2011-06-02 11:00:00,3.29,,United Kingdom
555320,23182,TOILET SIGN OCCUPIED OR VACANT,2,2011-06-02 11:00:00,2.5,,United Kingdom
555320,47566b,TEA TIME PARTY BUNTING,4,2011-06-02 11:00:00,8.29,,United Kingdom
555320,82482,WOODEN PICTURE FRAME WHITE FINISH,1,2011-06-02 11:00:00,4.96,,United Kingdom
555320,84509a,SET OF 4 ENGLISH ROSE PLACEMATS,1,2011-06-02 11:00:00,7.46,,United Kingdom
555320,84596f,SMALL MARSHMALLOWS PINK BOWL,3,2011-06-02 11:00:00,2.46,,United Kingdom
555320,84969,BOX OF 6 ASSORTED COLOUR TEASPOONS,1,2011-06-02 11:00:00,8.29,,United Kingdom
555320,85099B,JUMBO BAG RED RETROSPOT,4,2011-06-02 11:00:00,4.13,,United Kingdom
555320,DOT,DOTCOM POSTAGE,1,2011-06-02 11:00:00,98.54,,United Kingdom
555321,15056n,EDWARDIAN PARASOL NATURAL,1,2011-06-02 11:01:00,12.46,,United Kingdom
555321,20615,BLUE POLKADOT PASSPORT COVER,1,2011-06-02 11:01:00,4.13,,United Kingdom
555321,20676,RED RETROSPOT BOWL,4,2011-06-02 11:01:00,2.46,,United Kingdom
555321,20718,RED RETROSPOT SHOPPER BAG,1,2011-06-02 11:01:00,3.29,,United Kingdom
555321,21179,NO JUNK MAIL METAL SIGN,1,2011-06-02 11:01:00,3.29,,United Kingdom
555321,21216,"SET 3 RETROSPOT TEA,COFFEE,SUGAR",1,2011-06-02 11:01:00,10.79,,United Kingdom
555321,21558,SKULL LUNCH BOX WITH CUTLERY ,1,2011-06-02 11:01:00,4.96,,United Kingdom
555321,21864,UNION JACK FLAG PASSPORT COVER ,1,2011-06-02 11:01:00,4.13,,United Kingdom
555321,21866,UNION JACK FLAG LUGGAGE TAG,8,2011-06-02 11:01:00,3.29,,United Kingdom
555321,21930,JUMBO STORAGE BAG SKULLS,1,2011-06-02 11:01:00,4.96,,United Kingdom
555321,21935,SUKI  SHOULDER BAG,1,2011-06-02 11:01:00,4.13,,United Kingdom
555321,22063,CERAMIC BOWL WITH STRAWBERRY DESIGN,1,2011-06-02 11:01:00,5.79,,United Kingdom
555321,22171,3 HOOK PHOTO SHELF ANTIQUE WHITE,1,2011-06-02 11:01:00,16.63,,United Kingdom
555321,22297,HEART IVORY TRELLIS SMALL,1,2011-06-02 11:01:00,2.46,,United Kingdom
555321,22352,LUNCH BOX WITH CUTLERY RETROSPOT ,1,2011-06-02 11:01:00,4.96,,United Kingdom
555321,22501,PICNIC BASKET WICKER LARGE,1,2011-06-02 11:01:00,20.79,,United Kingdom
555321,22507,MEMO BOARD RETROSPOT  DESIGN,1,2011-06-02 11:01:00,10.79,,United Kingdom
555321,22668,PINK BABY BUNTING,1,2011-06-02 11:01:00,5.79,,United Kingdom
555321,23182,TOILET SIGN OCCUPIED OR VACANT,1,2011-06-02 11:01:00,2.5,,United Kingdom
555321,85099B,JUMBO BAG RED RETROSPOT,2,2011-06-02 11:01:00,4.13,,United Kingdom
555321,DOT,DOTCOM POSTAGE,1,2011-06-02 11:01:00,56.79,,United Kingdom
555322,20655,QUEEN OF SKIES LUGGAGE TAG,1,2011-06-02 11:01:00,2.46,,United Kingdom
555322,20676,RED RETROSPOT BOWL,2,2011-06-02 11:01:00,2.46,,United Kingdom
555322,20711,JUMBO BAG TOYS ,1,2011-06-02 11:01:00,4.13,,United Kingdom
555322,20712,JUMBO BAG WOODLAND ANIMALS,1,2011-06-02 11:01:00,4.13,,United Kingdom
555322,20717,STRAWBERRY SHOPPER BAG,2,2011-06-02 11:01:00,2.46,,United Kingdom
555322,20718,RED RETROSPOT SHOPPER BAG,1,2011-06-02 11:01:00,3.29,,United Kingdom
555322,21035,SET/2 RED RETROSPOT TEA TOWELS ,1,2011-06-02 11:01:00,6.25,,United Kingdom
555322,21078,SET/20 STRAWBERRY PAPER NAPKINS ,1,2011-06-02 11:01:00,2.46,,United Kingdom
555322,21216,"SET 3 RETROSPOT TEA,COFFEE,SUGAR",1,2011-06-02 11:01:00,10.79,,United Kingdom
555322,21218,RED SPOTTY BISCUIT TIN,1,2011-06-02 11:01:00,8.29,,United Kingdom
555322,21714,CITRONELLA CANDLE GARDEN POT,3,2011-06-02 11:01:00,2.46,,United Kingdom
555322,21868,POTTING SHED TEA MUG,1,2011-06-02 11:01:00,3.29,,United Kingdom
555322,21888,BINGO SET,1,2011-06-02 11:01:00,7.46,,United Kingdom
555322,21936,RED RETROSPOT PICNIC BAG,1,2011-06-02 11:01:00,5.79,,United Kingdom
555322,21949,SET OF 6 STRAWBERRY CHOPSTICKS,1,2011-06-02 11:01:00,2.46,,United Kingdom
555322,21974,SET OF 36 PAISLEY FLOWER DOILIES,2,2011-06-02 11:01:00,3.75,,United Kingdom
555322,22041,"RECORD FRAME 7"" SINGLE SIZE ",1,2011-06-02 11:01:00,4.96,,United Kingdom
555322,22173,METAL 4 HOOK HANGER FRENCH CHATEAU,1,2011-06-02 11:01:00,5.79,,United Kingdom
555322,22195,LARGE HEART MEASURING SPOONS,1,2011-06-02 11:01:00,3.29,,United Kingdom
555322,22197,SMALL POPCORN HOLDER,2,2011-06-02 11:01:00,1.63,,United Kingdom
555322,22352,LUNCH BOX WITH CUTLERY RETROSPOT ,2,2011-06-02 11:01:00,4.96,,United Kingdom
555322,22385,JUMBO BAG SPACEBOY DESIGN,1,2011-06-02 11:01:00,4.13,,United Kingdom
555322,22386,JUMBO BAG PINK POLKADOT,1,2011-06-02 11:01:00,4.13,,United Kingdom
555322,22411,JUMBO SHOPPER VINTAGE RED PAISLEY,1,2011-06-02 11:01:00,4.13,,United Kingdom
555322,22469,HEART OF WICKER SMALL,5,2011-06-02 11:01:00,4.13,,United Kingdom
555322,22501,PICNIC BASKET WICKER LARGE,1,2011-06-02 11:01:00,20.79,,United Kingdom
555322,22629,SPACEBOY LUNCH BOX ,1,2011-06-02 11:01:00,2.46,,United Kingdom
555322,22659,LUNCH BOX I LOVE LONDON,1,2011-06-02 11:01:00,2.46,,United Kingdom
555322,47566b,TEA TIME PARTY BUNTING,1,2011-06-02 11:01:00,8.29,,United Kingdom
555322,47591d,PINK FAIRY CAKE CHILDRENS APRON,1,2011-06-02 11:01:00,4.96,,United Kingdom
555322,84032A,CHARLIE+LOLA PINK HOT WATER BOTTLE,1,2011-06-02 11:01:00,5.79,,United Kingdom
555322,84032B,CHARLIE + LOLA RED HOT WATER BOTTLE,1,2011-06-02 11:01:00,5.79,,United Kingdom
