InvoiceNo,StockCode,Description,Quantity,InvoiceDate,UnitPrice,CustomerID,Country
579461,23367,SET 12 COLOUR PENCILS SPACEBOY ,24,2011-11-29 14:42:00,0.65,15615.0,United Kingdom
579461,22112,CHOCOLATE HOT WATER BOTTLE,12,2011-11-29 14:42:00,4.95,15615.0,United Kingdom
579461,23355,HOT WATER BOTTLE KEEP CALM,24,2011-11-29 14:42:00,4.15,15615.0,United Kingdom
579461,22111,SCOTTIE DOG HOT WATER BOTTLE,24,2011-11-29 14:42:00,4.25,15615.0,United Kingdom
579461,22114,HOT WATER BOTTLE TEA AND SYMPATHY,12,2011-11-29 14:42:00,4.25,15615.0,United Kingdom
579461,21930,JUMBO STORAGE BAG SKULLS,10,2011-11-29 14:42:00,2.08,15615.0,United Kingdom
579461,21931,JUMBO STORAGE BAG SUKI,10,2011-11-29 14:42:00,2.08,15615.0,United Kingdom
579461,20712,JUMBO BAG WOODLAND ANIMALS,10,2011-11-29 14:42:00,2.08,15615.0,United Kingdom
579461,22386,JUMBO BAG PINK POLKADOT,10,2011-11-29 14:42:00,2.08,15615.0,United Kingdom
579461,85099B,JUMBO BAG RED RETROSPOT,10,2011-11-29 14:42:00,2.08,15615.0,United Kingdom
579461,85099F,JUMBO BAG STRAWBERRY,10,2011-11-29 14:42:00,2.08,15615.0,United Kingdom
579461,23581,JUMBO BAG PAISLEY PARK,10,2011-11-29 14:42:00,2.08,15615.0,United Kingdom
579461,22411,JUMBO SHOPPER VINTAGE RED PAISLEY,10,2011-11-29 14:42:00,2.08,15615.0,United Kingdom
579461,85099C,JUMBO  BAG BAROQUE BLACK WHITE,10,2011-11-29 14:42:00,2.08,15615.0,United Kingdom
579461,23344,JUMBO BAG 50'S CHRISTMAS ,50,2011-11-29 14:42:00,2.08,15615.0,United Kingdom
579461,23343,JUMBO BAG VINTAGE CHRISTMAS ,50,2011-11-29 14:42:00,2.08,15615.0,United Kingdom
579461,23298,SPOTTY BUNTING,3,2011-11-29 14:42:00,4.95,15615.0,United Kingdom
579461,23295,SET OF 12 MINI LOAF BAKING CASES,8,2011-11-29 14:42:00,0.83,15615.0,United Kingdom
579461,23199,JUMBO BAG APPLES,10,2011-11-29 14:42:00,2.08,15615.0,United Kingdom
579461,22178,VICTORIAN GLASS HANGING T-LIGHT,12,2011-11-29 14:42:00,1.95,15615.0,United Kingdom
579461,23129,HEART SHAPED HOLLY WREATH,4,2011-11-29 14:42:00,4.15,15615.0,United Kingdom
579461,22945,CHRISTMAS METAL TAGS ASSORTED ,24,2011-11-29 14:42:00,0.85,15615.0,United Kingdom
579461,85053,FRENCH ENAMEL CANDLEHOLDER,6,2011-11-29 14:42:00,2.1,15615.0,United Kingdom
579462,22086,PAPER CHAIN KIT 50'S CHRISTMAS ,80,2011-11-29 14:43:00,2.55,13211.0,United Kingdom
579462,23121,PACK OF 6 COCKTAIL PARASOL STRAWS,24,2011-11-29 14:43:00,0.42,13211.0,United Kingdom
579462,21495,SKULLS AND CROSSBONES WRAP,25,2011-11-29 14:43:00,0.42,13211.0,United Kingdom
579462,21497,FANCY FONTS BIRTHDAY WRAP,25,2011-11-29 14:43:00,0.42,13211.0,United Kingdom
579462,21498,RED RETROSPOT WRAP ,25,2011-11-29 14:43:00,0.42,13211.0,United Kingdom
579462,22707,WRAP MONSTER FUN ,25,2011-11-29 14:43:00,0.42,13211.0,United Kingdom
579462,23231,WRAP  VINTAGE DOILY ,25,2011-11-29 14:43:00,0.42,13211.0,United Kingdom
579462,23298,SPOTTY BUNTING,3,2011-11-29 14:43:00,4.95,13211.0,United Kingdom
579462,47590B,PINK HAPPY BIRTHDAY BUNTING,3,2011-11-29 14:43:00,5.45,13211.0,United Kingdom
579462,22436,12 COLOURED PARTY BALLOONS,20,2011-11-29 14:43:00,0.65,13211.0,United Kingdom
579463,23081,GREEN METAL BOX ARMY SUPPLIES,1,2011-11-29 14:47:00,8.25,,United Kingdom
579463,23429,RED RETRO KITCHEN WALL CLOCK,1,2011-11-29 14:47:00,8.15,,United Kingdom
579464,23382,BOX OF 6 CHRISTMAS CAKE DECORATIONS,8,2011-11-29 14:51:00,3.75,15214.0,United Kingdom
579464,23497,CLASSIC CHROME BICYCLE BELL ,12,2011-11-29 14:51:00,1.45,15214.0,United Kingdom
579464,21620,SET OF 4 ROSE BOTANICAL CANDLES,12,2011-11-29 14:51:00,1.25,15214.0,United Kingdom
579464,23498,CLASSIC BICYCLE CLIPS ,12,2011-11-29 14:51:00,1.45,15214.0,United Kingdom
579464,23552,BICYCLE PUNCTURE REPAIR KIT ,6,2011-11-29 14:51:00,2.08,15214.0,United Kingdom
579464,21905,MORE BUTTER METAL SIGN ,12,2011-11-29 14:51:00,0.79,15214.0,United Kingdom
579464,22816,CARD MOTORBIKE SANTA,12,2011-11-29 14:51:00,0.42,15214.0,United Kingdom
579464,23089,GLASS BON BON JAR,12,2011-11-29 14:51:00,1.95,15214.0,United Kingdom
579464,23340,VINTAGE CHRISTMAS CAKE FRILL,12,2011-11-29 14:51:00,1.65,15214.0,United Kingdom
579464,22111,SCOTTIE DOG HOT WATER BOTTLE,6,2011-11-29 14:51:00,4.95,15214.0,United Kingdom
579465,22809,SET OF 6 T-LIGHTS SANTA,2,2011-11-29 14:53:00,2.95,15790.0,United Kingdom
579465,23300,GARDENERS KNEELING PAD CUP OF TEA ,6,2011-11-29 14:53:00,1.65,15790.0,United Kingdom
579465,23301,GARDENERS KNEELING PAD KEEP CALM ,5,2011-11-29 14:53:00,1.65,15790.0,United Kingdom
579465,23323,WHITE WICKER STAR ,1,2011-11-29 14:53:00,2.1,15790.0,United Kingdom
579465,21098,CHRISTMAS TOILET ROLL,2,2011-11-29 14:53:00,1.25,15790.0,United Kingdom
579465,22625,RED KITCHEN SCALES,1,2011-11-29 14:53:00,8.5,15790.0,United Kingdom
579465,22624,IVORY KITCHEN SCALES,1,2011-11-29 14:53:00,8.5,15790.0,United Kingdom
579465,21351,CINAMMON & ORANGE WREATH,2,2011-11-29 14:53:00,6.75,15790.0,United Kingdom
579465,23400,SHELF WITH 4 HOOKS HOME SWEET HOME,2,2011-11-29 14:53:00,6.25,15790.0,United Kingdom
579465,23323,WHITE WICKER STAR ,1,2011-11-29 14:53:00,2.1,15790.0,United Kingdom
579465,23322,LARGE WHITE HEART OF WICKER,2,2011-11-29 14:53:00,2.95,15790.0,United Kingdom
579465,48138,DOORMAT UNION FLAG,3,2011-11-29 14:53:00,8.25,15790.0,United Kingdom
579465,23522,WALL ART DOG AND BALL ,1,2011-11-29 14:53:00,2.89,15790.0,United Kingdom
579465,21411,GINGHAM HEART  DOORSTOP RED,2,2011-11-29 14:53:00,4.25,15790.0,United Kingdom
579465,22114,HOT WATER BOTTLE TEA AND SYMPATHY,1,2011-11-29 14:53:00,4.25,15790.0,United Kingdom
579465,23355,HOT WATER BOTTLE KEEP CALM,1,2011-11-29 14:53:00,4.95,15790.0,United Kingdom
579465,22852,DOG BOWL VINTAGE CREAM,2,2011-11-29 14:53:00,4.25,15790.0,United Kingdom
579465,22470,HEART OF WICKER LARGE,3,2011-11-29 14:53:00,2.95,15790.0,United Kingdom
579465,22109,FULL ENGLISH BREAKFAST PLATE,1,2011-11-29 14:53:00,3.75,15790.0,United Kingdom
579465,22108,PING! MICROWAVE PLATE,1,2011-11-29 14:53:00,3.75,15790.0,United Kingdom
579465,23342,MINT DINER WALL CLOCK,1,2011-11-29 14:53:00,8.5,15790.0,United Kingdom
579465,22607,WOODEN ROUNDERS GARDEN SET ,1,2011-11-29 14:53:00,9.95,15790.0,United Kingdom
579465,21108,FAIRY CAKE FLANNEL ASSORTED COLOUR,18,2011-11-29 14:53:00,0.79,15790.0,United Kingdom
579465,85150,LADIES & GENTLEMEN METAL SIGN,1,2011-11-29 14:53:00,2.55,15790.0,United Kingdom
579465,85152,HAND OVER THE CHOCOLATE   SIGN ,1,2011-11-29 14:53:00,2.1,15790.0,United Kingdom
579465,82583,HOT BATHS METAL SIGN,1,2011-11-29 14:53:00,2.1,15790.0,United Kingdom
579465,22093,MOTORING TISSUE BOX,3,2011-11-29 14:53:00,0.39,15790.0,United Kingdom
579465,22561,WOODEN SCHOOL COLOURING SET,3,2011-11-29 14:53:00,1.65,15790.0,United Kingdom
579465,22099,CARAVAN SQUARE TISSUE BOX,1,2011-11-29 14:53:00,0.39,15790.0,United Kingdom
579465,22091,EMPIRE TISSUE BOX,2,2011-11-29 14:53:00,0.39,15790.0,United Kingdom
579465,20983,12 PENCILS TALL TUBE RED RETROSPOT,2,2011-11-29 14:53:00,0.85,15790.0,United Kingdom
579465,21166,COOK WITH WINE METAL SIGN ,1,2011-11-29 14:53:00,2.08,15790.0,United Kingdom
579465,21907,I'M ON HOLIDAY METAL SIGN,1,2011-11-29 14:53:00,2.1,15790.0,United Kingdom
579465,22816,CARD MOTORBIKE SANTA,36,2011-11-29 14:53:00,0.42,15790.0,United Kingdom
579465,22469,HEART OF WICKER SMALL,2,2011-11-29 14:53:00,1.65,15790.0,United Kingdom
579466,22139,RETROSPOT TEA SET CERAMIC 11 PC ,48,2011-11-29 14:57:00,4.25,15189.0,United Kingdom
579466,22138,BAKING SET 9 PIECE RETROSPOT ,24,2011-11-29 14:57:00,4.25,15189.0,United Kingdom
579467,23660,HENRIETTA HEN MUG ,12,2011-11-29 14:57:00,1.65,15755.0,United Kingdom
579467,20914,SET/5 RED RETROSPOT LID GLASS BOWLS,12,2011-11-29 14:57:00,2.95,15755.0,United Kingdom
579467,23581,JUMBO BAG PAISLEY PARK,10,2011-11-29 14:57:00,2.08,15755.0,United Kingdom
579467,21876,POTTERING MUG,12,2011-11-29 14:57:00,1.65,15755.0,United Kingdom
579467,85099B,JUMBO BAG RED RETROSPOT,10,2011-11-29 14:57:00,2.08,15755.0,United Kingdom
579467,21380,WOODEN HAPPY BIRTHDAY GARLAND,6,2011-11-29 14:57:00,2.95,15755.0,United Kingdom
579467,21381,MINI WOODEN HAPPY BIRTHDAY GARLAND,12,2011-11-29 14:57:00,1.69,15755.0,United Kingdom
579467,23560,SET OF 6 RIBBONS COUNTRY STYLE,6,2011-11-29 14:57:00,2.89,15755.0,United Kingdom
579467,23562,SET OF 6 RIBBONS PERFECTLY PRETTY  ,6,2011-11-29 14:57:00,2.89,15755.0,United Kingdom
579467,23203,JUMBO BAG VINTAGE DOILY ,10,2011-11-29 14:57:00,2.08,15755.0,United Kingdom
579467,23393,HOME SWEET HOME CUSHION COVER ,4,2011-11-29 14:57:00,3.75,15755.0,United Kingdom
579467,46000S,POLYESTER FILLER PAD 40x40cm,1,2011-11-29 14:57:00,1.45,15755.0,United Kingdom
579467,22171,3 HOOK PHOTO SHELF ANTIQUE WHITE,2,2011-11-29 14:57:00,8.5,15755.0,United Kingdom
579467,22170,PICTURE FRAME WOOD TRIPLE PORTRAIT,4,2011-11-29 14:57:00,6.75,15755.0,United Kingdom
579467,22169,FAMILY ALBUM WHITE PICTURE FRAME,2,2011-11-29 14:57:00,8.5,15755.0,United Kingdom
579468,21912,VINTAGE SNAKES & LADDERS,1,2011-11-29 14:58:00,3.75,14711.0,United Kingdom
579468,23229,VINTAGE DONKEY TAIL GAME ,1,2011-11-29 14:58:00,3.75,14711.0,United Kingdom
579468,21790,VINTAGE SNAP CARDS,1,2011-11-29 14:58:00,0.85,14711.0,United Kingdom
579468,84032B,CHARLIE + LOLA RED HOT WATER BOTTLE,2,2011-11-29 14:58:00,2.95,14711.0,United Kingdom
579468,23355,HOT WATER BOTTLE KEEP CALM,1,2011-11-29 14:58:00,4.95,14711.0,United Kingdom
579468,23390,DOLLY GIRL MINI BACKPACK,1,2011-11-29 14:58:00,4.15,14711.0,United Kingdom
579468,23312,VINTAGE CHRISTMAS GIFT SACK,5,2011-11-29 14:58:00,4.15,14711.0,United Kingdom
579468,23318,BOX OF 6 MINI VINTAGE CRACKERS,1,2011-11-29 14:58:00,2.49,14711.0,United Kingdom
579468,23320,GIANT 50'S CHRISTMAS CRACKER,2,2011-11-29 14:58:00,2.89,14711.0,United Kingdom
579468,23284,DOORMAT KEEP CALM AND COME IN,2,2011-11-29 14:58:00,8.25,14711.0,United Kingdom
579468,23035,DRAWER KNOB CERAMIC IVORY,8,2011-11-29 14:58:00,1.45,14711.0,United Kingdom
579468,82483,WOOD 2 DRAWER CABINET WHITE FINISH,1,2011-11-29 14:58:00,6.95,14711.0,United Kingdom
579468,84879,ASSORTED COLOUR BIRD ORNAMENT,8,2011-11-29 14:58:00,1.69,14711.0,United Kingdom
579468,22669,RED BABY BUNTING ,5,2011-11-29 14:58:00,2.95,14711.0,United Kingdom
579468,22592,CARDHOLDER HOLLY WREATH METAL,1,2011-11-29 14:58:00,3.75,14711.0,United Kingdom
579468,22619,SET OF 6 SOLDIER SKITTLES,1,2011-11-29 14:58:00,3.75,14711.0,United Kingdom
579468,22460,EMBOSSED GLASS TEALIGHT HOLDER,4,2011-11-29 14:58:00,1.25,14711.0,United Kingdom
579468,22832,BROCANTE SHELF WITH HOOKS,1,2011-11-29 14:58:00,10.75,14711.0,United Kingdom
579468,21754,HOME BUILDING BLOCK WORD,1,2011-11-29 14:58:00,6.25,14711.0,United Kingdom
579468,21733,RED HANGING HEART T-LIGHT HOLDER,2,2011-11-29 14:58:00,2.95,14711.0,United Kingdom
579468,23414,ZINC BOX SIGN HOME,1,2011-11-29 14:58:00,9.95,14711.0,United Kingdom
579468,22822,CREAM WALL PLANTER HEART SHAPED,1,2011-11-29 14:58:00,5.95,14711.0,United Kingdom
579468,72811,SMALL ZINC/GLASS CANDLEHOLDER,2,2011-11-29 14:58:00,1.49,14711.0,United Kingdom
579468,22928,YELLOW GIANT GARDEN THERMOMETER,1,2011-11-29 14:58:00,5.95,14711.0,United Kingdom
579468,22624,IVORY KITCHEN SCALES,1,2011-11-29 14:58:00,8.5,14711.0,United Kingdom
579468,82484,WOOD BLACK BOARD ANT WHITE FINISH,1,2011-11-29 14:58:00,7.95,14711.0,United Kingdom
579468,23535,WALL ART BICYCLE SAFETY,1,2011-11-29 14:58:00,5.95,14711.0,United Kingdom
579468,22109,FULL ENGLISH BREAKFAST PLATE,1,2011-11-29 14:58:00,3.75,14711.0,United Kingdom
579468,85034C,3 ROSE MORRIS BOXED CANDLES,2,2011-11-29 14:58:00,1.25,14711.0,United Kingdom
579468,22624,IVORY KITCHEN SCALES,1,2011-11-29 14:58:00,8.5,14711.0,United Kingdom
579468,46000M,POLYESTER FILLER PAD 45x45cm,6,2011-11-29 14:58:00,1.55,14711.0,United Kingdom
579468,23393,HOME SWEET HOME CUSHION COVER ,2,2011-11-29 14:58:00,3.75,14711.0,United Kingdom
579468,23394,POSTE FRANCE CUSHION COVER,2,2011-11-29 14:58:00,3.75,14711.0,United Kingdom
579468,21818,GLITTER HEART DECORATION,6,2011-11-29 14:58:00,0.39,14711.0,United Kingdom
579469,85099C,JUMBO  BAG BAROQUE BLACK WHITE,100,2011-11-29 15:00:00,1.79,13068.0,United Kingdom
579470,22529,MAGIC DRAWING SLATE GO TO THE FAIR ,3,2011-11-29 15:06:00,0.42,16549.0,United Kingdom
579470,22530,MAGIC DRAWING SLATE DOLLY GIRL ,3,2011-11-29 15:06:00,0.42,16549.0,United Kingdom
579470,22539,MINI JIGSAW DOLLY GIRL,2,2011-11-29 15:06:00,0.42,16549.0,United Kingdom
579470,22538,MINI JIGSAW GO TO THE FAIR,2,2011-11-29 15:06:00,0.42,16549.0,United Kingdom
579470,22531,MAGIC DRAWING SLATE CIRCUS PARADE  ,3,2011-11-29 15:06:00,0.42,16549.0,United Kingdom
579470,22540,MINI JIGSAW CIRCUS PARADE ,5,2011-11-29 15:06:00,0.42,16549.0,United Kingdom
579470,22535,MAGIC DRAWING SLATE BUNNIES ,3,2011-11-29 15:06:00,0.42,16549.0,United Kingdom
579470,23439,HAND WARMER RED LOVE HEART,4,2011-11-29 15:06:00,2.1,16549.0,United Kingdom
579470,22632,HAND WARMER RED RETROSPOT,3,2011-11-29 15:06:00,2.1,16549.0,United Kingdom
579470,22834,HAND WARMER BABUSHKA DESIGN,1,2011-11-29 15:06:00,2.1,16549.0,United Kingdom
579470,22866,HAND WARMER SCOTTY DOG DESIGN,3,2011-11-29 15:06:00,2.1,16549.0,United Kingdom
579470,22867,HAND WARMER BIRD DESIGN,4,2011-11-29 15:06:00,2.1,16549.0,United Kingdom
579470,22865,HAND WARMER OWL DESIGN,4,2011-11-29 15:06:00,2.1,16549.0,United Kingdom
579470,22633,HAND WARMER UNION JACK,3,2011-11-29 15:06:00,2.1,16549.0,United Kingdom
579470,16218,CARTOON  PENCIL SHARPENERS,10,2011-11-29 15:06:00,0.06,16549.0,United Kingdom
579470,21892,TRADITIONAL WOODEN CATCH CUP GAME ,5,2011-11-29 15:06:00,1.25,16549.0,United Kingdom
579470,21891,TRADITIONAL WOODEN SKIPPING ROPE,5,2011-11-29 15:06:00,1.45,16549.0,United Kingdom
579470,22541,MINI JIGSAW LEAP FROG,4,2011-11-29 15:06:00,0.42,16549.0,United Kingdom
579470,22534,MAGIC DRAWING SLATE SPACEBOY ,2,2011-11-29 15:06:00,0.42,16549.0,United Kingdom
579470,22532,MAGIC DRAWING SLATE LEAP FROG ,4,2011-11-29 15:06:00,0.42,16549.0,United Kingdom
579470,22533,MAGIC DRAWING SLATE BAKE A CAKE ,1,2011-11-29 15:06:00,0.42,16549.0,United Kingdom
579470,22544,MINI JIGSAW SPACEBOY,1,2011-11-29 15:06:00,0.42,16549.0,United Kingdom
579470,22537,MAGIC DRAWING SLATE DINOSAUR,1,2011-11-29 15:06:00,0.42,16549.0,United Kingdom
579470,22547,MINI JIGSAW DINOSAUR ,1,2011-11-29 15:06:00,0.42,16549.0,United Kingdom
579470,22546,MINI JIGSAW PURDEY,2,2011-11-29 15:06:00,0.42,16549.0,United Kingdom
579470,16235,RECYCLED PENCIL WITH RABBIT ERASER,7,2011-11-29 15:06:00,0.21,16549.0,United Kingdom
579470,23508,MINI PLAYING CARDS DOLLY GIRL ,5,2011-11-29 15:06:00,0.42,16549.0,United Kingdom
579470,23509,MINI PLAYING CARDS FUN FAIR ,3,2011-11-29 15:06:00,0.42,16549.0,United Kingdom
579470,23506,MINI PLAYING CARDS SPACEBOY ,6,2011-11-29 15:06:00,0.42,16549.0,United Kingdom
579470,21703,BAG 125g SWIRLY MARBLES,5,2011-11-29 15:06:00,0.42,16549.0,United Kingdom
579470,23562,SET OF 6 RIBBONS PERFECTLY PRETTY  ,2,2011-11-29 15:06:00,2.89,16549.0,United Kingdom
579470,23560,SET OF 6 RIBBONS COUNTRY STYLE,2,2011-11-29 15:06:00,2.89,16549.0,United Kingdom
579470,20979,36 PENCILS TUBE RED RETROSPOT,1,2011-11-29 15:06:00,1.25,16549.0,United Kingdom
579470,20975,12 PENCILS SMALL TUBE RED RETROSPOT,1,2011-11-29 15:06:00,0.65,16549.0,United Kingdom
579470,20982,12 PENCILS TALL TUBE SKULLS,3,2011-11-29 15:06:00,0.85,16549.0,United Kingdom
579470,20978,36 PENCILS TUBE SKULLS,1,2011-11-29 15:06:00,1.25,16549.0,United Kingdom
579470,23372,SET 36 COLOUR PENCILS DOLLY GIRL,3,2011-11-29 15:06:00,1.25,16549.0,United Kingdom
579470,23369,SET 36 COLOUR PENCILS LOVE LONDON,3,2011-11-29 15:06:00,1.25,16549.0,United Kingdom
579470,23371,SET 36 COLOUR PENCILS SPACEBOY ,3,2011-11-29 15:06:00,1.25,16549.0,United Kingdom
579470,23367,SET 12 COLOUR PENCILS SPACEBOY ,3,2011-11-29 15:06:00,0.65,16549.0,United Kingdom
579470,20973,12 PENCIL SMALL TUBE WOODLAND,2,2011-11-29 15:06:00,0.65,16549.0,United Kingdom
579470,23365,SET 12 COLOUR PENCILS LOVE LONDON,3,2011-11-29 15:06:00,0.65,16549.0,United Kingdom
579470,23366,SET 12 COLOURING PENCILS DOILY,2,2011-11-29 15:06:00,0.65,16549.0,United Kingdom
579470,20983,12 PENCILS TALL TUBE RED RETROSPOT,3,2011-11-29 15:06:00,0.85,16549.0,United Kingdom
579470,23129,HEART SHAPED HOLLY WREATH,6,2011-11-29 15:06:00,4.15,16549.0,United Kingdom
579470,23131,MISTLETOE HEART WREATH CREAM,6,2011-11-29 15:06:00,4.15,16549.0,United Kingdom
579470,23289,DOLLY GIRL CHILDRENS BOWL,3,2011-11-29 15:06:00,1.25,16549.0,United Kingdom
579470,23290,SPACEBOY CHILDRENS BOWL,3,2011-11-29 15:06:00,1.25,16549.0,United Kingdom
579470,23346,SPACEBOY BEAKER,2,2011-11-29 15:06:00,1.25,16549.0,United Kingdom
579470,23345, DOLLY GIRL BEAKER,2,2011-11-29 15:06:00,1.25,16549.0,United Kingdom
579470,22142,CHRISTMAS CRAFT WHITE FAIRY ,4,2011-11-29 15:06:00,1.45,16549.0,United Kingdom
579470,22909,SET OF 20 VINTAGE CHRISTMAS NAPKINS,5,2011-11-29 15:06:00,0.85,16549.0,United Kingdom
579470,23313,VINTAGE CHRISTMAS BUNTING,2,2011-11-29 15:06:00,4.95,16549.0,United Kingdom
579470,20914,SET/5 RED RETROSPOT LID GLASS BOWLS,3,2011-11-29 15:06:00,2.95,16549.0,United Kingdom
579470,22910,PAPER CHAIN KIT VINTAGE CHRISTMAS,3,2011-11-29 15:06:00,2.95,16549.0,United Kingdom
579470,22086,PAPER CHAIN KIT 50'S CHRISTMAS ,3,2011-11-29 15:06:00,2.95,16549.0,United Kingdom
579470,22141,CHRISTMAS CRAFT TREE TOP ANGEL,2,2011-11-29 15:06:00,2.1,16549.0,United Kingdom
579470,22144,CHRISTMAS CRAFT LITTLE FRIENDS,4,2011-11-29 15:06:00,2.1,16549.0,United Kingdom
579470,23130,MISTLETOE HEART WREATH GREEN,5,2011-11-29 15:06:00,4.15,16549.0,United Kingdom
579470,23344,JUMBO BAG 50'S CHRISTMAS ,2,2011-11-29 15:06:00,2.08,16549.0,United Kingdom
579470,23343,JUMBO BAG VINTAGE CHRISTMAS ,2,2011-11-29 15:06:00,2.08,16549.0,United Kingdom
579470,22112,CHOCOLATE HOT WATER BOTTLE,1,2011-11-29 15:06:00,4.95,16549.0,United Kingdom
579470,22113,GREY HEART HOT WATER BOTTLE,1,2011-11-29 15:06:00,4.25,16549.0,United Kingdom
579470,21484,CHICK GREY HOT WATER BOTTLE,1,2011-11-29 15:06:00,4.25,16549.0,United Kingdom
579470,22111,SCOTTIE DOG HOT WATER BOTTLE,1,2011-11-29 15:06:00,4.95,16549.0,United Kingdom
579470,21481,FAWN BLUE HOT WATER BOTTLE,1,2011-11-29 15:06:00,3.75,16549.0,United Kingdom
579470,22114,HOT WATER BOTTLE TEA AND SYMPATHY,1,2011-11-29 15:06:00,4.25,16549.0,United Kingdom
579470,21561,DINOSAUR LUNCH BOX WITH CUTLERY,1,2011-11-29 15:06:00,2.55,16549.0,United Kingdom
579470,21559,STRAWBERRY LUNCH BOX WITH CUTLERY,1,2011-11-29 15:06:00,2.55,16549.0,United Kingdom
579470,21558,SKULL LUNCH BOX WITH CUTLERY ,1,2011-11-29 15:06:00,2.55,16549.0,United Kingdom
579470,20972,PINK CREAM FELT CRAFT TRINKET BOX ,1,2011-11-29 15:06:00,1.25,16549.0,United Kingdom
579470,20971,PINK BLUE FELT CRAFT TRINKET BOX,2,2011-11-29 15:06:00,1.25,16549.0,United Kingdom
579470,22274,FELTCRAFT DOLL EMILY,1,2011-11-29 15:06:00,2.95,16549.0,United Kingdom
579470,22273,FELTCRAFT DOLL MOLLY,1,2011-11-29 15:06:00,2.95,16549.0,United Kingdom
579470,21928,JUMBO BAG SCANDINAVIAN BLUE PAISLEY,1,2011-11-29 15:06:00,2.08,16549.0,United Kingdom
579470,21929,JUMBO BAG PINK VINTAGE PAISLEY,1,2011-11-29 15:06:00,2.08,16549.0,United Kingdom
579470,22663,JUMBO BAG DOLLY GIRL DESIGN,2,2011-11-29 15:06:00,2.08,16549.0,United Kingdom
579470,85099F,JUMBO BAG STRAWBERRY,2,2011-11-29 15:06:00,2.08,16549.0,United Kingdom
579470,85099B,JUMBO BAG RED RETROSPOT,2,2011-11-29 15:06:00,2.08,16549.0,United Kingdom
579470,23357,HOT WATER BOTTLE SEX BOMB,1,2011-11-29 15:06:00,4.95,16549.0,United Kingdom
579470,23356,LOVE HOT WATER BOTTLE,1,2011-11-29 15:06:00,5.95,16549.0,United Kingdom
579470,84029G,KNITTED UNION FLAG HOT WATER BOTTLE,3,2011-11-29 15:06:00,4.25,16549.0,United Kingdom
579470,23355,HOT WATER BOTTLE KEEP CALM,2,2011-11-29 15:06:00,4.95,16549.0,United Kingdom
579470,84029E,RED WOOLLY HOTTIE WHITE HEART.,1,2011-11-29 15:06:00,4.25,16549.0,United Kingdom
579470,23247,BISCUIT TIN 50'S CHRISTMAS,3,2011-11-29 15:06:00,2.89,16549.0,United Kingdom
579470,23234,BISCUIT TIN VINTAGE CHRISTMAS,3,2011-11-29 15:06:00,2.89,16549.0,United Kingdom
579470,22639,SET OF 4 NAPKIN CHARMS HEARTS,1,2011-11-29 15:06:00,2.55,16549.0,United Kingdom
579470,22638,SET OF 4 NAPKIN CHARMS CROWNS ,1,2011-11-29 15:06:00,2.55,16549.0,United Kingdom
579470,22604,SET OF 4 NAPKIN CHARMS CUTLERY,2,2011-11-29 15:06:00,2.55,16549.0,United Kingdom
579470,22641,SET OF 4 NAPKIN CHARMS INSTRUMENT,2,2011-11-29 15:06:00,2.55,16549.0,United Kingdom
579470,85150,LADIES & GENTLEMEN METAL SIGN,2,2011-11-29 15:06:00,2.55,16549.0,United Kingdom
579470,21164,HOME SWEET HOME METAL SIGN ,4,2011-11-29 15:06:00,2.95,16549.0,United Kingdom
579470,23426,METAL SIGN DROP YOUR PANTS,3,2011-11-29 15:06:00,2.89,16549.0,United Kingdom
579470,21908,CHOCOLATE THIS WAY METAL SIGN,3,2011-11-29 15:06:00,2.1,16549.0,United Kingdom
579470,22413,METAL SIGN TAKE IT OR LEAVE IT ,4,2011-11-29 15:06:00,2.95,16549.0,United Kingdom
579470,85152,HAND OVER THE CHOCOLATE   SIGN ,4,2011-11-29 15:06:00,2.1,16549.0,United Kingdom
579470,82551,LAUNDRY 15C METAL SIGN,3,2011-11-29 15:06:00,1.45,16549.0,United Kingdom
579470,82552,WASHROOM METAL SIGN,4,2011-11-29 15:06:00,1.45,16549.0,United Kingdom
579470,82600,N0 SINGING METAL SIGN,4,2011-11-29 15:06:00,2.1,16549.0,United Kingdom
579470,21905,MORE BUTTER METAL SIGN ,1,2011-11-29 15:06:00,0.79,16549.0,United Kingdom
579470,82583,HOT BATHS METAL SIGN,3,2011-11-29 15:06:00,2.1,16549.0,United Kingdom
579470,21174,POTTERING IN THE SHED METAL SIGN,4,2011-11-29 15:06:00,2.08,16549.0,United Kingdom
579470,21175,GIN AND TONIC DIET METAL SIGN,5,2011-11-29 15:06:00,2.55,16549.0,United Kingdom
579470,21166,COOK WITH WINE METAL SIGN ,6,2011-11-29 15:06:00,2.08,16549.0,United Kingdom
579470,21169,YOU'RE CONFUSING ME METAL SIGN ,7,2011-11-29 15:06:00,1.69,16549.0,United Kingdom
579470,22670,FRENCH WC SIGN BLUE METAL,4,2011-11-29 15:06:00,1.25,16549.0,United Kingdom
579470,22675,FRENCH KITCHEN SIGN BLUE METAL,3,2011-11-29 15:06:00,1.25,16549.0,United Kingdom
579470,21181,PLEASE ONE PERSON METAL SIGN,10,2011-11-29 15:06:00,2.1,16549.0,United Kingdom
579470,20846,ZINC HEART LATTICE T-LIGHT HOLDER,4,2011-11-29 15:06:00,1.25,16549.0,United Kingdom
579470,84970L,SINGLE HEART ZINC T-LIGHT HOLDER,6,2011-11-29 15:06:00,1.25,16549.0,United Kingdom
579470,23144,ZINC T-LIGHT HOLDER STARS SMALL,8,2011-11-29 15:06:00,0.83,16549.0,United Kingdom
579470,21066,VINTAGE RED MUG,1,2011-11-29 15:06:00,1.25,16549.0,United Kingdom
579470,21877,HOME SWEET HOME MUG,1,2011-11-29 15:06:00,1.65,16549.0,United Kingdom
579470,21875,KINGS CHOICE MUG,1,2011-11-29 15:06:00,1.25,16549.0,United Kingdom
579470,21872,GLAMOROUS  MUG,1,2011-11-29 15:06:00,1.25,16549.0,United Kingdom
579470,21068,VINTAGE BILLBOARD LOVE/HATE MUG,2,2011-11-29 15:06:00,1.25,16549.0,United Kingdom
579470,22896,PEG BAG APPLES DESIGN,1,2011-11-29 15:06:00,2.55,16549.0,United Kingdom
579470,21155,RED RETROSPOT PEG BAG,1,2011-11-29 15:06:00,2.55,16549.0,United Kingdom
579470,21154,RED RETROSPOT OVEN GLOVE ,2,2011-11-29 15:06:00,1.25,16549.0,United Kingdom
579470,22897,OVEN MITT APPLES DESIGN,2,2011-11-29 15:06:00,1.45,16549.0,United Kingdom
579470,47559B,TEA TIME OVEN GLOVE,2,2011-11-29 15:06:00,1.25,16549.0,United Kingdom
579470,22075,6 RIBBONS ELEGANT CHRISTMAS ,2,2011-11-29 15:06:00,1.65,16549.0,United Kingdom
579470,85049E,SCANDINAVIAN REDS RIBBONS,3,2011-11-29 15:06:00,1.25,16549.0,United Kingdom
579470,22758,LARGE PURPLE BABUSHKA NOTEBOOK  ,2,2011-11-29 15:06:00,1.25,16549.0,United Kingdom
579470,22753,SMALL YELLOW BABUSHKA NOTEBOOK ,2,2011-11-29 15:06:00,0.85,16549.0,United Kingdom
579470,22754,SMALL RED BABUSHKA NOTEBOOK ,2,2011-11-29 15:06:00,0.85,16549.0,United Kingdom
579470,84535B,FAIRY CAKES NOTEBOOK A6 SIZE,4,2011-11-29 15:06:00,0.65,16549.0,United Kingdom
579470,84536B,FAIRY CAKES NOTEBOOK A7 SIZE,3,2011-11-29 15:06:00,0.42,16549.0,United Kingdom
579470,23005,TRAVEL CARD WALLET I LOVE LONDON,3,2011-11-29 15:06:00,0.42,16549.0,United Kingdom
579470,22996,TRAVEL CARD WALLET VINTAGE TICKET,2,2011-11-29 15:06:00,0.42,16549.0,United Kingdom
579470,22998,TRAVEL CARD WALLET KEEP CALM,3,2011-11-29 15:06:00,0.42,16549.0,United Kingdom
579470,22994,TRAVEL CARD WALLET RETROSPOT,3,2011-11-29 15:06:00,0.42,16549.0,United Kingdom
579470,22997,TRAVEL CARD WALLET UNION JACK,3,2011-11-29 15:06:00,0.42,16549.0,United Kingdom
579470,84536A,ENGLISH ROSE NOTEBOOK A7 SIZE,3,2011-11-29 15:06:00,0.42,16549.0,United Kingdom
579470,21327,SKULLS WRITING SET ,2,2011-11-29 15:06:00,1.65,16549.0,United Kingdom
579470,21329,DINOSAURS  WRITING SET ,2,2011-11-29 15:06:00,1.65,16549.0,United Kingdom
579470,21730,GLASS STAR FROSTED T-LIGHT HOLDER,4,2011-11-29 15:06:00,4.95,16549.0,United Kingdom
579470,21034,REX CASH+CARRY JUMBO SHOPPER,6,2011-11-29 15:06:00,0.95,16549.0,United Kingdom
579470,22178,VICTORIAN GLASS HANGING T-LIGHT,6,2011-11-29 15:06:00,1.95,16549.0,United Kingdom
579470,22119,PEACE WOODEN BLOCK LETTERS,4,2011-11-29 15:06:00,6.95,16549.0,United Kingdom
579470,22120,WELCOME  WOODEN BLOCK LETTERS,2,2011-11-29 15:06:00,9.95,16549.0,United Kingdom
579470,21754,HOME BUILDING BLOCK WORD,3,2011-11-29 15:06:00,6.25,16549.0,United Kingdom
579470,22118,JOY WOODEN BLOCK LETTERS,4,2011-11-29 15:06:00,4.95,16549.0,United Kingdom
579470,21755,LOVE BUILDING BLOCK WORD,3,2011-11-29 15:06:00,6.25,16549.0,United Kingdom
579470,22121,NOEL WOODEN BLOCK LETTERS ,1,2011-11-29 15:06:00,5.95,16549.0,United Kingdom
579470,23406,HOME SWEET HOME KEY HOLDER,2,2011-11-29 15:06:00,6.25,16549.0,United Kingdom
579470,23096,PETIT TRAY CHIC,6,2011-11-29 15:06:00,1.65,16549.0,United Kingdom
579470,23570,TRADITIONAL PICK UP STICKS GAME ,3,2011-11-29 15:06:00,1.25,16549.0,United Kingdom
579470,21790,VINTAGE SNAP CARDS,3,2011-11-29 15:06:00,0.85,16549.0,United Kingdom
579470,22642,SET OF 4 NAPKIN CHARMS STARS   ,1,2011-11-29 15:06:00,2.55,16549.0,United Kingdom
579470,23196,VINTAGE LEAF MAGNETIC NOTEPAD,2,2011-11-29 15:06:00,1.45,16549.0,United Kingdom
579470,23197,SKETCHBOOK MAGNETIC SHOPPING LIST,2,2011-11-29 15:06:00,1.45,16549.0,United Kingdom
579470,23198,PANTRY MAGNETIC  SHOPPING LIST,3,2011-11-29 15:06:00,1.45,16549.0,United Kingdom
