InvoiceNo,StockCode,Description,Quantity,InvoiceDate,UnitPrice,CustomerID,Country
545579,85187,S/12 MINI RABBIT EASTER,6,2011-03-04 08:10:00,1.65,17508.0,Greece
545579,22270,HAPPY EASTER HANGING DECORATION,4,2011-03-04 08:10:00,3.75,17508.0,Greece
545579,85211,S/4 GROOVY CAT MAGNETS,12,2011-03-04 08:10:00,1.65,17508.0,Greece
545579,22908,PACK OF 20 NAPKINS RED APPLES,12,2011-03-04 08:10:00,0.85,17508.0,Greece
545579,21936,RED RETROSPOT PICNIC BAG,5,2011-03-04 08:10:00,2.95,17508.0,Greece
545579,21932,SCANDINAVIAN PAISLEY PICNIC BAG,5,2011-03-04 08:10:00,2.95,17508.0,Greece
545579,20717,STRAWBERRY SHOPPER BAG,10,2011-03-04 08:10:00,1.25,17508.0,Greece
545579,21937,STRAWBERRY   PICNIC BAG,15,2011-03-04 08:10:00,2.95,17508.0,Greece
545579,21078,SET/20 STRAWBERRY PAPER NAPKINS ,24,2011-03-04 08:10:00,0.85,17508.0,Greece
545579,20723,STRAWBERRY CHARLOTTE BAG,10,2011-03-04 08:10:00,0.85,17508.0,Greece
545579,85099C,JUMBO  BAG BAROQUE BLACK WHITE,10,2011-03-04 08:10:00,1.95,17508.0,Greece
545579,22411,JUMBO SHOPPER VINTAGE RED PAISLEY,10,2011-03-04 08:10:00,1.95,17508.0,Greece
545579,85099F,JUMBO BAG STRAWBERRY,10,2011-03-04 08:10:00,1.95,17508.0,Greece
545579,35915B,BLUE KNITTED HEN ,6,2011-03-04 08:10:00,1.65,17508.0,Greece
545579,35915C,PEACH KNITTED HEN ,6,2011-03-04 08:10:00,1.65,17508.0,Greece
545579,22293,HANGING CHICK GREEN DECORATION,24,2011-03-04 08:10:00,1.45,17508.0,Greece
545579,35912B,WHITE/PINK CHICK DECORATION,12,2011-03-04 08:10:00,1.25,17508.0,Greece
545579,22268,EASTER DECORATION SITTING BUNNY,12,2011-03-04 08:10:00,0.85,17508.0,Greece
545579,22289,HANGING METAL CHICKEN DECORATION,24,2011-03-04 08:10:00,1.25,17508.0,Greece
545579,22288,HANGING METAL RABBIT DECORATION,24,2011-03-04 08:10:00,1.25,17508.0,Greece
545579,22266,EASTER DECORATION HANGING BUNNY,24,2011-03-04 08:10:00,0.65,17508.0,Greece
545579,15034,PAPER POCKET TRAVELING FAN ,24,2011-03-04 08:10:00,0.14,17508.0,Greece
545580,20711,JUMBO BAG TOYS ,10,2011-03-04 08:43:00,1.95,13931.0,United Kingdom
545580,21929,JUMBO BAG PINK VINTAGE PAISLEY,10,2011-03-04 08:43:00,1.95,13931.0,United Kingdom
545580,21033,JUMBO BAG CHARLIE AND LOLA TOYS,10,2011-03-04 08:43:00,2.95,13931.0,United Kingdom
545580,85099B,JUMBO BAG RED RETROSPOT,10,2011-03-04 08:43:00,1.95,13931.0,United Kingdom
545580,85099C,JUMBO  BAG BAROQUE BLACK WHITE,10,2011-03-04 08:43:00,1.95,13931.0,United Kingdom
545580,85099F,JUMBO BAG STRAWBERRY,10,2011-03-04 08:43:00,1.95,13931.0,United Kingdom
545580,22661,CHARLOTTE BAG DOLLY GIRL DESIGN,10,2011-03-04 08:43:00,0.85,13931.0,United Kingdom
545580,20719,WOODLAND CHARLOTTE BAG,10,2011-03-04 08:43:00,0.85,13931.0,United Kingdom
545580,20724,RED RETROSPOT CHARLOTTE BAG,10,2011-03-04 08:43:00,0.85,13931.0,United Kingdom
545580,22721,SET OF 3 CAKE TINS SKETCHBOOK,3,2011-03-04 08:43:00,4.95,13931.0,United Kingdom
545580,22993,SET OF 4 PANTRY JELLY MOULDS,12,2011-03-04 08:43:00,1.25,13931.0,United Kingdom
545580,84992,72 SWEETHEART FAIRY CAKE CASES,24,2011-03-04 08:43:00,0.55,13931.0,United Kingdom
545580,21380,WOODEN HAPPY BIRTHDAY GARLAND,6,2011-03-04 08:43:00,2.95,13931.0,United Kingdom
545580,21381,MINI WOODEN HAPPY BIRTHDAY GARLAND,24,2011-03-04 08:43:00,1.69,13931.0,United Kingdom
545580,22499,WOODEN UNION JACK BUNTING,3,2011-03-04 08:43:00,5.95,13931.0,United Kingdom
545580,22668,PINK BABY BUNTING,5,2011-03-04 08:43:00,2.95,13931.0,United Kingdom
545580,21626,VINTAGE UNION JACK PENNANT,12,2011-03-04 08:43:00,1.95,13931.0,United Kingdom
545580,22084,PAPER CHAIN KIT EMPIRE,12,2011-03-04 08:43:00,2.95,13931.0,United Kingdom
545580,22382,LUNCH BAG SPACEBOY DESIGN ,10,2011-03-04 08:43:00,1.65,13931.0,United Kingdom
545580,22383,LUNCH BAG SUKI DESIGN ,10,2011-03-04 08:43:00,1.65,13931.0,United Kingdom
545581,22421,LIPSTICK PEN FUSCHIA,12,2011-03-04 09:03:00,0.42,,United Kingdom
545581,22419,LIPSTICK PEN RED,12,2011-03-04 09:03:00,0.42,,United Kingdom
545581,21109,LARGE CAKE TOWEL CHOCOLATE SPOTS,12,2011-03-04 09:03:00,6.75,,United Kingdom
545581,21110,LARGE CAKE TOWEL PINK SPOTS,12,2011-03-04 09:03:00,6.75,,United Kingdom
545581,21112,SWISS ROLL TOWEL PINK  SPOTS,24,2011-03-04 09:03:00,2.55,,United Kingdom
545581,21111,"SWISS ROLL TOWEL, CHOCOLATE  SPOTS",24,2011-03-04 09:03:00,2.55,,United Kingdom
545581,21108,FAIRY CAKE FLANNEL ASSORTED COLOUR,18,2011-03-04 09:03:00,2.55,,United Kingdom
545581,21107,CREAM SLICE FLANNEL PINK SPOT ,24,2011-03-04 09:03:00,2.55,,United Kingdom
545581,21106,CREAM SLICE FLANNEL CHOCOLATE SPOT ,24,2011-03-04 09:03:00,2.55,,United Kingdom
545581,48138,DOORMAT UNION FLAG,10,2011-03-04 09:03:00,6.75,,United Kingdom
545581,22084,PAPER CHAIN KIT EMPIRE,40,2011-03-04 09:03:00,2.55,,United Kingdom
545581,21586,KINGS CHOICE GIANT TUBE MATCHES,12,2011-03-04 09:03:00,2.55,,United Kingdom
545581,21623,VINTAGE UNION JACK MEMOBOARD,2,2011-03-04 09:03:00,9.95,,United Kingdom
545581,21621,VINTAGE UNION JACK BUNTING,6,2011-03-04 09:03:00,8.5,,United Kingdom
545582,22083,PAPER CHAIN KIT RETROSPOT,40,2011-03-04 09:05:00,2.55,13694.0,United Kingdom
545582,21213,PACK OF 72 SKULL CAKE CASES,120,2011-03-04 09:05:00,0.42,13694.0,United Kingdom
545582,21873,IF YOU CAN'T STAND THE HEAT MUG,72,2011-03-04 09:05:00,1.06,13694.0,United Kingdom
545582,15044D,RED PAPER PARASOL,50,2011-03-04 09:05:00,2.55,13694.0,United Kingdom
545582,15044B,BLUE PAPER PARASOL ,50,2011-03-04 09:05:00,2.55,13694.0,United Kingdom
545582,15044A,PINK PAPER PARASOL ,50,2011-03-04 09:05:00,2.55,13694.0,United Kingdom
545582,15044C,PURPLE PAPER PARASOL,50,2011-03-04 09:05:00,2.55,13694.0,United Kingdom
545582,22367,CHILDRENS APRON SPACEBOY DESIGN,50,2011-03-04 09:05:00,1.65,13694.0,United Kingdom
545582,20676,RED RETROSPOT BOWL,72,2011-03-04 09:05:00,1.06,13694.0,United Kingdom
545582,20754,RETROSPOT RED WASHING UP GLOVES,72,2011-03-04 09:05:00,1.69,13694.0,United Kingdom
545582,20914,SET/5 RED RETROSPOT LID GLASS BOWLS,32,2011-03-04 09:05:00,2.55,13694.0,United Kingdom
545582,21035,SET/2 RED RETROSPOT TEA TOWELS ,100,2011-03-04 09:05:00,2.75,13694.0,United Kingdom
545582,21039,RED RETROSPOT SHOPPING BAG,100,2011-03-04 09:05:00,2.1,13694.0,United Kingdom
545582,21154,RED RETROSPOT OVEN GLOVE ,200,2011-03-04 09:05:00,1.06,13694.0,United Kingdom
545582,21155,RED RETROSPOT PEG BAG,250,2011-03-04 09:05:00,2.1,13694.0,United Kingdom
545582,21156,RETROSPOT CHILDRENS APRON,60,2011-03-04 09:05:00,1.65,13694.0,United Kingdom
545582,21210,SET OF 72 RETROSPOT PAPER  DOILIES,96,2011-03-04 09:05:00,1.25,13694.0,United Kingdom
545582,21212,PACK OF 72 RETROSPOT CAKE CASES,120,2011-03-04 09:05:00,0.42,13694.0,United Kingdom
545582,85014B,RED RETROSPOT UMBRELLA,96,2011-03-04 09:05:00,4.95,13694.0,United Kingdom
545582,79160,HEART SHAPE WIRELESS DOORBELL,48,2011-03-04 09:05:00,1.69,13694.0,United Kingdom
545582,21929,JUMBO BAG PINK VINTAGE PAISLEY,100,2011-03-04 09:05:00,1.65,13694.0,United Kingdom
545582,22384,LUNCH BAG PINK POLKADOT,100,2011-03-04 09:05:00,1.45,13694.0,United Kingdom
545582,21903,MAN FLU METAL SIGN,48,2011-03-04 09:05:00,1.85,13694.0,United Kingdom
545583,85099B,JUMBO BAG RED RETROSPOT,30,2011-03-04 09:08:00,1.95,12553.0,France
545583,21931,JUMBO STORAGE BAG SUKI,10,2011-03-04 09:08:00,1.95,12553.0,France
545583,22139,RETROSPOT TEA SET CERAMIC 11 PC ,3,2011-03-04 09:08:00,4.95,12553.0,France
545583,22617,BAKING SET SPACEBOY DESIGN,3,2011-03-04 09:08:00,4.95,12553.0,France
545583,22138,BAKING SET 9 PIECE RETROSPOT ,3,2011-03-04 09:08:00,4.95,12553.0,France
545583,21891,TRADITIONAL WOODEN SKIPPING ROPE,12,2011-03-04 09:08:00,1.25,12553.0,France
545583,22090,PAPER BUNTING RETROSPOT,6,2011-03-04 09:08:00,2.95,12553.0,France
545583,21731,RED TOADSTOOL LED NIGHT LIGHT,12,2011-03-04 09:08:00,1.65,12553.0,France
545583,21559,STRAWBERRY LUNCH BOX WITH CUTLERY,6,2011-03-04 09:08:00,2.55,12553.0,France
545583,22435,SET OF 9 HEART SHAPED BALLOONS,12,2011-03-04 09:08:00,1.25,12553.0,France
545583,20749,ASSORTED COLOUR MINI CASES,2,2011-03-04 09:08:00,7.95,12553.0,France
545583,20971,PINK BLUE FELT CRAFT TRINKET BOX,12,2011-03-04 09:08:00,1.25,12553.0,France
545583,22749,FELTCRAFT PRINCESS CHARLOTTE DOLL,4,2011-03-04 09:08:00,3.75,12553.0,France
545583,22570,FELTCRAFT CUSHION RABBIT,4,2011-03-04 09:08:00,3.75,12553.0,France
545583,22568,FELTCRAFT CUSHION OWL,4,2011-03-04 09:08:00,3.75,12553.0,France
545583,POST,POSTAGE,2,2011-03-04 09:08:00,18.0,12553.0,France
545584,85135C,RED DRAGONFLY HELICOPTER,1,2011-03-04 09:11:00,7.95,,United Kingdom
545585,22090,PAPER BUNTING RETROSPOT,6,2011-03-04 09:32:00,2.95,12541.0,Spain
545585,21121,SET/10 RED POLKADOT PARTY CANDLES,24,2011-03-04 09:32:00,1.25,12541.0,Spain
545585,21122,SET/10 PINK POLKADOT PARTY CANDLES,24,2011-03-04 09:32:00,1.25,12541.0,Spain
545585,21124,SET/10 BLUE POLKADOT PARTY CANDLES,24,2011-03-04 09:32:00,1.25,12541.0,Spain
545585,21499,BLUE POLKADOT WRAP,25,2011-03-04 09:32:00,0.42,12541.0,Spain
545585,21500,PINK POLKADOT WRAP ,25,2011-03-04 09:32:00,0.42,12541.0,Spain
545585,22381,TOY TIDY PINK POLKADOT,5,2011-03-04 09:32:00,2.1,12541.0,Spain
545585,22386,JUMBO BAG PINK POLKADOT,10,2011-03-04 09:32:00,1.95,12541.0,Spain
545585,21212,PACK OF 72 RETROSPOT CAKE CASES,24,2011-03-04 09:32:00,0.55,12541.0,Spain
545585,22197,SMALL POPCORN HOLDER,36,2011-03-04 09:32:00,0.85,12541.0,Spain
545585,21213,PACK OF 72 SKULL CAKE CASES,24,2011-03-04 09:32:00,0.55,12541.0,Spain
545585,21975,PACK OF 60 DINOSAUR CAKE CASES,24,2011-03-04 09:32:00,0.55,12541.0,Spain
545585,22417,PACK OF 60 SPACEBOY CAKE CASES,24,2011-03-04 09:32:00,0.55,12541.0,Spain
545585,22138,BAKING SET 9 PIECE RETROSPOT ,3,2011-03-04 09:32:00,4.95,12541.0,Spain
545585,22617,BAKING SET SPACEBOY DESIGN,3,2011-03-04 09:32:00,4.95,12541.0,Spain
545585,22955,36 FOIL STAR CAKE CASES ,6,2011-03-04 09:32:00,2.1,12541.0,Spain
545585,POST,POSTAGE,1,2011-03-04 09:32:00,28.0,12541.0,Spain
545586,21455,PAINTED YELLOW WOODEN DAISY,8,2011-03-04 09:44:00,0.85,,United Kingdom
545586,21448,12 DAISY PEGS IN WOOD BOX,1,2011-03-04 09:44:00,1.65,,United Kingdom
545586,21460,GREEN EASTER EGG HUNT START POST,1,2011-03-04 09:44:00,1.95,,United Kingdom
545586,84212,"ASSORTED FLOWER COLOUR ""LEIS""",6,2011-03-04 09:44:00,0.65,,United Kingdom
545586,85186A,EASTER BUNNY GARLAND OF FLOWERS,4,2011-03-04 09:44:00,0.42,,United Kingdom
545586,21562,HAWAIIAN GRASS SKIRT ,3,2011-03-04 09:44:00,1.25,,United Kingdom
545586,22421,LIPSTICK PEN FUSCHIA,2,2011-03-04 09:44:00,0.42,,United Kingdom
545586,22021,BLUE FELT EASTER EGG BASKET,6,2011-03-04 09:44:00,1.65,,United Kingdom
545586,84459B,YELLOW METAL CHICKEN HEART ,4,2011-03-04 09:44:00,1.49,,United Kingdom
545586,85204,HANGING WOOD AND FELT FLOWER,6,2011-03-04 09:44:00,0.42,,United Kingdom
545586,21382,SET/4 SPRING FLOWER DECORATION,2,2011-03-04 09:44:00,2.95,,United Kingdom
545587,21868,POTTING SHED TEA MUG,2,2011-03-04 09:46:00,1.25,14796.0,United Kingdom
545587,21873,IF YOU CAN'T STAND THE HEAT MUG,1,2011-03-04 09:46:00,1.25,14796.0,United Kingdom
545587,37370,RETRO COFFEE MUGS ASSORTED,1,2011-03-04 09:46:00,1.25,14796.0,United Kingdom
545587,21871,SAVE THE PLANET MUG,2,2011-03-04 09:46:00,1.25,14796.0,United Kingdom
545587,21875,KINGS CHOICE MUG,2,2011-03-04 09:46:00,1.25,14796.0,United Kingdom
545587,21877,HOME SWEET HOME MUG,2,2011-03-04 09:46:00,1.25,14796.0,United Kingdom
545587,21870,I CAN ONLY PLEASE ONE PERSON MUG,1,2011-03-04 09:46:00,1.25,14796.0,United Kingdom
545587,21874,GIN AND TONIC MUG,3,2011-03-04 09:46:00,1.25,14796.0,United Kingdom
545587,21870,I CAN ONLY PLEASE ONE PERSON MUG,2,2011-03-04 09:46:00,1.25,14796.0,United Kingdom
545587,21982,PACK OF 12 SUKI TISSUES ,12,2011-03-04 09:46:00,0.29,14796.0,United Kingdom
545587,21981,PACK OF 12 WOODLAND TISSUES ,12,2011-03-04 09:46:00,0.29,14796.0,United Kingdom
545587,22615,PACK OF 12 CIRCUS PARADE TISSUES ,12,2011-03-04 09:46:00,0.29,14796.0,United Kingdom
545587,22614,PACK OF 12 SPACEBOY TISSUES,12,2011-03-04 09:46:00,0.29,14796.0,United Kingdom
545587,22616,PACK OF 12 LONDON TISSUES ,12,2011-03-04 09:46:00,0.29,14796.0,United Kingdom
545587,84380,SET OF 3 BUTTERFLY COOKIE CUTTERS,3,2011-03-04 09:46:00,1.25,14796.0,United Kingdom
545587,21700,BIG DOUGHNUT FRIDGE MAGNETS,5,2011-03-04 09:46:00,0.85,14796.0,United Kingdom
545587,22417,PACK OF 60 SPACEBOY CAKE CASES,1,2011-03-04 09:46:00,0.55,14796.0,United Kingdom
545587,21977,PACK OF 60 PINK PAISLEY CAKE CASES,2,2011-03-04 09:46:00,0.55,14796.0,United Kingdom
545587,21976,PACK OF 60 MUSHROOM CAKE CASES,1,2011-03-04 09:46:00,0.55,14796.0,United Kingdom
545587,21213,PACK OF 72 SKULL CAKE CASES,2,2011-03-04 09:46:00,0.55,14796.0,United Kingdom
545587,84991,60 TEATIME FAIRY CAKE CASES,3,2011-03-04 09:46:00,0.55,14796.0,United Kingdom
545587,22966,GINGERBREAD MAN COOKIE CUTTER,2,2011-03-04 09:46:00,1.25,14796.0,United Kingdom
545587,22063,CERAMIC BOWL WITH STRAWBERRY DESIGN,2,2011-03-04 09:46:00,2.95,14796.0,United Kingdom
545587,22067,CHOC TRUFFLE GOLD TRINKET POT ,2,2011-03-04 09:46:00,1.65,14796.0,United Kingdom
545587,37450,CERAMIC CAKE BOWL + HANGING CAKES,2,2011-03-04 09:46:00,2.95,14796.0,United Kingdom
545587,37446,MINI CAKE STAND WITH HANGING CAKES,3,2011-03-04 09:46:00,1.45,14796.0,United Kingdom
545587,22055,MINI CAKE STAND  HANGING STRAWBERY,2,2011-03-04 09:46:00,1.65,14796.0,United Kingdom
545587,84596E,SMALL LICORICE DES PINK BOWL,2,2011-03-04 09:46:00,1.25,14796.0,United Kingdom
545587,84596B,SMALL DOLLY MIX DESIGN ORANGE BOWL,2,2011-03-04 09:46:00,1.25,14796.0,United Kingdom
545587,84596F,SMALL MARSHMALLOWS PINK BOWL,1,2011-03-04 09:46:00,1.25,14796.0,United Kingdom
545587,84596F,SMALL MARSHMALLOWS PINK BOWL,1,2011-03-04 09:46:00,1.25,14796.0,United Kingdom
545587,84596G,SMALL CHOCOLATES PINK BOWL,1,2011-03-04 09:46:00,1.25,14796.0,United Kingdom
545587,84596L,BISCUITS SMALL BOWL LIGHT BLUE,1,2011-03-04 09:46:00,1.25,14796.0,United Kingdom
545587,21231,SWEETHEART CERAMIC TRINKET BOX,8,2011-03-04 09:46:00,1.25,14796.0,United Kingdom
545587,21232,STRAWBERRY CERAMIC TRINKET BOX,20,2011-03-04 09:46:00,1.25,14796.0,United Kingdom
545587,22890,NOVELTY BISCUITS CAKE STAND 3 TIER,2,2011-03-04 09:46:00,9.95,14796.0,United Kingdom
545587,22059,CERAMIC STRAWBERRY DESIGN MUG,9,2011-03-04 09:46:00,1.49,14796.0,United Kingdom
545587,37448,CERAMIC CAKE DESIGN SPOTTED MUG,8,2011-03-04 09:46:00,1.49,14796.0,United Kingdom
545587,85152,HAND OVER THE CHOCOLATE   SIGN ,4,2011-03-04 09:46:00,2.1,14796.0,United Kingdom
545587,82600,NO SINGING METAL SIGN,3,2011-03-04 09:46:00,2.1,14796.0,United Kingdom
545587,82583,HOT BATHS METAL SIGN,3,2011-03-04 09:46:00,2.1,14796.0,United Kingdom
545587,82582,AREA PATROLLED METAL SIGN,2,2011-03-04 09:46:00,2.1,14796.0,United Kingdom
545587,21165,BEWARE OF THE CAT METAL SIGN ,4,2011-03-04 09:46:00,1.69,14796.0,United Kingdom
545587,21172,PARTY METAL SIGN ,3,2011-03-04 09:46:00,1.45,14796.0,United Kingdom
545587,21166,COOK WITH WINE METAL SIGN ,2,2011-03-04 09:46:00,2.08,14796.0,United Kingdom
545587,21907,I'M ON HOLIDAY METAL SIGN,1,2011-03-04 09:46:00,2.1,14796.0,United Kingdom
545587,21181,PLEASE ONE PERSON METAL SIGN,3,2011-03-04 09:46:00,2.1,14796.0,United Kingdom
545587,21175,GIN + TONIC DIET METAL SIGN,3,2011-03-04 09:46:00,2.55,14796.0,United Kingdom
545587,47503A,ASS FLORAL PRINT MULTI SCREWDRIVER,1,2011-03-04 09:46:00,1.25,14796.0,United Kingdom
545587,84974,S/2 ZINC HEART DESIGN PLANTERS,1,2011-03-04 09:46:00,9.95,14796.0,United Kingdom
545587,47503H,ASS FLORAL PRINT SPIRIT LEVEL ,1,2011-03-04 09:46:00,1.95,14796.0,United Kingdom
545587,37423,WHITE WITH BLACK CATS PLATE,6,2011-03-04 09:46:00,0.85,14796.0,United Kingdom
545587,23178,JAM CLOCK MAGNET,2,2011-03-04 09:46:00,2.89,14796.0,United Kingdom
545587,23180,MUM'S KITCHEN CLOCK,1,2011-03-04 09:46:00,4.95,14796.0,United Kingdom
545587,47580,TEA TIME DES TEA COSY,2,2011-03-04 09:46:00,2.55,14796.0,United Kingdom
545587,21070,VINTAGE BILLBOARD MUG ,2,2011-03-04 09:46:00,1.25,14796.0,United Kingdom
545587,21071,VINTAGE BILLBOARD DRINK ME MUG,2,2011-03-04 09:46:00,1.25,14796.0,United Kingdom
545587,47559B,TEA TIME OVEN GLOVE,7,2011-03-04 09:46:00,1.25,14796.0,United Kingdom
545587,37447,CERAMIC CAKE DESIGN SPOTTED PLATE,4,2011-03-04 09:46:00,1.49,14796.0,United Kingdom
545587,22064,PINK DOUGHNUT TRINKET POT ,4,2011-03-04 09:46:00,1.65,14796.0,United Kingdom
545588,22791,T-LIGHT GLASS FLUTED ANTIQUE,12,2011-03-04 10:03:00,1.25,13382.0,United Kingdom
545588,85053,FRENCH ENAMEL CANDLEHOLDER,6,2011-03-04 10:03:00,2.1,13382.0,United Kingdom
545588,84795B,SUNSET CHECK HAMMOCK,2,2011-03-04 10:03:00,7.95,13382.0,United Kingdom
545588,22487,WHITE WOOD GARDEN PLANT LADDER,1,2011-03-04 10:03:00,9.95,13382.0,United Kingdom
545588,21668,RED STRIPE CERAMIC DRAWER KNOB,12,2011-03-04 10:03:00,1.25,13382.0,United Kingdom
545588,22771,CLEAR DRAWER KNOB ACRYLIC EDWARDIAN,12,2011-03-04 10:03:00,1.25,13382.0,United Kingdom
545588,22772,PINK DRAWER KNOB ACRYLIC EDWARDIAN,12,2011-03-04 10:03:00,1.25,13382.0,United Kingdom
545588,21673,WHITE SPOT BLUE CERAMIC DRAWER KNOB,12,2011-03-04 10:03:00,1.25,13382.0,United Kingdom
545588,22773,GREEN DRAWER KNOB ACRYLIC EDWARDIAN,12,2011-03-04 10:03:00,1.25,13382.0,United Kingdom
545588,22774,RED DRAWER KNOB ACRYLIC EDWARDIAN,12,2011-03-04 10:03:00,1.25,13382.0,United Kingdom
545588,22805,BLUE DRAWER KNOB ACRYLIC EDWARDIAN,12,2011-03-04 10:03:00,1.25,13382.0,United Kingdom
545588,21136,PAINTED METAL PEARS ASSORTED,8,2011-03-04 10:03:00,1.69,13382.0,United Kingdom
545588,84879,ASSORTED COLOUR BIRD ORNAMENT,8,2011-03-04 10:03:00,1.69,13382.0,United Kingdom
545588,21682,LARGE MEDINA STAMPED METAL BOWL ,4,2011-03-04 10:03:00,4.95,13382.0,United Kingdom
545588,85123A,WHITE HANGING HEART T-LIGHT HOLDER,6,2011-03-04 10:03:00,2.95,13382.0,United Kingdom
545589,84755,COLOUR GLASS T-LIGHT HOLDER HANGING,16,2011-03-04 10:21:00,0.65,17001.0,United Kingdom
545589,84945,MULTI COLOUR SILVER T-LIGHT HOLDER,12,2011-03-04 10:21:00,0.85,17001.0,United Kingdom
545589,21051,RIBBONS PURSE ,6,2011-03-04 10:21:00,2.1,17001.0,United Kingdom
545589,22846,BREAD BIN DINER STYLE RED ,2,2011-03-04 10:21:00,16.95,17001.0,United Kingdom
545589,22173,METAL 4 HOOK HANGER FRENCH CHATEAU,8,2011-03-04 10:21:00,2.95,17001.0,United Kingdom
545589,84978,HANGING HEART JAR T-LIGHT HOLDER,12,2011-03-04 10:21:00,1.25,17001.0,United Kingdom
545589,22727,ALARM CLOCK BAKELIKE RED ,4,2011-03-04 10:21:00,3.75,17001.0,United Kingdom
545589,22730,ALARM CLOCK BAKELIKE IVORY,8,2011-03-04 10:21:00,3.75,17001.0,United Kingdom
545589,21668,RED STRIPE CERAMIC DRAWER KNOB,12,2011-03-04 10:21:00,1.25,17001.0,United Kingdom
545589,22467,GUMBALL COAT RACK,6,2011-03-04 10:21:00,2.55,17001.0,United Kingdom
545589,85099B,JUMBO BAG RED RETROSPOT,20,2011-03-04 10:21:00,1.95,17001.0,United Kingdom
545589,21586,KINGS CHOICE GIANT TUBE MATCHES,12,2011-03-04 10:21:00,2.55,17001.0,United Kingdom
545589,21422,PORCELAIN ROSE SMALL,16,2011-03-04 10:21:00,0.85,17001.0,United Kingdom
545589,21928,JUMBO BAG SCANDINAVIAN BLUE PAISLEY,20,2011-03-04 10:21:00,1.95,17001.0,United Kingdom
545589,21634,ASSORTED MINI MADRAS NOTEBOOK,24,2011-03-04 10:21:00,1.25,17001.0,United Kingdom
545590,22254,FELT TOADSTOOL LARGE,12,2011-03-04 10:24:00,1.25,15220.0,United Kingdom
545590,22255,FELT TOADSTOOL  SMALL,12,2011-03-04 10:24:00,0.85,15220.0,United Kingdom
545590,22264,FELT FARM ANIMAL WHITE BUNNY ,12,2011-03-04 10:24:00,0.85,15220.0,United Kingdom
545590,85015,SET OF 12  VINTAGE POSTCARD SET,6,2011-03-04 10:24:00,2.55,15220.0,United Kingdom
545590,21745,GAOLERS KEYS DECORATIVE GARDEN ,4,2011-03-04 10:24:00,3.75,15220.0,United Kingdom
545590,21731,RED TOADSTOOL LED NIGHT LIGHT,12,2011-03-04 10:24:00,1.65,15220.0,United Kingdom
545590,22231,JIGSAW TREE WITH BIRDHOUSE,12,2011-03-04 10:24:00,1.45,15220.0,United Kingdom
545590,84279P,CHERRY BLOSSOM  DECORATIVE FLASK,4,2011-03-04 10:24:00,3.75,15220.0,United Kingdom
545590,85032B,BLOSSOM IMAGES GIFT WRAP SET,6,2011-03-04 10:24:00,2.1,15220.0,United Kingdom
545590,18007,ESSENTIAL BALM 3.5g TIN IN ENVELOPE,24,2011-03-04 10:24:00,0.18,15220.0,United Kingdom
545590,22535,MAGIC DRAWING SLATE BUNNIES ,24,2011-03-04 10:24:00,0.42,15220.0,United Kingdom
545590,21703,BAG 125g SWIRLY MARBLES,12,2011-03-04 10:24:00,0.42,15220.0,United Kingdom
545590,21790,VINTAGE SNAP CARDS,12,2011-03-04 10:24:00,0.85,15220.0,United Kingdom
545590,21892,TRADITIONAL WOODEN CATCH CUP GAME ,12,2011-03-04 10:24:00,1.25,15220.0,United Kingdom
545590,22619,SET OF 6 SOLDIER SKITTLES,4,2011-03-04 10:24:00,3.75,15220.0,United Kingdom
545590,22620,4 TRADITIONAL SPINNING TOPS,12,2011-03-04 10:24:00,1.25,15220.0,United Kingdom
545590,22148,EASTER CRAFT 4 CHICKS ,12,2011-03-04 10:24:00,1.95,15220.0,United Kingdom
545590,22858,EASTER TIN KEEPSAKE,6,2011-03-04 10:24:00,1.65,15220.0,United Kingdom
545590,22957,SET 3 PAPER VINTAGE CHICK PAPER EGG,6,2011-03-04 10:24:00,2.95,15220.0,United Kingdom
545590,22654,DELUXE SEWING KIT ,3,2011-03-04 10:24:00,5.95,15220.0,United Kingdom
545590,85177,BASKET OF FLOWERS SEWING KIT,12,2011-03-04 10:24:00,0.85,15220.0,United Kingdom
545590,84077,WORLD WAR 2 GLIDERS ASSTD DESIGNS,48,2011-03-04 10:24:00,0.29,15220.0,United Kingdom
545590,23193,BUFFALO BILL TREASURE BOOK BOX,8,2011-03-04 10:24:00,2.25,15220.0,United Kingdom
545591,20723,STRAWBERRY CHARLOTTE BAG,10,2011-03-04 10:28:00,0.85,17581.0,United Kingdom
545591,20724,RED RETROSPOT CHARLOTTE BAG,10,2011-03-04 10:28:00,0.85,17581.0,United Kingdom
545591,20717,STRAWBERRY SHOPPER BAG,10,2011-03-04 10:28:00,1.25,17581.0,United Kingdom
545591,20718,RED RETROSPOT SHOPPER BAG,10,2011-03-04 10:28:00,1.25,17581.0,United Kingdom
545591,20716,PARTY FOOD SHOPPER BAG,10,2011-03-04 10:28:00,1.25,17581.0,United Kingdom
545591,22383,LUNCH BAG SUKI DESIGN ,10,2011-03-04 10:28:00,1.65,17581.0,United Kingdom
545591,22662,LUNCH BAG DOLLY GIRL DESIGN,10,2011-03-04 10:28:00,1.65,17581.0,United Kingdom
545591,21035,SET/2 RED RETROSPOT TEA TOWELS ,6,2011-03-04 10:28:00,3.25,17581.0,United Kingdom
545591,22197,SMALL POPCORN HOLDER,24,2011-03-04 10:28:00,0.85,17581.0,United Kingdom
545591,20725,LUNCH BAG RED RETROSPOT,10,2011-03-04 10:28:00,1.65,17581.0,United Kingdom
545591,20712,JUMBO BAG WOODLAND ANIMALS,10,2011-03-04 10:28:00,1.95,17581.0,United Kingdom
545591,20713,JUMBO BAG OWLS,10,2011-03-04 10:28:00,1.95,17581.0,United Kingdom
545591,21929,JUMBO BAG PINK VINTAGE PAISLEY,10,2011-03-04 10:28:00,1.95,17581.0,United Kingdom
545591,22379,RECYCLING BAG RETROSPOT ,5,2011-03-04 10:28:00,2.1,17581.0,United Kingdom
545591,85099B,JUMBO BAG RED RETROSPOT,20,2011-03-04 10:28:00,1.95,17581.0,United Kingdom
545591,85099F,JUMBO BAG STRAWBERRY,20,2011-03-04 10:28:00,1.95,17581.0,United Kingdom
545591,22381,TOY TIDY PINK POLKADOT,5,2011-03-04 10:28:00,2.1,17581.0,United Kingdom
545591,22411,JUMBO SHOPPER VINTAGE RED PAISLEY,10,2011-03-04 10:28:00,1.95,17581.0,United Kingdom
545591,22356,CHARLOTTE BAG PINK POLKADOT,10,2011-03-04 10:28:00,0.85,17581.0,United Kingdom
545591,22661,CHARLOTTE BAG DOLLY GIRL DESIGN,10,2011-03-04 10:28:00,0.85,17581.0,United Kingdom
545591,22664,TOY TIDY DOLLY GIRL DESIGN,5,2011-03-04 10:28:00,2.1,17581.0,United Kingdom
545591,20719,WOODLAND CHARLOTTE BAG,10,2011-03-04 10:28:00,0.85,17581.0,United Kingdom
545592,22989,SET 2 PANTRY DESIGN TEA TOWELS,6,2011-03-04 10:30:00,2.95,17581.0,United Kingdom
545592,22993,SET OF 4 PANTRY JELLY MOULDS,12,2011-03-04 10:30:00,1.25,17581.0,United Kingdom
545592,22722,SET OF 6 SPICE TINS PANTRY DESIGN,4,2011-03-04 10:30:00,3.95,17581.0,United Kingdom
545592,22720,SET OF 3 CAKE TINS PANTRY DESIGN ,3,2011-03-04 10:30:00,4.95,17581.0,United Kingdom
545592,84375,SET OF 20 KIDS COOKIE CUTTERS,12,2011-03-04 10:30:00,2.1,17581.0,United Kingdom
545592,22978,PANTRY ROLLING PIN,6,2011-03-04 10:30:00,3.75,17581.0,United Kingdom
545592,22980,PANTRY SCRUBBING BRUSH,12,2011-03-04 10:30:00,1.65,17581.0,United Kingdom
545592,22911,PAPER CHAIN KIT LONDON,6,2011-03-04 10:30:00,2.95,17581.0,United Kingdom
545592,22992,REVOLVER WOODEN RULER ,12,2011-03-04 10:30:00,1.95,17581.0,United Kingdom
545592,48194,DOORMAT HEARTS,5,2011-03-04 10:30:00,7.95,17581.0,United Kingdom
545592,48187,DOORMAT NEW ENGLAND,5,2011-03-04 10:30:00,7.95,17581.0,United Kingdom
545592,22932,BAKING MOULD TOFFEE CUP CHOCOLATE,6,2011-03-04 10:30:00,2.55,17581.0,United Kingdom
545592,22931,BAKING MOULD HEART WHITE CHOCOLATE,6,2011-03-04 10:30:00,2.55,17581.0,United Kingdom
545592,22933,BAKING MOULD EASTER EGG MILK CHOC,6,2011-03-04 10:30:00,2.95,17581.0,United Kingdom
545592,22936,BAKING MOULD ROSE WHITE CHOCOLATE,6,2011-03-04 10:30:00,3.25,17581.0,United Kingdom
545592,22937,BAKING MOULD CHOCOLATE CUPCAKES,6,2011-03-04 10:30:00,2.55,17581.0,United Kingdom
545592,22967,SET 3 SONG BIRD PAPER EGGS ASSORTED,6,2011-03-04 10:30:00,2.95,17581.0,United Kingdom
545592,22957,SET 3 PAPER VINTAGE CHICK PAPER EGG,6,2011-03-04 10:30:00,2.95,17581.0,United Kingdom
545593,22776,SWEETHEART CAKESTAND 3 TIER,2,2011-03-04 10:31:00,9.95,17581.0,United Kingdom
545593,22727,ALARM CLOCK BAKELIKE RED ,4,2011-03-04 10:31:00,3.75,17581.0,United Kingdom
545593,48138,DOORMAT UNION FLAG,10,2011-03-04 10:31:00,6.75,17581.0,United Kingdom
545595,M,Manual,1,2011-03-04 10:39:00,0.85,14570.0,United Kingdom
545595,84536B,FAIRY CAKES NOTEBOOK A7 SIZE,12,2011-03-04 10:39:00,0.42,14570.0,United Kingdom
545595,22665,RECIPE BOX BLUE SKETCHBOOK DESIGN,3,2011-03-04 10:39:00,2.95,14570.0,United Kingdom
545595,22414,DOORMAT NEIGHBOURHOOD WITCH ,1,2011-03-04 10:39:00,7.95,14570.0,United Kingdom
545595,21738,COSY SLIPPER SHOES SMALL  RED ,1,2011-03-04 10:39:00,2.95,14570.0,United Kingdom
545595,21983,PACK OF 12 BLUE PAISLEY TISSUES ,12,2011-03-04 10:39:00,0.29,14570.0,United Kingdom
545595,22311,OFFICE MUG WARMER BLACK+SILVER ,1,2011-03-04 10:39:00,2.95,14570.0,United Kingdom
545595,20666,ECONOMY HOLIDAY PURSE,1,2011-03-04 10:39:00,2.95,14570.0,United Kingdom
545595,21986,PACK OF 12 PINK POLKADOT TISSUES,12,2011-03-04 10:39:00,0.29,14570.0,United Kingdom
545595,20686,DOLLY MIXTURE CHILDREN'S UMBRELLA,2,2011-03-04 10:39:00,3.25,14570.0,United Kingdom
