InvoiceNo,StockCode,Description,Quantity,InvoiceDate,UnitPrice,CustomerID,Country
545663,15060B,FAIRY CAKE DESIGN UMBRELLA,4,2011-03-04 14:52:00,3.75,13491.0,United Kingdom
545663,21892,TRADITIONAL WOODEN CATCH CUP GAME ,12,2011-03-04 14:52:00,1.25,13491.0,United Kingdom
545663,17084P,DRAGONS BLOOD INCENSE,25,2011-03-04 14:52:00,0.21,13491.0,United Kingdom
545663,17084N,FAIRY DREAMS INCENSE ,25,2011-03-04 14:52:00,0.21,13491.0,United Kingdom
545663,79321,CHILLI LIGHTS,4,2011-03-04 14:52:00,5.75,13491.0,United Kingdom
545663,22646,CERAMIC STRAWBERRY CAKE MONEY BANK,12,2011-03-04 14:52:00,1.45,13491.0,United Kingdom
545663,22494,EMERGENCY FIRST AID TIN ,12,2011-03-04 14:52:00,1.25,13491.0,United Kingdom
545663,22268,EASTER DECORATION SITTING BUNNY,12,2011-03-04 14:52:00,0.85,13491.0,United Kingdom
545663,21829,DINOSAUR KEYRINGS ASSORTED,36,2011-03-04 14:52:00,0.21,13491.0,United Kingdom
545663,37448,CERAMIC CAKE DESIGN SPOTTED MUG,12,2011-03-04 14:52:00,1.49,13491.0,United Kingdom
545664,21754,HOME BUILDING BLOCK WORD,3,2011-03-04 15:15:00,5.95,12584.0,Italy
545664,21260,FIRST AID TIN,6,2011-03-04 15:15:00,3.25,12584.0,Italy
545664,22848,BREAD BIN DINER STYLE PINK,1,2011-03-04 15:15:00,16.95,12584.0,Italy
545664,84849B,FAIRY SOAP SOAP HOLDER,12,2011-03-04 15:15:00,1.69,12584.0,Italy
545664,21624,VINTAGE UNION JACK DOORSTOP,3,2011-03-04 15:15:00,5.95,12584.0,Italy
545664,21623,VINTAGE UNION JACK MEMOBOARD,2,2011-03-04 15:15:00,9.95,12584.0,Italy
545664,48138,DOORMAT UNION FLAG,2,2011-03-04 15:15:00,7.95,12584.0,Italy
545664,21622,VINTAGE UNION JACK CUSHION COVER,12,2011-03-04 15:15:00,4.95,12584.0,Italy
545664,21524,DOORMAT SPOTTY HOME SWEET HOME,2,2011-03-04 15:15:00,7.95,12584.0,Italy
545664,22366,DOORMAT AIRMAIL ,2,2011-03-04 15:15:00,7.95,12584.0,Italy
545664,22692,DOORMAT WELCOME TO OUR HOME,2,2011-03-04 15:15:00,7.95,12584.0,Italy
545664,22722,SET OF 6 SPICE TINS PANTRY DESIGN,8,2011-03-04 15:15:00,3.95,12584.0,Italy
545664,22720,SET OF 3 CAKE TINS PANTRY DESIGN ,6,2011-03-04 15:15:00,4.95,12584.0,Italy
545664,21756,BATH BUILDING BLOCK WORD,3,2011-03-04 15:15:00,5.95,12584.0,Italy
545664,22667,RECIPE BOX RETROSPOT ,12,2011-03-04 15:15:00,2.95,12584.0,Italy
545664,21217,RED RETROSPOT ROUND CAKE TINS,1,2011-03-04 15:15:00,9.95,12584.0,Italy
545664,21216,"SET 3 RETROSPOT TEA,COFFEE,SUGAR",4,2011-03-04 15:15:00,4.95,12584.0,Italy
545664,POST,POSTAGE,3,2011-03-04 15:15:00,28.0,12584.0,Italy
545665,21386,IVORY HANGING DECORATION  EGG,12,2011-03-04 15:20:00,0.85,17535.0,United Kingdom
545665,21389,IVORY HANGING DECORATION  BIRD,12,2011-03-04 15:20:00,0.85,17535.0,United Kingdom
545665,22214,CANDLE PLATE LACE WHITE,6,2011-03-04 15:20:00,2.55,17535.0,United Kingdom
545665,84978,HANGING HEART JAR T-LIGHT HOLDER,12,2011-03-04 15:20:00,1.25,17535.0,United Kingdom
545665,84755,COLOUR GLASS T-LIGHT HOLDER HANGING,16,2011-03-04 15:20:00,0.65,17535.0,United Kingdom
545665,21739,COSY SLIPPER SHOES SMALL GREEN,6,2011-03-04 15:20:00,2.95,17535.0,United Kingdom
545665,22262,FELT EGG COSY CHICKEN,12,2011-03-04 15:20:00,0.85,17535.0,United Kingdom
545665,85093,CANDY SPOT EGG WARMER HARE,12,2011-03-04 15:20:00,1.25,17535.0,United Kingdom
545665,22525,CHILDRENS GARDEN GLOVES PINK,10,2011-03-04 15:20:00,1.25,17535.0,United Kingdom
545665,22521,CHILDS GARDEN TROWEL PINK,12,2011-03-04 15:20:00,0.85,17535.0,United Kingdom
545665,20847,ZINC HEART LATTICE CHARGER LARGE,4,2011-03-04 15:20:00,3.75,17535.0,United Kingdom
545665,22524,CHILDRENS GARDEN GLOVES BLUE,10,2011-03-04 15:20:00,1.25,17535.0,United Kingdom
545665,22522,CHILDS GARDEN FORK BLUE ,12,2011-03-04 15:20:00,0.85,17535.0,United Kingdom
545666,37468,,67,2011-03-04 15:33:00,0.0,,United Kingdom
545667,84692,BOX OF 24 COCKTAIL PARASOLS,2,2011-03-04 16:07:00,0.83,,United Kingdom
545667,84796A,PINK HAWAIIAN PICNIC HAMPER FOR 2,1,2011-03-04 16:07:00,8.29,,United Kingdom
545667,84796B,BLUE SAVANNAH PICNIC HAMPER FOR 2,2,2011-03-04 16:07:00,8.29,,United Kingdom
545667,84913B,MINT GREEN ROSE TOWEL,1,2011-03-04 16:07:00,3.29,,United Kingdom
545667,84923,PINK BUTTERFLY HANDBAG W BOBBLES,1,2011-03-04 16:07:00,4.13,,United Kingdom
545667,84946,ANTIQUE SILVER TEA GLASS ETCHED,10,2011-03-04 16:07:00,2.46,,United Kingdom
545667,84969,BOX OF 6 ASSORTED COLOUR TEASPOONS,4,2011-03-04 16:07:00,3.29,,United Kingdom
545667,85016,SET OF 6 VINTAGE NOTELETS KIT,1,2011-03-04 16:07:00,2.46,,United Kingdom
545667,85017B,ENVELOPE 50 BLOSSOM IMAGES,1,2011-03-04 16:07:00,0.83,,United Kingdom
545667,85039A,SET/4 RED MINI ROSE CANDLE IN BOWL,1,2011-03-04 16:07:00,1.63,,United Kingdom
545667,85039B,S/4 IVORY MINI ROSE CANDLE IN BOWL,1,2011-03-04 16:07:00,1.63,,United Kingdom
545667,85039C,S/4 BLACK MINI ROSE CANDLE IN BOWL,1,2011-03-04 16:07:00,1.63,,United Kingdom
545667,85040A,S/4 PINK FLOWER CANDLES IN BOWL,2,2011-03-04 16:07:00,3.29,,United Kingdom
545667,85099F,JUMBO BAG STRAWBERRY,1,2011-03-04 16:07:00,4.13,,United Kingdom
545667,85116,BLACK CANDELABRA T-LIGHT HOLDER,1,2011-03-04 16:07:00,1.63,,United Kingdom
545667,85130D,BEADED CRYSTAL HEART PINK LARGE,1,2011-03-04 16:07:00,3.29,,United Kingdom
545667,85131B,BEADED CRYSTAL HEART GREEN ON STICK,1,2011-03-04 16:07:00,0.83,,United Kingdom
545667,85131D,BEADED CRYSTAL HEART PINK ON STICK,1,2011-03-04 16:07:00,0.83,,United Kingdom
545667,85150,LADIES & GENTLEMEN METAL SIGN,2,2011-03-04 16:07:00,4.96,,United Kingdom
545667,85169B,BLACK LOVE BIRD CANDLE,1,2011-03-04 16:07:00,2.46,,United Kingdom
545667,85186C,BUNNY EGG GARLAND,1,2011-03-04 16:07:00,0.83,,United Kingdom
545667,85187,S/12 MINI RABBIT EASTER,1,2011-03-04 16:07:00,3.29,,United Kingdom
545667,85204,HANGING WOOD AND FELT FLOWER,1,2011-03-04 16:07:00,0.42,,United Kingdom
545667,90161A,ANT COPPER RED BOUDICCA BRACELET,1,2011-03-04 16:07:00,4.98,,United Kingdom
545667,90184C,BLACK CHUNKY BEAD BRACELET W STRAP,1,2011-03-04 16:07:00,9.15,,United Kingdom
545667,DOT,DOTCOM POSTAGE,1,2011-03-04 16:07:00,176.48,,United Kingdom
545667,22423,REGENCY CAKESTAND 3 TIER,1,2011-03-04 16:07:00,12.75,,United Kingdom
545667,21843,RED RETROSPOT CAKE STAND,4,2011-03-04 16:07:00,10.95,,United Kingdom
545667,15036,ASSORTED COLOURS SILK FAN,30,2011-03-04 16:07:00,1.63,,United Kingdom
545667,15044C,PURPLE PAPER PARASOL,1,2011-03-04 16:07:00,5.79,,United Kingdom
545667,15056N,EDWARDIAN PARASOL NATURAL,1,2011-03-04 16:07:00,12.46,,United Kingdom
545667,15058B,PINK POLKADOT GARDEN PARASOL,1,2011-03-04 16:07:00,24.96,,United Kingdom
545667,17084N,FAIRY DREAMS INCENSE ,1,2011-03-04 16:07:00,0.42,,United Kingdom
545667,20619,TROPICAL PASSPORT COVER ,11,2011-03-04 16:07:00,1.63,,United Kingdom
545667,20707,CRAZY DAISY HEART DECORATION,2,2011-03-04 16:07:00,0.83,,United Kingdom
545667,20713,JUMBO BAG OWLS,1,2011-03-04 16:07:00,4.13,,United Kingdom
545667,20718,RED RETROSPOT SHOPPER BAG,1,2011-03-04 16:07:00,2.46,,United Kingdom
545667,20724,RED RETROSPOT CHARLOTTE BAG,2,2011-03-04 16:07:00,1.63,,United Kingdom
545667,20733,GOLD MINI TAPE MEASURE ,1,2011-03-04 16:07:00,0.83,,United Kingdom
545667,20735,BLACK MINI TAPE MEASURE ,2,2011-03-04 16:07:00,0.83,,United Kingdom
545667,20902,VINTAGE KEEPSAKE BOX PARIS DAYS,1,2011-03-04 16:07:00,12.46,,United Kingdom
545667,20971,PINK BLUE FELT CRAFT TRINKET BOX,1,2011-03-04 16:07:00,2.46,,United Kingdom
545667,21035,SET/2 RED RETROSPOT TEA TOWELS ,1,2011-03-04 16:07:00,6.63,,United Kingdom
545667,21068,VINTAGE BILLBOARD LOVE/HATE MUG,1,2011-03-04 16:07:00,2.46,,United Kingdom
545667,21069,VINTAGE BILLBOARD TEA MUG,1,2011-03-04 16:07:00,2.46,,United Kingdom
545667,21070,VINTAGE BILLBOARD MUG ,1,2011-03-04 16:07:00,2.46,,United Kingdom
545667,21071,VINTAGE BILLBOARD DRINK ME MUG,1,2011-03-04 16:07:00,2.46,,United Kingdom
545667,21154,RED RETROSPOT OVEN GLOVE ,1,2011-03-04 16:07:00,2.46,,United Kingdom
545667,21155,RED RETROSPOT PEG BAG,1,2011-03-04 16:07:00,4.96,,United Kingdom
545667,21165,BEWARE OF THE CAT METAL SIGN ,1,2011-03-04 16:07:00,4.13,,United Kingdom
545667,21167,WHITE SAGE INCENSE,1,2011-03-04 16:07:00,0.42,,United Kingdom
545667,21174,POTTERING IN THE SHED METAL SIGN,1,2011-03-04 16:07:00,4.13,,United Kingdom
545667,21179,NO JUNK MAIL METAL SIGN,2,2011-03-04 16:07:00,1.63,,United Kingdom
545667,21195,PINK  HONEYCOMB PAPER BALL ,2,2011-03-04 16:07:00,4.13,,United Kingdom
545667,21208,PASTEL COLOUR HONEYCOMB FAN,3,2011-03-04 16:07:00,3.29,,United Kingdom
545667,21212,PACK OF 72 RETROSPOT CAKE CASES,1,2011-03-04 16:07:00,1.25,,United Kingdom
545667,21288,STRIPEY CHOCOLATE NESTING BOXES,3,2011-03-04 16:07:00,3.29,,United Kingdom
545667,21289,LARGE STRIPES CHOCOLATE GIFT BAG,1,2011-03-04 16:07:00,1.25,,United Kingdom
545667,21380,WOODEN HAPPY BIRTHDAY GARLAND,1,2011-03-04 16:07:00,5.79,,United Kingdom
545667,21385,IVORY HANGING DECORATION  HEART,1,2011-03-04 16:07:00,1.63,,United Kingdom
545667,21386,IVORY HANGING DECORATION  EGG,1,2011-03-04 16:07:00,1.63,,United Kingdom
545667,21454,PAINTED PINK RABBIT ,2,2011-03-04 16:07:00,0.83,,United Kingdom
545667,21455,PAINTED YELLOW WOODEN DAISY,2,2011-03-04 16:07:00,0.83,,United Kingdom
545667,21506,"FANCY FONT BIRTHDAY CARD, ",1,2011-03-04 16:07:00,0.83,,United Kingdom
545667,21507,"ELEPHANT, BIRTHDAY CARD, ",1,2011-03-04 16:07:00,0.83,,United Kingdom
545667,21559,STRAWBERRY LUNCH BOX WITH CUTLERY,1,2011-03-04 16:07:00,4.96,,United Kingdom
545667,21658,GLASS  BEURRE DISH,1,2011-03-04 16:07:00,8.29,,United Kingdom
545667,21669,BLUE STRIPE CERAMIC DRAWER KNOB,8,2011-03-04 16:07:00,3.33,,United Kingdom
545667,21731,RED TOADSTOOL LED NIGHT LIGHT,1,2011-03-04 16:07:00,3.29,,United Kingdom
545667,21754,HOME BUILDING BLOCK WORD,1,2011-03-04 16:07:00,11.63,,United Kingdom
545667,21755,LOVE BUILDING BLOCK WORD,1,2011-03-04 16:07:00,11.63,,United Kingdom
545667,21773,DECORATIVE ROSE BATHROOM BOTTLE,4,2011-03-04 16:07:00,2.46,,United Kingdom
545667,21774,DECORATIVE CATS BATHROOM BOTTLE,3,2011-03-04 16:07:00,2.46,,United Kingdom
545667,21790,VINTAGE SNAP CARDS,1,2011-03-04 16:07:00,1.63,,United Kingdom
545667,21811,HANGING HEART WITH BELL,1,2011-03-04 16:07:00,2.46,,United Kingdom
545667,21874,GIN AND TONIC MUG,1,2011-03-04 16:07:00,3.29,,United Kingdom
545667,21905,MORE BUTTER METAL SIGN ,2,2011-03-04 16:07:00,1.63,,United Kingdom
545667,21935,SUKI  SHOULDER BAG,1,2011-03-04 16:07:00,3.29,,United Kingdom
545667,21974,SET OF 36 PAISLEY FLOWER DOILIES,2,2011-03-04 16:07:00,2.92,,United Kingdom
545667,21977,PACK OF 60 PINK PAISLEY CAKE CASES,1,2011-03-04 16:07:00,1.25,,United Kingdom
545667,21992,VINTAGE PAISLEY STATIONERY SET,1,2011-03-04 16:07:00,2.46,,United Kingdom
545667,21993,FLORAL FOLK STATIONERY SET,1,2011-03-04 16:07:00,2.46,,United Kingdom
545667,22023,EMPIRE BIRTHDAY CARD,2,2011-03-04 16:07:00,0.83,,United Kingdom
545667,22026,BANQUET BIRTHDAY  CARD  ,1,2011-03-04 16:07:00,0.83,,United Kingdom
545667,22029,SPACEBOY BIRTHDAY CARD,1,2011-03-04 16:07:00,0.83,,United Kingdom
545667,22037,ROBOT BIRTHDAY CARD,1,2011-03-04 16:07:00,0.83,,United Kingdom
545667,22084,PAPER CHAIN KIT EMPIRE,1,2011-03-04 16:07:00,5.79,,United Kingdom
545667,22110,BIRD HOUSE HOT WATER BOTTLE,1,2011-03-04 16:07:00,7.46,,United Kingdom
545667,22116,METAL SIGN HIS DINNER IS SERVED,1,2011-03-04 16:07:00,1.63,,United Kingdom
545667,22138,BAKING SET 9 PIECE RETROSPOT ,1,2011-03-04 16:07:00,10.79,,United Kingdom
545667,22171,3 HOOK PHOTO SHELF ANTIQUE WHITE,1,2011-03-04 16:07:00,16.63,,United Kingdom
545667,22174,PHOTO CUBE,1,2011-03-04 16:07:00,3.29,,United Kingdom
545667,22178,VICTORIAN GLASS HANGING T-LIGHT,1,2011-03-04 16:07:00,2.46,,United Kingdom
545667,22183,CAKE STAND VICTORIAN FILIGREE MED,2,2011-03-04 16:07:00,5.79,,United Kingdom
545667,22219,LOVEBIRD HANGING DECORATION WHITE ,3,2011-03-04 16:07:00,1.63,,United Kingdom
545667,22227,HANGING HEART MIRROR DECORATION ,2,2011-03-04 16:07:00,1.25,,United Kingdom
545667,22233,JIGSAW RABBIT AND BIRDHOUSE,1,2011-03-04 16:07:00,3.29,,United Kingdom
545667,22241,GARLAND WOODEN HAPPY EASTER,1,2011-03-04 16:07:00,2.46,,United Kingdom
545667,22247,BUNNY DECORATION MAGIC GARDEN,1,2011-03-04 16:07:00,1.63,,United Kingdom
545667,22249,DECORATION WHITE CHICK MAGIC GARDEN,1,2011-03-04 16:07:00,1.63,,United Kingdom
545667,22251,BIRDHOUSE DECORATION MAGIC GARDEN,1,2011-03-04 16:07:00,2.46,,United Kingdom
545667,22283,6 EGG HOUSE PAINTED WOOD,1,2011-03-04 16:07:00,15.79,,United Kingdom
545667,22286,"DECORATION , WOBBLY RABBIT , METAL ",1,2011-03-04 16:07:00,3.29,,United Kingdom
545667,22294,HEART FILIGREE DOVE  SMALL,1,2011-03-04 16:07:00,2.46,,United Kingdom
545667,22296,HEART IVORY TRELLIS LARGE,2,2011-03-04 16:07:00,3.29,,United Kingdom
545667,22328,ROUND SNACK BOXES SET OF 4 FRUITS ,1,2011-03-04 16:07:00,5.79,,United Kingdom
545667,22335,HEART DECORATION PAINTED ZINC ,1,2011-03-04 16:07:00,1.25,,United Kingdom
545667,22342,HOME GARLAND PAINTED ZINC ,1,2011-03-04 16:07:00,3.29,,United Kingdom
545667,22355,CHARLOTTE BAG SUKI DESIGN,2,2011-03-04 16:07:00,1.63,,United Kingdom
545667,22356,CHARLOTTE BAG PINK POLKADOT,1,2011-03-04 16:07:00,1.63,,United Kingdom
545667,22360,GLASS JAR ENGLISH CONFECTIONERY,1,2011-03-04 16:07:00,5.79,,United Kingdom
545667,22361,GLASS JAR DAISY FRESH COTTON WOOL,1,2011-03-04 16:07:00,5.79,,United Kingdom
545667,22364,GLASS JAR DIGESTIVE BISCUITS,1,2011-03-04 16:07:00,5.79,,United Kingdom
545667,22367,CHILDRENS APRON SPACEBOY DESIGN,1,2011-03-04 16:07:00,4.13,,United Kingdom
545667,22378,WALL TIDY RETROSPOT ,1,2011-03-04 16:07:00,4.13,,United Kingdom
545667,22456,NATURAL SLATE CHALKBOARD LARGE ,3,2011-03-04 16:07:00,9.96,,United Kingdom
545667,22457,NATURAL SLATE HEART CHALKBOARD ,1,2011-03-04 16:07:00,5.79,,United Kingdom
545667,22464,HANGING METAL HEART LANTERN,1,2011-03-04 16:07:00,3.29,,United Kingdom
545667,22469,HEART OF WICKER SMALL,4,2011-03-04 16:07:00,1.65,,United Kingdom
545667,22470,HEART OF WICKER LARGE,1,2011-03-04 16:07:00,2.95,,United Kingdom
545667,22582,PACK OF 6 SWEETIE GIFT BOXES,1,2011-03-04 16:07:00,4.96,,United Kingdom
545667,22583,PACK OF 6 HANDBAG GIFT BOXES,1,2011-03-04 16:07:00,4.96,,United Kingdom
545667,22610,PENS ASSORTED FUNNY FACE,1,2011-03-04 16:07:00,1.63,,United Kingdom
545667,22661,CHARLOTTE BAG DOLLY GIRL DESIGN,2,2011-03-04 16:07:00,1.63,,United Kingdom
545667,22663,JUMBO BAG DOLLY GIRL DESIGN,1,2011-03-04 16:07:00,4.13,,United Kingdom
545667,22681,FRENCH BLUE METAL DOOR SIGN 6,1,2011-03-04 16:07:00,2.46,,United Kingdom
545667,22686,FRENCH BLUE METAL DOOR SIGN No,1,2011-03-04 16:07:00,2.46,,United Kingdom
545667,22692,DOORMAT WELCOME TO OUR HOME,1,2011-03-04 16:07:00,15.79,,United Kingdom
545667,22697,GREEN REGENCY TEACUP AND SAUCER,4,2011-03-04 16:07:00,5.79,,United Kingdom
545667,22698,PINK REGENCY TEACUP AND SAUCER,4,2011-03-04 16:07:00,5.79,,United Kingdom
545667,22699,ROSES REGENCY TEACUP AND SAUCER ,2,2011-03-04 16:07:00,5.79,,United Kingdom
545667,22716,CARD CIRCUS PARADE,1,2011-03-04 16:07:00,0.83,,United Kingdom
545667,22717,CARD DOG AND BALL ,1,2011-03-04 16:07:00,0.83,,United Kingdom
545667,22718,CARD CAT AND TREE ,1,2011-03-04 16:07:00,0.83,,United Kingdom
545667,22720,SET OF 3 CAKE TINS PANTRY DESIGN ,1,2011-03-04 16:07:00,10.79,,United Kingdom
545667,22722,SET OF 6 SPICE TINS PANTRY DESIGN,1,2011-03-04 16:07:00,8.29,,United Kingdom
545667,22726,ALARM CLOCK BAKELIKE GREEN,1,2011-03-04 16:07:00,7.46,,United Kingdom
545667,22745,POPPY'S PLAYHOUSE BEDROOM ,3,2011-03-04 16:07:00,4.13,,United Kingdom
545667,22746,POPPY'S PLAYHOUSE LIVINGROOM ,4,2011-03-04 16:07:00,4.13,,United Kingdom
545667,22748,POPPY'S PLAYHOUSE KITCHEN,3,2011-03-04 16:07:00,4.13,,United Kingdom
545667,22771,CLEAR DRAWER KNOB ACRYLIC EDWARDIAN,11,2011-03-04 16:07:00,2.5,,United Kingdom
545667,22772,PINK DRAWER KNOB ACRYLIC EDWARDIAN,3,2011-03-04 16:07:00,2.5,,United Kingdom
545667,22774,RED DRAWER KNOB ACRYLIC EDWARDIAN,3,2011-03-04 16:07:00,2.5,,United Kingdom
545667,22775,PURPLE DRAWERKNOB ACRYLIC EDWARDIAN,3,2011-03-04 16:07:00,2.5,,United Kingdom
545667,22805,BLUE DRAWER KNOB ACRYLIC EDWARDIAN,3,2011-03-04 16:07:00,2.5,,United Kingdom
545667,22813,PACK 3 BOXES BIRD PANNETONE ,1,2011-03-04 16:07:00,4.13,,United Kingdom
545667,22819,"BIRTHDAY CARD, RETRO SPOT",2,2011-03-04 16:07:00,0.83,,United Kingdom
545667,22837,HOT WATER BOTTLE BABUSHKA ,1,2011-03-04 16:07:00,9.13,,United Kingdom
545667,22851,SET 20 NAPKINS FAIRY CAKES DESIGN ,1,2011-03-04 16:07:00,1.63,,United Kingdom
545667,22869,NUMBER TILE COTTAGE GARDEN 1,1,2011-03-04 16:07:00,4.13,,United Kingdom
545667,22872,NUMBER TILE COTTAGE GARDEN 4,1,2011-03-04 16:07:00,4.13,,United Kingdom
545667,22893,MINI CAKE STAND T-LIGHT HOLDER,1,2011-03-04 16:07:00,0.83,,United Kingdom
545667,22939,APRON APPLE DELIGHT,1,2011-03-04 16:07:00,10.79,,United Kingdom
545667,22960,JAM MAKING SET WITH JARS,1,2011-03-04 16:07:00,8.29,,United Kingdom
545667,22972,CHILDREN'S SPACEBOY MUG,2,2011-03-04 16:07:00,3.29,,United Kingdom
545667,22975,SPACEBOY CHILDRENS EGG CUP,2,2011-03-04 16:07:00,2.46,,United Kingdom
545667,22983,CARD BILLBOARD FONT,2,2011-03-04 16:07:00,0.83,,United Kingdom
545667,22993,SET OF 4 PANTRY JELLY MOULDS,3,2011-03-04 16:07:00,2.46,,United Kingdom
545667,22994,TRAVEL CARD WALLET RETROSPOT,1,2011-03-04 16:07:00,0.83,,United Kingdom
545667,23126,FELTCRAFT GIRL AMELIE KIT,1,2011-03-04 16:07:00,9.96,,United Kingdom
545667,23127,FELTCRAFT GIRL NICOLE KIT,1,2011-03-04 16:07:00,9.96,,United Kingdom
545667,23128,FELTCRAFT BOY JEAN-PAUL KIT,1,2011-03-04 16:07:00,9.96,,United Kingdom
545667,23177,TREASURE ISLAND BOOK BOX,1,2011-03-04 16:07:00,4.58,,United Kingdom
545667,35915B,BLUE KNITTED HEN ,2,2011-03-04 16:07:00,0.83,,United Kingdom
545667,35915C,PEACH KNITTED HEN ,2,2011-03-04 16:07:00,0.83,,United Kingdom
545667,40001,WHITE BAMBOO RIBS LAMPSHADE,1,2011-03-04 16:07:00,1.63,,United Kingdom
545667,40003,WHITE BAMBOO RIBS LAMPSHADE,1,2011-03-04 16:07:00,3.29,,United Kingdom
545667,47566,PARTY BUNTING,13,2011-03-04 16:07:00,4.96,,United Kingdom
545667,47574A,ENGLISH ROSE SCENTED HANGING FLOWER,4,2011-03-04 16:07:00,2.46,,United Kingdom
545667,47593B,SCOTTIE DOGS BABY BIB,1,2011-03-04 16:07:00,0.83,,United Kingdom
545667,79000,MOROCCAN TEA GLASS,3,2011-03-04 16:07:00,1.65,,United Kingdom
545667,79406,FROSTED WHITE BASE ,1,2011-03-04 16:07:00,0.83,,United Kingdom
545667,82482,WOODEN PICTURE FRAME WHITE FINISH,2,2011-03-04 16:07:00,4.96,,United Kingdom
545667,82494L,WOODEN FRAME ANTIQUE WHITE ,1,2011-03-04 16:07:00,7.46,,United Kingdom
545667,82552,WASHROOM METAL SIGN,1,2011-03-04 16:07:00,2.46,,United Kingdom
545667,82567,"AIRLINE LOUNGE,METAL SIGN",2,2011-03-04 16:07:00,1.63,,United Kingdom
545667,82578,KITCHEN METAL SIGN,2,2011-03-04 16:07:00,1.25,,United Kingdom
545667,82580,BATHROOM METAL SIGN,2,2011-03-04 16:07:00,1.25,,United Kingdom
545667,82581,TOILET METAL SIGN,2,2011-03-04 16:07:00,1.25,,United Kingdom
545667,82582,AREA PATROLLED METAL SIGN,1,2011-03-04 16:07:00,4.13,,United Kingdom
545667,82583,HOT BATHS METAL SIGN,1,2011-03-04 16:07:00,4.13,,United Kingdom
545667,84279B,CHERRY BLOSSOM DECORATIVE FLASK,2,2011-03-04 16:07:00,8.29,,United Kingdom
545667,84306,S/3 PINK SQUARE PLANTERS ROSES,1,2011-03-04 16:07:00,8.29,,United Kingdom
545667,84375,SET OF 20 KIDS COOKIE CUTTERS,1,2011-03-04 16:07:00,4.13,,United Kingdom
545667,84509A,SET OF 4 ENGLISH ROSE PLACEMATS,2,2011-03-04 16:07:00,7.46,,United Kingdom
545667,84568,GIRLS ALPHABET IRON ON PATCHES ,8,2011-03-04 16:07:00,0.42,,United Kingdom
545667,84625A,PINK NEW BAROQUECANDLESTICK CANDLE,1,2011-03-04 16:07:00,5.79,,United Kingdom
545668,22998,TRAVEL CARD WALLET KEEP CALM,48,2011-03-04 17:02:00,0.42,14031.0,United Kingdom
545668,15056BL,EDWARDIAN PARASOL BLACK,10,2011-03-04 17:02:00,5.95,14031.0,United Kingdom
545668,20679,EDWARDIAN PARASOL RED,6,2011-03-04 17:02:00,5.95,14031.0,United Kingdom
545668,84879,ASSORTED COLOUR BIRD ORNAMENT,32,2011-03-04 17:02:00,1.69,14031.0,United Kingdom
545668,22988,SOLDIERS EGG CUP ,48,2011-03-04 17:02:00,1.25,14031.0,United Kingdom
545668,22606,WOODEN SKITTLES GARDEN SET,4,2011-03-04 17:02:00,12.75,14031.0,United Kingdom
545668,22607,WOODEN ROUNDERS GARDEN SET ,4,2011-03-04 17:02:00,9.95,14031.0,United Kingdom
545668,22605,WOODEN CROQUET GARDEN SET,4,2011-03-04 17:02:00,12.75,14031.0,United Kingdom
545668,23052,RECYCLED ACAPULCO MAT TURQUOISE,1,2011-03-04 17:02:00,8.25,14031.0,United Kingdom
545668,37370,RETRO COFFEE MUGS ASSORTED,144,2011-03-04 17:02:00,1.06,14031.0,United Kingdom
