InvoiceNo,StockCode,Description,Quantity,InvoiceDate,UnitPrice,CustomerID,Country
566720,21770,OPEN CLOSED METAL SIGN,1,2011-09-14 12:42:00,4.95,13634.0,United Kingdom
566720,21903,MAN FLU METAL SIGN,1,2011-09-14 12:42:00,2.1,13634.0,United Kingdom
566720,21181,PLEASE ONE PERSON METAL SIGN,1,2011-09-14 12:42:00,2.1,13634.0,United Kingdom
566720,21982,PACK OF 12 SUKI TISSUES ,12,2011-09-14 12:42:00,0.39,13634.0,United Kingdom
566720,21984,PACK OF 12 PINK PAISLEY TISSUES ,12,2011-09-14 12:42:00,0.39,13634.0,United Kingdom
566720,22950,36 DOILIES VINTAGE CHRISTMAS,2,2011-09-14 12:42:00,1.45,13634.0,United Kingdom
566720,21331,MOROCCAN BEATEN METAL DISH LARGE,1,2011-09-14 12:42:00,12.75,13634.0,United Kingdom
566720,22352,LUNCH BOX WITH CUTLERY RETROSPOT ,1,2011-09-14 12:42:00,2.55,13634.0,United Kingdom
566720,23254,CHILDRENS CUTLERY DOLLY GIRL ,1,2011-09-14 12:42:00,4.15,13634.0,United Kingdom
566720,84692,BOX OF 24 COCKTAIL PARASOLS,1,2011-09-14 12:42:00,0.42,13634.0,United Kingdom
566720,22173,METAL 4 HOOK HANGER FRENCH CHATEAU,2,2011-09-14 12:42:00,3.29,13634.0,United Kingdom
566720,23347,I LOVE LONDON BEAKER,1,2011-09-14 12:42:00,1.25,13634.0,United Kingdom
566720,22794,SWEETHEART WIRE MAGAZINE RACK,2,2011-09-14 12:42:00,7.95,13634.0,United Kingdom
566720,23153,ZINC SWEETHEART WIRE LETTER RACK,2,2011-09-14 12:42:00,3.75,13634.0,United Kingdom
566720,23132,SMALL IVORY HEART WALL ORGANISER,6,2011-09-14 12:42:00,5.75,13634.0,United Kingdom
566720,22178,VICTORIAN GLASS HANGING T-LIGHT,6,2011-09-14 12:42:00,1.95,13634.0,United Kingdom
566720,84970S,HANGING HEART ZINC T-LIGHT HOLDER,12,2011-09-14 12:42:00,0.85,13634.0,United Kingdom
566720,22199,FRYING PAN RED RETROSPOT,1,2011-09-14 12:42:00,4.25,13634.0,United Kingdom
566720,22203,MILK PAN RED RETROSPOT,1,2011-09-14 12:42:00,3.75,13634.0,United Kingdom
566720,21390,FILIGRIS HEART WITH BUTTERFLY,24,2011-09-14 12:42:00,1.25,13634.0,United Kingdom
566720,23175,REGENCY MILK JUG PINK ,4,2011-09-14 12:42:00,3.25,13634.0,United Kingdom
566720,23174,REGENCY SUGAR BOWL GREEN,4,2011-09-14 12:42:00,4.15,13634.0,United Kingdom
566720,23103,JINGLE BELL HEART DECORATION,24,2011-09-14 12:42:00,1.65,13634.0,United Kingdom
566720,22411,JUMBO SHOPPER VINTAGE RED PAISLEY,2,2011-09-14 12:42:00,2.08,13634.0,United Kingdom
566720,21929,JUMBO BAG PINK VINTAGE PAISLEY,1,2011-09-14 12:42:00,2.08,13634.0,United Kingdom
566720,85099B,JUMBO BAG RED RETROSPOT,1,2011-09-14 12:42:00,2.08,13634.0,United Kingdom
566720,22697,GREEN REGENCY TEACUP AND SAUCER,4,2011-09-14 12:42:00,2.95,13634.0,United Kingdom
566720,22698,PINK REGENCY TEACUP AND SAUCER,4,2011-09-14 12:42:00,2.95,13634.0,United Kingdom
566720,22696,WICKER WREATH LARGE,4,2011-09-14 12:42:00,1.95,13634.0,United Kingdom
566720,22643,SET OF 4 NAPKIN CHARMS LEAVES   ,1,2011-09-14 12:42:00,2.55,13634.0,United Kingdom
566720,22638,SET OF 4 NAPKIN CHARMS CROWNS ,3,2011-09-14 12:42:00,2.55,13634.0,United Kingdom
566720,22640,SET OF 4 NAPKIN CHARMS 3 KEYS ,1,2011-09-14 12:42:00,2.55,13634.0,United Kingdom
566720,21974,SET OF 36 PAISLEY FLOWER DOILIES,2,2011-09-14 12:42:00,1.45,13634.0,United Kingdom
566720,23121,PACK OF 6 COCKTAIL PARASOL STRAWS,2,2011-09-14 12:42:00,0.42,13634.0,United Kingdom
566720,23120,PACK OF 6 SMALL FRUIT STRAWS,2,2011-09-14 12:42:00,0.42,13634.0,United Kingdom
566720,23119,PACK OF 6 LARGE FRUIT STRAWS ,2,2011-09-14 12:42:00,0.62,13634.0,United Kingdom
566720,22626,BLACK KITCHEN SCALES,1,2011-09-14 12:42:00,8.5,13634.0,United Kingdom
566720,23173,REGENCY TEAPOT ROSES ,4,2011-09-14 12:42:00,9.95,13634.0,United Kingdom
566721,22086,PAPER CHAIN KIT 50'S CHRISTMAS ,6,2011-09-14 12:50:00,2.95,12921.0,United Kingdom
566721,23340,VINTAGE CHRISTMAS CAKE FRILL,12,2011-09-14 12:50:00,1.65,12921.0,United Kingdom
566721,22941,CHRISTMAS LIGHTS 10 REINDEER,4,2011-09-14 12:50:00,8.5,12921.0,United Kingdom
566721,22942,CHRISTMAS LIGHTS 10 SANTAS ,4,2011-09-14 12:50:00,8.5,12921.0,United Kingdom
566721,22731,3D CHRISTMAS STAMPS STICKERS ,18,2011-09-14 12:50:00,1.25,12921.0,United Kingdom
566721,21791,VINTAGE HEADS AND TAILS CARD GAME ,12,2011-09-14 12:50:00,1.25,12921.0,United Kingdom
566721,22549,PICTURE DOMINOES,12,2011-09-14 12:50:00,1.45,12921.0,United Kingdom
566721,22560,TRADITIONAL MODELLING CLAY,24,2011-09-14 12:50:00,1.25,12921.0,United Kingdom
566721,22561,WOODEN SCHOOL COLOURING SET,12,2011-09-14 12:50:00,1.65,12921.0,United Kingdom
566721,23188,VINTAGE  2 METER FOLDING RULER,12,2011-09-14 12:50:00,1.65,12921.0,United Kingdom
566721,21889,WOODEN BOX OF DOMINOES,12,2011-09-14 12:50:00,1.25,12921.0,United Kingdom
566721,23229,VINTAGE DONKEY TAIL GAME ,6,2011-09-14 12:50:00,3.75,12921.0,United Kingdom
566721,21888,BINGO SET,4,2011-09-14 12:50:00,3.75,12921.0,United Kingdom
566721,22550,HOLIDAY FUN LUDO,4,2011-09-14 12:50:00,3.75,12921.0,United Kingdom
566721,23126,FELTCRAFT GIRL AMELIE KIT,4,2011-09-14 12:50:00,4.95,12921.0,United Kingdom
566721,23079,TOADSTOOL BEDSIDE LIGHT ,2,2011-09-14 12:50:00,8.95,12921.0,United Kingdom
566721,22654,DELUXE SEWING KIT ,3,2011-09-14 12:50:00,5.95,12921.0,United Kingdom
566721,22653,BUTTON BOX ,10,2011-09-14 12:50:00,1.95,12921.0,United Kingdom
566721,22745,POPPY'S PLAYHOUSE BEDROOM ,6,2011-09-14 12:50:00,2.1,12921.0,United Kingdom
566721,22273,FELTCRAFT DOLL MOLLY,6,2011-09-14 12:50:00,2.95,12921.0,United Kingdom
566721,22749,FELTCRAFT PRINCESS CHARLOTTE DOLL,4,2011-09-14 12:50:00,3.75,12921.0,United Kingdom
566721,22150,3 STRIPEY MICE FELTCRAFT,6,2011-09-14 12:50:00,1.95,12921.0,United Kingdom
566721,22147,FELTCRAFT BUTTERFLY HEARTS,12,2011-09-14 12:50:00,1.45,12921.0,United Kingdom
566721,22780,LIGHT GARLAND BUTTERFILES PINK,4,2011-09-14 12:50:00,4.25,12921.0,United Kingdom
566721,22179,SET 10 NIGHT OWL LIGHTS,4,2011-09-14 12:50:00,6.75,12921.0,United Kingdom
566722,20725,LUNCH BAG RED RETROSPOT,10,2011-09-14 12:51:00,1.65,13408.0,United Kingdom
566722,22189,CREAM HEART CARD HOLDER,8,2011-09-14 12:51:00,3.95,13408.0,United Kingdom
566722,22295,HEART FILIGREE DOVE LARGE,24,2011-09-14 12:51:00,1.65,13408.0,United Kingdom
566722,22355,CHARLOTTE BAG SUKI DESIGN,10,2011-09-14 12:51:00,0.85,13408.0,United Kingdom
566722,22597,MUSICAL ZINC HEART DECORATION ,72,2011-09-14 12:51:00,0.72,13408.0,United Kingdom
566722,22726,ALARM CLOCK BAKELIKE GREEN,8,2011-09-14 12:51:00,3.75,13408.0,United Kingdom
566722,22729,ALARM CLOCK BAKELIKE ORANGE,12,2011-09-14 12:51:00,3.75,13408.0,United Kingdom
566722,23154,SET OF 4 JAM JAR MAGNETS,12,2011-09-14 12:51:00,2.08,13408.0,United Kingdom
566722,71459,HANGING JAM JAR T-LIGHT HOLDERS,96,2011-09-14 12:51:00,0.72,13408.0,United Kingdom
566722,22960,JAM MAKING SET WITH JARS,12,2011-09-14 12:51:00,3.75,13408.0,United Kingdom
566722,21673,WHITE SPOT BLUE CERAMIC DRAWER KNOB,24,2011-09-14 12:51:00,1.45,13408.0,United Kingdom
566722,22333,RETROSPOT PARTY BAG + STICKER SET,48,2011-09-14 12:51:00,1.45,13408.0,United Kingdom
566723,84836,ZINC METAL HEART DECORATION,12,2011-09-14 13:02:00,1.25,15804.0,United Kingdom
566723,23397,FOOT STOOL HOME SWEET HOME ,2,2011-09-14 13:02:00,9.95,15804.0,United Kingdom
566723,23328,SET 6 SCHOOL MILK BOTTLES IN CRATE,4,2011-09-14 13:02:00,3.75,15804.0,United Kingdom
566723,85048,15CM CHRISTMAS GLASS BALL 20 LIGHTS,2,2011-09-14 13:02:00,7.95,15804.0,United Kingdom
566723,23411, TRELLIS COAT RACK,6,2011-09-14 13:02:00,4.95,15804.0,United Kingdom
566723,23427,STOOL HOME SWEET HOME ,2,2011-09-14 13:02:00,12.5,15804.0,United Kingdom
566723,23425,STORAGE TIN HOME SWEET HOME,6,2011-09-14 13:02:00,2.49,15804.0,United Kingdom
566723,22488,NATURAL SLATE RECTANGLE CHALKBOARD,12,2011-09-14 13:02:00,1.65,15804.0,United Kingdom
566723,22456,NATURAL SLATE CHALKBOARD LARGE ,3,2011-09-14 13:02:00,4.95,15804.0,United Kingdom
566723,22466,FAIRY TALE COTTAGE NIGHT LIGHT,12,2011-09-14 13:02:00,1.95,15804.0,United Kingdom
566723,23399,HOME SWEET HOME HANGING HEART,12,2011-09-14 13:02:00,0.85,15804.0,United Kingdom
566723,21812,GARLAND WITH HEARTS AND BELLS,6,2011-09-14 13:02:00,4.95,15804.0,United Kingdom
566724,21485,RETROSPOT HEART HOT WATER BOTTLE,3,2011-09-14 13:04:00,4.95,14284.0,United Kingdom
566724,22644,CERAMIC CHERRY CAKE MONEY BANK,12,2011-09-14 13:04:00,1.45,14284.0,United Kingdom
566724,22960,JAM MAKING SET WITH JARS,6,2011-09-14 13:04:00,4.25,14284.0,United Kingdom
566724,23423,PANTRY 3 HOOK ROLLING PIN HANGER,6,2011-09-14 13:04:00,3.75,14284.0,United Kingdom
566724,22558,CLOTHES PEGS RETROSPOT PACK 24 ,12,2011-09-14 13:04:00,1.65,14284.0,United Kingdom
566724,23245,SET OF 3 REGENCY CAKE TINS,4,2011-09-14 13:04:00,4.95,14284.0,United Kingdom
566724,23110,PARISIENNE KEY CABINET ,2,2011-09-14 13:04:00,5.75,14284.0,United Kingdom
566724,23153,ZINC SWEETHEART WIRE LETTER RACK,4,2011-09-14 13:04:00,3.75,14284.0,United Kingdom
566724,23407,SET OF 2 TRAYS HOME SWEET HOME,2,2011-09-14 13:04:00,9.95,14284.0,United Kingdom
566724,22424,ENAMEL BREAD BIN CREAM,1,2011-09-14 13:04:00,12.75,14284.0,United Kingdom
566724,22086,PAPER CHAIN KIT 50'S CHRISTMAS ,6,2011-09-14 13:04:00,2.95,14284.0,United Kingdom
566724,85048,15CM CHRISTMAS GLASS BALL 20 LIGHTS,4,2011-09-14 13:04:00,7.95,14284.0,United Kingdom
566724,22158,3 HEARTS HANGING DECORATION RUSTIC,8,2011-09-14 13:04:00,2.95,14284.0,United Kingdom
C566725,20727,LUNCH BAG  BLACK SKULL.,-1,2011-09-14 13:08:00,1.65,14606.0,United Kingdom
566726,22119,PEACE WOODEN BLOCK LETTERS,1,2011-09-14 13:12:00,6.95,15021.0,United Kingdom
566726,23412,HEART MIRROR ANTIQUE WHITE,3,2011-09-14 13:12:00,7.5,15021.0,United Kingdom
566726,23270,SET OF 2 CERAMIC PAINTED HEARTS ,1,2011-09-14 13:12:00,1.45,15021.0,United Kingdom
566726,23129,HEART SHAPED HOLLY WREATH,6,2011-09-14 13:12:00,4.15,15021.0,United Kingdom
566726,22187,GREEN CHRISTMAS TREE CARD HOLDER,1,2011-09-14 13:12:00,4.25,15021.0,United Kingdom
566726,23268,SET OF 2 CERAMIC CHRISTMAS REINDEER,3,2011-09-14 13:12:00,1.45,15021.0,United Kingdom
566726,23269,SET OF 2 CERAMIC CHRISTMAS TREES,2,2011-09-14 13:12:00,1.45,15021.0,United Kingdom
566726,23218,LAUREL STAR ANTIQUE GOLD,1,2011-09-14 13:12:00,1.25,15021.0,United Kingdom
566726,23219,LAUREL STAR ANTIQUE SILVER ,1,2011-09-14 13:12:00,1.25,15021.0,United Kingdom
566726,23211,RED ROCKING HORSE HAND PAINTED,2,2011-09-14 13:12:00,1.25,15021.0,United Kingdom
566726,22571,ROCKING HORSE RED CHRISTMAS ,3,2011-09-14 13:12:00,0.85,15021.0,United Kingdom
566726,22572,ROCKING HORSE GREEN CHRISTMAS ,2,2011-09-14 13:12:00,0.85,15021.0,United Kingdom
566726,23227,FILIGREE HEART BUTTERFLY WHITE ,1,2011-09-14 13:12:00,1.25,15021.0,United Kingdom
566726,21809,CHRISTMAS HANGING TREE WITH BELL,2,2011-09-14 13:12:00,1.25,15021.0,United Kingdom
566726,22601,CHRISTMAS RETROSPOT ANGEL WOOD,2,2011-09-14 13:12:00,0.85,15021.0,United Kingdom
566726,22153,ANGEL DECORATION STARS ON DRESS,2,2011-09-14 13:12:00,0.42,15021.0,United Kingdom
566726,22154,ANGEL DECORATION 3 BUTTONS ,2,2011-09-14 13:12:00,0.42,15021.0,United Kingdom
566726,21817,GLITTER CHRISTMAS TREE,3,2011-09-14 13:12:00,0.85,15021.0,United Kingdom
566726,23214,JINGLE BELL HEART ANTIQUE GOLD,1,2011-09-14 13:12:00,2.08,15021.0,United Kingdom
566726,23215,JINGLE BELL HEART ANTIQUE SILVER,1,2011-09-14 13:12:00,2.08,15021.0,United Kingdom
566726,35954,SMALL FOLKART STAR CHRISTMAS DEC,2,2011-09-14 13:12:00,0.42,15021.0,United Kingdom
566726,23212,HEART WREATH DECORATION WITH BELL,4,2011-09-14 13:12:00,1.25,15021.0,United Kingdom
566726,23399,HOME SWEET HOME HANGING HEART,2,2011-09-14 13:12:00,0.85,15021.0,United Kingdom
566726,23265,SET OF 3 WOODEN TREE DECORATIONS,1,2011-09-14 13:12:00,1.25,15021.0,United Kingdom
566726,35933,PINK STOCKING CHRISTMAS DECORATION,4,2011-09-14 13:12:00,0.38,15021.0,United Kingdom
566726,23266,SET OF 3 WOODEN STOCKING DECORATION,1,2011-09-14 13:12:00,1.25,15021.0,United Kingdom
566726,23329,DECORATIVE WICKER HEART LARGE,2,2011-09-14 13:12:00,1.65,15021.0,United Kingdom
566726,23332,IVORY WICKER HEART LARGE,2,2011-09-14 13:12:00,1.65,15021.0,United Kingdom
566726,37468,HARDMAN MUG 3 ASSORTED,2,2011-09-14 13:12:00,0.39,15021.0,United Kingdom
566726,23330,DECORATIVE WICKER HEART MEDIUM,2,2011-09-14 13:12:00,1.25,15021.0,United Kingdom
566726,23333,IVORY WICKER HEART MEDIUM,2,2011-09-14 13:12:00,1.25,15021.0,United Kingdom
566726,22142,CHRISTMAS CRAFT WHITE FAIRY ,1,2011-09-14 13:12:00,1.45,15021.0,United Kingdom
566726,22144,CHRISTMAS CRAFT LITTLE FRIENDS,1,2011-09-14 13:12:00,2.1,15021.0,United Kingdom
566726,22144,CHRISTMAS CRAFT LITTLE FRIENDS,1,2011-09-14 13:12:00,2.1,15021.0,United Kingdom
566726,22141,CHRISTMAS CRAFT TREE TOP ANGEL,1,2011-09-14 13:12:00,2.1,15021.0,United Kingdom
566726,23321,SMALL WHITE HEART OF WICKER,1,2011-09-14 13:12:00,1.65,15021.0,United Kingdom
566726,22578,WOODEN STAR CHRISTMAS SCANDINAVIAN,1,2011-09-14 13:12:00,0.85,15021.0,United Kingdom
566726,22579,WOODEN TREE CHRISTMAS SCANDINAVIAN,1,2011-09-14 13:12:00,0.85,15021.0,United Kingdom
566726,22595,GINGHAM HEART DECORATION,1,2011-09-14 13:12:00,0.85,15021.0,United Kingdom
566726,22593,CHRISTMAS GINGHAM STAR,1,2011-09-14 13:12:00,0.85,15021.0,United Kingdom
566726,23401,RUSTIC MIRROR WITH LACE HEART,1,2011-09-14 13:12:00,6.25,15021.0,United Kingdom
566726,23404,HOME SWEET HOME BLACKBOARD,1,2011-09-14 13:12:00,4.95,15021.0,United Kingdom
566726,70006,LOVE HEART POCKET WARMER,1,2011-09-14 13:12:00,1.65,15021.0,United Kingdom
566726,21754,HOME BUILDING BLOCK WORD,1,2011-09-14 13:12:00,6.25,15021.0,United Kingdom
566726,22349,DOG BOWL CHASING BALL DESIGN,1,2011-09-14 13:12:00,3.75,15021.0,United Kingdom
566726,22350,ILLUSTRATED CAT BOWL ,2,2011-09-14 13:12:00,2.55,15021.0,United Kingdom
566726,23201,JUMBO BAG ALPHABET,1,2011-09-14 13:12:00,2.08,15021.0,United Kingdom
566726,21931,JUMBO STORAGE BAG SUKI,2,2011-09-14 13:12:00,2.08,15021.0,United Kingdom
566726,21930,JUMBO STORAGE BAG SKULLS,1,2011-09-14 13:12:00,2.08,15021.0,United Kingdom
566726,20713,JUMBO BAG OWLS,1,2011-09-14 13:12:00,2.08,15021.0,United Kingdom
566726,85099C,JUMBO  BAG BAROQUE BLACK WHITE,2,2011-09-14 13:12:00,2.08,15021.0,United Kingdom
566726,23135,SMALL ZINC HEART WALL ORGANISER,1,2011-09-14 13:12:00,5.75,15021.0,United Kingdom
566726,23132,SMALL IVORY HEART WALL ORGANISER,1,2011-09-14 13:12:00,5.75,15021.0,United Kingdom
566726,23133,LARGE IVORY HEART WALL ORGANISER,1,2011-09-14 13:12:00,8.25,15021.0,United Kingdom
566726,22111,SCOTTIE DOG HOT WATER BOTTLE,1,2011-09-14 13:12:00,4.95,15021.0,United Kingdom
566726,84029G,KNITTED UNION FLAG HOT WATER BOTTLE,1,2011-09-14 13:12:00,4.25,15021.0,United Kingdom
566726,21479,WHITE SKULL HOT WATER BOTTLE ,1,2011-09-14 13:12:00,4.25,15021.0,United Kingdom
566726,23356,LOVE HOT WATER BOTTLE,1,2011-09-14 13:12:00,5.95,15021.0,United Kingdom
566726,21624,VINTAGE UNION JACK DOORSTOP,1,2011-09-14 13:12:00,5.95,15021.0,United Kingdom
566726,22632,HAND WARMER RED RETROSPOT,4,2011-09-14 13:12:00,2.1,15021.0,United Kingdom
566726,22865,HAND WARMER OWL DESIGN,1,2011-09-14 13:12:00,2.1,15021.0,United Kingdom
566726,23439,HAND WARMER RED LOVE HEART,2,2011-09-14 13:12:00,2.1,15021.0,United Kingdom
566726,22866,HAND WARMER SCOTTY DOG DESIGN,2,2011-09-14 13:12:00,2.1,15021.0,United Kingdom
566726,22632,HAND WARMER RED RETROSPOT,2,2011-09-14 13:12:00,2.1,15021.0,United Kingdom
566726,22632,HAND WARMER RED RETROSPOT,1,2011-09-14 13:12:00,2.1,15021.0,United Kingdom
566726,22867,HAND WARMER BIRD DESIGN,1,2011-09-14 13:12:00,2.1,15021.0,United Kingdom
566726,22834,HAND WARMER BABUSHKA DESIGN,2,2011-09-14 13:12:00,2.1,15021.0,United Kingdom
566726,22865,HAND WARMER OWL DESIGN,1,2011-09-14 13:12:00,2.1,15021.0,United Kingdom
566726,82494L,WOODEN FRAME ANTIQUE WHITE ,1,2011-09-14 13:12:00,2.95,15021.0,United Kingdom
566726,82482,WOODEN PICTURE FRAME WHITE FINISH,1,2011-09-14 13:12:00,2.95,15021.0,United Kingdom
566726,20969,RED FLORAL FELTCRAFT SHOULDER BAG,1,2011-09-14 13:12:00,3.75,15021.0,United Kingdom
566726,22569,FELTCRAFT CUSHION BUTTERFLY,1,2011-09-14 13:12:00,3.75,15021.0,United Kingdom
566726,82484,WOOD BLACK BOARD ANT WHITE FINISH,2,2011-09-14 13:12:00,7.95,15021.0,United Kingdom
566726,20679,EDWARDIAN PARASOL RED,1,2011-09-14 13:12:00,5.95,15021.0,United Kingdom
566726,23343,JUMBO BAG VINTAGE CHRISTMAS ,3,2011-09-14 13:12:00,2.08,15021.0,United Kingdom
566726,35637A,IVORY STRING CURTAIN WITH POLE ,2,2011-09-14 13:12:00,1.95,15021.0,United Kingdom
566726,84006,MAGIC TREE -PAPER FLOWERS,2,2011-09-14 13:12:00,0.85,15021.0,United Kingdom
566726,82483,WOOD 2 DRAWER CABINET WHITE FINISH,2,2011-09-14 13:12:00,6.95,15021.0,United Kingdom
566727,84947,ANTIQUE SILVER TEA GLASS ENGRAVED,216,2011-09-14 13:12:00,1.06,17347.0,United Kingdom
566728,23187,FRENCH STYLE STORAGE JAR BONBONS,48,2011-09-14 13:15:00,0.29,15841.0,United Kingdom
566728,22676,FRENCH BLUE METAL DOOR SIGN 1,20,2011-09-14 13:15:00,1.25,15841.0,United Kingdom
566728,21166,COOK WITH WINE METAL SIGN ,24,2011-09-14 13:15:00,2.08,15841.0,United Kingdom
566728,21925,UNION STRIPE CUSHION COVER ,12,2011-09-14 13:15:00,1.25,15841.0,United Kingdom
566728,71101E,STANDING FAIRY POLE SUPPORT ,48,2011-09-14 13:15:00,0.72,15841.0,United Kingdom
566728,22677,FRENCH BLUE METAL DOOR SIGN 2,20,2011-09-14 13:15:00,1.25,15841.0,United Kingdom
566728,22678,FRENCH BLUE METAL DOOR SIGN 3,20,2011-09-14 13:15:00,1.25,15841.0,United Kingdom
566728,85015,SET OF 12  VINTAGE POSTCARD SET,24,2011-09-14 13:15:00,0.65,15841.0,United Kingdom
566728,85111,SILVER GLITTER FLOWER VOTIVE HOLDER,36,2011-09-14 13:15:00,0.29,15841.0,United Kingdom
566728,21915,RED  HARMONICA IN BOX ,12,2011-09-14 13:15:00,1.25,15841.0,United Kingdom
566728,21927,BLUE/CREAM STRIPE CUSHION COVER ,12,2011-09-14 13:15:00,1.25,15841.0,United Kingdom
566728,20838,FRENCH LATTICE CUSHION COVER ,12,2011-09-14 13:15:00,0.85,15841.0,United Kingdom
566728,20839,FRENCH PAISLEY CUSHION COVER ,12,2011-09-14 13:15:00,0.85,15841.0,United Kingdom
566728,20840,FRENCH FLORAL CUSHION COVER ,12,2011-09-14 13:15:00,0.85,15841.0,United Kingdom
566728,21530,DAIRY MAID TOASTRACK,36,2011-09-14 13:15:00,0.79,15841.0,United Kingdom
566729,23199,JUMBO BAG APPLES,1,2011-09-14 13:23:00,2.08,14562.0,United Kingdom
566729,21430,SET/3 RED GINGHAM ROSE STORAGE BOX,12,2011-09-14 13:23:00,3.75,14562.0,United Kingdom
566729,22839,3 TIER CAKE TIN GREEN AND CREAM,5,2011-09-14 13:23:00,14.95,14562.0,United Kingdom
566729,22838,3 TIER CAKE TIN RED AND CREAM,3,2011-09-14 13:23:00,14.95,14562.0,United Kingdom
566729,22384,LUNCH BAG PINK POLKADOT,1,2011-09-14 13:23:00,1.65,14562.0,United Kingdom
566729,23206,LUNCH BAG APPLE DESIGN,1,2011-09-14 13:23:00,1.65,14562.0,United Kingdom
566729,20725,LUNCH BAG RED RETROSPOT,2,2011-09-14 13:23:00,1.65,14562.0,United Kingdom
566729,23200,JUMBO BAG PEARS,2,2011-09-14 13:23:00,2.08,14562.0,United Kingdom
566730,21643,ASSORTED TUTTI FRUTTI MIRROR,6,2011-09-14 13:31:00,1.25,14606.0,United Kingdom
566730,22488,NATURAL SLATE RECTANGLE CHALKBOARD,1,2011-09-14 13:31:00,1.65,14606.0,United Kingdom
566730,20963,APPLE BATH SPONGE,3,2011-09-14 13:31:00,1.25,14606.0,United Kingdom
566730,37448,CERAMIC CAKE DESIGN SPOTTED MUG,1,2011-09-14 13:31:00,1.49,14606.0,United Kingdom
566730,84692,BOX OF 24 COCKTAIL PARASOLS,1,2011-09-14 13:31:00,0.42,14606.0,United Kingdom
566730,21684,SMALL MEDINA STAMPED METAL BOWL ,1,2011-09-14 13:31:00,0.85,14606.0,United Kingdom
566730,21844,RED RETROSPOT MUG,1,2011-09-14 13:31:00,2.95,14606.0,United Kingdom
566730,20996,JAZZ HEARTS ADDRESS BOOK,1,2011-09-14 13:31:00,0.19,14606.0,United Kingdom
566730,21931,JUMBO STORAGE BAG SUKI,1,2011-09-14 13:31:00,2.08,14606.0,United Kingdom
566730,23080,RED METAL BOX TOP SECRET,1,2011-09-14 13:31:00,8.25,14606.0,United Kingdom
566730,22571,ROCKING HORSE RED CHRISTMAS ,1,2011-09-14 13:31:00,0.85,14606.0,United Kingdom
566730,21390,FILIGRIS HEART WITH BUTTERFLY,1,2011-09-14 13:31:00,1.25,14606.0,United Kingdom
566730,21239,PINK  POLKADOT CUP,1,2011-09-14 13:31:00,0.85,14606.0,United Kingdom
566730,22077,6 RIBBONS RUSTIC CHARM,1,2011-09-14 13:31:00,1.95,14606.0,United Kingdom
566730,22996,TRAVEL CARD WALLET VINTAGE TICKET,7,2011-09-14 13:31:00,0.42,14606.0,United Kingdom
566730,85078,SCANDINAVIAN 3 HEARTS NAPKIN RING,1,2011-09-14 13:31:00,0.19,14606.0,United Kingdom
566730,21494,ROTATING LEAVES T-LIGHT HOLDER,1,2011-09-14 13:31:00,1.25,14606.0,United Kingdom
566730,21204,DAISIES  HONEYCOMB GARLAND ,1,2011-09-14 13:31:00,1.65,14606.0,United Kingdom
566730,21915,RED  HARMONICA IN BOX ,1,2011-09-14 13:31:00,1.25,14606.0,United Kingdom
566730,21828,EIGHT PIECE SNAKE  SET,1,2011-09-14 13:31:00,1.25,14606.0,United Kingdom
566730,21539,RED RETROSPOT BUTTER DISH,1,2011-09-14 13:31:00,4.95,14606.0,United Kingdom
566730,22329,ROUND CONTAINER SET OF 5 RETROSPOT,1,2011-09-14 13:31:00,1.65,14606.0,United Kingdom
566730,20970,PINK FLORAL FELTCRAFT SHOULDER BAG,1,2011-09-14 13:31:00,3.75,14606.0,United Kingdom
566730,22273,FELTCRAFT DOLL MOLLY,1,2011-09-14 13:31:00,2.95,14606.0,United Kingdom
566730,47590A,BLUE HAPPY BIRTHDAY BUNTING,1,2011-09-14 13:31:00,5.45,14606.0,United Kingdom
566730,22360,GLASS JAR ENGLISH CONFECTIONERY,1,2011-09-14 13:31:00,2.95,14606.0,United Kingdom
566731,23175,REGENCY MILK JUG PINK ,1,2011-09-14 13:37:00,3.25,17883.0,United Kingdom
566731,23174,REGENCY SUGAR BOWL GREEN,1,2011-09-14 13:37:00,4.15,17883.0,United Kingdom
566731,21739,COSY SLIPPER SHOES SMALL GREEN,1,2011-09-14 13:37:00,2.95,17883.0,United Kingdom
566731,82482,WOODEN PICTURE FRAME WHITE FINISH,1,2011-09-14 13:37:00,2.95,17883.0,United Kingdom
566731,22831,WHITE BROCANTE SOAP DISH,1,2011-09-14 13:37:00,2.95,17883.0,United Kingdom
566731,22666,RECIPE BOX PANTRY YELLOW DESIGN,1,2011-09-14 13:37:00,2.95,17883.0,United Kingdom
566731,22697,GREEN REGENCY TEACUP AND SAUCER,1,2011-09-14 13:37:00,2.95,17883.0,United Kingdom
566731,22699,ROSES REGENCY TEACUP AND SAUCER ,3,2011-09-14 13:37:00,2.95,17883.0,United Kingdom
566731,23177,TREASURE ISLAND BOOK BOX,1,2011-09-14 13:37:00,2.25,17883.0,United Kingdom
566731,23171,REGENCY TEA PLATE GREEN ,3,2011-09-14 13:37:00,1.65,17883.0,United Kingdom
566731,23170,REGENCY TEA PLATE ROSES ,3,2011-09-14 13:37:00,1.65,17883.0,United Kingdom
566731,23172,REGENCY TEA PLATE PINK,3,2011-09-14 13:37:00,1.65,17883.0,United Kingdom
566731,22907,PACK OF 20 NAPKINS PANTRY DESIGN,1,2011-09-14 13:37:00,0.85,17883.0,United Kingdom
566731,21078,SET/20 STRAWBERRY PAPER NAPKINS ,1,2011-09-14 13:37:00,0.85,17883.0,United Kingdom
566731,22851,SET 20 NAPKINS FAIRY CAKES DESIGN ,4,2011-09-14 13:37:00,0.85,17883.0,United Kingdom
566731,21200,MULTICOLOUR HONEYCOMB PAPER GARLAND,1,2011-09-14 13:37:00,1.65,17883.0,United Kingdom
566731,21206,STRAWBERRY HONEYCOMB  GARLAND ,1,2011-09-14 13:37:00,1.65,17883.0,United Kingdom
566731,47566,PARTY BUNTING,1,2011-09-14 13:37:00,4.95,17883.0,United Kingdom
566731,22625,RED KITCHEN SCALES,1,2011-09-14 13:37:00,8.5,17883.0,United Kingdom
566731,21621,VINTAGE UNION JACK BUNTING,1,2011-09-14 13:37:00,8.5,17883.0,United Kingdom
566732,20712,JUMBO BAG WOODLAND ANIMALS,10,2011-09-14 13:42:00,2.08,17716.0,United Kingdom
566732,23203,JUMBO BAG VINTAGE DOILY ,10,2011-09-14 13:42:00,2.08,17716.0,United Kingdom
566732,23199,JUMBO BAG APPLES,10,2011-09-14 13:42:00,2.08,17716.0,United Kingdom
566732,20713,JUMBO BAG OWLS,10,2011-09-14 13:42:00,2.08,17716.0,United Kingdom
566732,22386,JUMBO BAG PINK POLKADOT,10,2011-09-14 13:42:00,2.08,17716.0,United Kingdom
566732,23209,LUNCH BAG VINTAGE DOILY ,10,2011-09-14 13:42:00,1.65,17716.0,United Kingdom
566732,23207,LUNCH BAG ALPHABET DESIGN,10,2011-09-14 13:42:00,1.65,17716.0,United Kingdom
566732,23206,LUNCH BAG APPLE DESIGN,10,2011-09-14 13:42:00,1.65,17716.0,United Kingdom
566732,22384,LUNCH BAG PINK POLKADOT,10,2011-09-14 13:42:00,1.65,17716.0,United Kingdom
566732,23240,SET OF 4 KNICK KNACK TINS DOILY ,6,2011-09-14 13:42:00,4.15,17716.0,United Kingdom
566732,22847,BREAD BIN DINER STYLE IVORY,1,2011-09-14 13:42:00,16.95,17716.0,United Kingdom
566732,23360,SET 8 CANDLES VINTAGE DOILY,12,2011-09-14 13:42:00,1.95,17716.0,United Kingdom
566732,21257,VICTORIAN SEWING BOX MEDIUM,4,2011-09-14 13:42:00,7.95,17716.0,United Kingdom
566732,22086,PAPER CHAIN KIT 50'S CHRISTMAS ,12,2011-09-14 13:42:00,2.95,17716.0,United Kingdom
566732,22571,ROCKING HORSE RED CHRISTMAS ,12,2011-09-14 13:42:00,0.85,17716.0,United Kingdom
566732,22572,ROCKING HORSE GREEN CHRISTMAS ,12,2011-09-14 13:42:00,0.85,17716.0,United Kingdom
566732,23268,SET OF 2 CERAMIC CHRISTMAS REINDEER,24,2011-09-14 13:42:00,1.45,17716.0,United Kingdom
566732,23344,JUMBO BAG 50'S CHRISTMAS ,10,2011-09-14 13:42:00,2.08,17716.0,United Kingdom
566733,22077,6 RIBBONS RUSTIC CHARM,12,2011-09-14 13:54:00,1.95,15103.0,United Kingdom
566733,23330,DECORATIVE WICKER HEART MEDIUM,12,2011-09-14 13:54:00,1.25,15103.0,United Kingdom
566733,22826,LOVE SEAT ANTIQUE WHITE METAL,1,2011-09-14 13:54:00,85.0,15103.0,United Kingdom
566733,85053,FRENCH ENAMEL CANDLEHOLDER,6,2011-09-14 13:54:00,2.1,15103.0,United Kingdom
566733,16161P,WRAP ENGLISH ROSE ,25,2011-09-14 13:54:00,0.42,15103.0,United Kingdom
566733,22907,PACK OF 20 NAPKINS PANTRY DESIGN,12,2011-09-14 13:54:00,0.85,15103.0,United Kingdom
566733,23293,SET OF 12 FAIRY CAKE BAKING CASES,8,2011-09-14 13:54:00,0.83,15103.0,United Kingdom
566733,23236,STORAGE TIN VINTAGE DOILY ,6,2011-09-14 13:54:00,2.89,15103.0,United Kingdom
566733,22965,3 TRADITIONAl BISCUIT CUTTERS  SET,6,2011-09-14 13:54:00,2.1,15103.0,United Kingdom
566733,22960,JAM MAKING SET WITH JARS,6,2011-09-14 13:54:00,4.25,15103.0,United Kingdom
566733,23307,SET OF 60 PANTRY DESIGN CAKE CASES ,24,2011-09-14 13:54:00,0.55,15103.0,United Kingdom
566733,22720,SET OF 3 CAKE TINS PANTRY DESIGN ,6,2011-09-14 13:54:00,4.95,15103.0,United Kingdom
566733,22294,HEART FILIGREE DOVE  SMALL,24,2011-09-14 13:54:00,1.25,15103.0,United Kingdom
566734,22548,HEADS AND TAILS SPORTING FUN,1,2011-09-14 14:09:00,1.25,16910.0,United Kingdom
566734,21790,VINTAGE SNAP CARDS,1,2011-09-14 14:09:00,0.85,16910.0,United Kingdom
566734,22759,SET OF 3 NOTEBOOKS IN PARCEL,1,2011-09-14 14:09:00,1.65,16910.0,United Kingdom
