InvoiceNo,StockCode,Description,Quantity,InvoiceDate,UnitPrice,CustomerID,Country
569230,22699,ROSES REGENCY TEACUP AND SAUCER ,6,2011-10-02 15:07:00,2.95,16533.0,United Kingdom
569230,84536A,ENGLISH ROSE NOTEBOOK A7 SIZE,6,2011-10-02 15:07:00,0.42,16533.0,United Kingdom
569230,22430,ENAMEL WATERING CAN CREAM,1,2011-10-02 15:07:00,4.95,16533.0,United Kingdom
569230,82494L,WOODEN FRAME ANTIQUE WHITE ,4,2011-10-02 15:07:00,2.95,16533.0,United Kingdom
569230,22098,BOUDOIR SQUARE TISSUE BOX,3,2011-10-02 15:07:00,0.39,16533.0,United Kingdom
569230,82580,BATHROOM METAL SIGN,5,2011-10-02 15:07:00,0.55,16533.0,United Kingdom
569230,22989,SET 2 PANTRY DESIGN TEA TOWELS,1,2011-10-02 15:07:00,3.25,16533.0,United Kingdom
569230,82583,HOT BATHS METAL SIGN,1,2011-10-02 15:07:00,2.1,16533.0,United Kingdom
569230,85152,HAND OVER THE CHOCOLATE   SIGN ,1,2011-10-02 15:07:00,2.1,16533.0,United Kingdom
569230,82567,"AIRLINE LOUNGE,METAL SIGN",1,2011-10-02 15:07:00,2.1,16533.0,United Kingdom
569230,21169,YOU'RE CONFUSING ME METAL SIGN ,2,2011-10-02 15:07:00,1.69,16533.0,United Kingdom
569230,21181,PLEASE ONE PERSON METAL SIGN,1,2011-10-02 15:07:00,2.1,16533.0,United Kingdom
569230,21907,I'M ON HOLIDAY METAL SIGN,1,2011-10-02 15:07:00,2.1,16533.0,United Kingdom
569230,21905,MORE BUTTER METAL SIGN ,1,2011-10-02 15:07:00,0.79,16533.0,United Kingdom
569230,21166,COOK WITH WINE METAL SIGN ,1,2011-10-02 15:07:00,2.08,16533.0,United Kingdom
569230,22488,NATURAL SLATE RECTANGLE CHALKBOARD,1,2011-10-02 15:07:00,1.65,16533.0,United Kingdom
569230,22722,SET OF 6 SPICE TINS PANTRY DESIGN,1,2011-10-02 15:07:00,3.95,16533.0,United Kingdom
569230,47503A,ASS FLORAL PRINT MULTI SCREWDRIVER,12,2011-10-02 15:07:00,0.42,16533.0,United Kingdom
569230,85053,FRENCH ENAMEL CANDLEHOLDER,2,2011-10-02 15:07:00,2.1,16533.0,United Kingdom
569230,23245,SET OF 3 REGENCY CAKE TINS,2,2011-10-02 15:07:00,4.95,16533.0,United Kingdom
569230,22794,SWEETHEART WIRE MAGAZINE RACK,1,2011-10-02 15:07:00,7.95,16533.0,United Kingdom
569230,22456,NATURAL SLATE CHALKBOARD LARGE ,1,2011-10-02 15:07:00,4.95,16533.0,United Kingdom
569230,22507,MEMO BOARD RETROSPOT  DESIGN,1,2011-10-02 15:07:00,4.95,16533.0,United Kingdom
569230,23110,PARISIENNE KEY CABINET ,1,2011-10-02 15:07:00,5.75,16533.0,United Kingdom
569230,82484,WOOD BLACK BOARD ANT WHITE FINISH,1,2011-10-02 15:07:00,7.95,16533.0,United Kingdom
569230,22645,CERAMIC HEART FAIRY CAKE MONEY BANK,4,2011-10-02 15:07:00,1.45,16533.0,United Kingdom
569231,21377,SMALL CAMPHOR WOOD FIELD  MUSHROOM,2,2011-10-02 15:18:00,1.65,13379.0,United Kingdom
569231,22818,CARD CHRISTMAS VILLAGE,12,2011-10-02 15:18:00,0.42,13379.0,United Kingdom
569231,22049,WRAP CHRISTMAS SCREEN PRINT,25,2011-10-02 15:18:00,0.19,13379.0,United Kingdom
569231,23354,6 GIFT TAGS 50'S CHRISTMAS ,1,2011-10-02 15:18:00,0.83,13379.0,United Kingdom
569231,22339,CHRISTMAS TREE PAINTED ZINC ,8,2011-10-02 15:18:00,0.19,13379.0,United Kingdom
569231,22336,DOVE DECORATION PAINTED ZINC ,5,2011-10-02 15:18:00,0.19,13379.0,United Kingdom
569231,22337,ANGEL DECORATION PAINTED ZINC ,6,2011-10-02 15:18:00,0.65,13379.0,United Kingdom
569231,23375,50'S CHRISTMAS PAPER GIFT BAG,20,2011-10-02 15:18:00,0.82,13379.0,United Kingdom
569231,22043,CHRISTMAS CARD SCREEN PRINT ,12,2011-10-02 15:18:00,0.19,13379.0,United Kingdom
569231,84247E,PACK OF 12 CHRISTMAS FUN CARDS,1,2011-10-02 15:18:00,2.95,13379.0,United Kingdom
569231,22508,DOORSTOP RETROSPOT HEART,1,2011-10-02 15:18:00,3.75,13379.0,United Kingdom
569231,23101,SILVER STARS TABLE DECORATION,3,2011-10-02 15:18:00,0.83,13379.0,United Kingdom
569231,23100,SILVER BELLS TABLE DECORATION,2,2011-10-02 15:18:00,1.25,13379.0,United Kingdom
569231,21668,RED STRIPE CERAMIC DRAWER KNOB,6,2011-10-02 15:18:00,1.45,13379.0,United Kingdom
569231,21672,WHITE SPOT RED CERAMIC DRAWER KNOB,6,2011-10-02 15:18:00,1.45,13379.0,United Kingdom
569231,21671,RED SPOT CERAMIC DRAWER KNOB,6,2011-10-02 15:18:00,1.45,13379.0,United Kingdom
569231,23354,6 GIFT TAGS 50'S CHRISTMAS ,14,2011-10-02 15:18:00,0.83,13379.0,United Kingdom
569231,22637,PIGGY BANK RETROSPOT ,4,2011-10-02 15:18:00,2.55,13379.0,United Kingdom
569231,23399,HOME SWEET HOME HANGING HEART,7,2011-10-02 15:18:00,0.85,13379.0,United Kingdom
569231,21169,YOU'RE CONFUSING ME METAL SIGN ,1,2011-10-02 15:18:00,1.69,13379.0,United Kingdom
569231,22338,STAR DECORATION PAINTED ZINC ,24,2011-10-02 15:18:00,0.19,13379.0,United Kingdom
569231,23284,DOORMAT KEEP CALM AND COME IN,4,2011-10-02 15:18:00,8.25,13379.0,United Kingdom
569231,23381,PACK OF 12 VINTAGE LEAF TISSUES ,10,2011-10-02 15:18:00,0.39,13379.0,United Kingdom
569231,22906,12 MESSAGE CARDS WITH ENVELOPES,4,2011-10-02 15:18:00,1.65,13379.0,United Kingdom
569231,22487,WHITE WOOD GARDEN PLANT LADDER,1,2011-10-02 15:18:00,9.95,13379.0,United Kingdom
569231,23144,ZINC T-LIGHT HOLDER STARS SMALL,5,2011-10-02 15:18:00,0.83,13379.0,United Kingdom
569231,23153,ZINC SWEETHEART WIRE LETTER RACK,1,2011-10-02 15:18:00,3.75,13379.0,United Kingdom
569231,23145,ZINC T-LIGHT HOLDER STAR LARGE,5,2011-10-02 15:18:00,0.95,13379.0,United Kingdom
569231,23380,PACK OF 12 VINTAGE DOILY TISSUES,10,2011-10-02 15:18:00,0.39,13379.0,United Kingdom
569231,22094,RED RETROSPOT TISSUE BOX,1,2011-10-02 15:18:00,0.39,13379.0,United Kingdom
569231,20956,PORCELAIN T-LIGHT HOLDERS ASSORTED,5,2011-10-02 15:18:00,1.25,13379.0,United Kingdom
569231,22189,CREAM HEART CARD HOLDER,3,2011-10-02 15:18:00,3.95,13379.0,United Kingdom
569231,22795,SWEETHEART RECIPE BOOK STAND,1,2011-10-02 15:18:00,6.75,13379.0,United Kingdom
569231,22170,PICTURE FRAME WOOD TRIPLE PORTRAIT,2,2011-10-02 15:18:00,6.75,13379.0,United Kingdom
569231,22577,WOODEN HEART CHRISTMAS SCANDINAVIAN,10,2011-10-02 15:18:00,0.29,13379.0,United Kingdom
569231,22596,CHRISTMAS STAR WISH LIST CHALKBOARD,5,2011-10-02 15:18:00,1.25,13379.0,United Kingdom
569231,22603,CHRISTMAS RETROSPOT TREE WOOD,9,2011-10-02 15:18:00,0.85,13379.0,United Kingdom
569231,21034,REX CASH+CARRY JUMBO SHOPPER,1,2011-10-02 15:18:00,0.95,13379.0,United Kingdom
569231,82494L,WOODEN FRAME ANTIQUE WHITE ,6,2011-10-02 15:18:00,2.95,13379.0,United Kingdom
569231,22151,PLACE SETTING WHITE HEART,24,2011-10-02 15:18:00,0.42,13379.0,United Kingdom
569231,22152,PLACE SETTING WHITE STAR,24,2011-10-02 15:18:00,0.42,13379.0,United Kingdom
569231,82482,WOODEN PICTURE FRAME WHITE FINISH,6,2011-10-02 15:18:00,2.95,13379.0,United Kingdom
569231,23293,SET OF 12 FAIRY CAKE BAKING CASES,2,2011-10-02 15:18:00,0.83,13379.0,United Kingdom
569231,23295,SET OF 12 MINI LOAF BAKING CASES,2,2011-10-02 15:18:00,0.83,13379.0,United Kingdom
569231,35970,ZINC FOLKART SLEIGH BELLS,2,2011-10-02 15:18:00,1.69,13379.0,United Kingdom
569232,15060B,FAIRY CAKE DESIGN UMBRELLA,3,2011-10-02 15:26:00,3.75,16667.0,United Kingdom
569232,20679,EDWARDIAN PARASOL RED,3,2011-10-02 15:26:00,5.95,16667.0,United Kingdom
569232,85014A,BLACK/BLUE POLKADOT UMBRELLA,3,2011-10-02 15:26:00,5.95,16667.0,United Kingdom
569232,51014C,"FEATHER PEN,COAL BLACK",12,2011-10-02 15:26:00,0.39,16667.0,United Kingdom
569232,21559,STRAWBERRY LUNCH BOX WITH CUTLERY,1,2011-10-02 15:26:00,2.55,16667.0,United Kingdom
569232,85071B,RED CHARLIE+LOLA PERSONAL DOORSIGN,5,2011-10-02 15:26:00,0.39,16667.0,United Kingdom
569232,85071A,BLUE CHARLIE+LOLA PERSONAL DOORSIGN,5,2011-10-02 15:26:00,0.39,16667.0,United Kingdom
569232,84375,SET OF 20 KIDS COOKIE CUTTERS,2,2011-10-02 15:26:00,2.1,16667.0,United Kingdom
569232,21207,SKULL AND CROSSBONES  GARLAND ,5,2011-10-02 15:26:00,1.65,16667.0,United Kingdom
569232,22086,PAPER CHAIN KIT 50'S CHRISTMAS ,5,2011-10-02 15:26:00,2.95,16667.0,United Kingdom
569232,20974,12 PENCILS SMALL TUBE SKULL,5,2011-10-02 15:26:00,0.65,16667.0,United Kingdom
569232,22964,3 PIECE SPACEBOY COOKIE CUTTER SET,3,2011-10-02 15:26:00,2.1,16667.0,United Kingdom
569232,22966,GINGERBREAD MAN COOKIE CUTTER,3,2011-10-02 15:26:00,1.25,16667.0,United Kingdom
569232,84032B,CHARLIE + LOLA RED HOT WATER BOTTLE,2,2011-10-02 15:26:00,2.95,16667.0,United Kingdom
569232,84032A,CHARLIE+LOLA PINK HOT WATER BOTTLE,2,2011-10-02 15:26:00,2.95,16667.0,United Kingdom
569232,22112,CHOCOLATE HOT WATER BOTTLE,2,2011-10-02 15:26:00,4.95,16667.0,United Kingdom
569232,23356,LOVE HOT WATER BOTTLE,2,2011-10-02 15:26:00,5.95,16667.0,United Kingdom
569232,23355,HOT WATER BOTTLE KEEP CALM,2,2011-10-02 15:26:00,4.95,16667.0,United Kingdom
569232,22111,SCOTTIE DOG HOT WATER BOTTLE,2,2011-10-02 15:26:00,4.95,16667.0,United Kingdom
569232,22114,HOT WATER BOTTLE TEA AND SYMPATHY,2,2011-10-02 15:26:00,4.25,16667.0,United Kingdom
569232,21479,WHITE SKULL HOT WATER BOTTLE ,2,2011-10-02 15:26:00,4.25,16667.0,United Kingdom
569232,20727,LUNCH BAG  BLACK SKULL.,10,2011-10-02 15:26:00,1.65,16667.0,United Kingdom
569232,21558,SKULL LUNCH BOX WITH CUTLERY ,6,2011-10-02 15:26:00,2.55,16667.0,United Kingdom
569232,22771,CLEAR DRAWER KNOB ACRYLIC EDWARDIAN,12,2011-10-02 15:26:00,1.25,16667.0,United Kingdom
569232,22772,PINK DRAWER KNOB ACRYLIC EDWARDIAN,12,2011-10-02 15:26:00,1.25,16667.0,United Kingdom
569232,22805,BLUE DRAWER KNOB ACRYLIC EDWARDIAN,12,2011-10-02 15:26:00,1.25,16667.0,United Kingdom
569232,22775,PURPLE DRAWERKNOB ACRYLIC EDWARDIAN,12,2011-10-02 15:26:00,1.25,16667.0,United Kingdom
569232,22774,RED DRAWER KNOB ACRYLIC EDWARDIAN,12,2011-10-02 15:26:00,1.25,16667.0,United Kingdom
569232,22186,RED STAR CARD HOLDER,6,2011-10-02 15:26:00,1.95,16667.0,United Kingdom
569232,22167, OVAL WALL MIRROR DIAMANTE ,2,2011-10-02 15:26:00,9.95,16667.0,United Kingdom
569232,22165,"DIAMANTE HEART SHAPED WALL MIRROR, ",2,2011-10-02 15:26:00,12.75,16667.0,United Kingdom
569232,22947,WOODEN ADVENT CALENDAR RED,2,2011-10-02 15:26:00,16.95,16667.0,United Kingdom
C569233,85114B,IVORY ENCHANTED FOREST PLACEMAT,-2,2011-10-02 15:26:00,1.65,17841.0,United Kingdom
C569233,22350,ILLUSTRATED CAT BOWL ,-1,2011-10-02 15:26:00,2.55,17841.0,United Kingdom
C569233,22467,GUMBALL COAT RACK,-2,2011-10-02 15:26:00,2.55,17841.0,United Kingdom
569234,21558,SKULL LUNCH BOX WITH CUTLERY ,1,2011-10-02 15:33:00,2.55,17841.0,United Kingdom
569234,21716,BOYS VINTAGE TIN SEASIDE BUCKET,1,2011-10-02 15:33:00,2.55,17841.0,United Kingdom
569234,23284,DOORMAT KEEP CALM AND COME IN,10,2011-10-02 15:33:00,7.08,17841.0,United Kingdom
569234,22212,FOUR HOOK  WHITE LOVEBIRDS,1,2011-10-02 15:33:00,2.1,17841.0,United Kingdom
569234,22452,MEASURING TAPE BABUSHKA PINK,1,2011-10-02 15:33:00,2.95,17841.0,United Kingdom
569234,23087,ZINC  HEART T-LIGHT HOLDER,1,2011-10-02 15:33:00,1.25,17841.0,United Kingdom
569234,23275,SET OF 3 HANGING OWLS OLLIE BEAK,3,2011-10-02 15:33:00,1.25,17841.0,United Kingdom
569234,79302M,"ART LIGHTS,FUNK MONKEY",1,2011-10-02 15:33:00,2.95,17841.0,United Kingdom
569234,23006,TRAVEL CARD WALLET FLOWER MEADOW,1,2011-10-02 15:33:00,0.42,17841.0,United Kingdom
569234,23081,GREEN METAL BOX ARMY SUPPLIES,1,2011-10-02 15:33:00,8.25,17841.0,United Kingdom
569234,23080,RED METAL BOX TOP SECRET,1,2011-10-02 15:33:00,8.25,17841.0,United Kingdom
569234,23203,JUMBO BAG VINTAGE DOILY ,1,2011-10-02 15:33:00,2.08,17841.0,United Kingdom
569234,22568,FELTCRAFT CUSHION OWL,1,2011-10-02 15:33:00,3.75,17841.0,United Kingdom
569234,22755,SMALL PURPLE BABUSHKA NOTEBOOK ,1,2011-10-02 15:33:00,0.85,17841.0,United Kingdom
569234,85053,FRENCH ENAMEL CANDLEHOLDER,1,2011-10-02 15:33:00,2.1,17841.0,United Kingdom
569234,22725,ALARM CLOCK BAKELIKE CHOCOLATE,1,2011-10-02 15:33:00,3.75,17841.0,United Kingdom
569234,21756,BATH BUILDING BLOCK WORD,1,2011-10-02 15:33:00,6.25,17841.0,United Kingdom
569234,21925,UNION STRIPE CUSHION COVER ,1,2011-10-02 15:33:00,1.25,17841.0,United Kingdom
569234,23403,LETTER HOLDER HOME SWEET HOME,2,2011-10-02 15:33:00,3.75,17841.0,United Kingdom
569234,23393,HOME SWEET HOME CUSHION COVER ,2,2011-10-02 15:33:00,3.75,17841.0,United Kingdom
569234,23396,LE JARDIN BOTANIQUE CUSHION COVER,3,2011-10-02 15:33:00,3.75,17841.0,United Kingdom
569234,23394,POSTE FRANCE CUSHION COVER,3,2011-10-02 15:33:00,3.75,17841.0,United Kingdom
569234,21686,MEDINA STAMPED METAL STOOL,1,2011-10-02 15:33:00,39.95,17841.0,United Kingdom
569234,21673,WHITE SPOT BLUE CERAMIC DRAWER KNOB,12,2011-10-02 15:33:00,1.45,17841.0,United Kingdom
569234,20961,STRAWBERRY BATH SPONGE ,1,2011-10-02 15:33:00,1.25,17841.0,United Kingdom
569234,82578,KITCHEN METAL SIGN,1,2011-10-02 15:33:00,0.55,17841.0,United Kingdom
569234,23399,HOME SWEET HOME HANGING HEART,3,2011-10-02 15:33:00,0.85,17841.0,United Kingdom
569234,20707,CRAZY DAISY HEART DECORATION,1,2011-10-02 15:33:00,1.25,17841.0,United Kingdom
569234,23323,WHITE WICKER STAR ,1,2011-10-02 15:33:00,2.1,17841.0,United Kingdom
569234,22227,HANGING HEART MIRROR DECORATION ,2,2011-10-02 15:33:00,0.65,17841.0,United Kingdom
569234,21975,PACK OF 60 DINOSAUR CAKE CASES,1,2011-10-02 15:33:00,0.55,17841.0,United Kingdom
569234,21718,RED METAL BEACH SPADE ,1,2011-10-02 15:33:00,1.25,17841.0,United Kingdom
569234,22663,JUMBO BAG DOLLY GIRL DESIGN,1,2011-10-02 15:33:00,2.08,17841.0,United Kingdom
569234,20992,JAZZ HEARTS PURSE NOTEBOOK,1,2011-10-02 15:33:00,0.39,17841.0,United Kingdom
569234,21201,TROPICAL  HONEYCOMB PAPER GARLAND ,1,2011-10-02 15:33:00,2.55,17841.0,United Kingdom
569234,22041,"RECORD FRAME 7"" SINGLE SIZE ",1,2011-10-02 15:33:00,2.55,17841.0,United Kingdom
569234,21669,BLUE STRIPE CERAMIC DRAWER KNOB,24,2011-10-02 15:33:00,1.45,17841.0,United Kingdom
569234,22774,RED DRAWER KNOB ACRYLIC EDWARDIAN,12,2011-10-02 15:33:00,1.25,17841.0,United Kingdom
569234,21670,BLUE SPOT CERAMIC DRAWER KNOB,24,2011-10-02 15:33:00,1.45,17841.0,United Kingdom
569234,22310,IVORY KNITTED MUG COSY ,1,2011-10-02 15:33:00,1.65,17841.0,United Kingdom
569234,22219,LOVEBIRD HANGING DECORATION WHITE ,2,2011-10-02 15:33:00,0.85,17841.0,United Kingdom
569234,22335,HEART DECORATION PAINTED ZINC ,1,2011-10-02 15:33:00,0.65,17841.0,United Kingdom
569234,21212,PACK OF 72 RETROSPOT CAKE CASES,1,2011-10-02 15:33:00,0.55,17841.0,United Kingdom
569234,21439,BASKET OF TOADSTOOLS,1,2011-10-02 15:33:00,1.25,17841.0,United Kingdom
569234,22554,PLASTERS IN TIN WOODLAND ANIMALS,1,2011-10-02 15:33:00,1.65,17841.0,United Kingdom
569234,21578,WOODLAND DESIGN  COTTON TOTE BAG,2,2011-10-02 15:33:00,2.25,17841.0,United Kingdom
569234,22623,BOX OF VINTAGE JIGSAW BLOCKS ,1,2011-10-02 15:33:00,5.95,17841.0,United Kingdom
569234,22326,ROUND SNACK BOXES SET OF4 WOODLAND ,1,2011-10-02 15:33:00,2.95,17841.0,United Kingdom
569234,23406,HOME SWEET HOME KEY HOLDER,1,2011-10-02 15:33:00,6.25,17841.0,United Kingdom
569234,22179,SET 10 NIGHT OWL LIGHTS,2,2011-10-02 15:33:00,6.75,17841.0,United Kingdom
569234,79321,CHILLI LIGHTS,4,2011-10-02 15:33:00,5.75,17841.0,United Kingdom
569234,22475,SKULL DESIGN TV DINNER TRAY,2,2011-10-02 15:33:00,4.95,17841.0,United Kingdom
569234,22766,PHOTO FRAME CORNICE,1,2011-10-02 15:33:00,2.95,17841.0,United Kingdom
569234,22425,ENAMEL COLANDER CREAM,1,2011-10-02 15:33:00,4.95,17841.0,United Kingdom
569234,22348,TEA BAG PLATE RED RETROSPOT,1,2011-10-02 15:33:00,0.85,17841.0,United Kingdom
569234,22350,ILLUSTRATED CAT BOWL ,1,2011-10-02 15:33:00,2.55,17841.0,United Kingdom
569234,23112,PARISIENNE CURIO CABINET,1,2011-10-02 15:33:00,7.5,17841.0,United Kingdom
569234,23110,PARISIENNE KEY CABINET ,1,2011-10-02 15:33:00,5.75,17841.0,United Kingdom
569234,21137,BLACK RECORD COVER FRAME,6,2011-10-02 15:33:00,3.75,17841.0,United Kingdom
569234,22222,CAKE PLATE LOVEBIRD WHITE,1,2011-10-02 15:33:00,4.95,17841.0,United Kingdom
569234,22212,FOUR HOOK  WHITE LOVEBIRDS,1,2011-10-02 15:33:00,2.1,17841.0,United Kingdom
569234,23133,LARGE IVORY HEART WALL ORGANISER,1,2011-10-02 15:33:00,8.25,17841.0,United Kingdom
569234,46000U,POLYESTER FILLER PAD 30CMx30CM,2,2011-10-02 15:33:00,1.25,17841.0,United Kingdom
569234,46000M,POLYESTER FILLER PAD 45x45cm,4,2011-10-02 15:33:00,1.55,17841.0,United Kingdom
569234,23403,LETTER HOLDER HOME SWEET HOME,1,2011-10-02 15:33:00,3.75,17841.0,United Kingdom
569234,23393,HOME SWEET HOME CUSHION COVER ,1,2011-10-02 15:33:00,3.75,17841.0,United Kingdom
569234,22179,SET 10 NIGHT OWL LIGHTS,1,2011-10-02 15:33:00,6.75,17841.0,United Kingdom
569234,20830,SILVER PHOTO FRAME,2,2011-10-02 15:33:00,2.1,17841.0,United Kingdom
569234,21559,STRAWBERRY LUNCH BOX WITH CUTLERY,1,2011-10-02 15:33:00,2.55,17841.0,United Kingdom
569234,20616,CHERRY BLOSSOM PASSPORT COVER,1,2011-10-02 15:33:00,0.75,17841.0,United Kingdom
569234,20971,PINK BLUE FELT CRAFT TRINKET BOX,1,2011-10-02 15:33:00,1.25,17841.0,United Kingdom
569234,21981,PACK OF 12 WOODLAND TISSUES ,12,2011-10-02 15:33:00,0.39,17841.0,United Kingdom
569234,22557,PLASTERS IN TIN VINTAGE PAISLEY ,1,2011-10-02 15:33:00,1.65,17841.0,United Kingdom
569234,22326,ROUND SNACK BOXES SET OF4 WOODLAND ,1,2011-10-02 15:33:00,2.95,17841.0,United Kingdom
569234,22356,CHARLOTTE BAG PINK POLKADOT,1,2011-10-02 15:33:00,0.85,17841.0,United Kingdom
569234,21955,DOORMAT UNION JACK GUNS AND ROSES,1,2011-10-02 15:33:00,8.25,17841.0,United Kingdom
569234,21122,SET/10 PINK POLKADOT PARTY CANDLES,2,2011-10-02 15:33:00,1.25,17841.0,United Kingdom
569234,23203,JUMBO BAG VINTAGE DOILY ,1,2011-10-02 15:33:00,2.08,17841.0,United Kingdom
569234,22995,TRAVEL CARD WALLET SUKI,1,2011-10-02 15:33:00,0.42,17841.0,United Kingdom
569234,22077,6 RIBBONS RUSTIC CHARM,1,2011-10-02 15:33:00,1.95,17841.0,United Kingdom
569234,82482,WOODEN PICTURE FRAME WHITE FINISH,1,2011-10-02 15:33:00,2.95,17841.0,United Kingdom
569234,22807,SET OF 6 T-LIGHTS TOADSTOOLS,1,2011-10-02 15:33:00,2.95,17841.0,United Kingdom
569234,23287,RED VINTAGE SPOT BEAKER,1,2011-10-02 15:33:00,0.85,17841.0,United Kingdom
569234,22721,SET OF 3 CAKE TINS SKETCHBOOK,1,2011-10-02 15:33:00,4.95,17841.0,United Kingdom
569234,84509B,SET OF 4 FAIRY CAKE PLACEMATS,1,2011-10-02 15:33:00,3.75,17841.0,United Kingdom
569234,22200,FRYING PAN PINK POLKADOT,1,2011-10-02 15:33:00,4.25,17841.0,United Kingdom
569234,22055,MINI CAKE STAND  HANGING STRAWBERY,1,2011-10-02 15:33:00,1.65,17841.0,United Kingdom
569234,22064,PINK DOUGHNUT TRINKET POT ,1,2011-10-02 15:33:00,1.65,17841.0,United Kingdom
569234,21232,STRAWBERRY CERAMIC TRINKET BOX,1,2011-10-02 15:33:00,1.25,17841.0,United Kingdom
569234,22063,CERAMIC BOWL WITH STRAWBERRY DESIGN,1,2011-10-02 15:33:00,2.95,17841.0,United Kingdom
569235,20668,DISCO BALL CHRISTMAS DECORATION,48,2011-10-02 15:35:00,0.12,17841.0,United Kingdom
569236,85231G,ORANGE SCENTED SET/9 T-LIGHTS,5,2011-10-02 15:49:00,0.85,14432.0,United Kingdom
569236,85231B,CINAMMON SET OF 9 T-LIGHTS,5,2011-10-02 15:49:00,0.85,14432.0,United Kingdom
569236,17012C,ORIGAMI LAVENDER INCENSE/CANDL SET ,6,2011-10-02 15:49:00,0.85,14432.0,United Kingdom
569236,17012D,ORIGAMI ROSE INCENSE/CANDLE SET ,6,2011-10-02 15:49:00,0.85,14432.0,United Kingdom
569236,17012F,ORIGAMI SANDLEWOOD INCENSE/CAND SET,6,2011-10-02 15:49:00,0.85,14432.0,United Kingdom
569236,17012A,ORIGAMI VANILLA INCENSE/CANDLE SET ,6,2011-10-02 15:49:00,0.85,14432.0,United Kingdom
569236,21012,ANTIQUE ALL GLASS CANDLESTICK,4,2011-10-02 15:49:00,2.1,14432.0,United Kingdom
569236,71477,COLOUR GLASS. STAR T-LIGHT HOLDER,3,2011-10-02 15:49:00,3.95,14432.0,United Kingdom
569236,82494L,WOODEN FRAME ANTIQUE WHITE ,4,2011-10-02 15:49:00,2.95,14432.0,United Kingdom
569236,23298,SPOTTY BUNTING,4,2011-10-02 15:49:00,4.95,14432.0,United Kingdom
569236,47566,PARTY BUNTING,2,2011-10-02 15:49:00,4.95,14432.0,United Kingdom
569236,22669,RED BABY BUNTING ,5,2011-10-02 15:49:00,2.95,14432.0,United Kingdom
569236,22993,SET OF 4 PANTRY JELLY MOULDS,1,2011-10-02 15:49:00,1.25,14432.0,United Kingdom
569236,85111,SILVER GLITTER FLOWER VOTIVE HOLDER,12,2011-10-02 15:49:00,0.29,14432.0,United Kingdom
569236,22632,HAND WARMER RED RETROSPOT,4,2011-10-02 15:49:00,2.1,14432.0,United Kingdom
569236,23439,HAND WARMER RED LOVE HEART,4,2011-10-02 15:49:00,2.1,14432.0,United Kingdom
569236,35964,FOLKART CLIP ON STARS,4,2011-10-02 15:49:00,0.39,14432.0,United Kingdom
569236,85230G,ORANGE VOTIVE CANDLE,24,2011-10-02 15:49:00,0.29,14432.0,United Kingdom
569236,85230B,CINNAMON SCENTED VOTIVE CANDLE,24,2011-10-02 15:49:00,0.29,14432.0,United Kingdom
569236,22778,GLASS CLOCHE SMALL,1,2011-10-02 15:49:00,3.95,14432.0,United Kingdom
569236,17091J,VANILLA INCENSE IN TIN,12,2011-10-02 15:49:00,0.38,14432.0,United Kingdom
569236,22637,PIGGY BANK RETROSPOT ,4,2011-10-02 15:49:00,2.55,14432.0,United Kingdom
569236,23169,CLASSIC GLASS COOKIE JAR,1,2011-10-02 15:49:00,4.15,14432.0,United Kingdom
569236,22672,FRENCH BATHROOM SIGN BLUE METAL,4,2011-10-02 15:49:00,1.65,14432.0,United Kingdom
569236,82580,BATHROOM METAL SIGN,6,2011-10-02 15:49:00,0.55,14432.0,United Kingdom
569236,21136,PAINTED METAL PEARS ASSORTED,6,2011-10-02 15:49:00,1.69,14432.0,United Kingdom
569236,22342,HOME GARLAND PAINTED ZINC ,6,2011-10-02 15:49:00,0.75,14432.0,United Kingdom
569236,35914,PINK CHICK EGG WARMER + EGG CUP,3,2011-10-02 15:49:00,0.85,14432.0,United Kingdom
569236,21403,BLUE EGG  SPOON,6,2011-10-02 15:49:00,0.12,14432.0,United Kingdom
569236,21402,RED  EGG  SPOON,6,2011-10-02 15:49:00,0.12,14432.0,United Kingdom
569236,21400,RED PUDDING SPOON,6,2011-10-02 15:49:00,0.12,14432.0,United Kingdom
569236,21401,BLUE PUDDING SPOON,6,2011-10-02 15:49:00,0.12,14432.0,United Kingdom
569236,22208,WOOD STAMP SET THANK YOU,1,2011-10-02 15:49:00,0.83,14432.0,United Kingdom
569236,22209,WOOD STAMP SET HAPPY BIRTHDAY,1,2011-10-02 15:49:00,0.83,14432.0,United Kingdom
569236,22210,WOOD STAMP SET BEST WISHES,1,2011-10-02 15:49:00,0.83,14432.0,United Kingdom
569236,22211,WOOD STAMP SET FLOWERS,1,2011-10-02 15:49:00,0.83,14432.0,United Kingdom
569236,85032A,ROMANTIC IMAGES GIFT WRAP SET,2,2011-10-02 15:49:00,0.65,14432.0,United Kingdom
569236,85032B,BLOSSOM IMAGES GIFT WRAP SET,2,2011-10-02 15:49:00,0.65,14432.0,United Kingdom
569236,85032C,CURIOUS IMAGES GIFT WRAP SET,2,2011-10-02 15:49:00,0.65,14432.0,United Kingdom
569236,22488,NATURAL SLATE RECTANGLE CHALKBOARD,4,2011-10-02 15:49:00,1.65,14432.0,United Kingdom
569236,85123A,WHITE HANGING HEART T-LIGHT HOLDER,8,2011-10-02 15:49:00,2.95,14432.0,United Kingdom
569236,35911A,MULTICOLOUR RABBIT EGG WARMER,3,2011-10-02 15:49:00,0.85,14432.0,United Kingdom
569236,22602,RETROSPOT WOODEN HEART DECORATION,6,2011-10-02 15:49:00,0.85,14432.0,United Kingdom
569236,22294,HEART FILIGREE DOVE  SMALL,6,2011-10-02 15:49:00,1.25,14432.0,United Kingdom
569236,21391,FRENCH LAVENDER SCENT HEART,3,2011-10-02 15:49:00,0.75,14432.0,United Kingdom
569236,21811,HANGING HEART WITH BELL,2,2011-10-02 15:49:00,0.39,14432.0,United Kingdom
569236,21810,CHRISTMAS HANGING STAR WITH BELL,2,2011-10-02 15:49:00,0.39,14432.0,United Kingdom
569236,21823,PAINTED METAL HEART WITH HOLLY BELL,4,2011-10-02 15:49:00,0.39,14432.0,United Kingdom
569236,22161,HEART DECORATION RUSTIC HANGING ,4,2011-10-02 15:49:00,0.19,14432.0,United Kingdom
569236,22338,STAR DECORATION PAINTED ZINC ,4,2011-10-02 15:49:00,0.19,14432.0,United Kingdom
569236,22152,PLACE SETTING WHITE STAR,2,2011-10-02 15:49:00,0.42,14432.0,United Kingdom
569236,22151,PLACE SETTING WHITE HEART,2,2011-10-02 15:49:00,0.42,14432.0,United Kingdom
569236,22163,HEART STRING MEMO HOLDER HANGING,4,2011-10-02 15:49:00,0.79,14432.0,United Kingdom
569236,35967,FOLK ART METAL STAR T-LIGHT HOLDER,4,2011-10-02 15:49:00,0.38,14432.0,United Kingdom
569236,21809,CHRISTMAS HANGING TREE WITH BELL,2,2011-10-02 15:49:00,0.39,14432.0,United Kingdom
569236,35954,SMALL FOLKART STAR CHRISTMAS DEC,6,2011-10-02 15:49:00,0.19,14432.0,United Kingdom
569236,35933,PINK STOCKING CHRISTMAS DECORATION,4,2011-10-02 15:49:00,0.38,14432.0,United Kingdom
569236,35646,VINTAGE BEAD PINK EVENING BAG,6,2011-10-02 15:49:00,1.25,14432.0,United Kingdom
569236,35648,VINTAGE BEAD PINK PURSE ,8,2011-10-02 15:49:00,0.83,14432.0,United Kingdom
569236,35651,VINTAGE BEAD PINK SCARF ,4,2011-10-02 15:49:00,1.65,14432.0,United Kingdom
569236,22469,HEART OF WICKER SMALL,6,2011-10-02 15:49:00,1.65,14432.0,United Kingdom
569236,35265,COLOURFUL FLOWER FRUIT BOWL,2,2011-10-02 15:49:00,1.95,14432.0,United Kingdom
569236,22093,MOTORING TISSUE BOX,4,2011-10-02 15:49:00,0.39,14432.0,United Kingdom
569236,22097,SWALLOW SQUARE TISSUE BOX,6,2011-10-02 15:49:00,0.39,14432.0,United Kingdom
569236,22094,RED RETROSPOT TISSUE BOX,6,2011-10-02 15:49:00,0.39,14432.0,United Kingdom
569236,23270,SET OF 2 CERAMIC PAINTED HEARTS ,1,2011-10-02 15:49:00,1.45,14432.0,United Kingdom
569237,23525,BUFFALO BILL WALL ART ,2,2011-10-02 15:50:00,3.75,,United Kingdom
569237,79321,CHILLI LIGHTS,2,2011-10-02 15:50:00,5.75,,United Kingdom
569237,22776,SWEETHEART 3 TIER CAKE STAND ,1,2011-10-02 15:50:00,9.95,,United Kingdom
569237,23189,SET OF 12 FORK CANDLES,2,2011-10-02 15:50:00,2.89,,United Kingdom
569237,23532,WALL ART WORK REST AND PLAY  ,1,2011-10-02 15:50:00,4.95,,United Kingdom
569237,23539,WALL ART LOVES' SECRET ,2,2011-10-02 15:50:00,5.95,,United Kingdom
569238,22417,PACK OF 60 SPACEBOY CAKE CASES,1,2011-10-02 15:52:00,0.55,17954.0,United Kingdom
569238,21213,PACK OF 72 SKULL CAKE CASES,6,2011-10-02 15:52:00,0.55,17954.0,United Kingdom
569238,21212,PACK OF 72 RETROSPOT CAKE CASES,3,2011-10-02 15:52:00,0.55,17954.0,United Kingdom
569238,22326,ROUND SNACK BOXES SET OF4 WOODLAND ,1,2011-10-02 15:52:00,2.95,17954.0,United Kingdom
569238,22328,ROUND SNACK BOXES SET OF 4 FRUITS ,2,2011-10-02 15:52:00,2.95,17954.0,United Kingdom
569238,22329,ROUND CONTAINER SET OF 5 RETROSPOT,1,2011-10-02 15:52:00,1.65,17954.0,United Kingdom
569238,21558,SKULL LUNCH BOX WITH CUTLERY ,2,2011-10-02 15:52:00,2.55,17954.0,United Kingdom
569238,22085,PAPER CHAIN KIT SKULLS ,3,2011-10-02 15:52:00,2.95,17954.0,United Kingdom
569238,23350,ROLL WRAP VINTAGE SPOT ,5,2011-10-02 15:52:00,1.25,17954.0,United Kingdom
569238,23346,SPACEBOY BEAKER,2,2011-10-02 15:52:00,1.25,17954.0,United Kingdom
569238,23345, DOLLY GIRL BEAKER,1,2011-10-02 15:52:00,1.25,17954.0,United Kingdom
569238,21086,SET/6 RED SPOTTY PAPER CUPS,2,2011-10-02 15:52:00,0.65,17954.0,United Kingdom
569238,21987,PACK OF 6 SKULL PAPER CUPS,12,2011-10-02 15:52:00,0.65,17954.0,United Kingdom
