InvoiceNo,StockCode,Description,Quantity,InvoiceDate,UnitPrice,CustomerID,Country
564735,23112,PARISIENNE CURIO CABINET,2,2011-08-28 13:35:00,7.5,15856.0,United Kingdom
564735,21931,JUMBO STORAGE BAG SUKI,1,2011-08-28 13:35:00,2.08,15856.0,United Kingdom
564735,22817,CARD SUKI BIRTHDAY,12,2011-08-28 13:35:00,0.42,15856.0,United Kingdom
564735,22815,CARD PSYCHEDELIC APPLES,12,2011-08-28 13:35:00,0.42,15856.0,United Kingdom
564735,22814,CARD PARTY GAMES ,12,2011-08-28 13:35:00,0.42,15856.0,United Kingdom
564735,22025,RING OF ROSES BIRTHDAY CARD,12,2011-08-28 13:35:00,0.42,15856.0,United Kingdom
564735,22031,BOTANICAL LAVENDER BIRTHDAY CARD,12,2011-08-28 13:35:00,0.42,15856.0,United Kingdom
564735,22032,BOTANICAL LILY GREETING CARD,12,2011-08-28 13:35:00,0.42,15856.0,United Kingdom
564735,22037,ROBOT BIRTHDAY CARD,12,2011-08-28 13:35:00,0.42,15856.0,United Kingdom
564735,21507,ELEPHANT BIRTHDAY CARD ,12,2011-08-28 13:35:00,0.42,15856.0,United Kingdom
564735,22984,CARD GINGHAM ROSE ,12,2011-08-28 13:35:00,0.42,15856.0,United Kingdom
564735,22029,SPACEBOY BIRTHDAY CARD,12,2011-08-28 13:35:00,0.42,15856.0,United Kingdom
564735,22712,CARD DOLLY GIRL ,12,2011-08-28 13:35:00,0.42,15856.0,United Kingdom
564735,21506,"FANCY FONT BIRTHDAY CARD, ",12,2011-08-28 13:35:00,0.42,15856.0,United Kingdom
564735,22026,BANQUET BIRTHDAY  CARD  ,12,2011-08-28 13:35:00,0.42,15856.0,United Kingdom
564735,22027,TEA PARTY BIRTHDAY CARD,12,2011-08-28 13:35:00,0.42,15856.0,United Kingdom
564735,21504,SKULLS GREETING CARD,12,2011-08-28 13:35:00,0.42,15856.0,United Kingdom
564735,21509,COWBOYS AND INDIANS BIRTHDAY CARD ,12,2011-08-28 13:35:00,0.42,15856.0,United Kingdom
564735,22713,CARD I LOVE LONDON ,12,2011-08-28 13:35:00,0.42,15856.0,United Kingdom
564735,22716,CARD CIRCUS PARADE,12,2011-08-28 13:35:00,0.42,15856.0,United Kingdom
564735,22718,CARD CAT AND TREE ,12,2011-08-28 13:35:00,0.42,15856.0,United Kingdom
564735,22717,CARD DOG AND BALL ,12,2011-08-28 13:35:00,0.42,15856.0,United Kingdom
564735,90098,NECKLACE+BRACELET PINK BUTTERFLY,1,2011-08-28 13:35:00,2.55,15856.0,United Kingdom
564736,22673,FRENCH GARDEN SIGN BLUE METAL,12,2011-08-28 13:42:00,1.25,16353.0,United Kingdom
564736,82580,BATHROOM METAL SIGN,24,2011-08-28 13:42:00,0.55,16353.0,United Kingdom
564736,84378,SET OF 3 HEART COOKIE CUTTERS,24,2011-08-28 13:42:00,1.25,16353.0,United Kingdom
564736,22675,FRENCH KITCHEN SIGN BLUE METAL,12,2011-08-28 13:42:00,1.25,16353.0,United Kingdom
564736,20754,RETROSPOT RED WASHING UP GLOVES,12,2011-08-28 13:42:00,2.1,16353.0,United Kingdom
564736,20751,FUNKY WASHING UP GLOVES ASSORTED,12,2011-08-28 13:42:00,2.1,16353.0,United Kingdom
564736,79321,CHILLI LIGHTS,48,2011-08-28 13:42:00,4.95,16353.0,United Kingdom
564736,84029G,KNITTED UNION FLAG HOT WATER BOTTLE,12,2011-08-28 13:42:00,3.75,16353.0,United Kingdom
564736,21155,RED RETROSPOT PEG BAG,12,2011-08-28 13:42:00,2.55,16353.0,United Kingdom
564736,22895,SET OF 2 TEA TOWELS APPLE AND PEARS,12,2011-08-28 13:42:00,3.25,16353.0,United Kingdom
564736,84380,SET OF 3 BUTTERFLY COOKIE CUTTERS,24,2011-08-28 13:42:00,1.25,16353.0,United Kingdom
564737,21080,SET/20 RED RETROSPOT PAPER NAPKINS ,12,2011-08-28 14:00:00,0.85,15312.0,United Kingdom
564737,47566,PARTY BUNTING,4,2011-08-28 14:00:00,4.95,15312.0,United Kingdom
564737,20981,12 PENCILS TALL TUBE WOODLAND,12,2011-08-28 14:00:00,0.85,15312.0,United Kingdom
564737,84029E,RED WOOLLY HOTTIE WHITE HEART.,4,2011-08-28 14:00:00,3.95,15312.0,United Kingdom
564737,22114,HOT WATER BOTTLE TEA AND SYMPATHY,4,2011-08-28 14:00:00,4.25,15312.0,United Kingdom
564737,85123A,WHITE HANGING HEART T-LIGHT HOLDER,12,2011-08-28 14:00:00,2.95,15312.0,United Kingdom
564737,82482,WOODEN PICTURE FRAME WHITE FINISH,6,2011-08-28 14:00:00,2.55,15312.0,United Kingdom
564737,22189,CREAM HEART CARD HOLDER,8,2011-08-28 14:00:00,3.95,15312.0,United Kingdom
564737,22188,BLACK HEART CARD HOLDER,8,2011-08-28 14:00:00,3.95,15312.0,United Kingdom
564738,23356,LOVE HOT WATER BOTTLE,3,2011-08-28 14:16:00,5.95,16816.0,United Kingdom
564738,23355,HOT WATER BOTTLE KEEP CALM,4,2011-08-28 14:16:00,4.95,16816.0,United Kingdom
564738,84536A,ENGLISH ROSE NOTEBOOK A7 SIZE,16,2011-08-28 14:16:00,0.42,16816.0,United Kingdom
564739,84559A,3D SHEET OF DOG STICKERS,1,2011-08-28 14:28:00,0.85,16931.0,United Kingdom
564739,84012,MAGIC SHEEP WOOL GROWING FROM PAPER,1,2011-08-28 14:28:00,0.85,16931.0,United Kingdom
564739,84006,MAGIC TREE -PAPER FLOWERS,1,2011-08-28 14:28:00,0.85,16931.0,United Kingdom
564739,23084,RABBIT NIGHT LIGHT,1,2011-08-28 14:28:00,2.08,16931.0,United Kingdom
564739,23004,TRAVEL CARD WALLET PANTRY,6,2011-08-28 14:28:00,0.42,16931.0,United Kingdom
564739,23004,TRAVEL CARD WALLET PANTRY,6,2011-08-28 14:28:00,0.42,16931.0,United Kingdom
564739,23006,TRAVEL CARD WALLET FLOWER MEADOW,6,2011-08-28 14:28:00,0.42,16931.0,United Kingdom
564739,22996,TRAVEL CARD WALLET VINTAGE TICKET,3,2011-08-28 14:28:00,0.42,16931.0,United Kingdom
564739,23191,BUNDLE OF 3 RETRO NOTE BOOKS,6,2011-08-28 14:28:00,1.65,16931.0,United Kingdom
564739,20992,JAZZ HEARTS PURSE NOTEBOOK,6,2011-08-28 14:28:00,0.39,16931.0,United Kingdom
564739,22139,RETROSPOT TEA SET CERAMIC 11 PC ,4,2011-08-28 14:28:00,4.95,16931.0,United Kingdom
564739,23249,VINTAGE RED ENAMEL TRIM PLATE,3,2011-08-28 14:28:00,1.65,16931.0,United Kingdom
564739,23251,VINTAGE RED ENAMEL TRIM MUG ,3,2011-08-28 14:28:00,1.25,16931.0,United Kingdom
564739,23316,RED REFECTORY CLOCK ,2,2011-08-28 14:28:00,9.95,16931.0,United Kingdom
564739,22191,IVORY DINER WALL CLOCK,1,2011-08-28 14:28:00,8.5,16931.0,United Kingdom
564739,22193,RED DINER WALL CLOCK,1,2011-08-28 14:28:00,8.5,16931.0,United Kingdom
564739,22193,RED DINER WALL CLOCK,1,2011-08-28 14:28:00,8.5,16931.0,United Kingdom
564739,22191,IVORY DINER WALL CLOCK,1,2011-08-28 14:28:00,8.5,16931.0,United Kingdom
564739,22727,ALARM CLOCK BAKELIKE RED ,2,2011-08-28 14:28:00,3.75,16931.0,United Kingdom
564739,22725,ALARM CLOCK BAKELIKE CHOCOLATE,2,2011-08-28 14:28:00,3.75,16931.0,United Kingdom
564739,22730,ALARM CLOCK BAKELIKE IVORY,2,2011-08-28 14:28:00,3.75,16931.0,United Kingdom
564739,22726,ALARM CLOCK BAKELIKE GREEN,2,2011-08-28 14:28:00,3.75,16931.0,United Kingdom
564739,37413,ICON MUG REVOLUTIONARY,3,2011-08-28 14:28:00,0.39,16931.0,United Kingdom
564739,23237,SET OF 4 KNICK KNACK TINS LEAF,1,2011-08-28 14:28:00,4.15,16931.0,United Kingdom
564739,23239,SET OF 4 KNICK KNACK TINS POPPIES,1,2011-08-28 14:28:00,4.15,16931.0,United Kingdom
564739,21845,DAIRY MAID STRIPE MUG,4,2011-08-28 14:28:00,0.79,16931.0,United Kingdom
564739,23252,VINTAGE RED ENAMEL TRIM JUG ,3,2011-08-28 14:28:00,3.75,16931.0,United Kingdom
564739,23196,VINTAGE LEAF MAGNETIC NOTEPAD,6,2011-08-28 14:28:00,1.45,16931.0,United Kingdom
564739,23202,JUMBO BAG VINTAGE LEAF,2,2011-08-28 14:28:00,2.08,16931.0,United Kingdom
564740,22767,TRIPLE PHOTO FRAME CORNICE ,1,2011-08-28 14:39:00,9.95,14044.0,United Kingdom
564740,20679,EDWARDIAN PARASOL RED,1,2011-08-28 14:39:00,5.95,14044.0,United Kingdom
564740,15056N,EDWARDIAN PARASOL NATURAL,1,2011-08-28 14:39:00,5.95,14044.0,United Kingdom
564740,21216,"SET 3 RETROSPOT TEA,COFFEE,SUGAR",1,2011-08-28 14:39:00,4.95,14044.0,United Kingdom
564740,22768,FAMILY PHOTO FRAME CORNICE,1,2011-08-28 14:39:00,9.95,14044.0,United Kingdom
564740,22243,5 HOOK HANGER RED MAGIC TOADSTOOL,1,2011-08-28 14:39:00,1.65,14044.0,United Kingdom
564740,22384,LUNCH BAG PINK POLKADOT,1,2011-08-28 14:39:00,1.65,14044.0,United Kingdom
564740,20726,LUNCH BAG WOODLAND,1,2011-08-28 14:39:00,1.65,14044.0,United Kingdom
564740,20723,STRAWBERRY CHARLOTTE BAG,1,2011-08-28 14:39:00,0.85,14044.0,United Kingdom
564740,21581,SKULLS  DESIGN  COTTON TOTE BAG,1,2011-08-28 14:39:00,2.25,14044.0,United Kingdom
564740,23208,LUNCH BAG VINTAGE LEAF DESIGN,2,2011-08-28 14:39:00,1.65,14044.0,United Kingdom
564740,82600,NO SINGING METAL SIGN,1,2011-08-28 14:39:00,2.1,14044.0,United Kingdom
564740,21903,MAN FLU METAL SIGN,1,2011-08-28 14:39:00,2.1,14044.0,United Kingdom
564740,21908,CHOCOLATE THIS WAY METAL SIGN,1,2011-08-28 14:39:00,2.1,14044.0,United Kingdom
564740,23182,TOILET SIGN OCCUPIED OR VACANT,2,2011-08-28 14:39:00,0.83,14044.0,United Kingdom
564740,22412,METAL SIGN NEIGHBOURHOOD WITCH ,1,2011-08-28 14:39:00,2.1,14044.0,United Kingdom
564740,22413,METAL SIGN TAKE IT OR LEAVE IT ,1,2011-08-28 14:39:00,2.95,14044.0,United Kingdom
564740,21179,NO JUNK MAIL METAL SIGN,1,2011-08-28 14:39:00,0.39,14044.0,United Kingdom
564740,21329,DINOSAURS  WRITING SET ,1,2011-08-28 14:39:00,1.65,14044.0,United Kingdom
564740,23206,LUNCH BAG APPLE DESIGN,1,2011-08-28 14:39:00,1.65,14044.0,United Kingdom
564740,22383,LUNCH BAG SUKI DESIGN ,1,2011-08-28 14:39:00,1.65,14044.0,United Kingdom
564740,20725,LUNCH BAG RED RETROSPOT,1,2011-08-28 14:39:00,1.65,14044.0,United Kingdom
564740,22960,JAM MAKING SET WITH JARS,1,2011-08-28 14:39:00,4.25,14044.0,United Kingdom
564740,22904,CALENDAR PAPER CUT DESIGN,2,2011-08-28 14:39:00,2.95,14044.0,United Kingdom
564740,23138,SINGLE WIRE HOOK IVORY HEART,1,2011-08-28 14:39:00,1.45,14044.0,United Kingdom
564740,23209,LUNCH BAG VINTAGE DOILY ,2,2011-08-28 14:39:00,1.65,14044.0,United Kingdom
564740,23207,LUNCH BAG ALPHABET DESIGN,1,2011-08-28 14:39:00,1.65,14044.0,United Kingdom
564740,20727,LUNCH BAG  BLACK SKULL.,2,2011-08-28 14:39:00,1.65,14044.0,United Kingdom
564740,21993,FLORAL FOLK STATIONERY SET,2,2011-08-28 14:39:00,1.25,14044.0,United Kingdom
564740,21992,VINTAGE PAISLEY STATIONERY SET,1,2011-08-28 14:39:00,1.25,14044.0,United Kingdom
564740,21990,MODERN FLORAL STATIONERY SET,1,2011-08-28 14:39:00,1.25,14044.0,United Kingdom
564740,21991,BOHEMIAN COLLAGE STATIONERY SET,1,2011-08-28 14:39:00,1.25,14044.0,United Kingdom
564740,22562,MONSTERS STENCIL CRAFT,1,2011-08-28 14:39:00,1.25,14044.0,United Kingdom
564740,22563,HAPPY STENCIL CRAFT,1,2011-08-28 14:39:00,1.25,14044.0,United Kingdom
564740,23138,SINGLE WIRE HOOK IVORY HEART,1,2011-08-28 14:39:00,1.45,14044.0,United Kingdom
564740,22326,ROUND SNACK BOXES SET OF4 WOODLAND ,1,2011-08-28 14:39:00,2.95,14044.0,United Kingdom
564740,21452,TOADSTOOL MONEY BOX,2,2011-08-28 14:39:00,2.95,14044.0,United Kingdom
564740,21391,FRENCH LAVENDER SCENT HEART,3,2011-08-28 14:39:00,0.75,14044.0,United Kingdom
564740,23198,PANTRY MAGNETIC  SHOPPING LIST,1,2011-08-28 14:39:00,1.45,14044.0,United Kingdom
564740,22382,LUNCH BAG SPACEBOY DESIGN ,1,2011-08-28 14:39:00,1.65,14044.0,United Kingdom
564740,20728,LUNCH BAG CARS BLUE,2,2011-08-28 14:39:00,1.65,14044.0,United Kingdom
564740,21269,ANTIQUE CREAM CUTLERY SHELF ,1,2011-08-28 14:39:00,8.5,14044.0,United Kingdom
564740,85123A,WHITE HANGING HEART T-LIGHT HOLDER,2,2011-08-28 14:39:00,2.95,14044.0,United Kingdom
564740,85053,FRENCH ENAMEL CANDLEHOLDER,1,2011-08-28 14:39:00,2.1,14044.0,United Kingdom
564740,22196,SMALL HEART MEASURING SPOONS,1,2011-08-28 14:39:00,0.85,14044.0,United Kingdom
564740,22195,LARGE HEART MEASURING SPOONS,1,2011-08-28 14:39:00,1.65,14044.0,United Kingdom
564740,22244,3 HOOK HANGER MAGIC GARDEN,1,2011-08-28 14:39:00,1.95,14044.0,United Kingdom
564740,23093,SMALL PARISIENNE HEART PHOTO FRAME ,1,2011-08-28 14:39:00,2.49,14044.0,United Kingdom
564740,23240,SET OF 4 KNICK KNACK TINS DOILY ,1,2011-08-28 14:39:00,4.15,14044.0,United Kingdom
564740,23236,STORAGE TIN VINTAGE DOILY ,1,2011-08-28 14:39:00,2.89,14044.0,United Kingdom
564740,22766,PHOTO FRAME CORNICE,2,2011-08-28 14:39:00,2.95,14044.0,United Kingdom
564740,85132C,CHARLIE AND LOLA FIGURES TINS,3,2011-08-28 14:39:00,1.95,14044.0,United Kingdom
564740,23005,TRAVEL CARD WALLET I LOVE LONDON,3,2011-08-28 14:39:00,0.42,14044.0,United Kingdom
564740,23000,TRAVEL CARD WALLET TRANSPORT,3,2011-08-28 14:39:00,0.42,14044.0,United Kingdom
564740,22999,TRAVEL CARD WALLET VINTAGE LEAF,3,2011-08-28 14:39:00,0.42,14044.0,United Kingdom
564740,22998,TRAVEL CARD WALLET KEEP CALM,3,2011-08-28 14:39:00,0.42,14044.0,United Kingdom
564740,22996,TRAVEL CARD WALLET VINTAGE TICKET,3,2011-08-28 14:39:00,0.42,14044.0,United Kingdom
564740,22995,TRAVEL CARD WALLET SUKI,3,2011-08-28 14:39:00,0.42,14044.0,United Kingdom
564740,22994,TRAVEL CARD WALLET RETROSPOT,2,2011-08-28 14:39:00,0.42,14044.0,United Kingdom
564740,23004,TRAVEL CARD WALLET PANTRY,3,2011-08-28 14:39:00,0.42,14044.0,United Kingdom
564740,23002,TRAVEL CARD WALLET SKULLS,4,2011-08-28 14:39:00,0.42,14044.0,United Kingdom
564740,21218,RED SPOTTY BISCUIT TIN,1,2011-08-28 14:39:00,3.75,14044.0,United Kingdom
564740,23324,RUSTIC STRAWBERRY JAM POT LARGE ,2,2011-08-28 14:39:00,2.08,14044.0,United Kingdom
564740,21874,GIN AND TONIC MUG,1,2011-08-28 14:39:00,1.25,14044.0,United Kingdom
564740,21873,IF YOU CAN'T STAND THE HEAT MUG,1,2011-08-28 14:39:00,1.25,14044.0,United Kingdom
564740,21068,VINTAGE BILLBOARD LOVE/HATE MUG,1,2011-08-28 14:39:00,1.25,14044.0,United Kingdom
564740,21872,GLAMOROUS  MUG,2,2011-08-28 14:39:00,1.25,14044.0,United Kingdom
564740,22666,RECIPE BOX PANTRY YELLOW DESIGN,1,2011-08-28 14:39:00,2.95,14044.0,United Kingdom
564740,22328,ROUND SNACK BOXES SET OF 4 FRUITS ,1,2011-08-28 14:39:00,2.95,14044.0,United Kingdom
564740,22352,LUNCH BOX WITH CUTLERY RETROSPOT ,1,2011-08-28 14:39:00,2.55,14044.0,United Kingdom
564740,21558,SKULL LUNCH BOX WITH CUTLERY ,1,2011-08-28 14:39:00,2.55,14044.0,United Kingdom
564740,21559,STRAWBERRY LUNCH BOX WITH CUTLERY,1,2011-08-28 14:39:00,2.55,14044.0,United Kingdom
564741,22698,PINK REGENCY TEACUP AND SAUCER,6,2011-08-28 14:53:00,2.95,16107.0,United Kingdom
564741,23084,RABBIT NIGHT LIGHT,48,2011-08-28 14:53:00,1.79,16107.0,United Kingdom
564741,22632,HAND WARMER RED RETROSPOT,96,2011-08-28 14:53:00,1.85,16107.0,United Kingdom
564741,22865,HAND WARMER OWL DESIGN,96,2011-08-28 14:53:00,1.85,16107.0,United Kingdom
564741,21481,FAWN BLUE HOT WATER BOTTLE,72,2011-08-28 14:53:00,2.55,16107.0,United Kingdom
564742,23331,DECORATIVE WICKER HEART SMALL,1,2011-08-28 15:01:00,0.63,17346.0,United Kingdom
564742,23334,IVORY WICKER HEART SMALL,2,2011-08-28 15:01:00,0.63,17346.0,United Kingdom
564742,23346,SPACEBOY BEAKER,1,2011-08-28 15:01:00,1.25,17346.0,United Kingdom
564742,21428,SET3 BOOK BOX GREEN GINGHAM FLOWER ,1,2011-08-28 15:01:00,4.25,17346.0,United Kingdom
564742,23438, RED SPOT GIFT BAG LARGE,1,2011-08-28 15:01:00,1.25,17346.0,United Kingdom
564742,21588,RETROSPOT GIANT TUBE MATCHES,3,2011-08-28 15:01:00,2.55,17346.0,United Kingdom
564742,21155,RED RETROSPOT PEG BAG,1,2011-08-28 15:01:00,2.55,17346.0,United Kingdom
564742,85049E,SCANDINAVIAN REDS RIBBONS,1,2011-08-28 15:01:00,1.25,17346.0,United Kingdom
564742,23330,DECORATIVE WICKER HEART MEDIUM,1,2011-08-28 15:01:00,1.25,17346.0,United Kingdom
564742,23333,IVORY WICKER HEART MEDIUM,1,2011-08-28 15:01:00,1.25,17346.0,United Kingdom
564742,23333,IVORY WICKER HEART MEDIUM,1,2011-08-28 15:01:00,1.25,17346.0,United Kingdom
564742,23334,IVORY WICKER HEART SMALL,1,2011-08-28 15:01:00,0.63,17346.0,United Kingdom
564742,23347,I LOVE LONDON BEAKER,1,2011-08-28 15:01:00,1.25,17346.0,United Kingdom
564742,22976,CIRCUS PARADE CHILDRENS EGG CUP ,3,2011-08-28 15:01:00,1.25,17346.0,United Kingdom
564742,23329,DECORATIVE WICKER HEART LARGE,1,2011-08-28 15:01:00,1.65,17346.0,United Kingdom
564742,23345, DOLLY GIRL BEAKER,1,2011-08-28 15:01:00,1.25,17346.0,United Kingdom
564742,23333,IVORY WICKER HEART MEDIUM,2,2011-08-28 15:01:00,1.25,17346.0,United Kingdom
564742,23332,IVORY WICKER HEART LARGE,3,2011-08-28 15:01:00,1.65,17346.0,United Kingdom
564742,23343,JUMBO BAG VINTAGE CHRISTMAS ,10,2011-08-28 15:01:00,2.08,17346.0,United Kingdom
564742,22383,LUNCH BAG SUKI DESIGN ,2,2011-08-28 15:01:00,1.65,17346.0,United Kingdom
564742,22661,CHARLOTTE BAG DOLLY GIRL DESIGN,6,2011-08-28 15:01:00,0.85,17346.0,United Kingdom
564742,23330,DECORATIVE WICKER HEART MEDIUM,1,2011-08-28 15:01:00,1.25,17346.0,United Kingdom
564742,23350,ROLL WRAP VINTAGE SPOT ,1,2011-08-28 15:01:00,1.25,17346.0,United Kingdom
564742,85099B,JUMBO BAG RED RETROSPOT,3,2011-08-28 15:01:00,2.08,17346.0,United Kingdom
564742,22382,LUNCH BAG SPACEBOY DESIGN ,2,2011-08-28 15:01:00,1.65,17346.0,United Kingdom
564742,23344,JUMBO BAG 50'S CHRISTMAS ,10,2011-08-28 15:01:00,2.08,17346.0,United Kingdom
564742,21326,AGED GLASS SILVER T-LIGHT HOLDER,12,2011-08-28 15:01:00,0.65,17346.0,United Kingdom
564742,23084,RABBIT NIGHT LIGHT,2,2011-08-28 15:01:00,2.08,17346.0,United Kingdom
564742,21528,DAIRY MAID TRADITIONAL TEAPOT ,1,2011-08-28 15:01:00,6.95,17346.0,United Kingdom
564742,23204,CHARLOTTE BAG APPLES DESIGN,5,2011-08-28 15:01:00,0.85,17346.0,United Kingdom
564742,23209,LUNCH BAG VINTAGE DOILY ,2,2011-08-28 15:01:00,1.65,17346.0,United Kingdom
564742,20726,LUNCH BAG WOODLAND,1,2011-08-28 15:01:00,1.65,17346.0,United Kingdom
564742,22662,LUNCH BAG DOLLY GIRL DESIGN,2,2011-08-28 15:01:00,1.65,17346.0,United Kingdom
564742,23065,LARGE DECO JEWELLERY STAND,1,2011-08-28 15:01:00,12.5,17346.0,United Kingdom
564742,23206,LUNCH BAG APPLE DESIGN,3,2011-08-28 15:01:00,1.65,17346.0,United Kingdom
564742,20727,LUNCH BAG  BLACK SKULL.,2,2011-08-28 15:01:00,1.65,17346.0,United Kingdom
564743,21643,ASSORTED TUTTI FRUTTI MIRROR,3,2011-08-28 15:17:00,1.25,14606.0,United Kingdom
564743,21900,"KEY FOB , SHED",2,2011-08-28 15:17:00,0.65,14606.0,United Kingdom
564743,85169B,BLACK LOVE BIRD CANDLE,1,2011-08-28 15:17:00,1.25,14606.0,United Kingdom
564743,20996,JAZZ HEARTS ADDRESS BOOK,1,2011-08-28 15:17:00,0.19,14606.0,United Kingdom
564743,82580,BATHROOM METAL SIGN,1,2011-08-28 15:17:00,0.55,14606.0,United Kingdom
564743,23002,TRAVEL CARD WALLET SKULLS,1,2011-08-28 15:17:00,0.42,14606.0,United Kingdom
564743,23000,TRAVEL CARD WALLET TRANSPORT,3,2011-08-28 15:17:00,0.42,14606.0,United Kingdom
564743,21935,SUKI  SHOULDER BAG,1,2011-08-28 15:17:00,1.65,14606.0,United Kingdom
564743,21864,UNION JACK FLAG PASSPORT COVER ,1,2011-08-28 15:17:00,2.1,14606.0,United Kingdom
564743,22556,PLASTERS IN TIN CIRCUS PARADE ,1,2011-08-28 15:17:00,1.65,14606.0,United Kingdom
564743,21983,PACK OF 12 BLUE PAISLEY TISSUES ,4,2011-08-28 15:17:00,0.29,14606.0,United Kingdom
564743,22200,FRYING PAN PINK POLKADOT,1,2011-08-28 15:17:00,4.25,14606.0,United Kingdom
564743,22297,HEART IVORY TRELLIS SMALL,3,2011-08-28 15:17:00,1.25,14606.0,United Kingdom
564743,21446,12 RED ROSE PEG PLACE SETTINGS,1,2011-08-28 15:17:00,1.25,14606.0,United Kingdom
564743,21746,SMALL RED RETROSPOT WINDMILL,3,2011-08-28 15:17:00,1.25,14606.0,United Kingdom
564743,21844,RED RETROSPOT MUG,5,2011-08-28 15:17:00,2.95,14606.0,United Kingdom
564743,15056BL,EDWARDIAN PARASOL BLACK,1,2011-08-28 15:17:00,5.95,14606.0,United Kingdom
564743,22097,SWALLOW SQUARE TISSUE BOX,1,2011-08-28 15:17:00,0.39,14606.0,United Kingdom
564743,21217,RED RETROSPOT ROUND CAKE TINS,4,2011-08-28 15:17:00,9.95,14606.0,United Kingdom
564743,20985,HEART CALCULATOR,2,2011-08-28 15:17:00,1.25,14606.0,United Kingdom
564743,22329,ROUND CONTAINER SET OF 5 RETROSPOT,1,2011-08-28 15:17:00,1.65,14606.0,United Kingdom
564743,21154,RED RETROSPOT OVEN GLOVE ,3,2011-08-28 15:17:00,1.25,14606.0,United Kingdom
564743,20749,ASSORTED COLOUR MINI CASES,1,2011-08-28 15:17:00,7.95,14606.0,United Kingdom
564743,20914,SET/5 RED RETROSPOT LID GLASS BOWLS,3,2011-08-28 15:17:00,2.95,14606.0,United Kingdom
564743,82486,3 DRAWER ANTIQUE WHITE WOOD CABINET,1,2011-08-28 15:17:00,8.95,14606.0,United Kingdom
564743,22483,RED GINGHAM TEDDY BEAR ,1,2011-08-28 15:17:00,2.95,14606.0,United Kingdom
564744,84050,PINK HEART SHAPE EGG FRYING PAN,5,2011-08-28 15:25:00,1.65,13778.0,United Kingdom
564744,22273,FELTCRAFT DOLL MOLLY,5,2011-08-28 15:25:00,2.95,13778.0,United Kingdom
564744,82600,NO SINGING METAL SIGN,12,2011-08-28 15:25:00,2.1,13778.0,United Kingdom
564744,22384,LUNCH BAG PINK POLKADOT,6,2011-08-28 15:25:00,1.65,13778.0,United Kingdom
564744,22940,FELTCRAFT CHRISTMAS FAIRY,5,2011-08-28 15:25:00,4.25,13778.0,United Kingdom
564744,22112,CHOCOLATE HOT WATER BOTTLE,3,2011-08-28 15:25:00,4.95,13778.0,United Kingdom
564744,47590B,PINK HAPPY BIRTHDAY BUNTING,5,2011-08-28 15:25:00,5.45,13778.0,United Kingdom
564744,47590A,BLUE HAPPY BIRTHDAY BUNTING,5,2011-08-28 15:25:00,5.45,13778.0,United Kingdom
564744,22693,GROW A FLYTRAP OR SUNFLOWER IN TIN,24,2011-08-28 15:25:00,1.25,13778.0,United Kingdom
564745,22169,FAMILY ALBUM WHITE PICTURE FRAME,2,2011-08-28 15:27:00,8.5,16806.0,United Kingdom
564745,22171,3 HOOK PHOTO SHELF ANTIQUE WHITE,1,2011-08-28 15:27:00,8.5,16806.0,United Kingdom
564745,23092,LARGE ANTIQUE WHITE PHOTO FRAME,4,2011-08-28 15:27:00,7.9,16806.0,United Kingdom
564745,22170,PICTURE FRAME WOOD TRIPLE PORTRAIT,3,2011-08-28 15:27:00,6.75,16806.0,United Kingdom
564745,22171,3 HOOK PHOTO SHELF ANTIQUE WHITE,1,2011-08-28 15:27:00,8.5,16806.0,United Kingdom
564745,22963,JAM JAR WITH GREEN LID,6,2011-08-28 15:27:00,0.85,16806.0,United Kingdom
564745,84978,HANGING HEART JAR T-LIGHT HOLDER,12,2011-08-28 15:27:00,1.25,16806.0,United Kingdom
564745,22889,NUMBER TILE VINTAGE FONT No ,2,2011-08-28 15:27:00,2.1,16806.0,United Kingdom
564745,22889,NUMBER TILE VINTAGE FONT No ,2,2011-08-28 15:27:00,2.1,16806.0,United Kingdom
564745,22884,NUMBER TILE VINTAGE FONT 5,2,2011-08-28 15:27:00,1.95,16806.0,United Kingdom
564745,22880,NUMBER TILE VINTAGE FONT 1,2,2011-08-28 15:27:00,1.95,16806.0,United Kingdom
564745,22887,NUMBER TILE VINTAGE FONT 8,2,2011-08-28 15:27:00,1.95,16806.0,United Kingdom
564745,22879,NUMBER TILE VINTAGE FONT 0,2,2011-08-28 15:27:00,1.95,16806.0,United Kingdom
564745,22883,NUMBER TILE VINTAGE FONT 4,2,2011-08-28 15:27:00,1.95,16806.0,United Kingdom
564745,22882,NUMBER TILE VINTAGE FONT 3,2,2011-08-28 15:27:00,1.95,16806.0,United Kingdom
564745,22881,NUMBER TILE VINTAGE FONT 2,2,2011-08-28 15:27:00,1.95,16806.0,United Kingdom
564745,22880,NUMBER TILE VINTAGE FONT 1,2,2011-08-28 15:27:00,1.95,16806.0,United Kingdom
564745,22885,NUMBER TILE VINTAGE FONT 6 ,2,2011-08-28 15:27:00,1.95,16806.0,United Kingdom
564745,22888,NUMBER TILE VINTAGE FONT 9 ,2,2011-08-28 15:27:00,1.95,16806.0,United Kingdom
564745,22886,NUMBER TILE VINTAGE FONT 7,2,2011-08-28 15:27:00,1.95,16806.0,United Kingdom
564745,22665,RECIPE BOX BLUE SKETCHBOOK DESIGN,1,2011-08-28 15:27:00,2.95,16806.0,United Kingdom
564745,22666,RECIPE BOX PANTRY YELLOW DESIGN,2,2011-08-28 15:27:00,2.95,16806.0,United Kingdom
564745,22665,RECIPE BOX BLUE SKETCHBOOK DESIGN,1,2011-08-28 15:27:00,2.95,16806.0,United Kingdom
564745,23165,LARGE CERAMIC TOP STORAGE JAR,1,2011-08-28 15:27:00,1.65,16806.0,United Kingdom
564745,23167,SMALL CERAMIC TOP STORAGE JAR ,4,2011-08-28 15:27:00,0.83,16806.0,United Kingdom
564745,23166,MEDIUM CERAMIC TOP STORAGE JAR,2,2011-08-28 15:27:00,1.25,16806.0,United Kingdom
564745,23165,LARGE CERAMIC TOP STORAGE JAR,1,2011-08-28 15:27:00,1.65,16806.0,United Kingdom
564745,22099,CARAVAN SQUARE TISSUE BOX,1,2011-08-28 15:27:00,0.39,16806.0,United Kingdom
564745,23346,SPACEBOY BEAKER,1,2011-08-28 15:27:00,1.25,16806.0,United Kingdom
564745,22095,LADS ONLY TISSUE BOX,1,2011-08-28 15:27:00,0.39,16806.0,United Kingdom
564745,23197,SKETCHBOOK MAGNETIC SHOPPING LIST,3,2011-08-28 15:27:00,1.45,16806.0,United Kingdom
564745,23198,PANTRY MAGNETIC  SHOPPING LIST,4,2011-08-28 15:27:00,1.45,16806.0,United Kingdom
564745,23196,VINTAGE LEAF MAGNETIC NOTEPAD,3,2011-08-28 15:27:00,1.45,16806.0,United Kingdom
564745,22993,SET OF 4 PANTRY JELLY MOULDS,2,2011-08-28 15:27:00,1.25,16806.0,United Kingdom
564745,22629,SPACEBOY LUNCH BOX ,1,2011-08-28 15:27:00,1.95,16806.0,United Kingdom
564745,22099,CARAVAN SQUARE TISSUE BOX,1,2011-08-28 15:27:00,0.39,16806.0,United Kingdom
564745,22723,SET OF 6 HERB TINS SKETCHBOOK,3,2011-08-28 15:27:00,3.95,16806.0,United Kingdom
564745,22097,SWALLOW SQUARE TISSUE BOX,2,2011-08-28 15:27:00,0.39,16806.0,United Kingdom
564745,21179,NO JUNK MAIL METAL SIGN,6,2011-08-28 15:27:00,0.39,16806.0,United Kingdom
564745,21034,REX CASH+CARRY JUMBO SHOPPER,2,2011-08-28 15:27:00,0.95,16806.0,United Kingdom
564745,22560,TRADITIONAL MODELLING CLAY,1,2011-08-28 15:27:00,1.25,16806.0,United Kingdom
564745,22489,PACK OF 12 TRADITIONAL CRAYONS,1,2011-08-28 15:27:00,0.42,16806.0,United Kingdom
564745,21754,HOME BUILDING BLOCK WORD,2,2011-08-28 15:27:00,5.95,16806.0,United Kingdom
564745,82494L,WOODEN FRAME ANTIQUE WHITE ,4,2011-08-28 15:27:00,2.95,16806.0,United Kingdom
564745,82482,WOODEN PICTURE FRAME WHITE FINISH,4,2011-08-28 15:27:00,2.55,16806.0,United Kingdom
564745,85135B,BLUE DRAGONFLY HELICOPTER,1,2011-08-28 15:27:00,7.95,16806.0,United Kingdom
564746,23084,RABBIT NIGHT LIGHT,24,2011-08-28 15:58:00,1.79,17633.0,United Kingdom
564746,22895,SET OF 2 TEA TOWELS APPLE AND PEARS,6,2011-08-28 15:58:00,3.25,17633.0,United Kingdom
564746,21164,HOME SWEET HOME METAL SIGN ,6,2011-08-28 15:58:00,2.95,17633.0,United Kingdom
564746,21524,DOORMAT SPOTTY HOME SWEET HOME,10,2011-08-28 15:58:00,6.75,17633.0,United Kingdom
564746,48187,DOORMAT NEW ENGLAND,10,2011-08-28 15:58:00,6.75,17633.0,United Kingdom
564746,22692,DOORMAT WELCOME TO OUR HOME,2,2011-08-28 15:58:00,7.95,17633.0,United Kingdom
564746,21672,WHITE SPOT RED CERAMIC DRAWER KNOB,12,2011-08-28 15:58:00,1.25,17633.0,United Kingdom
564746,21668,RED STRIPE CERAMIC DRAWER KNOB,12,2011-08-28 15:58:00,1.25,17633.0,United Kingdom
564746,23028,DRAWER KNOB CRACKLE GLAZE BLUE,6,2011-08-28 15:58:00,1.65,17633.0,United Kingdom
564746,23031,DRAWER KNOB CRACKLE GLAZE PINK,6,2011-08-28 15:58:00,1.65,17633.0,United Kingdom
564746,23027,DRAWER KNOB VINTAGE GLASS HEXAGON,6,2011-08-28 15:58:00,2.08,17633.0,United Kingdom
564746,23026,DRAWER KNOB VINTAGE GLASS STAR,6,2011-08-28 15:58:00,2.08,17633.0,United Kingdom
564746,23032,DRAWER KNOB CRACKLE GLAZE IVORY,6,2011-08-28 15:58:00,1.65,17633.0,United Kingdom
564747,22768,FAMILY PHOTO FRAME CORNICE,2,2011-08-28 16:09:00,9.95,14869.0,United Kingdom
564747,23548,WRAP MAGIC FOREST ,25,2011-08-28 16:09:00,0.42,14869.0,United Kingdom
564747,23546,WRAP PAISLEY PARK ,25,2011-08-28 16:09:00,0.42,14869.0,United Kingdom
564747,82484,WOOD BLACK BOARD ANT WHITE FINISH,2,2011-08-28 16:09:00,7.95,14869.0,United Kingdom
