InvoiceNo,StockCode,Description,Quantity,InvoiceDate,UnitPrice,CustomerID,Country
562377,84997B,CHILDRENS CUTLERY RETROSPOT RED ,1,2011-08-04 15:04:00,4.15,14535.0,United Kingdom
562377,84997D,CHILDRENS CUTLERY POLKADOT PINK,2,2011-08-04 15:04:00,4.15,14535.0,United Kingdom
562377,20754,RETROSPOT RED WASHING UP GLOVES,2,2011-08-04 15:04:00,2.1,14535.0,United Kingdom
562377,22627,MINT KITCHEN SCALES,1,2011-08-04 15:04:00,8.5,14535.0,United Kingdom
562377,22624,IVORY KITCHEN SCALES,1,2011-08-04 15:04:00,8.5,14535.0,United Kingdom
562377,22963,JAM JAR WITH GREEN LID,6,2011-08-04 15:04:00,0.85,14535.0,United Kingdom
562377,16045,POPART WOODEN PENCILS ASST,100,2011-08-04 15:04:00,0.04,14535.0,United Kingdom
562377,22720,SET OF 3 CAKE TINS PANTRY DESIGN ,2,2011-08-04 15:04:00,4.95,14535.0,United Kingdom
562377,22961,JAM MAKING SET PRINTED,2,2011-08-04 15:04:00,1.45,14535.0,United Kingdom
562377,22561,WOODEN SCHOOL COLOURING SET,4,2011-08-04 15:04:00,1.65,14535.0,United Kingdom
562377,22564,ALPHABET STENCIL CRAFT,4,2011-08-04 15:04:00,1.25,14535.0,United Kingdom
562377,85059,FRENCH ENAMEL WATER BASIN,1,2011-08-04 15:04:00,3.75,14535.0,United Kingdom
562377,23178,JAM CLOCK MAGNET,2,2011-08-04 15:04:00,2.89,14535.0,United Kingdom
562377,23175,REGENCY MILK JUG PINK ,1,2011-08-04 15:04:00,3.25,14535.0,United Kingdom
562377,23152,IVORY SWEETHEART WIRE LETTER RACK ,2,2011-08-04 15:04:00,3.75,14535.0,United Kingdom
562377,22457,NATURAL SLATE HEART CHALKBOARD ,12,2011-08-04 15:04:00,2.95,14535.0,United Kingdom
562377,22488,NATURAL SLATE RECTANGLE CHALKBOARD,4,2011-08-04 15:04:00,1.65,14535.0,United Kingdom
562377,22794,SWEETHEART WIRE MAGAZINE RACK,1,2011-08-04 15:04:00,7.95,14535.0,United Kingdom
562377,22411,JUMBO SHOPPER VINTAGE RED PAISLEY,2,2011-08-04 15:04:00,2.08,14535.0,United Kingdom
562377,23203,JUMBO BAG DOILEY PATTERNS,2,2011-08-04 15:04:00,2.08,14535.0,United Kingdom
562377,23199,JUMBO BAG APPLES,2,2011-08-04 15:04:00,2.08,14535.0,United Kingdom
562377,47590A,BLUE HAPPY BIRTHDAY BUNTING,1,2011-08-04 15:04:00,5.45,14535.0,United Kingdom
562377,47590B,PINK HAPPY BIRTHDAY BUNTING,1,2011-08-04 15:04:00,5.45,14535.0,United Kingdom
562377,47566,PARTY BUNTING,2,2011-08-04 15:04:00,4.95,14535.0,United Kingdom
562377,22456,NATURAL SLATE CHALKBOARD LARGE ,2,2011-08-04 15:04:00,4.95,14535.0,United Kingdom
562377,82484,WOOD BLACK BOARD ANT WHITE FINISH,1,2011-08-04 15:04:00,7.95,14535.0,United Kingdom
562377,21561,DINOSAUR LUNCH BOX WITH CUTLERY,1,2011-08-04 15:04:00,2.55,14535.0,United Kingdom
562377,22630,DOLLY GIRL LUNCH BOX,1,2011-08-04 15:04:00,1.95,14535.0,United Kingdom
562377,22629,SPACEBOY LUNCH BOX ,1,2011-08-04 15:04:00,1.95,14535.0,United Kingdom
562377,20992,JAZZ HEARTS PURSE NOTEBOOK,6,2011-08-04 15:04:00,0.39,14535.0,United Kingdom
562377,21755,LOVE BUILDING BLOCK WORD,1,2011-08-04 15:04:00,5.95,14535.0,United Kingdom
562377,85123A,WHITE HANGING HEART T-LIGHT HOLDER,12,2011-08-04 15:04:00,2.95,14535.0,United Kingdom
562377,47504H,ENGLISH ROSE SPIRIT LEVEL ,1,2011-08-04 15:04:00,0.79,14535.0,United Kingdom
562377,47503A,ASS FLORAL PRINT MULTI SCREWDRIVER,3,2011-08-04 15:04:00,0.42,14535.0,United Kingdom
562377,21621,VINTAGE UNION JACK BUNTING,6,2011-08-04 15:04:00,8.5,14535.0,United Kingdom
562377,82494L,WOODEN FRAME ANTIQUE WHITE ,6,2011-08-04 15:04:00,2.95,14535.0,United Kingdom
562377,85066,CREAM SWEETHEART MINI CHEST,1,2011-08-04 15:04:00,12.75,14535.0,United Kingdom
562377,82482,WOODEN PICTURE FRAME WHITE FINISH,6,2011-08-04 15:04:00,2.55,14535.0,United Kingdom
562377,84978,HANGING HEART JAR T-LIGHT HOLDER,6,2011-08-04 15:04:00,1.25,14535.0,United Kingdom
562377,23138,SINGLE WIRE HOOK IVORY HEART,12,2011-08-04 15:04:00,1.45,14535.0,United Kingdom
562377,72122,COFFEE SCENT PILLAR CANDLE,4,2011-08-04 15:04:00,0.95,14535.0,United Kingdom
562377,23026,DRAWER KNOB VINTAGE GLASS STAR,6,2011-08-04 15:04:00,2.08,14535.0,United Kingdom
562377,21668,RED STRIPE CERAMIC DRAWER KNOB,6,2011-08-04 15:04:00,1.25,14535.0,United Kingdom
562377,23032,DRAWER KNOB CRACKLE GLAZE IVORY,6,2011-08-04 15:04:00,1.65,14535.0,United Kingdom
562377,23033,DRAWER KNOB CERAMIC RED,6,2011-08-04 15:04:00,1.45,14535.0,United Kingdom
562377,21669,BLUE STRIPE CERAMIC DRAWER KNOB,6,2011-08-04 15:04:00,1.25,14535.0,United Kingdom
562377,23028,DRAWER KNOB CRACKLE GLAZE BLUE,6,2011-08-04 15:04:00,1.65,14535.0,United Kingdom
562377,23031,DRAWER KNOB CRACKLE GLAZE PINK,6,2011-08-04 15:04:00,1.65,14535.0,United Kingdom
562377,23029,DRAWER KNOB CRACKLE GLAZE GREEN,6,2011-08-04 15:04:00,1.65,14535.0,United Kingdom
562377,22383,LUNCH BAG SUKI DESIGN ,2,2011-08-04 15:04:00,1.65,14535.0,United Kingdom
562377,23546,WRAP PAISLEY PARK ,25,2011-08-04 15:04:00,0.42,14535.0,United Kingdom
562377,23548,WRAP MAGIC FOREST ,25,2011-08-04 15:04:00,0.42,14535.0,United Kingdom
562377,22704,WRAP RED APPLES ,25,2011-08-04 15:04:00,0.42,14535.0,United Kingdom
562377,23209,LUNCH BAG DOILEY PATTERN ,1,2011-08-04 15:04:00,1.65,14535.0,United Kingdom
562377,23208,LUNCH BAG VINTAGE LEAF DESIGN,2,2011-08-04 15:04:00,1.65,14535.0,United Kingdom
562377,23206,LUNCH BAG APPLE DESIGN,2,2011-08-04 15:04:00,1.65,14535.0,United Kingdom
562377,22382,LUNCH BAG SPACEBOY DESIGN ,2,2011-08-04 15:04:00,1.65,14535.0,United Kingdom
562377,23207,LUNCH BAG ALPHABET DESIGN,3,2011-08-04 15:04:00,1.65,14535.0,United Kingdom
562377,23306,SET OF 36 DOILIES PANTRY DESIGN,2,2011-08-04 15:04:00,1.45,14535.0,United Kingdom
562377,23077,DOUGHNUT LIP GLOSS ,20,2011-08-04 15:04:00,1.25,14535.0,United Kingdom
562377,22469,HEART OF WICKER SMALL,2,2011-08-04 15:04:00,1.65,14535.0,United Kingdom
562377,22470,HEART OF WICKER LARGE,2,2011-08-04 15:04:00,2.95,14535.0,United Kingdom
562377,21034,REX CASH+CARRY JUMBO SHOPPER,1,2011-08-04 15:04:00,0.95,14535.0,United Kingdom
562377,22328,ROUND SNACK BOXES SET OF 4 FRUITS ,3,2011-08-04 15:04:00,2.95,14535.0,United Kingdom
562377,23167,SMALL CERAMIC TOP STORAGE JAR ,8,2011-08-04 15:04:00,0.83,14535.0,United Kingdom
562377,23166,MEDIUM CERAMIC TOP STORAGE JAR,12,2011-08-04 15:04:00,1.25,14535.0,United Kingdom
562377,23165,LARGE CERAMIC TOP STORAGE JAR,6,2011-08-04 15:04:00,1.65,14535.0,United Kingdom
562378,21034,REX CASH+CARRY JUMBO SHOPPER,5,2011-08-04 15:07:00,0.95,15046.0,United Kingdom
562378,85049F,BABY BOOM RIBBONS ,6,2011-08-04 15:07:00,1.25,15046.0,United Kingdom
562378,85049G,CHOCOLATE BOX RIBBONS ,6,2011-08-04 15:07:00,1.25,15046.0,United Kingdom
562378,22077,6 RIBBONS RUSTIC CHARM,6,2011-08-04 15:07:00,1.65,15046.0,United Kingdom
562378,23140,TRIPLE WIRE HOOK IVORY HEART,3,2011-08-04 15:07:00,4.15,15046.0,United Kingdom
562378,85049C,ROMANTIC PINKS RIBBONS ,6,2011-08-04 15:07:00,1.25,15046.0,United Kingdom
562378,85049E,SCANDINAVIAN REDS RIBBONS,12,2011-08-04 15:07:00,1.25,15046.0,United Kingdom
562378,85049A,TRADITIONAL CHRISTMAS RIBBONS,6,2011-08-04 15:07:00,1.25,15046.0,United Kingdom
562378,23150,IVORY SWEETHEART SOAP DISH,1,2011-08-04 15:07:00,2.49,15046.0,United Kingdom
562378,21326,AGED GLASS SILVER T-LIGHT HOLDER,12,2011-08-04 15:07:00,0.65,15046.0,United Kingdom
562378,23322,LARGE WHITE HEART OF WICKER,4,2011-08-04 15:07:00,2.95,15046.0,United Kingdom
562378,21809,CHRISTMAS HANGING TREE WITH BELL,48,2011-08-04 15:07:00,1.25,15046.0,United Kingdom
562378,23226,FILIGREE HEART DAISY WHITE,48,2011-08-04 15:07:00,1.25,15046.0,United Kingdom
562378,85061W,WHITE JEWELLED HEART DECORATION,24,2011-08-04 15:07:00,0.85,15046.0,United Kingdom
562378,23138,SINGLE WIRE HOOK IVORY HEART,12,2011-08-04 15:07:00,1.45,15046.0,United Kingdom
562378,23131,MISTLETOE HEART WREATH CREAM,48,2011-08-04 15:07:00,3.75,15046.0,United Kingdom
562378,22806,SET OF 6 T-LIGHTS WEDDING CAKE ,1,2011-08-04 15:07:00,2.95,15046.0,United Kingdom
562378,21824,PAINTED METAL STAR WITH HOLLY BELLS,24,2011-08-04 15:07:00,1.45,15046.0,United Kingdom
562378,82482,WOODEN PICTURE FRAME WHITE FINISH,2,2011-08-04 15:07:00,2.55,15046.0,United Kingdom
562378,21080,SET/20 RED RETROSPOT PAPER NAPKINS ,2,2011-08-04 15:07:00,0.85,15046.0,United Kingdom
562378,22907,PACK OF 20 NAPKINS PANTRY DESIGN,2,2011-08-04 15:07:00,0.85,15046.0,United Kingdom
562378,22908,PACK OF 20 NAPKINS RED APPLES,2,2011-08-04 15:07:00,0.85,15046.0,United Kingdom
562378,21811,HANGING HEART WITH BELL,48,2011-08-04 15:07:00,1.25,15046.0,United Kingdom
562378,22153,ANGEL DECORATION STARS ON DRESS,96,2011-08-04 15:07:00,0.42,15046.0,United Kingdom
562378,21823,PAINTED METAL HEART WITH HOLLY BELL,48,2011-08-04 15:07:00,1.45,15046.0,United Kingdom
562378,35970,ZINC FOLKART SLEIGH BELLS,6,2011-08-04 15:07:00,1.69,15046.0,United Kingdom
562378,21807,WHITE CHRISTMAS STAR DECORATION,36,2011-08-04 15:07:00,0.42,15046.0,United Kingdom
562378,22824,3 TIER SWEETHEART GARDEN SHELF,1,2011-08-04 15:07:00,35.95,15046.0,United Kingdom
562378,84879,ASSORTED COLOUR BIRD ORNAMENT,160,2011-08-04 15:07:00,1.45,15046.0,United Kingdom
562379,85123A,WHITE HANGING HEART T-LIGHT HOLDER,12,2011-08-04 15:17:00,2.95,15134.0,United Kingdom
562379,21745,GAOLERS KEYS DECORATIVE GARDEN ,4,2011-08-04 15:17:00,3.75,15134.0,United Kingdom
562379,23176,ABC TREASURE BOOK BOX ,8,2011-08-04 15:17:00,2.25,15134.0,United Kingdom
562379,21704,BAG 250g SWIRLY MARBLES,12,2011-08-04 15:17:00,0.85,15134.0,United Kingdom
562379,22619,SET OF 6 SOLDIER SKITTLES,4,2011-08-04 15:17:00,3.75,15134.0,United Kingdom
562379,22139,RETROSPOT TEA SET CERAMIC 11 PC ,3,2011-08-04 15:17:00,4.95,15134.0,United Kingdom
562379,22492,MINI PAINT SET VINTAGE ,36,2011-08-04 15:17:00,0.65,15134.0,United Kingdom
562379,22493,PAINT YOUR OWN CANVAS SET,12,2011-08-04 15:17:00,1.65,15134.0,United Kingdom
562379,22669,RED BABY BUNTING ,5,2011-08-04 15:17:00,2.95,15134.0,United Kingdom
562379,84976,RECTANGULAR SHAPED MIRROR,12,2011-08-04 15:17:00,0.79,15134.0,United Kingdom
562379,23322,LARGE WHITE HEART OF WICKER,6,2011-08-04 15:17:00,2.95,15134.0,United Kingdom
562379,35961,FOLKART ZINC HEART CHRISTMAS DEC,12,2011-08-04 15:17:00,0.85,15134.0,United Kingdom
562380,23349,ROLL WRAP VINTAGE CHRISTMAS,12,2011-08-04 15:23:00,1.25,14778.0,United Kingdom
562380,23353,6 GIFT TAGS VINTAGE CHRISTMAS ,12,2011-08-04 15:23:00,0.83,14778.0,United Kingdom
562380,23350,ROLL WRAP VINTAGE SPOT ,12,2011-08-04 15:23:00,1.25,14778.0,United Kingdom
562380,23374,RED SPOT PAPER GIFT BAG,10,2011-08-04 15:23:00,0.82,14778.0,United Kingdom
562380,23438,GIFT BAG LARGE SPOT ,12,2011-08-04 15:23:00,1.25,14778.0,United Kingdom
562380,23083,SET 6 PAPER TABLE LANTERN STARS ,12,2011-08-04 15:23:00,3.75,14778.0,United Kingdom
562380,23048,SET OF 10 LANTERNS FAIRY LIGHT STAR,4,2011-08-04 15:23:00,4.15,14778.0,United Kingdom
562380,23436,GIFT BAG LARGE VINTAGE CHRISTMAS,12,2011-08-04 15:23:00,1.25,14778.0,United Kingdom
562380,23078,ICE CREAM PEN LIP GLOSS ,24,2011-08-04 15:23:00,1.25,14778.0,United Kingdom
562380,23077,DOUGHNUT LIP GLOSS ,20,2011-08-04 15:23:00,1.25,14778.0,United Kingdom
562380,22720,SET OF 3 CAKE TINS PANTRY DESIGN ,3,2011-08-04 15:23:00,4.95,14778.0,United Kingdom
562380,22768,FAMILY PHOTO FRAME CORNICE,2,2011-08-04 15:23:00,9.95,14778.0,United Kingdom
562380,22767,TRIPLE PHOTO FRAME CORNICE ,2,2011-08-04 15:23:00,9.95,14778.0,United Kingdom
562380,23014,GLASS APOTHECARY BOTTLE ELIXIR,4,2011-08-04 15:23:00,3.95,14778.0,United Kingdom
562380,23012,GLASS APOTHECARY BOTTLE PERFUME,4,2011-08-04 15:23:00,3.95,14778.0,United Kingdom
562380,23133,LARGE IVORY HEART WALL ORGANISER,8,2011-08-04 15:23:00,7.05,14778.0,United Kingdom
562380,23132,SMALL IVORY HEART WALL ORGANISER,12,2011-08-04 15:23:00,4.95,14778.0,United Kingdom
562381,21039,RED RETROSPOT SHOPPING BAG,12,2011-08-04 15:33:00,2.55,16873.0,United Kingdom
562381,20718,RED RETROSPOT SHOPPER BAG,20,2011-08-04 15:33:00,1.25,16873.0,United Kingdom
562381,85099B,JUMBO BAG RED RETROSPOT,10,2011-08-04 15:33:00,2.08,16873.0,United Kingdom
562381,20724,RED RETROSPOT CHARLOTTE BAG,20,2011-08-04 15:33:00,0.85,16873.0,United Kingdom
562381,20961,STRAWBERRY BATH SPONGE ,10,2011-08-04 15:33:00,1.25,16873.0,United Kingdom
562381,20963,APPLE BATH SPONGE,10,2011-08-04 15:33:00,1.25,16873.0,United Kingdom
562381,20685,DOORMAT RED RETROSPOT,4,2011-08-04 15:33:00,7.95,16873.0,United Kingdom
562381,21523,DOORMAT FANCY FONT HOME SWEET HOME,2,2011-08-04 15:33:00,7.95,16873.0,United Kingdom
562381,22692,DOORMAT WELCOME TO OUR HOME,2,2011-08-04 15:33:00,7.95,16873.0,United Kingdom
562381,82482,WOODEN PICTURE FRAME WHITE FINISH,6,2011-08-04 15:33:00,2.55,16873.0,United Kingdom
562381,23075,PARLOUR CERAMIC WALL HOOK,8,2011-08-04 15:33:00,4.15,16873.0,United Kingdom
562381,20725,LUNCH BAG RED RETROSPOT,10,2011-08-04 15:33:00,1.65,16873.0,United Kingdom
562381,22199,FRYING PAN RED RETROSPOT,4,2011-08-04 15:33:00,4.25,16873.0,United Kingdom
562381,21154,RED RETROSPOT OVEN GLOVE ,10,2011-08-04 15:33:00,1.25,16873.0,United Kingdom
562381,21155,RED RETROSPOT PEG BAG,12,2011-08-04 15:33:00,2.55,16873.0,United Kingdom
562381,21212,PACK OF 72 RETROSPOT CAKE CASES,24,2011-08-04 15:33:00,0.55,16873.0,United Kingdom
562381,22625,RED KITCHEN SCALES,2,2011-08-04 15:33:00,8.5,16873.0,United Kingdom
562381,20754,RETROSPOT RED WASHING UP GLOVES,6,2011-08-04 15:33:00,2.1,16873.0,United Kingdom
562381,22348,TEA BAG PLATE RED RETROSPOT,24,2011-08-04 15:33:00,0.85,16873.0,United Kingdom
562381,21918,SET 12 KIDS COLOUR  CHALK STICKS,48,2011-08-04 15:33:00,0.42,16873.0,United Kingdom
562381,22637,PIGGY BANK RETROSPOT ,8,2011-08-04 15:33:00,2.55,16873.0,United Kingdom
562381,22560,TRADITIONAL MODELLING CLAY,48,2011-08-04 15:33:00,1.06,16873.0,United Kingdom
562381,21788,KIDS RAIN MAC BLUE,24,2011-08-04 15:33:00,0.85,16873.0,United Kingdom
562381,21789,KIDS RAIN MAC PINK,24,2011-08-04 15:33:00,0.85,16873.0,United Kingdom
562381,22892,SET OF SALT AND PEPPER TOADSTOOLS,24,2011-08-04 15:33:00,1.25,16873.0,United Kingdom
562381,22489,PACK OF 12 TRADITIONAL CRAYONS,24,2011-08-04 15:33:00,0.42,16873.0,United Kingdom
562381,22491,PACK OF 12 COLOURED PENCILS,24,2011-08-04 15:33:00,0.85,16873.0,United Kingdom
562381,22561,WOODEN SCHOOL COLOURING SET,24,2011-08-04 15:33:00,1.65,16873.0,United Kingdom
562381,21844,RED RETROSPOT MUG,12,2011-08-04 15:33:00,2.95,16873.0,United Kingdom
562382,22927,?,-40,2011-08-04 15:36:00,0.0,,United Kingdom
562383,22523,?,-90,2011-08-04 15:37:00,0.0,,United Kingdom
562384,23175,,-44,2011-08-04 15:41:00,0.0,,United Kingdom
562385,47559B,,-84,2011-08-04 15:42:00,0.0,,United Kingdom
562386,84596L,,-21,2011-08-04 15:43:00,0.0,,United Kingdom
562387,22429,ENAMEL MEASURING JUG CREAM,4,2011-08-04 15:51:00,4.25,13402.0,United Kingdom
562387,23321,SMALL WHITE HEART OF WICKER,12,2011-08-04 15:51:00,1.65,13402.0,United Kingdom
562387,22952,60 CAKE CASES VINTAGE CHRISTMAS,24,2011-08-04 15:51:00,0.55,13402.0,United Kingdom
562387,21506,"FANCY FONT BIRTHDAY CARD, ",12,2011-08-04 15:51:00,0.42,13402.0,United Kingdom
562387,21519,GIN & TONIC DIET GREETING CARD ,12,2011-08-04 15:51:00,0.42,13402.0,United Kingdom
562387,21504,SKULLS GREETING CARD,12,2011-08-04 15:51:00,0.42,13402.0,United Kingdom
562387,22815,CARD PSYCHEDELIC APPLES,12,2011-08-04 15:51:00,0.42,13402.0,United Kingdom
562387,84251B,"GREETING CARD, STICKY GORDON",12,2011-08-04 15:51:00,0.19,13402.0,United Kingdom
562387,84249A,"GREETING CARD,SQUARE, DOUGHNUTS",12,2011-08-04 15:51:00,0.42,13402.0,United Kingdom
562387,22077,6 RIBBONS RUSTIC CHARM,12,2011-08-04 15:51:00,1.65,13402.0,United Kingdom
562387,22075,6 RIBBONS ELEGANT CHRISTMAS ,12,2011-08-04 15:51:00,1.65,13402.0,United Kingdom
562387,22851,SET 20 NAPKINS FAIRY CAKES DESIGN ,12,2011-08-04 15:51:00,0.85,13402.0,United Kingdom
562387,22469,HEART OF WICKER SMALL,12,2011-08-04 15:51:00,1.65,13402.0,United Kingdom
562387,21985,PACK OF 12 HEARTS DESIGN TISSUES ,24,2011-08-04 15:51:00,0.29,13402.0,United Kingdom
562387,21982,PACK OF 12 SUKI TISSUES ,24,2011-08-04 15:51:00,0.29,13402.0,United Kingdom
562387,20914,SET/5 RED RETROSPOT LID GLASS BOWLS,12,2011-08-04 15:51:00,2.95,13402.0,United Kingdom
562387,22328,ROUND SNACK BOXES SET OF 4 FRUITS ,18,2011-08-04 15:51:00,2.95,13402.0,United Kingdom
562387,22988,SOLDIERS EGG CUP ,12,2011-08-04 15:51:00,1.25,13402.0,United Kingdom
562387,22261,FELT EGG COSY WHITE RABBIT ,12,2011-08-04 15:51:00,0.85,13402.0,United Kingdom
562387,22260,FELT EGG COSY BLUE RABBIT ,12,2011-08-04 15:51:00,0.85,13402.0,United Kingdom
562387,22263,FELT EGG COSY LADYBIRD ,12,2011-08-04 15:51:00,0.85,13402.0,United Kingdom
562387,22427,ENAMEL FLOWER JUG CREAM,3,2011-08-04 15:51:00,5.95,13402.0,United Kingdom
562388,48138,DOORMAT UNION FLAG,1,2011-08-04 15:52:00,7.95,18099.0,United Kingdom
562388,22998,TRAVEL CARD WALLET KEEP CALM,24,2011-08-04 15:52:00,0.42,18099.0,United Kingdom
562388,23154,SET OF 4 JAM JAR MAGNETS,12,2011-08-04 15:52:00,2.08,18099.0,United Kingdom
562388,23156,SET OF 5 MINI GROCERY MAGNETS,12,2011-08-04 15:52:00,2.08,18099.0,United Kingdom
562388,23309,SET OF 60 I LOVE LONDON CAKE CASES ,4,2011-08-04 15:52:00,0.55,18099.0,United Kingdom
562388,21976,PACK OF 60 MUSHROOM CAKE CASES,4,2011-08-04 15:52:00,0.55,18099.0,United Kingdom
562388,21212,PACK OF 72 RETROSPOT CAKE CASES,6,2011-08-04 15:52:00,0.55,18099.0,United Kingdom
562388,22616,PACK OF 12 LONDON TISSUES ,12,2011-08-04 15:52:00,0.29,18099.0,United Kingdom
562388,21981,PACK OF 12 WOODLAND TISSUES ,12,2011-08-04 15:52:00,0.29,18099.0,United Kingdom
562388,22615,PACK OF 12 CIRCUS PARADE TISSUES ,12,2011-08-04 15:52:00,0.29,18099.0,United Kingdom
562388,22554,PLASTERS IN TIN WOODLAND ANIMALS,12,2011-08-04 15:52:00,1.65,18099.0,United Kingdom
562388,22556,PLASTERS IN TIN CIRCUS PARADE ,12,2011-08-04 15:52:00,1.65,18099.0,United Kingdom
562388,84596B,SMALL DOLLY MIX DESIGN ORANGE BOWL,8,2011-08-04 15:52:00,0.42,18099.0,United Kingdom
562388,84596F,SMALL MARSHMALLOWS PINK BOWL,8,2011-08-04 15:52:00,0.42,18099.0,United Kingdom
562388,22720,SET OF 3 CAKE TINS PANTRY DESIGN ,1,2011-08-04 15:52:00,4.95,18099.0,United Kingdom
562388,22109,FULL ENGLISH BREAKFAST PLATE,1,2011-08-04 15:52:00,3.75,18099.0,United Kingdom
562388,21065,BOOM BOX SPEAKER GIRLS,2,2011-08-04 15:52:00,5.95,18099.0,United Kingdom
562388,21064,BOOM BOX SPEAKER BOYS,2,2011-08-04 15:52:00,5.95,18099.0,United Kingdom
562388,22197,POPCORN HOLDER,4,2011-08-04 15:52:00,0.85,18099.0,United Kingdom
562389,21746,SMALL RED RETROSPOT WINDMILL,24,2011-08-04 15:55:00,1.25,16531.0,United Kingdom
562389,23081,GREEN METAL BOX ARMY SUPPLIES,2,2011-08-04 15:55:00,8.25,16531.0,United Kingdom
562389,23080,RED METAL BOX TOP SECRET,2,2011-08-04 15:55:00,8.25,16531.0,United Kingdom
562389,22433,WATERING CAN GREEN DINOSAUR,6,2011-08-04 15:55:00,1.95,16531.0,United Kingdom
562389,22432,WATERING CAN PINK BUNNY,6,2011-08-04 15:55:00,1.95,16531.0,United Kingdom
562389,22564,ALPHABET STENCIL CRAFT,12,2011-08-04 15:55:00,1.25,16531.0,United Kingdom
562389,16218,CARTOON  PENCIL SHARPENERS,80,2011-08-04 15:55:00,0.06,16531.0,United Kingdom
562389,22491,PACK OF 12 COLOURED PENCILS,12,2011-08-04 15:55:00,0.85,16531.0,United Kingdom
562389,20977,36 PENCILS TUBE WOODLAND,16,2011-08-04 15:55:00,1.25,16531.0,United Kingdom
562389,21061,PARTY INVITES FOOTBALL,12,2011-08-04 15:55:00,0.85,16531.0,United Kingdom
562389,21058,PARTY INVITES WOODLAND,12,2011-08-04 15:55:00,0.85,16531.0,United Kingdom
562389,21452,TOADSTOOL MONEY BOX,6,2011-08-04 15:55:00,2.95,16531.0,United Kingdom
562389,21790,VINTAGE SNAP CARDS,12,2011-08-04 15:55:00,0.85,16531.0,United Kingdom
562389,21915,RED  HARMONICA IN BOX ,12,2011-08-04 15:55:00,1.25,16531.0,United Kingdom
562390,21246,,-92,2011-08-04 16:00:00,0.0,,United Kingdom
562391,22854,,-40,2011-08-04 16:02:00,0.0,,United Kingdom
562392,22425,ENAMEL COLANDER CREAM,3,2011-08-04 16:07:00,4.95,15205.0,United Kingdom
562392,85059,FRENCH ENAMEL WATER BASIN,4,2011-08-04 16:07:00,3.75,15205.0,United Kingdom
562392,22424,ENAMEL BREAD BIN CREAM,8,2011-08-04 16:07:00,10.95,15205.0,United Kingdom
562392,22331,WOODLAND PARTY BAG + STICKER SET,8,2011-08-04 16:07:00,1.65,15205.0,United Kingdom
562392,23203,JUMBO BAG DOILEY PATTERNS,10,2011-08-04 16:07:00,2.08,15205.0,United Kingdom
562392,21578,WOODLAND DESIGN  COTTON TOTE BAG,6,2011-08-04 16:07:00,2.25,15205.0,United Kingdom
562392,15056N,EDWARDIAN PARASOL NATURAL,3,2011-08-04 16:07:00,5.95,15205.0,United Kingdom
562392,48184,DOORMAT ENGLISH ROSE ,2,2011-08-04 16:07:00,7.95,15205.0,United Kingdom
562392,22630,DOLLY GIRL LUNCH BOX,12,2011-08-04 16:07:00,1.95,15205.0,United Kingdom
562392,22629,SPACEBOY LUNCH BOX ,12,2011-08-04 16:07:00,1.95,15205.0,United Kingdom
562392,22429,ENAMEL MEASURING JUG CREAM,4,2011-08-04 16:07:00,4.25,15205.0,United Kingdom
562392,21976,PACK OF 60 MUSHROOM CAKE CASES,24,2011-08-04 16:07:00,0.55,15205.0,United Kingdom
562392,22980,PANTRY SCRUBBING BRUSH,12,2011-08-04 16:07:00,1.65,15205.0,United Kingdom
562392,22979,PANTRY WASHING UP BRUSH,12,2011-08-04 16:07:00,1.45,15205.0,United Kingdom
562392,22423,REGENCY CAKESTAND 3 TIER,3,2011-08-04 16:07:00,12.75,15205.0,United Kingdom
562392,22892,SET OF SALT AND PEPPER TOADSTOOLS,12,2011-08-04 16:07:00,1.25,15205.0,United Kingdom
562392,21534,DAIRY MAID LARGE MILK JUG,3,2011-08-04 16:07:00,4.95,15205.0,United Kingdom
562392,22393,PAPERWEIGHT VINTAGE COLLAGE,6,2011-08-04 16:07:00,2.55,15205.0,United Kingdom
562392,21058,PARTY INVITES WOODLAND,12,2011-08-04 16:07:00,0.85,15205.0,United Kingdom
562392,20984,12 PENCILS TALL TUBE POSY,24,2011-08-04 16:07:00,0.29,15205.0,United Kingdom
562392,21703,BAG 125g SWIRLY MARBLES,12,2011-08-04 16:07:00,0.42,15205.0,United Kingdom
562392,22622,BOX OF VINTAGE ALPHABET BLOCKS,2,2011-08-04 16:07:00,11.95,15205.0,United Kingdom
562392,23010,CIRCUS PARADE BABY GIFT SET,1,2011-08-04 16:07:00,16.95,15205.0,United Kingdom
562392,23008,DOLLY GIRL BABY GIFT SET,1,2011-08-04 16:07:00,16.95,15205.0,United Kingdom
562393,23354,6 GIFT TAGS 50'S CHRISTMAS ,24,2011-08-04 16:17:00,0.83,18172.0,United Kingdom
562393,23352,ROLL WRAP 50'S RED CHRISTMAS ,36,2011-08-04 16:17:00,1.25,18172.0,United Kingdom
562393,23351,ROLL WRAP 50'S CHRISTMAS,36,2011-08-04 16:17:00,1.25,18172.0,United Kingdom
562393,23350,ROLL WRAP VINTAGE SPOT ,36,2011-08-04 16:17:00,1.25,18172.0,United Kingdom
562393,23319,BOX OF 6 MINI 50'S CRACKERS,24,2011-08-04 16:17:00,2.49,18172.0,United Kingdom
562393,23320,GIANT 50'S CHRISTMAS CRACKER,24,2011-08-04 16:17:00,2.89,18172.0,United Kingdom
562393,23274,STAR T-LIGHT HOLDER WILLIE WINKIE,24,2011-08-04 16:17:00,1.65,18172.0,United Kingdom
562393,23272,TREE T-LIGHT HOLDER WILLIE WINKIE,24,2011-08-04 16:17:00,1.65,18172.0,United Kingdom
562393,85053,FRENCH ENAMEL CANDLEHOLDER,6,2011-08-04 16:17:00,2.1,18172.0,United Kingdom
562393,22730,ALARM CLOCK BAKELIKE IVORY,8,2011-08-04 16:17:00,3.75,18172.0,United Kingdom
562393,22726,ALARM CLOCK BAKELIKE GREEN,8,2011-08-04 16:17:00,3.75,18172.0,United Kingdom
562393,22729,ALARM CLOCK BAKELIKE ORANGE,4,2011-08-04 16:17:00,3.75,18172.0,United Kingdom
562393,22727,ALARM CLOCK BAKELIKE RED ,8,2011-08-04 16:17:00,3.75,18172.0,United Kingdom
562393,48184,DOORMAT ENGLISH ROSE ,6,2011-08-04 16:17:00,7.95,18172.0,United Kingdom
562393,48194,DOORMAT HEARTS,6,2011-08-04 16:17:00,7.95,18172.0,United Kingdom
562393,85123A,WHITE HANGING HEART T-LIGHT HOLDER,24,2011-08-04 16:17:00,2.95,18172.0,United Kingdom
562393,84879,ASSORTED COLOUR BIRD ORNAMENT,24,2011-08-04 16:17:00,1.69,18172.0,United Kingdom
562393,23159,SET OF 5 PANCAKE DAY MAGNETS,24,2011-08-04 16:17:00,2.08,18172.0,United Kingdom
562393,23154,SET OF 4 JAM JAR MAGNETS,24,2011-08-04 16:17:00,2.08,18172.0,United Kingdom
562393,23156,SET OF 5 MINI GROCERY MAGNETS,24,2011-08-04 16:17:00,2.08,18172.0,United Kingdom
562393,21136,PAINTED METAL PEARS ASSORTED,24,2011-08-04 16:17:00,1.69,18172.0,United Kingdom
562393,22086,PAPER CHAIN KIT 50'S CHRISTMAS ,24,2011-08-04 16:17:00,2.95,18172.0,United Kingdom
562393,23203,JUMBO BAG DOILEY PATTERNS,10,2011-08-04 16:17:00,2.08,18172.0,United Kingdom
562393,23335,EGG FRYING PAN IVORY ,6,2011-08-04 16:17:00,2.08,18172.0,United Kingdom
562393,23338,EGG FRYING PAN RED ,6,2011-08-04 16:17:00,2.08,18172.0,United Kingdom
562393,23336,EGG FRYING PAN PINK ,6,2011-08-04 16:17:00,2.08,18172.0,United Kingdom
562393,23337,EGG FRYING PAN MINT ,6,2011-08-04 16:17:00,2.08,18172.0,United Kingdom
562416,22826,LOVE SEAT ANTIQUE WHITE METAL,2,2011-08-04 16:31:00,85.0,13969.0,United Kingdom
562416,23083,SET 6 PAPER TABLE LANTERN STARS ,6,2011-08-04 16:31:00,3.75,13969.0,United Kingdom
562416,23298,SPOTTY BUNTING,3,2011-08-04 16:31:00,4.95,13969.0,United Kingdom
562416,23206,LUNCH BAG APPLE DESIGN,10,2011-08-04 16:31:00,1.65,13969.0,United Kingdom
562416,22379,RECYCLING BAG RETROSPOT ,5,2011-08-04 16:31:00,2.1,13969.0,United Kingdom
562416,23344,JUMBO BAG 50'S CHRISTMAS ,10,2011-08-04 16:31:00,2.08,13969.0,United Kingdom
562416,22383,LUNCH BAG SUKI DESIGN ,10,2011-08-04 16:31:00,1.65,13969.0,United Kingdom
562416,22627,MINT KITCHEN SCALES,2,2011-08-04 16:31:00,8.5,13969.0,United Kingdom
562416,23293,SET OF 12 FAIRY CAKE BAKING CASES,8,2011-08-04 16:31:00,0.83,13969.0,United Kingdom
562416,23295,SET OF 12 MINI LOAF BAKING CASES,8,2011-08-04 16:31:00,0.83,13969.0,United Kingdom
562417,21974,SET OF 36 PAISLEY FLOWER DOILIES,1,2011-08-04 16:32:00,2.92,,United Kingdom
562417,21976,PACK OF 60 MUSHROOM CAKE CASES,1,2011-08-04 16:32:00,1.25,,United Kingdom
562417,21985,PACK OF 12 HEARTS DESIGN TISSUES ,14,2011-08-04 16:32:00,0.83,,United Kingdom
562417,22023,EMPIRE BIRTHDAY CARD,1,2011-08-04 16:32:00,0.83,,United Kingdom
562417,22083,PAPER CHAIN KIT RETROSPOT,1,2011-08-04 16:32:00,5.79,,United Kingdom
562417,22086,PAPER CHAIN KIT 50'S CHRISTMAS ,1,2011-08-04 16:32:00,5.79,,United Kingdom
562417,22090,PAPER BUNTING RETROSPOT,2,2011-08-04 16:32:00,5.79,,United Kingdom
562417,22156,HEART DECORATION WITH PEARLS ,1,2011-08-04 16:32:00,1.63,,United Kingdom
562417,22161,HEART DECORATION RUSTIC HANGING ,11,2011-08-04 16:32:00,0.79,,United Kingdom
562417,22178,VICTORIAN GLASS HANGING T-LIGHT,48,2011-08-04 16:32:00,1.25,,United Kingdom
562417,22219,LOVEBIRD HANGING DECORATION WHITE ,1,2011-08-04 16:32:00,1.63,,United Kingdom
