InvoiceNo,StockCode,Description,Quantity,InvoiceDate,UnitPrice,CustomerID,Country
566616,47566,PARTY BUNTING,4,2011-09-14 08:35:00,4.95,12895.0,United Kingdom
566616,85034A,3 GARDENIA MORRIS BOXED CANDLES,4,2011-09-14 08:35:00,4.25,12895.0,United Kingdom
566616,85034C,3 ROSE MORRIS BOXED CANDLES,4,2011-09-14 08:35:00,4.25,12895.0,United Kingdom
566616,22236,CAKE STAND 3 TIER MAGIC GARDEN,1,2011-09-14 08:35:00,12.75,12895.0,United Kingdom
566616,21992,VINTAGE PAISLEY STATIONERY SET,12,2011-09-14 08:35:00,1.25,12895.0,United Kingdom
566616,22090,PAPER BUNTING RETROSPOT,6,2011-09-14 08:35:00,2.95,12895.0,United Kingdom
566616,22089,PAPER BUNTING VINTAGE PAISLEY,6,2011-09-14 08:35:00,2.95,12895.0,United Kingdom
566616,22969,HOMEMADE JAM SCENTED CANDLES,12,2011-09-14 08:35:00,1.45,12895.0,United Kingdom
566616,21210,SET OF 72 RETROSPOT PAPER  DOILIES,12,2011-09-14 08:35:00,1.45,12895.0,United Kingdom
566616,21212,PACK OF 72 RETROSPOT CAKE CASES,24,2011-09-14 08:35:00,0.55,12895.0,United Kingdom
566616,21974,SET OF 36 PAISLEY FLOWER DOILIES,12,2011-09-14 08:35:00,1.45,12895.0,United Kingdom
566616,21977,PACK OF 60 PINK PAISLEY CAKE CASES,24,2011-09-14 08:35:00,0.55,12895.0,United Kingdom
566616,84988,SET OF 72 PINK HEART PAPER DOILIES,12,2011-09-14 08:35:00,1.45,12895.0,United Kingdom
566616,22138,BAKING SET 9 PIECE RETROSPOT ,3,2011-09-14 08:35:00,4.95,12895.0,United Kingdom
566616,23111,PARISIENNE SEWING BOX,2,2011-09-14 08:35:00,12.5,12895.0,United Kingdom
566616,23328,SET 6 SCHOOL MILK BOTTLES IN CRATE,4,2011-09-14 08:35:00,3.75,12895.0,United Kingdom
566617,23171,REGENCY TEA PLATE GREEN ,12,2011-09-14 09:11:00,1.65,18092.0,United Kingdom
566617,23172,REGENCY TEA PLATE PINK,12,2011-09-14 09:11:00,1.65,18092.0,United Kingdom
566617,23175,REGENCY MILK JUG PINK ,12,2011-09-14 09:11:00,3.25,18092.0,United Kingdom
566617,22309,TEA COSY RED  STRIPE,50,2011-09-14 09:11:00,2.1,18092.0,United Kingdom
566617,21485,RETROSPOT HEART HOT WATER BOTTLE,24,2011-09-14 09:11:00,4.25,18092.0,United Kingdom
566617,21481,FAWN BLUE HOT WATER BOTTLE,36,2011-09-14 09:11:00,3.39,18092.0,United Kingdom
566617,22182,CAKE STAND VICTORIAN FILIGREE SMALL,12,2011-09-14 09:11:00,4.95,18092.0,United Kingdom
566617,22423,REGENCY CAKESTAND 3 TIER,16,2011-09-14 09:11:00,10.95,18092.0,United Kingdom
566617,22699,ROSES REGENCY TEACUP AND SAUCER ,24,2011-09-14 09:11:00,2.55,18092.0,United Kingdom
566617,22114,HOT WATER BOTTLE TEA AND SYMPATHY,48,2011-09-14 09:11:00,3.75,18092.0,United Kingdom
566617,84029E,RED WOOLLY HOTTIE WHITE HEART.,24,2011-09-14 09:11:00,3.75,18092.0,United Kingdom
566617,23162,REGENCY TEA STRAINER,24,2011-09-14 09:11:00,3.75,18092.0,United Kingdom
566617,85048,15CM CHRISTMAS GLASS BALL 20 LIGHTS,4,2011-09-14 09:11:00,7.95,18092.0,United Kingdom
566617,23173,REGENCY TEAPOT ROSES ,12,2011-09-14 09:11:00,8.15,18092.0,United Kingdom
566617,22698,PINK REGENCY TEACUP AND SAUCER,24,2011-09-14 09:11:00,2.55,18092.0,United Kingdom
566617,23174,REGENCY SUGAR BOWL GREEN,12,2011-09-14 09:11:00,4.15,18092.0,United Kingdom
566618,35970,ZINC FOLKART SLEIGH BELLS,72,2011-09-14 09:13:00,1.49,17640.0,United Kingdom
566618,71477,COLOUR GLASS. STAR T-LIGHT HOLDER,72,2011-09-14 09:13:00,3.29,17640.0,United Kingdom
566618,21733,RED HANGING HEART T-LIGHT HOLDER,18,2011-09-14 09:13:00,2.95,17640.0,United Kingdom
566618,85123A,WHITE HANGING HEART T-LIGHT HOLDER,64,2011-09-14 09:13:00,2.55,17640.0,United Kingdom
566618,82494L,WOODEN FRAME ANTIQUE WHITE ,24,2011-09-14 09:13:00,2.55,17640.0,United Kingdom
566619,21166,COOK WITH WINE METAL SIGN ,48,2011-09-14 09:16:00,1.85,13798.0,United Kingdom
566619,22065,CHRISTMAS PUDDING TRINKET POT ,48,2011-09-14 09:16:00,1.25,13798.0,United Kingdom
566619,21928,JUMBO BAG SCANDINAVIAN BLUE PAISLEY,100,2011-09-14 09:16:00,1.79,13798.0,United Kingdom
566620,85227,SET OF 6 3D KIT CARDS FOR KIDS,12,2011-09-14 09:21:00,0.85,13588.0,United Kingdom
566620,22745,POPPY'S PLAYHOUSE BEDROOM ,6,2011-09-14 09:21:00,2.1,13588.0,United Kingdom
566620,22747,POPPY'S PLAYHOUSE BATHROOM,6,2011-09-14 09:21:00,2.1,13588.0,United Kingdom
566620,22746,POPPY'S PLAYHOUSE LIVINGROOM ,6,2011-09-14 09:21:00,2.1,13588.0,United Kingdom
566620,22748,POPPY'S PLAYHOUSE KITCHEN,6,2011-09-14 09:21:00,2.1,13588.0,United Kingdom
566620,21591,COSY HOUR CIGAR BOX MATCHES ,24,2011-09-14 09:21:00,1.25,13588.0,United Kingdom
566620,23353,6 GIFT TAGS VINTAGE CHRISTMAS ,12,2011-09-14 09:21:00,0.83,13588.0,United Kingdom
566620,23354,6 GIFT TAGS 50'S CHRISTMAS ,12,2011-09-14 09:21:00,0.83,13588.0,United Kingdom
566620,22142,CHRISTMAS CRAFT WHITE FAIRY ,12,2011-09-14 09:21:00,1.45,13588.0,United Kingdom
566620,22621,TRADITIONAL KNITTING NANCY,12,2011-09-14 09:21:00,1.65,13588.0,United Kingdom
566620,23188,VINTAGE  2 METER FOLDING RULER,12,2011-09-14 09:21:00,1.65,13588.0,United Kingdom
566620,22273,FELTCRAFT DOLL MOLLY,6,2011-09-14 09:21:00,2.95,13588.0,United Kingdom
566621,23427,STOOL HOME SWEET HOME ,1,2011-09-14 09:22:00,12.5,15845.0,United Kingdom
566621,23355,HOT WATER BOTTLE KEEP CALM,8,2011-09-14 09:22:00,4.95,15845.0,United Kingdom
566621,23356,LOVE HOT WATER BOTTLE,6,2011-09-14 09:22:00,5.95,15845.0,United Kingdom
566621,84978,HANGING HEART JAR T-LIGHT HOLDER,12,2011-09-14 09:22:00,1.25,15845.0,United Kingdom
566621,22568,FELTCRAFT CUSHION OWL,12,2011-09-14 09:22:00,3.75,15845.0,United Kingdom
566621,22569,FELTCRAFT CUSHION BUTTERFLY,12,2011-09-14 09:22:00,3.75,15845.0,United Kingdom
566621,22570,FELTCRAFT CUSHION RABBIT,12,2011-09-14 09:22:00,3.75,15845.0,United Kingdom
566621,22147,FELTCRAFT BUTTERFLY HEARTS,12,2011-09-14 09:22:00,1.45,15845.0,United Kingdom
566621,22142,CHRISTMAS CRAFT WHITE FAIRY ,12,2011-09-14 09:22:00,1.45,15845.0,United Kingdom
566621,22144,CHRISTMAS CRAFT LITTLE FRIENDS,12,2011-09-14 09:22:00,2.1,15845.0,United Kingdom
566621,22791,T-LIGHT GLASS FLUTED ANTIQUE,36,2011-09-14 09:22:00,1.25,15845.0,United Kingdom
566621,84879,ASSORTED COLOUR BIRD ORNAMENT,16,2011-09-14 09:22:00,1.69,15845.0,United Kingdom
566621,23322,LARGE WHITE HEART OF WICKER,12,2011-09-14 09:22:00,2.95,15845.0,United Kingdom
566621,23321,SMALL WHITE HEART OF WICKER,12,2011-09-14 09:22:00,1.65,15845.0,United Kingdom
566621,23301,GARDENERS KNEELING PAD KEEP CALM ,12,2011-09-14 09:22:00,1.65,15845.0,United Kingdom
566621,21326,AGED GLASS SILVER T-LIGHT HOLDER,36,2011-09-14 09:22:00,0.65,15845.0,United Kingdom
566621,84946,ANTIQUE SILVER T-LIGHT GLASS,24,2011-09-14 09:22:00,1.25,15845.0,United Kingdom
566621,22966,GINGERBREAD MAN COOKIE CUTTER,36,2011-09-14 09:22:00,1.25,15845.0,United Kingdom
566622,23083,SET 6 PAPER TABLE LANTERN STARS ,6,2011-09-14 09:27:00,3.75,13860.0,United Kingdom
566622,23058,CHRISTMAS HANGING SNOWFLAKE,12,2011-09-14 09:27:00,2.49,13860.0,United Kingdom
566622,21754,HOME BUILDING BLOCK WORD,3,2011-09-14 09:27:00,6.25,13860.0,United Kingdom
566622,82494L,WOODEN FRAME ANTIQUE WHITE ,6,2011-09-14 09:27:00,2.95,13860.0,United Kingdom
566622,21340,CLASSIC METAL BIRDCAGE PLANT HOLDER,1,2011-09-14 09:27:00,12.75,13860.0,United Kingdom
566622,22465,HANGING METAL STAR LANTERN,12,2011-09-14 09:27:00,1.65,13860.0,United Kingdom
566622,22295,HEART FILIGREE DOVE LARGE,12,2011-09-14 09:27:00,1.65,13860.0,United Kingdom
566622,22813,PACK 3 BOXES BIRD PANNETONE ,12,2011-09-14 09:27:00,1.95,13860.0,United Kingdom
566622,23236,STORAGE TIN VINTAGE DOILY ,6,2011-09-14 09:27:00,2.89,13860.0,United Kingdom
566622,22907,PACK OF 20 NAPKINS PANTRY DESIGN,12,2011-09-14 09:27:00,0.85,13860.0,United Kingdom
566622,22962,JAM JAR WITH PINK LID,12,2011-09-14 09:27:00,0.85,13860.0,United Kingdom
566622,22990,COTTON APRON PANTRY DESIGN,2,2011-09-14 09:27:00,4.95,13860.0,United Kingdom
566622,22989,SET 2 PANTRY DESIGN TEA TOWELS,6,2011-09-14 09:27:00,3.25,13860.0,United Kingdom
566622,22744,MAKE YOUR OWN MONSOON CARD KIT,6,2011-09-14 09:27:00,2.95,13860.0,United Kingdom
566622,22780,LIGHT GARLAND BUTTERFILES PINK,4,2011-09-14 09:27:00,4.25,13860.0,United Kingdom
566622,22570,FELTCRAFT CUSHION RABBIT,4,2011-09-14 09:27:00,3.75,13860.0,United Kingdom
566622,22569,FELTCRAFT CUSHION BUTTERFLY,4,2011-09-14 09:27:00,3.75,13860.0,United Kingdom
566622,23202,JUMBO BAG VINTAGE LEAF,10,2011-09-14 09:27:00,2.08,13860.0,United Kingdom
566622,20727,LUNCH BAG  BLACK SKULL.,10,2011-09-14 09:27:00,1.65,13860.0,United Kingdom
566622,23209,LUNCH BAG VINTAGE DOILY ,10,2011-09-14 09:27:00,1.65,13860.0,United Kingdom
566622,21484,CHICK GREY HOT WATER BOTTLE,4,2011-09-14 09:27:00,4.25,13860.0,United Kingdom
566622,22113,GREY HEART HOT WATER BOTTLE,4,2011-09-14 09:27:00,4.25,13860.0,United Kingdom
566622,22178,VICTORIAN GLASS HANGING T-LIGHT,6,2011-09-14 09:27:00,1.95,13860.0,United Kingdom
566622,23223,CHRISTMAS TREE HANGING SILVER ,12,2011-09-14 09:27:00,0.83,13860.0,United Kingdom
566623,21787,RAIN PONCHO RETROSPOT,72,2011-09-14 09:31:00,0.85,12756.0,Japan
566623,21786,POLKADOT RAIN HAT ,24,2011-09-14 09:31:00,0.42,12756.0,Japan
566623,21789,KIDS RAIN MAC PINK,24,2011-09-14 09:31:00,0.85,12756.0,Japan
566623,21788,KIDS RAIN MAC BLUE,24,2011-09-14 09:31:00,0.85,12756.0,Japan
566624,85078,SCANDINAVIAN 3 HEARTS NAPKIN RING,24,2011-09-14 09:36:00,0.19,17315.0,United Kingdom
566624,22224,WHITE LOVEBIRD LANTERN,12,2011-09-14 09:36:00,2.95,17315.0,United Kingdom
566624,71053,WHITE METAL LANTERN,4,2011-09-14 09:36:00,3.75,17315.0,United Kingdom
566624,47566,PARTY BUNTING,8,2011-09-14 09:36:00,4.95,17315.0,United Kingdom
566624,84882,GREEN WIRE STANDING CANDLE HOLDER,4,2011-09-14 09:36:00,3.75,17315.0,United Kingdom
566624,22804,CANDLEHOLDER PINK HANGING HEART,6,2011-09-14 09:36:00,2.95,17315.0,United Kingdom
566624,84970S,HANGING HEART ZINC T-LIGHT HOLDER,12,2011-09-14 09:36:00,0.85,17315.0,United Kingdom
566624,22151,PLACE SETTING WHITE HEART,72,2011-09-14 09:36:00,0.42,17315.0,United Kingdom
566624,22456,NATURAL SLATE CHALKBOARD LARGE ,6,2011-09-14 09:36:00,4.95,17315.0,United Kingdom
566624,22698,PINK REGENCY TEACUP AND SAUCER,6,2011-09-14 09:36:00,2.95,17315.0,United Kingdom
566624,84978,HANGING HEART JAR T-LIGHT HOLDER,12,2011-09-14 09:36:00,1.25,17315.0,United Kingdom
566624,22178,VICTORIAN GLASS HANGING T-LIGHT,6,2011-09-14 09:36:00,1.95,17315.0,United Kingdom
566624,71459,HANGING JAM JAR T-LIGHT HOLDERS,12,2011-09-14 09:36:00,0.85,17315.0,United Kingdom
566624,22697,GREEN REGENCY TEACUP AND SAUCER,12,2011-09-14 09:36:00,2.95,17315.0,United Kingdom
566624,22943,CHRISTMAS LIGHTS 10 VINTAGE BAUBLES,3,2011-09-14 09:36:00,4.95,17315.0,United Kingdom
566625,21262,WHITE GOOSE FEATHER CHRISTMAS TREE ,6,2011-09-14 09:38:00,2.95,14911.0,EIRE
566625,21263,GREEN GOOSE FEATHER TREE 60CM,12,2011-09-14 09:38:00,1.95,14911.0,EIRE
566625,21394,RED POLKADOT BEAKER ,48,2011-09-14 09:38:00,0.39,14911.0,EIRE
566625,21932,SCANDINAVIAN PAISLEY PICNIC BAG,10,2011-09-14 09:38:00,1.65,14911.0,EIRE
566625,21933,PINK VINTAGE PAISLEY PICNIC BAG,10,2011-09-14 09:38:00,1.65,14911.0,EIRE
566625,22161,HEART DECORATION RUSTIC HANGING ,24,2011-09-14 09:38:00,0.19,14911.0,EIRE
566625,35471D,SET OF 3 BIRD LIGHT PINK FEATHER ,24,2011-09-14 09:38:00,0.39,14911.0,EIRE
566625,35598B,BLACK CHRISTMAS TREE 60CM,6,2011-09-14 09:38:00,2.95,14911.0,EIRE
566625,35598D,PINK/WHITE CHRISTMAS TREE 60CM,24,2011-09-14 09:38:00,0.65,14911.0,EIRE
566625,35646,VINTAGE BEAD PINK EVENING BAG,24,2011-09-14 09:38:00,1.25,14911.0,EIRE
566625,35818P,"ACRYLIC JEWEL ICICLE, PINK",36,2011-09-14 09:38:00,0.38,14911.0,EIRE
566625,35648,VINTAGE BEAD PINK PURSE ,24,2011-09-14 09:38:00,0.83,14911.0,EIRE
566625,35815P,"ACRYLIC JEWEL SNOWFLAKE, PINK",48,2011-09-14 09:38:00,0.38,14911.0,EIRE
566625,35819B,"ACRYLIC HANGING JEWEL,BLUE",36,2011-09-14 09:38:00,0.38,14911.0,EIRE
566625,35651,VINTAGE BEAD PINK SCARF ,12,2011-09-14 09:38:00,1.65,14911.0,EIRE
566625,35933,PINK STOCKING CHRISTMAS DECORATION,10,2011-09-14 09:38:00,0.38,14911.0,EIRE
566625,84341B,SMALL PINK MAGIC CHRISTMAS TREE,36,2011-09-14 09:38:00,0.38,14911.0,EIRE
566625,85032D,YULETIDE IMAGES GIFT WRAP SET,48,2011-09-14 09:38:00,0.65,14911.0,EIRE
566625,85130C,BEADED CRYSTAL HEART BLUE  LARGE,24,2011-09-14 09:38:00,0.79,14911.0,EIRE
566625,85130B,BEADED CRYSTAL HEART GREEN LARGE,24,2011-09-14 09:38:00,0.79,14911.0,EIRE
566625,23431,NATURAL HANGING QUILTED HEARTS ,12,2011-09-14 09:38:00,0.83,14911.0,EIRE
566625,23427,STOOL HOME SWEET HOME ,1,2011-09-14 09:38:00,12.5,14911.0,EIRE
566625,23397,FOOT STOOL HOME SWEET HOME ,2,2011-09-14 09:38:00,9.95,14911.0,EIRE
566625,23400,SHELF WITH 4 HOOKS HOME SWEET HOME,2,2011-09-14 09:38:00,6.25,14911.0,EIRE
566625,23403,LETTER HOLDER HOME SWEET HOME,4,2011-09-14 09:38:00,3.75,14911.0,EIRE
566625,23401,RUSTIC MIRROR WITH LACE HEART,2,2011-09-14 09:38:00,6.25,14911.0,EIRE
566625,23413,VINTAGE COFFEE GRINDER BOX,3,2011-09-14 09:38:00,4.95,14911.0,EIRE
566625,85123A,WHITE HANGING HEART T-LIGHT HOLDER,6,2011-09-14 09:38:00,2.95,14911.0,EIRE
566625,15056N,EDWARDIAN PARASOL NATURAL,3,2011-09-14 09:38:00,5.95,14911.0,EIRE
566625,15036,ASSORTED COLOURS SILK FAN,12,2011-09-14 09:38:00,0.83,14911.0,EIRE
566625,22110,BIRD HOUSE HOT WATER BOTTLE,6,2011-09-14 09:38:00,2.55,14911.0,EIRE
566625,23099,FRENCH CARRIAGE LANTERN,2,2011-09-14 09:38:00,6.65,14911.0,EIRE
566625,22806,SET OF 6 T-LIGHTS WEDDING CAKE ,6,2011-09-14 09:38:00,2.95,14911.0,EIRE
566625,72586,SET OF 6 HALLOWEEN GHOST T-LIGHTS,36,2011-09-14 09:38:00,0.42,14911.0,EIRE
566625,23353,6 GIFT TAGS VINTAGE CHRISTMAS ,12,2011-09-14 09:38:00,0.83,14911.0,EIRE
566625,22219,LOVEBIRD HANGING DECORATION WHITE ,12,2011-09-14 09:38:00,0.85,14911.0,EIRE
566625,84879,ASSORTED COLOUR BIRD ORNAMENT,8,2011-09-14 09:38:00,1.69,14911.0,EIRE
566625,85199L,LARGE HANGING IVORY & RED WOOD BIRD,12,2011-09-14 09:38:00,0.65,14911.0,EIRE
566625,23275,SET OF 3 HANGING OWLS OLLIE BEAK,12,2011-09-14 09:38:00,1.25,14911.0,EIRE
566625,21136,PAINTED METAL PEARS ASSORTED,8,2011-09-14 09:38:00,1.69,14911.0,EIRE
566625,22829,SWEETHEART WIRE WALL TIDY,2,2011-09-14 09:38:00,9.95,14911.0,EIRE
566625,23132,SMALL IVORY HEART WALL ORGANISER,3,2011-09-14 09:38:00,5.75,14911.0,EIRE
566625,20726,LUNCH BAG WOODLAND,10,2011-09-14 09:38:00,1.65,14911.0,EIRE
566625,21559,STRAWBERRY LUNCH BOX WITH CUTLERY,6,2011-09-14 09:38:00,2.55,14911.0,EIRE
566625,23207,LUNCH BAG ALPHABET DESIGN,10,2011-09-14 09:38:00,1.65,14911.0,EIRE
566625,48187,DOORMAT NEW ENGLAND,2,2011-09-14 09:38:00,8.25,14911.0,EIRE
566625,20984,12 PENCILS TALL TUBE POSY,24,2011-09-14 09:38:00,0.29,14911.0,EIRE
566625,21117,BLOND DOLL DOORSTOP,12,2011-09-14 09:38:00,1.25,14911.0,EIRE
566625,21261,GREEN GOOSE FEATHER CHRISTMAS TREE ,6,2011-09-14 09:38:00,2.95,14911.0,EIRE
566625,21264,WHITE GOOSE FEATHER TREE 60CM ,12,2011-09-14 09:38:00,1.95,14911.0,EIRE
C566626,22461,SAVOY ART DECO CLOCK,-2,2011-09-14 10:07:00,3.95,15380.0,United Kingdom
566627,23209,LUNCH BAG VINTAGE DOILY ,20,2011-09-14 10:28:00,1.65,18229.0,United Kingdom
566627,22383,LUNCH BAG SUKI DESIGN ,40,2011-09-14 10:28:00,1.65,18229.0,United Kingdom
566627,22382,LUNCH BAG SPACEBOY DESIGN ,20,2011-09-14 10:28:00,1.65,18229.0,United Kingdom
566627,22193,RED DINER WALL CLOCK,2,2011-09-14 10:28:00,8.5,18229.0,United Kingdom
566627,20725,LUNCH BAG RED RETROSPOT,100,2011-09-14 10:28:00,1.45,18229.0,United Kingdom
566627,20728,LUNCH BAG CARS BLUE,20,2011-09-14 10:28:00,1.65,18229.0,United Kingdom
566628,40016,CHINESE DRAGON PAPER LANTERNS,600,2011-09-14 10:32:00,0.25,12971.0,United Kingdom
566628,21464,DISCO BALL ROTATOR BATTERY OPERATED,4,2011-09-14 10:32:00,4.25,12971.0,United Kingdom
566629,21770,OPEN CLOSED METAL SIGN,6,2011-09-14 10:32:00,4.95,15622.0,United Kingdom
566629,21908,CHOCOLATE THIS WAY METAL SIGN,12,2011-09-14 10:32:00,2.1,15622.0,United Kingdom
566629,84030E,ENGLISH ROSE HOT WATER BOTTLE,4,2011-09-14 10:32:00,4.25,15622.0,United Kingdom
566629,22114,HOT WATER BOTTLE TEA AND SYMPATHY,4,2011-09-14 10:32:00,4.25,15622.0,United Kingdom
566629,84029E,RED WOOLLY HOTTIE WHITE HEART.,4,2011-09-14 10:32:00,4.25,15622.0,United Kingdom
566629,23357,HOT WATER BOTTLE SEX BOMB,4,2011-09-14 10:32:00,4.95,15622.0,United Kingdom
566629,22112,CHOCOLATE HOT WATER BOTTLE,3,2011-09-14 10:32:00,4.95,15622.0,United Kingdom
566629,23203,JUMBO BAG VINTAGE DOILY ,20,2011-09-14 10:32:00,2.08,15622.0,United Kingdom
566629,23343,JUMBO BAG VINTAGE CHRISTMAS ,20,2011-09-14 10:32:00,2.08,15622.0,United Kingdom
566629,23344,JUMBO BAG 50'S CHRISTMAS ,10,2011-09-14 10:32:00,2.08,15622.0,United Kingdom
566629,22411,JUMBO SHOPPER VINTAGE RED PAISLEY,20,2011-09-14 10:32:00,2.08,15622.0,United Kingdom
566629,23200,JUMBO BAG PEARS,10,2011-09-14 10:32:00,2.08,15622.0,United Kingdom
566629,21930,JUMBO STORAGE BAG SKULLS,20,2011-09-14 10:32:00,2.08,15622.0,United Kingdom
566629,23209,LUNCH BAG VINTAGE DOILY ,10,2011-09-14 10:32:00,1.65,15622.0,United Kingdom
566629,20727,LUNCH BAG  BLACK SKULL.,10,2011-09-14 10:32:00,1.65,15622.0,United Kingdom
566629,20726,LUNCH BAG WOODLAND,10,2011-09-14 10:32:00,1.65,15622.0,United Kingdom
566629,22560,TRADITIONAL MODELLING CLAY,24,2011-09-14 10:32:00,1.25,15622.0,United Kingdom
566629,23397,FOOT STOOL HOME SWEET HOME ,2,2011-09-14 10:32:00,9.95,15622.0,United Kingdom
566629,23318,BOX OF 6 MINI VINTAGE CRACKERS,12,2011-09-14 10:32:00,2.49,15622.0,United Kingdom
566629,22950,36 DOILIES VINTAGE CHRISTMAS,24,2011-09-14 10:32:00,1.45,15622.0,United Kingdom
566629,22909,SET OF 20 VINTAGE CHRISTMAS NAPKINS,12,2011-09-14 10:32:00,0.85,15622.0,United Kingdom
566629,22952,60 CAKE CASES VINTAGE CHRISTMAS,24,2011-09-14 10:32:00,0.55,15622.0,United Kingdom
566629,23234,BISCUIT TIN VINTAGE CHRISTMAS,6,2011-09-14 10:32:00,2.89,15622.0,United Kingdom
566629,23314,VINTAGE CHRISTMAS TABLECLOTH,2,2011-09-14 10:32:00,12.5,15622.0,United Kingdom
566629,22910,PAPER CHAIN KIT VINTAGE CHRISTMAS,12,2011-09-14 10:32:00,2.95,15622.0,United Kingdom
566630,22577,WOODEN HEART CHRISTMAS SCANDINAVIAN,12,2011-09-14 10:33:00,0.85,12971.0,United Kingdom
566630,22578,WOODEN STAR CHRISTMAS SCANDINAVIAN,24,2011-09-14 10:33:00,0.85,12971.0,United Kingdom
566630,15044A,PINK PAPER PARASOL ,12,2011-09-14 10:33:00,2.95,12971.0,United Kingdom
566630,15044C,PURPLE PAPER PARASOL,12,2011-09-14 10:33:00,2.95,12971.0,United Kingdom
566630,15044D,RED PAPER PARASOL,12,2011-09-14 10:33:00,2.95,12971.0,United Kingdom
566630,22579,WOODEN TREE CHRISTMAS SCANDINAVIAN,24,2011-09-14 10:33:00,0.85,12971.0,United Kingdom
566631,23236,DOILEY BISCUIT TIN,6,2011-09-14 10:34:00,2.89,15622.0,United Kingdom
566631,23240,SET OF 4 KNICK KNACK TINS DOILEY ,6,2011-09-14 10:34:00,4.15,15622.0,United Kingdom
566632,23245,SET OF 3 REGENCY CAKE TINS,4,2011-09-14 10:35:00,4.95,15622.0,United Kingdom
566632,23294,SET OF 6 SNACK LOAF BAKING CASES,12,2011-09-14 10:35:00,0.83,15622.0,United Kingdom
566632,23293,SET OF 12 FAIRY CAKE BAKING CASES,12,2011-09-14 10:35:00,0.83,15622.0,United Kingdom
566632,21210,SET OF 72 RETROSPOT PAPER  DOILIES,12,2011-09-14 10:35:00,1.45,15622.0,United Kingdom
566632,23025,DRAWER KNOB VINTAGE GLASS BALL,6,2011-09-14 10:35:00,2.08,15622.0,United Kingdom
566633,23241,TREASURE TIN GYMKHANA DESIGN,24,2011-09-14 10:40:00,2.08,17193.0,United Kingdom
566633,23238,SET OF 4 KNICK KNACK TINS LONDON ,24,2011-09-14 10:40:00,4.15,17193.0,United Kingdom
566633,23240,SET OF 4 KNICK KNACK TINS DOILY ,24,2011-09-14 10:40:00,4.15,17193.0,United Kingdom
566633,23242,TREASURE TIN BUFFALO BILL ,24,2011-09-14 10:40:00,2.08,17193.0,United Kingdom
566634,82484,WOOD BLACK BOARD ANT WHITE FINISH,2,2011-09-14 10:42:00,7.95,13183.0,United Kingdom
566634,85150,LADIES & GENTLEMEN METAL SIGN,18,2011-09-14 10:42:00,2.55,13183.0,United Kingdom
566634,21165,BEWARE OF THE CAT METAL SIGN ,24,2011-09-14 10:42:00,1.69,13183.0,United Kingdom
566634,82583,HOT BATHS METAL SIGN,72,2011-09-14 10:42:00,1.85,13183.0,United Kingdom
566634,85152,HAND OVER THE CHOCOLATE   SIGN ,48,2011-09-14 10:42:00,1.85,13183.0,United Kingdom
566634,21175,GIN + TONIC DIET METAL SIGN,48,2011-09-14 10:42:00,2.08,13183.0,United Kingdom
566634,21166,COOK WITH WINE METAL SIGN ,96,2011-09-14 10:42:00,1.85,13183.0,United Kingdom
566634,21181,PLEASE ONE PERSON METAL SIGN,48,2011-09-14 10:42:00,1.85,13183.0,United Kingdom
566635,71459,HANGING JAM JAR T-LIGHT HOLDERS,288,2011-09-14 10:54:00,0.85,,United Kingdom
566647,21201,TROPICAL  HONEYCOMB PAPER GARLAND ,1,2011-09-14 11:21:00,2.55,18001.0,United Kingdom
566647,22090,PAPER BUNTING RETROSPOT,1,2011-09-14 11:21:00,2.95,18001.0,United Kingdom
566647,20752,BLUE POLKADOT WASHING UP GLOVES,1,2011-09-14 11:21:00,2.1,18001.0,United Kingdom
566647,22743,MAKE YOUR OWN FLOWERPOWER CARD KIT,1,2011-09-14 11:21:00,2.95,18001.0,United Kingdom
566647,16169E,WRAP 50'S  CHRISTMAS,50,2011-09-14 11:21:00,0.42,18001.0,United Kingdom
566647,22632,HAND WARMER RED RETROSPOT,1,2011-09-14 11:21:00,2.1,18001.0,United Kingdom
566647,85049A,TRADITIONAL CHRISTMAS RIBBONS,1,2011-09-14 11:21:00,1.25,18001.0,United Kingdom
566647,84558A,3D DOG PICTURE PLAYING CARDS,4,2011-09-14 11:21:00,2.95,18001.0,United Kingdom
566647,22812,PACK 3 BOXES CHRISTMAS PANNETONE,2,2011-09-14 11:21:00,1.95,18001.0,United Kingdom
566647,22086,PAPER CHAIN KIT 50'S CHRISTMAS ,1,2011-09-14 11:21:00,2.95,18001.0,United Kingdom
566647,22632,HAND WARMER RED RETROSPOT,1,2011-09-14 11:21:00,2.1,18001.0,United Kingdom
566647,21212,PACK OF 72 RETROSPOT CAKE CASES,1,2011-09-14 11:21:00,0.55,18001.0,United Kingdom
566647,23119,PACK OF 6 LARGE FRUIT STRAWS ,1,2011-09-14 11:21:00,0.62,18001.0,United Kingdom
566647,23025,DRAWER KNOB VINTAGE GLASS BALL,6,2011-09-14 11:21:00,2.08,18001.0,United Kingdom
566647,21086,SET/6 RED SPOTTY PAPER CUPS,2,2011-09-14 11:21:00,0.65,18001.0,United Kingdom
566647,22315,200 RED + WHITE BENDY STRAWS,1,2011-09-14 11:21:00,1.25,18001.0,United Kingdom
566647,21094,SET/6 RED SPOTTY PAPER PLATES,1,2011-09-14 11:21:00,0.85,18001.0,United Kingdom
566647,21080,SET/20 RED RETROSPOT PAPER NAPKINS ,1,2011-09-14 11:21:00,0.85,18001.0,United Kingdom
566647,21621,VINTAGE UNION JACK BUNTING,1,2011-09-14 11:21:00,8.5,18001.0,United Kingdom
566647,40005B,BLUE ORGANDY ROUND LAMPSHADE W BEA,2,2011-09-14 11:21:00,0.85,18001.0,United Kingdom
566647,21584,RETROSPOT SMALL TUBE MATCHES,3,2011-09-14 11:21:00,1.65,18001.0,United Kingdom
566647,40001,WHITE BAMBOO RIBS LAMPSHADE,5,2011-09-14 11:21:00,0.85,18001.0,United Kingdom
566647,84051,ASS COLOUR GLOWING TIARAS,6,2011-09-14 11:21:00,0.85,18001.0,United Kingdom
566647,21034,REX CASH+CARRY JUMBO SHOPPER,1,2011-09-14 11:21:00,0.95,18001.0,United Kingdom
566647,20969,RED FLORAL FELTCRAFT SHOULDER BAG,1,2011-09-14 11:21:00,3.75,18001.0,United Kingdom
566647,21498,RED RETROSPOT WRAP ,50,2011-09-14 11:21:00,0.42,18001.0,United Kingdom
566647,23547,WRAP FLOWER SHOP  ,25,2011-09-14 11:21:00,0.42,18001.0,United Kingdom
566647,22704,WRAP RED APPLES ,50,2011-09-14 11:21:00,0.42,18001.0,United Kingdom
566647,23230,WRAP ALPHABET DESIGN,25,2011-09-14 11:21:00,0.42,18001.0,United Kingdom
566647,23192,BUNDLE OF 3 ALPHABET EXERCISE BOOKS,1,2011-09-14 11:21:00,1.65,18001.0,United Kingdom
566647,21039,RED RETROSPOT SHOPPING BAG,1,2011-09-14 11:21:00,2.55,18001.0,United Kingdom
566647,22580,ADVENT CALENDAR GINGHAM SACK,1,2011-09-14 11:21:00,5.95,18001.0,United Kingdom
566647,22940,FELTCRAFT CHRISTMAS FAIRY,2,2011-09-14 11:21:00,4.25,18001.0,United Kingdom
566647,21242,RED RETROSPOT PLATE ,6,2011-09-14 11:21:00,1.69,18001.0,United Kingdom
566647,20676,RED RETROSPOT BOWL,6,2011-09-14 11:21:00,1.25,18001.0,United Kingdom
566647,22605,WOODEN CROQUET GARDEN SET,1,2011-09-14 11:21:00,14.95,18001.0,United Kingdom
566647,23559,WOODLAND BUNNIES LOLLY MAKERS,1,2011-09-14 11:21:00,2.08,18001.0,United Kingdom
566647,85049E,SCANDINAVIAN REDS RIBBONS,5,2011-09-14 11:21:00,1.25,18001.0,United Kingdom
566647,35970,ZINC FOLKART SLEIGH BELLS,2,2011-09-14 11:21:00,1.69,18001.0,United Kingdom
566647,23323,WHITE WICKER STAR ,9,2011-09-14 11:21:00,2.1,18001.0,United Kingdom
566647,23201,JUMBO BAG ALPHABET,1,2011-09-14 11:21:00,2.08,18001.0,United Kingdom
566647,23205,CHARLOTTE BAG VINTAGE ALPHABET ,3,2011-09-14 11:21:00,0.85,18001.0,United Kingdom
566648,23356,LOVE HOT WATER BOTTLE,3,2011-09-14 11:25:00,5.95,14198.0,United Kingdom
566648,23401,RUSTIC MIRROR WITH LACE HEART,2,2011-09-14 11:25:00,6.25,14198.0,United Kingdom
566648,23404,HOME SWEET HOME BLACKBOARD,6,2011-09-14 11:25:00,4.95,14198.0,United Kingdom
566648,82486,3 DRAWER ANTIQUE WHITE WOOD CABINET,2,2011-09-14 11:25:00,8.95,14198.0,United Kingdom
566648,82482,WOODEN PICTURE FRAME WHITE FINISH,6,2011-09-14 11:25:00,2.95,14198.0,United Kingdom
566648,22741,FUNKY DIVA PEN,48,2011-09-14 11:25:00,0.85,14198.0,United Kingdom
566648,22086,PAPER CHAIN KIT 50'S CHRISTMAS ,6,2011-09-14 11:25:00,2.95,14198.0,United Kingdom
566648,22910,PAPER CHAIN KIT VINTAGE CHRISTMAS,6,2011-09-14 11:25:00,2.95,14198.0,United Kingdom
566649,21181,PLEASE ONE PERSON METAL SIGN,48,2011-09-14 11:26:00,1.85,18173.0,United Kingdom
566649,21174,POTTERING IN THE SHED METAL SIGN,24,2011-09-14 11:26:00,2.08,18173.0,United Kingdom
566649,21175,GIN + TONIC DIET METAL SIGN,24,2011-09-14 11:26:00,2.55,18173.0,United Kingdom
566649,22086,PAPER CHAIN KIT 50'S CHRISTMAS ,12,2011-09-14 11:26:00,2.95,18173.0,United Kingdom
566649,22910,PAPER CHAIN KIT VINTAGE CHRISTMAS,12,2011-09-14 11:26:00,2.95,18173.0,United Kingdom
566649,35970,ZINC FOLKART SLEIGH BELLS,72,2011-09-14 11:26:00,1.49,18173.0,United Kingdom
566667,22095,LADS ONLY TISSUE BOX,1,2011-09-14 11:34:00,0.39,14660.0,United Kingdom
566667,22467,GUMBALL COAT RACK,2,2011-09-14 11:34:00,2.55,14660.0,United Kingdom
566667,47504K,ENGLISH ROSE GARDEN SECATEURS,4,2011-09-14 11:34:00,0.79,14660.0,United Kingdom
566667,23423,PANTRY 3 HOOK ROLLING PIN HANGER,1,2011-09-14 11:34:00,3.75,14660.0,United Kingdom
566667,21845,DAIRY MAID STRIPE MUG,6,2011-09-14 11:34:00,0.79,14660.0,United Kingdom
566667,22191,IVORY DINER WALL CLOCK,1,2011-09-14 11:34:00,8.5,14660.0,United Kingdom
566667,23187,FRENCH STYLE STORAGE JAR BONBONS,6,2011-09-14 11:34:00,0.29,14660.0,United Kingdom
566667,21530,DAIRY MAID TOASTRACK,6,2011-09-14 11:34:00,0.79,14660.0,United Kingdom
