InvoiceNo,StockCode,Description,Quantity,InvoiceDate,UnitPrice,CustomerID,Country
564432,48194,DOORMAT HEARTS,2,2011-08-25 11:40:00,7.95,13517.0,United Kingdom
564432,21524,DOORMAT SPOTTY HOME SWEET HOME,2,2011-08-25 11:40:00,7.95,13517.0,United Kingdom
564432,23170,REGENCY TEA PLATE ROSES ,12,2011-08-25 11:40:00,1.65,13517.0,United Kingdom
564432,23172,REGENCY TEA PLATE PINK,12,2011-08-25 11:40:00,1.65,13517.0,United Kingdom
564432,23171,REGENCY TEA PLATE GREEN ,12,2011-08-25 11:40:00,1.65,13517.0,United Kingdom
564432,22990,COTTON APRON PANTRY DESIGN,2,2011-08-25 11:40:00,4.95,13517.0,United Kingdom
564432,20754,RETROSPOT RED WASHING UP GLOVES,6,2011-08-25 11:40:00,2.1,13517.0,United Kingdom
564432,23164,REGENCY CAKE SLICE,4,2011-08-25 11:40:00,4.95,13517.0,United Kingdom
564432,22617,BAKING SET SPACEBOY DESIGN,3,2011-08-25 11:40:00,4.95,13517.0,United Kingdom
564432,22138,BAKING SET 9 PIECE RETROSPOT ,3,2011-08-25 11:40:00,4.95,13517.0,United Kingdom
564432,85230A,OPIUM SCENTED VOTIVE CANDLE,24,2011-08-25 11:40:00,0.29,13517.0,United Kingdom
564432,85230E,STRAWBRY SCENTED VOTIVE CANDLE,24,2011-08-25 11:40:00,0.29,13517.0,United Kingdom
564432,23298,SPOTTY BUNTING,3,2011-08-25 11:40:00,4.95,13517.0,United Kingdom
564432,22794,SWEETHEART WIRE MAGAZINE RACK,2,2011-08-25 11:40:00,7.95,13517.0,United Kingdom
564432,22335,HEART DECORATION PAINTED ZINC ,24,2011-08-25 11:40:00,0.65,13517.0,United Kingdom
564432,22699,ROSES REGENCY TEACUP AND SAUCER ,6,2011-08-25 11:40:00,2.95,13517.0,United Kingdom
564432,22698,PINK REGENCY TEACUP AND SAUCER,6,2011-08-25 11:40:00,2.95,13517.0,United Kingdom
564432,22697,GREEN REGENCY TEACUP AND SAUCER,6,2011-08-25 11:40:00,2.95,13517.0,United Kingdom
564432,23173,REGENCY TEAPOT ROSES ,2,2011-08-25 11:40:00,9.95,13517.0,United Kingdom
564432,21164,HOME SWEET HOME METAL SIGN ,6,2011-08-25 11:40:00,2.95,13517.0,United Kingdom
564432,21481,FAWN BLUE HOT WATER BOTTLE,6,2011-08-25 11:40:00,2.95,13517.0,United Kingdom
564432,22114,HOT WATER BOTTLE TEA AND SYMPATHY,4,2011-08-25 11:40:00,4.25,13517.0,United Kingdom
564432,21137,BLACK RECORD COVER FRAME,4,2011-08-25 11:40:00,3.75,13517.0,United Kingdom
564432,23191,BUNDLE OF 3 RETRO NOTE BOOKS,12,2011-08-25 11:40:00,1.65,13517.0,United Kingdom
564432,22759,SET OF 3 NOTEBOOKS IN PARCEL,12,2011-08-25 11:40:00,1.65,13517.0,United Kingdom
564432,84535B,FAIRY CAKES NOTEBOOK A6 SIZE,16,2011-08-25 11:40:00,0.65,13517.0,United Kingdom
564432,22692,DOORMAT WELCOME TO OUR HOME,2,2011-08-25 11:40:00,7.95,13517.0,United Kingdom
564433,20750,RED RETROSPOT MINI CASES,2,2011-08-25 11:46:00,7.95,16503.0,United Kingdom
564433,20749,ASSORTED COLOUR MINI CASES,2,2011-08-25 11:46:00,7.95,16503.0,United Kingdom
564433,21055,TOOL BOX SOFT TOY ,1,2011-08-25 11:46:00,8.95,16503.0,United Kingdom
564433,23077,DOUGHNUT LIP GLOSS ,20,2011-08-25 11:46:00,1.25,16503.0,United Kingdom
564433,22179,SET 10 NIGHT OWL LIGHTS,2,2011-08-25 11:46:00,6.75,16503.0,United Kingdom
564433,22580,ADVENT CALENDAR GINGHAM SACK,3,2011-08-25 11:46:00,5.95,16503.0,United Kingdom
564433,22946,WOODEN ADVENT CALENDAR CREAM,2,2011-08-25 11:46:00,16.95,16503.0,United Kingdom
564433,22834,HAND WARMER BABUSHKA DESIGN,12,2011-08-25 11:46:00,2.1,16503.0,United Kingdom
564433,22633,HAND WARMER UNION JACK,12,2011-08-25 11:46:00,2.1,16503.0,United Kingdom
564433,22866,HAND WARMER SCOTTY DOG DESIGN,12,2011-08-25 11:46:00,2.1,16503.0,United Kingdom
564433,22865,HAND WARMER OWL DESIGN,12,2011-08-25 11:46:00,2.1,16503.0,United Kingdom
564433,22138,BAKING SET 9 PIECE RETROSPOT ,3,2011-08-25 11:46:00,4.95,16503.0,United Kingdom
564433,21621,VINTAGE UNION JACK BUNTING,2,2011-08-25 11:46:00,8.5,16503.0,United Kingdom
564433,23298,SPOTTY BUNTING,3,2011-08-25 11:46:00,4.95,16503.0,United Kingdom
564433,11001,ASSTD DESIGN RACING CAR PEN,16,2011-08-25 11:46:00,1.69,16503.0,United Kingdom
564433,20726,LUNCH BAG WOODLAND,10,2011-08-25 11:46:00,1.65,16503.0,United Kingdom
564433,20727,LUNCH BAG  BLACK SKULL.,10,2011-08-25 11:46:00,1.65,16503.0,United Kingdom
564434,84832,ZINC WILLIE WINKIE  CANDLE STICK,12,2011-08-25 11:59:00,0.85,14687.0,United Kingdom
564434,84755,COLOUR GLASS T-LIGHT HOLDER HANGING,144,2011-08-25 11:59:00,0.55,14687.0,United Kingdom
564434,23152,IVORY SWEETHEART WIRE LETTER RACK ,8,2011-08-25 11:59:00,3.75,14687.0,United Kingdom
564434,23153,ZINC SWEETHEART WIRE LETTER RACK,4,2011-08-25 11:59:00,3.75,14687.0,United Kingdom
564434,23146,TRIPLE HOOK ANTIQUE IVORY ROSE,8,2011-08-25 11:59:00,3.29,14687.0,United Kingdom
564434,23147,SINGLE ANTIQUE ROSE HOOK IVORY,12,2011-08-25 11:59:00,1.45,14687.0,United Kingdom
564434,84945,MULTI COLOUR SILVER T-LIGHT HOLDER,48,2011-08-25 11:59:00,0.85,14687.0,United Kingdom
564434,84406B,CREAM CUPID HEARTS COAT HANGER,32,2011-08-25 11:59:00,3.75,14687.0,United Kingdom
564434,23273,HEART T-LIGHT HOLDER WILLIE WINKIE,24,2011-08-25 11:59:00,1.65,14687.0,United Kingdom
564434,85053,FRENCH ENAMEL CANDLEHOLDER,12,2011-08-25 11:59:00,2.1,14687.0,United Kingdom
564434,85062,PEARL CRYSTAL PUMPKIN T-LIGHT HLDR,48,2011-08-25 11:59:00,1.45,14687.0,United Kingdom
564434,22173,METAL 4 HOOK HANGER FRENCH CHATEAU,8,2011-08-25 11:59:00,2.95,14687.0,United Kingdom
564434,21770,OPEN CLOSED METAL SIGN,2,2011-08-25 11:59:00,4.95,14687.0,United Kingdom
564434,22671,FRENCH LAUNDRY SIGN BLUE METAL,12,2011-08-25 11:59:00,1.65,14687.0,United Kingdom
564434,22178,VICTORIAN GLASS HANGING T-LIGHT,96,2011-08-25 11:59:00,1.06,14687.0,United Kingdom
C564435,POST,POSTAGE,-1,2011-08-25 12:05:00,4.41,17676.0,United Kingdom
564436,21982,PACK OF 12 SUKI TISSUES ,12,2011-08-25 12:06:00,0.29,17841.0,United Kingdom
564436,21984,PACK OF 12 PINK PAISLEY TISSUES ,12,2011-08-25 12:06:00,0.29,17841.0,United Kingdom
564436,21985,PACK OF 12 HEARTS DESIGN TISSUES ,12,2011-08-25 12:06:00,0.29,17841.0,United Kingdom
564436,21986,PACK OF 12 PINK POLKADOT TISSUES,12,2011-08-25 12:06:00,0.29,17841.0,United Kingdom
564436,20724,RED RETROSPOT CHARLOTTE BAG,5,2011-08-25 12:06:00,0.85,17841.0,United Kingdom
564436,22356,CHARLOTTE BAG PINK POLKADOT,5,2011-08-25 12:06:00,0.85,17841.0,United Kingdom
564436,22355,CHARLOTTE BAG SUKI DESIGN,5,2011-08-25 12:06:00,0.85,17841.0,United Kingdom
564436,84596B,SMALL DOLLY MIX DESIGN ORANGE BOWL,3,2011-08-25 12:06:00,0.42,17841.0,United Kingdom
564436,84596F,SMALL MARSHMALLOWS PINK BOWL,3,2011-08-25 12:06:00,0.42,17841.0,United Kingdom
564436,20728,LUNCH BAG CARS BLUE,3,2011-08-25 12:06:00,1.65,17841.0,United Kingdom
564436,21114,LAVENDER SCENTED FABRIC HEART,5,2011-08-25 12:06:00,1.25,17841.0,United Kingdom
564436,21811,HANGING HEART WITH BELL,3,2011-08-25 12:06:00,1.25,17841.0,United Kingdom
564436,22602,RETROSPOT WOODEN HEART DECORATION,3,2011-08-25 12:06:00,0.85,17841.0,United Kingdom
564436,84836,ZINC METAL HEART DECORATION,3,2011-08-25 12:06:00,1.25,17841.0,United Kingdom
564436,22066,LOVE HEART TRINKET POT,3,2011-08-25 12:06:00,0.39,17841.0,United Kingdom
564436,21232,STRAWBERRY CERAMIC TRINKET BOX,3,2011-08-25 12:06:00,1.25,17841.0,United Kingdom
564436,84849D,HOT BATHS SOAP HOLDER,1,2011-08-25 12:06:00,1.69,17841.0,United Kingdom
564436,22556,PLASTERS IN TIN CIRCUS PARADE ,1,2011-08-25 12:06:00,1.65,17841.0,United Kingdom
564436,22382,LUNCH BAG SPACEBOY DESIGN ,2,2011-08-25 12:06:00,1.65,17841.0,United Kingdom
564436,22661,CHARLOTTE BAG DOLLY GIRL DESIGN,2,2011-08-25 12:06:00,0.85,17841.0,United Kingdom
564436,21172,PARTY METAL SIGN ,1,2011-08-25 12:06:00,1.45,17841.0,United Kingdom
564436,22385,JUMBO BAG SPACEBOY DESIGN,1,2011-08-25 12:06:00,2.08,17841.0,United Kingdom
564436,22663,JUMBO BAG DOLLY GIRL DESIGN,2,2011-08-25 12:06:00,2.08,17841.0,United Kingdom
564436,22760,"TRAY, BREAKFAST IN BED",1,2011-08-25 12:06:00,12.75,17841.0,United Kingdom
564436,21908,CHOCOLATE THIS WAY METAL SIGN,1,2011-08-25 12:06:00,2.1,17841.0,United Kingdom
564436,82567,"AIRLINE LOUNGE,METAL SIGN",1,2011-08-25 12:06:00,2.1,17841.0,United Kingdom
564436,22197,POPCORN HOLDER,1,2011-08-25 12:06:00,0.85,17841.0,United Kingdom
564436,47566,PARTY BUNTING,2,2011-08-25 12:06:00,4.95,17841.0,United Kingdom
564436,22505,MEMO BOARD COTTAGE DESIGN,2,2011-08-25 12:06:00,4.95,17841.0,United Kingdom
564436,22475,SKULL DESIGN TV DINNER TRAY,3,2011-08-25 12:06:00,4.95,17841.0,United Kingdom
564436,22222,CAKE PLATE LOVEBIRD WHITE,1,2011-08-25 12:06:00,4.95,17841.0,United Kingdom
564436,23238,SET OF 4 KNICK KNACK TINS LONDON ,2,2011-08-25 12:06:00,4.15,17841.0,United Kingdom
564436,22978,PANTRY ROLLING PIN,1,2011-08-25 12:06:00,3.75,17841.0,United Kingdom
564436,23028,DRAWER KNOB CRACKLE GLAZE BLUE,4,2011-08-25 12:06:00,1.65,17841.0,United Kingdom
564436,22432,WATERING CAN PINK BUNNY,1,2011-08-25 12:06:00,1.95,17841.0,United Kingdom
564436,16016,LARGE CHINESE STYLE SCISSOR,10,2011-08-25 12:06:00,0.85,17841.0,United Kingdom
564436,23112,PARISIENNE CURIO CABINET,1,2011-08-25 12:06:00,7.5,17841.0,United Kingdom
564436,22278,OVERNIGHT BAG VINTAGE ROSE PAISLEY,1,2011-08-25 12:06:00,4.95,17841.0,United Kingdom
564436,22174,PHOTO CUBE,2,2011-08-25 12:06:00,1.65,17841.0,United Kingdom
564436,23245,SET OF 3 REGENCY CAKE TINS,1,2011-08-25 12:06:00,4.95,17841.0,United Kingdom
564436,22483,RED GINGHAM TEDDY BEAR ,1,2011-08-25 12:06:00,2.95,17841.0,United Kingdom
564436,22385,JUMBO BAG SPACEBOY DESIGN,4,2011-08-25 12:06:00,2.08,17841.0,United Kingdom
564436,23201,JUMBO BAG ALPHABET,2,2011-08-25 12:06:00,2.08,17841.0,United Kingdom
564436,21381,MINI WOODEN HAPPY BIRTHDAY GARLAND,2,2011-08-25 12:06:00,1.69,17841.0,United Kingdom
564436,23004,TRAVEL CARD WALLET PANTRY,1,2011-08-25 12:06:00,0.42,17841.0,United Kingdom
564436,21629,SQUARE FLOOR CUSHION VINTAGE RED,2,2011-08-25 12:06:00,7.95,17841.0,United Kingdom
564436,23298,SPOTTY BUNTING,1,2011-08-25 12:06:00,4.95,17841.0,United Kingdom
564436,20829,GLITTER HANGING BUTTERFLY STRING,3,2011-08-25 12:06:00,2.1,17841.0,United Kingdom
564436,22219,LOVEBIRD HANGING DECORATION WHITE ,2,2011-08-25 12:06:00,0.85,17841.0,United Kingdom
564436,22863,SOAP DISH BROCANTE,1,2011-08-25 12:06:00,2.95,17841.0,United Kingdom
564436,72349B,SET/6 PURPLE BUTTERFLY T-LIGHTS,2,2011-08-25 12:06:00,2.1,17841.0,United Kingdom
564436,22131,FOOD CONTAINER SET 3 LOVE HEART ,1,2011-08-25 12:06:00,1.95,17841.0,United Kingdom
564436,21123,SET/10 IVORY POLKADOT PARTY CANDLES,1,2011-08-25 12:06:00,1.25,17841.0,United Kingdom
564436,21976,PACK OF 60 MUSHROOM CAKE CASES,1,2011-08-25 12:06:00,0.55,17841.0,United Kingdom
564436,22896,PEG BAG APPLES DESIGN,1,2011-08-25 12:06:00,2.55,17841.0,United Kingdom
564436,20754,RETROSPOT RED WASHING UP GLOVES,1,2011-08-25 12:06:00,2.1,17841.0,United Kingdom
564436,84078A,SET/4 WHITE RETRO STORAGE CUBES ,6,2011-08-25 12:06:00,34.95,17841.0,United Kingdom
564437,21558,SKULL LUNCH BOX WITH CUTLERY ,6,2011-08-25 12:10:00,2.55,13320.0,United Kingdom
564437,21559,STRAWBERRY LUNCH BOX WITH CUTLERY,6,2011-08-25 12:10:00,2.55,13320.0,United Kingdom
564437,22629,SPACEBOY LUNCH BOX ,12,2011-08-25 12:10:00,1.95,13320.0,United Kingdom
564437,20726,LUNCH BAG WOODLAND,10,2011-08-25 12:10:00,1.65,13320.0,United Kingdom
564437,22384,LUNCH BAG PINK POLKADOT,10,2011-08-25 12:10:00,1.65,13320.0,United Kingdom
564437,22382,LUNCH BAG SPACEBOY DESIGN ,10,2011-08-25 12:10:00,1.65,13320.0,United Kingdom
564437,20727,LUNCH BAG  BLACK SKULL.,10,2011-08-25 12:10:00,1.65,13320.0,United Kingdom
564437,23207,LUNCH BAG ALPHABET DESIGN,10,2011-08-25 12:10:00,1.65,13320.0,United Kingdom
564437,23209,LUNCH BAG VINTAGE DOILY ,10,2011-08-25 12:10:00,1.65,13320.0,United Kingdom
564437,23208,LUNCH BAG VINTAGE LEAF DESIGN,10,2011-08-25 12:10:00,1.65,13320.0,United Kingdom
564437,20719,WOODLAND CHARLOTTE BAG,10,2011-08-25 12:10:00,0.85,13320.0,United Kingdom
564437,23205,CHARLOTTE BAG VINTAGE ALPHABET ,10,2011-08-25 12:10:00,0.85,13320.0,United Kingdom
564437,20723,STRAWBERRY CHARLOTTE BAG,10,2011-08-25 12:10:00,0.85,13320.0,United Kingdom
564437,23204,CHARLOTTE BAG APPLES DESIGN,10,2011-08-25 12:10:00,0.85,13320.0,United Kingdom
564437,22356,CHARLOTTE BAG PINK POLKADOT,10,2011-08-25 12:10:00,0.85,13320.0,United Kingdom
564437,20724,RED RETROSPOT CHARLOTTE BAG,10,2011-08-25 12:10:00,0.85,13320.0,United Kingdom
564437,20717,STRAWBERRY SHOPPER BAG,10,2011-08-25 12:10:00,1.25,13320.0,United Kingdom
564437,20718,RED RETROSPOT SHOPPER BAG,10,2011-08-25 12:10:00,1.25,13320.0,United Kingdom
564437,22326,ROUND SNACK BOXES SET OF4 WOODLAND ,6,2011-08-25 12:10:00,2.95,13320.0,United Kingdom
564437,22327,ROUND SNACK BOXES SET OF 4 SKULLS,6,2011-08-25 12:10:00,2.95,13320.0,United Kingdom
564437,22328,ROUND SNACK BOXES SET OF 4 FRUITS ,6,2011-08-25 12:10:00,2.95,13320.0,United Kingdom
564437,22300,COFFEE MUG DOG + BALL DESIGN,6,2011-08-25 12:10:00,2.55,13320.0,United Kingdom
564437,22301,COFFEE MUG CAT + BIRD DESIGN,6,2011-08-25 12:10:00,2.55,13320.0,United Kingdom
564437,22379,RECYCLING BAG RETROSPOT ,5,2011-08-25 12:10:00,2.1,13320.0,United Kingdom
564437,21985,PACK OF 12 HEARTS DESIGN TISSUES ,24,2011-08-25 12:10:00,0.29,13320.0,United Kingdom
564437,21982,PACK OF 12 SUKI TISSUES ,24,2011-08-25 12:10:00,0.29,13320.0,United Kingdom
564437,21983,PACK OF 12 BLUE PAISLEY TISSUES ,24,2011-08-25 12:10:00,0.29,13320.0,United Kingdom
564437,21981,PACK OF 12 WOODLAND TISSUES ,24,2011-08-25 12:10:00,0.29,13320.0,United Kingdom
564437,23245,SET OF 3 REGENCY CAKE TINS,4,2011-08-25 12:10:00,4.95,13320.0,United Kingdom
564437,23345, DOLLY GIRL BEAKER,12,2011-08-25 12:10:00,1.25,13320.0,United Kingdom
564437,23346,SPACEBOY BEAKER,12,2011-08-25 12:10:00,1.25,13320.0,United Kingdom
564437,22352,LUNCH BOX WITH CUTLERY RETROSPOT ,6,2011-08-25 12:10:00,2.55,13320.0,United Kingdom
564437,22630,DOLLY GIRL LUNCH BOX,12,2011-08-25 12:10:00,1.95,13320.0,United Kingdom
564437,22383,LUNCH BAG SUKI DESIGN ,10,2011-08-25 12:10:00,1.65,13320.0,United Kingdom
564438,21931,JUMBO STORAGE BAG SUKI,20,2011-08-25 12:11:00,2.08,16628.0,United Kingdom
564438,20712,JUMBO BAG WOODLAND ANIMALS,10,2011-08-25 12:11:00,2.08,16628.0,United Kingdom
564438,20713,JUMBO BAG OWLS,20,2011-08-25 12:11:00,2.08,16628.0,United Kingdom
564438,22379,RECYCLING BAG RETROSPOT ,5,2011-08-25 12:11:00,2.1,16628.0,United Kingdom
564438,22381,TOY TIDY PINK POLKADOT,5,2011-08-25 12:11:00,2.1,16628.0,United Kingdom
564438,23199,JUMBO BAG APPLES,10,2011-08-25 12:11:00,2.08,16628.0,United Kingdom
564438,22411,JUMBO SHOPPER VINTAGE RED PAISLEY,10,2011-08-25 12:11:00,2.08,16628.0,United Kingdom
564438,22385,JUMBO BAG SPACEBOY DESIGN,10,2011-08-25 12:11:00,2.08,16628.0,United Kingdom
564438,85099B,JUMBO BAG RED RETROSPOT,20,2011-08-25 12:11:00,2.08,16628.0,United Kingdom
564438,21770,OPEN CLOSED METAL SIGN,2,2011-08-25 12:11:00,4.95,16628.0,United Kingdom
564438,20725,LUNCH BAG RED RETROSPOT,10,2011-08-25 12:11:00,1.65,16628.0,United Kingdom
564438,20728,LUNCH BAG CARS BLUE,10,2011-08-25 12:11:00,1.65,16628.0,United Kingdom
564438,20726,LUNCH BAG WOODLAND,10,2011-08-25 12:11:00,1.65,16628.0,United Kingdom
564438,22383,LUNCH BAG SUKI DESIGN ,10,2011-08-25 12:11:00,1.65,16628.0,United Kingdom
564438,22382,LUNCH BAG SPACEBOY DESIGN ,10,2011-08-25 12:11:00,1.65,16628.0,United Kingdom
564438,23206,LUNCH BAG APPLE DESIGN,10,2011-08-25 12:11:00,1.65,16628.0,United Kingdom
564438,22969,HOMEMADE JAM SCENTED CANDLES,12,2011-08-25 12:11:00,1.45,16628.0,United Kingdom
564438,22865,HAND WARMER OWL DESIGN,12,2011-08-25 12:11:00,2.1,16628.0,United Kingdom
564438,23275,SET OF 3 HANGING OWLS OLLIE BEAK,12,2011-08-25 12:11:00,1.25,16628.0,United Kingdom
564438,22866,HAND WARMER SCOTTY DOG DESIGN,12,2011-08-25 12:11:00,2.1,16628.0,United Kingdom
564438,22834,HAND WARMER BABUSHKA DESIGN,12,2011-08-25 12:11:00,2.1,16628.0,United Kingdom
564438,22867,HAND WARMER BIRD DESIGN,12,2011-08-25 12:11:00,2.1,16628.0,United Kingdom
564438,22632,HAND WARMER RED RETROSPOT,12,2011-08-25 12:11:00,2.1,16628.0,United Kingdom
564439,21215,IVORY PAPER CUP CAKE CASES ,24,2011-08-25 12:12:00,0.55,12841.0,United Kingdom
564439,47422,ASSORTED MONKEY SUCTION CUP HOOK,3,2011-08-25 12:12:00,0.42,12841.0,United Kingdom
564439,22468,BABUSHKA LIGHTS STRING OF 10,2,2011-08-25 12:12:00,6.75,12841.0,United Kingdom
564439,40016,CHINESE DRAGON PAPER LANTERNS,36,2011-08-25 12:12:00,0.42,12841.0,United Kingdom
564439,21213,PACK OF 72 SKULL CAKE CASES,48,2011-08-25 12:12:00,0.55,12841.0,United Kingdom
564439,23296,SET OF 6 TEA TIME BAKING CASES,1,2011-08-25 12:12:00,1.25,12841.0,United Kingdom
564439,22943,CHRISTMAS LIGHTS 10 VINTAGE BAUBLES,2,2011-08-25 12:12:00,4.95,12841.0,United Kingdom
564439,22932,BAKING MOULD TOFFEE CUP CHOCOLATE,2,2011-08-25 12:12:00,2.55,12841.0,United Kingdom
564439,35970,ZINC FOLKART SLEIGH BELLS,12,2011-08-25 12:12:00,1.69,12841.0,United Kingdom
564439,22193,RED DINER WALL CLOCK,1,2011-08-25 12:12:00,8.5,12841.0,United Kingdom
564439,23294,SET OF 6 SNACK LOAF BAKING CASES,1,2011-08-25 12:12:00,0.83,12841.0,United Kingdom
564440,20749,ASSORTED COLOUR MINI CASES,2,2011-08-25 12:13:00,7.95,13928.0,United Kingdom
564440,21135,VICTORIAN  METAL POSTCARD SPRING,8,2011-08-25 12:13:00,1.69,13928.0,United Kingdom
564440,21380,WOODEN HAPPY BIRTHDAY GARLAND,6,2011-08-25 12:13:00,2.95,13928.0,United Kingdom
564440,23298,SPOTTY BUNTING,3,2011-08-25 12:13:00,4.95,13928.0,United Kingdom
564440,21172,PARTY METAL SIGN ,12,2011-08-25 12:13:00,1.45,13928.0,United Kingdom
564440,35970,ZINC FOLKART SLEIGH BELLS,12,2011-08-25 12:13:00,1.69,13928.0,United Kingdom
564440,84970L,SINGLE HEART ZINC T-LIGHT HOLDER,12,2011-08-25 12:13:00,0.95,13928.0,United Kingdom
564440,84970S,HANGING HEART ZINC T-LIGHT HOLDER,12,2011-08-25 12:13:00,0.85,13928.0,United Kingdom
564471,22081,RIBBON REEL FLORA + FAUNA ,10,2011-08-25 12:26:00,1.65,12583.0,France
564471,22082,RIBBON REEL STRIPES DESIGN ,10,2011-08-25 12:26:00,1.65,12583.0,France
564471,22080,RIBBON REEL POLKADOTS ,20,2011-08-25 12:26:00,1.65,12583.0,France
564471,21210,SET OF 72 RETROSPOT PAPER  DOILIES,12,2011-08-25 12:26:00,1.45,12583.0,France
564471,21156,RETROSPOT CHILDRENS APRON,8,2011-08-25 12:26:00,1.95,12583.0,France
564471,21080,SET/20 RED RETROSPOT PAPER NAPKINS ,24,2011-08-25 12:26:00,0.85,12583.0,France
564471,21086,SET/6 RED SPOTTY PAPER CUPS,24,2011-08-25 12:26:00,0.65,12583.0,France
564471,21094,SET/6 RED SPOTTY PAPER PLATES,24,2011-08-25 12:26:00,0.85,12583.0,France
564471,23445,ICE CREAM BUBBLES,20,2011-08-25 12:26:00,0.83,12583.0,France
564471,22326,ROUND SNACK BOXES SET OF4 WOODLAND ,18,2011-08-25 12:26:00,2.95,12583.0,France
564471,POST,POSTAGE,1,2011-08-25 12:26:00,18.0,12583.0,France
564473,20728,LUNCH BAG CARS BLUE,20,2011-08-25 12:33:00,1.65,16722.0,United Kingdom
564473,20727,LUNCH BAG  BLACK SKULL.,20,2011-08-25 12:33:00,1.65,16722.0,United Kingdom
564473,22382,LUNCH BAG SPACEBOY DESIGN ,20,2011-08-25 12:33:00,1.65,16722.0,United Kingdom
564473,22383,LUNCH BAG SUKI DESIGN ,20,2011-08-25 12:33:00,1.65,16722.0,United Kingdom
564473,22384,LUNCH BAG PINK POLKADOT,10,2011-08-25 12:33:00,1.65,16722.0,United Kingdom
564473,20725,LUNCH BAG RED RETROSPOT,10,2011-08-25 12:33:00,1.65,16722.0,United Kingdom
564473,22662,LUNCH BAG DOLLY GIRL DESIGN,10,2011-08-25 12:33:00,1.65,16722.0,United Kingdom
564473,23206,LUNCH BAG APPLE DESIGN,20,2011-08-25 12:33:00,1.65,16722.0,United Kingdom
564473,23208,LUNCH BAG VINTAGE LEAF DESIGN,10,2011-08-25 12:33:00,1.65,16722.0,United Kingdom
564473,23209,LUNCH BAG VINTAGE DOILY ,20,2011-08-25 12:33:00,1.65,16722.0,United Kingdom
564473,23199,JUMBO BAG APPLES,10,2011-08-25 12:33:00,2.08,16722.0,United Kingdom
564473,21495,SKULLS AND CROSSBONES WRAP,25,2011-08-25 12:33:00,0.42,16722.0,United Kingdom
564474,22842,BISCUIT TIN VINTAGE RED,2,2011-08-25 12:46:00,6.75,14180.0,United Kingdom
564474,84968A,SET OF 16 VINTAGE ROSE CUTLERY,1,2011-08-25 12:46:00,12.75,14180.0,United Kingdom
564474,22426,ENAMEL WASH BOWL CREAM,4,2011-08-25 12:46:00,3.75,14180.0,United Kingdom
564474,22626,BLACK KITCHEN SCALES,2,2011-08-25 12:46:00,8.5,14180.0,United Kingdom
564474,22424,ENAMEL BREAD BIN CREAM,6,2011-08-25 12:46:00,12.75,14180.0,United Kingdom
564475,23210,WHITE ROCKING HORSE HAND PAINTED,72,2011-08-25 12:50:00,1.25,12500.0,Germany
564475,23211,RED ROCKING HORSE HAND PAINTED,72,2011-08-25 12:50:00,1.25,12500.0,Germany
564475,23212,HEART WREATH DECORATION WITH BELL,72,2011-08-25 12:50:00,1.25,12500.0,Germany
564475,23213,STAR WREATH DECORATION WITH BELL,72,2011-08-25 12:50:00,1.25,12500.0,Germany
564475,POST,POSTAGE,1,2011-08-25 12:50:00,18.0,12500.0,Germany
564476,22771,CLEAR DRAWER KNOB ACRYLIC EDWARDIAN,12,2011-08-25 12:57:00,1.25,12610.0,Italy
564476,21671,RED SPOT CERAMIC DRAWER KNOB,12,2011-08-25 12:57:00,1.25,12610.0,Italy
564476,23028,DRAWER KNOB CRACKLE GLAZE BLUE,6,2011-08-25 12:57:00,1.65,12610.0,Italy
564476,23029,DRAWER KNOB CRACKLE GLAZE GREEN,6,2011-08-25 12:57:00,1.65,12610.0,Italy
564476,22772,PINK DRAWER KNOB ACRYLIC EDWARDIAN,12,2011-08-25 12:57:00,1.25,12610.0,Italy
564476,21213,PACK OF 72 SKULL CAKE CASES,24,2011-08-25 12:57:00,0.55,12610.0,Italy
564476,21212,PACK OF 72 RETROSPOT CAKE CASES,24,2011-08-25 12:57:00,0.55,12610.0,Italy
564476,22437,SET OF 9 BLACK SKULL BALLOONS,20,2011-08-25 12:57:00,0.85,12610.0,Italy
564476,23108,SET OF 10 LED DOLLY LIGHTS,2,2011-08-25 12:57:00,6.25,12610.0,Italy
564476,23142,IVORY WIRE KITCHEN ORGANISER,1,2011-08-25 12:57:00,10.4,12610.0,Italy
564476,22776,SWEETHEART CAKESTAND 3 TIER,1,2011-08-25 12:57:00,9.95,12610.0,Italy
564476,22189,CREAM HEART CARD HOLDER,4,2011-08-25 12:57:00,3.95,12610.0,Italy
564476,21340,CLASSIC METAL BIRDCAGE PLANT HOLDER,1,2011-08-25 12:57:00,12.75,12610.0,Italy
564476,85123A,WHITE HANGING HEART T-LIGHT HOLDER,12,2011-08-25 12:57:00,2.95,12610.0,Italy
564476,22784,LANTERN CREAM GAZEBO ,6,2011-08-25 12:57:00,4.95,12610.0,Italy
564476,22464,HANGING METAL HEART LANTERN,12,2011-08-25 12:57:00,1.65,12610.0,Italy
564476,22178,VICTORIAN GLASS HANGING T-LIGHT,12,2011-08-25 12:57:00,1.25,12610.0,Italy
564476,POST,POSTAGE,1,2011-08-25 12:57:00,40.0,12610.0,Italy
564477,22946,WOODEN ADVENT CALENDAR CREAM,12,2011-08-25 12:59:00,12.75,13854.0,United Kingdom
564477,20749,ASSORTED COLOUR MINI CASES,12,2011-08-25 12:59:00,6.35,13854.0,United Kingdom
564477,21340,CLASSIC METAL BIRDCAGE PLANT HOLDER,8,2011-08-25 12:59:00,9.95,13854.0,United Kingdom
564477,84879,ASSORTED COLOUR BIRD ORNAMENT,8,2011-08-25 12:59:00,1.69,13854.0,United Kingdom
564479,15056BL,EDWARDIAN PARASOL BLACK,6,2011-08-25 13:12:00,5.95,12682.0,France
564479,20679,EDWARDIAN PARASOL RED,3,2011-08-25 13:12:00,5.95,12682.0,France
564479,85014B,RED RETROSPOT UMBRELLA,3,2011-08-25 13:12:00,5.95,12682.0,France
564479,85014A,BLACK/BLUE POLKADOT UMBRELLA,3,2011-08-25 13:12:00,5.95,12682.0,France
564479,23238,SET OF 4 KNICK KNACK TINS LONDON ,6,2011-08-25 13:12:00,4.15,12682.0,France
564479,23347,I LOVE LONDON BEAKER,12,2011-08-25 13:12:00,1.25,12682.0,France
564479,22556,PLASTERS IN TIN CIRCUS PARADE ,12,2011-08-25 13:12:00,1.65,12682.0,France
564479,22551,PLASTERS IN TIN SPACEBOY,12,2011-08-25 13:12:00,1.65,12682.0,France
564479,22554,PLASTERS IN TIN WOODLAND ANIMALS,12,2011-08-25 13:12:00,1.65,12682.0,France
564479,21731,RED TOADSTOOL LED NIGHT LIGHT,12,2011-08-25 13:12:00,1.65,12682.0,France
564479,22892,SET OF SALT AND PEPPER TOADSTOOLS,12,2011-08-25 13:12:00,1.25,12682.0,France
564479,22197,POPCORN HOLDER,12,2011-08-25 13:12:00,0.85,12682.0,France
564479,23298,SPOTTY BUNTING,3,2011-08-25 13:12:00,4.95,12682.0,France
564479,22432,WATERING CAN PINK BUNNY,6,2011-08-25 13:12:00,1.95,12682.0,France
564479,23203,JUMBO BAG VINTAGE DOILY ,20,2011-08-25 13:12:00,2.08,12682.0,France
564479,22382,LUNCH BAG SPACEBOY DESIGN ,10,2011-08-25 13:12:00,1.65,12682.0,France
564479,23206,LUNCH BAG APPLE DESIGN,10,2011-08-25 13:12:00,1.65,12682.0,France
564479,23209,LUNCH BAG VINTAGE DOILY ,10,2011-08-25 13:12:00,1.65,12682.0,France
564479,23199,JUMBO BAG APPLES,10,2011-08-25 13:12:00,2.08,12682.0,France
564479,85099B,JUMBO BAG RED RETROSPOT,10,2011-08-25 13:12:00,2.08,12682.0,France
564479,22385,JUMBO BAG SPACEBOY DESIGN,10,2011-08-25 13:12:00,2.08,12682.0,France
564479,22411,JUMBO SHOPPER VINTAGE RED PAISLEY,10,2011-08-25 13:12:00,2.08,12682.0,France
564479,POST,POSTAGE,2,2011-08-25 13:12:00,18.0,12682.0,France
C564478,22990,COTTON APRON PANTRY DESIGN,-2,2011-08-25 13:12:00,4.95,14732.0,United Kingdom
564480,82482,WOODEN PICTURE FRAME WHITE FINISH,12,2011-08-25 13:24:00,2.55,17656.0,United Kingdom
564480,23092,LARGE ANTIQUE WHITE PHOTO FRAME,2,2011-08-25 13:24:00,7.9,17656.0,United Kingdom
564480,82494L,WOODEN FRAME ANTIQUE WHITE ,18,2011-08-25 13:24:00,2.95,17656.0,United Kingdom
564480,84818,DANISH ROSE PHOTO FRAME,24,2011-08-25 13:24:00,0.79,17656.0,United Kingdom
564480,22771,CLEAR DRAWER KNOB ACRYLIC EDWARDIAN,24,2011-08-25 13:24:00,1.25,17656.0,United Kingdom
564480,21903,MAN FLU METAL SIGN,12,2011-08-25 13:24:00,2.1,17656.0,United Kingdom
564480,21162,TOXIC AREA  DOOR HANGER ,24,2011-08-25 13:24:00,0.39,17656.0,United Kingdom
564480,21248,DOOR HANGER  MUM + DADS ROOM,12,2011-08-25 13:24:00,1.45,17656.0,United Kingdom
564480,21163,DO NOT TOUCH MY STUFF DOOR HANGER ,24,2011-08-25 13:24:00,0.39,17656.0,United Kingdom
564480,23182,TOILET SIGN OCCUPIED OR VACANT,24,2011-08-25 13:24:00,0.83,17656.0,United Kingdom
564480,22513,DOORSTOP FOOTBALL DESIGN,4,2011-08-25 13:24:00,3.75,17656.0,United Kingdom
564480,22212,FOUR HOOK  WHITE LOVEBIRDS,6,2011-08-25 13:24:00,2.1,17656.0,United Kingdom
564480,21311,SET/4 BIRD MIRROR MAGNETS ,24,2011-08-25 13:24:00,0.29,17656.0,United Kingdom
564480,21306,SET/4 DAISY MIRROR MAGNETS,24,2011-08-25 13:24:00,0.29,17656.0,United Kingdom
564480,21523,DOORMAT FANCY FONT HOME SWEET HOME,2,2011-08-25 13:24:00,7.95,17656.0,United Kingdom
564480,48194,DOORMAT HEARTS,4,2011-08-25 13:24:00,7.95,17656.0,United Kingdom
564481,POST,POSTAGE,3,2011-08-25 13:33:00,15.0,12464.0,Belgium
564481,22624,IVORY KITCHEN SCALES,3,2011-08-25 13:33:00,8.5,12464.0,Belgium
564481,22847,BREAD BIN DINER STYLE IVORY,4,2011-08-25 13:33:00,14.95,12464.0,Belgium
564481,22846,BREAD BIN DINER STYLE RED ,4,2011-08-25 13:33:00,14.95,12464.0,Belgium
