InvoiceNo,StockCode,Description,Quantity,InvoiceDate,UnitPrice,CustomerID,Country
558771,23215,JINGLE BELL HEART ANTIQUE SILVER,4,2011-07-03 15:53:00,2.08,17105.0,United Kingdom
558771,23102,SILVER HEARTS TABLE DECORATION,12,2011-07-03 15:53:00,0.83,17105.0,United Kingdom
558771,22890,NOVELTY BISCUITS CAKE STAND 3 TIER,1,2011-07-03 15:53:00,9.95,17105.0,United Kingdom
558771,21232,STRAWBERRY CERAMIC TRINKET BOX,8,2011-07-03 15:53:00,1.25,17105.0,United Kingdom
558771,22423,REGENCY CAKESTAND 3 TIER,1,2011-07-03 15:53:00,12.75,17105.0,United Kingdom
558771,23323,WHITE WICKER STAR ,2,2011-07-03 15:53:00,2.1,17105.0,United Kingdom
558771,35265,COLOURFUL FLOWER FRUIT BOWL,1,2011-07-03 15:53:00,1.0,17105.0,United Kingdom
558771,22470,HEART OF WICKER LARGE,2,2011-07-03 15:53:00,2.95,17105.0,United Kingdom
558771,23321,SMALL WHITE HEART OF WICKER,2,2011-07-03 15:53:00,1.65,17105.0,United Kingdom
558771,22469,HEART OF WICKER SMALL,2,2011-07-03 15:53:00,1.65,17105.0,United Kingdom
558771,23322,LARGE WHITE HEART OF WICKER,2,2011-07-03 15:53:00,2.95,17105.0,United Kingdom
558772,22772,PINK DRAWER KNOB ACRYLIC EDWARDIAN,12,2011-07-03 16:00:00,1.25,15007.0,United Kingdom
558772,22771,CLEAR DRAWER KNOB ACRYLIC EDWARDIAN,12,2011-07-03 16:00:00,1.25,15007.0,United Kingdom
558772,23321,SMALL WHITE HEART OF WICKER,5,2011-07-03 16:00:00,1.65,15007.0,United Kingdom
558772,22607,WOODEN ROUNDERS GARDEN SET ,1,2011-07-03 16:00:00,9.95,15007.0,United Kingdom
558772,22469,HEART OF WICKER SMALL,2,2011-07-03 16:00:00,1.65,15007.0,United Kingdom
558772,23199,JUMBO BAG APPLES,2,2011-07-03 16:00:00,2.08,15007.0,United Kingdom
558772,20725,LUNCH BAG RED RETROSPOT,10,2011-07-03 16:00:00,1.65,15007.0,United Kingdom
558772,23206,LUNCH BAG APPLE DESIGN,10,2011-07-03 16:00:00,1.65,15007.0,United Kingdom
558772,21156,RETROSPOT CHILDRENS APRON,2,2011-07-03 16:00:00,1.95,15007.0,United Kingdom
558772,22628,PICNIC BOXES SET OF 3 RETROSPOT ,1,2011-07-03 16:00:00,4.95,15007.0,United Kingdom
558772,21246,RED RETROSPOT BIG BOWL,6,2011-07-03 16:00:00,4.95,15007.0,United Kingdom
558772,23184,BULL DOG BOTTLE OPENER,6,2011-07-03 16:00:00,4.95,15007.0,United Kingdom
558773,21564,PINK  HEART SHAPE LOVE BUCKET ,1,2011-07-03 16:00:00,2.95,17781.0,United Kingdom
558773,21563,RED HEART SHAPE LOVE BUCKET ,1,2011-07-03 16:00:00,2.95,17781.0,United Kingdom
558773,21381,MINI WOODEN HAPPY BIRTHDAY GARLAND,6,2011-07-03 16:00:00,1.69,17781.0,United Kingdom
558773,21918,SET 12 KIDS COLOUR  CHALK STICKS,2,2011-07-03 16:00:00,0.42,17781.0,United Kingdom
558773,21916,SET 12 RETRO WHITE CHALK STICKS,2,2011-07-03 16:00:00,0.42,17781.0,United Kingdom
558773,85135B,BLUE DRAGONFLY HELICOPTER,1,2011-07-03 16:00:00,7.95,17781.0,United Kingdom
558773,85136A,YELLOW SHARK HELICOPTER,1,2011-07-03 16:00:00,7.95,17781.0,United Kingdom
558773,21363,HOME SMALL WOOD LETTERS,1,2011-07-03 16:00:00,4.95,17781.0,United Kingdom
558773,21359,RELAX LARGE WOOD LETTERS,10,2011-07-03 16:00:00,3.95,17781.0,United Kingdom
558773,82484,WOOD BLACK BOARD ANT WHITE FINISH,1,2011-07-03 16:00:00,7.95,17781.0,United Kingdom
