InvoiceNo,StockCode,Description,Quantity,InvoiceDate,UnitPrice,CustomerID,Country
562272,21447,12 IVORY ROSE PEG PLACE SETTINGS,24,2011-08-04 08:18:00,1.25,12971.0,United Kingdom
562272,22807,SET OF 6 T-LIGHTS TOADSTOOLS,6,2011-08-04 08:18:00,2.95,12971.0,United Kingdom
562272,22156,HEART DECORATION WITH PEARLS ,12,2011-08-04 08:18:00,0.85,12971.0,United Kingdom
562272,47599B,BLUE PARTY BAGS ,12,2011-08-04 08:18:00,2.1,12971.0,United Kingdom
562273,22178,VICTORIAN GLASS HANGING T-LIGHT,24,2011-08-04 09:55:00,1.25,12502.0,Spain
562273,22423,REGENCY CAKESTAND 3 TIER,7,2011-08-04 09:55:00,12.75,12502.0,Spain
562273,22846,BREAD BIN DINER STYLE RED ,3,2011-08-04 09:55:00,16.95,12502.0,Spain
562273,22847,BREAD BIN DINER STYLE IVORY,1,2011-08-04 09:55:00,16.95,12502.0,Spain
562273,22625,RED KITCHEN SCALES,2,2011-08-04 09:55:00,8.5,12502.0,Spain
562273,23094,LE GRAND TRAY CHIC SET,1,2011-08-04 09:55:00,12.5,12502.0,Spain
562273,71406C,BLACK ORANGE SQUEEZER,10,2011-08-04 09:55:00,0.42,12502.0,Spain
562273,23169,CLASSIC GLASS COOKIE JAR,6,2011-08-04 09:55:00,4.15,12502.0,Spain
562273,22760,"TRAY, BREAKFAST IN BED",1,2011-08-04 09:55:00,12.75,12502.0,Spain
562273,22726,ALARM CLOCK BAKELIKE GREEN,4,2011-08-04 09:55:00,3.75,12502.0,Spain
562273,22457,NATURAL SLATE HEART CHALKBOARD ,6,2011-08-04 09:55:00,2.95,12502.0,Spain
562273,21115,ROSE CARAVAN DOORSTOP,2,2011-08-04 09:55:00,6.75,12502.0,Spain
562273,22485,SET OF 2 WOODEN MARKET CRATES,2,2011-08-04 09:55:00,12.75,12502.0,Spain
562273,20679,EDWARDIAN PARASOL RED,3,2011-08-04 09:55:00,5.95,12502.0,Spain
562273,22467,GUMBALL COAT RACK,6,2011-08-04 09:55:00,2.55,12502.0,Spain
562273,22914,BLUE COAT RACK PARIS FASHION,3,2011-08-04 09:55:00,4.95,12502.0,Spain
562273,21770,OPEN CLOSED METAL SIGN,2,2011-08-04 09:55:00,4.95,12502.0,Spain
562273,21279,VINTAGE KITCHEN PRINT FRUITS,6,2011-08-04 09:55:00,2.55,12502.0,Spain
562273,84870B,BLUE GEISHA GIRL ,4,2011-08-04 09:55:00,3.75,12502.0,Spain
562273,84870C,GREEN GEISHA GIRL ,4,2011-08-04 09:55:00,3.75,12502.0,Spain
562273,85114B,IVORY ENCHANTED FOREST PLACEMAT,6,2011-08-04 09:55:00,1.65,12502.0,Spain
562273,23012,GLASS APOTHECARY BOTTLE PERFUME,4,2011-08-04 09:55:00,3.95,12502.0,Spain
562273,22222,CAKE PLATE LOVEBIRD WHITE,3,2011-08-04 09:55:00,4.95,12502.0,Spain
562273,23020,GLASS  SONGBIRD STORAGE JAR,2,2011-08-04 09:55:00,12.5,12502.0,Spain
562273,23162,REGENCY TEA STRAINER,4,2011-08-04 09:55:00,3.75,12502.0,Spain
562273,23163,REGENCY SUGAR TONGS,8,2011-08-04 09:55:00,2.49,12502.0,Spain
562273,22699,ROSES REGENCY TEACUP AND SAUCER ,6,2011-08-04 09:55:00,2.95,12502.0,Spain
562273,22698,PINK REGENCY TEACUP AND SAUCER,6,2011-08-04 09:55:00,2.95,12502.0,Spain
562273,22697,GREEN REGENCY TEACUP AND SAUCER,6,2011-08-04 09:55:00,2.95,12502.0,Spain
562273,22215,CAKE STAND WHITE TWO TIER LACE,4,2011-08-04 09:55:00,8.5,12502.0,Spain
562273,POST,POSTAGE,6,2011-08-04 09:55:00,28.0,12502.0,Spain
562274,15056P,EDWARDIAN PARASOL PINK,3,2011-08-04 10:00:00,5.95,12704.0,Finland
562274,15056N,EDWARDIAN PARASOL NATURAL,3,2011-08-04 10:00:00,5.95,12704.0,Finland
562274,21731,RED TOADSTOOL LED NIGHT LIGHT,12,2011-08-04 10:00:00,1.65,12704.0,Finland
562274,20679,EDWARDIAN PARASOL RED,3,2011-08-04 10:00:00,5.95,12704.0,Finland
562274,21557,SET OF 6 FUNKY BEAKERS,6,2011-08-04 10:00:00,2.95,12704.0,Finland
562274,85099B,JUMBO BAG RED RETROSPOT,10,2011-08-04 10:00:00,2.08,12704.0,Finland
562274,22555,PLASTERS IN TIN STRONGMAN,12,2011-08-04 10:00:00,1.65,12704.0,Finland
562274,22557,PLASTERS IN TIN VINTAGE PAISLEY ,12,2011-08-04 10:00:00,1.65,12704.0,Finland
562274,22556,PLASTERS IN TIN CIRCUS PARADE ,12,2011-08-04 10:00:00,1.65,12704.0,Finland
562274,22554,PLASTERS IN TIN WOODLAND ANIMALS,12,2011-08-04 10:00:00,1.65,12704.0,Finland
562274,23108,SET OF 10 LED DOLLY LIGHTS,2,2011-08-04 10:00:00,6.25,12704.0,Finland
562274,22469,HEART OF WICKER SMALL,12,2011-08-04 10:00:00,1.65,12704.0,Finland
562274,23144,ZINC T-LIGHT HOLDER STARS SMALL,12,2011-08-04 10:00:00,0.83,12704.0,Finland
562274,23206,LUNCH BAG APPLE DESIGN,10,2011-08-04 10:00:00,1.65,12704.0,Finland
562274,23200,JUMBO BAG PEARS,10,2011-08-04 10:00:00,2.08,12704.0,Finland
562274,84970S,HANGING HEART ZINC T-LIGHT HOLDER,12,2011-08-04 10:00:00,0.85,12704.0,Finland
562274,POST,POSTAGE,2,2011-08-04 10:00:00,40.0,12704.0,Finland
562275,23289,DOLLY GIRL CHILDRENS BOWL,8,2011-08-04 10:04:00,1.25,12689.0,France
562275,23290,SPACEBOY CHILDRENS BOWL,8,2011-08-04 10:04:00,1.25,12689.0,France
562275,23291,DOLLY GIRL CHILDRENS CUP,8,2011-08-04 10:04:00,1.25,12689.0,France
562275,23292,SPACEBOY CHILDRENS CUP,8,2011-08-04 10:04:00,1.25,12689.0,France
562275,23287,RED VINTAGE SPOT BEAKER,8,2011-08-04 10:04:00,0.85,12689.0,France
562275,23313,VINTAGE CHRISTMAS BUNTING,5,2011-08-04 10:04:00,4.95,12689.0,France
562275,23345, DOLLY GIRL BEAKER,12,2011-08-04 10:04:00,1.25,12689.0,France
562275,23346,SPACEBOY BEAKER,12,2011-08-04 10:04:00,1.25,12689.0,France
562275,22449,SILK PURSE BABUSHKA PINK,6,2011-08-04 10:04:00,3.35,12689.0,France
562275,22029,SPACEBOY BIRTHDAY CARD,12,2011-08-04 10:04:00,0.42,12689.0,France
562275,22712,CARD DOLLY GIRL ,12,2011-08-04 10:04:00,0.42,12689.0,France
562275,22637,PIGGY BANK RETROSPOT ,4,2011-08-04 10:04:00,2.55,12689.0,France
562275,22551,PLASTERS IN TIN SPACEBOY,12,2011-08-04 10:04:00,1.65,12689.0,France
562275,22554,PLASTERS IN TIN WOODLAND ANIMALS,12,2011-08-04 10:04:00,1.65,12689.0,France
562275,21731,RED TOADSTOOL LED NIGHT LIGHT,12,2011-08-04 10:04:00,1.65,12689.0,France
562275,20719,WOODLAND CHARLOTTE BAG,10,2011-08-04 10:04:00,0.85,12689.0,France
562275,22661,CHARLOTTE BAG DOLLY GIRL DESIGN,10,2011-08-04 10:04:00,0.85,12689.0,France
562275,21578,WOODLAND DESIGN  COTTON TOTE BAG,6,2011-08-04 10:04:00,2.25,12689.0,France
562275,22635,CHILDS BREAKFAST SET DOLLY GIRL ,2,2011-08-04 10:04:00,9.95,12689.0,France
562275,22634,CHILDS BREAKFAST SET SPACEBOY ,2,2011-08-04 10:04:00,9.95,12689.0,France
562275,22367,CHILDRENS APRON SPACEBOY DESIGN,8,2011-08-04 10:04:00,1.95,12689.0,France
562275,21156,RETROSPOT CHILDRENS APRON,8,2011-08-04 10:04:00,1.95,12689.0,France
562275,21249,WOODLAND  HEIGHT CHART STICKERS ,6,2011-08-04 10:04:00,2.95,12689.0,France
562275,21452,TOADSTOOL MONEY BOX,6,2011-08-04 10:04:00,2.95,12689.0,France
562275,22975,SPACEBOY CHILDRENS EGG CUP,12,2011-08-04 10:04:00,1.25,12689.0,France
562275,22977,DOLLY GIRL CHILDRENS EGG CUP,12,2011-08-04 10:04:00,1.25,12689.0,France
562275,22898,CHILDRENS APRON APPLES DESIGN,8,2011-08-04 10:04:00,1.95,12689.0,France
562275,23206,LUNCH BAG APPLE DESIGN,10,2011-08-04 10:04:00,1.65,12689.0,France
562275,22899,CHILDREN'S APRON DOLLY GIRL ,6,2011-08-04 10:04:00,2.1,12689.0,France
562275,22382,LUNCH BAG SPACEBOY DESIGN ,10,2011-08-04 10:04:00,1.65,12689.0,France
562275,22390,PAPERWEIGHT CHILDHOOD MEMORIES,6,2011-08-04 10:04:00,2.55,12689.0,France
562275,22389,PAPERWEIGHT SAVE THE PLANET,6,2011-08-04 10:04:00,2.55,12689.0,France
562275,21892,TRADITIONAL WOODEN CATCH CUP GAME ,12,2011-08-04 10:04:00,1.25,12689.0,France
562275,POST,POSTAGE,2,2011-08-04 10:04:00,18.0,12689.0,France
562276,22935,BAKING MOULD ROSE MILK CHOCOLATE,6,2011-08-04 10:23:00,3.25,17735.0,United Kingdom
562276,22932,BAKING MOULD TOFFEE CUP CHOCOLATE,6,2011-08-04 10:23:00,2.55,17735.0,United Kingdom
562276,22667,RECIPE BOX RETROSPOT ,6,2011-08-04 10:23:00,2.95,17735.0,United Kingdom
562276,21155,RED RETROSPOT PEG BAG,6,2011-08-04 10:23:00,2.55,17735.0,United Kingdom
562276,21080,SET/20 RED RETROSPOT PAPER NAPKINS ,12,2011-08-04 10:23:00,0.85,17735.0,United Kingdom
562276,85099B,JUMBO BAG RED RETROSPOT,20,2011-08-04 10:23:00,2.08,17735.0,United Kingdom
562276,21936,RED RETROSPOT PICNIC BAG,5,2011-08-04 10:23:00,2.95,17735.0,United Kingdom
562276,20725,LUNCH BAG RED RETROSPOT,10,2011-08-04 10:23:00,1.65,17735.0,United Kingdom
562276,23209,LUNCH BAG DOILEY PATTERN ,10,2011-08-04 10:23:00,1.65,17735.0,United Kingdom
562276,21929,JUMBO BAG PINK VINTAGE PAISLEY,20,2011-08-04 10:23:00,2.08,17735.0,United Kingdom
562276,23202,JUMBO BAG VINTAGE LEAF,20,2011-08-04 10:23:00,2.08,17735.0,United Kingdom
562276,22411,JUMBO SHOPPER VINTAGE RED PAISLEY,10,2011-08-04 10:23:00,2.08,17735.0,United Kingdom
562276,22386,JUMBO BAG PINK POLKADOT,10,2011-08-04 10:23:00,2.08,17735.0,United Kingdom
562276,85099F,JUMBO BAG STRAWBERRY,20,2011-08-04 10:23:00,2.08,17735.0,United Kingdom
562276,21931,JUMBO STORAGE BAG SUKI,10,2011-08-04 10:23:00,2.08,17735.0,United Kingdom
562276,22383,LUNCH BAG SUKI DESIGN ,10,2011-08-04 10:23:00,1.65,17735.0,United Kingdom
562276,21930,JUMBO STORAGE BAG SKULLS,10,2011-08-04 10:23:00,2.08,17735.0,United Kingdom
562276,23207,LUNCH BAG ALPHABET DESIGN,10,2011-08-04 10:23:00,1.65,17735.0,United Kingdom
562276,22327,ROUND SNACK BOXES SET OF 4 SKULLS,6,2011-08-04 10:23:00,2.95,17735.0,United Kingdom
562276,22328,ROUND SNACK BOXES SET OF 4 FRUITS ,6,2011-08-04 10:23:00,2.95,17735.0,United Kingdom
562276,23076,ICE CREAM SUNDAE LIP GLOSS,24,2011-08-04 10:23:00,1.25,17735.0,United Kingdom
562276,22631,CIRCUS PARADE LUNCH BOX ,12,2011-08-04 10:23:00,1.95,17735.0,United Kingdom
562276,22382,LUNCH BAG SPACEBOY DESIGN ,10,2011-08-04 10:23:00,1.65,17735.0,United Kingdom
562276,22662,LUNCH BAG DOLLY GIRL DESIGN,10,2011-08-04 10:23:00,1.65,17735.0,United Kingdom
562276,22433,WATERING CAN GREEN DINOSAUR,6,2011-08-04 10:23:00,1.95,17735.0,United Kingdom
562276,22432,WATERING CAN PINK BUNNY,6,2011-08-04 10:23:00,1.95,17735.0,United Kingdom
562276,22907,PACK OF 20 NAPKINS PANTRY DESIGN,12,2011-08-04 10:23:00,0.85,17735.0,United Kingdom
562276,20727,LUNCH BAG  BLACK SKULL.,10,2011-08-04 10:23:00,1.65,17735.0,United Kingdom
562276,47566,PARTY BUNTING,8,2011-08-04 10:23:00,4.95,17735.0,United Kingdom
562276,22090,PAPER BUNTING RETROSPOT,6,2011-08-04 10:23:00,2.95,17735.0,United Kingdom
562276,47566B,TEA TIME PARTY BUNTING,4,2011-08-04 10:23:00,4.95,17735.0,United Kingdom
562276,84796B,BLUE SAVANNAH PICNIC HAMPER FOR 2,1,2011-08-04 10:23:00,12.75,17735.0,United Kingdom
562276,22469,HEART OF WICKER SMALL,12,2011-08-04 10:23:00,1.65,17735.0,United Kingdom
562276,22894,TABLECLOTH RED APPLES DESIGN ,2,2011-08-04 10:23:00,9.95,17735.0,United Kingdom
562276,22897,OVEN MITT APPLES DESIGN,10,2011-08-04 10:23:00,1.45,17735.0,United Kingdom
562276,23204,CHARLOTTE BAG APPLES DESIGN,20,2011-08-04 10:23:00,0.85,17735.0,United Kingdom
562276,23206,LUNCH BAG APPLE DESIGN,20,2011-08-04 10:23:00,1.65,17735.0,United Kingdom
562276,23199,JUMBO BAG APPLES,10,2011-08-04 10:23:00,2.08,17735.0,United Kingdom
562276,23200,JUMBO BAG PEARS,10,2011-08-04 10:23:00,2.08,17735.0,United Kingdom
562276,22845,VINTAGE CREAM CAT FOOD CONTAINER,2,2011-08-04 10:23:00,6.35,17735.0,United Kingdom
562276,21212,PACK OF 72 RETROSPOT CAKE CASES,24,2011-08-04 10:23:00,0.55,17735.0,United Kingdom
562276,84991,60 TEATIME FAIRY CAKE CASES,24,2011-08-04 10:23:00,0.55,17735.0,United Kingdom
562276,21213,PACK OF 72 SKULL CAKE CASES,24,2011-08-04 10:23:00,0.55,17735.0,United Kingdom
562276,21975,PACK OF 60 DINOSAUR CAKE CASES,24,2011-08-04 10:23:00,0.55,17735.0,United Kingdom
562276,21210,SET OF 72 RETROSPOT PAPER  DOILIES,12,2011-08-04 10:23:00,1.45,17735.0,United Kingdom
562276,22423,REGENCY CAKESTAND 3 TIER,1,2011-08-04 10:23:00,12.75,17735.0,United Kingdom
562276,23298,SPOTTY BUNTING,3,2011-08-04 10:23:00,4.95,17735.0,United Kingdom
562276,22966,GINGERBREAD MAN COOKIE CUTTER,12,2011-08-04 10:23:00,1.25,17735.0,United Kingdom
562276,22965,3 TRADITIONAl BISCUIT CUTTERS  SET,6,2011-08-04 10:23:00,2.1,17735.0,United Kingdom
562277,22151,PLACE SETTING WHITE HEART,432,2011-08-04 10:24:00,0.36,17315.0,United Kingdom
562277,82494L,WOODEN FRAME ANTIQUE WHITE ,3,2011-08-04 10:24:00,2.95,17315.0,United Kingdom
562277,22283,6 EGG HOUSE PAINTED WOOD,2,2011-08-04 10:24:00,7.95,17315.0,United Kingdom
562277,22151,PLACE SETTING WHITE HEART,24,2011-08-04 10:24:00,0.42,17315.0,United Kingdom
562278,21391,Sold as 1 on dotcom,-342,2011-08-04 10:27:00,0.0,,United Kingdom
562279,21391,,-26,2011-08-04 10:28:00,0.0,,United Kingdom
C562280,84926F,PSYCHEDELIC TILE COASTER,-24,2011-08-04 10:31:00,0.29,16133.0,United Kingdom
C562280,23020,GLASS  SONGBIRD STORAGE JAR,-1,2011-08-04 10:31:00,12.5,16133.0,United Kingdom
C562281,84663A,GRASS HOPPER WOODEN WALL CLOCK ,-3,2011-08-04 10:36:00,0.79,12476.0,Germany
C562281,22423,REGENCY CAKESTAND 3 TIER,-1,2011-08-04 10:36:00,12.75,12476.0,Germany
C562281,22798,ANTIQUE GLASS DRESSING TABLE POT,-3,2011-08-04 10:36:00,2.95,12476.0,Germany
C562281,84976,RECTANGULAR SHAPED MIRROR,-2,2011-08-04 10:36:00,0.79,12476.0,Germany
C562281,23020,GLASS  SONGBIRD STORAGE JAR,-1,2011-08-04 10:36:00,12.5,12476.0,Germany
562282,85099B,JUMBO BAG RED RETROSPOT,100,2011-08-04 10:38:00,1.79,13098.0,United Kingdom
562282,84692,BOX OF 24 COCKTAIL PARASOLS,100,2011-08-04 10:38:00,0.42,13098.0,United Kingdom
562282,48116,DOORMAT MULTICOLOUR STRIPE,10,2011-08-04 10:38:00,6.75,13098.0,United Kingdom
562282,23233,WRAP POPPIES  DESIGN,50,2011-08-04 10:38:00,0.42,13098.0,United Kingdom
562282,23232,WRAP VINTAGE LEAF DESIGN,50,2011-08-04 10:38:00,0.42,13098.0,United Kingdom
562282,23231,WRAP DOILEY DESIGN,50,2011-08-04 10:38:00,0.42,13098.0,United Kingdom
562282,23209,LUNCH BAG DOILEY PATTERN ,50,2011-08-04 10:38:00,1.65,13098.0,United Kingdom
562282,23208,LUNCH BAG VINTAGE LEAF DESIGN,30,2011-08-04 10:38:00,1.65,13098.0,United Kingdom
562282,23203,JUMBO BAG DOILEY PATTERNS,100,2011-08-04 10:38:00,1.79,13098.0,United Kingdom
562282,23202,JUMBO BAG VINTAGE LEAF,100,2011-08-04 10:38:00,1.79,13098.0,United Kingdom
562282,23199,JUMBO BAG APPLES,100,2011-08-04 10:38:00,1.79,13098.0,United Kingdom
562282,23172,REGENCY TEA PLATE PINK,12,2011-08-04 10:38:00,1.65,13098.0,United Kingdom
562282,23171,REGENCY TEA PLATE GREEN ,12,2011-08-04 10:38:00,1.65,13098.0,United Kingdom
562282,23170,REGENCY TEA PLATE ROSES ,12,2011-08-04 10:38:00,1.65,13098.0,United Kingdom
562282,23054,RECYCLED ACAPULCO MAT LAVENDER,4,2011-08-04 10:38:00,8.25,13098.0,United Kingdom
562282,23049,RECYCLED ACAPULCO MAT RED,6,2011-08-04 10:38:00,8.25,13098.0,United Kingdom
562282,22849,BREAD BIN DINER STYLE MINT,4,2011-08-04 10:38:00,14.95,13098.0,United Kingdom
562282,22848,BREAD BIN DINER STYLE PINK,4,2011-08-04 10:38:00,14.95,13098.0,United Kingdom
562282,22847,BREAD BIN DINER STYLE IVORY,4,2011-08-04 10:38:00,14.95,13098.0,United Kingdom
562282,22846,BREAD BIN DINER STYLE RED ,4,2011-08-04 10:38:00,14.95,13098.0,United Kingdom
562282,22704,WRAP RED APPLES ,50,2011-08-04 10:38:00,0.42,13098.0,United Kingdom
562282,22699,ROSES REGENCY TEACUP AND SAUCER ,24,2011-08-04 10:38:00,2.55,13098.0,United Kingdom
562282,22433,WATERING CAN GREEN DINOSAUR,6,2011-08-04 10:38:00,1.95,13098.0,United Kingdom
562282,22431,WATERING CAN BLUE ELEPHANT,6,2011-08-04 10:38:00,1.95,13098.0,United Kingdom
562282,22384,LUNCH BAG PINK POLKADOT,50,2011-08-04 10:38:00,1.65,13098.0,United Kingdom
562282,22382,LUNCH BAG SPACEBOY DESIGN ,50,2011-08-04 10:38:00,1.65,13098.0,United Kingdom
562282,22046,TEA PARTY  WRAPPING PAPER ,50,2011-08-04 10:38:00,0.42,13098.0,United Kingdom
562282,22045,SPACEBOY GIFT WRAP,50,2011-08-04 10:38:00,0.42,13098.0,United Kingdom
562282,21498,RED RETROSPOT WRAP ,50,2011-08-04 10:38:00,0.42,13098.0,United Kingdom
562282,21497,FANCY FONTS BIRTHDAY WRAP,50,2011-08-04 10:38:00,0.42,13098.0,United Kingdom
562282,21210,SET OF 72 RETROSPOT PAPER  DOILIES,12,2011-08-04 10:38:00,1.45,13098.0,United Kingdom
562282,20727,LUNCH BAG  BLACK SKULL.,30,2011-08-04 10:38:00,1.65,13098.0,United Kingdom
562282,20728,LUNCH BAG CARS BLUE,30,2011-08-04 10:38:00,1.65,13098.0,United Kingdom
562282,20725,LUNCH BAG RED RETROSPOT,50,2011-08-04 10:38:00,1.65,13098.0,United Kingdom
562282,20685,DOORMAT RED RETROSPOT,10,2011-08-04 10:38:00,6.75,13098.0,United Kingdom
562283,22278,OVERNIGHT BAG VINTAGE ROSE PAISLEY,3,2011-08-04 10:43:00,4.95,15249.0,United Kingdom
562283,23300,GARDENERS KNEELING PAD CUP OF TEA ,12,2011-08-04 10:43:00,1.65,15249.0,United Kingdom
562283,23301,GARDENERS KNEELING PAD KEEP CALM ,12,2011-08-04 10:43:00,1.65,15249.0,United Kingdom
562283,16169E,WRAP 50'S  CHRISTMAS,25,2011-08-04 10:43:00,0.42,15249.0,United Kingdom
562283,22993,SET OF 4 PANTRY JELLY MOULDS,12,2011-08-04 10:43:00,1.25,15249.0,United Kingdom
562283,22568,FELTCRAFT CUSHION OWL,4,2011-08-04 10:43:00,3.75,15249.0,United Kingdom
562283,84380,SET OF 3 BUTTERFLY COOKIE CUTTERS,12,2011-08-04 10:43:00,1.25,15249.0,United Kingdom
562283,84912B,GREEN ROSE WASHBAG,8,2011-08-04 10:43:00,3.75,15249.0,United Kingdom
562283,23298,SPOTTY BUNTING,12,2011-08-04 10:43:00,4.95,15249.0,United Kingdom
562283,23313,VINTAGE CHRISTMAS BUNTING,5,2011-08-04 10:43:00,4.95,15249.0,United Kingdom
562283,22668,PINK BABY BUNTING,5,2011-08-04 10:43:00,2.95,15249.0,United Kingdom
562283,23198,PANTRY MAGNETIC  SHOPPING LIST,12,2011-08-04 10:43:00,1.45,15249.0,United Kingdom
562283,20725,LUNCH BAG RED RETROSPOT,10,2011-08-04 10:43:00,1.65,15249.0,United Kingdom
562283,22384,LUNCH BAG PINK POLKADOT,10,2011-08-04 10:43:00,1.65,15249.0,United Kingdom
562283,23207,LUNCH BAG ALPHABET DESIGN,10,2011-08-04 10:43:00,1.65,15249.0,United Kingdom
562283,22383,LUNCH BAG SUKI DESIGN ,10,2011-08-04 10:43:00,1.65,15249.0,United Kingdom
562283,20728,LUNCH BAG CARS BLUE,10,2011-08-04 10:43:00,1.65,15249.0,United Kingdom
562283,20727,LUNCH BAG  BLACK SKULL.,10,2011-08-04 10:43:00,1.65,15249.0,United Kingdom
562283,21539,RED RETROSPOT BUTTER DISH,3,2011-08-04 10:43:00,4.95,15249.0,United Kingdom
562283,22491,PACK OF 12 COLOURED PENCILS,12,2011-08-04 10:43:00,0.85,15249.0,United Kingdom
562283,23243,SET OF TEA COFFEE SUGAR TINS PANTRY,4,2011-08-04 10:43:00,4.95,15249.0,United Kingdom
562283,23245,SET OF 3 REGENCY CAKE TINS,4,2011-08-04 10:43:00,4.95,15249.0,United Kingdom
562283,85132C,CHARLIE AND LOLA FIGURES TINS,12,2011-08-04 10:43:00,1.95,15249.0,United Kingdom
562283,22208,WOOD STAMP SET THANK YOU,12,2011-08-04 10:43:00,0.83,15249.0,United Kingdom
562283,22396,MAGNETS PACK OF 4 RETRO PHOTO,12,2011-08-04 10:43:00,0.39,15249.0,United Kingdom
562283,22403,MAGNETS PACK OF 4 VINTAGE LABELS ,12,2011-08-04 10:43:00,0.39,15249.0,United Kingdom
562283,22915,ASSORTED BOTTLE TOP  MAGNETS ,12,2011-08-04 10:43:00,0.42,15249.0,United Kingdom
562283,21934,SKULL SHOULDER BAG,10,2011-08-04 10:43:00,1.65,15249.0,United Kingdom
562283,20914,SET/5 RED RETROSPOT LID GLASS BOWLS,6,2011-08-04 10:43:00,2.95,15249.0,United Kingdom
562283,22348,TEA BAG PLATE RED RETROSPOT,12,2011-08-04 10:43:00,0.85,15249.0,United Kingdom
562283,22726,ALARM CLOCK BAKELIKE GREEN,4,2011-08-04 10:43:00,3.75,15249.0,United Kingdom
562283,22652,TRAVEL SEWING KIT,10,2011-08-04 10:43:00,1.65,15249.0,United Kingdom
562283,84536A,ENGLISH ROSE NOTEBOOK A7 SIZE,16,2011-08-04 10:43:00,0.42,15249.0,United Kingdom
562283,21535,RED RETROSPOT SMALL MILK JUG,6,2011-08-04 10:43:00,2.55,15249.0,United Kingdom
562283,23247,BISCUIT TIN 50'S CHRISTMAS,6,2011-08-04 10:43:00,2.89,15249.0,United Kingdom
562283,21218,RED SPOTTY BISCUIT TIN,6,2011-08-04 10:43:00,3.75,15249.0,United Kingdom
562283,22489,PACK OF 12 TRADITIONAL CRAYONS,24,2011-08-04 10:43:00,0.42,15249.0,United Kingdom
562284,20996,JAZZ HEARTS ADDRESS BOOK,24,2011-08-04 10:44:00,0.19,15133.0,United Kingdom
562284,84660C,PINK STITCHED WALL CLOCK,40,2011-08-04 10:44:00,0.79,15133.0,United Kingdom
562284,85114A,BLACK ENCHANTED FOREST PLACEMAT,60,2011-08-04 10:44:00,1.45,15133.0,United Kingdom
562284,20668,DISCO BALL CHRISTMAS DECORATION,96,2011-08-04 10:44:00,0.12,15133.0,United Kingdom
562284,21801,CHRISTMAS TREE DECORATION WITH BELL,36,2011-08-04 10:44:00,0.42,15133.0,United Kingdom
562284,23210,WHITE ROCKING HORSE HAND PAINTED,24,2011-08-04 10:44:00,1.25,15133.0,United Kingdom
562284,23211,RED ROCKING HORSE HAND PAINTED,24,2011-08-04 10:44:00,1.25,15133.0,United Kingdom
562284,23213,STAR WREATH DECORATION WITH BELL,12,2011-08-04 10:44:00,1.25,15133.0,United Kingdom
562284,23212,HEART WREATH DECORATION WITH BELL,12,2011-08-04 10:44:00,1.25,15133.0,United Kingdom
562284,21448,12 DAISY PEGS IN WOOD BOX,12,2011-08-04 10:44:00,1.65,15133.0,United Kingdom
562284,23157,SET OF 6 NATIVITY MAGNETS ,24,2011-08-04 10:44:00,2.08,15133.0,United Kingdom
562284,22727,ALARM CLOCK BAKELIKE RED ,4,2011-08-04 10:44:00,3.75,15133.0,United Kingdom
562285,51014A,"FEATHER PEN,HOT PINK",240,2011-08-04 10:45:00,0.39,17404.0,Sweden
562285,15036,ASSORTED COLOURS SILK FAN,720,2011-08-04 10:45:00,0.72,17404.0,Sweden
562286,71459,HANGING JAM JAR T-LIGHT HOLDER,120,2011-08-04 10:45:00,0.72,15061.0,United Kingdom
562286,48187,DOORMAT NEW ENGLAND,20,2011-08-04 10:45:00,6.75,15061.0,United Kingdom
562286,48116,DOORMAT MULTICOLOUR STRIPE,10,2011-08-04 10:45:00,6.75,15061.0,United Kingdom
562286,22659,LUNCH BOX I LOVE LONDON,24,2011-08-04 10:45:00,1.65,15061.0,United Kingdom
562286,22630,DOLLY GIRL LUNCH BOX,24,2011-08-04 10:45:00,1.65,15061.0,United Kingdom
562286,22629,SPACEBOY LUNCH BOX ,24,2011-08-04 10:45:00,1.65,15061.0,United Kingdom
562286,22558,CLOTHES PEGS RETROSPOT PACK 24 ,30,2011-08-04 10:45:00,1.45,15061.0,United Kingdom
562286,22530,MAGIC DRAWING SLATE DOLLY GIRL ,30,2011-08-04 10:45:00,0.36,15061.0,United Kingdom
562286,22467,GUMBALL COAT RACK,18,2011-08-04 10:45:00,2.1,15061.0,United Kingdom
562286,22423,REGENCY CAKESTAND 3 TIER,30,2011-08-04 10:45:00,10.95,15061.0,United Kingdom
562286,21500,PINK POLKADOT WRAP ,75,2011-08-04 10:45:00,0.34,15061.0,United Kingdom
562286,21499,BLUE POLKADOT WRAP,100,2011-08-04 10:45:00,0.34,15061.0,United Kingdom
562286,21498,RED RETROSPOT WRAP ,75,2011-08-04 10:45:00,0.34,15061.0,United Kingdom
562287,21243,PINK  POLKADOT PLATE ,8,2011-08-04 11:07:00,1.69,12455.0,Spain
562287,21244,BLUE POLKADOT PLATE ,8,2011-08-04 11:07:00,1.69,12455.0,Spain
562287,21242,RED RETROSPOT PLATE ,8,2011-08-04 11:07:00,1.69,12455.0,Spain
562287,POST,POSTAGE,1,2011-08-04 11:07:00,28.0,12455.0,Spain
562287,20677,PINK POLKADOT BOWL,8,2011-08-04 11:07:00,1.25,12455.0,Spain
562290,23203,JUMBO BAG DOILEY PATTERNS,10,2011-08-04 11:16:00,2.08,14825.0,United Kingdom
562290,23200,JUMBO BAG PEARS,10,2011-08-04 11:16:00,2.08,14825.0,United Kingdom
562290,21621,VINTAGE UNION JACK BUNTING,4,2011-08-04 11:16:00,8.5,14825.0,United Kingdom
562290,23298,SPOTTY BUNTING,3,2011-08-04 11:16:00,4.95,14825.0,United Kingdom
562290,22411,JUMBO SHOPPER VINTAGE RED PAISLEY,10,2011-08-04 11:16:00,2.08,14825.0,United Kingdom
562290,23344,JUMBO BAG 50'S CHRISTMAS ,10,2011-08-04 11:16:00,2.08,14825.0,United Kingdom
562313,22138,BAKING SET 9 PIECE RETROSPOT ,3,2011-08-04 11:38:00,4.95,14640.0,United Kingdom
562313,22634,CHILDS BREAKFAST SET SPACEBOY ,2,2011-08-04 11:38:00,9.95,14640.0,United Kingdom
562313,22617,BAKING SET SPACEBOY DESIGN,3,2011-08-04 11:38:00,4.95,14640.0,United Kingdom
562313,23321,SMALL WHITE HEART OF WICKER,24,2011-08-04 11:38:00,1.65,14640.0,United Kingdom
562313,22635,CHILDS BREAKFAST SET DOLLY GIRL ,2,2011-08-04 11:38:00,9.95,14640.0,United Kingdom
562313,23106,ZINC HEARTS PLANT POT HOLDER,8,2011-08-04 11:38:00,2.89,14640.0,United Kingdom
562313,84884A,ANT WHITE WIRE HEART SPIRAL,5,2011-08-04 11:38:00,3.95,14640.0,United Kingdom
562313,84946,ANTIQUE SILVER T-LIGHT GLASS,36,2011-08-04 11:38:00,1.25,14640.0,United Kingdom
562313,23313,VINTAGE CHRISTMAS BUNTING,5,2011-08-04 11:38:00,4.95,14640.0,United Kingdom
562313,23312,VINTAGE CHRISTMAS GIFT SACK,8,2011-08-04 11:38:00,4.15,14640.0,United Kingdom
562313,23322,LARGE WHITE HEART OF WICKER,6,2011-08-04 11:38:00,2.95,14640.0,United Kingdom
562313,23323,WHITE WICKER STAR ,6,2011-08-04 11:38:00,2.1,14640.0,United Kingdom
562313,84832,ZINC WILLIE WINKIE  CANDLE STICK,12,2011-08-04 11:38:00,0.85,14640.0,United Kingdom
562313,85053,FRENCH ENAMEL CANDLEHOLDER,6,2011-08-04 11:38:00,2.1,14640.0,United Kingdom
562313,84347,ROTATING SILVER ANGELS T-LIGHT HLDR,12,2011-08-04 11:38:00,2.55,14640.0,United Kingdom
562313,35967,FOLK ART METAL STAR T-LIGHT HOLDER,24,2011-08-04 11:38:00,0.38,14640.0,United Kingdom
562313,22441,GROW YOUR OWN BASIL IN ENAMEL MUG,8,2011-08-04 11:38:00,2.1,14640.0,United Kingdom
562313,23138,SINGLE WIRE HOOK IVORY HEART,12,2011-08-04 11:38:00,1.45,14640.0,United Kingdom
562313,23108,SET OF 10 LED DOLLY LIGHTS,4,2011-08-04 11:38:00,6.25,14640.0,United Kingdom
562313,23083,SET 6 PAPER TABLE LANTERN STARS ,6,2011-08-04 11:38:00,3.75,14640.0,United Kingdom
562313,22752,SET 7 BABUSHKA NESTING BOXES,2,2011-08-04 11:38:00,8.5,14640.0,United Kingdom
562313,21891,TRADITIONAL WOODEN SKIPPING ROPE,12,2011-08-04 11:38:00,1.45,14640.0,United Kingdom
562313,22620,4 TRADITIONAL SPINNING TOPS,12,2011-08-04 11:38:00,1.45,14640.0,United Kingdom
562313,21915,RED  HARMONICA IN BOX ,12,2011-08-04 11:38:00,1.25,14640.0,United Kingdom
562332,20727,LUNCH BAG  BLACK SKULL.,200,2011-08-04 11:44:00,1.45,13791.0,United Kingdom
562332,20728,LUNCH BAG CARS BLUE,100,2011-08-04 11:44:00,1.45,13791.0,United Kingdom
562332,20724,RED RETROSPOT CHARLOTTE BAG,100,2011-08-04 11:44:00,0.72,13791.0,United Kingdom
562332,22356,CHARLOTTE BAG PINK POLKADOT,100,2011-08-04 11:44:00,0.72,13791.0,United Kingdom
562339,15058B,PINK POLKADOT GARDEN PARASOL,1,2011-08-04 11:59:00,7.95,13571.0,United Kingdom
562339,22469,HEART OF WICKER SMALL,3,2011-08-04 11:59:00,1.65,13571.0,United Kingdom
562339,22470,HEART OF WICKER LARGE,2,2011-08-04 11:59:00,2.95,13571.0,United Kingdom
562339,23198,PANTRY MAGNETIC  SHOPPING LIST,4,2011-08-04 11:59:00,1.45,13571.0,United Kingdom
562339,22084,PAPER CHAIN KIT EMPIRE,1,2011-08-04 11:59:00,2.95,13571.0,United Kingdom
562339,22315,200 RED + WHITE BENDY STRAWS,1,2011-08-04 11:59:00,1.25,13571.0,United Kingdom
562339,23293,SET OF 12 FAIRY CAKE BAKING CASES,16,2011-08-04 11:59:00,0.83,13571.0,United Kingdom
562339,21916,SET 12 RETRO WHITE CHALK STICKS,1,2011-08-04 11:59:00,0.42,13571.0,United Kingdom
562339,22993,SET OF 4 PANTRY JELLY MOULDS,4,2011-08-04 11:59:00,1.25,13571.0,United Kingdom
562339,21992,VINTAGE PAISLEY STATIONERY SET,4,2011-08-04 11:59:00,1.25,13571.0,United Kingdom
