InvoiceNo,StockCode,Description,Quantity,InvoiceDate,UnitPrice,CustomerID,Country
560883,21163,DO NOT TOUCH MY STUFF DOOR HANGER ,48,2011-07-21 16:10:00,0.39,13694.0,United Kingdom
560883,21179,NO JUNK MAIL METAL SIGN,144,2011-07-21 16:10:00,0.39,13694.0,United Kingdom
560883,21905,MORE BUTTER METAL SIGN ,48,2011-07-21 16:10:00,0.79,13694.0,United Kingdom
560883,22115,METAL SIGN EMPIRE TEA,48,2011-07-21 16:10:00,0.79,13694.0,United Kingdom
560883,84402B,PURPLE DRESS JEWELLERY STAND,25,2011-07-21 16:10:00,0.79,13694.0,United Kingdom
560883,84857B,BLUE MONTE CARLO HANDBAG,24,2011-07-21 16:10:00,1.95,13694.0,United Kingdom
560883,85130B,BEADED CRYSTAL HEART GREEN LARGE,72,2011-07-21 16:10:00,0.79,13694.0,United Kingdom
560883,85130D,BEADED CRYSTAL HEART PINK LARGE,72,2011-07-21 16:10:00,0.79,13694.0,United Kingdom
560883,85071B,RED CHARLIE+LOLA PERSONAL DOORSIGN,96,2011-07-21 16:10:00,0.39,13694.0,United Kingdom
560884,21933,PINK VINTAGE PAISLEY PICNIC BAG,50,2011-07-21 16:12:00,1.65,13694.0,United Kingdom
560884,21932,SCANDINAVIAN PAISLEY PICNIC BAG,50,2011-07-21 16:12:00,1.65,13694.0,United Kingdom
560884,22384,LUNCH BAG PINK POLKADOT,100,2011-07-21 16:12:00,1.45,13694.0,United Kingdom
560884,22383,LUNCH BAG SUKI DESIGN ,100,2011-07-21 16:12:00,1.45,13694.0,United Kingdom
560884,23206,LUNCH BAG APPLE DESIGN,100,2011-07-21 16:12:00,1.45,13694.0,United Kingdom
560884,23208,LUNCH BAG VINTAGE LEAF DESIGN,100,2011-07-21 16:12:00,1.45,13694.0,United Kingdom
560884,23207,LUNCH BAG ALPHABET DESIGN,100,2011-07-21 16:12:00,1.45,13694.0,United Kingdom
560885,22668,PINK BABY BUNTING,5,2011-07-21 16:20:00,2.95,16188.0,United Kingdom
560885,22096,PINK PAISLEY SQUARE TISSUE BOX ,36,2011-07-21 16:20:00,0.39,16188.0,United Kingdom
560885,22161,HEART DECORATION RUSTIC HANGING ,24,2011-07-21 16:20:00,0.19,16188.0,United Kingdom
560885,85032A,ROMANTIC IMAGES GIFT WRAP SET,12,2011-07-21 16:20:00,0.65,16188.0,United Kingdom
560885,85078,SCANDINAVIAN 3 HEARTS NAPKIN RING,24,2011-07-21 16:20:00,0.19,16188.0,United Kingdom
560885,90166,PINK & WHITE ROSEBUD RING,3,2011-07-21 16:20:00,4.25,16188.0,United Kingdom
560885,21495,SKULLS AND CROSSBONES WRAP,25,2011-07-21 16:20:00,0.42,16188.0,United Kingdom
560885,22045,SPACEBOY GIFT WRAP,25,2011-07-21 16:20:00,0.42,16188.0,United Kingdom
560885,85184C,SET 4 VALENTINE DECOUPAGE HEART BOX,6,2011-07-21 16:20:00,2.95,16188.0,United Kingdom
560885,21430,SET/3 RED GINGHAM ROSE STORAGE BOX,4,2011-07-21 16:20:00,3.75,16188.0,United Kingdom
560885,22553,PLASTERS IN TIN SKULLS,24,2011-07-21 16:20:00,1.65,16188.0,United Kingdom
560885,23082,SET 6 PAPER TABLE LANTERN HEARTS ,6,2011-07-21 16:20:00,3.75,16188.0,United Kingdom
560885,22178,VICTORIAN GLASS HANGING T-LIGHT,12,2011-07-21 16:20:00,1.25,16188.0,United Kingdom
560886,23284,DOORMAT KEEP CALM AND COME IN,100,2011-07-21 16:27:00,6.75,16041.0,United Kingdom
560887,22847,BREAD BIN DINER STYLE IVORY,32,2011-07-21 16:28:00,14.95,16041.0,United Kingdom
560887,22840,ROUND CAKE TIN VINTAGE RED,48,2011-07-21 16:28:00,6.95,16041.0,United Kingdom
560887,23301,GARDENERS KNEELING PAD KEEP CALM ,144,2011-07-21 16:28:00,1.45,16041.0,United Kingdom
560887,23300,GARDENERS KNEELING PAD CUP OF TEA ,720,2011-07-21 16:28:00,1.45,16041.0,United Kingdom
560888,23341,PINK DINER WALL CLOCK,2,2011-07-21 16:33:00,8.5,15380.0,United Kingdom
560888,22193,RED DINER WALL CLOCK,12,2011-07-21 16:33:00,7.65,15380.0,United Kingdom
560888,23181,BULL DOG BOTTLE TOP WALL CLOCK,2,2011-07-21 16:33:00,8.25,15380.0,United Kingdom
560888,23178,JAM CLOCK MAGNET,6,2011-07-21 16:33:00,2.89,15380.0,United Kingdom
560888,22191,IVORY DINER WALL CLOCK,2,2011-07-21 16:33:00,8.5,15380.0,United Kingdom
560888,22192,BLUE DINER WALL CLOCK,2,2011-07-21 16:33:00,8.5,15380.0,United Kingdom
560888,23316,RED REFECTORY CLOCK ,2,2011-07-21 16:33:00,9.95,15380.0,United Kingdom
560888,84660C,PINK STITCHED WALL CLOCK,20,2011-07-21 16:33:00,0.79,15380.0,United Kingdom
560888,84660B,BLACK STITCHED WALL CLOCK,20,2011-07-21 16:33:00,0.79,15380.0,United Kingdom
560888,23315,IVORY REFECTORY CLOCK,2,2011-07-21 16:33:00,9.95,15380.0,United Kingdom
560888,23342,MINT DINER WALL CLOCK,2,2011-07-21 16:33:00,8.5,15380.0,United Kingdom
560888,22726,ALARM CLOCK BAKELIKE GREEN,4,2011-07-21 16:33:00,3.75,15380.0,United Kingdom
560888,22727,ALARM CLOCK BAKELIKE RED ,4,2011-07-21 16:33:00,3.75,15380.0,United Kingdom
560888,22728,ALARM CLOCK BAKELIKE PINK,4,2011-07-21 16:33:00,3.75,15380.0,United Kingdom
560888,79163,BLACK CHAMPAGNE GLASS,48,2011-07-21 16:33:00,0.39,15380.0,United Kingdom
560888,22461,SAVOY ART DECO CLOCK,6,2011-07-21 16:33:00,3.95,15380.0,United Kingdom
560889,84789,,1,2011-07-21 16:42:00,0.0,,United Kingdom
560890,84402B,,1,2011-07-21 16:43:00,0.0,,United Kingdom
560891,22093,MOTORING TISSUE BOX,36,2011-07-21 17:02:00,0.39,15106.0,United Kingdom
560891,21991,BOHEMIAN COLLAGE STATIONERY SET,12,2011-07-21 17:02:00,1.25,15106.0,United Kingdom
560891,21992,VINTAGE PAISLEY STATIONERY SET,12,2011-07-21 17:02:00,1.25,15106.0,United Kingdom
560891,22094,RED RETROSPOT TISSUE BOX,36,2011-07-21 17:02:00,0.39,15106.0,United Kingdom
560891,22116,METAL SIGN HIS DINNER IS SERVED,12,2011-07-21 17:02:00,0.79,15106.0,United Kingdom
560891,22287,DECORATION WOBBLY CHICKEN,24,2011-07-21 17:02:00,0.39,15106.0,United Kingdom
560891,22609,PENS ASSORTED SPACEBALL,36,2011-07-21 17:02:00,0.19,15106.0,United Kingdom
560891,85071A,BLUE CHARLIE+LOLA PERSONAL DOORSIGN,24,2011-07-21 17:02:00,0.39,15106.0,United Kingdom
560891,20893,HANGING BAUBLE T-LIGHT HOLDER SMALL,6,2011-07-21 17:02:00,2.55,15106.0,United Kingdom
560891,71477,COLOUR GLASS. STAR T-LIGHT HOLDER,4,2011-07-21 17:02:00,3.25,15106.0,United Kingdom
560891,22427,ENAMEL FLOWER JUG CREAM,3,2011-07-21 17:02:00,5.95,15106.0,United Kingdom
560891,22662,LUNCH BAG DOLLY GIRL DESIGN,10,2011-07-21 17:02:00,1.65,15106.0,United Kingdom
560891,23207,LUNCH BAG ALPHABET DESIGN,10,2011-07-21 17:02:00,1.65,15106.0,United Kingdom
560891,84912B,GREEN ROSE WASHBAG,4,2011-07-21 17:02:00,3.75,15106.0,United Kingdom
560891,15036,ASSORTED COLOURS SILK FAN,12,2011-07-21 17:02:00,0.83,15106.0,United Kingdom
560891,23132,SMALL IVORY HEART WALL ORGANISER,3,2011-07-21 17:02:00,5.75,15106.0,United Kingdom
560891,21878,PACK OF 6 SANDCASTLE FLAGS ASSORTED,12,2011-07-21 17:02:00,0.85,15106.0,United Kingdom
560891,22138,BAKING SET 9 PIECE RETROSPOT ,3,2011-07-21 17:02:00,4.95,15106.0,United Kingdom
560891,22278,OVERNIGHT BAG VINTAGE ROSE PAISLEY,3,2011-07-21 17:02:00,4.95,15106.0,United Kingdom
560892,21756,BATH BUILDING BLOCK WORD,4,2011-07-21 17:08:00,5.95,13089.0,United Kingdom
560892,20723,STRAWBERRY CHARLOTTE BAG,10,2011-07-21 17:08:00,0.85,13089.0,United Kingdom
560892,85131D,BEADED CRYSTAL HEART PINK ON STICK,12,2011-07-21 17:08:00,1.25,13089.0,United Kingdom
560892,15044B,BLUE PAPER PARASOL ,6,2011-07-21 17:08:00,2.95,13089.0,United Kingdom
560892,15044A,PINK PAPER PARASOL ,6,2011-07-21 17:08:00,2.95,13089.0,United Kingdom
560892,22629,SPACEBOY LUNCH BOX ,12,2011-07-21 17:08:00,1.95,13089.0,United Kingdom
560892,21669,BLUE STRIPE CERAMIC DRAWER KNOB,12,2011-07-21 17:08:00,1.25,13089.0,United Kingdom
560892,22558,CLOTHES PEGS RETROSPOT PACK 24 ,12,2011-07-21 17:08:00,1.65,13089.0,United Kingdom
560892,23206,LUNCH BAG APPLE DESIGN,10,2011-07-21 17:08:00,1.65,13089.0,United Kingdom
560892,22456,NATURAL SLATE CHALKBOARD LARGE ,6,2011-07-21 17:08:00,4.95,13089.0,United Kingdom
560892,22457,NATURAL SLATE HEART CHALKBOARD ,12,2011-07-21 17:08:00,2.95,13089.0,United Kingdom
560892,21673,WHITE SPOT BLUE CERAMIC DRAWER KNOB,12,2011-07-21 17:08:00,1.25,13089.0,United Kingdom
560892,84946,ANTIQUE SILVER T-LIGHT GLASS,24,2011-07-21 17:08:00,1.25,13089.0,United Kingdom
560892,22666,RECIPE BOX PANTRY YELLOW DESIGN,6,2011-07-21 17:08:00,2.95,13089.0,United Kingdom
560892,84949,SILVER HANGING T-LIGHT HOLDER,24,2011-07-21 17:08:00,1.65,13089.0,United Kingdom
560892,20725,LUNCH BAG RED RETROSPOT,10,2011-07-21 17:08:00,1.65,13089.0,United Kingdom
560892,20726,LUNCH BAG WOODLAND,10,2011-07-21 17:08:00,1.65,13089.0,United Kingdom
560892,22630,DOLLY GIRL LUNCH BOX,12,2011-07-21 17:08:00,1.95,13089.0,United Kingdom
560892,23209,LUNCH BAG DOILEY PATTERN ,10,2011-07-21 17:08:00,1.65,13089.0,United Kingdom
560892,82482,WOODEN PICTURE FRAME WHITE FINISH,24,2011-07-21 17:08:00,2.55,13089.0,United Kingdom
560892,22784,LANTERN CREAM GAZEBO ,12,2011-07-21 17:08:00,4.25,13089.0,United Kingdom
560892,84879,ASSORTED COLOUR BIRD ORNAMENT,96,2011-07-21 17:08:00,1.69,13089.0,United Kingdom
560892,48129,DOORMAT TOPIARY,4,2011-07-21 17:08:00,7.95,13089.0,United Kingdom
560892,23282,FOLDING BUTTERFLY MIRROR IVORY ,12,2011-07-21 17:08:00,0.83,13089.0,United Kingdom
560892,23280,FOLDING BUTTERFLY MIRROR HOT PINK ,12,2011-07-21 17:08:00,0.83,13089.0,United Kingdom
560892,23148,MINIATURE ANTIQUE ROSE HOOK IVORY,24,2011-07-21 17:08:00,0.83,13089.0,United Kingdom
560892,23032,DRAWER KNOB CRACKLE GLAZE IVORY,12,2011-07-21 17:08:00,1.65,13089.0,United Kingdom
560892,23031,DRAWER KNOB CRACKLE GLAZE PINK,12,2011-07-21 17:08:00,1.65,13089.0,United Kingdom
560892,23029,DRAWER KNOB CRACKLE GLAZE GREEN,12,2011-07-21 17:08:00,1.65,13089.0,United Kingdom
560892,23028,DRAWER KNOB CRACKLE GLAZE BLUE,12,2011-07-21 17:08:00,1.65,13089.0,United Kingdom
560892,22983,CARD BILLBOARD FONT,12,2011-07-21 17:08:00,0.42,13089.0,United Kingdom
560892,22386,JUMBO BAG PINK POLKADOT,10,2011-07-21 17:08:00,2.08,13089.0,United Kingdom
560892,22356,CHARLOTTE BAG PINK POLKADOT,10,2011-07-21 17:08:00,0.85,13089.0,United Kingdom
560892,22026,BANQUET BIRTHDAY  CARD  ,12,2011-07-21 17:08:00,0.42,13089.0,United Kingdom
560892,21874,GIN AND TONIC MUG,12,2011-07-21 17:08:00,1.25,13089.0,United Kingdom
560893,22139,RETROSPOT TEA SET CERAMIC 11 PC ,3,2011-07-21 17:08:00,4.95,13804.0,United Kingdom
560893,22138,BAKING SET 9 PIECE RETROSPOT ,3,2011-07-21 17:08:00,4.95,13804.0,United Kingdom
560893,22693,GROW A FLYTRAP OR SUNFLOWER IN TIN,24,2011-07-21 17:08:00,1.25,13804.0,United Kingdom
560893,15056P,EDWARDIAN PARASOL PINK,3,2011-07-21 17:08:00,5.95,13804.0,United Kingdom
560893,47590B,PINK HAPPY BIRTHDAY BUNTING,3,2011-07-21 17:08:00,5.45,13804.0,United Kingdom
560893,47590A,BLUE HAPPY BIRTHDAY BUNTING,3,2011-07-21 17:08:00,5.45,13804.0,United Kingdom
560893,23108,SET OF 10 LED DOLLY LIGHTS,2,2011-07-21 17:08:00,6.25,13804.0,United Kingdom
560893,23310,BUBBLEGUM RING ASSORTED,36,2011-07-21 17:08:00,0.42,13804.0,United Kingdom
560893,84077,WORLD WAR 2 GLIDERS ASSTD DESIGNS,48,2011-07-21 17:08:00,0.29,13804.0,United Kingdom
560893,21915,RED  HARMONICA IN BOX ,12,2011-07-21 17:08:00,1.25,13804.0,United Kingdom
560893,21791,VINTAGE HEADS AND TAILS CARD GAME ,12,2011-07-21 17:08:00,1.25,13804.0,United Kingdom
560893,21889,WOODEN BOX OF DOMINOES,12,2011-07-21 17:08:00,1.25,13804.0,United Kingdom
560893,22063,CERAMIC BOWL WITH STRAWBERRY DESIGN,6,2011-07-21 17:08:00,2.95,13804.0,United Kingdom
560893,22055,MINI CAKE STAND  HANGING STRAWBERY,8,2011-07-21 17:08:00,1.65,13804.0,United Kingdom
560893,22644,CERAMIC CHERRY CAKE MONEY BANK,12,2011-07-21 17:08:00,1.45,13804.0,United Kingdom
560893,23298,SPOTTY BUNTING,3,2011-07-21 17:08:00,4.95,13804.0,United Kingdom
560893,23180,MUM'S KITCHEN CLOCK,4,2011-07-21 17:08:00,4.95,13804.0,United Kingdom
560893,21175,GIN + TONIC DIET METAL SIGN,12,2011-07-21 17:08:00,2.55,13804.0,United Kingdom
560894,21381,MINI WOODEN HAPPY BIRTHDAY GARLAND,12,2011-07-21 17:09:00,1.69,14911.0,EIRE
560894,47590B,PINK HAPPY BIRTHDAY BUNTING,12,2011-07-21 17:09:00,5.45,14911.0,EIRE
560894,47590A,BLUE HAPPY BIRTHDAY BUNTING,12,2011-07-21 17:09:00,5.45,14911.0,EIRE
560894,47566,PARTY BUNTING,4,2011-07-21 17:09:00,4.95,14911.0,EIRE
560894,23201,JUMBO BAG ALPHABET,20,2011-07-21 17:09:00,2.08,14911.0,EIRE
560894,22556,PLASTERS IN TIN CIRCUS PARADE ,12,2011-07-21 17:09:00,1.65,14911.0,EIRE
560894,47591D,PINK FAIRY CAKE CHILDRENS APRON,8,2011-07-21 17:09:00,1.95,14911.0,EIRE
560894,22139,RETROSPOT TEA SET CERAMIC 11 PC ,6,2011-07-21 17:09:00,4.95,14911.0,EIRE
560894,22605,WOODEN CROQUET GARDEN SET,16,2011-07-21 17:09:00,12.75,14911.0,EIRE
560894,22622,BOX OF VINTAGE ALPHABET BLOCKS,2,2011-07-21 17:09:00,11.95,14911.0,EIRE
560894,23196,VINTAGE LEAF MAGNETIC NOTEPAD,12,2011-07-21 17:09:00,1.45,14911.0,EIRE
560894,22904,CALENDAR PAPER CUT DESIGN,24,2011-07-21 17:09:00,2.95,14911.0,EIRE
560894,23232,WRAP VINTAGE LEAF DESIGN,50,2011-07-21 17:09:00,0.42,14911.0,EIRE
560894,23205,CHARLOTTE BAG VINTAGE ALPHABET ,10,2011-07-21 17:09:00,0.85,14911.0,EIRE
560894,20728,LUNCH BAG CARS BLUE,10,2011-07-21 17:09:00,1.65,14911.0,EIRE
560894,23202,JUMBO BAG VINTAGE LEAF,30,2011-07-21 17:09:00,2.08,14911.0,EIRE
560894,21936,RED RETROSPOT PICNIC BAG,5,2011-07-21 17:09:00,2.95,14911.0,EIRE
560894,23155,KNICKERBOCKERGLORY MAGNET ASSORTED ,12,2011-07-21 17:09:00,0.83,14911.0,EIRE
560894,23156,SET OF 5 MINI GROCERY MAGNETS,12,2011-07-21 17:09:00,2.08,14911.0,EIRE
560895,23067,HANGING ENGRAVED METAL HEART,12,2011-07-21 17:12:00,4.15,13089.0,United Kingdom
560895,22460,EMBOSSED GLASS TEALIGHT HOLDER,24,2011-07-21 17:12:00,1.25,13089.0,United Kingdom
560895,23275,SET OF 3 HANGING OWLS OLLIE BEAK,36,2011-07-21 17:12:00,1.25,13089.0,United Kingdom
560895,22467,GUMBALL COAT RACK,12,2011-07-21 17:12:00,2.55,13089.0,United Kingdom
560895,21980,PACK OF 12 RED RETROSPOT TISSUES ,48,2011-07-21 17:12:00,0.29,13089.0,United Kingdom
560895,22417,PACK OF 60 SPACEBOY CAKE CASES,24,2011-07-21 17:12:00,0.55,13089.0,United Kingdom
560895,22951,60 CAKE CASES DOLLY GIRL DESIGN,24,2011-07-21 17:12:00,0.55,13089.0,United Kingdom
560895,84992,72 SWEETHEART FAIRY CAKE CASES,24,2011-07-21 17:12:00,0.55,13089.0,United Kingdom
560895,23307,SET OF 60 PANTRY DESIGN CAKE CASES ,24,2011-07-21 17:12:00,0.55,13089.0,United Kingdom
560895,23297,SET 40 HEART SHAPE PETIT FOUR CASES,24,2011-07-21 17:12:00,1.65,13089.0,United Kingdom
560895,21313,GLASS HEART T-LIGHT HOLDER ,24,2011-07-21 17:12:00,0.85,13089.0,United Kingdom
560895,22798,ANTIQUE GLASS DRESSING TABLE POT,8,2011-07-21 17:12:00,2.95,13089.0,United Kingdom
560895,23014,GLASS APOTHECARY BOTTLE ELIXIR,12,2011-07-21 17:12:00,3.45,13089.0,United Kingdom
560895,23013,GLASS APOTHECARY BOTTLE TONIC,12,2011-07-21 17:12:00,3.45,13089.0,United Kingdom
560895,22156,HEART DECORATION WITH PEARLS ,36,2011-07-21 17:12:00,0.85,13089.0,United Kingdom
560895,23226,FILIGREE HEART DAISY WHITE,24,2011-07-21 17:12:00,1.25,13089.0,United Kingdom
560895,23227,FILIGREE HEART BUTTERFLY WHITE ,24,2011-07-21 17:12:00,1.25,13089.0,United Kingdom
560895,23240,SET OF 4 KNICK KNACK TINS DOILEY ,12,2011-07-21 17:12:00,4.15,13089.0,United Kingdom
560895,23133,LARGE IVORY HEART WALL ORGANISER,8,2011-07-21 17:12:00,7.05,13089.0,United Kingdom
560895,23134,LARGE ZINC HEART WALL ORGANISER,8,2011-07-21 17:12:00,7.05,13089.0,United Kingdom
560895,71459,HANGING JAM JAR T-LIGHT HOLDER,36,2011-07-21 17:12:00,0.85,13089.0,United Kingdom
560895,23296,SET OF 6 TEA TIME BAKING CASES,8,2011-07-21 17:12:00,1.25,13089.0,United Kingdom
560895,23293,SET OF 12 FAIRY CAKE BAKING CASES,24,2011-07-21 17:12:00,0.83,13089.0,United Kingdom
560895,23295,SET OF 12 MINI LOAF BAKING CASES,16,2011-07-21 17:12:00,0.83,13089.0,United Kingdom
560895,22423,REGENCY CAKESTAND 3 TIER,4,2011-07-21 17:12:00,12.75,13089.0,United Kingdom
560895,22698,PINK REGENCY TEACUP AND SAUCER,6,2011-07-21 17:12:00,2.95,13089.0,United Kingdom
560895,22697,GREEN REGENCY TEACUP AND SAUCER,6,2011-07-21 17:12:00,2.95,13089.0,United Kingdom
560895,22699,ROSES REGENCY TEACUP AND SAUCER ,6,2011-07-21 17:12:00,2.95,13089.0,United Kingdom
560895,23245,SET OF 3 REGENCY CAKE TINS,16,2011-07-21 17:12:00,4.15,13089.0,United Kingdom
560895,21500,PINK POLKADOT WRAP ,25,2011-07-21 17:12:00,0.42,13089.0,United Kingdom
560895,21498,RED RETROSPOT WRAP ,25,2011-07-21 17:12:00,0.42,13089.0,United Kingdom
560895,21497,FANCY FONTS BIRTHDAY WRAP,25,2011-07-21 17:12:00,0.42,13089.0,United Kingdom
560895,23230,WRAP ALPHABET DESIGN,25,2011-07-21 17:12:00,0.42,13089.0,United Kingdom
560895,22704,WRAP RED APPLES ,25,2011-07-21 17:12:00,0.42,13089.0,United Kingdom
560895,16161P,WRAP ENGLISH ROSE ,25,2011-07-21 17:12:00,0.42,13089.0,United Kingdom
560895,23549,WRAP BIRD GARDEN ,25,2011-07-21 17:12:00,0.42,13089.0,United Kingdom
560895,23546,WRAP PAISLEY PARK ,25,2011-07-21 17:12:00,0.42,13089.0,United Kingdom
560895,23232,WRAP VINTAGE LEAF DESIGN,25,2011-07-21 17:12:00,0.42,13089.0,United Kingdom
560895,23545,WRAP RED DOILEY,25,2011-07-21 17:12:00,0.42,13089.0,United Kingdom
560895,23231,WRAP DOILEY DESIGN,25,2011-07-21 17:12:00,0.42,13089.0,United Kingdom
560895,84970S,HANGING HEART ZINC T-LIGHT HOLDER,24,2011-07-21 17:12:00,0.85,13089.0,United Kingdom
560896,22361,GLASS JAR DAISY FRESH COTTON WOOL,6,2011-07-21 17:26:00,2.95,15623.0,United Kingdom
560896,84356,POMPOM CURTAIN,2,2011-07-21 17:26:00,6.95,15623.0,United Kingdom
560896,35638B,PINK/BLUE STRING CURTAIN ,6,2011-07-21 17:26:00,1.95,15623.0,United Kingdom
560896,47566,PARTY BUNTING,4,2011-07-21 17:26:00,4.95,15623.0,United Kingdom
560896,23298,SPOTTY BUNTING,3,2011-07-21 17:26:00,4.95,15623.0,United Kingdom
560896,47566B,TEA TIME PARTY BUNTING,4,2011-07-21 17:26:00,4.95,15623.0,United Kingdom
560896,20828,GLITTER BUTTERFLY CLIPS,6,2011-07-21 17:26:00,2.55,15623.0,United Kingdom
560896,22489,PACK OF 12 TRADITIONAL CRAYONS,24,2011-07-21 17:26:00,0.42,15623.0,United Kingdom
560896,22768,FAMILY PHOTO FRAME CORNICE,2,2011-07-21 17:26:00,9.95,15623.0,United Kingdom
560896,23013,GLASS APOTHECARY BOTTLE TONIC,4,2011-07-21 17:26:00,3.95,15623.0,United Kingdom
560896,21773,DECORATIVE ROSE BATHROOM BOTTLE,12,2011-07-21 17:26:00,1.25,15623.0,United Kingdom
560896,22789,T-LIGHT HOLDER SWEETHEART HANGING,8,2011-07-21 17:26:00,1.95,15623.0,United Kingdom
560896,23023,RIDGED BONNE JAM JAR T-LIGHT HOLDER,6,2011-07-21 17:26:00,1.65,15623.0,United Kingdom
560896,84755,COLOUR GLASS T-LIGHT HOLDER HANGING,16,2011-07-21 17:26:00,0.65,15623.0,United Kingdom
560896,22607,WOODEN ROUNDERS GARDEN SET ,2,2011-07-21 17:26:00,9.95,15623.0,United Kingdom
560896,48187,DOORMAT NEW ENGLAND,2,2011-07-21 17:26:00,7.95,15623.0,United Kingdom
560896,22430,ENAMEL WATERING CAN CREAM,4,2011-07-21 17:26:00,4.95,15623.0,United Kingdom
560896,48188,DOORMAT WELCOME PUPPIES,2,2011-07-21 17:26:00,7.95,15623.0,United Kingdom
560896,22469,HEART OF WICKER SMALL,12,2011-07-21 17:26:00,1.65,15623.0,United Kingdom
560897,22216,T-LIGHT HOLDER WHITE LACE,24,2011-07-21 17:26:00,0.85,12971.0,United Kingdom
560897,47566,PARTY BUNTING,24,2011-07-21 17:26:00,4.95,12971.0,United Kingdom
C560898,85066,CREAM SWEETHEART MINI CHEST,-1,2011-07-21 17:30:00,12.75,12722.0,France
C560898,22797,CHEST OF DRAWERS GINGHAM HEART ,-2,2011-07-21 17:30:00,16.95,12722.0,France
C560899,84978,HANGING HEART JAR T-LIGHT HOLDER,-24,2011-07-21 17:32:00,1.25,15260.0,United Kingdom
560900,M,Manual,1,2011-07-21 17:33:00,2.95,,United Kingdom
560900,22717,CARD DOG AND BALL ,1,2011-07-21 17:33:00,0.42,,United Kingdom
560900,22030,SWALLOWS GREETING CARD,1,2011-07-21 17:33:00,0.42,,United Kingdom
560901,23013,GLASS APOTHECARY BOTTLE TONIC,4,2011-07-21 17:39:00,3.95,12476.0,Germany
560901,23014,GLASS APOTHECARY BOTTLE ELIXIR,4,2011-07-21 17:39:00,3.95,12476.0,Germany
560901,23012,GLASS APOTHECARY BOTTLE PERFUME,4,2011-07-21 17:39:00,3.95,12476.0,Germany
560901,23020,GLASS  SONGBIRD STORAGE JAR,1,2011-07-21 17:39:00,12.5,12476.0,Germany
560901,23092,LARGE ANTIQUE WHITE PHOTO FRAME,2,2011-07-21 17:39:00,7.9,12476.0,Germany
560901,23245,SET OF 3 REGENCY CAKE TINS,4,2011-07-21 17:39:00,4.95,12476.0,Germany
560901,23317,BLUE REFECTORY CLOCK ,2,2011-07-21 17:39:00,9.95,12476.0,Germany
560901,23073,GEORGIAN TRINKET BOX,1,2011-07-21 17:39:00,12.5,12476.0,Germany
560901,22971,QUEENS GUARD COFFEE MUG,6,2011-07-21 17:39:00,2.55,12476.0,Germany
560901,23192,BUNDLE OF 3 ALPHABET EXERCISE BOOKS,12,2011-07-21 17:39:00,1.65,12476.0,Germany
560901,84663A,GRASS HOPPER WOODEN WALL CLOCK ,10,2011-07-21 17:39:00,0.79,12476.0,Germany
560901,84976,RECTANGULAR SHAPED MIRROR,12,2011-07-21 17:39:00,0.79,12476.0,Germany
560901,85054,FRENCH ENAMEL POT W LID,6,2011-07-21 17:39:00,2.95,12476.0,Germany
560901,22441,GROW YOUR OWN BASIL IN ENAMEL MUG,8,2011-07-21 17:39:00,2.1,12476.0,Germany
560901,22429,ENAMEL MEASURING JUG CREAM,4,2011-07-21 17:39:00,4.25,12476.0,Germany
560901,22798,ANTIQUE GLASS DRESSING TABLE POT,8,2011-07-21 17:39:00,2.95,12476.0,Germany
560901,22801,ANTIQUE GLASS PEDESTAL BOWL,8,2011-07-21 17:39:00,3.75,12476.0,Germany
560901,22110,BIRD HOUSE HOT WATER BOTTLE,6,2011-07-21 17:39:00,2.55,12476.0,Germany
560901,21484,CHICK GREY HOT WATER BOTTLE,4,2011-07-21 17:39:00,3.45,12476.0,Germany
560901,21509,COWBOYS AND INDIANS BIRTHDAY CARD ,24,2011-07-21 17:39:00,0.42,12476.0,Germany
560901,21507,"ELEPHANT, BIRTHDAY CARD, ",24,2011-07-21 17:39:00,0.42,12476.0,Germany
560901,22037,ROBOT BIRTHDAY CARD,24,2011-07-21 17:39:00,0.42,12476.0,Germany
560901,22077,6 RIBBONS RUSTIC CHARM,12,2011-07-21 17:39:00,1.65,12476.0,Germany
560901,21116,OWL DOORSTOP,3,2011-07-21 17:39:00,4.95,12476.0,Germany
560901,22423,REGENCY CAKESTAND 3 TIER,6,2011-07-21 17:39:00,12.75,12476.0,Germany
560901,22627,MINT KITCHEN SCALES,2,2011-07-21 17:39:00,8.5,12476.0,Germany
560901,22624,IVORY KITCHEN SCALES,2,2011-07-21 17:39:00,8.5,12476.0,Germany
560901,21990,MODERN FLORAL STATIONERY SET,24,2011-07-21 17:39:00,1.25,12476.0,Germany
560901,21993,FLORAL FOLK STATIONERY SET,48,2011-07-21 17:39:00,1.25,12476.0,Germany
560901,84944,SET OF 6 KASHMIR FOLKART BAUBLES,12,2011-07-21 17:39:00,1.65,12476.0,Germany
560901,23203,JUMBO BAG DOILEY PATTERNS,10,2011-07-21 17:39:00,2.08,12476.0,Germany
560901,POST,POSTAGE,7,2011-07-21 17:39:00,18.0,12476.0,Germany
C560902,22508,DOORSTOP RETROSPOT HEART,-4,2011-07-21 17:45:00,3.75,17593.0,United Kingdom
C560902,37340,MULTICOLOUR SPRING FLOWER MUG,-2,2011-07-21 17:45:00,0.39,17593.0,United Kingdom
C560903,22178,VICTORIAN GLASS HANGING T-LIGHT,-75,2011-07-21 17:47:00,1.06,18198.0,United Kingdom
C560904,M,Manual,-1,2011-07-21 17:51:00,8.95,14875.0,United Kingdom
C560905,23146,TRIPLE HOOK ANTIQUE IVORY ROSE,-3,2011-07-21 17:54:00,3.29,13468.0,United Kingdom
560906,23164,REGENCY CAKE SLICE,4,2011-07-21 17:55:00,4.95,15827.0,United Kingdom
560906,23161,REGENCY CAKE FORK,12,2011-07-21 17:55:00,1.25,15827.0,United Kingdom
560906,22666,RECIPE BOX PANTRY YELLOW DESIGN,6,2011-07-21 17:55:00,2.95,15827.0,United Kingdom
560906,22720,SET OF 3 CAKE TINS PANTRY DESIGN ,3,2011-07-21 17:55:00,4.95,15827.0,United Kingdom
560906,23173,REGENCY TEAPOT ROSES ,2,2011-07-21 17:55:00,9.95,15827.0,United Kingdom
560906,23170,REGENCY TEA PLATE ROSES ,12,2011-07-21 17:55:00,1.65,15827.0,United Kingdom
560906,22699,ROSES REGENCY TEACUP AND SAUCER ,6,2011-07-21 17:55:00,2.95,15827.0,United Kingdom
560906,22423,REGENCY CAKESTAND 3 TIER,1,2011-07-21 17:55:00,12.75,15827.0,United Kingdom
560906,23245,SET OF 3 REGENCY CAKE TINS,4,2011-07-21 17:55:00,4.95,15827.0,United Kingdom
560906,23051,RECYCLED ACAPULCO MAT BLUE,2,2011-07-21 17:55:00,8.25,15827.0,United Kingdom
C560907,84997A,CHILDRENS CUTLERY POLKADOT GREEN ,-3,2011-07-21 17:55:00,4.15,16875.0,United Kingdom
560908,23296,SET OF 6 TEA TIME BAKING CASES,16,2011-07-21 17:56:00,1.25,15827.0,United Kingdom
560908,23294,SET OF 6 SNACK LOAF BAKING CASES,16,2011-07-21 17:56:00,0.83,15827.0,United Kingdom
560908,23293,SET OF 12 FAIRY CAKE BAKING CASES,16,2011-07-21 17:56:00,0.83,15827.0,United Kingdom
560908,23295,SET OF 12 MINI LOAF BAKING CASES,16,2011-07-21 17:56:00,0.83,15827.0,United Kingdom
560908,23297,SET 40 HEART SHAPE PETIT FOUR CASES,16,2011-07-21 17:56:00,1.65,15827.0,United Kingdom
C560909,20725,LUNCH BAG RED RETROSPOT,-1,2011-07-21 17:56:00,1.65,13590.0,United Kingdom
C560909,84997C,CHILDRENS CUTLERY POLKADOT BLUE,-1,2011-07-21 17:56:00,4.15,13590.0,United Kingdom
C560910,21539,RED RETROSPOT BUTTER DISH,-1,2011-07-21 17:57:00,4.95,14733.0,United Kingdom
C560910,22461,SAVOY ART DECO CLOCK,-5,2011-07-21 17:57:00,3.95,14733.0,United Kingdom
560911,16162L,THE KING GIFT BAG,1,2011-07-21 18:00:00,0.65,17961.0,United Kingdom
560911,16168M,FUNKY MONKEY GIFT BAG MEDIUM,6,2011-07-21 18:00:00,0.42,17961.0,United Kingdom
560911,17003,BROCADE RING PURSE ,1,2011-07-21 18:00:00,0.29,17961.0,United Kingdom
560911,90081A,LILY BROOCH AMETHYST COLOUR,1,2011-07-21 18:00:00,4.95,17961.0,United Kingdom
560911,22375,AIRLINE BAG VINTAGE JET SET BROWN,1,2011-07-21 18:00:00,4.25,17961.0,United Kingdom
560911,22998,TRAVEL CARD WALLET KEEP CALM,7,2011-07-21 18:00:00,0.42,17961.0,United Kingdom
560911,85035C,ROSE 3 WICK MORRIS BOX CANDLE,2,2011-07-21 18:00:00,4.25,17961.0,United Kingdom
560911,85035A,GARDENIA 3 WICK MORRIS BOXED CANDLE,2,2011-07-21 18:00:00,4.25,17961.0,United Kingdom
560911,85035B,CHOCOLATE 3 WICK MORRIS BOX CANDLE,2,2011-07-21 18:00:00,4.25,17961.0,United Kingdom
C560912,23252,VINTAGE RED ENAMEL TRIM JUG ,-4,2011-07-21 18:05:00,3.75,14400.0,United Kingdom
560913,85035B,CHOCOLATE 3 WICK MORRIS BOX CANDLE,1,2011-07-21 18:07:00,4.25,17961.0,United Kingdom
560914,84632,DECORATIVE HANGING SHELVING UNIT,1,2011-07-21 18:08:00,59.95,17175.0,United Kingdom
560914,23118,PARISIENNE JEWELLERY DRAWER ,2,2011-07-21 18:08:00,7.5,17175.0,United Kingdom
560914,21735,TWO DOOR CURIO CABINET,2,2011-07-21 18:08:00,12.75,17175.0,United Kingdom
560914,23112,PARISIENNE CURIO CABINET,2,2011-07-21 18:08:00,7.5,17175.0,United Kingdom
560914,23245,SET OF 3 REGENCY CAKE TINS,4,2011-07-21 18:08:00,4.95,17175.0,United Kingdom
560914,23321,SMALL WHITE HEART OF WICKER,12,2011-07-21 18:08:00,1.65,17175.0,United Kingdom
560914,22423,REGENCY CAKESTAND 3 TIER,1,2011-07-21 18:08:00,12.75,17175.0,United Kingdom
560914,22762,CUPBOARD 3 DRAWER MA CAMPAGNE,1,2011-07-21 18:08:00,14.95,17175.0,United Kingdom
560914,23111,PARISIENNE SEWING BOX,1,2011-07-21 18:08:00,12.5,17175.0,United Kingdom
560914,22963,JAM JAR WITH GREEN LID,12,2011-07-21 18:08:00,0.85,17175.0,United Kingdom
560914,22962,JAM JAR WITH PINK LID,12,2011-07-21 18:08:00,0.85,17175.0,United Kingdom
