InvoiceNo,StockCode,Description,Quantity,InvoiceDate,UnitPrice,CustomerID,Country
581492,90165B,WHITE ROSEBUD  PEARL EARRINGS,1,2011-12-09 10:03:00,2.48,,United Kingdom
581492,90168,2 DAISIES HAIR COMB,1,2011-12-09 10:03:00,2.9,,United Kingdom
581492,90169,DAISY HAIR COMB,1,2011-12-09 10:03:00,2.48,,United Kingdom
581492,90170,DAISY HAIR BAND,1,2011-12-09 10:03:00,1.65,,United Kingdom
581492,90174,BUTTERFLY HAIR BAND,2,2011-12-09 10:03:00,2.48,,United Kingdom
581492,90175A,WHITE GLASS CHUNKY CHARM BRACELET,2,2011-12-09 10:03:00,9.15,,United Kingdom
581492,90175D,TIGRIS EYE CHUNKY CHARM BRACELET,1,2011-12-09 10:03:00,9.15,,United Kingdom
581492,90177A,CLASSIC DIAMANTE EARRINGS JET,1,2011-12-09 10:03:00,2.9,,United Kingdom
581492,90177C,DROP DIAMANTE EARRINGS CRYSTAL,1,2011-12-09 10:03:00,2.9,,United Kingdom
581492,90181B,AMETHYST GLASS/SHELL/PEARL NECKLACE,1,2011-12-09 10:03:00,9.15,,United Kingdom
581492,90182C,BLACK 3 BEAD DROP EARRINGS,1,2011-12-09 10:03:00,2.9,,United Kingdom
581492,90183A,AMBER DROP EARRINGS W LONG BEADS,2,2011-12-09 10:03:00,2.9,,United Kingdom
581492,90183C,BLACK DROP EARRINGS W LONG BEADS,1,2011-12-09 10:03:00,2.9,,United Kingdom
581492,90184C,BLACK CHUNKY BEAD BRACELET W STRAP,1,2011-12-09 10:03:00,9.15,,United Kingdom
581492,90185B,AMETHYST DIAMANTE EXPANDABLE RING,1,2011-12-09 10:03:00,4.15,,United Kingdom
581492,90188,DROP EARRINGS W FLOWER & LEAF,2,2011-12-09 10:03:00,2.48,,United Kingdom
581492,90191,SILVER LARIAT 40CM,2,2011-12-09 10:03:00,12.48,,United Kingdom
581492,90192,JADE DROP EARRINGS W FILIGREE,1,2011-12-09 10:03:00,4.98,,United Kingdom
581492,90198A,VINTAGE ROSE BEAD BRACELET RASPBERR,2,2011-12-09 10:03:00,4.15,,United Kingdom
581492,90200A,PURPLE SWEETHEART BRACELET,1,2011-12-09 10:03:00,4.15,,United Kingdom
581492,90201A,PURPLE ENAMEL FLOWER RING,2,2011-12-09 10:03:00,2.9,,United Kingdom
581492,90201B,BLACK ENAMEL FLOWER RING,1,2011-12-09 10:03:00,2.9,,United Kingdom
581492,90201C,RED ENAMEL FLOWER RING,1,2011-12-09 10:03:00,2.9,,United Kingdom
581492,90201D,GREEN ENAMEL FLOWER RING,1,2011-12-09 10:03:00,2.9,,United Kingdom
581492,90202C,GREEN ENAMEL FLOWER HAIR TIE,1,2011-12-09 10:03:00,2.9,,United Kingdom
581492,90202D,PINK ENAMEL FLOWER HAIR TIE,1,2011-12-09 10:03:00,2.9,,United Kingdom
581492,90206C,CRYSTAL DIAMANTE STAR BROOCH,1,2011-12-09 10:03:00,4.98,,United Kingdom
581492,90208,PAIR OF PINK FLOWER CLUSTER SLIDE,1,2011-12-09 10:03:00,2.48,,United Kingdom
581492,90210A,GREY ACRYLIC FACETED BANGLE,1,2011-12-09 10:03:00,2.9,,United Kingdom
581492,DOT,DOTCOM POSTAGE,1,2011-12-09 10:03:00,933.17,,United Kingdom
581492,22378,WALL TIDY RETROSPOT ,2,2011-12-09 10:03:00,4.13,,United Kingdom
581492,22379,RECYCLING BAG RETROSPOT ,1,2011-12-09 10:03:00,4.13,,United Kingdom
581492,22380,TOY TIDY SPACEBOY  ,2,2011-12-09 10:03:00,4.13,,United Kingdom
581492,22396,MAGNETS PACK OF 4 RETRO PHOTO,1,2011-12-09 10:03:00,2.46,,United Kingdom
581492,22411,JUMBO SHOPPER VINTAGE RED PAISLEY,1,2011-12-09 10:03:00,4.13,,United Kingdom
581492,22418,10 COLOUR SPACEBOY PEN,3,2011-12-09 10:03:00,1.63,,United Kingdom
581492,22419,LIPSTICK PEN RED,3,2011-12-09 10:03:00,0.83,,United Kingdom
581492,22420,LIPSTICK PEN BABY PINK,1,2011-12-09 10:03:00,0.83,,United Kingdom
581492,22421,LIPSTICK PEN FUSCHIA,2,2011-12-09 10:03:00,0.83,,United Kingdom
581492,22422,TOOTHPASTE TUBE PEN,4,2011-12-09 10:03:00,1.25,,United Kingdom
581492,22437,SET OF 9 BLACK SKULL BALLOONS,1,2011-12-09 10:03:00,1.63,,United Kingdom
581492,22441,GROW YOUR OWN BASIL IN ENAMEL MUG,1,2011-12-09 10:03:00,4.13,,United Kingdom
581492,22446,PIN CUSHION BABUSHKA PINK,7,2011-12-09 10:03:00,2.46,,United Kingdom
581492,22457,NATURAL SLATE HEART CHALKBOARD ,1,2011-12-09 10:03:00,5.79,,United Kingdom
581492,22464,HANGING METAL HEART LANTERN,1,2011-12-09 10:03:00,3.29,,United Kingdom
581492,22466,FAIRY TALE COTTAGE NIGHT LIGHT,1,2011-12-09 10:03:00,4.13,,United Kingdom
581492,22467,GUMBALL COAT RACK,1,2011-12-09 10:03:00,4.96,,United Kingdom
581492,22478,BIRDHOUSE GARDEN MARKER ,1,2011-12-09 10:03:00,2.46,,United Kingdom
581492,22486,PLASMATRONIC LAMP,1,2011-12-09 10:03:00,8.29,,United Kingdom
581492,22488,NATURAL SLATE RECTANGLE CHALKBOARD,1,2011-12-09 10:03:00,3.29,,United Kingdom
581492,22489,PACK OF 12 TRADITIONAL CRAYONS,5,2011-12-09 10:03:00,0.83,,United Kingdom
581492,22495,SET OF 2 ROUND TINS CAMEMBERT ,1,2011-12-09 10:03:00,5.79,,United Kingdom
581492,22540,MINI JIGSAW CIRCUS PARADE ,1,2011-12-09 10:03:00,0.83,,United Kingdom
581492,22544,MINI JIGSAW SPACEBOY,1,2011-12-09 10:03:00,0.83,,United Kingdom
581492,22549,PICTURE DOMINOES,3,2011-12-09 10:03:00,3.29,,United Kingdom
581492,22551,PLASTERS IN TIN SPACEBOY,2,2011-12-09 10:03:00,3.29,,United Kingdom
581492,22553,PLASTERS IN TIN SKULLS,2,2011-12-09 10:03:00,3.29,,United Kingdom
581492,22554,PLASTERS IN TIN WOODLAND ANIMALS,3,2011-12-09 10:03:00,3.29,,United Kingdom
581492,22555,PLASTERS IN TIN STRONGMAN,3,2011-12-09 10:03:00,3.29,,United Kingdom
581492,22557,PLASTERS IN TIN VINTAGE PAISLEY ,2,2011-12-09 10:03:00,3.29,,United Kingdom
581492,22558,CLOTHES PEGS RETROSPOT PACK 24 ,3,2011-12-09 10:03:00,3.29,,United Kingdom
581492,22560,TRADITIONAL MODELLING CLAY,5,2011-12-09 10:03:00,2.46,,United Kingdom
581492,22565,FELTCRAFT HAIRBANDS PINK AND WHITE ,4,2011-12-09 10:03:00,1.63,,United Kingdom
581492,22566,FELTCRAFT HAIRBAND PINK AND PURPLE,3,2011-12-09 10:03:00,1.63,,United Kingdom
581492,22571,ROCKING HORSE RED CHRISTMAS ,4,2011-12-09 10:03:00,1.63,,United Kingdom
581492,22573,STAR WOODEN CHRISTMAS DECORATION,2,2011-12-09 10:03:00,1.63,,United Kingdom
581492,22574,HEART WOODEN CHRISTMAS DECORATION,5,2011-12-09 10:03:00,1.63,,United Kingdom
581492,22576,SWALLOW WOODEN CHRISTMAS DECORATION,3,2011-12-09 10:03:00,1.63,,United Kingdom
581492,22577,WOODEN HEART CHRISTMAS SCANDINAVIAN,4,2011-12-09 10:03:00,0.83,,United Kingdom
581492,22578,WOODEN STAR CHRISTMAS SCANDINAVIAN,19,2011-12-09 10:03:00,0.83,,United Kingdom
581492,22580,ADVENT CALENDAR GINGHAM SACK,9,2011-12-09 10:03:00,4.13,,United Kingdom
581492,22581,WOOD STOCKING CHRISTMAS SCANDISPOT,11,2011-12-09 10:03:00,0.83,,United Kingdom
581492,22585,PACK OF 6 BIRDY GIFT TAGS,2,2011-12-09 10:03:00,2.46,,United Kingdom
581492,22586,FELTCRAFT HAIRBAND PINK AND BLUE,2,2011-12-09 10:03:00,1.63,,United Kingdom
581492,22589,CARDHOLDER GINGHAM STAR,6,2011-12-09 10:03:00,4.96,,United Kingdom
581492,22591,CARDHOLDER GINGHAM CHRISTMAS TREE,1,2011-12-09 10:03:00,6.63,,United Kingdom
581492,22592,CARDHOLDER HOLLY WREATH METAL,3,2011-12-09 10:03:00,7.46,,United Kingdom
581492,22593,CHRISTMAS GINGHAM STAR,2,2011-12-09 10:03:00,1.63,,United Kingdom
581492,22594,CHRISTMAS GINGHAM TREE,3,2011-12-09 10:03:00,1.63,,United Kingdom
581492,22597,MUSICAL ZINC HEART DECORATION ,9,2011-12-09 10:03:00,0.83,,United Kingdom
581492,22598,CHRISTMAS MUSICAL ZINC TREE,4,2011-12-09 10:03:00,0.83,,United Kingdom
581492,22599,CHRISTMAS MUSICAL ZINC STAR,5,2011-12-09 10:03:00,0.83,,United Kingdom
581492,22600,CHRISTMAS RETROSPOT STAR WOOD,2,2011-12-09 10:03:00,1.63,,United Kingdom
581492,22601,CHRISTMAS RETROSPOT ANGEL WOOD,3,2011-12-09 10:03:00,1.63,,United Kingdom
581492,22602,RETROSPOT WOODEN HEART DECORATION,3,2011-12-09 10:03:00,1.63,,United Kingdom
581492,22608,PENS ASSORTED FUNKY JEWELED ,3,2011-12-09 10:03:00,0.42,,United Kingdom
581492,22614,PACK OF 12 SPACEBOY TISSUES,1,2011-12-09 10:03:00,0.83,,United Kingdom
581492,22615,PACK OF 12 CIRCUS PARADE TISSUES ,4,2011-12-09 10:03:00,0.83,,United Kingdom
581492,22616,PACK OF 12 LONDON TISSUES ,1,2011-12-09 10:03:00,0.83,,United Kingdom
581492,22619,SET OF 6 SOLDIER SKITTLES,4,2011-12-09 10:03:00,7.46,,United Kingdom
581492,22620,4 TRADITIONAL SPINNING TOPS,3,2011-12-09 10:03:00,2.46,,United Kingdom
581492,22621,TRADITIONAL KNITTING NANCY,2,2011-12-09 10:03:00,3.29,,United Kingdom
581492,22629,SPACEBOY LUNCH BOX ,1,2011-12-09 10:03:00,4.13,,United Kingdom
581492,22630,DOLLY GIRL LUNCH BOX,1,2011-12-09 10:03:00,4.13,,United Kingdom
581492,22632,HAND WARMER RED RETROSPOT,1,2011-12-09 10:03:00,4.13,,United Kingdom
581492,22633,HAND WARMER UNION JACK,1,2011-12-09 10:03:00,4.13,,United Kingdom
581492,22634,CHILDS BREAKFAST SET SPACEBOY ,1,2011-12-09 10:03:00,19.96,,United Kingdom
581492,22650,CERAMIC PIRATE CHEST MONEY BANK,2,2011-12-09 10:03:00,3.29,,United Kingdom
581492,22651,GENTLEMAN SHIRT REPAIR KIT ,1,2011-12-09 10:03:00,1.63,,United Kingdom
581492,22653,BUTTON BOX ,16,2011-12-09 10:03:00,1.63,,United Kingdom
581492,22654,DELUXE SEWING KIT ,2,2011-12-09 10:03:00,12.46,,United Kingdom
581492,22659,LUNCH BOX I LOVE LONDON,1,2011-12-09 10:03:00,4.13,,United Kingdom
581492,22662,LUNCH BAG DOLLY GIRL DESIGN,1,2011-12-09 10:03:00,4.13,,United Kingdom
581492,22666,RECIPE BOX PANTRY YELLOW DESIGN,5,2011-12-09 10:03:00,5.79,,United Kingdom
581492,22693,GROW A FLYTRAP OR SUNFLOWER IN TIN,3,2011-12-09 10:03:00,2.5,,United Kingdom
581492,22694,WICKER STAR ,1,2011-12-09 10:03:00,4.13,,United Kingdom
581492,22697,GREEN REGENCY TEACUP AND SAUCER,1,2011-12-09 10:03:00,5.79,,United Kingdom
581492,22699,ROSES REGENCY TEACUP AND SAUCER ,2,2011-12-09 10:03:00,5.79,,United Kingdom
581492,22701,PINK DOG BOWL,5,2011-12-09 10:03:00,2.46,,United Kingdom
581492,22703,PINK CAT BOWL,6,2011-12-09 10:03:00,1.63,,United Kingdom
581492,22712,CARD DOLLY GIRL ,1,2011-12-09 10:03:00,0.83,,United Kingdom
581492,22713,CARD I LOVE LONDON ,1,2011-12-09 10:03:00,0.83,,United Kingdom
581492,22714,CARD BIRTHDAY COWBOY,2,2011-12-09 10:03:00,0.83,,United Kingdom
581492,22716,CARD CIRCUS PARADE,3,2011-12-09 10:03:00,0.83,,United Kingdom
581492,22717,CARD DOG AND BALL ,1,2011-12-09 10:03:00,0.83,,United Kingdom
581492,22720,SET OF 3 CAKE TINS PANTRY DESIGN ,2,2011-12-09 10:03:00,10.79,,United Kingdom
581492,22725,ALARM CLOCK BAKELIKE CHOCOLATE,1,2011-12-09 10:03:00,7.46,,United Kingdom
581492,22726,ALARM CLOCK BAKELIKE GREEN,4,2011-12-09 10:03:00,7.46,,United Kingdom
581492,22727,ALARM CLOCK BAKELIKE RED ,4,2011-12-09 10:03:00,7.46,,United Kingdom
581492,22730,ALARM CLOCK BAKELIKE IVORY,1,2011-12-09 10:03:00,7.46,,United Kingdom
581492,22741,FUNKY DIVA PEN,4,2011-12-09 10:03:00,1.63,,United Kingdom
581492,22745,POPPY'S PLAYHOUSE BEDROOM ,2,2011-12-09 10:03:00,4.13,,United Kingdom
581492,22748,POPPY'S PLAYHOUSE KITCHEN,1,2011-12-09 10:03:00,4.13,,United Kingdom
581492,22749,FELTCRAFT PRINCESS CHARLOTTE DOLL,1,2011-12-09 10:03:00,7.46,,United Kingdom
581492,22751,FELTCRAFT PRINCESS OLIVIA DOLL,2,2011-12-09 10:03:00,7.46,,United Kingdom
581492,22753,SMALL YELLOW BABUSHKA NOTEBOOK ,1,2011-12-09 10:03:00,1.63,,United Kingdom
581492,22754,SMALL RED BABUSHKA NOTEBOOK ,1,2011-12-09 10:03:00,1.63,,United Kingdom
581492,22757,LARGE RED BABUSHKA NOTEBOOK ,3,2011-12-09 10:03:00,2.46,,United Kingdom
581492,22758,LARGE PURPLE BABUSHKA NOTEBOOK  ,2,2011-12-09 10:03:00,2.46,,United Kingdom
581492,22763,KEY CABINET MA CAMPAGNE,1,2011-12-09 10:03:00,19.96,,United Kingdom
581492,22768,FAMILY PHOTO FRAME CORNICE,2,2011-12-09 10:03:00,19.96,,United Kingdom
581492,22776,SWEETHEART 3 TIER CAKE STAND ,1,2011-12-09 10:03:00,19.96,,United Kingdom
581492,22795,SWEETHEART RECIPE BOOK STAND,1,2011-12-09 10:03:00,13.29,,United Kingdom
581492,22798,ANTIQUE GLASS DRESSING TABLE POT,3,2011-12-09 10:03:00,5.79,,United Kingdom
581492,22800,ANTIQUE TALL SWIRLGLASS TRINKET POT,3,2011-12-09 10:03:00,7.46,,United Kingdom
581492,22809,SET OF 6 T-LIGHTS SANTA,1,2011-12-09 10:03:00,5.79,,United Kingdom
581492,22811,SET OF 6 T-LIGHTS CACTI ,1,2011-12-09 10:03:00,5.79,,United Kingdom
581492,22814,CARD PARTY GAMES ,9,2011-12-09 10:03:00,0.42,,United Kingdom
581492,22815,CARD PSYCHEDELIC APPLES,18,2011-12-09 10:03:00,0.42,,United Kingdom
581492,22816,CARD MOTORBIKE SANTA,2,2011-12-09 10:03:00,0.42,,United Kingdom
581492,22817,CARD SUKI BIRTHDAY,5,2011-12-09 10:03:00,0.42,,United Kingdom
581492,22818,CARD CHRISTMAS VILLAGE,6,2011-12-09 10:03:00,0.42,,United Kingdom
581492,22819,"BIRTHDAY CARD, RETRO SPOT",3,2011-12-09 10:03:00,0.42,,United Kingdom
581492,22821,GIFT BAG PSYCHEDELIC APPLES,3,2011-12-09 10:03:00,0.83,,United Kingdom
581492,22835,HOT WATER BOTTLE I AM SO POORLY,3,2011-12-09 10:03:00,10.79,,United Kingdom
581492,22865,HAND WARMER OWL DESIGN,2,2011-12-09 10:03:00,4.13,,United Kingdom
581492,22866,HAND WARMER SCOTTY DOG DESIGN,3,2011-12-09 10:03:00,4.13,,United Kingdom
581492,22867,HAND WARMER BIRD DESIGN,4,2011-12-09 10:03:00,4.13,,United Kingdom
581492,22881,NUMBER TILE VINTAGE FONT 2,1,2011-12-09 10:03:00,4.13,,United Kingdom
581492,22885,NUMBER TILE VINTAGE FONT 6 ,1,2011-12-09 10:03:00,4.13,,United Kingdom
581492,22888,NUMBER TILE VINTAGE FONT 9 ,1,2011-12-09 10:03:00,4.13,,United Kingdom
581492,22890,NOVELTY BISCUITS CAKE STAND 3 TIER,1,2011-12-09 10:03:00,19.96,,United Kingdom
581492,22898,CHILDRENS APRON APPLES DESIGN,1,2011-12-09 10:03:00,4.13,,United Kingdom
581492,22899,CHILDREN'S APRON DOLLY GIRL ,2,2011-12-09 10:03:00,4.13,,United Kingdom
581492,22900,SET 2 TEA TOWELS I LOVE LONDON ,3,2011-12-09 10:03:00,6.63,,United Kingdom
581492,22905,CALENDAR IN SEASON DESIGN,1,2011-12-09 10:03:00,2.46,,United Kingdom
581492,22907,PACK OF 20 NAPKINS PANTRY DESIGN,1,2011-12-09 10:03:00,1.63,,United Kingdom
581492,22909,SET OF 20 VINTAGE CHRISTMAS NAPKINS,5,2011-12-09 10:03:00,1.63,,United Kingdom
581492,22910,PAPER CHAIN KIT VINTAGE CHRISTMAS,7,2011-12-09 10:03:00,5.79,,United Kingdom
581492,22914,BLUE COAT RACK PARIS FASHION,1,2011-12-09 10:03:00,10.79,,United Kingdom
581492,22922,FRIDGE MAGNETS US DINER ASSORTED,6,2011-12-09 10:03:00,1.8,,United Kingdom
581492,22924,FRIDGE MAGNETS LA VIE EN ROSE,6,2011-12-09 10:03:00,1.8,,United Kingdom
581492,22928,YELLOW GIANT GARDEN THERMOMETER,1,2011-12-09 10:03:00,12.46,,United Kingdom
581492,22940,FELTCRAFT CHRISTMAS FAIRY,1,2011-12-09 10:03:00,8.29,,United Kingdom
581492,22941,CHRISTMAS LIGHTS 10 REINDEER,2,2011-12-09 10:03:00,16.63,,United Kingdom
581492,22943,CHRISTMAS LIGHTS 10 VINTAGE BAUBLES,1,2011-12-09 10:03:00,10.79,,United Kingdom
581492,22948,METAL DECORATION NAUGHTY CHILDREN ,4,2011-12-09 10:03:00,1.66,,United Kingdom
581492,22951,60 CAKE CASES DOLLY GIRL DESIGN,2,2011-12-09 10:03:00,1.25,,United Kingdom
581492,22952,60 CAKE CASES VINTAGE CHRISTMAS,2,2011-12-09 10:03:00,1.25,,United Kingdom
581492,22955,36 FOIL STAR CAKE CASES ,1,2011-12-09 10:03:00,4.13,,United Kingdom
581492,22960,JAM MAKING SET WITH JARS,2,2011-12-09 10:03:00,8.29,,United Kingdom
581492,22961,JAM MAKING SET PRINTED,9,2011-12-09 10:03:00,3.29,,United Kingdom
581492,22962,JAM JAR WITH PINK LID,3,2011-12-09 10:03:00,1.63,,United Kingdom
581492,22963,JAM JAR WITH GREEN LID,3,2011-12-09 10:03:00,1.63,,United Kingdom
581492,22964,3 PIECE SPACEBOY COOKIE CUTTER SET,1,2011-12-09 10:03:00,4.13,,United Kingdom
581492,22965,3 TRADITIONAl BISCUIT CUTTERS  SET,1,2011-12-09 10:03:00,4.13,,United Kingdom
581492,22966,GINGERBREAD MAN COOKIE CUTTER,4,2011-12-09 10:03:00,2.46,,United Kingdom
581492,22969,HOMEMADE JAM SCENTED CANDLES,6,2011-12-09 10:03:00,3.29,,United Kingdom
581492,22975,SPACEBOY CHILDRENS EGG CUP,2,2011-12-09 10:03:00,2.46,,United Kingdom
581492,22976,CIRCUS PARADE CHILDRENS EGG CUP ,1,2011-12-09 10:03:00,2.46,,United Kingdom
581492,22977,DOLLY GIRL CHILDRENS EGG CUP,1,2011-12-09 10:03:00,2.46,,United Kingdom
581492,22979,PANTRY WASHING UP BRUSH,2,2011-12-09 10:03:00,3.29,,United Kingdom
581492,22980,PANTRY SCRUBBING BRUSH,1,2011-12-09 10:03:00,3.29,,United Kingdom
581492,22982,PANTRY PASTRY BRUSH,3,2011-12-09 10:03:00,2.46,,United Kingdom
581492,22983,CARD BILLBOARD FONT,1,2011-12-09 10:03:00,0.83,,United Kingdom
581492,22984,CARD GINGHAM ROSE ,1,2011-12-09 10:03:00,0.83,,United Kingdom
581492,22988,SOLDIERS EGG CUP ,1,2011-12-09 10:03:00,2.46,,United Kingdom
581492,22989,SET 2 PANTRY DESIGN TEA TOWELS,2,2011-12-09 10:03:00,6.63,,United Kingdom
581492,22992,REVOLVER WOODEN RULER ,3,2011-12-09 10:03:00,4.13,,United Kingdom
581492,22993,SET OF 4 PANTRY JELLY MOULDS,3,2011-12-09 10:03:00,2.46,,United Kingdom
581492,22995,TRAVEL CARD WALLET SUKI,4,2011-12-09 10:03:00,0.83,,United Kingdom
581492,22996,TRAVEL CARD WALLET VINTAGE TICKET,5,2011-12-09 10:03:00,0.83,,United Kingdom
581492,22997,TRAVEL CARD WALLET UNION JACK,1,2011-12-09 10:03:00,0.83,,United Kingdom
581492,22998,TRAVEL CARD WALLET KEEP CALM,4,2011-12-09 10:03:00,0.83,,United Kingdom
581492,22999,TRAVEL CARD WALLET VINTAGE LEAF,1,2011-12-09 10:03:00,0.83,,United Kingdom
581492,23005,TRAVEL CARD WALLET I LOVE LONDON,4,2011-12-09 10:03:00,0.83,,United Kingdom
581492,23007, SPACEBOY BABY GIFT SET,1,2011-12-09 10:03:00,10.79,,United Kingdom
581492,23009,I LOVE LONDON BABY GIFT SET,2,2011-12-09 10:03:00,10.79,,United Kingdom
581492,23012,GLASS APOTHECARY BOTTLE PERFUME,1,2011-12-09 10:03:00,8.29,,United Kingdom
581492,23013,GLASS APOTHECARY BOTTLE TONIC,2,2011-12-09 10:03:00,8.29,,United Kingdom
581492,23014,GLASS APOTHECARY BOTTLE ELIXIR,1,2011-12-09 10:03:00,8.29,,United Kingdom
581492,23050,RECYCLED ACAPULCO MAT GREEN,1,2011-12-09 10:03:00,16.63,,United Kingdom
581492,23051,RECYCLED ACAPULCO MAT BLUE,1,2011-12-09 10:03:00,16.63,,United Kingdom
581492,23052,RECYCLED ACAPULCO MAT TURQUOISE,5,2011-12-09 10:03:00,16.63,,United Kingdom
581492,23053,RECYCLED ACAPULCO MAT PINK,1,2011-12-09 10:03:00,16.63,,United Kingdom
581492,23054,RECYCLED ACAPULCO MAT LAVENDER,1,2011-12-09 10:03:00,16.63,,United Kingdom
581492,23074,EMBOSSED HEART TRINKET BOX,1,2011-12-09 10:03:00,4.13,,United Kingdom
581492,23076,ICE CREAM SUNDAE LIP GLOSS,3,2011-12-09 10:03:00,2.46,,United Kingdom
581492,23077,DOUGHNUT LIP GLOSS ,3,2011-12-09 10:03:00,2.46,,United Kingdom
581492,23082,SET 6 PAPER TABLE LANTERN HEARTS ,1,2011-12-09 10:03:00,7.46,,United Kingdom
581492,23083,SET 6 PAPER TABLE LANTERN STARS ,1,2011-12-09 10:03:00,7.46,,United Kingdom
581492,23084,RABBIT NIGHT LIGHT,57,2011-12-09 10:03:00,4.13,,United Kingdom
581492,23088,ZINC HEART FLOWER T-LIGHT HOLDER,1,2011-12-09 10:03:00,2.46,,United Kingdom
581492,23089,GLASS BON BON JAR,4,2011-12-09 10:03:00,3.29,,United Kingdom
581492,23093,SMALL PARISIENNE HEART PHOTO FRAME ,3,2011-12-09 10:03:00,4.96,,United Kingdom
581492,23103,JINGLE BELL HEART DECORATION,2,2011-12-09 10:03:00,3.29,,United Kingdom
581492,23110,PARISIENNE KEY CABINET ,1,2011-12-09 10:03:00,12.46,,United Kingdom
581492,23111,PARISIENNE SEWING BOX,1,2011-12-09 10:03:00,24.96,,United Kingdom
581492,23112,PARISIENNE CURIO CABINET,1,2011-12-09 10:03:00,14.96,,United Kingdom
581492,23118,PARISIENNE JEWELLERY DRAWER ,1,2011-12-09 10:03:00,14.96,,United Kingdom
581492,23158,SET OF 5 LUCKY CAT MAGNETS ,1,2011-12-09 10:03:00,4.13,,United Kingdom
581492,23165,LARGE CERAMIC TOP STORAGE JAR,2,2011-12-09 10:03:00,3.29,,United Kingdom
581492,23166,MEDIUM CERAMIC TOP STORAGE JAR,2,2011-12-09 10:03:00,2.46,,United Kingdom
581492,23168,CLASSIC CAFE SUGAR DISPENSER,2,2011-12-09 10:03:00,2.46,,United Kingdom
581492,23171,REGENCY TEA PLATE GREEN ,1,2011-12-09 10:03:00,3.29,,United Kingdom
581492,23172,REGENCY TEA PLATE PINK,1,2011-12-09 10:03:00,3.29,,United Kingdom
581492,23173,REGENCY TEAPOT ROSES ,1,2011-12-09 10:03:00,19.96,,United Kingdom
581492,23175,REGENCY MILK JUG PINK ,1,2011-12-09 10:03:00,7.46,,United Kingdom
581492,23177,TREASURE ISLAND BOOK BOX,1,2011-12-09 10:03:00,4.58,,United Kingdom
581492,23183,MOTHER'S KITCHEN SPOON REST ,3,2011-12-09 10:03:00,7.46,,United Kingdom
581492,23184,BULL DOG BOTTLE OPENER,2,2011-12-09 10:03:00,10.79,,United Kingdom
581492,23188,VINTAGE  2 METRE FOLDING RULER,1,2011-12-09 10:03:00,3.29,,United Kingdom
581492,23191,BUNDLE OF 3 RETRO NOTE BOOKS,1,2011-12-09 10:03:00,3.29,,United Kingdom
581492,23194,GYMKHANA TREASURE BOOK BOX,1,2011-12-09 10:03:00,4.58,,United Kingdom
581492,23196,VINTAGE LEAF MAGNETIC NOTEPAD,1,2011-12-09 10:03:00,3.29,,United Kingdom
581492,23197,SKETCHBOOK MAGNETIC SHOPPING LIST,2,2011-12-09 10:03:00,3.29,,United Kingdom
581492,23198,PANTRY MAGNETIC  SHOPPING LIST,2,2011-12-09 10:03:00,3.29,,United Kingdom
581492,23199,JUMBO BAG APPLES,2,2011-12-09 10:03:00,4.13,,United Kingdom
581492,23200,JUMBO BAG PEARS,1,2011-12-09 10:03:00,4.13,,United Kingdom
581492,23202,JUMBO BAG VINTAGE LEAF,2,2011-12-09 10:03:00,4.13,,United Kingdom
581492,23204,CHARLOTTE BAG APPLES DESIGN,6,2011-12-09 10:03:00,1.63,,United Kingdom
581492,23205,CHARLOTTE BAG VINTAGE ALPHABET ,3,2011-12-09 10:03:00,1.63,,United Kingdom
581492,23206,LUNCH BAG APPLE DESIGN,3,2011-12-09 10:03:00,4.13,,United Kingdom
581492,23208,LUNCH BAG VINTAGE LEAF DESIGN,3,2011-12-09 10:03:00,4.13,,United Kingdom
581492,23212,HEART WREATH DECORATION WITH BELL,7,2011-12-09 10:03:00,2.46,,United Kingdom
581492,23213,STAR WREATH DECORATION WITH BELL,7,2011-12-09 10:03:00,2.46,,United Kingdom
581492,23220,REINDEER HEART DECORATION GOLD,2,2011-12-09 10:03:00,1.63,,United Kingdom
581492,23224,CHERUB HEART DECORATION GOLD,1,2011-12-09 10:03:00,1.63,,United Kingdom
581492,23229,VINTAGE DONKEY TAIL GAME ,2,2011-12-09 10:03:00,7.46,,United Kingdom
581492,23234,BISCUIT TIN VINTAGE CHRISTMAS,4,2011-12-09 10:03:00,5.79,,United Kingdom
581492,23241,TREASURE TIN GYMKHANA DESIGN,3,2011-12-09 10:03:00,4.13,,United Kingdom
581492,23243,SET OF TEA COFFEE SUGAR TINS PANTRY,1,2011-12-09 10:03:00,10.79,,United Kingdom
581492,23245,SET OF 3 REGENCY CAKE TINS,7,2011-12-09 10:03:00,10.79,,United Kingdom
581492,23247,BISCUIT TIN 50'S CHRISTMAS,3,2011-12-09 10:03:00,5.79,,United Kingdom
581492,23264,SET OF 3 WOODEN SLEIGH DECORATIONS,3,2011-12-09 10:03:00,2.46,,United Kingdom
581492,23265,SET OF 3 WOODEN TREE DECORATIONS,3,2011-12-09 10:03:00,2.46,,United Kingdom
581492,23266,SET OF 3 WOODEN STOCKING DECORATION,2,2011-12-09 10:03:00,2.46,,United Kingdom
581492,23274,STAR T-LIGHT HOLDER WILLIE WINKIE,3,2011-12-09 10:03:00,3.29,,United Kingdom
581492,23275,SET OF 3 HANGING OWLS OLLIE BEAK,2,2011-12-09 10:03:00,2.46,,United Kingdom
581492,23280,FOLDING BUTTERFLY MIRROR HOT PINK ,2,2011-12-09 10:03:00,2.46,,United Kingdom
581492,23284,DOORMAT KEEP CALM AND COME IN,1,2011-12-09 10:03:00,15.79,,United Kingdom
581492,23285,PINK VINTAGE SPOT BEAKER,1,2011-12-09 10:03:00,1.63,,United Kingdom
581492,23287,RED VINTAGE SPOT BEAKER,1,2011-12-09 10:03:00,1.63,,United Kingdom
581492,23290,SPACEBOY CHILDRENS BOWL,1,2011-12-09 10:03:00,2.46,,United Kingdom
581492,23292,SPACEBOY CHILDRENS CUP,1,2011-12-09 10:03:00,2.46,,United Kingdom
581492,23293,SET OF 12 FAIRY CAKE BAKING CASES,3,2011-12-09 10:03:00,2.46,,United Kingdom
581492,23294,SET OF 6 SNACK LOAF BAKING CASES,1,2011-12-09 10:03:00,2.46,,United Kingdom
581492,23295,SET OF 12 MINI LOAF BAKING CASES,4,2011-12-09 10:03:00,2.46,,United Kingdom
581492,23298,SPOTTY BUNTING,2,2011-12-09 10:03:00,10.79,,United Kingdom
581492,23299,FOOD COVER WITH BEADS SET 2 ,1,2011-12-09 10:03:00,7.46,,United Kingdom
581492,23300,GARDENERS KNEELING PAD CUP OF TEA ,3,2011-12-09 10:03:00,3.29,,United Kingdom
581492,23301,GARDENERS KNEELING PAD KEEP CALM ,6,2011-12-09 10:03:00,3.29,,United Kingdom
581492,23307,SET OF 60 PANTRY DESIGN CAKE CASES ,7,2011-12-09 10:03:00,1.25,,United Kingdom
581492,23308,SET OF 60 VINTAGE LEAF CAKE CASES ,1,2011-12-09 10:03:00,1.25,,United Kingdom
581492,23309,SET OF 60 I LOVE LONDON CAKE CASES ,2,2011-12-09 10:03:00,1.25,,United Kingdom
581492,23310,BUBBLEGUM RING ASSORTED,4,2011-12-09 10:03:00,0.83,,United Kingdom
581492,23311,VINTAGE CHRISTMAS STOCKING ,1,2011-12-09 10:03:00,4.96,,United Kingdom
581492,23312,VINTAGE CHRISTMAS GIFT SACK,6,2011-12-09 10:03:00,8.29,,United Kingdom
581492,23313,VINTAGE CHRISTMAS BUNTING,4,2011-12-09 10:03:00,10.79,,United Kingdom
581492,23314,VINTAGE CHRISTMAS TABLECLOTH,1,2011-12-09 10:03:00,24.96,,United Kingdom
581492,23319,BOX OF 6 MINI 50'S CRACKERS,3,2011-12-09 10:03:00,4.96,,United Kingdom
581492,23322,LARGE WHITE HEART OF WICKER,1,2011-12-09 10:03:00,5.79,,United Kingdom
581492,23323,WHITE WICKER STAR ,6,2011-12-09 10:03:00,4.13,,United Kingdom
581492,23328,SET 6 SCHOOL MILK BOTTLES IN CRATE,5,2011-12-09 10:03:00,7.46,,United Kingdom
581492,23332,IVORY WICKER HEART LARGE,1,2011-12-09 10:03:00,3.29,,United Kingdom
581492,23334,IVORY WICKER HEART SMALL,1,2011-12-09 10:03:00,1.25,,United Kingdom
581492,23336,EGG FRYING PAN PINK ,1,2011-12-09 10:03:00,4.13,,United Kingdom
581492,23340,VINTAGE CHRISTMAS CAKE FRILL,3,2011-12-09 10:03:00,3.29,,United Kingdom
581492,23343,JUMBO BAG VINTAGE CHRISTMAS ,4,2011-12-09 10:03:00,4.13,,United Kingdom
581492,23344,JUMBO BAG 50'S CHRISTMAS ,5,2011-12-09 10:03:00,4.13,,United Kingdom
581492,23345, DOLLY GIRL BEAKER,1,2011-12-09 10:03:00,2.46,,United Kingdom
581492,23347,I LOVE LONDON BEAKER,1,2011-12-09 10:03:00,2.46,,United Kingdom
581492,23349,ROLL WRAP VINTAGE CHRISTMAS,2,2011-12-09 10:03:00,2.46,,United Kingdom
581492,23351,ROLL WRAP 50'S CHRISTMAS,5,2011-12-09 10:03:00,2.46,,United Kingdom
581492,23352,ROLL WRAP 50'S RED CHRISTMAS ,1,2011-12-09 10:03:00,2.46,,United Kingdom
581492,23353,6 GIFT TAGS VINTAGE CHRISTMAS ,3,2011-12-09 10:03:00,1.63,,United Kingdom
581492,23354,6 GIFT TAGS 50'S CHRISTMAS ,4,2011-12-09 10:03:00,1.63,,United Kingdom
581492,23357,HOT WATER BOTTLE SEX BOMB,1,2011-12-09 10:03:00,10.79,,United Kingdom
581492,23358,HOT STUFF HOT WATER BOTTLE,1,2011-12-09 10:03:00,7.46,,United Kingdom
581492,23365,SET 12 COLOUR PENCILS LOVE LONDON,1,2011-12-09 10:03:00,1.25,,United Kingdom
581492,23366,SET 12 COLOURING PENCILS DOILY,5,2011-12-09 10:03:00,1.25,,United Kingdom
581492,23367,SET 12 COLOUR PENCILS SPACEBOY ,10,2011-12-09 10:03:00,1.25,,United Kingdom
581492,23368,SET 12 COLOUR PENCILS DOLLY GIRL ,2,2011-12-09 10:03:00,1.25,,United Kingdom
581493,79190B,RETRO PLASTIC POLKA TRAY,15,2011-12-09 10:10:00,0.42,12423.0,Belgium
581493,79190A,RETRO PLASTIC 70'S TRAY,15,2011-12-09 10:10:00,0.42,12423.0,Belgium
581493,22915,ASSORTED BOTTLE TOP  MAGNETS ,12,2011-12-09 10:10:00,0.42,12423.0,Belgium
581493,22151,PLACE SETTING WHITE HEART,24,2011-12-09 10:10:00,0.42,12423.0,Belgium
581493,22632,HAND WARMER RED RETROSPOT,12,2011-12-09 10:10:00,2.1,12423.0,Belgium
