InvoiceNo,StockCode,Description,Quantity,InvoiceDate,UnitPrice,CustomerID,Country
561033,22470,HEART OF WICKER LARGE,6,2011-07-24 11:40:00,2.95,14443.0,United Kingdom
561033,22469,HEART OF WICKER SMALL,12,2011-07-24 11:40:00,1.65,14443.0,United Kingdom
561033,84879,ASSORTED COLOUR BIRD ORNAMENT,8,2011-07-24 11:40:00,1.69,14443.0,United Kingdom
561033,23109,PACK OF SIX LED TEA LIGHTS,6,2011-07-24 11:40:00,2.89,14443.0,United Kingdom
561033,22431,WATERING CAN BLUE ELEPHANT,6,2011-07-24 11:40:00,1.95,14443.0,United Kingdom
561033,22138,BAKING SET 9 PIECE RETROSPOT ,3,2011-07-24 11:40:00,4.95,14443.0,United Kingdom
561033,22619,SET OF 6 SOLDIER SKITTLES,4,2011-07-24 11:40:00,3.75,14443.0,United Kingdom
561033,22139,RETROSPOT TEA SET CERAMIC 11 PC ,3,2011-07-24 11:40:00,4.95,14443.0,United Kingdom
561033,84077,WORLD WAR 2 GLIDERS ASSTD DESIGNS,48,2011-07-24 11:40:00,0.29,14443.0,United Kingdom
561034,48111,DOORMAT 3 SMILEY CATS,1,2011-07-24 11:45:00,7.95,15506.0,United Kingdom
561034,22692,DOORMAT WELCOME TO OUR HOME,1,2011-07-24 11:45:00,7.95,15506.0,United Kingdom
561034,22660,DOORMAT I LOVE LONDON,1,2011-07-24 11:45:00,7.95,15506.0,United Kingdom
561034,22366,DOORMAT AIRMAIL ,1,2011-07-24 11:45:00,7.95,15506.0,United Kingdom
561034,48129,DOORMAT TOPIARY,1,2011-07-24 11:45:00,7.95,15506.0,United Kingdom
561034,22422,TOOTHPASTE TUBE PEN,6,2011-07-24 11:45:00,0.65,15506.0,United Kingdom
561034,21908,CHOCOLATE THIS WAY METAL SIGN,2,2011-07-24 11:45:00,2.1,15506.0,United Kingdom
561034,21908,CHOCOLATE THIS WAY METAL SIGN,3,2011-07-24 11:45:00,2.1,15506.0,United Kingdom
561034,21770,OPEN CLOSED METAL SIGN,2,2011-07-24 11:45:00,4.95,15506.0,United Kingdom
561034,21174,POTTERING IN THE SHED METAL SIGN,1,2011-07-24 11:45:00,2.08,15506.0,United Kingdom
561034,21907,I'M ON HOLIDAY METAL SIGN,2,2011-07-24 11:45:00,2.1,15506.0,United Kingdom
561034,22412,METAL SIGN NEIGHBOURHOOD WITCH ,2,2011-07-24 11:45:00,2.1,15506.0,United Kingdom
561034,21903,MAN FLU METAL SIGN,2,2011-07-24 11:45:00,2.1,15506.0,United Kingdom
561034,21174,POTTERING IN THE SHED METAL SIGN,2,2011-07-24 11:45:00,2.08,15506.0,United Kingdom
561034,22115,METAL SIGN EMPIRE TEA,3,2011-07-24 11:45:00,0.79,15506.0,United Kingdom
561034,22413,METAL SIGN TAKE IT OR LEAVE IT ,2,2011-07-24 11:45:00,2.95,15506.0,United Kingdom
561034,82600,NO SINGING METAL SIGN,1,2011-07-24 11:45:00,2.1,15506.0,United Kingdom
561034,85152,HAND OVER THE CHOCOLATE   SIGN ,1,2011-07-24 11:45:00,2.1,15506.0,United Kingdom
561034,82582,AREA PATROLLED METAL SIGN,3,2011-07-24 11:45:00,2.1,15506.0,United Kingdom
561034,21175,GIN + TONIC DIET METAL SIGN,4,2011-07-24 11:45:00,2.55,15506.0,United Kingdom
561034,82567,"AIRLINE LOUNGE,METAL SIGN",3,2011-07-24 11:45:00,2.1,15506.0,United Kingdom
561034,22924,FRIDGE MAGNETS LA VIE EN ROSE,6,2011-07-24 11:45:00,0.85,15506.0,United Kingdom
561034,21900,"KEY FOB , SHED",2,2011-07-24 11:45:00,0.65,15506.0,United Kingdom
561034,21899,GARAGE KEY FOB,4,2011-07-24 11:45:00,0.65,15506.0,United Kingdom
561034,21902,"KEY FOB , FRONT  DOOR ",3,2011-07-24 11:45:00,0.65,15506.0,United Kingdom
561034,21901,"KEY FOB , BACK DOOR ",2,2011-07-24 11:45:00,0.65,15506.0,United Kingdom
561034,84929,ASSTD FRUIT+FLOWERS FRIDGE MAGNETS,12,2011-07-24 11:45:00,0.19,15506.0,United Kingdom
561034,22923,FRIDGE MAGNETS LES ENFANTS ASSORTED,12,2011-07-24 11:45:00,0.85,15506.0,United Kingdom
561034,22631,CIRCUS PARADE LUNCH BOX ,2,2011-07-24 11:45:00,1.95,15506.0,United Kingdom
561034,22553,PLASTERS IN TIN SKULLS,1,2011-07-24 11:45:00,1.65,15506.0,United Kingdom
561034,21967,PACK OF 12 SKULL TISSUES,4,2011-07-24 11:45:00,0.29,15506.0,United Kingdom
561034,21982,PACK OF 12 SUKI TISSUES ,1,2011-07-24 11:45:00,0.29,15506.0,United Kingdom
561034,22615,PACK OF 12 CIRCUS PARADE TISSUES ,2,2011-07-24 11:45:00,0.29,15506.0,United Kingdom
561034,22616,PACK OF 12 LONDON TISSUES ,4,2011-07-24 11:45:00,0.29,15506.0,United Kingdom
561034,21982,PACK OF 12 SUKI TISSUES ,2,2011-07-24 11:45:00,0.29,15506.0,United Kingdom
561034,22659,LUNCH BOX I LOVE LONDON,4,2011-07-24 11:45:00,1.95,15506.0,United Kingdom
561034,22553,PLASTERS IN TIN SKULLS,7,2011-07-24 11:45:00,1.65,15506.0,United Kingdom
561034,22616,PACK OF 12 LONDON TISSUES ,2,2011-07-24 11:45:00,0.29,15506.0,United Kingdom
561034,22615,PACK OF 12 CIRCUS PARADE TISSUES ,2,2011-07-24 11:45:00,0.29,15506.0,United Kingdom
561034,22616,PACK OF 12 LONDON TISSUES ,1,2011-07-24 11:45:00,0.29,15506.0,United Kingdom
561034,22371,AIRLINE BAG VINTAGE TOKYO 78,3,2011-07-24 11:45:00,4.25,15506.0,United Kingdom
561034,22456,NATURAL SLATE CHALKBOARD LARGE ,1,2011-07-24 11:45:00,4.95,15506.0,United Kingdom
561034,85099F,JUMBO BAG STRAWBERRY,1,2011-07-24 11:45:00,2.08,15506.0,United Kingdom
561034,23201,JUMBO BAG ALPHABET,1,2011-07-24 11:45:00,2.08,15506.0,United Kingdom
561034,20713,JUMBO BAG OWLS,1,2011-07-24 11:45:00,2.08,15506.0,United Kingdom
561034,22381,TOY TIDY PINK POLKADOT,1,2011-07-24 11:45:00,2.1,15506.0,United Kingdom
561034,22386,JUMBO BAG PINK POLKADOT,1,2011-07-24 11:45:00,2.08,15506.0,United Kingdom
561034,22995,TRAVEL CARD WALLET SUKI,3,2011-07-24 11:45:00,0.42,15506.0,United Kingdom
561034,22996,TRAVEL CARD WALLET VINTAGE TICKET,2,2011-07-24 11:45:00,0.42,15506.0,United Kingdom
561034,22996,TRAVEL CARD WALLET VINTAGE TICKET,3,2011-07-24 11:45:00,0.42,15506.0,United Kingdom
561034,23000,TRAVEL CARD WALLET TRANSPORT,3,2011-07-24 11:45:00,0.42,15506.0,United Kingdom
561034,23005,TRAVEL CARD WALLET I LOVE LONDON,3,2011-07-24 11:45:00,0.42,15506.0,United Kingdom
561034,20992,JAZZ HEARTS PURSE NOTEBOOK,6,2011-07-24 11:45:00,0.39,15506.0,United Kingdom
561035,21694,SMALL REGAL  SILVER CANDLEPOT ,96,2011-07-24 11:52:00,2.55,17312.0,United Kingdom
561036,85202,HANGING WOOD AND FELT HEART,1,2011-07-24 11:54:00,0.42,13137.0,United Kingdom
561036,85203,HANGING WOOD AND FELT BUTTERFLY ,1,2011-07-24 11:54:00,0.42,13137.0,United Kingdom
561036,85204,HANGING WOOD AND FELT FLOWER,1,2011-07-24 11:54:00,0.12,13137.0,United Kingdom
561036,23240,SET OF 4 KNICK KNACK TINS DOILEY ,2,2011-07-24 11:54:00,4.15,13137.0,United Kingdom
561036,21902,"KEY FOB , FRONT  DOOR ",1,2011-07-24 11:54:00,0.65,13137.0,United Kingdom
561036,82552,WASHROOM METAL SIGN,1,2011-07-24 11:54:00,1.45,13137.0,United Kingdom
561036,21172,PARTY METAL SIGN ,1,2011-07-24 11:54:00,1.45,13137.0,United Kingdom
561036,23238,SET OF 4 KNICK KNACK TINS LONDON ,2,2011-07-24 11:54:00,4.15,13137.0,United Kingdom
561036,22082,RIBBON REEL STRIPES DESIGN ,2,2011-07-24 11:54:00,1.65,13137.0,United Kingdom
561036,21668,RED STRIPE CERAMIC DRAWER KNOB,1,2011-07-24 11:54:00,1.25,13137.0,United Kingdom
561036,23033,DRAWER KNOB CERAMIC RED,2,2011-07-24 11:54:00,1.45,13137.0,United Kingdom
561036,21733,RED HANGING HEART T-LIGHT HOLDER,1,2011-07-24 11:54:00,2.95,13137.0,United Kingdom
561036,22178,VICTORIAN GLASS HANGING T-LIGHT,4,2011-07-24 11:54:00,1.25,13137.0,United Kingdom
561036,22665,RECIPE BOX BLUE SKETCHBOOK DESIGN,1,2011-07-24 11:54:00,2.95,13137.0,United Kingdom
561036,22964,3 PIECE SPACEBOY COOKIE CUTTER SET,2,2011-07-24 11:54:00,2.1,13137.0,United Kingdom
561036,22759,SET OF 3 NOTEBOOKS IN PARCEL,2,2011-07-24 11:54:00,1.65,13137.0,United Kingdom
561036,23321,SMALL WHITE HEART OF WICKER,2,2011-07-24 11:54:00,1.65,13137.0,United Kingdom
561036,23294,SET OF 6 SNACK LOAF BAKING CASES,4,2011-07-24 11:54:00,0.83,13137.0,United Kingdom
561036,23296,SET OF 6 TEA TIME BAKING CASES,4,2011-07-24 11:54:00,1.25,13137.0,United Kingdom
561036,22966,GINGERBREAD MAN COOKIE CUTTER,2,2011-07-24 11:54:00,1.25,13137.0,United Kingdom
561036,23293,SET OF 12 FAIRY CAKE BAKING CASES,4,2011-07-24 11:54:00,0.83,13137.0,United Kingdom
561036,21213,PACK OF 72 SKULL CAKE CASES,4,2011-07-24 11:54:00,0.55,13137.0,United Kingdom
561036,23307,SET OF 60 PANTRY DESIGN CAKE CASES ,1,2011-07-24 11:54:00,0.55,13137.0,United Kingdom
561036,21212,PACK OF 72 RETROSPOT CAKE CASES,4,2011-07-24 11:54:00,0.55,13137.0,United Kingdom
561036,23308,SET OF 60 VINTAGE LEAF CAKE CASES ,4,2011-07-24 11:54:00,0.55,13137.0,United Kingdom
561036,23309,SET OF 60 I LOVE LONDON CAKE CASES ,4,2011-07-24 11:54:00,0.55,13137.0,United Kingdom
561036,23307,SET OF 60 PANTRY DESIGN CAKE CASES ,1,2011-07-24 11:54:00,0.55,13137.0,United Kingdom
561036,22965,3 TRADITIONAl BISCUIT CUTTERS  SET,2,2011-07-24 11:54:00,2.1,13137.0,United Kingdom
561036,23307,SET OF 60 PANTRY DESIGN CAKE CASES ,2,2011-07-24 11:54:00,0.55,13137.0,United Kingdom
561036,20914,SET/5 RED RETROSPOT LID GLASS BOWLS,2,2011-07-24 11:54:00,2.95,13137.0,United Kingdom
561036,23242,TREASURE TIN BUFFALO BILL ,1,2011-07-24 11:54:00,2.08,13137.0,United Kingdom
561036,21669,BLUE STRIPE CERAMIC DRAWER KNOB,6,2011-07-24 11:54:00,1.25,13137.0,United Kingdom
561036,21671,RED SPOT CERAMIC DRAWER KNOB,4,2011-07-24 11:54:00,1.25,13137.0,United Kingdom
561036,21672,WHITE SPOT RED CERAMIC DRAWER KNOB,4,2011-07-24 11:54:00,1.25,13137.0,United Kingdom
561036,21673,WHITE SPOT BLUE CERAMIC DRAWER KNOB,4,2011-07-24 11:54:00,1.25,13137.0,United Kingdom
561036,23245,SET OF 3 REGENCY CAKE TINS,2,2011-07-24 11:54:00,4.95,13137.0,United Kingdom
561036,22210,WOOD STAMP SET BEST WISHES,2,2011-07-24 11:54:00,0.83,13137.0,United Kingdom
561036,22208,WOOD STAMP SET THANK YOU,2,2011-07-24 11:54:00,0.83,13137.0,United Kingdom
561036,22211,WOOD STAMP SET FLOWERS,2,2011-07-24 11:54:00,0.83,13137.0,United Kingdom
561036,23238,SET OF 4 KNICK KNACK TINS LONDON ,2,2011-07-24 11:54:00,4.15,13137.0,United Kingdom
561036,23236,DOILEY STORAGE TIN,2,2011-07-24 11:54:00,2.89,13137.0,United Kingdom
561036,23240,SET OF 4 KNICK KNACK TINS DOILEY ,4,2011-07-24 11:54:00,4.15,13137.0,United Kingdom
561036,23241,TREASURE TIN GYMKHANA DESIGN,2,2011-07-24 11:54:00,2.08,13137.0,United Kingdom
561036,23242,TREASURE TIN BUFFALO BILL ,1,2011-07-24 11:54:00,2.08,13137.0,United Kingdom
561036,22083,PAPER CHAIN KIT RETROSPOT,2,2011-07-24 11:54:00,2.95,13137.0,United Kingdom
561036,22085,PAPER CHAIN KIT SKULLS ,2,2011-07-24 11:54:00,2.95,13137.0,United Kingdom
561036,22908,PACK OF 20 NAPKINS RED APPLES,1,2011-07-24 11:54:00,0.85,13137.0,United Kingdom
561036,21080,SET/20 RED RETROSPOT PAPER NAPKINS ,3,2011-07-24 11:54:00,0.85,13137.0,United Kingdom
561036,21989,PACK OF 20 SKULL PAPER NAPKINS,2,2011-07-24 11:54:00,0.85,13137.0,United Kingdom
561036,22727,ALARM CLOCK BAKELIKE RED ,1,2011-07-24 11:54:00,3.75,13137.0,United Kingdom
561036,22726,ALARM CLOCK BAKELIKE GREEN,1,2011-07-24 11:54:00,3.75,13137.0,United Kingdom
561036,22728,ALARM CLOCK BAKELIKE PINK,1,2011-07-24 11:54:00,3.75,13137.0,United Kingdom
561036,84944,SET OF 6 KASHMIR FOLKART BAUBLES,1,2011-07-24 11:54:00,1.65,13137.0,United Kingdom
561036,23316,RED REFECTORY CLOCK ,1,2011-07-24 11:54:00,9.95,13137.0,United Kingdom
561036,21770,OPEN CLOSED METAL SIGN,1,2011-07-24 11:54:00,4.95,13137.0,United Kingdom
561036,21905,MORE BUTTER METAL SIGN ,2,2011-07-24 11:54:00,0.79,13137.0,United Kingdom
561036,21172,PARTY METAL SIGN ,2,2011-07-24 11:54:00,1.45,13137.0,United Kingdom
561036,20728,LUNCH BAG CARS BLUE,2,2011-07-24 11:54:00,1.65,13137.0,United Kingdom
561036,23208,LUNCH BAG VINTAGE LEAF DESIGN,3,2011-07-24 11:54:00,1.65,13137.0,United Kingdom
561036,23206,LUNCH BAG APPLE DESIGN,3,2011-07-24 11:54:00,1.65,13137.0,United Kingdom
561036,23207,LUNCH BAG ALPHABET DESIGN,3,2011-07-24 11:54:00,1.65,13137.0,United Kingdom
561036,23209,LUNCH BAG DOILEY PATTERN ,3,2011-07-24 11:54:00,1.65,13137.0,United Kingdom
561036,23203,JUMBO BAG DOILEY PATTERNS,3,2011-07-24 11:54:00,2.08,13137.0,United Kingdom
561036,23200,JUMBO BAG PEARS,2,2011-07-24 11:54:00,2.08,13137.0,United Kingdom
561036,23199,JUMBO BAG APPLES,2,2011-07-24 11:54:00,2.08,13137.0,United Kingdom
561036,23202,JUMBO BAG VINTAGE LEAF,3,2011-07-24 11:54:00,2.08,13137.0,United Kingdom
561036,23201,JUMBO BAG ALPHABET,3,2011-07-24 11:54:00,2.08,13137.0,United Kingdom
561036,20713,JUMBO BAG OWLS,3,2011-07-24 11:54:00,2.08,13137.0,United Kingdom
561036,22381,TOY TIDY PINK POLKADOT,1,2011-07-24 11:54:00,2.1,13137.0,United Kingdom
561036,22379,RECYCLING BAG RETROSPOT ,1,2011-07-24 11:54:00,2.1,13137.0,United Kingdom
561036,21936,RED RETROSPOT PICNIC BAG,2,2011-07-24 11:54:00,2.95,13137.0,United Kingdom
561036,23284,DOORMAT KEEP CALM AND COME IN,1,2011-07-24 11:54:00,7.95,13137.0,United Kingdom
561036,48187,DOORMAT NEW ENGLAND,1,2011-07-24 11:54:00,7.95,13137.0,United Kingdom
561036,20685,DOORMAT RED RETROSPOT,1,2011-07-24 11:54:00,7.95,13137.0,United Kingdom
561037,23250,VINTAGE RED TRIM ENAMEL BOWL ,12,2011-07-24 11:55:00,1.25,12472.0,Germany
561037,23249,VINTAGE RED ENAMEL TRIM PLATE,12,2011-07-24 11:55:00,1.65,12472.0,Germany
561037,23252,VINTAGE RED ENAMEL TRIM JUG ,4,2011-07-24 11:55:00,3.75,12472.0,Germany
561037,21559,STRAWBERRY LUNCH BOX WITH CUTLERY,6,2011-07-24 11:55:00,2.55,12472.0,Germany
561037,22423,REGENCY CAKESTAND 3 TIER,2,2011-07-24 11:55:00,12.75,12472.0,Germany
561037,21238,RED RETROSPOT CUP,8,2011-07-24 11:55:00,0.85,12472.0,Germany
561037,21240,BLUE POLKADOT CUP,8,2011-07-24 11:55:00,0.85,12472.0,Germany
561037,23236,DOILEY STORAGE TIN,6,2011-07-24 11:55:00,2.89,12472.0,Germany
561037,23240,SET OF 4 KNICK KNACK TINS DOILEY ,6,2011-07-24 11:55:00,4.15,12472.0,Germany
561037,21914,BLUE HARMONICA IN BOX ,12,2011-07-24 11:55:00,1.25,12472.0,Germany
561037,21915,RED  HARMONICA IN BOX ,12,2011-07-24 11:55:00,1.25,12472.0,Germany
561037,22355,CHARLOTTE BAG SUKI DESIGN,10,2011-07-24 11:55:00,0.85,12472.0,Germany
561037,20723,STRAWBERRY CHARLOTTE BAG,10,2011-07-24 11:55:00,0.85,12472.0,Germany
561037,20724,RED RETROSPOT CHARLOTTE BAG,10,2011-07-24 11:55:00,0.85,12472.0,Germany
561037,23254,CHILDRENS CUTLERY DOLLY GIRL ,4,2011-07-24 11:55:00,4.15,12472.0,Germany
561037,23286,BLUE VINTAGE SPOT BEAKER,8,2011-07-24 11:55:00,0.85,12472.0,Germany
561037,23287,RED VINTAGE SPOT BEAKER,8,2011-07-24 11:55:00,0.85,12472.0,Germany
561037,23285,PINK VINTAGE SPOT BEAKER,8,2011-07-24 11:55:00,0.85,12472.0,Germany
561037,23288,GREEN VINTAGE SPOT BEAKER,8,2011-07-24 11:55:00,0.85,12472.0,Germany
561037,23290,SPACEBOY CHILDRENS BOWL,16,2011-07-24 11:55:00,1.25,12472.0,Germany
561037,23292,SPACEBOY CHILDRENS CUP,16,2011-07-24 11:55:00,1.25,12472.0,Germany
561037,23545,WRAP RED DOILEY,25,2011-07-24 11:55:00,0.42,12472.0,Germany
561037,23547,WRAP FLOWER SHOP  ,25,2011-07-24 11:55:00,0.42,12472.0,Germany
561037,23549,WRAP BIRD GARDEN ,25,2011-07-24 11:55:00,0.42,12472.0,Germany
561037,23548,WRAP MAGIC FOREST ,25,2011-07-24 11:55:00,0.42,12472.0,Germany
561037,23550,WRAP ALPHABET POSTER  ,25,2011-07-24 11:55:00,0.42,12472.0,Germany
561037,22629,SPACEBOY LUNCH BOX ,12,2011-07-24 11:55:00,1.95,12472.0,Germany
561037,22551,PLASTERS IN TIN SPACEBOY,12,2011-07-24 11:55:00,1.65,12472.0,Germany
561037,23256,CHILDRENS CUTLERY SPACEBOY ,4,2011-07-24 11:55:00,4.15,12472.0,Germany
561037,20719,WOODLAND CHARLOTTE BAG,10,2011-07-24 11:55:00,0.85,12472.0,Germany
561037,22326,ROUND SNACK BOXES SET OF4 WOODLAND ,12,2011-07-24 11:55:00,2.95,12472.0,Germany
561037,21731,RED TOADSTOOL LED NIGHT LIGHT,12,2011-07-24 11:55:00,1.65,12472.0,Germany
561037,22037,ROBOT BIRTHDAY CARD,12,2011-07-24 11:55:00,0.42,12472.0,Germany
561037,22716,CARD CIRCUS PARADE,12,2011-07-24 11:55:00,0.42,12472.0,Germany
561037,22029,SPACEBOY BIRTHDAY CARD,12,2011-07-24 11:55:00,0.42,12472.0,Germany
561037,22815,CARD PSYCHEDELIC APPLES,12,2011-07-24 11:55:00,0.42,12472.0,Germany
561037,22077,6 RIBBONS RUSTIC CHARM,12,2011-07-24 11:55:00,1.65,12472.0,Germany
561037,23034,DRAWER KNOB CERAMIC BLACK,6,2011-07-24 11:55:00,1.45,12472.0,Germany
561037,23035,DRAWER KNOB CERAMIC IVORY,6,2011-07-24 11:55:00,1.45,12472.0,Germany
561037,23033,DRAWER KNOB CERAMIC RED,6,2011-07-24 11:55:00,1.45,12472.0,Germany
561037,22467,GUMBALL COAT RACK,6,2011-07-24 11:55:00,2.55,12472.0,Germany
561037,23251,VINTAGE RED ENAMEL TRIM MUG ,12,2011-07-24 11:55:00,1.25,12472.0,Germany
561037,POST,POSTAGE,3,2011-07-24 11:55:00,18.0,12472.0,Germany
561038,23322,LARGE WHITE HEART OF WICKER,1,2011-07-24 11:58:00,2.95,17114.0,United Kingdom
561038,23321,SMALL WHITE HEART OF WICKER,2,2011-07-24 11:58:00,1.65,17114.0,United Kingdom
561038,22469,HEART OF WICKER SMALL,1,2011-07-24 11:58:00,1.65,17114.0,United Kingdom
561038,22470,HEART OF WICKER LARGE,2,2011-07-24 11:58:00,2.95,17114.0,United Kingdom
561038,23066,SMALL DECO JEWELLERY STAND,1,2011-07-24 11:58:00,8.25,17114.0,United Kingdom
561038,82482,WOODEN PICTURE FRAME WHITE FINISH,2,2011-07-24 11:58:00,2.55,17114.0,United Kingdom
561038,82494L,WOODEN FRAME ANTIQUE WHITE ,3,2011-07-24 11:58:00,2.95,17114.0,United Kingdom
561038,22796,PHOTO FRAME 3 CLASSIC HANGING,2,2011-07-24 11:58:00,9.95,17114.0,United Kingdom
561038,22427,ENAMEL FLOWER JUG CREAM,1,2011-07-24 11:58:00,5.95,17114.0,United Kingdom
561038,22424,ENAMEL BREAD BIN CREAM,1,2011-07-24 11:58:00,12.75,17114.0,United Kingdom
561038,21340,CLASSIC METAL BIRDCAGE PLANT HOLDER,1,2011-07-24 11:58:00,12.75,17114.0,United Kingdom
561038,82486,WOOD S/3 CABINET ANT WHITE FINISH,2,2011-07-24 11:58:00,8.95,17114.0,United Kingdom
561038,22170,PICTURE FRAME WOOD TRIPLE PORTRAIT,1,2011-07-24 11:58:00,6.75,17114.0,United Kingdom
561039,22791,T-LIGHT GLASS FLUTED ANTIQUE,72,2011-07-24 12:02:00,1.06,16525.0,United Kingdom
561039,82482,WOODEN PICTURE FRAME WHITE FINISH,36,2011-07-24 12:02:00,2.1,16525.0,United Kingdom
561039,21154,RED RETROSPOT OVEN GLOVE ,10,2011-07-24 12:02:00,1.25,16525.0,United Kingdom
561039,21155,RED RETROSPOT PEG BAG,6,2011-07-24 12:02:00,2.55,16525.0,United Kingdom
561039,47566,PARTY BUNTING,8,2011-07-24 12:02:00,4.95,16525.0,United Kingdom
561039,20685,DOORMAT RED RETROSPOT,10,2011-07-24 12:02:00,6.75,16525.0,United Kingdom
561039,21916,SET 12 RETRO WHITE CHALK STICKS,24,2011-07-24 12:02:00,0.42,16525.0,United Kingdom
561039,22151,PLACE SETTING WHITE HEART,432,2011-07-24 12:02:00,0.36,16525.0,United Kingdom
561040,22726,ALARM CLOCK BAKELIKE GREEN,4,2011-07-24 12:05:00,3.75,12431.0,Australia
561040,22727,ALARM CLOCK BAKELIKE RED ,4,2011-07-24 12:05:00,3.75,12431.0,Australia
561040,22138,BAKING SET 9 PIECE RETROSPOT ,6,2011-07-24 12:05:00,4.95,12431.0,Australia
561040,22617,BAKING SET SPACEBOY DESIGN,6,2011-07-24 12:05:00,4.95,12431.0,Australia
561040,22729,ALARM CLOCK BAKELIKE ORANGE,4,2011-07-24 12:05:00,3.75,12431.0,Australia
561040,22698,PINK REGENCY TEACUP AND SAUCER,6,2011-07-24 12:05:00,2.95,12431.0,Australia
561040,22730,ALARM CLOCK BAKELIKE IVORY,4,2011-07-24 12:05:00,3.75,12431.0,Australia
561040,23284,DOORMAT KEEP CALM AND COME IN,10,2011-07-24 12:05:00,6.75,12431.0,Australia
561040,21731,RED TOADSTOOL LED NIGHT LIGHT,24,2011-07-24 12:05:00,1.65,12431.0,Australia
561040,35637A,IVORY STRING CURTAIN WITH POLE ,6,2011-07-24 12:05:00,1.95,12431.0,Australia
561040,23300,GARDENERS KNEELING PAD CUP OF TEA ,12,2011-07-24 12:05:00,1.65,12431.0,Australia
561040,23301,GARDENERS KNEELING PAD KEEP CALM ,24,2011-07-24 12:05:00,1.65,12431.0,Australia
561040,85114B,IVORY ENCHANTED FOREST PLACEMAT,6,2011-07-24 12:05:00,1.65,12431.0,Australia
561040,85114C,RED ENCHANTED FOREST PLACEMAT,6,2011-07-24 12:05:00,1.65,12431.0,Australia
561040,84988,SET OF 72 PINK HEART PAPER DOILIES,12,2011-07-24 12:05:00,1.45,12431.0,Australia
561040,23306,SET OF 36 DOILIES PANTRY DESIGN,12,2011-07-24 12:05:00,1.45,12431.0,Australia
561040,21931,JUMBO STORAGE BAG SUKI,10,2011-07-24 12:05:00,2.08,12431.0,Australia
561040,23202,JUMBO BAG VINTAGE LEAF,10,2011-07-24 12:05:00,2.08,12431.0,Australia
561040,35004B,SET OF 3 BLACK FLYING DUCKS,12,2011-07-24 12:05:00,4.65,12431.0,Australia
561040,84978,HANGING HEART JAR T-LIGHT HOLDER,36,2011-07-24 12:05:00,1.06,12431.0,Australia
C561041,85062,PEARL CRYSTAL PUMPKIN T-LIGHT HLDR,-1,2011-07-24 12:10:00,1.65,15708.0,United Kingdom
C561041,21380,WOODEN HAPPY BIRTHDAY GARLAND,-1,2011-07-24 12:10:00,2.95,15708.0,United Kingdom
C561041,22725,ALARM CLOCK BAKELIKE CHOCOLATE,-1,2011-07-24 12:10:00,3.75,15708.0,United Kingdom
561042,22551,PLASTERS IN TIN SPACEBOY,12,2011-07-24 12:18:00,1.65,16305.0,United Kingdom
561042,22557,PLASTERS IN TIN VINTAGE PAISLEY ,12,2011-07-24 12:18:00,1.65,16305.0,United Kingdom
561042,22553,PLASTERS IN TIN SKULLS,12,2011-07-24 12:18:00,1.65,16305.0,United Kingdom
561042,22556,PLASTERS IN TIN CIRCUS PARADE ,12,2011-07-24 12:18:00,1.65,16305.0,United Kingdom
561042,23206,LUNCH BAG APPLE DESIGN,10,2011-07-24 12:18:00,1.65,16305.0,United Kingdom
561042,23209,LUNCH BAG DOILEY PATTERN ,10,2011-07-24 12:18:00,1.65,16305.0,United Kingdom
561042,22662,LUNCH BAG DOLLY GIRL DESIGN,10,2011-07-24 12:18:00,1.65,16305.0,United Kingdom
561042,22383,LUNCH BAG SUKI DESIGN ,10,2011-07-24 12:18:00,1.65,16305.0,United Kingdom
561042,23208,LUNCH BAG VINTAGE LEAF DESIGN,10,2011-07-24 12:18:00,1.65,16305.0,United Kingdom
561042,22382,LUNCH BAG SPACEBOY DESIGN ,10,2011-07-24 12:18:00,1.65,16305.0,United Kingdom
561042,23202,JUMBO BAG VINTAGE LEAF,10,2011-07-24 12:18:00,2.08,16305.0,United Kingdom
561042,85099C,JUMBO  BAG BAROQUE BLACK WHITE,10,2011-07-24 12:18:00,2.08,16305.0,United Kingdom
561042,23199,JUMBO BAG APPLES,10,2011-07-24 12:18:00,2.08,16305.0,United Kingdom
561042,23203,JUMBO BAG DOILEY PATTERNS,10,2011-07-24 12:18:00,2.08,16305.0,United Kingdom
561042,21931,JUMBO STORAGE BAG SUKI,10,2011-07-24 12:18:00,2.08,16305.0,United Kingdom
561042,21982,PACK OF 12 SUKI TISSUES ,24,2011-07-24 12:18:00,0.29,16305.0,United Kingdom
561042,22614,PACK OF 12 SPACEBOY TISSUES,24,2011-07-24 12:18:00,0.29,16305.0,United Kingdom
561042,22753,SMALL YELLOW BABUSHKA NOTEBOOK ,12,2011-07-24 12:18:00,0.85,16305.0,United Kingdom
561042,22755,SMALL PURPLE BABUSHKA NOTEBOOK ,12,2011-07-24 12:18:00,0.85,16305.0,United Kingdom
561042,23139,SINGLE WIRE HOOK PINK HEART,12,2011-07-24 12:18:00,1.45,16305.0,United Kingdom
561042,23138,SINGLE WIRE HOOK IVORY HEART,12,2011-07-24 12:18:00,1.45,16305.0,United Kingdom
561042,21770,OPEN CLOSED METAL SIGN,2,2011-07-24 12:18:00,4.95,16305.0,United Kingdom
561043,21380,WOODEN HAPPY BIRTHDAY GARLAND,6,2011-07-24 12:20:00,2.95,15708.0,United Kingdom
561043,21916,SET 12 RETRO WHITE CHALK STICKS,12,2011-07-24 12:20:00,0.42,15708.0,United Kingdom
561043,21733,RED HANGING HEART T-LIGHT HOLDER,20,2011-07-24 12:20:00,2.95,15708.0,United Kingdom
561043,85123A,WHITE HANGING HEART T-LIGHT HOLDER,20,2011-07-24 12:20:00,2.95,15708.0,United Kingdom
561043,22488,NATURAL SLATE RECTANGLE CHALKBOARD,4,2011-07-24 12:20:00,1.65,15708.0,United Kingdom
561043,84406B,CREAM CUPID HEARTS COAT HANGER,2,2011-07-24 12:20:00,4.15,15708.0,United Kingdom
561043,21754,HOME BUILDING BLOCK WORD,6,2011-07-24 12:20:00,5.95,15708.0,United Kingdom
561043,23245,SET OF 3 REGENCY CAKE TINS,1,2011-07-24 12:20:00,4.95,15708.0,United Kingdom
561043,21385,IVORY HANGING DECORATION  HEART,24,2011-07-24 12:20:00,0.85,15708.0,United Kingdom
561043,22193,RED DINER WALL CLOCK,1,2011-07-24 12:20:00,8.5,15708.0,United Kingdom
561043,23342,MINT DINER WALL CLOCK,1,2011-07-24 12:20:00,8.5,15708.0,United Kingdom
561043,23244,ROUND STORAGE TIN VINTAGE LEAF,6,2011-07-24 12:20:00,1.95,15708.0,United Kingdom
561043,22173,METAL 4 HOOK HANGER FRENCH CHATEAU,2,2011-07-24 12:20:00,2.95,15708.0,United Kingdom
561043,23146,TRIPLE HOOK ANTIQUE IVORY ROSE,2,2011-07-24 12:20:00,3.29,15708.0,United Kingdom
561043,22726,ALARM CLOCK BAKELIKE GREEN,2,2011-07-24 12:20:00,3.75,15708.0,United Kingdom
561043,22170,PICTURE FRAME WOOD TRIPLE PORTRAIT,4,2011-07-24 12:20:00,6.75,15708.0,United Kingdom
561043,22423,REGENCY CAKESTAND 3 TIER,1,2011-07-24 12:20:00,12.75,15708.0,United Kingdom
561043,82483,WOOD 2 DRAWER CABINET WHITE FINISH,4,2011-07-24 12:20:00,6.95,15708.0,United Kingdom
561043,72741,GRAND CHOCOLATECANDLE,18,2011-07-24 12:20:00,1.45,15708.0,United Kingdom
561043,22096,PINK PAISLEY SQUARE TISSUE BOX ,2,2011-07-24 12:20:00,0.39,15708.0,United Kingdom
561043,82484,WOOD BLACK BOARD ANT WHITE FINISH,2,2011-07-24 12:20:00,7.95,15708.0,United Kingdom
561043,22456,NATURAL SLATE CHALKBOARD LARGE ,1,2011-07-24 12:20:00,4.95,15708.0,United Kingdom
561043,71038,WHITE HANGING BEADS CANDLE HOLDER,8,2011-07-24 12:20:00,5.45,15708.0,United Kingdom
561043,22457,NATURAL SLATE HEART CHALKBOARD ,5,2011-07-24 12:20:00,2.95,15708.0,United Kingdom
561043,23237,SET OF 4 KNICK KNACK TINS LEAF,2,2011-07-24 12:20:00,4.15,15708.0,United Kingdom
561043,22768,FAMILY PHOTO FRAME CORNICE,1,2011-07-24 12:20:00,9.95,15708.0,United Kingdom
561043,23235,STORAGE TIN VINTAGE LEAF,2,2011-07-24 12:20:00,2.89,15708.0,United Kingdom
561043,23196,VINTAGE LEAF MAGNETIC NOTEPAD,3,2011-07-24 12:20:00,1.45,15708.0,United Kingdom
561043,23308,SET OF 60 VINTAGE LEAF CAKE CASES ,8,2011-07-24 12:20:00,0.55,15708.0,United Kingdom
561043,84991,60 TEATIME FAIRY CAKE CASES,6,2011-07-24 12:20:00,0.55,15708.0,United Kingdom
561043,22156,HEART DECORATION WITH PEARLS ,12,2011-07-24 12:20:00,0.85,15708.0,United Kingdom
561043,20762,GREEN FERN SKETCHBOOK ,2,2011-07-24 12:20:00,3.75,15708.0,United Kingdom
561043,20763,DAISY SKETCHBOOK ,2,2011-07-24 12:20:00,3.75,15708.0,United Kingdom
561043,22625,RED KITCHEN SCALES,2,2011-07-24 12:20:00,8.5,15708.0,United Kingdom
561043,22626,BLACK KITCHEN SCALES,1,2011-07-24 12:20:00,8.5,15708.0,United Kingdom
561043,22624,IVORY KITCHEN SCALES,2,2011-07-24 12:20:00,8.5,15708.0,United Kingdom
561043,22721,SET OF 3 CAKE TINS SKETCHBOOK,1,2011-07-24 12:20:00,4.95,15708.0,United Kingdom
561043,84836,ZINC METAL HEART DECORATION,12,2011-07-24 12:20:00,1.25,15708.0,United Kingdom
561043,22795,SWEETHEART RECIPE BOOK STAND,2,2011-07-24 12:20:00,6.75,15708.0,United Kingdom
561043,22854,CREAM SWEETHEART EGG HOLDER,2,2011-07-24 12:20:00,4.95,15708.0,United Kingdom
561043,22470,HEART OF WICKER LARGE,5,2011-07-24 12:20:00,2.95,15708.0,United Kingdom
561043,23322,LARGE WHITE HEART OF WICKER,5,2011-07-24 12:20:00,2.95,15708.0,United Kingdom
561043,23321,SMALL WHITE HEART OF WICKER,5,2011-07-24 12:20:00,1.65,15708.0,United Kingdom
561043,22469,HEART OF WICKER SMALL,5,2011-07-24 12:20:00,1.65,15708.0,United Kingdom
561044,23103,JINGLE BELL HEART DECORATION,24,2011-07-24 12:26:00,1.65,13831.0,United Kingdom
