InvoiceNo,StockCode,Description,Quantity,InvoiceDate,UnitPrice,CustomerID,Country
545595,15056N,EDWARDIAN PARASOL NATURAL,13,2011-03-04 10:39:00,5.95,14570.0,United Kingdom
545595,15056BL,EDWARDIAN PARASOL BLACK,1,2011-03-04 10:39:00,5.95,14570.0,United Kingdom
545595,22178,VICTORIAN GLASS HANGING T-LIGHT,6,2011-03-04 10:39:00,1.25,14570.0,United Kingdom
545595,37448,CERAMIC CAKE DESIGN SPOTTED MUG,4,2011-03-04 10:39:00,1.49,14570.0,United Kingdom
545595,21232,STRAWBERRY CERAMIC TRINKET BOX,4,2011-03-04 10:39:00,1.25,14570.0,United Kingdom
545595,37446,MINI CAKE STAND WITH HANGING CAKES,3,2011-03-04 10:39:00,1.45,14570.0,United Kingdom
545595,22747,POPPY'S PLAYHOUSE BATHROOM,2,2011-03-04 10:39:00,2.1,14570.0,United Kingdom
545595,22745,POPPY'S PLAYHOUSE BEDROOM ,2,2011-03-04 10:39:00,2.1,14570.0,United Kingdom
545595,22748,POPPY'S PLAYHOUSE KITCHEN,2,2011-03-04 10:39:00,2.1,14570.0,United Kingdom
545595,22746,POPPY'S PLAYHOUSE LIVINGROOM ,2,2011-03-04 10:39:00,2.1,14570.0,United Kingdom
545596,22291,HANGING CHICK CREAM DECORATION,24,2011-03-04 10:49:00,1.45,14447.0,United Kingdom
545596,22267,EASTER DECORATION EGG BUNNY ,12,2011-03-04 10:49:00,1.25,14447.0,United Kingdom
545596,22248,DECORATION  PINK CHICK MAGIC GARDEN,16,2011-03-04 10:49:00,0.85,14447.0,United Kingdom
545596,22551,PLASTERS IN TIN SPACEBOY,12,2011-03-04 10:49:00,1.65,14447.0,United Kingdom
545596,22557,PLASTERS IN TIN VINTAGE PAISLEY ,12,2011-03-04 10:49:00,1.65,14447.0,United Kingdom
545596,84997B,RED 3 PIECE RETROSPOT CUTLERY SET,4,2011-03-04 10:49:00,4.15,14447.0,United Kingdom
545596,84997A,GREEN 3 PIECE POLKADOT CUTLERY SET,4,2011-03-04 10:49:00,4.15,14447.0,United Kingdom
545596,20970,PINK FLORAL FELTCRAFT SHOULDER BAG,4,2011-03-04 10:49:00,3.75,14447.0,United Kingdom
545596,20969,RED FLORAL FELTCRAFT SHOULDER BAG,4,2011-03-04 10:49:00,3.75,14447.0,United Kingdom
545596,22148,EASTER CRAFT 4 CHICKS ,12,2011-03-04 10:49:00,1.95,14447.0,United Kingdom
545596,84997C,BLUE 3 PIECE POLKADOT CUTLERY SET,4,2011-03-04 10:49:00,4.15,14447.0,United Kingdom
545596,22365,DOORMAT RESPECTABLE HOUSE,2,2011-03-04 10:49:00,7.95,14447.0,United Kingdom
545596,85206A,CREAM FELT EASTER EGG BASKET,6,2011-03-04 10:49:00,1.65,14447.0,United Kingdom
545596,22383,LUNCH BAG SUKI  DESIGN ,10,2011-03-04 10:49:00,1.65,14447.0,United Kingdom
545596,20728,LUNCH BAG CARS BLUE,10,2011-03-04 10:49:00,1.65,14447.0,United Kingdom
545597,90129C,GREEN GLASS TASSLE BAG CHARM,2,2011-03-04 10:58:00,2.95,14570.0,United Kingdom
545597,90141C,TURQ PENDANT TRIPLE SHELL NECKLACE,1,2011-03-04 10:58:00,4.95,14570.0,United Kingdom
545597,90141A,GREEN PENDANT TRIPLE SHELL NECKLACE,1,2011-03-04 10:58:00,4.95,14570.0,United Kingdom
545597,90185A,AMBER DIAMANTE EXPANDABLE RING,1,2011-03-04 10:58:00,4.25,14570.0,United Kingdom
545597,90183C,BLACK DROP EARRINGS W LONG BEADS,1,2011-03-04 10:58:00,2.95,14570.0,United Kingdom
545597,90022,EDWARDIAN DROP EARRINGS JET BLACK,1,2011-03-04 10:58:00,3.75,14570.0,United Kingdom
545597,90180A,BLACK+WHITE NECKLACE W TASSEL,1,2011-03-04 10:58:00,9.95,14570.0,United Kingdom
545597,90040B,MURANO STYLE GLASS BRACELET BLACK,1,2011-03-04 10:58:00,3.5,14570.0,United Kingdom
545597,90124B,BLUE MURANO TWIST NECKLACE,1,2011-03-04 10:58:00,9.95,14570.0,United Kingdom
545598,22080,,-278,2011-03-04 11:16:00,0.0,,United Kingdom
545599,22272,,-140,2011-03-04 11:17:00,0.0,,United Kingdom
545600,85160A,,-21,2011-03-04 11:45:00,0.0,,United Kingdom
545601,22667,RECIPE BOX RETROSPOT ,6,2011-03-04 11:49:00,2.95,15827.0,United Kingdom
545601,22699,ROSES REGENCY TEACUP AND SAUCER ,6,2011-03-04 11:49:00,2.95,15827.0,United Kingdom
545601,22904,CALENDAR PAPER CUT DESIGN,6,2011-03-04 11:49:00,2.95,15827.0,United Kingdom
545601,47567B,TEA TIME KITCHEN APRON,3,2011-03-04 11:49:00,5.95,15827.0,United Kingdom
545601,20914,SET/5 RED RETROSPOT LID GLASS BOWLS,6,2011-03-04 11:49:00,2.95,15827.0,United Kingdom
545601,22720,SET OF 3 CAKE TINS PANTRY DESIGN ,3,2011-03-04 11:49:00,4.95,15827.0,United Kingdom
545601,22722,SET OF 6 SPICE TINS PANTRY DESIGN,4,2011-03-04 11:49:00,3.95,15827.0,United Kingdom
545601,22966,GINGERBREAD MAN COOKIE CUTTER,12,2011-03-04 11:49:00,1.25,15827.0,United Kingdom
545601,22666,RECIPE BOX PANTRY YELLOW DESIGN,6,2011-03-04 11:49:00,2.95,15827.0,United Kingdom
545602,22386,JUMBO BAG PINK POLKADOT,1,2011-03-04 11:49:00,1.95,17315.0,United Kingdom
545602,21929,JUMBO BAG PINK VINTAGE PAISLEY,1,2011-03-04 11:49:00,1.95,17315.0,United Kingdom
545602,85099C,JUMBO  BAG BAROQUE BLACK WHITE,1,2011-03-04 11:49:00,1.95,17315.0,United Kingdom
545602,85099B,JUMBO BAG RED RETROSPOT,1,2011-03-04 11:49:00,1.95,17315.0,United Kingdom
545602,22411,JUMBO SHOPPER VINTAGE RED PAISLEY,1,2011-03-04 11:49:00,1.95,17315.0,United Kingdom
545602,22456,NATURAL SLATE CHALKBOARD LARGE ,1,2011-03-04 11:49:00,4.95,17315.0,United Kingdom
545602,21916,SET 12 RETRO WHITE CHALK STICKS,3,2011-03-04 11:49:00,0.42,17315.0,United Kingdom
545602,84970S,HANGING HEART ZINC T-LIGHT HOLDER,29,2011-03-04 11:49:00,0.85,17315.0,United Kingdom
545602,84970L,SINGLE HEART ZINC T-LIGHT HOLDER,27,2011-03-04 11:49:00,0.95,17315.0,United Kingdom
545602,71459,HANGING JAM JAR T-LIGHT HOLDER,12,2011-03-04 11:49:00,0.85,17315.0,United Kingdom
545602,21531,RED RETROSPOT SUGAR JAM BOWL,2,2011-03-04 11:49:00,2.55,17315.0,United Kingdom
545602,21533,RETROSPOT LARGE MILK JUG,2,2011-03-04 11:49:00,4.95,17315.0,United Kingdom
545602,22457,NATURAL SLATE HEART CHALKBOARD ,6,2011-03-04 11:49:00,2.95,17315.0,United Kingdom
545603,47591D,PINK FAIRY CAKE CHILDRENS APRON,8,2011-03-04 11:49:00,1.95,15827.0,United Kingdom
545603,22978,PANTRY ROLLING PIN,6,2011-03-04 11:49:00,3.75,15827.0,United Kingdom
545630,21156,RETROSPOT CHILDRENS APRON,60,2011-03-04 12:06:00,1.65,14466.0,United Kingdom
545630,21042,RED RETROSPOT APRON ,9,2011-03-04 12:06:00,5.95,14466.0,United Kingdom
545630,22667,RECIPE BOX RETROSPOT ,6,2011-03-04 12:06:00,2.95,14466.0,United Kingdom
545630,21843,RED RETROSPOT CAKE STAND,3,2011-03-04 12:06:00,10.95,14466.0,United Kingdom
545630,22665,RECIPE BOX BLUE SKETCHBOOK DESIGN,6,2011-03-04 12:06:00,2.95,14466.0,United Kingdom
545630,22666,RECIPE BOX PANTRY YELLOW DESIGN,6,2011-03-04 12:06:00,2.95,14466.0,United Kingdom
545630,22423,REGENCY CAKESTAND 3 TIER,6,2011-03-04 12:06:00,12.75,14466.0,United Kingdom
545630,84988,SET OF 72 PINK HEART PAPER DOILIES,12,2011-03-04 12:06:00,1.45,14466.0,United Kingdom
545634,85053,FRENCH ENAMEL CANDLEHOLDER,6,2011-03-04 12:12:00,2.1,14911.0,EIRE
545634,22178,VICTORIAN GLASS HANGING T-LIGHT,12,2011-03-04 12:12:00,1.25,14911.0,EIRE
545634,22556,PLASTERS IN TIN CIRCUS PARADE ,12,2011-03-04 12:12:00,1.65,14911.0,EIRE
545634,21790,VINTAGE SNAP CARDS,12,2011-03-04 12:12:00,0.85,14911.0,EIRE
545634,21915,RED  HARMONICA IN BOX ,12,2011-03-04 12:12:00,1.25,14911.0,EIRE
545634,22620,4 TRADITIONAL SPINNING TOPS,12,2011-03-04 12:12:00,1.25,14911.0,EIRE
545634,22492,MINI PAINT SET VINTAGE ,36,2011-03-04 12:12:00,0.65,14911.0,EIRE
545634,21656,RIDGED GLASS POSY VASE ,6,2011-03-04 12:12:00,1.45,14911.0,EIRE
545634,22726,ALARM CLOCK BAKELIKE GREEN,4,2011-03-04 12:12:00,3.75,14911.0,EIRE
545634,22729,ALARM CLOCK BAKELIKE ORANGE,4,2011-03-04 12:12:00,3.75,14911.0,EIRE
545634,22966,GINGERBREAD MAN COOKIE CUTTER,12,2011-03-04 12:12:00,1.25,14911.0,EIRE
545634,22846,BREAD BIN DINER STYLE RED ,2,2011-03-04 12:12:00,16.95,14911.0,EIRE
545634,22099,CARAVAN SQUARE TISSUE BOX,12,2011-03-04 12:12:00,1.25,14911.0,EIRE
545634,84077,WORLD WAR 2 GLIDERS ASSTD DESIGNS,48,2011-03-04 12:12:00,0.29,14911.0,EIRE
545634,22489,PACK OF 12 TRADITIONAL CRAYONS,24,2011-03-04 12:12:00,0.42,14911.0,EIRE
545634,23232,WRAP VINTAGE PETALS  DESIGN,25,2011-03-04 12:12:00,0.42,14911.0,EIRE
545634,21506,"FANCY FONT BIRTHDAY CARD, ",12,2011-03-04 12:12:00,0.42,14911.0,EIRE
545634,22030,SWALLOWS GREETING CARD,12,2011-03-04 12:12:00,0.42,14911.0,EIRE
545634,C2,CARRIAGE,1,2011-03-04 12:12:00,50.0,14911.0,EIRE
545635,21232,STRAWBERRY CERAMIC TRINKET BOX,24,2011-03-04 12:14:00,1.25,13557.0,United Kingdom
545635,37446,MINI CAKE STAND WITH HANGING CAKES,8,2011-03-04 12:14:00,1.45,13557.0,United Kingdom
545635,16156S,WRAP PINK FAIRY CAKES ,25,2011-03-04 12:14:00,0.42,13557.0,United Kingdom
545635,22646,CERAMIC STRAWBERRY CAKE MONEY BANK,12,2011-03-04 12:14:00,1.45,13557.0,United Kingdom
545635,22851,SET 20 NAPKINS FAIRY CAKES DESIGN ,12,2011-03-04 12:14:00,0.85,13557.0,United Kingdom
545635,37448,CERAMIC CAKE DESIGN SPOTTED MUG,12,2011-03-04 12:14:00,1.49,13557.0,United Kingdom
545635,16161U,WRAP SUKI AND FRIENDS,25,2011-03-04 12:14:00,0.42,13557.0,United Kingdom
545635,21519,GIN & TONIC DIET GREETING CARD ,24,2011-03-04 12:14:00,0.42,13557.0,United Kingdom
545635,21867,PINK UNION JACK  LUGGAGE TAG,12,2011-03-04 12:14:00,1.25,13557.0,United Kingdom
545635,21865,PINK UNION JACK  PASSPORT COVER ,6,2011-03-04 12:14:00,2.1,13557.0,United Kingdom
545635,22998,TRAVEL CARD WALLET KEEP CALM,24,2011-03-04 12:14:00,0.42,13557.0,United Kingdom
545635,23179,CLOCK MAGNET MUM'S KITCHEN,6,2011-03-04 12:14:00,2.89,13557.0,United Kingdom
545635,22645,CERAMIC HEART FAIRY CAKE MONEY BANK,12,2011-03-04 12:14:00,1.45,13557.0,United Kingdom
545635,22644,CERAMIC CHERRY CAKE MONEY BANK,12,2011-03-04 12:14:00,1.45,13557.0,United Kingdom
545635,22806,SET OF 6 T-LIGHTS WEDDING CAKE ,6,2011-03-04 12:14:00,2.95,13557.0,United Kingdom
545635,84509G,SET OF 4 FAIRY CAKE PLACEMATS ,4,2011-03-04 12:14:00,3.75,13557.0,United Kingdom
545636,84879,ASSORTED COLOUR BIRD ORNAMENT,16,2011-03-04 12:15:00,1.69,16449.0,United Kingdom
545636,22502,PICNIC BASKET WICKER SMALL,4,2011-03-04 12:15:00,5.95,16449.0,United Kingdom
545636,22241,GARLAND WOODEN HAPPY EASTER,12,2011-03-04 12:15:00,1.25,16449.0,United Kingdom
545636,22856,ASSORTED EASTER DECORATIONS  BELLS,12,2011-03-04 12:15:00,1.25,16449.0,United Kingdom
545636,22292,HANGING CHICK  YELLOW DECORATION,24,2011-03-04 12:15:00,1.45,16449.0,United Kingdom
545636,22288,HANGING METAL RABBIT DECORATION,24,2011-03-04 12:15:00,1.25,16449.0,United Kingdom
545636,22251,BIRDHOUSE DECORATION MAGIC GARDEN,12,2011-03-04 12:15:00,1.25,16449.0,United Kingdom
545636,22286,"DECORATION , WOBBLY RABBIT , METAL ",12,2011-03-04 12:15:00,1.65,16449.0,United Kingdom
545636,22249,DECORATION WHITE CHICK MAGIC GARDEN,16,2011-03-04 12:15:00,0.85,16449.0,United Kingdom
545636,22295,HEART FILIGREE DOVE LARGE,12,2011-03-04 12:15:00,1.65,16449.0,United Kingdom
545636,84978,HANGING HEART JAR T-LIGHT HOLDER,12,2011-03-04 12:15:00,1.25,16449.0,United Kingdom
545636,22789,T-LIGHT HOLDER SWEETHEART HANGING,8,2011-03-04 12:15:00,1.95,16449.0,United Kingdom
545636,22776,SWEETHEART CAKESTAND 3 TIER,1,2011-03-04 12:15:00,9.95,16449.0,United Kingdom
545636,22854,CREAM SWEETHEART EGG HOLDER,4,2011-03-04 12:15:00,4.95,16449.0,United Kingdom
545636,22189,CREAM HEART CARD HOLDER,4,2011-03-04 12:15:00,3.95,16449.0,United Kingdom
545636,22169,FAMILY ALBUM WHITE PICTURE FRAME,2,2011-03-04 12:15:00,8.5,16449.0,United Kingdom
545636,22969,HOMEMADE JAM SCENTED CANDLES,12,2011-03-04 12:15:00,1.45,16449.0,United Kingdom
545636,22907,PACK OF 20 NAPKINS PANTRY DESIGN,12,2011-03-04 12:15:00,0.85,16449.0,United Kingdom
545636,84836,ZINC METAL HEART DECORATION,12,2011-03-04 12:15:00,1.25,16449.0,United Kingdom
545636,84970S,HANGING HEART ZINC T-LIGHT HOLDER,12,2011-03-04 12:15:00,0.85,16449.0,United Kingdom
545636,22832,BROCANTE SHELF WITH HOOKS,2,2011-03-04 12:15:00,10.75,16449.0,United Kingdom
545636,22457,NATURAL SLATE HEART CHALKBOARD ,6,2011-03-04 12:15:00,2.95,16449.0,United Kingdom
545636,22957,SET 3 PAPER VINTAGE CHICK PAPER EGG,6,2011-03-04 12:15:00,2.95,16449.0,United Kingdom
545637,21915,RED  HARMONICA IN BOX ,12,2011-03-04 12:16:00,1.25,15514.0,United Kingdom
545637,21096,SET/6 FRUIT SALAD  PAPER PLATES,5,2011-03-04 12:16:00,0.85,15514.0,United Kingdom
545637,22439,6 ROCKET BALLOONS ,10,2011-03-04 12:16:00,0.65,15514.0,United Kingdom
545637,22489,PACK OF 12 TRADITIONAL CRAYONS,12,2011-03-04 12:16:00,0.42,15514.0,United Kingdom
545637,22436,12 COLOURED PARTY BALLOONS,10,2011-03-04 12:16:00,0.65,15514.0,United Kingdom
545637,15034,PAPER POCKET TRAVELING FAN ,12,2011-03-04 12:16:00,0.14,15514.0,United Kingdom
545637,10002,INFLATABLE POLITICAL GLOBE ,2,2011-03-04 12:16:00,0.85,15514.0,United Kingdom
545637,16258A,SWIRLY CIRCULAR RUBBERS IN BAG,12,2011-03-04 12:16:00,0.42,15514.0,United Kingdom
545637,21826,EIGHT PIECE DINOSAUR SET,2,2011-03-04 12:16:00,1.25,15514.0,United Kingdom
545637,21829,DINOSAUR KEYRINGS ASSORTED,36,2011-03-04 12:16:00,0.21,15514.0,United Kingdom
545637,10120,DOGGY RUBBER,11,2011-03-04 12:16:00,0.21,15514.0,United Kingdom
545637,22908,PACK OF 20 NAPKINS RED APPLES,4,2011-03-04 12:16:00,0.85,15514.0,United Kingdom
545637,21088,SET/6 FRUIT SALAD PAPER CUPS,6,2011-03-04 12:16:00,0.65,15514.0,United Kingdom
545637,22726,ALARM CLOCK BAKELIKE GREEN,6,2011-03-04 12:16:00,3.75,15514.0,United Kingdom
545637,22727,ALARM CLOCK BAKELIKE RED ,7,2011-03-04 12:16:00,3.75,15514.0,United Kingdom
545637,22729,ALARM CLOCK BAKELIKE ORANGE,6,2011-03-04 12:16:00,3.75,15514.0,United Kingdom
545637,22970,LONDON BUS COFFEE MUG,12,2011-03-04 12:16:00,2.55,15514.0,United Kingdom
545637,22973,CHILDREN'S CIRCUS PARADE MUG,12,2011-03-04 12:16:00,1.65,15514.0,United Kingdom
545637,22988,SOLDIERS EGG CUP ,48,2011-03-04 12:16:00,1.25,15514.0,United Kingdom
545637,22976,CIRCUS PARADE CHILDRENS EGG CUP ,36,2011-03-04 12:16:00,1.25,15514.0,United Kingdom
545638,21430,SET/3 RED GINGHAM ROSE STORAGE BOX,24,2011-03-04 12:26:00,3.39,13113.0,United Kingdom
545638,22087,PAPER BUNTING WHITE LACE,40,2011-03-04 12:26:00,2.55,13113.0,United Kingdom
545638,22980,PANTRY SCRUBBING BRUSH,2,2011-03-04 12:26:00,1.65,13113.0,United Kingdom
545638,22723,SET OF 6 HERB TINS SKETCHBOOK,1,2011-03-04 12:26:00,3.95,13113.0,United Kingdom
545638,22981,PANTRY APPLE CORER,2,2011-03-04 12:26:00,1.45,13113.0,United Kingdom
545638,22982,PANTRY PASTRY BRUSH,2,2011-03-04 12:26:00,1.25,13113.0,United Kingdom
545638,22979,PANTRY WASHING UP BRUSH,2,2011-03-04 12:26:00,1.45,13113.0,United Kingdom
545638,22978,PANTRY ROLLING PIN,2,2011-03-04 12:26:00,3.75,13113.0,United Kingdom
545638,22457,NATURAL SLATE HEART CHALKBOARD ,10,2011-03-04 12:26:00,2.95,13113.0,United Kingdom
C545639,22423,REGENCY CAKESTAND 3 TIER,-1,2011-03-04 12:28:00,10.95,13113.0,United Kingdom
545644,22440,BALLOON WATER BOMB PACK OF 35,1200,2011-03-04 12:37:00,0.36,16333.0,United Kingdom
545644,21891,TRADITIONAL WOODEN SKIPPING ROPE,576,2011-03-04 12:37:00,1.06,16333.0,United Kingdom
545644,84077,WORLD WAR 2 GLIDERS ASSTD DESIGNS,1152,2011-03-04 12:37:00,0.21,16333.0,United Kingdom
545644,21915,RED  HARMONICA IN BOX ,280,2011-03-04 12:37:00,1.06,16333.0,United Kingdom
545644,22620,4 TRADITIONAL SPINNING TOPS,320,2011-03-04 12:37:00,1.06,16333.0,United Kingdom
545645,22654,DELUXE SEWING KIT ,1,2011-03-04 12:42:00,5.95,12755.0,Japan
545645,22968,ROSE COTTAGE KEEPSAKE BOX ,1,2011-03-04 12:42:00,9.95,12755.0,Japan
545645,22652,TRAVEL SEWING KIT,1,2011-03-04 12:42:00,1.65,12755.0,Japan
545646,20762,GREEN FERN SKETCHBOOK ,6,2011-03-04 12:42:00,3.75,14779.0,United Kingdom
545646,20775,DAISY NOTEBOOK ,3,2011-03-04 12:42:00,1.65,14779.0,United Kingdom
545646,10133,COLOURING PENCILS BROWN TUBE,1,2011-03-04 12:42:00,0.85,14779.0,United Kingdom
545646,10135,COLOURING PENCILS BROWN TUBE,1,2011-03-04 12:42:00,1.25,14779.0,United Kingdom
545646,37479B,CUBIC MUG FLOCK BLUE ON BROWN,1,2011-03-04 12:42:00,2.55,14779.0,United Kingdom
545646,22698,PINK REGENCY TEACUP AND SAUCER,2,2011-03-04 12:42:00,2.95,14779.0,United Kingdom
545647,22128,PARTY CONES CANDY ASSORTED,24,2011-03-04 12:46:00,1.25,12547.0,Spain
545647,22127,PARTY CONES CARNIVAL ASSORTED,24,2011-03-04 12:46:00,1.25,12547.0,Spain
545647,22583,PACK OF 6 HANDBAG GIFT BOXES,12,2011-03-04 12:46:00,2.55,12547.0,Spain
545647,22133,PINK LOVE HEART SHAPE CUP,24,2011-03-04 12:46:00,0.85,12547.0,Spain
545647,22132,RED LOVE HEART SHAPE CUP,24,2011-03-04 12:46:00,0.85,12547.0,Spain
545647,POST,POSTAGE,1,2011-03-04 12:46:00,28.0,12547.0,Spain
545648,22131,FOOD CONTAINER SET 3 LOVE HEART ,6,2011-03-04 13:09:00,1.95,17325.0,United Kingdom
545648,21114,LAVENDER SCENTED FABRIC HEART,10,2011-03-04 13:09:00,1.25,17325.0,United Kingdom
545648,20725,LUNCH BAG RED RETROSPOT,10,2011-03-04 13:09:00,1.65,17325.0,United Kingdom
545648,22759,SET OF 3 NOTEBOOKS IN PARCEL,12,2011-03-04 13:09:00,1.65,17325.0,United Kingdom
545648,22195,LARGE HEART MEASURING SPOONS,12,2011-03-04 13:09:00,1.65,17325.0,United Kingdom
545648,22384,LUNCH BAG PINK POLKADOT,10,2011-03-04 13:09:00,1.65,17325.0,United Kingdom
545649,84836,ZINC METAL HEART DECORATION,2,2011-03-04 13:14:00,1.25,14995.0,United Kingdom
545649,20982,12 PENCILS TALL TUBE SKULLS,2,2011-03-04 13:14:00,0.85,14995.0,United Kingdom
545649,84509A,SET OF 4 ENGLISH ROSE PLACEMATS,1,2011-03-04 13:14:00,3.75,14995.0,United Kingdom
545649,84509C,SET OF 4 POLKADOT PLACEMATS ,1,2011-03-04 13:14:00,3.75,14995.0,United Kingdom
545649,72802B,OCEAN SCENT CANDLE IN JEWELLED BOX,1,2011-03-04 13:14:00,4.25,14995.0,United Kingdom
545649,72802C,VANILLA SCENT CANDLE JEWELLED BOX,1,2011-03-04 13:14:00,4.25,14995.0,United Kingdom
545649,72802A,ROSE SCENT CANDLE IN JEWELLED BOX,1,2011-03-04 13:14:00,4.25,14995.0,United Kingdom
545649,47570B,TEA TIME TABLE CLOTH,1,2011-03-04 13:14:00,10.65,14995.0,United Kingdom
545649,21870,I CAN ONLY PLEASE ONE PERSON MUG,1,2011-03-04 13:14:00,1.25,14995.0,United Kingdom
545649,22460,EMBOSSED GLASS TEALIGHT HOLDER,2,2011-03-04 13:14:00,1.25,14995.0,United Kingdom
545649,72807A,SET/3 ROSE CANDLE IN JEWELLED BOX,1,2011-03-04 13:14:00,4.25,14995.0,United Kingdom
545649,72807B,SET/3 OCEAN SCENT CANDLE JEWEL BOX,1,2011-03-04 13:14:00,4.25,14995.0,United Kingdom
545649,72807C,SET/3 VANILLA SCENTED CANDLE IN BOX,1,2011-03-04 13:14:00,4.25,14995.0,United Kingdom
545649,21931,JUMBO STORAGE BAG SUKI,1,2011-03-04 13:14:00,1.95,14995.0,United Kingdom
545649,22900, SET 2 TEA TOWELS I LOVE LONDON ,1,2011-03-04 13:14:00,2.95,14995.0,United Kingdom
545649,22295,HEART FILIGREE DOVE LARGE,2,2011-03-04 13:14:00,1.65,14995.0,United Kingdom
545649,37495,FAIRY CAKE BIRTHDAY CANDLE SET,2,2011-03-04 13:14:00,3.75,14995.0,United Kingdom
545649,84519A,TOMATO CHARLIE+LOLA COASTER SET,1,2011-03-04 13:14:00,2.95,14995.0,United Kingdom
545649,22197,SMALL POPCORN HOLDER,3,2011-03-04 13:14:00,0.85,14995.0,United Kingdom
545649,20981,12 PENCILS TALL TUBE WOODLAND,2,2011-03-04 13:14:00,0.85,14995.0,United Kingdom
545649,21155,RED RETROSPOT PEG BAG,1,2011-03-04 13:14:00,2.55,14995.0,United Kingdom
545649,22231,JIGSAW TREE WITH BIRDHOUSE,1,2011-03-04 13:14:00,1.45,14995.0,United Kingdom
545649,85186C,BUNNY EGG GARLAND,1,2011-03-04 13:14:00,0.42,14995.0,United Kingdom
545649,85186A,EASTER BUNNY GARLAND OF FLOWERS,1,2011-03-04 13:14:00,0.42,14995.0,United Kingdom
545649,22156,HEART DECORATION WITH PEARLS ,1,2011-03-04 13:14:00,0.85,14995.0,United Kingdom
545649,22614,PACK OF 12 SPACEBOY TISSUES,2,2011-03-04 13:14:00,0.29,14995.0,United Kingdom
545649,21983,PACK OF 12 BLUE PAISLEY TISSUES ,1,2011-03-04 13:14:00,0.29,14995.0,United Kingdom
545649,22267,EASTER DECORATION EGG BUNNY ,2,2011-03-04 13:14:00,1.25,14995.0,United Kingdom
545649,22251,BIRDHOUSE DECORATION MAGIC GARDEN,1,2011-03-04 13:14:00,1.25,14995.0,United Kingdom
545649,22241,GARLAND WOODEN HAPPY EASTER,1,2011-03-04 13:14:00,1.25,14995.0,United Kingdom
545649,82494L,WOODEN FRAME ANTIQUE WHITE ,3,2011-03-04 13:14:00,2.95,14995.0,United Kingdom
545649,85123A,WHITE HANGING HEART T-LIGHT HOLDER,1,2011-03-04 13:14:00,2.95,14995.0,United Kingdom
545649,82482,WOODEN PICTURE FRAME WHITE FINISH,3,2011-03-04 13:14:00,2.55,14995.0,United Kingdom
545649,22411,JUMBO SHOPPER VINTAGE RED PAISLEY,1,2011-03-04 13:14:00,1.95,14995.0,United Kingdom
545649,20712,JUMBO BAG WOODLAND ANIMALS,1,2011-03-04 13:14:00,1.95,14995.0,United Kingdom
545649,21523,DOORMAT FANCY FONT HOME SWEET HOME,1,2011-03-04 13:14:00,7.95,14995.0,United Kingdom
545649,85099C,JUMBO  BAG BAROQUE BLACK WHITE,1,2011-03-04 13:14:00,1.95,14995.0,United Kingdom
545651,21973,,140,2011-03-04 13:14:00,0.0,,United Kingdom
C545650,40001,WHITE BAMBOO RIBS LAMPSHADE,-1,2011-03-04 13:14:00,0.64,15311.0,United Kingdom
C545650,22778,GLASS CLOCHE SMALL,-6,2011-03-04 13:14:00,3.39,15311.0,United Kingdom
545652,20750,RED RETROSPOT MINI CASES,2,2011-03-04 13:27:00,7.95,16414.0,United Kingdom
545652,84946,ANTIQUE SILVER TEA GLASS ETCHED,12,2011-03-04 13:27:00,1.25,16414.0,United Kingdom
545652,21217,RED RETROSPOT ROUND CAKE TINS,2,2011-03-04 13:27:00,9.95,16414.0,United Kingdom
545653,84946,ANTIQUE SILVER TEA GLASS ETCHED,1,2011-03-04 13:39:00,1.25,15311.0,United Kingdom
545653,21240,BLUE POLKADOT CUP,2,2011-03-04 13:39:00,0.85,15311.0,United Kingdom
545653,20675,BLUE POLKADOT BOWL,2,2011-03-04 13:39:00,1.25,15311.0,United Kingdom
545653,21244,BLUE POLKADOT PLATE ,2,2011-03-04 13:39:00,1.69,15311.0,United Kingdom
545653,21033,JUMBO BAG CHARLIE AND LOLA TOYS,2,2011-03-04 13:39:00,2.95,15311.0,United Kingdom
545653,21931,JUMBO STORAGE BAG SUKI,100,2011-03-04 13:39:00,1.65,15311.0,United Kingdom
545653,82001S,VINYL RECORD FRAME SILVER,24,2011-03-04 13:39:00,3.39,15311.0,United Kingdom
545653,85099B,JUMBO BAG RED RETROSPOT,100,2011-03-04 13:39:00,1.65,15311.0,United Kingdom
545653,82482,WOODEN PICTURE FRAME WHITE FINISH,36,2011-03-04 13:39:00,2.1,15311.0,United Kingdom
545653,21313,GLASS HEART T-LIGHT HOLDER ,96,2011-03-04 13:39:00,0.64,15311.0,United Kingdom
545653,84978,HANGING HEART JAR T-LIGHT HOLDER,36,2011-03-04 13:39:00,1.06,15311.0,United Kingdom
545653,21314,SMALL GLASS HEART TRINKET POT,48,2011-03-04 13:39:00,1.85,15311.0,United Kingdom
545653,22663,JUMBO BAG DOLLY GIRL DESIGN,4,2011-03-04 13:39:00,1.95,15311.0,United Kingdom
545653,22411,JUMBO SHOPPER VINTAGE RED PAISLEY,10,2011-03-04 13:39:00,1.95,15311.0,United Kingdom
545653,22385,JUMBO BAG SPACEBOY DESIGN,10,2011-03-04 13:39:00,1.95,15311.0,United Kingdom
545653,22281,EASTER TREE YELLOW BIRDS,2,2011-03-04 13:39:00,5.95,15311.0,United Kingdom
545653,21110,LARGE CAKE TOWEL PINK SPOTS,1,2011-03-04 13:39:00,6.75,15311.0,United Kingdom
545653,22613,PACK OF 20 SPACEBOY NAPKINS,5,2011-03-04 13:39:00,0.85,15311.0,United Kingdom
545653,22088,PAPER BUNTING COLOURED LACE,2,2011-03-04 13:39:00,2.95,15311.0,United Kingdom
545653,22908,PACK OF 20 NAPKINS RED APPLES,3,2011-03-04 13:39:00,0.85,15311.0,United Kingdom
545653,22805,BLUE DRAWER KNOB ACRYLIC EDWARDIAN,24,2011-03-04 13:39:00,1.25,15311.0,United Kingdom
545653,22773,GREEN DRAWER KNOB ACRYLIC EDWARDIAN,24,2011-03-04 13:39:00,1.25,15311.0,United Kingdom
545653,21755,LOVE BUILDING BLOCK WORD,2,2011-03-04 13:39:00,5.95,15311.0,United Kingdom
545653,15056N,EDWARDIAN PARASOL NATURAL,3,2011-03-04 13:39:00,5.95,15311.0,United Kingdom
545653,82583,HOT BATHS METAL SIGN,4,2011-03-04 13:39:00,2.1,15311.0,United Kingdom
545653,20829,GLITTER HANGING BUTTERFLY STRING,2,2011-03-04 13:39:00,2.1,15311.0,United Kingdom
545653,47590A,BLUE HAPPY BIRTHDAY BUNTING,2,2011-03-04 13:39:00,5.45,15311.0,United Kingdom
545653,20665,RED RETROSPOT PURSE ,3,2011-03-04 13:39:00,2.95,15311.0,United Kingdom
545653,85071D,CHARLIE+LOLA MY ROOM DOOR SIGN,2,2011-03-04 13:39:00,2.55,15311.0,United Kingdom
545653,85071A,BLUE CHARLIE+LOLA PERSONAL DOORSIGN,2,2011-03-04 13:39:00,2.95,15311.0,United Kingdom
545653,84849D,HOT BATHS SOAP HOLDER,5,2011-03-04 13:39:00,1.69,15311.0,United Kingdom
545653,22418,10 COLOUR SPACEBOY PEN,12,2011-03-04 13:39:00,0.85,15311.0,United Kingdom
545653,22420,LIPSTICK PEN BABY PINK,5,2011-03-04 13:39:00,0.42,15311.0,United Kingdom
545653,84563A,PINK & WHITE BREAKFAST TRAY,1,2011-03-04 13:39:00,5.95,15311.0,United Kingdom
545653,21470,FLOWER VINE RAFFIA FOOD COVER,2,2011-03-04 13:39:00,3.75,15311.0,United Kingdom
545654,22919,HERB MARKER MINT,12,2011-03-04 13:46:00,0.65,15681.0,United Kingdom
545654,22921,HERB MARKER CHIVES ,12,2011-03-04 13:46:00,0.65,15681.0,United Kingdom
545654,22917,HERB MARKER ROSEMARY,12,2011-03-04 13:46:00,0.65,15681.0,United Kingdom
545654,22920,HERB MARKER BASIL,12,2011-03-04 13:46:00,0.65,15681.0,United Kingdom
545654,22918,HERB MARKER PARSLEY,12,2011-03-04 13:46:00,0.65,15681.0,United Kingdom
545654,22916,HERB MARKER THYME,12,2011-03-04 13:46:00,0.65,15681.0,United Kingdom
545654,22863,SOAP DISH BROCANTE,8,2011-03-04 13:46:00,2.95,15681.0,United Kingdom
545654,22961,JAM MAKING SET PRINTED,24,2011-03-04 13:46:00,1.45,15681.0,United Kingdom
545654,22980,PANTRY SCRUBBING BRUSH,12,2011-03-04 13:46:00,1.65,15681.0,United Kingdom
545654,22979,PANTRY WASHING UP BRUSH,24,2011-03-04 13:46:00,1.45,15681.0,United Kingdom
545654,22992,REVOLVER WOODEN RULER ,24,2011-03-04 13:46:00,1.95,15681.0,United Kingdom
545654,23194,GYMKHANNA TREASURE BOOK BOX,8,2011-03-04 13:46:00,2.08,15681.0,United Kingdom
545654,23193,BUFFALO BILL TREASURE BOOK BOX,8,2011-03-04 13:46:00,2.08,15681.0,United Kingdom
545654,22087,PAPER BUNTING WHITE LACE,12,2011-03-04 13:46:00,2.95,15681.0,United Kingdom
545654,20979,36 PENCILS TUBE RED RETROSPOT,16,2011-03-04 13:46:00,1.25,15681.0,United Kingdom
545654,21313,GLASS HEART T-LIGHT HOLDER ,24,2011-03-04 13:46:00,0.85,15681.0,United Kingdom
545654,84978,HANGING HEART JAR T-LIGHT HOLDER,24,2011-03-04 13:46:00,1.25,15681.0,United Kingdom
545655,21922,UNION STRIPE WITH FRINGE  HAMMOCK,1,2011-03-04 13:58:00,7.95,14670.0,United Kingdom
545655,22967,SET 3 SONG BIRD PAPER EGGS ASSORTED,1,2011-03-04 13:58:00,2.95,14670.0,United Kingdom
545655,22804,CANDLEHOLDER PINK HANGING HEART,1,2011-03-04 13:58:00,2.95,14670.0,United Kingdom
545655,22577,WOODEN HEART CHRISTMAS SCANDINAVIAN,2,2011-03-04 13:58:00,0.85,14670.0,United Kingdom
545655,22335,HEART DECORATION PAINTED ZINC ,1,2011-03-04 13:58:00,0.65,14670.0,United Kingdom
545655,22318,FIVE HEART HANGING DECORATION,1,2011-03-04 13:58:00,2.95,14670.0,United Kingdom
545655,20998,ROSE DU SUD OVEN GLOVE,1,2011-03-04 13:58:00,2.95,14670.0,United Kingdom
545655,22964,3 PIECE SPACEBOY COOKIE CUTTER SET,1,2011-03-04 13:58:00,2.1,14670.0,United Kingdom
