InvoiceNo,StockCode,Description,Quantity,InvoiceDate,UnitPrice,CustomerID,Country
580384,22193,RED DINER WALL CLOCK,2,2011-12-04 10:10:00,8.5,17243.0,United Kingdom
580384,23355,HOT WATER BOTTLE KEEP CALM,2,2011-12-04 10:10:00,4.95,17243.0,United Kingdom
580384,22114,HOT WATER BOTTLE TEA AND SYMPATHY,7,2011-12-04 10:10:00,4.25,17243.0,United Kingdom
580384,22835,HOT WATER BOTTLE I AM SO POORLY,5,2011-12-04 10:10:00,4.95,17243.0,United Kingdom
580384,22112,CHOCOLATE HOT WATER BOTTLE,4,2011-12-04 10:10:00,4.95,17243.0,United Kingdom
580384,22314,OFFICE MUG WARMER CHOC+BLUE,12,2011-12-04 10:10:00,1.25,17243.0,United Kingdom
580384,23118,PARISIENNE JEWELLERY DRAWER ,3,2011-12-04 10:10:00,7.5,17243.0,United Kingdom
580384,20668,DISCO BALL CHRISTMAS DECORATION,72,2011-12-04 10:10:00,0.12,17243.0,United Kingdom
580384,23329,DECORATIVE WICKER HEART LARGE,10,2011-12-04 10:10:00,1.65,17243.0,United Kingdom
580384,21136,PAINTED METAL PEARS ASSORTED,24,2011-12-04 10:10:00,1.69,17243.0,United Kingdom
580384,84879,ASSORTED COLOUR BIRD ORNAMENT,40,2011-12-04 10:10:00,1.69,17243.0,United Kingdom
580384,23275,SET OF 3 HANGING OWLS OLLIE BEAK,12,2011-12-04 10:10:00,1.25,17243.0,United Kingdom
580384,21378,SMALL TALL CAMPHOR WOOD TOADSTOOL,6,2011-12-04 10:10:00,0.39,17243.0,United Kingdom
580384,21379,CAMPHOR WOOD PORTOBELLO MUSHROOM,6,2011-12-04 10:10:00,0.39,17243.0,United Kingdom
580384,23103,JINGLE BELL HEART DECORATION,24,2011-12-04 10:10:00,1.65,17243.0,United Kingdom
580385,21376,LARGE  TALL CAMPHOR WOOD TOADSTOOL ,2,2011-12-04 10:11:00,1.25,16326.0,United Kingdom
580385,23284,DOORMAT KEEP CALM AND COME IN,10,2011-12-04 10:11:00,7.08,16326.0,United Kingdom
580385,22690,DOORMAT HOME SWEET HOME BLUE ,2,2011-12-04 10:11:00,8.25,16326.0,United Kingdom
580385,22692,DOORMAT WELCOME TO OUR HOME,2,2011-12-04 10:11:00,8.25,16326.0,United Kingdom
580385,22691,DOORMAT WELCOME SUNRISE,2,2011-12-04 10:11:00,8.25,16326.0,United Kingdom
580385,48129,DOORMAT TOPIARY,4,2011-12-04 10:11:00,8.25,16326.0,United Kingdom
580385,48187,DOORMAT NEW ENGLAND,1,2011-12-04 10:11:00,8.25,16326.0,United Kingdom
580385,48111,DOORMAT 3 SMILEY CATS,2,2011-12-04 10:11:00,8.25,16326.0,United Kingdom
580385,20685,DOORMAT RED RETROSPOT,2,2011-12-04 10:11:00,8.25,16326.0,United Kingdom
580385,48194,DOORMAT HEARTS,2,2011-12-04 10:11:00,8.25,16326.0,United Kingdom
580385,23283,DOORMAT VINTAGE LEAF,2,2011-12-04 10:11:00,8.25,16326.0,United Kingdom
580385,21377,SMALL CAMPHOR WOOD FIELD  MUSHROOM,6,2011-12-04 10:11:00,0.39,16326.0,United Kingdom
580385,21375,LARGE CAMPHOR WOOD FIELD MUSHROOM ,1,2011-12-04 10:11:00,1.25,16326.0,United Kingdom
580385,21375,LARGE CAMPHOR WOOD FIELD MUSHROOM ,2,2011-12-04 10:11:00,1.25,16326.0,United Kingdom
580385,21376,LARGE  TALL CAMPHOR WOOD TOADSTOOL ,2,2011-12-04 10:11:00,1.25,16326.0,United Kingdom
580385,21375,LARGE CAMPHOR WOOD FIELD MUSHROOM ,2,2011-12-04 10:11:00,1.25,16326.0,United Kingdom
580385,22865,HAND WARMER OWL DESIGN,4,2011-12-04 10:11:00,2.1,16326.0,United Kingdom
580385,22867,HAND WARMER BIRD DESIGN,3,2011-12-04 10:11:00,2.1,16326.0,United Kingdom
580385,22632,HAND WARMER RED RETROSPOT,3,2011-12-04 10:11:00,2.1,16326.0,United Kingdom
580385,23439,HAND WARMER RED LOVE HEART,3,2011-12-04 10:11:00,2.1,16326.0,United Kingdom
580385,22633,HAND WARMER UNION JACK,2,2011-12-04 10:11:00,2.1,16326.0,United Kingdom
580385,22866,HAND WARMER SCOTTY DOG DESIGN,2,2011-12-04 10:11:00,2.1,16326.0,United Kingdom
580385,22866,HAND WARMER SCOTTY DOG DESIGN,2,2011-12-04 10:11:00,2.1,16326.0,United Kingdom
580385,21376,LARGE  TALL CAMPHOR WOOD TOADSTOOL ,2,2011-12-04 10:11:00,1.25,16326.0,United Kingdom
580386,22365,DOORMAT RESPECTABLE HOUSE,2,2011-12-04 10:29:00,8.25,18065.0,United Kingdom
580386,21524,DOORMAT SPOTTY HOME SWEET HOME,2,2011-12-04 10:29:00,8.25,18065.0,United Kingdom
580386,23284,DOORMAT KEEP CALM AND COME IN,2,2011-12-04 10:29:00,8.25,18065.0,United Kingdom
580386,22691,DOORMAT WELCOME SUNRISE,2,2011-12-04 10:29:00,8.25,18065.0,United Kingdom
580386,82484,WOOD BLACK BOARD ANT WHITE FINISH,2,2011-12-04 10:29:00,7.95,18065.0,United Kingdom
580386,21166,COOK WITH WINE METAL SIGN ,12,2011-12-04 10:29:00,2.08,18065.0,United Kingdom
580386,23424,GINGHAM RECIPE BOOK BOX,4,2011-12-04 10:29:00,4.95,18065.0,United Kingdom
580386,72760B,VINTAGE CREAM 3 BASKET CAKE STAND,2,2011-12-04 10:29:00,9.95,18065.0,United Kingdom
580386,84347,ROTATING SILVER ANGELS T-LIGHT HLDR,6,2011-12-04 10:29:00,2.55,18065.0,United Kingdom
580386,11001,ASSTD DESIGN RACING CAR PEN,16,2011-12-04 10:29:00,1.69,18065.0,United Kingdom
580387,22734,SET OF 6 RIBBONS VINTAGE CHRISTMAS,6,2011-12-04 10:29:00,2.89,18065.0,United Kingdom
580387,22086,PAPER CHAIN KIT 50'S CHRISTMAS ,12,2011-12-04 10:29:00,2.95,18065.0,United Kingdom
580387,22158,3 HEARTS HANGING DECORATION RUSTIC,8,2011-12-04 10:29:00,2.95,18065.0,United Kingdom
580387,22792,FLUTED ANTIQUE CANDLE HOLDER,12,2011-12-04 10:29:00,0.85,18065.0,United Kingdom
580387,72760B,VINTAGE CREAM 3 BASKET CAKE STAND,2,2011-12-04 10:29:00,9.95,18065.0,United Kingdom
580387,22776,SWEETHEART 3 TIER CAKE STAND ,1,2011-12-04 10:29:00,9.95,18065.0,United Kingdom
580388,23491,VINTAGE JINGLE BELLS HEART,4,2011-12-04 10:30:00,8.25,18065.0,United Kingdom
580388,23534,STOP FOR TEA WALL ART,3,2011-12-04 10:30:00,5.95,18065.0,United Kingdom
580388,23486,ANTIQUE HEART SHELF UNIT,2,2011-12-04 10:30:00,16.65,18065.0,United Kingdom
580388,23367,SET 12 COLOUR PENCILS SPACEBOY ,16,2011-12-04 10:30:00,0.65,18065.0,United Kingdom
580388,23506,MINI PLAYING CARDS SPACEBOY ,20,2011-12-04 10:30:00,0.42,18065.0,United Kingdom
580388,20975,12 PENCILS SMALL TUBE RED RETROSPOT,24,2011-12-04 10:30:00,0.65,18065.0,United Kingdom
580388,23569,TRADTIONAL ALPHABET STAMP SET,4,2011-12-04 10:30:00,4.95,18065.0,United Kingdom
580389,22596,CHRISTMAS STAR WISH LIST CHALKBOARD,12,2011-12-04 10:35:00,1.25,12952.0,United Kingdom
580389,23403,LETTER HOLDER HOME SWEET HOME,4,2011-12-04 10:35:00,3.75,12952.0,United Kingdom
580389,82583,HOT BATHS METAL SIGN,12,2011-12-04 10:35:00,2.1,12952.0,United Kingdom
580389,22624,IVORY KITCHEN SCALES,2,2011-12-04 10:35:00,8.5,12952.0,United Kingdom
580389,22627,MINT KITCHEN SCALES,2,2011-12-04 10:35:00,8.5,12952.0,United Kingdom
580389,23534,WALL ART STOP FOR TEA ,3,2011-12-04 10:35:00,5.95,12952.0,United Kingdom
580389,23294,SET OF 6 SNACK LOAF BAKING CASES,8,2011-12-04 10:35:00,0.83,12952.0,United Kingdom
580389,23295,SET OF 12 MINI LOAF BAKING CASES,8,2011-12-04 10:35:00,0.83,12952.0,United Kingdom
580389,23293,SET OF 12 FAIRY CAKE BAKING CASES,8,2011-12-04 10:35:00,0.83,12952.0,United Kingdom
580389,22847,BREAD BIN DINER STYLE IVORY,2,2011-12-04 10:35:00,16.95,12952.0,United Kingdom
580389,84378,SET OF 3 HEART COOKIE CUTTERS,12,2011-12-04 10:35:00,1.45,12952.0,United Kingdom
580389,23013,GLASS APOTHECARY BOTTLE TONIC,4,2011-12-04 10:35:00,3.95,12952.0,United Kingdom
580389,22867,HAND WARMER BIRD DESIGN,12,2011-12-04 10:35:00,2.1,12952.0,United Kingdom
580389,22865,HAND WARMER OWL DESIGN,12,2011-12-04 10:35:00,2.1,12952.0,United Kingdom
580389,22722,SET OF 6 SPICE TINS PANTRY DESIGN,4,2011-12-04 10:35:00,3.95,12952.0,United Kingdom
580389,23335,EGG FRYING PAN IVORY ,6,2011-12-04 10:35:00,2.08,12952.0,United Kingdom
580389,23336,EGG FRYING PAN PINK ,6,2011-12-04 10:35:00,2.08,12952.0,United Kingdom
580389,23406,HOME SWEET HOME KEY HOLDER,2,2011-12-04 10:35:00,6.25,12952.0,United Kingdom
580390,21888,Amazon,1,2011-12-04 10:37:00,0.0,,United Kingdom
580391,21868,Amazon,1,2011-12-04 10:42:00,0.0,,United Kingdom
C580392,84247E,PACK OF 12 CHRISTMAS FUN CARDS,-12,2011-12-04 10:46:00,2.95,16283.0,United Kingdom
580393,72349B,SET/6 PURPLE BUTTERFLY T-LIGHTS,12,2011-12-04 10:51:00,2.1,16438.0,United Kingdom
580393,72351A,SET/6 TURQUOISE BUTTERFLY T-LIGHTS,12,2011-12-04 10:51:00,2.1,16438.0,United Kingdom
580393,23340,VINTAGE CHRISTMAS CAKE FRILL,1,2011-12-04 10:51:00,1.65,16438.0,United Kingdom
580393,22465,HANGING METAL STAR LANTERN,1,2011-12-04 10:51:00,0.79,16438.0,United Kingdom
580393,85034C,3 ROSE MORRIS BOXED CANDLES,2,2011-12-04 10:51:00,1.25,16438.0,United Kingdom
580393,85038,6 CHOCOLATE LOVE HEART T-LIGHTS,4,2011-12-04 10:51:00,2.1,16438.0,United Kingdom
580393,22807,SET OF 6 T-LIGHTS TOADSTOOLS,1,2011-12-04 10:51:00,1.25,16438.0,United Kingdom
580393,21109,LARGE CAKE TOWEL CHOCOLATE SPOTS,3,2011-12-04 10:51:00,1.95,16438.0,United Kingdom
580393,21733,RED HANGING HEART T-LIGHT HOLDER,1,2011-12-04 10:51:00,2.95,16438.0,United Kingdom
580393,85123A,WHITE HANGING HEART T-LIGHT HOLDER,1,2011-12-04 10:51:00,2.95,16438.0,United Kingdom
580393,17191A,ROSE FLOWER CANDLE+INCENSE 16X16CM,2,2011-12-04 10:51:00,3.75,16438.0,United Kingdom
580393,17012F,ORIGAMI SANDLEWOOD INCENSE/CAND SET,2,2011-12-04 10:51:00,0.85,16438.0,United Kingdom
580393,17012C,ORIGAMI LAVENDER INCENSE/CANDL SET ,2,2011-12-04 10:51:00,0.85,16438.0,United Kingdom
580393,17012D,ORIGAMI ROSE INCENSE/CANDLE SET ,2,2011-12-04 10:51:00,0.85,16438.0,United Kingdom
580393,37446,MINI CAKE STAND WITH HANGING CAKES,2,2011-12-04 10:51:00,1.45,16438.0,United Kingdom
580393,22055,MINI CAKE STAND  HANGING STRAWBERY,2,2011-12-04 10:51:00,0.39,16438.0,United Kingdom
580393,72351B,SET/6 PINK  BUTTERFLY T-LIGHTS,12,2011-12-04 10:51:00,2.1,16438.0,United Kingdom
580393,21284,RETROSPOT CANDLE  SMALL,12,2011-12-04 10:51:00,0.39,16438.0,United Kingdom
580393,21108,FAIRY CAKE FLANNEL ASSORTED COLOUR,9,2011-12-04 10:51:00,0.79,16438.0,United Kingdom
580393,85040A,S/4 PINK FLOWER CANDLES IN BOWL,12,2011-12-04 10:51:00,1.65,16438.0,United Kingdom
580394,23145,ZINC T-LIGHT HOLDER STAR LARGE,36,2011-12-04 10:53:00,0.95,14397.0,United Kingdom
580394,22178,VICTORIAN GLASS HANGING T-LIGHT,48,2011-12-04 10:53:00,1.95,14397.0,United Kingdom
580394,84946,ANTIQUE SILVER T-LIGHT GLASS,24,2011-12-04 10:53:00,1.25,14397.0,United Kingdom
580394,23144,ZINC T-LIGHT HOLDER STARS SMALL,12,2011-12-04 10:53:00,0.83,14397.0,United Kingdom
580394,22478,BIRDHOUSE GARDEN MARKER ,20,2011-12-04 10:53:00,1.25,14397.0,United Kingdom
580394,22596,CHRISTMAS STAR WISH LIST CHALKBOARD,12,2011-12-04 10:53:00,1.25,14397.0,United Kingdom
580395,22208,WOOD STAMP SET THANK YOU,12,2011-12-04 10:56:00,0.83,17629.0,United Kingdom
580395,21485,RETROSPOT HEART HOT WATER BOTTLE,12,2011-12-04 10:56:00,4.95,17629.0,United Kingdom
580395,22086,PAPER CHAIN KIT 50'S CHRISTMAS ,6,2011-12-04 10:56:00,2.95,17629.0,United Kingdom
580395,20992,JAZZ HEARTS PURSE NOTEBOOK,24,2011-12-04 10:56:00,0.39,17629.0,United Kingdom
580395,22212,FOUR HOOK  WHITE LOVEBIRDS,30,2011-12-04 10:56:00,2.1,17629.0,United Kingdom
580395,23566,EGG CUP MILKMAID HEIDI,12,2011-12-04 10:56:00,1.25,17629.0,United Kingdom
580395,23565,EGG CUP MILKMAID HELGA ,12,2011-12-04 10:56:00,1.25,17629.0,United Kingdom
580395,21790,VINTAGE SNAP CARDS,12,2011-12-04 10:56:00,0.85,17629.0,United Kingdom
580395,35599D,PINK AND WHITE CHRISTMAS TREE 120CM,1,2011-12-04 10:56:00,2.95,17629.0,United Kingdom
580395,21704,BAG 250g SWIRLY MARBLES,12,2011-12-04 10:56:00,0.85,17629.0,United Kingdom
580395,22299,PIG KEYRING WITH LIGHT & SOUND ,48,2011-12-04 10:56:00,0.39,17629.0,United Kingdom
580395,22509,SEWING BOX RETROSPOT DESIGN ,4,2011-12-04 10:56:00,3.95,17629.0,United Kingdom
580395,22646,CERAMIC STRAWBERRY CAKE MONEY BANK,36,2011-12-04 10:56:00,0.39,17629.0,United Kingdom
580395,22758,LARGE PURPLE BABUSHKA NOTEBOOK  ,12,2011-12-04 10:56:00,0.39,17629.0,United Kingdom
580395,23235,STORAGE TIN VINTAGE LEAF,12,2011-12-04 10:56:00,1.25,17629.0,United Kingdom
580395,84032B,CHARLIE + LOLA RED HOT WATER BOTTLE,36,2011-12-04 10:56:00,0.79,17629.0,United Kingdom
580395,21828,EIGHT PIECE SNAKE  SET,12,2011-12-04 10:56:00,1.25,17629.0,United Kingdom
580395,23444,Next Day Carriage,1,2011-12-04 10:56:00,15.0,17629.0,United Kingdom
580396,22472,TV DINNER TRAY DOLLY GIRL,1,2011-12-04 11:00:00,1.95,13838.0,United Kingdom
580396,23535,WALL ART BICYCLE SAFETY,1,2011-12-04 11:00:00,5.95,13838.0,United Kingdom
580396,22768,FAMILY PHOTO FRAME CORNICE,2,2011-12-04 11:00:00,9.95,13838.0,United Kingdom
580396,22767,TRIPLE PHOTO FRAME CORNICE ,2,2011-12-04 11:00:00,9.95,13838.0,United Kingdom
580396,23012,GLASS APOTHECARY BOTTLE PERFUME,1,2011-12-04 11:00:00,3.95,13838.0,United Kingdom
580396,23296,SET OF 6 TEA TIME BAKING CASES,2,2011-12-04 11:00:00,1.25,13838.0,United Kingdom
580396,23013,GLASS APOTHECARY BOTTLE TONIC,1,2011-12-04 11:00:00,3.95,13838.0,United Kingdom
580396,21109,LARGE CAKE TOWEL CHOCOLATE SPOTS,1,2011-12-04 11:00:00,1.95,13838.0,United Kingdom
580396,23035,DRAWER KNOB CERAMIC IVORY,12,2011-12-04 11:00:00,1.45,13838.0,United Kingdom
580396,22960,JAM MAKING SET WITH JARS,2,2011-12-04 11:00:00,4.25,13838.0,United Kingdom
580396,23569,TRADTIONAL ALPHABET STAMP SET,1,2011-12-04 11:00:00,4.95,13838.0,United Kingdom
580396,21889,WOODEN BOX OF DOMINOES,1,2011-12-04 11:00:00,1.25,13838.0,United Kingdom
580396,22734,SET OF 6 RIBBONS VINTAGE CHRISTMAS,1,2011-12-04 11:00:00,2.89,13838.0,United Kingdom
580396,23413,DECORATIVE VINTAGE COFFEE  BOX,1,2011-12-04 11:00:00,4.95,13838.0,United Kingdom
580396,22961,JAM MAKING SET PRINTED,2,2011-12-04 11:00:00,1.45,13838.0,United Kingdom
580396,23188,VINTAGE  2 METRE FOLDING RULER,1,2011-12-04 11:00:00,1.65,13838.0,United Kingdom
580396,85034C,3 ROSE MORRIS BOXED CANDLES,1,2011-12-04 11:00:00,1.25,13838.0,United Kingdom
580396,23293,SET OF 12 FAIRY CAKE BAKING CASES,2,2011-12-04 11:00:00,0.83,13838.0,United Kingdom
580396,22993,SET OF 4 PANTRY JELLY MOULDS,1,2011-12-04 11:00:00,1.25,13838.0,United Kingdom
580396,23301,GARDENERS KNEELING PAD KEEP CALM ,1,2011-12-04 11:00:00,1.65,13838.0,United Kingdom
580396,48173C,DOORMAT BLACK FLOCK ,1,2011-12-04 11:00:00,8.25,13838.0,United Kingdom
580396,23294,SET OF 6 SNACK LOAF BAKING CASES,1,2011-12-04 11:00:00,0.83,13838.0,United Kingdom
580396,85034B,3 WHITE CHOC MORRIS BOXED CANDLES,1,2011-12-04 11:00:00,1.25,13838.0,United Kingdom
580396,23294,SET OF 6 SNACK LOAF BAKING CASES,1,2011-12-04 11:00:00,0.83,13838.0,United Kingdom
580396,23239,SET OF 4 KNICK KNACK TINS POPPIES,1,2011-12-04 11:00:00,1.65,13838.0,United Kingdom
580396,23082,SET 6 PAPER TABLE LANTERN HEARTS ,2,2011-12-04 11:00:00,3.75,13838.0,United Kingdom
580396,23295,SET OF 12 MINI LOAF BAKING CASES,1,2011-12-04 11:00:00,0.83,13838.0,United Kingdom
580396,22993,SET OF 4 PANTRY JELLY MOULDS,2,2011-12-04 11:00:00,1.25,13838.0,United Kingdom
580396,21109,LARGE CAKE TOWEL CHOCOLATE SPOTS,1,2011-12-04 11:00:00,1.95,13838.0,United Kingdom
580396,23295,SET OF 12 MINI LOAF BAKING CASES,1,2011-12-04 11:00:00,0.83,13838.0,United Kingdom
580396,20985,HEART CALCULATOR,1,2011-12-04 11:00:00,1.25,13838.0,United Kingdom
580396,23240,SET OF 4 KNICK KNACK TINS DOILY ,1,2011-12-04 11:00:00,4.15,13838.0,United Kingdom
580396,23256,CHILDRENS CUTLERY SPACEBOY ,1,2011-12-04 11:00:00,4.15,13838.0,United Kingdom
580396,23571,TRADITIONAL NAUGHTS & CROSSES,1,2011-12-04 11:00:00,1.65,13838.0,United Kingdom
580396,20985,HEART CALCULATOR,2,2011-12-04 11:00:00,1.25,13838.0,United Kingdom
580396,21791,VINTAGE HEADS AND TAILS CARD GAME ,2,2011-12-04 11:00:00,1.25,13838.0,United Kingdom
580396,20986,BLUE CALCULATOR RULER,3,2011-12-04 11:00:00,1.25,13838.0,United Kingdom
580396,23082,SET 6 PAPER TABLE LANTERN HEARTS ,1,2011-12-04 11:00:00,3.75,13838.0,United Kingdom
580396,22578,WOODEN STAR CHRISTMAS SCANDINAVIAN,2,2011-12-04 11:00:00,0.29,13838.0,United Kingdom
580396,22155,STAR DECORATION RUSTIC,2,2011-12-04 11:00:00,0.42,13838.0,United Kingdom
580396,23296,SET OF 6 TEA TIME BAKING CASES,1,2011-12-04 11:00:00,1.25,13838.0,United Kingdom
580396,21889,WOODEN BOX OF DOMINOES,1,2011-12-04 11:00:00,1.25,13838.0,United Kingdom
580396,23266,SET OF 3 WOODEN STOCKING DECORATION,1,2011-12-04 11:00:00,1.25,13838.0,United Kingdom
580396,22429,ENAMEL MEASURING JUG CREAM,1,2011-12-04 11:00:00,4.25,13838.0,United Kingdom
580396,23295,SET OF 12 MINI LOAF BAKING CASES,2,2011-12-04 11:00:00,0.83,13838.0,United Kingdom
580396,23349,ROLL WRAP VINTAGE CHRISTMAS,1,2011-12-04 11:00:00,1.25,13838.0,United Kingdom
580396,23193,BUFFALO BILL TREASURE BOOK BOX,3,2011-12-04 11:00:00,2.25,13838.0,United Kingdom
580396,23393,HOME SWEET HOME CUSHION COVER ,1,2011-12-04 11:00:00,3.75,13838.0,United Kingdom
580396,23570,TRADITIONAL PICK UP STICKS GAME ,1,2011-12-04 11:00:00,1.25,13838.0,United Kingdom
580396,22722,SET OF 6 SPICE TINS PANTRY DESIGN,1,2011-12-04 11:00:00,3.95,13838.0,United Kingdom
580396,23353,6 GIFT TAGS VINTAGE CHRISTMAS ,3,2011-12-04 11:00:00,0.83,13838.0,United Kingdom
580396,23349,ROLL WRAP VINTAGE CHRISTMAS,3,2011-12-04 11:00:00,1.25,13838.0,United Kingdom
580396,23350,ROLL WRAP VINTAGE SPOT ,3,2011-12-04 11:00:00,1.25,13838.0,United Kingdom
580396,22992,REVOLVER WOODEN RULER ,6,2011-12-04 11:00:00,1.95,13838.0,United Kingdom
580396,22474,SPACEBOY TV DINNER TRAY,1,2011-12-04 11:00:00,1.95,13838.0,United Kingdom
580397,23493,VINTAGE DOILY TRAVEL SEWING KIT,2,2011-12-04 11:24:00,1.95,13558.0,United Kingdom
580397,22961,JAM MAKING SET PRINTED,2,2011-12-04 11:24:00,1.45,13558.0,United Kingdom
580397,23301,GARDENERS KNEELING PAD KEEP CALM ,2,2011-12-04 11:24:00,1.65,13558.0,United Kingdom
580397,23300,GARDENERS KNEELING PAD CUP OF TEA ,1,2011-12-04 11:24:00,1.65,13558.0,United Kingdom
580397,23207,LUNCH BAG ALPHABET DESIGN,2,2011-12-04 11:24:00,1.65,13558.0,United Kingdom
580397,22382,LUNCH BAG SPACEBOY DESIGN ,1,2011-12-04 11:24:00,1.65,13558.0,United Kingdom
580397,23583,LUNCH BAG PAISLEY PARK  ,2,2011-12-04 11:24:00,1.65,13558.0,United Kingdom
580397,22662,LUNCH BAG DOLLY GIRL DESIGN,2,2011-12-04 11:24:00,1.65,13558.0,United Kingdom
580397,22469,HEART OF WICKER SMALL,4,2011-12-04 11:24:00,1.65,13558.0,United Kingdom
580397,23110,PARISIENNE KEY CABINET ,1,2011-12-04 11:24:00,5.75,13558.0,United Kingdom
580397,85066,CREAM SWEETHEART MINI CHEST,1,2011-12-04 11:24:00,12.75,13558.0,United Kingdom
580397,23330,DECORATIVE WICKER HEART MEDIUM,3,2011-12-04 11:24:00,1.25,13558.0,United Kingdom
580397,23192,BUNDLE OF 3 ALPHABET EXERCISE BOOKS,2,2011-12-04 11:24:00,1.65,13558.0,United Kingdom
580397,21313,GLASS HEART T-LIGHT HOLDER ,3,2011-12-04 11:24:00,0.85,13558.0,United Kingdom
580397,23311,VINTAGE CHRISTMAS STOCKING ,3,2011-12-04 11:24:00,2.55,13558.0,United Kingdom
580397,22899,CHILDREN'S APRON DOLLY GIRL ,1,2011-12-04 11:24:00,2.1,13558.0,United Kingdom
580397,21535,RED RETROSPOT SMALL MILK JUG,1,2011-12-04 11:24:00,2.55,13558.0,United Kingdom
580397,23270,SET OF 2 CERAMIC PAINTED HEARTS ,1,2011-12-04 11:24:00,1.45,13558.0,United Kingdom
580397,23398,HANGING HEART BONHEUR,1,2011-12-04 11:24:00,0.85,13558.0,United Kingdom
580397,23399,HOME SWEET HOME HANGING HEART,1,2011-12-04 11:24:00,0.85,13558.0,United Kingdom
580397,85094,CANDY SPOT EGG WARMER RABBIT,2,2011-12-04 11:24:00,0.19,13558.0,United Kingdom
580397,22791,T-LIGHT GLASS FLUTED ANTIQUE,3,2011-12-04 11:24:00,1.25,13558.0,United Kingdom
580397,84947,ANTIQUE SILVER TEA GLASS ENGRAVED,3,2011-12-04 11:24:00,1.25,13558.0,United Kingdom
580397,22866,HAND WARMER SCOTTY DOG DESIGN,2,2011-12-04 11:24:00,2.1,13558.0,United Kingdom
580397,22867,HAND WARMER BIRD DESIGN,2,2011-12-04 11:24:00,2.1,13558.0,United Kingdom
580397,23370,SET 36 COLOURING PENCILS DOILY,2,2011-12-04 11:24:00,1.25,13558.0,United Kingdom
580397,23372,SET 36 COLOUR PENCILS DOLLY GIRL,3,2011-12-04 11:24:00,1.25,13558.0,United Kingdom
580397,21914,BLUE HARMONICA IN BOX ,2,2011-12-04 11:24:00,1.25,13558.0,United Kingdom
580397,23570,TRADITIONAL PICK UP STICKS GAME ,1,2011-12-04 11:24:00,1.25,13558.0,United Kingdom
580397,21876,POTTERING MUG,1,2011-12-04 11:24:00,1.65,13558.0,United Kingdom
580397,21875,KINGS CHOICE MUG,1,2011-12-04 11:24:00,1.25,13558.0,United Kingdom
580397,22974,CHILDRENS DOLLY GIRL MUG,2,2011-12-04 11:24:00,1.65,13558.0,United Kingdom
580397,22197,POPCORN HOLDER,4,2011-12-04 11:24:00,0.85,13558.0,United Kingdom
580397,23245,SET OF 3 REGENCY CAKE TINS,1,2011-12-04 11:24:00,4.95,13558.0,United Kingdom
580397,22632,HAND WARMER RED RETROSPOT,2,2011-12-04 11:24:00,2.1,13558.0,United Kingdom
580397,23439,HAND WARMER RED LOVE HEART,2,2011-12-04 11:24:00,2.1,13558.0,United Kingdom
580398,22217,T-LIGHT HOLDER HANGING LACE,96,2011-12-04 11:32:00,0.39,14354.0,United Kingdom
580398,22442,GROW YOUR OWN FLOWERS SET OF 3,12,2011-12-04 11:32:00,1.95,14354.0,United Kingdom
580398,72819,CUPID DESIGN SCENTED CANDLES,12,2011-12-04 11:32:00,1.25,14354.0,United Kingdom
580399,48185,DOORMAT FAIRY CAKE,1,2011-12-04 11:45:00,8.25,13471.0,United Kingdom
580399,22365,DOORMAT RESPECTABLE HOUSE,1,2011-12-04 11:45:00,8.25,13471.0,United Kingdom
580399,21524,DOORMAT SPOTTY HOME SWEET HOME,1,2011-12-04 11:45:00,8.25,13471.0,United Kingdom
580399,48138,DOORMAT UNION FLAG,1,2011-12-04 11:45:00,8.25,13471.0,United Kingdom
580399,48111,DOORMAT 3 SMILEY CATS,1,2011-12-04 11:45:00,8.25,13471.0,United Kingdom
580399,22505,MEMO BOARD COTTAGE DESIGN,2,2011-12-04 11:45:00,4.95,13471.0,United Kingdom
580399,21891,TRADITIONAL WOODEN SKIPPING ROPE,3,2011-12-04 11:45:00,1.45,13471.0,United Kingdom
580399,22511,RETROSPOT BABUSHKA DOORSTOP,4,2011-12-04 11:45:00,0.79,13471.0,United Kingdom
580399,22993,SET OF 4 PANTRY JELLY MOULDS,2,2011-12-04 11:45:00,1.25,13471.0,United Kingdom
580399,22964,3 PIECE SPACEBOY COOKIE CUTTER SET,3,2011-12-04 11:45:00,2.1,13471.0,United Kingdom
580399,84380,SET OF 3 BUTTERFLY COOKIE CUTTERS,2,2011-12-04 11:45:00,1.45,13471.0,United Kingdom
580399,84378,SET OF 3 HEART COOKIE CUTTERS,4,2011-12-04 11:45:00,1.45,13471.0,United Kingdom
580399,84375,SET OF 20 KIDS COOKIE CUTTERS,6,2011-12-04 11:45:00,2.1,13471.0,United Kingdom
580399,22966,GINGERBREAD MAN COOKIE CUTTER,5,2011-12-04 11:45:00,1.25,13471.0,United Kingdom
580399,23307,SET OF 60 PANTRY DESIGN CAKE CASES ,3,2011-12-04 11:45:00,0.55,13471.0,United Kingdom
580399,21977,PACK OF 60 PINK PAISLEY CAKE CASES,1,2011-12-04 11:45:00,0.55,13471.0,United Kingdom
580399,84991,60 TEATIME FAIRY CAKE CASES,1,2011-12-04 11:45:00,0.55,13471.0,United Kingdom
580399,21976,PACK OF 60 MUSHROOM CAKE CASES,5,2011-12-04 11:45:00,0.55,13471.0,United Kingdom
580399,21975,PACK OF 60 DINOSAUR CAKE CASES,4,2011-12-04 11:45:00,0.55,13471.0,United Kingdom
580399,84991,60 TEATIME FAIRY CAKE CASES,12,2011-12-04 11:45:00,0.55,13471.0,United Kingdom
580399,23389,SPACEBOY MINI BACKPACK,3,2011-12-04 11:45:00,4.15,13471.0,United Kingdom
580399,23390,DOLLY GIRL MINI BACKPACK,3,2011-12-04 11:45:00,4.15,13471.0,United Kingdom
580399,21884,CAKES AND BOWS GIFT  TAPE,12,2011-12-04 11:45:00,0.65,13471.0,United Kingdom
580399,21121,SET/10 RED POLKADOT PARTY CANDLES,1,2011-12-04 11:45:00,1.25,13471.0,United Kingdom
580399,23508,MINI PLAYING CARDS DOLLY GIRL ,5,2011-12-04 11:45:00,0.42,13471.0,United Kingdom
580399,21892,TRADITIONAL WOODEN CATCH CUP GAME ,3,2011-12-04 11:45:00,1.25,13471.0,United Kingdom
580399,23376,PACK OF 12 VINTAGE CHRISTMAS TISSUE,4,2011-12-04 11:45:00,0.39,13471.0,United Kingdom
580399,23506,MINI PLAYING CARDS SPACEBOY ,5,2011-12-04 11:45:00,0.42,13471.0,United Kingdom
580399,21213,PACK OF 72 SKULL CAKE CASES,2,2011-12-04 11:45:00,0.55,13471.0,United Kingdom
580399,23307,SET OF 60 PANTRY DESIGN CAKE CASES ,1,2011-12-04 11:45:00,0.55,13471.0,United Kingdom
580399,21977,PACK OF 60 PINK PAISLEY CAKE CASES,4,2011-12-04 11:45:00,0.55,13471.0,United Kingdom
580399,84991,60 TEATIME FAIRY CAKE CASES,2,2011-12-04 11:45:00,0.55,13471.0,United Kingdom
580399,22417,PACK OF 60 SPACEBOY CAKE CASES,7,2011-12-04 11:45:00,0.55,13471.0,United Kingdom
580399,21111,"SWISS ROLL TOWEL, CHOCOLATE  SPOTS",2,2011-12-04 11:45:00,1.25,13471.0,United Kingdom
580399,22952,60 CAKE CASES VINTAGE CHRISTMAS,6,2011-12-04 11:45:00,0.55,13471.0,United Kingdom
580399,23376,PACK OF 12 VINTAGE CHRISTMAS TISSUE,2,2011-12-04 11:45:00,0.39,13471.0,United Kingdom
580399,21891,TRADITIONAL WOODEN SKIPPING ROPE,1,2011-12-04 11:45:00,1.45,13471.0,United Kingdom
580399,22909,SET OF 20 VINTAGE CHRISTMAS NAPKINS,6,2011-12-04 11:45:00,0.85,13471.0,United Kingdom
580399,22437,SET OF 9 BLACK SKULL BALLOONS,3,2011-12-04 11:45:00,0.85,13471.0,United Kingdom
580399,22553,PLASTERS IN TIN SKULLS,3,2011-12-04 11:45:00,1.65,13471.0,United Kingdom
580399,22099,CARAVAN SQUARE TISSUE BOX,1,2011-12-04 11:45:00,0.39,13471.0,United Kingdom
580399,22632,HAND WARMER RED RETROSPOT,4,2011-12-04 11:45:00,2.1,13471.0,United Kingdom
580399,22094,RED RETROSPOT TISSUE BOX,4,2011-12-04 11:45:00,0.39,13471.0,United Kingdom
580399,21115,ROSE CARAVAN DOORSTOP,2,2011-12-04 11:45:00,1.95,13471.0,United Kingdom
580399,22098,BOUDOIR SQUARE TISSUE BOX,4,2011-12-04 11:45:00,0.39,13471.0,United Kingdom
580399,22195,LARGE HEART MEASURING SPOONS,2,2011-12-04 11:45:00,1.65,13471.0,United Kingdom
580399,72741,GRAND CHOCOLATECANDLE,18,2011-12-04 11:45:00,1.45,13471.0,United Kingdom
580399,22099,CARAVAN SQUARE TISSUE BOX,1,2011-12-04 11:45:00,0.39,13471.0,United Kingdom
580399,84030E,ENGLISH ROSE HOT WATER BOTTLE,1,2011-12-04 11:45:00,4.25,13471.0,United Kingdom
580399,22969,HOMEMADE JAM SCENTED CANDLES,24,2011-12-04 11:45:00,1.45,13471.0,United Kingdom
580399,22835,HOT WATER BOTTLE I AM SO POORLY,2,2011-12-04 11:45:00,4.95,13471.0,United Kingdom
580399,23355,HOT WATER BOTTLE KEEP CALM,2,2011-12-04 11:45:00,4.95,13471.0,United Kingdom
580399,23355,HOT WATER BOTTLE KEEP CALM,1,2011-12-04 11:45:00,4.95,13471.0,United Kingdom
580399,21479,WHITE SKULL HOT WATER BOTTLE ,2,2011-12-04 11:45:00,4.25,13471.0,United Kingdom
580399,21165,BEWARE OF THE CAT METAL SIGN ,3,2011-12-04 11:45:00,1.69,13471.0,United Kingdom
580399,22115,METAL SIGN EMPIRE TEA,2,2011-12-04 11:45:00,0.79,13471.0,United Kingdom
580399,22413,METAL SIGN TAKE IT OR LEAVE IT ,2,2011-12-04 11:45:00,2.95,13471.0,United Kingdom
580399,21907,I'M ON HOLIDAY METAL SIGN,2,2011-12-04 11:45:00,2.1,13471.0,United Kingdom
580399,21770,OPEN CLOSED METAL SIGN,2,2011-12-04 11:45:00,4.95,13471.0,United Kingdom
580399,21166,COOK WITH WINE METAL SIGN ,3,2011-12-04 11:45:00,2.08,13471.0,United Kingdom
580399,21903,MAN FLU METAL SIGN,3,2011-12-04 11:45:00,2.1,13471.0,United Kingdom
