InvoiceNo,StockCode,Description,Quantity,InvoiceDate,UnitPrice,CustomerID,Country
575732,15056BL,EDWARDIAN PARASOL BLACK,6,2011-11-11 08:19:00,5.95,12712.0,Germany
575732,15056N,EDWARDIAN PARASOL NATURAL,6,2011-11-11 08:19:00,5.95,12712.0,Germany
575732,15056P,EDWARDIAN PARASOL PINK,3,2011-11-11 08:19:00,5.95,12712.0,Germany
575732,22867,HAND WARMER BIRD DESIGN,12,2011-11-11 08:19:00,2.1,12712.0,Germany
575732,22865,HAND WARMER OWL DESIGN,12,2011-11-11 08:19:00,2.1,12712.0,Germany
575732,21481,FAWN BLUE HOT WATER BOTTLE,4,2011-11-11 08:19:00,3.75,12712.0,Germany
575732,22114,HOT WATER BOTTLE TEA AND SYMPATHY,4,2011-11-11 08:19:00,4.25,12712.0,Germany
575732,23485,BOTANICAL GARDENS WALL CLOCK ,1,2011-11-11 08:19:00,25.0,12712.0,Germany
575732,POST,POSTAGE,2,2011-11-11 08:19:00,18.0,12712.0,Germany
575733,20749,ASSORTED COLOUR MINI CASES,2,2011-11-11 08:33:00,7.95,13810.0,Germany
575733,21509,COWBOYS AND INDIANS BIRTHDAY CARD ,12,2011-11-11 08:33:00,0.42,13810.0,Germany
575733,22025,RING OF ROSES BIRTHDAY CARD,12,2011-11-11 08:33:00,0.42,13810.0,Germany
575733,21506,"FANCY FONT BIRTHDAY CARD, ",12,2011-11-11 08:33:00,0.42,13810.0,Germany
575733,22717,CARD DOG AND BALL ,12,2011-11-11 08:33:00,0.42,13810.0,Germany
575733,84380,SET OF 3 BUTTERFLY COOKIE CUTTERS,12,2011-11-11 08:33:00,1.45,13810.0,Germany
575733,21354,TOAST ITS - BEST MUM,12,2011-11-11 08:33:00,1.25,13810.0,Germany
575733,21217,RED RETROSPOT ROUND CAKE TINS,5,2011-11-11 08:33:00,9.95,13810.0,Germany
575733,22551,PLASTERS IN TIN SPACEBOY,12,2011-11-11 08:33:00,1.65,13810.0,Germany
575733,22554,PLASTERS IN TIN WOODLAND ANIMALS,12,2011-11-11 08:33:00,1.65,13810.0,Germany
575733,22505,MEMO BOARD COTTAGE DESIGN,4,2011-11-11 08:33:00,4.95,13810.0,Germany
575733,22964,3 PIECE SPACEBOY COOKIE CUTTER SET,12,2011-11-11 08:33:00,2.1,13810.0,Germany
575733,84375,SET OF 20 KIDS COOKIE CUTTERS,12,2011-11-11 08:33:00,2.1,13810.0,Germany
575733,POST,POSTAGE,1,2011-11-11 08:33:00,18.0,13810.0,Germany
575734,21892,TRADITIONAL WOODEN CATCH CUP GAME ,12,2011-11-11 08:39:00,1.25,12384.0,Switzerland
575734,23084,RABBIT NIGHT LIGHT,6,2011-11-11 08:39:00,2.08,12384.0,Switzerland
575734,22632,HAND WARMER RED RETROSPOT,12,2011-11-11 08:39:00,2.1,12384.0,Switzerland
575734,85099F,JUMBO BAG STRAWBERRY,10,2011-11-11 08:39:00,2.08,12384.0,Switzerland
575734,23494,VINTAGE DOILY DELUXE SEWING KIT ,3,2011-11-11 08:39:00,5.95,12384.0,Switzerland
575734,22692,DOORMAT WELCOME TO OUR HOME,2,2011-11-11 08:39:00,8.25,12384.0,Switzerland
575734,20685,DOORMAT RED RETROSPOT,2,2011-11-11 08:39:00,8.25,12384.0,Switzerland
575734,15056BL,EDWARDIAN PARASOL BLACK,3,2011-11-11 08:39:00,5.95,12384.0,Switzerland
575734,21430,SET/3 RED GINGHAM ROSE STORAGE BOX,4,2011-11-11 08:39:00,3.75,12384.0,Switzerland
575734,POST,POSTAGE,2,2011-11-11 08:39:00,40.0,12384.0,Switzerland
575734,22366,DOORMAT AIRMAIL ,2,2011-11-11 08:39:00,8.25,12384.0,Switzerland
575734,23480,MINI LIGHTS WOODLAND MUSHROOMS,4,2011-11-11 08:39:00,3.75,12384.0,Switzerland
575734,22622,BOX OF VINTAGE ALPHABET BLOCKS,2,2011-11-11 08:39:00,11.95,12384.0,Switzerland
575735,23435,3 RAFFIA RIBBONS VINTAGE CHRISTMAS,10,2011-11-11 08:46:00,0.79,14156.0,EIRE
575735,85179A,GREEN BITTY LIGHT CHAIN,12,2011-11-11 08:46:00,1.25,14156.0,EIRE
575735,23367,SET 12 COLOUR PENCILS SPACEBOY ,16,2011-11-11 08:46:00,0.65,14156.0,EIRE
575735,23534,WALL ART STOP FOR TEA ,6,2011-11-11 08:46:00,5.95,14156.0,EIRE
575735,23507,MINI PLAYING CARDS BUFFALO BILL ,20,2011-11-11 08:46:00,0.42,14156.0,EIRE
575735,71477,COLOUR GLASS. STAR T-LIGHT HOLDER,12,2011-11-11 08:46:00,3.95,14156.0,EIRE
575735,21326,AGED GLASS SILVER T-LIGHT HOLDER,12,2011-11-11 08:46:00,0.65,14156.0,EIRE
575735,23273,HEART T-LIGHT HOLDER WILLIE WINKIE,12,2011-11-11 08:46:00,1.65,14156.0,EIRE
575735,21733,RED HANGING HEART T-LIGHT HOLDER,6,2011-11-11 08:46:00,2.95,14156.0,EIRE
575735,85123A,WHITE HANGING HEART T-LIGHT HOLDER,6,2011-11-11 08:46:00,2.95,14156.0,EIRE
575735,23129,HEART SHAPED HOLLY WREATH,4,2011-11-11 08:46:00,4.15,14156.0,EIRE
575735,23491,VINTAGE JINGLE BELLS HEART,2,2011-11-11 08:46:00,8.25,14156.0,EIRE
575735,22592,CARDHOLDER HOLLY WREATH METAL,4,2011-11-11 08:46:00,3.75,14156.0,EIRE
575735,23497,CLASSIC CHROME BICYCLE BELL ,12,2011-11-11 08:46:00,1.45,14156.0,EIRE
575735,22947,WOODEN ADVENT CALENDAR RED,6,2011-11-11 08:46:00,7.95,14156.0,EIRE
575735,22469,HEART OF WICKER SMALL,12,2011-11-11 08:46:00,1.65,14156.0,EIRE
575735,C2,CARRIAGE,1,2011-11-11 08:46:00,50.0,14156.0,EIRE
575736,23114,VINTAGE LEAF CHOPPING BOARD  ,3,2011-11-11 08:47:00,4.95,12697.0,Sweden
575736,23117,POPPY FIELDS CHOPPING BOARD,3,2011-11-11 08:47:00,4.95,12697.0,Sweden
575736,23434,3 RAFFIA RIBBONS 50'S CHRISTMAS ,10,2011-11-11 08:47:00,0.79,12697.0,Sweden
575736,23354,6 GIFT TAGS 50'S CHRISTMAS ,12,2011-11-11 08:47:00,0.83,12697.0,Sweden
575736,23382,BOX OF 6 CHRISTMAS CAKE DECORATIONS,8,2011-11-11 08:47:00,3.75,12697.0,Sweden
575736,23435,3 RAFFIA RIBBONS VINTAGE CHRISTMAS,10,2011-11-11 08:47:00,0.79,12697.0,Sweden
575736,22944,CHRISTMAS METAL POSTCARD WITH BELLS,72,2011-11-11 08:47:00,0.39,12697.0,Sweden
575736,22930,BAKING MOULD HEART MILK CHOCOLATE,6,2011-11-11 08:47:00,2.55,12697.0,Sweden
575736,23235,STORAGE TIN VINTAGE LEAF,6,2011-11-11 08:47:00,2.89,12697.0,Sweden
575736,22083,PAPER CHAIN KIT RETROSPOT,6,2011-11-11 08:47:00,2.95,12697.0,Sweden
575736,21200,MULTICOLOUR HONEYCOMB PAPER GARLAND,12,2011-11-11 08:47:00,1.65,12697.0,Sweden
575736,POST,POSTAGE,1,2011-11-11 08:47:00,40.0,12697.0,Sweden
575737,21108,FAIRY CAKE FLANNEL ASSORTED COLOUR,36,2011-11-11 08:59:00,0.79,14789.0,United Kingdom
575737,22367,CHILDRENS APRON SPACEBOY DESIGN,16,2011-11-11 08:59:00,1.95,14789.0,United Kingdom
575737,47591D,PINK FAIRY CAKE CHILDRENS APRON,16,2011-11-11 08:59:00,1.95,14789.0,United Kingdom
575737,20971,PINK BLUE FELT CRAFT TRINKET BOX,24,2011-11-11 08:59:00,1.25,14789.0,United Kingdom
575737,22645,CERAMIC HEART FAIRY CAKE MONEY BANK,12,2011-11-11 08:59:00,1.45,14789.0,United Kingdom
575737,22138,BAKING SET 9 PIECE RETROSPOT ,12,2011-11-11 08:59:00,4.95,14789.0,United Kingdom
575738,23437, 50'S CHRISTMAS GIFT BAG LARGE,12,2011-11-11 09:02:00,1.25,16790.0,United Kingdom
575738,22583,PACK OF 6 HANDBAG GIFT BOXES,6,2011-11-11 09:02:00,2.55,16790.0,United Kingdom
575738,22584,PACK OF 6 PANNETONE GIFT BOXES,6,2011-11-11 09:02:00,2.55,16790.0,United Kingdom
575738,23375,50'S CHRISTMAS PAPER GIFT BAG,10,2011-11-11 09:02:00,0.82,16790.0,United Kingdom
575738,23374,RED SPOT PAPER GIFT BAG,10,2011-11-11 09:02:00,0.82,16790.0,United Kingdom
575738,23438, RED SPOT GIFT BAG LARGE,12,2011-11-11 09:02:00,1.25,16790.0,United Kingdom
575738,23204,CHARLOTTE BAG APPLES DESIGN,10,2011-11-11 09:02:00,0.85,16790.0,United Kingdom
575738,20719,WOODLAND CHARLOTTE BAG,10,2011-11-11 09:02:00,0.85,16790.0,United Kingdom
575738,22661,CHARLOTTE BAG DOLLY GIRL DESIGN,10,2011-11-11 09:02:00,0.85,16790.0,United Kingdom
575738,21933,PINK VINTAGE PAISLEY PICNIC BAG,10,2011-11-11 09:02:00,1.65,16790.0,United Kingdom
575738,22208,WOOD STAMP SET THANK YOU,12,2011-11-11 09:02:00,0.83,16790.0,United Kingdom
575738,22210,WOOD STAMP SET BEST WISHES,12,2011-11-11 09:02:00,0.83,16790.0,United Kingdom
575739,20983,12 PENCILS TALL TUBE RED RETROSPOT,1,2011-11-11 09:05:00,1.63,,United Kingdom
575739,21000,ROSE DU SUD COSMETICS BAG,1,2011-11-11 09:05:00,3.29,,United Kingdom
575739,21064,BOOM BOX SPEAKER BOYS,1,2011-11-11 09:05:00,4.13,,United Kingdom
575739,21065,BOOM BOX SPEAKER GIRLS,3,2011-11-11 09:05:00,4.13,,United Kingdom
575739,21086,SET/6 RED SPOTTY PAPER CUPS,4,2011-11-11 09:05:00,1.63,,United Kingdom
575739,21094,SET/6 RED SPOTTY PAPER PLATES,5,2011-11-11 09:05:00,0.83,,United Kingdom
575739,21108,FAIRY CAKE FLANNEL ASSORTED COLOUR,3,2011-11-11 09:05:00,4.96,,United Kingdom
575739,21123,SET/10 IVORY POLKADOT PARTY CANDLES,3,2011-11-11 09:05:00,0.83,,United Kingdom
575739,21126,SET OF 6 GIRLS CELEBRATION CANDLES,1,2011-11-11 09:05:00,1.25,,United Kingdom
575739,21137,BLACK RECORD COVER FRAME,1,2011-11-11 09:05:00,7.46,,United Kingdom
575739,21154,RED RETROSPOT OVEN GLOVE ,2,2011-11-11 09:05:00,2.46,,United Kingdom
575739,21175,GIN + TONIC DIET METAL SIGN,1,2011-11-11 09:05:00,4.96,,United Kingdom
575739,21191,LARGE WHITE HONEYCOMB PAPER BELL  ,1,2011-11-11 09:05:00,4.13,,United Kingdom
575739,21212,PACK OF 72 RETROSPOT CAKE CASES,2,2011-11-11 09:05:00,1.25,,United Kingdom
575739,21213,PACK OF 72 SKULL CAKE CASES,1,2011-11-11 09:05:00,1.25,,United Kingdom
575739,21220,SET/4 BADGES DOGS,1,2011-11-11 09:05:00,2.46,,United Kingdom
575739,21238,RED RETROSPOT CUP,1,2011-11-11 09:05:00,1.63,,United Kingdom
575739,21257,VICTORIAN SEWING BOX MEDIUM,1,2011-11-11 09:05:00,15.79,,United Kingdom
575739,21258,VICTORIAN SEWING BOX LARGE,1,2011-11-11 09:05:00,24.96,,United Kingdom
575739,21313,GLASS HEART T-LIGHT HOLDER ,2,2011-11-11 09:05:00,1.63,,United Kingdom
575739,21328,BALLOONS  WRITING SET ,1,2011-11-11 09:05:00,3.29,,United Kingdom
575739,21329,DINOSAURS  WRITING SET ,2,2011-11-11 09:05:00,3.29,,United Kingdom
575739,21356,TOAST ITS - FAIRY FLOWER,2,2011-11-11 09:05:00,0.83,,United Kingdom
575739,21358,TOAST ITS - HAPPY BIRTHDAY,1,2011-11-11 09:05:00,0.83,,United Kingdom
575739,21381,MINI WOODEN HAPPY BIRTHDAY GARLAND,1,2011-11-11 09:05:00,3.29,,United Kingdom
575739,21383,PACK OF 12 STICKY BUNNIES,2,2011-11-11 09:05:00,1.25,,United Kingdom
575739,21417,COCKLE SHELL DISH,8,2011-11-11 09:05:00,4.13,,United Kingdom
575739,21429,RED GINGHAM ROSE JEWELLERY BOX,1,2011-11-11 09:05:00,4.13,,United Kingdom
575739,21430,SET/3 RED GINGHAM ROSE STORAGE BOX,1,2011-11-11 09:05:00,7.46,,United Kingdom
575739,21462,"NURSERY A,B,C PAINTED LETTERS",1,2011-11-11 09:05:00,13.29,,United Kingdom
575739,21479,WHITE SKULL HOT WATER BOTTLE ,1,2011-11-11 09:05:00,8.29,,United Kingdom
575739,21494,ROTATING LEAVES T-LIGHT HOLDER,10,2011-11-11 09:05:00,2.46,,United Kingdom
575739,21507,ELEPHANT BIRTHDAY CARD ,1,2011-11-11 09:05:00,0.83,,United Kingdom
575739,21508,VINTAGE KID DOLLY CARD ,1,2011-11-11 09:05:00,0.83,,United Kingdom
575739,21557,SET OF 6 FUNKY BEAKERS,1,2011-11-11 09:05:00,5.79,,United Kingdom
575739,21561,DINOSAUR LUNCH BOX WITH CUTLERY,1,2011-11-11 09:05:00,4.96,,United Kingdom
575739,21616,4 PEAR BOTANICAL DINNER CANDLES,1,2011-11-11 09:05:00,3.29,,United Kingdom
575739,21619,4 VANILLA BOTANICAL CANDLES,1,2011-11-11 09:05:00,3.29,,United Kingdom
575739,21642,ASSORTED TUTTI FRUTTI PEN,1,2011-11-11 09:05:00,1.63,,United Kingdom
575739,21650,ASSORTED TUTTI FRUTTI BRACELET,30,2011-11-11 09:05:00,0.83,,United Kingdom
575739,21675,BUTTERFLIES STICKERS,2,2011-11-11 09:05:00,1.63,,United Kingdom
575739,21676,FLOWERS  STICKERS,1,2011-11-11 09:05:00,1.63,,United Kingdom
575739,21680,WOODLAND  STICKERS,3,2011-11-11 09:05:00,1.63,,United Kingdom
575739,21703,BAG 125g SWIRLY MARBLES,2,2011-11-11 09:05:00,0.83,,United Kingdom
575739,21704,BAG 250g SWIRLY MARBLES,3,2011-11-11 09:05:00,1.63,,United Kingdom
575739,21705,BAG 500g SWIRLY MARBLES,2,2011-11-11 09:05:00,3.29,,United Kingdom
575739,21739,COSY SLIPPER SHOES SMALL GREEN,1,2011-11-11 09:05:00,2.46,,United Kingdom
575739,21744,SNOWFLAKE PORTABLE TABLE LIGHT ,3,2011-11-11 09:05:00,2.46,,United Kingdom
575739,21755,LOVE BUILDING BLOCK WORD,1,2011-11-11 09:05:00,12.46,,United Kingdom
575739,21756,BATH BUILDING BLOCK WORD,1,2011-11-11 09:05:00,11.63,,United Kingdom
575739,21773,DECORATIVE ROSE BATHROOM BOTTLE,1,2011-11-11 09:05:00,2.46,,United Kingdom
575739,21774,DECORATIVE CATS BATHROOM BOTTLE,1,2011-11-11 09:05:00,2.46,,United Kingdom
575739,21786,POLKADOT RAIN HAT ,1,2011-11-11 09:05:00,0.83,,United Kingdom
575739,21787,RAIN PONCHO RETROSPOT,1,2011-11-11 09:05:00,1.63,,United Kingdom
575739,21788,KIDS RAIN MAC BLUE,1,2011-11-11 09:05:00,1.63,,United Kingdom
575739,21790,VINTAGE SNAP CARDS,5,2011-11-11 09:05:00,1.63,,United Kingdom
575739,21791,VINTAGE HEADS AND TAILS CARD GAME ,8,2011-11-11 09:05:00,2.46,,United Kingdom
575739,21803,CHRISTMAS TREE STAR DECORATION,15,2011-11-11 09:05:00,0.42,,United Kingdom
575739,21804,WHITE CHRISTMAS GARLAND STARS TREES,2,2011-11-11 09:05:00,3.29,,United Kingdom
575739,21808,"CHRISTMAS GARLAND STARS,TREES",6,2011-11-11 09:05:00,3.29,,United Kingdom
575739,21810,CHRISTMAS HANGING STAR WITH BELL,15,2011-11-11 09:05:00,0.83,,United Kingdom
575739,21811,HANGING HEART WITH BELL,12,2011-11-11 09:05:00,0.83,,United Kingdom
575739,21812,GARLAND WITH HEARTS AND BELLS,5,2011-11-11 09:05:00,3.29,,United Kingdom
575739,21813,GARLAND WITH STARS AND BELLS,4,2011-11-11 09:05:00,3.29,,United Kingdom
575739,21818,GLITTER HEART DECORATION,1,2011-11-11 09:05:00,1.63,,United Kingdom
575739,21833,CAMOUFLAGE LED TORCH,1,2011-11-11 09:05:00,3.29,,United Kingdom
575739,21843,RED RETROSPOT CAKE STAND,1,2011-11-11 09:05:00,20.79,,United Kingdom
575739,21868,POTTING SHED TEA MUG,1,2011-11-11 09:05:00,3.29,,United Kingdom
575739,21871,SAVE THE PLANET MUG,1,2011-11-11 09:05:00,3.29,,United Kingdom
575739,21874,GIN AND TONIC MUG,1,2011-11-11 09:05:00,3.29,,United Kingdom
575739,21876,POTTERING MUG,2,2011-11-11 09:05:00,3.29,,United Kingdom
575739,21877,HOME SWEET HOME MUG,1,2011-11-11 09:05:00,3.29,,United Kingdom
575739,21883,STARS GIFT TAPE ,2,2011-11-11 09:05:00,1.63,,United Kingdom
575739,21892,TRADITIONAL WOODEN CATCH CUP GAME ,1,2011-11-11 09:05:00,2.46,,United Kingdom
575739,21894,POTTING SHED SEED ENVELOPES,1,2011-11-11 09:05:00,2.46,,United Kingdom
575739,21899,GARAGE KEY FOB,2,2011-11-11 09:05:00,1.63,,United Kingdom
575739,21900,"KEY FOB , SHED",3,2011-11-11 09:05:00,1.63,,United Kingdom
575739,21901,"KEY FOB , BACK DOOR ",2,2011-11-11 09:05:00,1.63,,United Kingdom
575739,21902,"KEY FOB , FRONT  DOOR ",1,2011-11-11 09:05:00,1.63,,United Kingdom
575739,21905,MORE BUTTER METAL SIGN ,1,2011-11-11 09:05:00,1.63,,United Kingdom
575739,21914,BLUE HARMONICA IN BOX ,4,2011-11-11 09:05:00,2.46,,United Kingdom
575739,21915,RED  HARMONICA IN BOX ,2,2011-11-11 09:05:00,2.46,,United Kingdom
575739,21931,JUMBO STORAGE BAG SUKI,3,2011-11-11 09:05:00,4.13,,United Kingdom
575739,21932,SCANDINAVIAN PAISLEY PICNIC BAG,2,2011-11-11 09:05:00,2.46,,United Kingdom
575739,21934,SKULL SHOULDER BAG,7,2011-11-11 09:05:00,1.63,,United Kingdom
575739,21935,SUKI  SHOULDER BAG,7,2011-11-11 09:05:00,1.63,,United Kingdom
575739,21936,RED RETROSPOT PICNIC BAG,1,2011-11-11 09:05:00,5.79,,United Kingdom
575739,21942,SKULLS DESIGN FLANNEL,1,2011-11-11 09:05:00,1.63,,United Kingdom
575739,21945,STRAWBERRIES  DESIGN FLANNEL ,1,2011-11-11 09:05:00,1.63,,United Kingdom
575739,21955,DOORMAT UNION JACK GUNS AND ROSES,1,2011-11-11 09:05:00,15.79,,United Kingdom
575739,21977,PACK OF 60 PINK PAISLEY CAKE CASES,1,2011-11-11 09:05:00,1.25,,United Kingdom
575739,21981,PACK OF 12 WOODLAND TISSUES ,1,2011-11-11 09:05:00,0.83,,United Kingdom
575739,21982,PACK OF 12 SUKI TISSUES ,4,2011-11-11 09:05:00,0.83,,United Kingdom
575739,21992,VINTAGE PAISLEY STATIONERY SET,2,2011-11-11 09:05:00,2.46,,United Kingdom
575739,22024,RAINY LADIES BIRTHDAY CARD,1,2011-11-11 09:05:00,0.83,,United Kingdom
575739,22026,BANQUET BIRTHDAY  CARD  ,2,2011-11-11 09:05:00,0.83,,United Kingdom
575739,22027,TEA PARTY BIRTHDAY CARD,1,2011-11-11 09:05:00,0.83,,United Kingdom
575739,22029,SPACEBOY BIRTHDAY CARD,1,2011-11-11 09:05:00,0.83,,United Kingdom
575739,22074,6 RIBBONS SHIMMERING PINKS ,2,2011-11-11 09:05:00,1.25,,United Kingdom
575739,22075,6 RIBBONS ELEGANT CHRISTMAS ,6,2011-11-11 09:05:00,1.63,,United Kingdom
575739,22076,6 RIBBONS EMPIRE  ,2,2011-11-11 09:05:00,1.25,,United Kingdom
575739,22077,6 RIBBONS RUSTIC CHARM,1,2011-11-11 09:05:00,4.13,,United Kingdom
575739,22086,PAPER CHAIN KIT 50'S CHRISTMAS ,4,2011-11-11 09:05:00,5.79,,United Kingdom
575739,22090,PAPER BUNTING RETROSPOT,1,2011-11-11 09:05:00,5.79,,United Kingdom
575739,22101,MIRROR MOSAIC VOTIVE HOLDER,10,2011-11-11 09:05:00,2.46,,United Kingdom
575739,22102,MIRROR MOSAIC T-LIGHT HOLDER ,6,2011-11-11 09:05:00,3.29,,United Kingdom
575739,22107,PIZZA PLATE IN BOX,7,2011-11-11 09:05:00,3.29,,United Kingdom
575739,22109,FULL ENGLISH BREAKFAST PLATE,3,2011-11-11 09:05:00,7.46,,United Kingdom
575739,22110,BIRD HOUSE HOT WATER BOTTLE,1,2011-11-11 09:05:00,5.79,,United Kingdom
575739,22114,HOT WATER BOTTLE TEA AND SYMPATHY,1,2011-11-11 09:05:00,8.29,,United Kingdom
575739,22116,METAL SIGN HIS DINNER IS SERVED,1,2011-11-11 09:05:00,1.63,,United Kingdom
575739,22123,PING MICROWAVE APRON,1,2011-11-11 09:05:00,4.13,,United Kingdom
575739,22124,SET OF 2 TEA TOWELS PING MICROWAVE,1,2011-11-11 09:05:00,2.46,,United Kingdom
575739,22129,PARTY CONES CANDY DECORATION,1,2011-11-11 09:05:00,2.46,,United Kingdom
575739,22134,MINI LADLE LOVE HEART RED ,5,2011-11-11 09:05:00,0.83,,United Kingdom
575739,22139,RETROSPOT TEA SET CERAMIC 11 PC ,1,2011-11-11 09:05:00,10.79,,United Kingdom
575739,22141,CHRISTMAS CRAFT TREE TOP ANGEL,3,2011-11-11 09:05:00,4.13,,United Kingdom
575739,22150,3 STRIPEY MICE FELTCRAFT,2,2011-11-11 09:05:00,4.13,,United Kingdom
575739,22154,ANGEL DECORATION 3 BUTTONS ,1,2011-11-11 09:05:00,0.83,,United Kingdom
575739,22155,STAR DECORATION RUSTIC,1,2011-11-11 09:05:00,0.83,,United Kingdom
575739,22156,HEART DECORATION WITH PEARLS ,2,2011-11-11 09:05:00,1.63,,United Kingdom
575739,22158,3 HEARTS HANGING DECORATION RUSTIC,1,2011-11-11 09:05:00,5.79,,United Kingdom
575739,22161,HEART DECORATION RUSTIC HANGING ,15,2011-11-11 09:05:00,0.79,,United Kingdom
575739,22163,HEART STRING MEMO HOLDER HANGING,6,2011-11-11 09:05:00,1.63,,United Kingdom
575739,22173,METAL 4 HOOK HANGER FRENCH CHATEAU,1,2011-11-11 09:05:00,5.79,,United Kingdom
575739,22174,PHOTO CUBE,3,2011-11-11 09:05:00,3.29,,United Kingdom
575739,22178,VICTORIAN GLASS HANGING T-LIGHT,1,2011-11-11 09:05:00,2.46,,United Kingdom
575739,22179,SET 10 NIGHT OWL LIGHTS,1,2011-11-11 09:05:00,13.29,,United Kingdom
575739,22185,SLATE TILE NATURAL HANGING,2,2011-11-11 09:05:00,3.29,,United Kingdom
575739,22195,LARGE HEART MEASURING SPOONS,1,2011-11-11 09:05:00,3.29,,United Kingdom
575739,22197,POPCORN HOLDER,3,2011-11-11 09:05:00,1.63,,United Kingdom
575739,22201,FRYING PAN BLUE POLKADOT,1,2011-11-11 09:05:00,8.29,,United Kingdom
575739,22207,FRYING PAN UNION FLAG,1,2011-11-11 09:05:00,8.29,,United Kingdom
575739,22219,LOVEBIRD HANGING DECORATION WHITE ,1,2011-11-11 09:05:00,1.63,,United Kingdom
575739,22222,CAKE PLATE LOVEBIRD WHITE,1,2011-11-11 09:05:00,9.96,,United Kingdom
575739,22227,HANGING HEART MIRROR DECORATION ,1,2011-11-11 09:05:00,1.25,,United Kingdom
575739,22250,DECORATION  BUTTERFLY  MAGIC GARDEN,1,2011-11-11 09:05:00,1.63,,United Kingdom
575739,22251,BIRDHOUSE DECORATION MAGIC GARDEN,2,2011-11-11 09:05:00,2.46,,United Kingdom
575739,22260,FELT EGG COSY BLUE RABBIT ,1,2011-11-11 09:05:00,1.63,,United Kingdom
575739,22274,FELTCRAFT DOLL EMILY,1,2011-11-11 09:05:00,5.79,,United Kingdom
575739,22302,COFFEE MUG PEARS  DESIGN,1,2011-11-11 09:05:00,4.96,,United Kingdom
575739,22303,COFFEE MUG APPLES DESIGN,2,2011-11-11 09:05:00,4.96,,United Kingdom
575739,22315,200 RED + WHITE BENDY STRAWS,1,2011-11-11 09:05:00,2.46,,United Kingdom
575739,22321,BIRD DECORATION RED RETROSPOT,1,2011-11-11 09:05:00,1.63,,United Kingdom
575739,22326,ROUND SNACK BOXES SET OF4 WOODLAND ,1,2011-11-11 09:05:00,5.79,,United Kingdom
575739,22335,HEART DECORATION PAINTED ZINC ,8,2011-11-11 09:05:00,1.25,,United Kingdom
575739,22337,ANGEL DECORATION PAINTED ZINC ,11,2011-11-11 09:05:00,0.63,,United Kingdom
575739,22338,STAR DECORATION PAINTED ZINC ,17,2011-11-11 09:05:00,0.63,,United Kingdom
575739,22339,CHRISTMAS TREE PAINTED ZINC ,5,2011-11-11 09:05:00,0.63,,United Kingdom
575739,22340,NOEL GARLAND PAINTED ZINC ,14,2011-11-11 09:05:00,0.83,,United Kingdom
575739,22352,LUNCH BOX WITH CUTLERY RETROSPOT ,2,2011-11-11 09:05:00,4.96,,United Kingdom
575739,22355,CHARLOTTE BAG SUKI DESIGN,1,2011-11-11 09:05:00,1.63,,United Kingdom
575739,22356,CHARLOTTE BAG PINK POLKADOT,1,2011-11-11 09:05:00,1.63,,United Kingdom
575739,22360,GLASS JAR ENGLISH CONFECTIONERY,1,2011-11-11 09:05:00,5.79,,United Kingdom
575739,22364,GLASS JAR DIGESTIVE BISCUITS,1,2011-11-11 09:05:00,5.79,,United Kingdom
575739,22378,WALL TIDY RETROSPOT ,2,2011-11-11 09:05:00,4.13,,United Kingdom
575739,22386,JUMBO BAG PINK POLKADOT,3,2011-11-11 09:05:00,4.13,,United Kingdom
575739,22414,DOORMAT NEIGHBOURHOOD WITCH ,1,2011-11-11 09:05:00,15.79,,United Kingdom
575739,22418,10 COLOUR SPACEBOY PEN,2,2011-11-11 09:05:00,1.63,,United Kingdom
575739,22419,LIPSTICK PEN RED,7,2011-11-11 09:05:00,0.83,,United Kingdom
575739,22421,LIPSTICK PEN FUSCHIA,1,2011-11-11 09:05:00,0.83,,United Kingdom
575739,22422,TOOTHPASTE TUBE PEN,4,2011-11-11 09:05:00,1.25,,United Kingdom
575739,22423,REGENCY CAKESTAND 3 TIER,1,2011-11-11 09:05:00,24.96,,United Kingdom
575739,22446,PIN CUSHION BABUSHKA PINK,1,2011-11-11 09:05:00,2.46,,United Kingdom
575739,22457,NATURAL SLATE HEART CHALKBOARD ,1,2011-11-11 09:05:00,5.79,,United Kingdom
575739,22464,HANGING METAL HEART LANTERN,1,2011-11-11 09:05:00,3.29,,United Kingdom
575739,22467,GUMBALL COAT RACK,2,2011-11-11 09:05:00,4.96,,United Kingdom
575739,22469,HEART OF WICKER SMALL,2,2011-11-11 09:05:00,3.29,,United Kingdom
575739,22472,TV DINNER TRAY DOLLY GIRL,1,2011-11-11 09:05:00,10.79,,United Kingdom
575739,22488,NATURAL SLATE RECTANGLE CHALKBOARD,16,2011-11-11 09:05:00,3.29,,United Kingdom
575739,22493,PAINT YOUR OWN CANVAS SET,1,2011-11-11 09:05:00,3.29,,United Kingdom
575739,22507,MEMO BOARD RETROSPOT  DESIGN,1,2011-11-11 09:05:00,10.79,,United Kingdom
575739,22539,MINI JIGSAW DOLLY GIRL,1,2011-11-11 09:05:00,0.83,,United Kingdom
575739,22543,MINI JIGSAW BAKE A CAKE ,1,2011-11-11 09:05:00,0.83,,United Kingdom
575739,22546,MINI JIGSAW PURDEY,1,2011-11-11 09:05:00,0.83,,United Kingdom
575739,22547,MINI JIGSAW DINOSAUR ,1,2011-11-11 09:05:00,0.83,,United Kingdom
575739,22551,PLASTERS IN TIN SPACEBOY,1,2011-11-11 09:05:00,3.29,,United Kingdom
575739,22554,PLASTERS IN TIN WOODLAND ANIMALS,1,2011-11-11 09:05:00,3.29,,United Kingdom
575739,22555,PLASTERS IN TIN STRONGMAN,1,2011-11-11 09:05:00,3.29,,United Kingdom
575739,22558,CLOTHES PEGS RETROSPOT PACK 24 ,1,2011-11-11 09:05:00,3.29,,United Kingdom
575739,22566,FELTCRAFT HAIRBAND PINK AND PURPLE,2,2011-11-11 09:05:00,1.63,,United Kingdom
575739,22571,ROCKING HORSE RED CHRISTMAS ,2,2011-11-11 09:05:00,1.63,,United Kingdom
575739,22572,ROCKING HORSE GREEN CHRISTMAS ,2,2011-11-11 09:05:00,1.63,,United Kingdom
575739,22573,STAR WOODEN CHRISTMAS DECORATION,1,2011-11-11 09:05:00,1.63,,United Kingdom
575739,22576,SWALLOW WOODEN CHRISTMAS DECORATION,1,2011-11-11 09:05:00,1.63,,United Kingdom
575739,22577,WOODEN HEART CHRISTMAS SCANDINAVIAN,28,2011-11-11 09:05:00,0.83,,United Kingdom
575739,22578,WOODEN STAR CHRISTMAS SCANDINAVIAN,21,2011-11-11 09:05:00,0.83,,United Kingdom
575739,22579,WOODEN TREE CHRISTMAS SCANDINAVIAN,20,2011-11-11 09:05:00,0.83,,United Kingdom
575739,22580,ADVENT CALENDAR GINGHAM SACK,7,2011-11-11 09:05:00,4.13,,United Kingdom
575739,22581,WOOD STOCKING CHRISTMAS SCANDISPOT,18,2011-11-11 09:05:00,0.83,,United Kingdom
575739,22582,PACK OF 6 SWEETIE GIFT BOXES,1,2011-11-11 09:05:00,4.96,,United Kingdom
575739,22586,FELTCRAFT HAIRBAND PINK AND BLUE,1,2011-11-11 09:05:00,1.63,,United Kingdom
575739,22592,CARDHOLDER HOLLY WREATH METAL,3,2011-11-11 09:05:00,7.46,,United Kingdom
575739,22593,CHRISTMAS GINGHAM STAR,1,2011-11-11 09:05:00,1.63,,United Kingdom
575739,22594,CHRISTMAS GINGHAM TREE,1,2011-11-11 09:05:00,1.63,,United Kingdom
575739,22595,GINGHAM HEART DECORATION,1,2011-11-11 09:05:00,1.63,,United Kingdom
575739,22596,CHRISTMAS STAR WISH LIST CHALKBOARD,2,2011-11-11 09:05:00,2.46,,United Kingdom
575739,22597,MUSICAL ZINC HEART DECORATION ,9,2011-11-11 09:05:00,0.83,,United Kingdom
575739,22598,CHRISTMAS MUSICAL ZINC TREE,8,2011-11-11 09:05:00,0.83,,United Kingdom
575739,22599,CHRISTMAS MUSICAL ZINC STAR,11,2011-11-11 09:05:00,0.83,,United Kingdom
575739,22614,PACK OF 12 SPACEBOY TISSUES,2,2011-11-11 09:05:00,0.83,,United Kingdom
575739,22616,PACK OF 12 LONDON TISSUES ,1,2011-11-11 09:05:00,0.83,,United Kingdom
575739,22620,4 TRADITIONAL SPINNING TOPS,5,2011-11-11 09:05:00,2.46,,United Kingdom
575739,22621,TRADITIONAL KNITTING NANCY,2,2011-11-11 09:05:00,3.29,,United Kingdom
575739,22627,MINT KITCHEN SCALES,1,2011-11-11 09:05:00,16.63,,United Kingdom
575739,22629,SPACEBOY LUNCH BOX ,2,2011-11-11 09:05:00,4.13,,United Kingdom
575739,22651,GENTLEMAN SHIRT REPAIR KIT ,2,2011-11-11 09:05:00,1.63,,United Kingdom
575739,22653,BUTTON BOX ,14,2011-11-11 09:05:00,1.63,,United Kingdom
575739,22661,CHARLOTTE BAG DOLLY GIRL DESIGN,1,2011-11-11 09:05:00,1.63,,United Kingdom
575739,22662,LUNCH BAG DOLLY GIRL DESIGN,1,2011-11-11 09:05:00,4.13,,United Kingdom
575739,22663,JUMBO BAG DOLLY GIRL DESIGN,1,2011-11-11 09:05:00,4.13,,United Kingdom
575739,22664,TOY TIDY DOLLY GIRL DESIGN,1,2011-11-11 09:05:00,4.13,,United Kingdom
575739,22666,RECIPE BOX PANTRY YELLOW DESIGN,1,2011-11-11 09:05:00,5.79,,United Kingdom
575739,22672,FRENCH BATHROOM SIGN BLUE METAL,1,2011-11-11 09:05:00,3.29,,United Kingdom
575739,22690,DOORMAT HOME SWEET HOME BLUE ,1,2011-11-11 09:05:00,15.79,,United Kingdom
575739,22696,WICKER WREATH LARGE,1,2011-11-11 09:05:00,4.13,,United Kingdom
575739,22699,ROSES REGENCY TEACUP AND SAUCER ,4,2011-11-11 09:05:00,5.79,,United Kingdom
575739,22713,CARD I LOVE LONDON ,1,2011-11-11 09:05:00,0.83,,United Kingdom
575739,22716,CARD CIRCUS PARADE,1,2011-11-11 09:05:00,0.83,,United Kingdom
575739,22720,SET OF 3 CAKE TINS PANTRY DESIGN ,2,2011-11-11 09:05:00,10.79,,United Kingdom
575739,22722,SET OF 6 SPICE TINS PANTRY DESIGN,17,2011-11-11 09:05:00,4.13,,United Kingdom
575739,22725,ALARM CLOCK BAKELIKE CHOCOLATE,1,2011-11-11 09:05:00,7.46,,United Kingdom
575739,22726,ALARM CLOCK BAKELIKE GREEN,2,2011-11-11 09:05:00,7.46,,United Kingdom
575739,22728,ALARM CLOCK BAKELIKE PINK,1,2011-11-11 09:05:00,7.46,,United Kingdom
575739,22731,3D CHRISTMAS STAMPS STICKERS ,2,2011-11-11 09:05:00,2.46,,United Kingdom
