InvoiceNo,StockCode,Description,Quantity,InvoiceDate,UnitPrice,CustomerID,Country
555322,85099B,JUMBO BAG RED RETROSPOT,1,2011-06-02 11:01:00,4.13,,United Kingdom
555322,DOT,DOTCOM POSTAGE,1,2011-06-02 11:01:00,88.71,,United Kingdom
555323,20711,JUMBO BAG TOYS ,1,2011-06-02 11:02:00,4.13,,United Kingdom
555323,20712,JUMBO BAG WOODLAND ANIMALS,3,2011-06-02 11:02:00,4.13,,United Kingdom
555323,21033,JUMBO BAG CHARLIE AND LOLA TOYS,1,2011-06-02 11:02:00,4.13,,United Kingdom
555323,21169,YOU'RE CONFUSING ME METAL SIGN ,1,2011-06-02 11:02:00,4.13,,United Kingdom
555323,21216,"SET 3 RETROSPOT TEA,COFFEE,SUGAR",1,2011-06-02 11:02:00,10.79,,United Kingdom
555323,21876,POTTERING MUG,1,2011-06-02 11:02:00,3.29,,United Kingdom
555323,21929,JUMBO BAG PINK VINTAGE PAISLEY,1,2011-06-02 11:02:00,4.13,,United Kingdom
555323,21930,JUMBO STORAGE BAG SKULLS,1,2011-06-02 11:02:00,4.96,,United Kingdom
555323,21931,JUMBO STORAGE BAG SUKI,3,2011-06-02 11:02:00,4.13,,United Kingdom
555323,22089,PAPER BUNTING VINTAGE PAISLEY,6,2011-06-02 11:02:00,4.13,,United Kingdom
555323,22167, OVAL WALL MIRROR DIAMANTE ,1,2011-06-02 11:02:00,19.96,,United Kingdom
555323,22385,JUMBO BAG SPACEBOY DESIGN,1,2011-06-02 11:02:00,4.13,,United Kingdom
555323,22629,SPACEBOY LUNCH BOX ,1,2011-06-02 11:02:00,2.46,,United Kingdom
555323,22630,DOLLY GIRL LUNCH BOX,1,2011-06-02 11:02:00,2.46,,United Kingdom
555323,22659,LUNCH BOX I LOVE LONDON,1,2011-06-02 11:02:00,2.46,,United Kingdom
555323,22844,VINTAGE CREAM DOG FOOD CONTAINER,1,2011-06-02 11:02:00,16.63,,United Kingdom
555323,22852,DOG BOWL VINTAGE CREAM,2,2011-06-02 11:02:00,8.29,,United Kingdom
555323,84997a,CHILDRENS CUTLERY POLKADOT GREEN ,1,2011-06-02 11:02:00,8.29,,United Kingdom
555323,DOT,DOTCOM POSTAGE,1,2011-06-02 11:02:00,46.0,,United Kingdom
555324,20658,RED RETROSPOT LUGGAGE TAG,1,2011-06-02 11:02:00,2.46,,United Kingdom
555324,20665,RED RETROSPOT PURSE ,1,2011-06-02 11:02:00,5.79,,United Kingdom
555324,20711,JUMBO BAG TOYS ,1,2011-06-02 11:02:00,4.13,,United Kingdom
555324,20712,JUMBO BAG WOODLAND ANIMALS,7,2011-06-02 11:02:00,4.13,,United Kingdom
555324,21078,SET/20 STRAWBERRY PAPER NAPKINS ,2,2011-06-02 11:02:00,2.46,,United Kingdom
555324,21080,SET/20 RED RETROSPOT PAPER NAPKINS ,1,2011-06-02 11:02:00,2.46,,United Kingdom
555324,21166,COOK WITH WINE METAL SIGN ,1,2011-06-02 11:02:00,4.13,,United Kingdom
555324,21430,SET/3 RED GINGHAM ROSE STORAGE BOX,1,2011-06-02 11:02:00,7.46,,United Kingdom
555324,21700,BIG DOUGHNUT FRIDGE MAGNETS,3,2011-06-02 11:02:00,8.29,,United Kingdom
555324,21786,POLKADOT RAIN HAT ,2,2011-06-02 11:02:00,0.79,,United Kingdom
555324,21843,RED RETROSPOT CAKE STAND,1,2011-06-02 11:02:00,20.79,,United Kingdom
555324,21931,JUMBO STORAGE BAG SUKI,1,2011-06-02 11:02:00,4.13,,United Kingdom
555324,21935,SUKI  SHOULDER BAG,1,2011-06-02 11:02:00,4.13,,United Kingdom
555324,21989,PACK OF 20 SKULL PAPER NAPKINS,1,2011-06-02 11:02:00,1.63,,United Kingdom
555324,22069,BROWN  PIRATE TREASURE CHEST ,1,2011-06-02 11:02:00,4.13,,United Kingdom
555324,22089,PAPER BUNTING VINTAGE PAISLEY,1,2011-06-02 11:02:00,4.13,,United Kingdom
555324,22134,MINI LADLE LOVE HEART RED ,1,2011-06-02 11:02:00,0.83,,United Kingdom
555324,22135,MINI LADLE LOVE HEART PINK,1,2011-06-02 11:02:00,0.83,,United Kingdom
555324,22178,VICTORIAN GLASS HANGING T-LIGHT,2,2011-06-02 11:02:00,2.46,,United Kingdom
555324,22196,SMALL HEART MEASURING SPOONS,1,2011-06-02 11:02:00,1.63,,United Kingdom
555324,22379,RECYCLING BAG RETROSPOT ,1,2011-06-02 11:02:00,4.96,,United Kingdom
555324,22385,JUMBO BAG SPACEBOY DESIGN,2,2011-06-02 11:02:00,4.13,,United Kingdom
555324,22386,JUMBO BAG PINK POLKADOT,1,2011-06-02 11:02:00,4.13,,United Kingdom
555324,22411,JUMBO SHOPPER VINTAGE RED PAISLEY,7,2011-06-02 11:02:00,4.13,,United Kingdom
555324,22467,GUMBALL COAT RACK,1,2011-06-02 11:02:00,4.96,,United Kingdom
555324,22501,PICNIC BASKET WICKER LARGE,1,2011-06-02 11:02:00,20.79,,United Kingdom
555324,22507,MEMO BOARD RETROSPOT  DESIGN,1,2011-06-02 11:02:00,10.79,,United Kingdom
555324,22663,JUMBO BAG DOLLY GIRL DESIGN,1,2011-06-02 11:02:00,4.13,,United Kingdom
555324,22807,SET OF 6 T-LIGHTS TOADSTOOLS,1,2011-06-02 11:02:00,5.79,,United Kingdom
555324,22844,VINTAGE CREAM DOG FOOD CONTAINER,1,2011-06-02 11:02:00,16.63,,United Kingdom
555324,22964,3 PIECE SPACEBOY COOKIE CUTTER SET,1,2011-06-02 11:02:00,4.13,,United Kingdom
555324,22992,REVOLVER WOODEN RULER ,1,2011-06-02 11:02:00,3.75,,United Kingdom
555324,23042,PAPER LANTERN 7 POINT SNOW STAR,1,2011-06-02 11:02:00,13.29,,United Kingdom
555324,23148,MINIATURE ANTIQUE ROSE HOOK IVORY,1,2011-06-02 11:02:00,2.46,,United Kingdom
555324,23199,JUMBO BAG APPLES,3,2011-06-02 11:02:00,4.13,,United Kingdom
555324,72351a,SET/6 TURQUOISE BUTTERFLY T-LIGHTS,1,2011-06-02 11:02:00,4.13,,United Kingdom
555324,84509a,SET OF 4 ENGLISH ROSE PLACEMATS,1,2011-06-02 11:02:00,7.46,,United Kingdom
555324,84510a,SET OF 4 ENGLISH ROSE COASTERS,1,2011-06-02 11:02:00,2.46,,United Kingdom
555324,84660a,WHITE STITCHED WALL CLOCK,3,2011-06-02 11:02:00,7.46,,United Kingdom
555324,84884a,ANT WHITE WIRE HEART SPIRAL,1,2011-06-02 11:02:00,8.29,,United Kingdom
555324,85040a,S/4 PINK FLOWER CANDLES IN BOWL,5,2011-06-02 11:02:00,3.29,,United Kingdom
555324,85099B,JUMBO BAG RED RETROSPOT,3,2011-06-02 11:02:00,4.13,,United Kingdom
555324,DOT,DOTCOM POSTAGE,1,2011-06-02 11:02:00,124.08,,United Kingdom
555325,20655,QUEEN OF SKIES LUGGAGE TAG,1,2011-06-02 11:02:00,2.46,,United Kingdom
555325,20711,JUMBO BAG TOYS ,1,2011-06-02 11:02:00,4.13,,United Kingdom
555325,20712,JUMBO BAG WOODLAND ANIMALS,1,2011-06-02 11:02:00,4.13,,United Kingdom
555325,20716,PARTY FOOD SHOPPER BAG,1,2011-06-02 11:02:00,2.46,,United Kingdom
555325,20978,36 PENCILS TUBE SKULLS,1,2011-06-02 11:02:00,2.46,,United Kingdom
555325,21328,BALLOONS  WRITING SET ,1,2011-06-02 11:02:00,3.29,,United Kingdom
555325,21430,SET/3 RED GINGHAM ROSE STORAGE BOX,1,2011-06-02 11:02:00,7.46,,United Kingdom
555325,21523,DOORMAT FANCY FONT HOME SWEET HOME,1,2011-06-02 11:02:00,16.63,,United Kingdom
555325,21557,SET OF 6 FUNKY BEAKERS,1,2011-06-02 11:02:00,5.63,,United Kingdom
555325,21721,CANDY SHOP  STICKER SHEET,1,2011-06-02 11:02:00,1.63,,United Kingdom
555325,21930,JUMBO STORAGE BAG SKULLS,1,2011-06-02 11:02:00,4.96,,United Kingdom
555325,21931,JUMBO STORAGE BAG SUKI,2,2011-06-02 11:02:00,4.13,,United Kingdom
555325,21935,SUKI  SHOULDER BAG,1,2011-06-02 11:02:00,4.13,,United Kingdom
555325,21942,SKULLS DESIGN FLANNEL,1,2011-06-02 11:02:00,1.63,,United Kingdom
555325,22197,SMALL POPCORN HOLDER,1,2011-06-02 11:02:00,1.63,,United Kingdom
555325,22207,FRYING PAN UNION FLAG,1,2011-06-02 11:02:00,8.29,,United Kingdom
555325,22358,KINGS CHOICE TEA CADDY ,1,2011-06-02 11:02:00,5.79,,United Kingdom
555325,22379,RECYCLING BAG RETROSPOT ,1,2011-06-02 11:02:00,4.96,,United Kingdom
555325,22502,PICNIC BASKET WICKER SMALL,2,2011-06-02 11:02:00,10.79,,United Kingdom
555325,22891,TEA FOR ONE POLKADOT,1,2011-06-02 11:02:00,8.29,,United Kingdom
555325,84380,SET OF 3 BUTTERFLY COOKIE CUTTERS,1,2011-06-02 11:02:00,3.29,,United Kingdom
555325,84997a,CHILDRENS CUTLERY POLKADOT GREEN ,3,2011-06-02 11:02:00,8.29,,United Kingdom
555325,DOT,DOTCOM POSTAGE,1,2011-06-02 11:02:00,47.67,,United Kingdom
555326,21080,SET/20 RED RETROSPOT PAPER NAPKINS ,1,2011-06-02 11:03:00,2.46,,United Kingdom
555326,21086,SET/6 RED SPOTTY PAPER CUPS,1,2011-06-02 11:03:00,1.63,,United Kingdom
555326,21094,SET/6 RED SPOTTY PAPER PLATES,5,2011-06-02 11:03:00,2.46,,United Kingdom
555326,21098,CHRISTMAS TOILET ROLL,1,2011-06-02 11:03:00,3.29,,United Kingdom
555326,21116,OWL DOORSTOP,1,2011-06-02 11:03:00,8.29,,United Kingdom
555326,21166,COOK WITH WINE METAL SIGN ,2,2011-06-02 11:03:00,4.13,,United Kingdom
555326,21557,SET OF 6 FUNKY BEAKERS,1,2011-06-02 11:03:00,5.63,,United Kingdom
555326,21559,STRAWBERRY LUNCH BOX WITH CUTLERY,1,2011-06-02 11:03:00,4.96,,United Kingdom
555326,21786,POLKADOT RAIN HAT ,2,2011-06-02 11:03:00,0.79,,United Kingdom
555326,21929,JUMBO BAG PINK VINTAGE PAISLEY,3,2011-06-02 11:03:00,4.13,,United Kingdom
555326,21931,JUMBO STORAGE BAG SUKI,3,2011-06-02 11:03:00,4.13,,United Kingdom
555326,21935,SUKI  SHOULDER BAG,1,2011-06-02 11:03:00,4.13,,United Kingdom
555326,21955,DOORMAT UNION JACK GUNS AND ROSES,1,2011-06-02 11:03:00,12.46,,United Kingdom
555326,22131,FOOD CONTAINER SET 3 LOVE HEART ,1,2011-06-02 11:03:00,4.13,,United Kingdom
555326,22156,HEART DECORATION WITH PEARLS ,2,2011-06-02 11:03:00,1.63,,United Kingdom
555326,22178,VICTORIAN GLASS HANGING T-LIGHT,2,2011-06-02 11:03:00,2.46,,United Kingdom
555326,22219,LOVEBIRD HANGING DECORATION WHITE ,3,2011-06-02 11:03:00,1.63,,United Kingdom
555326,22352,LUNCH BOX WITH CUTLERY RETROSPOT ,1,2011-06-02 11:03:00,4.96,,United Kingdom
555326,22385,JUMBO BAG SPACEBOY DESIGN,2,2011-06-02 11:03:00,4.13,,United Kingdom
555326,22411,JUMBO SHOPPER VINTAGE RED PAISLEY,3,2011-06-02 11:03:00,4.13,,United Kingdom
555326,22507,MEMO BOARD RETROSPOT  DESIGN,1,2011-06-02 11:03:00,10.79,,United Kingdom
555326,22629,SPACEBOY LUNCH BOX ,1,2011-06-02 11:03:00,2.46,,United Kingdom
555326,22964,3 PIECE SPACEBOY COOKIE CUTTER SET,1,2011-06-02 11:03:00,4.13,,United Kingdom
555326,22966,GINGERBREAD MAN COOKIE CUTTER,1,2011-06-02 11:03:00,2.46,,United Kingdom
555326,82580,BATHROOM METAL SIGN,1,2011-06-02 11:03:00,1.25,,United Kingdom
555326,85123a,WHITE HANGING HEART T-LIGHT HOLDER,1,2011-06-02 11:03:00,6.63,,United Kingdom
555326,DOT,DOTCOM POSTAGE,1,2011-06-02 11:03:00,79.67,,United Kingdom
555326,15056n,EDWARDIAN PARASOL NATURAL,1,2011-06-02 11:03:00,12.46,,United Kingdom
555326,20718,RED RETROSPOT SHOPPER BAG,1,2011-06-02 11:03:00,3.29,,United Kingdom
555326,20735,BLACK MINI TAPE MEASURE ,1,2011-06-02 11:03:00,1.63,,United Kingdom
555326,21033,JUMBO BAG CHARLIE AND LOLA TOYS,1,2011-06-02 11:03:00,4.13,,United Kingdom
555326,21078,SET/20 STRAWBERRY PAPER NAPKINS ,1,2011-06-02 11:03:00,2.46,,United Kingdom
555327,20665,RED RETROSPOT PURSE ,1,2011-06-02 11:03:00,5.79,,United Kingdom
555327,20711,JUMBO BAG TOYS ,1,2011-06-02 11:03:00,4.13,,United Kingdom
555327,20712,JUMBO BAG WOODLAND ANIMALS,2,2011-06-02 11:03:00,4.13,,United Kingdom
555327,20718,RED RETROSPOT SHOPPER BAG,1,2011-06-02 11:03:00,3.29,,United Kingdom
555327,21035,SET/2 RED RETROSPOT TEA TOWELS ,1,2011-06-02 11:03:00,6.25,,United Kingdom
555327,21078,SET/20 STRAWBERRY PAPER NAPKINS ,1,2011-06-02 11:03:00,2.46,,United Kingdom
555327,21080,SET/20 RED RETROSPOT PAPER NAPKINS ,2,2011-06-02 11:03:00,2.46,,United Kingdom
555327,21094,SET/6 RED SPOTTY PAPER PLATES,3,2011-06-02 11:03:00,2.46,,United Kingdom
555327,21166,COOK WITH WINE METAL SIGN ,1,2011-06-02 11:03:00,4.13,,United Kingdom
555327,21169,YOU'RE CONFUSING ME METAL SIGN ,1,2011-06-02 11:03:00,4.13,,United Kingdom
555327,21216,"SET 3 RETROSPOT TEA,COFFEE,SUGAR",2,2011-06-02 11:03:00,10.79,,United Kingdom
555327,21218,RED SPOTTY BISCUIT TIN,1,2011-06-02 11:03:00,8.29,,United Kingdom
555327,21559,STRAWBERRY LUNCH BOX WITH CUTLERY,1,2011-06-02 11:03:00,4.96,,United Kingdom
555327,21672,WHITE SPOT RED CERAMIC DRAWER KNOB,4,2011-06-02 11:03:00,2.46,,United Kingdom
555327,21700,BIG DOUGHNUT FRIDGE MAGNETS,1,2011-06-02 11:03:00,8.29,,United Kingdom
555327,21866,UNION JACK FLAG LUGGAGE TAG,1,2011-06-02 11:03:00,3.29,,United Kingdom
555327,21888,BINGO SET,1,2011-06-02 11:03:00,7.46,,United Kingdom
555327,21929,JUMBO BAG PINK VINTAGE PAISLEY,1,2011-06-02 11:03:00,4.13,,United Kingdom
555327,21930,JUMBO STORAGE BAG SKULLS,1,2011-06-02 11:03:00,4.96,,United Kingdom
555327,21931,JUMBO STORAGE BAG SUKI,6,2011-06-02 11:03:00,4.13,,United Kingdom
555327,21935,SUKI  SHOULDER BAG,1,2011-06-02 11:03:00,4.13,,United Kingdom
555327,21936,RED RETROSPOT PICNIC BAG,5,2011-06-02 11:03:00,5.79,,United Kingdom
555327,21937,STRAWBERRY   PICNIC BAG,2,2011-06-02 11:03:00,5.79,,United Kingdom
555327,21988,PACK OF 6 SKULL PAPER PLATES,2,2011-06-02 11:03:00,1.63,,United Kingdom
555327,21989,PACK OF 20 SKULL PAPER NAPKINS,1,2011-06-02 11:03:00,1.63,,United Kingdom
555327,22041,"RECORD FRAME 7"" SINGLE SIZE ",1,2011-06-02 11:03:00,4.96,,United Kingdom
555327,22083,PAPER CHAIN KIT RETROSPOT,1,2011-06-02 11:03:00,6.63,,United Kingdom
555327,22089,PAPER BUNTING VINTAGE PAISLEY,2,2011-06-02 11:03:00,4.13,,United Kingdom
555327,22197,SMALL POPCORN HOLDER,6,2011-06-02 11:03:00,1.63,,United Kingdom
555327,22219,LOVEBIRD HANGING DECORATION WHITE ,10,2011-06-02 11:03:00,1.63,,United Kingdom
555327,22357,KINGS CHOICE BISCUIT TIN,1,2011-06-02 11:03:00,8.29,,United Kingdom
555327,22358,KINGS CHOICE TEA CADDY ,1,2011-06-02 11:03:00,5.79,,United Kingdom
555327,22381,TOY TIDY PINK POLKADOT,1,2011-06-02 11:03:00,4.96,,United Kingdom
555327,22386,JUMBO BAG PINK POLKADOT,1,2011-06-02 11:03:00,4.13,,United Kingdom
555327,22418,10 COLOUR SPACEBOY PEN,2,2011-06-02 11:03:00,2.46,,United Kingdom
555327,22467,GUMBALL COAT RACK,1,2011-06-02 11:03:00,4.96,,United Kingdom
555327,22501,PICNIC BASKET WICKER LARGE,2,2011-06-02 11:03:00,20.79,,United Kingdom
555327,22519,CHILDS GARDEN BRUSH PINK,1,2011-06-02 11:03:00,4.13,,United Kingdom
555327,22629,SPACEBOY LUNCH BOX ,1,2011-06-02 11:03:00,2.46,,United Kingdom
555327,22630,DOLLY GIRL LUNCH BOX,1,2011-06-02 11:03:00,2.46,,United Kingdom
555327,22663,JUMBO BAG DOLLY GIRL DESIGN,1,2011-06-02 11:03:00,4.13,,United Kingdom
555327,22668,PINK BABY BUNTING,4,2011-06-02 11:03:00,5.79,,United Kingdom
555327,22697,GREEN REGENCY TEACUP AND SAUCER,2,2011-06-02 11:03:00,5.79,,United Kingdom
555327,22698,PINK REGENCY TEACUP AND SAUCER,3,2011-06-02 11:03:00,5.79,,United Kingdom
555327,22699,ROSES REGENCY TEACUP AND SAUCER ,3,2011-06-02 11:03:00,5.79,,United Kingdom
555327,22844,VINTAGE CREAM DOG FOOD CONTAINER,1,2011-06-02 11:03:00,16.63,,United Kingdom
555327,22961,JAM MAKING SET PRINTED,1,2011-06-02 11:03:00,3.29,,United Kingdom
555327,22995,TRAVEL CARD WALLET SUKI,1,2011-06-02 11:03:00,0.83,,United Kingdom
555327,48185,DOORMAT FAIRY CAKE,1,2011-06-02 11:03:00,14.13,,United Kingdom
555327,75049L,LARGE CIRCULAR MIRROR MOBILE,1,2011-06-02 11:03:00,2.46,,United Kingdom
555327,82581,TOILET METAL SIGN,1,2011-06-02 11:03:00,1.25,,United Kingdom
555327,84509a,SET OF 4 ENGLISH ROSE PLACEMATS,1,2011-06-02 11:03:00,7.46,,United Kingdom
555327,84510a,SET OF 4 ENGLISH ROSE COASTERS,1,2011-06-02 11:03:00,2.46,,United Kingdom
555327,85099B,JUMBO BAG RED RETROSPOT,2,2011-06-02 11:03:00,4.13,,United Kingdom
555327,85114a,BLACK ENCHANTED FOREST PLACEMAT,1,2011-06-02 11:03:00,3.29,,United Kingdom
555327,DOT,DOTCOM POSTAGE,1,2011-06-02 11:03:00,158.63,,United Kingdom
C555328,84755,COLOUR GLASS T-LIGHT HOLDER HANGING,-2,2011-06-02 11:07:00,0.65,16449.0,United Kingdom
C555328,22768,FAMILY PHOTO FRAME CORNICE,-2,2011-06-02 11:07:00,9.95,16449.0,United Kingdom
C555328,22766,PHOTO FRAME CORNICE,-4,2011-06-02 11:07:00,2.95,16449.0,United Kingdom
C555329,23110,PARISIENNE KEY CABINET ,-1,2011-06-02 11:08:00,5.75,15622.0,United Kingdom
555330,84804A,wet damaged,-125,2011-06-02 11:11:00,0.0,,United Kingdom
555331,84800L,wet damaged,-144,2011-06-02 11:11:00,0.0,,United Kingdom
555332,84801A,wet damaged,-48,2011-06-02 11:11:00,0.0,,United Kingdom
555333,84805B,wet damaged,-96,2011-06-02 11:12:00,0.0,,United Kingdom
555334,84805A,wet damaged,-96,2011-06-02 11:12:00,0.0,,United Kingdom
555335,84804B,,-96,2011-06-02 11:13:00,0.0,,United Kingdom
555336,15060B,FAIRY CAKE DESIGN UMBRELLA,1,2011-06-02 11:13:00,3.75,,United Kingdom
555336,22705,WRAP GREEN PEARS ,5,2011-06-02 11:13:00,0.42,,United Kingdom
555336,21703,BAG 125g SWIRLY MARBLES,2,2011-06-02 11:13:00,0.42,,United Kingdom
555336,22531,MAGIC DRAWING SLATE CIRCUS PARADE  ,1,2011-06-02 11:13:00,0.42,,United Kingdom
555336,22534,MAGIC DRAWING SLATE SPACEBOY ,2,2011-06-02 11:13:00,0.42,,United Kingdom
555336,21544,SKULLS  WATER TRANSFER TATTOOS ,1,2011-06-02 11:13:00,0.85,,United Kingdom
555336,84077,WORLD WAR 2 GLIDERS ASSTD DESIGNS,3,2011-06-02 11:13:00,0.29,,United Kingdom
555336,21219,SET/4 BADGES BALLOON GIRL,4,2011-06-02 11:13:00,1.25,,United Kingdom
555336,22489,PACK OF 12 TRADITIONAL CRAYONS,4,2011-06-02 11:13:00,0.42,,United Kingdom
555336,20973,12 PENCIL SMALL TUBE WOODLAND,2,2011-06-02 11:13:00,0.65,,United Kingdom
555336,20975,12 PENCILS SMALL TUBE RED RETROSPOT,2,2011-06-02 11:13:00,0.65,,United Kingdom
555336,20974,12 PENCILS SMALL TUBE SKULL,2,2011-06-02 11:13:00,0.65,,United Kingdom
555336,22382,LUNCH BAG SPACEBOY DESIGN ,2,2011-06-02 11:13:00,1.65,,United Kingdom
555336,22964,3 PIECE SPACEBOY COOKIE CUTTER SET,1,2011-06-02 11:13:00,2.1,,United Kingdom
555336,22991,GIRAFFE WOODEN RULER,1,2011-06-02 11:13:00,1.95,,United Kingdom
555336,22992,REVOLVER WOODEN RULER ,1,2011-06-02 11:13:00,1.95,,United Kingdom
555336,85036A,GARDENIA 1 WICK MORRIS BOXED CANDLE,2,2011-06-02 11:13:00,4.25,,United Kingdom
555336,23050,RECYCLED ACAPULCO MAT GREEN,1,2011-06-02 11:13:00,8.25,,United Kingdom
555336,22530,MAGIC DRAWING SLATE DOLLY GIRL ,1,2011-06-02 11:13:00,0.42,,United Kingdom
555336,22537,MAGIC DRAWING SLATE DINOSAUR,1,2011-06-02 11:13:00,0.42,,United Kingdom
555336,90115,SUMMER BUTTERFLIES BAG CHARM,1,2011-06-02 11:13:00,2.55,,United Kingdom
555336,21721,CANDY SHOP  STICKER SHEET,2,2011-06-02 11:13:00,0.85,,United Kingdom
555336,84826,ASSTD DESIGN 3D PAPER STICKERS,3,2011-06-02 11:13:00,0.85,,United Kingdom
555336,21086,SET/6 RED SPOTTY PAPER CUPS,1,2011-06-02 11:13:00,0.65,,United Kingdom
555336,21080,SET/20 RED RETROSPOT PAPER NAPKINS ,1,2011-06-02 11:13:00,0.85,,United Kingdom
555336,21094,SET/6 RED SPOTTY PAPER PLATES,1,2011-06-02 11:13:00,0.85,,United Kingdom
555336,21534,DAIRY MAID LARGE MILK JUG,1,2011-06-02 11:13:00,4.95,,United Kingdom
555336,21528,DAIRY MAID TRADITIONAL TEAPOT ,1,2011-06-02 11:13:00,6.95,,United Kingdom
555336,47590A,BLUE HAPPY BIRTHDAY BUNTING,1,2011-06-02 11:13:00,5.45,,United Kingdom
555336,21936,RED RETROSPOT PICNIC BAG,1,2011-06-02 11:13:00,2.95,,United Kingdom
555336,20752,BLUE POLKADOT WASHING UP GLOVES,1,2011-06-02 11:13:00,2.1,,United Kingdom
555336,21465,PINK FLOWER CROCHET FOOD COVER,1,2011-06-02 11:13:00,3.75,,United Kingdom
555336,20770,ABSTRACT CIRCLE JOURNAL ,1,2011-06-02 11:13:00,2.55,,United Kingdom
C555337,84906,PINK BUTTERFLY CUSHION COVER,-1,2011-06-02 11:13:00,1.95,16729.0,United Kingdom
C555338,22413,METAL SIGN TAKE IT OR LEAVE IT ,-6,2011-06-02 11:22:00,2.95,14323.0,United Kingdom
C555339,M,Manual,-1,2011-06-02 11:32:00,11.7,16422.0,United Kingdom
555340,22470,HEART OF WICKER LARGE,4,2011-06-02 11:33:00,2.95,13334.0,United Kingdom
555340,22469,HEART OF WICKER SMALL,6,2011-06-02 11:33:00,1.65,13334.0,United Kingdom
555340,22665,RECIPE BOX BLUE SKETCHBOOK DESIGN,2,2011-06-02 11:33:00,2.95,13334.0,United Kingdom
555340,21535,RED RETROSPOT SMALL MILK JUG,6,2011-06-02 11:33:00,2.55,13334.0,United Kingdom
555340,21539,RED RETROSPOT BUTTER DISH,3,2011-06-02 11:33:00,4.95,13334.0,United Kingdom
555340,22349,DOG BOWL CHASING BALL DESIGN,2,2011-06-02 11:33:00,3.75,13334.0,United Kingdom
555340,22350,ILLUSTRATED CAT BOWL ,6,2011-06-02 11:33:00,2.55,13334.0,United Kingdom
555340,20914,SET/5 RED RETROSPOT LID GLASS BOWLS,6,2011-06-02 11:33:00,2.95,13334.0,United Kingdom
555340,21868,POTTING SHED TEA MUG,6,2011-06-02 11:33:00,1.25,13334.0,United Kingdom
555340,21876,POTTERING MUG,6,2011-06-02 11:33:00,1.25,13334.0,United Kingdom
555340,22296,HEART IVORY TRELLIS LARGE,12,2011-06-02 11:33:00,1.65,13334.0,United Kingdom
555340,22295,HEART FILIGREE DOVE LARGE,12,2011-06-02 11:33:00,1.65,13334.0,United Kingdom
555340,21843,RED RETROSPOT CAKE STAND,3,2011-06-02 11:33:00,10.95,13334.0,United Kingdom
555340,21238,RED RETROSPOT CUP,16,2011-06-02 11:33:00,0.85,13334.0,United Kingdom
555340,21240,BLUE POLKADOT CUP,16,2011-06-02 11:33:00,0.85,13334.0,United Kingdom
555340,21239,PINK  POLKADOT CUP,8,2011-06-02 11:33:00,0.85,13334.0,United Kingdom
555340,21878,PACK OF 6 SANDCASTLE FLAGS ASSORTED,6,2011-06-02 11:33:00,0.85,13334.0,United Kingdom
555340,22989,SET 2 PANTRY DESIGN TEA TOWELS,3,2011-06-02 11:33:00,3.25,13334.0,United Kingdom
555340,22895,SET OF 2 TEA TOWELS APPLE AND PEARS,3,2011-06-02 11:33:00,3.25,13334.0,United Kingdom
555340,47559B,TEA TIME OVEN GLOVE,3,2011-06-02 11:33:00,1.25,13334.0,United Kingdom
555340,21042,RED RETROSPOT APRON ,3,2011-06-02 11:33:00,5.95,13334.0,United Kingdom
555340,21155,RED RETROSPOT PEG BAG,3,2011-06-02 11:33:00,2.55,13334.0,United Kingdom
555340,21156,RETROSPOT CHILDRENS APRON,4,2011-06-02 11:33:00,1.95,13334.0,United Kingdom
555340,22939,APRON APPLE DELIGHT,3,2011-06-02 11:33:00,4.95,13334.0,United Kingdom
555340,22897,OVEN MITT APPLES DESIGN,3,2011-06-02 11:33:00,1.45,13334.0,United Kingdom
555340,22898,CHILDRENS APRON APPLES DESIGN,3,2011-06-02 11:33:00,1.95,13334.0,United Kingdom
555340,22896,PEG BAG APPLES DESIGN,3,2011-06-02 11:33:00,2.55,13334.0,United Kingdom
555340,22352,LUNCH BOX WITH CUTLERY RETROSPOT ,3,2011-06-02 11:33:00,2.55,13334.0,United Kingdom
555340,21559,STRAWBERRY LUNCH BOX WITH CUTLERY,3,2011-06-02 11:33:00,2.55,13334.0,United Kingdom
555340,21561,DINOSAUR LUNCH BOX WITH CUTLERY,6,2011-06-02 11:33:00,2.55,13334.0,United Kingdom
555340,21558,SKULL LUNCH BOX WITH CUTLERY ,6,2011-06-02 11:33:00,2.55,13334.0,United Kingdom
555340,22776,SWEETHEART CAKESTAND 3 TIER,1,2011-06-02 11:33:00,9.95,13334.0,United Kingdom
555340,22628,PICNIC BOXES SET OF 3 RETROSPOT ,3,2011-06-02 11:33:00,4.95,13334.0,United Kingdom
555340,22224,WHITE LOVEBIRD LANTERN,6,2011-06-02 11:33:00,2.95,13334.0,United Kingdom
555340,15056N,EDWARDIAN PARASOL NATURAL,2,2011-06-02 11:33:00,5.95,13334.0,United Kingdom
555340,22441,GROW YOUR OWN BASIL IN ENAMEL MUG,6,2011-06-02 11:33:00,2.1,13334.0,United Kingdom
555340,47566,PARTY BUNTING,4,2011-06-02 11:33:00,4.95,13334.0,United Kingdom
555340,23298,SPOTTY BUNTING,6,2011-06-02 11:33:00,4.95,13334.0,United Kingdom
555340,22900,SET 2 TEA TOWELS I LOVE LONDON ,3,2011-06-02 11:33:00,3.25,13334.0,United Kingdom
555340,22616,PACK OF 12 LONDON TISSUES ,12,2011-06-02 11:33:00,0.29,13334.0,United Kingdom
555340,84692,BOX OF 24 COCKTAIL PARASOLS,15,2011-06-02 11:33:00,0.42,13334.0,United Kingdom
555340,22569,FELTCRAFT CUSHION BUTTERFLY,2,2011-06-02 11:33:00,3.75,13334.0,United Kingdom
555340,22568,FELTCRAFT CUSHION OWL,2,2011-06-02 11:33:00,3.75,13334.0,United Kingdom
555340,22150,3 STRIPEY MICE FELTCRAFT,6,2011-06-02 11:33:00,1.95,13334.0,United Kingdom
555340,22147,FELTCRAFT BUTTERFLY HEARTS,6,2011-06-02 11:33:00,1.45,13334.0,United Kingdom
555340,22273,FELTCRAFT DOLL MOLLY,3,2011-06-02 11:33:00,2.95,13334.0,United Kingdom
555340,22940,FELTCRAFT CHRISTMAS FAIRY,3,2011-06-02 11:33:00,4.25,13334.0,United Kingdom
555340,85099F,JUMBO BAG STRAWBERRY,10,2011-06-02 11:33:00,2.08,13334.0,United Kingdom
555340,85099B,JUMBO BAG RED RETROSPOT,10,2011-06-02 11:33:00,2.08,13334.0,United Kingdom
555340,22383,LUNCH BAG SUKI DESIGN ,10,2011-06-02 11:33:00,1.65,13334.0,United Kingdom
555340,20728,LUNCH BAG CARS BLUE,10,2011-06-02 11:33:00,1.65,13334.0,United Kingdom
555340,22971,QUEENS GUARD COFFEE MUG,12,2011-06-02 11:33:00,2.55,13334.0,United Kingdom
555340,23201,JUMBO BAG ALPHABET,10,2011-06-02 11:33:00,2.08,13334.0,United Kingdom
555340,22384,LUNCH BAG PINK POLKADOT,10,2011-06-02 11:33:00,1.65,13334.0,United Kingdom
555340,22386,JUMBO BAG PINK POLKADOT,10,2011-06-02 11:33:00,2.08,13334.0,United Kingdom
555340,23203,JUMBO BAG DOILEY PATTERNS,4,2011-06-02 11:33:00,2.08,13334.0,United Kingdom
555340,23199,JUMBO BAG APPLES,3,2011-06-02 11:33:00,2.08,13334.0,United Kingdom
555340,23200,JUMBO BAG PEARS,3,2011-06-02 11:33:00,2.08,13334.0,United Kingdom
555340,23284,DOORMAT KEEP CALM AND COME IN,2,2011-06-02 11:33:00,7.95,13334.0,United Kingdom
555340,23283,DOORMAT VINTAGE LEAVES DESIGN ,1,2011-06-02 11:33:00,7.95,13334.0,United Kingdom
555340,20770,ABSTRACT CIRCLE JOURNAL ,3,2011-06-02 11:33:00,2.55,13334.0,United Kingdom
555340,20758,ABSTRACT CIRCLES POCKET BOOK,6,2011-06-02 11:33:00,0.85,13334.0,United Kingdom
555340,20764,ABSTRACT CIRCLES SKETCHBOOK ,3,2011-06-02 11:33:00,3.75,13334.0,United Kingdom
555340,17107D,"FLOWER FAIRY,5 SUMMER B'DRAW LINERS",6,2011-06-02 11:33:00,2.55,13334.0,United Kingdom
555340,21034,REX CASH+CARRY JUMBO SHOPPER,1,2011-06-02 11:33:00,0.95,13334.0,United Kingdom
555340,22189,CREAM HEART CARD HOLDER,6,2011-06-02 11:33:00,3.95,13334.0,United Kingdom
555340,22426,ENAMEL WASH BOWL CREAM,3,2011-06-02 11:33:00,3.75,13334.0,United Kingdom
555340,22693,GROW A FLYTRAP OR SUNFLOWER IN TIN,24,2011-06-02 11:33:00,1.25,13334.0,United Kingdom
555340,15039,SANDALWOOD FAN,5,2011-06-02 11:33:00,0.85,13334.0,United Kingdom
555340,15036,ASSORTED COLOURS SILK FAN,12,2011-06-02 11:33:00,0.83,13334.0,United Kingdom
555340,21907,I'M ON HOLIDAY METAL SIGN,12,2011-06-02 11:33:00,2.1,13334.0,United Kingdom
555340,21174,POTTERING IN THE SHED METAL SIGN,12,2011-06-02 11:33:00,2.08,13334.0,United Kingdom
555340,22624,IVORY KITCHEN SCALES,1,2011-06-02 11:33:00,8.5,13334.0,United Kingdom
555340,22789,T-LIGHT HOLDER SWEETHEART HANGING,4,2011-06-02 11:33:00,1.95,13334.0,United Kingdom
555340,84970L,SINGLE HEART ZINC T-LIGHT HOLDER,12,2011-06-02 11:33:00,0.95,13334.0,United Kingdom
555340,84970S,HANGING HEART ZINC T-LIGHT HOLDER,12,2011-06-02 11:33:00,0.85,13334.0,United Kingdom
555340,23147,SINGLE ANTIQUE ROSE HOOK IVORY,6,2011-06-02 11:33:00,1.45,13334.0,United Kingdom
555340,82482,WOODEN PICTURE FRAME WHITE FINISH,12,2011-06-02 11:33:00,2.55,13334.0,United Kingdom
555340,20676,RED RETROSPOT BOWL,12,2011-06-02 11:33:00,1.25,13334.0,United Kingdom
555340,20972,PINK CREAM FELT CRAFT TRINKET BOX ,12,2011-06-02 11:33:00,1.25,13334.0,United Kingdom
555340,22430,ENAMEL WATERING CAN CREAM,3,2011-06-02 11:33:00,4.95,13334.0,United Kingdom
555340,22427,ENAMEL FLOWER JUG CREAM,1,2011-06-02 11:33:00,5.95,13334.0,United Kingdom
555340,84974,S/2 ZINC HEART DESIGN PLANTERS,1,2011-06-02 11:33:00,9.95,13334.0,United Kingdom
555340,85123A,WHITE HANGING HEART T-LIGHT HOLDER,1,2011-06-02 11:33:00,2.95,13334.0,United Kingdom
