InvoiceNo,StockCode,Description,Quantity,InvoiceDate,UnitPrice,CustomerID,Country
556814,23092,LARGE ANTIQUE WHITE PHOTO FRAME,2,2011-06-15 08:34:00,7.9,14852.0,United Kingdom
556814,23138,SINGLE WIRE HOOK IVORY HEART,12,2011-06-15 08:34:00,1.45,14852.0,United Kingdom
556814,23140,TRIPLE WIRE HOOK IVORY HEART,4,2011-06-15 08:34:00,4.15,14852.0,United Kingdom
556814,23132,SMALL IVORY HEART WALL ORGANISER,3,2011-06-15 08:34:00,5.75,14852.0,United Kingdom
556814,23133,LARGE IVORY HEART WALL ORGANISER,2,2011-06-15 08:34:00,8.25,14852.0,United Kingdom
556814,23142,IVORY WIRE KITCHEN ORGANISER,2,2011-06-15 08:34:00,10.4,14852.0,United Kingdom
556814,23150,IVORY SWEETHEART SOAP DISH,6,2011-06-15 08:34:00,2.49,14852.0,United Kingdom
556814,22847,BREAD BIN DINER STYLE IVORY,1,2011-06-15 08:34:00,16.95,14852.0,United Kingdom
556814,22624,IVORY KITCHEN SCALES,2,2011-06-15 08:34:00,8.5,14852.0,United Kingdom
556815,22741,FUNKY DIVA PEN,48,2011-06-15 08:36:00,0.85,14852.0,United Kingdom
556815,22740,POLKADOT PEN,48,2011-06-15 08:36:00,0.85,14852.0,United Kingdom
556815,85099B,JUMBO BAG RED RETROSPOT,10,2011-06-15 08:36:00,2.08,14852.0,United Kingdom
556815,20725,LUNCH BAG RED RETROSPOT,10,2011-06-15 08:36:00,1.65,14852.0,United Kingdom
556815,21936,RED RETROSPOT PICNIC BAG,5,2011-06-15 08:36:00,2.95,14852.0,United Kingdom
556815,22350,ILLUSTRATED CAT BOWL ,6,2011-06-15 08:36:00,2.55,14852.0,United Kingdom
556815,22349,DOG BOWL CHASING BALL DESIGN,6,2011-06-15 08:36:00,3.75,14852.0,United Kingdom
556815,84991,60 TEATIME FAIRY CAKE CASES,24,2011-06-15 08:36:00,0.55,14852.0,United Kingdom
556815,23032,DRAWER KNOB CRACKLE GLAZE IVORY,6,2011-06-15 08:36:00,1.65,14852.0,United Kingdom
556815,23031,DRAWER KNOB CRACKLE GLAZE PINK,6,2011-06-15 08:36:00,1.65,14852.0,United Kingdom
556815,23029,DRAWER KNOB CRACKLE GLAZE GREEN,6,2011-06-15 08:36:00,1.65,14852.0,United Kingdom
556815,23028,DRAWER KNOB CRACKLE GLAZE BLUE,6,2011-06-15 08:36:00,1.65,14852.0,United Kingdom
556815,22672,FRENCH BATHROOM SIGN BLUE METAL,12,2011-06-15 08:36:00,1.65,14852.0,United Kingdom
556815,85123A,WHITE HANGING HEART T-LIGHT HOLDER,12,2011-06-15 08:36:00,2.95,14852.0,United Kingdom
556815,84945,MULTI COLOUR SILVER T-LIGHT HOLDER,24,2011-06-15 08:36:00,0.85,14852.0,United Kingdom
556815,84755,COLOUR GLASS T-LIGHT HOLDER HANGING,32,2011-06-15 08:36:00,0.65,14852.0,United Kingdom
556815,85066,CREAM SWEETHEART MINI CHEST,2,2011-06-15 08:36:00,12.75,14852.0,United Kingdom
556815,82482,WOODEN PICTURE FRAME WHITE FINISH,6,2011-06-15 08:36:00,2.55,14852.0,United Kingdom
556815,82494L,WOODEN FRAME ANTIQUE WHITE ,6,2011-06-15 08:36:00,2.95,14852.0,United Kingdom
556815,22767,TRIPLE PHOTO FRAME CORNICE ,2,2011-06-15 08:36:00,9.95,14852.0,United Kingdom
556815,22766,PHOTO FRAME CORNICE,8,2011-06-15 08:36:00,2.95,14852.0,United Kingdom
556815,23227,FILIGREE HEART BUTTERFLY WHITE ,24,2011-06-15 08:36:00,1.25,14852.0,United Kingdom
556815,84879,ASSORTED COLOUR BIRD ORNAMENT,24,2011-06-15 08:36:00,1.69,14852.0,United Kingdom
556815,21756,BATH BUILDING BLOCK WORD,6,2011-06-15 08:36:00,5.95,14852.0,United Kingdom
556815,21754,HOME BUILDING BLOCK WORD,6,2011-06-15 08:36:00,5.95,14852.0,United Kingdom
556816,POST,POSTAGE,3,2011-06-15 09:01:00,18.0,12437.0,France
556816,21094,SET/6 RED SPOTTY PAPER PLATES,96,2011-06-15 09:01:00,0.64,12437.0,France
556816,21086,SET/6 RED SPOTTY PAPER CUPS,120,2011-06-15 09:01:00,0.65,12437.0,France
556816,22236,CAKE STAND 3 TIER MAGIC GARDEN,12,2011-06-15 09:01:00,10.95,12437.0,France
556816,20677,PINK POLKADOT BOWL,8,2011-06-15 09:01:00,1.25,12437.0,France
556816,22356,CHARLOTTE BAG PINK POLKADOT,20,2011-06-15 09:01:00,0.85,12437.0,France
556816,22326,ROUND SNACK BOXES SET OF4 WOODLAND ,12,2011-06-15 09:01:00,2.95,12437.0,France
556816,21561,DINOSAUR LUNCH BOX WITH CUTLERY,12,2011-06-15 09:01:00,2.55,12437.0,France
556816,20728,LUNCH BAG CARS BLUE,10,2011-06-15 09:01:00,1.65,12437.0,France
556816,20725,LUNCH BAG RED RETROSPOT,10,2011-06-15 09:01:00,1.65,12437.0,France
556816,22439,6 ROCKET BALLOONS ,24,2011-06-15 09:01:00,0.65,12437.0,France
556816,21224,SET/4 SKULL BADGES,20,2011-06-15 09:01:00,1.25,12437.0,France
556816,21544,SKULLS  WATER TRANSFER TATTOOS ,12,2011-06-15 09:01:00,0.85,12437.0,France
556817,17003,BROCADE RING PURSE ,720,2011-06-15 09:33:00,0.21,14609.0,United Kingdom
C556818,22456,NATURAL SLATE CHALKBOARD LARGE ,-1,2011-06-15 10:01:00,4.95,17284.0,United Kingdom
C556818,21042,RED RETROSPOT APRON ,-1,2011-06-15 10:01:00,5.95,17284.0,United Kingdom
556819,23298,SPOTTY BUNTING,9,2011-06-15 10:21:00,4.95,12682.0,France
556819,47566,PARTY BUNTING,4,2011-06-15 10:21:00,4.95,12682.0,France
556819,23084,RABBIT NIGHT LIGHT,96,2011-06-15 10:21:00,1.79,12682.0,France
556819,23053,RECYCLED ACAPULCO MAT PINK,2,2011-06-15 10:21:00,8.25,12682.0,France
556819,85014A,BLACK/BLUE POLKADOT UMBRELLA,3,2011-06-15 10:21:00,5.95,12682.0,France
556819,23249,VINTAGE RED ENAMEL TRIM PLATE,12,2011-06-15 10:21:00,1.65,12682.0,France
556819,23251,VINTAGE RED ENAMEL TRIM MUG ,12,2011-06-15 10:21:00,1.25,12682.0,France
556819,23250,VINTAGE RED TRIM ENAMEL BOWL ,12,2011-06-15 10:21:00,1.25,12682.0,France
556819,23252,VINTAGE RED ENAMEL TRIM JUG ,4,2011-06-15 10:21:00,3.75,12682.0,France
556819,23288,GREEN VINTAGE SPOT BEAKER,8,2011-06-15 10:21:00,0.85,12682.0,France
556819,23285,PINK VINTAGE SPOT BEAKER,8,2011-06-15 10:21:00,0.85,12682.0,France
556819,POST,POSTAGE,4,2011-06-15 10:21:00,18.0,12682.0,France
556820,22435,SET OF 9 HEART SHAPED BALLOONS,12,2011-06-15 10:22:00,1.25,12682.0,France
556820,21558,SKULL LUNCH BOX WITH CUTLERY ,6,2011-06-15 10:22:00,2.55,12682.0,France
556820,22352,LUNCH BOX WITH CUTLERY RETROSPOT ,12,2011-06-15 10:22:00,2.55,12682.0,France
556820,22432,WATERING CAN PINK BUNNY,12,2011-06-15 10:22:00,1.95,12682.0,France
556820,23209,LUNCH BAG DOILEY PATTERN ,10,2011-06-15 10:22:00,1.65,12682.0,France
556820,23203,JUMBO BAG DOILEY PATTERNS,10,2011-06-15 10:22:00,2.08,12682.0,France
556820,23240,SET OF 4 KNICK KNACK TINS DOILEY ,6,2011-06-15 10:22:00,4.15,12682.0,France
556820,23237,SET OF 4 KNICK KNACK TINS LEAVES ,6,2011-06-15 10:22:00,4.15,12682.0,France
556820,23238,SET OF 4 KNICK KNACK TINS LONDON ,6,2011-06-15 10:22:00,4.15,12682.0,France
556820,23245,SET OF 3 REGENCY CAKE TINS,4,2011-06-15 10:22:00,4.95,12682.0,France
556820,23306,SET OF 36 DOILIES PANTRY DESIGN,12,2011-06-15 10:22:00,1.45,12682.0,France
556820,21746,SMALL RED RETROSPOT WINDMILL,12,2011-06-15 10:22:00,1.25,12682.0,France
556820,21559,STRAWBERRY LUNCH BOX WITH CUTLERY,6,2011-06-15 10:22:00,2.55,12682.0,France
556820,22976,CIRCUS PARADE CHILDRENS EGG CUP ,12,2011-06-15 10:22:00,1.25,12682.0,France
556820,15056N,EDWARDIAN PARASOL NATURAL,6,2011-06-15 10:22:00,5.95,12682.0,France
556820,20750,RED RETROSPOT MINI CASES,4,2011-06-15 10:22:00,7.95,12682.0,France
556820,15056BL,EDWARDIAN PARASOL BLACK,3,2011-06-15 10:22:00,5.95,12682.0,France
556821,22697,GREEN REGENCY TEACUP AND SAUCER,2,2011-06-15 10:22:00,5.79,,United Kingdom
556821,22698,PINK REGENCY TEACUP AND SAUCER,2,2011-06-15 10:22:00,5.79,,United Kingdom
556821,22699,ROSES REGENCY TEACUP AND SAUCER ,2,2011-06-15 10:22:00,5.79,,United Kingdom
556821,22900,SET 2 TEA TOWELS I LOVE LONDON ,1,2011-06-15 10:22:00,4.13,,United Kingdom
556821,23173,REGENCY TEAPOT ROSES ,1,2011-06-15 10:22:00,19.96,,United Kingdom
556821,23174,REGENCY SUGAR BOWL GREEN,1,2011-06-15 10:22:00,8.29,,United Kingdom
556821,23175,REGENCY MILK JUG PINK ,1,2011-06-15 10:22:00,7.46,,United Kingdom
556821,47566b,TEA TIME PARTY BUNTING,1,2011-06-15 10:22:00,8.29,,United Kingdom
556821,48185,DOORMAT FAIRY CAKE,1,2011-06-15 10:22:00,14.13,,United Kingdom
556821,84510a,SET OF 4 ENGLISH ROSE COASTERS,2,2011-06-15 10:22:00,2.46,,United Kingdom
556821,84660c,PINK STITCHED WALL CLOCK,1,2011-06-15 10:22:00,7.46,,United Kingdom
556821,84987,SET OF 36 TEATIME PAPER DOILIES,1,2011-06-15 10:22:00,3.75,,United Kingdom
556821,85123a,WHITE HANGING HEART T-LIGHT HOLDER,1,2011-06-15 10:22:00,6.63,,United Kingdom
556821,DOT,DOTCOM POSTAGE,1,2011-06-15 10:22:00,50.96,,United Kingdom
556821,21411,GINGHAM HEART  DOORSTOP RED,1,2011-06-15 10:22:00,8.29,,United Kingdom
556821,21625,VINTAGE UNION JACK APRON,1,2011-06-15 10:22:00,14.13,,United Kingdom
556821,21931,JUMBO STORAGE BAG SUKI,5,2011-06-15 10:22:00,4.13,,United Kingdom
556821,22197,SMALL POPCORN HOLDER,1,2011-06-15 10:22:00,1.63,,United Kingdom
556821,22501,PICNIC BASKET WICKER LARGE,2,2011-06-15 10:22:00,20.79,,United Kingdom
556821,22502,PICNIC BASKET WICKER SMALL,1,2011-06-15 10:22:00,10.79,,United Kingdom
556821,22605,WOODEN CROQUET GARDEN SET,1,2011-06-15 10:22:00,24.96,,United Kingdom
556821,22671,FRENCH LAUNDRY SIGN BLUE METAL,1,2011-06-15 10:22:00,3.29,,United Kingdom
556822,84991,60 TEATIME FAIRY CAKE CASES,8,2011-06-15 10:22:00,0.55,17155.0,United Kingdom
556822,21172,PARTY METAL SIGN ,48,2011-06-15 10:22:00,1.45,17155.0,United Kingdom
556822,21975,PACK OF 60 DINOSAUR CAKE CASES,12,2011-06-15 10:22:00,0.55,17155.0,United Kingdom
556822,22417,PACK OF 60 SPACEBOY CAKE CASES,12,2011-06-15 10:22:00,0.55,17155.0,United Kingdom
556822,21977,PACK OF 60 PINK PAISLEY CAKE CASES,24,2011-06-15 10:22:00,0.55,17155.0,United Kingdom
556822,21213,PACK OF 72 SKULL CAKE CASES,24,2011-06-15 10:22:00,0.55,17155.0,United Kingdom
556822,21212,PACK OF 72 RETROSPOT CAKE CASES,24,2011-06-15 10:22:00,0.55,17155.0,United Kingdom
556822,23081,GREEN METAL BOX ARMY SUPPLIES,1,2011-06-15 10:22:00,8.25,17155.0,United Kingdom
556822,23080,RED METAL BOX TOP SECRET,1,2011-06-15 10:22:00,8.25,17155.0,United Kingdom
556823,21328,BALLOONS  WRITING SET ,1,2011-06-15 10:24:00,3.29,,United Kingdom
556823,21430,SET/3 RED GINGHAM ROSE STORAGE BOX,1,2011-06-15 10:24:00,7.46,,United Kingdom
556823,21864,UNION JACK FLAG PASSPORT COVER ,1,2011-06-15 10:24:00,4.13,,United Kingdom
556823,22381,TOY TIDY PINK POLKADOT,1,2011-06-15 10:24:00,4.96,,United Kingdom
556823,22605,WOODEN CROQUET GARDEN SET,1,2011-06-15 10:24:00,24.96,,United Kingdom
556823,22807,SET OF 6 T-LIGHTS TOADSTOOLS,1,2011-06-15 10:24:00,5.79,,United Kingdom
556823,85123a,WHITE HANGING HEART T-LIGHT HOLDER,1,2011-06-15 10:24:00,6.63,,United Kingdom
556823,DOT,DOTCOM POSTAGE,1,2011-06-15 10:24:00,20.5,,United Kingdom
556824,20676,RED RETROSPOT BOWL,1,2011-06-15 10:24:00,2.46,,United Kingdom
556824,21218,RED SPOTTY BISCUIT TIN,1,2011-06-15 10:24:00,8.29,,United Kingdom
556824,21272,SALLE DE BAIN HOOK,1,2011-06-15 10:24:00,2.46,,United Kingdom
556824,21424,WOODLAND STORAGE BOX LARGE ,1,2011-06-15 10:24:00,6.63,,United Kingdom
556824,21428,SET3 BOOK BOX GREEN GINGHAM FLOWER ,1,2011-06-15 10:24:00,8.29,,United Kingdom
556824,21430,SET/3 RED GINGHAM ROSE STORAGE BOX,1,2011-06-15 10:24:00,7.46,,United Kingdom
556824,21625,VINTAGE UNION JACK APRON,1,2011-06-15 10:24:00,14.13,,United Kingdom
556824,21700,BIG DOUGHNUT FRIDGE MAGNETS,6,2011-06-15 10:24:00,1.38,,United Kingdom
556824,21930,JUMBO STORAGE BAG SKULLS,1,2011-06-15 10:24:00,4.96,,United Kingdom
556824,21931,JUMBO STORAGE BAG SUKI,2,2011-06-15 10:24:00,4.13,,United Kingdom
556824,22136,LOVE HEART SOCK HANGER,1,2011-06-15 10:24:00,3.29,,United Kingdom
556824,22179,SET 10 NIGHT OWL LIGHTS,1,2011-06-15 10:24:00,13.29,,United Kingdom
556824,22195,LARGE HEART MEASURING SPOONS,1,2011-06-15 10:24:00,3.29,,United Kingdom
556824,22358,KINGS CHOICE TEA CADDY ,1,2011-06-15 10:24:00,5.79,,United Kingdom
556824,22378,WALL TIDY RETROSPOT ,1,2011-06-15 10:24:00,4.96,,United Kingdom
556824,22379,RECYCLING BAG RETROSPOT ,2,2011-06-15 10:24:00,4.96,,United Kingdom
556824,22411,JUMBO SHOPPER VINTAGE RED PAISLEY,3,2011-06-15 10:24:00,4.13,,United Kingdom
556824,22569,FELTCRAFT CUSHION BUTTERFLY,1,2011-06-15 10:24:00,7.46,,United Kingdom
556824,22630,DOLLY GIRL LUNCH BOX,1,2011-06-15 10:24:00,2.46,,United Kingdom
556824,22659,LUNCH BOX I LOVE LONDON,1,2011-06-15 10:24:00,2.46,,United Kingdom
556824,22839,3 TIER CAKE TIN GREEN AND CREAM,1,2011-06-15 10:24:00,29.17,,United Kingdom
556824,23199,JUMBO BAG APPLES,3,2011-06-15 10:24:00,4.13,,United Kingdom
556824,82482,WOODEN PICTURE FRAME WHITE FINISH,1,2011-06-15 10:24:00,4.96,,United Kingdom
556824,84988,SET OF 72 PINK HEART PAPER DOILIES,2,2011-06-15 10:24:00,3.75,,United Kingdom
556824,DOT,DOTCOM POSTAGE,1,2011-06-15 10:24:00,65.79,,United Kingdom
556825,20712,JUMBO BAG WOODLAND ANIMALS,8,2011-06-15 10:24:00,4.13,,United Kingdom
556825,20735,BLACK MINI TAPE MEASURE ,1,2011-06-15 10:24:00,1.63,,United Kingdom
556825,20828,GLITTER BUTTERFLY CLIPS,2,2011-06-15 10:24:00,4.96,,United Kingdom
556825,21080,SET/20 RED RETROSPOT PAPER NAPKINS ,1,2011-06-15 10:24:00,2.46,,United Kingdom
556825,21174,POTTERING IN THE SHED METAL SIGN,1,2011-06-15 10:24:00,4.13,,United Kingdom
556825,21328,BALLOONS  WRITING SET ,1,2011-06-15 10:24:00,3.29,,United Kingdom
556825,21430,SET/3 RED GINGHAM ROSE STORAGE BOX,5,2011-06-15 10:24:00,7.46,,United Kingdom
556825,21864,UNION JACK FLAG PASSPORT COVER ,1,2011-06-15 10:24:00,4.13,,United Kingdom
556825,21876,POTTERING MUG,1,2011-06-15 10:24:00,3.29,,United Kingdom
556825,21879,HEARTS GIFT TAPE,5,2011-06-15 10:24:00,1.63,,United Kingdom
556825,21930,JUMBO STORAGE BAG SKULLS,1,2011-06-15 10:24:00,4.96,,United Kingdom
556825,21931,JUMBO STORAGE BAG SUKI,5,2011-06-15 10:24:00,4.13,,United Kingdom
556825,21935,SUKI  SHOULDER BAG,1,2011-06-15 10:24:00,4.13,,United Kingdom
556825,21942,SKULLS DESIGN FLANNEL,1,2011-06-15 10:24:00,1.63,,United Kingdom
556825,21977,PACK OF 60 PINK PAISLEY CAKE CASES,1,2011-06-15 10:24:00,2.08,,United Kingdom
556825,21989,PACK OF 20 SKULL PAPER NAPKINS,2,2011-06-15 10:24:00,1.63,,United Kingdom
556825,22069,BROWN  PIRATE TREASURE CHEST ,1,2011-06-15 10:24:00,4.13,,United Kingdom
556825,22212,FOUR HOOK  WHITE LOVEBIRDS,1,2011-06-15 10:24:00,4.13,,United Kingdom
556825,22352,LUNCH BOX WITH CUTLERY RETROSPOT ,1,2011-06-15 10:24:00,4.96,,United Kingdom
556825,22365,DOORMAT RESPECTABLE HOUSE,1,2011-06-15 10:24:00,14.13,,United Kingdom
556825,22379,RECYCLING BAG RETROSPOT ,1,2011-06-15 10:24:00,4.96,,United Kingdom
556825,22385,JUMBO BAG SPACEBOY DESIGN,1,2011-06-15 10:24:00,4.13,,United Kingdom
556825,22386,JUMBO BAG PINK POLKADOT,1,2011-06-15 10:24:00,4.13,,United Kingdom
556825,22411,JUMBO SHOPPER VINTAGE RED PAISLEY,4,2011-06-15 10:24:00,4.13,,United Kingdom
556825,22501,PICNIC BASKET WICKER LARGE,1,2011-06-15 10:24:00,20.79,,United Kingdom
556825,22502,PICNIC BASKET WICKER SMALL,1,2011-06-15 10:24:00,10.79,,United Kingdom
556825,22663,JUMBO BAG DOLLY GIRL DESIGN,1,2011-06-15 10:24:00,4.13,,United Kingdom
556825,22679,FRENCH BLUE METAL DOOR SIGN 4,1,2011-06-15 10:24:00,2.46,,United Kingdom
556825,22685,FRENCH BLUE METAL DOOR SIGN 0,1,2011-06-15 10:24:00,2.46,,United Kingdom
556825,22845,VINTAGE CREAM CAT FOOD CONTAINER,1,2011-06-15 10:24:00,12.46,,United Kingdom
556825,22853,CAT BOWL VINTAGE CREAM,1,2011-06-15 10:24:00,6.63,,United Kingdom
556825,23051,RECYCLED ACAPULCO MAT BLUE,1,2011-06-15 10:24:00,16.63,,United Kingdom
556825,23199,JUMBO BAG APPLES,1,2011-06-15 10:24:00,4.13,,United Kingdom
556825,47566b,TEA TIME PARTY BUNTING,3,2011-06-15 10:24:00,8.29,,United Kingdom
556825,85014b,RED RETROSPOT UMBRELLA,1,2011-06-15 10:24:00,12.46,,United Kingdom
556825,85099B,JUMBO BAG RED RETROSPOT,6,2011-06-15 10:24:00,4.13,,United Kingdom
556825,85152,HAND OVER THE CHOCOLATE   SIGN ,1,2011-06-15 10:24:00,4.13,,United Kingdom
556825,DOT,DOTCOM POSTAGE,1,2011-06-15 10:24:00,117.42,,United Kingdom
556826,15056bl,EDWARDIAN PARASOL BLACK,2,2011-06-15 10:25:00,12.46,,United Kingdom
556826,20655,QUEEN OF SKIES LUGGAGE TAG,1,2011-06-15 10:25:00,2.46,,United Kingdom
556826,20711,JUMBO BAG TOYS ,7,2011-06-15 10:25:00,4.13,,United Kingdom
556826,20712,JUMBO BAG WOODLAND ANIMALS,14,2011-06-15 10:25:00,4.13,,United Kingdom
556826,20717,STRAWBERRY SHOPPER BAG,1,2011-06-15 10:25:00,2.46,,United Kingdom
556826,21080,SET/20 RED RETROSPOT PAPER NAPKINS ,2,2011-06-15 10:25:00,2.46,,United Kingdom
556826,21086,SET/6 RED SPOTTY PAPER CUPS,1,2011-06-15 10:25:00,1.63,,United Kingdom
556826,21094,SET/6 RED SPOTTY PAPER PLATES,1,2011-06-15 10:25:00,2.46,,United Kingdom
556826,21115,ROSE CARAVAN DOORSTOP,1,2011-06-15 10:25:00,14.13,,United Kingdom
556826,21116,OWL DOORSTOP,1,2011-06-15 10:25:00,8.29,,United Kingdom
556826,21174,POTTERING IN THE SHED METAL SIGN,1,2011-06-15 10:25:00,4.13,,United Kingdom
556826,21192,WHITE BELL HONEYCOMB PAPER ,2,2011-06-15 10:25:00,3.29,,United Kingdom
556826,21288,STRIPEY CHOCOLATE NESTING BOXES,1,2011-06-15 10:25:00,5.79,,United Kingdom
556826,21328,BALLOONS  WRITING SET ,1,2011-06-15 10:25:00,3.29,,United Kingdom
556826,21358,TOAST ITS - HAPPY BIRTHDAY,1,2011-06-15 10:25:00,2.46,,United Kingdom
556826,21424,WOODLAND STORAGE BOX LARGE ,2,2011-06-15 10:25:00,6.63,,United Kingdom
556826,21428,SET3 BOOK BOX GREEN GINGHAM FLOWER ,2,2011-06-15 10:25:00,8.29,,United Kingdom
556826,21430,SET/3 RED GINGHAM ROSE STORAGE BOX,4,2011-06-15 10:25:00,7.46,,United Kingdom
556826,21700,BIG DOUGHNUT FRIDGE MAGNETS,6,2011-06-15 10:25:00,1.38,,United Kingdom
556826,21865,PINK UNION JACK  PASSPORT COVER ,1,2011-06-15 10:25:00,4.13,,United Kingdom
556826,21874,GIN AND TONIC MUG,1,2011-06-15 10:25:00,3.29,,United Kingdom
556826,21929,JUMBO BAG PINK VINTAGE PAISLEY,3,2011-06-15 10:25:00,4.13,,United Kingdom
556826,21930,JUMBO STORAGE BAG SKULLS,3,2011-06-15 10:25:00,4.96,,United Kingdom
556826,21931,JUMBO STORAGE BAG SUKI,10,2011-06-15 10:25:00,4.13,,United Kingdom
556826,21988,PACK OF 6 SKULL PAPER PLATES,3,2011-06-15 10:25:00,1.63,,United Kingdom
556826,21989,PACK OF 20 SKULL PAPER NAPKINS,1,2011-06-15 10:25:00,1.63,,United Kingdom
556826,22041,"RECORD FRAME 7"" SINGLE SIZE ",4,2011-06-15 10:25:00,4.96,,United Kingdom
556826,22055,MINI CAKE STAND  HANGING STRAWBERY,6,2011-06-15 10:25:00,3.29,,United Kingdom
556826,22069,BROWN  PIRATE TREASURE CHEST ,2,2011-06-15 10:25:00,4.13,,United Kingdom
556826,22089,PAPER BUNTING VINTAGE PAISLEY,3,2011-06-15 10:25:00,4.13,,United Kingdom
556826,22120,WELCOME  WOODEN BLOCK LETTERS,1,2011-06-15 10:25:00,19.96,,United Kingdom
556826,22179,SET 10 NIGHT OWL LIGHTS,2,2011-06-15 10:25:00,13.29,,United Kingdom
556826,22207,FRYING PAN UNION FLAG,1,2011-06-15 10:25:00,8.29,,United Kingdom
556826,22212,FOUR HOOK  WHITE LOVEBIRDS,1,2011-06-15 10:25:00,4.13,,United Kingdom
556826,22297,HEART IVORY TRELLIS SMALL,4,2011-06-15 10:25:00,2.46,,United Kingdom
556826,22378,WALL TIDY RETROSPOT ,1,2011-06-15 10:25:00,4.96,,United Kingdom
556826,22379,RECYCLING BAG RETROSPOT ,2,2011-06-15 10:25:00,4.96,,United Kingdom
556826,22381,TOY TIDY PINK POLKADOT,1,2011-06-15 10:25:00,4.96,,United Kingdom
556826,22385,JUMBO BAG SPACEBOY DESIGN,10,2011-06-15 10:25:00,4.13,,United Kingdom
556826,22386,JUMBO BAG PINK POLKADOT,8,2011-06-15 10:25:00,4.13,,United Kingdom
556826,22411,JUMBO SHOPPER VINTAGE RED PAISLEY,6,2011-06-15 10:25:00,4.13,,United Kingdom
556826,22433,WATERING CAN GREEN DINOSAUR,1,2011-06-15 10:25:00,4.13,,United Kingdom
556826,22628,PICNIC BOXES SET OF 3 RETROSPOT ,1,2011-06-15 10:25:00,9.96,,United Kingdom
556826,22697,GREEN REGENCY TEACUP AND SAUCER,2,2011-06-15 10:25:00,5.79,,United Kingdom
556826,22698,PINK REGENCY TEACUP AND SAUCER,2,2011-06-15 10:25:00,5.79,,United Kingdom
556826,22844,VINTAGE CREAM DOG FOOD CONTAINER,1,2011-06-15 10:25:00,16.63,,United Kingdom
556826,22961,JAM MAKING SET PRINTED,1,2011-06-15 10:25:00,3.29,,United Kingdom
556826,23163,REGENCY SUGAR TONGS,1,2011-06-15 10:25:00,4.96,,United Kingdom
556826,23165,LARGE CERAMIC TOP STORAGE JAR,1,2011-06-15 10:25:00,3.29,,United Kingdom
556826,23168,CLASSIC CAFE SUGAR DISPENSER,3,2011-06-15 10:25:00,2.46,,United Kingdom
556826,23199,JUMBO BAG APPLES,4,2011-06-15 10:25:00,4.13,,United Kingdom
556826,23284,DOORMAT KEEP CALM AND COME IN,1,2011-06-15 10:25:00,15.79,,United Kingdom
556826,35004B,SET OF 3 BLACK FLYING DUCKS,1,2011-06-15 10:25:00,12.46,,United Kingdom
556826,47566b,TEA TIME PARTY BUNTING,6,2011-06-15 10:25:00,8.29,,United Kingdom
556826,47591d,PINK FAIRY CAKE CHILDRENS APRON,1,2011-06-15 10:25:00,4.96,,United Kingdom
556826,48194,DOORMAT HEARTS,1,2011-06-15 10:25:00,14.13,,United Kingdom
556826,82482,WOODEN PICTURE FRAME WHITE FINISH,1,2011-06-15 10:25:00,4.96,,United Kingdom
556826,82580,BATHROOM METAL SIGN,3,2011-06-15 10:25:00,1.25,,United Kingdom
556826,82581,TOILET METAL SIGN,1,2011-06-15 10:25:00,1.25,,United Kingdom
556826,84380,SET OF 3 BUTTERFLY COOKIE CUTTERS,1,2011-06-15 10:25:00,3.29,,United Kingdom
556826,84510a,SET OF 4 ENGLISH ROSE COASTERS,1,2011-06-15 10:25:00,2.46,,United Kingdom
556826,84796a,PINK HAWAIIAN PICNIC HAMPER FOR 2,1,2011-06-15 10:25:00,8.29,,United Kingdom
556826,84997a,CHILDRENS CUTLERY POLKADOT GREEN ,1,2011-06-15 10:25:00,8.29,,United Kingdom
556826,85099B,JUMBO BAG RED RETROSPOT,7,2011-06-15 10:25:00,4.13,,United Kingdom
556826,DOT,DOTCOM POSTAGE,1,2011-06-15 10:25:00,277.0,,United Kingdom
556827,71477,COLOUR GLASS. STAR T-LIGHT HOLDER,12,2011-06-15 10:29:00,3.25,15134.0,United Kingdom
556827,71459,HANGING JAM JAR T-LIGHT HOLDER,12,2011-06-15 10:29:00,0.85,15134.0,United Kingdom
556827,22469,HEART OF WICKER SMALL,12,2011-06-15 10:29:00,1.65,15134.0,United Kingdom
556827,22493,PAINT YOUR OWN CANVAS SET,12,2011-06-15 10:29:00,1.65,15134.0,United Kingdom
556827,35961,FOLKART ZINC HEART CHRISTMAS DEC,12,2011-06-15 10:29:00,0.85,15134.0,United Kingdom
556827,23177,TREASURE ISLAND BOOK BOX,8,2011-06-15 10:29:00,2.25,15134.0,United Kingdom
556827,22139,RETROSPOT TEA SET CERAMIC 11 PC ,3,2011-06-15 10:29:00,4.95,15134.0,United Kingdom
556827,23082,SET 6 PAPER TABLE LANTERN HEARTS ,6,2011-06-15 10:29:00,3.75,15134.0,United Kingdom
556827,22595,GINGHAM HEART DECORATION,12,2011-06-15 10:29:00,0.85,15134.0,United Kingdom
556827,22231,JIGSAW TREE WITH BIRDHOUSE,12,2011-06-15 10:29:00,0.59,15134.0,United Kingdom
556828,85152,HAND OVER THE CHOCOLATE   SIGN ,2,2011-06-15 10:39:00,2.1,17284.0,United Kingdom
556828,82600,NO SINGING METAL SIGN,2,2011-06-15 10:39:00,2.1,17284.0,United Kingdom
556828,22084,PAPER CHAIN KIT EMPIRE,1,2011-06-15 10:39:00,2.95,17284.0,United Kingdom
556828,21829,DINOSAUR KEYRINGS ASSORTED,36,2011-06-15 10:39:00,0.21,17284.0,United Kingdom
556828,22971,QUEENS GUARD COFFEE MUG,3,2011-06-15 10:39:00,2.55,17284.0,United Kingdom
556828,22906,12 MESSAGE CARDS WITH ENVELOPES,3,2011-06-15 10:39:00,1.65,17284.0,United Kingdom
556828,21179,NO JUNK MAIL METAL SIGN,3,2011-06-15 10:39:00,1.25,17284.0,United Kingdom
556828,21172,PARTY METAL SIGN ,3,2011-06-15 10:39:00,1.45,17284.0,United Kingdom
556828,23321,SMALL WHITE HEART OF WICKER,3,2011-06-15 10:39:00,1.65,17284.0,United Kingdom
556828,23078,ICE CREAM PEN LIP GLOSS ,24,2011-06-15 10:39:00,1.25,17284.0,United Kingdom
556828,22970,LONDON BUS COFFEE MUG,6,2011-06-15 10:39:00,2.55,17284.0,United Kingdom
556828,23109,LED TEA LIGHTS,6,2011-06-15 10:39:00,2.89,17284.0,United Kingdom
556828,22900,SET 2 TEA TOWELS I LOVE LONDON ,4,2011-06-15 10:39:00,3.25,17284.0,United Kingdom
556828,22564,ALPHABET STENCIL CRAFT,2,2011-06-15 10:39:00,1.25,17284.0,United Kingdom
556828,22563,HAPPY STENCIL CRAFT,2,2011-06-15 10:39:00,1.25,17284.0,United Kingdom
556828,22562,MONSTERS STENCIL CRAFT,2,2011-06-15 10:39:00,1.25,17284.0,United Kingdom
556828,21329,DINOSAURS  WRITING SET ,3,2011-06-15 10:39:00,1.65,17284.0,United Kingdom
556828,21327,SKULLS WRITING SET ,3,2011-06-15 10:39:00,1.65,17284.0,United Kingdom
556828,22902,TOTE BAG I LOVE LONDON,3,2011-06-15 10:39:00,2.1,17284.0,United Kingdom
556828,22713,CARD I LOVE LONDON ,12,2011-06-15 10:39:00,0.42,17284.0,United Kingdom
556828,22530,MAGIC DRAWING SLATE DOLLY GIRL ,2,2011-06-15 10:39:00,0.42,17284.0,United Kingdom
556828,22537,MAGIC DRAWING SLATE DINOSAUR,6,2011-06-15 10:39:00,0.42,17284.0,United Kingdom
556828,23307,SET OF 60 PANTRY DESIGN CAKE CASES ,3,2011-06-15 10:39:00,0.55,17284.0,United Kingdom
556828,23308,SET OF 60 VINTAGE LEAF CAKE CASES ,3,2011-06-15 10:39:00,0.55,17284.0,United Kingdom
556828,21210,SET OF 72 RETROSPOT PAPER  DOILIES,2,2011-06-15 10:39:00,1.45,17284.0,United Kingdom
556828,21094,SET/6 RED SPOTTY PAPER PLATES,4,2011-06-15 10:39:00,0.85,17284.0,United Kingdom
556828,23309,SET OF 60 I LOVE LONDON CAKE CASES ,6,2011-06-15 10:39:00,0.55,17284.0,United Kingdom
556828,21086,SET/6 RED SPOTTY PAPER CUPS,4,2011-06-15 10:39:00,0.65,17284.0,United Kingdom
556828,22908,PACK OF 20 NAPKINS RED APPLES,3,2011-06-15 10:39:00,0.85,17284.0,United Kingdom
556828,21080,SET/20 RED RETROSPOT PAPER NAPKINS ,4,2011-06-15 10:39:00,0.85,17284.0,United Kingdom
556828,22616,PACK OF 12 LONDON TISSUES ,24,2011-06-15 10:39:00,0.29,17284.0,United Kingdom
556828,21986,PACK OF 12 PINK POLKADOT TISSUES,12,2011-06-15 10:39:00,0.29,17284.0,United Kingdom
556829,22667,RECIPE BOX RETROSPOT ,6,2011-06-15 10:51:00,2.95,12809.0,Portugal
556829,23080,RED METAL BOX TOP SECRET,2,2011-06-15 10:51:00,8.25,12809.0,Portugal
556829,23174,REGENCY SUGAR BOWL GREEN,4,2011-06-15 10:51:00,4.15,12809.0,Portugal
556829,23210,WHITE ROCKING HORSE HAND PAINTED,24,2011-06-15 10:51:00,1.25,12809.0,Portugal
556829,23173,REGENCY TEAPOT ROSES ,2,2011-06-15 10:51:00,9.95,12809.0,Portugal
556829,23245,SET OF 3 REGENCY CAKE TINS,4,2011-06-15 10:51:00,4.95,12809.0,Portugal
556829,23250,VINTAGE RED TRIM ENAMEL BOWL ,12,2011-06-15 10:51:00,1.25,12809.0,Portugal
556829,23264,SET OF 3 WOODEN SLEIGH DECORATIONS,12,2011-06-15 10:51:00,1.25,12809.0,Portugal
556829,23252,VINTAGE RED ENAMEL TRIM JUG ,4,2011-06-15 10:51:00,3.75,12809.0,Portugal
556829,23306,SET OF 36 DOILIES PANTRY DESIGN,12,2011-06-15 10:51:00,1.45,12809.0,Portugal
556829,23307,SET OF 60 PANTRY DESIGN CAKE CASES ,24,2011-06-15 10:51:00,0.55,12809.0,Portugal
556829,23308,SET OF 60 VINTAGE LEAF CAKE CASES ,24,2011-06-15 10:51:00,0.55,12809.0,Portugal
556829,22423,REGENCY CAKESTAND 3 TIER,2,2011-06-15 10:51:00,12.75,12809.0,Portugal
556829,22441,GROW YOUR OWN BASIL IN ENAMEL MUG,8,2011-06-15 10:51:00,2.1,12809.0,Portugal
556829,21259,VICTORIAN SEWING BOX SMALL ,4,2011-06-15 10:51:00,5.95,12809.0,Portugal
