InvoiceNo,StockCode,Description,Quantity,InvoiceDate,UnitPrice,CustomerID,Country
561072,85054,FRENCH ENAMEL POT W LID,6,2011-07-24 15:39:00,2.95,14019.0,United Kingdom
561072,22980,PANTRY SCRUBBING BRUSH,12,2011-07-24 15:39:00,1.65,14019.0,United Kingdom
561072,22979,PANTRY WASHING UP BRUSH,12,2011-07-24 15:39:00,1.45,14019.0,United Kingdom
561072,22978,PANTRY ROLLING PIN,6,2011-07-24 15:39:00,3.75,14019.0,United Kingdom
561072,22993,SET OF 4 PANTRY JELLY MOULDS,12,2011-07-24 15:39:00,1.25,14019.0,United Kingdom
561072,22965,3 TRADITIONAl BISCUIT CUTTERS  SET,6,2011-07-24 15:39:00,2.1,14019.0,United Kingdom
561072,22561,WOODEN SCHOOL COLOURING SET,12,2011-07-24 15:39:00,1.65,14019.0,United Kingdom
561072,22489,PACK OF 12 TRADITIONAL CRAYONS,24,2011-07-24 15:39:00,0.42,14019.0,United Kingdom
561073,22558,CLOTHES PEGS RETROSPOT PACK 24 ,48,2011-07-24 15:46:00,1.45,13408.0,United Kingdom
561073,22956,36 FOIL HEART CAKE CASES,24,2011-07-24 15:46:00,2.1,13408.0,United Kingdom
561073,23188,VINTAGE  2 METER FOLDING RULER,24,2011-07-24 15:46:00,1.65,13408.0,United Kingdom
561073,23297,SET 40 HEART SHAPE PETIT FOUR CASES,48,2011-07-24 15:46:00,1.65,13408.0,United Kingdom
561073,20914,SET/5 RED RETROSPOT LID GLASS BOWLS,32,2011-07-24 15:46:00,2.55,13408.0,United Kingdom
561073,23299,FOOD COVER WITH BEADS SET 2 ,24,2011-07-24 15:46:00,3.75,13408.0,United Kingdom
561073,23154,SET OF 4 JAM JAR MAGNETS,24,2011-07-24 15:46:00,2.08,13408.0,United Kingdom
561073,22978,PANTRY ROLLING PIN,12,2011-07-24 15:46:00,3.75,13408.0,United Kingdom
561073,22189,CREAM HEART CARD HOLDER,12,2011-07-24 15:46:00,3.95,13408.0,United Kingdom
561073,71459,HANGING JAM JAR T-LIGHT HOLDER,96,2011-07-24 15:46:00,0.72,13408.0,United Kingdom
561073,23240,SET OF 4 KNICK KNACK TINS DOILEY ,24,2011-07-24 15:46:00,4.15,13408.0,United Kingdom
561073,23295,SET OF 12 MINI LOAF BAKING CASES,24,2011-07-24 15:46:00,0.83,13408.0,United Kingdom
561073,23245,SET OF 3 REGENCY CAKE TINS,16,2011-07-24 15:46:00,4.15,13408.0,United Kingdom
561073,23172,REGENCY TEA PLATE PINK,12,2011-07-24 15:46:00,1.65,13408.0,United Kingdom
561073,23171,REGENCY TEA PLATE GREEN ,12,2011-07-24 15:46:00,1.65,13408.0,United Kingdom
561073,23170,REGENCY TEA PLATE ROSES ,12,2011-07-24 15:46:00,1.65,13408.0,United Kingdom
561073,23082,SET 6 PAPER TABLE LANTERN HEARTS ,24,2011-07-24 15:46:00,3.75,13408.0,United Kingdom
561073,21770,OPEN CLOSED METAL SIGN,1,2011-07-24 15:46:00,4.95,13408.0,United Kingdom
561073,23285,PINK VINTAGE SPOT BEAKER,24,2011-07-24 15:46:00,0.85,13408.0,United Kingdom
561073,23286,BLUE VINTAGE SPOT BEAKER,24,2011-07-24 15:46:00,0.85,13408.0,United Kingdom
561073,23288,GREEN VINTAGE SPOT BEAKER,24,2011-07-24 15:46:00,0.85,13408.0,United Kingdom
561073,23287,RED VINTAGE SPOT BEAKER,24,2011-07-24 15:46:00,0.85,13408.0,United Kingdom
561073,85152,HAND OVER THE CHOCOLATE   SIGN ,12,2011-07-24 15:46:00,2.1,13408.0,United Kingdom
561073,22665,RECIPE BOX BLUE SKETCHBOOK DESIGN,12,2011-07-24 15:46:00,2.95,13408.0,United Kingdom
561074,84912A,PINK ROSE WASHBAG,4,2011-07-24 15:46:00,3.75,13037.0,United Kingdom
561074,20886,BOX OF 9 PEBBLE CANDLES,6,2011-07-24 15:46:00,1.95,13037.0,United Kingdom
561074,21695,SMALL SILVER FLOWER CANDLE POT,6,2011-07-24 15:46:00,2.95,13037.0,United Kingdom
561074,22692,DOORMAT WELCOME TO OUR HOME,2,2011-07-24 15:46:00,7.95,13037.0,United Kingdom
561074,82551,LAUNDRY 15C METAL SIGN,12,2011-07-24 15:46:00,1.45,13037.0,United Kingdom
561074,23138,SINGLE WIRE HOOK IVORY HEART,12,2011-07-24 15:46:00,1.45,13037.0,United Kingdom
561074,22766,PHOTO FRAME CORNICE,8,2011-07-24 15:46:00,2.95,13037.0,United Kingdom
561074,21932,SCANDINAVIAN PAISLEY PICNIC BAG,10,2011-07-24 15:46:00,1.65,13037.0,United Kingdom
561074,22776,SWEETHEART CAKESTAND 3 TIER,1,2011-07-24 15:46:00,9.95,13037.0,United Kingdom
561074,22429,ENAMEL MEASURING JUG CREAM,4,2011-07-24 15:46:00,4.25,13037.0,United Kingdom
561074,82486,WOOD S/3 CABINET ANT WHITE FINISH,2,2011-07-24 15:46:00,8.95,13037.0,United Kingdom
561074,21901,"KEY FOB , BACK DOOR ",24,2011-07-24 15:46:00,0.65,13037.0,United Kingdom
561074,23240,SET OF 4 KNICK KNACK TINS DOILEY ,6,2011-07-24 15:46:00,4.15,13037.0,United Kingdom
561074,23203,JUMBO BAG DOILEY PATTERNS,20,2011-07-24 15:46:00,2.08,13037.0,United Kingdom
561074,23202,JUMBO BAG VINTAGE LEAF,20,2011-07-24 15:46:00,2.08,13037.0,United Kingdom
561075,23322,LARGE WHITE HEART OF WICKER,6,2011-07-24 15:51:00,2.95,16458.0,United Kingdom
561075,85099B,JUMBO BAG RED RETROSPOT,10,2011-07-24 15:51:00,2.08,16458.0,United Kingdom
561075,22355,CHARLOTTE BAG SUKI DESIGN,20,2011-07-24 15:51:00,0.85,16458.0,United Kingdom
561075,20723,STRAWBERRY CHARLOTTE BAG,10,2011-07-24 15:51:00,0.85,16458.0,United Kingdom
561075,20724,RED RETROSPOT CHARLOTTE BAG,10,2011-07-24 15:51:00,0.85,16458.0,United Kingdom
561075,22356,CHARLOTTE BAG PINK POLKADOT,10,2011-07-24 15:51:00,0.85,16458.0,United Kingdom
561075,21931,JUMBO STORAGE BAG SUKI,10,2011-07-24 15:51:00,2.08,16458.0,United Kingdom
561075,21928,JUMBO BAG SCANDINAVIAN BLUE PAISLEY,10,2011-07-24 15:51:00,2.08,16458.0,United Kingdom
561075,22386,JUMBO BAG PINK POLKADOT,10,2011-07-24 15:51:00,2.08,16458.0,United Kingdom
561075,85099F,JUMBO BAG STRAWBERRY,10,2011-07-24 15:51:00,2.08,16458.0,United Kingdom
561075,85099C,JUMBO  BAG BAROQUE BLACK WHITE,10,2011-07-24 15:51:00,2.08,16458.0,United Kingdom
561076,21429,RED GINGHAM ROSE JEWELLERY BOX,16,2011-07-24 15:52:00,1.95,17696.0,United Kingdom
561076,22924,FRIDGE MAGNETS LA VIE EN ROSE,24,2011-07-24 15:52:00,0.85,17696.0,United Kingdom
561076,82482,WOODEN PICTURE FRAME WHITE FINISH,12,2011-07-24 15:52:00,2.55,17696.0,United Kingdom
561076,21164,HOME SWEET HOME METAL SIGN ,12,2011-07-24 15:52:00,2.95,17696.0,United Kingdom
561076,84356,POMPOM CURTAIN,2,2011-07-24 15:52:00,6.95,17696.0,United Kingdom
561076,84406B,CREAM CUPID HEARTS COAT HANGER,12,2011-07-24 15:52:00,4.15,17696.0,United Kingdom
561076,82494L,WOODEN FRAME ANTIQUE WHITE ,12,2011-07-24 15:52:00,2.95,17696.0,United Kingdom
561076,71279,PINK GLASS CANDLEHOLDER,6,2011-07-24 15:52:00,2.95,17696.0,United Kingdom
561076,82551,LAUNDRY 15C METAL SIGN,12,2011-07-24 15:52:00,1.45,17696.0,United Kingdom
561076,82600,NO SINGING METAL SIGN,24,2011-07-24 15:52:00,2.1,17696.0,United Kingdom
561076,21165,BEWARE OF THE CAT METAL SIGN ,12,2011-07-24 15:52:00,1.69,17696.0,United Kingdom
561076,21217,RED RETROSPOT ROUND CAKE TINS,2,2011-07-24 15:52:00,9.95,17696.0,United Kingdom
561076,23173,REGENCY TEAPOT ROSES ,6,2011-07-24 15:52:00,9.95,17696.0,United Kingdom
561077,22563,HAPPY STENCIL CRAFT,12,2011-07-24 15:53:00,1.25,17649.0,United Kingdom
561077,22436,12 COLOURED PARTY BALLOONS,20,2011-07-24 15:53:00,0.65,17649.0,United Kingdom
561077,22149,FELTCRAFT 6 FLOWER FRIENDS,6,2011-07-24 15:53:00,2.1,17649.0,United Kingdom
561077,22904,CALENDAR PAPER CUT DESIGN,6,2011-07-24 15:53:00,2.95,17649.0,United Kingdom
561077,20685,DOORMAT RED RETROSPOT,2,2011-07-24 15:53:00,7.95,17649.0,United Kingdom
561077,23296,SET OF 6 TEA TIME BAKING CASES,16,2011-07-24 15:53:00,1.25,17649.0,United Kingdom
561077,22665,RECIPE BOX BLUE SKETCHBOOK DESIGN,6,2011-07-24 15:53:00,2.95,17649.0,United Kingdom
561077,22723,SET OF 6 HERB TINS SKETCHBOOK,4,2011-07-24 15:53:00,3.95,17649.0,United Kingdom
561077,47566,PARTY BUNTING,4,2011-07-24 15:53:00,4.95,17649.0,United Kingdom
561077,22526,WHEELBARROW FOR CHILDREN ,1,2011-07-24 15:53:00,12.75,17649.0,United Kingdom
561077,23254,CHILDRENS CUTLERY DOLLY GIRL ,4,2011-07-24 15:53:00,4.15,17649.0,United Kingdom
561077,23256,CHILDRENS CUTLERY SPACEBOY ,4,2011-07-24 15:53:00,4.15,17649.0,United Kingdom
561077,22550,HOLIDAY FUN LUDO,4,2011-07-24 15:53:00,3.75,17649.0,United Kingdom
561077,21888,BINGO SET,4,2011-07-24 15:53:00,3.75,17649.0,United Kingdom
561077,22621,TRADITIONAL KNITTING NANCY,12,2011-07-24 15:53:00,1.65,17649.0,United Kingdom
561077,22147,FELTCRAFT BUTTERFLY HEARTS,12,2011-07-24 15:53:00,1.45,17649.0,United Kingdom
561077,22569,FELTCRAFT CUSHION BUTTERFLY,4,2011-07-24 15:53:00,3.75,17649.0,United Kingdom
561077,22749,FELTCRAFT PRINCESS CHARLOTTE DOLL,4,2011-07-24 15:53:00,3.75,17649.0,United Kingdom
561077,20972,PINK CREAM FELT CRAFT TRINKET BOX ,12,2011-07-24 15:53:00,1.25,17649.0,United Kingdom
561077,20728,LUNCH BAG CARS BLUE,10,2011-07-24 15:53:00,1.65,17649.0,United Kingdom
561077,23201,JUMBO BAG ALPHABET,10,2011-07-24 15:53:00,2.08,17649.0,United Kingdom
561077,22383,LUNCH BAG SUKI DESIGN ,10,2011-07-24 15:53:00,1.65,17649.0,United Kingdom
561077,21931,JUMBO STORAGE BAG SUKI,10,2011-07-24 15:53:00,2.08,17649.0,United Kingdom
561077,23203,JUMBO BAG DOILEY PATTERNS,10,2011-07-24 15:53:00,2.08,17649.0,United Kingdom
561077,22386,JUMBO BAG PINK POLKADOT,10,2011-07-24 15:53:00,2.08,17649.0,United Kingdom
561077,23236,DOILEY STORAGE TIN,6,2011-07-24 15:53:00,2.89,17649.0,United Kingdom
561077,23240,SET OF 4 KNICK KNACK TINS DOILEY ,6,2011-07-24 15:53:00,4.15,17649.0,United Kingdom
561077,20725,LUNCH BAG RED RETROSPOT,10,2011-07-24 15:53:00,1.65,17649.0,United Kingdom
561077,85099B,JUMBO BAG RED RETROSPOT,10,2011-07-24 15:53:00,2.08,17649.0,United Kingdom
561077,22558,CLOTHES PEGS RETROSPOT PACK 24 ,12,2011-07-24 15:53:00,1.65,17649.0,United Kingdom
561077,21080,SET/20 RED RETROSPOT PAPER NAPKINS ,12,2011-07-24 15:53:00,0.85,17649.0,United Kingdom
561077,21238,RED RETROSPOT CUP,8,2011-07-24 15:53:00,0.85,17649.0,United Kingdom
561077,84380,SET OF 3 BUTTERFLY COOKIE CUTTERS,12,2011-07-24 15:53:00,1.25,17649.0,United Kingdom
561077,22964,3 PIECE SPACEBOY COOKIE CUTTER SET,6,2011-07-24 15:53:00,2.1,17649.0,United Kingdom
561077,23243,SET OF TEA COFFEE SUGAR TINS PANTRY,4,2011-07-24 15:53:00,4.95,17649.0,United Kingdom
561077,22720,SET OF 3 CAKE TINS PANTRY DESIGN ,3,2011-07-24 15:53:00,4.95,17649.0,United Kingdom
561077,23298,SPOTTY BUNTING,3,2011-07-24 15:53:00,4.95,17649.0,United Kingdom
561077,22961,JAM MAKING SET PRINTED,12,2011-07-24 15:53:00,1.45,17649.0,United Kingdom
561077,22666,RECIPE BOX PANTRY YELLOW DESIGN,6,2011-07-24 15:53:00,2.95,17649.0,United Kingdom
561077,22993,SET OF 4 PANTRY JELLY MOULDS,12,2011-07-24 15:53:00,1.25,17649.0,United Kingdom
561077,22969,HOMEMADE JAM SCENTED CANDLES,12,2011-07-24 15:53:00,1.45,17649.0,United Kingdom
561077,22423,REGENCY CAKESTAND 3 TIER,2,2011-07-24 15:53:00,12.75,17649.0,United Kingdom
561077,23245,SET OF 3 REGENCY CAKE TINS,4,2011-07-24 15:53:00,4.95,17649.0,United Kingdom
561077,21212,PACK OF 72 RETROSPOT CAKE CASES,24,2011-07-24 15:53:00,0.55,17649.0,United Kingdom
561077,22847,BREAD BIN DINER STYLE IVORY,1,2011-07-24 15:53:00,16.95,17649.0,United Kingdom
561077,22843,BISCUIT TIN VINTAGE GREEN,2,2011-07-24 15:53:00,6.75,17649.0,United Kingdom
561077,22841,ROUND CAKE TIN VINTAGE GREEN,2,2011-07-24 15:53:00,7.95,17649.0,United Kingdom
561077,22429,ENAMEL MEASURING JUG CREAM,4,2011-07-24 15:53:00,4.25,17649.0,United Kingdom
561077,22427,ENAMEL FLOWER JUG CREAM,3,2011-07-24 15:53:00,5.95,17649.0,United Kingdom
561077,23252,VINTAGE RED ENAMEL TRIM JUG ,4,2011-07-24 15:53:00,3.75,17649.0,United Kingdom
561077,23199,JUMBO BAG APPLES,10,2011-07-24 15:53:00,2.08,17649.0,United Kingdom
561077,22908,PACK OF 20 NAPKINS RED APPLES,12,2011-07-24 15:53:00,0.85,17649.0,United Kingdom
561078,23196,VINTAGE LEAF MAGNETIC NOTEPAD,12,2011-07-24 16:05:00,1.45,16178.0,United Kingdom
561078,23263,SET OF 3 WOODEN HEART DECORATIONS,24,2011-07-24 16:05:00,1.25,16178.0,United Kingdom
561078,22668,PINK BABY BUNTING,5,2011-07-24 16:05:00,2.95,16178.0,United Kingdom
561078,22669,RED BABY BUNTING ,5,2011-07-24 16:05:00,2.95,16178.0,United Kingdom
561078,22965,3 TRADITIONAl BISCUIT CUTTERS  SET,12,2011-07-24 16:05:00,2.1,16178.0,United Kingdom
561078,22993,SET OF 4 PANTRY JELLY MOULDS,12,2011-07-24 16:05:00,1.25,16178.0,United Kingdom
561078,21584,RETROSPOT SMALL TUBE MATCHES,20,2011-07-24 16:05:00,1.65,16178.0,United Kingdom
561078,22622,BOX OF VINTAGE ALPHABET BLOCKS,4,2011-07-24 16:05:00,11.95,16178.0,United Kingdom
561079,22575,METAL MERRY CHRISTMAS WREATH,1,2011-07-24 16:12:00,1.95,13956.0,United Kingdom
561079,22079,RIBBON REEL HEARTS DESIGN ,2,2011-07-24 16:12:00,1.65,13956.0,United Kingdom
561079,22081,RIBBON REEL FLORA + FAUNA ,2,2011-07-24 16:12:00,1.65,13956.0,United Kingdom
561079,85049E,SCANDINAVIAN REDS RIBBONS,3,2011-07-24 16:12:00,1.25,13956.0,United Kingdom
561079,84754,S/15 SILVER GLASS BAUBLES IN BAG,1,2011-07-24 16:12:00,1.25,13956.0,United Kingdom
561079,22571,ROCKING HORSE RED CHRISTMAS ,1,2011-07-24 16:12:00,0.85,13956.0,United Kingdom
561079,35954,SMALL FOLKART STAR CHRISTMAS DEC,20,2011-07-24 16:12:00,0.42,13956.0,United Kingdom
561079,22336,DOVE DECORATION PAINTED ZINC ,1,2011-07-24 16:12:00,0.65,13956.0,United Kingdom
561079,21819,GLITTER CHRISTMAS STAR ,1,2011-07-24 16:12:00,0.85,13956.0,United Kingdom
561079,22336,DOVE DECORATION PAINTED ZINC ,5,2011-07-24 16:12:00,0.65,13956.0,United Kingdom
561079,22571,ROCKING HORSE RED CHRISTMAS ,1,2011-07-24 16:12:00,0.85,13956.0,United Kingdom
561079,21819,GLITTER CHRISTMAS STAR ,4,2011-07-24 16:12:00,0.85,13956.0,United Kingdom
561079,35953,FOLKART STAR CHRISTMAS DECORATIONS,11,2011-07-24 16:12:00,1.25,13956.0,United Kingdom
561079,22600,CHRISTMAS RETROSPOT STAR WOOD,6,2011-07-24 16:12:00,0.85,13956.0,United Kingdom
561079,22602,RETROSPOT WOODEN HEART DECORATION,8,2011-07-24 16:12:00,0.85,13956.0,United Kingdom
561079,23130,MISTLETOE HEART WREATH GREEN,3,2011-07-24 16:12:00,4.15,13956.0,United Kingdom
561079,23103,JINGLE BELL HEART DECORATION,10,2011-07-24 16:12:00,1.65,13956.0,United Kingdom
561079,84754,S/15 SILVER GLASS BAUBLES IN BAG,5,2011-07-24 16:12:00,1.25,13956.0,United Kingdom
561079,23321,SMALL WHITE HEART OF WICKER,3,2011-07-24 16:12:00,1.65,13956.0,United Kingdom
561079,22694,WICKER STAR ,6,2011-07-24 16:12:00,2.1,13956.0,United Kingdom
561079,22580,ADVENT CALENDAR GINGHAM SACK,2,2011-07-24 16:12:00,5.95,13956.0,United Kingdom
561079,22818,CARD CHRISTMAS VILLAGE,24,2011-07-24 16:12:00,0.42,13956.0,United Kingdom
561079,22816,CARD MOTORBIKE SANTA,36,2011-07-24 16:12:00,0.42,13956.0,United Kingdom
561079,22910,PAPER CHAIN KIT VINTAGE CHRISTMAS,1,2011-07-24 16:12:00,2.95,13956.0,United Kingdom
561079,22086,PAPER CHAIN KIT 50'S CHRISTMAS ,2,2011-07-24 16:12:00,2.95,13956.0,United Kingdom
561079,23313,VINTAGE CHRISTMAS BUNTING,2,2011-07-24 16:12:00,4.95,13956.0,United Kingdom
561079,23234,BISCUIT TIN VINTAGE CHRISTMAS,1,2011-07-24 16:12:00,2.89,13956.0,United Kingdom
561079,21264,WHITE GOOSE FEATHER TREE 60CM ,2,2011-07-24 16:12:00,1.95,13956.0,United Kingdom
561079,20754,RETROSPOT RED WASHING UP GLOVES,1,2011-07-24 16:12:00,2.1,13956.0,United Kingdom
561079,20751,FUNKY WASHING UP GLOVES ASSORTED,4,2011-07-24 16:12:00,2.1,13956.0,United Kingdom
561079,21563,RED HEART SHAPE LOVE BUCKET ,1,2011-07-24 16:12:00,2.95,13956.0,United Kingdom
561079,21385,IVORY HANGING DECORATION  HEART,12,2011-07-24 16:12:00,0.85,13956.0,United Kingdom
561079,22460,EMBOSSED GLASS TEALIGHT HOLDER,4,2011-07-24 16:12:00,1.25,13956.0,United Kingdom
561079,20983,12 PENCILS TALL TUBE RED RETROSPOT,3,2011-07-24 16:12:00,0.85,13956.0,United Kingdom
561079,23091,ZINC HERB GARDEN CONTAINER,1,2011-07-24 16:12:00,6.25,13956.0,United Kingdom
561079,21876,POTTERING MUG,2,2011-07-24 16:12:00,1.25,13956.0,United Kingdom
561079,22801,ANTIQUE GLASS PEDESTAL BOWL,2,2011-07-24 16:12:00,3.75,13956.0,United Kingdom
561079,47590B,PINK HAPPY BIRTHDAY BUNTING,1,2011-07-24 16:12:00,5.45,13956.0,United Kingdom
561079,47590A,BLUE HAPPY BIRTHDAY BUNTING,1,2011-07-24 16:12:00,5.45,13956.0,United Kingdom
561079,20749,ASSORTED COLOUR MINI CASES,1,2011-07-24 16:12:00,7.95,13956.0,United Kingdom
561079,84879,ASSORTED COLOUR BIRD ORNAMENT,29,2011-07-24 16:12:00,1.69,13956.0,United Kingdom
561079,22191,IVORY DINER WALL CLOCK,1,2011-07-24 16:12:00,8.5,13956.0,United Kingdom
561079,22427,ENAMEL FLOWER JUG CREAM,1,2011-07-24 16:12:00,5.95,13956.0,United Kingdom
561079,22667,RECIPE BOX RETROSPOT ,1,2011-07-24 16:12:00,2.95,13956.0,United Kingdom
561079,21217,RED RETROSPOT ROUND CAKE TINS,1,2011-07-24 16:12:00,9.95,13956.0,United Kingdom
561079,20750,RED RETROSPOT MINI CASES,1,2011-07-24 16:12:00,7.95,13956.0,United Kingdom
561079,22558,CLOTHES PEGS RETROSPOT PACK 24 ,2,2011-07-24 16:12:00,1.65,13956.0,United Kingdom
561079,20756,GREEN FERN POCKET BOOK,3,2011-07-24 16:12:00,0.85,13956.0,United Kingdom
561079,21080,SET/20 RED RETROSPOT PAPER NAPKINS ,3,2011-07-24 16:12:00,0.85,13956.0,United Kingdom
561079,20725,LUNCH BAG RED RETROSPOT,2,2011-07-24 16:12:00,1.65,13956.0,United Kingdom
561079,20718,RED RETROSPOT SHOPPER BAG,3,2011-07-24 16:12:00,1.25,13956.0,United Kingdom
561079,85014B,RED RETROSPOT UMBRELLA,1,2011-07-24 16:12:00,5.95,13956.0,United Kingdom
561079,85014A,BLACK/BLUE POLKADOT UMBRELLA,1,2011-07-24 16:12:00,5.95,13956.0,United Kingdom
561079,82484,WOOD BLACK BOARD ANT WHITE FINISH,2,2011-07-24 16:12:00,7.95,13956.0,United Kingdom
561079,22487,WHITE WOOD GARDEN PLANT LADDER,2,2011-07-24 16:12:00,9.95,13956.0,United Kingdom
561080,22419,LIPSTICK PEN RED,2,2011-07-24 16:13:00,0.42,,United Kingdom
561080,22111,SCOTTIE DOG HOT WATER BOTTLE,2,2011-07-24 16:13:00,4.95,,United Kingdom
561080,22112,CHOCOLATE HOT WATER BOTTLE,2,2011-07-24 16:13:00,4.95,,United Kingdom
561080,22835,HOT WATER BOTTLE I AM SO POORLY,2,2011-07-24 16:13:00,4.65,,United Kingdom
561080,22055,MINI CAKE STAND  HANGING STRAWBERY,2,2011-07-24 16:13:00,1.65,,United Kingdom
561080,22061,LARGE CAKE STAND  HANGING STRAWBERY,1,2011-07-24 16:13:00,9.95,,United Kingdom
561080,22063,CERAMIC BOWL WITH STRAWBERRY DESIGN,2,2011-07-24 16:13:00,2.95,,United Kingdom
561080,20676,RED RETROSPOT BOWL,4,2011-07-24 16:13:00,1.25,,United Kingdom
561080,21232,STRAWBERRY CERAMIC TRINKET BOX,2,2011-07-24 16:13:00,1.25,,United Kingdom
561080,22646,CERAMIC STRAWBERRY CAKE MONEY BANK,2,2011-07-24 16:13:00,1.45,,United Kingdom
561080,22059,CERAMIC STRAWBERRY DESIGN MUG,2,2011-07-24 16:13:00,1.49,,United Kingdom
561080,20914,SET/5 RED RETROSPOT LID GLASS BOWLS,1,2011-07-24 16:13:00,2.95,,United Kingdom
561080,22649,STRAWBERRY FAIRY CAKE TEAPOT,2,2011-07-24 16:13:00,4.95,,United Kingdom
561080,21238,RED RETROSPOT CUP,4,2011-07-24 16:13:00,0.85,,United Kingdom
561080,23178,JAM CLOCK MAGNET,2,2011-07-24 16:13:00,2.89,,United Kingdom
561080,23181,BULL DOG BOTTLE TOP WALL CLOCK,2,2011-07-24 16:13:00,8.25,,United Kingdom
561080,23179,CLOCK MAGNET MUM'S KITCHEN,2,2011-07-24 16:13:00,2.89,,United Kingdom
561080,23180,MUM'S KITCHEN CLOCK,2,2011-07-24 16:13:00,4.95,,United Kingdom
561080,82600,NO SINGING METAL SIGN,2,2011-07-24 16:13:00,2.1,,United Kingdom
561080,21175,GIN + TONIC DIET METAL SIGN,2,2011-07-24 16:13:00,2.55,,United Kingdom
561080,21169,YOU'RE CONFUSING ME METAL SIGN ,2,2011-07-24 16:13:00,1.69,,United Kingdom
561080,22413,METAL SIGN TAKE IT OR LEAVE IT ,2,2011-07-24 16:13:00,2.95,,United Kingdom
561080,21907,I'M ON HOLIDAY METAL SIGN,2,2011-07-24 16:13:00,2.1,,United Kingdom
561080,21108,FAIRY CAKE FLANNEL ASSORTED COLOUR,4,2011-07-24 16:13:00,2.55,,United Kingdom
561080,21107,CREAM SLICE FLANNEL PINK SPOT ,2,2011-07-24 16:13:00,2.95,,United Kingdom
561080,21106,CREAM SLICE FLANNEL CHOCOLATE SPOT ,2,2011-07-24 16:13:00,2.95,,United Kingdom
561080,21111,"SWISS ROLL TOWEL, CHOCOLATE  SPOTS",2,2011-07-24 16:13:00,2.95,,United Kingdom
561080,21112,SWISS ROLL TOWEL PINK  SPOTS,2,2011-07-24 16:13:00,2.95,,United Kingdom
561080,23341,PINK DINER WALL CLOCK,1,2011-07-24 16:13:00,8.5,,United Kingdom
561080,23315,IVORY REFECTORY CLOCK,1,2011-07-24 16:13:00,9.95,,United Kingdom
561080,23342,MINT DINER WALL CLOCK,1,2011-07-24 16:13:00,8.5,,United Kingdom
561080,22730,ALARM CLOCK BAKELIKE IVORY,2,2011-07-24 16:13:00,3.75,,United Kingdom
561080,22726,ALARM CLOCK BAKELIKE GREEN,2,2011-07-24 16:13:00,3.75,,United Kingdom
561080,22729,ALARM CLOCK BAKELIKE ORANGE,2,2011-07-24 16:13:00,3.75,,United Kingdom
561080,22728,ALARM CLOCK BAKELIKE PINK,1,2011-07-24 16:13:00,3.75,,United Kingdom
561080,85020,ROUND PINK HEART MIRROR,2,2011-07-24 16:13:00,2.1,,United Kingdom
561080,23009,I LOVE LONDON BABY GIFT SET,1,2011-07-24 16:13:00,16.95,,United Kingdom
561080,22314,OFFICE MUG WARMER CHOC+BLUE,2,2011-07-24 16:13:00,2.95,,United Kingdom
561080,22313,OFFICE MUG WARMER PINK,1,2011-07-24 16:13:00,2.95,,United Kingdom
561080,22312,OFFICE MUG WARMER POLKADOT,2,2011-07-24 16:13:00,2.95,,United Kingdom
561080,22311,OFFICE MUG WARMER BLACK+SILVER ,1,2011-07-24 16:13:00,2.95,,United Kingdom
561080,85014B,RED RETROSPOT UMBRELLA,2,2011-07-24 16:13:00,5.95,,United Kingdom
561080,85014A,BLACK/BLUE POLKADOT UMBRELLA,2,2011-07-24 16:13:00,5.95,,United Kingdom
561080,23346,SPACEBOY BEAKER,2,2011-07-24 16:13:00,1.25,,United Kingdom
561080,23345, DOLLY GIRL BEAKER,2,2011-07-24 16:13:00,1.25,,United Kingdom
561080,21462,"NURSERY A,B,C PAINTED LETTERS",1,2011-07-24 16:13:00,6.75,,United Kingdom
561080,22421,LIPSTICK PEN FUSCHIA,2,2011-07-24 16:13:00,0.42,,United Kingdom
561080,22420,LIPSTICK PEN BABY PINK,2,2011-07-24 16:13:00,0.42,,United Kingdom
561081,22167, OVAL WALL MIRROR DIAMANTE ,1,2011-07-24 16:15:00,9.95,13230.0,United Kingdom
561081,22794,SWEETHEART WIRE MAGAZINE RACK,1,2011-07-24 16:15:00,7.95,13230.0,United Kingdom
561081,23310,BUBBLEGUM RING ASSORTED,36,2011-07-24 16:15:00,0.42,13230.0,United Kingdom
561081,82484,WOOD BLACK BOARD ANT WHITE FINISH,2,2011-07-24 16:15:00,7.95,13230.0,United Kingdom
561081,22781,GUMBALL MAGAZINE RACK,1,2011-07-24 16:15:00,7.65,13230.0,United Kingdom
561081,23249,VINTAGE RED ENAMEL TRIM PLATE,1,2011-07-24 16:15:00,1.65,13230.0,United Kingdom
561081,23250,VINTAGE RED TRIM ENAMEL BOWL ,1,2011-07-24 16:15:00,1.25,13230.0,United Kingdom
561081,84596B,SMALL DOLLY MIX DESIGN ORANGE BOWL,6,2011-07-24 16:15:00,0.42,13230.0,United Kingdom
561081,84596L,BISCUITS SMALL BOWL LIGHT BLUE,2,2011-07-24 16:15:00,0.42,13230.0,United Kingdom
561081,84596G,SMALL CHOCOLATES PINK BOWL,2,2011-07-24 16:15:00,0.42,13230.0,United Kingdom
561081,84596F,SMALL MARSHMALLOWS PINK BOWL,5,2011-07-24 16:15:00,0.42,13230.0,United Kingdom
561081,22197,POPCORN HOLDER,10,2011-07-24 16:15:00,0.85,13230.0,United Kingdom
561081,21232,STRAWBERRY CERAMIC TRINKET BOX,4,2011-07-24 16:15:00,1.25,13230.0,United Kingdom
561081,37447,CERAMIC CAKE DESIGN SPOTTED PLATE,1,2011-07-24 16:15:00,1.49,13230.0,United Kingdom
561081,23077,DOUGHNUT LIP GLOSS ,20,2011-07-24 16:15:00,1.25,13230.0,United Kingdom
561081,21231,SWEETHEART CERAMIC TRINKET BOX,4,2011-07-24 16:15:00,1.25,13230.0,United Kingdom
561081,22055,MINI CAKE STAND  HANGING STRAWBERY,1,2011-07-24 16:15:00,1.65,13230.0,United Kingdom
561081,21877,HOME SWEET HOME MUG,1,2011-07-24 16:15:00,1.25,13230.0,United Kingdom
561081,23347,I LOVE LONDON BEAKER,1,2011-07-24 16:15:00,1.25,13230.0,United Kingdom
561081,23345, DOLLY GIRL BEAKER,1,2011-07-24 16:15:00,1.25,13230.0,United Kingdom
561081,23346,SPACEBOY BEAKER,1,2011-07-24 16:15:00,1.25,13230.0,United Kingdom
561081,23118,PARISIENNE JEWELLERY DRAWER ,1,2011-07-24 16:15:00,7.5,13230.0,United Kingdom
561081,22784,LANTERN CREAM GAZEBO ,2,2011-07-24 16:15:00,4.95,13230.0,United Kingdom
561081,71053,WHITE METAL LANTERN,2,2011-07-24 16:15:00,3.75,13230.0,United Kingdom
561081,23099,FRENCH CARRIAGE LANTERN,1,2011-07-24 16:15:00,6.65,13230.0,United Kingdom
561082,22983,CARD BILLBOARD FONT,12,2011-07-24 16:18:00,0.42,13230.0,United Kingdom
C561083,22983,CARD BILLBOARD FONT,-121,2011-07-24 16:20:00,0.36,13230.0,United Kingdom
