InvoiceNo,StockCode,Description,Quantity,InvoiceDate,UnitPrice,CustomerID,Country
569203,79321,CHILLI LIGHTS,48,2011-10-02 10:32:00,4.95,16353.0,United Kingdom
569203,21154,RED RETROSPOT OVEN GLOVE ,20,2011-10-02 10:32:00,1.25,16353.0,United Kingdom
569204,21790,VINTAGE SNAP CARDS,4,2011-10-02 10:43:00,0.85,16591.0,United Kingdom
569204,23284,DOORMAT KEEP CALM AND COME IN,15,2011-10-02 10:43:00,7.08,16591.0,United Kingdom
569204,23355,HOT WATER BOTTLE KEEP CALM,4,2011-10-02 10:43:00,4.95,16591.0,United Kingdom
569204,22207,FRYING PAN UNION FLAG,2,2011-10-02 10:43:00,4.25,16591.0,United Kingdom
569204,22111,SCOTTIE DOG HOT WATER BOTTLE,2,2011-10-02 10:43:00,4.95,16591.0,United Kingdom
569204,22112,CHOCOLATE HOT WATER BOTTLE,3,2011-10-02 10:43:00,4.95,16591.0,United Kingdom
569204,22835,HOT WATER BOTTLE I AM SO POORLY,2,2011-10-02 10:43:00,4.95,16591.0,United Kingdom
569204,22476,EMPIRE UNION JACK TV DINNER TRAY,6,2011-10-02 10:43:00,4.95,16591.0,United Kingdom
569204,22728,ALARM CLOCK BAKELIKE PINK,2,2011-10-02 10:43:00,3.75,16591.0,United Kingdom
569204,22730,ALARM CLOCK BAKELIKE IVORY,1,2011-10-02 10:43:00,3.75,16591.0,United Kingdom
569205,22910,PAPER CHAIN KIT VINTAGE CHRISTMAS,2,2011-10-02 10:55:00,2.95,16923.0,United Kingdom
569205,23332,IVORY WICKER HEART LARGE,9,2011-10-02 10:55:00,1.65,16923.0,United Kingdom
569205,23322,LARGE WHITE HEART OF WICKER,5,2011-10-02 10:55:00,2.95,16923.0,United Kingdom
569205,23323,WHITE WICKER STAR ,5,2011-10-02 10:55:00,2.1,16923.0,United Kingdom
569205,23404,HOME SWEET HOME BLACKBOARD,12,2011-10-02 10:55:00,4.95,16923.0,United Kingdom
569205,23400,SHELF WITH 4 HOOKS HOME SWEET HOME,4,2011-10-02 10:55:00,6.25,16923.0,United Kingdom
569205,23393,HOME SWEET HOME CUSHION COVER ,5,2011-10-02 10:55:00,3.75,16923.0,United Kingdom
569205,23328,SET 6 SCHOOL MILK BOTTLES IN CRATE,12,2011-10-02 10:55:00,3.75,16923.0,United Kingdom
569205,23396,LE JARDIN BOTANIQUE CUSHION COVER,5,2011-10-02 10:55:00,3.75,16923.0,United Kingdom
569205,23394,POSTE FRANCE CUSHION COVER,5,2011-10-02 10:55:00,3.75,16923.0,United Kingdom
569205,21809,CHRISTMAS HANGING TREE WITH BELL,192,2011-10-02 10:55:00,0.39,16923.0,United Kingdom
569205,21900,"KEY FOB , SHED",7,2011-10-02 10:55:00,0.65,16923.0,United Kingdom
569205,21901,"KEY FOB , BACK DOOR ",4,2011-10-02 10:55:00,0.65,16923.0,United Kingdom
569205,20728,LUNCH BAG CARS BLUE,10,2011-10-02 10:55:00,1.65,16923.0,United Kingdom
569205,23406,HOME SWEET HOME KEY HOLDER,4,2011-10-02 10:55:00,6.25,16923.0,United Kingdom
569205,21756,BATH BUILDING BLOCK WORD,2,2011-10-02 10:55:00,6.25,16923.0,United Kingdom
569205,22423,REGENCY CAKESTAND 3 TIER,1,2011-10-02 10:55:00,12.75,16923.0,United Kingdom
569205,22896,PEG BAG APPLES DESIGN,3,2011-10-02 10:55:00,2.55,16923.0,United Kingdom
569205,22899,CHILDREN'S APRON DOLLY GIRL ,2,2011-10-02 10:55:00,2.1,16923.0,United Kingdom
569205,22898,CHILDRENS APRON APPLES DESIGN,3,2011-10-02 10:55:00,1.95,16923.0,United Kingdom
569205,21156,RETROSPOT CHILDRENS APRON,2,2011-10-02 10:55:00,1.95,16923.0,United Kingdom
569205,23355,HOT WATER BOTTLE KEEP CALM,4,2011-10-02 10:55:00,4.95,16923.0,United Kingdom
569205,22114,HOT WATER BOTTLE TEA AND SYMPATHY,3,2011-10-02 10:55:00,4.25,16923.0,United Kingdom
569205,22384,LUNCH BAG PINK POLKADOT,10,2011-10-02 10:55:00,1.65,16923.0,United Kingdom
569205,22624,IVORY KITCHEN SCALES,1,2011-10-02 10:55:00,8.5,16923.0,United Kingdom
569205,23426,METAL SIGN DROP YOUR PANTS,12,2011-10-02 10:55:00,2.89,16923.0,United Kingdom
569205,20724,RED RETROSPOT CHARLOTTE BAG,10,2011-10-02 10:55:00,0.85,16923.0,United Kingdom
569205,21258,VICTORIAN SEWING BOX LARGE,2,2011-10-02 10:55:00,12.75,16923.0,United Kingdom
569205,22627,MINT KITCHEN SCALES,1,2011-10-02 10:55:00,8.5,16923.0,United Kingdom
569205,22624,IVORY KITCHEN SCALES,1,2011-10-02 10:55:00,8.5,16923.0,United Kingdom
569205,20723,STRAWBERRY CHARLOTTE BAG,10,2011-10-02 10:55:00,0.85,16923.0,United Kingdom
569205,23207,LUNCH BAG ALPHABET DESIGN,10,2011-10-02 10:55:00,1.65,16923.0,United Kingdom
569205,22776,SWEETHEART 3 TIER CAKE STAND ,1,2011-10-02 10:55:00,9.95,16923.0,United Kingdom
569205,20727,LUNCH BAG  BLACK SKULL.,10,2011-10-02 10:55:00,1.65,16923.0,United Kingdom
569205,22382,LUNCH BAG SPACEBOY DESIGN ,10,2011-10-02 10:55:00,1.65,16923.0,United Kingdom
569205,22356,CHARLOTTE BAG PINK POLKADOT,10,2011-10-02 10:55:00,0.85,16923.0,United Kingdom
569205,23205,CHARLOTTE BAG VINTAGE ALPHABET ,3,2011-10-02 10:55:00,0.85,16923.0,United Kingdom
569205,22138,BAKING SET 9 PIECE RETROSPOT ,2,2011-10-02 10:55:00,4.95,16923.0,United Kingdom
569205,23108,SET OF 10 LED DOLLY LIGHTS,1,2011-10-02 10:55:00,6.25,16923.0,United Kingdom
569205,82494L,WOODEN FRAME ANTIQUE WHITE ,6,2011-10-02 10:55:00,2.95,16923.0,United Kingdom
569206,90209B,GREEN ENAMEL+GLASS HAIR COMB,1,2011-10-02 10:58:00,2.1,15038.0,United Kingdom
569206,90209C,PINK ENAMEL+GLASS HAIR COMB,1,2011-10-02 10:58:00,2.1,15038.0,United Kingdom
569206,23284,DOORMAT KEEP CALM AND COME IN,6,2011-10-02 10:58:00,8.25,15038.0,United Kingdom
569206,22469,HEART OF WICKER SMALL,1,2011-10-02 10:58:00,1.65,15038.0,United Kingdom
569206,23431,NATURAL HANGING QUILTED HEARTS ,12,2011-10-02 10:58:00,0.83,15038.0,United Kingdom
569206,23250,VINTAGE RED TRIM ENAMEL BOWL ,6,2011-10-02 10:58:00,1.25,15038.0,United Kingdom
569206,23085,ANTIQUE SILVER BAUBLE LAMP  ,2,2011-10-02 10:58:00,10.4,15038.0,United Kingdom
569206,23249,VINTAGE RED ENAMEL TRIM PLATE,6,2011-10-02 10:58:00,1.65,15038.0,United Kingdom
569206,84970S,HANGING HEART ZINC T-LIGHT HOLDER,2,2011-10-02 10:58:00,0.85,15038.0,United Kingdom
569206,23251,VINTAGE RED ENAMEL TRIM MUG ,6,2011-10-02 10:58:00,1.25,15038.0,United Kingdom
569206,85053,FRENCH ENAMEL CANDLEHOLDER,1,2011-10-02 10:58:00,2.1,15038.0,United Kingdom
569206,23355,HOT WATER BOTTLE KEEP CALM,1,2011-10-02 10:58:00,4.95,15038.0,United Kingdom
569206,21677,HEARTS  STICKERS,10,2011-10-02 10:58:00,0.85,15038.0,United Kingdom
569206,85107,CUT GLASS T-LIGHT HOLDER OCTAGON,4,2011-10-02 10:58:00,2.55,15038.0,United Kingdom
569206,22071,SMALL WHITE RETROSPOT MUG IN BOX ,2,2011-10-02 10:58:00,3.75,15038.0,United Kingdom
569206,85123A,WHITE HANGING HEART T-LIGHT HOLDER,2,2011-10-02 10:58:00,2.95,15038.0,United Kingdom
569206,20765,CHRYSANTHEMUM SKETCHBOOK ,1,2011-10-02 10:58:00,3.75,15038.0,United Kingdom
569206,51014L,"FEATHER PEN,LIGHT PINK",12,2011-10-02 10:58:00,0.39,15038.0,United Kingdom
569206,21340,CLASSIC METAL BIRDCAGE PLANT HOLDER,1,2011-10-02 10:58:00,12.75,15038.0,United Kingdom
569207,22381,TOY TIDY PINK POLKADOT,3,2011-10-02 11:04:00,2.1,17811.0,United Kingdom
569207,22379,RECYCLING BAG RETROSPOT ,3,2011-10-02 11:04:00,2.1,17811.0,United Kingdom
569207,22845,VINTAGE CREAM CAT FOOD CONTAINER,1,2011-10-02 11:04:00,6.35,17811.0,United Kingdom
569207,22993,SET OF 4 PANTRY JELLY MOULDS,2,2011-10-02 11:04:00,1.25,17811.0,United Kingdom
569207,22865,HAND WARMER OWL DESIGN,1,2011-10-02 11:04:00,2.1,17811.0,United Kingdom
569207,22812,PACK 3 BOXES CHRISTMAS PANNETONE,13,2011-10-02 11:04:00,1.95,17811.0,United Kingdom
569207,22469,HEART OF WICKER SMALL,3,2011-10-02 11:04:00,1.65,17811.0,United Kingdom
569207,23321,SMALL WHITE HEART OF WICKER,9,2011-10-02 11:04:00,1.65,17811.0,United Kingdom
569207,20914,SET/5 RED RETROSPOT LID GLASS BOWLS,1,2011-10-02 11:04:00,2.95,17811.0,United Kingdom
569207,22306,SILVER MUG BONE CHINA TREE OF LIFE,6,2011-10-02 11:04:00,1.06,17811.0,United Kingdom
569207,21533,RETROSPOT LARGE MILK JUG,1,2011-10-02 11:04:00,4.95,17811.0,United Kingdom
569207,21534,DAIRY MAID LARGE MILK JUG,1,2011-10-02 11:04:00,4.95,17811.0,United Kingdom
569207,22865,HAND WARMER OWL DESIGN,5,2011-10-02 11:04:00,2.1,17811.0,United Kingdom
569207,22633,HAND WARMER UNION JACK,5,2011-10-02 11:04:00,2.1,17811.0,United Kingdom
569207,22961,JAM MAKING SET PRINTED,24,2011-10-02 11:04:00,1.45,17811.0,United Kingdom
569207,47566B,TEA TIME PARTY BUNTING,2,2011-10-02 11:04:00,4.95,17811.0,United Kingdom
569207,22306,SILVER MUG BONE CHINA TREE OF LIFE,6,2011-10-02 11:04:00,1.06,17811.0,United Kingdom
569207,22307,GOLD MUG BONE CHINA TREE OF LIFE,6,2011-10-02 11:04:00,1.06,17811.0,United Kingdom
569208,21592,RETROSPOT CIGAR BOX MATCHES ,6,2011-10-02 11:10:00,1.25,16693.0,United Kingdom
569208,22487,WHITE WOOD GARDEN PLANT LADDER,1,2011-10-02 11:10:00,9.95,16693.0,United Kingdom
569208,23354,6 GIFT TAGS 50'S CHRISTMAS ,10,2011-10-02 11:10:00,0.83,16693.0,United Kingdom
569208,22812,PACK 3 BOXES CHRISTMAS PANNETONE,5,2011-10-02 11:10:00,1.95,16693.0,United Kingdom
569208,23020,GLASS  SONGBIRD STORAGE JAR,2,2011-10-02 11:10:00,12.5,16693.0,United Kingdom
569208,23395,BELLE JARDINIERE CUSHION COVER,6,2011-10-02 11:10:00,3.75,16693.0,United Kingdom
569208,23396,LE JARDIN BOTANIQUE CUSHION COVER,3,2011-10-02 11:10:00,3.75,16693.0,United Kingdom
569208,23393,HOME SWEET HOME CUSHION COVER ,3,2011-10-02 11:10:00,3.75,16693.0,United Kingdom
569208,78034B,BLUE NETTING STORAGE HANGER,1,2011-10-02 11:10:00,1.95,16693.0,United Kingdom
569208,16169E,WRAP 50'S  CHRISTMAS,25,2011-10-02 11:10:00,0.42,16693.0,United Kingdom
569208,22990,COTTON APRON PANTRY DESIGN,1,2011-10-02 11:10:00,4.95,16693.0,United Kingdom
569208,21588,RETROSPOT GIANT TUBE MATCHES,6,2011-10-02 11:10:00,2.55,16693.0,United Kingdom
569208,22659,LUNCH BOX I LOVE LONDON,1,2011-10-02 11:10:00,1.95,16693.0,United Kingdom
569208,23094,LE GRAND TRAY CHIC SET,1,2011-10-02 11:10:00,12.5,16693.0,United Kingdom
569208,22095,LADS ONLY TISSUE BOX,1,2011-10-02 11:10:00,0.39,16693.0,United Kingdom
569208,22174,PHOTO CUBE,1,2011-10-02 11:10:00,1.65,16693.0,United Kingdom
569208,22089,PAPER BUNTING VINTAGE PAISLEY,2,2011-10-02 11:10:00,2.95,16693.0,United Kingdom
569208,22090,PAPER BUNTING RETROSPOT,2,2011-10-02 11:10:00,2.95,16693.0,United Kingdom
569208,22426,ENAMEL WASH BOWL CREAM,2,2011-10-02 11:10:00,3.75,16693.0,United Kingdom
569208,21755,LOVE BUILDING BLOCK WORD,1,2011-10-02 11:10:00,6.25,16693.0,United Kingdom
569208,23092,LARGE ANTIQUE WHITE PHOTO FRAME,2,2011-10-02 11:10:00,7.9,16693.0,United Kingdom
569208,21470,FLOWER VINE RAFFIA FOOD COVER,1,2011-10-02 11:10:00,3.75,16693.0,United Kingdom
569208,21466,RED FLOWER CROCHET FOOD COVER,1,2011-10-02 11:10:00,3.75,16693.0,United Kingdom
569208,21468,BUTTERFLY CROCHET FOOD COVER,1,2011-10-02 11:10:00,3.75,16693.0,United Kingdom
569208,21465,PINK FLOWER CROCHET FOOD COVER,1,2011-10-02 11:10:00,3.75,16693.0,United Kingdom
569208,23328,SET 6 SCHOOL MILK BOTTLES IN CRATE,2,2011-10-02 11:10:00,3.75,16693.0,United Kingdom
569208,22839,3 TIER CAKE TIN GREEN AND CREAM,1,2011-10-02 11:10:00,14.95,16693.0,United Kingdom
569208,22665,RECIPE BOX BLUE SKETCHBOOK DESIGN,1,2011-10-02 11:10:00,2.95,16693.0,United Kingdom
569208,22151,PLACE SETTING WHITE HEART,24,2011-10-02 11:10:00,0.42,16693.0,United Kingdom
569208,22152,PLACE SETTING WHITE STAR,24,2011-10-02 11:10:00,0.42,16693.0,United Kingdom
569208,22721,SET OF 3 CAKE TINS SKETCHBOOK,1,2011-10-02 11:10:00,4.95,16693.0,United Kingdom
569208,23083,SET 6 PAPER TABLE LANTERN STARS ,1,2011-10-02 11:10:00,3.75,16693.0,United Kingdom
569208,23082,SET 6 PAPER TABLE LANTERN HEARTS ,1,2011-10-02 11:10:00,3.75,16693.0,United Kingdom
569208,22158,3 HEARTS HANGING DECORATION RUSTIC,8,2011-10-02 11:10:00,2.95,16693.0,United Kingdom
569208,23012,GLASS APOTHECARY BOTTLE PERFUME,1,2011-10-02 11:10:00,3.95,16693.0,United Kingdom
569208,23013,GLASS APOTHECARY BOTTLE TONIC,1,2011-10-02 11:10:00,3.95,16693.0,United Kingdom
569208,23014,GLASS APOTHECARY BOTTLE ELIXIR,1,2011-10-02 11:10:00,3.95,16693.0,United Kingdom
569208,21473,SWEETHEART CREAM STEEL TABLE RECT,1,2011-10-02 11:10:00,19.95,16693.0,United Kingdom
569209,21326,AGED GLASS SILVER T-LIGHT HOLDER,288,2011-10-02 11:30:00,0.55,16626.0,United Kingdom
569209,23503,PLAYING CARDS KEEP CALM & CARRY ON,12,2011-10-02 11:30:00,1.25,16626.0,United Kingdom
569209,23284,DOORMAT KEEP CALM AND COME IN,2,2011-10-02 11:30:00,8.25,16626.0,United Kingdom
569210,22696,WICKER WREATH LARGE,5,2011-10-02 11:41:00,1.95,13681.0,United Kingdom
569210,22695,WICKER WREATH SMALL,10,2011-10-02 11:41:00,1.45,13681.0,United Kingdom
569210,22469,HEART OF WICKER SMALL,10,2011-10-02 11:41:00,1.65,13681.0,United Kingdom
569210,23321,SMALL WHITE HEART OF WICKER,10,2011-10-02 11:41:00,1.65,13681.0,United Kingdom
569210,23322,LARGE WHITE HEART OF WICKER,5,2011-10-02 11:41:00,2.95,13681.0,United Kingdom
569210,22470,HEART OF WICKER LARGE,6,2011-10-02 11:41:00,2.95,13681.0,United Kingdom
569210,23323,WHITE WICKER STAR ,6,2011-10-02 11:41:00,2.1,13681.0,United Kingdom
569210,22694,WICKER STAR ,6,2011-10-02 11:41:00,2.1,13681.0,United Kingdom
569210,23329,DECORATIVE WICKER HEART LARGE,25,2011-10-02 11:41:00,1.65,13681.0,United Kingdom
569210,23332,IVORY WICKER HEART LARGE,25,2011-10-02 11:41:00,1.65,13681.0,United Kingdom
569210,22283,6 EGG HOUSE PAINTED WOOD,2,2011-10-02 11:41:00,7.95,13681.0,United Kingdom
569210,84849D,HOT BATHS SOAP HOLDER,3,2011-10-02 11:41:00,1.69,13681.0,United Kingdom
569210,23461,SWEETHEART BIRD HOUSE,5,2011-10-02 11:41:00,4.15,13681.0,United Kingdom
569210,22508,DOORSTOP RETROSPOT HEART,2,2011-10-02 11:41:00,3.75,13681.0,United Kingdom
569210,84029E,RED WOOLLY HOTTIE WHITE HEART.,4,2011-10-02 11:41:00,4.25,13681.0,United Kingdom
569210,22111,SCOTTIE DOG HOT WATER BOTTLE,4,2011-10-02 11:41:00,4.95,13681.0,United Kingdom
569210,23356,LOVE HOT WATER BOTTLE,4,2011-10-02 11:41:00,5.95,13681.0,United Kingdom
569210,21985,PACK OF 12 HEARTS DESIGN TISSUES ,10,2011-10-02 11:41:00,0.39,13681.0,United Kingdom
569210,23301,GARDENERS KNEELING PAD KEEP CALM ,5,2011-10-02 11:41:00,1.65,13681.0,United Kingdom
569210,23300,GARDENERS KNEELING PAD CUP OF TEA ,5,2011-10-02 11:41:00,1.65,13681.0,United Kingdom
569211,90051,CRACKED GLAZE NECKLACE RED,2,2011-10-02 12:04:00,6.95,15774.0,United Kingdom
569211,90064B,BLACK VINTAGE  CRYSTAL EARRINGS,2,2011-10-02 12:04:00,3.75,15774.0,United Kingdom
569211,90063B,BLACK VINT ART DEC CRYSTAL NECKLACE,2,2011-10-02 12:04:00,8.5,15774.0,United Kingdom
569211,90191,SILVER LARIAT 40CM,2,2011-10-02 12:04:00,12.75,15774.0,United Kingdom
569211,90194,SILVER LARIAT BLACK STONE EARRINGS,2,2011-10-02 12:04:00,4.25,15774.0,United Kingdom
569211,90010E,AMBER GLASS/SILVER BRACELET,2,2011-10-02 12:04:00,8.95,15774.0,United Kingdom
569211,22574,HEART WOODEN CHRISTMAS DECORATION,6,2011-10-02 12:04:00,0.85,15774.0,United Kingdom
569211,23330,DECORATIVE WICKER HEART MEDIUM,6,2011-10-02 12:04:00,1.25,15774.0,United Kingdom
569211,23333,IVORY WICKER HEART MEDIUM,20,2011-10-02 12:04:00,1.25,15774.0,United Kingdom
569211,22112,CHOCOLATE HOT WATER BOTTLE,1,2011-10-02 12:04:00,4.95,15774.0,United Kingdom
569211,22113,GREY HEART HOT WATER BOTTLE,2,2011-10-02 12:04:00,4.25,15774.0,United Kingdom
569211,22500,SET OF 2 TINS JARDIN DE PROVENCE,1,2011-10-02 12:04:00,4.95,15774.0,United Kingdom
569211,23410,CURIO CABINET LINEN AND LACE ,1,2011-10-02 12:04:00,8.15,15774.0,United Kingdom
569211,23091,ZINC HERB GARDEN CONTAINER,1,2011-10-02 12:04:00,6.25,15774.0,United Kingdom
569211,22558,CLOTHES PEGS RETROSPOT PACK 24 ,1,2011-10-02 12:04:00,1.65,15774.0,United Kingdom
569211,23061,VINTAGE EMBOSSED HEART,6,2011-10-02 12:04:00,1.25,15774.0,United Kingdom
569211,85123A,WHITE HANGING HEART T-LIGHT HOLDER,4,2011-10-02 12:04:00,2.95,15774.0,United Kingdom
569211,21407,BROWN CHECK CAT DOORSTOP ,2,2011-10-02 12:04:00,4.25,15774.0,United Kingdom
569211,23322,LARGE WHITE HEART OF WICKER,4,2011-10-02 12:04:00,2.95,15774.0,United Kingdom
569211,23321,SMALL WHITE HEART OF WICKER,3,2011-10-02 12:04:00,1.65,15774.0,United Kingdom
569211,23332,IVORY WICKER HEART LARGE,8,2011-10-02 12:04:00,1.65,15774.0,United Kingdom
569211,23405,HOME SWEET HOME 2 DRAWER CABINET,4,2011-10-02 12:04:00,4.95,15774.0,United Kingdom
569211,23404,HOME SWEET HOME BLACKBOARD,2,2011-10-02 12:04:00,4.95,15774.0,United Kingdom
569211,35001G,HAND OPEN SHAPE GOLD,2,2011-10-02 12:04:00,4.25,15774.0,United Kingdom
569211,23427,STOOL HOME SWEET HOME ,1,2011-10-02 12:04:00,12.5,15774.0,United Kingdom
569212,23331,DECORATIVE WICKER HEART SMALL,6,2011-10-02 12:05:00,0.63,15164.0,United Kingdom
569212,23334,IVORY WICKER HEART SMALL,6,2011-10-02 12:05:00,0.63,15164.0,United Kingdom
569212,23333,IVORY WICKER HEART MEDIUM,5,2011-10-02 12:05:00,1.25,15164.0,United Kingdom
569212,23330,DECORATIVE WICKER HEART MEDIUM,6,2011-10-02 12:05:00,1.25,15164.0,United Kingdom
569212,23332,IVORY WICKER HEART LARGE,3,2011-10-02 12:05:00,1.65,15164.0,United Kingdom
569212,23329,DECORATIVE WICKER HEART LARGE,3,2011-10-02 12:05:00,1.65,15164.0,United Kingdom
569212,22469,HEART OF WICKER SMALL,3,2011-10-02 12:05:00,1.65,15164.0,United Kingdom
569212,23322,LARGE WHITE HEART OF WICKER,3,2011-10-02 12:05:00,2.95,15164.0,United Kingdom
569212,23321,SMALL WHITE HEART OF WICKER,3,2011-10-02 12:05:00,1.65,15164.0,United Kingdom
569212,22470,HEART OF WICKER LARGE,3,2011-10-02 12:05:00,2.95,15164.0,United Kingdom
569212,85152,HAND OVER THE CHOCOLATE   SIGN ,4,2011-10-02 12:05:00,2.1,15164.0,United Kingdom
569212,21181,PLEASE ONE PERSON METAL SIGN,4,2011-10-02 12:05:00,2.1,15164.0,United Kingdom
569212,23228,FILIGREE HEART BIRD WHITE ,12,2011-10-02 12:05:00,1.25,15164.0,United Kingdom
569212,22219,LOVEBIRD HANGING DECORATION WHITE ,3,2011-10-02 12:05:00,0.85,15164.0,United Kingdom
569212,23400,SHELF WITH 4 HOOKS HOME SWEET HOME,2,2011-10-02 12:05:00,6.25,15164.0,United Kingdom
569212,22335,HEART DECORATION PAINTED ZINC ,6,2011-10-02 12:05:00,0.65,15164.0,United Kingdom
569212,22297,HEART IVORY TRELLIS SMALL,6,2011-10-02 12:05:00,1.25,15164.0,United Kingdom
569212,22295,HEART FILIGREE DOVE LARGE,6,2011-10-02 12:05:00,1.65,15164.0,United Kingdom
569212,22294,HEART FILIGREE DOVE  SMALL,6,2011-10-02 12:05:00,1.25,15164.0,United Kingdom
569212,21385,IVORY HANGING DECORATION  HEART,8,2011-10-02 12:05:00,0.85,15164.0,United Kingdom
569212,22456,NATURAL SLATE CHALKBOARD LARGE ,2,2011-10-02 12:05:00,4.95,15164.0,United Kingdom
569212,22296,HEART IVORY TRELLIS LARGE,6,2011-10-02 12:05:00,1.65,15164.0,United Kingdom
569212,85123A,WHITE HANGING HEART T-LIGHT HOLDER,2,2011-10-02 12:05:00,2.95,15164.0,United Kingdom
569212,22109,FULL ENGLISH BREAKFAST PLATE,3,2011-10-02 12:05:00,3.75,15164.0,United Kingdom
569212,84836,ZINC METAL HEART DECORATION,12,2011-10-02 12:05:00,1.25,15164.0,United Kingdom
569212,21068,VINTAGE BILLBOARD LOVE/HATE MUG,6,2011-10-02 12:05:00,1.25,15164.0,United Kingdom
569212,21070,VINTAGE BILLBOARD MUG ,4,2011-10-02 12:05:00,1.25,15164.0,United Kingdom
569212,21071,VINTAGE BILLBOARD DRINK ME MUG,5,2011-10-02 12:05:00,1.25,15164.0,United Kingdom
569212,21136,PAINTED METAL PEARS ASSORTED,8,2011-10-02 12:05:00,1.69,15164.0,United Kingdom
569212,21755,LOVE BUILDING BLOCK WORD,4,2011-10-02 12:05:00,6.25,15164.0,United Kingdom
569212,84792,ENCHANTED BIRD COATHANGER 5 HOOK,2,2011-10-02 12:05:00,4.65,15164.0,United Kingdom
569212,23301,GARDENERS KNEELING PAD KEEP CALM ,3,2011-10-02 12:05:00,1.65,15164.0,United Kingdom
569212,23300,GARDENERS KNEELING PAD CUP OF TEA ,3,2011-10-02 12:05:00,1.65,15164.0,United Kingdom
569212,22113,GREY HEART HOT WATER BOTTLE,4,2011-10-02 12:05:00,4.25,15164.0,United Kingdom
569212,22112,CHOCOLATE HOT WATER BOTTLE,4,2011-10-02 12:05:00,4.95,15164.0,United Kingdom
569212,22835,HOT WATER BOTTLE I AM SO POORLY,4,2011-10-02 12:05:00,4.95,15164.0,United Kingdom
569212,23356,LOVE HOT WATER BOTTLE,2,2011-10-02 12:05:00,5.95,15164.0,United Kingdom
569212,23355,HOT WATER BOTTLE KEEP CALM,6,2011-10-02 12:05:00,4.95,15164.0,United Kingdom
569212,22111,SCOTTIE DOG HOT WATER BOTTLE,3,2011-10-02 12:05:00,4.95,15164.0,United Kingdom
569212,23096,PETIT TRAY CHIC,3,2011-10-02 12:05:00,1.65,15164.0,United Kingdom
569212,84879,ASSORTED COLOUR BIRD ORNAMENT,8,2011-10-02 12:05:00,1.69,15164.0,United Kingdom
569212,22633,HAND WARMER UNION JACK,4,2011-10-02 12:05:00,2.1,15164.0,United Kingdom
569212,23439,HAND WARMER RED LOVE HEART,4,2011-10-02 12:05:00,2.1,15164.0,United Kingdom
569212,22632,HAND WARMER RED RETROSPOT,4,2011-10-02 12:05:00,2.1,15164.0,United Kingdom
569212,84879,ASSORTED COLOUR BIRD ORNAMENT,8,2011-10-02 12:05:00,1.69,15164.0,United Kingdom
569212,21754,HOME BUILDING BLOCK WORD,4,2011-10-02 12:05:00,6.25,15164.0,United Kingdom
569212,23397,FOOT STOOL HOME SWEET HOME ,1,2011-10-02 12:05:00,9.95,15164.0,United Kingdom
569213,85152,HAND OVER THE CHOCOLATE   SIGN ,2,2011-10-02 12:11:00,2.1,13782.0,United Kingdom
569213,21175,GIN + TONIC DIET METAL SIGN,2,2011-10-02 12:11:00,2.55,13782.0,United Kingdom
569213,23426,METAL SIGN DROP YOUR PANTS,2,2011-10-02 12:11:00,2.89,13782.0,United Kingdom
569213,82482,WOODEN PICTURE FRAME WHITE FINISH,3,2011-10-02 12:11:00,2.95,13782.0,United Kingdom
569213,23322,LARGE WHITE HEART OF WICKER,2,2011-10-02 12:11:00,2.95,13782.0,United Kingdom
569213,23321,SMALL WHITE HEART OF WICKER,2,2011-10-02 12:11:00,1.65,13782.0,United Kingdom
569213,21259,VICTORIAN SEWING BOX SMALL ,1,2011-10-02 12:11:00,5.95,13782.0,United Kingdom
569213,22588,CARD HOLDER GINGHAM HEART,2,2011-10-02 12:11:00,2.89,13782.0,United Kingdom
569213,21137,BLACK RECORD COVER FRAME,1,2011-10-02 12:11:00,3.75,13782.0,United Kingdom
569213,47566B,TEA TIME PARTY BUNTING,2,2011-10-02 12:11:00,4.95,13782.0,United Kingdom
569213,23298,SPOTTY BUNTING,2,2011-10-02 12:11:00,4.95,13782.0,United Kingdom
569213,47566,PARTY BUNTING,2,2011-10-02 12:11:00,4.95,13782.0,United Kingdom
569213,23472, NINE DRAWER OFFICE TIDY,1,2011-10-02 12:11:00,14.95,13782.0,United Kingdom
569213,23471,SIX DRAWER OFFICE TIDY,1,2011-10-02 12:11:00,9.95,13782.0,United Kingdom
569213,23152,IVORY SWEETHEART WIRE LETTER RACK ,2,2011-10-02 12:11:00,3.75,13782.0,United Kingdom
569213,82486,3 DRAWER ANTIQUE WHITE WOOD CABINET,2,2011-10-02 12:11:00,8.95,13782.0,United Kingdom
569213,82483,WOOD 2 DRAWER CABINET WHITE FINISH,2,2011-10-02 12:11:00,6.95,13782.0,United Kingdom
569214,16219,HOUSE SHAPE PENCIL SHARPENER,288,2011-10-02 12:22:00,0.06,14533.0,United Kingdom
569214,21642,ASSORTED TUTTI FRUTTI PEN,120,2011-10-02 12:22:00,0.29,14533.0,United Kingdom
569214,21650,ASSORTED TUTTI FRUTTI BRACELET,144,2011-10-02 12:22:00,0.19,14533.0,United Kingdom
569214,20974,12 PENCILS SMALL TUBE SKULL,48,2011-10-02 12:22:00,0.65,14533.0,United Kingdom
569214,20975,12 PENCILS SMALL TUBE RED RETROSPOT,48,2011-10-02 12:22:00,0.65,14533.0,United Kingdom
569214,23366,SET 12 COLOURING PENCILS DOILY,32,2011-10-02 12:22:00,0.65,14533.0,United Kingdom
569214,15034,PAPER POCKET TRAVELING FAN ,1200,2011-10-02 12:22:00,0.07,14533.0,United Kingdom
569214,22546,MINI JIGSAW PURDEY,48,2011-10-02 12:22:00,0.42,14533.0,United Kingdom
569214,22299,PIG KEYRING WITH LIGHT & SOUND ,48,2011-10-02 12:22:00,1.25,14533.0,United Kingdom
569215,23199,JUMBO BAG APPLES,2,2011-10-02 12:30:00,2.08,13571.0,United Kingdom
569215,23200,JUMBO BAG PEARS,3,2011-10-02 12:30:00,2.08,13571.0,United Kingdom
569215,23343,JUMBO BAG VINTAGE CHRISTMAS ,2,2011-10-02 12:30:00,2.08,13571.0,United Kingdom
569215,22411,JUMBO SHOPPER VINTAGE RED PAISLEY,3,2011-10-02 12:30:00,2.08,13571.0,United Kingdom
569215,22386,JUMBO BAG PINK POLKADOT,2,2011-10-02 12:30:00,2.08,13571.0,United Kingdom
569215,85099B,JUMBO BAG RED RETROSPOT,2,2011-10-02 12:30:00,2.08,13571.0,United Kingdom
569215,20712,JUMBO BAG WOODLAND ANIMALS,2,2011-10-02 12:30:00,2.08,13571.0,United Kingdom
569215,23203,JUMBO BAG VINTAGE DOILY ,10,2011-10-02 12:30:00,2.08,13571.0,United Kingdom
569215,20724,RED RETROSPOT CHARLOTTE BAG,6,2011-10-02 12:30:00,0.85,13571.0,United Kingdom
569215,22356,CHARLOTTE BAG PINK POLKADOT,5,2011-10-02 12:30:00,0.85,13571.0,United Kingdom
569215,20719,WOODLAND CHARLOTTE BAG,6,2011-10-02 12:30:00,0.85,13571.0,United Kingdom
569215,23204,CHARLOTTE BAG APPLES DESIGN,5,2011-10-02 12:30:00,0.85,13571.0,United Kingdom
569215,22355,CHARLOTTE BAG SUKI DESIGN,6,2011-10-02 12:30:00,0.85,13571.0,United Kingdom
569215,22910,PAPER CHAIN KIT VINTAGE CHRISTMAS,3,2011-10-02 12:30:00,2.95,13571.0,United Kingdom
569215,22994,TRAVEL CARD WALLET RETROSPOT,1,2011-10-02 12:30:00,0.42,13571.0,United Kingdom
569215,22995,TRAVEL CARD WALLET SUKI,1,2011-10-02 12:30:00,0.42,13571.0,United Kingdom
569215,84978,HANGING HEART JAR T-LIGHT HOLDER,12,2011-10-02 12:30:00,1.25,13571.0,United Kingdom
569215,23234,BISCUIT TIN VINTAGE CHRISTMAS,6,2011-10-02 12:30:00,2.89,13571.0,United Kingdom
569215,22197,POPCORN HOLDER,10,2011-10-02 12:30:00,0.85,13571.0,United Kingdom
569215,22091,EMPIRE TISSUE BOX,8,2011-10-02 12:30:00,0.39,13571.0,United Kingdom
569215,22093,MOTORING TISSUE BOX,8,2011-10-02 12:30:00,0.39,13571.0,United Kingdom
569215,22099,CARAVAN SQUARE TISSUE BOX,6,2011-10-02 12:30:00,0.39,13571.0,United Kingdom
569215,23369,SET 36 COLOUR PENCILS LOVE LONDON,1,2011-10-02 12:30:00,1.25,13571.0,United Kingdom
569215,85152,HAND OVER THE CHOCOLATE   SIGN ,2,2011-10-02 12:30:00,2.1,13571.0,United Kingdom
569215,21169,YOU'RE CONFUSING ME METAL SIGN ,3,2011-10-02 12:30:00,1.69,13571.0,United Kingdom
569215,21181,PLEASE ONE PERSON METAL SIGN,2,2011-10-02 12:30:00,2.1,13571.0,United Kingdom
569215,23240,SET OF 4 KNICK KNACK TINS DOILY ,3,2011-10-02 12:30:00,4.15,13571.0,United Kingdom
569215,23293,SET OF 12 FAIRY CAKE BAKING CASES,16,2011-10-02 12:30:00,0.83,13571.0,United Kingdom
569215,22092,BLUE PAISLEY TISSUE BOX,6,2011-10-02 12:30:00,0.39,13571.0,United Kingdom
569215,23295,SET OF 12 MINI LOAF BAKING CASES,8,2011-10-02 12:30:00,0.83,13571.0,United Kingdom
569215,23296,SET OF 6 TEA TIME BAKING CASES,4,2011-10-02 12:30:00,1.25,13571.0,United Kingdom
569215,23294,SET OF 6 SNACK LOAF BAKING CASES,8,2011-10-02 12:30:00,0.83,13571.0,United Kingdom
569215,22336,DOVE DECORATION PAINTED ZINC ,10,2011-10-02 12:30:00,0.19,13571.0,United Kingdom
569215,22338,STAR DECORATION PAINTED ZINC ,8,2011-10-02 12:30:00,0.19,13571.0,United Kingdom
569215,22339,CHRISTMAS TREE PAINTED ZINC ,20,2011-10-02 12:30:00,0.19,13571.0,United Kingdom
569216,82486,3 DRAWER ANTIQUE WHITE WOOD CABINET,2,2011-10-02 12:41:00,8.95,15555.0,United Kingdom
