InvoiceNo,StockCode,Description,Quantity,InvoiceDate,UnitPrice,CustomerID,Country
581475,22596,CHRISTMAS STAR WISH LIST CHALKBOARD,36,2011-12-09 08:39:00,0.39,13069.0,United Kingdom
581475,23235,STORAGE TIN VINTAGE LEAF,12,2011-12-09 08:39:00,1.25,13069.0,United Kingdom
581475,23272,TREE T-LIGHT HOLDER WILLIE WINKIE,12,2011-12-09 08:39:00,0.39,13069.0,United Kingdom
581475,23239,SET OF 4 KNICK KNACK TINS POPPIES,6,2011-12-09 08:39:00,1.65,13069.0,United Kingdom
581475,21705,BAG 500g SWIRLY MARBLES,24,2011-12-09 08:39:00,0.39,13069.0,United Kingdom
581475,22118,JOY WOODEN BLOCK LETTERS,18,2011-12-09 08:39:00,1.25,13069.0,United Kingdom
581475,22119,PEACE WOODEN BLOCK LETTERS,12,2011-12-09 08:39:00,1.95,13069.0,United Kingdom
581475,22217,T-LIGHT HOLDER HANGING LACE,12,2011-12-09 08:39:00,0.39,13069.0,United Kingdom
581475,22216,T-LIGHT HOLDER WHITE LACE,24,2011-12-09 08:39:00,0.29,13069.0,United Kingdom
581475,22380,TOY TIDY SPACEBOY  ,20,2011-12-09 08:39:00,0.79,13069.0,United Kingdom
581475,22442,GROW YOUR OWN FLOWERS SET OF 3,12,2011-12-09 08:39:00,1.95,13069.0,United Kingdom
581475,22664,TOY TIDY DOLLY GIRL DESIGN,20,2011-12-09 08:39:00,0.79,13069.0,United Kingdom
581475,22721,SET OF 3 CAKE TINS SKETCHBOOK,12,2011-12-09 08:39:00,1.95,13069.0,United Kingdom
581475,22723,SET OF 6 HERB TINS SKETCHBOOK,12,2011-12-09 08:39:00,1.25,13069.0,United Kingdom
581475,22785,SQUARECUSHION COVER PINK UNION JACK,12,2011-12-09 08:39:00,1.25,13069.0,United Kingdom
581475,22955,36 FOIL STAR CAKE CASES ,24,2011-12-09 08:39:00,0.79,13069.0,United Kingdom
581475,23141,TRIPLE WIRE HOOK PINK HEART,12,2011-12-09 08:39:00,0.79,13069.0,United Kingdom
581475,22956,36 FOIL HEART CAKE CASES,24,2011-12-09 08:39:00,0.79,13069.0,United Kingdom
581475,22581,WOOD STOCKING CHRISTMAS SCANDISPOT,48,2011-12-09 08:39:00,0.29,13069.0,United Kingdom
581476,23198,PANTRY MAGNETIC  SHOPPING LIST,48,2011-12-09 08:48:00,1.25,12433.0,Norway
581476,23197,SKETCHBOOK MAGNETIC SHOPPING LIST,24,2011-12-09 08:48:00,1.45,12433.0,Norway
581476,23184,BULL DOG BOTTLE OPENER,8,2011-12-09 08:48:00,4.95,12433.0,Norway
581476,23168,CLASSIC CAFE SUGAR DISPENSER,12,2011-12-09 08:48:00,1.25,12433.0,Norway
581476,23167,SMALL CERAMIC TOP STORAGE JAR ,96,2011-12-09 08:48:00,0.69,12433.0,Norway
581476,23166,MEDIUM CERAMIC TOP STORAGE JAR,48,2011-12-09 08:48:00,1.04,12433.0,Norway
581476,23165,LARGE CERAMIC TOP STORAGE JAR,48,2011-12-09 08:48:00,1.45,12433.0,Norway
581476,23004,TRAVEL CARD WALLET PANTRY,48,2011-12-09 08:48:00,0.42,12433.0,Norway
581476,23002,TRAVEL CARD WALLET SKULLS,24,2011-12-09 08:48:00,0.42,12433.0,Norway
581476,23000,TRAVEL CARD WALLET TRANSPORT,24,2011-12-09 08:48:00,0.42,12433.0,Norway
581476,22998,TRAVEL CARD WALLET KEEP CALM,72,2011-12-09 08:48:00,0.42,12433.0,Norway
581476,22994,TRAVEL CARD WALLET RETROSPOT,48,2011-12-09 08:48:00,0.42,12433.0,Norway
581476,22835,HOT WATER BOTTLE I AM SO POORLY,8,2011-12-09 08:48:00,4.95,12433.0,Norway
581476,22730,ALARM CLOCK BAKELIKE IVORY,4,2011-12-09 08:48:00,3.75,12433.0,Norway
581476,22728,ALARM CLOCK BAKELIKE PINK,8,2011-12-09 08:48:00,3.75,12433.0,Norway
581476,22727,ALARM CLOCK BAKELIKE RED ,8,2011-12-09 08:48:00,3.75,12433.0,Norway
581476,22726,ALARM CLOCK BAKELIKE GREEN,4,2011-12-09 08:48:00,3.75,12433.0,Norway
581476,22720,SET OF 3 CAKE TINS PANTRY DESIGN ,16,2011-12-09 08:48:00,4.25,12433.0,Norway
581476,22693,GROW A FLYTRAP OR SUNFLOWER IN TIN,192,2011-12-09 08:48:00,1.06,12433.0,Norway
581476,22670,FRENCH WC SIGN BLUE METAL,24,2011-12-09 08:48:00,1.25,12433.0,Norway
581476,22667,RECIPE BOX RETROSPOT ,24,2011-12-09 08:48:00,2.55,12433.0,Norway
581476,22666,RECIPE BOX PANTRY YELLOW DESIGN,24,2011-12-09 08:48:00,2.55,12433.0,Norway
581476,22631,CIRCUS PARADE LUNCH BOX ,12,2011-12-09 08:48:00,1.95,12433.0,Norway
581476,22628,PICNIC BOXES SET OF 3 RETROSPOT ,16,2011-12-09 08:48:00,4.95,12433.0,Norway
581476,22467,GUMBALL COAT RACK,6,2011-12-09 08:48:00,2.55,12433.0,Norway
581476,22197,POPCORN HOLDER,100,2011-12-09 08:48:00,0.72,12433.0,Norway
581476,22114,HOT WATER BOTTLE TEA AND SYMPATHY,8,2011-12-09 08:48:00,4.25,12433.0,Norway
581476,22112,CHOCOLATE HOT WATER BOTTLE,9,2011-12-09 08:48:00,4.95,12433.0,Norway
581476,21908,CHOCOLATE THIS WAY METAL SIGN,36,2011-12-09 08:48:00,2.1,12433.0,Norway
581476,21874,GIN AND TONIC MUG,36,2011-12-09 08:48:00,1.45,12433.0,Norway
581476,21872,GLAMOROUS  MUG,12,2011-12-09 08:48:00,1.25,12433.0,Norway
581476,21871,SAVE THE PLANET MUG,36,2011-12-09 08:48:00,1.45,12433.0,Norway
581476,21533,RETROSPOT LARGE MILK JUG,6,2011-12-09 08:48:00,4.95,12433.0,Norway
581476,21481,FAWN BLUE HOT WATER BOTTLE,12,2011-12-09 08:48:00,3.75,12433.0,Norway
581476,21479,WHITE SKULL HOT WATER BOTTLE ,4,2011-12-09 08:48:00,4.25,12433.0,Norway
581476,21248,DOOR HANGER  MUM + DADS ROOM,12,2011-12-09 08:48:00,1.45,12433.0,Norway
581476,21216,"SET 3 RETROSPOT TEA,COFFEE,SUGAR",24,2011-12-09 08:48:00,4.25,12433.0,Norway
581476,21181,PLEASE ONE PERSON METAL SIGN,48,2011-12-09 08:48:00,1.85,12433.0,Norway
581476,21175,GIN AND TONIC DIET METAL SIGN,48,2011-12-09 08:48:00,2.08,12433.0,Norway
581476,21169,YOU'RE CONFUSING ME METAL SIGN ,48,2011-12-09 08:48:00,1.45,12433.0,Norway
581476,21162,TOXIC AREA  DOOR HANGER ,24,2011-12-09 08:48:00,0.39,12433.0,Norway
581476,21159,MOODY BOY  DOOR HANGER ,24,2011-12-09 08:48:00,0.39,12433.0,Norway
581476,21158,MOODY GIRL DOOR HANGER ,24,2011-12-09 08:48:00,0.39,12433.0,Norway
581476,21154,RED RETROSPOT OVEN GLOVE ,10,2011-12-09 08:48:00,1.25,12433.0,Norway
581476,16016,LARGE CHINESE STYLE SCISSOR,40,2011-12-09 08:48:00,0.85,12433.0,Norway
581476,16014,SMALL CHINESE STYLE SCISSOR,60,2011-12-09 08:48:00,0.42,12433.0,Norway
581476,16008,SMALL FOLDING SCISSOR(POINTED EDGE),240,2011-12-09 08:48:00,0.12,12433.0,Norway
581476,85152,HAND OVER THE CHOCOLATE   SIGN ,48,2011-12-09 08:48:00,1.85,12433.0,Norway
581476,84596F,SMALL MARSHMALLOWS PINK BOWL,32,2011-12-09 08:48:00,0.42,12433.0,Norway
581476,84596B,SMALL DOLLY MIX DESIGN ORANGE BOWL,16,2011-12-09 08:48:00,0.42,12433.0,Norway
581476,84510A,SET OF 4 ENGLISH ROSE COASTERS,20,2011-12-09 08:48:00,1.25,12433.0,Norway
581476,82600,N0 SINGING METAL SIGN,48,2011-12-09 08:48:00,1.85,12433.0,Norway
581476,82581,TOILET METAL SIGN,48,2011-12-09 08:48:00,0.55,12433.0,Norway
581476,72760B,VINTAGE CREAM 3 BASKET CAKE STAND,2,2011-12-09 08:48:00,9.95,12433.0,Norway
581476,72232,FENG SHUI PILLAR CANDLE,144,2011-12-09 08:48:00,0.19,12433.0,Norway
581476,47559B,TEA TIME OVEN GLOVE,10,2011-12-09 08:48:00,1.25,12433.0,Norway
581476,47504H,ENGLISH ROSE SPIRIT LEVEL ,36,2011-12-09 08:48:00,0.79,12433.0,Norway
581476,23493,VINTAGE DOILY TRAVEL SEWING KIT,30,2011-12-09 08:48:00,1.95,12433.0,Norway
581476,23430,BLUE RETRO KITCHEN WALL CLOCK,2,2011-12-09 08:48:00,8.15,12433.0,Norway
581476,23429,RED RETRO KITCHEN WALL CLOCK,2,2011-12-09 08:48:00,8.15,12433.0,Norway
581476,23428,IVORY RETRO KITCHEN WALL CLOCK,2,2011-12-09 08:48:00,8.15,12433.0,Norway
581476,23358,HOT STUFF HOT WATER BOTTLE,18,2011-12-09 08:48:00,1.25,12433.0,Norway
581476,23293,SET OF 12 FAIRY CAKE BAKING CASES,32,2011-12-09 08:48:00,0.83,12433.0,Norway
581476,23243,SET OF TEA COFFEE SUGAR TINS PANTRY,12,2011-12-09 08:48:00,4.95,12433.0,Norway
581476,23240,SET OF 4 KNICK KNACK TINS DOILY ,6,2011-12-09 08:48:00,4.15,12433.0,Norway
581477,48111,DOORMAT 3 SMILEY CATS,10,2011-12-09 08:59:00,7.08,13426.0,United Kingdom
581477,22464,HANGING METAL HEART LANTERN,12,2011-12-09 08:59:00,0.79,13426.0,United Kingdom
581477,20982,12 PENCILS TALL TUBE SKULLS,12,2011-12-09 08:59:00,0.85,13426.0,United Kingdom
581477,20981,12 PENCILS TALL TUBE WOODLAND,12,2011-12-09 08:59:00,0.85,13426.0,United Kingdom
581477,23424,GINGHAM RECIPE BOOK BOX,8,2011-12-09 08:59:00,4.95,13426.0,United Kingdom
581477,23338,EGG FRYING PAN RED ,48,2011-12-09 08:59:00,1.85,13426.0,United Kingdom
581477,84970L,SINGLE HEART ZINC T-LIGHT HOLDER,12,2011-12-09 08:59:00,1.25,13426.0,United Kingdom
581477,22457,NATURAL SLATE HEART CHALKBOARD ,6,2011-12-09 08:59:00,2.95,13426.0,United Kingdom
581477,22469,HEART OF WICKER SMALL,12,2011-12-09 08:59:00,1.65,13426.0,United Kingdom
581477,22909,SET OF 20 VINTAGE CHRISTMAS NAPKINS,12,2011-12-09 08:59:00,0.85,13426.0,United Kingdom
581478,84947,ANTIQUE SILVER TEA GLASS ENGRAVED,24,2011-12-09 08:59:00,1.25,17364.0,United Kingdom
581478,23503,PLAYING CARDS KEEP CALM & CARRY ON,12,2011-12-09 08:59:00,1.25,17364.0,United Kingdom
581478,23445,ICE CREAM BUBBLES,20,2011-12-09 08:59:00,0.83,17364.0,United Kingdom
581478,23530,WALL ART ONLY ONE PERSON ,12,2011-12-09 08:59:00,4.95,17364.0,United Kingdom
581478,84997C,CHILDRENS CUTLERY POLKADOT BLUE,4,2011-12-09 08:59:00,4.15,17364.0,United Kingdom
581478,84997D,CHILDRENS CUTLERY POLKADOT PINK,4,2011-12-09 08:59:00,4.15,17364.0,United Kingdom
581478,84077,WORLD WAR 2 GLIDERS ASSTD DESIGNS,48,2011-12-09 08:59:00,0.29,17364.0,United Kingdom
581478,22749,FELTCRAFT PRINCESS CHARLOTTE DOLL,4,2011-12-09 08:59:00,3.75,17364.0,United Kingdom
581478,23127,FELTCRAFT GIRL NICOLE KIT,4,2011-12-09 08:59:00,4.95,17364.0,United Kingdom
581478,23126,FELTCRAFT GIRL AMELIE KIT,4,2011-12-09 08:59:00,4.95,17364.0,United Kingdom
581478,22747,POPPY'S PLAYHOUSE BATHROOM,6,2011-12-09 08:59:00,2.1,17364.0,United Kingdom
581478,22078,RIBBON REEL LACE DESIGN ,10,2011-12-09 08:59:00,2.1,17364.0,United Kingdom
581478,84946,ANTIQUE SILVER T-LIGHT GLASS,12,2011-12-09 08:59:00,1.25,17364.0,United Kingdom
581478,22791,T-LIGHT GLASS FLUTED ANTIQUE,12,2011-12-09 08:59:00,1.25,17364.0,United Kingdom
581478,21326,AGED GLASS SILVER T-LIGHT HOLDER,12,2011-12-09 08:59:00,0.65,17364.0,United Kingdom
581478,22170,PICTURE FRAME WOOD TRIPLE PORTRAIT,8,2011-12-09 08:59:00,6.75,17364.0,United Kingdom
581478,23082,SET 6 PAPER TABLE LANTERN HEARTS ,6,2011-12-09 08:59:00,3.75,17364.0,United Kingdom
581478,22909,SET OF 20 VINTAGE CHRISTMAS NAPKINS,24,2011-12-09 08:59:00,0.85,17364.0,United Kingdom
581479,22087,PAPER BUNTING WHITE LACE,10,2011-12-09 09:00:00,2.95,17364.0,United Kingdom
581480,23463,VINTAGE ZINC WATERING CAN,2,2011-12-09 09:07:00,9.95,14441.0,United Kingdom
581480,23464,VINTAGE ZINC WATERING CAN SMALL,4,2011-12-09 09:07:00,4.95,14441.0,United Kingdom
581480,22411,JUMBO SHOPPER VINTAGE RED PAISLEY,10,2011-12-09 09:07:00,2.08,14441.0,United Kingdom
581480,84029E,RED WOOLLY HOTTIE WHITE HEART.,8,2011-12-09 09:07:00,4.25,14441.0,United Kingdom
581480,22633,HAND WARMER UNION JACK,12,2011-12-09 09:07:00,2.1,14441.0,United Kingdom
581480,23355,HOT WATER BOTTLE KEEP CALM,12,2011-12-09 09:07:00,4.95,14441.0,United Kingdom
581480,84029G,KNITTED UNION FLAG HOT WATER BOTTLE,12,2011-12-09 09:07:00,4.25,14441.0,United Kingdom
581480,22112,CHOCOLATE HOT WATER BOTTLE,6,2011-12-09 09:07:00,4.95,14441.0,United Kingdom
581480,84347,ROTATING SILVER ANGELS T-LIGHT HLDR,18,2011-12-09 09:07:00,2.55,14441.0,United Kingdom
581481,21115,ROSE CARAVAN DOORSTOP,8,2011-12-09 09:07:00,1.95,17490.0,United Kingdom
581481,22059,CERAMIC STRAWBERRY DESIGN MUG,24,2011-12-09 09:07:00,0.39,17490.0,United Kingdom
581481,22072,RED RETROSPOT TEA CUP AND SAUCER ,24,2011-12-09 09:07:00,1.25,17490.0,United Kingdom
581481,22123,PING MICROWAVE APRON,24,2011-12-09 09:07:00,0.79,17490.0,United Kingdom
581481,22476,EMPIRE UNION JACK TV DINNER TRAY,8,2011-12-09 09:07:00,1.95,17490.0,United Kingdom
581481,22495,SET OF 2 ROUND TINS CAMEMBERT ,12,2011-12-09 09:07:00,0.79,17490.0,United Kingdom
581481,22496,SET OF 2 ROUND TINS DUTCH CHEESE,12,2011-12-09 09:07:00,0.79,17490.0,United Kingdom
581481,22513,DOORSTOP FOOTBALL DESIGN,8,2011-12-09 09:07:00,0.79,17490.0,United Kingdom
581481,22500,SET OF 2 TINS JARDIN DE PROVENCE,12,2011-12-09 09:07:00,1.25,17490.0,United Kingdom
581481,22664,TOY TIDY DOLLY GIRL DESIGN,20,2011-12-09 09:07:00,0.79,17490.0,United Kingdom
581481,22721,SET OF 3 CAKE TINS SKETCHBOOK,12,2011-12-09 09:07:00,1.95,17490.0,United Kingdom
581481,22785,SQUARECUSHION COVER PINK UNION JACK,12,2011-12-09 09:07:00,1.25,17490.0,United Kingdom
581481,23178,JAM CLOCK MAGNET,12,2011-12-09 09:07:00,1.25,17490.0,United Kingdom
581481,23302,KNEELING MAT HOUSEWORK  DESIGN,24,2011-12-09 09:07:00,0.79,17490.0,United Kingdom
581481,23533,WALL ART GARDEN HAVEN ,6,2011-12-09 09:07:00,1.95,17490.0,United Kingdom
581481,84819,DANISH ROSE ROUND SEWING BOX,16,2011-12-09 09:07:00,0.79,17490.0,United Kingdom
581482,22485,SET OF 2 WOODEN MARKET CRATES,12,2011-12-09 09:08:00,10.95,17490.0,United Kingdom
581482,22371,AIRLINE BAG VINTAGE TOKYO 78,12,2011-12-09 09:08:00,3.95,17490.0,United Kingdom
581482,21875,KINGS CHOICE MUG,36,2011-12-09 09:08:00,1.06,17490.0,United Kingdom
581482,23251,VINTAGE RED ENAMEL TRIM MUG ,96,2011-12-09 09:08:00,1.04,17490.0,United Kingdom
581482,23300,GARDENERS KNEELING PAD CUP OF TEA ,48,2011-12-09 09:08:00,1.45,17490.0,United Kingdom
581482,22138,BAKING SET 9 PIECE RETROSPOT ,24,2011-12-09 09:08:00,4.25,17490.0,United Kingdom
581483,23843,"PAPER CRAFT , LITTLE BIRDIE",80995,2011-12-09 09:15:00,2.08,16446.0,United Kingdom
C581484,23843,"PAPER CRAFT , LITTLE BIRDIE",-80995,2011-12-09 09:27:00,2.08,16446.0,United Kingdom
581485,22617,BAKING SET SPACEBOY DESIGN,18,2011-12-09 09:38:00,4.95,17389.0,United Kingdom
581485,22768,FAMILY PHOTO FRAME CORNICE,12,2011-12-09 09:38:00,9.95,17389.0,United Kingdom
581485,20749,ASSORTED COLOUR MINI CASES,84,2011-12-09 09:38:00,6.35,17389.0,United Kingdom
581486,22910,PAPER CHAIN KIT VINTAGE CHRISTMAS,12,2011-12-09 09:38:00,2.95,17001.0,United Kingdom
581486,22086,PAPER CHAIN KIT 50'S CHRISTMAS ,12,2011-12-09 09:38:00,2.95,17001.0,United Kingdom
581486,23344,JUMBO BAG 50'S CHRISTMAS ,20,2011-12-09 09:38:00,2.08,17001.0,United Kingdom
581486,23351,ROLL WRAP 50'S CHRISTMAS,12,2011-12-09 09:38:00,1.25,17001.0,United Kingdom
581486,23352,ROLL WRAP 50'S RED CHRISTMAS ,12,2011-12-09 09:38:00,1.25,17001.0,United Kingdom
581486,22727,ALARM CLOCK BAKELIKE RED ,8,2011-12-09 09:38:00,3.75,17001.0,United Kingdom
581486,22730,ALARM CLOCK BAKELIKE IVORY,4,2011-12-09 09:38:00,3.75,17001.0,United Kingdom
581486,23203,JUMBO BAG VINTAGE DOILY ,20,2011-12-09 09:38:00,2.08,17001.0,United Kingdom
581486,85099B,JUMBO BAG RED RETROSPOT,10,2011-12-09 09:38:00,2.08,17001.0,United Kingdom
581486,23201,JUMBO BAG ALPHABET,20,2011-12-09 09:38:00,2.08,17001.0,United Kingdom
581486,23207,LUNCH BAG ALPHABET DESIGN,10,2011-12-09 09:38:00,1.65,17001.0,United Kingdom
581486,22491,PACK OF 12 COLOURED PENCILS,12,2011-12-09 09:38:00,0.85,17001.0,United Kingdom
581486,22561,WOODEN SCHOOL COLOURING SET,12,2011-12-09 09:38:00,1.65,17001.0,United Kingdom
581486,22489,PACK OF 12 TRADITIONAL CRAYONS,24,2011-12-09 09:38:00,0.42,17001.0,United Kingdom
581486,22560,TRADITIONAL MODELLING CLAY,24,2011-12-09 09:38:00,1.25,17001.0,United Kingdom
581486,22139,RETROSPOT TEA SET CERAMIC 11 PC ,6,2011-12-09 09:38:00,4.95,17001.0,United Kingdom
581487,21137,BLACK RECORD COVER FRAME,120,2011-12-09 09:44:00,3.39,15694.0,United Kingdom
581488,23118,PARISIENNE JEWELLERY DRAWER ,16,2011-12-09 09:45:00,6.65,17428.0,United Kingdom
581488,23111,PARISIENNE SEWING BOX,16,2011-12-09 09:45:00,10.4,17428.0,United Kingdom
581488,22179,SET 10 NIGHT OWL LIGHTS,24,2011-12-09 09:45:00,5.95,17428.0,United Kingdom
581489,22061,LARGE CAKE STAND  HANGING STRAWBERY,48,2011-12-09 09:46:00,2.95,16954.0,United Kingdom
581489,22182,CAKE STAND VICTORIAN FILIGREE SMALL,24,2011-12-09 09:46:00,1.25,16954.0,United Kingdom
C581490,22178,VICTORIAN GLASS HANGING T-LIGHT,-12,2011-12-09 09:57:00,1.95,14397.0,United Kingdom
C581490,23144,ZINC T-LIGHT HOLDER STARS SMALL,-11,2011-12-09 09:57:00,0.83,14397.0,United Kingdom
581491,23571,TRADITIONAL NAUGHTS & CROSSES,12,2011-12-09 10:02:00,1.65,12433.0,Norway
581492,23369,SET 36 COLOUR PENCILS LOVE LONDON,2,2011-12-09 10:03:00,2.46,,United Kingdom
581492,23370,SET 36 COLOURING PENCILS DOILY,2,2011-12-09 10:03:00,2.46,,United Kingdom
581492,23371,SET 36 COLOUR PENCILS SPACEBOY ,3,2011-12-09 10:03:00,2.46,,United Kingdom
581492,23372,SET 36 COLOUR PENCILS DOLLY GIRL,1,2011-12-09 10:03:00,2.46,,United Kingdom
581492,23375,50'S CHRISTMAS PAPER GIFT BAG,1,2011-12-09 10:03:00,1.63,,United Kingdom
581492,23376,PACK OF 12 VINTAGE CHRISTMAS TISSUE,3,2011-12-09 10:03:00,0.83,,United Kingdom
581492,23377,PACK OF 12 DOLLY GIRL TISSUES,6,2011-12-09 10:03:00,0.83,,United Kingdom
581492,23378,PACK OF 12 50'S CHRISTMAS TISSUES,9,2011-12-09 10:03:00,0.83,,United Kingdom
581492,23379,PACK OF 12 RED APPLE TISSUES,4,2011-12-09 10:03:00,0.83,,United Kingdom
581492,23380,PACK OF 12 VINTAGE DOILY TISSUES,3,2011-12-09 10:03:00,0.83,,United Kingdom
581492,23381,PACK OF 12 VINTAGE LEAF TISSUES ,1,2011-12-09 10:03:00,0.83,,United Kingdom
581492,23382,BOX OF 6 CHRISTMAS CAKE DECORATIONS,4,2011-12-09 10:03:00,7.46,,United Kingdom
581492,23391, I LOVE LONDON MINI BACKPACK,2,2011-12-09 10:03:00,8.29,,United Kingdom
581492,23392,SPACEBOY ROCKET LOLLY MAKERS,2,2011-12-09 10:03:00,4.13,,United Kingdom
581492,23399,HOME SWEET HOME HANGING HEART,4,2011-12-09 10:03:00,2.08,,United Kingdom
581492,23405,HOME SWEET HOME 2 DRAWER CABINET,3,2011-12-09 10:03:00,10.79,,United Kingdom
581492,23418,LAVENDER TOILETTE BOTTLE,1,2011-12-09 10:03:00,4.13,,United Kingdom
581492,23426,METAL SIGN DROP YOUR PANTS,1,2011-12-09 10:03:00,5.79,,United Kingdom
581492,23434,3 RAFFIA RIBBONS 50'S CHRISTMAS ,9,2011-12-09 10:03:00,0.83,,United Kingdom
581492,23435,3 RAFFIA RIBBONS VINTAGE CHRISTMAS,3,2011-12-09 10:03:00,0.83,,United Kingdom
581492,23437, 50'S CHRISTMAS GIFT BAG LARGE,1,2011-12-09 10:03:00,2.46,,United Kingdom
581492,23439,HAND WARMER RED LOVE HEART,1,2011-12-09 10:03:00,4.13,,United Kingdom
581492,23451,SQUARE MINI PORTRAIT FRAME,1,2011-12-09 10:03:00,4.13,,United Kingdom
581492,23467,VINTAGE ZINC PLANTER  ,1,2011-12-09 10:03:00,6.25,,United Kingdom
581492,23469,CARD HOLDER LOVE BIRD SMALL,3,2011-12-09 10:03:00,8.29,,United Kingdom
581492,23480,MINI LIGHTS WOODLAND MUSHROOMS,2,2011-12-09 10:03:00,7.46,,United Kingdom
581492,23493,VINTAGE DOILY TRAVEL SEWING KIT,3,2011-12-09 10:03:00,3.29,,United Kingdom
581492,23494,VINTAGE DOILY DELUXE SEWING KIT ,1,2011-12-09 10:03:00,12.46,,United Kingdom
581492,23495,SET OF 3 PANTRY WOODEN SPOONS,1,2011-12-09 10:03:00,2.46,,United Kingdom
581492,23497,CLASSIC CHROME BICYCLE BELL ,4,2011-12-09 10:03:00,3.29,,United Kingdom
581492,23498,CLASSIC BICYCLE CLIPS ,2,2011-12-09 10:03:00,3.29,,United Kingdom
581492,23501,KEY RING BASEBALL BOOT UNION JACK,3,2011-12-09 10:03:00,2.46,,United Kingdom
581492,23506,MINI PLAYING CARDS SPACEBOY ,1,2011-12-09 10:03:00,0.83,,United Kingdom
581492,23508,MINI PLAYING CARDS DOLLY GIRL ,2,2011-12-09 10:03:00,0.83,,United Kingdom
581492,23510,MINI PLAYING CARDS GYMKHANA,1,2011-12-09 10:03:00,0.83,,United Kingdom
581492,23521,WALL ART CAT AND BIRD ,1,2011-12-09 10:03:00,5.79,,United Kingdom
581492,23526,WALL ART DOG LICENCE ,4,2011-12-09 10:03:00,12.46,,United Kingdom
581492,23530,WALL ART ONLY ONE PERSON ,2,2011-12-09 10:03:00,10.79,,United Kingdom
581492,23534,WALL ART STOP FOR TEA ,6,2011-12-09 10:03:00,12.46,,United Kingdom
581492,23535,WALL ART BICYCLE SAFETY,4,2011-12-09 10:03:00,12.46,,United Kingdom
581492,23536,WALL ART VILLAGE SHOW ,1,2011-12-09 10:03:00,12.46,,United Kingdom
581492,23538,WALL ART VINTAGE HEART,1,2011-12-09 10:03:00,10.79,,United Kingdom
581492,23551,PACK OF 12 PAISLEY PARK TISSUES ,1,2011-12-09 10:03:00,0.83,,United Kingdom
581492,23552,BICYCLE PUNCTURE REPAIR KIT ,12,2011-12-09 10:03:00,4.13,,United Kingdom
581492,23555,LANDMARK FRAME NOTTING HILL ,1,2011-12-09 10:03:00,24.96,,United Kingdom
581492,23559,WOODLAND BUNNIES LOLLY MAKERS,5,2011-12-09 10:03:00,4.13,,United Kingdom
581492,23561,SET OF 6 RIBBONS PARTY,1,2011-12-09 10:03:00,5.79,,United Kingdom
581492,23564,EGG CUP MILKMAID INGRID,2,2011-12-09 10:03:00,2.46,,United Kingdom
581492,23565,EGG CUP MILKMAID HELGA ,2,2011-12-09 10:03:00,2.46,,United Kingdom
581492,23567,EGG CUP HENRIETTA HEN PINK,1,2011-12-09 10:03:00,2.46,,United Kingdom
581492,23569,TRADTIONAL ALPHABET STAMP SET,2,2011-12-09 10:03:00,10.79,,United Kingdom
581492,23570,TRADITIONAL PICK UP STICKS GAME ,7,2011-12-09 10:03:00,2.46,,United Kingdom
581492,23571,TRADITIONAL NAUGHTS & CROSSES,2,2011-12-09 10:03:00,3.29,,United Kingdom
581492,23575,SNACK TRAY PAISLEY PARK,3,2011-12-09 10:03:00,4.13,,United Kingdom
581492,23579,SNACK TRAY I LOVE LONDON,1,2011-12-09 10:03:00,4.13,,United Kingdom
581492,23581,JUMBO BAG PAISLEY PARK,3,2011-12-09 10:03:00,4.13,,United Kingdom
581492,23583,LUNCH BAG PAISLEY PARK  ,2,2011-12-09 10:03:00,4.13,,United Kingdom
581492,23611,SET 10 CARDS RED RIDING HOOD 17214,3,2011-12-09 10:03:00,2.49,,United Kingdom
581492,23616,SET 10 CARDS JINGLE BELLS 17217,1,2011-12-09 10:03:00,2.49,,United Kingdom
581492,23621,SET 10 CARDS DAVID'S MADONNA 17074,3,2011-12-09 10:03:00,2.49,,United Kingdom
581492,23635,SET 10 CARDS CHRISTMAS HOLLY  17259,1,2011-12-09 10:03:00,4.16,,United Kingdom
581492,23644,SET 10 CARDS CHRISTMAS TREE 16955,1,2011-12-09 10:03:00,3.33,,United Kingdom
581492,23660,HENRIETTA HEN MUG ,1,2011-12-09 10:03:00,4.13,,United Kingdom
581492,23661,MILK MAIDS MUG ,1,2011-12-09 10:03:00,4.13,,United Kingdom
581492,35095A,BLUE VICTORIAN FABRIC OVAL BOX,1,2011-12-09 10:03:00,0.83,,United Kingdom
581492,35095B,RED VICTORIAN FABRIC OVAL BOX,1,2011-12-09 10:03:00,0.83,,United Kingdom
581492,35646,VINTAGE BEAD PINK EVENING BAG,1,2011-12-09 10:03:00,2.46,,United Kingdom
581492,35648,VINTAGE BEAD PINK PURSE ,2,2011-12-09 10:03:00,1.63,,United Kingdom
581492,35953,FOLKART STAR CHRISTMAS DECORATIONS,12,2011-12-09 10:03:00,0.61,,United Kingdom
581492,35964,FOLKART CLIP ON STARS,4,2011-12-09 10:03:00,0.83,,United Kingdom
581492,35970,ZINC FOLKART SLEIGH BELLS,1,2011-12-09 10:03:00,4.13,,United Kingdom
581492,46118,FUNKY MONKEY CUSHION COVER,1,2011-12-09 10:03:00,4.13,,United Kingdom
581492,46776A,WOVEN BUBBLE GUM CUSHION COVER,2,2011-12-09 10:03:00,4.13,,United Kingdom
581492,46776B,WOVEN BERRIES CUSHION COVER ,3,2011-12-09 10:03:00,4.13,,United Kingdom
581492,46776C,WOVEN FROST CUSHION COVER,1,2011-12-09 10:03:00,4.13,,United Kingdom
581492,46776D,WOVEN SUNSET CUSHION COVER ,2,2011-12-09 10:03:00,4.13,,United Kingdom
581492,46776E,WOVEN CANDY CUSHION COVER ,5,2011-12-09 10:03:00,4.13,,United Kingdom
581492,46776F,WOVEN ROSE GARDEN CUSHION COVER ,6,2011-12-09 10:03:00,4.13,,United Kingdom
581492,47310M,SMALL POP BOX FUNKY MONKEY,1,2011-12-09 10:03:00,1.63,,United Kingdom
581492,47480,HANGING PHOTO CLIP ROPE LADDER,3,2011-12-09 10:03:00,3.29,,United Kingdom
581492,47504H,ENGLISH ROSE SPIRIT LEVEL ,1,2011-12-09 10:03:00,3.29,,United Kingdom
581492,47559B,TEA TIME OVEN GLOVE,3,2011-12-09 10:03:00,2.46,,United Kingdom
581492,47563A,RETRO LONGBOARD IRONING BOARD COVER,2,2011-12-09 10:03:00,3.29,,United Kingdom
581492,47566,PARTY BUNTING,2,2011-12-09 10:03:00,10.79,,United Kingdom
581492,47590B,PINK HAPPY BIRTHDAY BUNTING,1,2011-12-09 10:03:00,10.79,,United Kingdom
581492,51014A,"FEATHER PEN,HOT PINK",2,2011-12-09 10:03:00,0.83,,United Kingdom
581492,51014L,"FEATHER PEN,LIGHT PINK",1,2011-12-09 10:03:00,0.83,,United Kingdom
581492,71270,PHOTO CLIP LINE,1,2011-12-09 10:03:00,2.46,,United Kingdom
581492,72349B,SET/6 PURPLE BUTTERFLY T-LIGHTS,1,2011-12-09 10:03:00,4.13,,United Kingdom
581492,72741,GRAND CHOCOLATECANDLE,3,2011-12-09 10:03:00,2.76,,United Kingdom
581492,72800E,4 IVORY DINNER CANDLES SILVER FLOCK,3,2011-12-09 10:03:00,3.29,,United Kingdom
581492,79321,CHILLI LIGHTS,1,2011-12-09 10:03:00,12.46,,United Kingdom
581492,82484,WOOD BLACK BOARD ANT WHITE FINISH,2,2011-12-09 10:03:00,16.63,,United Kingdom
581492,82567,"AIRLINE LOUNGE,METAL SIGN",2,2011-12-09 10:03:00,1.63,,United Kingdom
581492,82582,AREA PATROLLED METAL SIGN,1,2011-12-09 10:03:00,4.13,,United Kingdom
581492,82600,N0 SINGING METAL SIGN,1,2011-12-09 10:03:00,4.13,,United Kingdom
581492,84031A,CHARLIE+LOLA RED HOT WATER BOTTLE ,4,2011-12-09 10:03:00,4.13,,United Kingdom
581492,84077,WORLD WAR 2 GLIDERS ASSTD DESIGNS,1,2011-12-09 10:03:00,0.63,,United Kingdom
581492,84249A,"GREETING CARD,SQUARE, DOUGHNUTS",1,2011-12-09 10:03:00,0.83,,United Kingdom
581492,84347,ROTATING SILVER ANGELS T-LIGHT HLDR,2,2011-12-09 10:03:00,4.96,,United Kingdom
581492,84375,SET OF 20 KIDS COOKIE CUTTERS,1,2011-12-09 10:03:00,4.13,,United Kingdom
581492,84378,SET OF 3 HEART COOKIE CUTTERS,4,2011-12-09 10:03:00,2.46,,United Kingdom
581492,84519B,CARROT CHARLIE+LOLA COASTER SET,1,2011-12-09 10:03:00,5.79,,United Kingdom
581492,84559A,3D SHEET OF DOG STICKERS,2,2011-12-09 10:03:00,1.63,,United Kingdom
581492,84568,GIRLS ALPHABET IRON ON PATCHES ,31,2011-12-09 10:03:00,0.42,,United Kingdom
581492,84569D,PACK 6 HEART/ICE-CREAM PATCHES,1,2011-12-09 10:03:00,2.46,,United Kingdom
581492,84596B,SMALL DOLLY MIX DESIGN ORANGE BOWL,4,2011-12-09 10:03:00,0.83,,United Kingdom
581492,84596F,SMALL MARSHMALLOWS PINK BOWL,4,2011-12-09 10:03:00,0.83,,United Kingdom
581492,84598,BOYS ALPHABET IRON ON PATCHES,5,2011-12-09 10:03:00,0.42,,United Kingdom
581492,84692,BOX OF 24 COCKTAIL PARASOLS,1,2011-12-09 10:03:00,0.83,,United Kingdom
581492,84755,COLOUR GLASS T-LIGHT HOLDER HANGING,4,2011-12-09 10:03:00,1.24,,United Kingdom
581492,84828,JUNGLE POPSICLES ICE LOLLY MOULDS,1,2011-12-09 10:03:00,2.46,,United Kingdom
581492,84879,ASSORTED COLOUR BIRD ORNAMENT,16,2011-12-09 10:03:00,3.12,,United Kingdom
581492,84923,PINK BUTTERFLY HANDBAG W BOBBLES,3,2011-12-09 10:03:00,4.13,,United Kingdom
581492,84946,ANTIQUE SILVER T-LIGHT GLASS,18,2011-12-09 10:03:00,2.46,,United Kingdom
581492,84970S,HANGING HEART ZINC T-LIGHT HOLDER,3,2011-12-09 10:03:00,2.08,,United Kingdom
581492,84978,HANGING HEART JAR T-LIGHT HOLDER,4,2011-12-09 10:03:00,2.46,,United Kingdom
581492,84991,60 TEATIME FAIRY CAKE CASES,1,2011-12-09 10:03:00,1.25,,United Kingdom
581492,84997A,CHILDRENS CUTLERY POLKADOT GREEN ,1,2011-12-09 10:03:00,8.29,,United Kingdom
581492,84997B,CHILDRENS CUTLERY RETROSPOT RED ,1,2011-12-09 10:03:00,8.29,,United Kingdom
581492,20727,LUNCH BAG  BLACK SKULL.,2,2011-12-09 10:03:00,4.13,,United Kingdom
